Date	Source	Sentiment	Headline	Summary	URL
2026-03-04	Google	0.0	Baron Partners Fund (BPTRX) Competitors - Meyka		https://news.google.com/rss/articles/CBMiTEFVX3lxTE9KbVJiaElkX0xyZVNUM3JWNjh1NXpENXNCcEZoUkd4MEh3Y21xV3pSLXVPZUhmcmZuRy1jX0NVdzhIR2o4VnRxbFJwb2M?oc=5
2026-03-03	Yahoo	0.038	Vanguard’s VTI ETF Turned $10,000 Into $38,000 Over the Last Decade — Can It Do It Again?	Invest $10,000 in VTI today and here’s what the numbers say it could be worth by 2036 — history already answered this question for the last decade. $10,000 invested in VTI ten years ago grew to over $38,000 today, with dividends reinvested. That’s a quadrupling of capital from a single fund that requires no stock-picking, ... Vanguard’s VTI ETF Turned $10,000 Into $38,000 Over the Last Decade — Can It Do It Again?	https://247wallst.com/investing/2026/03/03/vanguards-vti-etf-turned-10000-into-38000-over-the-last-decade-can-it-do-it-again/?.tsrc=rss
2026-03-02	Google	0.0	DFA Intl Sustainability Core 1 (DFSPX) Competitors - Meyka		https://news.google.com/rss/articles/CBMiTEFVX3lxTE0ybUYxVktPVjFGaVlwVTRiTlV3M3Z0SmNNOURFUS0zaHpLWW9uSGhhcXFoYUFxWVJrNEJBUlZqQU1CLUh1MXFpZklJM3o?oc=5
2026-03-02	Google	0.0	Virtus KAR Mid-Cap Core Fund (VMCCX) Competitors - Meyka		https://news.google.com/rss/articles/CBMiTEFVX3lxTE9lVDlIREN1NTh1aUw5dVFsbktXUmhzNUpqcEpHdEVYbFlVUU1lLUdIZEM5UGJCM0dvYnVZbmtIenZ0VTZRT2hqZXRFbmg?oc=5
2026-03-01	Google	0.0	Global X U.S. Electrification ETF (ZAP) Competitors - Meyka		https://news.google.com/rss/articles/CBMiSkFVX3lxTE4xZWJnMy1hSlhBZnZzd3JrendaUlBSQmlGb01qVFVzcVhyQnoxel9iTmhRWlNoUjJXYjBTTXUySklMRS1PUXlUbEdB?oc=5
2026-02-27	Yahoo	0.24	Is Vanguard Total Stock Market Index Investor (VTSMX) a Strong Mutual Fund Pick Right Now?	Mutual Fund Report for VTSMX	https://finance.yahoo.com/news/vanguard-total-stock-market-index-120003658.html?.tsrc=rss
2026-02-27	Yahoo	0.225	3 “Set and Forget” ETFs That Could Fund Your Entire Retirement	Building an investment portfolio that can fund your retirement requires you to pick assets that can withstand the market’s ups and downs. The idea is to build a portfolio that doesn’t require regular checkups and also generates income for you. Investing in exchange-traded funds (ETFs) can be an ideal option if you’re reaching close to ... 3 “Set and Forget” ETFs That Could Fund Your Entire Retirement	https://247wallst.com/investing/2026/02/27/3-set-and-forget-etfs-that-could-fund-your-entire-retirement/?.tsrc=rss
2026-02-25	Yahoo	0.156	A $11 Billion ETF Quietly Outperforms the Total Market by Favoring Profitable Stocks	Most broad U.S. equity ETFs hand the biggest positions to the biggest companies, regardless of whether those companies are cheap or profitable. Avantis U.S. Equity ETF (NYSEARCA:AVUS) takes a different approach: it tilts the portfolio toward stocks that score well on both value and profitability, the two factors academic research most consistently links to long-run ... A $11 Billion ETF Quietly Outperforms the Total Market by Favoring Profitable Stocks	https://247wallst.com/investing/2026/02/25/a-11-billion-etf-quietly-outperforms-the-total-market-by-favoring-profitable-stocks/?.tsrc=rss
2026-02-18	Google	1.0	10 Best Low-Cost Index Funds to Buy in 2026 | Investing | U.S. News - Money/ US News		https://news.google.com/rss/articles/CBMieEFVX3lxTE5tc3VqOExlUkJfZmtlS2l0cFdIdThWblVTOEV5dEp3MWhQUzNHbXlHSEZQTktFcHloWUg0c0w0TVp4LW44dF9oZGl6SFRGUFJ3Y1BDNGpfalJvVmo2YjQ0M0hzbmlieFYyVm5CRkNRMWEwZ1dGeDE3TQ?oc=5
2026-02-13	Yahoo	0.0	The Only 3 Vanguard ETFs You Need for the Next 30 Years	Investors often overthink when it comes to building a long-term investment portfolio. With multiple sectors, companies, investment options, and alternatives, they tend to chase returns and forget about the long-term investment growth. Whether you’re a newbie or close to your retirement, if long-term investment is your goal, consider investing in exchange-traded funds (ETFs). While it ... The Only 3 Vanguard ETFs You Need for the Next 30 Years	https://247wallst.com/investing/2026/02/13/the-only-3-vanguard-etfs-you-need-for-the-next-30-years/?.tsrc=rss
2026-02-12	Google	0.6	7 Popular Vanguard Index Funds for February 2026 - NerdWallet		https://news.google.com/rss/articles/CBMicEFVX3lxTE9XSVM2RXEwUVZxb3R4UktFZGsySzlPQmxJbUp1SnZzUlQwcGMxU3VtbUdmY1RTR2Y0dkJ1WEk4dG82QnJJVld4NU0xRjMzdlFhVWpGQ3UtT3NlbWtlT21TOTFuQUM4bmdNOGNnbThNaHY?oc=5
2026-02-12	Yahoo	0.219	Everyone Missed Morningstar’s ETF Quietly Beating the S&P 500 by 30%	Most investors treat broad market funds like a set-it-and-forget-it decision. But what if your core equity position could be engineered to favor companies with stronger balance sheets, higher profitability, and better momentum without abandoning diversification? That’s the tension FlexShares Morningstar US Market Factor Tilt Index Fund (NYSEARCA:TILT) was designed to resolve. A Smarter Core Holding ... Everyone Missed Morningstar’s ETF Quietly Beating the S&amp;P 500 by 30%	https://247wallst.com/investing/2026/02/12/everyone-missed-morningstars-etf-quietly-beating-the-sp-500-by-30/?.tsrc=rss
2026-02-10	Yahoo	0.118	Vanguard’s Fund Is Destroying The S&P With Blistering 38.4% Run	If you own U.S. stocks, you’ve likely questioned whether international diversification still makes sense. American equities have dominated for years, and many investors wonder if adding ex-U.S. exposure is worth it. Vanguard Total International Stock Index Fund ETF Shares (NYSEARCA:VXUS) provides a single, low-cost way to own virtually every investable stock outside the United States. ... Vanguard’s Fund Is Destroying The S&amp;P With Blistering 38.4% Run	https://247wallst.com/investing/2026/02/10/vanguards-fund-is-destroying-the-sp-with-blistering-38-4-run/?.tsrc=rss
2026-02-03	Yahoo	0.238	Smart Investing: How to Avoid Mistakes & Build Lasting Wealth	LTCM co-founder Victor Haghani discusses a better approach to long-term investing.	https://finance.yahoo.com/news/smart-investing-avoid-mistakes-build-224200833.html?.tsrc=rss
2026-02-02	Yahoo	-0.15	Vanguard Slashes Fees Again, This Time on a Quarter of Its Funds	The pioneer in low-cost investing now has an average fund fee of 0.06%, or 60 cents on a $1,000 investment.	https://finance.yahoo.com/m/dd49cd25-79e9-3fc1-a1e0-09a727730e2c/vanguard-slashes-fees-again%2C.html?.tsrc=rss
2026-02-01	Yahoo	0.211	9 Vanguard ETFs With The Lowest Expense Ratios	The Vanguard Group of Valley Forge, Pa., is beloved for its low-cost, index investment strategy. The firm offers nearly two dozen exchange-traded funds (ETFs) with expense ratios of only 0.03%. Here is a selection of nine of the most popular. No. 9: Vanguard FTSE Developed Markets Index Fund ETF (VEA) This international index fund seeks ... 9 Vanguard ETFs With The Lowest Expense Ratios	https://247wallst.com/investing/2026/02/01/9-vanguard-etfs-with-the-lowest-expense-ratios/?.tsrc=rss
2026-01-28	Google	1.0	7 Best Vanguard Funds to Buy and Hold | Investing | U.S. News - US News Money		https://news.google.com/rss/articles/CBMihgFBVV95cUxOMXhDZzM1bXZWSG83czJmWDk0T1RBTEh1QnJRbkExR1ktX0VwbnJVbzNnN3ZWU19EbXZnS19GaElHS3lKa21lSTI4SS1LWl9feGpuN0t1WEExWTJpSkpya3VGcHd0N2ZRMEZuZTBZVXk1eXlfS2piUDdxRFZOSXpHQ05oekg3dw?oc=5
2026-01-26	Yahoo	-0.061	Buy These 3 ETFs and Hold For Decades	Each one of us works hard to make money, and it is always a delight to have your money work for you. Investing in the right assets and holding them for the long term can be one way of making money. Exchange-traded funds have gained immense popularity over the past year. It is a passive ... Buy These 3 ETFs and Hold For Decades	https://247wallst.com/investing/2026/01/26/buy-these-3-etfs-and-hold-for-decades/?.tsrc=rss
2026-01-21	Yahoo	0.228	4 Dividend ETFs Perfect For Retirees On Social Security	When you are living on Social Security, it goes without saying that every dollar matters, and finding a way to supplement income can go a long way to not just covering basic expenses, but also helping out when emergency medical expenses happen. This is where dividend income becomes a central part of any investment portfolio, ... 4 Dividend ETFs Perfect For Retirees On Social Security	https://247wallst.com/investing/2026/01/21/4-dividend-etfs-perfect-for-retirees-on-social-security/?.tsrc=rss
2026-01-12	Yahoo	-0.024	iShares ETF Has A ‘Set And Forget’ Investment For Retirees You Don’t Need To Overthink	The hardest part of retirement investing isn’t picking stocks or timing the market – it’s resisting the urge to do either. iShares Core S&amp;P Total U.S. Stock Market ETF (NYSEARCA:ITOT) solves this by offering exposure to the entire U.S. equity market in a single position, charging just 0.03% annually, and requiring no ongoing decisions beyond ... iShares ETF Has A ‘Set And Forget’ Investment For Retirees You Don’t Need To Overthink	https://247wallst.com/investing/2026/01/11/ishares-etf-has-a-set-and-forget-investment-for-retirees-you-dont-need-to-overthink/?.tsrc=rss
2025-12-25	Google	0.5	Top Mutual Funds Holding IBM Stock: Vanguard and Fidelity - Investopedia		https://news.google.com/rss/articles/CBMiogFBVV95cUxOVnlYbUVYZm1zQmd4M0hhRThaSVhlSWsyRFN3S0c5ZWQ0QzJDWFNURG0xODJvT1J1dUw3QnhuNHprX3VmUElycExWY09vSzRMSFEzV0VrTE5ZZC1YT0s2V3VoZS1iOGFUcHdaMU9kUDdKMnpaZ2xIVldHdmlqSUV0OXhSTzVsazdKTWVrN3c0NEZ4NmwzY0xlR1BLMzhyeWFOUVE?oc=5
2025-12-18	Yahoo	0.163	ITOT’s 37% Concentration in Top Ten Holdings Could Make or Break 2026 Returns	The iShares Core S&amp;P Total U.S. Stock Market ETF (NYSE:ITOT) returned 16.4% through mid-December, tracking the broad U.S. equity market’s strong 2025. With tech stocks dominating returns and the fund trading near its November peak, investors are asking whether another double-digit year is realistic or if the easy gains are behind us. The answer hinges ... ITOT’s 37% Concentration in Top Ten Holdings Could Make or Break 2026 Returns	https://247wallst.com/investing/2025/12/18/itots-37-concentration-in-top-ten-holdings-could-make-or-break-2026-returns/?.tsrc=rss
2025-12-18	Yahoo	0.134	My Top Vanguard ETFs To Buy In 2026	As the calendar turns to 2026, the investment landscape has a different feel than it did just a few years ago. Among the different reasons is a heightened level of volatility that has helped define 2025 and left a lot of investors feeling a mix of both fatigue and caution going into a new year. ... My Top Vanguard ETFs To Buy In 2026	https://247wallst.com/investing/2025/12/18/my-top-vanguard-etfs-to-buy-in-2026/?.tsrc=rss
2025-12-18	Yahoo	0.132	There’s No Quick Fix for Soaring Health Insurance Costs. These Accounts Can Help.	More Americans may turn to health savings accounts as insurance premiums are set to soar next year for millions of consumers.  The accounts, known as HSAs, may be used for a variety of medical expenses, and the new tax law expanded their footprint.  Health insurance premiums are set to more than double next year, on average, for more than 20 million Americans enrolled in coverage through the Affordable Care Act.	https://finance.yahoo.com/m/6f73783c-2eee-31c3-bec2-831cad427e51/there%E2%80%99s-no-quick-fix-for.html?.tsrc=rss
2025-12-04	Yahoo	0.05	ETFs to Keep Your Portfolio on Track in the Long Term	Despite November's volatility, optimism is returning to Wall Street. Discover how long-term strategies combined with ETFs can help investors build resilient portfolios ready to capture the next phase of the bull market.	https://finance.yahoo.com/news/etfs-keep-portfolio-track-long-160800229.html?.tsrc=rss
2025-11-26	Google	0.5	25 Top Picks for Tax-Efficient ETFs and Mutual Funds - Morningstar		https://news.google.com/rss/articles/CBMihAFBVV95cUxNYy1TaTc0YnoyUl9ydmpqdEpNN29PMGZkYVprMVdIdWFMYTR3dnVxNERyZGhaTWtWSXAxMXFRT241b0xaQURZRmhNanYtSjVZNzc1X2VaS2k0VTFqa1FHNFZsQkxpWmhKYjRRTXd6b0FwcWpqM0J0UWVLMUVBTGR0eUUwZzg?oc=5
2025-11-06	Google	0.5	Top 5 Biggest Mutual Funds - Investopedia		https://news.google.com/rss/articles/CBMibEFVX3lxTE1jSWdyWUh6bGVlR1hDZGJmWUs2bWRFVHVoYjZ3VFVsMm1hU1VIUUl0Q3BpOE1UcTBwaUlTMFg4ZFZabmF4cnZNTE1QeFBSYVdtdFVSbkdEYzhSZ2JpUzJUTzV6aTMwUFZ2RkQ1Ug?oc=5
2025-10-25	Google	0.0	It’s dividend time! And every dollar counts: Money Talks - Cleveland.com		https://news.google.com/rss/articles/CBMiowFBVV95cUxPUUwwMTFZUVlsZ2RRc1JYWGthV1dUTWdDS3pBeDhZalBWR3hkTnY5Q1hXZHJJSV9UREdWUGpZR1JRTVZVRUNOSUJFNTlVTFVkX0l5NjNfQVBybTY5akUydXQ2MzE5cDdNRmoyMWFaRnVHSzJCU3pOY01GQkpMWU13ZFZSQXJSQXI1ZHA0c0gxa1ZkYkNTaVh1T2ZONjZwaW10dU5F0gG3AUFVX3lxTE05WGZSeXNYajdnMkljSHdRbWRWM29Xc3NuMWlIdWlLd1BGMUdtdGx5QjU0cExMVXN0djZMSzlTalVSaWZtbC1zZG1CQ3l4ZjZFamp5RmJrSDExU2wzX0YxcEJmbGFhY3d5ekNfOWF2TW5qUWR4UW9DbUJVVjJKWTNXLTk5ckdoNTRjVXBmcGZpWnNibkFfdmJqSHAzWWhoR0pyNXNtajJnVWZOVWl0VWsxbDI0WFo2SQ?oc=5
2025-10-02	Yahoo	0.0	Buy, Hold and Build Wealth: ETFs for Long-Term Investors	Market volatility is rising but buy-and-hold ETFs like SPY, VOO and VTI offer investors diversification and long-term resilience.	https://finance.yahoo.com/news/buy-hold-build-wealth-etfs-140500550.html?.tsrc=rss
2025-10-01	Yahoo	0.3	Growth & Large-Cap ETFs Worth Considering to Power Your Portfolio	U.S. Q2 GDP grows at fastest pace in two years, fueled by consumer spending and business investment, boosting ETF opportunities.	https://finance.yahoo.com/news/growth-large-cap-etfs-worth-140000091.html?.tsrc=rss
2025-09-23	Google	0.0	Morningstar Plans to Acquire CRSP, Solidifying Position as a Top-Tier Global Index Provider - The Globe and Mail		https://news.google.com/rss/articles/CBMiiwJBVV95cUxPaGFSdmQxOXZudXRVR1ZPVzlIc2ZRUEo5dU11bWxzcVFTdkZwUzFUNFY5MHdBSTNHWmJqd0dQTGVxblM3akJrYWlvdHRkejhjaGVRc0tOYkhjMGFsZXRDYl94VUE3cm84Qm1uLVphLVRIXzNOZmVFTTdIeU0xSEZ4T1FRNlJoSmZJbWtFS1oxZFVJbDYyNE05QlRHemNaY2VoX192SVlrejRMWGJqZ25Eb01laGdtckVOdG1HNWtCVzhfY1UyNXkzbjZKR3VsQVVaQldpdEFJeUlYNE01WEh5emZNM1RvN2dHbXJzWnliVDd5MHMxXzJKVUJSN2w5RS1id0hRSHZxblcyY3M?oc=5
2025-09-16	Google	-0.133	The 'godfather of financial independence' says young people should do two things to build wealth—and it's nothing 'silly' like buying a house - Fortune		https://news.google.com/rss/articles/CBMirgFBVV95cUxQWVVYczBZak1mczM3SmpjUFBvUmJQS2ZfcTFzTEllM1VudzJfcVAzTVphN09mSjBFVEFOMU04aDBndVVQUHlBdkYtLVVRbUxVNS1SOXRlT2VRNjNBX21uS29nTDU1bElyb0JmeUFsRE0yeGh6bnB0TTEwR1FaMEw0QlBIUHhKR2NkN3RqbDNublNhYk5lWjZ3cklDSUc3c2RxNU9NbVI5VWN5WXhXaXc?oc=5
2025-09-12	Google	0.24	Is Vanguard Total Stock Market Index Admiral (VTSAX) a Strong Mutual Fund Pick Right Now? - Yahoo Finance		https://news.google.com/rss/articles/CBMihgFBVV95cUxPWEd4cDBFSWprMzJ3cUctSDZ5enJEYjRKQkFIZm10bWg0YzFsTzZrYmhLb2h0STFKRjRPYU5oTWRNLVVzb0tpelcwQm1pVV9CcTFZem9hV2JUa0FnUGRzbjdiU1VnUmtPNk5lOVdjd2psOG5zSGV0MndsT3ZhZGR4YmVmVUladw?oc=5
2025-08-05	Google	0.5	#631: Q&A: Is ChatGPT’s Portfolio Better Than VTSAX? - Afford Anything		https://news.google.com/rss/articles/CBMif0FVX3lxTFBaZnhneWVsNUNuQUx0UWZkSXhsaTRTeEUtWkFPMGFUZkItcEdLRVByYnJjMkV1aU0zZ19fZlg2WEZVaVBNYlFhamZpc3ZoU19nclJ6QlhKcjZrM2N1blNNNmNqNXBCZV85VVFUNjE4b08zcWdPOUlvTHRsSFk4d2s?oc=5
2025-08-01	Yahoo	0.2	Monster AI Earnings & Economic Resilience to Power Up Growth ETFs	Meta and Microsoft surge on earnings, lifting ETFs like QQQ, VOO, and VUG as AI momentum and U.S. growth drive market gains.	https://finance.yahoo.com/news/monster-ai-earnings-economic-resilience-103000286.html?.tsrc=rss
2025-07-21	Google	0.0	World’s Largest Mutual Fund – Ticker: VTSAX - stl.news		https://news.google.com/rss/articles/CBMibkFVX3lxTE5YNG9BLTNwTU9oRldXTUU2S2JlQ2lsYmJpZnd2SFY4bjltdVVMeWxSQjBNdGNqZEJaYUJ2M3U4V0w0U0p0cUJSX1JKQW4wVjRUcHl4QXRsRklfaElzVy1iSnhKMUJlS1Fra3h3bnl3?oc=5
2025-07-11	Google	0.0	#624: JL Collins Part 1: The Simple Path vs. The “Optimal” Path - Afford Anything		https://news.google.com/rss/articles/CBMijgFBVV95cUxPOHJUa3lZdmVEaWxaR3VOWm8xNlJybHdiWHIxQi02WEpJZGZxYzJCLTR4YnNQRmhwQUdMNDNGc1g5a0NjLUljLUNDMEFCTDBaYWh4RjZYMi1mTUhvLTdZZlFZSGtVck5MdnEtb2F3SWhxVkZScUxNd09QTjhHQjgxa19PSUszWVc2TmJZdDhB?oc=5
2025-06-18	Google	0.0	Vanguard eliminates managers from 44 stock mutual funds, ETFs - Pensions & Investments		https://news.google.com/rss/articles/CBMipgFBVV95cUxOaVJIeEVRd1lpU3Q0TWpMU0RZT0ZJd3R4WjNSNXR1M2VfZ1lENDdFV1hxcGpEU3Uzb2R2Mk03dzl2YlpPdXh6T2ZFNWN1czZxRGNHQUF4emlPOWhINlhLcGg0WGYxS0d1SXpQMnZwWG5TT043RThvWnpWalc3WW9yUWZ3RmxxQmNDWEd3bW8yRnN3amtyNy1JOE5tYXpWSDBWRTJLZEZn?oc=5
2025-05-31	Google	0.0	Can You Buy Vanguard Funds Through Another Brokerage? - Investopedia		https://news.google.com/rss/articles/CBMipwFBVV95cUxQYzZ1MnphTGtOcE5fR0dmVTA2U2xMSzRLU1BwcDhCcEJ6X21LNEFYRzE4aFZ1a003Y0hodldUSVdBLUJWRHd1RG5mWHlKUnpfVXl1RHVHa3dzVWE0cm9hR3YtMGNMZGZhMnlGZkNhOGVoQ0dHdXRvejhVRTYxUXFrNVFIWjB6TC13UDZOR3FqY0U2dlRiSVlNeE9oeFB5T3pYUy1aZU44Zw?oc=5
2025-05-20	Google	0.25	S&P 500 vs. Total Market Index Funds: Which Is Better for Long-Term Growth? - Investopedia		https://news.google.com/rss/articles/CBMikgFBVV95cUxOV1FOMHh5TmVBcGlEWThMMVp1a3ZrS1pfUUlQMkM0UkxNQzd2dWZrWU0zb1U3RWJBWHNSam5PSVhzcVA5QVZqZGViLVdDczdCV1l1Qy05YU9pN213MXhWaC0xSXN0cG92bW1kaGJrMFVNWWRTamJTY0NDVnU4alQyekl5Wmd5MkxwY0M2amtSVWZDUQ?oc=5
2025-05-20	Google	0.0	JL Collins: The (Still) Simple Path to Wealth - Morningstar		https://news.google.com/rss/articles/CBMihwFBVV95cUxPOG41YU9ydEJia19TeW5Zb3RtRTdEeGhUcUhGeUVSX09sM3lnZk9DcTh5b3dXNGw2MmRsdFQxQ09uYzdGdDN5ZmdJWXR4QUNoS1l4Rm1zSGVFUURVTWFBQl82YV9XTjF4U3NzdW1aX1dhcnpBS2dlSm1meWxMRUJyZHNmaU9pQ3M?oc=5
2025-04-29	Google	0.0	6 Funds to Add to Your HSA | Investing - Money/ US News		https://news.google.com/rss/articles/CBMiY0FVX3lxTE5WZ2lpeFVMTEZLMzFBYVc0QnBaZEFVaE52MEhYLWM5di01bmk4c2FiN21wVU90eG5xUU9LY0JWcXpFa0JlZk5CeWNZVnNTbFNFeVRLdnA2WTdPQWtSeWdPOThRRQ?oc=5
2025-04-08	Google	0.5	How Top Funds Fared in the Stock Market Meltdown - Morningstar		https://news.google.com/rss/articles/CBMigAFBVV95cUxNZkRhWERWck1mblY0SkJ3VzBPaGg0ckFXRVJHdDh1UFhIYVlLTHNnYlFrOUxqeDNLOUM5c1BnN3ZuMFlYWURzb2pRZHVxMFZ4d2dPSTZoSFhIY255VVVCdjlvdFMxRy1UOVQ1d2Z4eVBZY1ViOU5tR0xndXJTMFhsQg?oc=5
2025-03-31	Google	1.0	7 Best Vanguard Index Funds to Buy - US News Money		https://news.google.com/rss/articles/CBMiggFBVV95cUxPMjhPWkdvUk93MlZGU1YyNFFXTnRacDdCdFoxRlM3b05sRG1VR0F1bTgwa0Z6Vm02bHc2eUlVUEo2UjR2a2xndEM2bUJ0WVhLbVlHc3hlMjNSOFRPYzI0NFJyM0MwSENHOUY1d05nSEl4N0pERWdBZW16MjNGZUpZSVlB?oc=5
2025-03-12	Google	0.133	22-Year-Old With $70K Cash Debates Dropping $40K Into VTSAX – 'Am I Making A Huge Mistake Or Securing My Financial Future?' - Yahoo Finance		https://news.google.com/rss/articles/CBMieEFVX3lxTE9wbTJjVTU1NTJrUFFyU1JsbWRLNXZCMHMzb2hpU0g2cGNSWFE3eWlhUDM4RmdtNnBMWnRCME1ZNWVYVjVjcFoyN19GUWJQWkdqbkpTdi1Nc1VUMTJSNzJzeVI1NlFfTl9aWTFnRWhDeVJ0T1pTSTRPQQ?oc=5
