Date	Source	Sentiment	Headline	Summary	URL
2026-02-25	Google	0.0	Press Release: GE expands use of Aireon’s space-based ADS-B data - Runway Girl		https://news.google.com/rss/articles/CBMigwFBVV95cUxQWlV3a1VtR1NUMFA4Qi10TTZPSWxuOHZEUy01RDNVdHBFRHRpOTdsX1VHckdYTWxrVzdtYm1EQjlWaXFJOWRFVVJkV0pvNmdUYTBQaTFnQk05amphNmhkSW5Eclk3TE1qYVQ1VUp1b1lXM2pJUWR5TENibkJlOVAwWnZ2aw?oc=5
2026-02-25	Google	0.0	TD Asset Management Inc Sells 130,914 Shares of GE Vernova Inc. $GEV - MarketBeat		https://news.google.com/rss/articles/CBMixAFBVV95cUxOempPbkhNeWMzT1FBT3BETDlfVmR3WklGZ1RFR1ZWYm93bDJpUm9RTVNMY3FCSzNGMkJ0Ynh5RUxFTEstNG56WDVxbzRidEE2VkhUN0d4cFRENUhDbmp2ZjlsMkkwRHVBenUwbmdGV0ZaT1hjbGZual8tbGJLQWM1OFdRQi1sZ1hOVElfRVp4UzRobk03MGhIX1dBUk1vV3pIeXVKMGs4NWY0REtXcnpoUGl0eWgwUV94cjZNdEFMSFlOdm9Y?oc=5
2026-02-25	Google	0.0	Tableaux LLC Buys Shares of 12,044 GE Aerospace $GE - MarketBeat		https://news.google.com/rss/articles/CBMirwFBVV95cUxQVklqLWFDLUxsR09JNEZqdWZWTEFtV0c2OGdDNnFMaGtPN3R3RHp2T2RjYXNYWjhaSzVzbl9NaGJYODNYMTVLenF6OTdaT2Flb3RDZkN3aV9kLUVVSkFoV2ZqZVMxSnBIak01UjkyaGMzNTVOR0NvSFN6NVljVkZpS2ZxMVBXX3FMUnZSa2VZdEg5eEV6M25kZUVaMWdlOV8zb3VMWlZRUHh5NHB6V2lz?oc=5
2026-02-25	Google	0.0	The Next Big Rally in GE Vernova Stock Could Start Like This - Trefis		https://news.google.com/rss/articles/CBMiyAFBVV95cUxPdnpIamJmWmRaNnlMam04WF9HWWFBVHk3YjNIZ0dFTk94QndrM3h1YURCcU5iU2s2bUdvT25jMDFkZnB5ckpnTzR2eXRsNkFsX2ZxbnpYemRDdlVKb2x3MDlOWEtkcHo2Ml91d2dXd3FkbFJHSkxmU1VfRUNBQWFXVEF3VHpOendiNXVlMTFvYmpQOUpDM3pPRVRwYko5NEw2TGV4bXJuaTJZTjJWSkRwSENUeGVkVm5uNG5FYVFYT054eWpWVGNtZA?oc=5
2026-02-25	Google	0.0	Zacks Investment Ideas feature highlights: Bloom Energy, Excelerate Energy and GE Vernova - Zacks Investment Research		https://news.google.com/rss/articles/CBMixwFBVV95cUxQWHVNTk54eS1MUmx1bzN2ZWNxNi1zdlptR1ZwOXVnRU5XekpVTFJVekkwU2RVNGVaN3ktQkNSNE54d3VucVFyeW9lMjlUYXhYVFdONFNyaDdSbUViOXR6ZTQ3U1FlZHVucU5PZk5MZzN0eXJXajhKeWpJVWtDQzlldkhmRDBheUdFazhacF83cVl6Slc2Z2I5dzNNajNsbVp5WW1HRndRY0R2MkxROFdVU1BDMUZJVENjdWVqbWJ5Rk5hMTA2LXAw?oc=5
2026-02-25	Yahoo	-0.023	'Big Short' Investor Michael Burry Draws Parallel Between Nvidia and This 1920s Era Hot Stock: 'You Would Have Lost Money…'	"On Monday, ""Big Short"" investor Michael Burry, known for his high-profile bet against the U.S. housing market, said that today's artificial intelligence surge, led by Nvidia Corp (NASDAQ:NVDA), could follow a boom-and-bust pattern similar to the 1920s radio craze. AI Boom Compared To RCA's Historic Collapse Burry over the weekend drew parallels between the current AI frenzy and the speculative surge around Radio Corporation of America nearly a century ago. ""In the 1920s there was radio mania foc"	https://finance.yahoo.com/news/big-short-investor-michael-burry-223042880.html?.tsrc=rss
2026-02-25	Google	-0.1	Tian Ge Issues Response to Sina Hong Kong’s Partial Cash Offer - TipRanks		https://news.google.com/rss/articles/CBMiswFBVV95cUxOaFNqSTAzbUxrdi1nUVo5bGJfdDZHNk9vLVJITjBWNktWU0hfYk5LdG53N0VxWHpkdTBIaGpkTi16REVwZ3Q3bDN3NGRWLWMwRnl3aFloeHA1a0daMHJKb0lSQ3RUNGt4WlFYOVJzaW5OREtCal9zdGFBeVZZaTNTU0ItVDRIUzVwUmFTR2txclp6NGtsVmNZZ1hoYTZFYTIyWmM0djhudHRRdnRWLVBVNjRkWQ?oc=5
2026-02-25	Yahoo	-0.188	How Is GE Aerospace’s Stock Performance Compared to Other Aerospace & Defense Stocks?	GE Aerospace has outpaced its aerospace & defense peers over the past year, and analysts remain optimistic about the stock’s prospects.	https://www.barchart.com/story/news/411808/how-is-ge-aerospaces-stock-performance-compared-to-other-aerospace-defense-stocks?.tsrc=rss
2026-02-25	Yahoo	-0.2	3 Big Reasons G Should Be On Your Watchlist	Over the last six months, Genpact’s shares have sunk to $37.95, producing a disappointing 16.5% loss - a stark contrast to the S&amp;P 500’s 6.2% gain. This may have investors wondering how to approach the situation.	https://finance.yahoo.com/news/3-big-reasons-g-watchlist-144135539.html?.tsrc=rss
2026-02-25	Google	-0.5	NLRB Says GE Unit Illegally Gave Raises Without Bargaining - Law360		https://news.google.com/rss/articles/CBMiuwFBVV95cUxNUGlJeEd1TXJMeDNYR0tnZ0pHVXQycWZ2UUxySlkyRU9jUlFwMFhZaU1uY1h0OUpQX1NtVVczLURZcHR2SndvUUF4NGxscnNnZFJTOFFWLXVoRmE4R2U2MGFnNWEweGp2WTFMdEFucExEZGZzY09GOTMtUFhiNlEwX1B1b1NJa1lNMHpJSmpkQ1FiU1NlNTQ5NWxvUmFla0p1Nm9pZXZxU2tMUzdPakxZSEhPcFJFUXFMdlhv0gFyQVVfeXFMTzBrOV8wTWk3ODFILVZVdUd4dmd0WE9PSnBKQ2R5NzZMRXZ6WjdJMHhfbHRyazI4cFdsMXdlOGl2QnE4cVZJTEpTWUtRYk10RklGNEVYaWtkX0k1cExmSXBNX0dPN0xTanltMkQ4LS1lLUNR?oc=5
2026-02-24	Google	0.45	‘Leading With Empathy Is the Most Important Thing’ - Barron's		https://news.google.com/rss/articles/CBMi7wNBVV95cUxPVktwUFFCVHNaVmplMDY2ak5LTHlNcWNFT0YycHlCTnJKckwwMjgyQWhjZUxYZldjck54N1YwM0NReHdpYVcydUw4UWtTanI5VGhORjRFX1Y2YmJZS2pod3hoeEdFNGFxQkF4dTA2ZzN5MzZTNzNjNEdhU3ZZSWFyLUk1TXpRRFhiRkJZeHRzd2ozWExEZ2w2VWhDZGRsMjhBa0p1TTRoMFd2Y1hsZWY5MThOTGNMVlBmUHhqZTladk4teVdyWDJ6bVU5Y0F1a2hRUXlKbzRNUERjSUFVS3ptOG5hWE5QN3pEM2RZZGZmbjh1OWdIMzlIUlEzdThLNFdiT2UzZDBpN0FsbnBCMGhGU3VHSWNHQjZHMGJiaVRfQXBWcU40dHluRmZ1MEZtY2ZRdXduWl9jci13WDZzclo1M1JPY2p5M3pOU0hvT21xSHNBRHc4czl2dEVhd25qdGp1MmVRbmd0OXpDWDU2X1JuYjNUQzE1SElyNHBkNVBERlJuS2J3N1ZCR1JTVFpvdTJkWmhQdy1LbXNvQ3U4Q1dwaVJnaUVSbFlHbUJsb2dJb29ycFhBNWJCekp6a3A0cGp1ZmFIbUNidWhqVDJXVnpRYldtYXlseDJsNWYzOF9tU0pqVkNSWDlmNGpTazZKWms?oc=5
2026-02-24	Google	0.367	GE, Kratos Secure US Air Force Contract for Expendable ‘Loyal Wingman’ Engine - The Defense Post		https://news.google.com/rss/articles/CBMiZkFVX3lxTE5XTFloTTJqUzJzSFRscjJzNkRxaEM0NUl0TllRT1BweGhXTnI4RjdpZWNkRURLYmlDQ2JkajZ2dlBYaFZFbnlMQVBmRE9Xa3MtZ3BXSlBLclpfcGFVMkFubi12VUp0QdIBa0FVX3lxTE1teUZIVmRBOGN1cElOOFYzaUpEZ2tSVkxQbUxadmtjNlY4M3JUYzBadzUyc3VkdjBrNDJGOUxIYzV3Vjl2QlVnSU01Q25ucXVrVHlHYkVRdk5RZzVaWjRPcDJ6dEIzZmYwOFNR?oc=5
2026-02-24	Google	0.3	Ways to Foster a Friendlier and Fun Team Culture - Barron's		https://news.google.com/rss/articles/CBMi7wNBVV95cUxQd00wZlowNXVmd1JHZ3ZqdzVGX2J2Ry1mQjAzNEZGSklTMUhteWZoTDl2Wk11aW5YUUZNNFZBTmtNNnI3Z1pQQ3lZcDZYRjJmMEZZNjhvTFRHclcwbjBDQld6T0V2ZHhTV21vbWx0bnNMX1FVZkczRHUzNEhRYWcwdjNsYnlPVVhHNzZjOVBxYlkyclQ0MzZUVkMxdUVjUkdVNjJrNzBuSW45anBSM0xEbngwOUk1MS1xWXUwaDYySFBpTVFvUkNvb1B2aUpvdm55d2dRRzViM1Myd3BPWEMya0R0WUQwSXJBc09jYzNnSlhwWmg3MmJvSmxmNGJjZWFlM1hNLWJRVmgyTktMc25rMFltNnFxRUxSUWJja0lNbW1DTVlVM0dEbFVzd0VBc1lKSnNvMjY4MTVQRDhUd1lSYzBxekZtWkNkbVZrZTlpRlRJZldSUGM4T01ZSjhUc2dqUDZNUHFaZnFTWjl1Z3pvdHZHOXRzXzdIdjNaR0dlMzVla2JEV2Z6cTg4SzFPeU44alBUXzJkc3hPREtTRURvWUhtYnNCR0hRWUIxajNVX3NERWhQc3EzTUhtY1ByOFIwTktRekdDNV9uQXR1cFpNRjhXUTVta0l0NlRMV2JrNk1yWU9Xd0Q1YzEzdXZqems?oc=5
2026-02-24	Yahoo	0.297	United Airlines selects GE Aerospace (GE)’s GEnx Engines for Boeing 787	​GE Aerospace (NYSE:GE) is one of the Best Aerospace and Defense Stocks to Invest In Right Now. On February 16, GE Aerospace (NYSE:GE) announced a major deal with United Airlines, highlighting that the airline selected 300 GEnx engines for its new Boeing 787 Dreamliners. The order includes extra spare engines, which will bring United Airlines’ […]	https://finance.yahoo.com/news/united-airlines-selects-ge-aerospace-144245024.html?.tsrc=rss
2026-02-24	Google	0.25	Baylor St. Luke’s First in U.S. to Use GE Allia Moveo Platform - Woodlands Online		https://news.google.com/rss/articles/CBMia0FVX3lxTFB4b0ROZ3NsVzhtS3hHMVI1UTlwWnVpNXZESjdMeE9EdjlWcG9uNUxEeG5FU3lxcnYxLVJNT1IxcklYLW9PUmpJT1c2ZVlRVTdoTFF6VElkMzN4X0k5MEJvTFBSZ3VTbk9QdHo4?oc=5
2026-02-24	Google	0.25	GE Vernova (NYSE:GEV) Trading 5.7% Higher - Here's What Happened - MarketBeat		https://news.google.com/rss/articles/CBMirwFBVV95cUxQT19XQ1ItNDBIc1BRSFliYWV6c3BtT1RsX3FBQll3ZWlTUDlGdDFiUEZhYUVqM2Q3U05aZlZWV0J0WVdVTWd3WGp3eTVMVl9rNXpvekhkSl9ueTlCVGRpbXlWTUtyU2hGbmVqSFJZb0Q2SWM3b2M0QlBVMk16N3VYT2RFMWJ4aGF6WjVMR3JFbzVsbmxRRW9xOGlzZGxzSll1dmM5Y2sxX1NGZGZvVGFr?oc=5
2026-02-24	Google	0.16	GE Vernova stock hits all-time high at 846.28 USD - Investing.com India		https://news.google.com/rss/articles/CBMipgFBVV95cUxOMzU2ZDh4d2t0Q2xWZk45TnR5bjkzdWRlT3pyS1Z0eFlIY29FQzF3bnE4dHFsZkstbjZvYk51bHRYVHVMbzVqNFQtMms4TnRYTUNxUG03Wi1kcHhYWTBFSzlqNEFfWjVUcElqZEEtWERNRlB2a0lvbVowNDhuUWRGNjF0ZmtDc0ExdWFuQ21jb0o1N2FNV2kzcUVFZjgycWIwQS16Vkhn?oc=5
2026-02-24	Yahoo	0.15	GE Aerospace vs. RTX: Which Aerospace & Defense Stock Should You Bet On?	GE outpaces RTX with stronger growth, bigger engine wins and rising estimates, even as RTX boasts a record $268B backlog and lower valuation.	https://finance.yahoo.com/news/ge-aerospace-vs-rtx-aerospace-175900930.html?.tsrc=rss
2026-02-24	Google	0.136	GE Vernova’s AI Power Supercycle And The Test For New Payouts - simplywall.st		https://news.google.com/rss/articles/CBMiywFBVV95cUxOeVd1Y0ExejZDY2d4QlkyLUdFOEstOEc0aGZpVnU5ZUh0dlhPSlZEMVV0d3JKRTlXVVgzbVMtdWZRUl9Fbkk1SDlWREQyc1RKSVE2ZU5ZSjVFeGE2Q1JCM2lBWWtMSDRVbmhiRlExM2FBLVZJT28wQ1RNY3U1T01HN21yNUFvZ0xpMlByM1p3OUxNbVFFS0hpRVBNa1NEdkw2Y2VhcWRpaWdqTkhyLXJlUGItejJXSVFkWVhiM3VaNVdTWnNVYW5Vd1p0TdIB0AFBVV95cUxNZnBjVUhkQjhPU3QySmI4Nk1YSmxHY3YwNDFWekdwV21WbmFoMWV3V2JCdzRSR1lFVFpvWHZkY0RWaUhKV3plaTFiNVh4RkFUYTh5bHRxbjlIemgyeHhrZ0xBZFFmcEJFdXg3a2hGZi01U1UwTUJjZkZmamI2Y2RKQzcxQlRVajV3N2FpWmNvQkE1YW9vbk1Xc25mNktsbXNycVZMWk8xQzl5VHVVQ3JEUUQ2eWpkZmZSNnFxSVhXWlBaX1RfM0QxNUpfT3ctVFZD?oc=5
2026-02-24	Yahoo	0.123	UPS Market Competitive Landscape Report 2025: Top Companies Analysis, Profiles, Strategic Developments, Mergers, Sustainability Goals, Product Innovations and Launches, Revenues	The global uninterruptible power supply (UPS) market is set to grow from USD 9.59 billion in 2025 to USD 14.56 billion by 2033, with a CAGR of 5.36%. This steady growth is fueled by rising demand for reliable power solutions across commercial, industrial, and residential sectors in both developed and developing nations. Technological advancements like high-efficiency UPS systems, lithium-ion batteries, and smart energy management are key drivers. Leading manufacturers such as Hitachi, ABB, Gener	https://finance.yahoo.com/news/ups-market-competitive-landscape-report-121900071.html?.tsrc=rss
2026-02-24	Yahoo	0.079	GE (GE) Upgraded to Strong Buy: Here's What You Should Know	GE (GE) might move higher on growing optimism about its earnings prospects, which is reflected by its upgrade to a Zacks Rank #1 (Strong Buy).	https://finance.yahoo.com/news/ge-ge-upgraded-strong-buy-170004999.html?.tsrc=rss
2026-02-24	Google	0.068	GE Aerospace Expands Defense And Commercial Engine Opportunities With New Deals - simplywall.st		https://news.google.com/rss/articles/CBMi0gFBVV95cUxQa3VMVFpfQWtTRGNfZU8ycmJXOEc5bmRHbXpndHItOUktSHdib2V2MXcwRWJVbWJkYVZVVFY0U0JpTW9PN01OU2RJNjB6NVBJcmFxUDQtZ1BFNkd3YkFBNHkyQXNhX2E4c0ZXNURkR2FudXpEVFY0dXMxMmUteGtLTFZseE01ekRWOUp2UF9EUWZUWTNzSE9tNDlJX09Rd3MxdHNrOEZZbWxaUHZmRjBhZFU4cVFvb3dzc19Rcmw5bGloNE1QMjhyNUVBVDdHWkVNUHfSAdcBQVVfeXFMTkh6M1FVU2Y2Ujd2V3BSbjVVNGhSMFJxNjFrci1SM2NWOElQS2pMTkpNWVBDTjQ0cno0ZVZMUHVJa0RmMGVWU0RpSWVYMDlHVmdxNHR1TE1sbGlkQkhLMk5lZHZrZWYyVjhuaGJuT3BxVVo3UERRVndrRFk0aGFQQnlWVk52MkxyamxIOThlU1JDWS1ONnhCYnBteVlVZml3V0tTRFJkMHRFWlVhdkhyWnpJRWY1ekxlQ2dQTXVrMHFRWmNOQUo5U2ppdERYajN3S2pQQ3FtTWM?oc=5
2026-02-24	Yahoo	0.068	Smart Pills Market Competitive Landscape Report 2025: Key Players Analysis, Profiles, Strategic Developments, Mergers, Product Innovations, Revenue Insights, and Future Forecasts to 2033	The global smart pills market is projected to expand from $5.72 billion in 2025 to $15.05 billion by 2033, growing at a CAGR of 12.85%. This growth is driven by rising demand from an aging population, technological advancements, and increased adoption in minimally invasive surgeries. Smart pills, also known as digital pills, enhance medication adherence and health monitoring through sensors communicating with devices. With their integration into telemedicine and relevance to chronic disease mana	https://finance.yahoo.com/news/smart-pills-market-competitive-landscape-161400120.html?.tsrc=rss
2026-02-24	Yahoo	0.034	Dow Jones AI Giant Nvidia Eyes Buy Point With Earnings Set To Surge 72%	Dow Jones AI giant Nvidia stock is approaching a new buy point ahead of the company's quarterly earnings report this week.	https://finance.yahoo.com/m/1037c113-b1d7-32e3-998b-a0706744effd/dow-jones-ai-giant-nvidia.html?.tsrc=rss
2026-02-24	Google	0.0	GE Aerospace $GE Holdings Raised by Clearstead Advisors LLC - MarketBeat		https://news.google.com/rss/articles/CBMiuwFBVV95cUxQYXBmY2pTTlp2WTgzLUcyckZpX08yY1NSYlhyOENVYko4cWttbkpvYW0xVHJQeG1WQW42eHpiV2E1ZHB5a0Nrbm8yVE9STi1LNFJOQkk1NDdpZFJCdVBRU1BJWHBuQzVjenFUYXpZZ0Fsb0tQYkdUbGNOd0NnckZvXzB0ckc2SnpJYklNUEhCT3kzV3p2aVF0dEZQRTBDVWQ0NGdhVHl2Wk94QUFkOHBIUWNiblJlU3N0Q1U4?oc=5
2026-02-24	Google	0.0	GE Aerospace (NYSE:GE) Shares Up 2.1% - Time to Buy? - MarketBeat		https://news.google.com/rss/articles/CBMinwFBVV95cUxPT2hjODlkbVE0T1UwMTZKdzZybmx1ckgxUmNmOFMzRFhjV05pblRUdWQzamdXY0hkTUQ0ZDR4OUN6b1poVksyVXJkb0xEcTc3VEtRa0hmcnNob0RzX3gxTXZLV3hlMGRaV2E1UWx1NUZCdElmSEEta3owMWFHMDBJa0k5anY3SkF1UVBXNE00VlhoTDN5cE0zc2dkR21JVk0?oc=5
2026-02-24	Google	0.0	GE Aerospace Climbed 27% in 6 Months. Here’s Where Shares Could Go Next - TIKR.com		https://news.google.com/rss/articles/CBMimgFBVV95cUxQSDRkT1JZLW1JSEIxSVFEU0phdEF0MFMwbEhtVEFSYUlHa3JhVmR3bU43QmFtVklrNFhERVJYanRLZ3VqbVlmYWp1M2tPSUxtZDF3TWcxeFQ3R2ItU2JFRTdFd0JGak42RFlOQ2xmQmdlT1I3RmpQR0JtSUFEWnBhRFdsZ0tFZUNTT0x5dlhpa1hDUUlvQkNyMTN3?oc=5
2026-02-24	Google	0.0	GE Aerospace teams with Palantir on AI-driven jet-engine contract (GE:NYSE) - Seeking Alpha		https://news.google.com/rss/articles/CBMipgFBVV95cUxOTVEtLVVLTUMtTmpOZWJ3RGE1dk5mOU9OQ3pNNEZOQlRtRER5WFoxQzdDQmVPV3U5MXNCRW5hMFlNV09jTlZaZnlWTnhVeWFmdDcyVUtRTUhLOTN0WndPMmZSWHJXR0xUTHlaUGVRdWI3ZkpNSnlQZHRXX21WR242VWRuOEFKbXBnWm94RWU3RExBTlI5MWVZRG1PQzRqdUlHUEV2dWVn?oc=5
2026-02-24	Google	0.0	GE Vernova Growth Supercycle Tied To AI Power And Payouts - Yahoo Finance		https://news.google.com/rss/articles/CBMihgFBVV95cUxQNlNlSUZjZ2Nja2szbmxobzlzdldMMl9TRWRKUjJqY1Biem9zOUxKNVpxVkRleVpCTjREV015U0F4bWxZQWRnV09IRDl4UEZJM3BTQjEzbHZsTGFkTlV4S3ZWUGM5WkhPSVdCUFV3MDVTZUFsM2EzY1JBNDU3bjU0QzZrQTlzQQ?oc=5
2026-02-24	Google	0.0	I Trust GE Vernova (GEV) CEO, Says Jim Cramer - Yahoo Finance		https://news.google.com/rss/articles/CBMiekFVX3lxTE9BRkJORk90d3dmS3J4TWc2ejlmQnNsTTJ0eEJzSUNyVTFMdEhvVHhmYVRWMjMzOUloUmpzb1JzaWpaRDlhdFg5Z3lCQUZlQXJ0QmNuOTJ3anZBa3FJTlhQSVNnTERnRnliWkhsYVcyM3RBRVAzdG03bVFn?oc=5
2026-02-24	Google	0.0	Mufg Securities Americas Inc. Grows Stake in GE Vernova Inc. $GEV - MarketBeat		https://news.google.com/rss/articles/CBMiwAFBVV95cUxPLTB3dVl3OUtHNC0tblJKNC01OExja3F4RnN0Ml9zYmtWZHc0d3czT1V0bU5NMTZZSk5YQlBwZ0FkcTRRb3pBTFIzdENOWEV6REplYzZaRHZqLUZCbGNWdC1kOXlLaGxKb2QzLV9Ha29KUmctYUFEZ3FDckdXVTA1ZHZGOFBzb25ub3RXRGowdVFHX3Q1am4yZEJTLTFXWGFTVE43c0xpQTVRWjd2ZmRmaXNRTkVmSjhVdDRSVnJxcWw?oc=5
2026-02-24	Google	0.0	Mufg Securities Americas Inc. Purchases 4,962 Shares of GE Aerospace $GE - MarketBeat		https://news.google.com/rss/articles/CBMiygFBVV95cUxQRmZrRHZ6cnNqU1U3bEsyenFIS1RhaWxBcWVPWm9GbHRNSGF4TVdDdWQtTzJrV2RxRGs1QUFPX1lJa3VPemZ0dVNNaS1OUFd2N3BYNkM5NG9vSVBiQVhhek9RQXFna1ZGSWtRNl9rRXpyeUtZSFFnelpDV0tpZ1FUcmdVWTF4N1pjR3BvaW1yRThydy1DWDhJaTJneDRPQ2RDa1llUVVZNjBwZ0hFSlBSZENqRW1RaC1wVnZjTjE2cmpqX3VwcGFQb1Nn?oc=5
2026-02-24	Google	0.0	Nuclear Imaging Market Is Going to Boom |• GE Healthcare • Siemens Healthineers - openPR.com		https://news.google.com/rss/articles/CBMikwFBVV95cUxOVGRfXzMwdTVFOXlLODFNbXoxM29CS1B6RzJTS0F4dnRtZTZxaUtNOGJ5VDZqU3hUOXpfR2hRT2NDcG5KdjZXUkFDTFNzNl82elUtTEx3eDJrWmx5bUZfRXpTTlpqSERpUzNxN2NZWXNrVXhjWHJqbEk4SEpCVUNnalJmSTBwU2NrLVcxNUV4X1FvTUE?oc=5
2026-02-24	Google	0.0	RTX post sparks buzz as Pratt & Whitney vies to power stealthy Mach 2 jet - CT Insider		https://news.google.com/rss/articles/CBMipgFBVV95cUxPUi1DcHVJV2ZkMnV6WXZWU0RKekpnNFJSTl9UNUgtMm5jSGh6S0tvaTkyLU9PbVRYQXJDUWxKazMwQ0JlQzZKWTlkRDNGb3Y4ZTh1UTBmUTdZZE1lT252a0xFUlNKcUwxV0p3VEJBSGM1UkZyWV9qVjFRQkhmNG9CTkIyQk0tb2FuOG5UOUF1eVduZHBHcmdyVWIxMnotYk9DaVRzOXp3?oc=5
2026-02-24	Google	0.0	Rice Partnership LLC Buys 7,177 Shares of GE Vernova Inc. $GEV - MarketBeat		https://news.google.com/rss/articles/CBMivAFBVV95cUxNTUNTNkNTaXBIUkpqZ1E1YXRsQ2JaS3lTaVBaVWNqQ2ZRa01rLXpDYkJWclpuTjYzS194TG5nTmg5LVhTVXpvSjVQLWhOZ2FGWDJUT3NuUEJ3OTQwVlBZcE5QSElKLVBfanZtYU5ZWVpVZE5kUUNqWmtzbW0tM09IWWg1OGdGNkVXSW5fSGtuX3Y1V2k0dXBnZG5IMFdvbkIyNWlLMlVqdkJEN3UxQThmbThFLTlrSTY3TkNvWA?oc=5
2026-02-24	Google	0.0	U.S. Air Force Selects Honeywell and GE-Kratos Team for CCA Engines - RealClearDefense		https://news.google.com/rss/articles/CBMivwFBVV95cUxNVzZkZEIyUXdsV2JDZ3ZMMi1xejRDX1luRWJjaG95RlF3cnFuWWRHOUxoLTlBeG1SWm1uaWd6bTRhU2dLWlNZSlRfN0V5R1R1TFBNendaOTI2WktNUEVsb1lRdERfQk9xc1hmSzFoZS05UTUxX3BHdlBSQjdXRUI3QVpUTXloLWFkTGlkLUdoMUJnSkljZ3E4bEJ4UUFiLUY4b3ZhSm5LVnVMVFB4SGhjdkJMX0FuYWp4ejBfSzhGcw?oc=5
2026-02-24	Yahoo	-0.01	Is GE HealthCare Technologies (GEHC) Offering Value After Its Spin Off From General Electric?	If you are wondering whether GE HealthCare Technologies is offering good value today, you are not alone. The stock often draws interest from investors who care about what they are paying for future potential. The share price recently closed at US$83.86, with returns of 4.4% over the past week, 5.1% over the past month, 1.3% year to date, and a 7.2% decline over the past year. This gives a mixed picture for anyone thinking about timing. Recent company news has focused on GE HealthCare...	https://finance.yahoo.com/news/ge-healthcare-technologies-gehc-offering-090807596.html?.tsrc=rss
2026-02-24	Yahoo	-0.023	Kratos Deepens Role In Unmanned, Hypersonic And Missile Programs With New Deals	Kratos Defense & Security Solutions (NasdaqGS:KTOS) and GE Aerospace won a U.S. Air Force contract to design the next generation GEK1500 engine for small Collaborative Combat Aircraft. Kratos secured a Pentagon award related to hypersonic materials testing, focused on thermal protection systems. The company is participating in the Pentagon’s Drone Dominance Program Phase 1 Gauntlet. Through its Prometheus Energetics joint venture, Kratos is advancing a solid rocket motor manufacturing...	https://finance.yahoo.com/news/kratos-deepens-role-unmanned-hypersonic-010921247.html?.tsrc=rss
2026-02-24	Google	-0.05	I Trust GE Vernova (GEV) CEO, Says Jim Cramer - Insider Monkey		https://news.google.com/rss/articles/CBMijwFBVV95cUxOX0paam96OV9WUjRGRGpNUG9RekdEbTdGTWRMWF9tYTN2OE9GNW5wamxUNkd4Q20ya2FKZGIwYkZpMzVZcEgtVXFrWnNvd1pDa2JYZ042VXRvUUlnRy1mbTkwNzlwNC01REw0S1R1WVlpYklWbGhXcU83eEZmeFZadjZtb3dnVXlzbFZBNDZyVdIBlwFBVV95cUxPZERMT1RCel90cll5TjYtZU9kc25RSkpWTnBGRFBoeUFRdDdRRmthVlpaODZIeUVaUzE0WWJyaWwtalRRdUhqM1lYRHFWdF96X0JZSVFqLVBrUnY3X2ptNUVZU2NRSnNVWjIwTVRxRXRzalBxdXZEVmRJUHJ6VW5yTklQVVNfOTdXRXliNTBRMmloOEFNcnlV?oc=5
2026-02-24	Google	-0.05	United Airlines selects GE Aerospace (GE)’s GEnx Engines for Boeing 787 - Insider Monkey		https://news.google.com/rss/articles/CBMisgFBVV95cUxPY3J1UDhXNmg2dEtmM1lSZGR6dFBJVzRhandaTnNwMnNUU2RSdmpfOThwaUVYd2YySmQ3dU9ISUpablZ5aUc1RVBJeEF5cmVUODYwclFiU2pzVU1udkVWWkpXbkJsYTdMNXZ6NGhYRWRiVkVBLUVaMGgzU0NwN2R4TVYtYkFzM0dwZjAtYXdvTHFrNlZjMm5Ib0NTR1dtemVIS1puWDB0c1l6cExXUjRrZUF30gG6AUFVX3lxTE9GQkRWaGhreEJqQ1BWaGI3a0k4VkZXdU9DUF90TzlCVW5DekpCd0thUU5YX09fSW9qOU1NZjB5X1ZvbmFhX3A1eGZMano0VExtQzRmbzBKNkpfUkZ1WjVjclp2Y0JVN2dHT0JvRVcwb09PdmxMQWQybDk5aEJVcHpuSHZmWDZRNERfVlhjb25nWndKbmowUWdUQ21Db1M4eW9OQnJxVzNmdktXV3M2cDVIanEwV0wzVlJNdw?oc=5
2026-02-24	Google	-0.062	Is GE HealthCare Technologies Inc. (GEHC) Outperforming Other Medical Stocks This Year? - Yahoo Finance		https://news.google.com/rss/articles/CBMiiAFBVV95cUxNYVlwWUk1NEhuWjFVS2pJMWZ0Q2xRMm81WXVOUklWdGZ1bkZCcTB2VFNHOTI1MExJczh4c1pic3lpVGliSHhEcUlSeWdIMzRpQ2tNTklNSFlTclIyVDMxbWFSekI3anAwcVJiWkJDSHI4Snp0N0JrU2pBR3pBYk9lcl9MRWlRUnFH?oc=5
2026-02-24	Google	-0.094	GE Vernova : Deployment of BWRX-300 small modular reactor in Poland takes major step forward with design development - marketscreener.com		https://news.google.com/rss/articles/CBMi5gFBVV95cUxPRFVhQ05nWlpEZWFKSGd3NnRTY3daQlU2VnB4UDZTMnNTQjJLdnd5Yy1nNmkwSjVpeUMzMUp6OTAteG5VRFh3U1k4Q2dINFlubHJKZDN1d1JlMkJvU1BzQWFIYjE1RTBnbGVQS1NaS0Y1WVFVZHlIM0hUX3F2S0FYNnBJWUlhNVlkSzNWX0JZaG9sRThScG5hM2VqUUZGTXdSOWZaQnhOdW5yYUR2aVdiWVhGQ211NVFmRFEyaW9vV21seDRJNjlUMEFIN3h6SEo2Q1FZNTdHalh0ck83eEMyV2ZzcE5Zdw?oc=5
2026-02-24	Google	-0.1	The Stock That Didn’t Get Crushed by the AI Doomsday Essay - Barron's		https://news.google.com/rss/articles/CBMi_gJBVV95cUxPYkc0LVA4eHFsaTdpWmN2bGhwaldvN1kyaXdoa3ZOa25BTjFYWnV4dkRUU015VDc3a2Q0TUNkMW1xWmRYaHZkaWlVYTFFYWN1LTA5NVdoS3NXb2xFVFZVbGJUQ2lWVUVZdFBzdUxVUXFzSjJFSG9scWRQdG1nSk1FdnY2X3hjei1NYzdmSWlTUG5vS3NGdkU1TGhZZHVGTDlMZEx3QktUN2UyWVQ5X2VfdnR6U3JWeHR5VXVCeGRMZEpld1hfdDdwQ0liY1NpUlBULW5ub1p2OUpOZjREanlqanNWbWhEZE5GUFpIcDY5MW1tMWhvVTZBXzh3WktNejY5cUV3X1BlVlh4WlRVczdXTWQwSzhhWk9URVlZVTRlWXNqQ0xrNkZ0UGlRS09uZHBnMUkwMmdVYlJweFlpQTh1RFYyZDhzSkRhSkRzb1JzaUpEbENsNUVqU3d2SC1TTDB0bG9DMTFDUnlTUXZ2cTdhNHp5VFhZLTdOTmc5WVJR?oc=5
2026-02-24	Google	-0.156	GE Aerospace (NYSE:GE) Shares Down 1.3% - Here's What Happened - MarketBeat		https://news.google.com/rss/articles/CBMirAFBVV95cUxQWnlaWEZkYnpzWEF5cFRydTNONDJCSWdxRlJiMUJmMzFCQU9mUnZMRHJOcW1reENpdTJEM1dKTTNfVFZ5bTFzTkZYTmsya3k4UnBkNHZXRkVyc1libEoyWm9UaVlzTTY3ZF9CRm00M2RUdHZ4Q2ZSandudmE1Z1ROQlNRUVR2X1FlNnZmNktsaHZBa0stZGh2OERPVmI0aE5RMXl1S1o4ZnJnRGt6?oc=5
2026-02-23	Google	0.8	GE Aerospace and Kratos Win U.S. Air Force Award to Design Engine for Expendable Collaborative Combat Aircraft - GE Aerospace		https://news.google.com/rss/articles/CBMiuwFBVV95cUxPa1Y5cHFWOFlZNEtOQXBPRHBfamFfVldGV1h2WlJuWXczZFBiWEFtNUdoaFVuZ0NmcUtRemhzUWc2Y2UtcmpFQ3NDdTZQWTlXaVFORldGcDhaR0RlREcycDY0SkVRSThydXk5QzFYSzVXNTNPR3pqTl85M3YwTG9pQTd4MkhjMUhxMTduSmh3SUw5UlVRbDlKTWc2X2I5aUh6Z0pERDVLXzM1V1FhMS1WUENJeXZYT1FTWk1J?oc=5
2026-02-23	Google	0.8	Is GE Vernova (GEV) Still Attractive After 163% One Year Share Price Surge - Yahoo Finance		https://news.google.com/rss/articles/CBMigwFBVV95cUxNZ2lpOGdNOXdxMkNVWXNzWkxzNDNycUNFMTl5Y3ZSUko1cnA3X1c4NUFMYWExMU9PdjdQVmYyS2R3bXdhbXhYeUpqUDNaQ0NRcnB4Wk04T1h3aGV4NFZSQnh2STNpOHNyTXMtbDc0dl9WaFQ0OGNsZDd4QWwtZW5EVmhmMA?oc=5
2026-02-23	Google	0.8	Kratos and GE Aerospace win $12.4M Air Force engine contract - Investing.com		https://news.google.com/rss/articles/CBMitgFBVV95cUxPQzlqYkM4cFFCZ0NUOExNTFBMSlJOeDN2OFR0M05YeEUxcjYzWUxCbTBnOFkySkhiQnFVakdUbkRCdGNIdVlGQnhPNmhEOTQ1QnBjRW5NQlcxOUVXbXAxNUJyRnFJQy1pQ2JZVDNxRXpVeHdUTVlvcFhwRUw2Nk1FRlVmWEpKU29uLXZHSVIyMVUxTGhkNkM3Y3NxLTl3M2g0ckFfR1VvWHRLS0V0U29ENmU0LVFqQQ?oc=5
2026-02-23	Google	0.4	GE Aerospace Secures $12.4M Contract for Advanced Engine Design - GuruFocus		https://news.google.com/rss/articles/CBMiogFBVV95cUxNWDRyTlhIdDJwb29tX0dwYlZab0oxNjV1NHJ1RWhEdjAyZHA5VTdVVzNkSU52MUt3Slo0aXduUWtvREVvT2RqWlliT2hHLWFaU0JGWUdzM00yTGZaa0tPRkFFS0lkdlQ1Q1EwYnVNQnV4SE5uOERKRjFzYnNwSlpzclluc3p5aHZOeE9OQXlkbnA1MHFGRGxyUGVvQWh0aENhUGc?oc=5
2026-02-23	Google	0.4	Kratos and GE Aerospace secure U.S. Air Force contract to develop GEK1500 engine for Collaborative Combat Aircraft - Defence Industry Europe		https://news.google.com/rss/articles/CBMi2gFBVV95cUxOaVh6RHJwLW9tcmlfaGRSY1lVM3h4MDVPei00RjNEVFppc0hqTFIwU1pEdU1yc3BmVmxjb1FMc2UyNWlDaUhucWM4R1kwUlFmQUdpN3ZRVGxJMUx4blNMTnVZTndjTDJialBQQTZkeWFFYVhUdE1KdHVBSFZhRUVoS0MtSGVQTHdxZ3N4clJ6eXB6NDg5U0ZLOWZRZllFYW96dkZia3N5a19uR3BJYzJWY0NrcEJIdDJUaVRpM2lGNFo4NTJVd2hRRjFLXzdJZkFUVXo5T1JJOHZYZw?oc=5
2026-02-23	Google	0.4	Kratos, GE Win Air Force Contract For GEK1500 Engine Preliminary Design - Defense Daily		https://news.google.com/rss/articles/CBMiuAFBVV95cUxQT3lVSzVnLUI0U0J1cnd5ZXU5U3NFV2hrRXdOVDRXeEEtRHpnN2xFOFRKeHlkZkEtZDhUODVTTGd1a3c2MTVwVEc3aGM2dUE3cWRzNWlESHhMazJuRHJsaWJzbEFsd3huUUVGbkhtMjFncjc1UGZ4TzFrNk1qQUhKcjltWTdzcXlkazJlRm5FVng2aWx2YWpGNVkzWjg0ZmJHSjJQaFhMUnJFMDhsRk5QRUZ3ODlkcHdJ?oc=5
2026-02-23	Google	0.3	NextEra Energy vs. GE Vernova: Which Energy Transition Stock Wins? - TradingView		https://news.google.com/rss/articles/CBMiuwFBVV95cUxOU0t3eld1UjJmSndPc05fWURwYWw3bkZpblhmMnRTNGVHWGItZWFJLXVoWnF5X0lRbVRvVENwVHA3VXBLektJbUxIT0ozREVNVGpvRnhqb18xa1h4dG5BVzAxYjRVQ3NDZnI0TUk4SHB6dE9YSDkyUmtISTdjSzhGeGZEa1hoNl9VM3JiZmZDYm1FQTY5TmhObGZKTFJ5UlhWM0tDbEx4T0Y3UTlUbE94T0hhY2wyQ0FJLU40?oc=5
2026-02-23	Google	0.3	NextEra Energy vs. GE Vernova: Which Energy Transition Stock Wins? - Zacks Investment Research		https://news.google.com/rss/articles/CBMipwFBVV95cUxNVnZaOUFNbUNKaHpVT2owOUVKSzEtZkZYaUVRZEI4UXNWdWkya196THJXZnhVRE8za0tDSzBTazd3NlpuNF9Wak5vdGJPZ3EtNndraklyXzZUWUt1TWxrMHo4cEFFM3phY05DSVQ4QVBNenREQlR6WDdOWmVtS19pQVpZSzk5empfMkI4R2JQN21ZTFoxMDJZM1I0MHpYNmZsazZvWHphSQ?oc=5
2026-02-23	Google	0.217	Assessing GE Vernova (GEV) Valuation After Strong Recent Shareholder Returns - simplywall.st		https://news.google.com/rss/articles/CBMiywFBVV95cUxNSnN1U29TQXRjcnRrU3FqaFhFX19ScS1uekRNZGI5QXE2MnhKZUpQMEl1a2l3dDVKcEViT1JqRW5KeTNPdlhtd2NOQ2VxVWVJa2Z5Z2s1dXFzWnA1Nndoa05aenE3dkt1XzZNUS0wSVJ4TV9fZWFJdGFFZUVFTXpDNko4RjFOWUM0T2FkaEdFMFZIeUVQSkFNTmk3a2VGMHVEc280SWw5ZjZCU0p6N1FLR0txS2pWZlI1cm43QW5ael8zeXJKVV92MEdNUdIB0AFBVV95cUxPWHY5WjF2ZkRWTlFIY2kzci1sVzdibGVoMHNxbVZmdlFhNXZWWFY4d2NFR215d3lkUV9yNkxGZnB2T3NXdmo4dUV0SXdycGV6SnE1WWkwOWpSdFp3LWlKNHdVQVBfd3RwaHdieWZtSFhRNTg5c0pNcGN5MzVXeVRnaHR6b05OU1J0NExub1VqOW9Hbl8wVkllelN1ejV1R24xYzRHVHJfMHR6ak5pSEFpbUNZVlBoeFloTFVvWFBpcC03LTBDMDdaZmo5a0FWa29V?oc=5
2026-02-23	Google	0.2	November 20th Options Now Available For GE Aerospace - Nasdaq		https://news.google.com/rss/articles/CBMihwFBVV95cUxQMWJLZFRKY3BxV3c2dVlHVDFtdnJSV1FLdzcyTVNfc2VuZ2U3OWFyWUVfanhNVDJGM2xSbkNPTnpiemdiSnctSG5Wb0pJNU9vUUFfc1ppRzBLcmNOVDB4QTFmUFVIQ0JRaTdJOUJYMXF0MlU5NmFYTUFsOG9rOHdtQVJVOTUwbXM?oc=5
