Date	Source	Sentiment	Headline	Summary	URL
2026-02-23	Google	0.192	GE HealthCare Technologies Inc. (GEHC) Positioned to Capitalize on Strong Demand Backlog - Insider Monkey		https://news.google.com/rss/articles/CBMiyAFBVV95cUxQV3lpS2lqRDRHVVU4eUFsQXoxaTBCbmdCUWxJS3VLNDJNUmF1N1V0X2dMUU9Od29SYTM1ZDJvWU51SjlaUFhnRGpfdXpqYVhhdUhUTVhBYUZUT3VNSlQ3c0Y3SkhYUFFVcGVIV3RmQktzYi04SXpiRS1tbHMxN2pQVy0zVFJhY1B5RWJ4YjkxTFRnNTlMUUpYekFoYXg2YVNBakllSm1YZ3RGTE5qX0I0SmpLTW9sM2g3bHpPakhSTVZSTVhtQlNleNIB0AFBVV95cUxQNjNDQ0pBNXZ5VkNYdDBhbzYyRGhQeE5aRVVEZ1Rta1BPaF8xVVVReE9LTkhjVlZyN016V0twV0UtQlI1TnVYdzlGWXR5UDhMTzZaekRLZmR6Tm00QlBpYXhkRGlMWElkckliNUsxRGktRVlNNHJXQ2xIdGl4aDg1emkzS3RKcWpjLWRXdjRwbEFFdmIweG11QlVLeGFsMmxsa29JWEpydVl6Q0pZZ2t2aVBjeXU0UXZZbVRYUEszWWhZVjUtRkt5akdsVEpuZ081?oc=5
2026-02-23	Yahoo	0.18	GE and 5 More Stocks That Can Win as AI Shakes Up the Economy	Manufacturing and aerospace & defense stocks are turning out to be potential havens as artificial intelligence disrupts industries from software to financial technology and professional services.  “AI will enable a structural reduction in the cost of doing business for many commercial aerospace companies, supporting higher through-cycle margins,” wrote Deutsche Bank analyst Scott Deuschle in a Monday note.	https://finance.yahoo.com/m/42b6641c-d535-3518-85f0-2dcfdbaa2b61/ge-and-5-more-stocks-that-can.html?.tsrc=rss
2026-02-23	Google	0.162	General Electric (GE) Is Up 8.8% After New Aerospace Engine Wins And Space Deals - Has The Bull Case Changed? - simplywall.st		https://news.google.com/rss/articles/CBMi0gFBVV95cUxQSFNtQUJqYTYxTTRILWdwZENhbmxPOU9PWmw3S29rRnBVMUN2bFdWT1prNjlDUXZlUmpkdk1laGJFVVZ1Z2dJbzM4ODhhV3pPOHlTRjZmRjdTcU5haXc3TDlkY1BkU1BLUnFub2pJY1B3RkZLRFJ0QzFMSGNhVWU1RERHTzg4SVp6UVliaGZET0FUU19YWUVnNzdOUzNGWEZuMHZCYS1PQ1V0MlFsaVlsRGREbFd1Q0k2Tm5uMXdyNFhRWGVLc0IzUUNNWlZqNEItT2fSAdcBQVVfeXFMTWI5OVZpZ0NwT3RlcEVVekx2NlhMSG1ocFRPZlJoajR3SDhhQUhCalFUU1JlMEk2VE1JNTVPcmVqelNNdGhNOHdoMHlUeFl2YW9OaDdPSkYtRWlUeGE0Y19PZ2ZVbWd1UVhERDhnNHlHWkV5OUhfYlE1c1VNbVgwUTM5MXprQ25BVk04Qjg5YnlfUjRRNjNMc1V1ell4aWM2VWJGU05qY1dCN2N2S1VHTEtKUW9lVE9GbWdnS2NkVjNLUE00Q3B1dFNWZkhfRmZ6R2NEeUVfZG8?oc=5
2026-02-23	Yahoo	0.157	A Look At General Electric’s (GE) Valuation After Morgan Stanley’s Bullish Aerospace Initiation	Morgan Stanley’s fresh coverage of General Electric (GE) has thrown fresh attention on GE Aerospace, highlighting its standalone structure, cash flow potential, and role in recent aerospace program wins and partnerships. See our latest analysis for General Electric. Against this backdrop, General Electric’s 1 month share price return of 16.79% and 90 day share price return of 16.96% suggest momentum has been building. A 1 year total shareholder return of 73.71% and very large 3 and 5 year...	https://finance.yahoo.com/news/look-general-electric-ge-valuation-131122893.html?.tsrc=rss
2026-02-23	Google	0.136	Ronald Reagan Presidential Foundation and Institute and GE Aerospace Launch New Workforce Readiness Scholarship – Van Nuys News Press - Van Nuys News Press		https://news.google.com/rss/articles/CBMi3gFBVV95cUxPSmRfbGFTNjVOVU9RT0ZLSWhhXzJpdDhZV2M0cmE1X3YxTlIwSVR5d3hLYmQ1MWM1d0t5VXZGV3loNHNzNWVlWGRUbmtCWHlGeS1sTFlYR3ZmbXJVc3JkeTdHOTlvTU5LZENyUVlBVDFMRVpZTkhOUUlwTFZUWGxkTnZKandZb1lmRloyM2FzeDQ2MDJvMjNyMUFOc3R5UFFYVlZkV1BMRTdiY0hvYjliUVlBMHJ5YjVSb3h0TldVZzZwUS1ucWFCMmZmaUphbi1DcktFLVdHQ0l5akhxalE?oc=5
2026-02-23	Yahoo	0.136	UAL Orders 300 GEnx Engines From GE Aerospace to Power Boeing 787s	United Airlines selects 300 GE GEnx engines for new 787s, becomes the largest GEnx operator and boosts GE's long-term service revenues.	https://finance.yahoo.com/news/ual-orders-300-genx-engines-154100814.html?.tsrc=rss
2026-02-23	Yahoo	0.107	Power Transformer Market Competitive Analysis Report 2025: Profiles, Strategic Developments, Mergers, Product Innovations, Revenue Insights, and Future Forecasts to 2033	The global power transformer market, valued at USD 28.92 billion in 2025, is projected to reach USD 52.16 billion by 2033, with a robust CAGR of 7.65%. This growth is driven by rising electricity demand, infrastructural development, and renewable energy initiatives, enhancing power distribution efficiency. Key players like Bharat Heavy Electricals, Daihen Corporation, and General Electric are pivotal in this sector, offering advanced transformers facilitating efficient energy transfer across ext	https://finance.yahoo.com/news/power-transformer-market-competitive-analysis-152700314.html?.tsrc=rss
2026-02-23	Google	0.1	GE Vernova Is Up 37% in the Last 6 Months. Here’s How Much the Stock Could Rise in 2026 - TIKR.com		https://news.google.com/rss/articles/CBMirwFBVV95cUxNeG1LS1V1SHNCZ2s4NlhIbDBxaDlkWEN3cmtRX3VTSG1zSGxxQzFGcGxLVmVQeDc4RFdSMTB0VDk1NnVFeHNORGNPaFRqazBqR1hLN0lESE9MbW5MU0V6bVA3eWp2UDhnSDVCV0NCcnFRdzhsVUVTaGdxdWNjME53QktiVU43bS1idDFzZXpRSTA0X1l3TFNMUFpETEEwb2U0QndZeGZvQzh5QXYtTzQw?oc=5
2026-02-23	Google	0.1	USF’s Center for Advanced Medical Learning and Simulation Installs GE HealthCare IGT System - Imaging Technology News		https://news.google.com/rss/articles/CBMiyAFBVV95cUxObmJEem5RelNKZkxNcnM3bmQyMF85YU9wYnMyYnQyWWt0WkNYS3ZBYTlLU2N2NmJFLTgtTFBmT2dfRDBRWE1tejNKVDJSNVJXU0swUTZXZGE0WDlCX1czOTNxa3VOX0JPM1pLMlJDUElYNTlMeGRqcXEzSzJ1VFZzb2NDdlZuUkQySzRQRUNJNk1tTXpPY0hDbHdIaWhha3lVOEZCUzZMaWY4bjlvUlNiSUxOeXlKdGFzeEFoUUNhR1VQWmRuUDhMTw?oc=5
2026-02-23	Google	0.068	A new mural at Bug O Nay Ge Shig School | Education | walkermn.com - The Pilot Independent		https://news.google.com/rss/articles/CBMiwgFBVV95cUxNTldWV3lPNEJvV0pCY2NwTTUwV2tQZUVYSEJadE5nM2FuX1MwLUpoOFVBWTczRDlNRGxhaTByQkRfUTRBdk9tdFotYUtJMGpoZW9IeXJmRC1YeS1YOFBleEN6cWNUYS1mMTJvLWZBMzBMdzhjU3J3ckc3M1RreDZJTmtUYjNER2tJZGVhVzRxLURWdEwzanN3VWNQVV9CRlZrdVJHNU1zYWRIVnYxbTdSSlgwRGo2VGVWUVhrTzk0UDg5UQ?oc=5
2026-02-23	Google	0.05	General Electric Lands Air Force Deal - Benzinga		https://news.google.com/rss/articles/CBMimwFBVV95cUxPRWhvVTNBZm5nMjRiQnBObnc1QjFNNVQ4VHhDTXNhNGhXOGVPSW9YeXkwanhPM0tURklKV3JMSEc3bjc4S2E3OUlMNDdrM1FmZWstRndtV1NXcVdORVlUMXBJeG9qT2dmTGRoc0dKclREMDQzTkczME5lNmtUTy1VS21hTDlycEFvU1Bjenc5eG5fUnF3T05MR2wyaw?oc=5
2026-02-23	Google	0.0	American Makes Long-Term Commitment to GE Engines - American Machinist		https://news.google.com/rss/articles/CBMivgFBVV95cUxOWk9nNXV6NEE5bVlucEl6Q1RsWFo5cHZLT1M0YW9PbVhXSUhDb244SS1yQU9XdEJyNHFmakh3WjNZbVFVVHV6SzljcG9uZ25wS3VfTnd5UXJjdndkN1V5LUhhajZuOFBaVS1LMTUycjhXVkFoTjVlZTlmSFhrdF93MUpadFEzajh0SllwODNpNFJhc09xSkZTU3c3Y3BiNzIzYmlzSmd5Mk52UzR2WDV2OXhLUnllTkU1VmF5OVJn?oc=5
2026-02-23	Yahoo	0.0	Azul S.A. Appoints John S. Slattery to its Strategy Committee	Azul S.A. Appoints John S. Slattery to its Strategy Committee	https://finance.yahoo.com/news/azul-appoints-john-slattery-strategy-142100173.html?.tsrc=rss
2026-02-23	Google	0.0	GE Aerospace and Kratos sign $12,4 million contract to create a 1.500-pound stealth engine that could redefine US combat drones - CPG Click Petróleo e Gás		https://news.google.com/rss/articles/CBMijgFBVV95cUxQclZ6c3VTOEhKM0h4eFY4WmVMYktfU1BaUm1zd0RfSDhyVnVfaTR1c3N1TGtkc040S2paalJPVXctcUl2c3N5MWZLTTRfVVhYWTFSX182eWhDSmJYSDhTVVBZQUJsSlFZdGVVblpweWRvS0RmY3hyZ3lxUGdvcC1wUlFnRWh6dFFnaU52RElB?oc=5
2026-02-23	Google	0.0	GE Aerospace stock (GE) slips after hours despite $12.4M U.S. Air Force engine award with Kratos - Bez Kabli		https://news.google.com/rss/articles/CBMiugFBVV95cUxOYkRwYVVrTjBpZ1ZjcFRna0twQ2xIYTB2a3J5aVBvWHRNWVdpU203aG9qVklmMGpoLWMzY0pOOVBNTW0zV3pXcjE0VTY2b1VpeWZNcjdhRG9RbU84azc3Mk1ZazRnUF95QTlUUVVyTWJhcTh5akIwRExFY2hBYWxOQ0dGTzg2UVpVOG1OZjVxaDZ2NWM2bkZZT0MtS0pNenRsTjFOUUMxanhKWVZJOUY5Ni1SbzJCN0w0d1E?oc=5
2026-02-23	Google	0.0	GE Renewables Spinoff Can Patent Wind Turbine Protector - Law360		https://news.google.com/rss/articles/CBMimwFBVV95cUxNVUh5bTdfSk1fMDdLeWNmRTJJaGUyR3lkWG40Wlg5SmxlSTl3dmFjdl9TelYyYTUteUFPM0NTcjBKcnJKUE02TlRfdF9FWG5TTEN6R2VUdG1PSEZXeWdYOWdfQXVkWENWYUdYQWFUZnNqWEo3TXNhMDg1cmxhNzdVNjNSMzNUTUJNZGE3UDBZTzdzdnlOSkwyLUs0ONIBWEFVX3lxTE00dVhULUVwSnBqTHp6OV9OZEhwek9OZGEtcmRHZDV6cFdZYUREcWt3enJPMDJtVnkzMEJWVDhMRXZWUnczRkxOMUVpcW5QbDU3YVlCMW9fUFg?oc=5
2026-02-23	Google	0.0	GE Stock Quote Price and Forecast - CNN		https://news.google.com/rss/articles/CBMiTkFVX3lxTE1nSmw3Rk5pQ3d5cDBvNklmUHpnSHNPcENIWTBGLXk0YXZaTHktTk5Nb3JfVVRfejRvUkwzeGsyRWk2TlZwREFJQmY5TTUzUQ?oc=5
2026-02-23	Google	0.0	GE Vernova Inc. $GEV Shares Acquired by Private Advisory Group LLC - MarketBeat		https://news.google.com/rss/articles/CBMiwwFBVV95cUxPSzJFSDl5NjN5eUs0WF9DRUVuenRBcVZLYU5OTVFmWTN6TnQ4SW1SUG8tSmQ4WFpQdjdSUDA4T0xIUVg5bjJOMFhPbURXakFDNldvLVVCSTBzM1JHNmlpdi1tRnJWNHdkZ0k0bkNYZFpUX1V1Zm9pMGN2VzNjOTFET3Z2SmhudFlzbm0zRmZKdXRtSkNHV24yQjM1SjBwMFJMMDdVbXEwNDBkazF4VTRKZ0tReWJkOGx4NEYxdE1Hc244d3M?oc=5
2026-02-23	Google	0.0	GE Vernova Inc. $GEV is O Neil Global Advisors Inc.'s 7th Largest Position - MarketBeat		https://news.google.com/rss/articles/CBMiywFBVV95cUxPTDFHcm1qcWc2ZURNU3N1QWQwSlFoNG92T3Voc0NYdWhxQ3lzdWlaLW9GMUhyM2hLeFVxOU1xaUxQNkFyVE1nV0Z6ODVUc0RfdFprQXRQZEM1eHRoNmVhUXhiTUZ2cGh6WUYwUGd5UWo2NkJ1RTVRQkIwZEJ3SmNIQUpOb0NWWXpoLWxkdzNONGVwcHhaN1FPYnljcUllNGFvOTg0LUtVQ2JXQ2dpUktZMWNnYVRVNEZ2ckx4MVFSQ19QMGM1M3EtOFFxNA?oc=5
2026-02-23	Google	0.0	GE-Kratos-USAF Deal Expands CCA Engine Agreement - Aviation Week		https://news.google.com/rss/articles/CBMiqAFBVV95cUxPaXY1c0RzYWlNczA3dUdKYXpOcGItTHRqbklRcG9aX2I2Z2dkSEZMZ3dKQmJfWm5rekJoUzZOanBLbzJpTm96RnM3RU94OHFOVDZEMnJ6aXZRVmxYb1pBb3NmSVJlb1dOYUQyTExoNmxCV29VUlBkNXhhQ0l2a3NMbnZXalk3VEU1UjB1RVRITjdMUUFOVE1fdEluTmdMejVUYWdVNnBwY00?oc=5
2026-02-23	Google	0.0	Georgia Bans Foreigners Without Permanent Residence Permit From Courier, Taxi, Tour Guide Jobs - Civil Georgia		https://news.google.com/rss/articles/CBMiR0FVX3lxTE12MUkwSDBmX2VlN3FSVktDdDVoa1UycVNmMWZwcFBZN0xfczE0cF9ha2Ywbk0zN0Z5Y1ZtMURDZmlkREI2OG5J0gGSAkFVX3lxTE1iN1pMdHhEWjlOa2M4M25CSk5rbUxWU1BteHJ5ZEZsS3hVdUpvN2FJYURXaEZJT3U0TzVHWVlYeHNIMGUtQU0zTjVRbHNLQXVvbDRQX0NtYlpTSXZ1SnEyalRZRll4VU1fYzRzUUNhVnhkMlpnZkk1aFVMWWQtYW5ERzhIbWpWZ3RBTmVTM2FwQURVbDA0dEFNOHhmYWVyNG5pX1B2WVZ1cXRwVjdJWndQSlg4Q25ZMFZqb2V4cFNqSE1CcDRCRnJOanphVE1qVG5KWTdZdjZOckx6Uk84Zy1CY1EwcnlsdWJwVDk5c3JPeEJKaXgyb3hOQ21wSnNZTkRrNkhVYkdyak9mX25QemFMWlE?oc=5
2026-02-23	Google	0.0	Granite Investment Partners LLC Has $37.95 Million Stake in GE Aerospace $GE - MarketBeat		https://news.google.com/rss/articles/CBMizwFBVV95cUxPU2RycVVFT1d6RG5pM3NBMHk2TU9taVpKc3ZST3ZCOEpCMlBhWEtHN0hOXzhOUzR3X21pajJuZVNWUjNIZjV6ekd6ZE1scjhfaUN5a3Mtb2FoSXd0bmk4aDk1MEJOd19zaGhmQU5leS1PcklxUDA2aDZpdFF1T2lnektVZVhtcmRiSGxOVmNSQ0hnZ2lRTjR1c28tZl9OcVQtZXdpbV9Zc3k4OUpNRERMYVp3elBpa0lKdmhYbjc3dGRlM2g3a3BGT2tlcXpON1U?oc=5
2026-02-23	Google	0.0	Indexes Slide As Trump Ups Tariffs; GE Vernova, Southern Copper, Tenet Healthcare In Focus - Investor's Business Daily		https://news.google.com/rss/articles/CBMihAFBVV95cUxNWWlUSV8wTlhwb04wbmtFQ1Z3R2ZPZDUyTF90X19lZG5ianR5dzh2akd6dnVoeDRPNGVWVl9NczBRSFRaN1Ywb0lpOXhucTJ1aFVGQk1jYlo0dU9hSGkwSlByUVEwN25LUnJYNm0zUGZxMDhaWHRjSk9JZi1TOWhqSGVSSG4?oc=5
2026-02-23	Google	0.0	LaFleur & Godfrey LLC Cuts Stake in GE Vernova Inc. $GEV - MarketBeat		https://news.google.com/rss/articles/CBMiswFBVV95cUxQRDBzd3ZRbzZvalV5TmctLVg5bVRhaTI1QS1YdkVGaGZkNHFoc0l4OUotMmRQSnpubXFoc1FMeE15V1l2ZGpoSEF6M01kV3RuMWZoQzM1R2gwQUtfMDZncHk4REd5WVp5cDRmb3hLT2tyQVdSOXA4aUVCbUlUVGthRzZhNXJXWWx5VU9aTVhQYVZfaWpLcktjMkpieUtOZVFicmxCaThWZkhYSU5TallydEpEWQ?oc=5
2026-02-23	Google	0.0	Lawrence Culp: Turnaround Architect, GE Aerospace Chairman and CEO, and Champion of Lean Transformation - BBN Times		https://news.google.com/rss/articles/CBMi0AFBVV95cUxQRkhVbGR5TndQYk9UTW12VzFDZElYVnZKbWFRbzc4cmRfbV9FVFJnTjlYWXByaTczLUVRTnlhRC0xdjNCYjZaVnR1SG44LTFJajRTODQ5cjdndHlfelVPZ25XT2MwMVFDcHE5WWxiZUstZ3NCLUdYTUpvU1lLa3Zubkt6VkVkWEM2eVJnaWpYZmVwQlpXZW40U3RJX3BpanFHRmJtdHM3R1ZGSDlHNnJrQk4wcjR4WjNDYUdEd2lKY3VUdmQwY1RCYmh3dEJGOWl1?oc=5
2026-02-23	Google	0.0	Makena Capital Management LLC Sells 40,082 Shares of GE Aerospace $GE - MarketBeat		https://news.google.com/rss/articles/CBMixwFBVV95cUxOVEl2c0w1aXN6bEFEZ3oxa0xFTVhQMjA3OTNQeHB3c2pxampPWk5zbERCMmF6N0loc1pLT1VkemhINDIyZ1ZYZVdJRE9SZFJTU1Nhc0VKMDA0R25WSTBiZ2lGVUxJTlh3N25fSmhzTV9VeWNEVDRzZEJnbmxoRTZFZGdNN0x5Q1NUaXVjVE9RRkphQ0lmWndjR1plazlfS0FGcmNUUi1BYlRwQ3kycW1PVE9vdXNCMFBJSzNqb19hbXBGbDc5M3A0?oc=5
2026-02-23	Google	0.0	U.S. bets $12.4M on cheaper engines for combat drones from Kratos, GE - Stock Titan		https://news.google.com/rss/articles/CBMiwAFBVV95cUxOc0N5TjhZcE8tNVBPQWJ4SW5LRHoxOVVTeThNekt3MzNSMW0wX1IxaXQ5WGp4YlJudVJ1UElVRUl6aDJTUU9pcExwZy1tdmpjazhISHVnbmJ6bWl4QnREblQ4SjlrZGNEUmhJSFRCYk5XT1RCMmlFcC1YZTd0dVAzMnc4OElLaWIzd1hVakxjbkZ1VVFWczBmQ2JWNWhkU25tUl93M1pzQ2ZpaENmUldVV1dkaXpIby1OZ1BpYTZlS0E?oc=5
2026-02-23	Google	0.0	UAL Orders 300 GEnx Engines From GE Aerospace to Power Boeing 787s - Yahoo Finance		https://news.google.com/rss/articles/CBMifkFVX3lxTFBUWFY5aWlRcnFyRzF1R0xfZGdWRVJZSHRjYjU5bVFYdjVGdFh6Q2t4VnRTMXRrZGw2WnhpeWt1NlpMVnByc3BiVVp6U3J1UWw2R1l2dGNkVm8yNGw5UEIxeDRtT0RObVZyVXZoVjVTMTlRYjExMWgyOEJwSEE5UQ?oc=5
2026-02-23	Google	0.0	UAL Orders 300 GEnx Engines From GE Aerospace to Power Boeing 787s - Zacks Investment Research		https://news.google.com/rss/articles/CBMiqwFBVV95cUxQMmJTcEp3bjlTWGVRUlZhRGcxOFAtR25uWVNfTm1PZWpBWWF3Ql96OEpGMVZ5V2JZODhoM1NsSjRLV3VEMkJ4YlJhTzkwSkpSdzk1YmFfVERXUWhPeUVtMVNxeVZWX3gyaTlaTHpZeU9iSGZHU3V4eVJBS3VqbERpNmw0SmFSbUcwN211RlAyQVlhWHI5RFA5eG1CX2hvbmVvbzhtT0lsbE1GaFE?oc=5
2026-02-23	Google	0.0	US Air Force awards CCA engine contracts to Honeywell, GE-Kratos - FlightGlobal		https://news.google.com/rss/articles/CBMivgFBVV95cUxPTGE0VEtqbE5mTGNLME1CQzZEX3ZxSkQ3VEg0NXhMNjZCLVBuYXlnV0VUbWhmZEVGZlJDcXRRa2hFTWR4MHJ4M21VRFA0VTBUV2F2Qm9acFFtcHVUVGFQMy1wcXhueTk1MUE1WmVtU1NIbXl3b2JvWmVRMTlNb1ZqTWViWWs3ejN0eDJIN01CcWJYcHdEZEQ0enBJVU1sSEdzY2x2NTdJZURwTDNVdHcwVHFBOTBVQTdhbEIxT25R?oc=5
2026-02-23	Google	-0.4	GE Vernova Inc. $GEV Stock Holdings Decreased by Granite Investment Partners LLC - MarketBeat		https://news.google.com/rss/articles/CBMi1gFBVV95cUxQUVROSC02akxFVEszb1VfODFBWG5tU2VqUjk4ZmdmRDNrNUt5V3F4WWZ3RGp3MUQydE1SblR6X1V2cEpsQ2E3ZGp4SDlwUjJaOUlNS0lFODBXYWY0TVlTOTh2dUJhVGZrZmZ4VnJBbVRlUjBocTdvWVZBdXBieFd0QXpCeHZ2UG5UaXJxMXhEN0Mydmp1YUxSb2dNMUIxdkdnSXB3TXNWMEl2VFFZSGRFM2tUYUN3RFRjWHFrNnJhT0JhYlBjdWpUdFNQY0Q3RlFMSXZ2OUR3?oc=5
2026-02-22	Yahoo	0.397	Morgan Stanley Initiates Coverage on GE Aerospace (GE) with Overweight Rating	GE Aerospace (NYSE:GE) is among the 11 best military technology stocks to buy right now. On February 20, Morgan Stanley initiated coverage on the stock with an Overweight rating and announced a price target of $425. According to TipRanks, the firm described the company as the ‘best in class’ stock in the industry and cited […]	https://finance.yahoo.com/news/morgan-stanley-initiates-coverage-ge-112330365.html?.tsrc=rss
2026-02-22	Google	0.025	How General Electric Company (GE) Affects Rotational Strategy Timing - Stock Traders Daily		https://news.google.com/rss/articles/CBMi3wFBVV95cUxPN2c5d0ttY1VqYnl3aDlQUnJPajR0aWxvR1ZzbVM0Q25rU1QxSFMyaXJ0UXVScG5MQXhHdDV5cHE2N19ETFMtMWx0QjJjWGZCcnZqcVFiM0xRdXdXeXBRYkkyVHlHOEV1LVVENXBiTUVaQUhsZ0FOb18yYzVQY21Ya1dvakEzZ0hqU3oxenFEZTAzQ3pPU2FrbWxrTEFpOFZUN3dfTXRnTlRxY2dJakJmSlVadnYtSDRuMjUwWDZHcGd4NGhNZEpyLVlZcTMzTmpZTG4xbml1QXAzY2tkeU4w?oc=5
2026-02-22	Google	0.025	Why Some Airlines Are Switching From Rolls-Royce To General Electric Engines - Simple Flying		https://news.google.com/rss/articles/CBMieEFVX3lxTFB3WnVJUVVZTmR0Y00yX1BDdUZoRlVNTm5PMzBaSzBBU1hSRjBiTklwbnpwbXgxYUZLVUhtdEFOV1BWTFdzaDBBQ21PWlZzMmpNeS0weG9iV29CTEltV0VUZW5kVzJvckd1aUdmVkwtMVlMTlJ2Mm5EWQ?oc=5
2026-02-22	Google	0.0	GE Aerospace $GE Stock Holdings Lifted by Hillsdale Investment Management Inc. - MarketBeat		https://news.google.com/rss/articles/CBMi0wFBVV95cUxOZEI2YUZXMVRzeVJFQVJhcnNGTWFCTGVmZEdxUmI3MG1KbEFqQi1MZUl1Sk41bjVacElKNm1vNFN6cUM4Wkk3Zi1MZ2FtYVlXQTZEaFl4Nl8zYXdnNEo5WmRWMm9nbTdqMVRoWTYtVGlUaXdGekJLOFhfU3I3QTg3MHMzZnBsTzJDSHVBLXIzajBGMElqV3pjcy1nYUdkb1VPTFRuOTZCbGdFdFJqVDRpZlNna1pRNWU4VERmWC1KandTUkRBRFpxX1A4dE5QczhqcVVZ?oc=5
2026-02-22	Google	0.0	Tredje AP fonden Takes $9.04 Million Position in GE Aerospace $GE - MarketBeat		https://news.google.com/rss/articles/CBMiwAFBVV95cUxNcW5JMUVvUTgxai1yaHJIRTZIakwxeDlLb2p2blZFVGlDak1hSXFjUGFkNU1VYjFlclpqdWZHX2U3MWlTd1lVV2U4b3dLd1drcDM1bzRERXZtWTlWSmhhempuTUUyRzNnUVlHampFRklWQU1KUTFVTlpENVRsRUFBT21KZ0NCUUs4QTZCZDl6QzBiU2NiQjZEN193N2JKY3o3ajBBMWxpUjRsN3hfZm02djJNaHFuWHpYYjZQcXZScTc?oc=5
2026-02-21	Google	0.1	GE keeps fixing a fridge, but it won’t stay fixed – what now? - InkFreeNews.com		https://news.google.com/rss/articles/CBMinAFBVV95cUxPZjhfbkxvUDk4clhHNk5IdnRQWlh0blpNaUFIcHRLeFlSV2RIaG1VTzhZWTNGUnJPdlR3ZUlHaDg1c3MwRktKZVFRekVGazFWQVRYQUZ3VnQ5d3pIVVlac29ONUNQMlMyOGUzZG9QaHR0QThNVXdpR25GN0hjT0VmelBqTHh2a3EyTTlsaVdUdkQ0a1d2ZDBBUmxHQWI?oc=5
2026-02-21	Google	0.0	GE Aerospace (NYSE:GE) Lowered to Hold Rating by Wall Street Zen - MarketBeat		https://news.google.com/rss/articles/CBMitgFBVV95cUxOcjI2WkVfQWR4cjRabW1uTkdQQ2tyeUV0a0prbTNkTHVIVjliR2QwVWRvSjlvcXBJeTczN2F0QmdsOWVRYTQ3RWhzWDFjNk8xaFlqeTE5R01GaUExckJqdGVnUVltVFlSaDN6dGtTd2N0dXpfTmx3ZERKZmZReFJCaE01dmduQ3lNQlNRQzZaeGFmVEpKa2pzaE9wM05HVVZYSkctblFNLWc4R1BaY1U1dDg4anBSQQ?oc=5
2026-02-21	Google	0.0	GE Aerospace (NYSE:GE) Stock Price Up 2.3% - Time to Buy? - MarketBeat		https://news.google.com/rss/articles/CBMipgFBVV95cUxPNXpIMzNyU2dWSkttbUdxMVRfNWVUYWhvUGlXelA5MjBtdTJSRE1OY3dkTEg4R1dxd2M2b0dyQWxEX3B0Y0pDOC1lZVh6ZWdCUndybTZTV2EtVFVaMnFsVWpGMUtjTlZVTkJZNFd6VUFvQXA5N3g0eTFLNzMzaXhjalR2QjN2N0NrUFZ3eDZQUTdOTEJBbHBNdXZocy1IUk0zdUVIM2tR?oc=5
2026-02-21	Google	0.0	GE Vernova Inc. $GEV Shares Acquired by Stevens Capital Management LP - MarketBeat		https://news.google.com/rss/articles/CBMixwFBVV95cUxPNkVXYnhJbldabnZwLWVldTgtOUpPaHVOUVcyaTRHZHRNbTBiZUVpT2ZDbnBGR0NnVTZDWGw0RUQwYmpHRXFtR2E3VnlzT2pNbnhMemV0NzJaMkVhRHdSVUIxSEZWN3UtSnBpcFYwbVVKVmRCUUFMUG5YQ3NlM0p0TEF3bzlTNGl3WHlUZ3hDQTVRWW5PY09CTUw3Nnh0LXZHczNCWmVjVkxBQUZ2WXhBVlRQWGM2VHZ4ZHgzT0hMSnY0YnFZR3Jv?oc=5
2026-02-21	Google	0.0	Journey Advisory Group LLC Raises Holdings in GE Aerospace $GE - MarketBeat		https://news.google.com/rss/articles/CBMivwFBVV95cUxQb01oSzdsS1VmR0hBczdJWUJ5RmFJV1V1Y0JxamZQakc4ZjB5Nm55ZWFFbHZaTFFOa1dGMS1oUGU0YWlWc2x6dUFqVkVuYmxkT3R0U3JFSE5Td2E1TmVSNWdyWlRleGNRTFlJTkNrVEJydTZGbEFER19yVG4yQWpGU3p6V245UjFKcEViVWpqYTFzOXNkd2ZtTTZ1OGhYdnVXVXMzQWRnYVMtaS1XVkR0Z2pydENrQmRzTXNqRU1rMA?oc=5
2026-02-21	Google	0.0	PODCAST | Healthcare’s AI Inflection Point: GE HealthCare CAIO on Building Systems That Fade Into the Background - CDO Magazine		https://news.google.com/rss/articles/CBMi3wFBVV95cUxOTFdrdk1RMWNGSENRdnVlZWpab2pvWHk4cEd0a0lUYy1ydlNGY2NXZXllOXVtTVU2SVVCeTM0dUFpUlJLbUJiTk9kaHpWQ3hXMTJxelNJbHFBQUhyN1ZoaXdrVms1bTF0MnRWaDViYjM3dDk5akY2Q0syaDdDYnhCTVBabktFekhxQ3QwYnd4bnE4Y2NvNm1pT0pfWVBuY2RGUjdhbVNMYXlETm5tNkJnTnRmQzJoYVgzX3lQUlpmYXBuTk9xYTYzQU5DSEpxTW5fMVBFdmpLYzRyc2dzczJB?oc=5
2026-02-20	Yahoo	0.45	Morgan Stanley Initiates GE Aerospace Coverage With Top Price Target	GE Aerospace will exceed Wall Street's consensus estimates for earnings and free cash flow through 2028, according to Morgan Stanley.	https://finance.yahoo.com/m/7ba6ba5d-a745-36f7-956a-37004ca1235c/morgan-stanley-initiates-ge.html?.tsrc=rss
2026-02-20	Google	0.3	GE HealthCare Wins FDA Clearances for Next-Gen SIGNA MRI Portfolio - Zacks Investment Research		https://news.google.com/rss/articles/CBMiqwFBVV95cUxNLWdYZGdGTzc3Y3RWdG52aEU4TVhjZXF4eVRvampXME5DWS1FajVmdkhvMlJTcVR6NTJwNmgwejl5UDUwVmlyTndhdHl5UWZxRmpoYWJ0cElkdmJkTF9iVExEemtKdEU4eklBcjFJMHdVZC1pOUE4dHZsRmNFc0tUMUU5bFFDMGpMdjFWSmxnaWhNMFlKcW03UVJmUWJhRHZ4MUsxN2c1a3N0Smc?oc=5
2026-02-20	Google	0.25	Morgan Stanley Initiates GE Aerospace Coverage With Top Price Target - Investor's Business Daily		https://news.google.com/rss/articles/CBMiV0FVX3lxTE9uRi1wN1RWeWNMb0VTdDBjQnhldWpxcHN2T0V0WDVuaEJob0xTaWlaSlNYMmlrMHZHeXRsR0hvanQ4OGVsbDhmdzdGN3c1NnNFd2FkbllNaw?oc=5
2026-02-20	Yahoo	0.226	Why VIS Gives Your Pure Industrial Exposure at 0.10% Fees (Not for Everyone)	Manufacturing value-added reached $2.95 trillion in Q3 2025, accelerating at 3.2% growth after months of cyclical weakness. For investors considering concentrated industrial exposure, Vanguard Industrials Index Fund ETF Shares (NYSEARCA:VIS) offers a straightforward solution: pure-play access to the sector’s recovery without the complexity of options overlays or leverage. The question isn’t whether industrials belong in ... Why VIS Gives Your Pure Industrial Exposure at 0.10% Fees (Not for Every	https://247wallst.com/investing/2026/02/20/why-vis-gives-your-pure-industrial-exposure-at-0-10-fees-not-for-everyone/?.tsrc=rss
2026-02-20	Google	0.2	GE HealthCare Wins FDA Clearances for Next-Gen SIGNA MRI Portfolio - Nasdaq		https://news.google.com/rss/articles/CBMimgFBVV95cUxOWWhMNTVkUFEta3MxbHdNWThiNUlzMGFpanlFdHI1ZG1fblFCbG1aUVZxX0FZeGVsNmY5d3BEWlpxTmRRN2l4ZE1wUno0ZlU3VHNXa3NmYXk0cjVlSjZFRlJfRU5ic3NiRDlFMG82SHJMc2NIXy1UVWtqRWxnTzdyOHRkdVY0NjIzOW9GUFhBU3dLZjltcWV2MW9n?oc=5
2026-02-20	Yahoo	0.188	Starfighters and GE Progress STARLAUNCH Platform	"CAPE CANAVERAL, Fla., February 20, 2026--Starfighters Space, Inc. (""Starfighters"" or the ""Company"") (NYSE American: FJET), the aerospace company, owner and operator of the world’s largest fleet of commercial supersonic aircraft, announced today that, after successful wind tunnel testing of the STARLAUNCH I rocket design, it is moving forward to Critical Design Review (""CDR"") with support from GE Aerospace. The CDR is intended to confirm design maturity and support the program’s transition into i"	https://finance.yahoo.com/news/starfighters-ge-progress-starlaunch-platform-130000912.html?.tsrc=rss
2026-02-20	Yahoo	0.184	Here Are Friday’s Top Wall Street Analyst Research Calls: Amgen, ETSY, Eldorado Gold, GE Aerospace, Merck, Southern Company, Walmart, Yeti, and More	Pre-Market Stock Futures: Futures are trading lower as we wrap up the holiday-shortened week that gave us a little taste of just about everything. While Walmart posted results that beat expectations, its forward guidance and outlook fell short of Wall Street’s expectations, and the stock was down from the opening bell to the close. All ... Here Are Friday’s Top Wall Street Analyst Research Calls: Amgen, ETSY, Eldorado Gold, GE Aerospace, Merck, Southern Company, Walmart, Yeti, and More	https://247wallst.com/investing/2026/02/20/here-are-fridays-top-wall-street-analyst-research-calls-amgen-etsy-eldorado-gold-ge-aerospace-merck-southern-company-walmart-yeti-and-more/?.tsrc=rss
2026-02-20	Yahoo	0.183	GE Just Hit Another Record. No One Noticed.	Thomas Edison would be proud.  There is, of course, no longer a single General Electric.  With GE Aerospace and GE Vernova recently hitting new 52-week highs, the combined value of the three companies is about $620 billion, up from about $540 billion at the end of 2025.	https://finance.yahoo.com/m/0705d594-51d8-322a-b028-29baf24d184c/ge-just-hit-another-record..html?.tsrc=rss
2026-02-20	Yahoo	0.175	GE Aerospace gains after MS starts stock at OW on aftermarket demand	Investing.com -- Morgan Stanley initiated coverage of GE Aerospace with an Overweight rating and a $425 price target, saying the market underestimates the its long term free cash flow and pricing power. Shares of the jet engine maker gained 1.5% in Friday premarket trading.	https://finance.yahoo.com/news/ge-aerospace-gains-ms-upgrades-140736580.html?.tsrc=rss
2026-02-20	Google	0.16	GE hits record high as Morgan Stanley starts at Overweight on durable services growth - Seeking Alpha		https://news.google.com/rss/articles/CBMiwAFBVV95cUxQai13MEl4eHI0ZURxNHlaZjBSY2kxV0ZxczNyY1RuME4zdnExdlZodmJMRlBWbzI4MC11RFRzWld3Q2RjUGJjbmhOVUlHLWt2Mkw2cF9PNDltcEpvcjRyYWZDWHpJRHV1eHRLNk5BME5ENUhJMmVnTDI4cjJFcWNraEFMSXFkbWFaazEydVV0UGdnUG80TUplSTg0emVHVEZ2bEZreVlIeDBJX2NJaktvWGdCQlotRGZtcF9aVFEybjk?oc=5
2026-02-20	Yahoo	0.15	TransDigm's 47.2% Operating Margin Crushes GE's 21.4%. Why Does GE Still Get the Higher Valuation?	Airlines need planes. Boeing and Airbus can't build them fast enough.	https://www.fool.com/investing/2026/02/20/transdigms-472-operating-margin-crushes-ges-214-wh/?.tsrc=rss
2026-02-20	Google	0.136	GE Aerospace $GE is New Millennium Group LLC's 9th Largest Position - MarketBeat		https://news.google.com/rss/articles/CBMixAFBVV95cUxNNnJtNExETENwckpGazVsVkNyVnV3UXZORFZ1SVNtc3I1eFdXeFZ2MHFjM3JRdVIybFhyWWd0TWQ0S0VwQWxPVk1vMzZqeXY1WjdZN1pPYzEtTkllWXo4dVRzaTJFMWVHX3RiTUduOVR5WWdtNHUxSm1nZ0dXeXFORm94SGxMS1JjaHNYYlJBWjliZGh0TkNXX0hoV3dUeHZlYUtnQ2JLZ214RDVNV3VnRDN1aTdUaEFGcDZXUFlvZUVYQjZs?oc=5
2026-02-20	Google	0.091	GE Vernova Inc. $GEV Shares Purchased by New Millennium Group LLC - MarketBeat		https://news.google.com/rss/articles/CBMiwgFBVV95cUxOa3VuanhyMjFYXzZhc09lMnE1R01jMHA2cWp0TmZNdTNULWdqQU02MHhyQUw5RXhVcEtpYkZNOTVtSV9fV1Y0RHN4eDJJNDR6VnJ2QXZBeFVvemtSX2wtaGJJLU1BcTZ5TEFESFZQeWtIRFhqemxEMHp6U0YxWFgxU1lPVXB6US1pek5La00zQmdOazhRYWZyd3BqcC1lVzdHQmwwOE9GNzdneGZUaU1WTzVfNTlzRzFQcVdpalJsQVVKUQ?oc=5
2026-02-20	Google	0.08	This Aerospace Stock Got A Big Wall Street Nod – And It Is On Track To Hit All-Time High - Stocktwits		https://news.google.com/rss/articles/CBMivAFBVV95cUxOM2pzOWZuMnlZRFVGUWxFMU95ZEJ3dERMVWpvZTdXLU1WNW9ESUFsNVpzQTJhaXg3bW1hbHZlWmNsZ0o1ZjhmbkpSYzhWM0RZZVIzNWJDcEVER09KMjd2ek9JdjJQbDRqbWRkQ2RWUF9tbzkwbG9hWjRfcURBWHVRNDZXZ3h2NmMySmVON0FscEdmeW8yS1lTbW05NnhrMUtKa0RuV3JJVzU4NTdVWXFzOXV4cEF2cElIZENiQg?oc=5
2026-02-20	Yahoo	0.068	New Aerospace Stock, Up 75% This Week, Lands Support From GE Aerospace	Starfighters Space partners with GE Aerospace on the next phase of its launch program review. Shares rallied 75% this week.	https://finance.yahoo.com/m/5da841b7-280f-38dd-a623-99ef09c81bcc/new-aerospace-stock%2C-up-75%25.html?.tsrc=rss
