Date	Source	Sentiment	Headline	Summary	URL
2026-02-18	Google	-0.25	'Imperfect Women' On Apple TV: Why This Kerry Washington Thriller Is Already So Buzzy - Scary Mommy		https://news.google.com/rss/articles/CBMilgFBVV95cUxQNjVwc24tTWxUQzI1VHlvcGFUY1NwMHV3WG1nLXNRdjd2S2N3MEhGR0dvb0FKamR6V3lJNnpaVWxOTUdCT1lfN3FhdVpYeV9iQjhDdFZBdk10VWFpc1VORTRTSU9wdGIwRUI5VWRtdmFJOV8wRC1CQXNnYlhDaEIxSUxSVDBDRC1CRFJZdDh5a0YtVWlZSUE?oc=5
2026-02-17	Yahoo	0.25	Trump’s America First Agenda Is Pushing Industrial ETFs like XLI To The Moon	The industrial sector doesn’t make headlines like tech stocks do, but it’s the machinery behind infrastructure spending, defense budgets, and manufacturing cycles. When GDP growth accelerates or governments commit to multi-year infrastructure plans, industrial companies see order books expand. That’s the core thesis behind The Industrial Select Sector SPDR Fund (NYSEARCA:XLI), which offers pure exposure ... Trump’s America First Agenda Is Pushing Industrial ETFs like XLI To The Moon	https://247wallst.com/investing/2026/02/17/trumps-america-first-agenda-is-pushing-industrial-etfs-like-xli-to-the-moon/?.tsrc=rss
2026-02-17	Google	0.222	GE Aerospace's Quick Six with Packey Velleca - GE Aerospace		https://news.google.com/rss/articles/CBMihwFBVV95cUxPZjJtUDRHWDlTWmNldm56MDVKNnZJb1RiM1dyWW9PTThFZERqRHJtZzJfQXgzeUxqbERRdU9Jc2JPZkk2aDdvQXFDdUtZNndQLTcwckZic1FocVB1RGZpQ2hmMFVCeDUzdWpOUk50Wklqb2g3ZkFWa0pXcmhFRGo3SFFINy0tNFE?oc=5
2026-02-17	Google	0.0	GE Vernova Declares Second Quarter 2026 Dividend - Business Wire		https://news.google.com/rss/articles/CBMiqAFBVV95cUxPcW9YbXFOektQY3k4VVMtZ1pkcFNDcjVCUDJVTWdBaFpRUTZJVnc1Wjh1UTlkdkw4eEF3X0c2SF91UEVOaXJvSGtja3VieDV2Um9hcjQ1Y1NNU0Q2eFppdnlmYVVCNnlOZW1xQThLM3ZocUhYQ1pMX08zazJmQUZueFdaZUZCd3VQV1lwek9jNnk0dnlwT1JEZkxxVWdvcjNTTlRZOVZBYjY?oc=5
2026-02-17	Google	0.0	GE Vernova Declares Second Quarter 2026 Dividend - Yahoo Finance		https://news.google.com/rss/articles/CBMihwFBVV95cUxOcE9NODNaendLUzFxUHRqVGZVSmNhTDJDeWtXZTgxT3h1cjh2QlFlS3JfYU10WW8yN3lqZy1wZm1nNjB4cjExQkNuRDZlM1JKLUk4SXpCVmZQOXY0SnFSNmhaM0h1QmdpODNOX1hhckJYdHZsaGJuTUlCSm5oUF9OXzFTdENYc3M?oc=5
2026-02-17	Yahoo	0.0	How Jet Engines Are Powering Data Centers	Companies are converting aircraft engines to land-based natural gas turbines for power generation in the AI boom.	https://finance.yahoo.com/m/0bb3dc2b-f0b9-3b06-8822-66a27f508afb/how-jet-engines-are-powering.html?.tsrc=rss
2026-02-17	Yahoo	0.0	Praana Group Advances Strategic Expansion with Appointment of Darpan Parikh	Praana Group, a diversified conglomerate with businesses spanning specialty chemicals and fiberglass, and Galata Chemicals, a global leader in specialty additives and performance chemicals, have announced the appointment of Darpan Parikh as the Member of their Board and Chief Executive Officer of Galata Chemicals. This appointment marks an important milestone in the Group's continued evolution as a globally integrated specialty chemicals and advanced materials platform.	https://finance.yahoo.com/news/praana-group-advances-strategic-expansion-123200522.html?.tsrc=rss
2026-02-17	Yahoo	0.0	Stock Market Today, Feb. 17: Amazon Stops Slide Spurred By AI Spending Fears	Today, Feb. 17, 2026, AI spending angst rattled growth stocks even as value names quietly propped up a volatile Wall Street session.	https://www.fool.com/coverage/stock-market-today/2026/02/17/stock-market-today-feb-17-amazon-stops-slide-spurred-on-by-ai-spending-fears/?.tsrc=rss
2026-02-17	Google	0.0	Stocks Rebound Off Lows; GE Aerospace, Nextpower, Five Below Flash Buy Signals - Investor's Business Daily		https://news.google.com/rss/articles/CBMiY0FVX3lxTE04SHVkNFRSc25SY2JNbVZUcjluZmY2SGpsd1FGNnBhX1NRNDZiOGVtZlM4V0FHLWwxZ1JKWjRXSE91QUd4OTdiNmc0c0czLXpLRWJZaHJSTEVxendOQUUyYzVzZw?oc=5
2026-02-17	Google	0.0	United Airlines picks GE Aerospace engines for historic Boeing Dreamliner order - The Business Journals		https://news.google.com/rss/articles/CBMirwFBVV95cUxOU1BWS0JweU0wU0lRemxJY0x2SFM1eEVzYUR1QnBZcTdLUUVxaGxFbzd5cVNjN081UmEtdEhNVmdwc2ZqSHUwMzVtWFMwcEJFNlNFVFc4MnVOYU9NOUZ0WnI4Yl91ckJGRmhxQWxvWUV5cldnNTNGRkh4OGVUcWFDWV9ZV1REa3ZlRHgxczNacXhzamlQbTBFZWdxUV9sd0JuSl9HZ0oyUGlFYVhTazlR?oc=5
2026-02-17	Google	0.0	Washer Timer Control Knob Replacement WH01X10460 WE01X20378 GE Washer & Dryer Parts Knob Compatible With GE Dryer WE01X20378 AP5806667 175D3296P001 WH01X10460(2PCS GE Vented Dryer Clothes Dryers Precision Auto Labs Dryer Kn - hotelier.com.py		https://news.google.com/rss/articles/CBMiowFBVV95cUxNcjhKS3NfSkROMG5aM0h3VW5DQkhiWXBCd1N2VWRJVk9YM0JDMEJWaEpNYTBKTDd6OEVkQ24ycGZmUmNHa3pnWUV3aDAtRG90SUE2ZW91ZnVUSGRPZm95aG1fQVBPczZHbWliWEFzS0FPS2ZUYzBjTG5GSWRzam5lT2FFNnRiVjFiQ194RDdYNGZ6ZTJfMWgyYjZ6ZEh1T0FzaTU0?oc=5
2026-02-17	Google	-0.117	Why Amazon Stock and the Rest of Big Tech Could Be the Next GE. That’s Not a Good Thing. - Barron's		https://news.google.com/rss/articles/CBMihANBVV95cUxQcXNIX0lBZ3VoVXhPTTE2R0lEVFNoSFNqXzc0YWtiQW5PUEEwMk1Ha3Jtd3oyWFFtQURIR3NGYm9JRXl3OFJZY3JzbzFjRzVlblNUMUR5LVQxRjYzZHZCRjdySllkb19ucHVrT1lkVnMzSzBTM0lONk1aR19BbWFaU0dxcHg2NC1yRERhLVdvN3hMODFCbXNpTzEzYjlGQTlqYW1Rbk5DSk5oT1o3Y2N5M0tJSnpPbENiRzJpcHNsSXZlQS1mQkViVUdZZWpZQVhjX0NkVTZHc0FYNVZJeHh0TWdFQXNIOW85dUlvWUxVUFBnQlozeWd6SGotNHN2N0hzYzVNLWdQZVZFZU5MYXAtMHU5djRscm1wTlpyYjE2V29mQ2g3WVZiLXdaSENsclNubEQ3TXhRdGR5Yk14RjF1alQ4M2piNGFoZy1oQUZrTHIwOGFjUkN1UWR0Z1BHWnlWcHF0MVV3SVFyaDRCZmREODBHQzFKZExMZXFPLUlPNThNTUlN?oc=5
2026-02-17	Yahoo	-0.138	GE Aerospace Wins Big United Deal And Expands Long Term Engine Base	GE Aerospace, part of General Electric (NYSE:GE), has agreed to supply 300 GEnx engines to United Airlines for its Boeing 787 Dreamliner fleet. The deal secures United’s position as the largest GEnx operator worldwide and deepens GE’s role in widebody aircraft propulsion. The agreement also supports a long runway of recurring service and maintenance work tied to these engines over time. For investors, this update is central to GE’s aviation-focused profile, with GE Aerospace as the core...	https://finance.yahoo.com/news/ge-aerospace-wins-big-united-231308249.html?.tsrc=rss
2026-02-17	Google	-0.138	GE Aerospace Wins Big United Deal And Expands Long Term Engine Base - Yahoo Finance		https://news.google.com/rss/articles/CBMif0FVX3lxTE9Vc2Z6VDV1b0I1MTIwb1lqVmpCX2ZYOUNtTXF2WGpNWkhsZmREQ2F6UG54NkNOSmY1dHZmbUlmQzNCZk5XOGxkdWdLa2lkeGlsYk9VdzR1bDg3RHJxaTUyR09Wc1FhZWhQd3A1VGVEV3hPWW1ITUFrajkyaHdreXc?oc=5
2026-02-16	Yahoo	0.5	From Aerospace to AI: 3 Names Supercharging Dividends	After posting massive gains in 2025, a jet engine behemoth just boosted its dividend by over 30%. Meanwhile, two key AI stocks also announced strong increases.	https://www.dividendstocks.com/articles/from-aerospace-to-ai-3-names-supercharging-dividends/?utm_source=yahoofinance&utm_medium=yahoofinance&.tsrc=rss
2026-02-16	Google	0.318	United picks 300 new jet engines, becomes top GEnx 787 operator - Stock Titan		https://news.google.com/rss/articles/CBMivAFBVV95cUxNLU9lNHpyOG5RdWVpN284aW95RzM3Y3ZyVlRSYS1tSkw1eE41Tk85YkxsZkJnZHZta05yS0FBSnNQZHl0Y0lWT2NFWW83TWdfM211LVplMmJhS1NyX185MGx6TDN6VG1CVFB0UFl5ejB1ejE4VzhVZVBhZ0tFaFRZMng2anBKcDJ1WXJadEh0RE5aMVQ4OU5PcnNqTVBMZjBHcmNlSkw3ODJEM2JnUThkSGdoSVEydGZUZVB5YQ?oc=5
2026-02-16	Google	0.136	Duke eyes new nuclear plant in NC; Wilmington company could play a role - Wilmington Star-News		https://news.google.com/rss/articles/CBMi4gFBVV95cUxOLUtsZU13MFV3aURyYXNDNEU5eXpMQVlHeFkyakVTNWFxX2RsT3lFSU1zUFE5YnJubl8tS2VfcGhxcWVJMi1aTlRmdnNHWG1wSEFlTnNFd05fSjVvcWZ4V0F2VnNqRXk4TmhYazE4MXlUU3RMdFFtSXFQWUU2Nmp0VVB3d19JenZ4LUJpRndHU3BNN2VxdExWU3hsTVpyRzZwVlpPYlVHeC1FTU02SWtMSFd4NlJ1a1JFLVFiZjdRT2ltdUJfV01UOTdDdEZqcm91N21ncV9qSDZYa1FDUW5JTXN3?oc=5
2026-02-16	Yahoo	0.136	United Airlines Selects GE Aerospace GEnx Engines to Power New 787 Dreamliners	GE Aerospace (NYSE:GE) announced today that United Airlines (Nasdaq: UAL) has selected 300 GEnx engines to power their new Boeing 787 Dreamliners. The agreement also includes additional spare engines and brings United Airlines' 787 fleet to more than 200 GEnx powered aircraft.	https://finance.yahoo.com/news/united-airlines-selects-ge-aerospace-145000574.html?.tsrc=rss
2026-02-16	Google	0.114	GE Vernova (NYSE:GEV) Is Doing The Right Things To Multiply Its Share Price - Yahoo Finance		https://news.google.com/rss/articles/CBMie0FVX3lxTE92Qm9qUUlhUFN0T0Z2WlAyaE5TRl9sUHNFMlIzNVJJX1Q4Tl9PVnRZTGEzXzFCNnM3Wk5RR1RHd1lTbi1scDljeEVuX1FKelZlSUdIVlNCQ01XekdIZFdGUEw3T19SSm80emlWUXlMaFRsdndPb2Z4eWV5cw?oc=5
2026-02-16	Yahoo	0.0	Brink’s Announces Adrian Button as EVP and President, Brink’s North America (NA)	RICHMOND, Va., Feb. 16, 2026 (GLOBE NEWSWIRE) -- The Brink’s Company (NYSE:BCO), a leading global provider of cash and valuables management, digital retail solutions (DRS), and ATM managed services (AMS), today announced that Adrian Button has been appointed executive vice president and president, Brink’s North America, effective immediately. Adrian will join the executive leadership team and report directly to Mark Eubanks, president and chief executive officer. Adrian brings more than 30 years	https://finance.yahoo.com/news/brink-announces-adrian-button-evp-130000783.html?.tsrc=rss
2026-02-16	Google	0.0	GE Aerospace Explores Automation in Engine Repair Work - AVweb		https://news.google.com/rss/articles/CBMiekFVX3lxTFB4cUhOYkJTYkN1bVNvTzEtLTJoaFlHSHFSdzRuSnhoVjh2ZzRFNGtDeGZBVEFnaF9jLTg1bU1ESHhOYU5UVnAwcndxMEVjWHF4NXpPdDhISU50WlhFb25QX0hTcS05N3U1SS1UXy1oalJqbFJwamxUdVVR?oc=5
2026-02-16	Google	0.0	GE Electric Stock Surged 50% Last Year. Here’s What Could Drive Further Gains in 2026 - TIKR.com		https://news.google.com/rss/articles/CBMirAFBVV95cUxOdFJvd3JPY1NESUpCUUlTU3o3QXNVeVJBT3haanlkSnBRZEs3NHdqekEyNzIwamtfM19zanpZam1fLVVLZWl4NmsxU3VvSTVQMWV6Z0dYZ1lDLWNDSGYtNXc2V1RDWVpNQkUzOEt3Q2hpUXVFTzdBY3B5VElQSDllUDYtVTdKM1ZXQklIak5kbU05RU1NX1JvaF9CUDhKNXJ3dE5IYXVZbVRaWWdx?oc=5
2026-02-16	Google	0.0	LACoFD Air Operations welcomes visit from GE President - Fire & Safety Journal Americas		https://news.google.com/rss/articles/CBMinAFBVV95cUxNWHo4Z3NiZWIwbEFSeEc0SGN2TE5vY0N0blZHNmtOUy1kNWNXVzFOc1lsM3ZELXd1dXphVXJZU2tKTWFxYlBwQmtQYXU1dFU4M0t2M3BTT0tVemNRVV9UVlVDR09adFNlaTV3QkwxTkJwcWlkbWliY1J5R2ZmcGdzbHpPNmNLd1QtNVVzc1NpUTVlLW5uTWQzWWcxY08?oc=5
2026-02-16	Google	0.0	Looking Into GE Aerospace's Recent Short Interest - Benzinga		https://news.google.com/rss/articles/CBMisAFBVV95cUxNcGJJSy1fd2x3UEQ2LUVRQlNRZV9sWmpsU0tfSmpHTFd6aWRkYUlIeTVUSDhiaVVIVGxLYUEydzlyalZBS0YtSVhqLWowTWZtU183STFyZzFHTkZWT0FqVHEzVC1MOS1TdTNOUF9oSXBXYW9oZlVGRE9RS1BoTm1qNTlqckJOWmtMdTdNSlA2bDdJSWZYY1BHdlNyVVdXNEhaYlJ0RG9fdDJJNGkxQjdaWg?oc=5
2026-02-16	Yahoo	0.0	Strength in Defense & Propulsion Unit Drives GE Aerospace: Can It Sustain?	GE's Defense & Propulsion unit gains steam on major engine contracts and double-digit order growth-can momentum carry into 2026?	https://finance.yahoo.com/news/strength-defense-propulsion-unit-drives-145300890.html?.tsrc=rss
2026-02-16	Google	0.0	Walmart is offering $180 off its GE Profile Opal 2.0 Nugget Ice Maker - AL.com		https://news.google.com/rss/articles/CBMirAFBVV95cUxOMnBTQ3pNMlNoWXprUk5xZ2ctU3hmMGJ2bWZRamJzRGZNRGVHYmx1c0k5SGZrUzdRUGRpdnpncnAzLV9MYWs3UFQtenl0Q3dVWjBrSmVSR0I1OVpfdVNvQXlKRkV1MG9hTF8yR3lYWkJCc09oTmlUdXQ1TmhvbUdwd2pJYjEza0Z4VGc0a2J0TktpT3FzMGRFN2ZJN1d1QndMUkJuSGhubXF5X2Ra0gHAAUFVX3lxTE1HQVhGeFZrdUY5UHNDUW92a1o3RkFvNWE4OEJKT0dVTEhOT2JXenBIV20yX1dQV29Lbjg0dEw0djZpaWVpTEFqRXJQRFpWVlVKWV9sdkcwb0x3Q1B1cXI2YlUzSGJLNkN2WW5zY2lMa1BVak13ZDkzTDBzTi1hVzFrRkxqZjBlMVdCMXZzWmdGaFltTFFTQUNwMmUxR3NDS0twbmlLbjgzbWtBczhRdktycXNUc25rTkxfQzRNSmNwWQ?oc=5
2026-02-16	Google	0.0	Why United Picked GE Aerospace To Power Its Growing 787 Fleet - Simple Flying		https://news.google.com/rss/articles/CBMiiwFBVV95cUxNZk45NHlPOFRiNVp1cGxMMjRlb1dNaG9BZXhiRjNJOWMtYmxxNkpyYXdTSXY4RWppZFdjUzhKbGRoYm94bU81eFNsVmdESFkzOHRvLW5ickVHa0xEM09xalZWOFNBMVVXNVNZdVpUSFpqbHgxeFhqMHpPY1RLcUgtcU1US1llM2wxVGRv?oc=5
2026-02-16	Google	0.0	“Big Bet on Efficiency” United Airlines (UAL) Expands GE Aerospace Partnership with 300 GEnx Engines - TipRanks		https://news.google.com/rss/articles/CBMixAFBVV95cUxOVGJGaDRrNUpOTEs2ODM0OENFVUNZUFg5Mmg5WUw1RVpOR3lpMjdrYkY0bTBMdUhqZjlQc0lnX2lxSGZTSmh3UWpzOWp6NVhnaEJ5UjZIa1h6Zl85UUZKS3RUT1BsSGJUa2hnYzR1bFlWQWhFMVJqVVJTbXE3WTZDT1dfLVBZeWpIdkdQb1VIRl9KZEZ2T0JCSmlTQjlIZkJ0OGQ1SUpEdmhqejZJLS1WQnIyWE9yclk2RTIybTBnWjBxMnow?oc=5
2026-02-16	Google	-0.167	Proton GE 10-32 Fixes Akiba's Trip After Previous Update - Steam Deck HQ		https://news.google.com/rss/articles/CBMickFVX3lxTE9qNEFVWEpIdGRYMXBXTU5obFJSLUN2anIxZTR2aWNLa2ZGVElWcGdfQXNyTVVVQmRNV1RSTWlCeXBZMjh4dDRjVk5PdVJwVWR6SS1oNWdTNldiUzNpYlFieldPSDduMm5hMzRXV3o0QkgtUQ?oc=5
2026-02-15	Google	0.0	GE Vernova (GEV) is Still Buyable, Says Jim Cramer - Yahoo Finance		https://news.google.com/rss/articles/CBMif0FVX3lxTE5zSVhDUkhDZ1Y5ZE9qQTBXTzBZVjMzQmtYblNNUmlaR011T3lVaEt6dU1WZXpQMndwTDh0UExBU0s3aXl2ZmdReFJ0OWxkeWRrdC1KTGZybHJxTlJ4ZEJnRC0yMnQ4aVBMbFRxZlBfbnFDcnVwNWJqVnJVNHJEYUk?oc=5
2026-02-14	Yahoo	0.375	GE Aerospace’s Singapore Bet Tests Growth Versus Rich Valuation	GE Aerospace (NYSE:GE) is committing a multi year US$300 million investment to upgrade its Singapore repair hub. The project focuses on advanced automation, AI, and digital technologies to support jet engine repair operations. The upgraded facility is aimed at increasing capacity and reducing turnaround times for airline customers. For you as an investor, this move sits at the intersection of GE Aerospace's core jet engine business and the aviation sector's growing maintenance needs. The...	https://finance.yahoo.com/news/ge-aerospace-singapore-bet-tests-200729654.html?.tsrc=rss
2026-02-13	Yahoo	0.3	Is It Worth Investing in GE (GE) Based on Wall Street's Bullish Views?	Based on the average brokerage recommendation (ABR), GE (GE) should be added to one's portfolio. Wall Street analysts' overly optimistic recommendations cast doubt on the effectiveness of this highly sought-after metric. So, is the stock worth buying?	https://finance.yahoo.com/news/worth-investing-ge-ge-based-143004310.html?.tsrc=rss
2026-02-13	Yahoo	0.0	3 Growth Stocks to Add to Your Roster	Growth is oxygen. But when it evaporates, the consequences can be severe - ask anyone who bought Cisco in the Dot-Com Bubble or newer investors who lived through the 2020 to 2022 COVID cycle.	https://finance.yahoo.com/news/3-growth-stocks-add-roster-043232697.html?.tsrc=rss
2026-02-13	Yahoo	0.0	GE Aerospace Partner Safran Rises On Rosy Guidance For 2026 And Beyond	GE Aerospace's partner Safran raised its guidance for 2026 and beyond, forecasting growth of 10% for the next two years.	https://finance.yahoo.com/m/3c5615f9-c016-36a0-ab9b-2b113ebd6f66/ge-aerospace-partner-safran.html?.tsrc=rss
2026-02-13	Yahoo	0.0	GE Aerospace turns to robots and 'Lean' methods to tackle jet engine repair crunch	GE Aerospace technician Suresh Sinnaiyan has spent more than a decade repairing jet‑engine compressor blades by guiding them across a sanding belt with practised precision.  Now, at the aerospace giant's new automation lab in Singapore, he is teaching a robot to do the same job.  The switch is part of GE's ‌push to prepare the next wave of industrial development and ease one of aviation's biggest bottlenecks: overloaded repair shops and scarce parts.	https://finance.yahoo.com/news/ge-aerospace-turns-robots-lean-040127542.html?.tsrc=rss
2026-02-12	Yahoo	0.0	Howmet's Q4 Earnings & Revenues Surpass Estimates, Increase Y/Y	HWM delivers a strong Q4 beat as aerospace demand lifts revenues, margins and cash flow, with upbeat 2026 guidance ahead.	https://finance.yahoo.com/news/howmets-q4-earnings-revenues-surpass-175300628.html?.tsrc=rss
2026-02-12	Yahoo	0.0	The Zacks Analyst Blog Highlights Parker-Hannifin, Goldman Sachs, GE Aerospace, C.H. Robinson Worldwide and Carpenter Technology	"Parker-Hannifin and Goldman Sachs lead five ""old economy"" stocks delivering earnings beats as the rally broadens beyond AI darlings."	https://finance.yahoo.com/news/zacks-analyst-blog-highlights-parker-145600771.html?.tsrc=rss
2026-02-11	Yahoo	0.3	GE Aerospace Rallies 51.5% in a Year: Is the Stock Still Worth Buying?	GE stock soars 51.5% in a year on strong engine demand and defense wins, but rich valuation raises the buy-now question.	https://finance.yahoo.com/news/ge-aerospace-rallies-51-5-150500522.html?.tsrc=rss
2026-02-11	Yahoo	0.1	Stock Of The Day Shakes Off Earnings Slide, Trades Near Buy Point	Despite the earnings flop, multiple analysts raised their price targets on GE Aerospace, and the stock started to rebound.	https://finance.yahoo.com/m/6122f41c-7dbc-3421-ad34-3719ca6d1a47/stock-of-the-day-shakes-off.html?.tsrc=rss
2026-02-11	Yahoo	0.033	Buy 5 Old Economy Stocks Post Solid Earnings in Last Reported Quarter	PH, GS, GE, CHRW and CRS are five old-economy stocks that posted strong quarterly earnings, signaling potential upside in 2026.	https://finance.yahoo.com/news/buy-5-old-economy-stocks-131600571.html?.tsrc=rss
2026-02-11	Yahoo	0.0	From Farm Equipment to Power Grids: These 6 Stocks Are Riding India’s Boom	India’s infrastructure boom is creating opportunities for U.S. industrial companies with the scale and capabilities to serve the world’s most populous nation. With ambitious renewable energy targets and massive agricultural modernization, India represents a multi-decade growth catalyst for select American manufacturers. These five companies stand out for their established presence, technological leadership, and direct exposure ... From Farm Equipment to Power Grids: These 6 Stocks Are Riding Ind	https://247wallst.com/investing/2026/02/11/from-farm-equipment-to-power-grids-these-6-stocks-are-riding-indias-boom/?.tsrc=rss
2026-02-11	Yahoo	0.0	GE Aerospace Bets On Singapore AI Repair Hub And Services Growth	GE Aerospace, part of General Electric (NYSE:GE), is committing a major multi year investment to expand its engine repair capabilities in Singapore. The plan includes advanced automation, AI enabled inspection technologies, and a formal partnership with Singapore's Economic Development Board. The expansion targets growing demand for aircraft engine maintenance and services across the Asia Pacific aviation market. For GE Aerospace, services are a core piece of the business model, and this...	https://finance.yahoo.com/news/ge-aerospace-bets-singapore-ai-190923608.html?.tsrc=rss
2026-02-10	Yahoo	0.0	Zacks.com featured highlights include Amphenol, GE Aerospace, ResMed and Ameriprise Financial	Amphenol stands out among new GARP picks as acquisitions, AI-driven demand and margin expansion set the stage for solid 2026 growth.	https://finance.yahoo.com/news/zacks-com-featured-highlights-amphenol-090300108.html?.tsrc=rss
2026-02-09	Google	-0.02	GE Aerospace signs Industrial Participation agreement and manufacturing MoU with Saudi Arabia’s General Authority for Military Industries (GAMI) - GE Aerospace		https://news.google.com/rss/articles/CBMi1wFBVV95cUxQNVZ6M29UNkhacWN6RGVfZms5Z1FpWmdSUFZGVUwyRS0weXB6eUtxZXZmZm5KbUkta1FYTThIZ3RMYzVhcEdMQnRnZ2hlVm1QUW1GME1IV2I4NlJSSEJtRzZvcG5rWWhrOEhseHdrbkJzMDAzR01BbDI5ZU1rWFFKTmFQYnFTYkM5Y3BkMERQWDNQZk1kb1VYTHY1V1VpUWZzOUhzWjkwZU9uLVVoczVUZWsxZ0Z4RElQTGU3aDBwbWxkOHNRdTlleUVjWXZBdlAwWHpRelUyUQ?oc=5
2026-02-04	Google	0.0	Massachusetts woman gets refund for defective GE oven after I-Team reports - CBS News		https://news.google.com/rss/articles/CBMihAFBVV95cUxNb3NVTkNlM0tpbTZTLTdtSDdjNTF4RTNMZ2NIejFWMFF5bTRWbTFXMWU0R3h4RFR6ZHdlOEgxQWpycDZvX0tCNkJyMU8wVHlHdFVRSm81VkpCZHVSSFU2SHMzQXB5QXJsc3Z1SXRIdFY2Nm1PSDJra0RTUE5tYWJiYzVFTnk?oc=5
2026-02-03	Google	0.0	Understanding PCB Risks at the GE-Pittsfield/Housatonic River Site - U.S. Environmental Protection Agency (.gov)		https://news.google.com/rss/articles/CBMilwFBVV95cUxQcXJJRTJMSGtXQ3Awc2dCZFhmQURLRHc3dWdHY0J5Y2ZKaEZIc3dJWWQ0U01HRXktbnJPN3hMc05TRzBmY1hJMXo3NmNPSkdTTGNMeUs4a0N0d2tlU204UndhSjZhYjd0Zk1oN3JnRGJMS1JmdmlSeXZjMlpZOUJ5alJVclJsbmpUVG01QUFlYXVCc2EzRW04?oc=5
2026-01-29	Google	0.0	GE Aerospace Releases 2025 Annual Report and 10-K - GE Aerospace		https://news.google.com/rss/articles/CBMisgFBVV95cUxQUmtCLWFXN0N1eFoyUkY4VlFxdTdkMGQ5bkFXalFjSHFRaFoyclQ1ZHl2VS1VUmhFSXF4WkhzWkdONEEycXBNTEUtZ1lmaU01TWdrUmREekRBUVJRYmxSZGJaSW0zckdnX28tRUdETXJXVnlwTEdCU1B0aHlLT0Y4SmI2WjR5Z3VMMHIwRUQ2VHp1b0NEemdMVFE3eEVOb0xQanhVcDlGd2hQSWlYN2ZWOE1B?oc=5
2026-01-28	Google	0.433	GE Vernova's wind setbacks overshadow strong showing from power, electrification units - Reuters		https://news.google.com/rss/articles/CBMimAFBVV95cUxQVXVxZm41Y2ozd2hIaDF3bjNiekJaaXUxUlktc0p4YWFJN2Ntb01yS20xYzU5ZFZPOHBteFNFbEs3ODRoUlk1ajloUExGZHo3NmZ1RFBVcWVULUdqYUR3UWxDZWVRMGxIRVQ1NTlrYV9DM2l4WS0yVFpaVTIwSG1fVFpueHoyRy1YTlhXaUJIcU1KSkZmbko2Nw?oc=5
2026-01-28	Google	0.083	To Combat Fake Water Filters, GE Appliances Opens Own U.S. Factory - The New York Times - The New York Times		https://news.google.com/rss/articles/CBMihAFBVV95cUxOQmJqcEc0dFhFc2UtZHUwSWVrRkVUTVYzMHhmYmNVeGVMMHU3RFR4cUpRYmI3ZTI4THAxc3FPQ2RrNVdHbWVoNm5NbEd4cW1iSXgzUFZaRTgwUC13WVlySEl3Yk9sQTRaQXVHdWpmd1k5YjVFLXdUT0IwOURaTVFIc3RhQ2o?oc=5
2026-01-28	Google	0.068	New jobs coming to GE Appliance Park in Louisville as it adds high-tech water filter line - WDRB		https://news.google.com/rss/articles/CBMi9AFBVV95cUxQSU9Jc2NfYWFqVWFMb1NWZk5YX05WV2V6d0lZZDNqV2ZMNFBibFl1bzRnWXJYUWUzY3MzZWo1MDdQUnJPOE9UaTRtZXhqWGdsRWtkQlJkX2JLVzBCS1FTd01VcnczeDFFVzlXSldKUGpBU2tLWndWV0Q2UHBEb0RVRlY0bnMzYXZvZEhsV0ZDLXRKQ2FEVlF3V0JCNmV5ZlJhRDRVNlcwaEJXYm5VTl9ITkJmcWJHRm81ekFoUGlLVjY5TTRjdHd0bUhGMXhYZDg4SUdOdWZWT2xMTU9Eci0wRU4wa1Nsbm5LZW04S2FFN2RqTHV3?oc=5
2026-01-26	Google	0.75	NASA, GE Aerospace Hybrid Engine System Marks Successful Test - NASA (.gov)		https://news.google.com/rss/articles/CBMiZEFVX3lxTFBLMWNIcEtXbFRsSmpjeVpndFU0bGFsUExiMzREM1hSQUI2LVY4YUZ2NEdMbElrYWlPeV9FRllrb1NUT1JyelZEZ1dTQmJkUXU5RWo0RFljRXF3ZTVtSlhmXzhhZ2c?oc=5
2026-01-26	Google	0.5	GE Aerospace Successfully Demonstrates Narrowbody Hybrid Electric Engine System in Ground Test - GE Aerospace		https://news.google.com/rss/articles/CBMixgFBVV95cUxNQlAwdDNUeFdsRHhTYmhiZkN2ZG43MWN3SzhxT3J4YXUyRDNlYXEtcXlLVXVaZTlNS1FVSzdMeG56ZjdhemNQYjZJaTJWaXFjY3JGdGprZlMyQnd3SDAyWmJlaEpkXzhnX1NIZWlRSV9RTjNpbVZ4SF94emdOamlJREFlZ2VMWUZsSGUwcXQtNFIyaWlzUWZUYk9uRlNXSXJKQzlqVW5BcjFpZlc1cTk5V0xYWHU2NkRaTkdfNFptdGlZcE1EQ2c?oc=5
2026-01-22	Google	0.0	GE Aerospace Releases Its 4Q’25, FY25 Results and 2026 Guidance - GE Aerospace		https://news.google.com/rss/articles/CBMiwgFBVV95cUxQQ2ZyRUFpOGRhT1JlaEVEa2R0blRaZDBPTVZrSkxSVlZIT1FpV3BiaVZDWnJQYkhXNGl2YlBtQnd1S1FULS11NlAwTnBtX2FvR0R4UmhPNEJvZTNLaDRpSmV5Mml6Y1dFTjJhQ0ItZTV3LU1qR1dPc2VQeHo4bnJHOXFVRW43bUZNQ000SW1iZ2lfbWYxcEw4eXBia3FiaHkxUDZCYVZUbVhKUEsxUmxoNHE0dTBXVFVOZzFjSFlHNmZlQQ?oc=5
2026-01-14	Google	0.136	New rotating-detonation engine boosts hypersonic missile efficiency - New Atlas		https://news.google.com/rss/articles/CBMieEFVX3lxTE9TYVB5cTF0Ulltb0k5a2xhRWozQkJfajJxSGVWdEJMMVhIOHhNUmE3NkUxbGJfblNPOTJZcG0wMXNkMGNGWFZpTGJ2aERPY3V4WU1zOVBSZFVlQUxaWUZfYWhzeUFPN1hQam9FMzVvRktMUDZKcDVpZQ?oc=5
2025-12-30	Google	0.0	Anesthesia System Correction: GE HealthCare Updates Use Instructions for CareStation Anesthesia Systems - fda.gov		https://news.google.com/rss/articles/CBMihAJBVV95cUxOT0xMdGoxak5jM1B6VmZOZnVsb1BuVjZWVTJFYWRYSzVVWERNd0JwMTB0bDhGbmw1Umg2R3NaRzlOQmxFSnpvS1AyU0ZHWXBvT1dhY083LUI0aVJZcVhaZWhLajVWdmRlQ3JrV2VKeWlGd0VtU3FybmtvbzV6VXhYeXVGRkNRTXVNUWp6TUF3emFMNjFTc1lWUDNxbEhXVVpxbjQtN3ZTRnhndi0yb1phdndyQkdpUmRaVS1SYW5kZ0ZrMXN5dE1zRE9EZlNLRDFTVjJldXk3dU5aTkVLUVlRQzhDWllVSHJKbkNlNE1PZkR2djVjU3BUeWpmb0lmU1VIOXFKZA?oc=5
2025-12-12	Google	0.1	Adoption of Genetically Engineered Crops in the United States - Recent Trends in GE Adoption - Economic Research Service (.gov)		https://news.google.com/rss/articles/CBMixwFBVV95cUxQRmRDMVNCZ0xncVc4WjhMX2oybUgyU3pCRmdWU3RuODNIZUd4Y0xpMWxtWGFDMkRkb2lkUU9JVTZmU1dBSk1lYVpKbkxaLUduWFVwYXoyWER6YVZQbV9nclJtLV9UOXFLZWJWWUFXSFZmWEk0a2tSc2toVXJ4bjRFQVhmWkVNNEJ3QlVhRkhQZ1B2YUY3RmpsZ2tLWHVybXNWTnkzZGJoVUpmalRqdVlhclh5ckgxMEdRcU1rbXYtNzFBWXVyU1lZ?oc=5
2025-12-11	Google	0.0	On-Time Gift Delivery: See GE Aerospace’s AI-Designed, Multi-Modal Jet Engine to Power Santa’s Sleigh - GE Aerospace		https://news.google.com/rss/articles/CBMixAFBVV95cUxQR2VRQW5oZ21ZbmNRY3k2TTM4cnVHSTFWZDhvN0pqTTJ0Q25GQUdEeWV3WjNldm5PNkRXQk9CTEdFRlc4aHo2RnI4cWpNUmJBSEttQVFpdS1FR0hWTW1zckdUWnB4eHp6YURvUTYxa1NTRHBsczMzNWtTeHA1cFdXM1BMRG1uUHF0NlM0VFNCYWIzbUc3UEswTEZ6WlBMMDhzblRWMnVYTVVNTTFibXllbEF0NXhBb3JhLXNWcUZicHJGWGxy?oc=5
2025-11-12	Google	0.187	GE Aerospace Advanced Silicon Carbide Power Devices Key to More Efficient AI Data Centers, and other High Power Industrial Applications - GE Aerospace		https://news.google.com/rss/articles/CBMixAFBVV95cUxNbjFxamJBOVRlM0Rfa1ZQTXV2SHl6bWpoVF9laDFYbzVSRkgybTl3b3g4Vm41WUMyWjlwcG1NSWhkSVJTUDRsN3NOUTJYajJZd2RhWkJqMloxMHpHMmJCdzNXRlgyMC1xQ2drYXNINHRCZHdsakF5S2E5SVFjNTYtSnlsaEFqVTUyVEtrYWsyeVdKYXVJMUVOeXdIM1dyRUZ2VVRWUjVGWlBQYmJQOWFpcTdER2I3RFBTSUhacUFFbVMwN0ZD?oc=5
2025-11-12	Google	0.0	Expansion Plans: GE Aerospace’s MRO Facility in Celma, Brazil, Gears Up to Double Its Capacity - GE Aerospace		https://news.google.com/rss/articles/CBMiwAFBVV95cUxQYVdOY1B6N2JPejVadFJVQlBuUndlekV3ZnB1c0pEc1pWZnhsdjZCQ1ZMUGJRb24ySld1Z0tDZEdiclR6TkpCeEFPdWVoeGJLZUxmYzlYaTF4YTlMcFExcG1JVnZCWnBueTZJeVUtdG5VVlpqd0F6RUY5WThsb2I3X3phaUVuaWV2SnZQOWxTcEljaXlKYWRCdnFTcmJTLUVJXzFLYXlOZ3Vvb2lMSHRBU0FtRFZzbmctS1Z4VHFKN3Q?oc=5
2025-11-05	Google	0.0	GE Aerospace and Shield AI to Collaborate on Propulsion for X-BAT Vehicle Program - GE Aerospace		https://news.google.com/rss/articles/CBMiuwFBVV95cUxQbXRfMS1DUmxGVFpMcU9xNnlYMW5LOU9XSEhUTU95SXVhTDI3VlBTSWhJcVlpYjF3dFU2N3VhS3l6dkZOQktGb1hRU2gxU0F5dG41SUFMVlphZElnSXF1U1NydjZFWUQ3WHB1Y1FzUHBrMG9MTWZ5b1RiLU9KNEhHNG5ZWTZrX0RIVHJ0aG1VWFVvVmFxdHR2a3ZHU3M1SVNDaDNjYUxROEFfa0ZIbElMSXR0UlVrM3pPdWlF?oc=5
