Date	Source	Sentiment	Headline	Summary	URL
2026-02-26	Yahoo	0.5	Can GE's Growth Investments Create Long-Term Value for Investors?	GE Aerospace is investing more than $1B in MRO expansion as LEAP engine deliveries and shop visits surge, aiming to unlock long-term aftermarket growth.	https://finance.yahoo.com/news/ges-growth-investments-create-long-153800069.html?.tsrc=rss
2026-02-26	Yahoo	0.5	Top Midday Stories: Nvidia Shares Fall After Earnings; Janus Henderson Receives Acquisition Offer From Victory	The Nasdaq Composite fell 1.7% in late-morning trading Thursday, the S&amp;P 500 dropped 1%, and the Dow	https://finance.yahoo.com/news/top-midday-stories-nvidia-shares-170006031.html?.tsrc=rss
2026-02-26	Yahoo	0.3	Market Chatter: US Aerospace, Chip Firms Grappling With Rare Earth Shortages Ahead of Trump-Xi Talks	Suppliers to US aerospace and semiconductor firms are grappling with rare earth shortages, heighteni	https://finance.yahoo.com/news/market-chatter-us-aerospace-chip-161339972.html?.tsrc=rss
2026-02-26	Google	0.3	“China Is Flexing Its Rare Earth Muscle” as GE, Intel, and Nvidia Face Supply Risk - TipRanks		https://news.google.com/rss/articles/CBMirAFBVV95cUxNUVBPcEl1YzFZMTdOT25iNVY4Q3ppQzJmZ1NlOTR5OXFlaFdjc3M4VTJfT0RDVjJvRXphak14eU1JOGtaMDc1SkZBQkZ3ODJEc0ZvRERjNDMyc3FHMVh3TklPMFMxR2RjWGFnaEJsamo2enR5SnRKLUxrX3ZKQUw3cktoeUpNb1dTbTZPNklUU2MxeElBS05OaVZiY1VjT0JXTFBsZnN6dHZSLXhq?oc=5
2026-02-26	Google	0.183	GE wins first digital TrueChoice Defense deal for J85 engine - Airforce Technology		https://news.google.com/rss/articles/CBMidEFVX3lxTE1JMmJHR2hCM0pJamQtazdLTjl4NmdLbDcycFhvQWcwWThTRTR0ZGoyN1ZvRjJZWFM0cmVpSGdmMTBseDR5MHpWemNNRk5XX1pNSWJIa2RxSXAyYWRqcS1DaHo1UVNGYThEN0ptODVEZWpPV1Ut?oc=5
2026-02-26	Yahoo	0.167	Delta Air Lines Aims at Fleet Growth: More Upside Ahead?	DAL unveils a sweeping widebody fleet expansion, betting on long-haul growth and premium demand to power its next phase of global expansion.	https://finance.yahoo.com/news/delta-air-lines-aims-fleet-133900410.html?.tsrc=rss
2026-02-26	Yahoo	0.112	Five Rare Earth Stocks To Watch As Shortages Hit Aerospace	Rare earth stocks are mixed on Thursday morning despite a Reuters report that aerospace and semiconductor firms are facing shortages of yttrium and scandium.  MP Materials, NioCorp Developments, American Resources, Rio Tinto and Lynas Rare Earths are among the public companies working to supply key industries outside of China.	https://finance.yahoo.com/m/c0e58b2b-7ede-37e7-a57e-20300045066d/five-rare-earth-stocks-to.html?.tsrc=rss
2026-02-26	Google	0.083	GE Aerospace Wins Key Air Force Deals As Valuation Stays Stretched - simplywall.st		https://news.google.com/rss/articles/CBMi0gFBVV95cUxQRmZyMkNfb01vNHZDNDFDTGVNM3dkQ1pQZTZvcnF5NFlRcVBYcDVKWlFJS0hXVG8wRXY4czB0MzNUMkVoUFZFNW1FbHlsaDFIbnBCb2RGZDRHVWowY2FVZTRuUVU4ZjF4b1ZGZG4xWFhkUTBJamptVnFiR3Itd3NhNVM2WDdtZi0xaEVzTmxsX1V0MWM2bGg5NVVQSUJwRlpkSjlmSnhTdTRTMy1NdUdXMnlTWDRGNHhIc24tZW1DSmxEVTBsSDFUbURJb1plMVZGTmfSAdcBQVVfeXFMUGJmUDQzOWNJSTF5TkVJbUxPU2hqOTVzVHU4dUVleHNpcUlrSW9lTU16UDcxS1VjMG5DWEVlYXFXTVVHckVZeGw1WDlTUEhmZjJJMWpmNjZlamQ4cHF2LTJVcWRMTV9sLXZDUDJtQmJvUTEyUi12X3hSNmRnei1Iem5Tcm85R1hFN25WYWI1R0l0TjI5c2ExVUVpV1V2SkNhMF92T3pWeWFaRVB3Mi1SUUxGeUtoalEtRjZjZkg1cE5QeF9XSm9GbTFyNERhRG9iTERURS1XRHc?oc=5
2026-02-26	Google	0.0	A Closer Look at GE Vernova's Options Market Dynamics - Benzinga		https://news.google.com/rss/articles/CBMirgFBVV95cUxNc2o1Uk1QRTVzb3hPQmhpZV9WbTJIUlkzOThuaFd3cWgzLXplYWRZVjdPR3lkMXFwbEtma1k5Y0pRdVJIRlZmVldXM1c3QU5Val9Va1RvNlpxNTV0T1hFV1U4Snd5QXFpX1lyUkptTGdWYV8tQU4yN0dPcmlRSWZTSGlZeTVkeTFIR2ppX193bHdlTExoWUVBWVpQeXpSVXJJUV9vUDNSY3dMbENJeHc?oc=5
2026-02-26	Google	0.0	Can GE's Growth Investments Create Long-Term Value for Investors? - The Globe and Mail		https://news.google.com/rss/articles/CBMi3gFBVV95cUxOMmpycjE2Wm5sVHVzanh5ZS1VN1k4TFNyRU1PaE1sT3FaanJaU2pmWmNMa0ZreHg2cG9pWG5uWi1Qa1RCQmptOFM3YTYtaXczNHdFT1RsZ0hnQm52UWlwSENSVHhTVWl2X1FRaWpSNE4xd054c3R0RkxfUjVtRm0tempSN09GOFZ4aWJRd3BtSDBCNFRPNDQ4UmFMeWxoc0RKYi1Nako3elFoNUJKeHQtNE93cXZ1Qlp1XzZGRVlialpOZXZGcUFSd2k4N21nVnNtOWl1dHViWll3alZTNHc?oc=5
2026-02-26	Google	0.0	GE Aerospace awarded Defense Logistics Agency contract to improve U.S. Air Force J85 engine readiness - Defence Industry Europe		https://news.google.com/rss/articles/CBMiyAFBVV95cUxPTndXMVhpSE5MT3Z6Sk92ZjUxS0hiX1dLTG5sdnpVTFdqdHFkdGtNY2RvMXJXT1FwOFhReDdDUWEyV1k3eTlVd0QxVmFQVUR5SkFNOHJvV0J6WlJtaXI2bkZZVzBYb0lDMTAtOHgtSXVLaUxxeGFmT2NKTmdjR1g3UUMyb3hrTnc3d2d6cjBHQTVFVUpwU2l1eDdUenBWV25qTVNtU08xLW5zN21iMXkwUWZiZTNEVHNYLXJyQmhOQTFsLWxjd2NMSQ?oc=5
2026-02-26	Google	0.0	GE HealthCare Advances AI-Powered Fetal Ultrasound Through Diagnoly Partnership - The Healthcare Technology Report.		https://news.google.com/rss/articles/CBMivwFBVV95cUxNaGJlNzVzazdzWndGTjllanIzZ3Q2N1ZXd1NJT0NtVWFTZTZMeFZpaXR0bHh1T1FaMm91bGxpb3JVdDB3QUlmY3Z6UXpQNmtpQklKU003dXBZenNHcTZuN1RNWmpkRDUtbnF2a3pRajJJakJOa0o1dVVhbjdFUEpXOWNfbkJTRy1xamMwUjBlVHVTdFJHa25RbURxcmFQbVVuM3pPSGxDNDR1Rkd4TjE2MVB3dV82YXl3b1dQUHdrYw?oc=5
2026-02-26	Google	0.0	GE HealthCare Introduces Next-Gen LOGIQ Ultrasound Systems - Medical Product Outsourcing		https://news.google.com/rss/articles/CBMingFBVV95cUxPNXN0cGxNNjYtNzVHZ2s3WVBsSVBUWkpVenZnMmVBMEhGTHlpVnJzSFM3N3NIS2dNTWJHdXRFQnBOcWQwcUhKQXJXQnc1ZGZGUllMU2I5V1NQc0dUN2VCeGQ0clQxRnhLVWdHMkJjbGc1WDAwSmduaWFrajk4dWwzb2pwLWZjS2VCLWNEeHVXNkVKMUJ4WWZlSnFsTDRpUQ?oc=5
2026-02-26	Google	0.0	GE HealthCare Launches Next-Generation LOGIQ Ultrasound Portfolio with AI Tools - HIT Consultant		https://news.google.com/rss/articles/CBMinAFBVV95cUxNd0QtdkRUUmU2bDBLb3BDNlhJTW9UXzdzTnhiVHpBQWo3Mzh6NE9XOEt6OGJfRXJVWlFrQ1dPNWdabGxyUm9yaTV0UXk2LVZHbmVfSTY1b1JLVEM0c204aVBFNmxxMGFiblBkakhpRTA4YzVGeWdUeVVkVWFfTFU5MEhaMlVxQ3FiaTZxTl9FQmQzam1WVWVacmtWMDc?oc=5
2026-02-26	Google	0.0	GE HealthCare Unveils Enhanced LOGIQ Ultrasound Systems - diagnosticimaging.com		https://news.google.com/rss/articles/CBMijwFBVV95cUxNTGtkdnhuZUwzSGlCM2REM1dWcVJrU0xLblZJay1tdF94dkVfcmp0cDRFZHJEYVpieDdxcWl1T19JX3JTUGduUUxVUXMxNVp3RU5CLUdobXpZX2JxRHRJMVN0OUlHTDZxVnNGeGFEdUdTWVROQnVya09UNVNKZ2o4NFB6aXd6VGd3X0Q5UGRJNA?oc=5
2026-02-26	Google	0.0	GE HealthCare at Citi’s 2026 Unplugged: Innovation Drives Growth - Investing.com		https://news.google.com/rss/articles/CBMiugFBVV95cUxOT09mdUV1c2FKMnFiRDRuX0xnejZCYmh3SWhMYlNuazhfbFliZFI3TGlScGlrbF9mbDdQWEI2SGIyQWREZGdINXg4cktkQ1BIc2htbWx2MjhDZUV3aVh3eENKRTBmTkxjQnEzcV81bDM1QXQ3Nms3SFkwS3lSM3NKdW9fOERGOEVUMTk2aXFnWVBvdDRpemhqVjdrWWRqb0QxQzBGVEFVSTgyZUtRODZoM0EwbnRzUXltTEE?oc=5
2026-02-26	Google	0.0	GE HealthCare inks 10-year Care Alliance with UCSF Health - MassDevice		https://news.google.com/rss/articles/CBMidkFVX3lxTE9JaENhd3o1MmZDX2o5ZXhUVm1zVHpfUmlDRExKdTBPX0g1UkVMa2VycmptWmpwQkRySFU1TU9XaU1rNFRwMUVxS1lVblU5UGNYYTdIWlB0a1EzUS1QaTdOMEVyS21USEZfbjdkMHVJaWdLbS1rQnc?oc=5
2026-02-26	Google	0.0	GE Vernova Inc. $GEV is Virtus Wealth Solutions LLC's 7th Largest Position - MarketBeat		https://news.google.com/rss/articles/CBMizAFBVV95cUxNTnZHQzdUdWVUNEhnOE11aWhoNGZfWlNtMEdCMnFKOWdLa3gwcXN1eTcwT0FGRWJrS09YR1JENEpQRGNXaEJGOWctNDFvVXB4X2t5MW5GcFZJamxISXE3MUJqcUo3RzlwbDFkWERGMFNwVWlCSHN0VDFxVDlqMExDMVhIZ2REVjZPQ1lUampza1FUVlE5dE03SkdVYlhiSTZmNU5fOElfT0pNbEpTUlNiTmpUaUdaOGJMMTFHN095UEwxclJpbGtZdzZkUk4?oc=5
2026-02-26	Google	0.0	GEHC, UCSF Health ink 10-year imaging collaboration - AuntMinnie		https://news.google.com/rss/articles/CBMivwFBVV95cUxQcTc0OXB0Z3AtRHRrbHVuNmJnWktxZ2ZwblBnVDZrVDEzLVVTVXJ2NzZ0LUZDQkZfVERPaGR0SENVYWY4U0JxU3EyYWh5UUcxem15X3hSN2N0Mk92Mko5TnBEaHM1ZVlMczdDLURrYlFubk5aUVRoNmZ0YW1IRmZEcUF1UGNlQU1hWlEyaE93Z1JNRy1iZi1EUnZocFdldzB3bGhpc1RDaWlEaFdPejBqRmtmdk5LenY1VmFpVTAxMA?oc=5
2026-02-26	Google	0.0	Mitsubishi UFJ Asset Management Co. Ltd. Acquires 22,913 Shares of GE Vernova Inc. $GEV - MarketBeat		https://news.google.com/rss/articles/CBMi2wFBVV95cUxPZGxERXlqZkRnbXUxVFcxMU9ZbElsWFhxZ01KNTZIQVhsTWVXbjRCa1pNMGsza2ZReHZVaEwxUUtkZUpnVHJVT0RZdDBKZHRHNGNfN1Y5RTJZbl9JZW9tY0hFSmxDdmxMRTlHNDRiQUFXcWlxZmRJZzViY2g0b3F0NGw0S0pMV0ltRkk1UUtRbFZScUc3TXItOVh5MUpaSWlmb1VkemFtOGUzaDhmNWhjaVROZEkySnRXVWtrdE1uTFJIdGNlYS1RbEhjdm1UYlhHWXdTcjBOV05yckE?oc=5
2026-02-26	Google	0.0	Mitsubishi UFJ Asset Management Co. Ltd. Purchases 88,521 Shares of GE Aerospace $GE - MarketBeat		https://news.google.com/rss/articles/CBMi2AFBVV95cUxQZVFYNVdJMUJuWVZfSXpiVFRkVlJrOUp2NnhkY0xxaVpsbmZVcVVkbDUtNHhwc3ZPQ3lxRFdvbDVEYWlnMTlzcGs0YTA1MTdTa0dHZWMxRjJ6d2V0RDdNdVNvN2ZlbXZLU3NxaFZCS0ZfcUVnbkcyT1U0NVp3akE5YThjQkxUSXlmWVdVR1V4RmVKVVdORGhRQ0hiVUxEUzNuN2RmclBCYW0xWVJqa0NNVVgyUHNibU16T2JfV1ppcjdWaXR0OUNoSDBTSTliSERxT1ZiaXVlQVc?oc=5
2026-02-26	Yahoo	0.0	One Fund Bet $5 Million on Enovis Stock Last Quarter. Shares Surged 14% Post-Earnings	Enovis develops medical devices for orthopedic care and rehabilitation, serving healthcare professionals and institutions worldwide.	https://www.fool.com/coverage/filings/2026/02/26/one-fund-bet-usd5-million-on-enovis-stock-last-quarter-shares-surged-14-post-earnings/?.tsrc=rss
2026-02-26	Google	0.0	Optiver Holding B.V. Purchases 5,472 Shares of GE Aerospace $GE - MarketBeat		https://news.google.com/rss/articles/CBMivAFBVV95cUxPMmJqS29BTmxFZFRXUHZ0SjhLd0V1X3k3VHBWdmtiSHdWMDRhck5UcHpnRVh6QWVpcHBXTEhZVDRpZ0MtenptdGx4Zk81bk9TTXFYanVncmpBZkxRSkZFT1ZKMmFyd0ZHQXdlbDdyanlrX2JOTEkwQnByWER2ZXlCNWJ0eHdPVHVFcHNrMEt0SlNiRTFpdmk0NjlNbmxHMVU5eXRNMDFjMmw3RFJONVltZzBIcXlNV05PVk5xTw?oc=5
2026-02-26	Google	0.0	Pilot’s Widow Sues Boeing, GE Following UPS Crash - AVweb		https://news.google.com/rss/articles/CBMifkFVX3lxTE5GWTdSZ0R0aHRGNnZxdFVFUG9tVkxfd05PM0ZwY19WQUtVQmprTlphazZoLU9ld3ZRbHJTVE1qN09DOEFxMlduVk9BcnE2Vnk4bjViVENCOFNKeWRBR2hjUEk1WGdjS25mc1NSRUNhTkx4T0JMd1BSY0NBYk9GZw?oc=5
2026-02-26	Google	0.0	Sumitomo Life Insurance Co. Raises Holdings in GE Aerospace $GE - MarketBeat		https://news.google.com/rss/articles/CBMivwFBVV95cUxONFZGQTQtbl9SMzNPaFBNYjVXSG5CekVyVlp1MXFuNklwY21XSjdzcDcwemVKY2dmdmk3MjBEZE93WDBjdG9FVjAzMWo1R1RmUDh6U0phUVVMR2ZFbDZiMlV4NGFxRklpWDVXa2Y4Rl9NRVd4NTRUcFFsdHQtRWYxZ3dwTWtxVE54b2JFY1VSMHpoNHB1SDlQTE1NVDNCaUp2QXF1Uzc0T0d4R3FabjItRGE3N2xrd1BOdTNENmdGMA?oc=5
2026-02-26	Google	0.0	Thoroughbred Financial Services LLC Purchases 3,708 Shares of GE Aerospace $GE - MarketBeat		https://news.google.com/rss/articles/CBMi0wFBVV95cUxQR0FmU2hGWGtHZldCaE42S21iSEdvMV9QMVdNZWpoX3lXR1RyV2xXWkFZX1hTRTBzU1Z3dEZuWlhJb3lCT2NpTG0yNEFJWEY1OGRndFQwM2Q2THp5cnN0Uy1IeDM0MFAyMml2dm1xelhpTkd5WndiTlh5X2pyckJYZ0IxTklUNWN2bzRCa3J6REV4T1FDamJnOEFZQWE5ZjIzazI0c3dRczZxMXB5STBuTTQ2bUxKNmRZRk5lMWl2REt3djlGMUQtZ00tQzNGUkxoS3Rj?oc=5
2026-02-26	Yahoo	0.0	Vontier Appoints Rasha Hasaneen as Chief Innovation and Growth Officer	RALEIGH, N.C., February 26, 2026--Vontier Corporation (NYSE: VNT), a leading global provider of critical technologies and solutions to connect, manage and scale the mobility ecosystem, today announced the appointment of Rasha Hasaneen as Chief Innovation and Growth Officer to drive the company’s enterprise innovation, AI strategy and digital modernization efforts.	https://finance.yahoo.com/news/vontier-appoints-rasha-hasaneen-chief-130000487.html?.tsrc=rss
2026-02-26	Google	0.0	Wife of UPS pilot files lawsuit against GE, Boeing over plane crash - WLKY		https://news.google.com/rss/articles/CBMimwFBVV95cUxOdnFPTHNsZHpOMjJwYVU2T1gtU1NoT2VrZHYxUm0tZDMzdHNGdU5HekFFVTBYeXZYalNRQWhrVEJiQURUaDJNZHJSbmpNRUs2VVl2bGZqY1BWX0QyN3NpOEZiTkxQTzU2UW5JZ0hvYVBsNkpqbnE4WWFnUEhJdC1WYXB1RGhEUXVJUnR6WFowQkFjMlRDVzNGTGdoNA?oc=5
2026-02-26	Google	0.0	Wife of UPS pilot sues Boeing, GE, and Texas maintenance company - whas11.com		https://news.google.com/rss/articles/CBMi5wFBVV95cUxPRkVtVEY1UnBMNUZzMTREN3pGR1Y4WFlzNGlxbzFHTTc5eTEtSUlsNy1PUlRCVWdXQnVVWFh4NUtHNVdNaGZ4SWMyMUkwTlhDbHBGaXcyNE4wNF8zUnZxNHNSZU5PUGVpdk50M3NqMVhLNUVtRlhlNE9BejdRTV9SdzFpazRRa0ZzV0dRenNoQU02aDkzVVl4OXBKSmpySFE2aDM4VjZCVU9uUlVfVFRiaklDQnVuTjUxMTJzRkZNdnFhMGUxSTczZ3J1MFYyVjUyMDdQVUtETFl1cWFGUWtUaFlWNjliRjQ?oc=5
2026-02-26	Google	0.0	Wife of UPS pilot who died in Louisville plane crash files lawsuit - Lexington Herald Leader		https://news.google.com/rss/articles/CBMidEFVX3lxTFAtODNoMjR6UlJaeTZKRWd3YVFYV05UX2VJRktyWW9YMlJucGpEWTh3a3hCMWJubXpNQ2J6MVM0NGlIc2lkOTdVR3FRUXo2cHRlRjdQQnM3c0JxaTk0M3VJRm5wbHVyTmNXVFpQQjRRaVQ0U3VW0gF0QVVfeXFMUHZOOHBXWGFyZlh6SG9OQ0JkSUtOTTBKRzhGbXVjY0h2am9IMDJ0bjRUZjZDbVJjaXQzeGdZSElMSURyZ1J2RmJaM0p1djl0aVlhT1JmX3ItdXVJeTZiT0tzZWkwX0ZGX3NUN3YwLWpvbmdRV0M?oc=5
2026-02-26	Google	0.0	Wife of pilot who died in UPS crash files lawsuit against Boeing, GE - The Courier-Journal		https://news.google.com/rss/articles/CBMizwFBVV95cUxQc1hKMnhnUlBQWkh2MS13Y1pNY1ZoUm8yMUd5UFVYTUcxVUg5ZS0tbERxV1pQaVJrY0hkejB0cGRRZVJrQ19JUkVRUXU5LTVMTWVoQ0NzRFJZb3RJQlAydDYzc3R5MEt1YU00S0ctQnRyeEVjTlI0S3VfVnlvenBnRGUxMnlwTU9SdHo1RTBHeEtlWmMyTnNROFBZNXFPOEp2blRJWHdyck9kQm9MR1g2ZjAtdUh1SXZsS3d4RXpOOGpIWlVFcmFWU3VPS3FzQ0E?oc=5
2026-02-26	Google	-0.075	Wife of UPS crash victim sues Boeing, GE, and maintenance company - whas11.com		https://news.google.com/rss/articles/CBMi3AFBVV95cUxOMFo0Nkg4ZGNBRXk3VlpQaWMxRnJkMmNwb0MyWnVGUFhMcjZtV3A3X09QT3Z5ZEZWQ1dMLURxUkZpZDI3dTc4WV82WEwzd3dWcHlpWjlwcUVKQ2JtajJSSUFZSG5rS1JzU3dYdHQxM0VCN1FKVkFBM05rTjltZ21uT3dVOE9EaDdlV19OdEJWVTlRck81ZFhic0duazV4RHR3TlZ4VmpnVHA5X193Z2ZEUFNhRlVQVjdiU01DcVprMGhYaXpnR3IzeE5RMzI0a3Nwa1ZzT2xNVHpOSHVh?oc=5
2026-02-26	Google	-0.2	Pilot’s widow sues Boeing, GE and maintenance firm over 2025 UPS crash in Kentucky - KEYE		https://news.google.com/rss/articles/CBMiogNBVV95cUxORG5fNGdmX29YMFZ0djQybi1DTzR0N25DUmhLc09kZVE5VzdGNGFPdHNFb2d0UlZlUXpYMWZadXVwNHRldHBfM0xXZHV1VFNqU0ZKTDFIUVQzWk9yUlY3aXFGdjRnZDc0REhtaXllU0hCMDJPOVdWZHU3elNDN1A0blFUU1NNRmFDWGxSZGlNNFJDUmFjUDhMbDFuSFdZRWNnSXpMR01TajhlYXQ1UVFpN25ncExQRENyb25HNG1aRWx2OFhmbW1zb0Nobi1UVGZaT0tTVS1JenlHY0lnblZwLWhQVWVOQXdSQ0RyUlRBVTc3cE5ZUkh5UE5rRTk5YVVQd3U1Z3BXdWFWWVk4OUFMLWl6c25lNHZLU2Fwa0ktYTg2ay1kMDZGTWZ5T1lMa2wtLUdKNkdFemEzN3FRN0tEV0Q3Ymk0OTYxM0x2cGxpMUJPZDNZWk4yNThqSUVRTGUtS3JxTFJNV0cyM1o2NEpXRlhYVWJJb3dJZlNFbU1SUlZwTmtpbXgydEhrekUybDhmSUh5OVpMS1A3UEtRazNpZmpB?oc=5
2026-02-26	Google	-0.2	Widow of Pilot Killed in UPS Crash Sues Boeing, GE - FLYING Magazine		https://news.google.com/rss/articles/CBMiggFBVV95cUxOUDd6b2hjaHY1ZHNuTFI4alE1VFB3b3UzVENUTjc0RTZyblZTR0lDTXZiMUhMb3VjUGkzdXJrM0VkYnZneDgtMllCenJlRGdBbngzVUJvM2NBZU5ZeWlWZG0tdS1hRXZldjNPNTkyVUdncjdGYkdCbWVEMkY3T2lYX0ln?oc=5
2026-02-26	Google	-0.3	GE Stock Is Soaring—Is It Too Late To Jump In? - Forbes		https://news.google.com/rss/articles/CBMipwFBVV95cUxPcVVWVjlraFZiNE1Tc0VCZ3ZjVGZic0x4bE02Z2tSYVNIMHVVQWxrLU1hRDJxRldCaXM3Zk5JNkdYaTBtODBhanUwbklxNXB6UGMwd0tGdmZKTTgtZUpCUmR5MXFTaUNOSEJtbTM2TGh4VlZCX0dMbUxWMkRGZTlCcTJhM1pfcXdfeDVBa1hvQlpHN0t4TFFES18xWmhZYlRiSDMwYmtxOA?oc=5
2026-02-25	Google	0.425	1 Brilliant Energy Stock to Buy Now and Hold for the Long Term - The Globe and Mail		https://news.google.com/rss/articles/CBMi3gFBVV95cUxQWDBPSkhNR0tuaVZ0QWhKMXduMVRDLUlTTVVoTEx1aXNoRlFRNklfSE1DVmRubkY2WVdNSGZLbXlBd2VuanpuSHRZVGNXT2FaY3VoRXZEMUpEdVVtRHZkWkE3dHJUblB4cGduM042dHNnRDRQWjdUREc3RUJMal9aWmk3OGY4ZEU1akc3SmtxNmFuaGhfZDJSc3Vla2N2RndkU1V3dHF3MWU0WUJ3TnZKc3dlZEhla1U1MUxlMjVTS19hWGtJM0lETDJLWFZ2dTNPeERBREllWVJzMzVvYUE?oc=5
2026-02-25	Google	0.4	Gentuity Announces Advanced Intravascular Imaging Solutions to Become Available Through GE HealthCare in the United States | Newswise - Newswise		https://news.google.com/rss/articles/CBMi7AFBVV95cUxORWNWV1FsTXdWd0JqVHBFT3J0SVFObVc4ZVh4V1UxVDdHV0tCeHZqOTFsanFMeXdKZm1YMUtDOENueDRnMkV5NWFxYjN3eF9VNGw3ekVaOHNiX3YzVV9nM1BHUWdmTVh1RzY3UHRiZXd1RFpFdU1zT2lGUXdKX2swdWZ5UlhKUTVLSkxRSnhYeVVnNmVtQ0pxbVdkZVFULS05Mkp1Y3l6Sl8tWnYtVUR2TnhTeVpsUVdPT2hudW5feTl0LVROSFJGNk80MGlkU0JkbWVaN0VMLUQ1V3NzU0UteG1FTElqWlMtWWtCNdIB7AFBVV95cUxORWNWV1FsTXdWd0JqVHBFT3J0SVFObVc4ZVh4V1UxVDdHV0tCeHZqOTFsanFMeXdKZm1YMUtDOENueDRnMkV5NWFxYjN3eF9VNGw3ekVaOHNiX3YzVV9nM1BHUWdmTVh1RzY3UHRiZXd1RFpFdU1zT2lGUXdKX2swdWZ5UlhKUTVLSkxRSnhYeVVnNmVtQ0pxbVdkZVFULS05Mkp1Y3l6Sl8tWnYtVUR2TnhTeVpsUVdPT2hudW5feTl0LVROSFJGNk80MGlkU0JkbWVaN0VMLUQ1V3NzU0UteG1FTElqWlMtWWtCNQ?oc=5
2026-02-25	Google	0.4	Gentuity LLC Announces Advanced Intravascular Imaging Solutions to Become Available Through GE HealthCare in the United States - marketscreener.com		https://news.google.com/rss/articles/CBMi6AFBVV95cUxNdkJDMlJ2RFFyLWxBcGJ5ZjRQQUZQbS1xcHJXd0hpMVlFSjIxWk9yYTRDZ1F4a1lEX0NVUFR6QUFLcDM0QklrcjlFU3pRXzBmRXV3YmxKREY4aWhldS00bTZSTTVDaklmLVEyUWQ0cGdEZ0RxcldMcEtYY01uMm9HOFFQMDdDR09YT3dtT2txbHNfbzZSYkZnTWtXOXZMRUhWN181OGJxaXN5a2xmSHlhMG91MlVLN0VySXFmR0V6T3o0ZzliY1hCZkxjRUc5ajZ5Y3RTX2lpa1FyM2JUY25vVEx1aXlCRzBS?oc=5
2026-02-25	Google	0.318	GE HealthCare gets FDA OK for two new SIGNA MR systems - DOTmed		https://news.google.com/rss/articles/CBMiUEFVX3lxTE5MczBvNHo1RHRnYXBUSjhhYjkxZEZ1ekR0a0FEZlprUXJBYlIweXRLbHJBOHc0SlRzUTNBRktpSFRRVWtDaGJoLVdoeW5jdG1z?oc=5
2026-02-25	Google	0.318	Why GE Vernova Is The Market’s New Favorite Energy Play - Forbes		https://news.google.com/rss/articles/CBMiswFBVV95cUxNZ1p6eWpPRXJxLUpiOTBlUkhUU25YVV9Xd0h1b041R09IdWZwZjFGeExJejlOTW90THZJdXV0Mm4tendyRV9vQ0swTkVHb05QeFMzN0ZzMDU5SVF5c25Qa3RtcTBlUjJ4aTEteXhMT3h4Qk5MMW9RVEJpaG1tS283blBOb1oxTXROQllweUg2YVBxNXZNQXM3RU15YjBQMU1ObnROMmVUQ2lfTm9nbXdyOWlVUQ?oc=5
2026-02-25	Yahoo	0.3	Zacks Investment Ideas feature highlights: Bloom Energy, Excelerate Energy and GE Vernova	Bloom Energy breaks out to fresh highs as AI-driven power demand lifts Excelerate Energy and GE Vernova in a surging energy trade.	https://finance.yahoo.com/news/zacks-investment-ideas-feature-highlights-150100749.html?.tsrc=rss
2026-02-25	Google	0.2	GE Aerospace Delivered $7.7 Billion in Free Cash Flow Last Year: Here’s Where Shares Could Go in 2026 - TIKR.com		https://news.google.com/rss/articles/CBMiwgFBVV95cUxOOWg4OFNiTGlEWFVERXFUV3JLSk1fRmJXTnpkNTlMSmRCbzhLX3pBbzdUS0RMNnZaSlpITl9DY3BfUlhadjBIVHg0N0t6V0RxNXVqTWFBamFhLUpHRGNSZ0JrYkNlZ1hxOWQ5MTBHVUU1SXFJV19IUkhMTy1NNTFSMXdGRHlJdFFNdXJFX1RnMHJFenBYdVNGa2JGczdoZDZ2XzNkZHR1TWplYXZRaFhQY05CUC1aM0M1Q2JJMjk5aHY0Zw?oc=5
2026-02-25	Google	0.148	GE Aerospace (NYSE:GE) Hits New 1-Year High - Still a Buy? - MarketBeat		https://news.google.com/rss/articles/CBMiqgFBVV95cUxNdTlmQXhaTzFyVzZpWlJIZXFuU1owQTU5MUVrem05SFZ1YXhRejVydXJCaE9CUWlfZUY0UEhhc0VwMHZjNWROdjJxVW1HRmNnSWY3anEwZzJtYzRITXBFM28zRFNLWEFsSXk4Q2lta29wUjlNdU93NFh4U3kyNEwyUnhiTUdqN1l2R0JqQmhzNW5HaFB3QmlTejZoWmR2RWJKdlpDeWNwcG43Zw?oc=5
2026-02-25	Google	0.145	GE Aerospace partners with Palantir to secure new U.S. military contract, leveraging AI to address supply chain bottlenecks for the J85 engine. - 富途牛牛		https://news.google.com/rss/articles/CBMipAFBVV95cUxNSTdMUm5qbnBYdlV0cnM4dUtVaW5aZk4wNXc1amFEWWNuZ2RlejRFMjdfZ1A5akc2clpBNVlaNmV2VU8wSWlGUlBDNURtVkRtR2JWUTRBQkpCbUszVmhRdWgzcmg1TlpiWVNtSjBFVVpQcFp5VnNBek9zNzF3LWRaTmFoam1KSllHN3NJaDVQTDFRakpldU9ycjcwLUFtcEJpb3Vacg?oc=5
2026-02-25	Google	0.136	GE HealthCare launches new ultrasound systems - AuntMinnie		https://news.google.com/rss/articles/CBMiwwFBVV95cUxPanpnMzB5UEd3Ym9HS01BY0FrSmFGRGRzbkRhY3h6eDJHUld5MVpRZnVvSDNlTlRIWTlENkRrcGszWHpsQ0x1VnVGYlBobGwwcTR3NmFwVjN4R0JtTXJ4bDJEMkxhMlFKOXRTNlZwNzE0c0pLekJKTFIwdXZIZ0E3d1NEY3habjBSS0x4ck9IcEp1NkJFckQtZk9nRTlMdG0wLV9Ca0EyU3lqUGhtVWU2aUhuZ09rb0t0aWQ4WnBTXzZzVFk?oc=5
2026-02-25	Yahoo	0.105	Kratos Contract Wins Deepen Role In Hypersonics Propulsion And Space Systems	Kratos Defense & Security Solutions (NasdaqGS:KTOS) recently secured multiple government and commercial contracts in hypersonic technologies, aerospace propulsion, and satellite ground systems. The company won a joint U.S. Air Force contract with GE Aerospace to develop the GEK1500 engine for Collaborative Combat Aircraft. Kratos also obtained a new hypersonic vehicle materials testing program, expanding its role in next generation defense technologies. For you as an investor, these wins...	https://finance.yahoo.com/news/kratos-contract-wins-deepen-role-120929437.html?.tsrc=rss
2026-02-25	Google	0.1	GE Aerospace $GE Shares Bought by Empirical Asset Management LLC - MarketBeat		https://news.google.com/rss/articles/CBMiwgFBVV95cUxNaDBndl9TM3RheWd3a0ZVZ2tWbHdndVpuNVVqSUpSQmZteDB3NXNreXM1UEhZS2VXZkMwYkN1TGd0YlF5LVJuNjlMNlAxdjJzanVJbTVrUjBXM0VXd3V5cnY5Y2JON3dCN0U5WTFDdE1ucTJhNGs4Q25TMXZndVhPUXZrOTRNZlhrRXlRSkl5VlhUM19tMXZUZnNJRndhWFhmOU5DajNLZnNRWThIRlViSGEyVTZ6NVp4eVBnUGtOclRLZw?oc=5
2026-02-25	Google	0.0	Bank of America Securities Sticks to Their Buy Rating for GE Aerospace (GE) - The Globe and Mail		https://news.google.com/rss/articles/CBMi6wFBVV95cUxQTUIwR3k1X19QcVZVYmQ5UDlDOFVjSUdZaHFwMzNqOUhPZnNVc0JyX05zZlBqVnVHT044SS1XcTJVeGFiUTJ4STNOSWIzRTBuaGd3R2lCX3JHeGxVYVVDcGJtSXBxTGlDVmQxT0pwQWVQS1lMOFBzcDhJbG9pakhLWVpaRy1vLUJUeHVaSWdtS2ZNSE9RVkJzWFM5eTRsc2dqMXNHWmN0LVUwWFhPOVlZZ04zR2M0akhaYTZVNi02bW5uODFNOUdEWjBObkRqOEVFTm1kNEQ4MjlKeENwYjVxRlpTVlJ3VFVaYmdJ?oc=5
2026-02-25	Google	0.0	Could This Fuel The Next Surge in GE Vernova Stock - Trefis		https://news.google.com/rss/articles/CBMisAFBVV95cUxOOGVlZzdRUjgwQ3ptY0hyd0JEWDh1VDdUVE5SMWVoYXRXbzRyN1l3d1huaFRsTlBGMExNZ1AzN3ZxNGtqZE1uZ3hPVzJRSS1faGNWSXVPOE1QZ1c1RVBJVlRucU1XcTN5SnhDdUdhcHFBSl9jSG1pWk1rcEtIcnZHMzhKZUVQZHNVSVlfUlQ3SUpMX0N1aDJOOExRVG1UcTh5MTBRVFVMSEpRYk83Z0Vfeg?oc=5
2026-02-25	Google	0.0	GE Aerospace Awarded DLA Contract to Increase USAF J85 Engine Readiness - ASDNews		https://news.google.com/rss/articles/CBMitwFBVV95cUxPT3k2eFBsNmM5Y09uVzhsNk5XQUU1cEV5UDg0eU1TY1dXdHNCOTJmY0tvTEZ4bXIxbFRjazE5TzZSZDVpakNxNzAwSzU2dV85M2s4emRyMFJHNE5Hb1c4bVIyNzM4VEZEcGsxZ0tPbHdXMmtOckt5czdZQTQ0WGVRbGJYdlgyQWxYVmpHaHdETVJWY1ZoX04ta3VWcHc4LTJzSjd4WWdlTTdUeVhKYTVaVi12dFozUU0?oc=5
2026-02-25	Yahoo	0.0	GE Aerospace Is Linking Up with Palantir. Should You Buy GE Stock Here?	GE Aerospace has announced its partnership with AI giant Palantir for a U.S. defense contract.	https://www.barchart.com/story/news/418948/ge-aerospace-is-linking-up-with-palantir-should-you-buy-ge-stock-here?.tsrc=rss
2026-02-25	Google	0.0	GE Aerospace Is Linking Up with Palantir. Should You Buy GE Stock Here? - Yahoo Finance		https://news.google.com/rss/articles/CBMihgFBVV95cUxQV3BLNUNGTkF1TlZpMkNuUk5nakY0bWpGZUZMSEtCbWo4OWtjeUViUl8yVDFCUWtiMFljYVpyT0g5Q2dYc2p0bEtObHN6LXo4UmhLbkt4ZWhKeFM3NzVPRnBFRTN5ZkQ3aTlMLUJBemtFOEdLYWhJeVFaanNMcnJ1cm5FSzBZUQ?oc=5
2026-02-25	Yahoo	0.0	GE Aerospace Partners With Palantir on AI Jet Engine Contract	Deal supports U.S. Air Force training fleet readiness through data analytics.	https://finance.yahoo.com/news/ge-aerospace-partners-palantir-ai-173739975.html?.tsrc=rss
2026-02-25	Google	0.0	GE Aerospace Secures DLA Contract to Boost J85 Engine Readiness - ExecutiveBiz		https://news.google.com/rss/articles/CBMigAFBVV95cUxQUGt5LVg0U21IV05zckVmYzZtbzVyQ0l5ZVdxdGlMUG9kVDh0LVJhNkF5dWtvcmZJX1VGR2I4cHJfSGxUTHJGWFFHSUFyOWVvREh4M0J4WlQ5SmMxeGo3bDJhTEFsclR0d1FyZGdpUFNpekhfbnNmSzFVRkxfYnNlbg?oc=5
2026-02-25	Google	0.0	GE HealthCare Rolls Out Next-Level Ultrasound Systems - Imaging Technology News		https://news.google.com/rss/articles/CBMikAFBVV95cUxQTzQ2cjEzM2VRRmltc0NwLXQxd240N3F2b2hFU1dBelZWckZNT3A2ZFljMzc3ampnTnM0ckNFbksxcGpLN0JHR2x1cmJUNGdyeFg4M1BpOG4wcmI1ZlAwVmlHQm5TdjU1OVlQQldnUFBwa180Y3F3TEppeURVZ3hTcWhrcjhOTUZnSjlhVDJqSy0?oc=5
2026-02-25	Google	0.0	GE HeathCare debuts next-generation LOGIQ ultrasound systems - MassDevice		https://news.google.com/rss/articles/CBMikgFBVV95cUxQLVBKUXZTWlNjLUxBUm1yd09BNlVySnJjX3hjclJrZ3lKWlItaXlyUG1sVjNPN1dfcXAyY2NBTmk0QXZKeXhGaEdDWmoxZjFLZ1N3Nlh2eXdEeUpIUURkRnl2UnlfT1FKWDMwd1RnWEtoUUN1VjNDOWZIMXZoY00tWjh0eGduNDlqNVgzSGtjNXRPQQ?oc=5
2026-02-25	Google	0.0	GE Vernova And OSGE Sign Polish Generic Design Agreement For BWRX-300 - NucNet		https://news.google.com/rss/articles/CBMiqgFBVV95cUxNSFh4M2tVQ2ZWOGo1V2kxT00taDhrR1I2MUZlWk5iSjdNZzhRUEJWd0dvZU1oV1VqanNqeGtOVVAwZ0pabW0xcHlrdlVENzlTV2xkXzZSdXRaWEVsV1E3UFdlVFlnV2ZZaWlRWU52Ym9iMi1qMktUVV85WU43dkdqMFNNbkdlcUJXTlRFbHVLaVIzR3ptaFNBTE9uMlhlMDJlMXNpdEpPcm04UQ?oc=5
2026-02-25	Google	0.0	GE Vernova is Sold Out and Scaling Up: Why Its 83-Gigawatt Backlog Could Point to $2,700 Stock Price - TIKR.com		https://news.google.com/rss/articles/CBMi0wFBVV95cUxNRGdVRlpScmo0aUowaUFLTXpVcmxzZXYzT1ZOTEpCaTRoV3g5Mm91OGNOeGlOektjd0VPY21Ka2JBU3p3NE1HZXE2OEhUQUJXZUVoNDVPaGdBYzF3SXBNMDRWRFRXc2FDTE52U1Z0anpPd2hseXpGczlaN0VZVExlZWRDZkVHTDdwN3FpUnhEdzFLcnJmRXpJVGZOM2N6UTAtLV9YR3QzbUZZNE50Skp5N3JmU0F6YUR6bWgzTjR3YWtQcnZ6cEpfOEtSTENIN3J4Q2tz?oc=5
2026-02-25	Google	0.0	GGM Financials LLC Decreases Stake in GE Vernova Inc. $GEV - MarketBeat		https://news.google.com/rss/articles/CBMiuAFBVV95cUxNaG1lblYxejcwcDhOOGFLRFRGX1F6NlMwQWJiZkFWSVhGcXVicC10eDNzaUNTNnRyNUlZcUxOdEIybU1peDBDbVhIeldUNmNBNHVmS3ZOcnNqVWRIbVMxQVFTWElwUk5HN2tGNVg4U1JNTTVJVUxhSUI4ajJmNkhHTDhKb2xuWjdZUHh3VVNnbnR3RHZlUHFpSHJmQ3l3SzBMVC1rcDRrV2tJTTFrNUE2UkZQN3dCb2Fo?oc=5
2026-02-25	Google	0.0	How Does GE Vernova Stock Compare With Peers? - Trefis		https://news.google.com/rss/articles/CBMipwFBVV95cUxOZVpaN0QwcU5rQ0FkazJpNWpLSjdVU2hYZnhoSmxmenR2cnJ2anlYMkNvbUlQcFA3eGl1OTFqWExVc0k1OXhNVUZxNldUS0M2NENsQU00TG1YRVQxeVFjN2VyTWpEalYxWkYtNjgzMGxLa1A1TjlZdkhzYk1vbF93LUszb0JkV0ZtcS0zb1pPTEZUcUJ2dzFCZ3VqTEN2RVNjckszTXFxNA?oc=5
2026-02-25	Google	0.0	How Investors Are Reacting To GE HealthCare Technologies (GEHC) AI‑Enabled, Helium‑Light MRI Platform Push - simplywall.st		https://news.google.com/rss/articles/CBMi4wFBVV95cUxNWUFsaXFTaGgxSkk5RXFTbUJxOEwxNkxWOVVGU0ZmN2h4UWlhSVdnRkFTSy1mNUQ3SmZxekVQc2FEUmVDVTNMcmYxUWpfV3pEaS1pYmc3LWJDbUFlMHRFTzdyVk9vNEVXRHZtVkpQXzQwOUZ3U1AtOWJDUlhCUzMyUFBxeWZQcTY3cW9ublBHUVY4Z2wzMlVWS1VZRERXTFBCaDRveDJLVTM5MXhQQ0tHZklCUWJOOU1fRE56bUt0UzZTeXNUQ2dUb0x0amRuQnRMaVFTVnFacWk4UEdZWVl3ekRwa9IB6AFBVV95cUxOZjZIblF4WVZvSTRZYjBSSFVtQW9Va3FLQ1lPeWw3WG1SY0tnVmZHVU5QTnVPX0h5RW1pUkxTcVg2WW9FaVhZVW9lbkpLSmxVQnYxQkozTE1pdXhLTjJtYi0xeEVYMWpzU2szMHVVNDZVNWFFZkRsektoNFIxcnF3NWpfUmdnemljOGtVWGVVODZ0LWlPY2hfVVhESEFnQzlPbzJ5bXJaMGdXRUlsYnZlcGRKZDVDa0J0OFpaZElKcWxBcGRYaFM2NWdwS3FLSU1HQlYxYVdBREEzYTJCYk52QWM3eG54MjFu?oc=5
