Date	Source	Sentiment	Headline	Summary	URL
2026-02-22	Google	0.025	How General Electric Company (GE) Affects Rotational Strategy Timing - Stock Traders Daily		https://news.google.com/rss/articles/CBMi3wFBVV95cUxPN2c5d0ttY1VqYnl3aDlQUnJPajR0aWxvR1ZzbVM0Q25rU1QxSFMyaXJ0UXVScG5MQXhHdDV5cHE2N19ETFMtMWx0QjJjWGZCcnZqcVFiM0xRdXdXeXBRYkkyVHlHOEV1LVVENXBiTUVaQUhsZ0FOb18yYzVQY21Ya1dvakEzZ0hqU3oxenFEZTAzQ3pPU2FrbWxrTEFpOFZUN3dfTXRnTlRxY2dJakJmSlVadnYtSDRuMjUwWDZHcGd4NGhNZEpyLVlZcTMzTmpZTG4xbml1QXAzY2tkeU4w?oc=5
2026-02-22	Google	0.0	GE Aerospace $GE Stock Holdings Lifted by Hillsdale Investment Management Inc. - MarketBeat		https://news.google.com/rss/articles/CBMi0wFBVV95cUxOZEI2YUZXMVRzeVJFQVJhcnNGTWFCTGVmZEdxUmI3MG1KbEFqQi1MZUl1Sk41bjVacElKNm1vNFN6cUM4Wkk3Zi1MZ2FtYVlXQTZEaFl4Nl8zYXdnNEo5WmRWMm9nbTdqMVRoWTYtVGlUaXdGekJLOFhfU3I3QTg3MHMzZnBsTzJDSHVBLXIzajBGMElqV3pjcy1nYUdkb1VPTFRuOTZCbGdFdFJqVDRpZlNna1pRNWU4VERmWC1KandTUkRBRFpxX1A4dE5QczhqcVVZ?oc=5
2026-02-22	Google	0.0	Sigma Planning Corp Trims Holdings in GE Vernova Inc. $GEV - MarketBeat		https://news.google.com/rss/articles/CBMiuAFBVV95cUxQUzRKZk54ZnV6bWFQbTF2RkxUVVV0RVo1T3pXNWoxQjJKazNuZDVwSjVaTmVNLWdZTkN0Q1NObXVqVGVYV3U0Ym5Bek1USHFJNGM3LWZDU09KMDc5RmFIYTBwb1JybnhOQS0yRG5hQ2o3aDRHWVJCdHNnY3FQbnluckF1WE5fSDdrMU1menJndTFHR1BSSlF3REtfX05Xd2lwa1dVR3RKR29idm9vdkx5UFoxZUdxM2NB?oc=5
2026-02-22	Google	0.0	Tredje AP fonden Takes $9.04 Million Position in GE Aerospace $GE - MarketBeat		https://news.google.com/rss/articles/CBMiwAFBVV95cUxNcW5JMUVvUTgxai1yaHJIRTZIakwxeDlLb2p2blZFVGlDak1hSXFjUGFkNU1VYjFlclpqdWZHX2U3MWlTd1lVV2U4b3dLd1drcDM1bzRERXZtWTlWSmhhempuTUUyRzNnUVlHampFRklWQU1KUTFVTlpENVRsRUFBT21KZ0NCUUs4QTZCZDl6QzBiU2NiQjZEN193N2JKY3o3ajBBMWxpUjRsN3hfZm02djJNaHFuWHpYYjZQcXZScTc?oc=5
2026-02-21	Google	0.6	$GE stock rose 8% this week. Here's what we see in our data. - Quiver Quantitative		https://news.google.com/rss/articles/CBMioAFBVV95cUxOX2JXTF9VeUZDc1o0cGE3dkRxQ0dLOGZ4WVBnUlQxWDFacVlBa0VKRVE1N0RBMGZZNG5MOE5Gd0ZraXNlOThQR2w4SmRJVFdjWmNzNXAtb01HYzM4NHNDQlBLOXAtek1Sb21qR0txMHpUU25yN2ZvQTlyRFpadVhBWTE1SjFVZklTU2ZEYlB1N3l6NWZFVTFfcHdNclp6QzM2?oc=5
2026-02-21	Google	0.0	GE Aerospace (NYSE:GE) Lowered to Hold Rating by Wall Street Zen - MarketBeat		https://news.google.com/rss/articles/CBMitgFBVV95cUxOcjI2WkVfQWR4cjRabW1uTkdQQ2tyeUV0a0prbTNkTHVIVjliR2QwVWRvSjlvcXBJeTczN2F0QmdsOWVRYTQ3RWhzWDFjNk8xaFlqeTE5R01GaUExckJqdGVnUVltVFlSaDN6dGtTd2N0dXpfTmx3ZERKZmZReFJCaE01dmduQ3lNQlNRQzZaeGFmVEpKa2pzaE9wM05HVVZYSkctblFNLWc4R1BaY1U1dDg4anBSQQ?oc=5
2026-02-21	Google	0.0	Journey Advisory Group LLC Raises Holdings in GE Aerospace $GE - MarketBeat		https://news.google.com/rss/articles/CBMivwFBVV95cUxQb01oSzdsS1VmR0hBczdJWUJ5RmFJV1V1Y0JxamZQakc4ZjB5Nm55ZWFFbHZaTFFOa1dGMS1oUGU0YWlWc2x6dUFqVkVuYmxkT3R0U3JFSE5Td2E1TmVSNWdyWlRleGNRTFlJTkNrVEJydTZGbEFER19yVG4yQWpGU3p6V245UjFKcEViVWpqYTFzOXNkd2ZtTTZ1OGhYdnVXVXMzQWRnYVMtaS1XVkR0Z2pydENrQmRzTXNqRU1rMA?oc=5
2026-02-21	Google	0.0	PODCAST | Healthcare’s AI Inflection Point: GE HealthCare CAIO on Building Systems That Fade Into the Background - CDO Magazine		https://news.google.com/rss/articles/CBMi3wFBVV95cUxOTFdrdk1RMWNGSENRdnVlZWpab2pvWHk4cEd0a0lUYy1ydlNGY2NXZXllOXVtTVU2SVVCeTM0dUFpUlJLbUJiTk9kaHpWQ3hXMTJxelNJbHFBQUhyN1ZoaXdrVms1bTF0MnRWaDViYjM3dDk5akY2Q0syaDdDYnhCTVBabktFekhxQ3QwYnd4bnE4Y2NvNm1pT0pfWVBuY2RGUjdhbVNMYXlETm5tNkJnTnRmQzJoYVgzX3lQUlpmYXBuTk9xYTYzQU5DSEpxTW5fMVBFdmpLYzRyc2dzczJB?oc=5
2026-02-20	Yahoo	0.5	Walmart downgraded, Etsy upgraded: Wall Street's top analyst calls	Walmart downgraded, Etsy upgraded: Wall Street's top analyst calls	https://finance.yahoo.com/news/walmart-downgraded-etsy-upgraded-wall-143958782.html?.tsrc=rss
2026-02-20	Yahoo	0.45	Morgan Stanley Initiates GE Aerospace Coverage With Top Price Target	GE Aerospace will exceed Wall Street's consensus estimates for earnings and free cash flow through 2028, according to Morgan Stanley.	https://finance.yahoo.com/m/7ba6ba5d-a745-36f7-956a-37004ca1235c/morgan-stanley-initiates-ge.html?.tsrc=rss
2026-02-20	Yahoo	0.226	Why VIS Gives Your Pure Industrial Exposure at 0.10% Fees (Not for Everyone)	Manufacturing value-added reached $2.95 trillion in Q3 2025, accelerating at 3.2% growth after months of cyclical weakness. For investors considering concentrated industrial exposure, Vanguard Industrials Index Fund ETF Shares (NYSEARCA:VIS) offers a straightforward solution: pure-play access to the sector’s recovery without the complexity of options overlays or leverage. The question isn’t whether industrials belong in ... Why VIS Gives Your Pure Industrial Exposure at 0.10% Fees (Not for Every	https://247wallst.com/investing/2026/02/20/why-vis-gives-your-pure-industrial-exposure-at-0-10-fees-not-for-everyone/?.tsrc=rss
2026-02-20	Google	0.2	GE HealthCare Wins FDA Clearances for Next-Gen SIGNA MRI Portfolio - Nasdaq		https://news.google.com/rss/articles/CBMimgFBVV95cUxOWWhMNTVkUFEta3MxbHdNWThiNUlzMGFpanlFdHI1ZG1fblFCbG1aUVZxX0FZeGVsNmY5d3BEWlpxTmRRN2l4ZE1wUno0ZlU3VHNXa3NmYXk0cjVlSjZFRlJfRU5ic3NiRDlFMG82SHJMc2NIXy1UVWtqRWxnTzdyOHRkdVY0NjIzOW9GUFhBU3dLZjltcWV2MW9n?oc=5
2026-02-20	Yahoo	0.188	Starfighters and GE Progress STARLAUNCH Platform	"CAPE CANAVERAL, Fla., February 20, 2026--Starfighters Space, Inc. (""Starfighters"" or the ""Company"") (NYSE American: FJET), the aerospace company, owner and operator of the world’s largest fleet of commercial supersonic aircraft, announced today that, after successful wind tunnel testing of the STARLAUNCH I rocket design, it is moving forward to Critical Design Review (""CDR"") with support from GE Aerospace. The CDR is intended to confirm design maturity and support the program’s transition into i"	https://finance.yahoo.com/news/starfighters-ge-progress-starlaunch-platform-130000912.html?.tsrc=rss
2026-02-20	Yahoo	0.184	Here Are Friday’s Top Wall Street Analyst Research Calls: Amgen, ETSY, Eldorado Gold, GE Aerospace, Merck, Southern Company, Walmart, Yeti, and More	Pre-Market Stock Futures: Futures are trading lower as we wrap up the holiday-shortened week that gave us a little taste of just about everything. While Walmart posted results that beat expectations, its forward guidance and outlook fell short of Wall Street’s expectations, and the stock was down from the opening bell to the close. All ... Here Are Friday’s Top Wall Street Analyst Research Calls: Amgen, ETSY, Eldorado Gold, GE Aerospace, Merck, Southern Company, Walmart, Yeti, and More	https://247wallst.com/investing/2026/02/20/here-are-fridays-top-wall-street-analyst-research-calls-amgen-etsy-eldorado-gold-ge-aerospace-merck-southern-company-walmart-yeti-and-more/?.tsrc=rss
2026-02-20	Yahoo	0.183	GE Just Hit Another Record. No One Noticed.	Thomas Edison would be proud.  There is, of course, no longer a single General Electric.  With GE Aerospace and GE Vernova recently hitting new 52-week highs, the combined value of the three companies is about $620 billion, up from about $540 billion at the end of 2025.	https://finance.yahoo.com/m/0705d594-51d8-322a-b028-29baf24d184c/ge-just-hit-another-record..html?.tsrc=rss
2026-02-20	Yahoo	0.175	GE Aerospace gains after MS starts stock at OW on aftermarket demand	Investing.com -- Morgan Stanley initiated coverage of GE Aerospace with an Overweight rating and a $425 price target, saying the market underestimates the its long term free cash flow and pricing power. Shares of the jet engine maker gained 1.5% in Friday premarket trading.	https://finance.yahoo.com/news/ge-aerospace-gains-ms-upgrades-140736580.html?.tsrc=rss
2026-02-20	Google	0.16	GE hits record high as Morgan Stanley starts at Overweight on durable services growth - Seeking Alpha		https://news.google.com/rss/articles/CBMiwAFBVV95cUxQai13MEl4eHI0ZURxNHlaZjBSY2kxV0ZxczNyY1RuME4zdnExdlZodmJMRlBWbzI4MC11RFRzWld3Q2RjUGJjbmhOVUlHLWt2Mkw2cF9PNDltcEpvcjRyYWZDWHpJRHV1eHRLNk5BME5ENUhJMmVnTDI4cjJFcWNraEFMSXFkbWFaazEydVV0UGdnUG80TUplSTg0emVHVEZ2bEZreVlIeDBJX2NJaktvWGdCQlotRGZtcF9aVFEybjk?oc=5
2026-02-20	Yahoo	0.15	TransDigm's 47.2% Operating Margin Crushes GE's 21.4%. Why Does GE Still Get the Higher Valuation?	Airlines need planes. Boeing and Airbus can't build them fast enough.	https://www.fool.com/investing/2026/02/20/transdigms-472-operating-margin-crushes-ges-214-wh/?.tsrc=rss
2026-02-20	Google	0.136	GE Aerospace $GE is New Millennium Group LLC's 9th Largest Position - MarketBeat		https://news.google.com/rss/articles/CBMixAFBVV95cUxNNnJtNExETENwckpGazVsVkNyVnV3UXZORFZ1SVNtc3I1eFdXeFZ2MHFjM3JRdVIybFhyWWd0TWQ0S0VwQWxPVk1vMzZqeXY1WjdZN1pPYzEtTkllWXo4dVRzaTJFMWVHX3RiTUduOVR5WWdtNHUxSm1nZ0dXeXFORm94SGxMS1JjaHNYYlJBWjliZGh0TkNXX0hoV3dUeHZlYUtnQ2JLZ214RDVNV3VnRDN1aTdUaEFGcDZXUFlvZUVYQjZs?oc=5
2026-02-20	Google	0.091	GE Vernova Inc. $GEV Shares Purchased by New Millennium Group LLC - MarketBeat		https://news.google.com/rss/articles/CBMiwgFBVV95cUxOa3VuanhyMjFYXzZhc09lMnE1R01jMHA2cWp0TmZNdTNULWdqQU02MHhyQUw5RXhVcEtpYkZNOTVtSV9fV1Y0RHN4eDJJNDR6VnJ2QXZBeFVvemtSX2wtaGJJLU1BcTZ5TEFESFZQeWtIRFhqemxEMHp6U0YxWFgxU1lPVXB6US1pek5La00zQmdOazhRYWZyd3BqcC1lVzdHQmwwOE9GNzdneGZUaU1WTzVfNTlzRzFQcVdpalJsQVVKUQ?oc=5
2026-02-20	Google	0.08	This Aerospace Stock Got A Big Wall Street Nod – And It Is On Track To Hit All-Time High - Stocktwits		https://news.google.com/rss/articles/CBMivAFBVV95cUxOM2pzOWZuMnlZRFVGUWxFMU95ZEJ3dERMVWpvZTdXLU1WNW9ESUFsNVpzQTJhaXg3bW1hbHZlWmNsZ0o1ZjhmbkpSYzhWM0RZZVIzNWJDcEVER09KMjd2ek9JdjJQbDRqbWRkQ2RWUF9tbzkwbG9hWjRfcURBWHVRNDZXZ3h2NmMySmVON0FscEdmeW8yS1lTbW05NnhrMUtKa0RuV3JJVzU4NTdVWXFzOXV4cEF2cElIZENiQg?oc=5
2026-02-20	Yahoo	0.068	New Aerospace Stock, Up 75% This Week, Lands Support From GE Aerospace	Starfighters Space partners with GE Aerospace on the next phase of its launch program review. Shares rallied 75% this week.	https://finance.yahoo.com/m/5da841b7-280f-38dd-a623-99ef09c81bcc/new-aerospace-stock%2C-up-75%25.html?.tsrc=rss
2026-02-20	Google	0.068	New Aerospace Stock, Up 75% This Week, Lands Support From GE Aerospace - Investor's Business Daily		https://news.google.com/rss/articles/CBMikgFBVV95cUxOc3ROd0RaY1VyS1Qyd2JYQ3c5MTRIOVBOc3ZYNE9fLVBIZkQzUzA4VG5ndHAwMHZsS2RYdlU1U2VheDNmZFB4RHlKUVhRZ0VSRTBoRWF4dHhQTXVMZGxOYXptX1lkYXc2Qnhrb0x5RWloMEpwM091bDNtTVNXWjlsZHl1LWk5VnA2akppMVJTMGhqdw?oc=5
2026-02-20	Yahoo	0.039	Three Stocks Flash Triple Strengths; A Data Center Play Is One Of Them	Three stocks were flashing strength to end a week of volatile trades in Friday's stock market.  All three now are scaling new records as they hover in buy zones with relative strength lines at 52-week highs.  GE Aerospace is in a buy zone above an entry at 332.79 as shares also hit an all-time high.	https://finance.yahoo.com/m/ab59a9ca-6cad-3fbd-a7c7-cdf77d437351/three-stocks-flash-triple.html?.tsrc=rss
2026-02-20	Google	0.0	Aberdeen Group plc Purchases 62,263 Shares of GE HealthCare Technologies Inc. $GEHC - MarketBeat		https://news.google.com/rss/articles/CBMi2AFBVV95cUxOSWZhQ29WbUtwUkMyZTh1OFJtMlpVMjV2LXJTMEc2a0JUNmdXd1Y5Y3ozTGJFLTdsaEZpOV9SLTl3VHVtS05Da1lVYWd5eE1GcjM1WUpnOVRaNVVPU3UxWEFvSFRJNUNBM0VubmVFa0RyRDFoSERTR2JfSVBtNUxLZjVXNi1fT0JUSG1YZ0pKYm1pMjR2ZmNBQ3E1UkRpTW1ISmlScGlhSHlvWUt3MFFVczM4alppSWNZWTUxVDZGUDlNQmt0N2lkWnQ4UnhpbVRGOVVsdUNpWVA?oc=5
2026-02-20	Google	0.0	City and St. Mary’s team up on GE Field - Itemlive		https://news.google.com/rss/articles/CBMiekFVX3lxTE1iVm10U1hfcXR6ckxRT2c3VE9ZcEU0Rm5fd2Q0amlsRlJ3d29GRVluejZBdUZMcHdqSWRSYmNCUXRWcjV4SE5iblBFamlwNFBLZWprRnVYMS1jVkZCZDhFX2lMb3lGdHlzbm00MHZTT3U2dEx3bmkwTlB3?oc=5
2026-02-20	Google	0.0	GE Aerospace $GE Shares Sold by Factory Mutual Insurance Co. - MarketBeat		https://news.google.com/rss/articles/CBMiuwFBVV95cUxPRkZQeEYwaksxY29OLTZ5R3VMNUpfb09UamV4R3NXYy16MUZnaGhRSl9MR1NyTHVyNVhIdVUxWm5vSjh5X1M1MXdOdE13X0NVU2QzZzhqZlVjd252S2xqMTVHNlVhaU9KZTZpNEFHSmlRdDVGZFFkTkhOZnY0cVhOODJZSUtvMGtEQjllS0Yyb0RUN04xTjFwc0xPem1MT1FKbGs1ZmVsUUVqSUlpR0xReFQyb0xZSkhsYXhz?oc=5
2026-02-20	Yahoo	0.0	GE Aerospace Flies Into Buy Range With Its 'AI Wingmate' In Tow	As GE Aerospace taps AI to enhance inspections and predictive maintenance, GE stock just flew into buy range.	https://finance.yahoo.com/m/528e0730-a182-3e6f-8689-275d49b94c73/ge-aerospace-flies-into-buy.html?.tsrc=rss
2026-02-20	Google	0.0	GE Aerospace Flies Into Buy Range With Its 'AI Wingmate' In Tow - Investor's Business Daily		https://news.google.com/rss/articles/CBMiuwFBVV95cUxPMzRHSms5ZktZZUExdTVJTjFWOGs2WjNrSWlYdld0T3Y4QTQtRUg5Wi1GbnN3d3ViY2pKXzhDUlBUblBOa2FCYUp3bHZRaDFNNkRlN2NlckpYS2J1TUlXQ3FFMVp6NGpUWmZQaDU1YkxWWnl1SnpkZ0dVeURDS0JQVTl0am1SWDExM1M3cmVZbTFSTVdQVnhvaDZuNkRURXZUTUZ1MVFRUVBad1pBb1FYel9aV3hsSVNkYXpn?oc=5
2026-02-20	Google	0.0	GE Aerospace Stock (GE) Opinions on Morgan Stanley Overweight Initiation - Quiver Quantitative		https://news.google.com/rss/articles/CBMirgFBVV95cUxPX2p0QkFaWmhKTUJqTk9xOFQzbzhBZjJzbUlRcnN6SldIX0hVaE5zeHB3N3M3cG9ucFE1b1QxZEY0MDFkVV9PSHV5eXVrTnlnRFpNelc3ZHNnMDVvdzJsZDY2VkE3WXptcHRiV2Z1N0FBR1ZhRURNTDlqMmVpS09xTGdQbmt3ZEhzYTlwcnVSLURyUlVudWxFR3V0UUN2M1dUZU9Wd2pQS0E2RV9Uc1E?oc=5
2026-02-20	Google	0.0	GE Aerospace gains after MS upgrades stock on aftermarket demand - Investing.com		https://news.google.com/rss/articles/CBMivgFBVV95cUxQTXJhMXI3Uzc3NGRRYkNGVG1zdF9vM3d4aEgxNWRrRWRUZ21Ba3VYT05PTUNFY3Jwb1MxemxrekU1Z1lfVy01aGtuR1ZtTkVjcTRtdHdzNkFkNGRqbTNrSVFOVjNsRV9zUHAyY21hOWlyZHU3WUdpamRWcXJfQTNBODZIQllZQU5WWHVieE1EQ0ZaR3hXRjduRWZoSk92WnVFeXZrMkFYWTdfbWJzZkFnTUd4dnNTZ3VyY2k2NE1R?oc=5
2026-02-20	Google	0.0	GE HealthCare After Triple FDA Clearance: Here’s Where the Stock Could Go in 2026 - TIKR.com		https://news.google.com/rss/articles/CBMiqAFBVV95cUxOakhzclY1aFRPLVRHWFdTN3JrUlZSOHBEdFRKTkI5S1hydzJST3U3Mjc0NGhkdy1LR1JXNU1VZFNWWjVkUmJtQUxrdlB1WkJKWHdhU2pwNnplaElhWkdhaXN4RTBlZ0J4X2pSMm4zcVJmNWJGSzlRZEJwMk1PNWNiRWstVmktR1BMalFoSWNsbUVJNGpiaHp2c3J1UDNscUgzMnkxM2t3bVA?oc=5
2026-02-20	Google	0.0	GE HealthCare advances Signa MRI portfolio with trio of FDA clearances - Medical Device Network		https://news.google.com/rss/articles/CBMitAFBVV95cUxPZm1zTmV0WWU1WXB0a0p3b0gzMFJMSWFkY19RR05fVW1nd2x3TkhiNGlZMU1mVmRXNVdTZ0VmUk82cTJqZUJUX1FLTEJIV2RrNzJNRnJnNDNnM0VxRkNlNEFJSC1vMmZNSEFMZmxsdGpDUWxFODRWNkpRZFpCa0wwamcyajZVRHBmSUFSR05JVEVXdmtlNzNfYk45WTI0ZFJTVUUtdE1QNmozQ3FKTXVVaHVfdXI?oc=5
2026-02-20	Google	0.0	GE HealthCare's SIGNA MRI Portfolio Granted FDA Clearance - Imaging Technology News		https://news.google.com/rss/articles/CBMilAFBVV95cUxPeXB6ZVFzMDRYeTVVNDVwMEdqTXhnU1E2aHJvTkhpdGZuYkgtdzhCTXEtZmhQM19aWTBuSk5QUG9lYTYzZEIxSkRVdFNLYUVUcGpxT1puYjA3WDMwZTJVQ3FoN0YtSTA0enRQS2oxUWtHckFfc2tUaGVrUk9BZGFaQktKbkpCYmRaekpaR0phMGhHanJ1?oc=5
2026-02-20	Google	0.0	GE Just Hit Another Record. No One Noticed. - Barron's		https://news.google.com/rss/articles/CBMikANBVV95cUxOelBBWDJPU1V6VXk3empCRHoxM3ExM2NGb1pkbktLaVdxbWZWYTZJZjFBeGV5VHJRZFh0RmR5VlFsdVZSa3VURG5aMm9EWnBQTktidEREZDhJWks5bmxxLWdxLUl6YVNEbDB1d2Y5dldhMHYxd0lnVlJ1OWdjMWE2S0V6WHN6Tm16b21PV1hxdGNUdE9jME01YURiZkdFMUF3Y1BPN2RuYmZWa3AzUjVCZjVOQUZGMkxDUnNFeU9NaDJpcDh5aVRkcm9mY0o0Q09MaW9BS2R4b0FYM0xPNk5PZzdRNVhaN0o1ZGh6U1VILVZmdVZUQldkNDBkb25QTGtSM1BPbktQUXEwTGdrQ3BELVNTZU51cHhJem1JTjc3UmlBcm1qT0VLVWxVMWFDY2lpOEhrZmRzS19pRUx0ZnpTTHJQNGxKUWpoV05wMmtiX3BvSXlLUzJxM0pidWRuTmVYWHBBLUJOWk9GNjRQbUZkQVZtUFpoQm9icllfc0plTlZ3MHE5Z0hKYkZLNkJJT0t5?oc=5
2026-02-20	Google	0.0	GE Supports Starfighters Space in Rocket Design Progress - GuruFocus		https://news.google.com/rss/articles/CBMimwFBVV95cUxQeV84TzM4RU1xYW12SUlBUmRhOUdqa3ZOUkY5bjFSbmNDN0lYV0R1bmRoUkZVMlMzTkEwZTVCYzZZNFA2X2FkN0Ixdlp4SzZUMnVubWRrTjZ0SDJTRnVoYkNIV0JEdTVmc1lCc3ZBR2ZhYm1ZcDd3bFdyWGV6cjE0Y1BEN3dZaTdLcmwyVDRLTDFhcW1WOG5FNHdsMA?oc=5
2026-02-20	Google	0.0	GE Vernova (GEV) Upgraded to Outperform as Energy Infrastructure Cycle Boosts Growth Prospects - Yahoo Finance		https://news.google.com/rss/articles/CBMihwFBVV95cUxOUmZGU3RucmptRERwQlFpdDVOams2QXRKVXFUOXVIRVd0SEFkU3Y0VTEzRzNJdEoyajR1a1dweV9CX0U4S3VRVU03eDBONjZ4ZmZ4ZXAtNEpQWFZhSzhRcHR4M3pvbmN0cHFuM3lZS25TM0VqUVR4NGNZVjlNRWdGcm5yXzE0enc?oc=5
2026-02-20	Google	0.0	GE stock price rises as Morgan Stanley starts GE Aerospace; American Airlines keeps CFM LEAP engines - TechStock²		https://news.google.com/rss/articles/CBMivAFBVV95cUxQYjE1WWRzMWZmQ01Wbjh0ZXZTYUpERTl2TWVPVG03NlZZYkNpWmRINnFjWGVGc3dHcHpib3lOUjlybXJvWjU0TVBpMjVRdVNpWTFqc1ExcXlQMjhKcW5hbFlrVGFWX1pPY0tIaEtmWkd2TVFHdkFpNENUOXRkdU5Kek95a0U5QVBMUlA4UlpoaEozYVdMQ3hndVVkeGdWWU5xTDhJS1gzeDV0bHYzYkxvRTM1UWZEN01CUlI0bQ?oc=5
2026-02-20	Google	0.0	Gisèle Pelicot Picks Up the Pieces - Air Mail		https://news.google.com/rss/articles/CBMibkFVX3lxTE0wWEZUTTl1cEMzNTBLQ0VtNGhLMGZGRi1vNm5YVXhGMmRmbFpNRk83ZXBSRjFha3hBMkhXZjZnRlFZM19LLXA5aDNyT21EMzRZUy1lLVEtNElKUEotWEJqM0REWFp2Uk9panRrZ3l3?oc=5
2026-02-20	Google	0.0	Greenville Triumph delays GE Vernova Park opener - SCBiz		https://news.google.com/rss/articles/CBMid0FVX3lxTE1kbk53dmN1c1F6bGs3OUYwMjhiZzF0Rm85U3E4UTRJNVd1NUVkVVh0TFQ2cENYXzIydlpxWDFDTmNkQTNJZ1FOaFRvZ180NnNhU2dXQktUck1SdUp4ZGc0dmc3bDR1N2JSOTNpQ0tFUFc1TnZwbjVF?oc=5
2026-02-20	Google	0.0	Morgan Stanley Initiates Coverage of GE Aerospace Stock (GE) With ‘Buy’ Rating - TipRanks		https://news.google.com/rss/articles/CBMipwFBVV95cUxPc3BjNkctbnk1LUNGS3BlM1I1NXR3cS1QZUd3VFhwV2pTa3ZZYzhRYkVzMWZXWkdYdGhtVjBBZ3k4Ym9TVTlZUHBGTUdtS2xWMnBkMnR0VUI0dUlER0ZONmdSWWdLMHRIMXg1aVhEbWNvN2hsdk1wUW41R3VxQWdFZ3hNbkNKRWE3cUtGU1QyUlpBamdYLXFUdUJEUkltYVYyN1A5TXB3MA?oc=5
2026-02-20	Google	0.0	Morgan Stanley initiates GE Aerospace stock with overweight rating - Investing.com		https://news.google.com/rss/articles/CBMixAFBVV95cUxPdUZEY05qSHQtRUJ5aEFCZ0NNR3dIcTVjWVlSbHAwMDdybjhOa1JETTB3WGNOdmJzcVA4WWFZMzdrMFBFbk5BMlpoel9NVzZtNzF6c2h2V1lyaWhUelI3R2VHNzQ3MkoyUnZ1QzhqYVZiT2h0TkdfSEctLWd3TGJROXlpY3V3S0RCdkxBTjRyLUJZUkpoQkstbVJiTUswU3Bhb0Y2ZUlJeEJscm0yb195eW5xYVVlQVV0MDhpZGU2S3o0LW43?oc=5
2026-02-20	Google	0.0	Starfighters and GE Progress STARLAUNCH Platform - Business Wire		https://news.google.com/rss/articles/CBMiqAFBVV95cUxOVWFvamdpRklrTjhVbkRWYzFGYlFtTzR4cEpFQ3l2aVRNY0FRTnlEcmNUWUN1Snhnd05FR1poZXQ1VXNKbVpfRkxKWEVUTjE0SmdpWlBicXpjMk1mMmhrT0FqbTcwWDBlVFpDbGRwV0xoUlFhTmRmdHVFZkR3S0NJazJXUXlPQjVPSzl3RGk0a09jbnhwOHczUWZVenI5UnM2Q0NETm1NeEw?oc=5
2026-02-20	Google	0.0	Starfighters and GE Progress STARLAUNCH Platform - The Joplin Globe		https://news.google.com/rss/articles/CBMi5gFBVV95cUxONXl6OE5JNGtSMFVGbFJlYnBEeDhWR0s3U3pHeVhCTTZTNklUTHQ0WGRseGk0X3hqemhkX18xZXZhV2FlcGQ0RFB1Y1Q0WHJxbXdCTVlXc0FuRXFxOERUcFBQY2x4TER0WHpsdFQ5ZlBqUlVDSld4OGVkTndESEpYdi1NSFRBLV9kYzFmUGZEUkI1c0padkxYZTRhT3dOQXlXNGtmMjB5SlZSY2pOREZraXoyZGJHUTBjd3F0SGZ0dC1rRWROWXNhX0xXQmdWM1lkVXU5NUFmLUZ5SFVLcXJSWVlMLUlnQQ?oc=5
2026-02-20	Google	0.0	Starfighters and GE Progress STARLAUNCH Platform - Yahoo Finance		https://news.google.com/rss/articles/CBMilAFBVV95cUxQMFdleS10THJZdm5sLWNCSGc5T0pkS2NCampDU0Z2YlRUT0JoS3h5bjBBb2UxR0lXSXhJWkRUOXZxS2tkTjQtRTdoRFRFRGJyRjRQckcxZ3J3WHppUG1pMGRfMC1SeXNaZUNoTl94aUhLTUJxaWZLaDdsSkVUbDByUW1EMXF0WXNlSHR5SjNXdll2UUtz?oc=5
2026-02-20	Google	0.0	TGC GE Unveils Acquisition Slate & Promotion - World Screen		https://news.google.com/rss/articles/CBMiggFBVV95cUxOQnZwenJleElYcWt1eDh6N3R5Q1lJYXN1bWowZHpjczdvOTNiSHE3dDdPZzNobTNIc25OLTdNQ0x5YW1lVTR0UXo3bmo5amdVZFJkc3gwMmJXVGRwaGlIOVkwREdES05FVUtqckxYOFRhNHhxVlVnOHN6QjFMOU5kV3dn?oc=5
2026-02-20	Google	0.0	What's Going On With GE HealthCare Technologies Stock? - Benzinga		https://news.google.com/rss/articles/CBMiswFBVV95cUxNWnBHUVdKMXFoQ1NuMUMwcUZrakxGOVNqSThUSnZVYnpxQkJIVU1pTGxWbG1HZVJ6YldCQnpVak9ZTlRQb1ROWTdFbi1fLTk0Y3pFTktGcmhXNnhqTWV0dDV2N1N1cy1pNWJHU1I0YlBxdEV6OUEwakV3bnVJWGw1bUppSE5oeWU5MXVVcmlOREVZVHJXejZ4eGVHUHgyaWhxUjhZMlVJNkVkVUR4dVI5VWtINA?oc=5
2026-02-20	Yahoo	-0.004	Dow Jones Futures Fall Before Big Economic Data, Possible Trump Tariff Ruling; AI Leader Climbs, Cancer-Test Firm Crashes	The stock market fell back on U.S.-Iran fears and other big headwinds. GE Aero led new buys, but there's no clear trend. Comfort Systems and Grail were big earnings movers.	https://finance.yahoo.com/m/47756834-4e30-3cbe-b375-51e97242a8bc/dow-jones-futures-fall-before.html?.tsrc=rss
2026-02-20	Google	-0.4	What's Behind The 2x Rise In GE Vernova Stock? - Forbes		https://news.google.com/rss/articles/CBMipgFBVV95cUxPLUVpV3Bfd0dDd3hVR1lkZllXMWdnd3ZQaFY2RUZvcE5RSlNLRWdhSk1YakNlSElyV0FaczJRYm1UWG1HU19XSWtPZkRORkZ6UU1TdDktN1g1R2lvbHFWSmprQkdidllZenE3dFhCX3l0RnpLd3VNNklGMmR1U3I0T1RxQ3lsUTVURW9rM2twWGtuM3FlOXNlcFVpZnZ1Sm40ZHJ2S0x3?oc=5
2026-02-19	Google	0.8	Addy Brown makes return in Iowa State women's win over Arizona State - The Des Moines Register		https://news.google.com/rss/articles/CBMijwJBVV95cUxQRXNSeWVoN3V1Qy1qM0dTOXNkWDRXbmhPSUZvOWlvNTJRMEhGVXV4NER2ekY3LXhGa0NDemlRX2I4ZTNEZmxpNDlnZnVHaXZHTUR2ckVsaVJBZkNMY1VXNkM1amN1WjRXRWJuUVRKMGoyVVFBTHNpWkt5UlFoRWhEQ1lSNGZweVB0RGZCQlYzOVZZMGVhSzFOZ2ZkZjdnUDF2bVVQOW5SZ25FcE9GX1hFTllZaVFTVE1fT3lmdHhSd1ZtR3A4cEZsdmo2Wl8ySDBoTXk0WV9MR2NZWW9sNmxxNS10UEtPb1VXWF82UGk5WWhnMWt0S0cxYUQzT1VhZzRHN2JfX3huTEg2Z01Dd3JJ?oc=5
2026-02-19	Google	0.6	Snow, ice, groundhogs. Oh, my! Freezing weather inspires a warm meal - Bergen Record		https://news.google.com/rss/articles/CBMi7wFBVV95cUxNTkJZbTZYMHU0dm53UkhnbUQwT1RiS2NkMlBMU1V1MDA4Z2FsVEU2U3FpMkV0UHNmMTdCWGd6OGVja19jeHFVTFYwWlhzTVFCdi1RcWFUMjhvTmctc3kyUVN6N1ZvOUU4dVRJa3lYRFlUOHdhMTRNTm9OWGNzVGQwcjRyOUJiaTJrSFphYUNUNlJpajc2RHFGOFVhWUd2MUxmLS1Fb09XTVhqeVpVdWJkZkhnNXlJT19sNGJSR0J4TkxxdncxRGdobmVGQVhwZVoyWFFXQXg2Qm9RNWFMUWU5bU1TOURfMXFQRTZpM1d6cw?oc=5
2026-02-19	Google	0.5	GE HealthCare nabs 3 notable MRI FDA clearances - Radiology Business		https://news.google.com/rss/articles/CBMiywFBVV95cUxONHlhM3doYXEzc2U4ZTFwTnpBUWRDUVVzZjFLM3lIeklFSmFsdjBZMHJwLU9VTEp3UHduakRBcEt6OEFyTEtGVWl2aGpPZkJGc0VsRDNCeEZyXy1pTXE2X2dIcklxUTVDRHlwV3FVVlE2V3VpWFRXT0QxU2syTVAwendfNWh0TWdUUFJWR0h6V2pkR3FnVm1POERPWFBqWUF1c1B1MU4wbjhsalYtWVdOMVhROGVGcVlJY2pnekg4SU96elJYRHBWbnplNA?oc=5
2026-02-19	Google	0.4	Despite dominant win, Texas Tech women's basketball not talking Big 12 title - Lubbock Avalanche-Journal		https://news.google.com/rss/articles/CBMi-wFBVV95cUxOQXpLdVVVWTlnSnRkcFhzVTZoVkZ6LTJRTUpSOTIwemdJS0c2am5yNW5TUTFUUVJjT2lmSkdzUUVTVFBSVk9BQXM0SWNDQjNNQnlYRlRTc2hweTgza1E1OHFjVEZuaXUxYUR2a2RYNVVRRGMwUmdFOXhfU01oTGdWN0oyTzBTTVVvdmV5UEtoRmg2MWRBclpTNXktMWtlTy0wMmhzN1ZXWHlaa1EzR0hnRzAtaFJKWTBtWkQ3NHFrMkQwSGgyOGFnMERabGR6NEowb2VIWDFqc0V0RGkzMnlEUWNQNEZUVFJ6WWpfbUFUZmtSdDlheFV5VXdBWQ?oc=5
2026-02-19	Google	0.4	Texas Tech women's basketball routs Baylor for second win over Bears - Lubbock Avalanche-Journal		https://news.google.com/rss/articles/CBMi8wFBVV95cUxPdUZ6RHFRYWhxVHp5aC1xT3U4bGJUZUtuZWhqeHgyOVM1OEkzWmRlRWw1ZzIwcy14UlFlM0NGMUlJbjBYRW5CLW5vQkVKdFZQLWhpd2ItWENXYXVkbkppdkdNSzhBakczYjhHbWhKbFYtMWR0MWNSSXlHcE5wZDgzZ19jOGYzV1VxaEVWVVltWGlnMVNfS2I1Q2tzck02QXBuYjdQdXpOdnpjZXZ6cHVub2RLZ2NNVEZuOXhIeUhjN2RMcXhCMWg1X2l2VUZNblZrWEpYRlY1ejVTcGJITlpMdGZsRlUtME84Y0ZjZUJ2QnJHTE0?oc=5
2026-02-19	Google	0.371	The State Street SPDR Dow Jones REIT ETF Could Soar If These 2 Things Go Right - The Motley Fool		https://news.google.com/rss/articles/CBMimAFBVV95cUxQbVpEaXhzUnNNeGpOdm1mMTNsTzlCNU1ReDhYMnVOZVI1YzhZVHh1cW4xWF96c0F2OGV5MGpnV0JrVng1Ym1QOXRaSU5wM2Q5RGdDaWVuUUowV295YlE0MTQ5a2o5YUxkTDdmd1pvQ29QQTBlQ3VCWVp5eUJQYmxsQVlIdGx1VWJ1TlZwVHFSVFBqZlJzakgzXw?oc=5
2026-02-19	Google	0.3	GE HealthCare wins FDA nod for next-gen Signa MRI tech - MassDevice		https://news.google.com/rss/articles/CBMickFVX3lxTE84WnpZN0hGemVvQ0gySzZhUnZWamZILVFCcXFwaWlPSF95TGgtNVJ2bHZjY3RSMTFEaEpuTnc5ZFFUZElFeGlTRG9nMGJnOHNTMDBwN3d0aF95eEV1SFJDd0lGSkxHWnhvWmU5V2p0TnBHQQ?oc=5
2026-02-19	Google	0.267	Mikaela Shiffrin Didn’t Just Win Gold. She Changed Her Entire Story. - Outside Magazine		https://news.google.com/rss/articles/CBMipAFBVV95cUxNbGpuQndNRmJ6TVVZNUFuNTF3LXJlcmJOMUxyVUNBZ1lnQmg3cUtXd3d5LUxqUjY1NERXSS1zZDFDZ3V1RnBXQTVlQS0zcDQxWHlPOUdfN1ZzT3E2ckRZazVMTUVSRld2Mnh2Ukg0Tlh0N245dV9TbVNsRTRWRk56aVFHdXhmU1FRbk5RLXEzQUtBclhmcU1HV0J1Rm5fZTRGTTAzZw?oc=5
2026-02-19	Google	0.25	Tell Me Why: ‘We need to make sure we’re investing in technologies‘ — Larry Culp - American Airlines Newsroom		https://news.google.com/rss/articles/CBMikwFBVV95cUxNSE0yMnlSRl9FaUZmM2txX202MzdrLXkzOWttRmU1WUM3aUwzNnRsc2VqVnJNV3FlQWM0WE1lNTVGcHVWcVBqNURxTnlxXzAwQTE3RG9XVmVVNGdtcXV5bXhwb3E0RkQ1QmRpRmxfUUVzTkxwSDhHbERiX20tbGpNVmdzaU9fSW5rdlJLVS1EUjVDNDg?oc=5
2026-02-19	Google	0.244	An IU football fan comes clean | OPINION - The Herald-Times		https://news.google.com/rss/articles/CBMiwgFBVV95cUxPSlk3eGlxOGoxYnVsbFFFZG5DdXl0RDZkWF9aS1YzS09Sb0drTHlyc1h4U2dRbkU1aTlYelJpRzU0UFNGQmpGMEZCcGhZNjBQOFRncThMbGUzM3k5VnJBVm9QR2lodV9BRm9UanBmUFRYdDdzYlBYNFJ5VGZqczVvdGZPeEIycGhHSFYwa2NRbW96TGY5OTNoZmtydkhoSjZSWHczWDBjWC1BWVc1ZmtVcENiV2VsX0Jld0t0N1hsY2tkZw?oc=5
2026-02-19	Yahoo	0.217	GE Vernova Inc. (GEV) is Attracting Investor Attention: Here is What You Should Know	GE Vernova (GEV) has received quite a bit of attention from Zacks.com users lately. Therefore, it is wise to be aware of the facts that can impact the stock's prospects.	https://finance.yahoo.com/news/ge-vernova-inc-gev-attracting-140005122.html?.tsrc=rss
2026-02-19	Google	0.2	Which city department pays the most employees below living wage? - The Commercial Appeal		https://news.google.com/rss/articles/CBMiugFBVV95cUxORXRpRTRrVFVBdjdMZjNOTVB2QksxWERVLUJEY01xZVZGQng3UHhlQnZBeEEyZUozcDZwUGxVZ3JBOHgwRnAxeklMM2oxeHNKTUVjUllLR2MyRS00dUpjSXpkQ2k3TkhFcGdETnpHS0E3eEMza2wtNVJCSTRCbXF2bXRpNmUwSW54Z3JrSHlqTFlMSkw2UjlEM0t6OEZhTkI2WUtKSjFvSHF1Nm8yR2JzeUxRM29KSFZXSVE?oc=5
