Date	Source	Sentiment	Headline	Summary	URL
2026-02-19	Yahoo	0.18	Why General Electric (GE) Is Up 5.1% After United’s Record GEnx Engine Order And Dividend Update	In February 2026, GE Aerospace announced that United Airlines selected 300 GEnx engines, plus spares, to power its new Boeing 787 Dreamliners, expanding United’s GEnx-powered 787 fleet to more than 200 aircraft and making it the largest GEnx operator globally. Alongside this major commercial win, GE Aerospace’s recently declared US$0.47 per-share dividend and strong recent results highlight the company’s focus on returning capital while deepening long-term airline partnerships. Next, we’ll...	https://finance.yahoo.com/news/why-general-electric-ge-5-191157453.html?.tsrc=rss
2026-02-19	Yahoo	0.173	GE Aerospace Stock Wins Big as Engine Battle Roars on	Airbus  surprising 2026 financial guidance goes beyond its battle with  Boeing  It reaches down the aerospace supply chain, in particular to the engines made by RTX and  GE Aerospace  that are under the wings of modern jetliners.  Airbus expects to make 870 jets in 2026, up from just under 800 in 2025.  One of the issues is engines.	https://finance.yahoo.com/m/71541a48-902a-3394-94c0-81c710af5e55/ge-aerospace-stock-wins-big.html?.tsrc=rss
2026-02-19	Google	0.15	GE HealthCare Wins 3 FDA Nods for Next-Gen SIGNA MRI Tech - Medical Product Outsourcing		https://news.google.com/rss/articles/CBMinAFBVV95cUxNU3VjLU9PdTdIQVAyXzkxX1duaXEyanA1c2pGdGlISWFrMUpTNk4xZ3luZzViTGV1OFVOVFpwWjVxMXRCWXNPTC1Tdld3TW1KQ0hCbzdhc1doZkJOaDJhZ3piN3ctVnZXRlYxXzVHOWp5elFRQlZOd2ZsbWM4eE8tWEJMRHJCMENxNFhfV2hndDg3a2hLdGlhWkVuVkg?oc=5
2026-02-19	Google	0.133	How Do Investors Really Feel About GE Vernova Inc? - Benzinga		https://news.google.com/rss/articles/CBMisgFBVV95cUxONUkzRmctcnRmbURGbzV6Y3RHV2Z2TG53NWR3Z3J2Y3FUdThFR01VdzA2RkpVS05lQlBGdW01d1RtVmFLSXdtcEZ2N2FQX3dLTEZpcGNabV9RZEV0NXJuVnBLV2JEMV8tVE1rRjZtdHZONGJRRGdxalVsVEVMNDl5R0NPalBmY1FBbDRXMTI5Zm9pREU0UC1qV2JoaTdaNjhVZU5ITVNEaTluaVJwODVLc3Rn?oc=5
2026-02-19	Google	0.133	This company wants to lock Tennesseans out of the courthouse | Opinion - The Tennessean		https://news.google.com/rss/articles/CBMingFBVV95cUxONG5aaGZ3R1pOUFRxY2RXYnBCaVhXNExCUFVXdjRDcHhUWGpveTJwQ1ZYRm5RSkotT3U1NlhMcXNEelBlc29reks4dGtmS2M4VW5veEYyNHNYV2pmaUhEMXhHcnR0U040VHdFX0Z4WV83M0JzR0VIWjl3WWNBSURRU05qZTBFTVNKbGsyVDhNM3djam5xa1JzYnJET2ZfUQ?oc=5
2026-02-19	Google	0.131	First National Bank of Omaha Makes New $1.20 Million Investment in GE Aerospace $GE - MarketBeat		https://news.google.com/rss/articles/CBMi2AFBVV95cUxPUHRhQWZMckk5VzdPd092bGw4ejQ1NUxwU01Rb1g4bE96QVE1dnJoYi10MWlQSENyeGRIU25YSk5zODZIVzljdGlVY0kyWWRYbWMyRDRRSzByUXVXUkZ0OXpTVDJWWDdfcGlFWE9JMXZaTHBKUkJ2T0NGU05jNzVIaU9SOWtjX3lFWExDUU94RjJVOGQ1WllPdnYwb1ZPYlY0SndfWjE0TmFBN1ZURW1QcjhiZ2RDU1RENW0yMkpCMUNnZ2ExVm9Mb0ttTjVIVzdiRmtCdTdxcm4?oc=5
2026-02-19	Google	0.119	GE Aerospace (NYSE:GE) Hits New 1-Year High - Time to Buy? - MarketBeat		https://news.google.com/rss/articles/CBMiqgFBVV95cUxNMGFabnhidnVYRjlQQ1hMWExUWEtsdGR1Nld4eFNSY2ZUUzFPck1nZkNkTWE4NWJwYjFNWUFPXy0xSUoxNFlLX2YzbVpVU3ZrVnczdFVSazRjR1pnMzNYRnZfTVlKUm5mVDFuQllkOUFKcXBJQlZLZVdRRmNuTzJlNmh1amx0R1E2NUhaSElPa2RRaDM5aXBQTGFENGtELWt3R2FxMUpXZG9pdw?oc=5
2026-02-19	Yahoo	0.112	Investors Heavily Search GE Aerospace (GE): Here is What You Need to Know	GE (GE) has received quite a bit of attention from Zacks.com users lately. Therefore, it is wise to be aware of the facts that can impact the stock's prospects.	https://finance.yahoo.com/news/investors-heavily-search-ge-aerospace-140006579.html?.tsrc=rss
2026-02-19	Google	0.107	Ge stock hits 52-week high, reaching 333.03 USD - Investing.com		https://news.google.com/rss/articles/CBMiowFBVV95cUxNTU5JeDhqNFEtM3l5dUZicnppY1B5d2ZpemR2SWx2YlBBdXltZjlBaXBmRUtkNXBXNjNVQ2VCSW5wTjBiVGZNTzBWZjI5bDFkRlMzaFR4S2hyMndQVlpGM3FXYzRvY05nVUJUUFZrcU93U2pMWU5nSldlN01oUXptc3JIc2p6Rnk5c2RRVVAybTByVGFUZmtTdnpyal9TaU1SbGs0?oc=5
2026-02-19	Google	0.091	FDA Issues Three 510(k) Clearances for New MRI Offerings from GE HealthCare - diagnosticimaging.com		https://news.google.com/rss/articles/CBMingFBVV95cUxQdk5CaW5kdHdtQ0xRM2ZnT0tmOTJIUXB3b1ZyYlFHWmpBeVlOSDJCMkNXa0NmNXM0UlllTGhnSzBpRWNaNGFqQV9aOEJvUzRUUFRzUlpXZWhBMWUxRG42VVlzZkVSZXZjcEZHSnF2N29pejhwenVwMUlYbHhDLTdQTDhRQ0sxLWFlVm52b3M2MjJxc2hueWVQbldDaHBnUQ?oc=5
2026-02-19	Google	0.091	United selects GE Aerospace GEnx Engines to Power New 787 Dreamliners | WEBN | Aviation Blog - Jay Ratliff - iHeart		https://news.google.com/rss/articles/CBMi4gFBVV95cUxNSDhDdVZhWXlhR29TWTdxVzNNZUdINHduQ1dlZUhqZlU3d2FaSTlyZVQtVnpMMXpXRnFTOXBkTFFPOU1rRkh3THhWV191M3V3MEdBdmc5VkVqZTlOYU8xQTZ5RHA5S2NLY3l0U01rdFRYaVlTbTdfSE9tcFpyTkY1bFFSNjRDY0dtMy1pelBrZWd1OUtRa08ySFJnbEhkS3JPZ2ZQVl9PN2s2cUstY1ZodTRBd2dqOTVaSjAxMktGRTJfa0IxLUhqRkxnZ3VwQXM5a0QzWHZrbXEyNVBSRXR5Rk93?oc=5
2026-02-19	Yahoo	0.089	The Hidden Value in Genuine Parts Company’s Spin-Off Plan	Genuine Parts Company’s recent selloff offers value investors a chance to buy an industrial distributor before it spins off as a standalone firm.	https://www.marketbeat.com/originals/the-hidden-value-in-genuine-parts-companys-spin-off-plan/?utm_source=yahoofinance&utm_medium=yahoofinance&.tsrc=rss
2026-02-19	Google	0.068	Former Arby's on Patton Avenue proposed for new drive-thru chain - The Asheville Citizen Times		https://news.google.com/rss/articles/CBMivAFBVV95cUxQWWlFQXZHemxvOGJwOS16dlEycnoyUk5VT2tuUkVyYnpVSUlacjhVbnFWSndWeXZNekp5dDI2MENFNkNzUWJLVjdscWgzNld5SWdiX1VtX3hzdk1TMVBMMGRCaGlOa0pTR2pCNFNTMlJ6TC11UjhUaEhsOFhfV0JKYW1TS2ZxRTk0QmJIMVg3aEg2SzEyd0ZobS1OZGNkLXlqYUxnY1dPSXNwbTY5Z1VuQ21EV1QtZ29maTd3bw?oc=5
2026-02-19	Google	0.04	When will the snow end in Binghamton? Historical data offers clues - Press & Sun-Bulletin		https://news.google.com/rss/articles/CBMisgFBVV95cUxOZkt6LVh1OHRqUTA4RFJJQzc3MGdUY3oxYm1uU1c1bThYX1hrTEQ4SG1CZHVkWUpuWko0YnlsQ0NtR3Z0RUxnN0Z3NUVXbUl5SHVWcUo2SWlQb1JFUGlQUXpYT3cyOFVpUUFZc2hxTVZXZGJ4bmhEcHRNVE9tOE1DdHE1ckpKY2tqOUNWUzlxaHJMMDRVa1I1YXF1ZTRxSEdaOWtPMjVNaV9HSVNxWXFraGNn?oc=5
2026-02-19	Google	0.025	Shia LaBeouf Raves About Church, Sex in Wild Clip Recorded Week Before Arrest - Yahoo		https://news.google.com/rss/articles/CBMioAFBVV95cUxNTG93U0N0WGFwUzZqWVc1R3FDNmlGb0FoaVJnYTQ0TDhrVTEyQkRaYmpuRm1sT2I0cS1xQ2ZyRHBTUENlWjBBRWpFcHpKMzl0UFh3NnB2Tk9WdmRRV2xqUm8wQWttdEhpWU42cjlGbFJ3LW5VclctNTVtVG1Wa0dzQktBLTJGSkhUOUNHS0ZnblJSTEVZdGVKQnM5RWhwZ0lD?oc=5
2026-02-19	Google	0.0	15 Wilmington actors who are well-known for big TV and movie roles - Wilmington Star-News		https://news.google.com/rss/articles/CBMiiAJBVV95cUxQZFFlWHBuS2gtT0xlckJxb21CQUxQMmNtaWRYem1fVkhWanZzUzFKR2xYMFJ5RFJjdW15bUxKLWRra3FyT3Jscl85MHB5OUJZWEVCclRZMng4aGE2UDhkY09VYVdFNG1Oam1pZzBnWTlXc1o2UEpmVm9ucnhKaDZYdDdad1ljbmFuSThyTjZsRWU4TWlPaHJ2Q0I1RDlXTkNLMm12TlVxNll2V1RieEt0ZlFOUjJXUmlpRGFONUhQdVltM1BzVExwRmEtSE9jR3pqNk84OFA3SzgzTWFoMkF4MEtZWlVaQmRfSVZ0bHVXNm52eWxrRVduRDB1NVBhb3p1OWhjbktlMFE?oc=5
2026-02-19	Google	0.0	American Airlines chooses CFM International engines to power future deliveries of Airbus A321neos - American Airlines Newsroom		https://news.google.com/rss/articles/CBMivwFBVV95cUxNS3Eydl9DLVJYX1pJazg3d2liSFFUWHI3VWxwS0ZhWlJUZXYxN1FsMFBWdmZrTzhZU09WaHN6cGxBNWNCM2dLdXBBWm8zemVnMjlaOVk0ZzhaV1NzcFY1LWQtNV9EOVhNcXJlU04yWmJQamZkSl9fM0ZRM1B2dFlNN09xeTNGRVJUQTI2alQzajFnN0FvNVZsUk1yMUVOZkdKTmMzTExEbzAyUUxRRV95Wks0MjVlVXRKN3JnS3NjMA?oc=5
2026-02-19	Google	0.0	Axxcess Wealth Management LLC Sells 4,305 Shares of GE Aerospace $GE - MarketBeat		https://news.google.com/rss/articles/CBMixgFBVV95cUxOWVJZbUY4bnFCb1NIQXpwc2RPNVZ0ZTE1ekkwMzF3N0JDXzh0OU45YWlnZDNtNEpkc2hfZm9DS2d5UTdWZFZOTm1EQUpmZ3RjYmxZSUpzS2pIUHJkREFXZ3VNWHgxa0I4UktCWEVFUUZUMVJabmlzdnRtT2x1MERBdUdUblJIbDZXXzUyWVY4WTZUNzBwMGl6Y0ZNVHMzRkdiSk45Y0JFN2tSdW8yMTYtZGRla0tuMWxVcDZjbV9xSUY2eXRjTXc?oc=5
2026-02-19	Google	0.0	Bristol-Plymouth boys basketball's Aisiku reaches 1,000 career points - Taunton Daily Gazette		https://news.google.com/rss/articles/CBMi7AFBVV95cUxQc0VyX21FZXgxaDd0WHh1UzFNeW5CYmJ2UE1JNC1LOFNzWUc5aW1ZdUd3c0ZNU2tkUUpOQ3NBQVE5MmRac1podm9HVnUwMjQxNmNjdEFmY0dpZjJuc2VzaDFWdTNpNjdCUTVJcnd5THZvOTI2VVVlTUkzY0VVTFdnN3ZJalJoQ1M4Z3lDVDVyb2UxTzI0TG5BSHM4RTAtRHZzT001MVZEazVNQ294MDJlcXF6YmNRU0FtNGo5cnNjN0M3N3lKemRkR09KZzNDeG95b2M0OGNWZGRSQ0VybENjOGxqWVFkcGpBSVJzeA?oc=5
2026-02-19	Google	0.0	ESR highlights partnership with GE HealthCare - AuntMinnieEurope		https://news.google.com/rss/articles/CBMi1wFBVV95cUxNcVNkWHBKYWxmc1BwejZtOXdkb1Q1bnlkamNna0FTc1RUdG1uM0piTTFMUW8wOXU1ZGNiVURpUXE1cmQyUjVrc0FjcGE3ZTZ1REtBb0xTcjFIR1VUUGhKOGJSQjYwZE9KSV9ZdUozWDhwQVRWbV9hNXZScnNZWGsyMEFuMTFBYXpIeFJJRnF1SlFrSVI4ZXZWSndBeDRIMkt4NUF3TFJvLUlJb3dMZENnN0xBZERRTDBrc3Q4UURnVjlRdWhrUHowTWVFU1l1OU4zSXZlWVBQMA?oc=5
2026-02-19	Google	0.0	GE Aerospace (NYSE:GE) Trading Up 1.5% - What's Next? - MarketBeat		https://news.google.com/rss/articles/CBMinwFBVV95cUxPSWllTXBFRUtnYlJLalJfcGM3VE54a3VscUI3al9YTzVrM25hWDlMak16MTllS3kzNmpuMl8zLW1ZVmtTQTZFT2NFZW5DMzQtN1FCNlNhNzBYc19WYkpQdDNKUHVuS1BLZHE5ZWZIdFJXN0JuVG9WRU9zNjVtX2UtRzN6RWJnZm1DRDcySWo0N1hwdWN4U2ZMSEp1UlkyNzA?oc=5
2026-02-19	Google	0.0	GE Aerospace, United Airlines ink big engine order - Dayton Daily News		https://news.google.com/rss/articles/CBMirwFBVV95cUxPejN6dF9EeE1rNWI5Wi12a2o3WTFPcko0aC1KNlI5Q0c4cGhDZGJ4SlBLZm1nRHA0djJfdXprb1ZKaTVYNGoyVkNTWkNmVjRURlBsa0o1Vk5uRi1ldWFFbmFHSXIzYlBmSUFQYmFqbng3VG8xZ3B2UlZhN0MyVVM4eUluYVV2bXhFNXZsMk1kSVRMYUNWdXpMdVVkVEpDQURDX0Zsa2I1enFrNEdyRGln?oc=5
2026-02-19	Google	0.0	GE HealthCare achieves MRI portfolio milestone with FDA clearances for next-generation SIGNA MRI technology designed to enhance precision imaging and clinical efficiency - Business Wire		https://news.google.com/rss/articles/CBMiygJBVV95cUxOX3lLdEtST2Y1aUh6SlhsRlVYY1FoWHRfVWs0ZmdHcWd5MTlreFR5WS10RmVpcURSRmJRRUd1cVZmdExET1EzQ1pQVFRTcGliTjFISVJuU3FZTnVEQkhPNUo0THp4ZFJ5Tm1LVjM1eGZQUjNTZEw4WF9WMUJzX3JYNklDQ1ZnU21aNnhROWNaZUtXS01GNm5ZM1hLb3BqbXdZajZERmJLV0c3TmduazhMV2oyYjM2aDRscFR3YS1Gb1RCYWtLYWh6bU9veXliX3NWTGxXeUVKM1NheFgwRkE5N3hQOXB6MURWQkQ0dzFuQ2tzNW5iUGpqalZnemRKRjRzek1HYXpMTFVabUVwZFZRODEzU3Jncm9UMEFNcTRnM1hQb1NLOUVpSXVsbWE1YnBuSGJOcUpEYldzTUhlbGpJSXQ4RjZBLTIycHc?oc=5
2026-02-19	Google	0.0	GE HealthCare expands US$35m AI ultrasound deal - Health Tech World		https://news.google.com/rss/articles/CBMiqAFBVV95cUxQREl5bEk3aWpIcjJxVXNyb280MW91SEpEd2JNaWV6Nk5UQy1xc0NNUmJ5VmU4S2xsZ1J1QnhwbUp2Q1A4MnVRUXBvemprWlBsMnVKTXJQMHBWalJuLVIzbGViS3NVaFFRVHN1UFlTRzc1bGVVTFVwR3hlSk1nWEs2TVh1VS13cGtlN2pmblhCcm9NN2VHS2FRNnR1WERqRDhTX1F2dENsams?oc=5
2026-02-19	Google	0.0	GE HealthCare secures FDA clearances for Signa MRI tech - AuntMinnie		https://news.google.com/rss/articles/CBMixwFBVV95cUxPVlNJV2VFZEJtUW9pZG51WnBYVG5HT2RUbmphZmlBQmZqVGdWY2laWU9HWDJGcHd0Z3pSclp4WFRoX1J4cV93RU5OVTNJa2F0OGlLR3RpSWd6STJaNHV2QUFIbVhpWU40QnlNckFkdDRNVEN2Z2JjNlFmSWxQd3FvV2ZZRmR3TDZoRExNU04xUXpHWkV0NDlfNjhkeUlKcEZublR2bDRDSEQyOGNWUGFja19JSFBoSk9rcTV4VUVKcUxfWnY5S2lJ?oc=5
2026-02-19	Google	0.0	GE United Engine Deal Deepens Growth Story For Aerospace Revenues - simplywall.st		https://news.google.com/rss/articles/CBMi0gFBVV95cUxPQmxHLTZId3A0ZTFJOWxia1Yxa3FmMG5TQ0NhS1dwZkE0M1h0dGpCTnQwbnU0MHR4X0toS2ZadzUwWkQ1YmxFQmdmZGtTMmhmN2NIOXJvRXY4cmw1U3hYcWc5TURQYzM1RkVRMnFXR3g2NEROOVNvSEpyNmMyNmhFajVPYWx0MlNiZVM3a0c1bE1xVFZub0NScG8xdkFjSlIwcXdRSDU4SHJOLVRuSlFDVHlDZk41bUlPODB1SGNUbTY4OGhqYXpEc0Ntb2todm5RbHc?oc=5
2026-02-19	Google	0.0	GE Vernova (NYSE:GEV) Shares Up 2% - Here's What Happened - MarketBeat		https://news.google.com/rss/articles/CBMipwFBVV95cUxPZGduX042dW1tenFIVUxhNVljT2lTZktreTQ5RWRfZHQ2QlhHc0V4ak1vMzZESldKcFdvT2NzWEdwZnlSRW84dDJmMGpKYnlBYXAzVFRaZnB4VXcyNzNwR0U4UG9CVW5TNWxsYW42Nmg3aW5HRkJwUkFPWkwwU0ZVVmpOUkVuanpYUEN4Um1hWkRqcW82VzJheGJKb19sN25GSnZ0NHJ2SQ?oc=5
2026-02-19	Google	0.0	GE Vernova Contracts Highlight Growth Potential And Valuation Questions For Investors - simplywall.st		https://news.google.com/rss/articles/CBMiywFBVV95cUxPdXVfNVdzelMtbmQ0QjhWay1oV2h3Y3J5SWVBVGxBRy10TnhwRFNGSTBYX1ZfdHBmQ2FJQ3JpM2dqRkdlUlRoWmExNnVBTkhXVHVBdkgtekZDMEFNYmVmb1BkREViV3VVLW9aNGRyMndzSmZmaEI5TnJ0SzZnMy12V2ZuS3BiczhieGJnWEFINXNrX1ExeVJ6d2EyQkZ6TDFDTjlmUEpBYkgtMlM0VWJOTjJkblBLWmRYNWJFOEhDRENvLXhKT3UwTTFScw?oc=5
2026-02-19	Google	0.0	GE Vernova Gas And Wind Deals Test Valuation And Earnings Expectations - Yahoo Finance		https://news.google.com/rss/articles/CBMie0FVX3lxTFBvVGZITjBhWHZvZTBTcFBUNnZLTWp5Q1pHVEFKdHZ2UTBNNXdSR0FqVmtKNXU4VVRXUlhscWl3dEVCWDJ4RWJCczlJYWdTdmRqQUJ1MDBBN3NBeEV4cnFVbnBVMjRJT1R3NVdmZHpmSFd3ejk3ZUt3aTMwbw?oc=5
2026-02-19	Google	0.0	Greenville Triumph move GE Vernova Park opening date to June - greenville journal		https://news.google.com/rss/articles/CBMioAFBVV95cUxOMjlaN25vRzRrNHpfMVBrdF85ZFFhSDdtcFZlcFZvY3RKZ185WnU4X0x6OWtWcmpIeTNHR0xQMkNxaVlqTzRvV2NWVmFPN21ZSE1pYWRxY0dVUUFvTU1VVzc0UG12OFpHYjRuVmNiVnVqRlZGS0FqRkFlUWc0cVA5NzAzdUJCdFB4Yll5Q0w4NTBtN1lGclZRZ1VEQ3FNcGRk?oc=5
2026-02-19	Google	0.0	Harold Davidson & Associates Inc. Has $6.39 Million Position in GE Aerospace $GE - MarketBeat		https://news.google.com/rss/articles/CBMi0AFBVV95cUxQVmJfTGUzWnhFT0RTMGF6Yk8tQjgzRWMzcDc4UkFwb1UwZzdIbHlGbjZnREFaanVHa0NPOHRiNEFHY2FsQ1JLUXZZUFJSOFpRV3p2MU9xTElOdjdqUnhscG5oWXVxS1YyRXRCQktvXzJqVWx6WkRVUk9lczctcG9LUVR1aE9ocGtTdjE5X3Z4Z19UMUFxV2Y2QXdqSy03VldhNk13RHMza2pVUU9DRHphVVRUZ3pVX1dBNTFBVGQyOU1nQTJYVll3UWthZDVCTWNT?oc=5
2026-02-19	Google	0.0	HighTower Advisors LLC Buys 254,756 Shares of GE HealthCare Technologies Inc. $GEHC - MarketBeat		https://news.google.com/rss/articles/CBMi2AFBVV95cUxQZXBLcFA0eXh4c0I1cU1maTVYeDdiVXE0N1FKM2xJODNvckE2b3BlaUFJR0p3bkw1bnIzZ2pVWnR2Z1VETTRtWWdHQlFBYUdwcm5ZZlBzdVFGSmNyTXNYOFpMY3gzNElEcFZ0R1FDZTJ5VTNnck4xX2RlZDFkdm9SYzU2OXFqNTI5bWNxVVNPNlhvcWxJM2sxRTBicl91bE1URGlYZGV4MTZHVldwTFEwSVpNQkgtQ3VJV2lmRW9PVXZQeVRRSzE1enJJbTVxZ2U2UnJGSjlJNzY?oc=5
2026-02-19	Google	0.0	Inside Addy Brown's emotional return to Iowa State women's basketball - The Des Moines Register		https://news.google.com/rss/articles/CBMi_wFBVV95cUxPRnJqVUV1YUJ5SEdtZEpxb0F1NGJBNXNKZHlPaGdLUWN6Q1QxMFFIaGJfOV9hcnlzaE5UbFdqelVaWnBDbkllc0lOMUtkS0Vvd2JJdE10TE44ajVEVVdUa05IZlkxREw2SnpCOGdmZG1qdkM0OEgxVGlLT1prR2Zxa2dIQ3JMUHFYSVRMLTBWSXh1SWgzUVFBcmpxN0RxczN0czVzaEktcE9jX0pmdzVOUHVzankzRjB0VWQ0UG90UDU5UWJhdGlpVlNOeDNxZ2dQNVJiRG03bXJjOFQ1WmdfN2hodDFJN3d0MXRIVVFnZUtQRWVBWHE3S0lORzdLc3c?oc=5
2026-02-19	Google	0.0	Interstate 80 reopens over Donner Pass; WCSD on two-hour delay Friday - Reno Gazette Journal		https://news.google.com/rss/articles/CBMimgFBVV95cUxQcWduektVTkVJSG10WXhBLUhHY2Y3SFV4QmQ0b0IyM0NOaGVhRFl5Rkc4Ym9hYXJPZFg0c0loZDlrMVlEblRraE0zd3RVM043VVFqVnZ5d0hWdkJQSExTZFp5RHNncGlUSUtud3JZeUw2c0N0Q2ZQZGZoQ0xZSkhyYjZyQmpmRExGczNIS0tKMXJIVDl5dWZXdHl3?oc=5
2026-02-19	Google	0.0	L & S Advisors Inc Purchases 1,507 Shares of GE Vernova Inc. $GEV - MarketBeat		https://news.google.com/rss/articles/CBMivgFBVV95cUxQbWtKZjZEU2VuQl96alE2LVJHUEN6RGs2NUJUdEdwTE9rWmR0TFo4OHo2dXNXcHl5WUpPMEFaZG5YX19nOEtGWGhwQmFCbU5fNFd0d1R3MXhRMmxQQnVXcmNNRzFzRnlkOXdvaFdGZ3hnb3BrZDQwUXc4X0NRNTJUYVhIZGNvQlNWQlVtTGR0WDRsM2hFS09kZWN1c2JvZ0tnM0Exa1RZX291REh3b29oZUpWWW1HYlo3WWVvajFR?oc=5
2026-02-19	Google	0.0	P/E Ratio Insights for GE Aerospace - Benzinga		https://news.google.com/rss/articles/CBMikgFBVV95cUxPOXNmX1MzckRuUGlzTXZ4dVA2c3lUZFE4M0xQaW5aVzZUbkh3dTk5Tnhld0VMc18tM3hsR2I1UzhLMDR6TkZHNFhQSnk0eDFDc05qc1V1S0pNM0c5S1daU21NaGQtbTkza1Q1TWpnT0IzdTlTWERGaFo0YWNmeHZFM3h4Q2RLUlNvUUV6bEFaNERxZw?oc=5
2026-02-19	Google	0.0	Stocks Fall, Oil Jumps On Iran Fears; GE Aerospace, Planet Labs, Cameco In Focus - Investor's Business Daily		https://news.google.com/rss/articles/CBMic0FVX3lxTE9lb1pMYTZlcWYwZWNzWkhlclZXMWVXcGN3UUR6Qjlrb3RPc3BCVzNCU2dSbmRLUUJEQjdtTld6LXAwVFdYNUh2SVRtMl82SV8yWW1XdUtVbHczNXNKUEpRR1pyMGROOFFDeTNqZlRsWkRuM0U?oc=5
2026-02-19	Google	0.0	Tennessee defeats Oklahoma basketball - Vols Wire		https://news.google.com/rss/articles/CBMihwJBVV95cUxPZTZhTkZvcGV0TF9jc3pIRlR1Rm5wQzN5ZFZSNkFfVlJ3Y3JoYTRhZFNuQWxNZ3k1LVJRVnJWdGRGenR1OEhjLTlxNjVUQzJuYTVTV2l1VVNhTkhFRE1XYnAyUzBlSEFhZmFTN1BVYUtpUG5uekloWTh4TU1ObEVjNnhEaHZ3YTB5ZVZuc0pOSUhlell5MkpLRnUyYUpDb0pod3ZlTEthUGplak5mMGN4QXBXT3JlUTQ2ZmJhekZQVVRRSEpneTZFeUVQNk90WFQ3WUJldWs3ejdwaG5zeHVVdnJvdkU4WHd4OWFYMGhhY3luUGNZeEh6YXNXRFhtX2o3SGV0SGl2MA?oc=5
2026-02-19	Yahoo	0.0	This Fortune 500 CEO says ‘lean manufacturing’—the management philosophy Toyota made famous—is a prerequisite for leveraging AI	Also: All the news and watercooler chat from Fortune.	https://finance.yahoo.com/news/fortune-500-ceo-says-lean-103158808.html?.tsrc=rss
2026-02-19	Google	0.0	When is daylight saving time 2026? Delaware law may make it permanent - Delawareonline.com		https://news.google.com/rss/articles/CBMiwgFBVV95cUxPU0drRGhvMk9TcEZqSUt2cFFmX1h6ZlVaN0w2TXpCa1JvZnRBM0FER2hURU5OSjNtNVBwODAzaFBwZmsyVUlSc3dkNlg5OWtLOXBwbjJUQkZtMVVXQl9oQm9KYlJxM0tUZXN4TWNOQWtmdERKS2dvOUpkM2F4WnBFblFqREJMb3h1alRkWFVSTjlNNENUYkY1b01UaUh6RlNjQWZVZ0lIaTV6a1JEU3o3akgtR1NxdGVTUzIxbHJZQlUydw?oc=5
2026-02-19	Google	-0.003	UAW Faces Prosecution For Illegal Firing of Worker Who Objected to Funding Union Boss Political Activities - National Right to Work Legal Defense Foundation		https://news.google.com/rss/articles/CBMiXkFVX3lxTE5aVTNRU0pHcER5cmszdk9QaG43cUtQVTVHbFhCUEpUMTdmbnRxWWtBeDlxOWN0RmdtSjE5SVRXMVg1NnRiT2VsNHJMQ3FObUdVOGk0TFpXNUZVNGhVYWc?oc=5
2026-02-19	Google	-0.05	Isolated storms, colder temperatures expected in Memphis this weekend - The Commercial Appeal		https://news.google.com/rss/articles/CBMixwFBVV95cUxQbVNBQWtJbkt3T2VWMlAtbXdGdWV0cmwzcDdCSUtaR0JXUVZjRkpQQVRCbWdDcXhLcXpST1pPbk93czVnZE5HZzY5LTVvRHFJSnpvZ2JZYXE0WTdjU0R5YzJrWUVPV0lMRkN2TFFNV3ZscThna3RacVV2WEJrSUpRTFR6X3IwdjRDVGRVNWNSa1ByY2lRa2tDQ2tfNlhkajRucmNKRkh5blNwa2xOWFNUdUFLQlExdU5YUDduWVNkeTdjdVpoZUVj?oc=5
2026-02-19	Google	-0.067	GE Profile made a smaller version of its nugget ice maker that needs less counter space - The Verge		https://news.google.com/rss/articles/CBMingFBVV95cUxPQUNxUVY0UHMydVlFVFhPWGtUYkN3MlM2NldpNXBYZVpBZkluRVBHZUh0TW43bUhBbUNXMGFSdDJUNVNCakxtWU9RcFl5VktvZ2tGeHVBemRWM3RVQ3VwTVk1U2dtbG9qTEh2NS1XNDMtS19DNklXQ25saUx3SHNJV2p4RlZwSTh0Q2dwdm1Zc0N4a1paZktHeDdISlAydw?oc=5
2026-02-19	Google	-0.133	2026 Genesis Invitational Thursday TV coverage: How to watch Round 1 - GOLF.com		https://news.google.com/rss/articles/CBMigAFBVV95cUxNalpVaXI0d1JQSUU2bG1XQzVUUVp0SGptOW5fMlotcGE5RmhFbjdlSjl5eHd6MGJmdENUczNYR2tnZjFaS04xSlV5emdGLUlVUWx1d0l5UnFLX05sVkp0RzFOaU1ya0djQndnU29jSFZSZUxTbW9XTXhBMnlabUhzTg?oc=5
2026-02-19	Google	-0.2	The Global Health Reform Debate's Dangerous Blindspot - Think Global Health		https://news.google.com/rss/articles/CBMimgFBVV95cUxPeGdDYS1FaUJXdTZGNVBCMFA0NFFlUm10dGhIM043OWl1Ni1VdkRVbm95d1llUktVVl95Mno0RlVMN3ZWNV9vSlBJMTQyN3dpNk41OEg0WVByalg4NFdCUWtCYTJvOEF1YVFqcHp4ZnBVd2plQlh2d3FqYzhxV01fLTBPTUVOeVNxU2ltOFVUaWZ2ZnZSbU5FNHR3?oc=5
2026-02-19	Google	-0.259	Despite tough finish, Chris Gotterup still atop PGA Tour FedEx Cup list - The Palm Beach Post		https://news.google.com/rss/articles/CBMiwwFBVV95cUxQYXJlVUZqanowRlFZRjhLei12bkxCVkZKLTVCb2VPWjlhSHBBbHZiaGdtRkhjN0ZkSk94UkJpdFJPYlVpalRmZmJJLXJWanUydUpMdjV4QXdLUElaUllPbTB4TDg3d2UxdXJGZnNrS3NCdEJXbnlxZ25MM1V0VWM4RXZpa185MDA1VVlwWlhOS29hRS1DcUdoOEtfRkR6RXk0cXlLOTV3MTE2WlBJSVVqWmlUM1pELWFXZXBxQmVnSW1qbWs?oc=5
2026-02-18	Yahoo	1.0	1 S&P 500 Stock with Impressive Fundamentals and 2 We Find Risky	The S&amp;P 500 (^GSPC) is often seen as a benchmark for strong businesses, but that doesn’t mean every stock is worth owning. Some companies face significant challenges, whether it’s stagnating growth, heavy debt, or disruptive new competitors.	https://finance.yahoo.com/news/1-p-500-stock-impressive-043229583.html?.tsrc=rss
2026-02-18	Google	0.5	Unpacking the Latest Options Trading Trends in GE Vernova - Benzinga		https://news.google.com/rss/articles/CBMitAFBVV95cUxQazZOR2JydmZTNUY3U3BUQ1lyNk5hakRybF90V0lmLVRmUEltb2M0Zlk3MFFYU3ViZENrM0FrUnFjME5Jc2VUN0tQeWNYaU83TnE0WnYwWFJYWlR1LWp5VVV4UU1xUWNZNGp4MFRwQ1hUaHpldG8ybGRrdWpkSkh6bHBZUXl4T3IyWXd6dkRSUXdDNkg1UGh3V2VORVE4Z3AtY3VyZnNvczN4aHllX21Ld0lMS0w?oc=5
2026-02-18	Google	0.133	NJ weather: Snow forecast for this weekend. How much snow will we get - Asbury Park Press		https://news.google.com/rss/articles/CBMipAFBVV95cUxPWjFZSTlXTU5pTnNUcVdlSm9ka3luajhlX1pLWk5RaTU5RVhVc2Q2dVA0MTNOSTFHeGlGemtTbWpWYjhvY09BSFl2b2hDdmMtc25fb2NocnJyMmJiNV9TcG9FWWhHS3Nud1RKRkc4dkZRejdPTmQwM0FtbXJwNzJyN19kTlJOLUNrcDI5dFlibHd6aE9FYXZUOEZaNmhGYmp0OWFyVA?oc=5
2026-02-18	Google	0.0	2026 Saratoga Jazz Festival presented by GE Vernova - The Berkshire Edge		https://news.google.com/rss/articles/CBMinwFBVV95cUxNWVRvc3BxRmdLUHI0dUFQT2xWWXVRNWxXT3k3OTU4QTBBX0VWTWREYjBaRFVSVTYzdDE3dUZNN1JIYllfZHY5SGRxZHBOWDRkX1k0QWl0cWkyaWYzaVVZWWJhcmZxM3NFaHNsbkFVTFAycUdIWTVTQ0lOSzd1TEl3QkphUExMelBQUlZRbHlyWDIwb2loWlMwUEZLQUVfT0E?oc=5
2026-02-18	Google	0.0	23,000 products sold under Sysco, Gordon FS recalled for plastic risk - Greenville Online		https://news.google.com/rss/articles/CBMi9AFBVV95cUxONjRfdzZfX3hXYlJ2TmlicEhmbWd5NE1IRjE1dkRFekNTUjVwSF9NX2pkN1JPcWswTUoweUxWUHdfTjhzYUpDYWQ3TVRuUVJwVHFQUFlwOGxiY0VIZVNwd3RxN2ZCODRmcnRfNEZZNmVkYXUtU3l0djdrS1dtRFBRSWF3UUp6Q2JaMkRieUoyWHhtNGxZcE9uN2VQUy1WekQzNTdoNlJyX1dHUjRveTk4UkJfa09pNk9CZ2Z2LVlVdXVmSmk3cnJxZy04RlhDSUtSQ2lJdF9mZ3FUV3JFdnlBbXJNTDl0UDRibU1odThJZFBLR1Zu?oc=5
2026-02-18	Yahoo	0.0	Dow Jones Futures Rise; Nvidia Gains On Meta AI Deal, Rivals Fall	Futures rose in a still-divided stock market. An Nvidia-Meta AI deal lifted the AI chip king and hit rivals. Palo Alto tumbled on guidance.	https://finance.yahoo.com/m/62f55c1c-6a09-3e63-a246-6986c43570cb/dow-jones-futures-rise%3B.html?.tsrc=rss
2026-02-18	Google	0.0	GE Aerospace (NYSE:GE) Trading Up 3.7% - Should You Buy? - MarketBeat		https://news.google.com/rss/articles/CBMipAFBVV95cUxNX0JlSS1KN0hqOUU0X2Rmc1BOY05kRlNZYkxZc251QW8xV1B2NWcxWUhpeWE4UFBpQi1pNmdaRVV0NGdfU2d1d2hvWmc0bUl2MVNrWng2OUUxZ2UwU1FKWTdoNXEtZGptcTRHa1o4WUhqZThHMWhWZlpjTmxmY2xMS090bHdSMUljOExfS0RONnE0dXFueVpGSFVTWTdlNkJtRkFlOA?oc=5
2026-02-18	Yahoo	0.0	GE Aerospace and United ink big engine order	"Feb. 18—GE Aerospace, a big Southwestern Ohio employer, has inked a deal with one of the nation's biggest airlines. GE said United Airlines has selected 300 GEnx engines to power United's new Boeing 787 Dreamliners. The agreement includes spare engines and brings United Airlines' 787 fleet to more than 200 GEnx powered aircraft. ""GE Aerospace has an enduring relationship with United that spans ..."	https://www.journal-news.com/local/ge-aerospace-and-united-ink-big-engine-order/3SIAEGO3NZHCNDOB7ZBLTALBRY/?.tsrc=rss
2026-02-18	Google	0.0	GE HealthCare AI Chief on Why AI Must Fade Into the Background — and What It Takes to Get There - CDO Magazine		https://news.google.com/rss/articles/CBMixgFBVV95cUxOWFJoOS1UaTFaRlZBSDlIdjVEVjV0bTZRYmdMU3lZSjhrajItSWRwQnE3dTBqR1kyTHVURkJ1cUZzS3NHTTdpV3ZncVNGNldUbWphcEdYMWl5RzQ3VXlnbTE5bWhWWFRHVHFjZXRGZXh1RkF4QzdKMUQ2eGJsZFB3dDdBMk1fRHNhekh5V3ExOURNZHd4U3R6cTUxRzB4YWpmd2w0TUdiVnZ0V2tUYWZhcFJhcUdMMWM1UkdfZG9CNlBSNXV1a3c?oc=5
2026-02-18	Google	0.0	GE HealthCare and BARDA outlay $35m to expand AI ultrasound development contract - Medical Device Network		https://news.google.com/rss/articles/CBMiwAFBVV95cUxQTmFPeUJQZWNGX0ZjRjEzYW04UE1UbkV1cmNBclhBZWw4Ry1OUmtpRm9weGgteEtJSlpCeG9KVzFDaHl1RnNfSEtxLUhRYUZ1anpoMFY0Mk1Ndy1hN0FjTmpTSWVRNGJPOWVsUi11elVBMm92RHQ1SkN2WnNVai1ySkFRNkZ5cWtvbEJRUlpXMFZUSlBmaDh5dVpSTE5IbGl0M0NYMDVIQnlnTnRqNWpTbUJJX0RkemlUZFhReWFabU0?oc=5
2026-02-18	Google	0.0	GE HealthCare's $35M federal partnership to fund AI-powered ultrasound research - Radiology Business		https://news.google.com/rss/articles/CBMi0AFBVV95cUxPSE9Mb3VkczIwTVhyV05rWXJwNEdTQ1FKYkQ4LTVQZG9ta05MUE5Id1VGVmswWnpIV2dkem5IdTN2dGpVVmYtVmctZjE2dnVKU3JhSUl6M2x5ejRUN0xVc1NyeWFZR0ZPc21WX3d3MlVhbHhGR1EzT0pXbU9oRnd5dlFpTFBkUklxLVllOHBPV1RiWVJSS0pQb1FjTGJja3VCS3JJb1g1YTAybHBLSElJYzZrZm1Wc2toR3lQUjhEZ3F5V01tV2Z3a1BVcWlGdTVU?oc=5
2026-02-18	Google	0.0	GE HealthCare, BARDA ink $35M expansion to AI-enabled imaging deal - Healthcare Dive		https://news.google.com/rss/articles/CBMirAFBVV95cUxPWE9rTFpqWUQ4LThEYW05MDZ0Vm8xcDNSN1diZ3UxRU9PNVdxTmF4eHRnanpZZXlTS0NnbzhGUjJxQ05LZmZZS1NCNWhKVzZIa25WMlhsdWRnZVAxeEl2RC1yeDdqRndYdlc2cVZDZW9QRTB1aFQ1czVoNl82RERsbmhkV2k2R1lZbTNGUnA5MlNibmdsc1Fkd3F2czVjcldpT2pDSXpfVU1kVGda?oc=5
2026-02-18	Google	0.0	GE Vernova, SENER Meet to Discuss Collaboration - Mexico Business News		https://news.google.com/rss/articles/CBMiiwFBVV95cUxOVzFxNTVWWFNoblJyMkswdXpuckptRExUa2FrNGlXd2QzWUU1dU9uNDV5N2JVb3dYV3VGbk45ZXhZR0I0YXo3dFd3WU9RcDFWZjlHT191cWFwYXNMRGdDNGJWLXozRThKR0VHOUFGZXpaeUt6V2JfczZTZ0phQlVmSnFBQTBhRnVGRWFv?oc=5
2026-02-18	Google	0.0	M&G PLC Invests $1.52 Million in GE Aerospace $GE - MarketBeat		https://news.google.com/rss/articles/CBMiqgFBVV95cUxPd1RCSFZHZFlrWFZIMjUyMjZCbG9yMHR4MVhjeS1RZHA2alA2ZFNuNy1SZUs2XzdjclE5QWNrN2lxNlVIa0ktWWtSSnlNNmh4SFdTeG9GYmplM3EwRGotMFRGekdhWlU1N2JrWll6ZU9XY2UwMmtuT0RKcFBDYTFqcXhsNG1BYzZlNkhaWmtXWDdjTk5yQ1VuTTN0NnVTNnVvSENURTlrRGNxQQ?oc=5
2026-02-18	Google	0.0	See photos from Ash Wednesday service in Salem - Statesman Journal		https://news.google.com/rss/articles/CBMi0wFBVV95cUxQNFIwTkEwYllqNVA2akY4TmJZaDl6QTZhM2VTdVhOQ1JLdUM4UWYzRDk3U01Bdm5sRmNCOWYzZENDS1NYRC1TV0U2VnpnVnViTzVnSzlIQlRzcjVLSUlVbEhRQTdZZ1V4aks5djVHT256bkljeG1jQU1xTTRxODF2MVFzNjNsRHBnRTF6OG5NV1h6azJESTVjRmJPMWViOEx3MDBObnFXNHpWYW5rZVpSS0ZILWN3Mm9nZHh2YzJEdldKMDQybl9KZ2diYVlLWU81bWUw?oc=5
2026-02-18	Google	0.0	Will winter storm hit Delaware, I-95 corridor? Here's the forecast - The News Journal		https://news.google.com/rss/articles/CBMirAFBVV95cUxNMVU0TFFUUFFhX2d0MllLNU9UR3htdFNrZklSUXNQWm8yVU9HM3JOZWdoV3Y4c1lsOGZCVW5GMWJQc3VhOGt0UnBjMHRibmt4Z2NXUFlKWEJTZGEtSko4R01EQkVfa0JHNkZtV0QzQU5RVU5BZ1VLdzVNLXBuODJtNkc4dXB1SDZoWTV3UC1aRUt2dk5fNHVGNWk4cmdaQTdCdGZDY3VuV3hFX3gx?oc=5
2026-02-18	Google	-0.05	Jim Cramer Shared Why GE Vernova (GEV) Stock Got Crushed - Yahoo Finance		https://news.google.com/rss/articles/CBMiekFVX3lxTE5MRnhGZmdRVlFSNklUOXB1MlJVUFpwSnV1ellhVV9yNDdSUUN0TzdDbW51aERjYk5hZGI0NjBIRWhMMWlLMzFWZkhiaGdCVG9xdWVvQWljdFBnLU5fLUVvRjFhZFMzX25uS3llVDZoNU10OVZ1UE15ckJR?oc=5
