Date	Source	Sentiment	Headline	Summary	URL
2026-02-19	Google	0.0	Harold Davidson & Associates Inc. Has $6.39 Million Position in GE Aerospace $GE - MarketBeat		https://news.google.com/rss/articles/CBMi0AFBVV95cUxQVmJfTGUzWnhFT0RTMGF6Yk8tQjgzRWMzcDc4UkFwb1UwZzdIbHlGbjZnREFaanVHa0NPOHRiNEFHY2FsQ1JLUXZZUFJSOFpRV3p2MU9xTElOdjdqUnhscG5oWXVxS1YyRXRCQktvXzJqVWx6WkRVUk9lczctcG9LUVR1aE9ocGtTdjE5X3Z4Z19UMUFxV2Y2QXdqSy03VldhNk13RHMza2pVUU9DRHphVVRUZ3pVX1dBNTFBVGQyOU1nQTJYVll3UWthZDVCTWNT?oc=5
2026-02-19	Google	0.0	HighTower Advisors LLC Buys 254,756 Shares of GE HealthCare Technologies Inc. $GEHC - MarketBeat		https://news.google.com/rss/articles/CBMi2AFBVV95cUxQZXBLcFA0eXh4c0I1cU1maTVYeDdiVXE0N1FKM2xJODNvckE2b3BlaUFJR0p3bkw1bnIzZ2pVWnR2Z1VETTRtWWdHQlFBYUdwcm5ZZlBzdVFGSmNyTXNYOFpMY3gzNElEcFZ0R1FDZTJ5VTNnck4xX2RlZDFkdm9SYzU2OXFqNTI5bWNxVVNPNlhvcWxJM2sxRTBicl91bE1URGlYZGV4MTZHVldwTFEwSVpNQkgtQ3VJV2lmRW9PVXZQeVRRSzE1enJJbTVxZ2U2UnJGSjlJNzY?oc=5
2026-02-19	Google	0.0	Inside Addy Brown's emotional return to Iowa State women's basketball - The Des Moines Register		https://news.google.com/rss/articles/CBMi_wFBVV95cUxPRnJqVUV1YUJ5SEdtZEpxb0F1NGJBNXNKZHlPaGdLUWN6Q1QxMFFIaGJfOV9hcnlzaE5UbFdqelVaWnBDbkllc0lOMUtkS0Vvd2JJdE10TE44ajVEVVdUa05IZlkxREw2SnpCOGdmZG1qdkM0OEgxVGlLT1prR2Zxa2dIQ3JMUHFYSVRMLTBWSXh1SWgzUVFBcmpxN0RxczN0czVzaEktcE9jX0pmdzVOUHVzankzRjB0VWQ0UG90UDU5UWJhdGlpVlNOeDNxZ2dQNVJiRG03bXJjOFQ1WmdfN2hodDFJN3d0MXRIVVFnZUtQRWVBWHE3S0lORzdLc3c?oc=5
2026-02-19	Google	0.0	Interstate 80 reopens over Donner Pass; WCSD on two-hour delay Friday - Reno Gazette Journal		https://news.google.com/rss/articles/CBMimgFBVV95cUxQcWduektVTkVJSG10WXhBLUhHY2Y3SFV4QmQ0b0IyM0NOaGVhRFl5Rkc4Ym9hYXJPZFg0c0loZDlrMVlEblRraE0zd3RVM043VVFqVnZ5d0hWdkJQSExTZFp5RHNncGlUSUtud3JZeUw2c0N0Q2ZQZGZoQ0xZSkhyYjZyQmpmRExGczNIS0tKMXJIVDl5dWZXdHl3?oc=5
2026-02-19	Google	0.0	L & S Advisors Inc Purchases 1,507 Shares of GE Vernova Inc. $GEV - MarketBeat		https://news.google.com/rss/articles/CBMivgFBVV95cUxQbWtKZjZEU2VuQl96alE2LVJHUEN6RGs2NUJUdEdwTE9rWmR0TFo4OHo2dXNXcHl5WUpPMEFaZG5YX19nOEtGWGhwQmFCbU5fNFd0d1R3MXhRMmxQQnVXcmNNRzFzRnlkOXdvaFdGZ3hnb3BrZDQwUXc4X0NRNTJUYVhIZGNvQlNWQlVtTGR0WDRsM2hFS09kZWN1c2JvZ0tnM0Exa1RZX291REh3b29oZUpWWW1HYlo3WWVvajFR?oc=5
2026-02-19	Google	0.0	P/E Ratio Insights for GE Aerospace - Benzinga		https://news.google.com/rss/articles/CBMikgFBVV95cUxPOXNmX1MzckRuUGlzTXZ4dVA2c3lUZFE4M0xQaW5aVzZUbkh3dTk5Tnhld0VMc18tM3hsR2I1UzhLMDR6TkZHNFhQSnk0eDFDc05qc1V1S0pNM0c5S1daU21NaGQtbTkza1Q1TWpnT0IzdTlTWERGaFo0YWNmeHZFM3h4Q2RLUlNvUUV6bEFaNERxZw?oc=5
2026-02-19	Google	0.0	Stocks Fall, Oil Jumps On Iran Fears; GE Aerospace, Planet Labs, Cameco In Focus - Investor's Business Daily		https://news.google.com/rss/articles/CBMic0FVX3lxTE9lb1pMYTZlcWYwZWNzWkhlclZXMWVXcGN3UUR6Qjlrb3RPc3BCVzNCU2dSbmRLUUJEQjdtTld6LXAwVFdYNUh2SVRtMl82SV8yWW1XdUtVbHczNXNKUEpRR1pyMGROOFFDeTNqZlRsWkRuM0U?oc=5
2026-02-19	Google	0.0	Tennessee defeats Oklahoma basketball - Vols Wire		https://news.google.com/rss/articles/CBMihwJBVV95cUxPZTZhTkZvcGV0TF9jc3pIRlR1Rm5wQzN5ZFZSNkFfVlJ3Y3JoYTRhZFNuQWxNZ3k1LVJRVnJWdGRGenR1OEhjLTlxNjVUQzJuYTVTV2l1VVNhTkhFRE1XYnAyUzBlSEFhZmFTN1BVYUtpUG5uekloWTh4TU1ObEVjNnhEaHZ3YTB5ZVZuc0pOSUhlell5MkpLRnUyYUpDb0pod3ZlTEthUGplak5mMGN4QXBXT3JlUTQ2ZmJhekZQVVRRSEpneTZFeUVQNk90WFQ3WUJldWs3ejdwaG5zeHVVdnJvdkU4WHd4OWFYMGhhY3luUGNZeEh6YXNXRFhtX2o3SGV0SGl2MA?oc=5
2026-02-19	Yahoo	0.0	This Fortune 500 CEO says ‘lean manufacturing’—the management philosophy Toyota made famous—is a prerequisite for leveraging AI	Also: All the news and watercooler chat from Fortune.	https://finance.yahoo.com/news/fortune-500-ceo-says-lean-103158808.html?.tsrc=rss
2026-02-19	Google	0.0	When is daylight saving time 2026? Delaware law may make it permanent - Delawareonline.com		https://news.google.com/rss/articles/CBMiwgFBVV95cUxPU0drRGhvMk9TcEZqSUt2cFFmX1h6ZlVaN0w2TXpCa1JvZnRBM0FER2hURU5OSjNtNVBwODAzaFBwZmsyVUlSc3dkNlg5OWtLOXBwbjJUQkZtMVVXQl9oQm9KYlJxM0tUZXN4TWNOQWtmdERKS2dvOUpkM2F4WnBFblFqREJMb3h1alRkWFVSTjlNNENUYkY1b01UaUh6RlNjQWZVZ0lIaTV6a1JEU3o3akgtR1NxdGVTUzIxbHJZQlUydw?oc=5
2026-02-19	Google	-0.003	UAW Faces Prosecution For Illegal Firing of Worker Who Objected to Funding Union Boss Political Activities - National Right to Work Legal Defense Foundation		https://news.google.com/rss/articles/CBMiXkFVX3lxTE5aVTNRU0pHcER5cmszdk9QaG43cUtQVTVHbFhCUEpUMTdmbnRxWWtBeDlxOWN0RmdtSjE5SVRXMVg1NnRiT2VsNHJMQ3FObUdVOGk0TFpXNUZVNGhVYWc?oc=5
2026-02-19	Google	-0.05	Isolated storms, colder temperatures expected in Memphis this weekend - The Commercial Appeal		https://news.google.com/rss/articles/CBMixwFBVV95cUxQbVNBQWtJbkt3T2VWMlAtbXdGdWV0cmwzcDdCSUtaR0JXUVZjRkpQQVRCbWdDcXhLcXpST1pPbk93czVnZE5HZzY5LTVvRHFJSnpvZ2JZYXE0WTdjU0R5YzJrWUVPV0lMRkN2TFFNV3ZscThna3RacVV2WEJrSUpRTFR6X3IwdjRDVGRVNWNSa1ByY2lRa2tDQ2tfNlhkajRucmNKRkh5blNwa2xOWFNUdUFLQlExdU5YUDduWVNkeTdjdVpoZUVj?oc=5
2026-02-19	Google	-0.067	GE Profile made a smaller version of its nugget ice maker that needs less counter space - The Verge		https://news.google.com/rss/articles/CBMingFBVV95cUxPQUNxUVY0UHMydVlFVFhPWGtUYkN3MlM2NldpNXBYZVpBZkluRVBHZUh0TW43bUhBbUNXMGFSdDJUNVNCakxtWU9RcFl5VktvZ2tGeHVBemRWM3RVQ3VwTVk1U2dtbG9qTEh2NS1XNDMtS19DNklXQ25saUx3SHNJV2p4RlZwSTh0Q2dwdm1Zc0N4a1paZktHeDdISlAydw?oc=5
2026-02-19	Google	-0.133	2026 Genesis Invitational Thursday TV coverage: How to watch Round 1 - GOLF.com		https://news.google.com/rss/articles/CBMigAFBVV95cUxNalpVaXI0d1JQSUU2bG1XQzVUUVp0SGptOW5fMlotcGE5RmhFbjdlSjl5eHd6MGJmdENUczNYR2tnZjFaS04xSlV5emdGLUlVUWx1d0l5UnFLX05sVkp0RzFOaU1ya0djQndnU29jSFZSZUxTbW9XTXhBMnlabUhzTg?oc=5
2026-02-19	Google	-0.2	The Global Health Reform Debate's Dangerous Blindspot - Think Global Health		https://news.google.com/rss/articles/CBMimgFBVV95cUxPeGdDYS1FaUJXdTZGNVBCMFA0NFFlUm10dGhIM043OWl1Ni1VdkRVbm95d1llUktVVl95Mno0RlVMN3ZWNV9vSlBJMTQyN3dpNk41OEg0WVByalg4NFdCUWtCYTJvOEF1YVFqcHp4ZnBVd2plQlh2d3FqYzhxV01fLTBPTUVOeVNxU2ltOFVUaWZ2ZnZSbU5FNHR3?oc=5
2026-02-19	Google	-0.259	Despite tough finish, Chris Gotterup still atop PGA Tour FedEx Cup list - The Palm Beach Post		https://news.google.com/rss/articles/CBMiwwFBVV95cUxQYXJlVUZqanowRlFZRjhLei12bkxCVkZKLTVCb2VPWjlhSHBBbHZiaGdtRkhjN0ZkSk94UkJpdFJPYlVpalRmZmJJLXJWanUydUpMdjV4QXdLUElaUllPbTB4TDg3d2UxdXJGZnNrS3NCdEJXbnlxZ25MM1V0VWM4RXZpa185MDA1VVlwWlhOS29hRS1DcUdoOEtfRkR6RXk0cXlLOTV3MTE2WlBJSVVqWmlUM1pELWFXZXBxQmVnSW1qbWs?oc=5
2026-02-18	Yahoo	1.0	1 S&P 500 Stock with Impressive Fundamentals and 2 We Find Risky	The S&amp;P 500 (^GSPC) is often seen as a benchmark for strong businesses, but that doesn’t mean every stock is worth owning. Some companies face significant challenges, whether it’s stagnating growth, heavy debt, or disruptive new competitors.	https://finance.yahoo.com/news/1-p-500-stock-impressive-043229583.html?.tsrc=rss
2026-02-18	Google	0.5	Unpacking the Latest Options Trading Trends in GE Vernova - Benzinga		https://news.google.com/rss/articles/CBMitAFBVV95cUxQazZOR2JydmZTNUY3U3BUQ1lyNk5hakRybF90V0lmLVRmUEltb2M0Zlk3MFFYU3ViZENrM0FrUnFjME5Jc2VUN0tQeWNYaU83TnE0WnYwWFJYWlR1LWp5VVV4UU1xUWNZNGp4MFRwQ1hUaHpldG8ybGRrdWpkSkh6bHBZUXl4T3IyWXd6dkRSUXdDNkg1UGh3V2VORVE4Z3AtY3VyZnNvczN4aHllX21Ld0lMS0w?oc=5
2026-02-18	Google	0.133	NJ weather: Snow forecast for this weekend. How much snow will we get - Asbury Park Press		https://news.google.com/rss/articles/CBMipAFBVV95cUxPWjFZSTlXTU5pTnNUcVdlSm9ka3luajhlX1pLWk5RaTU5RVhVc2Q2dVA0MTNOSTFHeGlGemtTbWpWYjhvY09BSFl2b2hDdmMtc25fb2NocnJyMmJiNV9TcG9FWWhHS3Nud1RKRkc4dkZRejdPTmQwM0FtbXJwNzJyN19kTlJOLUNrcDI5dFlibHd6aE9FYXZUOEZaNmhGYmp0OWFyVA?oc=5
2026-02-18	Google	0.0	2026 Saratoga Jazz Festival presented by GE Vernova - The Berkshire Edge		https://news.google.com/rss/articles/CBMinwFBVV95cUxNWVRvc3BxRmdLUHI0dUFQT2xWWXVRNWxXT3k3OTU4QTBBX0VWTWREYjBaRFVSVTYzdDE3dUZNN1JIYllfZHY5SGRxZHBOWDRkX1k0QWl0cWkyaWYzaVVZWWJhcmZxM3NFaHNsbkFVTFAycUdIWTVTQ0lOSzd1TEl3QkphUExMelBQUlZRbHlyWDIwb2loWlMwUEZLQUVfT0E?oc=5
2026-02-18	Google	0.0	23,000 products sold under Sysco, Gordon FS recalled for plastic risk - Greenville Online		https://news.google.com/rss/articles/CBMi9AFBVV95cUxONjRfdzZfX3hXYlJ2TmlicEhmbWd5NE1IRjE1dkRFekNTUjVwSF9NX2pkN1JPcWswTUoweUxWUHdfTjhzYUpDYWQ3TVRuUVJwVHFQUFlwOGxiY0VIZVNwd3RxN2ZCODRmcnRfNEZZNmVkYXUtU3l0djdrS1dtRFBRSWF3UUp6Q2JaMkRieUoyWHhtNGxZcE9uN2VQUy1WekQzNTdoNlJyX1dHUjRveTk4UkJfa09pNk9CZ2Z2LVlVdXVmSmk3cnJxZy04RlhDSUtSQ2lJdF9mZ3FUV3JFdnlBbXJNTDl0UDRibU1odThJZFBLR1Zu?oc=5
2026-02-18	Yahoo	0.0	Dow Jones Futures Rise; Nvidia Gains On Meta AI Deal, Rivals Fall	Futures rose in a still-divided stock market. An Nvidia-Meta AI deal lifted the AI chip king and hit rivals. Palo Alto tumbled on guidance.	https://finance.yahoo.com/m/62f55c1c-6a09-3e63-a246-6986c43570cb/dow-jones-futures-rise%3B.html?.tsrc=rss
2026-02-18	Google	0.0	GE Aerospace (NYSE:GE) Trading Up 3.7% - Should You Buy? - MarketBeat		https://news.google.com/rss/articles/CBMipAFBVV95cUxNX0JlSS1KN0hqOUU0X2Rmc1BOY05kRlNZYkxZc251QW8xV1B2NWcxWUhpeWE4UFBpQi1pNmdaRVV0NGdfU2d1d2hvWmc0bUl2MVNrWng2OUUxZ2UwU1FKWTdoNXEtZGptcTRHa1o4WUhqZThHMWhWZlpjTmxmY2xMS090bHdSMUljOExfS0RONnE0dXFueVpGSFVTWTdlNkJtRkFlOA?oc=5
2026-02-18	Yahoo	0.0	GE Aerospace and United ink big engine order	"Feb. 18—GE Aerospace, a big Southwestern Ohio employer, has inked a deal with one of the nation's biggest airlines. GE said United Airlines has selected 300 GEnx engines to power United's new Boeing 787 Dreamliners. The agreement includes spare engines and brings United Airlines' 787 fleet to more than 200 GEnx powered aircraft. ""GE Aerospace has an enduring relationship with United that spans ..."	https://www.journal-news.com/local/ge-aerospace-and-united-ink-big-engine-order/3SIAEGO3NZHCNDOB7ZBLTALBRY/?.tsrc=rss
2026-02-18	Google	0.0	GE HealthCare AI Chief on Why AI Must Fade Into the Background — and What It Takes to Get There - CDO Magazine		https://news.google.com/rss/articles/CBMixgFBVV95cUxOWFJoOS1UaTFaRlZBSDlIdjVEVjV0bTZRYmdMU3lZSjhrajItSWRwQnE3dTBqR1kyTHVURkJ1cUZzS3NHTTdpV3ZncVNGNldUbWphcEdYMWl5RzQ3VXlnbTE5bWhWWFRHVHFjZXRGZXh1RkF4QzdKMUQ2eGJsZFB3dDdBMk1fRHNhekh5V3ExOURNZHd4U3R6cTUxRzB4YWpmd2w0TUdiVnZ0V2tUYWZhcFJhcUdMMWM1UkdfZG9CNlBSNXV1a3c?oc=5
2026-02-18	Google	0.0	GE HealthCare and BARDA outlay $35m to expand AI ultrasound development contract - Medical Device Network		https://news.google.com/rss/articles/CBMiwAFBVV95cUxQTmFPeUJQZWNGX0ZjRjEzYW04UE1UbkV1cmNBclhBZWw4Ry1OUmtpRm9weGgteEtJSlpCeG9KVzFDaHl1RnNfSEtxLUhRYUZ1anpoMFY0Mk1Ndy1hN0FjTmpTSWVRNGJPOWVsUi11elVBMm92RHQ1SkN2WnNVai1ySkFRNkZ5cWtvbEJRUlpXMFZUSlBmaDh5dVpSTE5IbGl0M0NYMDVIQnlnTnRqNWpTbUJJX0RkemlUZFhReWFabU0?oc=5
2026-02-18	Google	0.0	GE HealthCare's $35M federal partnership to fund AI-powered ultrasound research - Radiology Business		https://news.google.com/rss/articles/CBMi0AFBVV95cUxPSE9Mb3VkczIwTVhyV05rWXJwNEdTQ1FKYkQ4LTVQZG9ta05MUE5Id1VGVmswWnpIV2dkem5IdTN2dGpVVmYtVmctZjE2dnVKU3JhSUl6M2x5ejRUN0xVc1NyeWFZR0ZPc21WX3d3MlVhbHhGR1EzT0pXbU9oRnd5dlFpTFBkUklxLVllOHBPV1RiWVJSS0pQb1FjTGJja3VCS3JJb1g1YTAybHBLSElJYzZrZm1Wc2toR3lQUjhEZ3F5V01tV2Z3a1BVcWlGdTVU?oc=5
2026-02-18	Google	0.0	GE HealthCare, BARDA ink $35M expansion to AI-enabled imaging deal - Healthcare Dive		https://news.google.com/rss/articles/CBMirAFBVV95cUxPWE9rTFpqWUQ4LThEYW05MDZ0Vm8xcDNSN1diZ3UxRU9PNVdxTmF4eHRnanpZZXlTS0NnbzhGUjJxQ05LZmZZS1NCNWhKVzZIa25WMlhsdWRnZVAxeEl2RC1yeDdqRndYdlc2cVZDZW9QRTB1aFQ1czVoNl82RERsbmhkV2k2R1lZbTNGUnA5MlNibmdsc1Fkd3F2czVjcldpT2pDSXpfVU1kVGda?oc=5
2026-02-18	Google	0.0	GE Vernova, SENER Meet to Discuss Collaboration - Mexico Business News		https://news.google.com/rss/articles/CBMiiwFBVV95cUxOVzFxNTVWWFNoblJyMkswdXpuckptRExUa2FrNGlXd2QzWUU1dU9uNDV5N2JVb3dYV3VGbk45ZXhZR0I0YXo3dFd3WU9RcDFWZjlHT191cWFwYXNMRGdDNGJWLXozRThKR0VHOUFGZXpaeUt6V2JfczZTZ0phQlVmSnFBQTBhRnVGRWFv?oc=5
2026-02-18	Google	0.0	M&G PLC Invests $1.52 Million in GE Aerospace $GE - MarketBeat		https://news.google.com/rss/articles/CBMiqgFBVV95cUxPd1RCSFZHZFlrWFZIMjUyMjZCbG9yMHR4MVhjeS1RZHA2alA2ZFNuNy1SZUs2XzdjclE5QWNrN2lxNlVIa0ktWWtSSnlNNmh4SFdTeG9GYmplM3EwRGotMFRGekdhWlU1N2JrWll6ZU9XY2UwMmtuT0RKcFBDYTFqcXhsNG1BYzZlNkhaWmtXWDdjTk5yQ1VuTTN0NnVTNnVvSENURTlrRGNxQQ?oc=5
2026-02-18	Google	0.0	See photos from Ash Wednesday service in Salem - Statesman Journal		https://news.google.com/rss/articles/CBMi0wFBVV95cUxQNFIwTkEwYllqNVA2akY4TmJZaDl6QTZhM2VTdVhOQ1JLdUM4UWYzRDk3U01Bdm5sRmNCOWYzZENDS1NYRC1TV0U2VnpnVnViTzVnSzlIQlRzcjVLSUlVbEhRQTdZZ1V4aks5djVHT256bkljeG1jQU1xTTRxODF2MVFzNjNsRHBnRTF6OG5NV1h6azJESTVjRmJPMWViOEx3MDBObnFXNHpWYW5rZVpSS0ZILWN3Mm9nZHh2YzJEdldKMDQybl9KZ2diYVlLWU81bWUw?oc=5
2026-02-18	Google	0.0	Will winter storm hit Delaware, I-95 corridor? Here's the forecast - The News Journal		https://news.google.com/rss/articles/CBMirAFBVV95cUxNMVU0TFFUUFFhX2d0MllLNU9UR3htdFNrZklSUXNQWm8yVU9HM3JOZWdoV3Y4c1lsOGZCVW5GMWJQc3VhOGt0UnBjMHRibmt4Z2NXUFlKWEJTZGEtSko4R01EQkVfa0JHNkZtV0QzQU5RVU5BZ1VLdzVNLXBuODJtNkc4dXB1SDZoWTV3UC1aRUt2dk5fNHVGNWk4cmdaQTdCdGZDY3VuV3hFX3gx?oc=5
2026-02-18	Google	-0.05	Jim Cramer Shared Why GE Vernova (GEV) Stock Got Crushed - Yahoo Finance		https://news.google.com/rss/articles/CBMiekFVX3lxTE5MRnhGZmdRVlFSNklUOXB1MlJVUFpwSnV1ellhVV9yNDdSUUN0TzdDbW51aERjYk5hZGI0NjBIRWhMMWlLMzFWZkhiaGdCVG9xdWVvQWljdFBnLU5fLUVvRjFhZFMzX25uS3llVDZoNU10OVZ1UE15ckJR?oc=5
2026-02-18	Google	-0.25	'Imperfect Women' On Apple TV: Why This Kerry Washington Thriller Is Already So Buzzy - Scary Mommy		https://news.google.com/rss/articles/CBMilgFBVV95cUxQNjVwc24tTWxUQzI1VHlvcGFUY1NwMHV3WG1nLXNRdjd2S2N3MEhGR0dvb0FKamR6V3lJNnpaVWxOTUdCT1lfN3FhdVpYeV9iQjhDdFZBdk10VWFpc1VORTRTSU9wdGIwRUI5VWRtdmFJOV8wRC1CQXNnYlhDaEIxSUxSVDBDRC1CRFJZdDh5a0YtVWlZSUE?oc=5
2026-02-17	Yahoo	0.25	Trump’s America First Agenda Is Pushing Industrial ETFs like XLI To The Moon	The industrial sector doesn’t make headlines like tech stocks do, but it’s the machinery behind infrastructure spending, defense budgets, and manufacturing cycles. When GDP growth accelerates or governments commit to multi-year infrastructure plans, industrial companies see order books expand. That’s the core thesis behind The Industrial Select Sector SPDR Fund (NYSEARCA:XLI), which offers pure exposure ... Trump’s America First Agenda Is Pushing Industrial ETFs like XLI To The Moon	https://247wallst.com/investing/2026/02/17/trumps-america-first-agenda-is-pushing-industrial-etfs-like-xli-to-the-moon/?.tsrc=rss
2026-02-17	Google	0.222	GE Aerospace's Quick Six with Packey Velleca - GE Aerospace		https://news.google.com/rss/articles/CBMihwFBVV95cUxPZjJtUDRHWDlTWmNldm56MDVKNnZJb1RiM1dyWW9PTThFZERqRHJtZzJfQXgzeUxqbERRdU9Jc2JPZkk2aDdvQXFDdUtZNndQLTcwckZic1FocVB1RGZpQ2hmMFVCeDUzdWpOUk50Wklqb2g3ZkFWa0pXcmhFRGo3SFFINy0tNFE?oc=5
2026-02-17	Google	0.0	GE Vernova Declares Second Quarter 2026 Dividend - Business Wire		https://news.google.com/rss/articles/CBMiqAFBVV95cUxPcW9YbXFOektQY3k4VVMtZ1pkcFNDcjVCUDJVTWdBaFpRUTZJVnc1Wjh1UTlkdkw4eEF3X0c2SF91UEVOaXJvSGtja3VieDV2Um9hcjQ1Y1NNU0Q2eFppdnlmYVVCNnlOZW1xQThLM3ZocUhYQ1pMX08zazJmQUZueFdaZUZCd3VQV1lwek9jNnk0dnlwT1JEZkxxVWdvcjNTTlRZOVZBYjY?oc=5
2026-02-17	Google	0.0	GE Vernova Declares Second Quarter 2026 Dividend - Yahoo Finance		https://news.google.com/rss/articles/CBMihwFBVV95cUxOcE9NODNaendLUzFxUHRqVGZVSmNhTDJDeWtXZTgxT3h1cjh2QlFlS3JfYU10WW8yN3lqZy1wZm1nNjB4cjExQkNuRDZlM1JKLUk4SXpCVmZQOXY0SnFSNmhaM0h1QmdpODNOX1hhckJYdHZsaGJuTUlCSm5oUF9OXzFTdENYc3M?oc=5
2026-02-17	Yahoo	0.0	How Jet Engines Are Powering Data Centers	Companies are converting aircraft engines to land-based natural gas turbines for power generation in the AI boom.	https://finance.yahoo.com/m/0bb3dc2b-f0b9-3b06-8822-66a27f508afb/how-jet-engines-are-powering.html?.tsrc=rss
2026-02-17	Yahoo	0.0	Praana Group Advances Strategic Expansion with Appointment of Darpan Parikh	Praana Group, a diversified conglomerate with businesses spanning specialty chemicals and fiberglass, and Galata Chemicals, a global leader in specialty additives and performance chemicals, have announced the appointment of Darpan Parikh as the Member of their Board and Chief Executive Officer of Galata Chemicals. This appointment marks an important milestone in the Group's continued evolution as a globally integrated specialty chemicals and advanced materials platform.	https://finance.yahoo.com/news/praana-group-advances-strategic-expansion-123200522.html?.tsrc=rss
2026-02-17	Yahoo	0.0	Stock Market Today, Feb. 17: Amazon Stops Slide Spurred By AI Spending Fears	Today, Feb. 17, 2026, AI spending angst rattled growth stocks even as value names quietly propped up a volatile Wall Street session.	https://www.fool.com/coverage/stock-market-today/2026/02/17/stock-market-today-feb-17-amazon-stops-slide-spurred-on-by-ai-spending-fears/?.tsrc=rss
2026-02-17	Google	0.0	Stocks Rebound Off Lows; GE Aerospace, Nextpower, Five Below Flash Buy Signals - Investor's Business Daily		https://news.google.com/rss/articles/CBMiY0FVX3lxTE04SHVkNFRSc25SY2JNbVZUcjluZmY2SGpsd1FGNnBhX1NRNDZiOGVtZlM4V0FHLWwxZ1JKWjRXSE91QUd4OTdiNmc0c0czLXpLRWJZaHJSTEVxendOQUUyYzVzZw?oc=5
2026-02-17	Google	0.0	United Airlines picks GE Aerospace engines for historic Boeing Dreamliner order - The Business Journals		https://news.google.com/rss/articles/CBMirwFBVV95cUxOU1BWS0JweU0wU0lRemxJY0x2SFM1eEVzYUR1QnBZcTdLUUVxaGxFbzd5cVNjN081UmEtdEhNVmdwc2ZqSHUwMzVtWFMwcEJFNlNFVFc4MnVOYU9NOUZ0WnI4Yl91ckJGRmhxQWxvWUV5cldnNTNGRkh4OGVUcWFDWV9ZV1REa3ZlRHgxczNacXhzamlQbTBFZWdxUV9sd0JuSl9HZ0oyUGlFYVhTazlR?oc=5
2026-02-17	Google	0.0	Washer Timer Control Knob Replacement WH01X10460 WE01X20378 GE Washer & Dryer Parts Knob Compatible With GE Dryer WE01X20378 AP5806667 175D3296P001 WH01X10460(2PCS GE Vented Dryer Clothes Dryers Precision Auto Labs Dryer Kn - hotelier.com.py		https://news.google.com/rss/articles/CBMiowFBVV95cUxNcjhKS3NfSkROMG5aM0h3VW5DQkhiWXBCd1N2VWRJVk9YM0JDMEJWaEpNYTBKTDd6OEVkQ24ycGZmUmNHa3pnWUV3aDAtRG90SUE2ZW91ZnVUSGRPZm95aG1fQVBPczZHbWliWEFzS0FPS2ZUYzBjTG5GSWRzam5lT2FFNnRiVjFiQ194RDdYNGZ6ZTJfMWgyYjZ6ZEh1T0FzaTU0?oc=5
2026-02-17	Google	-0.117	Why Amazon Stock and the Rest of Big Tech Could Be the Next GE. That’s Not a Good Thing. - Barron's		https://news.google.com/rss/articles/CBMihANBVV95cUxQcXNIX0lBZ3VoVXhPTTE2R0lEVFNoSFNqXzc0YWtiQW5PUEEwMk1Ha3Jtd3oyWFFtQURIR3NGYm9JRXl3OFJZY3JzbzFjRzVlblNUMUR5LVQxRjYzZHZCRjdySllkb19ucHVrT1lkVnMzSzBTM0lONk1aR19BbWFaU0dxcHg2NC1yRERhLVdvN3hMODFCbXNpTzEzYjlGQTlqYW1Rbk5DSk5oT1o3Y2N5M0tJSnpPbENiRzJpcHNsSXZlQS1mQkViVUdZZWpZQVhjX0NkVTZHc0FYNVZJeHh0TWdFQXNIOW85dUlvWUxVUFBnQlozeWd6SGotNHN2N0hzYzVNLWdQZVZFZU5MYXAtMHU5djRscm1wTlpyYjE2V29mQ2g3WVZiLXdaSENsclNubEQ3TXhRdGR5Yk14RjF1alQ4M2piNGFoZy1oQUZrTHIwOGFjUkN1UWR0Z1BHWnlWcHF0MVV3SVFyaDRCZmREODBHQzFKZExMZXFPLUlPNThNTUlN?oc=5
2026-02-17	Yahoo	-0.138	GE Aerospace Wins Big United Deal And Expands Long Term Engine Base	GE Aerospace, part of General Electric (NYSE:GE), has agreed to supply 300 GEnx engines to United Airlines for its Boeing 787 Dreamliner fleet. The deal secures United’s position as the largest GEnx operator worldwide and deepens GE’s role in widebody aircraft propulsion. The agreement also supports a long runway of recurring service and maintenance work tied to these engines over time. For investors, this update is central to GE’s aviation-focused profile, with GE Aerospace as the core...	https://finance.yahoo.com/news/ge-aerospace-wins-big-united-231308249.html?.tsrc=rss
2026-02-17	Google	-0.138	GE Aerospace Wins Big United Deal And Expands Long Term Engine Base - Yahoo Finance		https://news.google.com/rss/articles/CBMif0FVX3lxTE9Vc2Z6VDV1b0I1MTIwb1lqVmpCX2ZYOUNtTXF2WGpNWkhsZmREQ2F6UG54NkNOSmY1dHZmbUlmQzNCZk5XOGxkdWdLa2lkeGlsYk9VdzR1bDg3RHJxaTUyR09Wc1FhZWhQd3A1VGVEV3hPWW1ITUFrajkyaHdreXc?oc=5
2026-02-16	Yahoo	0.5	From Aerospace to AI: 3 Names Supercharging Dividends	After posting massive gains in 2025, a jet engine behemoth just boosted its dividend by over 30%. Meanwhile, two key AI stocks also announced strong increases.	https://www.dividendstocks.com/articles/from-aerospace-to-ai-3-names-supercharging-dividends/?utm_source=yahoofinance&utm_medium=yahoofinance&.tsrc=rss
2026-02-16	Google	0.318	United picks 300 new jet engines, becomes top GEnx 787 operator - Stock Titan		https://news.google.com/rss/articles/CBMivAFBVV95cUxNLU9lNHpyOG5RdWVpN284aW95RzM3Y3ZyVlRSYS1tSkw1eE41Tk85YkxsZkJnZHZta05yS0FBSnNQZHl0Y0lWT2NFWW83TWdfM211LVplMmJhS1NyX185MGx6TDN6VG1CVFB0UFl5ejB1ejE4VzhVZVBhZ0tFaFRZMng2anBKcDJ1WXJadEh0RE5aMVQ4OU5PcnNqTVBMZjBHcmNlSkw3ODJEM2JnUThkSGdoSVEydGZUZVB5YQ?oc=5
2026-02-16	Google	0.136	Duke eyes new nuclear plant in NC; Wilmington company could play a role - Wilmington Star-News		https://news.google.com/rss/articles/CBMi4gFBVV95cUxOLUtsZU13MFV3aURyYXNDNEU5eXpMQVlHeFkyakVTNWFxX2RsT3lFSU1zUFE5YnJubl8tS2VfcGhxcWVJMi1aTlRmdnNHWG1wSEFlTnNFd05fSjVvcWZ4V0F2VnNqRXk4TmhYazE4MXlUU3RMdFFtSXFQWUU2Nmp0VVB3d19JenZ4LUJpRndHU3BNN2VxdExWU3hsTVpyRzZwVlpPYlVHeC1FTU02SWtMSFd4NlJ1a1JFLVFiZjdRT2ltdUJfV01UOTdDdEZqcm91N21ncV9qSDZYa1FDUW5JTXN3?oc=5
2026-02-16	Yahoo	0.136	United Airlines Selects GE Aerospace GEnx Engines to Power New 787 Dreamliners	GE Aerospace (NYSE:GE) announced today that United Airlines (Nasdaq: UAL) has selected 300 GEnx engines to power their new Boeing 787 Dreamliners. The agreement also includes additional spare engines and brings United Airlines' 787 fleet to more than 200 GEnx powered aircraft.	https://finance.yahoo.com/news/united-airlines-selects-ge-aerospace-145000574.html?.tsrc=rss
2026-02-16	Google	0.114	GE Vernova (NYSE:GEV) Is Doing The Right Things To Multiply Its Share Price - Yahoo Finance		https://news.google.com/rss/articles/CBMie0FVX3lxTE92Qm9qUUlhUFN0T0Z2WlAyaE5TRl9sUHNFMlIzNVJJX1Q4Tl9PVnRZTGEzXzFCNnM3Wk5RR1RHd1lTbi1scDljeEVuX1FKelZlSUdIVlNCQ01XekdIZFdGUEw3T19SSm80emlWUXlMaFRsdndPb2Z4eWV5cw?oc=5
2026-02-16	Yahoo	0.0	Brink’s Announces Adrian Button as EVP and President, Brink’s North America (NA)	RICHMOND, Va., Feb. 16, 2026 (GLOBE NEWSWIRE) -- The Brink’s Company (NYSE:BCO), a leading global provider of cash and valuables management, digital retail solutions (DRS), and ATM managed services (AMS), today announced that Adrian Button has been appointed executive vice president and president, Brink’s North America, effective immediately. Adrian will join the executive leadership team and report directly to Mark Eubanks, president and chief executive officer. Adrian brings more than 30 years	https://finance.yahoo.com/news/brink-announces-adrian-button-evp-130000783.html?.tsrc=rss
2026-02-16	Google	0.0	GE Aerospace Explores Automation in Engine Repair Work - AVweb		https://news.google.com/rss/articles/CBMiekFVX3lxTFB4cUhOYkJTYkN1bVNvTzEtLTJoaFlHSHFSdzRuSnhoVjh2ZzRFNGtDeGZBVEFnaF9jLTg1bU1ESHhOYU5UVnAwcndxMEVjWHF4NXpPdDhISU50WlhFb25QX0hTcS05N3U1SS1UXy1oalJqbFJwamxUdVVR?oc=5
2026-02-16	Google	0.0	GE Electric Stock Surged 50% Last Year. Here’s What Could Drive Further Gains in 2026 - TIKR.com		https://news.google.com/rss/articles/CBMirAFBVV95cUxOdFJvd3JPY1NESUpCUUlTU3o3QXNVeVJBT3haanlkSnBRZEs3NHdqekEyNzIwamtfM19zanpZam1fLVVLZWl4NmsxU3VvSTVQMWV6Z0dYZ1lDLWNDSGYtNXc2V1RDWVpNQkUzOEt3Q2hpUXVFTzdBY3B5VElQSDllUDYtVTdKM1ZXQklIak5kbU05RU1NX1JvaF9CUDhKNXJ3dE5IYXVZbVRaWWdx?oc=5
2026-02-16	Google	0.0	LACoFD Air Operations welcomes visit from GE President - Fire & Safety Journal Americas		https://news.google.com/rss/articles/CBMinAFBVV95cUxNWHo4Z3NiZWIwbEFSeEc0SGN2TE5vY0N0blZHNmtOUy1kNWNXVzFOc1lsM3ZELXd1dXphVXJZU2tKTWFxYlBwQmtQYXU1dFU4M0t2M3BTT0tVemNRVV9UVlVDR09adFNlaTV3QkwxTkJwcWlkbWliY1J5R2ZmcGdzbHpPNmNLd1QtNVVzc1NpUTVlLW5uTWQzWWcxY08?oc=5
2026-02-16	Google	0.0	Looking Into GE Aerospace's Recent Short Interest - Benzinga		https://news.google.com/rss/articles/CBMisAFBVV95cUxNcGJJSy1fd2x3UEQ2LUVRQlNRZV9sWmpsU0tfSmpHTFd6aWRkYUlIeTVUSDhiaVVIVGxLYUEydzlyalZBS0YtSVhqLWowTWZtU183STFyZzFHTkZWT0FqVHEzVC1MOS1TdTNOUF9oSXBXYW9oZlVGRE9RS1BoTm1qNTlqckJOWmtMdTdNSlA2bDdJSWZYY1BHdlNyVVdXNEhaYlJ0RG9fdDJJNGkxQjdaWg?oc=5
2026-02-16	Yahoo	0.0	Strength in Defense & Propulsion Unit Drives GE Aerospace: Can It Sustain?	GE's Defense & Propulsion unit gains steam on major engine contracts and double-digit order growth-can momentum carry into 2026?	https://finance.yahoo.com/news/strength-defense-propulsion-unit-drives-145300890.html?.tsrc=rss
2026-02-16	Google	0.0	Walmart is offering $180 off its GE Profile Opal 2.0 Nugget Ice Maker - AL.com		https://news.google.com/rss/articles/CBMirAFBVV95cUxOMnBTQ3pNMlNoWXprUk5xZ2ctU3hmMGJ2bWZRamJzRGZNRGVHYmx1c0k5SGZrUzdRUGRpdnpncnAzLV9MYWs3UFQtenl0Q3dVWjBrSmVSR0I1OVpfdVNvQXlKRkV1MG9hTF8yR3lYWkJCc09oTmlUdXQ1TmhvbUdwd2pJYjEza0Z4VGc0a2J0TktpT3FzMGRFN2ZJN1d1QndMUkJuSGhubXF5X2Ra0gHAAUFVX3lxTE1HQVhGeFZrdUY5UHNDUW92a1o3RkFvNWE4OEJKT0dVTEhOT2JXenBIV20yX1dQV29Lbjg0dEw0djZpaWVpTEFqRXJQRFpWVlVKWV9sdkcwb0x3Q1B1cXI2YlUzSGJLNkN2WW5zY2lMa1BVak13ZDkzTDBzTi1hVzFrRkxqZjBlMVdCMXZzWmdGaFltTFFTQUNwMmUxR3NDS0twbmlLbjgzbWtBczhRdktycXNUc25rTkxfQzRNSmNwWQ?oc=5
2026-02-16	Google	0.0	Why United Picked GE Aerospace To Power Its Growing 787 Fleet - Simple Flying		https://news.google.com/rss/articles/CBMiiwFBVV95cUxNZk45NHlPOFRiNVp1cGxMMjRlb1dNaG9BZXhiRjNJOWMtYmxxNkpyYXdTSXY4RWppZFdjUzhKbGRoYm94bU81eFNsVmdESFkzOHRvLW5ickVHa0xEM09xalZWOFNBMVVXNVNZdVpUSFpqbHgxeFhqMHpPY1RLcUgtcU1US1llM2wxVGRv?oc=5
2026-02-16	Google	0.0	“Big Bet on Efficiency” United Airlines (UAL) Expands GE Aerospace Partnership with 300 GEnx Engines - TipRanks		https://news.google.com/rss/articles/CBMixAFBVV95cUxOVGJGaDRrNUpOTEs2ODM0OENFVUNZUFg5Mmg5WUw1RVpOR3lpMjdrYkY0bTBMdUhqZjlQc0lnX2lxSGZTSmh3UWpzOWp6NVhnaEJ5UjZIa1h6Zl85UUZKS3RUT1BsSGJUa2hnYzR1bFlWQWhFMVJqVVJTbXE3WTZDT1dfLVBZeWpIdkdQb1VIRl9KZEZ2T0JCSmlTQjlIZkJ0OGQ1SUpEdmhqejZJLS1WQnIyWE9yclk2RTIybTBnWjBxMnow?oc=5
2026-02-16	Google	-0.167	Proton GE 10-32 Fixes Akiba's Trip After Previous Update - Steam Deck HQ		https://news.google.com/rss/articles/CBMickFVX3lxTE9qNEFVWEpIdGRYMXBXTU5obFJSLUN2anIxZTR2aWNLa2ZGVElWcGdfQXNyTVVVQmRNV1RSTWlCeXBZMjh4dDRjVk5PdVJwVWR6SS1oNWdTNldiUzNpYlFieldPSDduMm5hMzRXV3o0QkgtUQ?oc=5
