Date	Source	Sentiment	Headline	Summary	URL
2026-02-22	Yahoo	0.214	Needham Lowers Super Micro (SMCI) Price Target to $40, Keeps Buy	We recently published an article titled 12 Best Data Storage Stocks to Buy Right Now. On February 4, Needham lowered its price target on Super Micro Computer, Inc. (NASDAQ:SMCI) to $40 from $51 while maintaining a Buy rating. The firm attributed the company’s second-quarter earnings outperformance to a large-scale data center deployment by a major […]	https://finance.yahoo.com/news/needham-lowers-super-micro-smci-122737669.html?.tsrc=rss
2026-02-21	Google	0.083	Super Micro Computer: The Less Discussed FQ2 Accounting Items (Rating Upgrade) - Seeking Alpha		https://news.google.com/rss/articles/CBMisgFBVV95cUxPdnl1dXNTb0JHMDgxWDUwaFRQeWpkMkVJSWNXU0RoRWR0SnJwZG9MVXJaSjg1UEk1Mi1udGFmb0VEVjNBUmFBMG1JajBTOEh1STJSejhJMGhXSG9iN2o1X29YVG8zNWZ5U3F2d3VYa1ZHQ0pJLWpVM3lvQjZlYWNGWTJvd0Jhb0NUd1NfdnYtY3V3SzAwOW5JdDlVS0NhejJBbS1HbEg0RWtMYVdvUTFISWpB?oc=5
2026-02-20	Yahoo	0.292	Super Micro Computer, Inc. (SMCI) Is a Trending Stock: Facts to Know Before Betting on It	Recently, Zacks.com users have been paying close attention to Super Micro (SMCI). This makes it worthwhile to examine what the stock has in store.	https://finance.yahoo.com/news/super-micro-computer-inc-smci-140002827.html?.tsrc=rss
2026-02-20	Google	0.222	Why Super Micro Computer Stock (SMCI) Jumped 8% - TipRanks		https://news.google.com/rss/articles/CBMijAFBVV95cUxNekYzX1U3LTRrcDZsZ1NpZW1mVDl0WXJ5eTl6OElwc28tSlEtV3dLZkZHSG1vSFY5RWdJMDNQOHM0VnZaYzJHSkI2Z1Z1Yk9wR1loOG5TZTBrLWxaWXpkUU51TDNJZUp3R1E4dWFBa2IxaFVwbW84aFduVHljWVBvdWpURXhWZkRnVDZIcg?oc=5
2026-02-20	Google	0.167	Super Micro Computer (SMCI) Stock Surges 8% on $40B Revenue Outlook and Analyst Upgrade - CoinCentral		https://news.google.com/rss/articles/CBMirAFBVV95cUxOS0NuVVo0dXJQSU1tdU9FSGZLTXVoVHA4aEpVNDg5STh3c3k5Y1pqMzJpMXNJSDY5cDJEdXg4RkFqT2hTSV9uUDZFQjQzWkJVOXRCemlsSmhaTXEwT1JpMGpNX3JJX1U4UWt4bEVUUWZvYVZoMGpnZXFwdjBldmcyY21jd2dfSmMyZlpleTEtV3RLNDlZNzZ0cUhyQmhDd0RzbDJ3a0N2ajJ6X0JM?oc=5
2026-02-20	Google	0.083	Super Micro (SMCI) Shows Mixed Options Sentiment Amid Trading Su - GuruFocus		https://news.google.com/rss/articles/CBMipwFBVV95cUxOb3dKOHBnSFFJM0Y1VDQ0VDlhNlU2VzNTWU5SdFFsTzNmbjRJYU5XM0NxVS00R1huY2lrbnp1ZUdLaEdic0RFMzlXRjZ1QXRkS3g4Y3ZuVFVQYS11N1ZJanhiWUcwcTR4UENqNzhaa1dTbDRVRFNnenNqNWZvWUtFajRpZ3Z3dkpHN1VhWWZJWW5jOHdwVzZsaFJlTGZXd042TEdJSk1Jaw?oc=5
2026-02-20	Yahoo	-0.091	Troubled Nvidia ally Supermicro pledged to hire a new CFO ‘immediately.’ That was 14 months ago.	“No one wants this job,” said executive search firm Cowen Partners president Shawn Cole.	https://finance.yahoo.com/news/troubled-nvidia-ally-supermicro-pledged-051300669.html?.tsrc=rss
2026-02-19	Google	0.333	Super Micro Computer Shares Rise 8.25% on Analyst Upgrades - Intellectia AI		https://news.google.com/rss/articles/CBMilAFBVV95cUxNS1hraGRtRWpkWFdUbExib2tfYlk3aVczdzBtXzdoQm5TaF9leHRaS05FYW5mbmFVYXp2Ujc1OWZVajRGMUNxYm5PczlyeVlJQ3NzRHY1M3RnOFkxLUZ3YlNWb3ktcFhOUW9aSTFFVDJ3NHVuNkFuMGJEbjRKMEtfdFlvN2tTX25HeUJVSXpSb1RfOUhp?oc=5
2026-02-19	Yahoo	0.333	Super Micro Shares Jump 5% -- Bullish Options Bets Ignite a Comeback	Super Micro Jumps as Traders Pile Into Calls. Momentum Returns	https://finance.yahoo.com/news/super-micro-shares-jump-5-182017868.html?.tsrc=rss
2026-02-19	Google	0.333	Where Will Super Micro Computer Stock Be in 5 Years? - The Globe and Mail		https://news.google.com/rss/articles/CBMi0AFBVV95cUxOWWd4SUx1WjVORlZXdnlFc0VocUU3aVdRM3NnVkh0YmJSMV9wZ2tURFhmQkowdGVFLW9UYkRmWHJYeF9LS2t2ZllZZmMzQzFCMEF6RmZrLWZ3LXFSNWp5WThLUzBaRldmUy1rRmc5ZFp6ZjdHbk9rbGxEeHlpWFNfeUM3RHcxbWJBRi1HTFA4T1lyMVNpOVl0d0p1OGd6QW5YdGxGV2tRZFBocWQ5TF9KczhiMW5iYnQyV3REUEpfd2h4eGxlc3V4cGlRSUpwTTc2?oc=5
2026-02-19	Yahoo	0.115	Super Micro Computer Stock Is Pushing Above Its 50-Day Moving Average. Should You Buy SMCI Here?	Supermicro shares inched higher on a significant increase in bullish options activity. Here’s why SMCI stock is likely undervalued at current levels.	https://www.barchart.com/story/news/312879/super-micro-computer-stock-is-pushing-above-its-50-day-moving-average-should-you-buy-smci-here?.tsrc=rss
2026-02-19	Yahoo	0.048	Stock Market Today, Feb. 19: Super Micro Computer Surges After $40B Revenue Outlook Reignites AI Momentum	Super Micro advances after pointing to at least $40 billion in full-year revenue following record quarterly results tied to AI systems. The stock’s sharp jump puts the spotlight on whether the company can keep converting that demand into stronger margins.	https://www.fool.com/coverage/stock-market-today/2026/02/19/stock-market-today-feb-19-super-micro-computer-surges-after-usd40b-revenue-outlook-reignites-ai-momentum/?.tsrc=rss
2026-02-19	Google	0.04	TSLA, PLTR and SMCI Forecasts – Tech Stocks Mixed Early on Thursday as Traders Uncertain - FXEmpire		https://news.google.com/rss/articles/CBMi0gFBVV95cUxQQS1hVmZaeHNGVll6dXVPVTdiVnNoSFV6a1A4anh6UFJpTjRXSjd4M1ZQNVRkaVU3ZUsxYWtmZW4zRmJPUnZ6Wk9VMVFZR1NJd3FDMkNMcDV2dlBWSGs4Z0NoTzVNamR0dlFLbUhsWm9WaTI5OE1pVjR4S0VKaXVzZjU4ZWpMMG1feGhQc1RJQVoyYkh0dFBJUGhEQUNDbjVyTWFxUTVhVEFYYmFTZU55Q2ZRbnVqQlJvRURnbTJvZFBuZVFPU0xJMVRzVUhibVVNWXc?oc=5
2026-02-19	Google	0.0	Supermicro Eyes 'Make In India' Move For AI Servers - Benzinga		https://news.google.com/rss/articles/CBMipAFBVV95cUxNckVkdHZMejljSDJVWG9xSm5ubGFQb1lTZUp3Z21kTjV2bEVtMTdoWG50cElfWW1ITnoteHFrVEhZbWxqeTJ1clZ2dHB6UGVoc2Y3NzgzdW1EWC1YT3RQQ1JBZTA0Tlo2RDZEU2gtT0JuUGtFbzJWd1A2Yjk2VW01RXc0OTBxMkxLLUlISjVNQnNqR0JLanVzU0NUT1dTWVRjR0pqUA?oc=5
2026-02-18	Yahoo	0.311	DELL vs. SMCI: Which AI-Server Stock Offers Better Growth Opportunity?	Super Micro Computer's AI-driven revenue surge, rack-scale expansion and lower valuation stack up against Dell's margin pressures in the AI server race.	https://finance.yahoo.com/news/dell-vs-smci-ai-server-180000146.html?.tsrc=rss
2026-02-18	Google	0.3	DELL vs. SMCI: Which AI-Server Stock Offers Better Growth Opportunity? - Zacks Investment Research		https://news.google.com/rss/articles/CBMirAFBVV95cUxNekF4Z3ZnajhCV1V1V1NodG9XOTl5anpSN2Y4c1VJeHF0SG5lQTV1cVB5clVXejlkS0FqczR4ZG5ZMWRIb0VFNTdSR3NfakxUM2lUN2lNT2ZvMmx3UFNuczM3ZW0wQ2FrU1cyVEUxMm5YTWp4cVU2SE8xS0R4Qk0wWEJsRTgzbGlJWHpMdDhlNEFvT1FZendSTzZNN0VrSnRIM1hFblJvb0l4NGRv?oc=5
2026-02-18	Google	0.167	Nvidia Partner Super Micro's Momentum Drops As Investors Shrug Off Earnings Surprise— Shares Approach 52-Week Low - Benzinga		https://news.google.com/rss/articles/CBMi_AFBVV95cUxOZHhZalZDSlVlWFBNeXE2cUpoR0UwU3B6RjA2N2FqT1RjQXQxUnVMdWRaaHBrWmE0VW95ZWhFZFFDc1lXUE9WVHhpNXdIRHlCS3I4bjBzMXBLRU9fSWRoMEhPLVI1dUhpRmVKbUgzaFJLbXBQNjU1M19zTjNua0d6SEhUVW41bzl1Y3JYQ3l4dUF3RGZsNmpGbXM0eTlkTFl5LTIxUGo2VXl1Mzc5Z3JaYndnR1h4d1RVNUc2UGh2dWE3c3VFSHRvLVVHS0JnUnZnZk9obDJYRlAxVEsyVVpCMWdodGlPOVE3bVpiWmM3ZzR6ZXJmTXc3UVVOSUc?oc=5
2026-02-18	Google	0.167	Super Micro (SMCI) Options Show Mixed Sentiment Amid Stock Dip - GuruFocus		https://news.google.com/rss/articles/CBMioAFBVV95cUxPTUVCSHI2Z05NSmFiXzd5TGk0T0ZrWDdsSXlnWjV0U2I2UXFPTDhWVDJXaFlvMm9JaUlqczRVaW9FTk9IRmowSlFIOXFUX2JYVzgzX0NoNXF4bEd2cVU3X3RLa2RpdEhINFhJbHVTaTRZTmVHZ2VCRHlNYXNOOWFaNmN5ZG5BSXlqLVFKbkZyUnA3TGM3ZXhibGw5TTVUV1pj?oc=5
2026-02-17	Google	0.217	Super Micro (SMCI) Shows Bearish Options Sentiment Amid Modest Share Dip - GuruFocus		https://news.google.com/rss/articles/CBMirgFBVV95cUxOVG5rTE9YV0F0MHIyMXhCU1VnVDNTSVdDbERHeUVaQTQtSEtrdzNiRDhrd1Nfc1VIajV0b0tzbHlNUXN6bjRmdGdwT1ZmXzZLTWkxbHdJT2hwX1k4ekJjWXFxQlR0N045M0FmSnRiVmMxeGg3cERDSGJsMjhpa2FsY1RGam9kU0dPS1lUQ1IzdVdfbnljby1fS3hjQWZBbGhnRHlNUEdYWms5S2E3ZUE?oc=5
2026-02-17	Yahoo	0.012	Super Micro Computer (SMCI) Trading 35% Below Analyst Targets After 11% Weekly Drop	Super Micro Computer (Nasdaq: SMCI) is trading at $30.54, down 11.2% over the past week. Yet Wall Street analysts see the stock climbing to an average target of $41.31, implying 35% upside from current levels. That gap widened sharply during the recent selloff, raising the question: is the market pricing in risks analysts are missing, ... Super Micro Computer (SMCI) Trading 35% Below Analyst Targets After 11% Weekly Drop	https://247wallst.com/investing/2026/02/17/super-micro-computer-smci-trading-35-below-analyst-targets-after-11-weekly-drop/?.tsrc=rss
2026-02-15	Yahoo	0.22	Super Micro Computer (SMCI) Week in Review: 11% Stock Drop Despite 123% Growth	Super Micro Computer (NASDAQ:SMCI) dropped 11.2% this week, closing at $30.54 on Friday. The decline stands out against the broader market’s modest pullback. The S&amp;P 500 (NYSEARCA:SPY) fell 1.3% and the Nasdaq-100 (NASDAQ:QQQ) dropped 1.3% over the same period. Despite the weekly selloff, SMCI remains up 4.3% year-to-date. Three storylines explain what moved the stock ... Super Micro Computer (SMCI) Week in Review: 11% Stock Drop Despite 123% Growth	https://247wallst.com/investing/2026/02/15/super-micro-computer-smci-week-in-review-11-stock-drop-despite-123-growth/?.tsrc=rss
2026-02-14	Yahoo	0.223	Super Micro Balances AI Infrastructure Growth With Pressured Margins And Competition	Super Micro Computer (NasdaqGS:SMCI) is reporting strong long term growth in AI focused server infrastructure, supported by rising demand from data center and enterprise customers. The company continues to face margin pressure and intense competition, yet is still growing market share and generating positive free cash flow. Management has raised revenue guidance and is engaging directly with customers and investors at major technology and investor conferences. Super Micro Computer focuses...	https://finance.yahoo.com/news/super-micro-balances-ai-infrastructure-071116609.html?.tsrc=rss
2026-02-13	Yahoo	0.298	1 Volatile Stock to Own for Decades and 2 We Avoid	A highly volatile stock can deliver big gains - or just as easily wipe out a portfolio if things go south. While some investors embrace risk, mistakes can be costly for those who aren’t prepared.	https://finance.yahoo.com/news/1-volatile-stock-own-decades-044240366.html?.tsrc=rss
2026-02-13	Yahoo	0.25	NVIDIA vs. SMCI: Which AI Hardware Stock Is the Better Buy Now?	With AI demand surging, NVIDIA's soaring revenue and 73%+ gross margin outshine Supermicro's margin squeeze. Is NVDA the smarter AI bet now?	https://finance.yahoo.com/news/nvidia-vs-smci-ai-hardware-200000479.html?.tsrc=rss
2026-02-13	Yahoo	0.235	Super Micro Computer’s (SMCI) Increased Full year Outlook Still Conservative	Super Micro Computer, Inc. (NASDAQ:SMCI) is one of the 10 undervalued growth stocks for the next 5 years. Super Micro Computer (NASDAQ:SMCI) is up over 10% since the earnings report on February 3. A major factor driving this sentiment is the CEO’s comment on the earnings call regarding the company’s $40 billion revenue target. He called […]	https://finance.yahoo.com/news/super-micro-computer-smci-increased-161752896.html?.tsrc=rss
2026-02-13	Yahoo	0.0	Should You Buy, Sell, or Hold Vertiv Stock Post Q4 Earnings?	VRT stock dips after Q4, but explosive AI-driven order growth, a record $15B backlog, and upbeat 1Q26 outlook keep investors watching closely.	https://finance.yahoo.com/news/buy-sell-hold-vertiv-stock-162700810.html?.tsrc=rss
2026-02-13	Yahoo	0.0	Supermicro Announces Participation in Upcoming Investor Events	SAN JOSE, Calif., February 13, 2026--Super Micro Computer, Inc. (Nasdaq: SMCI), a Total IT Solution Provider for AI/ML, HPC, Cloud, Storage, and 5G/Edge, today announced its participation in the upcoming investor conferences:	https://finance.yahoo.com/news/supermicro-announces-participation-upcoming-investor-140500821.html?.tsrc=rss
2026-02-12	Yahoo	0.333	Super Micro (SMCI): 3 Reasons We Love This Stock	Super Micro has gotten torched over the last six months - since August 2025, its stock price has dropped 30.9% to $32.09 per share. This may have investors wondering how to approach the situation.	https://finance.yahoo.com/news/super-micro-smci-3-reasons-040315959.html?.tsrc=rss
2026-02-12	Yahoo	0.112	Super Micro Computer Balances AI Growth With Margin And Competition Risks	Super Micro Computer (NasdaqGS:SMCI) reports strong revenue growth and rising demand for its AI server and data center solutions. The company highlights ongoing pressure on gross profit margins, which are currently at low levels relative to its recent history. Management points to higher-margin product adoption as a potential support for margins over time, against a backdrop of heightened AI infrastructure competition. Super Micro Computer, trading under NasdaqGS:SMCI, sits at the center of...	https://finance.yahoo.com/news/super-micro-computer-balances-ai-161048979.html?.tsrc=rss
2026-02-12	Yahoo	0.018	GraniteShares Announces Weekly Distributions for its YieldBOOST ETFs: COYY, TSYY, NVYY, XBTY, AMYY, TQQY, AZYY, YSPY, MTYY, PLYY, HOYY, SMYY, BBYY, FBYY, IOYY, MAAY, NUGY, SEMY, QBY, RGYY, HMYY and RTYY	New York, Feb. 12, 2026 (GLOBE NEWSWIRE) -- GraniteShares today announced the weekly distributions for its GraniteShares YieldBOOST ETFs: COYY, TSYY, NVYY, XBTY, AMYY, TQQY, AZYY, YSPY, MTYY, PLYY, HOYY, SMYY, BBYY, FBYY, IOYY, MAAY, NUGY, SEMY, QBY, RGYY, HMYY and RTYY as shown in the table below. ETF TickerETF NameDistribution FrequencyDistribution per ShareDistribution Rate1,330-Day SEC Yield2ROC4Ex-Date & Record Date5,6Payment Date7COYYGraniteShares YieldBOOST COIN ETFWeekly$0.13624150.69%0.	https://finance.yahoo.com/news/graniteshares-announces-weekly-distributions-yieldboost-140800119.html?.tsrc=rss
2026-02-11	Google	0.167	Super Micro Computer (SMCI) Navigates Growth and Profitability Challenges - Yahoo Finance		https://news.google.com/rss/articles/CBMiiAFBVV95cUxPQWVleHVHRUIwUk5kZy1iVFJ2cV9VOWd1OUp6S0NBRFlKTm9BTldUVTU4RVVDcTZ4bjNuQkQ5c3lqZGd3TDJnOWVwa1JBTHd1MFFRYUpwSnc2LTFTdTVSWTg2WXRhMjJyODkxSGtrbHVRR2NUYW5RS1pERkdVel94eFg4RGJCdDk2?oc=5
2026-02-10	Yahoo	0.333	Super Micro (SMCI) Is One of the AI Stocks Analysts Are Watching After Q2 Blowout	Super Micro Computer, Inc. (NASDAQ:SMCI) is one of the 10 AI Stocks Analysts Are Watching. On February 4, Rosenblatt analyst Kevin Cassidy reiterated a Buy rating on the stock with a $50.00 price target. The rating affirmation follows SMCI’s robust fiscal Q2 2026 results. SMCI’s had a significant earnings and revenue beat, posting an earnings per share […]	https://finance.yahoo.com/news/super-micro-smci-one-ai-154047743.html?.tsrc=rss
2026-02-09	Google	0.067	Investors Heavily Search Super Micro Computer, Inc. (SMCI): Here is What You Need to Know - Yahoo Finance		https://news.google.com/rss/articles/CBMiigFBVV95cUxOY29OZ01fUHAzOVJoOXdCYWlmWkx1YVliZ3dZUjhGSmRQS3ZBVmdmYmIzUnA0RjNCN1U0bVNYcVZhMEhDTHhKZlpNNEg3dUswN0FPczBfNkozSFk2UElsRlRqd0llVko3WEV6SzVkNktKOUFhMWZoZUM3aFNHRFZCMWNCd1FqVERUYWc?oc=5
2026-02-07	Google	0.333	Super Micro (SMCI) Jumps 18% on ‘More-Than-Double’ Sales Target - Yahoo Finance		https://news.google.com/rss/articles/CBMie0FVX3lxTFA0V2hESndFUWlGeXBqZzV1ZndtNVBreGhiNkdRd0Vqd0dObGhvM3NTbWhiSHE1YkE5NHpKV0dvUURjVVl2Sm5VT3ljWG9xVExKTGhBOHRHcktiTVM0cVQzWG5MdjBsVmxvbWN2bGxCRjZqUWZuLTcwTF9yVQ?oc=5
2026-02-06	Google	0.417	Why Super Micro Computer (SMCI) is a Top Value Stock for the Long-Term - Yahoo Finance		https://news.google.com/rss/articles/CBMigAFBVV95cUxQRy1xUUtmay1RVmFXN1NfOHZBYzBUdHhnVDd3YnFRUzk1dXhNZ0VaMGlMdUd5Y2xlbTlZZmloNXA4V2dqUC0zbTZsZ1ktSnEzdzZwcGpMNGtlU18xb1lmVGdOaVVQSDl5QjdKZTJ5NkJVdFUyOTdKSWtNVV9zbG1GZw?oc=5
2026-02-05	Google	0.19	After NVIDIA, Is SMCI the Smartest AI Stock to Buy Right Now? - Yahoo Finance		https://news.google.com/rss/articles/CBMigAFBVV95cUxPU0tYLTBtMzRSU0Nwak91WDFmZXlYRzJidTM0a3ZjSFU0OXliMlBLd01IYTJXbkI4d01NVTkyUUEtemYzcHgxODdiUEM5bTE5Yk5ubWlPM3YtdmYyTDFMWDFnM2RUaTVuZ29nZzFpeGtIUDcxSlpjRVR2ajJxb2xqRg?oc=5
2026-02-05	Google	0.0	SMCI Stock Price and Chart — NASDAQ:SMCI - TradingView		https://news.google.com/rss/articles/CBMiXEFVX3lxTFBGWjdWS1VWUDVvWEZtcXc4VU1UTWhhTjRlN3JSMDVYekNTelM1YnpsWE5JN0t1NmdtaUZndk1KWHZMMFFMMWpZb3VrMnplbFJMTmUxUEdFZXI0dDhx?oc=5
2026-02-04	Google	0.417	Super Micro Computer: The Most Misunderstood AI Stock Today (NASDAQ:SMCI) - Seeking Alpha		https://news.google.com/rss/articles/CBMioAFBVV95cUxPRlgzR05WRWdOZEZmeU1GX09HVVR5R3FsY0VHWFBfWkpJVEkxWEpoNHJSbG5BdEZQbWdSSzY5T3hGcExrb1dPb1pCdFY4bzA3aWhPNzZwdmFvTHkyOHJGMmpPYm1yYjNhYWlOZXZqV1V4aFpKYWZ5LU00cVFTTUpTSDRNQlNwYmd4Y2dtSlB4Ym9xYVZZaTREbFVBNEZGQ1Vw?oc=5
2026-02-04	Google	0.333	SMCI Stock Rises as AI Boom Boosts Earnings. This Is a Worry for Super Micro. - Barron's		https://news.google.com/rss/articles/CBMiiwNBVV95cUxQSjl5ZWVsMUdqRzhDN1FfUVlBVTFyN29xOG9xU2pQRXY1XzNFaEl6c3paVkluVXotQmZxWGhlZm5xbWFjRVdCNVNXMzV3SDJZVDRPZ1pfbXZqLWdiRXJxZkJpbTNST2lLWEhSOVQteDFObm93WnAxbmlfLWpUaDB1Q2E5MXkxdnducG01UGZYT0NRTWZfUktTaWdmYTd3bUFvR3RlWVpmcUNRclRCamZNTk5CZWUxakJVZ0VYQlZPSDM1cTFuanhWcWU1Q2R6T3F0c2JtYUhCUHRWNmhwX2pqeW12RTdRVVNWd2lPYml0bVZMeGNmcE9ZUGRubEtlNjA1M05JMEdNcmNQRzFEUUVXalEyejZ4WDUzdHVLZDlVY2FiNHVQMUlBTm1RNlJuYk9PMnZmM05TQTI5Q1BKbk9TS2s0ME1rR2RKQ2tJU1RQUFFxUndEQzVzZVBvTnV4ejVGZHBjeXpnVzAyX25ZTGdVSm81dnNzcVdxX0thWkFpVGluTGQ2TUVWWGoyZw?oc=5
2026-02-04	Google	0.333	Super Micro Computer, Inc. (SMCI): A Bull Case Theory - Yahoo Finance		https://news.google.com/rss/articles/CBMigAFBVV95cUxNRE5lT1hGR2hVZmlzZnJpRTRXbEEzd3BLdWhobDA1TjU3VHVEaWkxTU9GSG5UdS1fNUNmX0w5dDRVa244RkdJbnQ0UXQzb2d3ejlQZEFFcV9ySkZDNW9mMHM0d05mY04xQVdRRC1rTXBWcXAxS0psZXZ6c2hHb1pDcw?oc=5
2026-02-04	Google	0.333	Why Super Micro (SMCI) Stock Is Trading Up Today - Yahoo Finance		https://news.google.com/rss/articles/CBMifEFVX3lxTFBnR0FGSjM2VGRRR2J6dmJtLXBOemlvMFMyckx3NmFlYS1xYlduSFBBN25OSDBHX0RlWmVBWGM2WHRySjBCM1hRTXdrWVFsVGFxQ2tlMEZjRW9QQ2puUjJHOGo4OF9jYnZEZDYzMnJ2VS0wNEZReVdlSnBfWks?oc=5
2026-02-04	Google	0.222	SMCI stock steadies premarket after Super Micro lifts FY2026 sales outlook to $40 billion - TechStock²		https://news.google.com/rss/articles/CBMirgFBVV95cUxNUUlGSWpKdEVHRzl3N1QyOFZLRU1FVWw2WmFGcWdLTzAwc1VLcDViVUVBS0I0UkJwekZSR09CdDJpaWdsZ0VBT1hkVzJkR2ZtSHIxQUo5WTEybUpwdE9YSWV4Z0FQdFZSaW9kbm9qTTd5TXBKNjYtX3dnUTZPaUtMT0hGVjdDeVNlY3pRZkRkNmxwVUVpdXRKSUYxUHdkZ1BEczJ5ZHhtc3ZsRlVobGc?oc=5
2026-02-04	Google	0.167	A Look At Super Micro Computer (SMCI) Valuation After Recent Share Price Pullback - Yahoo Finance		https://news.google.com/rss/articles/CBMiggFBVV95cUxQWGowUUZUSmRwUFNUQVZuUnMwQUtyYjhlaWdZQ3MxREg2LXVLLWIycWQ1TU1VYWE2LVhDMnpvakRkOGkwV2p1cmtkSHJHdVlhX0RUMXZUaTVESkd4V2ZIWFRsa25NbUs4RDRWSVVwcWE5YXBxS3AyYUNsNFV2bnBXMHh3?oc=5
2026-02-04	Google	0.167	Even After the Rally Today in SMCI Stock, Analysts Think Super Micro Computer Can Double from Here - Yahoo Finance		https://news.google.com/rss/articles/CBMifkFVX3lxTFBXa2ZmRm5wQkx6QTJRdTc1TVI5M0J3TFhMUkxVU0ExXzh2ZkdxdHlhYVdfOHBiVlQ3TURSVk5wZHJrbWk5ZXUtUlJQa08tM1p5WkV4M1cyWVVHZkw4d2dEQWZaTUlMOFB3MFY5UnhZTmt6ekFMZlB0VjFNbDJ2Zw?oc=5
2026-02-04	Google	0.167	Super Micro (SMCI) Gets 13% Boost as Sales, Outlook Soar - Yahoo Finance		https://news.google.com/rss/articles/CBMiekFVX3lxTE00cFQ3ZXlwa1ZLSFJkRHo4VDJEeV92TVoycEROOUZIQzJ6VzcyR0ZuckhTaHlTRDh0ZGxyUWxJMUpqd2dXOFRqUWJsRmF2cUk0ZTFwSjFQamV4TENqY2E2NGZCZGhDYUZBOTBPWlQ1aXJWZ2NtNjdJakZR?oc=5
2026-02-04	Google	0.167	Super Micro Computer: Blowout Earnings Confirm Bullish Case (NASDAQ:SMCI) - Seeking Alpha		https://news.google.com/rss/articles/CBMipAFBVV95cUxQN0pQZmNQdVRtcWV3UFZST01JWTV4Q3lqUjBoY0FPZklRUkd0TzZaUjhTNl9NeGpzZE93SXNWVjJ0X0F6N3pVZ1dZRkRpVnVibVNOT1RxWGhfY1diamFNTlB2ZGtDb0dMakpzQXFTUmw3NnRNVkgxZ0tTb0ZJbmk1X0pJWktrX3JaV0Q4UHFhUmw0SmFBQ3Zab0ZfaldweTdGTW02WQ?oc=5
2026-02-03	Google	0.417	Super Micro Computer soars as Q2 results, guidance top estimates (SMCI:NASDAQ) - Seeking Alpha		https://news.google.com/rss/articles/CBMiowFBVV95cUxNUnFPbTQwMWRGN2hNNG9xWjFucTZXX1FoZHNYY19tUU5ZSmdUelh6em44cm9sU0pKOGZmRW9MZXZZNXRTQmlKNkZveUlNcHVnX0Q0ZnZjNVJ6cS1RcS0yaXJyWFZNcmVIeU5Da2lsUC1najRkRHFQYTBQQk9wUVNTSUtTSXczRVZ1Y1NHT1dLcFNBOUMycXVWRVhLN1NDbmxmaUpZ?oc=5
2026-02-03	Google	0.3	‘Don’t Hold Your Breath’: Investor Says SMCI Stock’s Best Days May Be Behind It (For Now) - TipRanks		https://news.google.com/rss/articles/CBMisgFBVV95cUxNTTB3YWM5bDNGQWtGeG1VWVVSRkFHRnB3VnpuTlZUcnBRYXdpRTYwZjgtVE1LeWVnVEhBT2JLQlZsSkRGeVZrTi1OeEFzb1Fyb0ozOUU0LVNmRmtTdTlxSGZBU1g5OVNDbGFUVnRpWXpDMG4yWllXdFBFZVVNZmpCUE92T0E0LTlvLUJQSjdOYlkzbjRaQmdOOFdhOEtLVHh0a0Rrc3lKMzNfY3ZNVDRKa0ZB?oc=5
2026-02-03	Google	0.278	SMCI Earnings: Super Micro Computer Stock Pops 7% as Financial Results Top Estimates - TipRanks		https://news.google.com/rss/articles/CBMisgFBVV95cUxQOWQ4VmR1WjdZZzByejFzNmoyX3FHcFo5WUhRVkFsZ2g2TVlKN29jQWF4cEo2ZVhrVWpFZnZGTl9ZMkN5bW1tS2s5Nk00anlsbEpnQmlvbUVISUkzVkt6eHdMY0dXcC1OWHk5UENrMW1zNE1SQWZqVnFtQlNDdkVIckI5T2tqRGhsRTZ6NThJcjZreHBEdlhFcy1seHF6RXdJTk5zT01aZlJ4ZG8zdDhFVHdn?oc=5
2026-02-03	Google	0.167	Super Micro (NASDAQ:SMCI) Reports Bullish Q4 CY2025, Stock Soars - Yahoo Finance		https://news.google.com/rss/articles/CBMigwFBVV95cUxPbms5eHFLVTRPcG9LMXhOTFFIdjRhRkJxaUp5Vkl4SFBGSHIySUk2dmdxNkc0YjNZNDQwUklEQmJyZ3dfMENDREJUcmMwUTVONGhLTFFVc21Xd2RrSi1QWDR5WEFneVZJelB3dFo0cllVYlNNY1pmUllva19WRV9aYVFYNA?oc=5
2026-02-03	Google	0.167	Super Micro Computer Reports After the Close, and Wall Street Expects 82% Revenue Growth - 24/7 Wall St.		https://news.google.com/rss/articles/CBMiygFBVV95cUxQVlZrMGNhMTdRNDlKc3ZabVBmZjNWQjBzb1RvcnJhdFpWcnVfZ0o0d25vWGpNeEl1dW1ybDFtRG1KOGdWaHNvWVItWURob1dYYldSMlFNY0FXYnFoclZnekxVQUl6cFVpZy1lVC1mbnptUlVLM1ZyNFhaVGd4X3Q3VEFoRkloakF2RFMyekFsRHV2aEJoY3lvUU5OcVp4QjBXSmE0bEZ2Y01zLUVDWmlEMXJJenJwcHA0SkYwQjlEU1o5cURZZGxXVU13?oc=5
2026-02-03	Google	0.133	Is It Time To Reassess Super Micro Computer (SMCI) After Mixed Share Price Performance? - Yahoo Finance		https://news.google.com/rss/articles/CBMihwFBVV95cUxOTi11MjJaYTlUbnJTTFM1dHIwc0dRcHEyTUVXN2JhTUdSR1RzWUVJVC1lMHUzbDBIdzdMMUVPNkJfa2NxdFJqSEF6VjBRV1FQUmdYbC00WjQwdzQwQUhlT05zdkNQZE9rZlhOSDZUbUdMYllBcWFxT0FxUDVfcTF3dmp2a0ZkZjQ?oc=5
2026-02-03	Google	0.0	SMCI Stock Braces for Q2 Earnings – Analysts Cautious, Options Eye 12% Swing - TipRanks		https://news.google.com/rss/articles/CBMipAFBVV95cUxPM09vbTVDS29CVTBZYkpXcXZHOWh6cFZ6ZzJPTkFzOUJpeUpMM0ltNTEyalBmU3M2MUF1MDlVd205UGVLa2FjU2hVcE9pdTJkSjNBaVc0NVE3V2FGcG0wRFpqLVNVeXVYbnNZWHV3OFpyWjhlWTJ4bUtVYk5VR1RNZWUwLW0ySW5yMU1ROU15bzBHTFlxWDZYNFVDMk9XU3RPdTM5Rg?oc=5
2026-02-03	Google	0.0	SMCI Stock Rises Ahead Of Q2 Earnings — What Does The Street Expect? - Stocktwits		https://news.google.com/rss/articles/CBMiyAFBVV95cUxQa29xRDRJbGVOYXN2dHgzMUFXSWdqUm14cWx4bGdZbkJIVVJmNTZCRklTNGxodHIxZVotQ3cyaTZoWE1YNHJNNlF2aGsxUDNGVzB6aFB4MGNqcTQ2bktMbGNscTRIOGxjRXh1VHlyanROclloYlB4OThFQWMxR21kRjhjQnpYNDNkZXVVZnV1dmI3UXhGUnFqb21OUVJfcnJrdG1BcHg0WW15aVhLSm9ZeVdHNm1XZFdLanZsbm54bS0wa2U4MUZSdw?oc=5
2026-02-02	Google	0.167	Super Micro Computer, Inc.'s (NASDAQ:SMCI) US$1.0b market value fall may be overlooked by institutional investors after a year of 8.4% returns - Yahoo Finance		https://news.google.com/rss/articles/CBMigwFBVV95cUxQcTROOXVLQjFKTC1NOTZVT2RULVg1Rl9QSHBpd25EYTkwaGVpcEFfM0xYQ0NHQkZmN0pxX0dvcUhxcjlIcDhNUlU1dWZoUGhVNUVDZ1FNRVVjaUl0Y1h6bk1zOC1JN3pzNjJvNjNodnFMYUcyMmlwOTduMWRCMVN1cy00WQ?oc=5
2026-02-02	Google	0.0	Traction in AI-GPU Platform and DCBBS to Propel SMCI's Q2 Earnings - Yahoo Finance		https://news.google.com/rss/articles/CBMiggFBVV95cUxQeVdKVFVEMXRvRnhmWGYzdzZpSHhUdFZRMnpWZEVpTHluakNwRlFYU3VFOWxzajJRRk0zRFR4NV9IMkFsallUdTRGWUFfTzA5b1pvQ1JCc3h6Mm0yVWt1NEJ6OUx0QUhCeFRrdnk2OEdVYUduZUJyczRnM0cwN1RhZnJn?oc=5
2026-02-01	Google	0.167	Super Micro Earnings: What To Look For From SMCI - Yahoo Finance		https://news.google.com/rss/articles/CBMiggFBVV95cUxOeEVlSGk2SnVTQmJMMkNVbFlXTGNlYmU2UjczQVJmQk5VWEpqTTZkZ0lZNmhKTzN2eUlmS3RaYTN3Z2VzNHBOeDVGWUhWUURJTDY3eDhHbXh1ZHBnMjhyRkNTcXRQWWotVlJIYVlUbW44Rzc0TUxlaWx2ZkNoR3BrSG9n?oc=5
2026-01-29	Google	0.222	Should You Hold or Fold Super Micro Computer Stock Before Q2 Earnings? - Zacks Investment Research		https://news.google.com/rss/articles/CBMirwFBVV95cUxPT1lmZG12Zy16OUFMdGdJUkstRy1BOExLb1ItYW1VcVgxUnptdGNPWGtKVDl0Rm9OU2dqdHZlUE9wTTc3MWp2UFBmR0QyTk1BdDc3Tjk1ZHViTXlXTXBTV1VaMndNZjJiRW5WVm5UUUozUHlqaFNQRW85bFpyZHFpLVNleTJkVC16TlIzc1g2b0hqV1V4TGhod3BqQnhDN3gzcHRzWG10YmNtMUNyck9Z?oc=5
2026-01-29	Google	0.0	AMD vs. SMCI: Which AI Hardware Stock Do Analysts Prefer Ahead of Earnings? - TipRanks		https://news.google.com/rss/articles/CBMipAFBVV95cUxONlVodGtmbjRuS2FXeERLZkhYamhZUVYwWWZ4NVZCbjlJVVFiVlptOFhGcTA0M2dCQl9iUlJzYzVESFhIbDFCTF83Y2RsZWhFYU0yMC0xMFFwWU1vQTA1WFh6aUNtZHhoZzR1YVQyOWdxUVUtMDNuRzdJUHoxZkx3ZVduM1RwQXp2ampic3I4eUVHaElzUnVDVF85WTVPNlBzUFhMbw?oc=5
2026-01-27	Google	0.222	Why BofA remains cautious on Super Micro (SMCI) even as AI demand grows - MSN		https://news.google.com/rss/articles/CBMi4wFBVV95cUxNNkExcUpPbnNPUlVLZWJIcGVlUE5lVGM0aFFEX01IWEhNd0hVU3JGTlpJT0F3ZjlMVTZENGFpQ2g2a0h1a0ZSNmV6NXg0aUEyb0dyaDEyZTZLRjNyM2N5X2RPSFg0SHIzT3ItSy01T2xic2w1UnRzMDlxNzh6LXMxRE5uaXlyeWNqZnNvazhnQk5lY1RlU05WNUVaSlFnbXJaamFac0JuZ2Z0dklPcmxMSWRNWU4wX1NxeGJOU2M2UmxBeVZpVTVmWWRKQW5zemdyU0dsTnpRYzMyd1hZeEM5X0prQQ?oc=5
2026-01-26	Google	0.4	PLTR vs. SMCI: Which AI Stock Is the Better Buy Ahead of Earnings? Top Analysts Weigh In - TipRanks		https://news.google.com/rss/articles/CBMitgFBVV95cUxOeVVaZHRib1hwNjIwWVYtOUItbm1RUjBuRThYYmRBWmpaUmRwTmpCSjhSal9yclYxVEdhb3pucUxvM3pGZmpTRTEweDZUR3NONF9aUWk5cmtGUWpnTFcwOHNoRjRrUXpBVkljWVFaZkxHYTJSeU9ubnJPaEFaVHlmNGhUeHduTWhLdkxWdFJrNkJMYThPVUY0eGtBeVJOVjJUUUZ4UUhYdk5IZkhhd1d4enhvVjFVQQ?oc=5
2026-01-26	Google	0.117	Super Micro Computer (SMCI) Stock Sinks As Market Gains: Here's Why - Yahoo Finance		https://news.google.com/rss/articles/CBMigwFBVV95cUxOMU5ud0dKNDhGN3lYV3FYMXNaSE1tM29kekEyOWl2c1BfYlIxSF9KY2hmOWUwNlNDbjdIQzZKMlZ6YTU2MExqb01UZ01SczZCa1A3V2d5X0lSLWxDRmFndUs3bUVqZ1NrNU5xUVR6Zmtyc2xEYkFXeG1JNTBhS0g2Z1Fadw?oc=5
2026-01-26	Google	0.033	Super Micro Computer (SMCI): Hyperscaler Data Center Spending Is Robust, Says Citi - Yahoo Finance		https://news.google.com/rss/articles/CBMiiwFBVV95cUxQc0Z4aVRTR2dkMTI2WWExQ0lQQ05ESVVEVTZ5WklxX2g5bEk0X3o1dXpYRWNBNGV4Y1BLR1lrdEVjLUNjQ05IZWQ5cU5qOFdsSmRGRDdmY0l6ckpmZE5zUDBjYXZza1lXRFVOUURRR0YzM3ZXNnZjbko5ZTVrMDhnZ0diT09pTjF5MXJV?oc=5
