Date	Source	Sentiment	Headline	Summary	URL
2026-02-25	Google	0.217	Bitfarms Plans US Move Amid Strong Financial Showings - StocksToTrade		https://news.google.com/rss/articles/CBMic0FVX3lxTE9IZjdfcTVzeFluYTRHOUZ4dk5HRU9VM1VGdV9xSmFnSVRTdFhjdmpfRUhQeDNoWi1QbzVGYUN3MDhRRzN0VFJYVmxIM01mRXFRczNvVzVFRmdZZXowVDI0T1hlbkkzaVlDUlBqbUdkNnU5SXM?oc=5
2026-02-24	StocksToTrade	0.458	Bitfarms To Reshape Future With Debt Repayment and US Strategy	"Bitfarms is strategically repositioning itself by repaying a $300 million debt to Macquarie Group and relocating its headquarters from Canada to the U.S., rebranding as ""Keel Infrastructure."" This move aims to enhance financial stability, attract more investors, and capitalize on opportunities within the U.S. market, particularly in digital infrastructure and HPC/AI sectors. Despite a recent downgrade to ""Market Perform,"" the company's stock has surged, reflecting investor confidence in its long"	https://stockstotrade.com/news/bitfarms-ltd-bitf-news-2026_02_24/
2026-02-24	Google	0.357	Bitfarms Announces Filing and Mailing of Materials for Special Meeting of Shareholders to Approve U.S. Redomiciliation Plan - Investing News Network		https://news.google.com/rss/articles/CBMi4wFBVV95cUxQd2RzTDJQcEtOaTJtR0JCUFZidzNrd0JuNlNZNEpfYTViR2J6cVFCN3I3VmxuUDBwN1AxZjZZTEpRM2QyZHFNVWtucXFjMlczSHVsSkhIQ19NWEo1dE10U09ReGlSQ3UwOXpoYXZTZW4wMThpcWRncUg5dmZ0RVZER3NwN0VwX0xqUjRhV19VMmMtaVdiRHZRdHlaTDRfdDlkTDZBR2o1cFhVd0s5Ty00enJpOHAybDhLOVVoaUlHdmlVdFY2Zi1NelM0WGR6cExzb2xGM2R6OWlKbTFYOW5MbHppQQ?oc=5
2026-02-24	Google	0.0	Bitfarms Sets Shareholder Vote on U.S. Move and Rebrand to Keel Infrastructure - TipRanks		https://news.google.com/rss/articles/CBMiyAFBVV95cUxPYm9obUROVnBzYjRHTWJfanE2ZnZ2YTctclNwRldPMjlmUGZlZXNjY0tjWGtpLU9xNFQ3OXJQUFRfb3R3YmdFNTBDTWV0M2pIX2lBTHZUQjRLNl9Va3ZRN1Y2bkdIYUR1aEdmSWloc0FsY2daVjdTcDNaN1F4Z2xuMjViVzdROE1UZzF6b0lHT2laY3V3TWJ4NENFQXJ6aERabU1DT3lVWHFvb29wQlFyYWxaeTc1aC1lUVhtalRCejNqV0lmUmRHUQ?oc=5
2026-02-24	Google	0.0	Bitfarms To Reshape Future With Debt Repayment and US Strategy - StocksToTrade		https://news.google.com/rss/articles/CBMic0FVX3lxTE0wWjRLZXBVVUNTR240Vk5UbXg3RDh1T2NtNWFkRkdlMkhTNUZiRkJLSTJvMWM3UmJlcFZzTDFaekFUNmxCRzZlN292YjlZNFUyNWNmUlBERVdBenhSZUNablFoQ052RV9oMDJlR2ZzZXp6TlE?oc=5
2026-02-24	Google	0.0	Bitfarms to Repay $300M Debt, Rebrands as Keel Infrastructure in Strategic U.S. Move - StocksToTrade		https://news.google.com/rss/articles/CBMidkFVX3lxTE1GVlhOcEMxSFp1a0VxNi1TWUc5X1BnaEh6RTBQeHFUOEJNWDJFY2VIb2g1NWs2dFNQWEo0LUVUYlFhaFBYdmctZ29VaGx0QjBqRDVtM3ZmOWxKSDVmTlpMTF9HeUFEOERwcFIyTWZPcG9WdDFpRUE?oc=5
2026-02-23	Stock Traders Daily	0.264	(BITF) Investment Analysis and Advice (BITF:CA)	This article provides an investment analysis and advice for Bitfarms Ltd. (BITF:CA), including long-term trading plans with specific buy and sell targets and stop-loss recommendations. It also presents AI-generated ratings for near, mid, and long terms, and lists recent related articles for further insights.	https://news.stocktradersdaily.com/canada/bitf-investment-analysis-and-advice_20260223_38dbf2
2026-02-23	Google	0.0	Bitfarms Ltd. $BITF Shares Sold by MMCAP International Inc. SPC - MarketBeat		https://news.google.com/rss/articles/CBMivgFBVV95cUxPQUJXN3QtUzBuTHAtajBab1IwUVN0Ulg4dl9kcjI2NVYtbDZGcTBvWk1uUVBHSUZlLXozYnUteHFiamxpeDJsN2dobUQ5UXNxWWNWMHFrcmZFcEh6SWRrd0EwMXRMUm01WFdaWHRKbjU1T1JObmE2dHN5dm0yaTdGZHBtXzVPU19heGRWR3dONkZFRWFvZWtYUzBmemxtV3hlNENkcWozZXc0SGd2a2hYeFMzNXBuX2JZQUpDZVh3?oc=5
2026-02-23	Yahoo	-0.13	Bitdeer Liquidates Entire Bitcoin Treasury as Mining Margins Tighten — Will Other Crypto Miners Follow in 2026?	Bitdeer has sold all of its self-owned Bitcoin, reducing its treasury balance to 0 BTC. Several trackers still show over 1,000 Bitcoins due to outdated ...	https://www.ccn.com/news/crypto/bitdeer-liquidates-entire-bitcoin-treasury-as-mining-margins-tighten-will-other-crypto-miners-follow-in-2026/?.tsrc=rss
2026-02-20	Google	0.0	BIT Capital GmbH Has $9.69 Million Stock Position in Bitfarms Ltd. $BITF - MarketBeat		https://news.google.com/rss/articles/CBMiyAFBVV95cUxOemxfbVlrdHlfemU5VFo5TlItRzl5YUFmMGtaUE5ld0l4dXl1bDNtMTdEU1g1ZWNjRUV2cl9KRzdxdFZaOVo3QU1mUFhPQmxSRFh6eU51TGduREUtcW5aV0Fzc0hBQTd4OE5Mc3EyZjY3Z3dHakN1bW52bmxPXzZxUjkzb0ZER01FZEZUZVFnVXFZdUplTldGZlBUaW1vcVhJbkFrU2dZNWs1VHJpN1A0QmNaeHo4dHg0NXV6YmlpUDRQTTBqRlptQw?oc=5
2026-02-17	Yahoo	0.058	Bitfarms Ltd. (BITF) Stock Slides as Market Rises: Facts to Know Before You Trade	In the most recent trading session, Bitfarms Ltd. (BITF) closed at $2.1, indicating a -1.87% shift from the previous trading day.	https://finance.yahoo.com/news/bitfarms-ltd-bitf-stock-slides-231503198.html?.tsrc=rss
2026-02-16	Google	0.0	Bitfarms: A Bitcoin Mining Company In Transition (NASDAQ:BITF) - Seeking Alpha		https://news.google.com/rss/articles/CBMikgFBVV95cUxOcEVFVlA2MTA4TDVXeFl3NWV2X2p1VVpHUUd0cTNUTHBYMzE4b2ZtY21YZWdPMnJMQUlJMDE5bHU0LURNY3U4Y0tMeUExd3gxVlZaWTl2eEREVUdQZ2UtWnZaRFhTd210SWxheFlWZGlrbGNIeU1wRWh5MklNQ3VxbFk3NTdxVmh0WVpfZkNyVlhmQQ?oc=5
2026-02-14	Insider Monkey	0.342	12 Best Penny Stocks That Will Skyrocket	"Bitfarms Ltd. (NASDAQ:BITF) is highlighted as one of the best penny stocks, with a strategic plan approved by its board to move from Canada to the US and focus on high-performance computing and AI data centers. This reincorporation, subject to shareholder approval, aims to boost shareholder value, unlock new capital sources, and simplify its investment thesis for US investors. Despite a ""Hold"" rating from KBW, analysts project a significant upside for the stock."	https://www.insidermonkey.com/blog/12-best-penny-stocks-that-will-skyrocket-1695544/6
2026-02-14	Yahoo	0.018	Bitfarms Redomiciliation With Keel Reshapes Valuation And Investor Outlook	Bitfarms (TSX:BITF) will be re-named Keel Infrastructure Corp. The transaction includes a redomiciliation to the US and a new parent entity named Keel Infrastructure. The company is expected to trade on both the Nasdaq and TSX after required approvals.	https://finance.yahoo.com/news/bitfarms-keel-reverse-merger-reshapes-200446835.html?.tsrc=rss
2026-02-09	Construction Owners Club	0.422	Bitfarms Announces U.S. Redomiciliation and Rebrand to Keel Infrastructure	Bitfarms Ltd. announced plans to redomicile its operations from Canada to the U.S. and rebrand as Keel Infrastructure, pending shareholder and regulatory approvals. This strategic shift aims to strengthen its position in the high-performance computing (HPC) and artificial intelligence data center market, expand access to capital, and simplify its narrative for U.S. investors. The company will also repay its $300-million Macquarie debt facility to improve financial flexibility and plans for a sha	https://www.constructionowners.com/press-release/bitfarms-plans-u-s-move-rebrand-as-keel
2026-02-09	Yahoo	0.192	Is GigaCloud's Cheap Valuation Reason Enough to Bet on the Stock?	GCT trades at a deep discount versus peers, but tariff risks, high logistics costs and macro uncertainty raise doubts about betting on its cheap valuation.	https://finance.yahoo.com/news/gigaclouds-cheap-valuation-reason-enough-135600176.html?.tsrc=rss
2026-02-09	Google	-0.156	Bitfarms (NASDAQ:BITF) Shares Gap Down - Time to Sell? - MarketBeat		https://news.google.com/rss/articles/CBMipAFBVV95cUxNZ0poZ0RMaE1VbUNRTFp4azRMYllOMHJOaXM3bThOTEkweERKQ2htYURXVGQwcFVHOVRuNlRENjRTM3p4VFJKdHFIVnk3YmFPY01zUkhzeW5FOTl3SWw5WjVHRFAwaDFMUkl4UmMweXhiVzdDam9zOEY1WHVfWVpkcXdPN1hja2tCZWdPUU1zV1pWMnZSenRBRWlOemlGeXpUbXNsOA?oc=5
2026-02-07	Yahoo	0.316	How Liquidity And Regulation Are Rewriting The Narrative For Bitfarms (TSX:BITF)	What Changed in Bitfarms Latest Price Target Update Bitfarms latest update keeps model fair value steady at CA$8.48 per share, while the discount rate edges higher to 7.59% and revenue growth assumptions stay effectively unchanged at 37.19%. In other words, the headline valuation anchor is intact; however, the required return has been nudged up as analysts focus more on liquidity, funding risk, and the policy backdrop for crypto. As you read on, you will see how these small tweaks reflect a...	https://finance.yahoo.com/news/liquidity-regulation-rewriting-narrative-bitfarms-230529569.html?.tsrc=rss
2026-02-06	Yahoo	0.0	Bitfarms Plans to Redomicile to the U.S. from Canada	Bitfarms (BITF.TO, BITF) on Friday said its board approved a plan of arrangement under which the com	https://finance.yahoo.com/news/bitfarms-plans-redomicile-u-canada-125505162.html?.tsrc=rss
2026-02-06	Yahoo	0.0	Bitfarms Stock Pumps as It Dumps Bitcoin Mining for AI With Name Change, Move to US	Publicly traded Bitcoin miner Bitfarms is planning a move to the United States and a name change as it transitions from crypto to AI compute.	https://decrypt.co/357222/bitfarms-stock-pumps-dumps-bitcoin-mining-business?.tsrc=rss
2026-02-06	Google	0.0	Bitfarms plans U.S. redomiciliation as part of AI transition; stock spikes (BITF:NASDAQ) - Seeking Alpha		https://news.google.com/rss/articles/CBMirgFBVV95cUxPYzhpU0xUY3EteUdRSlBZZVVGZFZQRTZFaHBHODVnUGpfUnNvRUtHWkdmdENGcnBfN2xXeE5jY05Ddkh5SWkxckVEYjJJQUJmMjViRktDOERtS0tVejVzZDlOMDM0dGdWUFFpdFpTTlozYzBSOWpqZVZvRlMtcGZBWldJS1pWbU9ySXl6ZW1TbU5XWmFwUnkxdXRWOG9WQk1OQm1jNmR5SDh4ODlkM2c?oc=5
2026-02-06	Yahoo	-0.032	Bitfarms stock jumps 16% as firm finalizes shift from bitcoin mining to AI infrastructure	The company will move its parent entity to Delaware and seek a new Nasdaq and TSX ticker, aiming to access U.S. capital markets.	https://www.theblock.co/post/388848/bitfarms-stock-jumps-33-firm-finalizes-shift-bitcoin-mining-ai-infrastructure?utm_source=yahoo-finance&utm_medium=rss&.tsrc=rss
2026-02-06	MarketBeat	-0.06	"Bitfarms Ltd. (NASDAQ:BITF) Given Average Rating of ""Moderate Buy"" by Analysts"	"Analysts have given Bitfarms Ltd. (NASDAQ:BITF) an average rating of ""Moderate Buy"" with a one-year average target price of $4.04. Despite this, the stock has been trading down, missing revenue estimates, and reporting negative profitability. Institutional investors have significantly increased their positions in the company, now owning approximately 20.6% of shares."	https://www.marketbeat.com/instant-alerts/bitfarms-ltd-nasdaqbitf-given-average-rating-of-moderate-buy-by-analysts-2026-02-06/
2026-02-06	TipRanks	-0.092	Bitfarms Sets March 20, 2026 Special Meeting for Common Shareholders	Bitfarms Ltd. has scheduled a special meeting for common shareholders on March 20, 2026, to discuss special corporate business. The record date for voting eligibility and notice will be February 13, 2026, and the company will ensure broad participation by covering delivery costs for proxy materials to objecting beneficial owners. While the latest analyst rating on BITF stock is a Hold with a C$3.00 price target, TipRanks’ AI Analyst, Spark, rates BITF as Neutral due to concerns about financial p	https://www.tipranks.com/news/company-announcements/bitfarms-sets-march-20-2026-special-meeting-for-common-shareholders
2026-02-06	Yahoo	-0.156	Bitfarms shares surge after it ditches its 'bitcoin company' identity and doubles down on AI with U.S. move	The company said it will focus on building data centers for high-performance computing and artificial-intelligence workloads.	https://www.coindesk.com/business/2026/02/06/bitfarms-says-it-s-no-longer-a-bitcoin-company-doubling-down-on-ai-with-u-s-move?.tsrc=rss
2026-02-04	Google	-0.078	Bitfarms (NASDAQ:BITF) Stock Price Down 8.9% - What's Next? - MarketBeat		https://news.google.com/rss/articles/CBMipwFBVV95cUxORzl2LXlyRHJtLWZJNHUzRUhTa19qV3BOMlcyVjVsR2lkWkZtaEZ4VU9Tc1BwOGZPei1EQUxQT1NRNlpqbEptb0lWaGlLZXppRVNwSDEzWGhXRGNTQjZ4MGZ5LVY3cGJ2WlZ4dlVLbGFkeGhFOThfMlg3T2dUNGgzX25sZFBubUtSVzd2WHdmcTAwdzB5VTV2TEw3ejhmYVJLUHdxUXUxSQ?oc=5
2026-02-04	Google	-0.156	Bitfarms (TSE:BITF) Shares Down 10.8% - Here's Why - MarketBeat		https://news.google.com/rss/articles/CBMinAFBVV95cUxPMG1SdFNmN0RBMHBIXy03SDVRRUJEZU5uTXFtWjloNXQzTldXWDdQcVotZkFiMFVyWm5QcV9PbjlBWUFjU1ZaSGFHMFYyQ0hBSHN2c0E4bHVLeXhfZ2E0WVJ1SW9PRGFKQ2FiV3dCN3RjNmh4eTVNQjVRUGRvU3ZydENTVHlUS2pueVppd1dPYXVjSkJaQ3ZfYWk5YW8?oc=5
2026-02-03	Stock Traders Daily	0.268	(BITF) Long Term Investment Analysis (BITF:CA)	"This article provides a long-term investment analysis for Bitfarms Ltd. (BITF:CA), including specific trading plans with buy and short targets and stop-loss recommendations. It highlights the company's long-term rating as ""Strong"" based on AI-generated signals for February 3 and offers access to real-time triggers and related articles."	https://news.stocktradersdaily.com/canada/bitf-long-term-investment-analysis_20260203_aae813
2026-02-03	Google	-0.025	(BITF) Long Term Investment Analysis (BITF:CA) - Stock Traders Daily		https://news.google.com/rss/articles/CBMilwFBVV95cUxObVhnYmYtMm1SZ0ljNG9kWlFZRDhMOXJtTXFybWhzZjN2X21SUENpOEpGSTJpSlhxSURJOFFqTnhKNzlrNXdGM09SUXlMR2xKcm55VW02UjdMMTdia1pmUXhpZGxITXozRkc4aERjNVVpZHdiMWhWWXBrVkFGci00LXpYcjJmTGhjdUVOd0F4ak05MTJqamtN?oc=5
2026-02-02	Google	0.0	BITF Faces Downgrade as Liquidity Concerns Loom - StocksToTrade		https://news.google.com/rss/articles/CBMic0FVX3lxTE03a1A2ckF0RUxCWUtpc29kVWxRREQ3M19aNV81ck9nRFRrd04wU21ZX0NPU3hJYlFVUUNTTjY1UjhRUU12dG1qLUhmRHpzUEJtYzZJQTVoRmxNNElpSXo4czJqQ0JnMVotSFAxR0FOZ0dCRGM?oc=5
2026-02-02	StocksToTrade	-0.422	BITF Faces Downgrade as Liquidity Concerns Loom	"Bitfarms Ltd. (BITF) has been downgraded to ""Market Perform"" by a prominent financial firm, sending its stock down by 3.42% due to concerns over debt, spending, and broader regulatory challenges in the crypto market. The company faces a complex financial picture with a net loss and increased expenses, although its balance sheet shows effective asset utilization and reasonable liquidity. Stakeholders are advised to monitor policy changes and strategic shifts as the company navigates these financi"	https://stockstotrade.com/news/bitfarms-ltd-bitf-news-2026_02_02/
2026-01-30	Yahoo	0.302	Bitfarms Ltd. (BITF) Sees a More Significant Dip Than Broader Market: Some Facts to Know	The latest trading day saw Bitfarms Ltd. (BITF) settling at $2.34, representing a -4.49% change from its previous close.	https://finance.yahoo.com/news/bitfarms-ltd-bitf-sees-more-231502733.html?.tsrc=rss
2026-01-30	Simply Wall Street	0.16	Bitfarms Reshapes Footprint And Governance As U.S. Redomiciling Progresses	Bitfarms (TSX:BITF) is undergoing significant strategic changes, including exiting its Latin American operations by selling its Paraguay site and appointing Edie Hofmeister as the new Chair of the Board. These moves are a part of the company's plan to redomicile to the United States amidst tightening U.S. crypto regulations. This shift aims to simplify its operational footprint, strengthen governance, and align the company more closely with U.S. capital markets, while potentially exposing it to 	https://simplywall.st/stocks/ca/software/tsx-bitf/bitfarms-shares/news/bitfarms-reshapes-footprint-and-governance-as-us-redomicilin
2026-01-30	Yahoo	-0.019	Bitfarms Reshapes Governance And Footprint With U.S. Focus And Exit From Paraguay	Bitfarms appoints a new Chair to support its plan to move its corporate domicile from Canada to the U.S. The company exits Latin America through the sale of its Paraguay site. These changes come as U.S. regulators increase oversight of cryptocurrency businesses. Bitfarms (TSX:BITF), recently trading at around CA$3.32, is reshaping its footprint and governance at the same time. The share price sits against a mixed performance record, with a 7% decline year to date, a 54.4% gain over the past...	https://finance.yahoo.com/news/bitfarms-reshapes-governance-footprint-u-131112331.html?.tsrc=rss
2026-01-30	StocksToTrade	-0.494	Bitfarms Faces Downgrade, Eyes on Liquidity and Legislation Timing	Bitfarms (BITF) has been downgraded by Keefe Bruyette to Market Perform due to concerns over liquidity risks, increased leverage, and high capital expenditure. The company's stock is down amidst uncertainties in cryptocurrency market regulation and delays in crypto-friendly legislation. Key financial metrics show negative gross margins and return on equity, highlighting operational inefficiencies and the need for strategic shifts and cost streamlining.	https://stockstotrade.com/news/bitfarms-ltd-bitf-news-2026_01_29/
2026-01-29	Yahoo	0.411	Bitfarms Ltd. (BITF) Gets Downgraded to Market Perform from Outperform by Keefe Bruyette – Here’s Why	Bitfarms Ltd. (NASDAQ:BITF) is one of the best strong buy stocks to invest in under $5. On January 26, Bitfarms Ltd. (NASDAQ:BITF) was downgraded to Market Perform from Outperform by Keefe Bruyette while raising the price target to $3 from $2.50. The firm told investors that it does not anticipate the materialization of a leasing […]	https://finance.yahoo.com/news/bitfarms-ltd-bitf-gets-downgraded-184855714.html?.tsrc=rss
2026-01-29	Source ONE News	0.34	Bitfarms plans to turn former Bitcoin mine near Moses Lake into AI data center	Bitfarms is redeveloping its former Bitcoin mining facility near Moses Lake into a high-performance computing and AI data center. The project, approved by the City of Moses Lake, will involve demolishing the existing infrastructure and constructing a 100,000-square-foot data center capable of supporting advanced AI workloads with liquid-cooled GPUs. This move reflects a broader industry trend of pivoting from cryptocurrency mining to AI and cloud computing.	https://www.yoursourceone.com/columbia_basin/bitfarms-plans-to-turn-former-bitcoin-mine-near-moses-lake-into-ai-data-center/article_58d0d37e-122a-4d0a-b781-7461acf13b1e.html
2026-01-28	Google	0.0	Trend Tracker for (BITF) (BITF:CA) - Stock Traders Daily		https://news.google.com/rss/articles/CBMiiAFBVV95cUxQRFpwWE1zWWtKblU5bUtkVTBLWFlNMjc4YWxTTjJ6dHRqZ3djVUNINllady1WRGNqc19ITUJ4OE9hamxPRHlFTzJubURXZWcxYnhFSE5IMGo2SjFfbGpxZWExY2h5Tjloa1paVmpnZ2ZXbWxUWGFKNTNHUVV1S0dHbmU4eXNrUDZZ?oc=5
2026-01-27	Simply Wall Street	0.243	Bitfarms Recasts Washington Site As AI Infrastructure And U.S. Platform	Bitfarms plans to convert its Washington facility to support NVIDIA GPU-based AI and high-performance computing workloads. The company is also redomiciling to the U.S. and has appointed Edie Hofmeister as board chair to oversee this strategic shift away from being solely a Bitcoin miner. This move aims to broaden revenue sources and reposition Bitfarms as an infrastructure platform, though it comes with capital expenditure risks.	https://simplywall.st/stocks/ca/software/tsx-bitf/bitfarms-shares/news/bitfarms-recasts-washington-site-as-ai-infrastructure-and-us
2026-01-27	Finviz	0.025	Symbotic Up More Than 100% in a Year: How to Approach the Stock?	Symbotic (SYM) has seen over 100% growth in the past year, driven by a $22.5 billion backlog and strong revenue projections for fiscal Q1 2026. Despite tailwinds like a robust backlog and strong liquidity, the stock faces challenges including high reliance on Walmart, absence of dividends, and international expansion difficulties. Furthermore, SYM's valuation is considered sky-high, trading at a significant premium to its industry, leading Zacks to issue a Strong Sell rating due to these risks a	https://finviz.com/news/288328/symbotic-up-more-than-100-in-a-year-how-to-approach-the-stock
2026-01-27	Yahoo	0.0	Bitcoin miners HIVE, Bitfarm and Bitdeer downgraded as analyst warns on AI shift	KBW's Stephen Glagola said that turning business models toward AI and HPC may take longer to pay off than the market expects.	https://www.coindesk.com/markets/2026/01/27/bitcoin-miners-hive-bitfarm-and-bitdeer-downgraded-as-analyst-warns-on-ai-shift?.tsrc=rss
2026-01-27	Google	0.0	Bitfarms: Holds Ground As HPC Permit Review Tests Its Pivot (NASDAQ:BITF) - Seeking Alpha		https://news.google.com/rss/articles/CBMioAFBVV95cUxNUDdUX01veXdxVkV1QjRqd0RTNlN6WHVvY1ZwbEJ0Zi1zeEZCTzB5ZXlud1p2cENWSVFQQ2ZvdjUteUFYc1VXVFo0cmt6OUczcjlFSnVhc0Q5WGo3T1JtMHVYNDhoRmEzV2xscnVoZXZWU2xRZlVGUkVrc2x3MzZERUhkWkRfSEVkYXZhNkVhX3Q4TzdMRWlmSk1JWEhXbGl6?oc=5
2026-01-26	Google	0.0	Assessing Bitfarms (TSX:BITF) Valuation After A Mixed Year Of Share Price Performance - Yahoo Finance		https://news.google.com/rss/articles/CBMiiwFBVV95cUxNM3FsSm1CNkgyZHJXanRzNFZFUHctTWl0eUxJVldMLU0zOVAwOXQ1a2xWX0o0UnpqUGlFcGVjTG00XzNveHNfRUpqNF91UFVwbDEtWF9LeXFEQ3U2c3gwUGhmcTkwRHNZdk12d2E2X3JXYklqVnVyZC1ZQUxkRmpvOGVHZmM0ZzBpbTBj?oc=5
2026-01-26	StocksToTrade	-0.326	Crypto Sector Faces Hurdles as Market Legislation Stalls​	The crypto sector is experiencing setbacks as new market structure legislation faces delays, leading to increased uncertainty for companies like Bitfarms Ltd. This legislative hiccup has caused turbulence in stock valuations, with Bitfarms' stock trading down by 5.47%, and observers caution that such delays could hinder growth potentials for companies reliant on regulatory clarity. The article emphasizes the need for stakeholders to monitor regulatory developments closely and adapt strategies to	https://stockstotrade.com/news/bitfarms-ltd-bitf-news-2026_01_26/
2026-01-26	Stocktwits	-0.409	Why Bitfarms Stock Is Down After Hours?	Bitfarms stock saw a decline after-hours and closed down 5.5% on Monday following a downgrade by Keefe Bruyette to 'Market Perform' from 'Outperform'. The downgrade was driven by concerns over Bitfarms' rising leverage and elevated capital expenditures, with the firm not expecting a leasing agreement to materialize until the latter half of 2026. Despite raising its price target to $3, Keefe Bruyette highlighted liquidity risks and stated it would become more constructive on the stock with greate	https://stocktwits.com/news-articles/markets/equity/bitfarms-shares-fall-after-hours-as-an-analyst-raises-liquidity-concerns/cmyJdblR4hn
2026-01-25	Yahoo Finance	0.424	Bitfarms Ltd. (BITF) Accelerates Strategic Shift Toward AI and High-Performance Computing Infrastructure	Bitfarms Ltd. is shifting its strategy from pure Bitcoin mining to AI and high-performance computing infrastructure, including developing data centers for NVIDIA's Vera Rubin GPUs. This move aims to diversify revenue, reduce crypto-market reliance, and align with AI's long-term growth. The company is also redomiciling to the U.S. to access more capital and strengthen its position in the American mining ecosystem, supported by President Trump's stance on Bitcoin infrastructure.	https://finance.yahoo.com/news/bitfarms-ltd-bitf-accelerates-strategic-003715488.html
2026-01-19	Google	0.0	(BITF) Stock Analysis and Trading Signals (BITF:CA) - Stock Traders Daily		https://news.google.com/rss/articles/CBMingFBVV95cUxOY2J6a0w1VWd2UzdQNnd2Z184cERjWjg3UnVYUW9DX3hhUzVpZzNRMkhDQXYxaEJBcm5mOV9NUGtKS3VMMzA2OG9yZVVqTFo1NlFNNWxNcUhtdDR0MXh5NUxLakp1alNSQlU1SzNtWDB1MUgxWXZnaWJ6ZWdYUTJTTW9TRmtOelpsR0EzamdaWU9MTjA2RkxVR1R2NWsyUQ?oc=5
2026-01-19	Google	0.0	Bitfarms Ltd. (BITF) Announces the Sale of Bitcoin Mining Site in Paso Pe - Yahoo Finance		https://news.google.com/rss/articles/CBMihAFBVV95cUxORXd5WC1VZ3BWSnJ1enlGQi13VFNUYldZVDJwZ0pZSFVkaVVnQjBjZHowZDNjV05iU2dCbzk1T18yMGNVWjlRaTVCeVdfNHhIenV6NEdYTWZLa2RJTEJScWFtU09heGtCTnJKWmpqa0s1MGU4RkFmanVDOG9xcUJZY1JjR3Y?oc=5
2026-01-18	Google	0.0	Bitfarms Ltd. (BITF) Rebalances Energy Portfolio to Focus on North America After Latin America Exit - Yahoo Finance		https://news.google.com/rss/articles/CBMiiAFBVV95cUxQdjY0UWxJN2dVMkZ5WmZrcDh4dk1uVV9zbDgxb0lYb1FwWXRPNGtodUdGWnNNbFlnRnpwOGNwTlduYU5SazB2d29COGc1aDR1WVV1akN2M2ZNRl9FbWVSTGVxTmp5dGVqby10ckhScWl1TV9hYXNFQzdUb0V1ekJYVWxiRkd5OWdX?oc=5
2026-01-13	Google	-0.25	Does Bitfarms (TSX:BITF) Still Merely Mirror Bitcoin or Is Its Strategy Starting to Diverge? - Yahoo Finance		https://news.google.com/rss/articles/CBMif0FVX3lxTFBWbE1BWUJNeE1ORnlER19sb1dxUDZIcGNDQmxnOENGa3JaaWhVblZ0NVhhaEhNNmtwUHc0YU5mRmtscTZUMTcyMFVEcUowb1o4TDlHSmJoOXlUUkduaWRkbXpwbTNON3dONFhfLV9TSmN1d1pMdVlkLXhqOUVLMHM?oc=5
2026-01-07	Google	0.0	Bitfarms to Present at Needham Growth Conference in NYC | Wed, 01/07/2026 - 16:05 - Bitfarms		https://news.google.com/rss/articles/CBMiswFBVV95cUxNWnZVRmVJQVVfUzlOM2FTb1JpZk1Md3VaeEVzNi1aVk5acFNMcjNySW1QN2kxM1JQNjkxbzNmWTVUVUlLd2lxVTBzNm85OHIxc3g5MDZtOE5QUUtSN1NNdHNvMFNRZzhIOWtuOWtOS1RNSFBta1NqV1JUWTUxWlpNanFmWmdfWGRubGMzVUgtWnhPaEwzTzBVbG9adjFaRFItRVZ4U1A5YXd4ZlIzNFZuaFcxbw?oc=5
2026-01-05	Google	0.0	Assessing Bitfarms (TSX:BITF) Valuation As Crypto Miner Shifts Toward HPC And AI Data Centers - Yahoo Finance		https://news.google.com/rss/articles/CBMiiwFBVV95cUxPaTY0bGZpRjZrQkNuTWxlRk1aWEp3UTNQakxJM09sYWc4czRMc01rNVNuRkFXOXZWYTcySktUcDZGOV83Q0JHUG9BZjdpYTlpaDd3eGpxUHF4RV9fZzNBc2l4RXlLVGpQd0lCZWw2R3lGTS1YVjFDMjZzOXc4dC1XbHJIejBDRjg1V3FZ?oc=5
2026-01-02	Google	0.1	Bitfarms Announces Complete Exit from Latam with Sale of its Paso Pe Site for up to $30M | Fri, 01/02/2026 - 07:00 - Bitfarms		https://news.google.com/rss/articles/CBMiyAFBVV95cUxNTG9wN1JEZjdqR0NweTdqTkxpOVVTS0tob2NUVXE2T2wwYXZ6anZwdFRNRDNzWHFlQnliWjJsRGo2bkZoUUNlUDY2MV9lZGlJcHhzeFRYMzlxdHVVNWk3cDJySzI3Ul96dDc2LUMtUG5ZS2hHb0ZlLXV3Q2pYbXZRRG9QczcwYVFLOTZWWFZ2TGtpOHJBUTVQUG1Tek84TEkwSkRuTzh1MVdRZFV6ZmJyWjcwRHhxWWhDRUh6M0U2ZndfRnZqU1psRw?oc=5
2025-12-23	Google	0.0	Bitfarms (TSX:BITF) Is Up 6.9% After Index Inclusion And AI Pivot Plan - What's Changed - Yahoo Finance		https://news.google.com/rss/articles/CBMidkFVX3lxTE5FRlFwd3lOT0laSkVIa2VhVTZZZi1CQm9kMzZEa0RDc2NHZEJhN0RKWWtUMmtROGFyNm91NlFFYll1aWxWbHBwM0VWTDRrT283bVNSUV80Q1l6UWYxVWpHQ0VXY3F6YnEyUVF3NGt5LU1IeVoxTEE?oc=5
2025-12-18	Google	0.0	Is Bitfarms (TSX:BITF) Undervalued After Its Recent Share Price Pullback? - Yahoo Finance		https://news.google.com/rss/articles/CBMiigFBVV95cUxNWXFCd1NPNWJsU0h0S1hleXFHTU9pNXcxTVNEbl9PWC1IZWE2b0lMT19ueDZIaGFoRjJqWnVtRUlpSzduaGtEZE9OZ3BEX01LWUtISXNxb2lXNlNzVlpvTEIyLVVYaElYOEMwUGpTZ3FrVXljUXRFeUVnM1MyRHdFNmlDZFk5aFdxRkE?oc=5
