Date	Source	Sentiment	Headline	Summary	URL
2026-02-25	Yahoo	0.6	Dow Jones Futures With Trump Speech Imminent; Nvidia Earnings Loom	Futures: rose with President Donald Trump about to give his State of the Union speech. Nvidia earnings are on tap.	https://finance.yahoo.com/m/bdeb1df7-ae4f-357c-a6ee-1963c3acdf10/dow-jones-futures-with-trump.html?.tsrc=rss
2026-02-24	Yahoo	0.25	Why Monolithic Power Systems, IBD Stock Of The Day, Is Called A Top Pick	Monolithic Power Systems is the IBD Stock Of The Day as the chipmaker earns plaudits for its Q4 report. MPWR stock is a recent breakout.	https://finance.yahoo.com/m/0fa30a96-b046-33ec-9d40-20b94ac7e5de/why-monolithic-power-systems%2C.html?.tsrc=rss
2026-02-24	Google	0.25	Why Monolithic Power Systems, IBD Stock Of The Day, Is Called A Top Pick - Investor's Business Daily		https://news.google.com/rss/articles/CBMirAFBVV95cUxObHpndW5meFFXWTZaZWdpYlFISnFjZFJKZDc1eWtJUzdIMnpaQTNXWWVkdlE2R05vTXp0V2JsZ0hRZVdpY3ZwaXNCVFFLTnNtQm1QWmlXZzFsTXJyRTNyLVNzRUFkVjdaN1BZSVMxajNOdXRXTHZ3ak5CaGJKcTZVMWdwTGhETTJxa0tCcU9qTk1sSTRDVlFHTUZVRnJpLW5KTHJMM2pBSTdORDFJ?oc=5
2026-02-24	Google	0.0	Monolithic Power Systems, Inc. $MPWR Position Increased by Lansforsakringar Fondforvaltning AB publ - MarketBeat		https://news.google.com/rss/articles/CBMi7gFBVV95cUxNbkROTkRpeU1hVS16bGQ1YjdpY3g4YmxPdUlXUkRuZnpfbnRzV2U1UmZ4RllOaHpiZnd4SHhWc285WDhULVNoQ2RLQ0hyOUt4Qm42d2hFS0tZTVZfNTlsb2w5M0lqanpGRE5jV1hGRDJuY1pHcjZtdDJ1eEVpekYyTE1uWEVrMTcyalJ0TW00V0VTU1VSeVFxaUdXaDFfS1lxT1dLZ05hVG1UTGZrM01JQ2ZSLThxMG5rczlPb0RIMHNoLXoxWkItOFIxNk1UcEQ1eEFKbEN3Tmo4bHVwTjZ3Tm0zdUUxUzVvM0VzWmZ3?oc=5
2026-02-24	Google	-0.1	A Look At Monolithic Power Systems (MPWR) Valuation After Citi Highlights Data Center Strength - simplywall.st		https://news.google.com/rss/articles/CBMi4wFBVV95cUxPZGwwT01Hcm1LZ1F6NGg5UnI4a3o1Y3JWbnpMN3RrZUNPWGYxZzB5akE1bE5PY2NzeEJaSFAycUMwVXhTOURoV00tdW5UempwQXQ5cFhoNVVoZDhsRTNqU2czZmc3d1NlTXFhMzN5Mk9WZ09TWng4dFVWdEl5aU9IMm1aU29KeGF1MlYyYUliQ0FzYlJNQkNJTXNwUkJmRmhfSDVmenZPTHl2TkNoVHN0aTB3YUZld3lHNjI3QWVuSWlpc0N1TzNXYmZGblhaalFpQUQ2WmxrTTZMVkpNb1lwUHMzZ9IB6AFBVV95cUxNako4MHNSZzRhLWt1d1kxNUEzbEFOdXhQNV9aWVM4Y2ZjMVNUNzdOSUpRanpZNHR0ODUta1FPRlI3NVhkSEVNTWdnd2RBWE1VRGdPcTA2Tmg2OWdERUtpc0NLbUxsSlIyejZQWDJkWlhIbVJoV3p2aDE4ek0xaTNDd1N2LUJxNTZTXzA4eUh3aGFSY1dRUEE2dS0xRGxRb3czQkNWQXRDZXE1MURTTlNOcWVYTWtYeXpyQWZuRkFyeXBUakU1cGU3UnlYUFZGclYxYzhDSVJpSXlPNlZzRmFXbm5LRWJjc2cz?oc=5
2026-02-23	Google	0.5	Texas Instruments (TXN) and Monolithic Power Systems (MPWR) Named Top Picks by Citi - GuruFocus		https://news.google.com/rss/articles/CBMiugFBVV95cUxQanB3VGRIcXJ3cnoxUHNqTXRLalo1RWxPUVo4T2NKZEVhLTNvTlloUTRDUl84UzJZa0k0d1hKUHRhcWtSbW5rOEs1SDhKVlhGVnRmSGhqdVg5WFpYOUROS0lzU3BsOVBsWnVGd002eEZzb3lXZTNRNDZGMzNCUmQ3dncwRGkxN3A5Y25XSTBTempkTUkyQmNuOTZJMDNtSUltVkpBNHRPTl9jTnNqeDM1bTNtS1FIblN5M0E?oc=5
2026-02-23	Yahoo	0.356	These 2 chip stocks are new Top Picks at Citi	Investing.com -- Citi has moved Texas Instruments (NASDAQ:TXN) and Monolithic Power Systems (NASDAQ:MPWR) to its top Buy-rated analog semiconductor picks following the latest earnings season, saying the group has entered a more favorable phase of the cycle.	https://finance.yahoo.com/news/2-chip-stocks-top-picks-120606228.html?.tsrc=rss
2026-02-23	Yahoo	0.193	2 Cash-Heavy Stocks to Consider Right Now and 1 Facing Challenges	Companies with more cash than debt can be financially resilient, but that doesn’t mean they’re all strong investments. Some lack leverage because they struggle to grow or generate consistent profits, making them unattractive borrowers.	https://finance.yahoo.com/news/2-cash-heavy-stocks-consider-044608845.html?.tsrc=rss
2026-02-23	Yahoo	0.0	Analysts Tout Three Chip Stocks Hovering Around Buy Zones	Analysts pounded the table for three analog chip stocks after their fourth-quarter earnings reports, including STM stock.	https://finance.yahoo.com/m/72978b89-2176-305b-89f0-acf0941e6e8f/analysts-tout-three-chip.html?.tsrc=rss
2026-02-23	Google	0.0	Oppenheimer Reaffirms Buy on Monolithic Power (MPWR), Citing Long-Term Growth Potential - MSN		https://news.google.com/rss/articles/CBMi6wJBVV95cUxQcnhPU3RqNjVIWnprSmQtcldWWkNxc3ZOT09xSXhBSjBNeDNoS0xuY3VvR2U5MGdIaDFvTmE2ZlMyREJfTWVTbWtfU3lYcUJGVm1hQllINDdGRGREbzNILXBxdnJkYjVpSGVfQXNMZzlQT2E2Mm9IT0szNnpiRWpCRGNMa3U4cVpVTkdROVhSNWp1TDR4WElGNjRaX0J2NlJUY0otcWpBa1dsTU4yZzkzenZIQ3JsUzFWOGtNY2lCYTVVSnZVYk1OUHpoZUN5NUtzSWllM3ZFdXJDRG9Gc01UaGpfdEU1Rldvc2IzU0F0aVFxZ01DREpDeHlCSFlDVFFXVzlBakp5MWgwSEhmejFhMFhncTRRTk5DYmt6NmdWb3RLQTNicTFhTjdQNzZJSTVQTU5fZzU0M1RXTWViQ2UxZHhOeGFqc1NrcHR3d1RxRGNBcGtjc24xekRtdWhaZnFWdGJpTkNIM3Y0TXc?oc=5
2026-02-23	Google	0.0	SOXX, MPWR, NXPI, MCHP: ETF Inflow Alert - Nasdaq		https://news.google.com/rss/articles/CBMid0FVX3lxTE1oRnlXUVA0eExXazAycmtISGNndHpPNGRKZzZGanpMTUFEN2tFS0ctTWExc05yS25KNjJRdTdDRUlUNS1KWGZ1U2lxRG1wZm1ES1pIWG1kNjY2TkhWZDJsWUY5MWRsUkhrZUQ1bDIzRWhrZzVSU3k4?oc=5
2026-02-22	Google	0.286	2 Cash-Heavy Stocks to Consider Right Now and 1 Facing Challenges - The Globe and Mail		https://news.google.com/rss/articles/CBMi4wFBVV95cUxQUkxOTk9xQXF4MVFaRDBVdklqN1JXeUcxUDhXZTVxc2JJRE14dEVGcDJGZC13a1ZXSXpnOUFyaGw5NzFqcXVOOE9XSlJYelJPcndsdFFPTGlHU2NIU01nMDQ2UUZ2S3RCM3poaDNCNFVhSmo2dWp3NXV6NnMtd05zbjNZUGo2Y1dQY25VZnVlLXMzZ2hoSDBNRWZvZHpPeFhDMjR1b0RZWGt6b2NUck94eGhFLXJKd3doNjNnV3ZwMkRMTGo0dUVPR0dVa1hXTUVKbDZaQlVyMzdWTkJkWnpHVTh4bw?oc=5
2026-02-22	Google	0.067	Empirical Financial Services LLC d.b.a. Empirical Wealth Management Invests $3.85 Million in Monolithic Power Systems, Inc. $MPWR - MarketBeat		https://news.google.com/rss/articles/CBMijwJBVV95cUxPVzJiaG1FTnVORmVGX3YxNlRpY01YUXd1eE1OWmJ5aHh5Um01eFhZLTN1cmYtNmRRX1lkU19aeXNWdTFVY3MtTFMtc05aamZSMFFMVzNoU0RIdXBiMWo0Ql94ZWd4dVpsNWF6dDR3RXkzM0xvdFFKWUdoV2VYbmZCRlRtUGtZX0dMV21HR1J0UGZDNkktLXN3c1RHWE9NS2ZhTVVnck5JN3JZZ3JQNWRpWFZOZlV5ZUlWRUkxX1Z2NjNZV0Y5cnpQWWxJMm9qRVZUclV3THVneU92Z0JLOF8ydW1fbTE1N0ttMVFEWUFrU1h6MnI5ZkNpNXp5cFVRYjZyVW9wdDV6Tnd4dVRTam9B?oc=5
2026-02-22	Google	0.0	Monolithic Power Systems Pops on AI-Chip Hype: Is MPWR Still a Buy? - AD HOC NEWS		https://news.google.com/rss/articles/CBMiwgFBVV95cUxQOVR2RTBibFp5SkpKWHFVa0J2VWhXVURNeU5jOXFSUjR2TEhvcml5ZWl2dFAzTGVXMzlaSFBNaWFWUmNUcTRVMDNvMDQwWHR3cWUyVjE5RXo0U2l6UzRYbExiNjkxTS1hSWFmSHpaVlBtdWdtc3lwTGNjQ3VMSWtyWXh4YzJCbEo0d0FyRjRodzJEel9FaXNhTVd2OXFRZm92MXdJU3dyQXd0LVVrU19XaXJRUGZvdGFuaXpia1RWdWpsZw?oc=5
2026-02-22	Google	0.0	Monolithic Power Systems, Inc. $MPWR Shares Acquired by Raiffeisen Bank International AG - MarketBeat		https://news.google.com/rss/articles/CBMi3wFBVV95cUxQYTdIVFFSU3EwMHQxU2ZvRDVJd1BWWmJFdVdjR19zb01WWFktN25IUkdmbnRSVlNDV1R5Wmg5MEFBNWxZYXQ2VnE5Y2R5a25ycS1yY0o5X3RQck9xVGdHckZITG8tZkxfcmJRUlAwNVBYd05EakNXZ2VNQ19IVE0zbG9rTGYzTnFmb0xRTk9GM0JJaWM5QVdOZXB0WjdZQjZUay0ybWVjU3JRR2Y1OUtiaDJ2Q0NYalVZSENFeTctZmRaZk85d0piNm1ObFY1OEs3SUcxZlJUUUkyc3JVRU5r?oc=5
2026-02-22	Google	0.0	Monolithic Power Systems, Inc. $MPWR Shares Sold by Tredje AP fonden - MarketBeat		https://news.google.com/rss/articles/CBMixAFBVV95cUxOQWdydHZTYk90RGhSeGc1d1hSaEl5WEtSeVdGWE1tN1pHQ0JOaWV6cEFTakMyYmtJZEs1OHVaMUI4V2hPbElTR01fWHFDaldCSmZSelJWZFVQYlRQZkFlaWZ5ZWhxaElPRFNIOGx2UFVhcWFobUxGTHdTUmk5MkRFMkt0aGpYTWpiVGJ4VzZuZUZfMjl0cFVPTk1kdDRvUDQtTHN4Wjk5R09rb00xcnB3MXRDTUgtNlJZcnRnMnh1S0prRENE?oc=5
2026-02-21	Google	0.0	NEOS Investment Management LLC Raises Stock Position in Monolithic Power Systems, Inc. $MPWR - MarketBeat		https://news.google.com/rss/articles/CBMi5AFBVV95cUxNSURlUXV5aVRtQ2k3NmNMMkFxaEllRkZEUDhzaENkUUxrYkNES202U202eWtHMW1JOENkUmJIbU5uT19qNGw1WW5CWjA1bWxSTF9TZDdmZk9odTF2UnF0STZZTjUxeGZaRUp5R2FSWmZJV1hXQnBjYWdRRWdsTWF0TE1CSUNZVWFrZ2ZmdE1mTkNRcWJDQ1I0bEZSdlhSVHpOSUNOQ3FfMG91NFl6SHRrSl9xeEprbGdBNThHekZ6ajhKcmV1dVBmNm52dnpQM3JLYjNNbk9yRVk1R2gtSFRTdnRTb0o?oc=5
2026-02-19	Google	0.25	First National Bank of Omaha Buys Shares of 2,787 Monolithic Power Systems, Inc. $MPWR - MarketBeat		https://news.google.com/rss/articles/CBMi2wFBVV95cUxNNGFWbWhPM2w2dkd3LVpfY0JQNzEyODhKajdHR01ZdEs1b055WE1ERnRET3ZPWEVOaDNMb1o2QkJfTDRLNkg2cGZhS0hmLVlPTnZaNlgxUC0wNVppaDBuQnZrSGw3UjIwTkwyU09tTC1LWUlaUE1NUElRWEJ3d2wzRWFLWGNxUHctaW1TOEtDMzZrOC1hQ0o2NnhtdUlqU0pVUEtzdG4zNUZ6T0xpdUlrWVN5d19WY3Bodk1udXF2ejBuejhuRXZIdUJ4c3JCSVJwWUx5Qzl2SmpZX2s?oc=5
2026-02-19	Yahoo	0.122	2 S&P 500 Stocks to Target This Week and 1 We Find Risky	The S&amp;P 500 (^GSPC) is often seen as a benchmark for strong businesses, but that doesn’t mean every stock is worth owning. Some companies face significant challenges, whether it’s stagnating growth, heavy debt, or disruptive new competitors.	https://finance.yahoo.com/news/2-p-500-stocks-target-043524906.html?.tsrc=rss
2026-02-19	Yahoo	0.061	What Are Wall Street Analysts' Target Price for Monolithic Power Systems Stock?	As Monolithic Power Systems has outperformed relative to the broader market over the past year, Wall Street analysts remain strongly optimistic about the stock’s prospects.	https://www.barchart.com/story/news/308074/what-are-wall-street-analysts-target-price-for-monolithic-power-systems-stock?.tsrc=rss
2026-02-19	Google	0.0	NewEdge Wealth LLC Has $16.94 Million Position in Monolithic Power Systems, Inc. $MPWR - MarketBeat		https://news.google.com/rss/articles/CBMi2gFBVV95cUxPcjNlRW5JdVlEVXI2NXVzRzc1bmNxbHNYc3VMVHpYQTk1SHBsbHFjZDVVazFIeWptd1NWR0NPN1lhR3Q4Q3pLNmhiV1ppclJKcGUwT2wzbFBaU1BpamVFVk15REs0QkZKVloxSmxzNkN5X3ZsT3g4c3RXemxzcEhjUTJyRXlONm1oTlkzNlZudGV6MEZtUXVpYXRXNlZEYkM0STF1MnNuUTduZS03WDJ1bTc2ZWlzTzdobHQyZEQ2MzlUYzBQWXdfX2RXbUVJYUdRcjhtWXRUdzRiUQ?oc=5
2026-02-18	Yahoo	0.135	Assessing Monolithic Power Systems (MPWR) Valuation After Record Revenue And Upgraded AI Data Center Outlook	Monolithic Power Systems (MPWR) is back in focus after reporting record fourth quarter revenue of US$751.2 million, paired with revenue guidance of US$770 million to US$790 million for the first quarter of 2026. See our latest analysis for Monolithic Power Systems. The record revenue update comes after a strong run in the share price, with a 30 day share price return of 15.02% and a 90 day share price return of 38.63%. The 1 year total shareholder return of 73.02% and 5 year total shareholder...	https://finance.yahoo.com/news/assessing-monolithic-power-systems-mpwr-231237366.html?.tsrc=rss
2026-02-18	Google	0.0	CFO Retirement And Interim Successor Put Focus On MPWR Valuation And Margins - simplywall.st		https://news.google.com/rss/articles/CBMi4wFBVV95cUxPNEdEZFVWYlVNTEFtamN4V2VLajNaVDFEeE5sQlY1dTd3NGp1TnVOeVZBYjlvV3lyd2lGdE5WR1VESVIyWHVtWjRocDVsZkpKYk9WV1ZIT0YxeGFudTdNMUxNcTJ6Znd3aUFhbVJRS21tSVVMdC1sbE1fMGZxOFBOMmZFemp1bHhMS1lfSFRpNFNrTVdqeHBKZFpIM3FHZVI0dDF1NF9ONnZOcDk0UkhXT2FPbkV0TW5xNlJEQWdUNnM4LWk4VldROTdsbFNha1ZDR3p2UU5fSjFFTEx6eDBTdXcyVQ?oc=5
2026-02-18	Google	0.0	JPMorgan Chase & Co. Acquires 6,503 Shares of Monolithic Power Systems, Inc. $MPWR - MarketBeat		https://news.google.com/rss/articles/CBMi0gFBVV95cUxQaF93QTdjT2UzUVI2Tk94YUZLeWduVmxpWkc4YmNwdzRaUXZpa3NLeUZndDF0aUR3dGgtOUN2UktHQzZlRGg1VjNnNTZaRUNSb2lfbEZBeUFwSGFQNkRUOHhoYmEtVWtTRnMyV25hX214WnJtWlJKY2Z0Zkc4cXl3d09rODVZVzhqeVZsTms4VkZETGtBTE1VRXNLRUVtblhSNlpHRTU0dE9MWElvcEM3WmhCTHdiekVVdFUxZTNzcllGeFVlWmxIUjZfendLTzlWQ3c?oc=5
2026-02-18	Google	0.0	Vanguard Group Inc. Increases Holdings in Monolithic Power Systems, Inc. $MPWR - MarketBeat		https://news.google.com/rss/articles/CBMi0AFBVV95cUxOeHNlczZxVjVUTldManlnX3lTREZKM0ZCWndnWkxheUk0VnB1a0xPUmYwTEkxTXllVTI2NFpvT0xCeWxGMVlRRWlLVGhqNVdWZGI2cjRGNEx4LWhWWV9NNVdHdUgzdFE0czhSWFJiSWt2OXFfSDFKXzhEU0lsaktvenMxQ3ppNTc1LUxkdW5DMUY1Ym53aEdqMnhRR1F5MXRGYkdFc3Y2SXJibWVOS1NWT2t4V0tlbTN1VlVQSjZwOURGOFdqQncteTFsaTVXZm1S?oc=5
2026-02-18	Yahoo	-0.022	Is It Too Late To Consider Monolithic Power Systems (MPWR) After Its Surge To US$1,173?	If you are wondering whether Monolithic Power Systems at US$1,173.18 is priced for perfection or still offers value, the next sections will walk through what the current market tag might be implying. The stock has had a mixed recent patch, with a 2.0% decline over the last 7 days, a 13.6% gain over 30 days, and returns of 25.3% year to date and 70.8% over the last year, plus 148.7% over 3 years and 213.6% over 5 years. Recent coverage of Monolithic Power Systems has focused on the company as...	https://finance.yahoo.com/news/too-consider-monolithic-power-systems-091225242.html?.tsrc=rss
2026-02-17	Yahoo	0.1	Are Computer and Technology Stocks Lagging  Monolithic Power Systems (MPWR) This Year?	Here is how Monolithic Power (MPWR) and Ericsson (ERIC) have performed compared to their sector so far this year.	https://finance.yahoo.com/news/computer-technology-stocks-lagging-monolithic-144003442.html?.tsrc=rss
2026-02-17	Yahoo	0.0	2 Growth Stocks Set to Flourishand 1 We Ignore	Growth is oxygen. But when it evaporates, the consequences can be severe - ask anyone who bought Cisco in the Dot-Com Bubble or newer investors who lived through the 2020 to 2022 COVID cycle.	https://finance.yahoo.com/news/2-growth-stocks-set-flourishand-043234889.html?.tsrc=rss
2026-02-17	Google	0.0	Fifth Third Bancorp Raises Position in Monolithic Power Systems, Inc. $MPWR - MarketBeat		https://news.google.com/rss/articles/CBMizgFBVV95cUxNWUVLcy1vbzdVWnRvZ0Eyc3h4WG0za2VfLTdxamh1dUtnbnF3ZHBNUFg0MGlybmpBcWNXdGhHT0oxYV9CWHF0cEd5YkgyYTZDOEdOWEJqMHVZUjVqSDF5QnA4bkNvZTFOcjg1dlU2VF9lNnZGSkFFN2NfaUpQbWs1YTFuQWV3aWNWTTFvcGZWV3VJdUVYLVdoWGhmU2lzN1RuMkhoc1hCVGlGZkcxaGNaVTZ3R1FYcnJ1aWdzMFRWcS1rUk9kQ1FuZWg5RWxydw?oc=5
2026-02-16	Yahoo	0.233	From Aerospace to AI: 3 Names Supercharging Dividends	After posting massive gains in 2025, a jet engine behemoth just boosted its dividend by over 30%. Meanwhile, two key AI stocks also announced strong increases.	https://www.dividendstocks.com/articles/from-aerospace-to-ai-3-names-supercharging-dividends/?utm_source=yahoofinance&utm_medium=yahoofinance&.tsrc=rss
2026-02-16	Yahoo	0.078	2 Momentum  Stocks Worth Your Attention and 1 We Ignore	Each stock in this article is trading near its 52-week high. These elevated prices usually indicate some degree of investor confidence, business improvements, or favorable market conditions.	https://finance.yahoo.com/news/2-momentum-stocks-worth-attention-043943935.html?.tsrc=rss
2026-02-16	Google	0.0	2 Growth Stocks Set to Flourishand 1 We Ignore - The Globe and Mail		https://news.google.com/rss/articles/CBMiygFBVV95cUxNREVObjI5XzZnQlAyQnJUYllONnIxaUpkUFQzM0RvSS03SHJ5dG5TVHVzQ1p4Wk1seFNXU3FmdTRxOXBvV3QzZnJYZHpsQWdYNmI3Mlp1ajhZcU03VkFSUVVhSmJDbVR1TVlvenJpTzBEemJfT0NXQVJ3Z0pkWWhQTEQtQTQzcURvczZ3S2dvZGNmYVAzVjlqdm9tSi1GaWtOSENkTl9TX1MyVzZiejlXSDRwYXNvV1lxRnhveE5EWjhlZkxkZUVQTF9B?oc=5
2026-02-15	Google	0.3	2 Momentum Stocks Worth Your Attention and 1 We Ignore - The Globe and Mail		https://news.google.com/rss/articles/CBMi1AFBVV95cUxNSFhUQ3lfX2pfQVlpQVhRNkV6TEpJQi1IcGIxa1dBakZhVE1iVjhNMUJOZ28yZ2E2cUQydTJhMlozeVk2MW03Rk0yVzBORG5UNFNXMUlTVUlYODJuWWs5TWN1NkF4OVA5ZkktXzN2NEVPRWs4QnN1ek53S05xVTBNLUthUlpJTUFKWk5DQnVLNHZONXlJSHlXcXVFZEN0aDhIUkhqN0RleXpyX0JBclNYRzZJQUoxMTRRdjYzSzBVUWZGVEF3QTlkcWVkVG1zZ1NWU2F3aw?oc=5
2026-02-14	Google	0.167	Assessing Monolithic Power Systems (MPWR) Valuation After Record Earnings Beat And Strong Data Center Demand - Sahm		https://news.google.com/rss/articles/CBMi7wFBVV95cUxOZ3ZyM3F0bE96X1o2eGJRXzgtNGRNZ2c2ME9ReVQ5MDdjRTJjTl9JRzhmSEFmZHFfTWR6R25vQ3FPbUJtWnhwNHViZXdaNlB0MjVKTW14aHNxZVdBRjRnbFF0TURuRkFLcXpjanpxcVNIZ2g5bmRLNTV6ejItN2hvcFg3QUJJa1ZEc0hxVnJTWmFVUG1wSlZRWEVfcHZTX2duR285b1hzU3FiTXZNaEJ6bVR3QVZ5a1BndU10S3pPS1c5Q1FlbFRUZV9qczVsN3kteEctLWlYakpQYi1DX3poeWdtaGVzM3VXTnRsR25yUQ?oc=5
2026-02-14	Google	0.0	Advisors Asset Management Inc. Has $4.38 Million Stock Position in Monolithic Power Systems, Inc. $MPWR - MarketBeat		https://news.google.com/rss/articles/CBMi7wFBVV95cUxQQXl0ME1pLWRIb00wd292enpjR25wQW5kbURMYmtNSmhMa3RadTdiM1NsOEFOZ0otYUVqLTRJR3hXajJfWmJBLTVCcmZTZ2pOM0RsQ0NPLW9rWVJVM0JvLVNfYm5OSDFmUlZBUFU3ZTVxZTE2WHZNZ0wzWnFpVW9CQ2htMjNIczZnbHJsMWR4UEp1SUdLMHVzNkV0NUlfUV9EN1ZwNTNZdDhiRHJseXRacDhfOWx4ZkFIczBhNGgxYm9XT0l1a3piZXhJbXozSlZmN2ZNWmdWMTRxVVAwQ2x2V21lZzFfUDZ3ZEo3c3VSdw?oc=5
2026-02-13	Yahoo	0.44	KeyBanc Raises Monolithic Power Systems (MPWR) Price Target on Record Quarterly Revenue	Monolithic Power Systems, Inc. (NASDAQ:MPWR) ranks among the best high growth high margin stocks to buy now. On February 6, KeyBanc boosted its price target for Monolithic Power Systems, Inc. (NASDAQ:MPWR) to $1,500 from $1,300, retaining an Overweight rating on the company’s shares. The boost comes after the company’s fourth-quarter results and first-quarter forecasts, which […]	https://finance.yahoo.com/news/keybanc-raises-monolithic-power-systems-145458481.html?.tsrc=rss
2026-02-13	Yahoo	0.179	2 Volatile Stocks with Exciting Potential and 1 We Question	A highly volatile stock can deliver big gains - or just as easily wipe out a portfolio if things go south. While some investors embrace risk, mistakes can be costly for those who aren’t prepared.	https://finance.yahoo.com/news/2-volatile-stocks-exciting-potential-044550938.html?.tsrc=rss
2026-02-13	Yahoo	0.167	Monolithic Power Systems Links CFO Transition And Higher Dividend To Margins	Monolithic Power Systems (NasdaqGS:MPWR) announced the planned retirement of long-serving CFO and Executive Vice President Bernie Blegen. The company named an interim CFO to support continuity in its finance leadership during the transition. Alongside the leadership changes, Monolithic Power Systems approved a higher quarterly dividend following robust quarterly results. For investors watching Monolithic Power Systems at a share price of $1,155.93, these updates connect leadership change...	https://finance.yahoo.com/news/monolithic-power-systems-links-cfo-211316162.html?.tsrc=rss
2026-02-12	Yahoo	0.467	What Makes Monolithic Power (MPWR) a Strong Momentum Stock: Buy Now?	Does Monolithic Power (MPWR) have what it takes to be a top stock pick for momentum investors? Let's find out.	https://finance.yahoo.com/news/makes-monolithic-power-mpwr-strong-170004817.html?.tsrc=rss
2026-02-12	Yahoo	0.344	Why Monolithic Power (MPWR) is a Top Growth Stock for the Long-Term	The Zacks Style Scores offers investors a way to easily find top-rated stocks based on their investing style. Here's why you should take advantage.	https://finance.yahoo.com/news/why-monolithic-power-mpwr-top-144504226.html?.tsrc=rss
2026-02-12	Google	0.25	Earnings Estimates Moving Higher for Monolithic (MPWR): Time to Buy? - Yahoo Finance		https://news.google.com/rss/articles/CBMikwFBVV95cUxQeG9rVlVMLTZRb3podkNrYmV5dWZaLUo3UTJaYi1fQzRrTWdWZ3Z6UUMteHp6b3NBQmxtRGVsWWU5c1pyTTUtdTNLMGpiVjlaZjl2aWItTUVaQVBiT3hWT2wwZURsS2RzZFlpdE1kUE1ORU1aWXRCVm1GNFgwcENpSnlBTVluSWR4SHRtRUFESjc2ZXc?oc=5
2026-02-12	Yahoo	0.182	The Top 5 Analyst Questions From Monolithic Power Systems’s Q4 Earnings Call	Monolithic Power Systems delivered a solid fourth quarter, with results surpassing Wall Street’s revenue and profit estimates and prompting a positive market response. Management attributed this quarter’s performance to robust demand in enterprise data and communications end markets, as well as continued momentum in automotive. Tony Balow, vice president of finance, emphasized, “Our non-enterprise data end markets grew by over 40% year-over-year, showcasing the strength of our diversified busine	https://finance.yahoo.com/news/top-5-analyst-questions-monolithic-054403908.html?.tsrc=rss
2026-02-12	Yahoo	0.15	Earnings Estimates Moving Higher for Monolithic (MPWR): Time to Buy?	Monolithic Power (MPWR) shares have started gaining and might continue moving higher in the near term, as indicated by solid earnings estimate revisions.	https://finance.yahoo.com/news/earnings-estimates-moving-higher-monolithic-172002271.html?.tsrc=rss
2026-02-12	Google	0.0	Baader Bank Aktiengesellschaft Takes Position in Monolithic Power Systems, Inc. $MPWR - MarketBeat		https://news.google.com/rss/articles/CBMi2wFBVV95cUxOMWJJMjFhLURlVUhhNHNHNk44TDB4NGQ4ODBramhmelRobFg0cEttLVdOWVM1U3VhYkpaRFhOdjhleHlRb29xWVAwMlVIOGliRnBDVnZLM3NMT0w5emFYQUVPX1VydFZTX2k5UnV6UlpFSXJ3MV9wcTFwNU9mNjk4R19KTkdhMDQ5dWUwY09venNwbVl1cVRkNnNIRm5EeHhZcjVaY1FNQkp3MmJ5b0ZPdVQxX0tvQmlQOVIwM0tPSFlpQ2FhY0VEV2JRZXMxT1V1V1BrZVdpdnRuQ1E?oc=5
2026-02-11	Google	0.0	Monolithic Power Systems (NASDAQ:MPWR) Is Paying Out A Larger Dividend Than Last Year - simplywall.st		https://news.google.com/rss/articles/CBMi4wFBVV95cUxNcWRjdk9VajE5NnRuem5VTFdMeEJFQ3FWSVZES0dZM2dKZl9CUEJ5dkVPbUtIUEZJdzAtaDBCaXpjY2N5N19GUGFEYVpTSzR3bkkwRXQ0cmtmQUJDaHAydWo1eEx4ZWNLTkh3RVlrTmNhdDB2a0o5S211M0RRWDhfWThxaVdfcTF6cVdTLXI1SF9qRHZsWkd3QWhCQUMtckJydVFWaEtodlpDaFAzWVlEQzVxVmF0YWstMWdIaWh2cmtYTTdKWHI3b3VGbjN6alEwMGRCRkZZZThsak5waTR1SXdyVQ?oc=5
2026-02-11	Google	0.0	Monolithic Power Systems Inc (MPWR) Stock Price Up 4.11% on Feb 11 - GuruFocus		https://news.google.com/rss/articles/CBMiowFBVV95cUxNaG1Cb19EOHBVVzRmRmktYnZCZmprOWhBMHMwYWZQQlZDSXZQTFhhb2UtU0ZaQ09QbGc2cnc2enNqNWNnaHZ5cXp1emZwN2RUdXM1blVxRFE2V1p6WjJrWndxZ1JORUliLTBLUE9pMFZyQl8yTVdHS21pRGFoRGRnOGRfTHlSWEV6QWZXTUc0WTdHUl9JdklpaVl1b0ZBYWpnQVFv?oc=5
2026-02-10	Google	-0.078	Monolithic Power Systems (NASDAQ:MPWR) Trading Down 5.5% - What's Next? - MarketBeat		https://news.google.com/rss/articles/CBMitwFBVV95cUxNU1hHMU9FQ2dxQ1lEMkd2Y0RTWEhpOFVxaFl6aEZvSGkzelpIYWU2eW1FWm1IRXJGTzk2MG43TzNvSXVQSTAzX2xMSmEyMVhUZlJ3eVMtcG0xNUtoUWNRSmwyRmdVSHQwbHRLbE5GZnFoM2FYUlM2cDE0Vkk4ZExzdUFJalowdERpNTRTWkNjVTJLRENmSWVXME1NSWxqT3pnQndvcEg3WjlUaVFwWi1sUnBXOVNqUEk?oc=5
2026-02-10	Google	-0.156	$MPWR stock is down 6% today. Here's what we see in our data. - Quiver Quantitative		https://news.google.com/rss/articles/CBMiogFBVV95cUxNR0hqbmdpVTNtblR6QzBDNmRsUF8ydDlNd2I5SEs2aUVVWWtzaktGclBKUlBNVDdBVkFCWVZXcjBtTHJ1dHNoS3ZIdjFSR3dRVWhYaElzdEtrcWFFQTQ1dDdvcnRDUjhCMHV1d2N0RjVSczR2emdCS0xJYXJjT05ueW9nTVhsTWdYc1k4SUlhX2c3c0FfTG5DcVZXajZBWnVodEE?oc=5
2026-02-10	Google	-0.156	Monolithic Power Systems Inc (MPWR) Shares Gap Down to $1144.09 on Feb 10 - GuruFocus		https://news.google.com/rss/articles/CBMirAFBVV95cUxOQ29FSFZFWHp3NDNqQXA1VG5fc2tEeUYyMUlMSno2RVl0b3pydlFrUXlkbXgyV0p4ZHF1ZXFDY2x5ZVBEXzg5blM3aFI5d3ZWY3VQd2NpSVlPZGYxX1dYOHYtUjRaTmJIZFJmZDVLaEYwMHhlRk1YUzA1Z2Q4TXR3ZU5rWVlJdUZkWHpaV01xQ2k1ZVFSZkJvNnE1cEV5SmlsX1Q1R2hwZkI4NFhB?oc=5
2026-02-08	Yahoo	0.12	Monolithic Power Systems (MPWR) Is Up 9.4% After Dividend Hike And Revenue Guidance Update	In early February 2026, Monolithic Power Systems reported past fourth-quarter and 2025 results with higher sales year on year, issued first-quarter 2026 revenue guidance of US$770.0 million to US$790.0 million, announced a quarterly dividend increase from US$1.56 to US$2.00 per share, and outlined the planned retirement of long-serving CFO Bernie Blegen, with Corporate Controller Rob Dean to become interim CFO. An interesting angle for investors is how the company is pairing a sizable...	https://finance.yahoo.com/news/monolithic-power-systems-mpwr-9-001610126.html?.tsrc=rss
2026-02-07	Google	0.068	New Buy Rating for Monolithic Power (MPWR), the Technology Giant - The Globe and Mail		https://news.google.com/rss/articles/CBMi3AFBVV95cUxOVm5IV2E5dFVKS1V6NnlxMGxLQ2dpay1yV3pjZXRrOFZBZjU2TEdlN0Z3Nlhaam5vRVlIanpXZjNyM1A1eHZBbnNHc0x3Z2tMajdtUW9JbXhoV1dDTmJBQl9wX3ZYQTktekd5UUNRUWYxdjNSZXBNUXYta0M3Z255MXQzNkdfM3pjc1J3THQ2YkswZGJ4SU9laEFQM1hRcjAyMU84OFVuSnhvYTdnWXp3bEtJSE9YNUk2UW5jbkVrYnhGWUpuRV80aVpnWnoxQ3pHUjQxZ2xwX1hHMEdx?oc=5
2026-02-07	Google	0.0	Monolithic Power (MPWR) Receives a Buy from Wells Fargo - The Globe and Mail		https://news.google.com/rss/articles/CBMi0gFBVV95cUxPQjZVd2M2Wk9FOHFWUWQ5TlNfcjczQmtFamNpb0FHYVV4MUFfR0M4VFRjWi1NeXBDdEE1U1lqTG5zREVBcXlOOFlzNHR1UGkxdjItZllKejVnX2pXRWMzdHB3WV91cTJsWGpLcjhBb0dDMXdkNFlscnk4eEdXZ3UxU3paa0hGS0JaM0dkVmtxbnlseU9yOW5vTF9jNkFzSVNUSnNHRUpfVmR5QUF2akhCaHd0aDNXS09MeUlFRDUyRGt4aWlOY1JMVUFUMW5qLVJxR3c?oc=5
2026-02-07	Google	0.0	Monolithic Power Systems (MPWR) Net Margin Reset Tests Premium Valuation Narrative - simplywall.st		https://news.google.com/rss/articles/CBMi4wFBVV95cUxPQVUydkJydTNWYlNnLW5ka043dVRwRS1zM2puZWkxb3NnUWkzSnpsSTZTY3VaQ1Z3T1RqVGR2bEt3ZXlkTWE2N3dhcnVLMG92QmgwbVpMdGVTUTJ3OUF4Q1VVNGhNemsxbVhPNEstZjJ4eHJWUUVMMTBQVlVtVTJkcmQxcV9fYU5zenczSzRvbU9WTkN2M1RjcjlGYk1IR05LNVVZNFVtd0xzSE5zRGRUaXJxZEoyQXFHM3M1UUNJenRkSXZUMl85TEtiRW1jbXR4MDljd1ZOTy04UUZHTXRzdEtjVdIB6AFBVV95cUxPTW1KYU1HMDFneS1zd09JOENkUEN4d0EzQTJZVjBmQ3owSFd5alFhWkJIQURiMlkxT1V2dUtnX0dBUXVqNDNITXpmQ0U5amtFckI3ZmpocTJFUnFKVEU4SjI5RHhqRHpQZjFBRUlCNVcxbjdSM2c3VkdsZXc2TWxSTTY0SV9mci1tbEdXU282Mnd1OFB1QzZBRFg5NWhhVlY3MXZqaEdGUGVvWWhOV3paOVc0eU43VHg1dlBCWkRZTVNwZnNmZHFTX2N3NERlUVJuRU5leGxmMEVPQUFxdUotUjBpUDZoQm5H?oc=5
2026-02-06	Google	0.217	These Analysts Increase Their Forecasts On Monolithic Power Following Strong Q4 Results - Benzinga		https://news.google.com/rss/articles/CBMi9AFBVV95cUxPZnF5S3U2ekVYbF8zVm9tTExhSENOWXY0VXdhVGswN2NZVnhCRVNaVWt6b0lKVjYyczBiQVJCUG1FWG5jZERjbXhYOUdKdFhRMk16VlY0amJCNm54RUZHZlBHMTRJbG15TWZKalJwMDNkcm1nVWc5MHo1alpJYzBQYXJLbkN3QnRuVDJYZmxOZTk3dWxNNjBqUVEtR01FclRIY3poTGFpTkxRZ0VOQW12anZCc1d0VnFFQjBKQk9DWEo1Nm5EUFcxanI3QmZLeXBkeU5hS2lHYTR5dGpLVWZSVnFiQWtEUDRNQzRPcmRhalNEdVlD?oc=5
2026-02-06	Google	0.148	MPWR stock jumps to a new high: what to know after Monolithic Power Systems’ upbeat outlook - TechStock²		https://news.google.com/rss/articles/CBMirwFBVV95cUxNUHdTTTNNanVSNFdVaGZKazlsdUtkVlBBTjJvd25Kb2U0RTRMQkM1bnlLMEtabGtRMmZQbEVVS3I1NHMyZHFjSWlsYW9PY3d3Ui1faGZfWFVzUVdxX2pZVzFCT194NWRyV09qaU01MllNa2xQc3p0Rkc3a3N6V3IxZVlLYzVIZGNTNHFfYkcxN0s2UVM0cGdPQy1BbFJzb0F5NURseXlSdEVrQ19QQVNn?oc=5
2026-02-06	Google	0.111	MPWR Q4 Deep Dive: Data Center and Automotive Growth Drive Strong Outlook - FinancialContent		https://news.google.com/rss/articles/CBMi3AFBVV95cUxOMFhvM0FIUHdnbno0dlRFYVVzakNjckRQdnNvS3NmemtpVnlkXzR4OU5FdGd6SmdxRmR2b1RQVnZMN3dJSlh0RzRnU2Uzb003WWlNRE1oZmNwWnpTWnZRck5lNTBCTF9IR1pPR29vZG5abWF5YzdXVDJXY0tEQ1hqT0RrTmgycGlTTmhjSVpLUmRwTHE1cE92ejZ6RUlpZnJzc1hYMTdib0ZNRHhiWk9rN29qUGdUN2hjM0Z0cFNKREJDTXJhU2VqN19UZWo5VGpqX05MdkJ2cWVKVWll?oc=5
