Date	Source	Sentiment	Headline	Summary	URL
2026-02-25	Google	0.1	Empirical Asset Management LLC Takes Position in Monolithic Power Systems, Inc. $MPWR - MarketBeat		https://news.google.com/rss/articles/CBMi2wFBVV95cUxQV2tiMXF2LU8wVWdTTWdfbzB5YTJvN0lBbWFUQ3FEMXNqc0pCSTFhN01KQmNPTmgyZDJYSFFNMzgxVXpSTXNJNFpCMUZ6bGdGSHVUT1JkZWVTcGpCdHNjdGd5bXVhZzJTTHRhOEwxR1JKM1RZdXp1SmpPa2pOb0JXd1A5VnpJVUtobXg5LXpvV1VLT0ZDVHc5VlItd3dNai04cnJGbzZqYndTcmtObmxzRFoyck5xVU9MdjlDdlUwNnNrZ19Hak53d1FzUzF2VUxWMWpVdTlzODFxR0k?oc=5
2026-02-25	Yahoo	-0.228	2 Profitable Stocks on Our Buy List and 1 Facing Headwinds	Not all profitable companies are built to last - some rely on outdated models or unsustainable advantages. Just because a business is in the green today doesn’t mean it will thrive tomorrow.	https://finance.yahoo.com/news/2-profitable-stocks-buy-list-123135008.html?.tsrc=rss
2026-02-24	Google	0.25	Why Monolithic Power Systems, IBD Stock Of The Day, Is Called A Top Pick - Investor's Business Daily		https://news.google.com/rss/articles/CBMirAFBVV95cUxObHpndW5meFFXWTZaZWdpYlFISnFjZFJKZDc1eWtJUzdIMnpaQTNXWWVkdlE2R05vTXp0V2JsZ0hRZVdpY3ZwaXNCVFFLTnNtQm1QWmlXZzFsTXJyRTNyLVNzRUFkVjdaN1BZSVMxajNOdXRXTHZ3ak5CaGJKcTZVMWdwTGhETTJxa0tCcU9qTk1sSTRDVlFHTUZVRnJpLW5KTHJMM2pBSTdORDFJ?oc=5
2026-02-24	Google	0.0	Monolithic Power Systems, Inc. $MPWR Position Increased by Lansforsakringar Fondforvaltning AB publ - MarketBeat		https://news.google.com/rss/articles/CBMi7gFBVV95cUxNbkROTkRpeU1hVS16bGQ1YjdpY3g4YmxPdUlXUkRuZnpfbnRzV2U1UmZ4RllOaHpiZnd4SHhWc285WDhULVNoQ2RLQ0hyOUt4Qm42d2hFS0tZTVZfNTlsb2w5M0lqanpGRE5jV1hGRDJuY1pHcjZtdDJ1eEVpekYyTE1uWEVrMTcyalJ0TW00V0VTU1VSeVFxaUdXaDFfS1lxT1dLZ05hVG1UTGZrM01JQ2ZSLThxMG5rczlPb0RIMHNoLXoxWkItOFIxNk1UcEQ1eEFKbEN3Tmo4bHVwTjZ3Tm0zdUUxUzVvM0VzWmZ3?oc=5
2026-02-24	Google	-0.1	A Look At Monolithic Power Systems (MPWR) Valuation After Citi Highlights Data Center Strength - simplywall.st		https://news.google.com/rss/articles/CBMi6AFBVV95cUxNako4MHNSZzRhLWt1d1kxNUEzbEFOdXhQNV9aWVM4Y2ZjMVNUNzdOSUpRanpZNHR0ODUta1FPRlI3NVhkSEVNTWdnd2RBWE1VRGdPcTA2Tmg2OWdERUtpc0NLbUxsSlIyejZQWDJkWlhIbVJoV3p2aDE4ek0xaTNDd1N2LUJxNTZTXzA4eUh3aGFSY1dRUEE2dS0xRGxRb3czQkNWQXRDZXE1MURTTlNOcWVYTWtYeXpyQWZuRkFyeXBUakU1cGU3UnlYUFZGclYxYzhDSVJpSXlPNlZzRmFXbm5LRWJjc2cz0gHoAUFVX3lxTE1qSjgwc1JnNGEta3V3WTE1QTNsQU51eFA1X1pZUzhjZmMxU1Q3N05JSlFqelk0dHQ4NS1rUU9GUjc1WGRIRU1NZ2d3ZEFYTVVEZ09xMDZOaDY5Z0RFS2lzQ0ttTGxKUjJ6NlBYMmRaWEhtUmhXenZoMTh6TTFpM0N3U3YtQnE1NlNfMDh5SHdoYVJjV1FQQTZ1LTFEbFFvdzNCQ1ZBdENlcTUxRFNOU05xZVhNa1h5enJBZm5GQXJ5cFRqRTVwZTdSeVhQVkZyVjFjOENJUmlJeU82VnNGYVdubktFYmNzZzM?oc=5
2026-02-23	Google	0.5	Texas Instruments (TXN) and Monolithic Power Systems (MPWR) Named Top Picks by Citi - GuruFocus		https://news.google.com/rss/articles/CBMiugFBVV95cUxQanB3VGRIcXJ3cnoxUHNqTXRLalo1RWxPUVo4T2NKZEVhLTNvTlloUTRDUl84UzJZa0k0d1hKUHRhcWtSbW5rOEs1SDhKVlhGVnRmSGhqdVg5WFpYOUROS0lzU3BsOVBsWnVGd002eEZzb3lXZTNRNDZGMzNCUmQ3dncwRGkxN3A5Y25XSTBTempkTUkyQmNuOTZJMDNtSUltVkpBNHRPTl9jTnNqeDM1bTNtS1FIblN5M0E?oc=5
2026-02-23	Yahoo	0.193	2 Cash-Heavy Stocks to Consider Right Now and 1 Facing Challenges	Companies with more cash than debt can be financially resilient, but that doesn’t mean they’re all strong investments. Some lack leverage because they struggle to grow or generate consistent profits, making them unattractive borrowers.	https://finance.yahoo.com/news/2-cash-heavy-stocks-consider-044608845.html?.tsrc=rss
2026-02-23	Google	0.0	Oppenheimer Reaffirms Buy on Monolithic Power (MPWR), Citing Long-Term Growth Potential - MSN		https://news.google.com/rss/articles/CBMi6wJBVV95cUxQcnhPU3RqNjVIWnprSmQtcldWWkNxc3ZOT09xSXhBSjBNeDNoS0xuY3VvR2U5MGdIaDFvTmE2ZlMyREJfTWVTbWtfU3lYcUJGVm1hQllINDdGRGREbzNILXBxdnJkYjVpSGVfQXNMZzlQT2E2Mm9IT0szNnpiRWpCRGNMa3U4cVpVTkdROVhSNWp1TDR4WElGNjRaX0J2NlJUY0otcWpBa1dsTU4yZzkzenZIQ3JsUzFWOGtNY2lCYTVVSnZVYk1OUHpoZUN5NUtzSWllM3ZFdXJDRG9Gc01UaGpfdEU1Rldvc2IzU0F0aVFxZ01DREpDeHlCSFlDVFFXVzlBakp5MWgwSEhmejFhMFhncTRRTk5DYmt6NmdWb3RLQTNicTFhTjdQNzZJSTVQTU5fZzU0M1RXTWViQ2UxZHhOeGFqc1NrcHR3d1RxRGNBcGtjc24xekRtdWhaZnFWdGJpTkNIM3Y0TXc?oc=5
2026-02-23	Google	0.0	SOXX, MPWR, NXPI, MCHP: ETF Inflow Alert - Nasdaq		https://news.google.com/rss/articles/CBMid0FVX3lxTE1oRnlXUVA0eExXazAycmtISGNndHpPNGRKZzZGanpMTUFEN2tFS0ctTWExc05yS25KNjJRdTdDRUlUNS1KWGZ1U2lxRG1wZm1ES1pIWG1kNjY2TkhWZDJsWUY5MWRsUkhrZUQ1bDIzRWhrZzVSU3k4?oc=5
2026-02-22	Google	0.286	2 Cash-Heavy Stocks to Consider Right Now and 1 Facing Challenges - The Globe and Mail		https://news.google.com/rss/articles/CBMi4wFBVV95cUxQUkxOTk9xQXF4MVFaRDBVdklqN1JXeUcxUDhXZTVxc2JJRE14dEVGcDJGZC13a1ZXSXpnOUFyaGw5NzFqcXVOOE9XSlJYelJPcndsdFFPTGlHU2NIU01nMDQ2UUZ2S3RCM3poaDNCNFVhSmo2dWp3NXV6NnMtd05zbjNZUGo2Y1dQY25VZnVlLXMzZ2hoSDBNRWZvZHpPeFhDMjR1b0RZWGt6b2NUck94eGhFLXJKd3doNjNnV3ZwMkRMTGo0dUVPR0dVa1hXTUVKbDZaQlVyMzdWTkJkWnpHVTh4bw?oc=5
2026-02-22	Google	0.067	Empirical Financial Services LLC d.b.a. Empirical Wealth Management Invests $3.85 Million in Monolithic Power Systems, Inc. $MPWR - MarketBeat		https://news.google.com/rss/articles/CBMijwJBVV95cUxPVzJiaG1FTnVORmVGX3YxNlRpY01YUXd1eE1OWmJ5aHh5Um01eFhZLTN1cmYtNmRRX1lkU19aeXNWdTFVY3MtTFMtc05aamZSMFFMVzNoU0RIdXBiMWo0Ql94ZWd4dVpsNWF6dDR3RXkzM0xvdFFKWUdoV2VYbmZCRlRtUGtZX0dMV21HR1J0UGZDNkktLXN3c1RHWE9NS2ZhTVVnck5JN3JZZ3JQNWRpWFZOZlV5ZUlWRUkxX1Z2NjNZV0Y5cnpQWWxJMm9qRVZUclV3THVneU92Z0JLOF8ydW1fbTE1N0ttMVFEWUFrU1h6MnI5ZkNpNXp5cFVRYjZyVW9wdDV6Tnd4dVRTam9B?oc=5
2026-02-22	Google	0.0	Monolithic Power Systems, Inc. $MPWR Shares Sold by Citigroup Inc. - MarketBeat		https://news.google.com/rss/articles/CBMiwAFBVV95cUxQeVpMUU51MFNTOC1ub2FpSkk2ZjJybXlzN0lrVDdQWFhkdEswTHZ2NklvMFRydmFGeGNmemJVNnoyRjBsNkNkNldZeUdyVDNDUWl5RktxUTgyeFZFRFlPazA0SUc0SG9JZ0JfbG02TlgxeW9tUW5RWlA5clVERkdHZXlYQjFFdms4YjJoTF82am5kU21oV0RRbU90QUhnVkFQSmVsRnF4RFpmU0o0Umx2dEVmaGp4R2ZQRHh2Q1AwWHM?oc=5
2026-02-21	Google	0.0	NEOS Investment Management LLC Raises Stock Position in Monolithic Power Systems, Inc. $MPWR - MarketBeat		https://news.google.com/rss/articles/CBMi5AFBVV95cUxNSURlUXV5aVRtQ2k3NmNMMkFxaEllRkZEUDhzaENkUUxrYkNES202U202eWtHMW1JOENkUmJIbU5uT19qNGw1WW5CWjA1bWxSTF9TZDdmZk9odTF2UnF0STZZTjUxeGZaRUp5R2FSWmZJV1hXQnBjYWdRRWdsTWF0TE1CSUNZVWFrZ2ZmdE1mTkNRcWJDQ1I0bEZSdlhSVHpOSUNOQ3FfMG91NFl6SHRrSl9xeEprbGdBNThHekZ6ajhKcmV1dVBmNm52dnpQM3JLYjNNbk9yRVk1R2gtSFRTdnRTb0o?oc=5
2026-02-20	Google	0.5	Better Value & Growth: NVDA, MU Lead Monolithic Power Systems Stock - Trefis		https://news.google.com/rss/articles/CBMixgFBVV95cUxPVGFqNFRTeFFoNlFoZkFFQWgyOUY4ZXVsbnNxYVhtOUNoU3YxZFA5bEd0RVBGaS13XzBkank5UFk2cXRiUElmQ25SYzVwWjZJalBXZGZKUXBrekFOQ1JHclliR2dOZ3V2aG83U05kQVE1SkcySHA4VldSclZRY3pFVGJpNVZjTE9jWEd2ZEFEZ0c2SWVtZUhpZVlSajB2Y0JzZ01uUkk3TEltWDB2WUxjQkVSNGdIMms4TkNUS1JST1VFRmpLRkE?oc=5
2026-02-19	Yahoo	0.122	2 S&P 500 Stocks to Target This Week and 1 We Find Risky	The S&amp;P 500 (^GSPC) is often seen as a benchmark for strong businesses, but that doesn’t mean every stock is worth owning. Some companies face significant challenges, whether it’s stagnating growth, heavy debt, or disruptive new competitors.	https://finance.yahoo.com/news/2-p-500-stocks-target-043524906.html?.tsrc=rss
2026-02-19	Yahoo	0.061	What Are Wall Street Analysts' Target Price for Monolithic Power Systems Stock?	As Monolithic Power Systems has outperformed relative to the broader market over the past year, Wall Street analysts remain strongly optimistic about the stock’s prospects.	https://www.barchart.com/story/news/308074/what-are-wall-street-analysts-target-price-for-monolithic-power-systems-stock?.tsrc=rss
2026-02-19	Yahoo	0.035	Some US investors pivot to infrastructure amid broader AI selloff	As Wall Street's love affair with artificial intelligence heavyweights cools, some investors are pivoting to infrastructure companies they expect to benefit from AI capital spending, a shift that is spawning a slew of new products.  After huge gains in recent years, shares in AI tech giants such as ‌Alphabet and Amazon have suffered sharp declines as investors worry returns from their massive investment in developing smarter AI systems won't justify such lofty valuations.  To profit from ‌that s	https://finance.yahoo.com/news/us-investors-pivot-infrastructure-amid-163133774.html?.tsrc=rss
2026-02-18	Yahoo	0.135	Assessing Monolithic Power Systems (MPWR) Valuation After Record Revenue And Upgraded AI Data Center Outlook	Monolithic Power Systems (MPWR) is back in focus after reporting record fourth quarter revenue of US$751.2 million, paired with revenue guidance of US$770 million to US$790 million for the first quarter of 2026. See our latest analysis for Monolithic Power Systems. The record revenue update comes after a strong run in the share price, with a 30 day share price return of 15.02% and a 90 day share price return of 38.63%. The 1 year total shareholder return of 73.02% and 5 year total shareholder...	https://finance.yahoo.com/news/assessing-monolithic-power-systems-mpwr-231237366.html?.tsrc=rss
2026-02-18	Google	0.0	CFO Retirement And Interim Successor Put Focus On MPWR Valuation And Margins - simplywall.st		https://news.google.com/rss/articles/CBMi4wFBVV95cUxPNEdEZFVWYlVNTEFtamN4V2VLajNaVDFEeE5sQlY1dTd3NGp1TnVOeVZBYjlvV3lyd2lGdE5WR1VESVIyWHVtWjRocDVsZkpKYk9WV1ZIT0YxeGFudTdNMUxNcTJ6Znd3aUFhbVJRS21tSVVMdC1sbE1fMGZxOFBOMmZFemp1bHhMS1lfSFRpNFNrTVdqeHBKZFpIM3FHZVI0dDF1NF9ONnZOcDk0UkhXT2FPbkV0TW5xNlJEQWdUNnM4LWk4VldROTdsbFNha1ZDR3p2UU5fSjFFTEx6eDBTdXcyVQ?oc=5
2026-02-18	Google	0.0	Vanguard Group Inc. Increases Holdings in Monolithic Power Systems, Inc. $MPWR - MarketBeat		https://news.google.com/rss/articles/CBMi0AFBVV95cUxOeHNlczZxVjVUTldManlnX3lTREZKM0ZCWndnWkxheUk0VnB1a0xPUmYwTEkxTXllVTI2NFpvT0xCeWxGMVlRRWlLVGhqNVdWZGI2cjRGNEx4LWhWWV9NNVdHdUgzdFE0czhSWFJiSWt2OXFfSDFKXzhEU0lsaktvenMxQ3ppNTc1LUxkdW5DMUY1Ym53aEdqMnhRR1F5MXRGYkdFc3Y2SXJibWVOS1NWT2t4V0tlbTN1VlVQSjZwOURGOFdqQncteTFsaTVXZm1S?oc=5
2026-02-18	Yahoo	-0.022	Is It Too Late To Consider Monolithic Power Systems (MPWR) After Its Surge To US$1,173?	If you are wondering whether Monolithic Power Systems at US$1,173.18 is priced for perfection or still offers value, the next sections will walk through what the current market tag might be implying. The stock has had a mixed recent patch, with a 2.0% decline over the last 7 days, a 13.6% gain over 30 days, and returns of 25.3% year to date and 70.8% over the last year, plus 148.7% over 3 years and 213.6% over 5 years. Recent coverage of Monolithic Power Systems has focused on the company as...	https://finance.yahoo.com/news/too-consider-monolithic-power-systems-091225242.html?.tsrc=rss
2026-02-17	Yahoo	0.1	Are Computer and Technology Stocks Lagging  Monolithic Power Systems (MPWR) This Year?	Here is how Monolithic Power (MPWR) and Ericsson (ERIC) have performed compared to their sector so far this year.	https://finance.yahoo.com/news/computer-technology-stocks-lagging-monolithic-144003442.html?.tsrc=rss
2026-02-17	Google	0.0	Fifth Third Bancorp Raises Position in Monolithic Power Systems, Inc. $MPWR - MarketBeat		https://news.google.com/rss/articles/CBMizgFBVV95cUxNWUVLcy1vbzdVWnRvZ0Eyc3h4WG0za2VfLTdxamh1dUtnbnF3ZHBNUFg0MGlybmpBcWNXdGhHT0oxYV9CWHF0cEd5YkgyYTZDOEdOWEJqMHVZUjVqSDF5QnA4bkNvZTFOcjg1dlU2VF9lNnZGSkFFN2NfaUpQbWs1YTFuQWV3aWNWTTFvcGZWV3VJdUVYLVdoWGhmU2lzN1RuMkhoc1hCVGlGZkcxaGNaVTZ3R1FYcnJ1aWdzMFRWcS1rUk9kQ1FuZWg5RWxydw?oc=5
2026-02-16	Yahoo	0.233	From Aerospace to AI: 3 Names Supercharging Dividends	After posting massive gains in 2025, a jet engine behemoth just boosted its dividend by over 30%. Meanwhile, two key AI stocks also announced strong increases.	https://www.dividendstocks.com/articles/from-aerospace-to-ai-3-names-supercharging-dividends/?utm_source=yahoofinance&utm_medium=yahoofinance&.tsrc=rss
2026-02-16	Yahoo	0.078	2 Momentum  Stocks Worth Your Attention and 1 We Ignore	Each stock in this article is trading near its 52-week high. These elevated prices usually indicate some degree of investor confidence, business improvements, or favorable market conditions.	https://finance.yahoo.com/news/2-momentum-stocks-worth-attention-043943935.html?.tsrc=rss
2026-02-15	Google	0.0	(MPWR) Price Dynamics and Execution-Aware Positioning - Stock Traders Daily		https://news.google.com/rss/articles/CBMizAFBVV95cUxPZk02aDJMcF9YWHhZZ0ptckFjWUx1dF91YnhZV3FjNThZWUxEOHJfa1dwT1lqTWlDMWhmWmxUQUF0ZFRkcVlHaUFySkVhU3BtWE1kWExwZ19NclV6UUp4MXF3M1NKVURJUnlKUXI1S0wwRm1RcC1lRUhhVW50LTk2TEN2SVRJRkRmSUhlQ3dOeEFjdy1VbExyX2xnU0lQMEtOeUJUQzNYNTdZM3kwOVVteEVkLU1CZTJ5UWdHczdsbVZHbjJGZnlsYm5xUjM?oc=5
2026-02-13	Yahoo	0.179	2 Volatile Stocks with Exciting Potential and 1 We Question	A highly volatile stock can deliver big gains - or just as easily wipe out a portfolio if things go south. While some investors embrace risk, mistakes can be costly for those who aren’t prepared.	https://finance.yahoo.com/news/2-volatile-stocks-exciting-potential-044550938.html?.tsrc=rss
2026-02-12	Yahoo	0.344	Why Monolithic Power (MPWR) is a Top Growth Stock for the Long-Term	The Zacks Style Scores offers investors a way to easily find top-rated stocks based on their investing style. Here's why you should take advantage.	https://finance.yahoo.com/news/why-monolithic-power-mpwr-top-144504226.html?.tsrc=rss
2026-02-12	Google	0.0	Monolithic Power Systems (MPWR) Is Up 5.3% After Dividend Hike And CFO Transition Update - What's Changed - Sahm		https://news.google.com/rss/articles/CBMi5AFBVV95cUxPNTBvX2VNT1VKNWZMRERyelJCaUU0ZEpWb0xDR3BkUUtzdW1JNFA1ZzBKOXlZUDRza05hRHZoN2FSVll4c3JDdHgtLU55eWJ1V2FObU5NbUp6M1RtaHlqaXJTUUVoajhfQmRZSFVKTHZGWUdyWUJ2OGxibnJYRF93RHdrWmgtZ0QxVERtZG9Ob3RhMmowdkp5R0k5MjZjcG5sQXhmWU0wbUtjblVvWDdGa000eHhNdHZsYlAwbUNWM1JrWHdWNFk3OV9hYTJDbUxuSTdCMkt2a2NLZGE1a2pxVUMzZmI?oc=5
2026-02-11	Google	0.0	Monolithic Power Systems (NASDAQ:MPWR) Is Paying Out A Larger Dividend Than Last Year - simplywall.st		https://news.google.com/rss/articles/CBMi4wFBVV95cUxNcWRjdk9VajE5NnRuem5VTFdMeEJFQ3FWSVZES0dZM2dKZl9CUEJ5dkVPbUtIUEZJdzAtaDBCaXpjY2N5N19GUGFEYVpTSzR3bkkwRXQ0cmtmQUJDaHAydWo1eEx4ZWNLTkh3RVlrTmNhdDB2a0o5S211M0RRWDhfWThxaVdfcTF6cVdTLXI1SF9qRHZsWkd3QWhCQUMtckJydVFWaEtodlpDaFAzWVlEQzVxVmF0YWstMWdIaWh2cmtYTTdKWHI3b3VGbjN6alEwMGRCRkZZZThsak5waTR1SXdyVQ?oc=5
2026-02-10	Google	0.0	Monolithic Power Systems Is Surging—Has Valuation Caught Up? - MarketBeat		https://news.google.com/rss/articles/CBMinAFBVV95cUxNU2I3OVVvSWFIdGFkczRDQ05vSURMbFE0VmpBUmdMTGJfcU84OTFlazFfeGlHakRiUzVjZUlOVEw0WE9KVDhoMk5sczdMbnFuLXplOFJhYk1CZUFQSUpycFlFUlZ1MzZKTDhFai1MNEoxd040Mm9oY2Z2czZQeFhxa0Qxa1lSdlhBQjg0ay05TnJVQjVseFFfemJFdlg?oc=5
2026-02-10	Google	0.0	Xiao, Monolithic Power Systems EVP, sells $26.7 million in MPWR stock - Investing.com		https://news.google.com/rss/articles/CBMiygFBVV95cUxQU1VXejFJYWVKU0tzTHRjSHUyQ29RQ3hqeFRvNE8tZzdERWZ4VXFPdDVDVjBkbHpnOUgwcWtsN05CV0FMLWZ4X3J2WDZ6YWNLMHlQSFN1TzA3Zy1ZemdlVWhrWWFZN1V5Ykx0d0F3cDk3S3pJeDNVa1VfcDJSMDM2TjJLX0gzVE1tUVZ1MG4tLUl6cHpCaHB6bnNSRjg1TnRmRXZMMkRQdU9LNEFRa2RoS08wMHUyQXNDa0xmcllweHBQZEJxVmplLWxB?oc=5
2026-02-10	Google	-0.078	Monolithic Power Systems (NASDAQ:MPWR) Trading Down 5.5% - What's Next? - MarketBeat		https://news.google.com/rss/articles/CBMitwFBVV95cUxNU1hHMU9FQ2dxQ1lEMkd2Y0RTWEhpOFVxaFl6aEZvSGkzelpIYWU2eW1FWm1IRXJGTzk2MG43TzNvSXVQSTAzX2xMSmEyMVhUZlJ3eVMtcG0xNUtoUWNRSmwyRmdVSHQwbHRLbE5GZnFoM2FYUlM2cDE0Vkk4ZExzdUFJalowdERpNTRTWkNjVTJLRENmSWVXME1NSWxqT3pnQndvcEg3WjlUaVFwWi1sUnBXOVNqUEk?oc=5
2026-02-10	Google	-0.156	$MPWR stock is down 6% today. Here's what we see in our data. - Quiver Quantitative		https://news.google.com/rss/articles/CBMiogFBVV95cUxNR0hqbmdpVTNtblR6QzBDNmRsUF8ydDlNd2I5SEs2aUVVWWtzaktGclBKUlBNVDdBVkFCWVZXcjBtTHJ1dHNoS3ZIdjFSR3dRVWhYaElzdEtrcWFFQTQ1dDdvcnRDUjhCMHV1d2N0RjVSczR2emdCS0xJYXJjT05ueW9nTVhsTWdYc1k4SUlhX2c3c0FfTG5DcVZXajZBWnVodEE?oc=5
2026-02-09	Google	0.0	Monolithic Power Systems (MPWR) stock slides Monday — after a record close, traders eye dividend hike and CFO shift - TechStock²		https://news.google.com/rss/articles/CBMiywFBVV95cUxNRDVoeTJTdVlOX0lVdmJjNXV5M0VsX3VRR054Y29fNTZ4aGhYUjZUWFNtRW5YMmZocEpZQ2hYZG5FUTduRXlsUHpkeWFwdU5pZzBTb0Fyb18zY1RIWnF1bUp1REtlaVJsVEM3MjVudzlBMlFhR19JUnNlUGp2NTV4NmhkTWhFZTdMZWZKdW5KWVhoTi1XcUNOUmRiLW1JeVhCZ215WURaaFItanBpTHZsbC1yYVlMN1c3ZF9WVW9uQUxOZGo5c1k1TVFfbw?oc=5
2026-02-08	Google	0.0	A Look At Monolithic Power Systems (MPWR) Valuation After Earnings Beat And 28% Dividend Increase - Sahm		https://news.google.com/rss/articles/CBMi3wFBVV95cUxPU1NhZEQyMjV3eVNNS2dNaGFmWDFhWjRsMUtIRXhLM3k5WHh4Qno0bUowaHg3bkYwYTBabkl0VVRNLU5iRi12SzNFNDBhM2NWYWJ2bERwVkdpZi1pRmdOcWxzbm5pNm9PTDBnM1QwR2x2c1lKdHNOaTRhN1QxRHp1ZFNyZ1BvQXBPaG9EMUlqQmkwWEt4NnZ0MTNPMnlJWW1ST0xITEtLcWhmV1BUS1B3LTBBNlRTVHNZV01CR3M3cnVnXzF4MDlRMWJwR0w3cTFFYVRfeUpLZ2liTUhWM3ZF?oc=5
2026-02-07	Google	0.0	Monolithic Power Systems (MPWR) Is Up 9.4% After Dividend Hike And Revenue Guidance Update - Yahoo Finance		https://news.google.com/rss/articles/CBMigwFBVV95cUxPY3o5V0hQOE1iUDZ2OHhrbFo3XzBUUTNiRGpEMjBmMVRYU0F3MzRUZjVFUDNMdFFPNGFmZVcyb3pzcFZmQ1EtVkQ3NXBGaG1MTTV3MmttdlZyeEZ5WldGSkhFcXpNc3kzdllqZ1JJQnJzQVZCMmVKMjYzdFJkWjFVOWFDNA?oc=5
2026-02-07	Google	0.0	Monolithic Power Systems (MPWR) Net Margin Reset Tests Premium Valuation Narrative - simplywall.st		https://news.google.com/rss/articles/CBMi4wFBVV95cUxPQVUydkJydTNWYlNnLW5ka043dVRwRS1zM2puZWkxb3NnUWkzSnpsSTZTY3VaQ1Z3T1RqVGR2bEt3ZXlkTWE2N3dhcnVLMG92QmgwbVpMdGVTUTJ3OUF4Q1VVNGhNemsxbVhPNEstZjJ4eHJWUUVMMTBQVlVtVTJkcmQxcV9fYU5zenczSzRvbU9WTkN2M1RjcjlGYk1IR05LNVVZNFVtd0xzSE5zRGRUaXJxZEoyQXFHM3M1UUNJenRkSXZUMl85TEtiRW1jbXR4MDljd1ZOTy04UUZHTXRzdEtjVdIB6AFBVV95cUxPTW1KYU1HMDFneS1zd09JOENkUEN4d0EzQTJZVjBmQ3owSFd5alFhWkJIQURiMlkxT1V2dUtnX0dBUXVqNDNITXpmQ0U5amtFckI3ZmpocTJFUnFKVEU4SjI5RHhqRHpQZjFBRUlCNVcxbjdSM2c3VkdsZXc2TWxSTTY0SV9mci1tbEdXU282Mnd1OFB1QzZBRFg5NWhhVlY3MXZqaEdGUGVvWWhOV3paOVc0eU43VHg1dlBCWkRZTVNwZnNmZHFTX2N3NERlUVJuRU5leGxmMEVPQUFxdUotUjBpUDZoQm5H?oc=5
2026-02-06	Google	0.111	MPWR Q4 Deep Dive: Data Center and Automotive Growth Drive Strong Outlook - FinancialContent		https://news.google.com/rss/articles/CBMi3AFBVV95cUxOMFhvM0FIUHdnbno0dlRFYVVzakNjckRQdnNvS3NmemtpVnlkXzR4OU5FdGd6SmdxRmR2b1RQVnZMN3dJSlh0RzRnU2Uzb003WWlNRE1oZmNwWnpTWnZRck5lNTBCTF9IR1pPR29vZG5abWF5YzdXVDJXY0tEQ1hqT0RrTmgycGlTTmhjSVpLUmRwTHE1cE92ejZ6RUlpZnJzc1hYMTdib0ZNRHhiWk9rN29qUGdUN2hjM0Z0cFNKREJDTXJhU2VqN19UZWo5VGpqX05MdkJ2cWVKVWll?oc=5
2026-02-06	Google	0.0	Monolithic Power Systems (MPWR) Stock Trades Up, Here Is Why - Finviz		https://news.google.com/rss/articles/CBMikgFBVV95cUxNUUR1RVI5S0RxWHE5OFJHNTZvblVrUW9DWGxEeGpOT0M3blBvR2UxcXBJUTFUbWF3Y3dEZndTRk5TdlRSR2RGX2NMdWZabGpudXhRdnJkRTY4UllhUlBPV21jMWhMOEtvcUpmVldYbEs2WkFheEVvS0R0Ykh1amQ5M09HNGI4MnFnX2dQazRhVmU3Zw?oc=5
2026-02-05	Google	0.217	Monolithic Power Systems Inc (NASDAQ:MPWR) Reports Strong Guidance and Dividend Hike After Mixed Q4 2025 - ChartMill		https://news.google.com/rss/articles/CBMi6AFBVV95cUxORjctT01vQXhfRnlzQnFMaWgtNzg2X3NSd3Q1LTdDcmpJODZLaERZbFNEQWhfbWN6bndiblFZU1oyYnFpZmV5S054UHY2NjlwM2hiZkpuejFJS1lFcDY2WVFsb1luTEFWeVpndHVUUjhrd3RNTk85a3ZUWlZUZWtWRkdCZnBOZE9BUU8xQUdtU0dhVVh3V2thTXFVdVUyN3pXekgzR1FTZW94MWxhcTE5Z181RDNTcFVPNE1OMFFaTjYxT2xtcVJCa05Jb19CR1MwN0xPLUVVTDJob05KWE1NeWktMWhlNnRT?oc=5
2026-02-05	Google	0.0	Monolithic (MPWR) Q4 Earnings: How Key Metrics Compare to Wall Street Estimates - Yahoo Finance		https://news.google.com/rss/articles/CBMigwFBVV95cUxNcnJSaS1NaW1nbkx6ZWlxalBWNzhTZjUyUFVGa2l1bVI5VWhPRkNxR0F4eTFFVWxMTXpSOEYtcU1JUWhfM2RTMU9kakdQY2dtTTBEd1BiVmZuZXJNc3NndldJcnFDRmdLVTJtQkg2TkduSk82MnVMU256M3d4LVFTY0xjOA?oc=5
2026-02-05	Google	0.0	Monolithic Power (MPWR) Tops Q4 Earnings and Revenue Estimates - Yahoo Finance		https://news.google.com/rss/articles/CBMigAFBVV95cUxOanRrS3JTVXJ5Ty10VGozUUZ1NHFqQWNtMG01QnRHT1NxeGRZb3lvM2xLY0J4dm1QZVFJRDdJWFduY2tFQnJJXzRjM0dCVWExNGhCUGNyY0hKTS1vQ2k3LUgxMmdfMS1rN2d6VWVpTHBoTHowaC1xSTdtRmpKU0Nibw?oc=5
2026-02-05	Google	0.0	Monolithic Power Systems (NASDAQ:MPWR) Q4: Beats On Revenue But Inventory Levels Increase - Finviz		https://news.google.com/rss/articles/CBMiuAFBVV95cUxONk1yQjFjTFNuZi04UnF4LUhwNUpXbHhuOVk1RlpNU2NoXzJPc3ppOG4zSGxKUXFQck42Q1hlSDE1Sk5qM3E1dGF2T3MtMmxlZ25YUUR4S25WbGxnN3YzU09TcU9zR29CR2Q4aVI5VVVZd1NhdTBGNG4wSGlUNWl6Q3NtVDZDOUhVWkd6SlBjQlM2UFBidkRxcjdnbi1STjY0cy1JVlluSTkxZmxSZmVnYWhUcXBCTF85?oc=5
2026-02-04	Google	0.136	New Analyst Forecast: $MPWR Given $1300 Price Target - Quiver Quantitative		https://news.google.com/rss/articles/CBMilgFBVV95cUxNRnVIandEWGl1RTNGZVNCdGZDdEVtcXJ5YWc5aVB3RHBGcDZzNzZJaXY0MWRVMXdmalA4MHNrTk5DUGdDd2E2STNGTHVaSnQwX1FTQnRzNjBsMVcwNWtsQkdHTGdwdUtsSkZPdThDOHE4bmJkWWNaZXJUb3U4V0pTWXBNckMtajNuc2hDODRKeUhmMmIxbGc?oc=5
2026-02-04	Google	0.0	Insider Sale: EVP and CFO of $MPWR Sells 220 Shares - Quiver Quantitative		https://news.google.com/rss/articles/CBMikgFBVV95cUxOeGR0WndoVGZNUVA2MFdUaG9oWjNaUnZQV1drNHNtYVc5M0NUU1pqT1lpZkIyT21LZG4wUlVpV3RfU3Y1V2ZGVDBGMHBFd1dRTVdicEFfYjczaUpSS2o4aGpkS251X0NtVWhmUzJaeGVCUXV2VmNOVkNXSWRpVlBxanZDTVNyQmFCMW5vTkkyRWlEQQ?oc=5
2026-02-04	Google	0.0	MPWR Stock Today: February 04 – AI/Auto Demand Sets Up Q4 Beat - Meyka		https://news.google.com/rss/articles/CBMikAFBVV95cUxQR2NKU0FOdnpqaDEzLTVsUWN1WkV6cElNQ3hRMjNGX3dxbUNIdFQwXzJxaGxhLUFpSkNkc1JhelQwbUlub1lzbHZCVTg5cnNVZ3VIRlo1VlBfdkVEVThKZlVTTW5HUVdoVlFmVDlIeHNBeE5IdTNfd3dNZ2lnT1ZDZTV5aW9WUzJvVWRSUW9yNTE?oc=5
2026-02-03	Google	0.148	Monolithic Power Systems (NASDAQ:MPWR) Hits New 1-Year High - Should You Buy? - MarketBeat		https://news.google.com/rss/articles/CBMiwwFBVV95cUxQdEFKdVN4YmhQZXNPM1drUUZzbFJWVXRSMEszODNTcmRfS0FpTWg1WHVzWVZtYWFZcUl0VlJMU1dDcVJ1eVYwbEJGcnlkeEVIazJJWlRSMUFzbHpXbk1iaFRoT21PZzk0aTNZZ3FIdlFCcGJUOGNETVZMakkxdzBpX180VGd4ZVhBVWdxXzBDY1dmbk84SEM1S0NqalZLaHRrZWhFQjFOX1lfeU9yellxY3R0WEl3OUdqcEx3V3FSV3hkLTQ?oc=5
2026-02-03	Google	0.0	Monolithic (MPWR) Q4 Earnings on the Horizon: Analysts' Insights on Key Performance Measures - Yahoo Finance		https://news.google.com/rss/articles/CBMiiAFBVV95cUxPM0dSM1lSeWwyRXpPbkwydUlWRFhucWlxeXV2S19kSWRGTEJoV1JzWmNlTU9JLVNfSWFvZlBoWW91cDNVUWZCdm93SmtnaWVjaThMV25NbXdPT0FUQ3Zfdkt3ZmJ3WlZQQTBEanZGWW45VVA2c3NaaDFoNUJfVmFja2t4alpfN1Bz?oc=5
2026-02-03	Google	0.0	Monolithic Power Systems (MPWR) Reports Q4: Everything You Need To Know Ahead Of Earnings - Yahoo Finance		https://news.google.com/rss/articles/CBMiiwFBVV95cUxOVjN0VGlabV9RSDIzSXFXRTZjendINTU2V0hSdXRocGJDM0dIdFVQZE0zbGkwU005QUt4OUgxb0doa3l1RE1WbG5INmZ5SmtyZHpvTW9rYmVUVzBKRndjaktjLUpQZUxhSmotVmRQT1ZaUkktczYtOTZUUXdjWDA3QkQxTll2TjFXWmZr?oc=5
2026-02-03	Google	-0.3	Is It Too Late To Consider Monolithic Power Systems (MPWR) After Rapid Share Price Surge? - Sahm		https://news.google.com/rss/articles/CBMi1AFBVV95cUxNSnF3R2tsR1dSdE0wWnhwQ2JPZWc5cEI1R1c2ejBpRjk0cS1qYWlERm44ZFBHZS11M2JfdnR0Y0Q3U2tSaFZvMHhyejNQbXBIRVRJeTU5eVpBQ3BWdzJVUGE3bGhYTzI2Xzk5dlhPMVFZamFZYm5SZHBVNWJjeVpJMHJaNEVwU1dVeUNJU3g2bXM2a1A5djNiaUJnaUlNdVBDUTIzcjFDOGZvQnlxQk1COVRubUxRUmZyVDZqbXJYWWw1bXdscFRVSWQyU3U2VWV3XzVCXw?oc=5
2026-02-02	Google	0.433	Oppenheimer Cites Strong Automotive and AI Demand Driving Monolithic Power Systems, Inc. (MPWR) Upside - Yahoo Finance		https://news.google.com/rss/articles/CBMijAFBVV95cUxQM1M2aWYxVGpHNGppdS1PVklKTC1fVWc1T2lqNVNZZ3h3dVI2bWJscHZYOUtoZlI2T3c0QjktdTRnZERlbE9lOXRDUjNWZWhmWWZXOTZkUDdyWVB2dmIwZnhIQ2QwLUhVUllMQVVKSV9zMnRfX0lrNkcxWU02VThxeGlzNmx1T1pHdG1Ycg?oc=5
2026-02-02	Google	0.0	Monolithic Power Systems, Inc. (MPWR): A Bull Case Theory - Finviz		https://news.google.com/rss/articles/CBMiiwFBVV95cUxQUm53azVRS2xJVWJwOHo1aFlnVC1WMHhUMkE0SFlaN19CVVRNLVUzejFGcGc5Nno4WU9DcHp1MmZ0ckRvUGY4VlFoNk9FdTBMUzNja0l5VnJnTTJDalFGc0dVc1QyRjdETlpyWkY0ZkFubGpZVWhSNFJfaUdILTRoWFpFMHE4RTJzNlJv?oc=5
2026-02-02	Google	-0.05	Monolithic Power Systems (MPWR) stock sinks 5% into earnings week — what investors watch next - TechStock²		https://news.google.com/rss/articles/CBMirgFBVV95cUxPTWl2WjJqTmhWS09IbVMwZ29ybjZoUTlFaXJwXzhBTHNQVU8waVB2MFd4WU5lVGE2WWxjdDB6LWtMRm8zNGtra0xPR0p1cG0wOXNzYy11TXNmOFR2TWsxOEhCX3N3Q2hfdjF2akZTTnd6bC1tQ2EtQWNXU0Fha29LclIwM0RjS3dPcS1WZS1WZGNhZ2QwenhyaW5famlveDREbW1UWEtVd0FGZ2ZISlE?oc=5
2026-01-31	Google	0.0	How Monolithic Power Systems Stock Gained 40% - Trefis		https://news.google.com/rss/articles/CBMiqgFBVV95cUxOYVhfWE1pRkdoVlFiMllpMlgyejk4bE1mOGlBUWxCaGdERFctTWtLX3ROTEU2SXUzOTZsQ3AzdlFhc2w0QTF6bGM0S0RYbXI1UXRtcHU1OVZyU1NQYlB6NDE2TWdJR0VRUWkyaXJDeTd3bTNUSE9hU1JwWnByektNNGx0aVZIVGpVLU1ZeGZISXp5S0J4Z0NmZGd6bUoySG81aGl3SFdDS0c5Zw?oc=5
2026-01-30	Google	0.067	Is It Too Late To Consider Monolithic Power Systems (MPWR) After Strong Multi‑Year Rally? - Yahoo Finance		https://news.google.com/rss/articles/CBMiiwFBVV95cUxOOGUtaTUzcUVwQ2JzQkswM1EtQ3Z4Slk5aE16T0hXaHpLcld4YWR6aFgyQ3ppSy1mU2tRaGM1ZG1KZjVlZkJWdTVabC1oZ2RoR3NYTGU3U2c4dUd3eE52WmpKOFR3YXRyZjlxTC14ZWtUczlzbXVvaUJkbFF4eW9Ga0w4VUlOWFdxYzlj?oc=5
2026-01-30	Google	0.0	Assessing Monolithic Power Systems (MPWR) Valuation After Semiconductor Rally And Upbeat 2026 Data Growth Outlook - Yahoo Finance		https://news.google.com/rss/articles/CBMijgFBVV95cUxPMzZNRUZlT0E0UVZvSTVzSThPWjdQYmhMY2VoNF9OellTTWZlR2w0NTRwSXhkLXA0dC1handzeVlNbDhDb2xyNEo1ME9FSTczVzBVM3pLSktaSnJ5NHlQTmo5eDZ2WGNyUm0tZmE1SENDWUR4Q1YxcUhsUG0zRlFEandBM09lWFdLWG1NZE5R?oc=5
2026-01-30	Google	0.0	Is Monolithic Power Systems (MPWR) Stock Outpacing Its Computer and Technology Peers This Year? - Yahoo Finance		https://news.google.com/rss/articles/CBMiiAFBVV95cUxNcHh3cDAxWVhJT2VEakJ6SDJiTjlKVFhjbERKSkhpOE1oYnpNY3I0Q2E2TjRtZHU2X0ZGdmlKWDcwTUdrZTlQNUxtaHhlTUNhclZVSDFkMHFXMzFxNW5YVGpMNFFSNkNQdzJPV2hpbnZWbFJFSzJvV3JVa3NzTkhsQ2liMGpuTDcw?oc=5
2026-01-30	Google	-0.108	Monolithic Power Systems, Inc. (NASDAQ:MPWR) Stock Rockets 28% As Investors Are Less Pessimistic Than Expected - simplywall.st		https://news.google.com/rss/articles/CBMi4gFBVV95cUxOWWFVRjlfUklxNVBKQ3MyenhabF9LZC1WUmc0UnhsZnRLMDdpVWlMZkFnRGFVanlqcFprTXFPOFpMSTRUdDNaZEs0dGV4cmRQYmVCM2RFT0ZsZEV5WEZLd04tQ1IzcHJVNWlvSVdLT3NnTXI1bTNfUmhTNmRnWGRSZ1FXQnRVMkhYWnhWRS02Wm5YTFA3T2M5RmwzakJaYmhPaHgtQU9SUGQ4S3VaSWxBdmtvT2dxblA4N0U2RG1ad1Z3cHE4LWlUSnc3cWxTdEo0TUVvUnN0U2ZTQVhheFJPdVRB?oc=5
