Date	Source	Sentiment	Headline	Summary	URL
2026-01-28	Google	0.0	Nvidia AI Partner Breaks Out, Boosted By Big Demand - Investor's Business Daily		https://news.google.com/rss/articles/CBMi0gFBVV95cUxPV3NjV05zemJGbHM0dHFFOUZuVWlOejVOYzlaMG1id0dkOWItRUItWWUtekUtOUo3ZWN1WTdpS29TT05Oc2ZpTUlqYVVnNTZGWEpUTWo0SWlrMUppdUJNMWI4VlhKa0lmeTlaUWpoUUxUOGhfTUJSay1QUG5RajFTSjQyejVsNGdwTDN6RnpFWW5fYmstR3FaM2VqWDRpdGlSeHp0Y2ZFZXkzQklnQ25aODJoXzhfTUNTS20tUzgwTENqZFE5OTlwU3BENk5RWVVINnc?oc=5
2026-01-28	Google	0.0	Why Monolithic Power Systems (MPWR) Stock Is Up Today - The Globe and Mail		https://news.google.com/rss/articles/CBMi0wFBVV95cUxPTWtDb09rY2JDWDNnM2loRFFxRUwwLTVnSmlLRFdvTjJkdUFkTHA1MmZtN2RHUi1iN1F1X0tfYUVQeTV6aHJSMXNJRnVLYmhPekMtT1lQYVltWmRzdEZHODJfZHV3dnJTdm02WUYxR1lNY3RVdUZ6cHhQQzNzVTBiWURNbWF2ZG81elNXeVhKVkNZMkVvcGp4N0FIZEpaWnlCNm03RzM5UWZVeEIxZktoUGdWLVdsdHVIWW94bmZuTnZrdFhwSEZETVhvX0M3OHFXNzVJ?oc=5
2026-01-28	Google	0.0	Why Monolithic Power Systems (MPWR) Stock Is Up Today - Yahoo Finance		https://news.google.com/rss/articles/CBMihgFBVV95cUxNb3RsUFBTb1l0b29wQTEzX2MzU3dLRVlKNm1nQlVCSWpsclpZb2p6Ul9xaUpoWFpqeE84UU1NN3RVbVN0TW8xM1dTbzcydVd2SnJVbEM5VUlWd29BUkdTbUw5eWxGTVFIUHdlc09OTHdCOWd0U3NNZTNYS0lOSUdfQV83MWpJUQ?oc=5
2026-01-23	Google	0.0	Monolithic Power Systems: Premium Valuation Is Well-Deserved (NASDAQ:MPWR) - Seeking Alpha		https://news.google.com/rss/articles/CBMiogFBVV95cUxNWGFfNThSWDRzUlh5WWx2ck9FQVBQUjZmaDJBeVNNZGVnOWNKS1BiU3JVTkhabFdLdXEybk0wZS1hWXJxM1VNYWhlTGZDVjVIVHN1TFFzNW5yUFBmLXRvazQ4VWZveW9PeFFTRTBDMVdfbEZQbXJCQ0pPcWlHTUZCU3hrRmdTcElhN0cxMDZVY3M2enQyLWE1NGVULU14QklrekE?oc=5
2026-01-20	Google	0.0	Monolithic Power Systems Is A Silent Killer (Rating Downgrade) (NASDAQ:MPWR) - Seeking Alpha		https://news.google.com/rss/articles/CBMiowFBVV95cUxQdFdlMVZaMWJxenBNRmNFQ0kwQXRVcDllamI4TUFaeUUwZ0R6RFVfREprekFMOHYtcy1zc1AxM09aOXNtNFpCN2dOVHd1d3hhWnlaRWRuaU1TZTlzQ1ljZklOa2tzY0JtbU9YcjBTcmJsS2NpM1RXRXdNeGdEa3RsZWRNYm5LMjUyTEdqZDlIM0I0MlE3ZUdFeGZpSTc0ZkFjbE5J?oc=5
2026-01-19	Google	0.0	Why Monolithic Power Systems (MPWR) stock is in focus ahead of Tuesday’s reopen - TechStock²		https://news.google.com/rss/articles/CBMingFBVV95cUxNTHBLMUE5VGh1SGlVUnV0NWRkTEQwWGViWE9MVWVuQi03RGhGSV9WdXVkbHRSM0owMzJVeHFGSENVZmRtdk8wdkJpbGM1M3djM3NST2NMNlo5YThIUUk1QkhVSC1YS0RtLXZHQmdMVTdVRkFucUtUeEtCTFFRNklvN3BfbVg4ZU5QWTZsZ2tvaGhHZDZhbXBhaUhHQnNzdw?oc=5
2026-01-18	Google	-0.1	Monolithic Power Systems (MPWR) Emerges as High-Conviction AI Data Center Power Play - Yahoo Finance		https://news.google.com/rss/articles/CBMiiwFBVV95cUxNUWhnYlpRbC03OElYeUQwZHEzVV94MjdKMkotcXFGY0hfbWttal9GR1ZkVUdNZEpTMzVBZXRFR0k0OHlOVXJfUTR2bzFfTGo3X3hHSWY3dHZ5RmlCMGlHc19QemNzUTgxMk1JNzdKVmkwN1JhYXZZMFNZNUE5YnlyQnhHWHNvU3FubU1N?oc=5
2026-01-15	Google	0.25	Why Is Monolithic Power Systems (MPWR) Stock Rocketing Higher Today - Yahoo Finance		https://news.google.com/rss/articles/CBMihgFBVV95cUxOd0tiaXlGVGNGQnpQalIya2w0U19ibzY4LVVFX29mY3lLT0ZmZ2JSLVoxS1QzeDV0TW40clBvOGJxdTNXVjZOT0tjMHpYWWxlcHRJMk5lMGFYTm5wQTliNndTSUtadDRQdHM5LUpiNFhucnRvbGh3ZkF6MW9Jczc4QmFFNEczdw?oc=5
2026-01-15	Google	0.217	A Look At Monolithic Power Systems (MPWR) Valuation After Its Strong Recent Share Price Performance - Yahoo Finance		https://news.google.com/rss/articles/CBMihwFBVV95cUxNd01GUnltek9OOEJFaGg1YUNPbnF1RThPb1Q0N09GeHhqVzM4blVvTS1meWV0SFdxU1ZVSXdHaTZTQ1IzUERtaS1Hd1c1M1NHWFhKQWtpaTZxOUxHdVljaGh0ekozcllRamxYbk5Sc3FsRk1rODg1WFFLZ3pMN0lQY3JkSDRmZ1E?oc=5
2026-01-15	Google	0.0	Monolithic Power (MPWR) Faces a Key Test: How Durable Is Its AI Power-Management Edge? - Yahoo Finance		https://news.google.com/rss/articles/CBMigwFBVV95cUxQODZJTzFRbWx4ZGNlTXlob1NVNGdNSWlVT3NvdlpLaWR5S1Y5WlE2aDJVS3prRVpYZlE5MGluWmFxcXplcV9SYnBLNktKbjhrOHB6dFhxSGl0NkFYRnc2bGxHMTIzbG5QaXU1NXF4REd0UV9PVy1PTkNBTEE4Umgtem5rUQ?oc=5
2026-01-07	Google	0.0	Here's Why We Think Monolithic Power Systems (NASDAQ:MPWR) Might Deserve Your Attention Today - simplywall.st		https://news.google.com/rss/articles/CBMi4wFBVV95cUxPWms1SXFCOHNIOExzS250LV8xdG9WdGF0X3E0azBNMmYxRWpWbWRUTFJWdEVPcUo2RnF4RWhfOGVtUGR1UVZjNmRZMWRnREI2QVpNTW5GczRLZWlweVVUaFhNYXZMam5NVEdKOVU3WVdkZC14Ym1sX2dQdnM5WXczVDVURHhLN3BfZGk1a0pSTEJQS1NYQ3hILWo3NlFZMzMzQmZpR0NYWjY5LS1Nc2tIaTF0Um4teGx2aE43VmQ1dzlSSTBVRllKSi1tYkxhLVl0YlVZc1I5VFVMVmJoWjQyTTFlUdIB6AFBVV95cUxNbzdnandKd0h1dWRkTDliTUxJMkw1VzU4S0g0OGhURFVseXJZRE1yRWZNa2Y0ZFB3NDlZVVRsNElSV3gyWnVIN2xFejdpR0p1U3E5SWhaMllnVVRSZElUM204bGU5amcxVEFPNzlsbmVJbDBRR2w4eTdZOUFXemFwaHBhSWJwLWxDaEJIVFBNcmNkcUVHSnpTN0FTdFE1Q2Y1MmZBMFREbjltV3FQNG5ub09McEV1VlBtNWpLb1N3OVhHc3JqWm44c0VuN3BXc0RTVHJJbzlCQ1V6aEs0RXYtX2Q0YThqUGs2?oc=5
2026-01-06	Google	0.533	Why MPWR Stock Could Be A Great Buy In 2026 - Forbes		https://news.google.com/rss/articles/CBMipAFBVV95cUxNYjVfdjNLenF6Yk5uZFR6MFZsVHZlT0pjZEZtcEpiejRfOHNlaTh3X0poa0J2Uk5CbWhsNjdHbmNuaFo5NUVkWG1mV083M2JoTjNrTXF0cW9ORzF5TU9BOGh0em5kdUlzWmoySTJuRzNrdlZTeGFVdlVvRjhVZ0dMVjJMMEZ6MVl0UnZJWDN2U1hKQkFZZko1YkdnMXBOSVJ4LXhEWQ?oc=5
2026-01-03	Google	0.0	Buying MPWR at a Discount? You Are Getting Paid to Do It - Trefis		https://news.google.com/rss/articles/CBMiuAFBVV95cUxPZlhMal92VE1mMnBFMk9qbUFySm85azlzMmhRR0t6S2p5bkRfSmx2RkphWV9EWmM5QjVDODdJUkd4M3RiLVRFRFAzYlFHN0pQeFFwbFNOQmhUeFd4SlAtUmxNUEllanpVWmItcXFxOTZVRVRzRnlLeFlGQkhxcXFrSFFXRnJJMzM5RS1mWHk0LVRNN1pBUC10ZHNIcFUzeWlQRVVxUDFkMXVrcEl2RThtUk9xOEk5dmY2?oc=5
2026-01-02	Google	0.0	Monolithic Power Systems' (NASDAQ:MPWR) three-year total shareholder returns outpace the underlying earnings growth - Yahoo Finance		https://news.google.com/rss/articles/CBMiigFBVV95cUxOSk9qVkRpMFJLX1lzMHBqTGgtZnRPdVhodnFJcVNsSWQ2bU51MTF0aVlpSTY0R3JVTFZoQjJKWUo3QVdSWWQ3NVJZcWdKb2ZXaU5hWXd2aUZreFBjbVZueU1wVEZiQ09GUGl5RklpY1Q3SS1TdUFlLUNTZDFaQ2Y0b0ZabW9yelJHVkE?oc=5
2025-12-31	Google	-0.125	Is Monolithic Power Systems (MPWR) Outperforming Other Computer and Technology Stocks This Year? - Yahoo Finance		https://news.google.com/rss/articles/CBMikwFBVV95cUxOZHVicGhxOUNJN0pESWlVR3FYdndBT3JacnBfY0xNMHlQWmJ2dlYtZ3hlTTJhVm1TVmFfNXZpZTlVanB3NEx6THFhWG1KMmtXWWNpM1hNdFFRbm9JSHdacGQtaHM1OHI1MFRidWxKWVZuTDNCZEVLOXBEdDF0SXJhR2ppX1NpLWNvckxPVGdSTlg3T00?oc=5
2025-12-29	Google	0.3	Why Monolithic Power Systems, Inc. (NASDAQ:MPWR) Could Be Worth Watching - Yahoo Finance		https://news.google.com/rss/articles/CBMihAFBVV95cUxNU3E4NDRWU2gzZFI5YWt6MFFYdUYzd0JKYVRPcXV3anMwQm00M1E3VE9lRDFVVTZLSEdlTjhobXhqVlUzQ0tqeFZ4eXBRM3dVcjJoS3Zmc21zRWpaR0g0SHRtRGlFMkdlNnNPX1UtczNrS0JWTDVRZk9tYWNIUDcyOXh0YUY?oc=5
2025-12-25	Google	0.267	Is Monolithic Power Systems, Inc.'s (NASDAQ:MPWR) Recent Performance Tethered To Its Attractive Financial Prospects? - Yahoo Finance		https://news.google.com/rss/articles/CBMiiAFBVV95cUxOR3htdmIzUGcwNzVzdkZDd3I5a25QNENaUHNVbVJneVFlOHNUbG1ZYWY2LXVxVGdMR2dvRXY2TEMxUTY0S25mQWtnSzFaU05wLTExdHZ4djhnbFRRbGMyUmM3emJHeFNnMnNBZ0NLWlVDaVByVHI1R0tUTGZEdjV3REJ5YUV6VTRQ?oc=5
2025-12-23	Google	0.5	Monolithic Power Systems (MPWR): 3 Reasons We Love This Stock - Yahoo Finance		https://news.google.com/rss/articles/CBMigwFBVV95cUxNR3VmUWxheVV6S0R1cFdkd0lpeF9abi1XT21GQ0JfOHZHT2R3QmZBVnhRUHlqeFRvblM0NkM0NjZPSDZFSWVtQkxaSU52T0ozU0cwRU03TU56RVlpLWxGR1JPNUphZFFsb0VPM2V2TFhaM1NtV0lmeXhfakVVTGliSU5CYw?oc=5
2025-12-21	Google	0.25	Monolithic Power Systems (NASDAQ:MPWR) Has More To Do To Multiply In Value Going Forward - Yahoo Finance		https://news.google.com/rss/articles/CBMiigFBVV95cUxNY0dzbkItc21XNG5EdlpxWGV6eDNsd05YQ2h3eGhjVk9UdU9HMXNLZWp3d09ObzlUU0pEWHFmSDNSa1VtNjJNSDIyTnV0WjI3cG92UVhXZG11WVB2VFdCbWNEMDRNVFJWWDE5M25nam1nY3NTZG9XOFJjUFVZdUJ0QXpwZjFNbklYZmc?oc=5
2025-12-18	Google	0.0	This Strategy Pays You 8.7% While Lining Up MPWR at Bargain Prices - Trefis		https://news.google.com/rss/articles/CBMixgFBVV95cUxNdFhSaFZYVi1wYU5yQ1RqYS1zSmF6Q20zNWZReS03MDhhMnVpNkloaW1nQ29jX2pacTVGWXExYkN0WkQzZFMyYXVEd1NfWURIVW80VFB4cS1wYWRmbnQ3cnlOdXdURGI5Y0xUa3V3RmJMVF9CdW9STGN4WFBJWkNLbVM1Tmc3TDlheUFmNHNOS3JVanI3MWNPTlR4Zl9Za3VHNlpDWEtRWjJrU0d4eFpjUHJ4RXUxMHBDR1F5czM0clM1Q29lRlE?oc=5
2025-12-15	Google	0.433	Strong Results Boosted Monolithic Power Systems (MPWR) in Q3 - Yahoo Finance		https://news.google.com/rss/articles/CBMijgFBVV95cUxPd194ZWUtdlJydW8tc2s0R3QwbXFXbExlbm1EZVh0TDM0eFJhSDM4a2l1eGdwbFRyTUxFNThibmlZemRPYlEtQ3JvRk1ZRHZsSW9EVTU0Zy0yX2Z0UV9xaHpwNUV4Q0pWUGhENTh6ZkVFVEl5dncwd3FPMzNnNi02aWdUYy1PZVRRRXZQQUhn?oc=5
2025-11-28	Google	0.2	Monolithic Power Systems (NASDAQ:MPWR) stock performs better than its underlying earnings growth over last five years - Yahoo Finance		https://news.google.com/rss/articles/CBMiigFBVV95cUxQMl9PZHFKX012YXpGZkF1OWNlVE9ySjZ2OUFlRnlnYzJRX0g0aVQ5allaVUpIVnF0UzJtT1FMMUJubk1jLTh6dVpVa1VVQ1lfOXQ0QVlXWlBaeEpsOWE4aFUxeFBrMW5TZWhFRkFjV3BncDJhTVhWeXRUb01NTlRzcjBlcWo1dXZXV2c?oc=5
2025-11-24	Google	-0.2	Declining Stock and Solid Fundamentals: Is The Market Wrong About Monolithic Power Systems, Inc. (NASDAQ:MPWR)? - Yahoo Finance		https://news.google.com/rss/articles/CBMikAFBVV95cUxOVlhLSXNKUVdwZDFLdUQ1MVdzTHcyWFhDTndlOUtsb1FzSk9mN1JKUlpKY2RVU0hpb0NKUDFFYlZPQ2ExMTNSM0gxUTB4V0pPeUFXLVhSRmd5OHJnemZDc0RDLVZqOXNRbmdpaGxoRDV6aEYtZ1ZKSkFiTUktWnRjLVdCalZwVlFPbXpUNEVSX2Y?oc=5
2025-11-16	Google	0.0	At US$920, Is It Time To Put Monolithic Power Systems, Inc. (NASDAQ:MPWR) On Your Watch List? - Yahoo Finance		https://news.google.com/rss/articles/CBMifEFVX3lxTE9lQjNZQVhOWjNSSE0yMWhDQ0p6djFpbHF0aTZBaVdKcjJXX2M4M1habGF4Uno5TS1Wc2Jkd2JqRUtzMlpVVjhDYkxEakUzblFhZk5lb3lRTVJjX3pPb2FPOFd6cHNLM1pBYW40NmEySzBQQTFxamxtMFlYWmI?oc=5
2025-11-12	Google	0.7	Monolithic Power Systems' (NASDAQ:MPWR) Earnings Aren't As Good As They Appear - Yahoo Finance		https://news.google.com/rss/articles/CBMiigFBVV95cUxNMzZKVmZfQlVfdGtYWXFYcTNvWVJrQmQxQnF1dGxNWEhqTlRrVjQwZGpONnJiNkVKTkhQbnJWMExCSHRKVlk5THF5cG4tNmNLVEx1SktwdEZtME5ObHY3UHVfR0h5d19RUVdrZDRaVk8wMFdBbmNXeWRxNHVEd3BfYkFyUlNBMHZfeHc?oc=5
2025-11-10	Google	0.0	Does Monolithic Power Systems (NASDAQ:MPWR) Deserve A Spot On Your Watchlist? - Yahoo Finance		https://news.google.com/rss/articles/CBMiigFBVV95cUxQcTU2cWFxMDNHQm5GckRJMlRTdkJSQXJZWUdVYkkyWGdfUjA4LXBkck11d29YQnNOSEl2ZDlOalUyYmNJdUQzanNWRXZlT2IwTzNhQWlfUmZaSnRBMUI2LVNqM0hoWm5YUlo3U0VjVXFjRC1SZ3BneHJtYzlZeER3R3FnRzBESTlObUE?oc=5
2025-10-31	Google	0.0	MPWR Q3 Deep Dive: Broad-Based Growth, Margin Stability, and Solution Expansion - Yahoo Finance		https://news.google.com/rss/articles/CBMieEFVX3lxTE5rMlpmZWpjbFpxamM2UlczT2FCMTV5blU0RmptTDZDQTFrTVF0UTl5ZGo1Ukg5aWFkeTZWUHNwQ0QwT3dRb2I0alI4THdicWJWRFlpZW5JSllPdUhNWXA3THQyc0hRZ1JJTk9pYmc5ZUJ0TnZqRW5xSw?oc=5
2025-10-31	Google	0.0	Why Monolithic Power Systems (MPWR) Stock Is Falling Today - TradingView		https://news.google.com/rss/articles/CBMiuAFBVV95cUxOYllrVGV1ZUgzU2oyNlo0MWpPVEpzMEhEbW1STWpoaWM4TGdELWJGbkxTdldPRW0zTFBib1VycF9MQU1Pcjc3R2poVVB6dmU2QjZrV3RUVW40MnFYejBsVms5VUhfbWpZSDFLcEU4SFhiNkRueWFsLXNfdHY3eDhDMFljbW1lTzR5T2FuZUlPOGdnVjdqRDlfYmliNlgzZzlaSVlOeWo3bmtNMExYRllEX0tuU1FpcUw4?oc=5
2025-10-31	Google	-0.156	$MPWR stock is down 13% today. Here's what we see in our data. - Quiver Quantitative		https://news.google.com/rss/articles/CBMiowFBVV95cUxQbUZ5SS1lMkNrTEhVOFJ1aERvUS1uSUtvVG9pa2tkc19VaTdLczh3YXlQMlZ3Q19vMV9TUjNNMmJ6bVhpNC1FWGdDOHdDZzRRZnhKTU9BRWRKU0lyZVhCVS1ZeHpPUkgya1cxZEJUaG5jdEdyM1ZsdnhIdTgyZzZTV2ZEYS1VV0YwUzlMRDhQSjZtOTQtMnhadnBCbDk5UWNHUHFJ?oc=5
2025-10-30	Google	0.5	Monolithic Power (MPWR) Q3 Earnings and Revenues Top Estimates - Yahoo Finance		https://news.google.com/rss/articles/CBMihgFBVV95cUxQZURiNGxVbVRUaXgwUF9OQkkzSVgyUi02eDNNbm5iMW9WbEhOWHdDc1VMYlJKXzkwSWZVUzRaM2xORUZwei0tU0pEcV9lOXg3OXdCQ2NvNVAtc1haM3dud1RaM3ZuTTVDY29CbktnUnJveTNWNXc0bGdOX09KaERJNDZkbHBFZw?oc=5
2025-10-30	Google	0.0	Monolithic (MPWR) Q3 Earnings: Taking a Look at Key Metrics Versus Estimates - Yahoo Finance		https://news.google.com/rss/articles/CBMihwFBVV95cUxOaTU1UmpNMzFZY2dFVHFjMF8zUjl2aFlSRllWZWNENlpKNENDdTBJSHNMQjNlVVdOM2d5Q2xQS29qMFZUOWd0NEFmbmtGZnhxMkVqQ0pTbENiVmNsa1FvS0pWX25VR2RFMEg0MFdzcHBqZ2doaWE2eHloNVhNZEZnLWF5MF8yS2s?oc=5
2025-10-30	Google	0.0	Monolithic Power Systems (MPWR) Dips 3% After Earnings After Massive Run - 24/7 Wall St.		https://news.google.com/rss/articles/CBMiswFBVV95cUxOQUNpT2lQMUU5NHNtT2hsR3kzVkcwcEd3Q1VFTkZRbXctbE83cWprZXhfZ2ptalg2RkpvbWhTanJfQ0JhbXI0RmVxcjVHUjAtc2tMVmR6bDVSOThPUHhIMnhZQThoZGJHdmlaMDBkMUMzdTlod0l5MG9DNkZNY2xPVEJWTDNOcnNucDBRUDA2R2FVUEdSUTd2elVaTXlkNVE4ZnBTSVpDTkIyc21KZnlZY1Y5RQ?oc=5
2025-10-30	Google	0.0	Monolithic Power Systems Inc (MPWR) Q3 2025 Earnings Call Highlights: Record Revenue and ... - Yahoo Finance		https://news.google.com/rss/articles/CBMihgFBVV95cUxOa2hwNzFMU0p2QWhBTE1XM0R0VHZ3WWZOUEhZQ3FIRy12S09VRzJrdDBYbnh6MF9HNTN1OTJlZG1wTWpTbWhnckU3NFc4Z2IySlJSY09jYmNvazRVRG1nRGRKeDhXY1Z0RXRzelRLRXhCWnJRQ1A3WUFoN0xZemRtS2RvdW9TUQ?oc=5
2025-10-28	Google	0.0	Monolithic Power Systems' (NASDAQ:MPWR) 29% CAGR outpaced the company's earnings growth over the same five-year period - Yahoo Finance		https://news.google.com/rss/articles/CBMiigFBVV95cUxQTDNzNWduc0lRT0VnSzdDQTlWaFpPQWFzQldfdjlxQ0NKaHJ0ay1tSDNMQ1hJQXo5VmJhN2tCNHdiNXpfbHhuTmFBUzVyNjJkNVhpOUtJdHpxVEFraTRGSWR4TXg0Y24xdFpkeW1UX0FPV3NFWmM4NFM1THVJMWswaE1tajVpRHl2YXc?oc=5
2025-10-23	Google	-0.067	Monolithic Power (MPWR) Earnings Expected to Grow: Should You Buy? - Yahoo Finance		https://news.google.com/rss/articles/CBMijgFBVV95cUxOdHJWLXJJdHFweFN1OXVKeFVVSFZZMndTVzVBelZWUFl3MGRsTlVuYlVpbkNMQV9BTWh3U1o1S1RkX1BlcWVnR2g5X3AtSlFMTFdBSm5TU2xOSTVGTFFEelkwcGx3VEhqU1FIaXR5TThTRXpOVWlzMENhclpIeHMxSDRIblFYY1RvY0p6T1Bn?oc=5
2025-10-21	Google	0.0	mPWR Accelerates Latin American Expansion with Strategic Acquisition of Mexican Fintech Kredeo - Yahoo Finance		https://news.google.com/rss/articles/CBMikAFBVV95cUxPUVpWVEdFYm1NcXozVC1DZG5oY0ltYm5kZGlzb2RkM1hCbm1ZRlUyT2p0cXFSbWp6SWVjb3ZxU3RBMFQ0c0dnVzRCRF9panFlb2dCYnd3X3A0MkhBb2hoUjVteVdKcmJENWI2aTVCTFJpRnlWanNidnp3LXRhOXNabzdES0gzZkM5OVRxcVdmbUs?oc=5
2025-10-17	Google	0.0	Why Monolithic Power Systems (MPWR) Shares Are Trading Lower Today - Yahoo Finance		https://news.google.com/rss/articles/CBMihgFBVV95cUxNbjJpQWVhWVhVblotck5ybVptZnJwa1MyZ0lkVzNoNE91YlZmMGZkUjkwUEp0WklqRGM4WXZjdEFhOUxfT3p6RXd3S1Zoc0Uyb0JsWHZmNUdQN0o1QUg2QlpSRXRZTGpKbWFRVzBzYVd1NmFfUW1feGYxZmR4MFJPS0lVeFNUQQ?oc=5
2025-10-13	Google	0.0	Monolithic Power Systems (MPWR) Stock Trades Up, Here Is Why - Yahoo Finance		https://news.google.com/rss/articles/CBMiiAFBVV95cUxNSHJVS19hQ1RuUFJEVVlReFRiNGxTQ0ZxbmV2QlVtVXNESVpFQnB3TW1pNlpGczRmOGd2MHk0LWNyV1QwXzh3VDROZ29uNldTelpvaXZnVzlQTlF5QU5Ld091UmlEWTNtMnl5eFE0YXJsZHN3Z3V5YU91SDlGazkxaEpiT0VTcW81?oc=5
2025-10-09	Google	0.0	KeyBanc Capital Markets Lifts Monolithic Power Systems, Inc. (MPWR) Price Target Buoyed By Growing Business - Yahoo Finance		https://news.google.com/rss/articles/CBMijwFBVV95cUxPb2NiRUYyUjdZVWhWZXRPaWUyOXlWZ1YyNnVtcHNCWnFTa0VlVVB0NnJYRFBuRGhhT0NUOHpwUUNCbzExSjlrS3RaYU02YklhYU0yWlV6WGpQSnJGSXF1bkliRHBKdWhodC1GRTJ4aTBwTXpOX0w3ODVNYXhhbTluWWJHWXdCb1JKT0ZlaTJtRQ?oc=5
2025-10-08	Google	0.25	Monolithic Power Systems (MPWR): Assessing Valuation as AI Hype and Legal Risks Push Shares to Fresh Highs - Yahoo Finance		https://news.google.com/rss/articles/CBMijgFBVV95cUxNbi1GOHE3SWJCVGhVQy1YREVSRmtsbWdZVkR4Q0pXTUlxNlF4bWhJR2dpUHE4TTR2cHZOZTdlNEVrRDNqOUs2cEVncmZxcG9lVEV2SjFxVTFROVhaeWlDaFRSY3NRRmxNR0Jtb0syZVFlRGtZUUdyYndvdXRvUWNXd0xMOWRXbndxek5rVnlR?oc=5
2025-10-07	Google	0.393	ON or MPWR: Which Is the Better Value Stock Right Now? - Yahoo Finance		https://news.google.com/rss/articles/CBMifkFVX3lxTE5ESWRKaGdxNzlBUEJDaWh4Tl9nN2c2UjRWWC1YR0Z6d1dWYjAxdWROSWpUTF9fSm9JZXdJNl94dmtTQkY4eWVZRW8yTkMxZ3EwU1V1d1BqSkRtdjhZdWhDUlhZcFFqR3FmZnlYa09lMG1ZSFNEaEd5UFAyRVFQQQ?oc=5
2025-09-20	Google	0.217	Is Monolithic Power Systems, Inc.'s (NASDAQ:MPWR) Recent Stock Performance Tethered To Its Strong Fundamentals? - Yahoo Finance		https://news.google.com/rss/articles/CBMiiAFBVV95cUxPRGxkRHdzLTYxcEhZUnJlRUhQY3NaXzY2Mlgyc00zd21MNW03alRQdjVfMkI4LXRtNnBsMmk1LWpuUTkxVzRYUDh0a0piOFVOTXBZSkZwWFc0UFZZOWVOXzFyVVhrMTg1ZEtsaXlsSHRRVjhuT1NXMXh3RzM4Mjl4YU04cEFhSE1z?oc=5
2025-09-17	Google	0.0	Monolithic Power Systems, Inc. (MPWR): A Bull Case Theory - Yahoo Finance		https://news.google.com/rss/articles/CBMihgFBVV95cUxPeEdHSXVUNmJ4c0JacUpqcGpOQXNENlRtOFBwc3dBc01BZEQ4UzhLci1hYXNxMEZCcUN2TjZjbmNiYUgzWTZ1ZFhpQUs2elN6THpfbmZZcW84Z1gxeUhMM3R2X003TkpqSkVEcVBXUUNfSGhzTnc1a2l2ZkoyUHJIREdobUtnQQ?oc=5
2025-09-16	Google	0.143	Monolithic Power Systems (NASDAQ:MPWR) Is Doing The Right Things To Multiply Its Share Price - Yahoo Finance		https://news.google.com/rss/articles/CBMiigFBVV95cUxNQl9vNnJyMnpod2NRUnFfcV9aanNNSnNmb1A5T3NrMmlCN2lzUWt5bG55cjBFSmQzendBTy10cVRsRzFDZjhUNGs4ZUcybVloRlJUR2plTy1abFFFbVpOZTlNZ21JaFJkOHVKMGtWY0tUTjdzV1JDYktsajF3Q3hxLTNUV09DdUhHenc?oc=5
2025-08-27	Google	0.0	Investing in Monolithic Power Systems (NASDAQ:MPWR) five years ago would have delivered you a 223% gain - Yahoo Finance		https://news.google.com/rss/articles/CBMikAFBVV95cUxPLUFMU285QmItM09ybU85X3ZseEo2c1BwWXZIYzVIdGxxbjNLeTNick5udGpMWWtocFE0d0xqaHR6eUt0OUIwbXJDdjdrQ3N2dUVON21jOVNfWW9xem15ck5jMWt3V29yaEpnRmhkSHExNGpMSFNhcWw5aE9vMnA3TFE1blRkVWVrbDIwaVRSV20?oc=5
2025-08-09	Google	0.0	Should You Think About Buying Monolithic Power Systems, Inc. (NASDAQ:MPWR) Now? - Yahoo Finance		https://news.google.com/rss/articles/CBMiiwFBVV95cUxPZmRlYkY1aDBEV2RRY0FaVXZBMWlOOXkwMnJXR3lPY3FIbkpXa2lIS0MwU2dtNVd0TDdvTVJZZWEtTDVaUWFydTFVNjZoeUJKT1N0eDBHdmxQaHllSlBVN3FyNkVXcTNPeWMyX2ZaWERmZEtMQ1JWREZxMzZjUkQ3NVV0Z3Bxd2szSk4w?oc=5
2025-08-08	Google	0.433	Here's Why Monolithic Power (MPWR) is a Strong Growth Stock - Yahoo Finance		https://news.google.com/rss/articles/CBMigwFBVV95cUxNU3JveEVzd196cU4ybjZOYTBhcmI2Q0dYQ21JVlIxV0VITzBuX2ZYU05FNGtpMWtSVzA4X2laRjQzempvaDBQaVhRS0pUZU01Y2tpVkpOMTlhblU1c1JCaTdTd19CS0pMc3NHNmx5dFZhTS1PeDJERkt2eEZEbEViQ3oyaw?oc=5
2025-08-01	Google	0.0	Monolithic Power Systems (MPWR) Reports Earnings Growth With Quarterly Sales At US$665 Million - Yahoo Finance		https://news.google.com/rss/articles/CBMiiwFBVV95cUxQbl9KT0VONXFoTy1xZ1EzQXo1OXZyUHRUQ3JqRl9MVmdIS1l0VUNJQzhnaHl4dm1nN0pIejVVTEZ5TV9QLXJ1OUlHV2kwVFpqTEdVMmlRSXBFV0FsT0JnWnZpemNpSm9aT09Zck9xWWtObkNDVWIzazduS2l2ZElfcVBNNnVGNGo0Z3lN?oc=5
2025-08-01	Google	0.0	Why Are Monolithic Power Systems (MPWR) Shares Soaring Today - Yahoo Finance		https://news.google.com/rss/articles/CBMihgFBVV95cUxQdTZlczIxdmI1dmtGRkd6WlhkMzZZbGdacFRLOFdVTHJrS2xvTHVySGM4ZGI2NHVyWDFGZGsweVBPZUVMdGt2MUpWdEpXeEdtTGpvOHNUTG5HaTdJTUpNeGVudFZhcGZXRTJRNW8xTUpMM2xNbHhIRWRlejdhVGIwbG1nc2c1Zw?oc=5
2025-05-01	Google	0.5	Jim Cramer on Monolithic Power Systems, Inc. (MPWR): ‘I Need Some More Clarity In This One’ - Yahoo Finance		https://news.google.com/rss/articles/CBMiiAFBVV95cUxQYXVDbDZkVW4xbWloYW45RzlGR1BfaTJjRERkN0U2QmVEYnNrblNqOGgtSDl4emhtdzNCWDRCMlRySno3NTB6M3JDOGMtRDZjVVJ0eGtXYlMtMWhQUXBxVDBWdlVab2ZLQnMyMDl5eFVvU25LTmdQNTZxYWRUWUNHN3M2VUtzTjJt?oc=5
