Date	Source	Sentiment	Headline	Summary	URL
2026-03-05	Yahoo	0.0	Is It Time to Rebalance Toward the United States? ETFs in Focus	Middle East tensions, oil risks and global exposure concerns push investors to reconsider domestic allocations, drawing attention toward U.S.-focused ETFs.	https://finance.yahoo.com/news/time-rebalance-toward-united-states-173000743.html?.tsrc=rss
2026-03-04	Google	0.5	Vanguard Sector ETFs outperform the S&P 500 in 2026, Top pick to consider this March - Meyka		https://news.google.com/rss/articles/CBMiqgFBVV95cUxONXB5VWJoVWNZYXFSanpTQldEYU5yNTBiRHFUbThHT2JvTTZNYzVWVDFTUDk1NDc4U0RMNm96TTdsNklLYWR2eWxBaWtoREkyMGJmRGp4MnBxUVlCZEhiMmxSS1RQZUNnQWRPRE1JcmN6dGFGRE9zZ29JMkctZXBDeHdsQjIyaVN6OGNINDdmeDRwak1DMlZzYTVVZVJ0dDU5UkxVUURQRVVSUQ?oc=5
2026-03-04	Google	0.0	VG Utilities Stock Quote, Share Price, News and Analysis - Longbridge		https://news.google.com/rss/articles/CBMiW0FVX3lxTFBSbFdkM1l2a1lMLS1KR0Q5bURFa1hPZGgydFNWdXhnak1OVm0xM1MzRHAwV2k4b3pxdHp0VWYxRmVjLWZRTjJZdWFBbGdFZ09jNm5qLThDOXRrdzg?oc=5
2026-02-28	Google	0.286	The Smartest Vanguard ETF to Buy With $1,000 Right Now - Yahoo Finance		https://news.google.com/rss/articles/CBMifkFVX3lxTE1lcHlrRE9UaEFldFQzYWozelRhNEtYZVkzWTVPbW5PbERGbnFJajBUMlJXc0hrRG9Ic3RtU2RHSnItcjdobll4UVRiZzVaSER2Sm56bGFRcVh3VXRDcGloVldyelBUTnpwRlJYb1FscW5PbzBVVXhVNGZhcDAtZw?oc=5
2026-02-28	Google	0.0	Price-Driven Insight from (VPU) for Rule-Based Strategy - Stock Traders Daily		https://news.google.com/rss/articles/CBMizAFBVV95cUxPY01ZX0o3TkJxRmZoMURFYlhrNnpEdnlrRHVXLVNVWTBWdXlCdVVSSHJGTVprdm9uaE1oOUw3NmM1OEpHWkxSR2YxMzNMQlRNQ0Nablp1WFFncHFCLUQ0RjlNNlRXMVp4WWQ4TXJtM1FZRzE0Tjd4Z2RkMjJxeFdrR20tTTRWTGFSbDJLQ1h4OWZjYXlaR3pRbGdUZWpZMmF5Tm1rY284S2hLWEY3NkhzNEZUV3BhQUhaNVktNlJ2b0NURm1ITUpEMXI4UTk?oc=5
2026-02-28	Google	0.0	VPU Should I Buy - Intellectia AI		https://news.google.com/rss/articles/CBMiXEFVX3lxTE9fczVzVGMwY1hpbWtiNGxtb3I0aHBhNkxFMGhBWVlCZFE5OTlsNnhIZFV4SHUza0RSNTNfOXhmd3ZUUnJhRHBFWGFLb1lDbHB5SUtfYnZCelBEMjgt?oc=5
2026-02-26	Google	0.0	VPU ETF: Tech Commitments Could Boost The Utility Sector (NYSEARCA:VPU) - Seeking Alpha		https://news.google.com/rss/articles/CBMinAFBVV95cUxOdWVuay1nMGZSeFRTQzdCUUczb3NKRGduYU5POXUyS3pDMU5sOU4yODc4VmJWV0lxUjd3Ynlna3RueS1PN3l2MDVLSFZnWDJPQ21faE15M09nT2ZUeV9qd3Nicmw3Vm9jVHpoVndFSzJ4X293ejhCeEg3dFFHUHV0WUpoeU90UHI1RlJKeVdHcE9KWUR4SmxmaVU2c1k?oc=5
2026-02-25	Google	0.6	After Trump's SOTU, Hyperscalers Told to Build Their Own Power — Grid ETFs In Focus - Benzinga		https://news.google.com/rss/articles/CBMi0gFBVV95cUxNUEs0ekc1bnl2MWIwdlFNTmhuOUJ3RXIyblliMXc5cHdyRHFhQnhCNjZ6VDEzQUVseWNOc0pnLUh5T250aEp6UFRjNE1iMi0yWGhGMjRSVXNiTDJ6UThGVUpMZDh3ZWx5a1c4amtfOE44LWRLR21KRnQyaDRwTURIbzlaSVl6bGREendfal9qbVd2NW1qeDJIVjBpN1BlVDJCVW5wMldIWlVLN1ZHZndLSzdGVXlUdFhTT3ZaZmZuSVc5bC1vX19ueWgyVGppNUJKZGc?oc=5
2026-02-20	Google	0.583	VYMI vs. VIGI vs. VPU: Which Vanguard Dividend ETF Is Best for Steady Passive Income? - TipRanks		https://news.google.com/rss/articles/CBMisAFBVV95cUxOUkxES0pnaXlPc2NhYnNUc0pWOFl4VHIwMXdWcE10Zk1JbnBLVE5FbFlKZFc5SXZyS19DQmFIc1hOTXRtLVcyX2FmbEJyYnpWRmlYYXpOM3BuajFOSUhBTnVTMmNOUzRHVTBtbzlLN3JobHpaWnVHd0NpbzctMzNLNHlIU21pS29SMDVBOV9mOVJ0dnhuWGFxTjNmZFE1d1YwY2MtZ3A2TS0tdmtvTk01LQ?oc=5
2026-02-18	Google	0.318	Is Gentex’s New Tactical VPU a Meaningful Step Toward Diversification for GNTX’s Investment Story? - simplywall.st		https://news.google.com/rss/articles/CBMixwFBVV95cUxPRWxoS3RrQmVYMmRMa1Azd3BBRF9kcE1KakVoVU1adE11MkxQQk1FcVkzSVpPMmtTakNMZmxIVVh3Ym0xRUZSZmJabHV2Rzd4SXR6X0NDNTAtMHMyZWZDdTdTcDkyaElvdkltVlpYQzhEZEx3RF9xNVZGMFROQmJCUGN1VFFERkc0MlNsRXNCN2lxeFJlMDdvYWVUOXR0UnVhRTZnLVVlMUk3eWJQQTVFbkZOY0R1YUQ0aHlLRFFiekVHekp4QWlB0gHMAUFVX3lxTFBpSGNXb1MydFozbVg5V2tmdzJwYmtTTWJoOWxvY1k0Vi1ZTTJRb3FsYjBkT0FHYjhKc0h0Rk9kQklubDN6ZlVaOEhUd2tGR0ZwN1ZsU1R0QTF5NDlaTkcyTUtHWVpkXzYzY0NkWWRIVl9tQkQ0NkZRamNuQWxUYVpoNjJHQ0U5aXN4OWJVdkIzUEpLV244d2JtZEtkUFcwN3dEdW83RWtPT2hqbUxwRGo4aHJCcEtDb2FjSGZpa3RVb2ZzMWZYdDJMZjBBMA?oc=5
2026-02-17	Google	0.0	(VPU) Price Dynamics and Execution-Aware Positioning - Stock Traders Daily		https://news.google.com/rss/articles/CBMiygFBVV95cUxQYjNBRnVpZXM5b01hdk00X1hkM3FFYWRvV2pZUHkwOUJvSG1BRlpPVmJ0N21HdHp6Z2M1ZC00TEhBV2ZBOG43WGh1bUlyaUl2WlJmY1puZVgtVGVXQnd6Q213bzl1cWpQb0pEajhKU0diSlQ4V256U2ZNZGxhSkNZdm8wZ1VMa1k4RURyRG80aWFsT1ZscjZZM1UtY3dmN0ljX2NZMzJrdlZMa3JMTHFFYWlYNmFfMWw1a1pMREFxNGh5ZUcxdlUxX3Nn?oc=5
2026-02-16	Yahoo	0.0	Are Odds Improving for a Fed Rate Cut? ETFs to Consider	Cooling inflation boosts the odds for a Fed interest rate cut in June. These ETFs can help investors ride the potential gains.	https://finance.yahoo.com/news/odds-improving-fed-rate-cut-160200766.html?.tsrc=rss
2026-02-16	Google	0.0	Are Odds Improving for a Fed Rate Cut? ETFs to Consider - TradingView		https://news.google.com/rss/articles/CBMirwFBVV95cUxNaVdnVVBuZFo3eHN4c1kxaWd3X2Z2OWZ5d3Rhd01wc0pKanZQV1hvYnlkdGtzdDF2QlMtWFJaVG1mczg2ZnpjaW40VDM0bHFkUkdVbUNkblh1MFRaRHJha0s2TFl4Z3lVY2xBbm1kUnBXM0NndnNlNFZHaDlSZU5XNVhoTk9BZEZFQ2ZvNExpX1VEOS1pemQ3SVpZSUVqa09jc19POXc5eEpWX3BNMFYw?oc=5
2026-02-13	Yahoo	0.5	AI Fatigue Setting In: ETFs That May Offer Respite	As AI fatigue rattles markets with sell-offs hitting trucking, logistics and real estate services, rotating into defensive ETFs becomes attractive.	https://finance.yahoo.com/news/ai-fatigue-setting-etfs-may-160300798.html?.tsrc=rss
2026-02-11	Yahoo	0.0	$9.8 Billion Utilities ETF Is A 3% Yielding Backdoor Bet on AI’s Explosive Growth	The Vanguard Utilities Index Fund ETF Shares (NYSEARCA:VPU) generates its 2.73% dividend yield by holding a diversified portfolio of 67 utility companies across the electric, gas, and water sectors. Investors receive quarterly distributions funded by the dividends these underlying holdings pay out. VPU manages $9.8 billion in assets while charging just 0.09% in annual fees, ... $9.8 Billion Utilities ETF Is A 3% Yielding Backdoor Bet on AI’s Explosive Growth	https://247wallst.com/investing/2026/02/11/9-8-billion-utilities-etf-is-a-3-yielding-backdoor-bet-on-ais-explosive-growth/?.tsrc=rss
2026-02-06	Yahoo	0.0	ETFs to Play as Investors Chase Diversification Amid Tech Rout	"From ""software-mageddon"" to rising AI capex pressuring Big Tech, diversification via defensive and global ETFs gains focus."	https://finance.yahoo.com/news/etfs-play-investors-chase-diversification-162300724.html?.tsrc=rss
2026-01-30	Google	0.5	This Low-Cost Vanguard Fund Could Help Keep Your Portfolio Safe in 2026 - Finviz		https://news.google.com/rss/articles/CBMipAFBVV95cUxNaFhVYm9pNWtNYW4xZzVyOG1YVElqRXJoc1pEM0FvZUJxRVRyNXhKSl9Ba3FmNkNqYUVkU0tqUm0xMGVySDBhOV95d2dEeHJYSlhFWl9fVFpHOWdtbUZKYnIwSzRacFVfa0QzbTNJMU5TQ0UzYTlHMFR6UHlYajI4Z2FmaEtyR1ZyV0hDeW52MGh5VHZZdjRJMnNYZVZOdWJCWVVDaA?oc=5
2026-01-26	Google	0.0	William Zhang | Cybersecurity Lead, Digital and AI VPU, WBG - World Bank Blogs		https://news.google.com/rss/articles/CBMiakFVX3lxTE05Q3dfZjJkbVRhdHFUSkxMM2ZQb3c3aDIyTWltTEs0aHZYUC1ZWm1mX1BieTJha0xXVldheHVObkRJUnBrVnAxUEVfOXVXa3JvYU5nMFNQdHBDeDQwZGpnUzU3Z2FpNVIydmc?oc=5
2026-01-23	Google	0.25	VPU: Time For Utilities To Turn Higher (Upgrade) (NYSEARCA:VPU) - Seeking Alpha		https://news.google.com/rss/articles/CBMijwFBVV95cUxOcmx5SjNJdWNxclRadi1naEFjWWVHUUl1c2lPOVpoaDhBWjVydjk4SkxVSmRKZ2U0dG9nam5Ba0F4MDNyOWRrWGdhQUhyNy1EcFk0eUx4cjV6aVE4bjRXdFpVeTNQQnpQbFVlRDdUZWE4SkR6WENhQ2lVcU9wT3RiTXUzenVMNlljUDhycEY2UQ?oc=5
2026-01-14	Google	0.443	Is the Vanguard Utilities ETF the Smartest Income Play You Can Make Right Now? - The Motley Fool		https://news.google.com/rss/articles/CBMikAFBVV95cUxPS2ROUVlmN3huN08xLVNCa2k3NDBMZk8xM3ZDektpUjhXNzljV1VMdFBfT0lsSEhkNWtFb2xpQzRHRkN6a1hGTVZTY2pGc1ZwNFVNakc4Z3pJdmtUQmF6M0pXcWFoQ3pqSjRfbld5UWlEcno1cHRXYjFIUk9MRGJyYURsaml6VE43U3dfT19Xd3c?oc=5
2026-01-14	Google	0.0	(VPU) Movement as an Input in Quant Signal Sets - Stock Traders Daily		https://news.google.com/rss/articles/CBMixAFBVV95cUxQVENqYXFJUFlTbEpNN00ya0lGc1l3cWJ3OHlyeUprcThKU3gycGFDcnRacTJpTmtOb0V4d2s2ZW5iMFlXMVdMUWxLNFdmbzFKekZGRjJTYnJ1bkN0LVM0eWhrTUhaWUtodmVobVZPTGVrNnRKQ3JCbXRDTXltb0dCcjhwbU1WT28tZFllU045TkMxZXRMZUpHZkV2QVBVRkZOMDhnTDBLRTZ3RDhIUlFfSTF5RjBPd0RFOXVrUGdpbDA1Z2xX?oc=5
2026-01-05	Yahoo	0.32	The 3 ETFs Investors Should Buy For a Glorious 2026	I want a glorious 2026 for my portfolio, and I’ve put in thousands of hours of research in recent years to try to pinpoint some top stocks I want to own for the long-term. That said, in terms of finding opportunities that may work in 2026 and for many years into the future, I think ... The 3 ETFs Investors Should Buy For a Glorious 2026	https://247wallst.com/investing/2026/01/05/the-3-etfs-investors-should-buy-for-a-glorious-2026/?.tsrc=rss
2025-12-16	Yahoo	0.242	Top-Ranked Utility ETFs Poised to Benefit From Recent Fed Rate Cut	A third Fed rate cut this year is boosting utilities, making diversified Utility ETFs like XLU an attractive way to tap lower borrowing costs and steady dividends.	https://finance.yahoo.com/news/top-ranked-utility-etfs-poised-130300133.html?.tsrc=rss
2025-12-13	Google	0.0	A Once-in-a-Decade Investment Opportunity: 1 Vanguard Index Fund to Buy for the AI Boom - The Globe and Mail		https://news.google.com/rss/articles/CBMi_wFBVV95cUxOWDh4ZWt0ZmxpVmptZGVQaW5RaDdOTV8wU09FR001UWNoWnE2eGRhRHNoUGppaEY1bXlnUFcwMmVpWnU5dmlSand2clRjcy1RRlZtUG1ySEwyMmpSQzdaaTM5V3NhME41dm1vMXo0X2ZPbTV3dnpGMjczV1U1T28tOEU5WndSMlRORVQwZ1JmRXdpN2dxNUNGeE9JZGMxZG1nNW1yWmt2azJkYTNXZFRiOXJScDRfR0JhdDdJRW1TZzQ5RHhqaDhmMkxOOWM3bnpDZkZ5bHJUcFFPX0RLdDJzempjd254cnlVN18tZUliRHR3MnhYVkpnNzF3aVkwUW8?oc=5
2025-12-02	Yahoo	-0.1	Buy these 4 Utility ETFs to Ride the AI Boom Before 2025 Ends	Utility ETFs like XLU gain momentum as AI-driven data center power demand and falling rate expectations boost the sector's appeal.	https://finance.yahoo.com/news/buy-4-utility-etfs-ride-132500390.html?.tsrc=rss
2025-12-01	Google	0.0	Kazakhstan Faces $1.5 Bn Losses After Attack on Caspian Pipeline Consortium - Kursiv Media Узбекистан		https://news.google.com/rss/articles/CBMiswFBVV95cUxNSE54aVcxaUtFTzZEU2Y0emlTOFlmX0ljQ1ZncFlDZDRJUThrZmxsS1YtNTdxX3BaOENtZl9VOVppQWVIWEpoNHQ3dXlySU5ocGRFakp1cHFtS0dNbm5sVE1IRzZrQ2VlOVY2MThSZE9IdEItdlNRMHkzNU4wVjVEejBPUkQzS2F3MWtrVFltZ3A0aWltRUVTd2wwdEVqZ043T3RpWTFOQlhlbENQZmh4aEpWb9IBuAFBVV95cUxNeXhieUlIMkVLME9ObkluVExZYkx4VXdMdjBXQ3Y2V1VSOU9Qc3puQkwtNGdfcHlEb1NIT2ZSVWtzODNiQXdFdTJHOWVpM0dEc2ZLM3BmbDNQVVE2ZUpkblF4QjJETnR2ZWpuN0txN3RZOFRrMjAxT3lFZmgxZ0gxMWltZkR0WVpHcE9nXzU3T1RkQUR2Vkx2QlQyTWlscTA5VnZwMjY4aFhLY3dvN1lfUzBKdW1wRkh5?oc=5
2025-11-16	Google	0.6	The 3 ETFs Every Investor Should Own - Yahoo Finance		https://news.google.com/rss/articles/CBMie0FVX3lxTE5saE1GLTNMTkh3My05OFZXNGN1RFcxbmRBaHJzWTBoMUhCalNKUlBEeGxMQlVRbkV1dG9DSF9wNUxBeExCejg0LVFXX1dvSDhzMEZpQThEekczV014b2l3clpMR2ZYTnRnSWNEeU9EcUtVQWJ3dnV0cGo2VQ?oc=5
2025-11-13	Google	0.0	Openchip and NEC Moving Ahead with RISC-V VPUs for Aurora - HPCwire		https://news.google.com/rss/articles/CBMimAFBVV95cUxQV3RmRkxIQTNNb1pxQW9MdlUydjlOeEZITlRmdE10dTVzdk9WeHVYc01Pc2NScnJXd054SjB0al9lazZtNVNvSjZUemhwOW9NXzk3dW9SVUdKdVpZMklfLWZOSXFjX2tFY194TGJHbTFDdTl5V1ZXaVFKQmFOdkZTekVuT1hYclJZYlRST3hfVC0tRmhrR2g5Vw?oc=5
2025-11-10	Google	0.5	Is This the Most Overlooked Way to Profit From AI Infrastructure Spending? - Nasdaq		https://news.google.com/rss/articles/CBMijgFBVV95cUxQNzlQNHFtcnlERUpfZkpvZ1ZTelV1S0ZwUEdJY1h5QU55ODRkUmNma1NyRkJKNm5FUDZsclpURW9CTm90V3EyUzRrM1dQNTgwWmJMNjg0TzA4OE9VMGNLNnVkbmVTVUVMZEdUeTRCa1R0SldWbHk3VVlEcmpFeVM2WmpmX3FLbTVpeEFlcFNn?oc=5
2025-11-07	Google	-0.05	Pittsburgh VPU Detectives Make Gun & Drugs Arrest - City of Pittsburgh (.gov)		https://news.google.com/rss/articles/CBMiuAFBVV95cUxPckg4T1p2WVkwY2ROeU9vN19IV0REdE10NXhKSTJLc2lWakFERXV2aG1zMVluRTZDNnc5azBKSWRsSWx3cV9Id2ZSekdNckpoNTd5eVhPbU9IVlVCYTJINlIwREp0cXJhcEVFcndBM1dNTWVkc3RzTHJtWS02blR4Q3V1TG0tWHk4SFBNQk9RaWcybEVMTE1iSy1Ob1F0YUNMa3otRDdPNVd5UlRJMEdzb2FQRk13VVUw?oc=5
2025-11-04	Google	0.443	The Smartest Vanguard ETF to Buy With $1,000 Right Now - The Motley Fool		https://news.google.com/rss/articles/CBMimAFBVV95cUxOZkg4S2Q0R0hVWEhzMTJzLWFaSHVpTjh4R2NLaXFZSG1iMk1LWlBudkNudUZoX083QUFLaG1yRHVhRlpTdy1URGRLMWJPdkRCMHBRSlJoOTVhTnFOMmh2VDhsOHZxU0dyTEpILUNBWjRlWE1DUDZveVNKVDVTNDFlUUM4YUdlX2NkSVVoZlZEaHd3SnFBVUM3Qg?oc=5
2025-11-04	Yahoo	0.0	How Rising AI Power Demand Is Fueling Utility ETFs	We spotlight Utility ETFs that are beating the S&amp;P 500.	https://finance.yahoo.com/news/rising-ai-power-demand-fueling-194300954.html?.tsrc=rss
2025-10-30	Yahoo	0.4	Utility ETFs in Spotlight as Fed Cuts Rate Amid AI Power Boom	Utility ETFs, like XLU and VPU, are set to shine as the Fed's latest rate cut and AI-driven power demand create a powerful tailwind for the sector.	https://finance.yahoo.com/news/utility-etfs-spotlight-fed-cuts-142900630.html?.tsrc=rss
2025-10-30	Google	0.0	IDU: Managing Downside Risk With This Passive Cap-Weighted Utilities ETF (NYSEARCA:IDU) - Seeking Alpha		https://news.google.com/rss/articles/CBMisgFBVV95cUxNMzZLSC1mRVgxaldjajJ0a1lBN2tGdmxWU2hyS2RSb3N1UFhxWkJxZHNKVXBTTUNGSlROWDVJUW9iMjBVYzRnN2RiSUtYR3R5TWdHajFsZk1aaXQ4QW9uT3pZNjB1bUhYUjJJb194TTdybUV4NzVTMnl3eXpjY01XWlp2RUwwWDNGMkVZbzFhRlROM19TX0pTdndOZUV1R0pYRE04MGs3elBTa1I3TGVJYXpB?oc=5
2025-10-30	Google	0.0	Utility ETFs in Spotlight as Fed Cuts Rate Amid AI Power Boom - Zacks Investment Research		https://news.google.com/rss/articles/CBMipAFBVV95cUxQdTZzY3ZQM0ZvWDQySUlJNkhWdUtCelE1S2UxRl9wQjktbXRpTXVQV2VCT1duc3ZmVjVzQkdESGxWMnVkUkJmZXBUVVlvTzNfRW1UQng5d2tnaW0wOUdYcTBKMERfWkY2bHRiN0VGQWxkZWt6dF91YnBYSnhIZWYwTUhPcE5Kd2NSbnZBNXdVdUlCcEpfVENhZ1VXdXFNQVVfSUFBYw?oc=5
2025-10-23	Yahoo	0.114	This is Wells Fargo’s most favored sector beyond just Technology	Investing.com -- Wells Fargo strategist Scott Wren said in a note Thursday that the current market rally extends far beyond artificial intelligence, highlighting sectors likely to benefit from massive infrastructure and energy investments tied to AI growth.	https://finance.yahoo.com/news/wells-fargo-most-favored-sector-144612184.html?.tsrc=rss
2025-10-23	Yahoo	0.0	Utility ETFs in the Spotlight as Q3 Earnings Season Kicks Off	AI-driven power demand and solid Q3 earnings from utilities like FE put ETFs such as XLU, VPU and IDU in focus.	https://finance.yahoo.com/news/utility-etfs-spotlight-q3-earnings-114500684.html?.tsrc=rss
2025-10-22	Google	0.629	The Best Vanguard ETF to Invest $1,000 In Right Now - The Motley Fool		https://news.google.com/rss/articles/CBMilwFBVV95cUxPVUNfTEdXSGllbmZrcS1COTFtTHVCQjA4aUYyOC1BeHl4MjRRSmxhMV9HcHl3VTdmdzNhZ0cwRVNiem1MVEJobVAzenAtejRFdmRRZ2RYOFNjQmJjcFlnanJCUHlyQkRCdHVSN0lxNHFraTZMZTFEUzc3M2FhOEpPdU9KOTVnQ0tRbDExb2s4UUh2bVFjU0k0?oc=5
2025-10-10	Yahoo	0.0	Zacks Investment Ideas feature highlights: XLP, KXI, XLU, VPU, VHT and XLV	As AI-fueled markets show bubble risks, defensive ETFs like XLP, XLU, and XLV offer investors stability and downside protection.	https://finance.yahoo.com/news/zacks-investment-ideas-feature-highlights-150200956.html?.tsrc=rss
2025-10-09	Yahoo	0.0	If the AI Bubble Bursts, Here Are Some Defensive ETFs to Consider	As AI-fueled gains spark bubble warnings, investors are eyeing defensive ETFs in consumer staples, utilities and healthcare for safety.	https://finance.yahoo.com/news/ai-bubble-bursts-defensive-etfs-145900514.html?.tsrc=rss
2025-09-30	Yahoo	0.36	Is Vanguard Utilities Index Admiral (VUIAX) a Strong Mutual Fund Pick Right Now?	Mutual Fund Report for VUIAX	https://finance.yahoo.com/news/vanguard-utilities-index-admiral-vuiax-110002483.html?.tsrc=rss
2025-09-25	Yahoo	0.0	AI Power Surge: Data Centers Energize Utility ETFs	AI's energy-hungry data centers are fueling a surge in utility ETFs, with funds like XLU, VPU, IDU, and FUTY outpacing sector growth.	https://finance.yahoo.com/news/ai-power-surge-data-centers-162900155.html?.tsrc=rss
2025-09-25	Google	0.0	AI Power Surge: Data Centers Energize Utility ETFs - Zacks Investment Research		https://news.google.com/rss/articles/CBMilAFBVV95cUxOal9aTlQ1VW9rcm5ZbmFaQlJ3SVcwY1JpQW1GVU9YN28xNzNOTzlPS0IxVk1OU3Q3S3RMd2NkeVRfT2dHRVZuZFdOQmkwaGxHMk5wZmFENFVxSkRBUy1WSkNPX2RvRVMtdTREMTlzWjl2SjhjR3NDSDRROUs2cFd3RnVOZ2E3bFRtdHZTS2R6RVZRQVpN?oc=5
2025-09-25	Yahoo	-0.1	AI Power Surge: How Is the Data Center Boom Energizing Utility ETFs?	AI's energy-hungry data centers are fueling a surge in utility ETFs, with funds like XLU, VPU, IDU, and FUTY outpacing sector growth.	https://finance.yahoo.com/news/ai-power-surge-data-center-133700191.html?.tsrc=rss
2025-09-25	Google	-0.1	AI Power Surge: How Is the Data Center Boom Energizing Utility ETFs? - The Globe and Mail		https://news.google.com/rss/articles/CBMi6AFBVV95cUxQb200eWtrLVJncEFfSHVaak9OdGExZVZNa1g4ZG1ONnJvSDlpTzF4azh5dEZneExmMnYzOWdSNnEyWmZHWXhtRFBVTFRJeHBHNkw5SnBhNHFXQjFfNTZnT1R5RFR5X3Z5Q0ZHaHhUWHRGb1lyZ1NLZnFKcDE2LW11SnRGaUZENVoydWY3SXp6UWdyemY0THpXR0wxTDA2UVNyck0zZlBrT2ZpUWJwb3Q0Rkh5N0ZGbGh1c0xoalpPZ1BNLW5NRmpMeWE4eHFERzRldllmT2JDcG5ERWxOQzZoZm8xdFlYQjh1?oc=5
2025-09-18	Google	0.0	VPU: Understanding The Structure And Suitability Of This Utility ETF (NYSEARCA:VPU) - Seeking Alpha		https://news.google.com/rss/articles/CBMioAFBVV95cUxPRDNhMG05QmxEQjIySk5RZ1hSczh1SURTMmdMYkQyb1MtcjQ0MWxoUnpGNlVvRHItZlQ1MEZDOTVXYzlrYms0em1jUWtQbE9icjRKTlRENmFFNTJTRTRwR2Q5ejUwQ19wTFAydnkwak9yMGFFZDdLdUhfMkZFZVBoT3VCVFFWeTNVU01wYk82VndBX0xwQWRTWW1zcGZ1aUwx?oc=5
2025-09-18	Google	0.0	VPU: Utilities Dashboard For September - Seeking Alpha		https://news.google.com/rss/articles/CBMihAFBVV95cUxPYllIQVFuWG8tdjdRY2NvUkZVTVJ5NEowaXNMYlpUamswN1RLOTY0ME5lU2NXUHN2RDJYbm4tb0ZXeHBIeHNzSU1iWG5MMjMxUDVaSjk2Qm13ZjQ2S3BncUhWZVFmdWdzY20ybnJHTDNiMTRXbzZsX3FBM3JxVjYwQWFkTmE?oc=5
2025-08-08	Google	0.7	Video Processing Unit (VPU) – the NETINT’s Journey to a Superior Discovery - vocal.media		https://news.google.com/rss/articles/CBMipgFBVV95cUxNQnhZY1h2UXlPcVZYUlY5bWpHcmFPNmVLVW43QmZLc2RtcS0wQmxRZ2VGenNlemtTUDhBU253aDJ0RFU4eVN2N3FxTkJMZ1RKeTlCUVFpNWdocHg1ckRZaUwzcWJyVHpKa2J5eFI3Y080RUwxOElOSTQxZTQtOEhFbl9Md21qSEJmYVlVTlRVZ3ZBekcwbkdTNVUtYlNoNy1ROXVES0hR?oc=5
2025-08-08	Google	0.6	Could Buying Vanguard Utilities ETF Today Set You Up for Life? - The Motley Fool		https://news.google.com/rss/articles/CBMilwFBVV95cUxOcXhCSnpNQVhBY3lrUzFhbTdxQm53d1FXRnBUcExVWHNUMTRiVExDblE4bjVWZllWYzNtbmY2eFNNYjR3UTA3LTBURjlnazFvd2FidUFqdnFVV2xHWHZrcGlPcmpLY2EzLVRmQ3dnVEJYUllqX0Q1eWtWUl9UWjU2YWxDaWJ3QVUyeFRDNk93Ul9lWmQ2TGZR?oc=5
2025-08-08	Google	0.0	Could Buying Vanguard Utilities ETF Today Set You Up for Life? - The Globe and Mail		https://news.google.com/rss/articles/CBMi4gFBVV95cUxQc1BUejV4OUlTVjFubS1RVHhMNUxIWDdmb05xeFVfMG43dHgtMHZ6YkM0bXJ0WmZPN2J6NG1jMmIxUkk4NFhlTTh2UWIzSDdQVDJnSHU2UVVnN3RjWG9YbjNyVC04WFZXbjhkMWVybHlYb2QwcTBRN2JJN0tPMGcweUl0WTZOVlJzRGxpM2pyS25PaXNQTnFWM01BQ3U4STNfUDFUQXNSN290b2Nzc2xvTE5ZaGx5a2xyRDZ6XzBvVjM1ZXJjcWVudjVFUDIxZDhlNmxoY1lWZUNZeDZmNjM5YW1B?oc=5
2025-08-05	Google	0.286	The Smartest Vanguard ETF to Buy With $1,000 Right Now - The Globe and Mail		https://news.google.com/rss/articles/CBMi1wFBVV95cUxQTkNmSGlVVzJlWlFBM1JaZFZxVmFJNG9GQnhET2VJNDZOTUs0Z0FIMkF0YXYzaXJhZTFCaXBFVFRrdG5nRDZUeXExanJKYVpucm9GT0JxblB2QVBTbXdzYTBIY2o0NlloV0I3bzA2NFRrN0pZeldTTldlRzVmVXlkd2R6cWxwaXlTczF1SENFMTViSUFpdFFnMndZT1BSWFkxTl80cmNzanFKM20tSWkzWTNXM1RuOHR4c3V0WXFtSHVpUkprdUc4c09JZW9haVQ2UVRiRlVWYw?oc=5
2025-07-30	Google	0.136	Powering 'Sleepy' Utilities to New Heights - ETF Trends		https://news.google.com/rss/articles/CBMickFVX3lxTE5kdElwRHRKOTdKQnpCY211aTl2R2ZFSEZpLVU1a2hPRlJSbkwyMnprLV91T3Juenp3bVU5eVAzTlN6OFVFdlhzWUZNXy1HU3NsM0FPcURzLWFVR09ISXc2TnBMZGhHYUNXUmF1SW44aEFuUdIBd0FVX3lxTFBPejBsY21jdGJfZmJ6SVpJSGVKMWRfcDFqMVZzUnRNQzJKSXBmeTYzSVhQeHJ3VS1Oa1ZVcHZZLXg1YlJRd3ZpYUp5eXI4SWJ5MVhRR2EzLWU1R2tyWjdRR20tTjAtbkxwbldmcHZMRGdWUUpFZFl3?oc=5
2025-07-25	Google	0.375	2 Dividend ETFs with Higher (and Better) Yields than VPU - 24/7 Wall St.		https://news.google.com/rss/articles/CBMinwFBVV95cUxQLTFzUS1vRkp1Vm5wMXAxdHFlUEtLR1hKY2RrNzhlUDhWSUtjZDAwamdSZWRvamMxR241VjB2UHFNbjctcDRodGVTUUdGOUkwVmxuelBuRkYxM0FzUkpqZFoxcWVKNTFxQ3ZRc2QzbDZjZ0tFX3RjbU5sU2JpWjhWRWNJTnVZaVRNMHdBU1JtWTlaSk5qT2xTQWtmZ25nWkk?oc=5
2025-07-22	Yahoo	0.0	Should You Invest in the Fidelity MSCI Utilities Index ETF (FUTY)?	Sector ETF report for FUTY	https://finance.yahoo.com/news/invest-fidelity-msci-utilities-index-102005873.html?.tsrc=rss
2025-07-21	Yahoo	0.148	Utilities ETF (VPU) Hits New 52-Week High	VPU hit a new 52-week high as investor demand for defensive plays boosts momentum in the utilities sector.	https://finance.yahoo.com/news/utilities-etf-vpu-hits-52-090000258.html?.tsrc=rss
2025-07-21	Google	0.148	Utilities ETF (VPU) Hits New 52-Week High - Yahoo Finance		https://news.google.com/rss/articles/CBMie0FVX3lxTE1xMUJraTRTUk9PeDg5Zl9zcXVPREQ0bjZhOGdzVXVYcVhqRjBkV2xNVE9vOW9WZlljUlpOakpXQmtGRmVqZ0sxVjR3MHZ5cjRHUzQ4NmlqX1Q1eE15MFd5TWJlNDdMNjMyenE4RWoxTng0Rm14Q3pBTVJmVQ?oc=5
2025-07-21	Yahoo	0.0	Should You Invest in the Invesco S&P 500 Equal Weight Utilities ETF (RSPU)?	Sector ETF report for RSPU	https://finance.yahoo.com/news/invest-invesco-p-500-equal-102006492.html?.tsrc=rss
2025-07-01	Google	0.5	Why VPU Works For Utilities, But You Might Want More (NYSEARCA:VPU) - Seeking Alpha		https://news.google.com/rss/articles/CBMilwFBVV95cUxNMHRWeEpPVTYzdUswc2xncUtBVHdValRtSnhDYXpiUVFzckJHY2ZCT3RwOG1GdDliV2NFekRsUUFRNWZrWXlwLWRVcGE5a1BTekVad2JadG02eDYxYWNkUXd0cjZNZ3pldkcxVjMxd1lKbTJZTG9mNmZmUEFaMWhMUC1ibzlPQUdjVGNteTZRTDVjbUlmZTVB?oc=5
2025-07-01	Google	0.0	Should You Invest in the Vanguard Utilities ETF (VPU)? - Yahoo Finance		https://news.google.com/rss/articles/CBMihgFBVV95cUxNcjJwdUx3R1Y4ZDAxMndYV01tRHdfeWUtSkRUSExvOHlVUHpRWUtST2l3OEpfbzJBeXBvSzN6ay04bFhBd1JpbkxCTE11eGx6Q0JMZzBiZWhXbVFRZ0M0ODNOLWg5MXU5Wk12QnpwY19VbVZnSEZIeU5YTktGZVBJLWkyaGxMZw?oc=5
2025-06-30	Google	0.05	VPU: Utilities Have Much To Gain From The Growing AI Data Center Boom (NYSEARCA:VPU) - Seeking Alpha		https://news.google.com/rss/articles/CBMirgFBVV95cUxQcVcwYlk4ZklmczBRSjlFRGRSVVdYdVN1V0lUbGtYODVEc21Qd3pEUHo5YW94VWp5bXlDSGhkN0VwN09hR0NGdC1aN25iMGo1OVI0c19RZ2Rtc21IU1I1Zm9VMkY3bU5vRUo2anVNVGdlTFBkRjBXVFlHVDVuNFlLbTI2VGtqWEdSTjRTejR1QUJFVG5RcXFtU3ZVQUVUQmRBSjd2M05JUEVuQUZJb2c?oc=5
2025-06-12	Google	0.6	Time to Buy the Vanguard Utilities Index Fund ETF to Take Advantage of a Growing Trend? - The Motley Fool		https://news.google.com/rss/articles/CBMilwFBVV95cUxPOW5lTG9RTzNzVWl3cGloQmJwSnZwb2laRjF1bXE1NFpwSlZjeHNucWtiS2Y0MXZoTEt5Tm1TZlMweVZmMDFYTkRDZG9oSTB2cDlrdldpQi12TEZIdUkxcjJiYmNibE9Rc0twaDIwX1p2S1ozcFZaTjlwZDlRVDNXS0JTOW5wY1h2bnk4YjBpU2xZSENqQ21N?oc=5
2025-06-11	Google	0.068	John Deere Electronics showcases new VPU in Cologne - Industrial Vehicle Technology International		https://news.google.com/rss/articles/CBMiqAFBVV95cUxONjBvQ3JiampqczhmSmVPbmdQQXV6QkVQVy1pS0oxMFg4blBMU0N2T2dqZ3BBZ3VQMFVUajNUNTBMVy03bzRTN2Q3cjhQRm9feTZtSE1kRmZwZDBzdTY2WGVtQXlzdWJtSlZIZHJ3dk0wMFNTUTU0UE0wYU50U3o4bEFiNDdubEo5TThFeDlmMUpiclhma0h0a1NsR2dvaWRHT0tyYnIyRXM?oc=5
2025-06-01	Google	0.55	3 Top Dividend ETFs to Buy in June for a Lifetime of Passive Income - The Motley Fool		https://news.google.com/rss/articles/CBMilwFBVV95cUxOY09lSGc5RUVmTFNaNl9fbVJCS0s5M2hqYi03YVlGNDU5YWRDMGNqSHEzbG5hNEFvZlhGZkhxNHExMzMzNkd2b09jamd5OE51dGFmN1FDWjJzdHVSRUFkNndkSXZoM1RETkI2ZTRNc1ItaWw0cTA2LXlUZmlkeEN5TlFPZ0oycVY1UVFtRllUbTRCX1g3UE40?oc=5
2025-06-01	Google	0.5	3 Top Dividend ETFs to Buy in June for a Lifetime of Passive Income - Nasdaq		https://news.google.com/rss/articles/CBMijAFBVV95cUxPQm5vb05FQW03Q2E4UGJRTUx0ZV9EeEZEdjBabmp2WTFMbEFjLWgtTGNXOGl4bEhqMW03cnplWjVQMWl3blZNbXZOMEIwUXNXcV90MGpfVXczRU11RWo1cVdmdzhIRVB4MGdaeTh6OTdYSzN4V2gzdWNtLV83ZTM0WklZa3FJbGJabklkLQ?oc=5
2025-05-30	Google	0.2	The Light Widow Sidewinder VPU lets you rotate and de-squeeze vertical video - Red Shark News		https://news.google.com/rss/articles/CBMiqAFBVV95cUxQTjVRXzN2U0tpTFNmNVVaaVFCTjhRYUtGbG5RYWFvSEhlOU1qck1DZ05xWERKaW9Ud2t1cE1hVVZBSFc5VTdNYmEySm9YNEloRlhOV1dYZnZPLTBtYm5PcWpMZmc1MXFiaDVaSGhFZ2k0bFViUGVIVmxjcHFVOXJMN1BueGgwV3VRdGM2SHFmcngyNVhUdXRUMFQ0SE13NVFkTWhQbFo0QXbSAbgBQVVfeXFMUGV6RmluZzNKa0Z1S2Y3Ym50Ukl4QWs2QnNfdWFtejgtLTFnbDUtcXVPTWZCY2FrTS05Y05WYlVHRG5zTmNFNzgyM1NQcVRjQUpQaEcxbk1TMHlKTlhocGpxYndIcmpDZXIyXzcxRXF4NEVuaEhfNnF6V3AycmxtTG1fY3Nudm15OWktZ2RrakxCR280dkY2bGVYLTd6azF6ZFE3Ri1uZ2UtRVBTVlBDM0RueV9kUXhmSQ?oc=5
2025-05-27	Google	0.0	Sidewinder VPU Rotate De squeeze HDMI - Newsshooter		https://news.google.com/rss/articles/CBMivwFBVV95cUxNSUN0dTFSM1VhdG43LU1jc3J0LXEtbl90Z3Q4UzFmMFk4RTBCVWh2QU9WY2VrazZmN0xBQU01VFlzNWNEcW4zaGV6THJHWmJoUWtIU1dRSXI2WVZkOW5SWnAweWhvamxJcVJPV0RJN2FqeHBPRTVEaWhpYmZyMU0zVG1RcGQzRldOZHdSRTd5MENYODd2R21GZWdVM2VreEUwTnNQMnNxcFBueDgtWEhQcUNZOENPLVI1Z3dOS29wTQ?oc=5
2025-05-15	Google	1.0	Baby Boomers: These 3 ETFs May Be the Best Options For Retirement in 2025 - 24/7 Wall St.		https://news.google.com/rss/articles/CBMitwFBVV95cUxPeUlyakNFV3REYWRtdjVWRVVHWHF5aF9NZVdWaUJFaXFlZzVHUXp2bnhOMXd0RUJQNV9YbklyUkhncmhEa3IzZ2R1eFFtbXFqa2xfYVJFOHJ5bEhTMVc4M0oxNTctcFlwTHhpblBncnhKbmpCc3NPRkQ0UlQtQk8wNllUOXVxVFN3cXlnc3JVTU5NMTVsVlB0SDBiREtaeF9YTi1qaldBYTlPSnkya29HSGh0bG9jak0?oc=5
2025-04-28	Google	0.136	New Eagle Launches Edge AI Raptor HPC Platform with John Deere VPU - Embedded Computing Design		https://news.google.com/rss/articles/CBMiwgFBVV95cUxNRkY2OXhQZXBlR0szR0M3UTBLcmluWXdtYUNRZkVoRWtEXzhGcmd4ajBRZkhvMURscTlVM2tmTVJ3VEJEYkxzSGJjUkRHazl3ZlZWd0ZSTk1HUnZ4WUVOaFk0VmJSUVBZMThkVnNaNnNNSWQzc0l0dTJDck5mOUEwajdCdkUyQkl5WUtGenUxOE5KLWV3MEM0MGhselhfYkFSTFRsWFZDNHFiOVNSUnkxZGRxNm5EdXlaN2R0NGNCV1dpdw?oc=5
2025-04-28	Google	0.0	Should You Invest in the Vanguard Utilities ETF (VPU)? - Nasdaq		https://news.google.com/rss/articles/CBMihAFBVV95cUxPa1U4R2NQSjJZNnhjQ0h6WXl4V1YyUXhtaDhPTFAta3FWektzc0dIU1JlMEhLTTkwUkRGc0ZrcXNxNDM1bm1nSldLLXZFZUxaR2VZeFA5ZWJiXzRtSnpwVEZBcm9kaUJxenNYYndaR3k3TkdKRjRvTDltSnprTmNDSXJOUDg?oc=5
