Date	Source	Sentiment	Headline	Summary	URL
2025-09-05	Yahoo	0.597	Best Funds Tap Coveted, But Hard-To-Reach Corners Of The Market	VanEck has consistently delivered some of the best funds that help investors diversify into untapped and new markets.	https://finance.yahoo.com/m/48f27657-0a30-34b3-9c57-1a29d4e1b098/best-funds-tap-coveted%2C-but.html?.tsrc=rss
2025-09-03	Google	0.0	NLR Fire Marshals investigating suspicious house fires; homeowner believes them linked - KATV		https://news.google.com/rss/articles/CBMihwNBVV95cUxQV1Fjd1lyTjVxWGNnM1Z5b05lSVUwR0Z5eE5pamExdDR3NlR1RU9ob0IycGpDVGdWSFZnbThSUGUzenhBYlpjbXYtNlUtSnJPZkxqY1poSmtZUUcxcWVtMjQ0NWczQWZNRzgtbEJmaDZPWWl6ZTVyNy1SNDNBSGJtVllKOXc2dTFtdEFlMHZ6MTFiSUNNUDdGdXlIckM0a1U4SjZ6YlNOV2d6U2FqY0Vpb1VtWGlfNk1sdVZVc3ZJMHlyR1Jsckd2d1l4TEpjYXJjOGpramRQYTBtSUlYQjlyZUJtVmFXN2xFTGljWUp1S2RpRG5VNXVsWTJoekxVNjE5MVpGeFZfRlBKR1JRV2d0U2t3dXlPVnl0RlctUVBoX0dvWjN6Y3FlTTRVcEJaN0hFMDRxOWJoWkIzelMyUmM4OU4zWk02eE1teG1BTDg4NlpzV2RzekhvVURxUFNVblpGVGlHNExqdld0OHdIR21YcFpCa1JNZ2d2bWZla0MxT21PWUt6cVhF?oc=5
2025-08-30	Google	0.068	Aaron Benanav, Beyond Capitalism—2, NLR 154, July–August 2025 - New Left Review		https://news.google.com/rss/articles/CBMiiAFBVV95cUxNNk5wNlY4LVMyUHlEd1FvRUFvS05hZFhfelJEU2FHYVhRLXdTSXVSb0Z1UTlDM21pemRUUl95eVlVWWZyMVo0UUpPdWRSaVdIMmpfbVBOM2dyUXFyVl9MYXd5QUVQV0M3Wks0N252anZvaVo4cnA1M2M4eHZyZnBSYUZxeGxlTVcx?oc=5
2025-08-30	Google	0.0	Friday Frenzy: NLR vs Rogers - KHBS		https://news.google.com/rss/articles/CBMidkFVX3lxTE5XRGgyNE1NT0RDVzRXWEpXdWNQcU10RF9hTmlMUGNrMWI0QWxoX2NITE1mdGw2bk5xMjFKVnluREx0UDZIOVBXTklmcjV0NGNxdlVHMlJKc0xYYmZnWVdjemJTa0tyUm1SOFBNLUpkS1ZnMzEyZ0E?oc=5
2025-08-28	Google	-0.188	North Little Rock woman hospitalized after being mauled by eight pit bulls, investigation underway - KARK		https://news.google.com/rss/articles/CBMi0AFBVV95cUxPeXFSMXhYVHJFOHlHajFOejI4aTFPeU45RlpwRm16NXRDRWJYNFR1RHJFeGZUMy1aUDZpV3licm1ITDlzYzZpRXNlMV80VFVDMHVZRzdSRDBiZi1rcF9KeWF6TXVKcGMtNkFQd3NRcXUwV0NkRWUyMmQ5WFNjMm9UamswS1RSWXNiOTR1aGxyU05lalk3Rk5rRVFxOEZWUmxDOXhXZ19reVlUU2xNVllfV3FPYllCaFZxVm1Dc2pnWVlxaFRndU01U2g3SFdwcjhf?oc=5
2025-08-25	Google	-0.188	Diamond Baseball seeks long-term deal to keep Arkansas Travelers in North Little Rock - thv11.com		https://news.google.com/rss/articles/CBMiuAFBVV95cUxOVDJXUU11WWVOSFI5TkRRVEVhQzB0UXFWQjFEY1pvSWZpWHZMLW9qVmdGaDRIemhienc3bzBPWTVtb1U0cVEyaTZ5ZFVOTThYcjhEVHIydVE4NDdoaGdSNWszdnVuR1hYSFBkMGhmZWNGVzU5ZFdkY0RzWVNMWnROaUZhU2VDZEhRR2d6REFUZW1FQnJuUzQydHFwQ25lSHQwVkFZQTdyNDhnc2FXRjFVTHRjRzJEeVNM?oc=5
2025-08-20	Google	0.433	NLR Emerges as a Strong Predictor in HCC IO - Oncodaily		https://news.google.com/rss/articles/CBMibEFVX3lxTFAybVBVcGNZS1R5OU4yNGVGcmk2U01FWGZHa1BUNnIyWG9pdXduQXVHZEhYVWtLeHNBc0dkbDNUOS0wVUZhaUYzYkk4ZE9tZHlvMldYa0s4d3ZNUUpKYmJmTTN3X1BGRGxXZFp2dg?oc=5
2025-08-19	Google	-0.188	ALDI coming to McCain Boulevard in North Little Rock - Arkansas Times		https://news.google.com/rss/articles/CBMingFBVV95cUxQSXZyWW5iUFRYZDR4UUtLS0IyNjVVc1gtOW9TSklFbTFPOE1wNXBZdmF1eldidkJvZDl0a0gweXBNcHpTaGVJODZTcXVUTVhkUnp1VDVsNDJFeFk4OVltZ29DVTBTYU1iUHFLUnUzVk8yZDQ3QWJqQ3YtYzcxREhnRnRSaWJESFItQnNLaVRaRndsVmFwdXJ2eGpmY0hfZw?oc=5
2025-08-18	Yahoo	0.0	These ETFs Are Going Nuclear	Energy demand is rising globally, in part because of AI use, and a handful of ETFs focused on nuclear energy stand to benefit.	https://www.thedailyupside.com/etf/thematics-sectors/these-etfs-are-going-nuclear/?.tsrc=rss
2025-08-11	Google	0.0	NLR: Buy To Unleash The Power Of The Atom - Seeking Alpha		https://news.google.com/rss/articles/CBMiiAFBVV95cUxQZlRZQUVZWkwyTDI0R3dHTkxpeVc4WjMtOHpyajViajhCWlFEZ0VVYl9CdXlweUV1U251N3E4c0hKS29hSl9yc3kwenpWQTZxekZPZ0VoY3ZOcFhJUTZHTmY3ZmNLM1V5MEFWWTJjaGhEbkZxQkV2Xzc1eDVUZVYxWFEzaFdrbWp2?oc=5
2025-08-10	Google	0.0	NLR ETF: AI-Powered Nuclear Renaissance (NYSEARCA:NLR) - Seeking Alpha		https://news.google.com/rss/articles/CBMihgFBVV95cUxOQ1BVRWhMTGNEV1RLM2hNWl9FQzRLTzNOQTNZT01Pa1hNUG1rc3lwUVVvSkZ3bnlUVm54UE03NVdlTnJZWHZVV0NjRjJ2OEFJMkRHVi1SODROaG1QVXpGVWZ1dVp1OTl1a2psbGJSdTFSSFF0V1QtYTIxR0FMclNCYVVFbUxPUQ?oc=5
2025-07-31	Google	-0.188	L’Oréal Celebrates 50 Years of Manufacturing in North Little Rock Arkansas - loreal.com		https://news.google.com/rss/articles/CBMikwFBVV95cUxOUlo4dkFrSS1SLUFlM2c2QnUyOVYweS1WRHM2S3VRVll3NE0xbFNKVmxJajhkZDJreHQwRklOTVdYQWgyV3M3dnZaYUozRENMTG0ycHVrZlhJekhHeGNVbDRGRUQ0clNjZ2FvLTlUYm5aZ2VrUlJJYWtwbEoycVozMXpXNk5vV0hYVEZhZXFUcFZELW8?oc=5
2025-07-30	Google	-0.075	NLR Police identify victim in fatal Maple Street shooting - KATV		https://news.google.com/rss/articles/CBMi-AFBVV95cUxNRVUyWlR0RUJKSkpUUWpWNkRqbWpZTXFNU2NpRnFHeXBiLU9aU0Nhd1BDWkx1WllfSHZEbFIyR3M1V1N0NHJtWnBxYjZBNjctVWlKM1BLdW00emNOVXZyTk9KR0NqQkhoeXBxQWk3RU1yNTNiY3J3WnFRd05URmhjbDhXcDV4X3FOWXc3cEIyNUJSMGtnSm0wMUFSVHNmQ0l6dFZYcVRYNFhrX2hHa3IzMXZXdnFickxFT2ltVHNoMzVQR2xKbk5CTXdqUVA4WXYtOGVIbklHOVZPd2E1ZkdtOWdDeEJ6eTAwNzRxRjN3dFJkSVduUEE3eA?oc=5
2025-07-29	Google	0.0	Buildings Research Sets Foundation for Future Design | News | NLR - National Laboratory of the Rockies (NLR) (.gov)		https://news.google.com/rss/articles/CBMilgFBVV95cUxPTktKRVMxMThFUV94bFEzTVV2TDhOa2prVEVITkUwTnVoT3BxU1d5NEF3MEFjbVQ0amFJcWRmOWVPckRfNG5oS1FuRFRtdHRtQ1BBRGVoTzMxRHNPbGh6MzIwaEpvR3hKZFMweHQtcl9faU15bWhmOGVWdG9VVUJTTWozdF9zanhvYjR6cm5wWWVNVnhVemc?oc=5
2025-07-18	Google	-0.5	Mold, crime and leaky ceilings: Tenants at troubled NLR apartments say they ‘just need help’ - Arkansas Times		https://news.google.com/rss/articles/CBMizwFBVV95cUxQU1g4dVd6bTdySDVwWF9RbHYxb0dQa0tueGZmN0FaMlZ6UmM2MndxUi00M0FjMFd4NjVTTnpMZ01oZmVVWENrQ2VnY1o4bzMzYW52cXFNdy12QXJHTGlULUxxZE81SXRUbXpCWVBQcktuMnRoM09kbFpXUzh0OF9qaU15LTNDYlozMGs4S0ptYjdKWmtEcmJRR0YwN1VHUHdIWERZVHg2V3BsTXhJaUVWbnd4bXREMmV0THl2Q2diX3Vla2ZaUkJ2OFd2Z21VUVE?oc=5
2025-07-15	Google	0.0	Can AI modeling of protein structures distinguish between sensor and helper NLR immune receptors? - Wiley		https://news.google.com/rss/articles/CBMiaEFVX3lxTFBFNzlkZzFZZEJ0S0VsYjZkREZPWG1IbnRJUTJqUHEyMUhrMGJOdDhOODZiZEJYa3hXTzE4cVhpZ25Hd1c1UE1lZWduNWFpUURLX2xjQ3k0Z1F2YkVwaDVfN1VFNlRIUVZp?oc=5
2025-07-14	Yahoo	-0.25	ETFs to Play on AI's Growing Momentum	NVDA's surge past a $4T market cap spotlights AI's explosive growth and the ETFs riding this tech-fueled momentum.	https://finance.yahoo.com/news/etfs-play-ais-growing-momentum-211400957.html?.tsrc=rss
2025-07-11	Google	0.0	NLR Options Chain — AMEX:NLR - TradingView		https://news.google.com/rss/articles/CBMia0FVX3lxTE1TeFVGWDVSWXFpM3p6clZldW9lQjkydnh5Z1hVbmh6Q1psT3h1dnhia2xDYVZSeV81eUx1dG9HVzllYXNNZ05UeTI2UEMwMWRMWWdxbVFqSW1mYW92UnMta0RHRVNidGtGTEww?oc=5
2025-07-07	Google	-0.3	Layne’s Chicken Fingers opening on NLR’s McCain next week - Arkansas Times		https://news.google.com/rss/articles/CBMiogFBVV95cUxNSlFsNDgzU3g3QTFLczdaRlBNM2xNQmlFbWg0c29WQVN2NmwwOUJlTVZCY05hWmpYWjZKYUtjNTBXVXRZTFJjVl9tVlFERHE3RG9CMzNQU3dzeVoyNmJIUFlsZzJRMWFCTHR6U1pCWjc4RVlHSjJZalRxWUpxbC1xZm9NelRfYzFCRF8wUlQzQnpBT3BfSzZNU19nTFRlWU5xa3c?oc=5
2025-07-06	Google	0.0	Inflammatory markers including NLR, AFR and SII as prognostic factors in neuroblastoma | Scientific Reports - Nature		https://news.google.com/rss/articles/CBMiX0FVX3lxTE04TE1nenZySG9IZXVRSTBZX1lJTmxBbnlTOWF3Z0RNMmk4VnRJNTVhYlpUQWJDX2R2Wnl1UGpTNEsyOE9hMmdPMklWcVYxX0dHS2JTOC1JclVOa3BCSmhR?oc=5
2025-07-01	Yahoo	0.0	Investing in AI-Fueled Nuclear Resurgence	Nuclear power emerges as a potential solution for tech giants' AI energy needs.	https://finance.yahoo.com/news/investing-ai-fueled-nuclear-resurgence-214200278.html?.tsrc=rss
2025-06-27	Google	0.5	Challenging the Prognostic Role of NLR in SCLC in the Era of Immunotherapy - AJMC		https://news.google.com/rss/articles/CBMiogFBVV95cUxNNERLTU5wV1BTMDE5MDVCNktKN0czZ0w1eElNWTRUa1VyaTdjUGpLallPbE42bEdWaGFvMTlkbU01dXF5bUN0dHZFcGYzWjB2OGY1UktlWlRlMU5McFVJd2JTUVdNdUIxZjhIWGw1RVF3TWtRZW9DQS1qVWFLVDkza0NhaHZ4dC1lRVp4VGJpTjR2Q05MdzlPOU91OHZwa0NzNlE?oc=5
2025-06-25	Yahoo	0.0	ETFs to Watch as SoftBank Eyes $1T Arizona AI hub	SoftBank's $1T Arizona AI proposal and Trump's AI push, fuel ETF opportunities across AI, tech and uranium sectors.	https://finance.yahoo.com/news/etfs-watch-softbank-eyes-1t-130200021.html?.tsrc=rss
2025-06-15	Google	0.068	Aaron Benanav, Beyond Capitalism—1, NLR 153, May–June 2025 - New Left Review		https://news.google.com/rss/articles/CBMiiAFBVV95cUxOVFJ1WWp5b2o5V3doejltTWppakhMRDhqM2wtR3p1amF1VncxaVZWS2pxVjItTUtCQmV5UHNPTzRESWhDaUhQNEZ6QXBIWEU1WEpCWlZqVTcwMlhQVkU5Q1h6Y1FldWJDaXYtUkVlYkFuemRnNkFaVFdWXzF3UEQ0UUo5ZlZLQjVZ?oc=5
2025-06-13	Google	-0.2	NLR Police investigating after dead body found on Faulkner Lake Road - KATV		https://news.google.com/rss/articles/CBMiwwFBVV95cUxORmVNQnBsdEcxZEpkb3dIUVc0Z0tEaU03OXg3cE9LQkpQbk1VdmdHOFJKZmpJdkpCa0RqS3M3NHk2TUI4MlkteUMxT1ZaT2JnTzgzdFJESmsxLXNfUEZKaWVkYXlnWVEyS0tBb2tpVmQ1b195aG4xTmlBbXJzUkNjczUwTVNXRmgwenVUVXRJSEI1SWk5cWRVRzhJU2lCdld0Skk5QWxOMlpEejFwZ1NzZXEybS1iOHhrSXdPeFBCZWxRZm8?oc=5
2025-06-09	Google	0.1	A head-to-head NLR gene pair from wild emmer confers stripe rust resistance in wheat - Nature		https://news.google.com/rss/articles/CBMiX0FVX3lxTE1EcUZncjdPallhcXJqMDJwOUtNOVRFQ1JjcDJBeDQ1SkIzOEJzQUROb3hYalNBMmNNdE9sRmxxa3ppN0U1cjVVeDkxQm9rMnpJYmhOQm9NalZqZ25MVHgw?oc=5
2025-06-09	Google	0.05	An atypical NLR pair TdCNL1 TdCNL5 from wild emmer confers powdery mildew resistance in wheat - Nature		https://news.google.com/rss/articles/CBMiX0FVX3lxTFBJZ0JxYnNKWWk0X2hkeXgtNnJpdF9IOERaa1N5bXhJVU4wZlBwVXN2RVpZZWF5SlFVUFNrN0thY2RYNlRqaTVpaENzRWZkZUJJVFN2R0hpSHlGUUdWQXRZ?oc=5
2025-06-09	Google	0.0	Conveyor Technology Cuts Ribbon on NLR Expansion - Arkansas Money & Politics		https://news.google.com/rss/articles/CBMic0FVX3lxTE0xQ1VhUDVhZkQzY1lraWdUc2xobFVHVnNtRDNlSXFpVnFFTWFmMWtXcGs5cHA4Z2d0Mi1CUFpqZnJlTkNnVzVzejVzRDNiNVQtb0NJYTNNN1JnUzNXMHBqLWxIdzlyX3hHdkl0N2llUU1nTjg?oc=5
2025-06-05	Google	-0.6	NLR: It's Not Just About Artificial Intelligence - Seeking Alpha		https://news.google.com/rss/articles/CBMikAFBVV95cUxQZkxyWndEdjZBMXppLWtOcVV4YzVoN0VveXhBejlZMzU5UDM0V2xibTZSU1F4R0xZeEQzZ01aLVo1OWVVbk5faU9KcjlWandsT0dLSWp0cW9JYWUzdGdJeXQ1aEtLc05KQ0draWN2c00wWDJYM2k0NU5COGh1Mkp2OGZ1aWFtVkRRc3NGSVd1cHI?oc=5
2025-06-03	Google	0.0	The Pizza Pub now open in NLR Park Hill - Arkansas Times		https://news.google.com/rss/articles/CBMijAFBVV95cUxNM3Z5YUgteUdxalViMU9QdXdKVGpZV1pjaGRrWFNyak83NDFYWUxVN3BmVzJxSDBoazA2MUJyb25IMnY2Rk1YVGw0cmRCS3ZvR3VjYmJaMlZsXzV1ek0wbkdBR1labWtrel9MejBxamlIUkRUWnJLNjdVdTNQNXpPM2JfWEJBUGFGbXMyTQ?oc=5
2025-05-30	Google	0.0	DnaJ mediates phage sensing by the bacterial NLR-related protein bNACHT25 - University of Colorado Boulder		https://news.google.com/rss/articles/CBMivgFBVV95cUxPVTRua1JfbmNQQ2FUeEJBM3k3TFFSQXA5dEtZRUxnaHgzblY3ZVNIbmI3TVJfQVhSaEk1VXFGU25vMEdWY0hfVnhBSlZwUWgzeVk4dTBINVFESldxTmd2N2RmbEgzYnpzLThRdFh6Qk4tME1aZzlfMzJIM2sxYXp1Y3J0U2IySFRvWTJhSlBCXzI2NGR1ekpwSUJlREZUMnFCSHdRbWRnejZ3WVVsVFFLTVV5a09NRzhZdVZ6V0tR?oc=5
2025-05-13	Google	-0.017	North Little Rock voters approve millage for new middle school construction - Arkansas Times		https://news.google.com/rss/articles/CBMitwFBVV95cUxQNVh1emsyaDNXX1B0TWxDU0xPSDJHb2dNNXVfZjZhYjJjNmM5QldVTFVZQldEdjFTV21ESE93S0U2b2twU1E0WlVsWTdpZ212dkJsd3FNMnFxX0RieFBoalN1bVFwbDMzR2tNeUNnLWdMU1dSVThPMXVRV0NnZF9fcFNfMk1nRzRIQkY5Y09tR3BscUFLNkFONXQ1Nll2ZUpLVjBzVzl6OXU5eWF4RmxjcVpPcEU3NFU?oc=5
2025-05-12	Google	0.0	Taziki’s closes NLR McCain Mall location, owners plan to reopen in spot nearby - Arkansas Times		https://news.google.com/rss/articles/CBMivgFBVV95cUxPcGNlOHJOcURHLUw0VVJKbkZVS3ZNY1BSSDNoWXJ5Vnp2MkZNOVpWVWJLc0gxWGgxLVJaaEJGYlp0MW5qSWlneWt0OXpIZ1BmaXl0ZXZBVm1zM2N1TDhuT2RaNkhJM1M5a2J5WGdPNVlfVU9ONkpaZmtPeGJTb256Vi1TM2hIY2RXOExNUW5rU3hMYkVRbkhyR0duXzlLR2FfMzR1b2k0MG0xTGpycmVPS0xCMDMyVkplUEtFbHNR?oc=5
2025-05-09	Google	0.068	State funds at stake in NLR’s Tuesday vote on millage for new middle school - Arkansas Times		https://news.google.com/rss/articles/CBMivAFBVV95cUxQS1YydkJJeVAxRy1NTnBGWkhnRV9td2FHY0VnSTVSUDNCU0Q3ZkFvdGc4T3YyZmt0WndwX3Y5MWdHOW04YU8wLVh2YTVZVG5QNjNIR0VZeVJ3aWhqMS1xeTl6VU1HSTB3d1hHejFaeUFZYVkwZFlvN1RGZGZKYTBVOGdBcWxvb09IXzkwMDFhZTFLRWZ4ODl4RERmNkJKQkJWNWhGQ09VbEJOME9PVERDZzl5MUtlWmxSb3dLbg?oc=5
2025-04-30	Google	0.0	NREL-Led Research Effort Adds Salt, Boosts Performance of Perovskites - National Laboratory of the Rockies (NLR) (.gov)		https://news.google.com/rss/articles/CBMiogFBVV95cUxPeXBHTmo0dk5hUHJNZ0JrZTFYX1dYM1MyeEtxY3IzdkZzdklrNWlXZmhYYjVhdi1OWnI4Rlk0ZEx2QlR3UDNxc3BFeUxMNFR5WkNzMFNycjdOY1V0VEJvYW5DLVhDNGxOenQ1VlJ4UmZmMHZSMEdFcWNOYWpCWkd0U2I3ZEdqQ21aQ2NjVEpfMW5KM0Y0Q3ZGdkpRcjdxNlg0RlE?oc=5
2025-04-27	Google	0.0	NLR: Nuclear Stocks Snap Back, But The Damage Has Been Done - Seeking Alpha		https://news.google.com/rss/articles/CBMikwFBVV95cUxQd1B1Q20ySTdoNjUzd09oanFac2lEUkRkVGd0R1Z1OGZlelhQZmFuOVI0RVgyRHoyVVVhUWF6cEs4UWNweUlua2dBbW0xMFZjYlFxa1NZSjFYUXVxOFlsTmo5TTk0dTRpblNfemNrQzFrTVBjbl9rV0gtWGQyTGpHYlRiTUttX2M1OFhYU3pGZWYwZjQ?oc=5
2025-04-03	Google	0.068	Fabian Scheidler, Preventing Peace — Sidecar - New Left Review		https://news.google.com/rss/articles/CBMiZ0FVX3lxTFBkenhqMmIzVmdvT2VISmFuMDdPU1BCbEtJcDFqeXEtNXF3N2U5ZUliVTltOXpGQzRGTXRBZjRTUGt0MUtfdkkwdWk4TWhUellsZnd5anFKdXlSbWRKZ2s4U0VzcTN4enM?oc=5
2025-03-27	Google	0.0	A wheat tandem kinase activates an NLR to trigger immunity - Science | AAAS		https://news.google.com/rss/articles/CBMiYEFVX3lxTE1lUkJ2aHhWamd2Z1VlYnZBNnp6QXBoZFVyN0lSOXc0emZtVlBFV3NDSjlleWlpVU5WeWVnUTY2Y21RZS1LN2NFMFcxVUoyVndZNlZpd1lWQllzenE1cVFsVg?oc=5
2025-03-27	Google	0.0	A wheat tandem kinase and NLR pair confers resistance to multiple fungal pathogens - Science | AAAS		https://news.google.com/rss/articles/CBMiYEFVX3lxTE5qYnJpYk5ma0c2NmlTYno3LXlXZm1hMG8tQ0pPcW5Rc292ejhoS3JpcU1JUG1xeXpRcWJjRE8xTU15b1BlVDQ0X21mdjhZZkhZYnI4TGhPQ1JlcnZPWjF5NQ?oc=5
2025-03-21	Google	-0.3	A cell wall-associated kinase phosphorylates NLR immune receptor to negatively regulate resistosome formation - Nature		https://news.google.com/rss/articles/CBMiX0FVX3lxTE5nZG85OHFRYmE1TGVXcnhBdjlHREx2MEtseF9XYVphOFNVb0lUVThOLWxYZGlGdWprRHBJQXhNb3lHaEJyVEpVM0tqMGM0NlpyWHdtSWNwWmVwZ1AxV3Jn?oc=5
