Date	Source	Sentiment	Headline	Summary	URL
2026-03-05	Google	0.15	NLR Names Ava Community Energy One of the Top Green Power Providers in the U.S. - California Community Choice Association		https://news.google.com/rss/articles/CBMioAFBVV95cUxORkdpUHluQVRqblYwTUsyWWY4TExrV1FmbUVJT01jaFR2YUo3LTRVa1NIeWRqOV9rMXpUQlRHby1KSko4Z21rNm50OGNRbUtGVmhsRUNlejBMQVBVU19ueW5VQVJwNnRnandoMjU2a3YwaHRpWnhIVmczdDg2U0Z3NEs1VlljdW5PcWJJWk55QXFjTm5IcG9HTGZJc18wc2pX?oc=5
2026-03-05	Google	0.0	Arrested NLR man says he shot his brother - The Arkansas Democrat-Gazette		https://news.google.com/rss/articles/CBMilAFBVV95cUxOd3VHNDZ4ODVzenZBeVk5Xy1QRVYtSVF4ZTJWbk5FTmhGLUU4eUpZU3lGY2FmdkhoS3VhaHVzZDU5M2ZXRWY1UE1RRU1fd1RobUhwUndpaTA5aWc4dGZfcGZNdHFDTWhXOXFHVENQeDZmUFdVQl9UaU5XLTIxVnAtVUJCc3k0djZHSUxuci1tTDhDd1lj?oc=5
2026-03-04	Google	0.4	Researchers Use Light To Tune Electronic Properties in Ultrathin Materials - National Laboratory of the Rockies (NLR) (.gov)		https://news.google.com/rss/articles/CBMiuwFBVV95cUxPVlJJTmk0dHZudVFxOEU5N3RlcDRSSUVQa1JZbVJWTlZzNlpZZ29tcy1WaktDNU5fQ0FhVWFuSDlqZXYyWUZBSnJYYTFESElBcnBQemZmR2ZBXzJQMkRDc1pHSTd4MkRXMnJOeGRjVXdZLXpXT0p1YTk4djVQbVRORmV4NmxfaGhmOGMwZ0V2QmVxREFkU0xlWnBtOTgxblVraEhNN25QSlpqMkV3T1RheHQxVXZaNmpyQkZN?oc=5
2026-03-04	Google	0.35	Gates-backed TerraPower wins U.S. approval to build advanced nuclear reactor (NLR:NYSEARCA) - Seeking Alpha		https://news.google.com/rss/articles/CBMiswFBVV95cUxQbENFYUlYZ0o1MW9UU0lNZ0prd1E4SU14RnZwWXdZTkYzVEQzSUtXZElGeE9iODVWUC1tOW8weW5VM2lDc2lfanlOX2RzWXRxWG5JSnFRa01mcmgxTEV5NXFPUFJOLVBqc05DRTE0R2hlSl9VZjVpWFY5NHdNdzdyUlNRbjNxSUJXSTR3b3VZV3h5Z05jeFZZcy1HWWU3Y18tLU5iWWtxUDg0QVhLb1VETlZfaw?oc=5
2026-03-04	Google	-0.188	Westbound I-40 lanes are blocked in North Little Rock after 18-wheeler crash - KARK		https://news.google.com/rss/articles/CBMitAFBVV95cUxQNmZFdnotc2NLbEV0UXktdTBhUlBSTGp3eU5QYVhESzBoblIwdjdPMUp3S0ZXcVZFQmt6bnYzb3JMYktib1BiZlFseUN4UXdJOEJVdUgwbGxnLURvSE9BaWNYX2E3Q2JmcXdZa2o0N2xWWWw1dVhKbXJlYmh1TFc1N3FiOURYSWVXMWpJb09PUEFTRDFRSy1qUDFCWXJzTlJCNXJiYm5fLWRaaHhYTWJZRlU1c3E?oc=5
2026-03-03	Google	0.0	REopt Expands Options To Help Energy Managers Cut Costs - National Laboratory of the Rockies (NLR) (.gov)		https://news.google.com/rss/articles/CBMiogFBVV95cUxQOG00V0Vkc1hDQjFLMFlZR2JqRGl0TGV3eU03UmhYZERyS0YyNGd6ejVmWUJYaDRoU1pnaFAwVVJlSnF0Y180R2p4TlN3THZycXEydUFaSzBLTFZnN0tQY19ZTHowRE8tUTctbjlRTUtJUkZyeFk5bzJJQzRNOVg3aE5FQXBmZThoVWFNZmt3dGJxS2M0STNXRzBReVItcVgwaXc?oc=5
2026-03-03	Google	0.0	Rising Above the Tide: Strategic Energy Planning on Tangier Island - National Laboratory of the Rockies (NLR) (.gov)		https://news.google.com/rss/articles/CBMisAFBVV95cUxQUG9sSU13cXY3YllWbC1pYy02VTExTXdDS1FFRGxrcEExMzVvUEtVMXJqTl9qTk5zN2NCUXJrbzdoaGNDSkhtZWlhNTYwYTdFeVBPaENtUGdNYWhhdzdBVHQwdGZZSmpGNGl2d3kwVFBZN0FQZmU4bDF6MzZXODBBMWF2VFF6cmlQYk1YcVFveGJKaks2bjB0SFhaUFFGVlZLRmxqdlhBUXBEel9KNGJnbg?oc=5
2026-03-03	Google	-0.188	North Little Rock police investigating Tuesday morning homicide - The Arkansas Democrat-Gazette		https://news.google.com/rss/articles/CBMimwFBVV95cUxNVHdrMXpsZnllSXczUFdEMVg3RVEzOXJpbk91YTQ5RmZsc1paU2JQYVZkYlZKMGp5N1ZhZkxDUm5sWXEzaDI1V05MbTEwYkNKWldpRHB0VWhteXNRanFleEthX3N1VGVwVnB3TXZZN2ppM1dWRDFYVFJuaVlFend1RDkxQXNfNTd1a29JUUcxaVVXdFhVbnNSWXcwOA?oc=5
2026-03-03	Google	-0.194	UPDATE: North Little Rock man found dead in apartment, brother arrested - KARK		https://news.google.com/rss/articles/CBMiigFBVV95cUxQd3RYMTBRTkFLdHFwYV9VSUZaWmd2Q2ZMMlVXbG84M2tBRWh5VVFITEFMNzB3T1k4ZzNpYlhNZFpvUXI5QTdtRmRNVVV0M1l6ZVF2blFibWNwanRzMnJWTUNmbHdHVHJKVHFwOG1uUWNZeWxJbUtUaEFKY3d4ZmJ5N21ZcERac1dFRXc?oc=5
2026-03-03	Google	-0.229	Suspect in custody after deadly shooting at North Little Rock apartment complex - THV11		https://news.google.com/rss/articles/CBMi1wFBVV95cUxOQXQ1R2p0MWFpbHIzdWhqTUtuQUJXS3d4WEpIQ1lzaXdXUTdFd3d2VTNtMUU2RHV1eU5meTBiQ194MDIzbzBDU3ZKOTVWRjRoVF9oZjU5anBYS3VTOFFLTUtnOWVZbHZhZTR6bUlDQkZSc2M1N1M5YUF4bU5nMmt5YUhndW95UWxKRzV4OVBJQVhETkE3cVZHQWh2cHRUcWZhMDBpMFhzTWNJVE1GQktkZkNOZ0Q2TUlPeFpCTHkzQU5nbXJZekhfZ0ZhLUttZ1RKT1UtSkFzdw?oc=5
2026-02-26	Google	0.0	NLR: Why The Outlook For 2026 Just Improved (NYSEARCA:NLR) - Seeking Alpha		https://news.google.com/rss/articles/CBMiiwFBVV95cUxORHVUYVVqVWYzRG5zdXNzckg4MXRJMmxVWVFnM0dsYVNPYVRCSVBSOWRVdExDc3R4WHppd3hkVHNxVVdvS1FReVl4Z09mdHJMSGlxQWtXX0pkZmptd1hTNUROM3J6LXd1dnpDa09IY0hnVDJXcnFFOURuR3JQX0RVbDRxOXViMEhneTAw?oc=5
2026-02-20	Google	0.0	Juicy update on the NLR restaurant scene - Arkansas Times		https://news.google.com/rss/articles/CBMikwFBVV95cUxQWDBGUnJEbFBTQXlkejhHb0lBYkZDYkhKOWZEY2wyUzl5N1RQbUhSdXVRN0JUdTYtRVN3UlJyYWJVNVZzcVItREpBdFRBRWs5RFlWZGNEYXkyTWs2Tzkwdi1CcnRJMUxDLTVQQnhrY3FGeHRFM29aYzZmZ0xZcFBsYVNjMXZ0bXpXYVBBSzAtSDZKNm8?oc=5
2026-02-18	Google	-0.188	North Little Rock candidates face off as residents cast votes for District 70 representative - THV11		https://news.google.com/rss/articles/CBMi9AFBVV95cUxQd05jb1ZkQzFxamxrc01LM3l0RlkxS0FHZk0tT1d2eTJzRElpd2hXZXhKOGxsbk5KcjFNTDZJQm81ZTlCbWZzRV9FWFlLYS1SNkx6bzNzSWxqVDdaY3RQVW83aUcxdVdBMjVnd1V2bGZNcXZ0enF5V3JFV205T205U3k5Q3RBS1RNMWdjSUhTMlkxNlhEeHVmaHFRX3ZyMW9fWUFnbXZ1RXRQd2VGZldRbzB2UlE4SWRPUGN4Uk1OZzFTaDNvSmVHOTlWcmhHamNXMmtGM0ZuWHVhV0RPUTNQNFpoam1jSzEtZTEwOFpqdEdVcUx3?oc=5
2026-02-16	Google	0.0	NLR: A Proxy For Nuclear Theme Investing (NYSEARCA:NLR) - Seeking Alpha		https://news.google.com/rss/articles/CBMihwFBVV95cUxQNjNwREgzUkhtaTVZSUVnbHVQUEZrSE5UMW5zUUNWdzVtQUFVUF9VN3BHUF9WVUhLYTc2ejJSbkxSWjNaMTl0UUZvM3h3TFlZN1hUNkZnQ3BkN1VwOXJkckEtT0tEZ3BKQWNNLTZQOXdCVkZSdWg2Z3d0VUZLTGhhUDU3MTl1d3c?oc=5
2026-02-13	Google	-0.044	Police at scene of incident near North Little Rock gas station | What we know - thv11.com		https://news.google.com/rss/articles/CBMiywFBVV95cUxNcERjZWpXWnliSU42TDVzdkNTSjBDSGMzWmVHUU04c3dJd2ctNjZmaGJLUjJlU2w5NmxzOExtQXRhRnpxXzdDcWdObC1fcGVyRWFlYVZsdU8wbkNqSld0NTZTMXBmejhqd2theTVXczhtRTVFXzd1MmVmeFlfa2VhRzZaQjQyVDlnTWkzN0JNSFJ5dUtyUktDa05uZkt5SVVpSkFtR3pYNmMwc2pWQmdmTHpFTkUzSThpNWlkNjdGQkZJaHlQUkRvUU5jRQ?oc=5
2026-02-13	Google	-0.188	Fastbreak Friday Night (02/13/2026): Jonesboro boys beat North Little Rock, JHS Girls lose to NLR - K8 News | Jonesboro, Arkansas		https://news.google.com/rss/articles/CBMixwFBVV95cUxPM0x1ekowUEUxUElJb2tTSnkxWEFHS3ZJVFpIamF5TjZmVmxiRXlhRkUwQ3p2NWZCNVpYVlRjX1U3VWhlajFySlkxWTM5WTU3dWVYeUF6TWhiWXJwV2ZNbFVXUUFfaDFVTC1YaWZ0eFFaWjlJbTFERVVhekdPcG0tYlpPWVdQYXd5RkJfUmJmVUtQOWlUV0t6YnJ0UkJFQzBFbV8takxjSTBSblF4eGs1S1ZQYVUzdGxLOW9qbUxKMXY4YnhiN3Jz?oc=5
2026-02-10	Google	-0.2	Colorado's Congressional leaders decry another round of layoffs at NLR - CBS News		https://news.google.com/rss/articles/CBMirgFBVV95cUxNV1RFd0M2dXc3enVvN3BpVDB1eUVCU3Q3OG8zNy0wWENidDB4Zi1BLXRZUDVCbFRnM2Z4MUxPSU5FbDZ1WmZ0WmpwYzVPZENyS3B1cS1WVU5RNFRsM0hlWEJzOHlOc00zZnlCVVFYMmFQUmI0UjA3a0xCWUhwMmczSTBzWENQbUlheDNSUFZvWDVTcjJ0R2JMaS1DcDVyaWVnQ2dWbVJXTVRNTlg4Y3c?oc=5
2026-02-04	Google	0.156	Lawsuit accuses North Little Rock pastor, church of sexual assault over 20 year span - THV11		https://news.google.com/rss/articles/CBMi2wFBVV95cUxQUE1jZDBmN3BVbTdUQzI5MnJ5WWlIaG1uWnVEZlBmTzBmTURybmZhM3g4NzRRZkVvczJwSkYwV20tOGpCb2luQmR4RkdrV2Z3WWM5WFZGRXdTdURVN1pNZVVFRmJIbk9scVJJWktZRWhVaFgxN2EzQ2NSRjZXU0gyX3ZmdXhDeXh6UDRVNWFaa0puVW5UN2NXNWppdTVzMktGUnZHTnNZRUNjVHcyTDItSVN0UDVBbVp6allFV3Vxb1Q5aGlfSE52RVRtMDlPcmFOcmRONU14bHV6TmM?oc=5
2026-01-30	Google	0.0	West Coast Ports Strategy Study - National Laboratory of the Rockies (NLR) (.gov)		https://news.google.com/rss/articles/CBMiU0FVX3lxTE1STFpWc2lHX2dfdTJUOHRwSlNORnZaRVgzdmZtQjZkV0JTYU1JbFVtelpkZE5Pc3I1dlJJZjRQYzhnN01fUWVCV2RFTmFYUElsZDJV?oc=5
2026-01-23	Google	0.0	Find a Job - National Laboratory of the Rockies (NLR) (.gov)		https://news.google.com/rss/articles/CBMiTEFVX3lxTFBoVC1nRGY0M0VuV1E4MGExUThZemdNOWhlRjBrZkNaQ1pzX0NCY3NZUUJRdWhIelFJbEh0WVZJQmJiZVdObDZIeWRuTWs?oc=5
2026-01-22	Google	0.0	reV: The Renewable Energy Potential Model - National Laboratory of the Rockies (NLR) (.gov)		https://news.google.com/rss/articles/CBMiX0FVX3lxTE82dTVJQzFzVFJGWVFPUVlwZGRnSzBSemlCTVNxRG9FbWVVcXo0Sk5jM3F3WDBUQUgwUnNXYzlzai1NXy10dU53VHo2R00zVkRhQzBCNnFVUVhBeTdUa2x3?oc=5
2026-01-21	Yahoo	0.033	Oklo Stock Upgraded to Buy. Meta Nuclear Deal Is a ‘Meaningful Step Forward.’	Oklo’s agreement with Meta Platforms to power its data centers is “one of a few firm, binding partnerships today,” says BofA Securities.	https://finance.yahoo.com/m/712d5898-2ca8-3297-99f8-2509bdaa1b8a/oklo-stock-upgraded-to-buy..html?.tsrc=rss
2026-01-21	Yahoo	-0.25	NLR ETF Climbs 75% in One Year as Uranium Miners Ride $100 Per Pound Breakout	The VanEck Uranium and Nuclear ETF has surged 75% over the past year, climbing from around $84 in January 2025 to $146.60 today. With $3.6 billion in assets, this fund concentrates on uranium miners and nuclear utilities, betting that renewed interest in carbon-free baseload power will translate into sustained demand for nuclear fuel and infrastructure. ... NLR ETF Climbs 75% in One Year as Uranium Miners Ride $100 Per Pound Breakout	https://247wallst.com/investing/2026/01/21/nlr-etf-climbs-75-in-one-year-as-uranium-miners-ride-100-per-pound-breakout/?.tsrc=rss
2026-01-20	Google	-0.1	NLR Advances Battery-Free Power for Remote Maritime Sensors and Navigation Aids - National Laboratory of the Rockies (NLR) (.gov)		https://news.google.com/rss/articles/CBMitwFBVV95cUxOODh1bVNPbFMxcER4cTNzWmhCT09KT0dtSnI0dGlmbkxNZmIzcDhtdGxnV1FLSWpEbzdwZWtscUhsbmlRVHRxeXg3YlpJMUxuMWxIT3hJcjZIUXFtWHR3dDJCV2RMTFgyM3hIOVpNVVBaWk1IWUo1dzVqNkl5M0R3TjlhTk1oS2RVcWZMbnpsLWtTcXJrNWJlbGloMHRwTE9sV0Z3OUxsaUtCeTdJaEVwNXhzR1pjbDQ?oc=5
2026-01-19	Google	-0.1	Mother killed in 2018 NLR shooting still unsolved; police ask public for help - KATV		https://news.google.com/rss/articles/CBMipwFBVV95cUxQN1l6bVJlcmZXOFEtRTVPVHRHcXo1ZWtSUGxRcnVMY0JQYXVHYUZWaFFVOTRrRTFuXzJTMGxaZXFCLXB3WUVwTXVTU2IyR1N3MG5jc3hXWWNBMC1PVkE1aWxqdGIwUU1QTEp5T0VuN3pDS0Fyd0t5ZW02dVgyZ0FITGlNWVQ2QmZoZFo0NXFUZDJzdU83NlBsbVl1YzNyQ29nWkRzN0dWUQ?oc=5
2026-01-16	Google	0.0	NLR report chronicles US geothermal market growth trends from 2021 to 2025 - ThinkGeoEnergy		https://news.google.com/rss/articles/CBMiqgFBVV95cUxOWE5MNUx2SEF5SXQ2OEVmQ1UydEpkT2w3ZWNfYlRMVUtBTlpEaFRmNXRhNEtiV2lEZFpaaFdSXzNKUzRZSzZmQk55UEpxWnhyQjR3OVRMYVlkWGhwVk9vTjlyb2dvd0phMW1HQ1l3ZkstTHRvdzk5NzBqVGJLLTZmajVuTkFzUjcxVTRCUjBzaVRiVll5LUlXLVBKblJESVIzRl9fWUpUb0FfZ9IBqgFBVV95cUxOWE5MNUx2SEF5SXQ2OEVmQ1UydEpkT2w3ZWNfYlRMVUtBTlpEaFRmNXRhNEtiV2lEZFpaaFdSXzNKUzRZSzZmQk55UEpxWnhyQjR3OVRMYVlkWGhwVk9vTjlyb2dvd0phMW1HQ1l3ZkstTHRvdzk5NzBqVGJLLTZmajVuTkFzUjcxVTRCUjBzaVRiVll5LUlXLVBKblJESVIzRl9fWUpUb0FfZw?oc=5
2026-01-15	Google	0.4	PRECISE: PREconfiguring and Controlling Inverter SEt-points - National Laboratory of the Rockies (NLR) (.gov)		https://news.google.com/rss/articles/CBMiTkFVX3lxTE1YUk9TNXByOEc4LXRzWUFKdDNfdkpfZmdQY2ZxaEhEdkk5czlVcW5wMU02VkExWVgzV1NSSWVYLVlESWZDUjJiWlVZSVdUZw?oc=5
2026-01-15	Yahoo	0.3	ETFs Primed to Benefit From America's $2.7 Billion Nuclear Push	The DOE's $2.7 billion push to build U.S. uranium enrichment capacity could fuel a nuclear revival - and make ETFs like URA compelling plays.	https://finance.yahoo.com/news/etfs-primed-benefit-americas-2-143900753.html?.tsrc=rss
2026-01-15	Google	-0.094	Police investigate North Little Rock shooting that left three men injured - thv11.com		https://news.google.com/rss/articles/CBMizgFBVV95cUxQU2lXQjQybmlDYWg4Qm5qOC1ERTVEdERULXNuV2Jyd3pqdFZFalNBeEV4T3dzYzB5WERKUzRXNVZEejlvV1RyQ2xGU1hTQ2N0aV9UTXY0aHJkZERCTmZUWXRUM3ZldGsyTmJMQXA1TEY5WEFrbUlhZEc5WWRjdHRKSmZtWGlJMHU0S3FORlhxdmRJaDhUUXd4dHIwa3Jxcm1qTzRBM3NraXQ4VnNveEFxdG1MWkl1dWVqNGIwSFVtUG5TajBTZVVhN3QwTHF5QQ?oc=5
2026-01-15	Google	-0.188	North Little Rock Police investigating after three people shot, no fatalities - KATV		https://news.google.com/rss/articles/CBMipwFBVV95cUxPdmxFWHlzRGRkaXhGLWQ0THdGX182V1NJREpvbHRJYkw0TmltZGZBOWdoTVN1SDdRN0FDbTJ4QmwzdVMtXzExNEZVUEx1YWZUUkx2XzdIWEJzcHpXZzQxVUVIS2FQaElKeVZEejYzOXl5ZlBRUkRJc3NFMWJGMEhVcTN0anJrTnJwRTNNaldvR2pKSmZIcWVPams0SmVkbHFlR3FCOExoOA?oc=5
2026-01-14	Google	0.0	NLR: This Is Why Uranium Prices Can Soar Like Gold And Silver - Seeking Alpha		https://news.google.com/rss/articles/CBMiowFBVV95cUxNUmdJTXBrSnhVYVk3M1FUdGVnbmxTNFB4dC1VckJLTy0xaUZRTjlkcWxQMUxuMUI1bDNEUklXSm9oc3JZUXhCZWdpWEl3OVdqOWZ0ekR0c2k4emFXTjFpaGItRmh6ZEFmRU5SdmFEX21XMmdNcnVyY3FPNXl3TWVSTjh5dU5TOGFsRE9keHdqYU1fdllUMTVqWXFNRWxNU05MakFB?oc=5
2026-01-14	Google	-0.188	North Little Rock police investigating reported shooting - KARK		https://news.google.com/rss/articles/CBMimgFBVV95cUxNLWs5bnBHQlMxNjJTaHlaQVVRNjE5TlV4Umh4LWp3elozNjZpVlhmSnRrRjJpRTRCS1l2NjF6aDZlRnV0VVJSMzdwUUtIaEo2c1lqWmF5TlBrdG5uU1phMEVSYTEwUGZILUpLUzQwLVVHNE1zVGRsM3Z6N3B2UGZYaXFUS01XOHZ5M09jaEJMRVNHaTkxbUN2eGFn?oc=5
2026-01-07	Google	0.0	Uranium 2026: Why I’m Switching ETFs, From URA To NLR (NYSEARCA:NLR) - Seeking Alpha		https://news.google.com/rss/articles/CBMilgFBVV95cUxOQjlrbmVqcVB5VmM1eHA4aklETGhrNkxIUWxldm51TVNPNFhEemNNOVZnRVl3MWVBNjhiWnJWMEFuX0RQbmg5TnNYYnZ4QU9ZUUFKRGFBRTFINzlxOGdZenlUdzVtbVVBNVotMl9aYUJ1TmNiVnZxaTdVckREcDBVLXVXYks5MVF2eEV0WU0zcFhJOC1aLXc?oc=5
2026-01-06	Google	0.068	Tariq Ali, Abduction in Caracas — Sidecar - New Left Review		https://news.google.com/rss/articles/CBMibEFVX3lxTFBPRGZDRU16MEpfaDd5OHlSTlZMVzZJS1lMZEg4M0lpMXFqTUFOeUthMDBUcDV6MGtJVl96U2p0ZkdjSk1PTVdXUUt6M0ZseDY3RVRMM29oQXlLV3hkQnExcHNBS3QwcC1YdFFLNg?oc=5
2026-01-06	Google	-0.188	Investigation underway after suspect fatally shot in North Little Rock - thv11.com		https://news.google.com/rss/articles/CBMiyAFBVV95cUxOc1BIbUhQNGhuMzhsbUh2R3NIaEZZR3BnSzhfNTl4bmtJVzBRY0JBUEFFWDRVcDN5YWg3TnB6NnVsRHBVc05ZX2dWOUQtYk01YmREdTU0bWF0aEx4SlBHNUlNT011NlF4QV9vQV9QV3IwMUpUS3h4NW1sUUJyTks1c3BES3NQdks2eVFsXzBOS0pxRHZmYjdEeC03bG1tekxMYmh3Qzc4YUtRb2VydGdXTlNSNWhzT1ZNYzlOaktqS3NLcl9oaEQ1Qg?oc=5
2026-01-06	Google	-0.188	North Little Rock Police investigating after officer-involved shooting in Park Hill area - KATV		https://news.google.com/rss/articles/CBMitwFBVV95cUxQWHEwXzZPZXdsOGVsRGFqZ0NVcXNTc0tNLW82SEV4eElmZV9hS0RNMi1vMDVzaDlSdVFOVi0wMkk3X0E4MWQydldVZUk0Z0M2V0tWc2tnemZKTURXOVNjTm9CNmRqTEVlZVRjNVk3dzVKclUyN3FFTDk4ZGk1Qmp5VGdXbUVQTXdxTXYyOEZJdzc4Z242R2hmR2Y3Z1dSZHJqZzBmbkF0dFNPb2lmQXplbW9wLWViTDA?oc=5
2026-01-06	Google	-0.194	North Little Rock neighbors react after man killed in officer-involved shooting - KARK		https://news.google.com/rss/articles/CBMiuAFBVV95cUxPVGJPenEzUkJqQmJfdHhLYWRpODNLWlYtbFdOVGdVbU1NbDl5ZTBsTVB4c2hDUDlKa1N0TVFhWjdfX0ZQNDcyd3VyOUhoMHFzVzdXdUh2cHROYnR5d3BldHQyUklKRnh0b3hlbmtNVWdNQXJjazF6SlUxWGJoaTBURzFWYlpGUDFzbE1WN2drNW1vX3haME91aW5UM19aWFJod3FRb2h2ako2T2xvQ2xndElURGNGSkRu?oc=5
2025-12-31	Yahoo	0.104	Advisors’ Favorite ETFs of 2025	ETFs, particularly strategies built around AI and crypto assets, saw massive growth among RIAs this past year.	https://www.thedailyupside.com/etf/industry-news-etf/advisors-favorite-etfs-of-2025/?.tsrc=rss
2025-12-29	Google	0.029	Grey Anderson, Primacy’s Calculus, NLR 156, November–December 2025 - New Left Review		https://news.google.com/rss/articles/CBMihgFBVV95cUxPN1VQeHhHekdlU284eVIxbXVCU25BMUtlejZBNy13aFIxRm5mSGlHMWxOZDFDRDd0dnBFdVJhV1MzRXdHa244Tk1DWmNxRnBxUFhvYTgwaGg5ZDlPc0dwYnZ4N1RxV0ZsU0x2Y2xLN2lQN2t2NnBEVGhZQ3k4R3MwN2NBTlpCdw?oc=5
2025-12-24	Google	0.25	Could American 'Spirited Self-Determination' Reshape Energy? - National Laboratory of the Rockies (NLR) (.gov)		https://news.google.com/rss/articles/CBMiowFBVV95cUxQSWE5Q1EteXdFdTlZVzVKZUNWNHlrQlRUS3N2eFNoUEpaaHU0dTZqLXFSSnhDMTNJekhlT1JwQUk0ejVZZ2JSdGNWeks3eUEwU0Jpc3NCbkQ0aXJJbTNpZUJYU2xLTURhUWJxVkUzaEllanhqdFkzM28zS3ZHMDROV3RiYXkzRHl1aE0tTEZnYUxvalgwZEZJVlExQnB2RzFSRmw4?oc=5
2025-12-18	Google	0.0	NLR: The Truth Is That The Nuclear Rally Appears To Be Over (NLR) - Seeking Alpha		https://news.google.com/rss/articles/CBMioAFBVV95cUxORU1xU3dHMWxKT0VFdjhPU1FOd09oMUtMVmVJSGx4V01NZV9DSEpjTV9Ic2VoRk1Dc1Nqdm1PalFjaE5QTXZIUnlYOTJSZVd5cDNoc2RLejVtYTJXM0xhVG5tdjdkcVlJMUNXMDQycjc4cjBLX2xFaEwwdlJ4VGVoZHhHRGZhV1Iwd3FTQmk0cUJILXZVdDI1bmo5Y1pBVVJY?oc=5
2025-12-18	Yahoo	-0.033	Trump Wants Nuclear Reactors Ready For America’s 250th Birthday	The administration is fast-tracking a nuclear revival to feed AI data centers and hit a patriotic deadline, raising uncomfortable questions about whether speed and safety can co-exist on the atomic level	https://app.moby.co/home/news/news-trump-wants-nuclear-reactors-ready-for-americas-250th-birthday?utm_source=yahoo_finance&utm_medium=rss&.tsrc=rss
2025-12-15	Google	0.0	NLR man sentenced to 120 consecutive years for double murder of two teenagers - KATV		https://news.google.com/rss/articles/CBMiuwJBVV95cUxNUW5MRW5JVENIY3cyNmlpcUJqTzYwSVVaaWFrOHdCOXhWU1kzS05BU0xfQS1oRDd4blNteE5iU2c1dDBPcE14bkhic1hlSmVpWkZJbEhHMzlGVGxPS2VkTFhhUHdfSGZYNWh2cmlOcHBkaHdtamx3OFN0ZTRvNnloRkI0NmsybG8yelpiSnkzX2gycEsyRWdrZk4yVzgtMnF5MnFkRTF1QlRlenpFRzBfZzZCb281NVNkdno1Z0dmOEktbmtrcnJyMGRaeTJLOGM5UFBIVVI1b0FNRW15SUt2Q09jb1NFSjZMZlZlaThVN1FHNE5uV293RUJsTEVqY0pSZG03ZWszbWlWSm03emdTZkhqMzlkTUNCMjRBWHF3NmVCSWQxSEtJSE91S3BzOUJDNDFjTTNRcENWX3c?oc=5
2025-12-15	Google	-0.219	North Little Rock brings holiday cheer with Elks Christmas Parade - KARK		https://news.google.com/rss/articles/CBMipgFBVV95cUxQUjk5VFZGYlp2M3k4bFRwc19fOXJNbk9TekdyN1YwSkVEMkVuckRNVzZsY2hVNElBQ084VzJWSndKeG1nbkFyM1ZtNS1rMklyVFI3U2szT1RNM1ZVY1E5d2psTjc1TGRKZVFScEpxZzhKclBPQVd3SXF1d0xzMVowQlMzeWN2NlNxYkttU0RiMl94ak8yWmtLLVdwS3EwRTg4OXJjcFVR?oc=5
2025-12-12	Google	-0.188	North Little Rock standoff ends with person in custody after evacuations, street closures - The Arkansas Democrat-Gazette		https://news.google.com/rss/articles/CBMimwFBVV95cUxQd3pTM2ZkZ0I0RU02QzVMaXR4Q2pWdjBZaThjcXVsQ3k4QVc0MjAyZXdTemozUmdWNDByaW1vSU12VFl2V0JXbzFhUWdoazVTUDhoRzJKX2JkcHJnTXBraGpDVDJnSThzUy1DSl9kY1hCTUNpOVhJcVdwVWpVdm5MU3BMSUdvQVFPS3FURzhSUEdHQWFrdWI1bVdlZw?oc=5
2025-12-12	Google	-0.188	Suspect arrested after barricading himself in North Little Rock home with a firearm - thv11.com		https://news.google.com/rss/articles/CBMi2wFBVV95cUxPQjR6Snh4RWJ4eUJKN0pPT2l2YkpNeWVCODZsSnBuX3RnUzdSSml3MTVRNEgzWDBPQ1kydGVrclhJSEhmTXJWRXkyWFRVeWtTZU80dDlHRl9vZTBEcUFILUVibUZJQzhGMXhJRTdoRmJPSl9YV21kb0lzel96ZnpPcUVoSThETDcyMmY2MmVqU1U3bnd4U0lzVVphbGk2aGJUZTVBTUx0c2JBWEtxM29GNlRTeElxWnByWlJNOUJZOHVGdGZUenluTGpuSjc5V2FLTG9MU1c2bkVOd3M?oc=5
2025-12-10	Google	0.0	She Wanted To Write Fantasy. Now, She Is Rewriting Recycling - National Laboratory of the Rockies (NLR) (.gov)		https://news.google.com/rss/articles/CBMipgFBVV95cUxOaFRFdk9nZmprSk0xZ2MxaW9EVWJwdVZDSlBzelFsdm81NTRiSW1RNUxja2lhSEVXMjFxTkU3bTh4ZDZpdUNWY0FiY1oxbFpMX2xOTWlOOUV6ME5XY1AzS3RhNk9mLWJ6Z1p5Z1lJbDZaeGR3NUhKZENCdVg2dko3Y1V4MFA2UmlOSVBHNHliS1UyWUoydXkyRTc5T292N2Nrb3VVVE13?oc=5
2025-12-10	Google	-0.094	North Little Rock Mayor Hartwick under investigation for 'interaction' at public event - The Arkansas Democrat-Gazette		https://news.google.com/rss/articles/CBMilgFBVV95cUxOcXJhSkltcEpvMDdCRVkzcXY3V1UzQkZHLXlrZG9EejhSOGMtbGxzZExCS2pTeXVaNGVJeEp6S3IwdXgtTUZnM0hGVzZFTW9iVzNYanE4T1M2dW54UkZSMzhkWlhmTzhibm5sYUZ3RHZ3a1A4Nlowa3d6bHpoSXpUaDlaTXJ3VGFVOERGZ0VyVll2bEpQU2c?oc=5
2025-12-10	Google	-0.133	Complaint filed against NLR Mayor Terry Hartwick for alleged interaction at public event - KATV		https://news.google.com/rss/articles/CBMirAFBVV95cUxNYktOWkpYT215Umx6VjBOWm1Jd3JtVUcwekpUN0lQYzNuSFdhY3NpcGJwTURiRnNYMTdSRi00TTBjTVNwOUZCX3RnM2RDOGg5LTgxT2lObGY3UlNhaC0yNmFUUzVhdGpVRUx1OUJULXpFU2p0NEROU3FwZHMxM0h6ZXR5UWZjZG8xSDhlZHpPZWI0M0ZtTnE3X2ZHekdnWW1zUUR2YktQWTZKclpp?oc=5
2025-12-10	Google	-0.196	Complaint filed against North Little Rock mayor for alleged interaction at event - thv11.com		https://news.google.com/rss/articles/CBMiywFBVV95cUxNeENKTG0xZ1Q5b1pNckQ2R0pnTWtiNjZ6SnVXbjJQREVRSG82R09zY1JWaTF1ZU9iWG9wY3NaU0dhb1JvZkhsdWFqTTJNc0JlNFJ6dFJjYVNYVTR4dmhHMlpMNmdvM1N4WmN1R2JrZGZES1ZBY1ktNkF5R0ZrUFhuUTdvZ3pENnJPQUhpZDhwbHRtQWxXbXRtbWZpNGdvUml6VXdWdTFGUEZELTladWl4RkFZMzlGdXowVTdIbEtfNDdaR285Q2h6UWowMA?oc=5
2025-12-06	Google	0.0	Holy Cross Energy Partnership - National Laboratory of the Rockies (NLR) (.gov)		https://news.google.com/rss/articles/CBMiYkFVX3lxTE1RSG9vNkdTb2VHdEtHR2FVelNGbDRqbFk2eGlhSzFlaENCS3Z4QXBwQ0hFN2Q2ZDR6YnU2Wm95WnRKcmI4b01VdW1yZU0zTXZJR2Z1VEJTY3B5a1JjbjQ4amh3?oc=5
2025-12-06	Google	0.0	PKelp Marine Energy Converter - National Laboratory of the Rockies (NLR) (.gov)		https://news.google.com/rss/articles/CBMiZ0FVX3lxTE5wWVlZeTM0aGVQWnZ3ZW5nN3Q2V3NhcHNpWVhMb2xzYUlfYS1VdWQ5dmtKN0tIbUZrZVlvODBjLVVhTHRYOUJMMm5JaXRnT2lPelpLNHduMkkySE1uLTNBTlkwZFBNbDg?oc=5
2025-12-05	Google	-0.188	MBB Preview: Arkansas vs Fresno State at North Little Rock - Arkansas Razorbacks		https://news.google.com/rss/articles/CBMikwFBVV95cUxNblREVGRBV3IzakR3SUlfVHBCelBMMnM3TDJTS2VnYlpNbFdHai1jVEJtMmhYYXZQNWg2QS1kRS1GclRMd0hEbzlzVm1Va1g0Q3BjZWNiV2k3UG45dGViaVhPeC1XbUlreW5hOHhjR2ZIZ0lYZXRJVFkxZm1aSllCMFJ5WXBqUnNUMndPVC1xN2k0Z3c?oc=5
2025-12-04	Google	0.0	Energy Security | Energy Systems Integration Facility - National Laboratory of the Rockies (NLR) (.gov)		https://news.google.com/rss/articles/CBMiU0FVX3lxTE5McTE0dWxhNTNRMWtnWXNTYUJadTZJV1R6UlYxaFdyWFVadkFUUEEyUm5IQlFPeGhPM1JvMXV5VTFPaDQ1aHNHX0lZYUtMTHlEMWFj?oc=5
2025-12-04	Google	-0.1	NLR Analysis Identifies Reservoir Thermal Energy Storage as a Solution for Data Center Cooling Needs - National Laboratory of the Rockies (NLR) (.gov)		https://news.google.com/rss/articles/CBMi3gFBVV95cUxPUk9zWi1lRUJndDJYRGNvdk5mdDdNZXNUT0xUSFl0UTAzOVVIWVY5TS1rclc0R3VsTU9TQjdjSktFSlhsRHZIXzc3SGc2M3VxbXA0QWVPaE5MVVh3SFEzZGtVcmFxSFhlcVZYNUVBZ3kzM3o3VEVadXNmQ2tqNzI0SG9fT0w0ekV2TlR4X1RVR3FfTEhfYXA1NVhiaV9LZld1RWZUVVpTR25PUjZ3TzRoWW9YbVRYZF92OVFJdmJINzNIdS1yYldibTd0dmpKMk1Ka2IwaF9MLUNSNW9nS2c?oc=5
2025-12-04	Google	-0.188	North Little Rock man is accused of firing into house - The Arkansas Democrat-Gazette		https://news.google.com/rss/articles/CBMinwFBVV95cUxOODhPZEtlM3Y5djBhUXpmekdpek9TM2xnTWNzTWYxekJlSkhDazJ6Z0Qyc0dXV1BLZ0RfLXVucDhNdkl4cURaRXE3T1NRenJlTnVOZGtmekFQWDg3NlVUQ1FnQm9LYWd4eGVTVTFRc2dyN2NraTIzWXdnTlI0T3Y1WVI4RXRuUnNsX1JkVjhRRzlrVzVYNlZQejB2TnhmMzg?oc=5
2025-12-03	Google	0.0	NLR Chamber Leads Coalition to Relaunch Innovation Hub - Arkansas Money & Politics		https://news.google.com/rss/articles/CBMic0FVX3lxTE9qbm42LUJGNnlaX3h0Y1BpQUI0emI0ak9FRkl5SC1YQTAxM3djTURWVGZXbERjZXVQVFo0WktNdC1qYk5aMFhqQkpDcnVHM2NZaXlQUzJYWFZkbXNyd1hZVVVWbU5sa1B6cXoxS00yalQ5WWM?oc=5
2025-12-02	Google	0.0	NLR Chamber of Commerce leads coalition to relaunch Innovation Hub - Arkansas Times		https://news.google.com/rss/articles/CBMisgFBVV95cUxQekdxWGRFN3lvMl92bVpYQ1h5WU00LUJ1cEtVRXBTUWRkdWxUaVp6WldBYTByWlhYN3JwdU5GcHhRVU1jZ0w1YkUyNWRpVU5WX2otRGhGcU1MREdWNkRmM05MVm9ZLWFaaC02MXcwVVdIQkF6b0ZTNDN2OW8wMlMtQURyN2tVSWhXZElOb1JLWjV4d3JJUnBWUUtFOFdtd0d4V0ZXOFVvcE1KbkV2ay1oZFVn?oc=5
2025-11-29	Google	0.0	Neutrophil-to-Lymphocyte Ratio (NLR): A Predictor of Microvascular Complications in Type 2 Diabetes Mellitus - Cureus		https://news.google.com/rss/articles/CBMi3AFBVV95cUxNc3Y0RTBQeE9yZkxiN0JTSUZmNFVJNURwMUJMVGpDMzJfMktJVWpKTTVLM3VCbVZwNlpfeGhnVWhEazZxd1hRYU9MM1FqYlBFX0EtTmtadXdsYmQ5NzI4NTdsX1JNVTc4REFCbld0QU1tUXdSSlNISlNJY3BZb1U0eGlGRGhfQ2hZRWxuVW9RUDF4MUhNdmNxSk5Jd0NLblBQOGZsV0JjU3hZWmlES3M1Y3c4RllIVndSQnZLM0hVSGxfQkthcXVKMTNCV3BrZ2FlcHZXa1RDS1diWGNQ?oc=5
2025-11-27	Google	0.3	URA Offers Greater Diversification And NLR Provides Lower Expenses, Tracking Error - Seeking Alpha		https://news.google.com/rss/articles/CBMiqgFBVV95cUxOaVU2djROUXROdmJMYWlneGU5T2NkQlhyd25wdGE5Qi14M2ZGcW41c2hTQ1lFbmFiTGUxZHJZYkotVmNhNVlqQ2dXRzlSeUxHSHRzYXdSVkhwYW80cUllNWNVQnlxSjY4QTBOd050WWlCNGFWbHZ2UE8tZHpWNGZWTHQwZ0dSOGMxVkNXcGxqdEw5OXpyU0ZCQXloU2F2WVI3cHJZa1pPNWxKZw?oc=5
2025-11-27	Google	-0.083	NLR Police arrest one, continue search for second suspect in deadly shooting - KATV		https://news.google.com/rss/articles/CBMi5wJBVV95cUxQc3lMQTR6SmdyUDhWWVFHNWdBMENBemJvTlQ0YzFTY09rUUpSLXRpSXp3WkZkLVpIYTZQNFh5UGN3cklQYmhLTEV3cEpqZHRja0VxWTFZWUt1UzhoNUVhU2lWM0V1OTJLNHJyUzJXclpmcmJlNTk2SUozRTh3MjhLUV8tanlVZTUyMmFDTzFqLU1UNHJCNG9YR0g5Ri1FQ0VzdTZxVjhkN0h2bVpwWWxXc3lWUURJM3lnZm5oMXU2cnNHNXZ6dWFKcmFldjhSUjBYN1RMN3o2OWlycjRyR1FWU2hpdlJoY3FrRFlLVEhkdGRzVExEM29meUdpRWZvQldQLWthZTY1RldpYmVUdEw4bDdtTFZJTFBzSC15VmtHazFNTy1BOHlwLWRRZUlOX1NYZHBJRGJfNmpwakhFS04yMkZHMnNaUFlvblo1dWFOdWJGWnlKbEJYU3RKZ2JBR1RqUDZuUFFjbw?oc=5
2025-11-26	Google	-0.15	Low neutrophil-to-lymphocyte ratio identifies secondary polycythemia in patients with erythrocytosis - Nature		https://news.google.com/rss/articles/CBMiX0FVX3lxTFBrZ3JKQVhKQjh5UUM0Y3JvQzdPbjVfdHgxUWN4VkhOM1N5aTVxOVBwaGNPd2Fua0oyYjNIRGpFcF91TmtwSlpKdUhCVkVENVB3UnJEMGZIczVrVk9XNkpZ?oc=5
2025-11-20	Google	-0.188	North Little Rock Fire Department puts out blaze at warehouse - KARK		https://news.google.com/rss/articles/CBMioAFBVV95cUxPa1U1TWxoVkZSQnNjRTdEdkt0ZkV2OF92Z0ZHWnNXN3gzN0xoYVQ0dzJ3WmVrd3hfX2hPdXRzN21SZnVTcXFzTjNST0ZQR09QeDdQWnl5TUd0dk5VQ1VXUndjS3FPZExKaXJhaEttU2JDUW02RUFWTXdhdUsyd1hiNVAyQnBpZk9LSnFUS2hIN2pHcUgzWWU1d1lkRUJaNnBx?oc=5
2025-11-19	Google	-0.188	North Little Rock's Innovation Hub to close in 2026 - THV11		https://news.google.com/rss/articles/CBMiyAFBVV95cUxNSTlxZmdVQmQzTzZmdDkyYlE2Zks3bkdqVy1aS0ZOb0J1cS1pQWh2QUIybnNTS1V0NnJpekwzeTZUODdOX2dZcjdnN2hkb20tdFUtR25Ga21vQl82ZXVQSllZRFdjWFZmRHhEb1QwdDZsMEFlLTVrSGVvMU5JRUszU3lGY3dZU25wYUR2Y2ZveTRiek9PdDNDQ2hsY3pmbHZnQUczV3Ytb1VSbWFwT1JpVHZmclEzWHpfNzFWYXJpWjJkcDdoWnQ4UQ?oc=5
2025-11-18	Google	0.0	NLR Library to Drop Innovation Hub - Arkansas Money & Politics		https://news.google.com/rss/articles/CBMidEFVX3lxTE1RR3FnNEpMWVhaM2YyMzhjWUZ6ZDNab3ZYZnFoYzNfU3FCN21kT2kwZ05CRF9qZVUweF9COWg2ZkxjZi1SSURPWm5CMWJibGlwY2dkSmZMS1gzc0ZmTG13NkpVY3FkelhqRDRqVXowZHhETFFa?oc=5
2025-11-17	Google	-0.188	North Little Rock church in need of donations ahead of Thanksgiving - KARK		https://news.google.com/rss/articles/CBMiqwFBVV95cUxOVjI2dlhtdFpJSG5CWmx1LTFhOVdnSTllbDMzbEtVYVhXQUpuSDFCbEJQOHBOZTBVelZDMl9yUmZSMDFLQVB5cjFTc2gxVmZvYW1nX09vRjhwaC1pNkJsUWk2VXlNaUpnVTJRdmtMVWkxZWwtTGdzQzVtcDhuU201eS1MTnFiTEJhM2pQWXFjTmZsMVJwTTh0bDYwSlRfWm1HSmpEczVfUVh3dDQ?oc=5
