Date	Source	Sentiment	Headline	Summary	URL
2025-11-14	Google	0.0	Friday Frenzy: NLR vs Bentonville West - KHBS		https://news.google.com/rss/articles/CBMigwFBVV95cUxPb2VjaHI2Nlk1Q0QwRkFnNy1XUkpidkZLN05fMW1fakJzTjlHT1o0NjhGZ1VRcklhN1EwWVhVU04tbWRWb0J5eG1GZEpWREMwU1YyVXVHQVpzVnpnbUZaRmdBWVVJT3hZZ19OYmRHQmdYVmlXaENaWnpONlJNOUh4RU44NA?oc=5
2025-11-14	Google	-0.188	City of North Little Rock weighs in on Shorter College Gardens ongoing apartment crisis - KATV		https://news.google.com/rss/articles/CBMivgJBVV95cUxQMllOaWotVTN6dkMzYmM4V1ZNai15NXpuVzUxLUt6TXp5aDVZa3FFSWVXZm5nYkp1VVpLLVZfbElRMUtjRW5ZWVJ4RnJ1VWhJS1R4S3NWVUJpM3pmdERXUW1MbTY2VHctM0ExR0RlcFgzREptN1VIVnk3cVBGNTdHVm9NVlhoY3UyS1B5bllFajBTTWxjblFvaDFGZGczOS1MblNob19DclU0d0xWV0lpSkpiZUpIT0tzQnJhZWVQdWc4WGNZV0k0LTNudWdMalIwcEptME5DSTZzOGE0enpqMm1xUkdwc3pyNXhGWm5FOHFPTWdsVEJwS3lQd1NUMVZpX28tM2xlT19qM3k2eWxyNG8tTkMwbndINzVnSHFpMlZNNjdNRWNnN2xPX0loaXVCeGs5S2lqTUhlejhUbkE?oc=5
2025-11-14	Google	-0.2	Unidentified man killed in NLR gas station shooting Thursday - The Arkansas Democrat-Gazette		https://news.google.com/rss/articles/CBMilgFBVV95cUxNaFRtZWxEUU9sOFc5dF95VDJTcTNkd3p1bnNVVEF3VktiNTRweWNUT0FNWWs5Vy1yYkNFRXpUYjdhTXluVGxRcXBHQzVGNWF1YVBrYjMzYTlMNE92aEl3ZXNIb2drVzVQbTN2YmNyRjFWS1FyeDdfTkt0RDFzXzUxcDBMUUEtS1BUV3VQUGpmakVYVmFBaWc?oc=5
2025-11-12	Google	0.0	HomeGoods Opens in NLR’s Lakewood Village - Arkansas Money & Politics		https://news.google.com/rss/articles/CBMickFVX3lxTFBhSWJwUFN5ZGNDb2gtUzR5VWtvQmJfd19MbzdkQjN3ZTRtY0JJSlgyWm9Zb0hlbk5jczY1RnZNcnFDVk5lYkZVbThQTnhlWTdfcGZzcjRFUEgzZldsaUl0ckh2c3FmV21mMEg5dHZ1UmxIQQ?oc=5
2025-11-12	Google	0.0	NLR Breaks Ground on Downtown Arena District - Arkansas Money & Politics		https://news.google.com/rss/articles/CBMickFVX3lxTE81T1hPeVZHTmxUZFpuejNUdzktZF94U2tsd0xHTjF1TW1qUUFjZnN0TkNFS19QWVJGbUx6ZXNYeG5uRjlzcTVOemdPb09yMlFVcEVmdjFKV1JpdWlBaU1HcV9XejN0ZC1VWEtqOUtma05wdw?oc=5
2025-11-12	Google	-0.125	"North Little Rock breaks ground on $25 million ""Gateway to Argenta"" - Little Rock Public Radio"		https://news.google.com/rss/articles/CBMiqwFBVV95cUxOckJNV2I1eTltMDQ4T3VDWWw2N2Mya1luVWtBc1BrN1B4b0x3ajZrUHI3cW1XaTBfYk1QUlhQUnZaREVZOUJFNUc5VXlUbWstNUtEUWxpTWttbmpKWVhVT1EweTNYZHI1RzNhcjl1d21idng5cnp4dGtXTWxmbUV0YjRwVUJCYXZWMkVHSmZOamNGMTRhdWhzTXI5ZXFzTEx6SFVFdzVNLTFXQm8?oc=5
2025-11-12	Google	-0.188	Developers break ground on $25 million Arena District in North Little Rock - The Arkansas Democrat-Gazette		https://news.google.com/rss/articles/CBMimwFBVV95cUxObkFlQVVPSXJEcnhDb29kM2tHaWFnaUUyRjRJQmJkLVJMNk5pSTcxUGpyaEYwdVdNVVUwQVE1OGFlSDlCYUVkRnVSLUFYdE5WNmlyQWZPaFZPTEY4bEVzWjFCeXJqNnBRUmZpRlFqcDVXTEV1Z0xSRmNPMEZQZkY1Qzh0dHpzdGgxUHZKX2EwV3NKV3pPZ2JlX3ZSOA?oc=5
2025-11-10	Yahoo	0.413	3 Alternative Energy ETFs That Are Crushing the Market This Year	These three alternative energy funds, with focuses on uranium, nuclear energy more broadly, or clean hydrogen, have experienced massive rallies this year.	https://www.marketbeat.com/stock-ideas/3-alternative-energy-etfs-that-are-crushing-the-market-this-year/?utm_source=yahoofinance&utm_medium=yahoofinance&.tsrc=rss
2025-11-09	Google	-0.4	VanEck ETF Trust - VanEck Uranium+Nuclear Energy ETF (NLR) Price Target Decreased by 11.32% to 155.64 - Nasdaq		https://news.google.com/rss/articles/CBMiuwFBVV95cUxPNHZXUnpqbV9fUkMxWl8wVUlITlc2U05wVkZOcS1KOE5VYk5CTzF4U181bERSRmVINjdQYUJ2MVp1ejc5SmdSckVEd0VuU1F4RjlZNGc4V3h2SlhzdDRfTmowLTJCa0dnU3lCVmV0anR1RG5tbUVBWW5PYXM5UzhJbDhCRFY0ZDJvQ2NsTWhnQlJWLTRkamhRTjNjeHVyWWJBSUdXOEhIb1dzSHdkeFAycjRHWmlTR2NjSms4?oc=5
2025-11-08	Google	-0.094	ALDI opening in North Little Rock next week - Arkansas Times		https://news.google.com/rss/articles/CBMikgFBVV95cUxNYWdOM2ptN2RXZXFCMnRBb3JEa0o2WVdsSEZzZU92UFlmbWlsOVhrd0NuZHZ6VTdSdThmNzJZa1dQYWo4X2ptZTVPU1ZubU1UT1pwVU5TWGRfTHhPWktPTWQyUjc1RWc3eDR2bm8teGxFV1JxbjFiSV9CbnBZVlhMcHY1OElLbnVTWDFKOGg2eHV2dw?oc=5
2025-11-07	Google	-0.188	North Little Rock housing officials step in to help apartment tenants after they report unsafe conditions - KARK		https://news.google.com/rss/articles/CBMi3AFBVV95cUxQN0dlNFRYcTAtc3otRzNBczhOYTFRVHpORTZCY3pXc2NQcWRqcmhTa2ZpNUx6b1RfR1AzdFJwcXZFUmdGdmVWeTQwckdEUW5WemRTVzJCTGdRU2U4MGxtTkJqTC1MMi16dVFYblR4SmRDNl8wUTZNTjNlNXdWTUlaYUxWODNDVXZKY3VhTHNEdHgtTUpFc1lsTXNUNHlEdVozZ0VXQnozcThLRHl5X1BTOUd1bU0xcE1sQVV6NlZjYkVOMU4xcTlxR2Z3QjFXRGdKX1NvNU1zUktoY0FM?oc=5
2025-11-04	Google	0.136	LR U-Haul Repair Shop Closes, New One Opens in NLR - Arkansas Money & Politics		https://news.google.com/rss/articles/CBMiZkFVX3lxTE4xZW1pNkpLeFIxdjdBZ29uZG1QUG9LRUMtX1NsbzZQZU1rMFFGMDdTTm5UYzVsbVoySmZCWUp3bkF6aUUxSUNkZjJmVndWU1QxY29xa0gxa2hxYlN0R09NYnRPbmZfZw?oc=5
2025-11-04	Google	0.0	CBRW and NLR to join BNSF Railway’s Shortline Select™ program - BNSF Railway		https://news.google.com/rss/articles/CBMixwFBVV95cUxQWkJtX3phMTIyYWRIbE9ydWQ5OUtLbUJmM29tMWlLSmZtczVXZUphdWM3Q3k3UzV1MlI2SVhoSzFqUlV1bGs4S1Q1Q0lyVEh4clR2ZThFZnJHRFlDZDNtUk5TcndScFY3akJUVVJJYjBadmdJeTJQcHNIMi1KNHhJdXM2U3NQNzdXOVFxbV9rSVJMUHVkUFQ4RWhIM1B2UUpkZnVmQ2plN3FxaTM2Nlh6Q0NxNXlvVF9nZVVZX3pNb1RVWTluYVRR?oc=5
2025-11-04	Google	0.0	Loss of calcium-dependent protein kinases OsCPK5 and OsCPK13 leads to NLR-dependent resistance in rice - PNAS		https://news.google.com/rss/articles/CBMiXEFVX3lxTE9DREhzcWhKRTNfd3BycXlKMk5JZ2lUdDNpUlY3cElxUW1sUF9rb0kyNjBxalNPOXhxTkllaWYtcWwxd0JraXFPYUFYNEhac0loSll5SkxpR3BTRGVM?oc=5
2025-11-04	Google	-0.188	Security camera captures suspect in string of North Little Rock house fires - KARK		https://news.google.com/rss/articles/CBMiqgFBVV95cUxPQ2tlYnZBZkJDYU1rNE8ySnYxZVUxSXBXV0V0Wm1hQlZkUmFfS3lOS0k1N3RDRkRpbll4VERNX2ZuYjYxSS1seGNhc1N1Uk92R0NWTEdmYXdpbDVhcndrZjFmQlV1ekgzR1BUNGRCUDlqY1FLVG9HZHM1MFJ5NjEtX2Z6TTlPbnVQSmNzZHhOMlA0OUkwREl6Nk9XTTBTbmZYTm04X2tUU0tEdw?oc=5
2025-11-04	Google	-0.188	Willy D’s Relocating to North Little Rock as Part of $25M Project - Arkansas Money & Politics		https://news.google.com/rss/articles/CBMib0FVX3lxTE91WDFwMVQwYlZTdHFFR1QtZ2pCcVVRWWlNbnJENENfSjUwSEplWUZNZkdDSWVBZGw5Uk1saHdmcXA1QlZJeThyWF9OdjJVdmpfUXRndl8wRnhidV85bld4Z0JzaHB5cFZZRGdTdmt0aw?oc=5
2025-11-03	Google	0.0	NLR Police are collecting items for nursing home residents - 501 LIFE Magazine		https://news.google.com/rss/articles/CBMiigFBVV95cUxQekVEcFNob1VhS0xtTjd3NDhlalk4MFotbWhqdDJZYkVTb1lSOEFpR3lCaVFyZHlWaHcxYmVxbG9VRjdtTFdmeHBSbjNXUTR5NXdlSWl2N2RVVXB2NllOdDVmMEM4ZkUzS2FvNnNYV0xpMWpicjdLSk5YZ1NkX2wzMmtuMnVodEtPbVE?oc=5
2025-10-27	Google	-0.026	North Little Rock welcomes new entertainment district, loosens alcohol restrictions - KATV		https://news.google.com/rss/articles/CBMiiwJBVV95cUxQOFhpX0VlTlRfUnBoTm1IWHBBdXQ4NnBfVUgzYmJtVUtQV21ZVEdjVS05SmhVanJqMHNYclBtUUYyRXh6VHljMXd1cDVFQm91S3hHLWpsOTFnX3NsUnpiUnBZYTlFQ0VWYmlKT3J2a2lWcTRQODV4Vm5qbjl5aFV1WHpkNjZKU0o4Z2xaYXE0UHR4UUxiYXFXbkJnTm9NRDJvLTZFT2o5dTNmbi1vdVpmelFuOGF0VzljaE1CSkNXbTM5bkNia2FIYXJNb2QxdjNPeXd2LWFrSGRtUzZIYTV3YWVFbUwyZ0ZJcmF5Mm1QbGVjelV0ZGZ6SUxUc3dYM0hVSDNUSjU1MFN3M0U?oc=5
2025-10-27	Google	-0.096	North Little Rock City Council designates Lakehill Shopping Center as third entertainment district - The Arkansas Democrat-Gazette		https://news.google.com/rss/articles/CBMilAFBVV95cUxOYVZpUXVjWC1aVjg0R01EQWk0MjBKU24wMDUzd3VzamFBR1d6NXdMR25oTWFGZTA3M2tVMmxnSHdkUzVHbkt0aFNFaWpjd21PTHpuQXhYTF9Ed2doeEd2Z0VXMU5KbnZ0UnhmUUVoekhHNVJZaDl2M3BwMkpwZkZWdXJPWG5QREJ5NHBpeWpNN2EwZGhw?oc=5
2025-10-23	Google	0.256	North Little Rock hosts outreach fair for unhoused community - KATV		https://news.google.com/rss/articles/CBMikgFBVV95cUxQUlBqRGk1RTAwQkhfZ2pTbUJ2TURnT1BXWk5UNGpBOVBVOWF5M2d4bGhiWmNQaVNrX0Y2VmYyZTl0ckFzT3hGcXJqU0Q1dDkyOE4zM010UEVlb09iRTlVTkNFUFZtd1RXR3BQdTVuQWxXaWRQb0p4Tk4wSi1RcXM2ZUwxbExuVDRKXzExOV9PT0E0Zw?oc=5
2025-10-23	Google	-0.118	North Little Rock School District orders 50 LGBTQ+ books hidden on students' digital platform - Arkansas Advocate		https://news.google.com/rss/articles/CBMizAFBVV95cUxNWlJwYlphOU1OeFVOUWdmZXh2U0lEVV9mWjBlNk8zLV8yM1QwdGYyQlF0X3A3eXNTRGtXaFh0OEo4cjZlUE9TeE9WRUxCY1dueHZESFpQdzNMMzBxa1VMWWN2TTNxclJWLUFrV1dNUEREbThYUVM5SXNHQUZseFRmQ1JJSURNbURVZ2hhWDhyNkJiZ1lMaWVBWVJVUUZpaFFHYnZneXJHQmZUakg4UGNWN1dwdEljQ3Z1UWJWN2VzOGwtNVMwU0J6NERKdXQ?oc=5
2025-10-22	Google	-0.188	North Little Rock School District tells teachers to hide LGBTQ+ books - Arkansas Times		https://news.google.com/rss/articles/CBMitAFBVV95cUxNaXZrTjNQRFROU2g0aFVCaTRBVjVqMUJOVTFrNTV6NUNkWHNRVWExSkdpQjZBUWRzZkVMV29WTGthbTk4a1hLTXg5RnB3bVQ1Nl9yYUpOY0UxZENCMno2VF9NRWdWYU14ZFh6ZmgwTlZNSHZkOTVDdHdiNGxOWFE1X2NTLWdRQi0zVUJMRDdsWHFjSFNsdy0tYmUzbDA4VlRFcHRfaFJXTjBSRDB2SG1ZYVRKT1g?oc=5
2025-10-21	Yahoo	0.267	What's Driving the Surge in Rare Earth Stocks	Here's what you need to know about critical materials, the latest front in the trade war.	https://finance.yahoo.com/news/whats-driving-surge-rare-earth-200900921.html?.tsrc=rss
2025-10-21	Google	0.15	NLR: Still A Fantastic Nuclear Play, Now Juiced Up By Military Interest (NYSEARCA:NLR) - Seeking Alpha		https://news.google.com/rss/articles/CBMirwFBVV95cUxNZ0tYRF9jTkxGTDNSYTdiWG9iemJjY05CU0Qwbi04eEdhVjE3S294MWxKWE80aVdNcGtmZlJka1VPVHhSemRUa2tGMS0zRklnR2c3Uzc5dHBCVWdfZlNadllVSWlYUllDLXprVkF3ZzQ3NnZ6MUN1TGgwZlZoNlFiSnRzSUpJM3ZWX1dTOUxMMHMwaHlUQ2ZUZ2FNOWVLUjhteGtYRkVvcXZfaldBejhZ?oc=5
2025-10-16	Google	0.068	Gabriel Hetland, Murder in the Caribbean — Sidecar - New Left Review		https://news.google.com/rss/articles/CBMicEFVX3lxTE1IOWJMYWltT0xiTVpqVmZwUUlzRVEzYllrWlNiN2toMHBZQWp3VnZCLWVVU1prc3g3dEctdEZhdVh5M0dndFo3T0ZjR0daMDlVU0xKTGxHd0hkNzRqUVdMOXg0NW1lNUJWMUg0YW1yTTg?oc=5
2025-10-16	Google	0.0	NLR: Participating In The Parabolic Trend (NYSEARCA:NLR) - Seeking Alpha		https://news.google.com/rss/articles/CBMigwFBVV95cUxPWXRQM1ZpQVg3eUIxZEg2dFlxTkUtNnNkNTN3eHVDZmlOZ0RrSFZuOHZvWjlSbHh0c1ZCck5YLW9BS1dsUHdsNkI3YU9PYmE3VTk0cExocjFPQ05qa3RzZUdnaGhQZ21rc0ltMEN3NUVaby16ZDYyWTlNdmZoTURuSmNUNA?oc=5
2025-10-15	Google	0.068	Martín Mosquera, The Meaning of Milei, NLR 155, September–October 2025 - New Left Review		https://news.google.com/rss/articles/CBMijAFBVV95cUxNcjFNN3RyZ05jN2h0QkVHeUs3dm8xWU56LUxsZ1VhODRYdHlVMlVSYVROZV9yZmU0WElJMjgySkhnUWY2b19FNm4yWWdBdjhiTTJGOEZwTG01dXFlWHQyWll2ZkoyVnhtc3NkZF9kOHZDSFdMb1pFaDB6ekxrcldWOHF2VVNiSjB3STBqcg?oc=5
2025-10-15	Google	0.068	Nicholas Mulder, Interludes of Abundance, NLR 155, September–October 2025 - New Left Review		https://news.google.com/rss/articles/CBMikAFBVV95cUxNSEFEa0x3SDBEWnFZWTNlSlRRd0pPeWpWZS01VmdQdmRRMmJOZFMwMG95amtsNU05NXplMG43cFlMVzNDajlMZUdXT2dSNHFDcEM4ZDJ5ZWZvUjRSc3lic0JzZndET1V4VmdDdlNmUmtFbDZZelpkaHNVWWhFNzA5TVZWZWpXbjZybUo0d0FaX3g?oc=5
2025-10-15	Google	-0.094	Teen charged in North Little Rock shooting death - KATV		https://news.google.com/rss/articles/CBMitwFBVV95cUxQUS1JUHNXNG5lUUVRYkJqNDktd1pGblhUTFlOdVVEOG4ycnltb3REVkk5dWpaYWI5ZS1MZGRaeGdzUkYxSFppNUgxZlI2alRBRGx4R0tKd2VjRE1jUmswMFV5b1QzTW1OT211U2FURUFTbVl3cnVDTnA4X1JfUHJsMFJtTzNaMHMtV3pFVHoyeENST19fU0h5dEV2UUdTUHNRNW1HYWdnQ3dEX3kyeVE2MF9QX2ZZdFk?oc=5
2025-10-15	Google	-0.188	14-year-old arrested, charged in connection to North Little Rock homicide - THV11		https://news.google.com/rss/articles/CBMixwFBVV95cUxQYmtILWtScEJqMEx2SnpHZ1ZnWHcxcnlUcUJ5MUU1ajdQN0JLbmZNWXh1Mm5XclZ5Q0c2NHRRdTZqbUQwdUZUdXVFcjlEVGdvNTBULTBneFJiMG1kN2hRWUwyWmd1UWcwWm9xZUpFWHhXWEZLUHV4MmJGdjRyRnZodERiOE1Nd0xNYXl2WlNMRm5Cd3lqcGx2VkRicHRoSk5fb1lONXA2aldjZGdZRFg4NFl0aEhLMXBpU2pzbF9Dd2k5SWRJUXFZ?oc=5
2025-10-13	Google	-0.188	North Little Rock City Council approves property tax renewal - KATV		https://news.google.com/rss/articles/CBMimAJBVV95cUxPNmZxSzQ3M3FOakVsTHZMSWlTcm81OTNLNHNhNjNVcXlSWDdwdHhoNUZPYkxNM19IdUhEeFpQZGxLdDhONEJoX3NaMFRvS2VkS05xdEJoZURick5VbkM3V3h0RFR4OXBtR3Q1aExhdEwzUzhXbldtbEZlWl9SakNIWmw2M2d2QjlMUHFBemJvczdWcGNxa1kyd1FoNS1qNE1HRjRUUk5kTWtLMS0xZ0sxZVFLaGlaaWRTeHNmTzhtTWxRbFVhS1pLYWhkZUdjSEZCZ2Z6TGRjMk5wdmtPVGp5UDVFcUU5RFh6UmVCZjNreHVxRElTNkFQSTF5Q0ZiaWs0bVlybFMzSnB0Y1djYXZaSlBiNkxBZW5j?oc=5
2025-10-10	Google	-0.188	Banana Ball Is Coming to North Little Rock | Travelers - MLB.com		https://news.google.com/rss/articles/CBMigwFBVV95cUxQdFFQZ0k1V01mdUJaY0VYTE1HLXI1WUhHWGx0UHNiZmc3azl2TVp5OE5CUXo1b2wwV0E0ZjBtcUpETlotdlZoNmpqT0VUYS04dmt3OVRwVXlQb1dtRWZWSm9keVJ4NFdMQ3JuTmFsem1MNHRfb25leXIwR1htVEp6Q2JEbw?oc=5
2025-10-10	Google	-0.3	An NLR pair in the Pm68 locus confers powdery mildew resistance in durum and common wheat - Nature		https://news.google.com/rss/articles/CBMiX0FVX3lxTE84N0pvaE9MUXVSbXlUN2VhaHJnYXRDMlBwNU1LUlJsV0Z2OGZIS2J3TWQxS1RaR2FJQm9UNVp4czRQU285QTRVMkxfVTlXTXZSbHNjX0NReUJvNGdGNVpF?oc=5
2025-09-26	Google	0.156	Pulaski Academy pulls away to top North Little Rock - The Arkansas Democrat-Gazette		https://news.google.com/rss/articles/CBMilwFBVV95cUxPR1dITHN0blE4WUdFVGFFVjlBR2JxdXVRQ29oYkN2TENVX0kyTFRTNW9xNHVqd3Q4ODFqYmU3ZjNsbmZaV0lOTzFFamVDb1VscEhhNjRQMWFXclpBekRQb0RRVEJjdGhVX283dXVVVnlaVTVQc3dVXzJBWkNxLVAzRU5VS0Y4YzNjb1dDOWh4QzJmUkFTWTU0?oc=5
2025-09-26	Google	-0.188	Coffee lovers in North Little Rock react to closing of Arkansas Starbucks locations - KARK		https://news.google.com/rss/articles/CBMivgFBVV95cUxPWU9QbGc4akZHY1dxSDBxVTVJYTR5ZFVkbHB3YmtMN0F2S3hMZXVxMTM2VGVrcE1Bc21vNEt5djB4MmRILW56ejd3Sm1pWElScjlLUnNoTDY0YUs4dzNYZVZZTlR3cHcyQ2xaa3JqQ2QwaHlqOF9ZN2U4TXZycS1CaVhIX1JQVVF1cURQZHpIWE9iSXZJUWQ2c29RZXZmYXhmSjVoVG5oRG91aWZ0c1V4N09MNUNxMHFDQmJZelJn?oc=5
2025-09-26	Google	-0.188	North Little Rock Athletic Club Changes Ownership - Arkansas Money & Politics		https://news.google.com/rss/articles/CBMifkFVX3lxTE81Uk5SZTNNYk82ZzJENTdiSEl5R0ptMWUySENiNWludDNzXzVZU3JfVk84ZlJHa2JON216alNsMHpKdzBjelpLTDgzYXU3QzJ4bjhmREhqZURtcVZRXy1GVEN5eFFka3MtYkRPbkpsLU80LVhld25Fb1dsamtfZw?oc=5
2025-09-25	Yahoo	-0.242	Why Thematic Investors Should Consider Nuclear Energy Names	The US electric grid faces increasing strain from surging demand driven by Artificial Intelligence (AI) and cloud computing data centers, industrial automation, and widespread electrification of transportation and other sectors. Nuclear energy is a reliable solution, advises Nancy Tengler, CIO of Laffer Tengler Investments.	https://finance.yahoo.com/news/why-thematic-investors-consider-nuclear-050100764.html?.tsrc=rss
2025-09-24	Google	0.0	Get Nuclear Stocks Upside in These 3 ETFs - ETF Database		https://news.google.com/rss/articles/CBMidkFVX3lxTFBQNTVOMC1RNXRhM3NXLXRwSU1nWFlJUGdwNnZlLXV4Y3RKdGphbHozWHdVYVNObERCbTJpUENDRzVsMEliZUNCbGVGQkpoM2x1d2htTmlGU1dLMEZ3YU0yM0tSdjh0Nm5PcmFTWFBiTkpkS29nRUE?oc=5
2025-09-23	Google	0.0	Discovery of functional NLRs using expression level, high-throughput transformation and large-scale phenotyping - Nature		https://news.google.com/rss/articles/CBMiX0FVX3lxTE9iQzEwZW5maW8zRkNEb0c2X0VEMzdoVlp3MjJCbnZTNlRKZmhkNUoxN1ZKRlRZZGtYbHJFMUtQNW9vR1htQWdKVkJLTnF0ZjZIMm5kSlFjX0xRRzRwb3dR?oc=5
2025-09-22	Google	-0.079	North Little Rock police officer Tommy Norman announces retirement after domestic violence arrest - The Arkansas Democrat-Gazette		https://news.google.com/rss/articles/CBMimgFBVV95cUxQN0ZpWFpuc25mVWE2cFFVYnl5ekhnSmEtcEYySWp6czFTN2Jzai0yc3hlUXR3S1lhTV91OW5FSzR4Yl9rbG53V1pvZzN2YVVvbTZJcjlHRW9xTGh1YXB3UkI1b20xUGtoYmU1b0liU2MtV1ZBczVPOG10OTBNR2VaYTI1aWFPNXNkcmhBMDNwN0gwQU1OblJGcUdB?oc=5
2025-09-21	Google	-0.044	State police search area near Interstate 40 in North Little Rock for suspect in unspecified case - Northwest Arkansas Democrat-Gazette		https://news.google.com/rss/articles/CBMilAFBVV95cUxQNXVuTmhfM3lrdmtMckhibmRWVXlIcmlRbGZ1azlmYUFMRTUzdVJ0SzZZT2JzSFpLSXBJTmxQZzB3QmlDanMybWloWFc5ZGlGQVNiOGVNNll4b1hjajgzS1FUUEI0T3daMDBKUWlTTHIzRTZteEZjc3hpcmhtT0RCV1pQYjJNV0ZNYndyVHptU3JfWXIx?oc=5
2025-09-20	Google	-0.188	North Little Rock ends lengthy drought - Northwest Arkansas Democrat-Gazette		https://news.google.com/rss/articles/CBMiigFBVV95cUxOcGFhQ1JJY0tMbVY0Z2VxV1BWUFktenl3dDdpdkFrMzZVeUFJa28talFxbzZyX1FrRWRjdVlQVjhlZHZELWJfNW5SRUx5aDFpUHhmUjlqamNydnI5SkdldWRkdVhJOXd0QWZpMm9BX3dfSUVTd2U3S2pFZU1jWHBmNWpRU05rM0RhcEE?oc=5
2025-09-19	Google	0.256	North Little Rock hosting outreach fair, amnesty day for unsheltered community - thv11.com		https://news.google.com/rss/articles/CBMi2gFBVV95cUxNQ2c0N2tnYmd2UXJ4WHFVOUlsVGRiazlxVjNHeTVkOFppT1pQaHpBSXRDbExhRW5iNk15TVdaOFpFNXpuMGVXbUVwUTlfWnJJeEtTbWpLRGVxRFV2d2hjZGRyejVvY2xXWTBya3YtZDUxLUZDM3VTZGV1bVVNR0FIZmpMTWt0VFA5ODZjRnZsMmFURTktcVlSb19HVEpkX2p3cDZQNGpfTlJodTczdHE3OTNEMVdSanVJTFZvcjFhSXZQd3NrRWFrNWc4SWh4SDdqcFpKa0JjMWwwdw?oc=5
2025-09-19	Yahoo	0.25	Nuclear ETFs Soar YTD Under Trump Regime, Top 2024 Performance	Nuclear ETFs like NLR, URA and URAN surge in 2025 as Trump's policy push, rising uranium prices and SMR deployment fuel solid gains.	https://finance.yahoo.com/news/nuclear-etfs-soar-ytd-under-160600425.html?.tsrc=rss
2025-09-19	Yahoo	0.0	ETFs to Play the Potential $10 Trillion Nuclear Surge	Nuclear power is surging as AI-driven data centers fuel demand, with ETFs riding momentum and SMRs reshaping the sector's future.	https://finance.yahoo.com/news/etfs-play-potential-10-trillion-154800257.html?.tsrc=rss
2025-09-19	Yahoo	0.0	What Is Swing Trading? This Nuclear Stocks Trade Shows Benefits.	Multiple trades in nuclear stocks show how swing trading helped us capture gains and avoid big losses.	https://finance.yahoo.com/m/387261ab-7e56-3ef2-8198-8a2182ff7aad/what-is-swing-trading%3F-this.html?.tsrc=rss
2025-09-19	Google	-0.109	North Little Rock uses big second-half to blow past LR Catholic 42-13 - thv11.com		https://news.google.com/rss/articles/CBMi_AFBVV95cUxQMXBlTTE1QTEtQklXZFVDbldEZlBLZkhGemN3QlJEOUNiVUtlOUNMcFd3ZWR3cVdhRnR3N3VJbXlNNXZ0eTFuR3Jpd1lTVzIzZmxCZW8wVVVHaWsyajltVlVNQk5DcVJCdVVOekdGRHE2NXlLRUFkWURGcjRzOElORDZUUTZoSU50N0JTSjZKY25vMnVfMjdhZjNBYTEyeFZBVFRZWkMyam9zU0d5alVpNTFWeTc5WVdQY1pqek52Z3cyRG9aSjJfTDRuRDBZbzZjbjQxeXpSc2dfZ0VVS1lYQlVhdTBLekNsblBEMlJpakdWdko1akZUX1Blc1Y?oc=5
2025-09-15	Google	0.018	North Little Rock police share more details surrounding shooting at high school football game - thv11.com		https://news.google.com/rss/articles/CBMiywFBVV95cUxQWmdFR0tVbEgxa08yU1RUd3Y2RkROVGxFYXh3TXlUV1JsLVVVb0pnTE5RVjB5VlJzTUtSV1J0UnpzcnBseHBhTGlKbTFyM1p3T29Kcmk5emdvcnR3eUxBZ0dSOHRLcXZhQnllV1dQSUVsSXJULVVKT3d3X3hDTEc2dWprOEZzWDRKU3VSbnVLc0ZTazQ5TlhOa2cwM1U0dzZESVpFTjJSajRHZDh2ZEUxemFCRWd1aVUwcnFQYmVMUkd4XzU5bncxR0RzSQ?oc=5
2025-09-15	Google	-0.05	Rosalynd Norman, wife of Tommy Norman, responds to husband's arrest - thv11.com		https://news.google.com/rss/articles/CBMi3gFBVV95cUxNQXZCWHlHLUM1VEJZQXRjbGtraENSel9QbmN1Tk5UV2hHNHRLcWVYNDF1ZEcwWEdqa000MEE5Q1RNVGRqVWl0LURnRWlDUFB2d3pIcno5STlfUGhHbmhHWDUtY09xMFNYcnIxaC1WNUJmeHVGaDFWdkFQZmZQNjIwYURYZ1pyNFkyMUU2ZXR4b0FCNU43bkZqWFNMUG9jSEptR0NxMmQ5RWxYel8zREVIQk1yVVowNi1NOGtyLW1iU2swV1pfZUxELTFqQkNxd3FxNnVEeHF6Y1l6Ri1IM3c?oc=5
2025-09-15	Google	-0.188	North Little Rock officials say man ‘not targeted’ in Friday-night stadium shooting - KARK		https://news.google.com/rss/articles/CBMipAFBVV95cUxNNm9iTTVYVkFrOVJ3aWYyM2ZuUzk0TGVtRmlOb3drM3VPZml0QklhNjEtQ3RaM0hocmxqZUtmLThOTzZxQ0ZpUUpxVjZZUHlpd18yX3ljbnl4bmZ4WGpQRzBqNGp1TGh5TUdabGtEY041eXk3MjVBbkNjTDNvU3ItVUkxa1BwZE9ldlNxcXdjUEN6Vl9yRFZ3bmY1R3pnWWFMQjdQMg?oc=5
2025-09-15	Google	-0.188	Police confirm no targeted individuals in North Little Rock stadium shooting - KATV		https://news.google.com/rss/articles/CBMi8AFBVV95cUxPWFBydC0wQmJtUmVtQmlFaWNZM2ZYY1FkdGs4Y2RFUHJITTBSZTYxbnVHSGFTWnQyY0ZMMWFWMl9vdThfVFVRTXdlaEtqN0JtbGw0RDJTbm9VM1hublJyQXU5elZSdzhjdUwxWm1ZZFppZHE3UEh3dnpNejFJdXY5c2NkVExObVIzckhsQ3FWOHV1YVJOLWFvNnNDME0yLVBvSHZkVkprS0prY3RKTEQyeXZ6Zl8zWkh6Ml83VExKSTVBVklWNndkOTY0MWJoNHUxa2JXNzlhZDdTZ01vNWlnU0VNM2VkVVNkQ1hkRDd1aHA?oc=5
2025-09-15	Google	-0.294	Officials say no suspect in North Little Rock football game shooting but shot came from off campus - The Arkansas Democrat-Gazette		https://news.google.com/rss/articles/CBMimgFBVV95cUxQOUNrYVRZUmJyVFI2dzlnZzJKdUxEcXRCaDNYZXVSYXBCMUdPQkJTVXZiSXp3d1k2NVVJTEQtMExZY0hHNjNZUWpwOWtGLXhhNXRIeEItNXhoY19JbWJSdnhkeWVFVnVNTWhpbkdSc2IyQ1lSRjNBbU5GN0N1VlZ6a0xjZ0Zldm1PdjRoWkFTUU5lbVdZMnZCQUtn?oc=5
2025-09-14	Google	-0.188	North Little Rock Officer Tommy Norman arrested on Saturday - KARK		https://news.google.com/rss/articles/CBMikAFBVV95cUxPbzhhd0R2bkVQeEgtMGV1ZTUzY1JuakFFb1h4WGVtT0tVSVdRUVpJdjFvSmhTZmQ2eDlCbmZTOUtWa2I4NzBETWxWUndqRzloT2k0cUdwQWpiS2ktemJDVDNqZUZRSVU3eHFFUk5rVERwaUpjMDQzTmNxSXp3OXppVEluQWxXRVpJSWludWlKbzk?oc=5
2025-09-14	Google	-0.188	Tommy Norman, North Little Rock police officer and influencer, arrested - The Arkansas Democrat-Gazette		https://news.google.com/rss/articles/CBMimgFBVV95cUxOQ2paWjBXLS1yUzVsZjdqN3doeG9hZjg0dUI3WW1NX2RLb2xMTEI1Y2tSNnZaRFZnWjN3c2xtLUswSXZFbHhCUnhWX05yZWJmQjNXVGc4RXJVdThQLUNMUktPcG9WSEdZWDI5WkZseXpzdmRRYTZoR3AxVlNmR0Q2Mk1EMmVzeUtfTFBGUXBOaUNnZFhkZV9vSVJn?oc=5
2025-09-14	Google	-0.294	North Little Rock Police investigation ongoing after shooting during game - The Arkansas Democrat-Gazette		https://news.google.com/rss/articles/CBMilwFBVV95cUxOckwwTjZuNXFoVk9POWJsX0Nad3pCcE5UUEpuRUxpaGVmRkdxQThBLTl4WFlNQkt1X0lqM0ZHcDZ3cGgySWpkNW05cTVMdkpkbmtheHkxcWhsSDdHS2lES0E3N0xLbXRoX2tqRmo5TkhEd0d1b3hoTTlGSk1qWUZMMTJJSmpSZU9JS1VJNHFGNllYZURxNWNF?oc=5
2025-09-13	Google	0.0	Low Potassium Triggers Tubular Epithelial NLR Family Pyrin Domain-Containing 3/Apoptosis-Associated Speck-Like Protein-Containing a CARD–Driven Kidney Inflammation Independently of Inflammasomes - ScienceDirect.com		https://news.google.com/rss/articles/CBMie0FVX3lxTFBaRkp6czQyZnBJMXVmZVZ2YmtCUlVnYmo2cVpOcDJMbWZnc0hKVlctTXN6YVBSMnFveWV5ZTZQbnJ4Q2tQQTMzQTJxNWxpbThBQUFfdHVSYXpRU1pzclN5SUpLMFhxS3lWbHNrY0RIdEJhMzVOdkRPRndXdw?oc=5
2025-09-13	Google	-0.294	'Get in the locker room' | Players recount shooting at Benton-North Little Rock game - thv11.com		https://news.google.com/rss/articles/CBMiugFBVV95cUxQSVY2YlNPOVVkVkh6V1NKSTNTMEd2UGdWamkwTWY3RFcxMDliRkE4djl5SWRWLW4wWTduTXlLX1Y3RmJlM0JzSXhUWnEwMFFJeFpHdXlYSkZscExPMU4xWDBoQVVPTXQ3am9MekVpZ2g2NDIzWW5GSFVwaFpsZE10dkZvMkxKYWtBRW12aE9ESlJIVjREV0VKZF9hUlBXT2Y5R3k4eEhrQks2TThtYmx3NlFPWWF5MGtVOWc?oc=5
2025-09-13	Google	-0.294	Police investigate North Little Rock football game shooting - K8 News | Jonesboro, Arkansas		https://news.google.com/rss/articles/CBMimAFBVV95cUxObFc1eGxEN1JYaXc5dy1EbHJGZTAxUlFmRVpRM2hOT2FTOUlYcTQ4cWpHSVZ1NmxadS0wWmsxVFdKNnpaaUtHRlVaTno3WTdfU2lwMUlDdGlPMnVTWlhhSUs2N2ZYVGhsS3N0cFFRLVNJUkRSSDZiQWFkRXlnUmVzREkxMXlEbmM0UWhmemM3YXE3Q2JmR0RqOdIBrAFBVV95cUxOWEJPeng3Wm5rZzZSdWlGZUxaUU81WG9EMm1CdE1aSDdQWFI5YndLc2s0R3l3STdrR2VuWFJqRnV4b2RPd2NxQktIR0JQUWFPYk5lM05qeWdtSHdGdVJkZWhHYzJ0UUU5a3RGS1lMX04xa1NGZ0laRC1oRXRuSmh0Ukc3X0RqU2VnNENjNmlXOXpkSGl4Z2EwU0NCNG82RUhZdVBzMG13SXd6cTUt?oc=5
2025-09-13	Google	-0.4	Benton vs. NLR game canceled after parent shot - Northwest Arkansas Democrat-Gazette		https://news.google.com/rss/articles/CBMikwFBVV95cUxQUENVaEZYSk1ONDVXaGViRzVhWWl0RFVMaXhJNDd2MkhqbXM5XzFhbGJ0S2FTT2FFbncxVkVESDNtbjNhQm0xR3Zjd1RiUUJjTVRzMXNaOE9jQWUtMkt0MlFDekExYlc4dXlUd2JCVFNWNUlyaGZuUXNtYlJnOVdqUnd1THZDY3hIS1ZmVjYzN1FLV0E?oc=5
2025-09-12	Google	-0.132	North Little Rock football game cancelled after male victim shot outside of stadium - KATV		https://news.google.com/rss/articles/CBMihwJBVV95cUxNWEkyVUhXRUZIdGtrWGtnLU9NbkgtVWR6ZU9VYUxyWnFMZ2g0dDg1Nm9tSk1WMDlDQi1sXzN2aC1zNm1TcTNFYmk0TnB3RHhnd2F4Q1FFV3JhQjVSM0ZYOVQzUVZSbV80ZE1OTklodEFOQTd1SWpJNzJvbTR2YkVoSFdCWHVzUHV5dGUwYTRTQTJ0T2JTOHFldXE0QlpmRmFTQllJVlRoRHNKanNxQUhYM1ZZZXVDMjFMY3JhMHgwenZsX1BRQ3N2dUNlQWtMQ1NLeGg2TW95MmZsbWtaRDBqekt0VEhwbjMxOEVYVU1HSGxaUW4yZWczNmh6cy1hN20zdGdoWHFBSQ?oc=5
2025-09-12	Google	-0.142	Shooting halts high school football game in North Little Rock - The Arkansas Democrat-Gazette		https://news.google.com/rss/articles/CBMinwFBVV95cUxQdHhGSndiN1pBa3lvLWVTWXBOVXNuaEdHLUM4eFNMc1ROVHV6T1YwOEN5THFHNEpYVGNUMFlPdEh4OUlhaDdTS3U2bVRpOVp2ZXRGSVJVWi15ZFNwSkpneGxmSk0zNDRZRDU0SVF5ejJGcUpqVE00Z2ZIbFJGOHNxa1lSdUsxcld3ZTFGV09yU1JRbTV0M0ZtV2ZBM21kanc?oc=5
2025-09-11	Yahoo	0.029	The Zacks Analyst Blog Highlights NLR, NUKZ, URA and URAN	Nuclear power is back in the spotlight, with ETFs like NLR, NUKZ, URA, and URAN surging 40-88% in the past year as global demand for clean, reliable energy grows.	https://finance.yahoo.com/news/zacks-analyst-blog-highlights-nlr-083000365.html?.tsrc=rss
2025-09-11	Google	0.0	The Zacks Analyst Blog Highlights NLR, NUKZ, URA and URAN - Yahoo Finance		https://news.google.com/rss/articles/CBMihgFBVV95cUxPTXdMNWFHR2JIRml5b3I2RFg1V3FJRUNBcGlqSTJ4LVR5SUc3YlVyektDVS1UUzlZazJWOXhMWVNTTGV3Sjd3OGRyVnJ3NGh1TUp5N1VITGdZNjBWV2YxbmlkeWVZc3gxWHZZYXNwU25BM1VzQm9FTW16bC1LSHQ3bGd5TElDdw?oc=5
2025-09-10	Yahoo	0.165	Uranium & Nuclear ETF (NLR) Hits New 52-Week High	VanEck Uranium and Nuclear ETF surged 91% from its low, hitting a 52-week high as AI and clean energy fuel uranium demand.	https://finance.yahoo.com/news/uranium-nuclear-etf-nlr-hits-151600961.html?.tsrc=rss
2025-09-10	Google	0.148	Uranium & Nuclear ETF (NLR) Hits New 52-Week High - Yahoo Finance		https://news.google.com/rss/articles/CBMif0FVX3lxTE04dXVSTG1acGxHN0gwZHNGSUpSaGRzR2kxcTBaellEZWZXbTVtMzlQNFRIOE5XUlN2ZFZ1SU1yWkRrZzR5OTFqQnQ1b3YyZ2V5OHZFTmI2WnN0dnFodDJtTnZZVlZuLXdJUEU0aEloUHZtaHRMbnl2Zk5KRjBwZWs?oc=5
2025-09-10	Google	0.148	Uranium & Nuclear ETF (NLR) Hits New 52-Week High - Zacks Investment Research		https://news.google.com/rss/articles/CBMijwFBVV95cUxQSWNVNmNEVDFUVWgyWUpsQS1lZ1VHYXZqWEo0b3dSVVRYVlI0c1NjUmc0VGs4T1NZOFdSMjNPeGlJWXhYUjVIcVdKYVlzVEpnSkRHVDJsSmVodDJMeWxGRERRSlIxX04xNU02MmNaa1BlcHMweFBxZVgwLWxoV2NzUF81Ymg0Mnkydk1zU3hZcw?oc=5
2025-09-10	Yahoo	-0.017	Nuclear ETFs Up At Least 40% in the Past Year: More Gains in Store?	Demand from tech giants is boosting interest in nuclear energy, but costs remain a hurdle. ETFs like NLR, URA, URAN and NUKZ have surged 40-80% in a year.	https://finance.yahoo.com/news/nuclear-etfs-least-40-past-140000756.html?.tsrc=rss
2025-09-08	Yahoo	0.233	Uranium Demand to Jump 28%: ETFs in Focus	Uranium demand could surge nearly 30% in five years, fueled by AI-driven energy needs and nuclear power's clean energy edge.	https://finance.yahoo.com/news/uranium-demand-jump-28-etfs-175900253.html?.tsrc=rss
