Date	Source	Sentiment	Headline	Summary	URL
2026-02-20	Yahoo	0.0	ETFs to Buy as NVIDIA Nears $30 Billion Investment in OpenAI	NVIDIA is nearing a $30B OpenAI stake, replacing a $100B pact and spotlighting ETFs loaded with the AI chip giant as investors weigh risk and reward.	https://finance.yahoo.com/news/etfs-buy-nvidia-nears-30-153900102.html?.tsrc=rss
2026-02-16	Yahoo	0.36	Is Vanguard Growth Index Admiral (VIGAX) a Strong Mutual Fund Pick Right Now?	Mutual Fund Report for VIGAX	https://finance.yahoo.com/news/vanguard-growth-index-admiral-vigax-120001705.html?.tsrc=rss
2026-02-12	Yahoo	0.4	PSA: Three Stocks Control 35% of Your Popular Vanguard Growth Fund	When you look at the most popular ETFs among retail investors, you’ll find Vanguard Growth Index Fund ETF Shares (NYSEARCA:VUG) near the top of the list. With $349.9 billion in assets and a 0.04% expense ratio, it offers cheap exposure to the companies driving the modern economy. But before adding it to your portfolio, you ... PSA: Three Stocks Control 35% of Your Popular Vanguard Growth Fund	https://247wallst.com/investing/2026/02/12/psa-three-stocks-control-35-of-your-popular-vanguard-growth-fund/?.tsrc=rss
2026-02-10	Google	0.0	Comparing American Funds and Vanguard Group: Fees, Management, and Returns - Investopedia		https://news.google.com/rss/articles/CBMilgFBVV95cUxNaGxfS1dnM1JOTF9kTTQwNzhNQ2RRT3lTWUdfM0FMWkk3SGxBMHZCSGQ5ZHp4SHJReFoxZ21XeUMzcG0xaHlCQXotdDZuUnE3aVJEWjBscFpBY0hjTWVlN284WU1nem5FaEhzYm8yT0hmbVAxU1FPb3Q3YklHWE04Z29tZ3JyS0FvOHVHS0ZneWk5cGFfSmc?oc=5
2026-02-09	Yahoo	0.425	The 0.04% Fee ETF That Turned $10,000 Into Over $35,000 Like Magic	When value stocks fall out of favor, investors panic. When they outperform, they feel vindicated. The real question: what role does a value ETF play when the market stops rewarding momentum and starts caring about fundamentals? Vanguard Value Index Fund ETF Shares (NYSEARCA:VTV) captures that shift. It holds over 300 large-cap U.S. companies trading at ... The 0.04% Fee ETF That Turned $10,000 Into Over $35,000 Like Magic	https://247wallst.com/investing/2026/02/09/the-0-04-fee-etf-that-turned-10000-into-over-35000-like-magic/?.tsrc=rss
2026-02-02	Yahoo	0.27	Vanguard Slashes Fees on Dozens of Mutual Funds and ETFs	The company that pioneered low-cost investing is again reducing fees on its mutual funds and exchange-traded funds.  Vanguard said Monday that it has reduced expense ratios for 84 mutual fund and exchange-traded share classes across 53 funds.  “When investors keep more of what they earn, the benefits compound over the long term, helping our clients achieve their most important financial goals,” Salim Ramji, Vanguard’s chief cxecutive officer, said in a statement.	https://finance.yahoo.com/m/c1590c58-2e3b-302b-8064-e6a6f1d56028/vanguard-slashes-fees-on.html?.tsrc=rss
2026-01-27	Yahoo	0.0	Should Vanguard Growth ETF (VUG) Be on Your Investing Radar?	Style Box ETF report for VUG	https://finance.yahoo.com/news/vanguard-growth-etf-vug-investing-112002569.html?.tsrc=rss
2026-01-17	Yahoo	0.207	Vanguard Lets Investors Bet on Cheap Big Tech Stocks The Easy Way | MGV	When growth stocks dominate headlines and valuations stretch, finding established companies trading at reasonable prices becomes harder. Vanguard Mega Cap Value Index Fund ETF Shares (NYSEARCA:MGV) offers exposure to the largest U.S. companies trading at value multiples, combining stability and upside without growth-stock premiums. Characteristics: Large-Cap Value at Lower Multiples MGV tracks 130 mega-cap stocks ... Vanguard Lets Investors Bet on Cheap Big Tech Stocks The Easy Way | MGV	https://247wallst.com/investing/2026/01/17/vanguard-lets-investors-bet-on-cheap-big-tech-stocks-the-easy-way-mgv/?.tsrc=rss
2026-01-11	Yahoo	0.085	ETFs That Can Beat the S&P 500 in 2026	The S&amp;P 500 closed a winning year and is expected to climb as much as 20% this year. The broad market index saw several ups and downs throughout 2025 but continues to remain a smart investment. Despite the risks, it is expected that the S&amp;P 500 will hit 7700 in 2026. It achieved double-digit gains ... ETFs That Can Beat the S&amp;P 500 in 2026	https://247wallst.com/investing/2026/01/11/etfs-that-can-beat-the-sp-500-in-2026/?.tsrc=rss
2025-12-29	Yahoo	0.0	Will the Ongoing Market Rally Continue in 2026? ETFs in Focus	S&amp;P 500 momentum and retail inflows set the stage for a potential 2026 rally, with ETFs offering ways to ride the bullish trend.	https://finance.yahoo.com/news/ongoing-market-rally-continue-2026-164200730.html?.tsrc=rss
2025-12-08	Yahoo	0.36	Is Vanguard Growth Index Institutional (VIGIX) a Strong Mutual Fund Pick Right Now?	Mutual Fund Report for VIGIX	https://finance.yahoo.com/news/vanguard-growth-index-institutional-vigix-120003872.html?.tsrc=rss
2025-12-04	Yahoo	0.05	ETFs to Keep Your Portfolio on Track in the Long Term	Despite November's volatility, optimism is returning to Wall Street. Discover how long-term strategies combined with ETFs can help investors build resilient portfolios ready to capture the next phase of the bull market.	https://finance.yahoo.com/news/etfs-keep-portfolio-track-long-160800229.html?.tsrc=rss
2025-11-28	Yahoo	0.0	ETFs to Benefit From Rate Cut Bets and Upbeat Forecasts	ETFs to watch as Wall Street turns upbeat, with bullish forecasts putting the S&amp;P 500 on track for 8,000 by 2026.	https://finance.yahoo.com/news/etfs-benefit-rate-cut-bets-151000943.html?.tsrc=rss
2025-11-24	Yahoo	0.0	Should You Boost Your Allocation to Growth ETFs Now?	Growth ETFs stand out as growth forecasts rise, Fed cut hopes build and investors pour billions back into U.S. equities.	https://finance.yahoo.com/news/boost-allocation-growth-etfs-now-134100986.html?.tsrc=rss
2025-10-30	Yahoo	-0.125	ETF Areas to Buy on Fed Cuts and Trade Truce Optimism	Fed turns dovish and trade tensions ease. Amid this scenario, tech & growth ETFs could soar along with some other areas. Watch SMH, QQQ, SPYG & IWO as markets may be up for a renewed rally.	https://finance.yahoo.com/news/etf-areas-buy-fed-cuts-102300580.html?.tsrc=rss
2025-10-28	Yahoo	0.367	The Zacks Analyst Blog Highlights VUG, IWF, IVW, SPYG and IUSG	With Fed rate cuts, easing inflation and strong earnings momentum, growth ETFs like VUG, IWF and SPYG are gaining fresh investor appeal.	https://finance.yahoo.com/news/zacks-analyst-blog-highlights-vug-092400264.html?.tsrc=rss
2025-10-27	Yahoo	0.0	Can Growth ETFs Power Ahead as Optimism Builds?	Growth ETFs like VUG, IWF and SPYG shine as easing inflation, Fed rate cuts and upbeat earnings fuel bullish momentum in U.S. markets.	https://finance.yahoo.com/news/growth-etfs-power-ahead-optimism-150100392.html?.tsrc=rss
2025-10-02	Yahoo	0.0	Buy, Hold and Build Wealth: ETFs for Long-Term Investors	Market volatility is rising but buy-and-hold ETFs like SPY, VOO and VTI offer investors diversification and long-term resilience.	https://finance.yahoo.com/news/buy-hold-build-wealth-etfs-140500550.html?.tsrc=rss
2025-10-01	Yahoo	0.3	Growth & Large-Cap ETFs Worth Considering to Power Your Portfolio	U.S. Q2 GDP grows at fastest pace in two years, fueled by consumer spending and business investment, boosting ETF opportunities.	https://finance.yahoo.com/news/growth-large-cap-etfs-worth-140000091.html?.tsrc=rss
2025-09-18	Yahoo	0.139	Equities Boom on Fed Interest Rate Cut	The resumption of Fed interest rate cuts on Wednesday, September 17, 2025, was met with strong investor enthusiasm. Of the $16.4 billion in net flows into ETFs on Wednesday, $14.63 billion flooded into equities globally. While domestic ETFs remained the primary focus, international exposures also benefited.	http://www.etf.com/sections/daily-etf-flows/equities-boom-fed-interest-rate-cut?utm_source=yahoo-finance&utm_medium=rss&utm_campaign=yahoo-finance-rss&.tsrc=rss
2025-09-17	Yahoo	0.044	Investors Retreat From International, Turn to U.S. Equities Ahead of Rate Cut	The highly anticipated Federal Reserve interest rate meeting this week kept investors focused domestically Tuesday, September 16, 2025. A collective retreat from international equities turned instead to an influx into U.S. equities as an asset class. Strategies that benefited spanned the range of equity exposures, including growth, value, mid- and small-cap, as well as broad large-cap equity ETFs.	http://www.etf.com/sections/daily-etf-flows/investors-retreat-international-turn-us-equities-ahead-rate-cut?utm_source=yahoo-finance&utm_medium=rss&utm_campaign=yahoo-finance-rss&.tsrc=rss
2025-07-21	Google	1.0	7 of the Best Growth Funds to Buy and Hold - US News Money		https://news.google.com/rss/articles/CBMigwFBVV95cUxOVmdGY2oyN2JKV3lpRTUyVVZITDk3RGlKcE9yQmlxNWNSZ0pxYjJZdFJyYmpNTk4xMlFlYTc4RnA5SDR0LXJ1RWwzS2NsdXc3cFhWQk9xclhTU1JqaFlIWm9CYl8wcXBfdGp4R1ZUOU1LTlJhRTRHOGVINGEweXJYbkExaw?oc=5
