Date	Source	Sentiment	Headline	Summary	URL
2026-02-19	Yahoo	0.136	NVIDIA’s 13F Bombshell: A New AI Power Trio Emerges	NVIDIA did anything but stand pat with its investments during Q4 2025. See how the company turned over its holdings in the quarter.	https://www.marketbeat.com/originals/nvidias-13f-bombshell-a-new-ai-power-trio-emerges/?utm_source=yahoofinance&utm_medium=yahoofinance&.tsrc=rss
2026-02-19	Yahoo	0.078	Synopsys Appoints Former Deloitte Executive Peter Shimer to Board of Directors and Announces Board Transitions	Synopsys, Inc. (NASDAQ: SNPS) today announced the appointment of Peter A. Shimer to its board of directors. Shimer brings four decades of experience at international public accounting firm Deloitte where he held numerous executive roles, including serving as its interim chief executive officer (CEO). During his tenure on the Deloitte executive committee and under his financial stewardship, the firm increased annual revenue by more than 135% to $30 billion. Shimer's appointment is effective immed	https://finance.yahoo.com/news/synopsys-appoints-former-deloitte-executive-210100831.html?.tsrc=rss
2026-02-19	Google	0.0	Advisors Capital Management LLC Grows Stock Holdings in Synopsys, Inc. $SNPS - MarketBeat		https://news.google.com/rss/articles/CBMizwFBVV95cUxQMXRrcDBlR0RkdG44MTZpTF92THk5QVY0ZERIbldjd0UySHJnTGhldkJvTVNHb0hNWUNWc2hNdmYwRXdTTWNlQjNkZDBNb3dQVHFMbTNoWktwMnRiQ1YtSWk1XzI3N2NUZjk5TlUtMl9FRG9sNzE0S1ZSdWJZUllpRi1WNW9hZkJPZjRFeklRMy15YkZWbjhkSDhqMlpHd3NINUJSck9iMy1uUnhvUHNMZFlFVE42dW5wQnlBY1B5TURvZUNzWjhQdVQxekM2NnM?oc=5
2026-02-19	Google	0.0	Ex-Deloitte executive who helped drive $30B revenue joins Synopsys board - Stock Titan		https://news.google.com/rss/articles/CBMiwAFBVV95cUxNMFhmU3NabEJXMEx4dWU0bG5zR1BUMVZyZldqeHFyV2NxZ2pRYVgtMmxWNzkzMHdvTW5HRDIwVG1uUGVSdUh4N2NTWlZmdTY2TFVXZ01BM3hVQzJRbzNJVWFESTlHMFJ2cWg5RjMzMkRSWnVXYWRhb1JfYWVyeWZ5NU5QNHRJRmR0aGhRS3hHcFNGY2w0WFVZcnF5dzV0dGdjNldjSnRwN21NM0xMNXNWX3BwX0J5ZHBjWlVqWHVic0c?oc=5
2026-02-19	Google	0.0	Lib Dems issue Holyrood warning to John Swinney as the party eyes key SNP seats - The Herald		https://news.google.com/rss/articles/CBMijgFBVV95cUxQUUs1MDdFZkM1SFhJSjcxSzlzQkMxQ3hzcThiSlBIYzcxcjVuZkFVQlpoV0xBMjB3dENReXViRFo4TGV4MmpENFc1VExaMzRtOWpwRk1WZjYzQWNoZXZNUi1PRUNzVU1PUXpyOE9CeWs2UUpFRkMwN1BNS3RTOFo0SzB2ZU5GY3NQaEcxS2hB?oc=5
2026-02-19	Google	0.0	SNP drive to fix Fife roads and give £150k to Dunfermline - Dunfermline Press		https://news.google.com/rss/articles/CBMiogFBVV95cUxNT1AtLUdIXzM4YWR2YmF4QjRWYVFMdDkxOUZrM215OGJuMjZHbjVwaGVVN2dCRXl2M1BmZlpFdU9TcjhZeFo3N0Jib2lpYnk3UDRUYU12d2xTNThWa2sxV2VCcElOLUFpSU01blJFX0dsQmRFUHVMUktXa3JPdWJ4Zi1MX0pVVXdRTndaUHl4RER3YzA2eWhsS2tnc01xTEJJT1E?oc=5
2026-02-19	Google	0.0	SNP supporters must put logic over loyalty at May’s election - TheNational.scot		https://news.google.com/rss/articles/CBMioAFBVV95cUxQN090TjR3d2J3Vk53TzJ1V2wyMVdxaG96OE9qa3U3eC1oN0NMV1QtY0E0R1JnSVJURUNsRHI2M0Q2VGxBQjhNSW54T05JaVdFNmVseTgwQVIwbmdOVWZnajlGMkx2T00tMlQ0ZGJ3TzYzempSSzdTOXB2RU1JQU1rajZKdXhWN1Nwd0hHSG4ydTlmbUtmQmVXTlh0WDhiS0Fl?oc=5
2026-02-19	Google	0.0	Synopsys Updates Board as Part of Governance Refresh - TipRanks		https://news.google.com/rss/articles/CBMipwFBVV95cUxNR3oxNTBsUlZFbkh5NTNwdDIxU0J0REFzVEdablNQSGlocFlxbUwwOHpvM2ppZnRRM0ptbTVvYnZ4NkxFNkIyaXRFVjNUdW44QWRrcUhERGNpQkFFazk1NHZzcl81M1FpNjRualRZVjJudWU0WGJremhyMjFaMnFZUkVrY1pNZ1hBZUw1ejZZNk1IZnJNN0FiVjdYbnE5alpuR3dqal9Mdw?oc=5
2026-02-19	Yahoo	-0.138	Applied Digital (APLD) Loses 4.9% as Nvidia Disposes of Shares	We recently published 10 Losing Stocks in an Otherwise Optimistic Market. Applied Digital Corp. (NASDAQ:APLD) was one of the worst performers on Wednesday. Applied Digital extended its losing streak to a sixth straight day on Wednesday, dropping 4.92 percent to close at $31.91 apiece, as investor sentiment was further dragged by news that Nvidia Corp. […]	https://finance.yahoo.com/news/applied-digital-apld-loses-4-142449970.html?.tsrc=rss
2026-02-18	Google	0.318	Expert analysis as new poll puts SNP in touching distance of majority - TheNational.scot		https://news.google.com/rss/articles/CBMimgFBVV95cUxOUU1CMWV3QlUtMTFiMERqRy16b3kzUDMtRXJZOF9FMGJleEh4ZFpndGRITXpYU0JMSDh2QUMzYTVmN2ZGTGpOMUtRVnNDc3lrMU1XMk5iVV9WRlV5WE51M3JFdlZKQkhORTlNNnR6alFQeUtHdk1qOHp0ZEJNRDgyc1h5cWdYZ2RZR0JjOWU1MVExMUt2dVBqS1hn?oc=5
2026-02-18	Google	0.25	Holyrood election 2026: Stephen Flynn and former MPs top regional list selections for SNP - The Scotsman		https://news.google.com/rss/articles/CBMinwFBVV95cUxQNjRKcGo2dFdBX25mZE5BZXZEZDhnOWFJb1J5dmlOUTgxRTZrMEZSTDluakctV2JmSG4zNEJNQlF0V19KWnVjSUNoR0NRdzdWUjU5cXI1djVrN3VVNnpUUGF2bS1jQ0pkRlpZcmJtRUd6aS03WHNmVTI0WmhWVXhnZ3VHeTZhdG1wVzVNRVZvMEJCZ0U1SERSVVlTb3hRQ3M?oc=5
2026-02-18	Yahoo	0.021	Assessing Synopsys (SNPS) Valuation After Recent Share Price Pullback	Why Synopsys is on investors’ radar today Synopsys (SNPS) is back in focus after recent share price moves, with the stock closing at $421.95 and showing mixed returns over the past year, month, and past 3 months. See our latest analysis for Synopsys. Recent selling pressure, including an 18.28% decline in the 1 month share price return, contrasts with a 9.23% gain over 3 months and a 3 year total shareholder return of 19.75%. This suggests longer term holders have still seen positive overall...	https://finance.yahoo.com/news/assessing-synopsys-snps-valuation-recent-201149980.html?.tsrc=rss
2026-02-18	Google	0.0	Assessing Synopsys (SNPS) Valuation After Recent Share Price Pullback - Yahoo Finance		https://news.google.com/rss/articles/CBMijwFBVV95cUxNRThYUnVKWWNVNkswLWJGemxjbzNWSVptdV8xWFFSSExuUzJhNzBjeVRNeGxLaS1TeTZGVlNoWVlodERiUWFjSGwwVUEwWE1Cank0MDhvQVlyczFNWVRNaHZoQy1vM0dUa2hjNVUtYV9WRUQyWTRSeTlEWnFsQm1xQ2hTSUVOTlE0N0ZIZXJINA?oc=5
2026-02-18	Google	0.0	Lord Advocate rejects claim 'SNP got political advantage from Peter Murrell memo' - TheNational.scot		https://news.google.com/rss/articles/CBMiowFBVV95cUxQZ2Z3QnpfcUNtTEVZOEtvc1dJX3pQQmhfZEpYZjRCcmtBTnFwcE9ZbTVqcTZ5R3RRUkdZZUgtUGVvLTN6aTgxVjJfQlZGNHZyaUsteUs4dkR6YTFoQUc3RXRVV0dQYlA3VjQ4d3V6Zk9LeE1TNkhfVy1rSEloU2pKUllMS0lkQU1NcVo1QlpwWnhIak82UDg5NVFmTnVqZlJVeTFn?oc=5
2026-02-18	Yahoo	0.0	Nvidia Sold Its Stakes in These Firms. The Stocks Are Sliding.	Shares of these firms lost ground Wednesday after a filing revealed Nvidia sold off its stakes.	https://www.investopedia.com/nvidia-sold-its-stakes-in-these-firms-the-stocks-are-sliding-11908549?.tsrc=rss
2026-02-18	Google	0.0	PNC Financial Services Group Inc. Grows Position in Synopsys, Inc. $SNPS - MarketBeat		https://news.google.com/rss/articles/CBMiyAFBVV95cUxNYkJ2UVd5YWpjTllrMGROMnNJTG5heUVSRFRrTFQyeXNpMjkwR2c4dEl5SndDOGtMREZUWmo4d0s2aklhWV93RjRFUG5tRGxMcVh6YUxBaFNodkRMYjVVUllvN3lPZmRmNVhHYVZQcWcxRmRId0FfcjRJMndhU1R4VUNGWjlud2FpU3haN25NR3o2Y2pJR3hlZTFQMEN1QVdCYno2eF8ycUNzSHBzMWxrRE9rREpuUUVoRng5c0FNWC1ERERhOHo2aA?oc=5
2026-02-18	Google	0.0	SNP unveil every regional list candidate for Holyrood election - TheNational.scot		https://news.google.com/rss/articles/CBMimwFBVV95cUxPd3Q0Skl0Q3B4a1dFNmh1ZXNXY1JrUU1rZnJJRWJldWozU1h6dmh3SVphNWdYRTlIMjFJRUtodkk3ckVrMmNzSGF0SXlMRWl4VE1ta0cyR0x1cU8tVEVaV1hFSnUzamxFZjE2NUVoX2QtcHhrNGlhc19ZdU5VQXl3X2N2OGtiZ2ZuU21pZDFaczU1V2NrTFdkLUY1NA?oc=5
2026-02-18	Google	0.0	Swinney was told of Murrell charges weeks before they became public - BBC		https://news.google.com/rss/articles/CBMiWkFVX3lxTE4tTFYteG5FNjBIdFpxeUJBZlJfc1JqUFk2bThNeVB3RjdBN2dDQ3pFZ1FmS1o5SDZ6dTRQcnh2VS1TSVdleFdwVzhMRS1KSEhUc0d0cVdqSG1iZw?oc=5
2026-02-18	Yahoo	-0.029	How Investors Are Reacting To Synopsys (SNPS) AI Disruption Fears Amid Chiplet Push And Ansys Deal	In recent days, Synopsys, Inc. has been presenting at the Chiplet Summit 2026 in Santa Clara, showcasing its chiplet and multi-die design expertise through multiple sessions led by senior technical leaders. At the same time, the company is facing market anxiety that artificial intelligence could reshape traditional electronic design automation workflows, even as its acquisition of Ansys and the integration of SimuTech Group highlight a broader push into advanced simulation and...	https://finance.yahoo.com/news/investors-reacting-synopsys-snps-ai-091212036.html?.tsrc=rss
2026-02-18	Google	-0.1	SNP handed 'clear political advantage' after Swinney secretly briefed on Murrell 'swindle' case, Lord Advocate warned - The Scottish Sun		https://news.google.com/rss/articles/CBMinwFBVV95cUxPY3pCOXowZlZvbTh2V0xVU1V0U0pRV3ZzUDRIb01vQ05JenVMVnl1dUdkcjdjcWVOWm5GYk1aaWxNTHNFUFNUZkRhc2VIaFJUb3Vwdm5uNlJOMVlfM2hjaEExbFJoMk90UUZDY3djc2dLd1l2QlIwQUNJWE9CT3gxRmtUYllZbUVPdVRUXzFNZ1p5bnI1MHp0S1VQVF9sNTA?oc=5
2026-02-18	Google	-0.5	Close Glasgow's 'failed' drug consumption room, Scottish Government urged - The Herald		https://news.google.com/rss/articles/CBMimAFBVV95cUxPQ1U0dmhHUU9CWEZyTmNkbjhFMlF6M3RVY2p0eV82QmFRdG52eEJBY19DTFpZQWRya2dSX0VvTU9RYzRERHBTU1ZJdG1jV2EyenRHNERrUkJQeXBBWk5adlZ5cFhQXzRXWW5aTHdOLWR6ZUl3UFg0RUV1aWphblVzcks1alVNeVlSRTBCR0VVcTVmS3NsYmxKbg?oc=5
2026-02-17	Yahoo	0.1	Nvidia Sells Off Stake in Arm, a Company It Once Tried to Buy	Nvidia unloaded 1.1 million shares, worth about $140 million based on Arm’s closing price Tuesday, according to a regulatory filing.  The disposal, which occurred sometime in the fourth quarter of last year, brings Nvidia’s stake to zero.  Nvidia declined to comment, while Arm didn’t immediately respond to a request for comment.	https://finance.yahoo.com/news/nvidia-sells-off-stake-arm-233905528.html?.tsrc=rss
2026-02-17	Google	0.0	Douglas Ross clashes with SNP minister over 'meddling in Peter Murrell case' claim - TheNational.scot		https://news.google.com/rss/articles/CBMirgFBVV95cUxOSjRZa3ZCRjR2Zk42S3E5WGwzeWUyR3N5VnZCREllZEZ4Vy1BRDdabWxBWEZ3WlpNVVhTbnZ3LXZMaDZGcVZXb3MxMklxeTB2cWI3UHhmaFkzaTZxR3F1U1RabGtZeERCSWVOWjFqRnU4SmpLdWl1Zm9tYmtrdHJacGlwOFFOSXhwaHpma2tSd2dDRDdrRTRtbVRxbXJkYk5oV2NMczZGNjMyRG4yRHc?oc=5
2026-02-17	Google	0.0	NEOS Investment Management LLC Buys 39,353 Shares of Synopsys, Inc. $SNPS - MarketBeat		https://news.google.com/rss/articles/CBMiygFBVV95cUxOWnlfaUxoUnNENFlDb0JpRWw4VGd0NVViZnR4dzdkZXg0a3Z1cmgxbUlEOHJKdm1YTkgzOEZCRTN6QmFETHJTcGw0bjRPZXFNTDNQMWhuUEVXTlg4a2U3WHVlRFFzS3U5bUJTZ0pYb2ZmN29XZTlRZkhkVDFqLVRxVFpZZHEteVI2ekRTTS1ZVmZPSFlSclZVUjU4Q0UtbGtXbDdJbnZQLVdJSEtjR0VoaEVHOWg3ZDBudGpUOHdNN1AxVHVTRENNQ293?oc=5
2026-02-17	Google	0.0	Public Sector Pension Investment Board Buys 4,807 Shares of Synopsys, Inc. $SNPS - MarketBeat		https://news.google.com/rss/articles/CBMi0wFBVV95cUxORFM3NV9tMGNyb0ZtWXdQVEJuZnZrOUJ5bE91S3BjVnl4NDFNLXdER1Z4NVhuSVBoSV9aNmVZeHBoYXN5RmJaZ0RDWEdGeU8zaE15eHVJQnYycDJfVEZxZWZZZnNkcW1ya0lTTW1rMV85ZnNHZm1GZVpSbklxTXl3Tk1GYWc5X2VuUHE5cVpZSGRJcjRwM2F4LWJuSU4yeElHSUoxY3NNcy0tcTUybXdYNU1kY1RLLXRqeVUwZUh5LUFfUm55SWdUTjY2bVQ4OTNPaU5N?oc=5
2026-02-17	Google	0.0	SNP’s Stephen Flynn under fire for £900 Champions League freebie - The Scottish Sun		https://news.google.com/rss/articles/CBMipAFBVV95cUxQaFQzS3RmUFlIMzJTUm4zZWtmdlZTTjI0aDg5VG1WYXRCdGlMMGJPUGRrQmJCVE5Tc3VRVTFaYkt2cE5JdzBsbjhrRnktekIzWTgtXzEtWm9BWHZtRVhYbnJCVVNtTldkM25zejRQaUU5ZXMzcm9OOVhIMDhfYUFobnRUel9VOVhISk00VGUya2xORlp4Mkl5QTVGVk16eTZzSURRRg?oc=5
2026-02-17	Google	0.0	Sarwar spiked SNP’s guns and finally we have a Scottish campaign - The Times		https://news.google.com/rss/articles/CBMivwNBVV95cUxQd21IbldpeEVCYUVHa1VrY1ZIVU1TN1lXMUkxb1JzSm13cXFHekJrdHNVZHhZdjJtc3RtcTV3NDlCSng0SXBFYVJ5QW1XVDJDUVZWZi05RjdsOXVxTWNUcjNveEFob1RFM3AtRkw1SGVyQTVRLTJBR1o5WmNzeldvQkhiVTZwWkFqQ0ZzclZUMm04cWd3ODI2MTFtUmN3aGxKRVZkeTZLNEs5TFM4WHowWWpNZWNnRjlwVlBucmwtc2w1WnB3V1N6a1plWWNIS0ZxQzBlWWxGOW54NmxFTXJBaE9KUE4wYVRDQTRxcXVZck8wUERsZ0lvYlNnUlcwU045bXdGWFR0bVF3UlBKUDRwVmJ4T1lvRU40eVVPR00wUEJyU1hTcXRmWGlLUWEzZGwzUHlzQ0dnejdrWGdMTjd3WHZMUF9ZY2p3cUU2ZjFOT3JadmtYbWowRGExelJZbTVRVWcyNHlYU3VVZmxtQUpNMVg0UVZSamZZTEVWOUhTZy1DWG01eDBfU3lYTmU2YndfbXc4TnFVcks5MHR1MlhkaklNcFJWRkJYRTVaalNlakdmd3UyOVVOcHdtRlJiZ2c?oc=5
2026-02-17	Yahoo	0.0	SimuTech Group Named 2025 Worldwide Channel Partner of the Year at Synopsys' Simulation and Analysis Global Sales Conference	SimuTech Group, a leading provider of Ansys simulation software — now part of the Synopsys portfolio — alongside comprehensive consulting and training services, today announced it has been named 2025 Worldwide Channel Partner of the Year at Synopsys' Simulation and Analysis (S&amp;A) Global Sales Conference.	https://finance.yahoo.com/news/simutech-group-named-2025-worldwide-133000664.html?.tsrc=rss
2026-02-17	Google	0.0	Skandinaviska Enskilda Banken AB publ Boosts Stake in Synopsys, Inc. $SNPS - MarketBeat		https://news.google.com/rss/articles/CBMizAFBVV95cUxOQm5EUlhfbVdUTWtBRGpvU2tCV1V0NE9yR0pIamxaeXVxSlBmSGlybzgyU2M3anIwVHpCbVdHZW1rTmcyWDNLRjF3MXU4cmZtVlZ3REFPYzF4cHAtcWs3VDZzcUtxYTBJaVptZEZzT1JDcE5mcXdISmhiMjlqYmZHbF8tT2xOaTRmU19IVkxxeHZBU05DeWxqdEZMZEJmc2V2TjhyQkhSbW9qVkVNYjFZYUxLQnZEOHhzcXlBbFJueEZhbnlIUXk4TFc1MF8?oc=5
2026-02-17	Google	0.0	Vanguard Group Inc. Raises Stock Holdings in Synopsys, Inc. $SNPS - MarketBeat		https://news.google.com/rss/articles/CBMivwFBVV95cUxPaUh1Wmo5WmN5Ml8xbUFKRHJTbmU0QmwwSUNPWTlpOHcwMnpiUzk1UVlyZ3BWMlZyUnM0WVdVc1NLTTk2NjhUVkFVTDBwaDNYWGlDdl9XOWM1azdySElPRVFFVkhDaC1pRExDdU5Dd0ZqTkl3RS1MTUZGU2kzaVFHTHVrSXpjWFg3dDU0MkY4TjFKMXlHUWFrVU5LTE9QeEhiZWtFbUpmMkxLZ3VPM291eGoyTGl5bFRGMlppdTBrNA?oc=5
2026-02-17	Google	0.0	Warning SNP's flagship tuition, prescriptions and benefits policies at risk without further tax hikes - The Scotsman		https://news.google.com/rss/articles/CBMi3wFBVV95cUxNa3UzYVZOLURDenVVa0NTZWZPd2xiWTZ6Z21nUERmcXh0VWpKMEhUQlN1V0Q1RlhlWGxtTFY3ZEFTZ0lRTmxRVjQyWnh0MnB3bGZZQlZVNldKaHdtenNsTXNtLWVGVXVpVWdlVk1uU0NCVWlLbUIxUldPSDNWa0llTVNkRk11eXhrdko5TVo0UWVWLVJ6YkhiM1FkMDNIVVIzM2VPWldkSmdWcEtkcWdqMmx0VUFRQ2ZPeVNyam12dWxTcjY4ZWNHeV93S2NxM29DYkFpUmZJcDV2aFhOMG9B?oc=5
2026-02-17	Google	0.0	What has changed since Alex Salmond called for both votes SNP in 2011? - TheNational.scot		https://news.google.com/rss/articles/CBMinAFBVV95cUxQeUVUdjBNZGFLSThZNjMxeU5TSGJKMGVIa1ZMblpyQ1hSX19yTHA2U2RoaXFKbk1QSGttZHZ6dXJlOE1LbUwwSGlDWVhRdHdubDRrTFo5a0dSZVpISEJxcERsYlViTDNjSFc5U05IdTN6M3N6YkFvVnZvdE1ULU1hdkg2MkNWUi1KaWVZQkl6RG9IMGtBbVgtdy1ETms?oc=5
2026-02-17	Yahoo	-0.05	Synopsys (SNPS) Stock Sinks As Market Gains: Here's Why	In the closing of the recent trading day, Synopsys (SNPS) stood at $421.61, denoting a -3.54% move from the preceding trading day.	https://finance.yahoo.com/news/synopsys-snps-stock-sinks-market-225003801.html?.tsrc=rss
2026-02-17	Yahoo	-0.078	Why Is the US Stock Market Down Today?	S&amp;P 500 drops 0.65% as AI disruption fears hit tech stocks. Get today’s US stock market analysis with sector breakdown and key movers.	https://beincrypto.com/why-is-the-us-stock-market-down-today/?.tsrc=rss
2026-02-17	Google	-0.1	Synopsys (SNPS) Stock Sinks As Market Gains: Here's Why - Yahoo Finance		https://news.google.com/rss/articles/CBMihAFBVV95cUxPNW16c1N3RGwzcVdPckJjMFRiSnNyVEtMUDZST1ptZXA0OWFUQVBFbC1UWE9HSzAyS1pJZkxzZ1JVUnFSNGFMa2VRUjl3NWtfWVNMSXVKbm9iSEVPSXBuR0R6RDRHSDlhbXQ4SkJQREJCSVljMFVZaVpuc3VsNVNKUmRIWFQ?oc=5
2026-02-17	Google	-0.167	SNP branded 'corrupt' over Peter Murrell case being pushed back until after Holyrood election - Scottish Daily Express		https://news.google.com/rss/articles/CBMilwFBVV95cUxOSWJwQ29qZDFTOTJ6dnBNMGNwWG9GclpkdmhjVDJHVzQzX1BTd042NGdvbXFhVVVydU5IeXJfXzAzendUQjE4MTQxOWR3b0FWMlNveUdXWEwzNlJUZzY1Y2J0YTd2XzZIb2RNYWdMc1pteFp2NkQyelQtVmo5RmZ5OVcza0ZzRmYwOXZrQXhYQTBWcjFhSTJ30gGcAUFVX3lxTE85MUo1Ry1WeVlwcFZYQUV0TllRMmVFdlV0YUNOR0VvY2JBS2lYS3daZFhUMGUyWEJ2MFJnVjRhUEhHX3VEVkFWTmNrMmd6MS1INXJmTEhGZkl6Q0xmb25YVzhTakduQU9PMkJPMl9ueG9hR3lsVnl2YkhyTDV1amRRQ1BpNjV1dXBVZ2xKeHREajFwZDVoZjQzU1VSaQ?oc=5
2026-02-17	Google	-0.5	SNP bosses branded 'corrupt' after Peter Murrell's court case postponed after bombshell charges revealed - The Scottish Sun		https://news.google.com/rss/articles/CBMikwFBVV95cUxQZnNWOFF4YWVBN2owa0FnUVB6bXZqUkQ0ZUFpVmVpNl9RUnlVVWRYQ3prdFR4Z0J5b1VmXzh5enNkQTJGRThWZVFBQVlFcHdGZC1mSWc4T0lEcjNjLWRZcGVyUktPSzhvYjVSM2ZSNW0xY01ZblRlQlExbE5yR0otMW5TQm5KZkk5SVJJaHRTZVNETnc?oc=5
2026-02-16	Google	0.0	Aberdeen Group plc Raises Holdings in Synopsys, Inc. $SNPS - MarketBeat		https://news.google.com/rss/articles/CBMitwFBVV95cUxPQ2pkYktUNzgzdnlWaUYyeTlFazlUazZ4N0ZiSU1YdVlQWTRjbEVvZDVyMGVtSThyWG8yWE90U2tpdFlrWUZ0dTBSUVV3QTVZZDIzdWJZUlpnTGZ2M1lVRzEzeGxuQnVsQmtGekpVMXVYcTlWUE9tT3gwU1k4TUhQb0daUktvb2cyNm5zNXBMU0JfZUZtd3hkSXp0UFA3aGd2QlpmblhDQVZ5R3duTzgyOS12LXBRaEE?oc=5
2026-02-16	Google	0.0	Fifth Third Bancorp Lowers Stock Holdings in Synopsys, Inc. $SNPS - MarketBeat		https://news.google.com/rss/articles/CBMiwAFBVV95cUxORTNhZ0VYcEtYRVg5d0hzM0QxZVJpN0NPdEdyVFJSNW1NWWJVdDJxX01qYXg1eS1OM25RY1l3VUE1dTd0TktseHR4R0lHQ2c3bUhHQ0dJWlB1VVNmbFNOWGJ5aXR1LXQ3QldpOURyZG4wUmdkZHFLZk1sM29ldDZvd0ItOGRGWnpzOTY1TzQ4dWJsX3NlNUstalJpWm9GV1JIcVVEX2t3RUxBUHVjdXRBYmh0NjVFWGk1ZjZDV3cyNW0?oc=5
2026-02-16	Google	0.0	M&G PLC Increases Position in Synopsys, Inc. $SNPS - MarketBeat		https://news.google.com/rss/articles/CBMiqwFBVV95cUxOeFZPUVhmeUtMMnNpLU40bTNTMW5sX3dJM0tDQ3RpMy1nRklHSm9MRGNRYTdXZnRBaXdETTNqak9mOFZDUnNxc0tkcDdWc1FXLVFKVEJTcEtJVkl2UFFnMVpWZWFWXzNlMTdUOFFJOTcyUWNuRjF1bFFZY2lnNEttUFRnbjkwWGtEN0xqNlZPMk5JV1R3eUY1VUpNeEVFU2JSRmoxcXRURDZwUGc?oc=5
2026-02-16	Google	0.0	Synopsys Investigation Initiated: Kahn Swick & Foti, LLC Investigates the Officers and Directors of Synopsys, Inc. - SNPS - The AI Journal		https://news.google.com/rss/articles/CBMizwFBVV95cUxQVVBxcHRMa2x0cWdXS29BU19PQklpOTV3NHFfT3R2TUl0WDh4M1RJQThaOE5ibXlCNzk2eWJGbGFzcDVZLTFUV0tDOGVseF95VGxzQXBJcHRBd2prX3FNTm9BbTFvS3U4eFBGQUlWYlFiX21YNURiM040ZjVaeGVMNHppN0VLRHowQmF0NE9DTmlpM2pza01PUXpIaGhRaVZaMjlWOF9kUXd3SFRfcnA4ckg1YklnRnRhWUdPV2F0R1VuZ04weDV6NGpYUmxoQkE?oc=5
2026-02-16	Google	0.0	Synopsys Stock (SNPS) Opinions on Quarterly Earnings Beat - Quiver Quantitative		https://news.google.com/rss/articles/CBMimgFBVV95cUxNUVZ2eWcxbUVuNHNxcDQ1bWF3Qm5na1BFcHFSNzZIMklGeVdGQzhRc3Q2SmpTVTJSMTNvU0czdHF0RGM5b2hTekM3SVVadXpyNW0wNFc4b3F3bWpDdWR1VkItSnpBRTFhcU1GODRxVTE0SnEzbzhEeU1CR24xRXpUTHlOejRSUUw0UEZMU0I2a3ZrWWY2SVg2YWhR?oc=5
2026-02-15	Google	0.0	GF Fund Management CO. LTD. Buys 3,294 Shares of Synopsys, Inc. $SNPS - MarketBeat		https://news.google.com/rss/articles/CBMiwgFBVV95cUxQTV9TeHpmaWVtZHZsZks5QmlVbEFHUDZjT3VOZkVJTUVMZkVYSzl1eHZBLUlwdHpVTFJ1U29SWVU5eFdIYTE4UXNCR2lvZXVTTllpSng0Nkx0dUhpbUZBWE5FMDQtemItNkIzX1JTRWhFN1Z6dkdrTHhFV1JiWVlyWWxtV2NpV3dUdWtRODlZazE4elpJbUY5cEFkYXhxSlpsNDBKQlhpTkVoUHJYOVJmRmNTcGVHbUREUC1nc1h6NU0ydw?oc=5
2026-02-15	Google	0.0	Synopsys (SNPS) Valuation Check As Institutions Add, Ansys Deal Closes And AI Partnerships Support Record Revenue - simplywall.st		https://news.google.com/rss/articles/CBMixgFBVV95cUxPLVZOdUhoNjJxNHlBTm0zVHh6Ml95dDV4UG5SZWFLMC04T0ZKd2VHZmllLW1vZktiNjBVOVJfNF9VMlJrTzNkMUZIZFEtX2dyYVlOSklpRUcydnNhRGxHQ1JzODdTczBXaTlSX1l0QjZMc2NIRWpQTkp1bFY3U2dsZUtoV25TcUtXT2t5Wlo1SUQ4ZVF6dXlvTXByLUtTS0FqaXJveDZYU0RhMzJaNVB1Rkd2YmdWWnViamg3bDF6SFRqWFRPb2c?oc=5
2026-02-14	Google	0.4	$SNPS stock rose 2% this week. Here's what we see in our data. | SNPS Stock News - Quiver Quantitative		https://news.google.com/rss/articles/CBMiowFBVV95cUxNZUUwbGIzTUl1MHdrLXBBZFRLX3BYVUZiX1M2RzYyazJfZkVqdzR6bGNNeVZ0MS1ZbmJtdzFELWtqekx6QllxQVVvc0sxa1U4aXFLMHRqWU9ySEJfdmpZTVdrYkFJX2JhYnA5MHM3T3k2dDRld0RpN0ZmTzFTZWZsQW1zZ1ZIX1dvUTBmRVBPa2VaRDZ4WGNhRWJFSk93SnI1amR3?oc=5
2026-02-14	Yahoo	-0.043	Synopsys Week In Review: China Headwinds, NVIDIA Partnership, and Margin Expansion	Synopsys (NASDAQ:SNPS) is having a week worth watching. The chip design software leader posted a 2.39% gain over the past five trading days, climbing from $426.88 to $437.09. Year to date, Synopsys is down 6.95%, and over the past month, shares have dropped 13.51%. That sounds like poor performance, but Synopsys is performing much better than ... Synopsys Week In Review: China Headwinds, NVIDIA Partnership, and Margin Expansion	https://247wallst.com/investing/2026/02/14/synopsys-week-in-review-china-headwinds-nvidia-partnership-and-margin-expansion/?.tsrc=rss
2026-02-11	Yahoo	0.217	Synopsys, Inc. (SNPS) is Attracting Investor Attention: Here is What You Should Know	Synopsys (SNPS) has received quite a bit of attention from Zacks.com users lately. Therefore, it is wise to be aware of the facts that can impact the stock's prospects.	https://finance.yahoo.com/news/synopsys-inc-snps-attracting-investor-140003035.html?.tsrc=rss
2026-02-11	Yahoo	0.123	Is Synopsys (SNPS) Getting Pricey After Recent Volatility In Its Share Price?	If you are wondering whether Synopsys at around US$437.45 is a fair deal or starting to look expensive, you are not alone in asking that question right now. The stock has been quite volatile recently, with a 4.4% gain over the last 7 days, a 16.7% decline over 30 days, a 8.9% decline year to date, and a 17.3% decline over 1 year, set against longer term returns of 16.4% over 3 years and 50.5% over 5 years. These swings have kept Synopsys on many investors' watchlists, as the share price...	https://finance.yahoo.com/news/synopsys-snps-getting-pricey-recent-091508311.html?.tsrc=rss
2026-02-10	Yahoo	0.103	Should You Invest in Synopsys (SNPS) Based on Bullish Wall Street Views?	Based on the average brokerage recommendation (ABR), Synopsys (SNPS) should be added to one's portfolio. Wall Street analysts' overly optimistic recommendations cast doubt on the effectiveness of this highly sought-after metric. So, is the stock worth buying?	https://finance.yahoo.com/news/invest-synopsys-snps-based-bullish-143002893.html?.tsrc=rss
2026-02-10	Google	0.0	Should You Invest in Synopsys (SNPS) Based on Bullish Wall Street Views? - Yahoo Finance		https://news.google.com/rss/articles/CBMihwFBVV95cUxQZlZTZEpBdkVyRlJaUUZ3WVlYLWliVVhnZDZvbm5OY0Y3YVlYa2xhbHl2WHVTcXF3Vi1PUm4tcjdOdEFmSWgyTFowSF9vRVJGMUxGbHVFLUp3WC1wdThtYWhMWTJuanhoNVpBYjRMMzZqZ2d0VWxGYk1YdmMzRGZLbF9uZkxRaFU?oc=5
2026-02-09	Google	0.125	Synopsys (SNPS) Rises Higher Than Market: Key Facts - Yahoo Finance		https://news.google.com/rss/articles/CBMihgFBVV95cUxOakI4aWlOWkhoYnVhV202VW9lSEItOXJEV1dzY0JzamhDb1dTcFdoU25ETVIzTDd1anMtajBCR0FPNmFyZDdpZ3VNazdZQm9CVU9uaDZpZzRkb3lQRUxnams3UkVXSTI5R3JXTEM2RGFVOEd6X0x0ZkwxRFNqTnlJdTJpTTAwdw?oc=5
2026-02-09	Yahoo	0.097	Synopsys (SNPS) Rises Higher Than Market: Key Facts	In the latest trading session, Synopsys (SNPS) closed at $438.9, marking a +2.82% move from the previous day.	https://finance.yahoo.com/news/synopsys-snps-rises-higher-market-224503061.html?.tsrc=rss
2026-02-03	Google	0.0	Synopsys stock slides 8% on AI disruption fears — what investors watch next for SNPS - TechStock²		https://news.google.com/rss/articles/CBMipAFBVV95cUxPZ2VVUFdRM1FCUFBUaGQxUkd6UkR2bUpRZTFNTkpPOXFzYmVwalEyd0dmRWEzSzNsekVYb2tJRWpGUUd2VG5takFodmluZXRJWmcwMC1zU0hCTVRqY2lQOTVacG1qQ0c2eW5FTnZ1WDhYakVreDRhVkxoZ3dhZXNweHNWNW42MXpoMGZaanJBNTBsVFMwWGh1dXgwWER2UjljdlRqbw?oc=5
2026-02-02	Google	0.0	Synopsys, Inc. (SNPS): A Bull Case Theory - Finviz		https://news.google.com/rss/articles/CBMidkFVX3lxTE1RVVNCR2U1N1ZOM2VXeGIxUTdRdzRacHdoRmNscjBDOUtwV3FqRHNPNmxhcHZtZ0t0SWpDVlpXUWNmVDVFUTBHZDFreDRGOFF1SmdMS1RpX1ZOUFlyMVFpYXR3bDhVV0U3cDFZU2FSaTBKUWNBZGc?oc=5
2026-02-02	Google	0.0	Synopsys, Inc. (SNPS): A Bull Case Theory - Yahoo Finance		https://news.google.com/rss/articles/CBMifkFVX3lxTE5Eb1pfYXF4SVRhZU1NaGVFQ3pid1FUX1N5S08yVVF2c01zampBaWY3VHh1aE11QUFKaW0zX2xRSno5SWdpSndLTmMwdTRBd1o0NVk1djFyUkxpWEpBX29MSm1fYXh6OWh5RHRpeS11SFhydHJVcmtmRHhGZ1I3Zw?oc=5
2026-02-02	Google	0.0	Synopsys: Powering The AI Engine (NASDAQ:SNPS) - Seeking Alpha		https://news.google.com/rss/articles/CBMifEFVX3lxTFBXZUwxQ0xxdFM0X3ZJNlYydDkwcTVuZlA2aDJPelVwMUFJeUF4VjNSTmhiU0RWMVZ0eWc4SXRBMWpOTUQ2LW1aMGxBTEVNT3hjajJTM2hMVDVLcFBCMklRQnVjWU8xSVdRbTN4ZDY4LWJjUGVfV1hXSDBQTFE?oc=5
2026-01-29	Google	0.333	Synopsys (SNPS) Falls More Steeply Than Broader Market: What Investors Need to Know - Yahoo Finance		https://news.google.com/rss/articles/CBMihAFBVV95cUxObjhSVkRyc3dlVjZNcVBTQUl0NW9aMEFLdnhMMFhYdWtYcmlZUjZpZkRLMk4tdVhyQ05SNzF6UmNXNUFfbUo5MkFzV0pFdkpfaHVqdzRCbXhqODctMm9yQ3c5Wjc3NVdXMlI4Ql9vQkRGSVhBTGtfM0h1WV9uOVhrRVRmZTc?oc=5
2026-01-28	Google	0.167	The association of Alzheimer’s disease-related SNPs with mild cognitive impairment susceptibility in the Chinese population - Nature		https://news.google.com/rss/articles/CBMiX0FVX3lxTE5Ba3RmMEVEc3ByQ0xTVW1YS0RhR0pFdzhtU0VMS3UyaWU0QklIRlJpUHFEWDhhQVdjcU9sZGw5RGZOQ0ozanFqcnlzV0x0Y3hRY0JUWE1MQnd1ZUpicUFZ?oc=5
2026-01-28	Google	0.0	A Look At Synopsys (SNPS) Valuation After Recent Mixed Share Performance - Yahoo Finance		https://news.google.com/rss/articles/CBMiiAFBVV95cUxQMEpJamh2RURjVmpkdEF3M3R0cHE5LU8yY3ZqMnlqdW9rQTVvTTJBY28tejdrb2tXUGpScHFVZ0JqT19CUDZwRzRFNUZ0VVJ0UGtLelRtdHJTdmZxUUN3c3kxTFlpN1o5ZFpfc0lZWWZKWXJaTElXTWF3T3JsN2g2RTNlYlhFV2tX?oc=5
2026-01-28	Google	0.0	What Synopsys (SNPS)'s Co-Packaged Optics Tie-Up With Lightmatter Means For Shareholders - Yahoo Finance		https://news.google.com/rss/articles/CBMihAFBVV95cUxPYU43ZHpzT0sycGNyNGFodTVpN3hSSmk4MmF6Y1ZldzFyOHJjaXkyd3ZqaWFzLTNZS2tPdGhPcW83OHE5Q1Bpa0FHTFpTQ1dqSHB3OU0yS0prdHdFd3Y1Nm1XZl9ZQU82V01EOW9jRzc1MklfV0ZXd1MwUkdfZjNYRkZJZzc?oc=5
2026-01-27	Google	0.167	Synopsys Announces Earnings Release Date for First Quarter Fiscal Year 2026 - Synopsys		https://news.google.com/rss/articles/CBMi2AFBVV95cUxNR19jSm5jajEwejNVWjlCWVRHa3FUV3MtZjFJQVl1bnAySTg1MkdJbnQzZkZwTVJ4OExtRXFjVDh0alAzM01mSVgtVndlOE0xVzcwX2RfUjNxN1drdHkxa2FKbDM2cEIxTW5WUWhNUmdTSWhzZUotOVdmeW83ZXRaY1V0dVo4ZzRydEt3TDZFd1Q0OGs4ZXNMRVJGdFpwb0RNcXZWX2t5UjVoLUNnRC1kTVhrZ1g4dTZUa0Z4MWFEbG1ub1A5aEJ5RWZDTVJMdmJNZVVZdGN0clU?oc=5
2026-01-27	Google	0.0	Synopsys, Inc. (SNPS) Is a Trending Stock: Facts to Know Before Betting on It - Yahoo Finance		https://news.google.com/rss/articles/CBMihAFBVV95cUxQeWhQekIwcm04YWJzZG11UFNXZHhMTzNsUm9YaHpESVdzRlA1QkhlQWlGWTlyWEJuWWxPUHdRS0xmRlNVNE9mYnBJZ0QtUk14cUNvVURGbE1URFdzOHlxcVl1TFVtZW9UWGh3ZDdqbFF6LWVTRllnNTVHLVhtOGVua0Y0Zzc?oc=5
