Date	Source	Sentiment	Headline	Summary	URL
2026-02-26	Yahoo	0.0	Synopsys Q1 Earnings Surpass Estimates, Revenues Rise Y/Y	SNPS posts a 24% EPS jump and 65% revenue surge in Q1, fueled by Design Automation and Ansys, while lifting its EPS outlook for fiscal 2026.	https://finance.yahoo.com/news/synopsys-q1-earnings-surpass-estimates-142100849.html?.tsrc=rss
2026-02-26	Google	0.0	Synopsys Q1 Earnings Surpass Estimates, Revenues Rise Y/Y - Yahoo Finance Australia		https://news.google.com/rss/articles/CBMikAFBVV95cUxPY2tkZ0dQcGZaVnpKSm1YdWo2NnFvbGZGN2UwNmdLWEJMeThhdVp3b3hvWTFvWjIwbTdKbVQtWVpBOTFIX294RzRiUjFTSWlxSE15RnQ3Wkl3R0NMM0Y0ZHdlWFpNbl9Lb21ObUItcWtoVnAzNTh4WE5JbmRhdDhPTTU3MDdzX2RFa1FSRDFUdnE?oc=5
2026-02-26	Google	0.0	Synopsys Stock (SNPS) Opinions on Earnings Release and AI Outlook - Quiver Quantitative		https://news.google.com/rss/articles/CBMipAFBVV95cUxPdmtGZ0YxN0x4Tlh4WFl2SUtJVmltVHZwNUhQSEVxeXV1M0I3YjNoX1hZUGFmbTNFVm9ySUtiVUk2dWRBdTFYVC1kQjdXaWRLaHJGUm8wTGM1X3YzU2ZUXzEweWxSSzdRM1pySWl2LWUwanZfeDB4ekllWF9zR1RtTXg5VmJoU0pmaWMtcWkxMFB2SGNFdVBNUGJ2YkJ2cDJhYUdaNg?oc=5
2026-02-26	Google	0.0	Synopsys posts Q1 FY26 earnings as market watch intensifies ahead of $SNPS call - Traders Union		https://news.google.com/rss/articles/CBMihgFBVV95cUxNdFNTVWhvVWJPVzZyblc3QmlOajVGUHdaZEdqRDRIZmI0UkF2dEtlTThKU1FLWmN6RVliUnNvSUc2Znp0XzZrd1A4TnBvZFVUWkN5QlBveHZfLTNMc3NMWThXVkE1YVE0aEdDbVI2c1E2UlN1TmtSX3ZHcmxJWjNvdFpHSlNQdw?oc=5
2026-02-26	Google	0.0	Synopsys, Inc. $SNPS Shares Acquired by Mitsubishi UFJ Asset Management Co. Ltd. - MarketBeat		https://news.google.com/rss/articles/CBMi0gFBVV95cUxOTTVLQ0RsMEVFTnVkVjdTd1JLZnJjQl9fZ01VWEFEZDE3MTY1alVFYXJqb0M2TVh4cWFDVDVCTGNoZ3VqcU0wenRPTUdrZzduU2xORGplR2JucWw3cXh6dGdtSWVucHJ3N2xwSXJPd0hBdW1PVFgtY04xbmdSYWl4UFk0MGREa20xYzhiREZoVWNDa0V1YkEwVlVwRlhGQVg3WFNBZ0hrek5vYmxvX1NUWDQ2MXdSMVlxdDZzMWhOZ2lNX1BWcEdHcHBUdUNONWM2dVE?oc=5
2026-02-26	Google	0.0	Synopsys, Inc. $SNPS Stock Holdings Raised by Montrusco Bolton Investments Inc. - MarketBeat		https://news.google.com/rss/articles/CBMi0gFBVV95cUxQVGtLYzFhRVYyLTNmTGM2NzZma3h6dGMwVDZ2ZUlGSUNfZTRlV19MQTVwd01RZjA1ejVMM1F0ZEU3c09yOUtRUW9GdGNTRHYtLThLbXRYdXdUQWhmeDB2UV9ZRk9yZFZ2a2s3eXB3aVNIVVBRLWZ2R2J5dHJodngtVGNsbEN2Y2lPbE55aUpwMTAza1FOV3JVTFRiOXU1bHlUUElrdzBtLXhkNDdWd2tPWFp6MTliYXFSZmJJWGIxRXhQOVI0bk1lQWE0aEdVTkJrT0E?oc=5
2026-02-26	Yahoo	0.0	Synopsys, Inc. Q1 2026 Earnings Call Summary	Moby summary of Synopsys, Inc.'s Q1 2026 earnings call	https://app.moby.co/home/research/tools/earningsCalendar/earnings-synopsys-inc-q1-2026-earnings-call-summary?utm_source=yahoo_finance&utm_medium=rss&.tsrc=rss
2026-02-26	Google	0.0	Wall Street Analysts See Synopsys (SNPS) as a Buy: Should You Invest? - Yahoo Finance		https://news.google.com/rss/articles/CBMihgFBVV95cUxQbklVY19qYlBDT0VDMjMtTnRkQjhXZzJuNlhka2M1QzFzN1FkM1pFVEdYM0phQkpkenZjeTVDbXE4a1phZ2loSmdDVUJZT3FXanFHTmNuWEZrNnVRUU1nNkJvUHY0SFFzYml4RG1pWTVjU3RuQmdlT3BFSUNCb1BXa1dGcDN4Zw?oc=5
2026-02-26	Google	0.0	Weakness in the IP Segment Weighed on Synopsys’ (SNPS) Performance - Yahoo Finance		https://news.google.com/rss/articles/CBMiigFBVV95cUxPXzdJNW9sMWl0Z19hc3BVd0k4b04tbm5oNjA3dEdiOEhzU3hkQVZsaHNTUzZkcklFMno3ODFYdWg3aXpJbUEyOFN6VnVyUV8tb2JvN2ZRSUE4eGdDSlpwRWJQQUVGWWlVbjgtQUNtUXpqWnRXNG1xZlZXc09NVTBBQXNoanNSbU9aYmc?oc=5
2026-02-26	Google	0.0	Wells Fargo & Company Cuts Synopsys (NASDAQ:SNPS) Price Target to $450.00 - MarketBeat		https://news.google.com/rss/articles/CBMivAFBVV95cUxQbXFiVUJyR1JHMXJWaXZXY21DOWs2MTczMHMxZEJrRXlRbXd5Wk5ITFZ2NGpxcG5zTEE4c0lxaGUwT2Q4dGFsSU5hRUN1Qmx2SEFmVURxZDhxUk9oWTVJSHY2QXRkbUxEVENULXQ2RFc3RTc5TTNTbnc0ZFBLOHNhOWRsRDFtRnRMWWRtUFk4MXgwdkpId3M5MjFkT1pQellwQ3RsVm44ekFYWW9WNl9NeC1qZUZaVVFvaEZRaA?oc=5
2026-02-26	Google	0.0	Wells Fargo Adjusts Synopsys (SNPS) Price Target Amidst Equal-We - GuruFocus		https://news.google.com/rss/articles/CBMixgFBVV95cUxOVEY1VTFabTRBMFVXRndTeHJtc1M1dWJaOTFxVEltU3d0Y0NFenl4ZkkyTVFhV293UHlDbTRXcDNLN2pwMUZQOW5xYTdCQTdtTnZiTWtra0h5NGFLT0J4MzVqX0NVWDh1WUE2cTRxZllsTi1iY2V1ZTg4cWsyVlNMUlNoQXNtWkVWZmZ6OWtpZTRKMzNTdzNVa0Qwd05OZGxvajV5WU1yZmRiV1Bjb0JSY3ZQRE50a04wZHlINU5hNWp4R3lyTlE?oc=5
2026-02-26	Google	0.0	Why Is Synopsys Stock Falling Thursday? - Benzinga		https://news.google.com/rss/articles/CBMimwFBVV95cUxQem56RU1NMWlua1JoMGVsR1kxZVlVSG90MlNYckIxMzZzeXlCRV9TbHVmUlVTbXFfVWFiLTdWdkZOcWw3VFJoX1hOR3hELXhOWngzTlBkQWNqYW90M2FaMndETGRfT2VqYWdTdFZBSGhYUmNpeDVRT3Z2bC1qcGYwQndmMC1MSFVCN2xpc3FsWEh2M3hqUEFRa2FxNA?oc=5
2026-02-26	Yahoo	-0.048	Wall Street Analysts See Synopsys (SNPS) as a Buy: Should You Invest?	The average brokerage recommendation (ABR) for Synopsys (SNPS) is equivalent to a Buy. The overly optimistic recommendations of Wall Street analysts make the effectiveness of this highly sought-after metric questionable. So, is it worth buying the stock?	https://finance.yahoo.com/news/wall-street-analysts-see-synopsys-143004532.html?.tsrc=rss
2026-02-26	Yahoo	-0.238	Nvidia CEO Huang said SaaSpocalypse narrative wrong, sees ’deep misunderstanding’	Investing.com - Over the last month or so, markets have been gripped by a grim narrative: the “SaaSpocalypse.” As agentic AI surged, investors fled traditional software names like Salesforce, ServiceNow, SAP, Cadence, Synopsys, and even legacy giants like IBM, on fears AI agents would replace the need for software altogether. In a wide-ranging interview with CNBC’s Rebecca Quick, Nvidia (NASDAQ:NVDA) CEO Jensen Huang called that thesis not just premature, but fundamentally wrong. His core argume	https://finance.yahoo.com/news/nvidia-ceo-huang-said-saaspocalypse-151227858.html?.tsrc=rss
2026-02-25	Google	0.433	Synopsys (SNPS) Reaffirms Strong Revenue Forecast for FY26 - GuruFocus		https://news.google.com/rss/articles/CBMimwFBVV95cUxPWWROdlJUQlhQaHVpZm1DYndJRXFHQzkyTDZjRmpGS0Q3UjR5RkkxdWx5QUlHQzU4NmJKYzE5SVBPTnRhWFZCWE12aDJrMHk2N3psYmlSSC0yNHRwYjViVUFZWjk3QlZILUN3enhSTnJzZUVNelNzTzVTSWxnR1UwSTV6WkllR1FkS1RaZnczSWhiaVhWczE1U1BWSQ?oc=5
2026-02-25	Google	0.433	Synopsys (SNPS) Reports Strong Q1 Revenue, Exceeding Expectations - GuruFocus		https://news.google.com/rss/articles/CBMiowFBVV95cUxNWEEtc250Mlptd05aR1lqNGh5UWJoRVFiZFRVUlQ3SVU3UGRLNFRFTEg2RE9paElSaGNVOGVnRGpoVEYxajROM2JTdVUyc0pBRTlDc1pLc0RUSUlyWm85MDVKRTNQY2RUTWNIclJhUC1oaW5RbVVPbW1TdVl3WUltNEU0UHRzZ3l4dU5hYjhfM3o1a04tSmtmdlFkYTlqb1VkUXJj?oc=5
2026-02-25	Google	0.433	Synopsys (SNPS) Shares Dip Despite Strong Q1 Earnings - GuruFocus		https://news.google.com/rss/articles/CBMilAFBVV95cUxNUFQ5NWVJNXZTRWxCSjZOdTd4bm1qRWtwdnF6ajhJbkJJOGRibndZUHZBd2s3UlppektETXJVdm8yQ1VMcnFoRnphMWxXdFNaRjZCaHRHZUFYcEVqQVVvTnVTbS1OVDlVSDM5YXhwckNXTkRXREs0akZYWnRXUDB4MWVIM0pkVTFBeU53Q0ZUTXNSVG1s?oc=5
2026-02-25	Google	0.433	Synopsys Posts Strong Q1 Results, Expands Buyback Program - TipRanks		https://news.google.com/rss/articles/CBMirAFBVV95cUxQZWxJdU9OeTFzZXE2QkQ3NU83dG01em9fU1ZlV3hVRDR1V0NiMzAzb3RSVXl0aEU2azNpYjhRM2I3Q3dJVHNCamVjTE1WTVVDb0NHQkNKVzR5cmNuX2lDTlVWWHAySWNWRDAtdXJobHFDR0ZDUUE0UEtRWVozcUd4RWd6T05EU0NKUTNVRmpKM3hHd3FBNVBkUnZ0SkhDSEdKTzRJWDEyZEVwbHda?oc=5
2026-02-25	Yahoo	0.297	Synopsys Carries $13.5 Billion in Debt Into Its Most Consequential Earnings Yet	Synopsys (NASDAQ: SNPS) reports Q1 FY2026 results tonight. While there will be revenue numbers and EPS figures to parse, if you’re watching this stock for the right reasons, you already know the real question at hand: Can Synopsys actually digest a $35 billion acquisition without choking on the debt? That’s the one thing. Everything else ... Synopsys Carries $13.5 Billion in Debt Into Its Most Consequential Earnings Yet	https://247wallst.com/investing/2026/02/25/synopsys-carries-13-5-billion-in-debt-into-its-most-consequential-earnings-yet/?.tsrc=rss
2026-02-25	Yahoo	0.2	Synopsys Posts Financial Results for First Quarter Fiscal Year 2026	Synopsys, Inc. (Nasdaq: SNPS) today reported results for its first quarter of fiscal year 2026. Revenue for the first quarter of fiscal year 2026 was $2.409 billion, compared to $1.455 billion for the first quarter of fiscal year 2025.	https://finance.yahoo.com/news/synopsys-posts-financial-results-first-210500899.html?.tsrc=rss
2026-02-25	Google	0.136	Live: Will Synopsys Beat Earnings After the Bell? - 24/7 Wall St.		https://news.google.com/rss/articles/CBMilgFBVV95cUxPNUFld3NMV09lSVk4eVBFSEsyMHYxME9VS3AtMG9hTWlPQTlfSWZaYUVxdmJwNW5LWURnajRPUVZkM0pFSnZ1UTlUanpGVUl1Tk5PZW15N2hTaEJxcG9zbHgyNmNSYk8zU1dJNmhCNUNzdWpZc0pZbE9zdTJFdjFua3JlSncycFZCQ0RPbXlGSmo4VTBMSmc?oc=5
2026-02-25	Google	0.136	Synopsys Stock Price Today | NASDAQ: SNPS Live - Investing.com		https://news.google.com/rss/articles/CBMiW0FVX3lxTE5kalFLWmRLUmdkRDdKTFllcUFiYko1SU1OaTBsdW80SGZERnVhZnZIaGxnRzItNVdQQnVoNUZqa2M1VlZWTFk3WDVKRmk5dWpIM25TNXpjZk91ZHc?oc=5
2026-02-25	Google	0.0	AMD Posts Linux Patches For SEV-SNP BTB Isolation - Phoronix		https://news.google.com/rss/articles/CBMiZkFVX3lxTE9fX0d0SWQxaEprQmxXWEdmd0ZEb0ZXWFRHdFFOZ3NFVk9IcENkRDZIYk5UaXlnVk9qb21uZndxdVpJWlhnVUZLeEd6cjZMNU1LSUFXSzhXd1cyUGNpM09OUUkzcEt4QQ?oc=5
2026-02-25	Google	0.0	North Star Asset Management Inc. Acquires 3,689 Shares of Synopsys, Inc. $SNPS - MarketBeat		https://news.google.com/rss/articles/CBMizwFBVV95cUxNM1pvVVNjUXhXRnhQbnBaQS05cTFERTRBREZpU3RENnNRMDZCNi1qZ25PZ1NUM0Z3YnhNU1ZiSF9zaGI1Q2NHNTJFLTBEYmEtNmVseS1pRGFQVmpYV1ZwWkF3RHNPRGU4blRMZU85VDRESmRnWkNPNVg0ZTFZVmluV3pVMDJrby1rblpRNnRaZkN3b2pRa0tTZldZVDFJLVg3cVc1aEg4aVRhalRoemZfemFWT3AtcnVhdm1iR0xKT0RtTnFHaEd1YTVCWXZTM3M?oc=5
2026-02-25	Google	0.0	Synopsys (NASDAQ:SNPS) Releases FY 2026 Earnings Guidance - MarketBeat		https://news.google.com/rss/articles/CBMirAFBVV95cUxPeHBoWmlvZkg1Y2d6d0FHUkdlV0FDbFdld2p3VFZHdjQ5UFVnTTZoSmo0c3pfZ0pBWV9mdVZiMFpBT3ZKYW9yQU9WdXk2eE52VmFNN3Z6VGFjMi1xczRYaWpaZ1RaYzBXNXdIMTI2d2FkZHBrUG55WEx0MFJYa0JiS3ptX19YZFp5V01nUmotbzROa1k5T3diSWREY0lJOFJNbkRQazUzLXJNdnNX?oc=5
2026-02-25	Google	0.0	Synopsys (SNPS) Announces $2 Billion Stock Buyback Plan - GuruFocus		https://news.google.com/rss/articles/CBMilgFBVV95cUxOSGtRZDJzQWVBV2x3ZHZkdjUzcFhNbkpWdmRhLWtob2MyR1dySzhxdkxlaTNFcnNLdlhkNllKNUJ3MTEyc2FEd2RSZ0lBdnVIdzVZSVBsdVpueF9RWm1VYl9JU3R3NlFtQXRuZHBSRlhieDdVWlQzeUJTYzFBSko4Slh0RkN2T2tjZGNhWGhaeEU5a0NtNUE?oc=5
2026-02-25	Google	0.0	Synopsys (SNPS) Reaffirms Fiscal 2026 Revenue Forecast - GuruFocus		https://news.google.com/rss/articles/CBMilgFBVV95cUxPNXRQZlE1TndUTU5kbHhPS0lxR0JTNklBTFk0SS1mS0NzUHlvNG1FcFJHU0c2aHhrTEZUTktVZDRDbVZuQV9WRTVHM0JrLXJObEduTktCajBVMFc2MllOenhaY0NqNkMteG1HNC14dWRWQW1YVGdPNFpCOXNCbkpZOWluRC1rSDZsbEFrSnlUY3BISUJDLVE?oc=5
2026-02-25	Yahoo	0.0	Synopsys beats estimates, guides in line with expectations	Investing.com -- Synopsys Inc (NASDAQ:SNPS) reported first-quarter results that exceeded Wall Street expectations, with adjusted earnings per share of $3.77 beating the analyst consensus of $3.56 by $0.21. Revenue reached $2.41 billion, surpassing the $2.39 billion estimate and representing a 65.6% increase from $1.455 billion in the same quarter last year.	https://finance.yahoo.com/news/synopsys-beats-estimates-guides-line-215105600.html?.tsrc=rss
2026-02-25	Google	0.0	Synopsys slides despite Q1 results demonstrating 65% revenue surge - Seeking Alpha		https://news.google.com/rss/articles/CBMipgFBVV95cUxQbURXeFhfYzFJRDlYeGk4NHdpSUJfUV9teEdQQTcyVkFibWZ4Y1ctWm8tdHBKSEJSdFJTaUZWeERmSnRuaEc4OXNuSF90VHpoZ1pIS1BicVg4TE5tOVhsUU12NVhXTVdxWVZETFZydTFVR3BxZU1JSlpYa1dsZWZtMVdxZ0p0VE5fdEsxd1dTcklLNHBOdW13MUFZVEgwV25acV9ZQThn?oc=5
2026-02-25	Google	0.0	Synopsys: Fiscal Q1 Earnings Snapshot - marketscreener.com		https://news.google.com/rss/articles/CBMikwFBVV95cUxPelZyNHZhNUtibU5jTXVuSllaaF9fbE1uNlBaekRCSDhMZ2RGTW1xcWpaS2Zyam5aOVFLRUVsNjN3TUhvTVNvNUE3LXN5MU5PZWJxZFd4MTFhYWlDUEZ3cG9ONXNFQU03WkpWb3ZpVWRHOVpPdC1ONGI4ZE1qaDlaVzN3SVkwcE9lWDJURTJ6UklKeE0?oc=5
2026-02-25	Yahoo	-0.017	NVIDIA Announces Financial Results for Fourth Quarter and Fiscal 2026	NVIDIA corporate headquarters NVIDIA corporate headquarters in Silicon Valley Record quarterly revenue of $68.1 billion, up 20% from Q3 and up 73% from a year agoRecord quarterly Data Center revenue of $62.3 billion, up 22% from Q3 and up 75% from a year agoRecord full-year revenue of $215.9 billion, up 65% SANTA CLARA, Calif., Feb. 25, 2026 (GLOBE NEWSWIRE) -- NVIDIA (NASDAQ: NVDA) today reported record revenue for the fourth quarter ended January 25, 2026, of $68.1 billion, up 20% from the pre	https://finance.yahoo.com/news/nvidia-announces-financial-results-fourth-213100479.html?.tsrc=rss
2026-02-25	Yahoo	-0.125	Synopsys: Fiscal Q1 Earnings Snapshot	The average estimate of eight analysts surveyed by Zacks Investment Research was for earnings of $3.57 per share. The maker of software used to test and develop chips posted revenue of $2.41 billion in the period, also beating Street forecasts. Seven analysts surveyed by Zacks expected $2.39 billion.	https://finance.yahoo.com/news/synopsys-fiscal-q1-earnings-snapshot-211446810.html?.tsrc=rss
2026-02-25	Google	-0.138	Research Alert: Snps Posts Modest Beats/raises; Design Ip Remains Weak, But Is Stabilizing - 富途牛牛		https://news.google.com/rss/articles/CBMipwFBVV95cUxQSmF5VFJhQ3c3U2IxZktHM0w0UkFJLV9FQlMxV2JXVzd2azVIUVlBd1ozV3lzelF6YVlrN0ZxSlhUY3RFMHZMUm1HWUJWa1o2S1d6dHhlVmNTOGhpcjBzdFZscFJLU24xUzkxc09LU2J5dTlnMVcwRGt4MEhuREFJcjBKejFNNmdyeUItUFlpblEwMmlvOG9XeUhSVHMxeV9hQ1AwNUpTMA?oc=5
2026-02-25	Yahoo	-0.2	Nvidia Is Building an AI Infrastructure Empire	Nvidia‘s (NASDAQ:NVDA) graphics processing units (GPUs) dominate the artificial intelligence (AI) ecosystem, powering the vast majority of AI training and inference workloads. Market data and company filings confirm its chips hold leading share in data centers. Yet Nvidia is not content with owning only the GPU layer of the supply chain and customer stack. The ... Nvidia Is Building an AI Infrastructure Empire	https://247wallst.com/investing/2026/02/25/nvidia-is-building-an-ai-infrastructure-empire/?.tsrc=rss
2026-02-24	Google	0.0	Generation Investment Management LLP Cuts Stock Holdings in Synopsys, Inc. $SNPS - MarketBeat		https://news.google.com/rss/articles/CBMi1AFBVV95cUxOS2MtZ3BOMm5PU0lIWTZPNGF6YVhoUENNdDdnWlZSNVpDYVRmLUlaM0hsVDZkajhuUlNON3VyWVREa2RNd2w1NGNEb09qbWxWM0gzWThsU2p3OHBmekRuWkNMVzlLM2pzV2U1dUpwejlWVWlIRGhDNWdrX1dCaTJqVThZSHNFeVlFR2tUSWpwUFVsRVBaMlVrRVFndHNHUXB1bllnZU13QklWdEhraXJuekI2QXJtVzQ3YVVjS2VwOGFsdVZSajNZbXdEYXZqOTZtSnRDZg?oc=5
2026-02-24	Google	0.0	Napean Trading & Investment Co Singapore PTE Ltd Buys 10,055 Shares of Synopsys, Inc. $SNPS - MarketBeat		https://news.google.com/rss/articles/CBMi3wFBVV95cUxQQklnZnBtVzVtbGlUOWVfcHhvc2ZmdDZUbGdSRFRKRmthRkdCbWQ4ODBWS3psbWNHRXBEU0EtZnhtTmhpNzBHNUNkeWk4UzAyTmY1dXVsU3V1QTJNMi1fSDJwbHFuQ3Jtc0t3SHQzTEtzbXQzT2xnV2YxVG96VFBCZi1QMzhlbTNuMk5VcUJGZGtsVWk4SnZncWRUUVNaVUtGb1R2VTB5NUVVbHVfM2ZDZUJaOVhBdDhQeVdFTnRJLTVsc09FX3gxdVpvUzR6N1RvMWZTbk9PT2FvNTVJZkRV?oc=5
2026-02-24	Google	0.0	What's Next: Synopsys's Earnings Preview - Benzinga		https://news.google.com/rss/articles/CBMimwFBVV95cUxQVjhIZk5PU19oOW9ReXg1VHVhVmhpLWVOWDJmMHZGOU5aY0dQXzJERzVGQ2YzSEpiMEJVdjVqRFNPclBMTmtyWm1remJLYkYxb1VIaU1mTzJmVHVsc0tUWlZFdV9IdzRmX1JNZ0JZeVRYTW9ZODlNQmh6cHZiXzcwV2NGU2xZdENNb0VPUHFrVzFZMGVWN243S3o0WQ?oc=5
2026-02-23	Google	0.5	Developer SNP Properties snaps up more of Shockoe Slip in 3-building, $7M deal - Richmond BizSense		https://news.google.com/rss/articles/CBMiuAFBVV95cUxQckh6MTcwcHFsN09pdzh1YkdPaHRSdkJiRTc3UG00VkNtQkdxWlhzclpsYVVXYkdmSzFjNDJkYjVHM052TC1KUVRvdmQxaURRbF9sOC1Gb1M1SUgzSHMtOUZSWXBYU1ZMc0NLanByQS00REd2YU5ROTJzdnl6WTFrR0VjODNZXzFvZTVKWlc1SmNfOExwY0s5SmNPb1oySGhCLVNWbnNZXzZONUJTTFhtaFo5aHJYQkRX?oc=5
2026-02-23	Yahoo	0.233	How The Synopsys (SNPS) Investment Story Is Shifting Into A 2026 Transition Year	Synopsys is under fresh scrutiny as the modeled fair value price target edges from US$555.65 to US$553.40, a small reset that still matters if you are watching entry points and risk. Analysts framing 2026 as a tougher transition year, with questions around growth, risk and the core electronic design automation and design IP businesses, are a big part of why that price target has been fine tuned rather than rewritten. Read on to see how you can track this evolving narrative and what to watch...	https://finance.yahoo.com/news/synopsys-snps-investment-story-shifting-150910866.html?.tsrc=rss
2026-02-23	Yahoo	0.217	Synopsys to Report Q1 Earnings: What's in the Cards for the Stock?	SNPS gears up for Q1 results with AI-driven demand, strong revenue growth expectations and macro headwinds shaping what's next for the stock.	https://finance.yahoo.com/news/synopsys-report-q1-earnings-whats-154200903.html?.tsrc=rss
2026-02-23	Google	0.0	Premier Fund Managers Ltd Has $241,000 Stock Position in Synopsys, Inc. $SNPS - MarketBeat		https://news.google.com/rss/articles/CBMizgFBVV95cUxNRHo5Qnlfd0o3WDFLa0toS0tWSEJzNnZEcUNFUzFBSUxicGlZZ3VIZDZTSG5qcmxyM1EwT1NXZ1dwbXpqR2thc2pEbGdTOUlwTzR5WFVtTkllQXFPX0FILXVYRkROZ2tvLUF5TEgyZXRreFJkRDVrUjBEanB6THRwQ1lfbWdKYm5lZWhpV1hpaDE0MkRSZDZ3M0YyQjBRTTBvSzl4REV2d2Rrbjg1bmpDc2Z1UzV2eXh1UjF5OVpYbGd2T3ItR2NpUk9tSnR2Zw?oc=5
2026-02-23	Google	0.0	Synopsys (SNPS) Valuation Check After Recent Pullback And Premium P/E Multiple - simplywall.st		https://news.google.com/rss/articles/CBMixgFBVV95cUxPYlhlaEVYVk1OOGdncW1mWXRWVG5ITF96S0x1VEJyYlRFTk4zQ0gxeGtFb2szYmstOURUWTFzbzllQ09GZVZCTFNPRWFWckI5QVpSNU8taUo0NThVamhBSWNNeUhZSDl1aTdQYy1saEVrOHdBUmwxRnRuM3BTLWN4dFByeEFTbE1nYnFiTHBOSGRfRmxrbUFiRjVvU2ktUmZJYTB0ampWM0hUYW1Za004YlZpWUVPSk9BaWVNblBaaFRiZmRyMGfSAcsBQVVfeXFMT2lkaWNIM3lZd2FDU2ZiLWQxeDYtN2lRUlcyS0VyQXdhM19ZakhLVm01aF9sVVdEblJBd2hHTU1ha2Z5Zk9KdWxFVnBzX09zNElTR3hIRk4wTm85Vk8tR1g4ZkRoY05takd2blpOSmFxcUlHR2hralRsbjdFRGdZMkhfbkw2bVVwWHhoY0dSRG1GR2RNZ0tla21Ha1kwNk11dnNVeUJFZkUzYnVwYjBOQjVZTEtDeC1hUzNveC05M0dCZ2lBQ2VBQktiZzQ?oc=5
2026-02-23	Google	0.0	Synopsys stock slips premarket after HSBC downgrade as SNPS heads into earnings week - TechStock²		https://news.google.com/rss/articles/CBMiqAFBVV95cUxObTJNT002d09yUG54cEtfekVZNTRPUDZZQS04WmdkcVN5Q2czakQ5Vlc1bUNxWmhTbjlqUEd3eGcwbXMtcE9TWThkWUVmZmsxaUx6N0ZpeE5wTFExQ1VRVXB2NDRLaDhodkFrRWtsZWxBWW5oa0ZGNVVyNUpYaEpSNmpvbXpBQjdrYUFUMVExa3BCQUdiVlNnbzFDSF9JbUFRSHV3WTctYTc?oc=5
2026-02-23	Google	0.0	Synopsys, Inc. $SNPS Position Increased by Lansforsakringar Fondforvaltning AB publ - MarketBeat		https://news.google.com/rss/articles/CBMi2AFBVV95cUxNdEJxZ2xmdHFZb0VVaWdMT01RampiQ2V0bFV3QzBVQzA4cnVWM09TWWN2VG5MVWpyMmdzZGRPX3R2dE5RX1Bkb3pueXhHdFRBOXc2VE1sejNqa0lVQUFTODU3SGVaUmRmb25VMUpVdEU0dExsWWJmaEpMc3NOYml0eXNiVjlqRXlSVDZHMFBYV0tnaUc4TmtqWkF4Y2Foam8zVWN0M2d6NnZxWXU3MU5QOWJEbjhHcDR2U2U1M21oNXlxNG9kb1dpYnR5bzFidl9pbWRKMkZHdTg?oc=5
2026-02-23	Google	0.0	Synopsys, Inc. (SNPS) Drops 5.2% — Developing Story - AlphaStreet News		https://news.google.com/rss/articles/CBMiYkFVX3lxTE0yRkpHSmdtMnZVZ21pZU9aYTRPQkhuRGV0cUlBMkJxS1ZxMFlYaE9YTFhvd1V3Y3NWZjhkQVJrMzNNX2tJd3dvN0Nwcnh0UUljS1FyVGx6V0duUzlkRExrZ0RB0gFnQVVfeXFMTnJlZXlfMElvclY1dWRIdDhCV0dTaUR4MnlyRmVNd3RtcGh1MjFIVk1jcWVGQXk1U3kxMmc0bDRaUExmcG93Sk1ocDJMNWFaeXd3SmJnUU5YSzlfTEVmTXVNRVBWVzczNA?oc=5
2026-02-23	Google	0.0	Synovus Financial Corp Sells 8,629 Shares of Synopsys, Inc. $SNPS - MarketBeat		https://news.google.com/rss/articles/CBMivwFBVV95cUxOXzNRU3N3dkdYZjd3RFRXMXFBNi1VbWoxeGtYLVo2N25Pazh0bTBGMUZKNGNCSWIyXzlSYVZCNmRkb1d4ZEh4QmhFcjUxMUVIb195ZlNiVFdNYnNDM3hPVERhY0RoM19nNGlJb2ktR0h4QXJ0YTdOR243SnJnQ2xucDM5RTNLZ1BCUTMwTlp2ajZidTFEejB4UTJ4VklkSkNyRC1SaUpsMU9xbXE0b1RYZEFzUTB4Z3ktZUMzWU1qMA?oc=5
2026-02-23	Yahoo	-0.083	Synopsys Stock: Analyst Estimates & Ratings	While Synopsys has underperformed relative to the broader market over the past year, Wall Street analysts remain moderately optimistic about the stock’s prospects.	https://www.barchart.com/story/news/362453/synopsys-stock-analyst-estimates-ratings?.tsrc=rss
2026-02-23	Google	-0.156	$SNPS stock is down 4% today. Here's what we see in our data. - Quiver Quantitative		https://news.google.com/rss/articles/CBMiogFBVV95cUxNZXF4aWRPSG52cUdiREtUVFplU05QRFgxRzhjcFhwLWRjOTRPM0hWNEVvLXBvXzFpUEJNUHl5YzBLREpWOE9LV2hrSnJUZURIUEpBT01tTExmZkNWbWFvWWc3cWhzZDN2dFp4by1vdEVqWGV1cm8zQ0M4eGNYRUNmOVUzdDUteEdjSEl1dG5NWFppLS1adENGOUNZN2hTUy0zb3c?oc=5
2026-02-22	Google	0.0	Gardner Lewis Asset Management L P Lowers Position in Synopsys, Inc. $SNPS - MarketBeat		https://news.google.com/rss/articles/CBMizAFBVV95cUxNbVJIQVdRd09BYjhseFVDLXIxcXVrZ1pDYzdPaG1jTktvQWV0S2ctRHNmcFhJRDRqMF9PbWxHS0d5LWtkaXRYZVRZbzdRaFVRX3BZTmlCRDlzUE9IVTR2bEduWWlNQjZFbEZsLVhPZVlSTTZRX1VBYk8yQkRvdXhsNXlFbDZVSmhFRXRYejZTVzlic0xFbnFfX2RtelBQazVZWVdENkhnSWZzeFEwbUFWVEJ0LU5ONXA2c05LZndHVjk1VjNJLTZyMllQS2c?oc=5
2026-02-21	Google	0.0	165,459 Shares in Synopsys, Inc. $SNPS Purchased by Greenwoods Asset Management Hong Kong Ltd. - MarketBeat		https://news.google.com/rss/articles/CBMi5AFBVV95cUxORUhPaGZYdGNXWHBpS25PTmVvcWlUZmpmV0wyZEJJVFNwRUVOVUhnTkxzY2dqNERFdjNPdG9zMDlsNnBYV1RoRlVOSklINEdDYkpWWFd5UWJrUzNPejZzVGlJN2ZnUUgyUE01M2RvcGdzV2w3OTJ1U1QyWFdIbUIyRTRsdHhydlQ3cjVHN0F1ZUNjZFp2MFU5d0VPQm9CVW0wdWoxVnV3YlRlNlVBS1lXTnhuOW9sQ09VU01TQVRfWFFsMEE2RVZPR1d4NHhUSlFNZVBDWW1PMGpNdTBHMlVRZ1gxSkM?oc=5
2026-02-21	Google	0.0	38,152 Shares in Synopsys, Inc. $SNPS Acquired by Jupiter Asset Management Ltd. - MarketBeat		https://news.google.com/rss/articles/CBMi0AFBVV95cUxNNlZJRGVIaURvNVdpN1BiMUpJT2swSnY1ZWRzMTBUZnFjMEFEbXlFSklIMVBaMFdFdWxBcUVndm5kSkNiSHlVOUJCYXZ3Q1lxZVBBVUl3WGRQOE1Xc0RwTHFzVVNSUHlyUkN3UUZCbHFSU1ZBUVlTaDIzbnNDemp3bUNSdkxmX19zSTd5Ny0xWnh6QTNvdnRJVThMSWdzYndidHQ5U2oyajN2MGhVay1PaW01dU14RkhNMmdXNlBhVmRmQjdodVFITk01WV9tYkEt?oc=5
2026-02-21	Google	0.0	Tredje AP fonden Decreases Holdings in Synopsys, Inc. $SNPS - MarketBeat		https://news.google.com/rss/articles/CBMiuAFBVV95cUxORi02ejZ4UG5Eb1pSY1JfNnlHOFRDZUhvVUVOeGhVdzN0QzJUdkhwQUtNWHZ5bjBFeV85OVlkc3BzU3lHTFlJOEF5UUtnSy1LenU4V2JlRkd6enNTajdfTGFKSHZTR2J3ZE9RWXRXYXE4M0drRUh3enNwaVlFb3NNdjFGZ1Nub250Z29HU2xJSTg1QnNNYllQcU9mQndOVV8wTkFVSFd6ZXJ0VUdLTThjMl95T2kzbV9t?oc=5
2026-02-21	Google	-0.05	Auditors probe SNP' renewables project amid claims £750m windfall has been spent - Scottish Daily Express		https://news.google.com/rss/articles/CBMiogFBVV95cUxNY1ppMmRtenlaSjJ6NlpmUFZOY0QxWllXV2JoeW9yUW96U1NCQWppMkd1YUNKcDRUcDA1WS1rM21TNjNoVFRPaWJFX2NSdWtlWURwcjRhNDV6ay13dnhnZFJIVjZPSVMwYTI4R2oycTRlV2pyMmVFWlpDeWFhZDRiU3lYVnUxejZCbEtjNF82b054NW9NV3g2dlpyYWpNSFAtUWfSAacBQVVfeXFMTVI2dW9TS183RzJ2eE5acjBvSVdCbVFaNjRLRklqM0VDUlA3NXVnRUZsQVBvSzRIMkV4OWpvMmhmZ0Y0bXVoRWVFc0lycWl0M0ZoZ1I0X3U4emlKZjIxajNMS1dKVkQ1a19UT0pMN1M2cFRBbG9EQjZVV0pRbE1YdFA3d1NIWnVzb2ZPa2xXTnB3aE1PR3hDUU9tblpkV3Y5VFluejRNSHc?oc=5
2026-02-21	Google	-0.4	Regional ballot is the 'secret weapon' to defeat SNP - Findlay - BBC		https://news.google.com/rss/articles/CBMiWkFVX3lxTE1NbEFvRFVoM01DUllsN0M1TjNLRVNDRWRRRmVsVExyZzBxbXYza1lrWmxUSnQyckRPZHBHcTZ6ZG5QYUN2a2xDeHlIcXpUM2xNcy1zcDB3UHJCUQ?oc=5
2026-02-20	Google	0.091	Mendel Money Management Makes New $2.22 Million Investment in Synopsys, Inc. $SNPS - MarketBeat		https://news.google.com/rss/articles/CBMi1AFBVV95cUxPYlJKcW5zU1BuN05jT2N3SDZTVzVrS3N5RFVlWFlNbUNXOC1jNnRFUEpXU2Fjc0lGQ0FHekpmQW5Hckh0blljbGtmNDVHdTl3WFB1T2RKM2FyVlVzWlF0anV3YTA4dm13RWZ3Q0VQZk5Pem5veXZjeXF6ZjloOXN3VVdqR2U4Q1JkZkR1bC12VmhIbE5kc3VfRU1DejJvcW1uOERjQWlWM2I1ZUEyMGhtVWR4Y2dXMTVYUzJPM3FJTUdDdERfUlI0TjhoUkJfYVgyb1RPNA?oc=5
2026-02-20	Google	0.0	Fiera Capital Corp Sells 13,785 Shares of Synopsys, Inc. $SNPS - MarketBeat		https://news.google.com/rss/articles/CBMiuwFBVV95cUxPX0pKLXY0QUdQUUVPaU5xUDJkaU5uTDB0VEJnb1A3OVlyajFNQzRfZ2hYWVNWZDVmbG1TajdQWWpuWmNzTVhmRTdJaG43azYta0E0SVd4dFlLVU03N1NlbWhBdVNmakVtZnA0UllLNzdMMi0wdG5rY0JKb2o2Tl9haWwyMHdDZ1lfc3JDYW5qZlhsd0RmcGI5LWg1OEhYQm5pWUZmMGFHQkw4QnNxcFlFYXhEazU0aXdBVmpn?oc=5
2026-02-20	Google	0.0	Synopsys (SNPS) Expands Board with Appointment of Peter A. Shime - GuruFocus		https://news.google.com/rss/articles/CBMiowFBVV95cUxOZVZQSWMybEZHOWY3ejFsTzJFNXNRd0FXUGNrcFVUYlVpRzQ5b1d4WkRTQktINFRyd1hHdmR4TGRndVVudVAwUVR5b1BMSHdvSk1qM3JLeVpJS05EdnZYamRSTzZvTEpLeUpxZUtRMGVJRnFPazI3OGJpREhqRlRINlBUSXF0bi1FSGNhc2xSUG82MEctM2hneC1CcVJYSXBVQWVj?oc=5
2026-02-20	Yahoo	0.0	Synopsys (SNPS) Q1 Earnings on the Horizon: Analysts' Insights on Key Performance Measures	Besides Wall Street's top-and-bottom-line estimates for Synopsys (SNPS), review projections for some of its key metrics to gain a deeper understanding of how the company might have fared during the quarter ended January 2026.	https://finance.yahoo.com/news/synopsys-snps-q1-earnings-horizon-141502068.html?.tsrc=rss
2026-02-20	Google	0.0	Synopsys, Inc. $SNPS Shares Acquired by BNP PARIBAS ASSET MANAGEMENT Holding S.A. - MarketBeat		https://news.google.com/rss/articles/CBMi0wFBVV95cUxQVUM4ODFmTFhZb1o1TUtRQVNFYkVQdTExanVRenlPT203Qm11SEdZTzJFTzRHUWI5cUtoejlualp3ZDNrYXFmbUdUb2xyaUY1a1R6ODlKdFAyRVBqVHExR3dEVnJHRVoxRXdEcGVPeUt1MTFzaDliWmNZZzg4Z3Q1UVYzSmE1b0hVbGwwZk1USjgwd3ZKamV4MllPWjIyNUloTUp1ZkxwQVFaWTJKckNlQllTR0tnbmhISGhuVm5mdjdHd1AweW8yRGxCVnJhb3c4dGlF?oc=5
2026-02-19	Yahoo	0.4	Synopsys Deepens AI Design And Security Reach With SimuTech Partnership	SimuTech Group, part of the Synopsys portfolio, was named 2025 Worldwide Channel Partner of the Year, underscoring its role within the company’s partner network. Synopsys (NasdaqGS:SNPS) is expanding AI driven design capabilities across its tools and workflows. The company is pursuing acquisitions aimed at strengthening its software integrity and security offerings. For you as an investor watching Synopsys, the focus is on how these moves fit into its core position in electronic design...	https://finance.yahoo.com/news/synopsys-deepens-ai-design-security-011536257.html?.tsrc=rss
2026-02-19	Google	0.143	Medicare Special Needs Plan enrollment 2026: Winners and losers - Modern Healthcare News		https://news.google.com/rss/articles/CBMilAFBVV95cUxPM3BuWU1sai1QaGx5aFBxNWp6engwNUlXTTlwSmc3ekUxWmpOQUlsbzBuUUFrNkJSZXFKcC1LbXU5NC12aUVOZ0lhdUtLblNldnBBYUtyRjJEVFhDVUlFTzR4akRaUDNRTnp5SFhaRE52TjI4SnZKa21TbFhtQWFyN2tGMjc0UDRPZXlTWHBzWmRmaU9T?oc=5
