Date	Source	Sentiment	Headline	Summary	URL
2026-03-02	Yahoo	0.217	Semiconductor Intellectual Property Research Report 2026-2035: A $13.54 Billion Market by 2030 with Arm, Synopsys, Cadence Design Systems, CEVA, Imagination Technologies Leading	"The semiconductor IP market is poised for rapid growth driven by increased adoption of complex IC architectures, IoT devices, and demand from telecom and automotive sectors. Opportunities lie in chip innovation, strategic partnerships, security IP integration, and licensing advanced semiconductor solutions. Semiconductor Intellectual Property Market Semiconductor Intellectual Property Market Dublin, March 02, 2026 (GLOBE NEWSWIRE) -- The ""Semiconductor Intellectual Property Market Report 2026"" h"	https://finance.yahoo.com/news/semiconductor-intellectual-property-research-report-141100391.html?.tsrc=rss
2026-03-02	Yahoo	0.214	Innatera Selects Synopsys Simulation to Scale Brain-Inspired Processors for Edge Devices	Innatera, the leader in brain-like neuromorphic computing for ultra-low-power intelligence at the sensor edge, selected Synopsys, Inc. (NASDAQ: SNPS) for design and validation of its next-generation neuromorphic microcontrollers. Synopsys' reliable solutions for electrostatic discharge (ESD) and power integrity analysis will help Innatera scale its operations to meet the growing demand for edge processing in industrial sensors, robotics, wearables, and smart home technologies.	https://finance.yahoo.com/news/innatera-selects-synopsys-simulation-scale-080000565.html?.tsrc=rss
2026-03-02	Google	0.0	A Look Into Synopsys Inc's Price Over Earnings - Benzinga		https://news.google.com/rss/articles/CBMioAFBVV95cUxPZGxqWlRtUkVuU0tHTHRuXzMybDdEZ1dKZVFHRnNCX2hDaVNpMTRGM3ZZaGVFQnRVVTE0UFhVYzVuN1hES296OXBFekUxQm5acklvYVZ0SVN6WlRWdEFHcG9XNVp0RHA0Uzg2MWxlUFRDTHh1ZjFDaTdQR210aXRsaEZTbHRXUmd4SUtqcDZaUjZNbWNubVNxaVdDd0RPZko5?oc=5
2026-03-02	Google	0.0	Synopsys (SNPS) Announces $250 Million Accelerated Share Repurch - GuruFocus		https://news.google.com/rss/articles/CBMiswFBVV95cUxPTlB6NmZ2Z0ViVklQYzdlNU5uWGlIWWkxeXE5NFIzQzJ1MXdsSkhuSldhQS0wWjQ0NnMwWHMtNnZ4OVlVbmRXTUhDVTVELUxHTDN5M1c3ajlrWkg5STZGaXVCb3ZQcDVNM2g1SklzZTNzOGRyOG9Oc0RVaE1FaVUwbmVVYVFVMGRoSGc4OUhXa2JCOXNuVXppdGVpYU1hbjI1SC13LURhYmJtVEFFUDhhRXFxbw?oc=5
2026-03-02	Google	0.0	Synopsys (SNPS) Initiates $250 Million Share Buyback - GuruFocus		https://news.google.com/rss/articles/CBMikgFBVV95cUxNZ2JpRjR0bWJlTTBZQXFnaE1WWEUybGkxUUVNMkNiZXNlTWI1THpLUGpWaU1jdmkyWnJMOEJtUFVrSFprM0ExM0QxaUZMcnA4bzZGSjBIZ1ZnX2hENzE4RGFHR1ZWaTJDMzFleTJKNEdsU2RHNkdmT1IyTHZtV2o3M3hYZWpfcnZuTWZUSHYtQzVBUQ?oc=5
2026-03-02	Yahoo	0.0	Synopsys Initiates $250 Million Accelerated Share Repurchase Agreement	Synopsys, Inc. (Nasdaq: SNPS) today announced that it has entered into an accelerated share repurchase agreement (ASR) with The Bank of Nova Scotia to repurchase an aggregate of $250 million of Synopsys stock.	https://finance.yahoo.com/news/synopsys-initiates-250-million-accelerated-140000932.html?.tsrc=rss
2026-03-02	Google	0.0	Synopsys Investigation Initiated: Kahn Swick & Foti, LLC Investigates the Officers and Directors of Synopsys, Inc. - SNPS - Business Wire		https://news.google.com/rss/articles/CBMigwJBVV95cUxNbjBPc09LU2RDTmV3WnpPZ19UR0xMbFBsSFR3WXktUDhydkVsOWJROTFtcTI5ZnlCeF9oRXlFMEhZN2lFck5NVWRzekxqUExQRFFxWC1HOThXakxCZ3Z0X01HN2NRRHNhYlUySm9hSjBNNDNXUjBlWUUwaEY3U2h0S3A0YW1EcTFqRzhOaGpHNDUyWi1xZnRtRjRLZTZqWWxVQXJmS2tLT2haUEpITWZqcmdpMFJScDIyTWFpWVhMN1ZfaXUzdzhzVFBqa3dMLTRmRkRYTlUzUzBnRXJObmRyc09kb1NXeUNBYzZvMGh4OHM0TS13c3phbU04aXpaeVVhLWdj?oc=5
2026-03-02	Google	0.0	Synopsys Launches $250 Million Accelerated Share Repurchase - TipRanks		https://news.google.com/rss/articles/CBMirwFBVV95cUxNYmpFWkN3WWNSUFAtWHhKQnFoTVJiNFduQzlmM0xQZDRwbTVWaEFkUEJGVXlyeUh6NEJXeGFWOVc5WkNSb1pQeEhiam1pSXhPZ2xjZWpzUmRpSVM3SXhhNkdPTzBsYVFxQlZrUThYZGVqZWF4QzFCLUljX3pEeUl6MWsxcVpCNXB2d1VXX1E2STNBcTlwRDh5Vi16VVR5SlJqLXN4Sm95ZGJBckVtUl9z?oc=5
2026-03-02	Google	0.0	Synopsys to spend $250M buying back stock by June 1, 2026 - Stock Titan		https://news.google.com/rss/articles/CBMitAFBVV95cUxNVExHdkxydk9ENnpLcW02aWN2ckJJYWNGQm9IUlRxWVJMX3NXalhnb3NGOTlFcy1wSzRKVXo2WTBENFhidzhORVhKVjVjVXp1Z09YMzhMUDAwSlBNVDR4YXZwdUpfbnBFOXV4UTFaQkNXZzhHUnowaUNRTGZxWjhTNUZldDNSZUpKN256dElqc0NIWU1HNGdxUU9oVzBoZHB5SVFidmZMbS1pUUh0ZU9XeTZQTUg?oc=5
2026-03-01	Google	0.0	Reassessing Synopsys (SNPS) After Recent Pullback And NVIDIA’s US$2.0b Investment - simplywall.st		https://news.google.com/rss/articles/CBMixAFBVV95cUxPa3ZKMTFZUnVFTXM4cmI0dE8zNlpJY3EwN2hUNnd2NWM2S1JDcXJyUTBXdlhMNElUQm9iVGVsd1FnVnhfSU0zTW1MbVFZU1NrZXN4c3o5UWV1ZGZqSFJlZmNueGdxZGkzbFE2c0ZvVzFJOGNCMFZpQ1FsTVFKOTd3RUU1cHU0UURHRThkT3VhNUR4UEFYcGRzZTFQbS15YTdPb3hHRm8zTG5ieFNhYXBGS1dmamlod1ZZblNKTXA2dTU2VzY20gHKAUFVX3lxTE9NSGkwa3ZTMXB5T0Y1Qm9nWFVGMFRDMDZPWm9ab1VjMGNfNVluV1RTQWtMaWMzRUI4cjJ1TlFTN3R6QzFxYnBmamNxZTJCR1pFaXdFRENUblFCR2ZUUVdyN1B2U05zX0wwaEN0aDNuYnF3Y3dBTEo5TUNWUFl3OXc0UzR2bFdqOURJQ2tTYW1VVEpwTk5CLUFZYlZ1NktqY1ZHM0VFdVpQdFdCcXUxUW1Bc2UxMmZVbUJBTkx6ME0yOTJHQnJlVFBqUGc?oc=5
2026-03-01	Google	0.0	Synopsys stock (SNPS) set for Monday test after Morgan Stanley downgrade, Converge event in focus - TechStock²		https://news.google.com/rss/articles/CBMitgFBVV95cUxNcEZRSUxKckhYbXkyZ0lXc1FoUEY0TU5JclJHT1FnTmdKQ3oyWGxXVV9PcjlBMlUtY1MxVVpobWVLLWtFZmRCTS1uUzdXR2RQdUwwYU9xZDJLbmNQMlM5Y1hBM2ZMOFFraGRUM19va1JfWkhFSVJiQWRvMURfendGaUpfZVdvM3ZMMzh0QnVrVnlxeUdoQmFfdy1YZk5Na09Ibk9SU2ZrMmlGMnlJek9tRXpwODk5UQ?oc=5
2026-02-28	Google	0.0	American Century Companies Inc. Buys 134,765 Shares of Synopsys, Inc. $SNPS - MarketBeat		https://news.google.com/rss/articles/CBMiywFBVV95cUxQNnFraVBuTEdiZGdfaWhwMEh1a051M19Wdkl5WFFkRVRMQ21Gb2kxbHptOWp0NWxVaGRULWFNanZCUTRTWUFGenBaeHA5SEZVZXgySWdXYWN4ZTlBQklxdUNwQzBvTnlyeXlIWXEzdnozWmQxUE02c290RkZ6TFpsWEZmUE1tN19iN2dOSkp5RzktRC1DTGVKclVrUjRKangyMXFmaDFMY0pEd3ZQcEY5aGRHaG9uMTRWSEU1cXdLbVVUalJGMkdvLUtHNA?oc=5
2026-02-28	Google	0.0	Choreo LLC Has $5.12 Million Stock Position in Synopsys, Inc. $SNPS - MarketBeat		https://news.google.com/rss/articles/CBMiwAFBVV95cUxPcjZMVWNuTGNlQWtQZ2RxX2NzOUUwRXdxRy15RlI4SEZGY3NWRXhJU1Z1SF9CNnV5Qkd6TzZhOWlMWGtNZnJzYzgxdXptN25ha0VlOF92ZG8wTEpkTHhjSWNvdU01Mk4zcGZGWjBYYzh1THFaMTZxTDMwQkxfVVoyZk10aDFBQ0ZUeW00di1FSnh5MTg0MlBLNEJLd1k1Sm9HM2VlLW56Y2sxU1ZrenRuUXhwTXVQT1pGek5YRjZDdFQ?oc=5
2026-02-28	Google	0.0	Harvest Portfolios Group Inc. Cuts Stock Position in Synopsys, Inc. $SNPS - MarketBeat		https://news.google.com/rss/articles/CBMiygFBVV95cUxON0lPT3YxR1BzeDZla1dVa1ZuSWNaSVYtRkVSc18wQXk1ZTRLaF9DQUI1RjB2cmt2T0lYLWN1SHlMaUNLLXJ3SmxxcEZ3Z0s3UFBRcUdNWHlDbkFvQ0tTU3MwWGk0TkFUdnpXQkdaVWVZbWRERE5sSEJTWm9DTFg3SlpZT1p6M3BnQXNjU1ZmN0VCWmFVRUYtWFNNbTQ3ZzdaVldyNXVSdl9yTDl6NTlqSXFXZVZtZHI4RVJ2M1hYdW9NRWVJNWdNbGlR?oc=5
2026-02-28	Google	0.0	Keystone Investors PTE Ltd. Purchases 18,096 Shares of Synopsys, Inc. $SNPS - MarketBeat		https://news.google.com/rss/articles/CBMiywFBVV95cUxNWUVUTktXWVlidWZFUjNyamF2dzdfQnpZenB0U1pOWXc4ejNUTzVodEhfcVVHVzZ4ckdjSFlOS1BTUkc1TjlFNk1wUG1neF83dUUtek1ySzk5UVpGaFZiT2prQld4eFlQLWRvckVXTnpPX21GNmY3WWNYMGlPZmQ3ZksxRzNxaXN0WUxNbEhoVjFXMDRHejgtcDVUZ29taGVxTGhCZnowUzlqYUFxeGxLcjc4ME9uWFJDdkFucmdIWjJZcEp6MHVZS3NaSQ?oc=5
2026-02-28	Google	0.0	Synopsys, Inc. $SNPS Shares Purchased by Rafferty Asset Management LLC - MarketBeat		https://news.google.com/rss/articles/CBMixwFBVV95cUxOWGRzWk0xaFBPc3VvNWt0MzhwS2FiSUtnM051VzVsOUJaM0Rpa2ZnWGpiY1VRUzhPVHNuUE1wTkpCMENmaDQteVFKOUlTTEl2S1BQQlVFUXJtcTJJaDYwSzZ6Q1hWYUxtQ3dnNjg2TzBjdDc2SDBQLWRXUThMQTItSU02dUY1MHVEdmpLZW90Z2JyMURXc25wVnlRSXc1V1RZa0NEc2FxVkliWDZQUUc3bGswSVpPbldrYlZYVGdzTHhBcmdBb2FB?oc=5
2026-02-28	Google	0.0	TIAA Trust National Association Increases Stake in Synopsys, Inc. $SNPS - MarketBeat		https://news.google.com/rss/articles/CBMiyAFBVV95cUxOY21zMHlPVEx1MktkQ3BnZ0lXN0tURVNFYXFKNlZ2aThES1I5ODhyUE5FM0FtM0M5NF9SMndlLVVpTTR4QTI0dmxBOTV6RndhT3lTWTh1RVlBSFBheVBSTHV1UERPTm9HNThlTW5YR21QRHNuWjBQQWJseW5DTnJPTmVQcENaT1BlNEtYV1RzZXJKMDNWXzFPM29tSkowMmMzdk9uUFBYR2lJSnEwcUZaM2p5YXJPRm1UeG82Z2hzQ1c2WnBaVTRKZQ?oc=5
2026-02-27	Yahoo	0.5	Block upgraded, Duolingo downgraded: Wall Street's top analyst calls	Block upgraded, Duolingo downgraded: Wall Street's top analyst calls	https://finance.yahoo.com/news/block-upgraded-duolingo-downgraded-wall-145003609.html?.tsrc=rss
2026-02-27	Google	0.4	Is Synopsys (SNPS) Still Attractive After Recent Share Price Pullback? - Yahoo Finance		https://news.google.com/rss/articles/CBMiiwFBVV95cUxPV1ZTenVDTjVWMTdqQnJOR21uQ2lFYThEUVEwcGFJdE91VWZfbER6VXplenV2dkNMZzZoak5IR0tmMDlhZlp0am5JT0hUbWlDVE5mNklRT3RjRWxyMDBkVWhNeUQxdklWSFZONU9TWGJfakVXYjlqMmNHTWxEZ0hhbTNDSlpGZDhrY0Vn?oc=5
2026-02-27	Google	0.333	A Quick Look at Today's Ratings for Synopsys(SNPS.US), With a Forecast Between $450 to $650 - 富途牛牛		https://news.google.com/rss/articles/CBMilwFBVV95cUxPd3VfeGRaSWlzY1FfbVdDNnMzVlpDeWtzdVRRbFRTc1U4MTRXVy1vZndWU1ZOQWYtcWZ5Z01aY0Q1WlpNNkRLRUlQYlQ3S0UteURNQTNFZkx3S2U0dzFlVkVrdy1xSWlCdGxwZ0l3UUF3dHRaWFJVTzRxMm5Jb0JfTVBoXzlHSmZ2ai1XaVZUUFdXbWNqb1Nz?oc=5
2026-02-27	Yahoo	0.262	Here Are Friday’s Top Wall Street Analyst Research Calls: Block, Costco, Dollar Tree, Duolingo, Palantir Technologies, Southwest Airlines, Synopsis, Warner Bros. Discovery, and More	Pre-Market Stock Futures: The futures are trading lower as we get set to conclude one of the zaniest trading weeks the stock market has seen in a long time. Despite crushing analysts’ earnings estimates and giving forward guidance above consensus, Nvidia Corp. (NASDAQ: NVDA) initially opened higher amid a rush of retail buying. Still, the ... Here Are Friday’s Top Wall Street Analyst Research Calls: Block, Costco, Dollar Tree, Duolingo, Palantir Technologies, Southwest Airlines, Synopsis, Warner	https://247wallst.com/investing/2026/02/27/here-are-fridays-top-wall-street-analyst-research-calls-block-costco-dollar-tree-duolingo-palantir-technologies-southwest-airlines-synopsis-warner-bros-discovery-and-more/?.tsrc=rss
2026-02-27	Google	0.16	Synopsys (SNPS) Margin Compression In Q1 2026 Challenges High Growth Narratives - simplywall.st		https://news.google.com/rss/articles/CBMixAFBVV95cUxQU3Z1U1gwLWREa19ESEN3dThMVEhVWVVjME5ZdTNFNWU1S3lHZzRQdU02dmVoZXUtV01oZnpDM2V4X1lxeUF0anV2RlVKX2lnSk90SVVJbzVBQlhYbnAtR3kxVGtKX0NoeTV2Mml4QS03eGh1U0ZxUVRSeHA0aW1PbXM4OHE3X3hhck11LUthV2hPQnNXZUJMNzVQU1lvUWdpaVF2R3p4N2MzZ2lZSG5ELW1pc21rNDBMX1ByZmtvOVZOZzly0gHKAUFVX3lxTFBveEJPZW4wb1dFamtJbWhBRnlVaFU2enlZaFhqVEdwUWw4djRGT1pTbTdaUXVNbHpqUFdLRGU1NE1KaTIzQURQcGwtcjNTZlNyY2pjWDhIZ3RneDBONHBuR1FSSzFBOC13dWhOUktQMzZ4OEFySHNKVEtleU01ei1aQXZoM085eXBjd2MyMm9xUkdLME1JcjhsU2R1WHY2SENCbTBBSEMyRmQ0akhwck9Wc0p0dUhvOGsyZDdUTmZScmw2T3pzNXJFd3c?oc=5
2026-02-27	Yahoo	0.065	Is Synopsys (SNPS) Still Attractive After Recent Share Price Pullback?	If you are wondering whether Synopsys at around US$426 is still a quality buy or starting to look expensive, you are asking the right question and valuation is the place to start. The share price is around US$426 after a 3.7% decline over the last 7 days, a 15.3% decline over 30 days and an 11.3% decline year to date, against a 6.3% decline over the last year and returns of 17.2% over 3 years and 85.4% over 5 years. Recent headlines around Synopsys have focused on its role as a key software...	https://finance.yahoo.com/news/synopsys-snps-still-attractive-recent-081044731.html?.tsrc=rss
2026-02-27	Yahoo	0.0	Can AI Push in EDA & Ansys Integration Help SNPS Stock Grow Further?	Synopsys rides on AI-driven chip demand and Ansys integration as Q1 revenues jump 65%, with EDA and simulation fueling momentum.	https://finance.yahoo.com/news/ai-push-eda-ansys-integration-133000678.html?.tsrc=rss
2026-02-27	Google	0.0	Can AI Push in EDA & Ansys Integration Help SNPS Stock Grow Further? - The Globe and Mail		https://news.google.com/rss/articles/CBMi4wFBVV95cUxOQUFXVmhrSU93ak5BOGVYMmE4clV6aHYtR2FVU3RWUWtyMmVoeVhsTjRWU2RVaW9DLThoTklmMkl5WWVOUFluazdlN0xJSkV5SHVJMjNBa09uMmpsMzdRUUlTc09sc3lvQVZJNm01ckdLN0FpUHRFM1Q3ZEhqZVBIRjd6eTh6RXdyUjhEVk50bmw1MnlpN3A3OG5Ra2lQTElOdDk4RG92aGdOT01CaDN5ZkdyMDF1M0dNbzB3cWJUSHBENEZQdHBCbWllcnhfUGZiR0VTNzFvMm1KbURsakpCZUdWMA?oc=5
2026-02-27	Google	0.0	Can AI Push in EDA & Ansys Integration Help SNPS Stock Grow Further? - Yahoo Finance		https://news.google.com/rss/articles/CBMigAFBVV95cUxPYnZpMlpibnRhVVJLVGdRV3ktVHY5V0tYOTB6Y1JoZlFNWDhEZ2RucVRsZ2MzRkw2TEdzZTJSTVFrZFBkY05XVHFTZUplREllOGtUNWxWWHlCSTlLUS1sVXZzZjdFYXU3ckJaOF9yWURvNmNWMkpQSUJmWTRZMVRmNQ?oc=5
2026-02-27	Google	0.0	Dana Investment Advisors Inc. Sells 44,375 Shares of Synopsys, Inc. $SNPS - MarketBeat		https://news.google.com/rss/articles/CBMiyAFBVV95cUxPRnBoMWNILTZNMlo5ZXd0WkszeVRhVmk0TU0wTkV0S0FLaDRHR0pIenBGNDJ4OXcxVGpjRzhHRnJXWUxuSk9PdXoxckZ4SFZFTmZXeTdVdVEybDNzaUtjajRJOVB6OHBtNFJ3ZnF0eV81VFJjNHd3VkZhTWNaTjU5YnJTVXNWRGE2cktsU2M5cmd6OFNueWJNeUZBaUhscnpIZnBLSmFtMlFxZjVjYmVHZWNwM2pTRFFiMHNNMnRTYVRLTEVrMHBUcA?oc=5
2026-02-27	Google	0.0	Erste Asset Management GmbH Sells 5,834 Shares of Synopsys, Inc. $SNPS - MarketBeat		https://news.google.com/rss/articles/CBMixgFBVV95cUxNc2I2YndXU2FzZDZwX1JmazVUcnV1eWFqQ0tJRWg1SjU0LXpVR3FlalRpSEtkZTRmeW1zVElTdGVVbE9rWmp2dnFiSXFTNkppOHJKbXB0V3pkeTBxYkFMYjNyT2JlcFNhcUw1Z041bjN3ZjlIZ0FaS0ZyRVd1SC1uZDlfV0JjWDN2VWZVXzNHdDU4TFNOV0JmZUFlcWJJX1BxYmNoZExEbk1Mc25jQ1FYWFpJTEtXcnNudnhVX1U5R3ZWOVIxcnc?oc=5
2026-02-27	Google	0.0	Handelsbanken Fonder AB Sells 184,342 Shares of Synopsys, Inc. $SNPS - MarketBeat		https://news.google.com/rss/articles/CBMiwwFBVV95cUxOUmxXZjVnTTYyR05FU3dwRjY2eFFZVjQtX3VNbWFxcktNLXpMMGRJVUd2RUNhUDFpajdqNHFUb0YyaGR5WU9WWXFQbHB1YS1CZ2pZaUNYd2RjaE5zbFRfVTdrZDF0UDNld0lDdjRVWXZ4OVhZVDVreG5zSFlWSjhISTgzY0lJVWJBLVFKYjRzMlAxbTRJS2VxcXJJSnBVRlBXUHFQUWZqTU9qTmRlRU9TWVFweEFXcUUxUjlFdUxJMFNFU3c?oc=5
2026-02-27	Google	0.0	Looking Into Synopsys Inc's Recent Short Interest - Benzinga		https://news.google.com/rss/articles/CBMisAFBVV95cUxPLVc3bnM3Zmt0UEFCZm1UY1NQZG1pNlBvdDcwaUVxRXJ1VlNwMWtlazB1X1dfYS16clpfLWlrblg2UG1jZGMxaW5TWEpDbVJkX1hlc3RLLWZxcW1JLTBRd0Y1R1p0NG02bUdneGRfOTJHLUo5VVdtV2ZyRGY2N3RYNXBSX3ZaekxjVVVyaWc2TWdzVUI4cEZDakNXMG1uTmRjM0gtRFpGSDQ0elkxS0lNbQ?oc=5
2026-02-27	Google	0.0	Primecap Management Co. CA Increases Stake in Synopsys, Inc. $SNPS - MarketBeat		https://news.google.com/rss/articles/CBMiwAFBVV95cUxPZXNFV1NNSUFDMmVqNjBlQ0NMdkFtdXJ6TUY4M1RpQmNfNkVlRENyLTV2Y09la2J4aVBGLS1fdGIzbS1Jbm1BVWJ4ZTk0QzZvSHU2SUotQnZ5MjZKcHBYTmQ1Mmh1U3pJYkp6bmtkS1ZjdjUteTd1czBTcjJyZ1JWYjJXc1IwTHhBa0JHRTNfeUJ4a21hWmdQRldfQWVpLUlXaUtCbzFDOTNzNlpzdmFqQnQzSmhOMnA5dDBvOXJyTmU?oc=5
2026-02-27	Google	0.0	Synopsys (SNPS) Gets a Buy from Needham - The Globe and Mail		https://news.google.com/rss/articles/CBMiuAFBVV95cUxOVGhrR3pycDNTYnlSRlNzVzJQWmhXTDhzYmNlR1p5NUtXTEdySWRNMDRiSjNuYWNudERtcTVyU0wzblBIdHF2RjdJMF82T1RFYjVDVUlyNENXdnB4Rk5JQlhheTBhMWU1clpyYktRb3huNmdobDZxVENWQVJ5c2RoajhGdVpBSjlsQTl4UTVvUHlhU2ZaeW91Y01uU1JSTENzNnV3TkI2NXczUVg0Q2dsVHZoMFFPYmpq?oc=5
2026-02-27	Google	0.0	Synopsys (SNPS) Sees Downgrade by Morgan Stanley with Price Targ - GuruFocus		https://news.google.com/rss/articles/CBMixgFBVV95cUxNcUNLZHNxWm5FcGZhenhlVHdWMm9XOUhQdmRoNG1maGs4WURTMG10dE5nV3BOTVc4Qi1hLUJmNHdfOHliRlJHVjdxS0kwQ3J4Y1BhMWR0V3o0aVNaY3g2MjZMMVFfeTFmSlhwMnczOVduSmVmMGF4UnFmTzIxVk9UN21WWmtkUnMwLWNxaUFNYjV5c1dFbGRDQVR5WW5JbjUtQTB1Vi16Y3lvMmpIX0RMX0k0LW1MWVl2MXhpT3hSZ0FzUUpGLWc?oc=5
2026-02-27	Yahoo	0.0	Synopsys To Reveal Ansys Synergies At Conference	The Synopsys Converge Conference starting March 11 in Santa Clara, Calif., could be the next catalyst for Synopsys stock.	https://finance.yahoo.com/m/d15cd9a7-353c-3f3f-ac97-f37d987859ea/synopsys-to-reveal-ansys.html?.tsrc=rss
2026-02-27	Yahoo	0.0	Synopsys' Growth Outlook Softens as Core Business Slows, Morgan Stanley Says	Synopsys (SNPS) faces slower expansion in its core software business, with underlying growth running	https://finance.yahoo.com/news/synopsys-apos-growth-outlook-softens-160632547.html?.tsrc=rss
2026-02-27	Google	0.0	Synopsys: Long-Term Opportunity Outweighs Near-Term Headwinds - MarketBeat		https://news.google.com/rss/articles/CBMinwFBVV95cUxOZlFHZUFidXRIS0dxejU0OXVidWc5aHJjUFlzZDVHdXpseVV2ZU9sM240YTlBSUQ4YkR4ZDd6eHNDWlpSM1E2OGlDdFR2UkRCSTA3Wk5vTkt1RzloTUVxVlNoQjVBWXhkb1FjU09scWlacTRIbW1GV1NmdHV4SVlCMzE5T1J4aFJUcGUtbUI0OXVYdExwdkN6Zm9uOGJJM3c?oc=5
2026-02-27	Google	0.0	US Bancorp DE Has $59.70 Million Stock Holdings in Synopsys, Inc. $SNPS - MarketBeat		https://news.google.com/rss/articles/CBMixgFBVV95cUxOdGlsUEZ4bnQwQW56ZlhEUTRVM1JhaVNGSzVKM2hPa2FIbExZUjdHTWFzUXNNTkNZWHJoQlpqRnNySkZSSXIxUmlBamxrbk1JQURoMy05dXJ2a1Z2cUZnRjBfejhOcTJGRTZucVRUVE1PRVBfRFJDTzM1Wk5ybWhJTU1CcTRlMTJMeVJoeEVLQmJ3NG9EeWRNMFpLUDFoVnRMQ2FCcTFBcUMtT2tKM0swbFhpSktVY2t2SWFzVEZ6NG5BM3FQdWc?oc=5
2026-02-27	Google	0.0	Westfield Capital Management Co. LP Buys 18,010 Shares of Synopsys, Inc. $SNPS - MarketBeat		https://news.google.com/rss/articles/CBMizwFBVV95cUxOSW5jYjNUMXdwcnQzTzZzTXU1OXVlZmZDSElEaUFEc2tLMFpfemtDS3FVb2JqQy11bVRPVEo2WFZUdV9wS2NmRDlDMnptcW5tdDg3Y2hlSmEyUS1KTElTSTg1MUpaVFkzOEhNLXFKNERnZXJYY2g4ZUMyc1dEZktRZzZiT2ZHZlVzM3ZYWDc1ZWJaaE1VcHhCSnBmY3Fmck9Ha2NIbkZRQTF0SEZrb0tGeVM3Q1pIbmlxYk5IeXNjalA5Q1RYYjZydXdSaWV0VWs?oc=5
2026-02-27	Google	-0.05	Synopsys, Inc. (NASDAQ:SNPS) Q1 2026 Earnings Call Transcript - Insider Monkey		https://news.google.com/rss/articles/CBMiogFBVV95cUxPbTNBdklUR1FoRlRBbE82bEp6T0xxWUs3Q09OX1ZaV0dRcnJBSE1HMGtVemRpV0tYdThOMWU2NmhyMmZyUV9RXzRucU5hU1pPQ2hhZDhNNjVOOGFxSzk5YUZwN3U0WThFS3UyYzhBRDNiV19CaDNMN3FqRjNoN0RadWloQ1g5WnUtNzJqd016bjE0TzJrMjc1SFc1RmhpYVUwZnc?oc=5
2026-02-27	Google	-0.071	Artisan Partners Limited Partnership Purchases 607,743 Shares of Synopsys, Inc. $SNPS - MarketBeat		https://news.google.com/rss/articles/CBMi2gFBVV95cUxNd3M2Rnh1bXVPWnVaakRUVXNPMER3aU85aFIyS0VmcjBpajhMWTFpLUZWa1FmdWl5Ql9FVUtnaUFBelFJRlJGdi1ZOFVGZzdmNmUxcVRpZlBzVGRzcU5sbmFRZlR0QTJYVWQyRW5hTHlKZy1fdFNPSkk3cWhiSDlZdUtkX29rX1VfMWxwWXNSOG1BMU5vSTJYTmwwMzF2MGNESHNiNlg1eGdSWjh3c21OdFhnTk1aYm8yTHBMTnBHOUY1dzBmUjhNa3U3VEJGbEZHemxTUko3LWQyZw?oc=5
2026-02-26	Google	0.5	SNP's snub to Shetland tunnels plan is just the latest insult of many to islanders - The Scotsman		https://news.google.com/rss/articles/CBMi1AFBVV95cUxPYnpqTnlETW4tXzVWRzRxYkF0T2NlUjI1Q0k0NEtlbTV2aWxSSGRLRno2RkVxU0QyMmdPbHNXS3Q1VHlMNGh0eVRaREVOc292TzlrcENRWExqTERUSzVrNVp1NUEwam0tbGdZWTVWY3VVdl9zVVEwenV3VzlIRWtTRmgyR2hoRGRmc3JXaGRXa1lpNGd5cnRHZFBxdmIteXVxdzJvdE9pUHpvYTNuQ2F2NTNBd3dxTlVDb1RaOEpXY1cwM0tFOXYwR05YLUVWQXVOUWJ2Vg?oc=5
2026-02-26	Google	0.433	Synopsys (SNPS) Reports Strong Q1 2026 Results, Exceeds EPS Guid - GuruFocus		https://news.google.com/rss/articles/CBMipwFBVV95cUxOSGlkbVNYNU4yT1FPbmRzVC1IRnpncnJsaFk1QmtlS1lBRjZ3VGR3MWRVYzJSME53eFR4VEhudjZDVmlsSndOWTJFTmRHQkxMMERkWjEtdHM3UEZqdDlwYTl4RG91YXM0UERfdllHS1g5cGJGdUttdGluMlFucmdlSUdEOVRBN2JJR0NacDBMQTllMGkxZTFuYlFqbFY0S09pX0FTQWxuNA?oc=5
2026-02-26	Yahoo	0.136	Weakness in the IP Segment Weighed on Synopsys’ (SNPS) Performance	Aristotle Funds, an investment advisor, released its “Growth Equity Fund” fourth-quarter 2025 investor letter. A copy of the letter can be downloaded here. U.S. equity markets reached new all-time highs in Q4 2025, with the S&amp;P 500 Index rising 2.66% and the Bloomberg U.S. Aggregate Bond Index increasing by 1.10%. Within the Russell 1000 Growth Index, […]	https://finance.yahoo.com/news/weakness-ip-segment-weighed-synopsys-133541025.html?.tsrc=rss
2026-02-26	Google	0.0	CRM, TTD, SNPS: Software Stocks Crack In Premarket After Downbeat Earnings, Extending Weeks-Long Selloff - Stocktwits		https://news.google.com/rss/articles/CBMi9wFBVV95cUxQelZPU1o5UW1DNnIwMi1pXzllSmJSUXAyVFM1ZXNqQ3V5Um9xNHozeU10STJkTWVrRzhrc3JYRGQyMld2OVlhMkNuSl9uWnJCT1N0SHNiUXpYSElVUS12dExwS1JOSV9XZ010NGtxMWpndnBmUkpMbGh6Yk9oN3Nnc3ZWNmdIX3N0Zmd1RHpRdS10VWdIcG1tb2Vxd3VsWWpvUVVYT2txLU1MOHhjUkROSUVTZWxlSldHNHNiWlBnekpSMWg5YUUyamF4OUFwODg2Sm84eUJtVFRrSGdhaWdUWGFrUThTQk1aVG9MYVVfUVUteVlHZzdZ?oc=5
2026-02-26	Google	0.0	Check Out What Whales Are Doing With SNPS - Benzinga		https://news.google.com/rss/articles/CBMinwFBVV95cUxPZUM5cjdIZERHYTNWQUYtZ2VZU2daZFhreURQTGNjTzNIVDN1eU9UdU9wekVxNnRLdkVTR0dwQl9EdndOZm1jQXcxTlFvaHBpTlBzR0pZUHhHX2VqMW1mVzRqY3U4TFpOUVh5UVhpVS1URm9hVTZEUEYyNmxmdmVUQXpFWU45ODk3cEpDMUZjV25BdE92UFBXU3lieUFZckk?oc=5
2026-02-26	Google	0.0	Decoding Synopsys Inc (SNPS): A Strategic SWOT Insight - GuruFocus		https://news.google.com/rss/articles/CBMilAFBVV95cUxNeGc0dks2dlE5SVBpVHRVNlR6aGRJeHo3WVZDTHEwM3dOLUF6aGhGR2R3aWoyR1FESVFHcjlKTVBicXo0RDFSYlpYY2tDcUdjeExaRVVFVld4R3BFRVpySFBycTJUTXRMV2lzZ0pkaUNvb3FENTlvUTVDZ2p4YkRuczFDa0p3VUt4SnlaYkdndmI2T2RT?oc=5
2026-02-26	Google	0.0	Investigation Alert: Long-Term Investors in shares - openPR.com		https://news.google.com/rss/articles/CBMijgFBVV95cUxOZmRfaDVQeVlTNTVoQkhZaDVhRm5heWIxSEV0T29BNUFoQ2hMck1HU285RkhXZjg3MnJuNHQ1M0drVDF6cWMzdXMySUNaa1VTTmhxblJVRWpPc1VBc25XY3paLVh0MTk2NUd5YS1DOVg4T3JwRV9OcGUzS0V2TW9zSXZQZXMxSXRmSkxjdG5R?oc=5
2026-02-26	Yahoo	0.0	Norwegian Cruise Line Sails Into the Next Phase of Travel Recovery With Premium Demand in Focus	Benchstone Capital exited its position in Norwegian Cruise Line during the fourth quarter as the cruise operator moves deeper into a post-reopening travel cycle. With its mix of premium and luxury brands, Norwegian is betting that higher-end demand can sustain revenue strength even as the broader travel surge normalizes.	https://www.fool.com/coverage/filings/2026/02/25/norwegian-cruise-line-sails-into-the-next-phase-of-travel-recovery-with-premium-demand-in-focus/?.tsrc=rss
2026-02-26	Google	0.0	Piper Sandler Issues Pessimistic Forecast for Synopsys (NASDAQ:SNPS) Stock Price - MarketBeat		https://news.google.com/rss/articles/CBMiywFBVV95cUxQclJNcHVvN0ZjSVExSVd4NFFwV05QM3FISU05cDc1aEdtUEN6SjdIdmxnU2V3ckJUcUg2TlJsWGhXeHFpQjRTX1dWaVNLZk1ITU1Sc0UyR2VERnpxbGE1RmZWclIwVm11M05hakowVFU0V1p3aWh4TUM3Rk5DY0htZEt5WTBhc2gyWlpWMUIxc2ZzSl9seU0xc2ItTF9VZ2lqV3FfSmNJSFp5MkJsUWNCcWpvQTNqY0JUSW1aX0pSTE05QXlhcEdmV1I1bw?oc=5
2026-02-26	Google	0.0	Report: Medicare Advantage growth gives way to SNPs - TechTarget		https://news.google.com/rss/articles/CBMirgFBVV95cUxPRkR5NEFtcVg0a0JjaXJOaU9oSXFuN0xIYXBZSktZUnlROWluVFhRTXhEOTRPTjZRMFhpZGkxNGVPa1pOTE5LQXRsS05rZE1CU3l6MXU0cjUzMGk4eFZhNDV0dmZSc1ZibmI4RlBZRnZoajhRR2RZdWMzdTlNWk9VcXhrdVlJbWdhOVpEalIzcl9nZ1lJU0RBekhnYzUtaHRqOUFrcmxOV0JveWxzbVE?oc=5
2026-02-26	Google	0.0	Rosenblatt Securities Cuts Synopsys (NASDAQ:SNPS) Price Target to $530.00 - MarketBeat		https://news.google.com/rss/articles/CBMivwFBVV95cUxQbkdnOE1OS3dqZUdUd0dtRXBqTFc1Zi1aanZKRVpCdmEwZ0NtQ3BDU25qLTFBLUE5SThWQm5pSlpsZzc1WVREZFJ0WXJMZkYwdjFkNW1SRHZTMjBBVEJxNm15N2c1TlEwV2k1a1FNa2owRVo2NzVPNU56VllNaEFNUWlVWHV5X0ZLSVU0UUtMN2IzZzFreGNJTUtsbW9TXzBwV0xROHgtN2dwc1ozTkdaZ1VzM1QwSmdueHcxSmNJOA?oc=5
2026-02-26	Google	0.0	SeaTown Holdings Pte. Ltd. Reduces Holdings in Synopsys, Inc. $SNPS - MarketBeat		https://news.google.com/rss/articles/CBMiwAFBVV95cUxOZkwxMHFqUGp5Z0o3Y0gzSnFFbGRsX1BTbGVzcFBmVGlYT0NqSlppVU1MeV9NMTZleXRseFF1NDBlMkdzQ0s4MzQyemVPNTBfVHUzUzVIRWtoZjBRLWFheGkwWGFsdTZhWk1iQkhRWTZkMndCcDNLRUh0OWxJdFQ1Y0gxZHk4TlU1MFVzOU5TWFZpc0lnMWU5YVFQeHlEX290SC0wcGhhUl9abThERlJZYm9jVUk4QjdxZmM2QkM4TjQ?oc=5
2026-02-26	Yahoo	0.0	Stocks Decline Pre-Bell as Traders Parse Nvidia's Earnings	US equity markets were tracking in the red before the opening bell Thursday as investors assess tech	https://finance.yahoo.com/news/stocks-decline-pre-bell-traders-121910188.html?.tsrc=rss
2026-02-26	Google	0.0	Synopsys (NASDAQ:SNPS) Posts Earnings Results - MarketBeat		https://news.google.com/rss/articles/CBMirwFBVV95cUxNWlVKVDlRNUJCLTlyUExLWUlnR0xUaUlsOXpqUDVtcEpGaTBCRTI5azEyUEdsODZDWDBRd09VLUhRcUtpY1Z5b196N19WTk9YVE83bVhBYUFMbmRQQ25seFZlLTlmZFFTZHZybnVqbUNnMXo5SEVrUEoyMmZtVnpORklQMUpka2FYbDE4ZmxJbk81V2M4a2xlMXFfVzFLWVdSSGpaNHdEM19QdEs4dm1v?oc=5
2026-02-26	Google	0.0	Synopsys (SNPS) Analyst Rating Update: Piper Sandler Lowers Pric - GuruFocus		https://news.google.com/rss/articles/CBMiwgFBVV95cUxNVnVFWlpqazk3dG9XSG5FTGRYYXhGMEJUYl9fclo2TzdUVGkxRDk1aF9rb1RTNWtsM1VWS0dpWmxsaThuSm84VjlIV3dlMkVsdFc1c0pKN0l4TkFXd3Y0b3FqWFR4S0ZHYU1RNWxmTDYzcXhSVzcwbDdBTTE2by1QRU1LSTY4dTBLUDFYUi1XbF9hM29mb2RxWjJFMUQ3SG1uZmxJUEVIb0lCaEIwLXdHZFVLTk5RLWU5WV9VTm9QY0FZQQ?oc=5
2026-02-26	Yahoo	0.0	Synopsys (SNPS) Beats Q1 Earnings and Revenue Estimates	Synopsys (SNPS) delivered earnings and revenue surprises of +5.71% and +0.75%, respectively, for the quarter ended January 2026. Do the numbers hold clues to what lies ahead for the stock?	https://finance.yahoo.com/news/synopsys-snps-beats-q1-earnings-002506920.html?.tsrc=rss
2026-02-26	Google	0.0	Synopsys (SNPS) Beats Q1 Earnings and Revenue Estimates - Yahoo Finance		https://news.google.com/rss/articles/CBMigwFBVV95cUxNYXpuaVF1N2RNS1doWTJQVFVvYlRjWk1lcEFZNjRMemRudWdqLUxBS2JFaW5VZWhSTEtmOENPZ3JsblRSeEpMT3hKekVuTGR2eTR0VnJTZ1BaLTFkaGE2bHI2eXVWYUl6RVlSdzFiN2lpNHBWeXpmTDJZT0otVEQyc29wQQ?oc=5
2026-02-26	Google	0.0	Synopsys Analysts Cut Their Forecasts Following Q1 Results - Benzinga		https://news.google.com/rss/articles/CBMizgFBVV95cUxPNFV2SGFURGRtcVhzSVdrOFh6TjZ3UlAyZ3Qwd0FUT0djMzNybFN2TUVYOEI1Njg5WkwwdjdhUi11V2FZX3lpWE0zQ0ZmLVBJcWNZSHZBbW1qVEFFOFFOM1BndW1zRHNxVVVmMTlDdE5hNndkWnhldHJCMlJWSV9Md0J1c2I3eHViM2RSMzZNdnlxX2RlUzhHRFk2b0VsMVVXQlNodzBSRGNtWkNLREpqTVdyNEpxUFlCZVAzd0c5WTh2V0k3UGZpd2xPUm9Fdw?oc=5
2026-02-26	Google	0.0	Synopsys Inc (NASDAQ:SNPS) Exceeds Wall Street Expectations - FXDailyReport.Com		https://news.google.com/rss/articles/CBMiiwFBVV95cUxQVExybEpzd0dNcG54Y284eXd1OEhTR0ZJU3ZrZ2pBNXcxSmRnYXZKaHZWWjhxa3dHS0VPSVVxWTdTRUJwOEVuWDlHMXpmcGhHc3hSSnpQU2paYjVQU280S3gxWjA5VF83dzZzaFFKMC1lOVNNUU9tUDE3NEVVakc0MGtXa0ZvM2FJY09z?oc=5
2026-02-26	Google	0.0	Synopsys Is Seeing Growth From AI - Morningstar		https://news.google.com/rss/articles/CBMijgFBVV95cUxQR1BzWDhxdXRoVDRRT1JFLWhURms5OEZ4MkF2YkxiYW8tYUpOaVE2bnZxbERqSFFoVVBoRVM0U01uOUF0QTZQeTcxdTJjYWJSWmgzTnU0aXRDQ3l4eGdYOGFtaGVoNW5vT1FEc0xwcTR0b0RaVmZVcmdRdms5WVo4UXJiZ1Z6blRJZ3FOSHlR?oc=5
