Date	Source	Sentiment	Headline	Summary	URL
2026-02-25	Yahoo	0.36	Is Vanguard 500 Index Investor (VFINX) a Strong Mutual Fund Pick Right Now?	Mutual Fund Report for VFINX	https://finance.yahoo.com/news/vanguard-500-index-investor-vfinx-120001812.html?.tsrc=rss
2026-02-25	Google	0.0	VOO Has Made Millionaires, But Its 1.1% Yield Worries Retirees - Yahoo Finance		https://news.google.com/rss/articles/CBMie0FVX3lxTE1Cd1dTSHdnXzhDNGg3ZU9GOVRGM2xOR0tNZkx4dVNnSnVkMWEwd1F2UDdjOHpRQVgyM0RLU0FIcG5TUmxMLVhudUxpaDdZemN3ZzNoMk9NbjFvMUo3RUc2LWhReFJpeXBsNUJCUXpZcGxoR1ZEYVJnQUw3QQ?oc=5
2026-02-25	Google	0.0	VUG vs. VOO vs. VTV: Which Vanguard ETF Stands Out for Highest Upside in 2026? - TipRanks		https://news.google.com/rss/articles/CBMilAFBVV95cUxObnk5OFAzWkNIUWFWdHJHcFV0Z2RVdTdrWFowRFRjMEtiOHpPR0VKc2tOb2hmM21BTFp2V0g5d2RXU2lGalJtNl95SXR2c2VTZi1UaEF5Mkc0T1d6bUVfX0drTTR6bXN0ZWVlc0Q5anlzT1pkWHFSNExSTUFGbGxrZXA0NFBTeHFXT0twQ2Q0bFZMVEtk?oc=5
2026-02-24	Yahoo	0.2	These Top S&P 500 ETFs are Likely to Outperform Your Portfolio	Owning an S&amp;P 500 ETF is like buying a slice of the entire U.S. economy, its diversified and historically one of the most reliable wealth-building tools ever created.	https://finance.yahoo.com/news/top-p-500-etfs-likely-212000360.html?.tsrc=rss
2026-02-23	Yahoo	0.643	The Best Stock to Invest $1 In Right Now	No, this isn't a pitch to buy penny stocks.	https://www.fool.com/investing/2026/02/23/the-best-stock-to-invest-1-in-right-now/?.tsrc=rss
2026-02-23	Yahoo	0.19	How This International ETF Could Complement a U.S.-Heavy Portfolio	Many U.S. investors focus solely on the S&amp;P 500 for their portfolio. Adding international stocks makes it built better for the long term.	https://www.fool.com/investing/2026/02/23/how-international-etf-can-complement-us-portfolio/?.tsrc=rss
2026-02-23	Yahoo	0.133	Prediction: After Beating the S&P 500 for the Last 15 Years, This Unstoppable Vanguard ETF Will Top the Market Again in 2026	This ETF invests aggressively in high-growth stocks, while maintaining minimal exposure to worse-performing areas of the market.	https://www.fool.com/investing/2026/02/23/prediction-beating-sp-500-vanguard-etf-market-2026/?.tsrc=rss
2026-02-23	Yahoo	0.131	7 S&P 500 Stocks Gain The Most After Trump Tariffs Are Slapped Down	Who benefits from the Supreme Count slapping down President Donald Trump's protectionist tariffs? Investors quickly looked for the winners.	https://finance.yahoo.com/m/1d3eb42b-6006-393d-b951-378ddb998793/7-s%26p-500-stocks-gain-the.html?.tsrc=rss
2026-02-23	Google	0.0	S&P 500 Index Catalysts: What’s Ahead for SPY, JEPI, VOO ETFs This Week - BanklessTimes		https://news.google.com/rss/articles/CBMiqwFBVV95cUxNNVlUeFRFd2dsYmktSjRYSjI2Ml9aNEc0MmVpOWh2bXJNNHVQZEo2dlZ1M1hPSzIwZ1Z3QnVNS1Ruc2RLUUVnbnlybUE1MlM3UmtDX0VJVzRRQ3l1eGxQc2lQZllzSmRsTlo1dFBQUzZ3QXFRSkRqT1ZFelpjbzhadl9CSGYyX2pQUUZMc3NjMEk3N08xVHVPbDVONWJ0NGpMZXRSV3dwX1otMFE?oc=5
2026-02-23	Yahoo	-0.125	Polymarket Shows 75% Odds of Bitcoin Dropping Below $55K – What Traders Need to Know	Traders on prediction market Polymarket are pricing in a 75% chance that Bitcoin (BTC) will plunge below $55,000, signaling a sharp shift 18% overnight rise in bearish sentiment as the asset struggles to hold the $65,000 support level. Source: PolymarketThis quantified bearish data arrives as Bitcoin struggles to remain the ...	https://cryptonews.com/news/polymarket-odds-bitcoin-price-drop-55k/?.tsrc=rss
2026-02-22	Yahoo	1.0	2 ETFs Robinhood Retail Investors Favor Over Palantir, Alphabet, Meta, and Netflix Shares	It is no wonder, considering this was the best January ever for ETF inflows.	https://www.fool.com/investing/2026/02/22/etf-hood-retail-investor-favor-ivv-voo-vea-vti/?.tsrc=rss
2026-02-22	Yahoo	0.425	Vanguard S&P 500 ETF: A Smart Buy for Long-Term Investors Right Now	Regardless of short-term valuation or economic growth concerns, the S&amp;P 500 remains one of the best long-term wealth creation tools.	https://www.fool.com/investing/2026/02/22/vanguard-sp-500-etf-smart-buy-long-term-investors/?.tsrc=rss
2026-02-19	Yahoo	0.0	10 Companies Churn Out A Whopping Third Of The S&P 500's Profit	Earnings season is wrapping up for the S&amp;P 500. And it's telling investors where the biggest profits are being made.	https://finance.yahoo.com/m/f4e7865c-cdd7-3628-8f19-39cfc52e0311/10-companies-churn-out-a.html?.tsrc=rss
2026-02-19	Google	0.0	SPY vs. VOO vs. IVV: Which S&P 500 (SPX) ETF Should You Buy? - TipRanks		https://news.google.com/rss/articles/CBMiiwFBVV95cUxPSlhEcTIwWjZ4cGptb0wyYm1SZkNaSUFZQW1LcFpFSHJkb1ZseFVlbUhvRENhenhsV04zRDV2WGxxdGpVUVZXRGh2bk5JQlJUdGIyOW9YRnBuSDhuUXlFNlZtbVZocEZ1bWN1clduaVlpSUNqazI0RC1KQnR5c3JRSDZCWksxdEtPTGZV?oc=5
2026-02-18	Yahoo	0.342	1 Growth ETF That Could Turn $100 Per Month Into $788,000	If you invest consistently over time, the strategy yields strong results.	https://www.fool.com/investing/2026/02/18/growth-etf-voog-could-turn-100-month-788000/?.tsrc=rss
2026-02-17	Yahoo	0.042	Should You Buy the Vanguard S&P 500 ETF With the Stock Market Near a Record High? History Offers a Clear Answer	Despite recent volatility, trends like artificial intelligence could fuel another strong year for the stock market.	https://www.fool.com/investing/2026/02/17/should-buy-vanguard-sp-500-etf-stock-record-high/?.tsrc=rss
2026-02-16	Yahoo	0.3	1 Unstoppable Vanguard ETF That Could Crush the S&P 500 (Again) in 2026	In 2025, international stocks had some of their best performance relative to the S&amp;P 500 in years. The momentum looks ready to carry forward into 2026.	https://www.fool.com/investing/2026/02/16/1-unstoppable-vanguard-etf-could-crush-sp-500/?.tsrc=rss
2026-02-16	Yahoo	-1.0	1 Boring ETF That Could Turn $100 Per Month Into $20,500	The Vanguard S&amp;P 500 ETF is still a rock-solid investment.	https://www.fool.com/investing/2026/02/16/1-boring-etf-that-could-turn-100-per-month/?.tsrc=rss
2026-02-14	Google	0.166	VOO Has Delivered Higher Returns, But IWM Provides Broad Small Cap Exposure - The Motley Fool		https://news.google.com/rss/articles/CBMivgFBVV95cUxPREVncGdvWi05dHFxMUpsWlY0dWNHWFljUEJHeXdNUHo1WmVSb2g4WkdpUUhzbHpNZVhSWHdiazdRQXh5YUZUU0FBMTc5LWgxaDRoOTBSbjZCMkUtRTNReDZzeE9mRWg0YW51bFFVVXdHYmd2RUZ2M3pNYmY1NzhKazZzSy04SVFMVlV1UUVleWlmc3k5LXpoZ2xTbVh6d1lYTTVLX0Q3N0ltaDRTRFZkVnd4MENlckpLMFZNZkZ3?oc=5
2026-02-11	Google	0.0	Voo and beyond - United Nations Development Programme		https://news.google.com/rss/articles/CBMiZkFVX3lxTE9VQWNRLVl2NmczX095ZklPZDM4VVJiaGJfLTJkN3BKR2lZWHZkU1o4cXEyWmlFSlZUTXdQV2Q1SW9hUWQ2SktnZTVBQkt2OHl2TlAxVmtwV2lBZkp5Tnl2ZkNyU0txZw?oc=5
2026-02-10	Google	0.0	VIG Vs. VOO: Buy Dividend Growth Amid Value Rotation (NYSEARCA:VIG) - Seeking Alpha		https://news.google.com/rss/articles/CBMilgFBVV95cUxNaExGc0F5UFNiRUo0c2JCN1dOeVdsVDhwNW15SGdrS0pwbDRzRzhFZk1IczhPVXo1RUd0N3M4NC01bXZOYzIzeTZqUDNXdUgtZHlVVUNVTklSa0R6VVZXNG80UHRWQktKbTlITHJFNlR6ZmI2bW9EVHRjM3NCTUZSazNvbVVFMFpvMzdSS0NKRENkeC1Zc3c?oc=5
2026-02-09	Google	0.0	SCHD vs. QQQI vs. VOO: Which Dividend ETF Could Offer the Highest Income in 2026? - TipRanks		https://news.google.com/rss/articles/CBMioAFBVV95cUxOdlF2Tlp1QWNmLWlYLS03SjBKTVB6a0wxTm52NURUTHFRSlB6SXFMd01tS0h0NW5ReXlEekt6bXNpT0JpS1d6UVVuTXExQXJ0MXBxbDdIUmtGN3RTOVVZN3dfd3RKNXZWWjlBalVHQlo4Q1JsQm5kZVNRUHZVNUFjd3UwdW0tTm5Ca1ZWX2NzUGpESFZUTldUeGJSTGhrOXZR?oc=5
2026-02-08	Google	0.55	Is Vanguard VOO or Invesco QQQ the Better Buy? How S&P 500 Diversification Compares to Tech-Focused Growth - The Motley Fool		https://news.google.com/rss/articles/CBMi7AFBVV95cUxQdDhBbU1HbDc4dm1xakVFOWo3T1FsM3NvV2s3eXJ2VVRXODRqZ1NJR3VxZmhJcUo0cUpoUmpxQkVDcExBVjVRRXB3anFlT1dLc1g1R2VzZ0JGd2RJWXc2alU4bWVqLWFOVklIMTh4cFdLdXk3UWxiWTh1OGJvWmQ2M2RnaGdjem4wWU5rWS1oUEZUMlhSdmE2YkdpZHNTc2NYcGhNbDhwWUE1XzRxZ1JoV1huWGQwSlFsMm1kOEZQV2xWRUVNNlloSU9OM2ZKRFl0MEpmSnV1bHdFY0ZsRVdmcVNOSkpBRjNpZWNkRg?oc=5
2026-02-08	Google	0.462	Is VOO or MGK the Better Vanguard ETF Buy Right Now? Here's What Investors Need to Know. - The Motley Fool		https://news.google.com/rss/articles/CBMizgFBVV95cUxPM20yZTFhbGNPbkQ4SVRnOUx2NHY4LUlRRUo0T2tIaG5UbnJHbk81d3dVbzAydF9acFNzYmpUSUlZazNyaXhrZEVKMVIwb3FObHJDWnZ1VV9aZUJXM2FLMlZUQTNkTUs3STg2b0VJRXRaT1NNdmc1djRXd2NFZExHbTFyZEVYZFVfRWJkTllOX2h5eE5YY0p6ZEQyLUNycjZIZTFKMXJQakpoUTE0c3l1VWlNQlJUQ3VuaHdHSW01S3lsdnhtNHFycVBtQnhNdw?oc=5
2026-02-07	Google	0.462	QQQ vs. VOO: Which Powerhouse ETF Is the Better Buy for Investors Right Now? - The Motley Fool		https://news.google.com/rss/articles/CBMivAFBVV95cUxNRjA3VXdOT3dxM1Vubmx3YWNiTTd3QklXNGtheXlYa3lFSy1faEdKZzAxbDJGUTN2ZjNtLURQYTFDaV9tN25MeTRDVTBVNjBxUjdMRFRTR0pZZ0s5NUsyc1J3cXZxTVY3bzhxTzZ0X291RVJqOExNb2V4cTRxNTNJMHRTczBZN3QtUFZ5NGNVYWdwZ1EwSlpkU0paUWxzWGhlWHV1cnRrYllYbWVadzQ0MkVKUlZmUVNvMDdlRQ?oc=5
2026-02-07	Google	0.393	QQQ vs. VOO: Which Powerhouse ETF Is the Better Buy for Investors Right Now? - Yahoo Finance		https://news.google.com/rss/articles/CBMie0FVX3lxTE9jUFp1bnl1VHkyYlZTcU9kcXZ1eWs2LVQ3S3FPemk3MkVmNklZQmNiOEJCZmFBeHJXYllpZFY0alVTanpINXBQaENSYlVrcFZpZHU1SVRmRnVkY3VaT2FFeHhoQUNxb3R6V1J1NkpDOV9GOVJVVzM3TGtTMA?oc=5
2026-01-24	Google	0.55	Better S&P 500 ETF: iShares IVV vs. Vanguard VOO - The Motley Fool		https://news.google.com/rss/articles/CBMingFBVV95cUxQczJYcTFuRzM0ZTdoYV9mZkFPRU45RExIbTRaZ1ZVTmVkNWFYeWQ5YmdMMG9aUDdRMG9FaXlkUzdXRGpsRmdIaVkyRmhvODdIUjVvQ19JRnVxZjFJX1Fvd19ZYU5GTG9hS1F4aHl5WmJWYWxGM01SMWpGVnM4RHBjMmptRC1kYUJsS1h5MmM4MHRLWTZRdHByUkw3VEdRQQ?oc=5
2026-01-24	Google	0.5	Better S&P 500 ETF: iShares IVV vs. Vanguard VOO - Yahoo Finance		https://news.google.com/rss/articles/CBMiekFVX3lxTE9QWmQ0aVFRb3ZoUVBJT1RxMlN3TGRhN0QwVURqR3MyeVA2UndhalpSNW5pelc5aW80bzlKWHp2TFJmSzNzUXFaT1o2VXd2dGlRV0lfMDVRMVhSMjZDdF9fTmxKVjhIa3QyOGxhQjRXTjVDRmdaSG1BVDFR?oc=5
2026-01-22	Google	0.393	VOO Versus SPY: Which S&P 500 ETF Is the Better Buy Right Now? - Morningstar		https://news.google.com/rss/articles/CBMikwFBVV95cUxOY2hQV2U1SXE1Nmd3UU9YTWFYYWxqNVFYNzM3ZjFPd29tTDJqUkRETE5jd1ZSeEpKTWdpN2VKd2YzWlZHS1FJSlVzSDlDREkwaTlLd1d6N0lSY0pvUWJBWE5UclZiR1VpcWRXc0lrU29FM0xfbC1FZTZ5WVFSTllRYURDZS1lZWlRekphUlNOdWJGMHM?oc=5
2026-01-20	Google	0.443	The Smartest Vanguard ETF to Buy With $500 Right Now - The Motley Fool		https://news.google.com/rss/articles/CBMikgFBVV95cUxQbHRiU0FhUUVXZVpuZU1zMENyV3dhZlpvdDZKUHBEcHkzeGg1c2F6cVRYR0hPbERZbFlXZ0t1OGxNejB2bUhndW9BNFc4YmtkbHllZkhReEhjZFNGLWFDalV0aE9IS3hBdWVUcEU3em1ONWN6d1Z2bjV0emdxeklBeFZVYXNySzFVS3FzOUF1UnozZw?oc=5
2026-01-16	Google	0.55	VOO vs. SPY: What's the Better S&P 500 ETF Buy? - The Motley Fool		https://news.google.com/rss/articles/CBMijgFBVV95cUxPa2RudW84dml1MjVvZmlRbXE4cVl5WFVmVFFKQWlWaThzVDJLeHNkUklNM1ZDZXRZSDRMX3hmRUhISkwtNjVGRFk5VjYtcWpsUkkzeVhHLVZuV3B4eXVyakpVaUVaZkNRYmdGeXg2ckVTM25NMTN3R0d0UlhVX0pMLVhHSTBqNzI5QTh5bjV3?oc=5
2026-01-14	Google	0.0	Should Vanguard S&P 500 ETF (VOO) Be on Your Investing Radar? - Yahoo Finance		https://news.google.com/rss/articles/CBMid0FVX3lxTE51eGhDQTk0azFyVVpOc2VuWGIxdUg5NVZ5NHkxZzUxdmJfdmJKRjFGazZRY0llOVBjU3N6YnBQTjloNzdiUjNzY252SGN1eWJHV3RobmtTd2l6Nlh3dUdIQkhGckFhbUJBdTY0VHdYM3dEa2ctNk9B?oc=5
2026-01-10	Google	0.6	2 S&P 500 ETFs to Buy With $100 and Hold Forever - The Motley Fool		https://news.google.com/rss/articles/CBMikwFBVV95cUxNQW9RNEJlOUctTEJGclNPV2hqdTVUTDNJNGxWNTZ4Tlo5TXBWWGNUaTV5YnJROXJiMGI5NURJaXFpVXRwZkNMa0s1R1lPNEJITmxHeDR3X1AtaXBSY1prNnlvQzdZdFM4S3R2aWhKQ05yaHlEQWpER1pobkdLVFFlTU1TMFpWeHAxT3NGcGY3bzZ4S2s?oc=5
2026-01-05	Google	0.5	Top S&P 500 ETFs for January 2026: IVV, VOO and More - NerdWallet		https://news.google.com/rss/articles/CBMiZEFVX3lxTFAwOVFpQTBacEtRYlRMTWhJT0Ryb0pNNG9aXzVkLVBGTUF0cVNSRXIzS1lnZ0Y4UFI1cWUtM3JUbl9aT3p2RmYycnY2LTZuQS1XVDBGYzdCakl5b1BqcmNzQUtSN1k?oc=5
2026-01-01	Google	0.5	VOO vs. SPY: Which Popular S&P 500 ETF Wins Out for Investors? - The Motley Fool		https://news.google.com/rss/articles/CBMirwFBVV95cUxPR3lNOUNCS3FDX25OQkc2Uy1wZklxZ19QVU5WbUE5b0FmTnd2aTdmc0Y1UUVOMXh0dmZsbWdJcHhjT1BKa2R0ckgtempuM00zTDlUdEpxTFR1elhkbklqOGhkMVRwbDc2LXZQTU9FQUpwaDBUbnFQdm4yTXNvT0hCRTAzd21USFdEMnJlS3pjXzBoWkZCLVgxejVyZlNsT0J2MmhQaWI5UkxPNHhlZTg0?oc=5
2025-12-29	Google	0.6	Forget Stocks: This S&P 500 ETF Is Poised for Explosive Growth. - The Motley Fool		https://news.google.com/rss/articles/CBMilgFBVV95cUxQbXJpbGdTZWtMeVNEMWp6V01STkwwWjJRdzRJSXZyU3VkMWEtLUdfT29zUl9uU1duS3I0YnRWekJQVUtUZjdRMndUVUZRNUh3QzJSSUFyT2dzczgtaGZIam80enlBWHhpR0x3ZWh4R0lTbkt6ZFZCS3RBNjNkVG5PZS1TS25xbTFydGV6NnRKU0dsUzJyWGc?oc=5
2025-12-27	Google	0.5	Better Vanguard ETF: VOO vs. VOOG - Yahoo Finance		https://news.google.com/rss/articles/CBMifEFVX3lxTE5DbTVuLUJsLTFGMm85X29fOElpVG5HSklNX0o2S1hRNl9nX3c5ZjV6X1Q3TF9GZzVsOEF4NFJPSUIzSEZCQTNPdVFmU2FsZWlFS2VndU9fWTVsdFNpc0l0RElpMDJSOW55YThxSEJHOG1nc3ROaTluLXNxdEs?oc=5
2025-12-21	Google	0.55	VOO vs. QQQ: Is S&P 500 Stability or Tech-Focused Growth the Better Choice for Investors? - The Motley Fool		https://news.google.com/rss/articles/CBMi0wFBVV95cUxNZjBVSFZjSm5XWDBIMWlDeUZfVElDX2pWWGx0ZFJZUDBQNmZMdno2Uml1dk8xcEo1MjRUUzIzUS1PVzdxU3NuLUE2bFJpZUJTSkNBMnZ3Um8xcndZeHpFcjBjaDBubVhaMklqVm9FLXBERUlLQmJmbDdRbGFOWkdkYmk0ZjA5eENMV25YOWhzNjdjUjRWWlltcTg3MHE5RWV1Z21pUEJPd1pRWngtazgwM2NqcmJldUF3SlFKUUlLeUg3QWw1Z0ItOGxkUzZKYmFwdW1n?oc=5
2025-12-21	Google	0.55	VOO vs. VOOG: Is S&P 500 Diversification or Tech-Focused Growth the Better Choice for Investors? - The Motley Fool		https://news.google.com/rss/articles/CBMi3AFBVV95cUxQYWZlZnlnMWFHel9fZFdJaFA0QVNHWlpZOWdqcW85OENVTmg0TEdaQ3d1MVhnTTgxWEljZDl2OFVmQm1GUHhtUTY5ejh3R0ZyaTZLQVRRSGNIeDMwMFN6TnRTRDFMejlla19iWFRVbGczMnRYWjFyc0pwVmR4MXV4ZzlINlJoSU9lNmNlMmlEejI3N1JJTktyMjQxeWl1MHdaakFJMDBNZVRuajRFWFJ0NlZEQXNFT3k2Z1RYV3N0Zm1rcmw0YTJCa3RkRFBtbURZSXVPOHk3ZXE2ZmhU?oc=5
2025-12-20	Google	0.2	VOO and VOOG Both Offer S&P 500 Exposure, But One Offers Greater Earning Potential for Investors - Yahoo Finance		https://news.google.com/rss/articles/CBMidkFVX3lxTE9pQTc4eVYxM1JZeG9GdlEzT3hLdmlnOXFBZW0zakVSS0M5VU92dmZTaTR1UmpvN3gtc085Vmg1VFVlNkVjekVrUWNET0VkTUR3d1BuTkFCRFBaUzF5aTlHbjZndldsMU9DbmJ1N1UzQlJNcjQ2TlE?oc=5
2025-12-20	Google	0.125	VUG Has Delivered Larger Gains, VOO Sports a Higher Dividend Yield and Lower Fees - Yahoo Finance		https://news.google.com/rss/articles/CBMiggFBVV95cUxOR2ZRNlRwRFVibGZiM2t6RE5xVExjWU9SMFRyQV81MTJwVGVRazJKSk5lUEYxZTRHLWJZQkY1OVltQ3pyU2lmeHkwRUhXSU5JOElaNGxiT0hjS1BQYkhGV2NuWWZpMXBmNUZzT19CZHNCT2Jsb1lsUEJHdHA5QXQyWFdn?oc=5
2025-12-20	Google	0.0	SPY vs. VOO: Which S&P 500 ETF Should You Choose? - The White Coat Investor		https://news.google.com/rss/articles/CBMiWEFVX3lxTE96eUJBYWc2NU13N3dhLTZBdW04eE9OMXg1WHVfa2dFU2NGYjhSVUdNZGZscGZ1Wmc2VWpfOHBFZndJX1dUSjBobk0zQXBsdlFGSVJ1YWF2ZWc?oc=5
2025-12-18	Google	0.2	Income Investors Skip VOO’s 1.09% Yield And Choose NOBL’s 68 Dividend Aristocrats Paying Twice As Much - Yahoo Finance		https://news.google.com/rss/articles/CBMifkFVX3lxTFBoVU9TMjd0NnFjek1lRVkxODhEQmV2MzhkTkZpU1RNOEZ6QldGeTRpem9nQVAzbmMxYXlQYVFmc2dUNVMzSVBWWkMweWdwZzNwWU5wOE9BVjl1UXBDWDFiS3hhVnZ2NkJZTjdNSnJnTDFGQXdZNzgzQ2tNTDVBZw?oc=5
2025-12-18	Google	0.038	Vanguard’s Other Index ETF Has Absolutely Destroyed SPY and VOO This Year | VXUS - Yahoo Finance		https://news.google.com/rss/articles/CBMiiAFBVV95cUxPcFd4TExzUVA5bS1aTkFUb2NQa1dFSWMyT2Q5QjBoSXFVWUd1LThBbTJqRGF1S2d5NEpwY2E4cTh1N3BxZnNkYS1ZNUgwaGpJcHNEckF2YmkyblBVWkY3Ym10a05xUVo2ZjRIdEdnT2Rxck12aG9tampjR1ViMkZTbFYtRV9NaUJh?oc=5
2025-12-17	Google	0.136	Stock Market Live December 17: Venezuela Blockaded, S&P 500 (VOO) Rebounds - Yahoo Finance		https://news.google.com/rss/articles/CBMigAFBVV95cUxOTlJsS0V3ZlhuYnptZUx2VjZKbHptalE2VkRsUlJKOGRweUpYNV9uUF9jcS1RMU52Z3VlY042UnVmYzRMNklQbjg5UUx3NHBsR0ctaEJUZDZ2TFNNYS1hazhDVzRhU3ozRjBIelZ6amNia0FSbnY4WHlRaE11bzgxXw?oc=5
2025-12-12	Google	0.5	Too Many People Pile In To VOO, and Should Look At These ETFs Instead - 24/7 Wall St.		https://news.google.com/rss/articles/CBMisgFBVV95cUxPTGZTOW52cE1IcFUyVVZ5bDZWYkU4aDRmbEgxRXRtdmNEcFo3SFlNd1ZGbXZxZkFPWWZrMjN2akY3bmdIa0lhX2lLSUtPcGJwOUdrQUN5NDIzZFZyT0dRRVpkMnVxZDE2VjU2aGNVeUpIMHR2bXdZc2xGSEQ1MTlxelhsak1fbDZkRDBYb0R0bENuZ3hVckZIS2VqQ3NSOU5MOGczcHlqdjl5cVNHclpQZFdB?oc=5
2025-12-10	Google	0.056	Stock Market Live December 10: S&P 500 (VOO) Flat As Investors Await Interest Rate News - Yahoo Finance		https://news.google.com/rss/articles/CBMigAFBVV95cUxQRjdEUURIM3l1MEtsWm92cEM4NENvMzlNY3FOT0wtUUpiSUw5X0lDZEc4Y2Y4MDZ3X2NqcXlOVFo0eVlMVENTM242WDU2VjBvMkVpTVFteWptWXlFWmZmcjhXSWpmT2hHSnBZTHluN204N3NoQ1N2c1ptUlVLSWpZdg?oc=5
2025-12-08	Google	0.35	The Vanguard S&P 500 ETF (VOO) Offers Broader Diversification Than the Vanguard Mega Cap Growth ETF (MGK) - The Motley Fool		https://news.google.com/rss/articles/CBMi5wFBVV95cUxQdklTYjV3amhIWGhQakQ4Z2UweGpVblVlYzJmYkRUTlpoQ1JBSklkUE9KeHBwQjFOZmVQSlI3Rk9CYmJfVGx0MEFnLTdOcnllV0FidkZwRHpEZG9JY1k5dmJGamFyZ19keVNFU1BYU3BuUFVvUXhVS3BPSTRucWdDZkpGYnRvamdsVEJPeFZWS1M5M3hub1pOTXV4X1FaQ3pVdjFtNGUtb2U1VHVHRl8yLVd4ak9pVTJnY0ZjSzQ0RlJZWm5pMHZmcE52cDZhNHdTbHhhUUUzRm51M0hBZnc4MGxSd19uREE?oc=5
2025-12-06	Google	0.55	Comparing Two of the Top Buy-and-Hold ETFs for Retail Investors: QQQ vs. VOO - The Motley Fool		https://news.google.com/rss/articles/CBMivgFBVV95cUxNN3N0VXRuenZDejNPa1BhQ0RiaXBoNGRYOFBfUGpGUjMzRVlIN3p3Y1BKQjlxQk1qeEF2RmhxblNMOFB6b3hDUFR5Ym9ZSFMzbFdUa0E0RUZadFVhOHVGUERfTmpLaEdLT0JuZVV6YUdHWHZzV1Nmb2FOaU1VcHlkSzgtS1Ytb2lBaEt4U2hrM0w0N01SdDM3LTBHZXh3dVZXb2tvYjFqelR1SEFmOW1ZeXJMZHgxLWFwb1Nic3N3?oc=5
2025-12-04	Google	0.136	Stock Market Live December 4: S&P 500 (VOO) Gains on Lighter Regulation for Carmakers - Yahoo Finance		https://news.google.com/rss/articles/CBMif0FVX3lxTE5CRGJfdzl5eEdyelFlNFR3RWZ1MlpFVDNRbG1DRUZuTXdpUTgtT0dDUEZqbVRTZFhsajlBUzhYTnJudEh3YlJIVUhjcEVjbVliTzhyRDR5bktsb0NkU00yVzBmM2lNTFJlNEJocnVnZklwTHFxSk5HRldHRFhqTW8?oc=5
2025-12-01	Google	0.6	S&P 500 Stability vs. Superior Growth: Is VOO or VUG the Better ETF for You? - Nasdaq		https://news.google.com/rss/articles/CBMimAFBVV95cUxQZ21tdVRzNnp3Vml3MEh5c2hndFo4ODZzblBHZURLTERGVDZTdlZfXzlUWEcyclRHMWgzNGJCTXBsQzZURzFHeDhXUHNxbUN4aVhVbWw2YTZVa3lZUFp3aDZDXzdLNVdXLWM2bjhZaHlqT2lIZVlKcUx6Q1YxWWVIbzhtVElweWpGMmE5c0pvUU4td2NXTElGWA?oc=5
2025-12-01	Google	0.6	S&P 500 Stability vs. Superior Growth: Is VOO or VUG the Better ETF for You? - The Motley Fool		https://news.google.com/rss/articles/CBMiwgFBVV95cUxNQjNVRjQ5em9qUE5XcWF2NWUxV2gtUHlLWGpaNUsxYjlGV2xXM05fLWFKcGJkRDhhVnVZMjdhVEpwX3htWlFrVHdfbUkxOFNWVURTeWt5bFRfUzZQcTdBX21uTTg1N1pfbnhtT0RINHN3WWFGUkhiTFZvcHRSVF9fU0VTbVBycG03SmxSeXlRb3MxMld2U0pMbE11RjlBU2FUWEhuRHhsb0NSamppQ1hITTdFczZnV2xDSlBHMWRTUnpkdw?oc=5
2025-12-01	Google	0.4	If You'd Invested $1,000 in the Vanguard S&P 500 ETF (VOO) 10 Years Ago, Here's How Much You'd Have Today - The Motley Fool		https://news.google.com/rss/articles/CBMikgFBVV95cUxPNmJzN1R4RGxLRWNBVXloNVdETnpvX0tWMmp1SVZhUEVIQTh2QjlUZVRicmJyTnhCZUVPY09nbG1YWmswVWJPYkg5Q0lYcHpobzQxb3hhc2ozYlR4N1c1OXVWX1lReF9CMFV4ZDlUYmx2NzJRR053WTc2RFp0UGNaemNHQzk1cmpUWW04bkhFTzU5QQ?oc=5
2025-12-01	Google	0.018	Stock Market Live December 1: S&P 500 (VOO) Sinks Amidst Crypto Selloff - Yahoo Finance		https://news.google.com/rss/articles/CBMif0FVX3lxTFAwWWt0VWhMVzFxeEJpaGpZUDVWZjBfUkxWR3I5ZFVnRkc1d2taUW9QcDBHZ3ZfTGQtQ1BOb2Y0SVZhMnpjaUpnNzQ3ZllNd1c2UmhMamFsbHRoTVRQa3pMNXRYZFJ2a3ZwN2JQUElNR1ZXX3JyTUt3QUtLaUxzaVk?oc=5
2025-12-01	Google	0.0	Battle of the S&P 500 ETFs: How VOO Compares to SPY on Fees, Yield, and Risk - Nasdaq		https://news.google.com/rss/articles/CBMilgFBVV95cUxPa2pyaWhUZF9aRzZGYWJ5cDdZMlljQnBrWllRaDlZNWZ2VDVyQk1fSEJNRjFIUWgweDlpUkh1anNaSWFvR2JzbHRPWWp6TXdnSzBlVlJpZF9UOVVZOG9aNWktVjZzNm5SVk9BX3FHMDJMQTA0XzNCMDBURUpXRVA2RE9pZTVoU09yejAtMkFRQ1pEa25JZGc?oc=5
2025-11-26	Google	0.136	Feeling Brand VOO: A New Inflows Record for ETF - VettaFi - Commentaries - Advisor Perspectives		https://news.google.com/rss/articles/CBMioAFBVV95cUxPVXlleWtfZ3VWRm93emk0SG12QVRtNllqSHp3SUpzT1lBZGVaVGpoM0lTTGJUNzlmNjN6MTZINDJKUUx3Y3VkcGFudWlBMEtEUUtTVTZidElfMmEwc0wwd20yRm5oWHFfWEhvUkJoRDdQamtBWWkzS285UFFaMmNYX3BaNHdLS3FUSFZfeV9ZQmhmV2NsTWtnSTYwSWRqdm5n?oc=5
2025-11-24	Google	0.0	SPY vs IVV vs VOO: understanding S&P 500 ETFs - Capital.com		https://news.google.com/rss/articles/CBMinAFBVV95cUxQY2M3OE9mVHhKTnAyS185R19KbTZpV1pmT2tKbmViRWt2QmhqbHNMOHhHalFtTVkyY0tjcVlraExFWmhwZ3BlUHh3UHJDdEh4OWxxWjhKbHJwN3YtbmdoOWRTamsxeEZMQmd0eFBlc1RxdWM2NW9uOUNzTjU0R0RiS2xEMXY0Vy1WSTZrX2tRUHBxTFRLNzdQS2M3WTY?oc=5
2025-11-23	Google	0.317	The Vanguard 500 Index Fund ETF (VOO) Offers Broader Exposure While the Vanguard Growth Index Fund ETF (VUG) Delivers Higher Growth - The Motley Fool		https://news.google.com/rss/articles/CBMihAJBVV95cUxQbWNZQ281SnBpY3BDRUtIOGY4VlpjRnQySEJuR0hEZl9NYUd6UGRzVjZrejZZZHhtVmJMOFpFNGd3WFBXaDVOdmxaVFFIQnRIVHRUbzFxTFhVRzU0Q2lGTWFySm9FUGxPNi16M2Zhc1YwVjBsbWJLQUtnb2lYTE43LUhMR1l3RUlJcWk1ODNFam9pbUt3V1dZTnc0dGRJMjN0b21pTWlPVDV1cy05MHNocldkUzVmTTdkbnNNakZXZDdzeTIzVF9tQjhSOGlYTmItdGNZRmxtX1dHNW9VVHpXUzNRWjJmckgzSFNUZnFRN1VkQmlSZnJjWS10VHlpZG84YWpkRg?oc=5
2025-11-21	Google	0.6	Should Investors Own Vanguard's VOO ETF Over Invesco's QQQ for Broader Diversification? - Nasdaq		https://news.google.com/rss/articles/CBMisgFBVV95cUxPQVlrWU1kWGhlNHpaVGpPWXBkMTdWcWEtN0M2dFlWQlpBRTM5Q0VxbEE3aGtjVGZSSElBYXdIT05UOUpRYUdFM1M5U3FaWjN0a002YXZSQURKSHJ2dHZac18xV3Vwdm1kYUNfenZSbEhya0VLbVExVEFSdjJOWWRqYmpOV1Naal9HNmxMVzdwSmp0ZEpJMGJxNmRfOFlUOGRwQzIwU0l6N1liYWNPelV5aS1n?oc=5
2025-11-21	Google	0.205	Stock Market Live November 21: S&P 500 (VOO) Bounces Higher on Positive Fed Commentary - Yahoo Finance		https://news.google.com/rss/articles/CBMigAFBVV95cUxQNzA0bWN4ejN4eHhQbDNtR3FCbHpYTmNCaWRwaWtzcHktMm5TRy1BajNxYmhoZnFsYVRsU0szSE5JaGFaUzB1NGZqbXhTbEtFdjVZdWNKVkQtWXZNbEZXemlGYm93YkF6U0FQMmlVRlVNOTZHX1A3UkowblZoWUtmMA?oc=5
2025-11-20	Google	0.6	VOO and MGK Both Offer Large-Cap Exposure, But Vary on Risk Profiles, Fees, and Diversification - The Motley Fool		https://news.google.com/rss/articles/CBMi1gFBVV95cUxPbkY4NC1GSXNVMGQ0QXh5UnRPRDFJVFpzU3NZU2lGTU0tUHhVRGpSQVNERS04WXZra1R1YkNQSWpKOXNocjBSTFpNampoNUQ1aHlUZlA3UTYzTHJteXRqYWE5V0hUajdwYkp3aFpMMl8yZ25RWDFyeEVZSmtSb3ptWXVnY3Z4VF9zY2kyUWRCQTlFR1pNdGlDTEdzYWUwdnZycnF2N2ozS0ttSU5CTFNXcEVyd0oza0c1aWQxdGpiTVBTVWsxSWRhSFpfZzZGRzRnaF85N21n?oc=5
2025-11-19	Google	0.3	VOO vs. QQQ: Diversification Is the Key - The Motley Fool		https://news.google.com/rss/articles/CBMijAFBVV95cUxNd2R4V1piTE9fNk8tRTVuWmJsSVJnZnRSRnlyZGN4NU4xQ0tkdHJBM1UtemFraWVHZ2xiaDBjb1RKN2g0UVRNYWJqdk9BOC13ZXZmNTdHSEh1bW1uNDdsMEZGWlltb2gtcXp0WkF1enltaHFlVkxGbW9jRmF5azJlWVRyQ3NWZHdWWGJtWA?oc=5
2025-11-18	Google	0.136	Stock Market Live November 18: S&P 500 (VOO) Opens Lower as Google CEO Warns of an AI Selloff - Yahoo Finance		https://news.google.com/rss/articles/CBMigAFBVV95cUxPMjRMRUl6UGdESUxSUnQyci13WGFWbjlyT19Sa0k1MmxrWktFbnJTZEJ0QjlNZWljUXJscU1SOVM4WXp3R09QQkFmQVhPWGJWUDgza2lkYU9ERmFUN2lqUGRBWEJZU0Nac3dtQzNjczlfRndJNElOWFNyWkNfdnFWWg?oc=5
2025-11-11	Google	-0.05	These Dow Stocks Have Crushed the VOO and VTI in 2025—Here’s Where They’re Headed Next - Yahoo Finance		https://news.google.com/rss/articles/CBMifEFVX3lxTE1LZmxCdVFaRUlYOFA0Q09DdzRhVDNGWHpyQm9WRnZuN19hRlg2VG0zRGN4NVR2UUFjdExzSjBILTJxNXhsTmxROEkwRGR4R2VSbmdGbXlNZ2NTMm9OQ3NsenFidHdYRm9BYlJjRng0VzBMQk5nTWNYS3ZqbmY?oc=5
2025-11-05	Google	0.6	Is the Vanguard 500 Index Fund ETF (VOO) a Buy Now? - The Motley Fool		https://news.google.com/rss/articles/CBMilgFBVV95cUxQcEczU2ZRajhFLVpCaHlTZkhQcmd0QTl5bHlfRGEyQTBMb2g4b2t0ZG4xYmEycUlzM0dtWUlPSXBhR3lXWjBIVVVRZGZHbE94cUF2cEtNaWxxQzZPU2cwbGNpbVZmSFF3NE9LZjQ1NklEMmVJZE1iU01HOEtaU3EyMjhCd2JSc2tmUmUzd0ZOaFBDSXBhSnc?oc=5
2025-11-05	Google	0.0	Is the Vanguard 500 Index Fund ETF (VOO) a Buy Now? - Yahoo Finance		https://news.google.com/rss/articles/CBMifkFVX3lxTFA3R2lCd083cTFIZDBKSGNjZk1TMGVFa0pacWl5NWV5eHRXclI1NS1vYjdUdVBQMFJZUDQ0QnNXdGxVZExFT1N4OWFxaFRLd3hteG1LcENVOExnMTZVazJfVlRwMjRQd2pVbUFWeWRzN2ZIWXNQeXFEZURqNDlvdw?oc=5
2025-11-03	Google	0.2	VOO: Our Core Pick Is Ready For A Correction (Rating Downgrade) (NYSEARCA:VOO) - Seeking Alpha		https://news.google.com/rss/articles/CBMiowFBVV95cUxOdWp0Y1ZiWUFnendFZmVSMl85ampLYmpaSmFmV3JwOUNQV3cxaFZkWTFHcFVLWEw0Tkxmbms0OXlGNXpQRE8xNndKenNWNXdWNDZuVXc3ZXowaXpKS3JsbWp6bURZN2FfYXN2dWItQld3UGwtM0NhcV9ib3dzaExqYldubVN3S21JS1F0LXpVUWxqa0ZmY3BZZTd2dWJfUkdIR3d3?oc=5
2025-11-03	Google	0.0	In the World Series of Inflows, VOO Could Also Go Back-to-Back - ETF Trends		https://news.google.com/rss/articles/CBMiogFBVV95cUxOaFlRWGNhbmdSMFNOYlhsRlNaOG9ZcDRvVGZKS29WUzV4c01lWkZvY3RPeHREWVk3NTdKUW9ZaWFIOU5kTFVCSDlaaU41WDZKd1lqVERMRFlsTjJrSzlpUFdsWXV3Q0l5cmtNd25hbXp0Q1QyYVZSSTRxS21uZmdZOE0xNUJQZVQ1ZVJ6SmJlcXE0TEtBRU1KUkxET3VpS1BUTnfSAacBQVVfeXFMUEdYVnA0cEp1ckhyTFQ2R3U5YWpVWERJNHpVZURXUkU4UGFrZWU1X2JMajRXejZtd1N0QXF5d2djTkVaRF92X2gyamtQN19lSGJlQ2dfQk5Gb2FJMkNldGFaaXRRemRiRFB3OVNsZXNIMDFIWU55bi1nQ2czSTlkSmNFQlpubjlIQ1lEVkFCTnowamU4U3dRY3l2TFZFNTJfQ1ZXMG41bmc?oc=5
2025-11-02	Google	0.35	Vanguard VOO ETF Offers Lower Costs and Stronger Growth Than IWM - The Motley Fool		https://news.google.com/rss/articles/CBMisAFBVV95cUxQaVZSSlNoVGVhc1daWVh6VUV4ZTRFU2tqbnlKUkg4VUJqNmN3LXJZNWNwaWFqYmtueGtwNXZQaEVjUjdhdEZxSTRtdzlwaDN2WGgwSUNkbmxfV1pydXppd3VNVUFINUN6R2NRQU9XV2lwWEhzU2Y2SWdnTlpvRk1BX0FQaWpuSTdrdXloczQ3aU94R2hWdE1KQ3I5YXUyczJLT2xVVUlBTnBvNGFqbkdDdw?oc=5
2025-10-31	Google	0.35	VOO vs. VOOG: Which Offers Broader Diversification? - The Motley Fool		https://news.google.com/rss/articles/CBMimwFBVV95cUxOOFd2eHJWYnpNQmFLTUUwVjlsd3RWTG5QeVVsX1ZJbnRBQmpWX2ljeHY5SzhWcy1hSmJJU1hneGJyZjJLLUFMN1dWamlFbjliSHJxU0JObVhiV2k0NEJCd25iNkp0eElsUWRHbTJ4UjhtQnpacVRoRUVoejZKNFNJY0dxdmVIT0RZVlY3dzlTMXhRVUZiTm5LR0Vscw?oc=5
2025-10-30	Google	0.35	Forget Stock Picking: 'VOO and Chill' Is Good Enough for This Money Writer - money.com		https://news.google.com/rss/articles/CBMilAFBVV95cUxNYjNFX1FiNW5JQmlmT3dQY2E5MnZMZHVoNjVVZll2bWx2R2dqUmZIOTREUVVvelRQWEV6QVNYNUhqR0xYTDVuVXJQVmZvY2xUdTlvT3k4ZC1hZGk3Ymk5cHlnaXVPX0dTS09vTHMzUVVLb1lxWm5BSlJSTHlBNHNkSmlCRFZKR05ITUpleVZkTkdpQVN50gGgAUFVX3lxTE5zdXpNSURoY05ybDhmY0lFMFlSTnJ5TnFqVkFJUkg2X3RtMGVTeDBxbVkxTUpyUzcyQ0JkNm80by1NX2ZGNDZfRFZ5akNweW1Ga1RNMU54SmhGckRWQ2JsMVlzQ0h4YTE5dlotWTFYYlc1T2NzUmRhTUY0RWt4ZmlTcVlVdkEwTmpmMUdIWEc0VXRUSWlfSjl5dWdqME1kZGM?oc=5
