Date	Source	Sentiment	Headline	Summary	URL
2026-02-25	Google	0.0	Clearstead Advisors LLC Boosts Stake in Schwab U.S. REIT ETF $SCHH - Defense World		https://news.google.com/rss/articles/CBMirgFBVV95cUxNY2htMW05SlpHTUtoM0Z1MGdHeXNzLUhBUkF1THpIWGpueEdrWU8tRG12alExdFdqT2pFRTNtRmlrRS0tM2w1UFBFSldMcjJxNEVoVS1lWkxhcGlGX25uZ0tPaDV2bHVSVHBIdEM2NEV0VlZhcE95NnZrOFNnTHdUR1BQOXEzd2FTdHNmSzZENVBTa3RIVGZhQl95QWhJU1lqMG5EdmNrQkotOGZwZ3c?oc=5
2026-02-17	Google	0.25	Is SCHH stock undervalued historically - Insider Selling & Long-Term Safe Investment Ideas - mfd.ru		https://news.google.com/rss/articles/CBMia0FVX3lxTE85REt5SG9NRUpGWFdHMHEzRGM5ellQOFhTaVUzeEkyVkVwS21GSXRhZ1cybk03bnhxUFdGQjk0d3FQakpPWEhxVWliRXl2WlRLR1hUQnJ6VDBYZ2o1VHhpcmd6T2UwSnAwU2hN?oc=5
2026-02-16	Google	0.0	How (SCHH) Movements Inform Risk Allocation Models - Stock Traders Daily		https://news.google.com/rss/articles/CBMiyAFBVV95cUxNTm9NS3pCak1ienE5dzdVTkFZMXdkaVlycnFFY0Rhb09mWFc3MFBMNEhTM3JwRlZ6M1MwSGtOcTZWcTBwTTVUM204SzF0Yi12VTlWMlVrMTR1ZVlmNnJKd24tbTFvdWx2Mmt1bVlJZDREMktGTVRfZTJmMWlvNFVlLUNvUXQyUUV3ZVU4dW1PVkdFMWJIM0w3MVRXVGxJdk5NQkZTc2NRNnFSLUpxRDlMN2s1cThrejhsWldpd2YxeV9XNXRjVnBJQg?oc=5
2026-02-16	Google	0.0	SCHH: Everything You Need To Know About The U.S. REIT ETF (NYSEARCA:SCHH) - Seeking Alpha		https://news.google.com/rss/articles/CBMinwFBVV95cUxQVmpEcXktUXFuTkRvOGVmcjBMX1ZyQ25VUlJlM1BHVHh6amJGTU8zQWxOdEVNMS1vQWFHcHNFVEl5X19KWjhiOFJMUURvV3VoeTJlM1JQOGJnNHRmdXJyS1kweGlJSURVRkVOWFBYUV82dDJ2VXNkZWpnSFQyaEdWd01MbVlwNHpaSWg3czdEaUxfV3ZGZTlwNUozZk4tN2s?oc=5
2026-01-27	Google	0.5	Best REIT ETF for Dividends: What To Look For - EBC Financial Group		https://news.google.com/rss/articles/CBMiekFVX3lxTE51ZFEtQktSYlBjUC1za1U3Y2szT3NtUElUOWg5V0NEdVpkY09xVGZMVUFDY3lwLV9FeWN1em51dkstbF9Sb2Vua1FmVlBzRDRqc1VmcFhITTNwRGgyakFESmxMcTZJVHpnY1pxWTBWaHNZQl9QRGNReXZn?oc=5
2026-01-11	Google	0.1	Looking for a REIT ETF? RWR and SCHH Offer Many Similarities -- and a Few Key Differences - Yahoo Finance		https://news.google.com/rss/articles/CBMie0FVX3lxTE5NSVp5aGhuZ1E4NEY1WVhrUF9oWC1nY2l4am5sVC1vejByOGxLcDRzWGpHamlhZy1TRjFQUUhrTjZTNDJVcWgwQ1VtQlR5NDB1Qm9CYzZleldwRnNhOFdJYmZ2eFpDVU5nU0tNV3diM2syVmh4OTVjY2pxcw?oc=5
2026-01-05	Google	0.6	VNQ vs SCHH: Scale and Income or a Leaner REIT Allocation - The Motley Fool		https://news.google.com/rss/articles/CBMipgFBVV95cUxQUGlNdXRqTnNpcTRuMmJEQi1tbTdMMU9WdTFVNXktRXYtNmRKQVFQS1Y0Z3lPOHdSa0NhUzh3bFl4b2I0Mkt0TUZjaHFlSnlpQy1RYXp3OWE3a2ZpR1NSYmd1Wlg2MXQ0WHUtZXlGS2VzdVk2dUlSdTF0aWFkdFdqQnN3bmdmS2pCckdyNlJKaHBYZV9VY0xVUDNYc1k0cEhHYnNWajNR?oc=5
2026-01-03	Google	0.0	Responsive Playbooks and the SCHH Inflection - Stock Traders Daily		https://news.google.com/rss/articles/CBMiwwFBVV95cUxQX1lRS0diZUJnelVRT0xGZXRaUk5OVWUwQzFFeGZEX0ZOb3BSRV9VNXZGbkx0VG1obUZkQkNsbXJEZE52OEgxeTZ5elE4X1lQTkd2cGdfY3dVaEpWdHF4QkFHUDMzZUZsMldOVFk4VFpkSGdic2ZBd1pGb3dHNmNva1l4WGpld19GYmo4eGIyQWNBakJ0OHRUb191Q0pvVzlyWEFjWlJWTHU1cGFNdWhkTFB5RDBkQ0NBUDA0dkIzZzNpWTA?oc=5
2026-01-02	Google	0.6	SCHH vs. RWR: Which U.S. REIT ETF Reigns Supreme? - The Motley Fool		https://news.google.com/rss/articles/CBMilwFBVV95cUxQNml4UDlLckhiVmUybmV6eWhSMHJHVGlYZ1E1c3hfUWtSajE0b2xILV9rV3p1NXFXT0libWk1VnBUa2JhYnpjSUEwU3dwcHlPYVl6YjFUanpENlZ4SjdrWE54bmM5bGVGSUhpbldObWtRY0NGVC1qNGRtQnVCdzZWcmVmMG1kN0NvQi1PaWd6QWVoeWpkaldz?oc=5
2026-01-02	Yahoo	-0.171	Should You Buy CRED ETF Before The Fed Cuts Rates In 2026?	The Columbia Research Enhanced Real Estate ETF (NYSE:CRED) launched in April 2023 at exactly the wrong moment. Real estate had just entered a brutal bear market triggered by the Federal Reserve’s fastest rate hiking cycle in four decades. Since inception, CRED has delivered a negative 1.6% return while managing just $3.1 million in assets, creating ... Should You Buy CRED ETF Before The Fed Cuts Rates In 2026?	https://247wallst.com/investing/2026/01/02/should-you-buy-cred-etf-before-the-fed-cuts-rates-in-2026/?.tsrc=rss
2025-12-31	Yahoo	0.008	Red Flags in Red States: Patriotic Investors Beware Fat Fees on Trump’s Truth Social ETFs	President Donald Trump’s Truth Social launched a suite of ETFs for “patriotic investors” All five Truth Social ETFs have an annual expense ratio of 0.65% or 65 basis points Truth Social American Red State REITs ETF (NYSE American: TSRS) targets operators in states where a Republican won at least two out of last three elections […] The post Red Flags in Red States: Patriotic Investors Beware Fat Fees on Trump’s Truth Social ETFs appeared first on CorpGov.	https://finance.yahoo.com/news/red-flags-red-states-patriotic-193920906.html?.tsrc=rss
2025-12-22	Yahoo	0.158	Real Estate ETF Poised For Breakout As Treasury Yields Drop And Cap Rates Compress	The Real Estate Select Sector SPDR Fund (NYSEARCA:XLRE) has spent 2025 in the penalty box and looks poised to close the year… exactly where it started. That underperformance may be setting up a contrarian opportunity that makes 2026 explosive. The fund tracks real estate investment trusts as the sector transitions from defensive survival mode to ... Real Estate ETF Poised For Breakout As Treasury Yields Drop And Cap Rates Compress	https://247wallst.com/investing/2025/12/22/real-estate-etf-poised-for-breakout-as-treasury-yields-drop-and-cap-rates-compress/?.tsrc=rss
2025-12-22	Yahoo	0.049	2026 Looks Like An Inflection Point For Schwab’s US REIT To Launch Higher | SCHH	The Schwab U.S. REIT ETF (NYSEARCA:SCHH) has spent the last year treading water, down roughly 2% while investors waited for interest rates to cooperate. With the 10-year Treasury hovering around 4.2% in mid-December and the Federal Reserve signaling a gradual path toward lower rates in 2026, SCHH sits at the inflection point where real estate ... 2026 Looks Like An Inflection Point For Schwab’s US REIT To Launch Higher | SCHH	https://247wallst.com/investing/2025/12/22/2026-looks-like-an-inflection-point-for-schwabs-us-reit-to-launch-higher-schh/?.tsrc=rss
2025-12-22	Google	0.0	Liquidity Mapping Around (SCHH) Price Events - Stock Traders Daily		https://news.google.com/rss/articles/CBMivwFBVV95cUxNMVMxNW91OTc4YllNcFB0bWRyWWJsT1drYWkwV1o5bkNLZ1Z4Nko4TEd4aGplSUVzZkdSalNhMkxaZFUxQkp0WkhCeHdXMmJfZThYLU9weVZUYzdEcVppcC1TUUZjOVFEUHFPMEplZEdoSFUtWmRlMlBYdVJVYmJaYWxld1F0UU5oNVExOUltNnlGWmRGVnE2QUVaY2ZvR2d1OFEwMm5jcWVWcTFCX0RXRlJTS1ZZTmhzM0R1Zk90VQ?oc=5
2025-12-19	Google	0.0	South County Habitat for Humanity gets $200K gift. How it will be used - The Providence Journal		https://news.google.com/rss/articles/CBMiyAFBVV95cUxQckZnZ3FPVlVDT2xFMzdPcDh3b3ZOYlg0dllaWi0wVjAtV2JNU0dadTNfb2JDMlNuZzRWd250Tmp0T1ZhaTBNcjhwaFBFSWtaYlY0RHZpX0o1ek5ybXNZZ2piQXlUMktZLW5yZVo2WHV2b1BnOVI0bFNGc2FmckdIaTM4aFdRYklUWXRueGVwckpmSjNueFN5LUROUFJ4TVEwYU5Wd0V5ckhNbGl1dm1ydFBmNmRRa2xfMXp0LU90S0JTWVZuUGdYYg?oc=5
2025-12-19	Yahoo	-0.108	Vanguard’s Forgotten ETF Yields 3.5% and Could Pop in 2026 as the Fed Lowers Rates | VNQ	The Vanguard Real Estate Index Fund ETF Shares (NYSEARCA:VNQ) has struggled badly. Over the past five years, the fund gained just 2.6% while the S&amp;P 500 surged 85%, a gap wide enough to make investors question whether real estate deserves a place in their portfolios. The culprit: the Federal Reserve’s aggressive rate hiking campaign beginning ... Vanguard’s Forgotten ETF Yields 3.5% and Could Pop in 2026 as the Fed Lowers Rates | VNQ	https://247wallst.com/investing/2025/12/19/vanguards-forgotten-etf-yields-3-5-and-could-pop-in-2026-as-the-fed-lowers-rates-vnq/?.tsrc=rss
2025-12-05	Google	0.0	SCHH: A Stable Yield - Seeking Alpha		https://news.google.com/rss/articles/CBMibEFVX3lxTFBud3YtWmsyTlZVTGZvOWJVR2JvRzIydXlpdWw3ejlwWDZvZ1NzUnFnUWVWSUlXc2R0MGtOOC1VWFRqWUt3ZllNZUUtaG1yVzdGMUJ5a0ZIaGFITHlPRzN5YmZfR1BITFFsbWpJTw?oc=5
2025-11-24	Google	0.283	3 REIT ETFs That Could Be Red Hot in 2026 - The Motley Fool		https://news.google.com/rss/articles/CBMiiwFBVV95cUxQUExoVS0xOW94OU5mUWhyYzBFcnlWSDExRW85S252MjE4bUZkSFJyRzVwZk9nX2Q4MUZnOE1mQ2pTaWFCbEg2YllabHVnQWJnNFItai1Zdnh0QU83dWs4MDJpWlhXSUJHemdDb1poTF9RNWVpaGhqWU5ncTl1TnZNSzA4V013OHRId2Rv?oc=5
2025-11-04	Google	1.0	The 7 Best REITs to Buy Before 2026 - DataDrivenInvestor		https://news.google.com/rss/articles/CBMijwFBVV95cUxPd0xtN1UyQ0RzelJFUUtxdGd2Tkd0YkNxbGNOX000YjE3SVk4LVZGVjVZQzZfZVZ2SGlnLUp5Z2lFSy16MjZqcXJWbDhTLVUyTUdiVXl5anMzZE4zTWlQZ3JhR1B0a2NZbmttX3c4d0JxajJ2Mk13ODRabThZQllzdkpud0gtYVBGNzIxQnhzSQ?oc=5
2025-09-26	Google	0.5	Schwab U.S. REIT ETF (SCHH) Top 25 Holdings - TIKR.com		https://news.google.com/rss/articles/CBMidEFVX3lxTFA1bGljMVk5LTVJLWUzSFZXb0JnNlA2dTRQN1N3VVA2Q2x6clhEeUNaYU1NSUQ5ZEFpY1E5ZXBmbENnbzVLTnYwOGdMUEpkZURhelN6cDhQN2RRTEx6MS1hb3N2R0dFbU1lWE8tYVhEV3pYUVBV?oc=5
2025-08-04	Google	0.1	These REITs Could Potentially Crush The Vanguard Real Estate ETF - Seeking Alpha		https://news.google.com/rss/articles/CBMiowFBVV95cUxQTzdHemwyZUVEcHdaMnhHTnE1cFB3UDFLNzV4SjBMNS0tOS14NmtmWkVBazl5Zy1wRGJZNGluWVFJVE83SkVNMHdsSW5hbFFneVJ3WHJQQjlJdUl1R1VpbE9yOHlxMTBpWnNraVRVX05aU1BsU3Bta0IyQ3FnV2Z2SkJ3eHdid1c5VktNMnNDV2gycnFkOGdlWS1yQmh3aXBLSFRN?oc=5
2025-06-27	Google	0.0	SCHD ETF: 3.9% Yield + Energy Surge Fuel Long-Term Upside - TradingNEWS		https://news.google.com/rss/articles/CBMirAFBVV95cUxPVjc2X1FvNTdXeXgxS05wVmV1X19oMVV0NkYxb2dPcGl5S1RJRlhjOC1OdWJMM1lLZkJkbElLTEhpaFFBbkNRX1p5ZUt3TU15ZW1KWllrTERtbzQwOEJUZlFpYV82MXhNVEtfY2ROaHNQSjZWbWhqWTkwZ1JienlPb1p1ZGhzWGhzdEU1NDFSNE1BVHBaRVNHMmdZbGthRmhOU2RWMG1wbjcta0t6?oc=5
2025-06-24	Google	0.0	SCHH Vs. SCHD: I Prefer SCHD For Its Lack Of REIT Exposure (NYSEARCA:SCHD) - Seeking Alpha		https://news.google.com/rss/articles/CBMingFBVV95cUxQanpwRGdZSlFUWTg2TjItb3RBbUFJMWk3dmpsWE5GVi1qUlYtaTZjdWJINUpITmNpQmdJS1ROaS1iVXlDQXhWNHdTcmNlLWhlSTFFV0lKUHRaelFvNlNLaFA3b3c4UEptZG9UZFNZVFdCTVZLNS1xT3VtX0RLZ05sdVBIRmh5TUZBX2pKekNCdXoxbVpLZnBIdlpxVlJqQQ?oc=5
2025-05-07	Google	0.7	SCHH: A Good Option For Investors Worried About Trade Woes (Rating Upgrade) - Seeking Alpha		https://news.google.com/rss/articles/CBMiswFBVV95cUxQQ2NxMkY2c1BUNXRWT0pRYUNVY3RMdlQydGpyeDh3NXJ0Q3o2eEp1M3l0WjUyOXZYd3R1WnZ2amkxTzItRUVudmxpdkttaXlPbTNsdjJYaE5jNzRlTDJGNEd0NGlKeGt0WjlOVEZ0TmwxWktubVNVZWMtd2I0SGFGZmR5TXNTT0c1U2RyMC1vcU82Ym5IcE14QjdyckFfN1A1TzVmQXdVNTFXNlpabXB1SU9fMA?oc=5
2025-03-25	Google	0.2	SCHH: Diversify Your Portfolio With A Real Estate ETF (NYSEARCA:SCHH) - Seeking Alpha		https://news.google.com/rss/articles/CBMimAFBVV95cUxQSDgxZEZySVpSSW5wdW4wQzRsUDVKaFVTTzdIYlF3WVhBZzNCc2Z4V2IwellVOENrRjhfM1NodFVpQ2FkNG5pU0IyeGRWU21QT2hPc2F2Nk9nQU1jeHBoWEdPREZwbTF1bXBKdjJJOVpYb3RLdmlJRVNzc0RBSFlBU1d1eVM2T1RUWXFWenZ4VjByVml1d2Z6aQ?oc=5
2025-03-12	Google	1.0	5 Best Schwab ETFs to Buy in 2025 - MSN		https://news.google.com/rss/articles/CBMikgFBVV95cUxQOUtGUWNxQUhpc1BSMm1jMlVPRUMxVE0yMzhqdXNGUEtoQVk5WGRuYUxoUmZHTWVwTmNqMnp5SGNDV1FkWi1TMEFJTERjUWk1NDJrSklqMnFDY21NYXdrUDM4elRIc084RjhNQ3VjN254Vm5yMl9rRjdTdm10a0lZVEpmdFhTYjNHck9ZT3ZRc2Y4QQ?oc=5
2025-03-03	Google	1.0	5 Best REIT ETFs To Buy For 2025: December Edition - Forbes		https://news.google.com/rss/articles/CBMigwFBVV95cUxNeVFPYmhZbW1JNWZuYmlfdjBpemdSdk5zdmUwbnN6RE9yN2NpWXpfMFRjWTV0d2JQbk1KWkk2THlmVTA4VVRaTWFHRjE0RWk0RVotTm1ybFI5aFlmNjdiTm5SLVhmYUtnNXFfbkRPZGpCY3RvZkk5QjRWZDFWV1duRGdSQQ?oc=5
