Date	Source	Sentiment	Headline	Summary	URL
2026-02-18	Yahoo	0.0	Why Is CoStar (CSGP) Stock Soaring Today	Shares of real estate data provider CoStar Group (NASDAQ:CSGP) jumped 6.7% in the afternoon session after the company unveiled a new artificial intelligence tool, Homes AI, for its Homes.com real estate platform.	https://finance.yahoo.com/news/why-costar-csgp-stock-soaring-205604958.html?.tsrc=rss
2026-02-18	Google	-0.125	Microsoft Stock In For Some Relief? Board Member Scoops Up $2M In MSFT After Sharp Slide - Stocktwits		https://news.google.com/rss/articles/CBMizAFBVV95cUxPREpRYU9oTjlhZzl3XzNUbmlWYzRQd0dqWDNTME51U2dtNlRWWkhaLWUxMmpGbi1hRzZmaUJnQjBzMHB6TkVXV3U4WlRPc3ltLS1XLUVIUlU4ZE5aNDVHVlBfeGV3bVVIX1phazVNckYwaXVnZl9TdlFnYnN6UkF5YzZoZlYtRmZNcVp4R0Z2eV9mRUxYTTBpcWZCNzB1NlROdGdDekdqTnBPVW1sYjhjak9McWtkUmV5eTIyUHBTS1NxWG14X1BITVNCWHc?oc=5
2026-02-17	Google	0.35	As Microsoft Bets on ‘True Self-Sufficiency,’ Should You Bet on MSFT Stock? - Barchart.com		https://news.google.com/rss/articles/CBMitAFBVV95cUxNTUw0RlY4TlZ5alNkb09jQnlIcjVnNldQendvOXAxSWRkenVCTlB6R0JwejV1SWZ0bUQ2ZFlIcy1yM1V3bmNlRVJtTl95Q0l1UjdFcHBfQXM1bkhCbGdPN0hKcWo0V282cF90VTZFVE03MTVKOHV0VmlRT0RLYU5ockJfRExPYmdzc3g4OWdXdGFWRk9yQ3VaZkJxS1VYNkRaZ3p3Qm5TLTNhNThmZmxTeXhHX0Y?oc=5
2026-02-17	Google	0.018	“AI Recommendation Poisoning”: Microsoft Stock (NASDAQ:MSFT) Sinks on New Threat - TipRanks		https://news.google.com/rss/articles/CBMipwFBVV95cUxPRTgtdHcxWF8zZjNaNXZhWWJrdHNFM1ZfdEQxSHNfUFpzelhMdFJZTDkzYlFJZkdpb1N5Y3ZSNHMzY0w0dmpnREZTQU9WcjF4MjNOMUNfMEFBTjE1aTI5VFJQN3lZZXloQ2t6RmZYX29Rb01Sc3lIcmJsZ3psTUszaWxNRjV4VUlDUmJFaEdMVTBqZ0ZYcnVIZVZlN0hqeHNOUFhxVzc0Yw?oc=5
2026-02-17	Google	0.0	MSFT Stock Today, February 17: AI ‘Scare Trade’ Hammers Software - Meyka		https://news.google.com/rss/articles/CBMikwFBVV95cUxOX3pHVThnUUpycXhiQVpSN1B0dGczTktwR3lFYzNRaFA3V2hfSHFJbm0zOE1wcEpXOHg0ZjI2M3owUXdvU01GdTV6TzJVSU4yNERsZ2xwWVNwckJ0amFndmZWZFNzZHU5dEV2ZUVxUnV0MmVjUmg2M3R3M25SLXNMbmFOMmNqZERuMXJTVW1uczlZZG8?oc=5
2026-02-17	Google	0.0	Melius Research Downgrades Microsoft Corporation (MSFT) Stock to Hold - Yahoo Finance		https://news.google.com/rss/articles/CBMimgFBVV95cUxQSXIwbk5OZ3RmbUZ2eEk3TExOTzlTWm1WVkJmYU4wdW03NVJ0SDV3TE55WXBucTRyQU9ETHBhZ2xrMmhLS0xqUUxIWlc5elZibkFxSEF3OTVMTHNXMEpZaFZ0a1JwYzlBemhHYll6QjZLUTlVLUlnUkdoYk0yaW54QnpuXzUxM1l4ZUhyM01xLUtHVzhnOWVVSFhR?oc=5
2026-02-17	Google	0.0	Microsoft: Cloud And AI-Driven Stability (NASDAQ:MSFT) - Seeking Alpha		https://news.google.com/rss/articles/CBMihwFBVV95cUxQZXhmQVZTeWV3S0ZCQmxhVTh6eTZZekNfTzJJUXVsZGxua2pOTUFqb19jTWdwbERIVHo3UllWLVltRmhTa0Jvb0VqQUw5c2NEZHVCMFZhWEdjNXp0MWF6c3dxd0dwUUtjZ1JWY196R2NCanZWeXIzWk1WRGV2bmpMcHRrY2VKZVE?oc=5
2026-02-17	Google	0.0	Microsoft’s Azure Reacceleration Could Shock Wall Street (NASDAQ:MSFT) - Seeking Alpha		https://news.google.com/rss/articles/CBMinAFBVV95cUxQbjlNLTFVVFkxLWQyQmF3Nk9FcDZoQTJqYzZoUVpOLW9iaHhHRzE3ZHJrRV8zT3FoRGpwQ1MtZXJWQks0Q1phNjU5Qm9kZlZVeEdDbWJLaE1jRXJWRVhyX1hqWTZiLWlJRDA4ejBmQUdHMm1jOGd4c1hsdEQ2Z1U5cWQwcmd5OUgyaHA2RVRvYWpmY0JjT0M4Q1Q3Rng?oc=5
2026-02-17	Google	0.0	SA analyst upgrades/downgrades: MSFT, ABNB, SNOW, ENB - Seeking Alpha		https://news.google.com/rss/articles/CBMikAFBVV95cUxNazJnajZiMnpMUnVlSkpMeXNlMmlVMVJtTUFKU1ZoZmJ1UjRhYTAtNU9tRmFfQkp5S0dhUlNwYkdoMU1tZWM5eHFxOFY1SnFxNnRXcHpQNVluSlhYM1pqVXRLVDVXUEhBcFhnN0dudGppYTZJRkhZSXRZMndSVEd0dFBGTkxuTFZzYVdzWktiSHk?oc=5
2026-02-17	Google	0.0	Should I Buy MSFT Stock in 2026? Expert Analysis & Price Target - Intellectia AI		https://news.google.com/rss/articles/CBMiZ0FVX3lxTE9IYUdNQzk0SmU1T0I0ZUFGQXdqbDZNSENnb0ZiTVRjYVhqeXEyMDU2T2VWTV9WOWlUbmJWNnpSOG1jTWQxdWpjUGRoODlFYlBaeFhjNXpaNklPc0ktZks1Q0xUQ2tkR2M?oc=5
2026-02-17	Yahoo	0.0	Why Is Nvidia Stock Underperforming in 2026?	Investors are worried about the sustainability of the AI boom and whether intensifying competition poses a threat.	https://www.fool.com/investing/2026/02/16/why-is-nvidia-stock-underperforming-in-2026/?.tsrc=rss
2026-02-17	Google	0.0	‘A Lose-Lose Situation,’ Says Analyst as Microsoft Stock (MSFT) Faces Downgrade - TipRanks		https://news.google.com/rss/articles/CBMipwFBVV95cUxQRFlJa2NkSDVOSVRRNkRIQkRjSURHX3Y4Y2lMZXZOMHBTVWhOaTNXNjJ2TTFRaHZja3hOVGVPVkhFMHZ2YmJ0VExBYmg0V3JYT29OM3gwazR0aFM3Qlhmanp4Z0FUeHB2aHJRb0E2SVF4TmZYNDVrMXJDN2xldEd3LVlWMllKSThSeDNiUGg0RTI5MTlicGFuVUtUVmpTcHlUcXBVbkZBaw?oc=5
2026-02-17	Google	-0.078	Microsoft Stock Slopes Down To Lowest Point in Months; Is The Stock A Buy Now? - Investor's Business Daily		https://news.google.com/rss/articles/CBMihgFBVV95cUxPZkFYY3pmQk1wcmVUa0Z5bjVEbWN4Y0xWTTRWNDVHZTNrZllxazZXU1l5RGFDQ0dIbEZqMVlTem9sWVhId3g2U1Fza1pqQTF0SDVlb1VjX1BkTUZhZ0VmSy1SSE9CdC12MmNUbC1VUGY4ODc0S3hoOGxIdkhNWkNwS294eHZSdw?oc=5
2026-02-17	Yahoo	-0.188	Microsoft Copilot Training Push Meets Weak Momentum And Valuation Upside Potential	Microsoft, ticker NasdaqGS:MSFT, is rolling out Copilot AI training across its Office applications to drive everyday workplace use. Company leaders are signaling that AI could automate most professional white collar tasks within the next 12 to 18 months. The push reflects an effort to move from simply offering AI tools to deeply embedding them into core productivity workflows. Microsoft enters this phase of Copilot expansion with its shares at $401.32 and a mixed recent return profile. The...	https://finance.yahoo.com/news/microsoft-copilot-training-push-meets-031206802.html?.tsrc=rss
2026-02-17	Yahoo	-0.194	Modi Seizes AI Summit to Assert India’s Global Ambitions After Tough Year	Two months into the new year, he’s secured major trade pacts with the European Union and the US, will host several foreign leaders in the coming weeks who want to clinch their own deals, is riding a wave of popular support following key state elections, and his top officials expect economic growth will beat the government’s own forecasts.  This week, Modi will have an opportunity to showcase not only India’s global ambitions but also his own resurgence when he takes the stage at a high profile artificial intelligence summit in New Delhi.  In attendance at the India AI Impact Summit will be more than a dozen heads of state, including from France and Brazil, and some of the most influential leaders in the tech world — from OpenAI’s Sam Altman to Sundar Pichai of Alphabet Inc. to Anthropic PBC’s Dario Amodei.	https://finance.yahoo.com/news/modi-seizes-ai-summit-assert-000000628.html?.tsrc=rss
2026-02-16	Google	0.25	Has The Recent Pullback In Microsoft (MSFT) Opened A Better Entry Point? - Yahoo Finance Singapore		https://news.google.com/rss/articles/CBMijwFBVV95cUxNbHp6cXRZWGhZVEdKSFRPME1JckhoMUhxVlVpQ2pEQXhTam9GcTE4SDFlTzAzazBVRlcwSWNHT0x3TVhPb2lWQ1VHaXBIdUpabXE3RHBxcDA5MFJWVW9SR29ncmZhZ1VXM0R0WG9Fazh0Q01ycHZhNHNjeXZoVjF0WmUyU1hoeklVX2tDNW16cw?oc=5
2026-02-16	Yahoo	0.136	New Horizons Embeds Microsoft Copilot Training Into Microsoft Office Courses to Accelerate Workplace AI Adoption	New Horizons, an Educate 360 brand, today announced it is embedding Microsoft Copilot training into all Microsoft Office courses across its portfolio, including Teams, Excel, Word, and PowerPoint. The update is designed to help organizations move from AI access to everyday adoption by teaching practical usage inside familiar workflows.	https://finance.yahoo.com/news/horizons-embeds-microsoft-copilot-training-210600133.html?.tsrc=rss
2026-02-16	Google	0.062	MSFT, GOOG and AMZN Forecast – Major Tech Stocks Looking to Recover After President’s Day - FXEmpire		https://news.google.com/rss/articles/CBMi0gFBVV95cUxPUWQzX19OcmtGX1dzem5zQkI0RFZ5SmV2cHRVbDRiVGttTHJES0NLSWZtcVZyVFZZdzc2cEMxeXFZdXhMQS1LUHRrNDAyeFJZVnQ1NWFMYWg5bUIwSnNUbEFRTWxEUnVtTEFZeV92ZnlncFZvQzhDdUVZQ2poUkN5Q1hxc3hyOHFGM0xUOHJnTDBkTThJMGZleTBid0dKcXpYQllQYWw5SmdpVW90Sk1CY0RHNUhnam1aNjZIWllxczJZVDdpNVFCckdWc256YzRlZFE?oc=5
2026-02-16	Yahoo	0.0	Analysts Set $348 Target for Google After February Dip	If you’re watching shares of Google (NASDAQ:GOOG), which dropped 5.3% over the past week, it won’t come as any surprise that it coincides with a shift in retail investor sentiment on Reddit. Despite the pullback, sentiment remains predominantly bullish, with 86% of discussions leaning positive across r/wallstreetbets and r/investing. The attention stems from Google’s Q4 ... Analysts Set $348 Target for Google After February Dip	https://247wallst.com/investing/2026/02/16/analysts-set-348-target-for-google-after-february-dip/?.tsrc=rss
2026-02-16	Yahoo	0.0	Clinical Communication & Collaboration Market by Platform, Component, Application, End User - Global Forecast to 2030 with Cisco Systems, Oracle, Baxter, Avaya, Spok Leading	The global clinical communication and collaboration market is set to reach $5.31 billion by 2030, growing at a CAGR of 13.02%. This growth is fueled by the increasing need for real-time communication, care coordination, and workflow efficiency in healthcare. A surge in mobile, cloud-based platform adoption and a shift to integrated, secure communication drives this expansion. Case studies from Stryker, Imprivata, and Ascom reveal notable improvements in staff responsiveness, patient admission ti	https://finance.yahoo.com/news/clinical-communication-collaboration-market-platform-154100292.html?.tsrc=rss
2026-02-16	Yahoo	0.0	Fifteen firms announce cross-border Trusted Tech Alliance initiative	The 15 firms will cooperate internationally to implement shared standards for secure and trustworthy digital technologies.	https://www.verdict.co.uk/trusted-tech-alliance-initiative/?.tsrc=rss
2026-02-16	Yahoo	0.0	Goldman Launches AI-Resilient Trade Basket	Pair trade targets sector divergence	https://finance.yahoo.com/news/goldman-launches-ai-resilient-trade-115225839.html?.tsrc=rss
2026-02-16	Yahoo	0.0	Innovia Consulting Announces Acquisition of 365Vertical and 365 Cannabis, Expanding Its Industry Focused Microsoft Business Applications Portfolio	Innovia Consulting, a leading Microsoft Dynamics 365 Business Central consultancy, today announced the acquisition of 365Vertical and 365 Cannabis, two specialized Microsoft partners known for delivering industry-tailored ERP and business management solutions. The acquisition strengthens Innovia's vertical market strategy and expands its ability to serve customers with deep, domain‑specific expertise.	https://finance.yahoo.com/news/innovia-consulting-announces-acquisition-365vertical-130000134.html?.tsrc=rss
2026-02-16	Yahoo	0.0	Investors Are Selling This AI Stock, but Is It Actually a Screaming Buy?	Microsoft hasn't done anything wrong, but its stock is tanking.	https://www.fool.com/investing/2026/02/16/investors-are-selling-this-ai-stock-but-is-it-a/?.tsrc=rss
2026-02-16	Yahoo	0.0	Marketplaces Are the Next Frontier in Publisher Deals With AI Companies	Microsoft, Amazon and others are planting flags in a new cottage industry as publishers look for additional revenue.	https://finance.yahoo.com/m/dee333a7-cf02-3fe1-8c6d-cadf52f626bd/marketplaces-are-the-next.html?.tsrc=rss
2026-02-16	Google	0.0	Microsoft Faces FTC Scrutiny As AI Alliances Shape Valuation Outlook - simplywall.st		https://news.google.com/rss/articles/CBMixwFBVV95cUxOVTkzcWt5VUhTNzVtaVB0Zzg2Z2hxQWZmejMwcmZVN3RjRm5acDY0UnRyN3dFSEh1ZUJyMml4TXh1Z2RsaFVpUV9wYnpEcjM5eTh1SjZ3bWVRSG03UFI1aWtYLWVHZ19fYnQ1ZFhNdG56Z3VIUWx3bmRraEN6S0lpU2ZpUUNQMXk0aXZ1QVVtcVdjek1Ba29iZVRTeEVkRVhRR0VOTVA0ZlFIbmtCSThrYmpTSmhVUjhHejd0dnZXWXJRX0dpQmNZ?oc=5
2026-02-16	Yahoo	0.0	Nebius Group’s AI Deals With Microsoft And Meta Shift Growth Profile	Nebius Group (NasdaqGS:NBIS) has signed multi billion dollar, multi year partnerships with Microsoft and Meta to support its AI data center operations. The company reports a sharp increase in annual recurring revenue alongside its first period of positive EBITDA. These developments highlight Nebius as a growing provider of AI infrastructure to large global technology platforms. Nebius Group now sits in the spotlight as a pure play on AI infrastructure, backed by marquee customers and recent...	https://finance.yahoo.com/news/nebius-group-ai-deals-microsoft-191126696.html?.tsrc=rss
2026-02-16	Yahoo	0.0	Nebius Stock Up Post Q4 Earnings: Buy, Stay Invested or Offload?	NBIS stock jumps after Q4 as AI cloud revenue soars 830%, EBITDA turns positive and capacity plans target $7-$9B run-rate by 2026.	https://finance.yahoo.com/news/nebius-stock-post-q4-earnings-153800187.html?.tsrc=rss
2026-02-16	Yahoo	0.0	ServiceNow Inc (NOW) Draws Analyst Attention Amid AI Shift	ServiceNow Inc (NYSE:NOW) is one of the best NYSE stocks to buy for the long term. On February 11, ServiceNow, Inc. (NYSE:NOW) announced the appointment of Danielle Fontaine as chief accounting officer and corporate controller, effective February 17. The update was shared in a press release following a filing with the Securities and Exchange Commission. […]	https://finance.yahoo.com/news/servicenow-inc-now-draws-analyst-150527006.html?.tsrc=rss
2026-02-16	Yahoo	0.0	Software Multiples Sink Despite Growth	RBC sees floor forming near 19x	https://finance.yahoo.com/news/software-multiples-sink-despite-growth-115910766.html?.tsrc=rss
2026-02-16	Yahoo	-0.033	Big Tech Will Spend $700 Billion on Artificial Intelligence in 2026. Here's My Top Stock to Buy to Take Advantage.	Expectations are already high for this AI stock, but big tech could provide an even bigger tailwind.	https://www.fool.com/investing/2026/02/16/big-tech-will-spend-700-billion-on-ai-top-stock/?.tsrc=rss
2026-02-16	Yahoo	-0.1	Alphabet and Anthropic CEOs Expected to Attend AI Summit. Why Nvidia’s Huang Isn’t.	Top tech executives will gather in New Delhi, India, for an AI Impact Summit that starts Monday.  The event follows previous government-led summits in the U.K., South Korea and France focused on artificial intelligence.  The week-long event, from Feb. 16-20, is aimed at moving “beyond aspirational frameworks towards concrete, measurable impact[s] that address both AI’s promise and its perils”, the summit’s website said.	https://finance.yahoo.com/m/925f67c0-b295-3bff-ba00-81eb1b48db8c/alphabet-and-anthropic-ceos.html?.tsrc=rss
2026-02-16	Yahoo	-0.2	Oracle Surges 12% While Apple, Amazon Tumble in Choppy Tech Week	Tech stocks delivered a choppy week, with the sector’s biggest names diverging sharply as AI spending debates intensified and bear market territory claimed two Magnificent Seven members. Incredibly, every single Magnificent 7 stock is now down year-to-date after NVIDIA (NASDAQ: NVDA) shares slipped 2.23% on Friday. Let’s dive into the biggest storylines in technology this week. While many stocks ... Oracle Surges 12% While Apple, Amazon Tumble in Choppy Tech Week	https://247wallst.com/investing/2026/02/16/oracle-surges-12-while-apple-amazon-tumble-in-choppy-tech-week/?.tsrc=rss
2026-02-16	Yahoo	-0.8	Microsoft's Quality Rank Surges As AI Spend Efficiency Calms Investor Nerves	Microsoft Corp. (NASDAQ:MSFT) has seen its fundamental strength reach elite levels, with its quality score on the Benzinga Edge rankings jumping from 79.51 to 90.08 week-on-week. Operational Excellence In An AI Arms Race This move into the top 10% of stocks for operational efficiency comes as the company demonstrates superior free cash flow (FCF) resilience compared to its “Big 5” hyperscaler peers, even as technical indicators show persistent short- and long-term price trend challenges. Improve	https://finance.yahoo.com/news/microsofts-quality-rank-surges-ai-203119515.html?.tsrc=rss
2026-02-16	Google	-1.0	‘Worst Selloff in 25 Years,’ Says Dan Ives: Software Stocks NOW, CRM, MSFT in Focus - TipRanks		https://news.google.com/rss/articles/CBMiqwFBVV95cUxNck92dTNSdWdBVWg4RkU2MHppNmdaSnRhZEFtNjNSYS00R2NFRWRDRW00ZHR2dzk0ZVdZZEFBTW5XQWdaanNxX1hJNXV2dmhkdWR1X0tZRGpvTWFGeEtGUno3eVdfWTdadWo5LUtKeXJrQzR0VUUzblN3VldOUmRvZTU4bGQwQzUwSFliSlk2a3pBRnBVZkZfbzBWMHRzV3RtdVVBMURMMU03bGM?oc=5
2026-02-15	Google	0.6	Should You Buy the Dip in Microsoft Stock? - The Motley Fool		https://news.google.com/rss/articles/CBMijAFBVV95cUxOeUtsd3NfNE5CYklBLXBmVzRQTnV2R0NlRVE4SjJXMzlaVzZKSVI1amVPSWNhaU9aTXd1cFhNT1RLeWlTcDRjRWJmMnhRN21BaFpGTnF1Z1JCNklGZ1VmR3VfTEdiWXRNLUFFUk0tVGVrWTVGZUE0M21LdjJwdkd5eGROQmw1UjlVa2s3bg?oc=5
2026-02-15	Google	0.5	Is Microsoft Corporation (MSFT) Chase Coleman III’s Top Pick? - Yahoo Finance		https://news.google.com/rss/articles/CBMijwFBVV95cUxQWDh4UEJJd2QtSnY3NmtjSzhCLU5uRk5uWUVoYjY0ZkhMN1NkdXk5cXRoQ0hidnpYRUhuZTNXZGtySkFfYmR6dUVhOW1VUl9iU01hakFqeVU0MVhJblBqWl91dFVDazBFbjY1QXNtMWlWRzFjRjdmRnlSVklrTkZLelE1Z3MzbVZvdnFfQzYwUQ?oc=5
2026-02-15	Google	0.175	Why Microsoft's Relatively Small Number of Paying Copilot Customers Could Be a Blessing in Disguise - The Motley Fool		https://news.google.com/rss/articles/CBMilgFBVV95cUxQZE9hNHVxTnBLdlBXNnkzTDVka1gxbHUzWkFFdGxTNDFjNlE3Y2RrSjNUY2JVS0c3bW80Um95eXVxNXFSZm42d2JhY1VBSGNiWkVXbXN6RG5Wb000Q0pKLUMtMW9lWm11dXFoNXlOaGwzQjU1RVJmd0xRQjByblhCUV9sLU9jUzNXNTNLdW5GS21lRDA5QVE?oc=5
2026-02-15	Google	0.0	FTC Scrutiny And AI Push Reframe Microsoft’s Cloud And Valuation Story - simplywall.st		https://news.google.com/rss/articles/CBMixwFBVV95cUxNcktqNXFMVGp2N3ZIeGZzV255aDBuVEtmUmEyNm10eFJTZFB6dEh4NzIxVmZtYl9mLXBHUEhydUtad0JmMEU2QjNlOGE5NWJuVG1PTzM1UlpoSjFHaGFPaTYzX2pUUDRBNWI0cElCMDZtWlUxNWQ4enpGV3ZEZ25YY1ZBTTBXOHhSbE5idGVlSkZhTnRJV3NtNERRY0VvTU5ZeXc2LVFzQVFqdEtCbnl6VHVqNXJOQVVERkdxU3ZyWndaYnpZYzhB?oc=5
2026-02-15	Google	0.0	Microsoft's Lack Of Leadership In AI, Wait - Seeking Alpha		https://news.google.com/rss/articles/CBMiiAFBVV95cUxPMGVaSzV6WGpYR1JzbDRiejBMMUEtNC0zNWJ6T3R1TVo2cDBkSFRuaWU4R01VUXBURWkwY2tQVTFxY28xMkpEcVQtLTBsRG5Rb2ttODVEU0lGWHlvdHU5alRRZ2owVmNXNUNXSXpIal95MGgyU3hVejF4U0xXSW5EX3pMMXZKZFo3?oc=5
2026-02-15	Google	0.0	Why you need to buy Microsoft stock before March 1 - Finbold		https://news.google.com/rss/articles/CBMie0FVX3lxTE9JeHhzNjlpM3dLSTVoekRScHc0U3pmRElIUzRQQ1NvODFvV2JGTmNCMnZjZUFqY2NzYVVSYWF0TV83RmpCUGVBbERpS1dYMXZsUGZ4Z2tpSkNpT192ejV0SlFHUW1VSlp6V3pYaEVpa19aLUM0dDJ6UEJsMA?oc=5
2026-02-15	Google	-0.2	Boston Common Asset Management LLC Sells 3,318 Shares of Microsoft Corporation $MSFT - MarketBeat		https://news.google.com/rss/articles/CBMi2wFBVV95cUxPbVplY0V3c3ZSUEZjY0VwZnZKN2NCcmF3dXIxbURRVjNnUHJhbWNQTTFCUU5TX1VSY1l0a0UzazY3SXNnU1BrQ3lsS203LVdxY3dxR29RNmVvcDROVU1PdUJvUUlEUFFtRjRJaElodTdxdzZIcEg3TjNFLVBDUWhzZmd6T3ZZRjIxUld2Z1Y2MWNfelg5Y0J6S3UxUC1wU1lnbTVtQW90TDRlMnZIeWpPdUVzQ0VtUnpFOEUtMWY0X2pUQnk0eVlqNmx3eTRNN0h6YmNUV0xndVdyZVk?oc=5
2026-02-14	Google	1.0	Amazon and Microsoft Enter Bear Markets: What’s Breaking the Magnificent 7? - 24/7 Wall St.		https://news.google.com/rss/articles/CBMitwFBVV95cUxNTjByU1VKTDlCYmZ2SFdvUFVFRUQteUgtOTdqNG8yYmJzQkxTMVN0eElJaE5WN0ZBU2Y2ci1YZHlNY3V4bEpVZlc3YzlXQWNFUTVkTDliejhRME1xQkFVSzVUTzZhcDJLdktlSW00SktTNW5ySkhDbHRKbzI2aEJzNUpkU3phYk56RzJpVlR5VEFtMm9pbmxISUk4bTd4VGFyNG5sOGpDcGF4enpwd29YenJ0VUY4Ujg?oc=5
2026-02-14	Google	0.222	Down 22% in 6 Months, Is Microsoft Stock a Buy? - The Motley Fool		https://news.google.com/rss/articles/CBMikAFBVV95cUxNa2l2RXh4azdvVVRlREVra003Zm85ZEI1eG1SX080MDE4ekpScEZQdHA0bTdZeUFOTUZQLXBDRWpVU2NFcWxyalYtRDJhcExhZy14UGNRMXJldmJ0QmNnVHBHZHhVY05vVHJCM3ZDTTNFTkJtaVJJX1FBczU0Z0NMWXA0WXZYTThhanBNVXd0MTY?oc=5
2026-02-14	Google	0.0	MSFT Stock Quote Price and Forecast - CNN		https://news.google.com/rss/articles/CBMiUEFVX3lxTFBQX3dUSG5UYjhqVm1nRmNzS2pFY0VvMjFRVlQ0WWk0RzFlM2NQZ1lnR2M0b1JKOUlFRU1KZTllYnJfODBUd0RKQ0FzT2o2SmFJ?oc=5
2026-02-13	Google	0.5	Microsoft: I Like This Price And I Like This Strategy More Than The Stock (NASDAQ:MSFT) - Seeking Alpha		https://news.google.com/rss/articles/CBMiswFBVV95cUxPTHRtTEhlcHZhZlpQaGJTWDNacUxsSWpfZzNubUFnMVRBQ2o5a21LN2lBNTVTM05DOXd5c0NGV1c2ZUhhTzhtZlNaeGQyU2t3VWxHTERldUh0a3pGZ0l5NlB1eTczQnlTMEh4aTNJMzBVQ0E2UWkyc1c1dEdkY0NINXJJN2NPOGNTNW1oT2NpNC1mLWtzVzA5MjJOdVNlMm5xU2g0X1Y3Wmw0NVpUWkxEanl1aw?oc=5
2026-02-13	Google	0.068	Two Years to Unemployment: Microsoft Stock (NASDAQ:MSFT) Notches Up With New Projection of AI in White Collar Work - TipRanks		https://news.google.com/rss/articles/CBMi1wFBVV95cUxQX0h4eXBuMmtyZmtLUFRyLXpEdXFUTk5BYjZKVlNCWk5lX1A5VGFFeXJSNWotdzduTDdGbkhoT3dQSHJ6RzFGWnEyUERpUjcwUHUxOHhWcEdNRGF5Ykx6YmNBUTZWWDMyRGFfanhJUWJjV3lmeF9IelQ4RFJiWGNTNEJJYXFGUmhvVXlUekZJU282OGh5czlZZFNjX1pPbEdLWlNqLTcxSWdFYllzUFdueWR0YmZmQTB5SHRnRzlEMTAtZndXakJYdUUxTkpTQWs1UGhha19pOA?oc=5
2026-02-13	Google	0.0	MSFT - Microsoft Corporation Stock Price and Quote - Finviz		https://news.google.com/rss/articles/CBMiTEFVX3lxTFB0V1VkaHZrMllybS1TTC0zTktMZUVvZEhJVDNudVF1aG93NmMzTTZHYlFGbDUtWFRXN1hUM295cDh5OFJ5UUlqdGhYTng?oc=5
2026-02-13	Google	0.0	Microsoft Is Spending, Investors Are Losing (NASDAQ:MSFT) - Seeking Alpha		https://news.google.com/rss/articles/CBMiiwFBVV95cUxOeEhDTWF6UmZOUXlHSDBFSVFtTDhjbHdSTlZRdU9oWkk1X3VCTTlIbzNpZG8yeEEwTXhUanJ1WmNzNXRzMEpPanpFZDFKSXdSZndiMjhZSFBnWXVOUDJwck9nSEVzSVY1TzZuQTE2OHpTS2xNQ19uWkVoUWZZNjVoemVndGtza2JOT3pj?oc=5
2026-02-13	Google	0.0	OpenAI's $588B Problem Just Made Microsoft Irresistible (NASDAQ:MSFT) - Seeking Alpha		https://news.google.com/rss/articles/CBMiqAFBVV95cUxPR3lrLWxvdW45VGxEOUNyR2R2VFF0UERLakVrY3B4d1Z4UHREM1FkMHoyS2NfX0hIWGp3Yy1TWDJmN3Y4NDVPVzJDVmFBY3cybWxUQTZsT1ZpUGp0Mks2SklYNVNMQjdCN0hRcDFBM2VUVUQ2YkNHRDlnakZNaVUxTFhTeGpyQnR3aTllT09ROWtjM3prTEs1WDlZVmx1S3BLT0liZXp6Y0o?oc=5
2026-02-12	Google	0.0	Street Reassesses Microsoft (MSFT) Amid Azure Growth and Capex Concerns - Yahoo Finance		https://news.google.com/rss/articles/CBMiiwFBVV95cUxNY1pDZHpOQjBtVWJrZXVXMUROVUtLaFVNZnBiUXhvT1lKdnBCeHdrenRkU19kd0VYSlpxSjVQMjAyNTFpeU83WWtGUUlOM3k5UUVFOHhucElmV2FROThVWDVldkVXM1NTRXRDNFE4bWpScUs5c2xjdmJHcG8wS3JWWklTSEYzYUk5Tnlv?oc=5
2026-02-11	Google	-0.2	Microsoft Corporation (MSFT) Forecasts 37%–38% Azure Growth as Investors Question Heavy Outlays - Yahoo Finance		https://news.google.com/rss/articles/CBMijgFBVV95cUxNVkc3VlhPUUp6bkVGbVhCcHpqMVljd2lKd0VEcEh3SEU1X2toLWcxaXpMZVl5Q3ZodEwxVG92bDhiX1NHSHJjMHI5R3pGZFJwdU44cEtqbDRkSXRXUHZ4eGRfMVJnd1pjLTdvb1NDZTN0XzU5QW53bWJJTWpJZldRZVRBcFJEZ2RBSVhZMXNB?oc=5
2026-02-10	Google	0.333	Jim Cramer on Microsoft (MSFT): “I Think They Need to Explain Their Story Better” - Yahoo Finance		https://news.google.com/rss/articles/CBMigwFBVV95cUxOVEFmRkRQUjNJSjh6T3NmRC1XUlEydzBoTU9hR3Y0bVJTa1VFLWVpYVBsZDcyV1VnUExqeU9wdEFEMng3Q3VrV3pES2xNVlVDM19rT2ZiRW51cndnUFJLLThSMGxIUWZvSkNiSEhheHZkVWNYQzMydlF5QXVnTHBMZm9xSQ?oc=5
2026-02-10	Google	0.0	Microsoft | MSFT Stock Price, Company Overview & News - Forbes		https://news.google.com/rss/articles/CBMiVkFVX3lxTE9MT2g0RzdRaGRDUHFQc1ZnOGVxdmN0VEVKUFpzOHFCU0dIWjJwWEdWVHl5bWV2TFlQblZyM3ZpZDJKZ2VXSnk1NHF2TXBnbUJCb1JlUWpn?oc=5
2026-02-09	Google	0.0	Microsoft (MSFT) Stock Trades Up, Here Is Why - Yahoo Finance		https://news.google.com/rss/articles/CBMigwFBVV95cUxPd0NHVXdDczUxeWMyUGhnVjFVZlNYbm04VmduQUY1MzJFOHdTT3QycTlDYktIWDN4Y0FVWVVKaFloS0pSTVYzWkE2YUQtSXFJWm9pSnR2VlE4M1JzM0VYUmJ5aFl4anpXU0lqTE12b2p2MUtyNjdLV0poZ1Zqc2UySlhOSQ?oc=5
2026-02-05	Google	0.0	Microsoft: It Is Just A Dip, Not A Bargain (NASDAQ:MSFT) - Seeking Alpha		https://news.google.com/rss/articles/CBMiiAFBVV95cUxOOS1KdkNIdFBUekdLbU83TWVTdjV2WW5HTkFKMklMZEVXbHZVQUV2eWo3RVFEelMtcHVaS0xlbDZJQ3VucnNTclFrM3c5NUxKcHVSYXFrbXBoalI0SE05c0FqMGxvYXc1T18wa24yZlhDSTN4WnZtbE1ET2tMM25CQXJVUmNRZjJW?oc=5
2026-02-05	Google	0.0	What's Going On With Microsoft Stock? - Benzinga		https://news.google.com/rss/articles/CBMinwFBVV95cUxOallZLXNiQXVFYjNTVUNyNEJVZzBYVEg3Sk1vWWMtc1FtZTR6VzI3eURDU1U2djltUy1zTUk4WDNWc3ZNSFcybnFMdHhmNl9Yd0ZmX3lHSFpjdVB5ZUhNZE4tVng1al9YZnh1UTNfazhnNzNsWDBEX002VUduTi04TlhsVnpFREttSm5vRlJUd1lEWlloaXVnamxScXJjZ0E?oc=5
2026-02-04	Google	0.289	Microsoft (MSFT) Maintains Strong AI Positioning Amid Hyperscaler Focus - Yahoo Finance		https://news.google.com/rss/articles/CBMihwFBVV95cUxQcEg2X05hQ0JlcWNyeG9samFnZjVUUk9tSXFtdEV1d2JUakY2VjA2OGllbnR0aHZDZ0kxTHZDTkhVdzJsWUxRY1NkcldqWTFKdEcyY21RYjQ2OGxjbkZMcU5weDNhU285V1ZsTzZoM3k3cnh3aFo0WlBNTDE5SWg3S1ZLUzBMUk0?oc=5
2026-02-04	Google	0.139	Microsoft (MSFT) Is Down 14.4% After AI Capex Surges Despite Strong Q2 Results And Backlog Growth – Has The Bull Case Changed? - Yahoo Finance		https://news.google.com/rss/articles/CBMiekFVX3lxTE1vOU1SS1cwQXZDRVFVYlk4WHFseDhpbzROdndWUjFPUzRrNGlid0NjMzNSYlZtUlJ6NFp4LVBmQVZDdS00b0RSa3JfY3J6dHZNNmJrT2hVYjJ5UzdfSXRfSmlrOVU1ZEh0VU1pMUdoT2RaWXc1RHk0RUN3?oc=5
2026-02-03	Google	0.443	625 Billion Reasons to Buy the Dip in Microsoft Stock Right Now - The Motley Fool		https://news.google.com/rss/articles/CBMimAFBVV95cUxNWEhJMkFPV2JLeDVDRWFTNFg4dlo1WXRGV2V5YldZVlpaNjdHOGRVbUtKZUpXeTZ2OHNTZFRCSXRVUEhuQk5VRDRZMjJPeDZ0TWpsR2dCdkdjN0syY1RDYVMzOHB4TkZ1YUxEQVZ4djYtV204V3NsdTN1NDRpQkI0UzNrakRpNlFoaTRMOUNBdjRMeV9rMG14MA?oc=5
2026-02-03	Google	0.3	Investors Are Selling, but Is This AI Stock Actually a Screaming Buy? - The Motley Fool		https://news.google.com/rss/articles/CBMimAFBVV95cUxPcnVxTURyelFaOVdjYlFtdm5GSkdEUC1ub2FRSkQ1N1hfOW94UXAxa0NJTVN0T1I5UjFMTE5HUWwtZTExTTZLN01oejhJQ1dsT29qSHRoQmhwODlKUzlMcDEyVFlhaG1PYkVaeUozZTl5YXRSZnVFZWo0V1BqRllveTFRX0s3U3JZcTBEN01QS0dJUDFNeXA4aA?oc=5
2026-02-03	Google	0.0	3 Reasons MSFT Has Explosive Upside Potential - Yahoo Finance		https://news.google.com/rss/articles/CBMigwFBVV95cUxOSFg1SWlGTzhSTXVxVU5FMzNKcVQ2c1F1SXkxZ3gyME1YZ05tLUFwYU8wUFptY0d6NW8wWmFkQ0xyRUhPc2d2V1F2QmpBcGptMS1GNThCX2hyR0lFOEpBeG1BRlVpTXA4RFhsNkJfenAxMXVOLVIwRkJiYU0yLWxvMEQ2dw?oc=5
2026-02-03	Google	0.0	Analysts Cut Microsoft (MSFT) Price Targets - Yahoo Finance		https://news.google.com/rss/articles/CBMihgFBVV95cUxPM2pBcTNuend0aUFWcmVOMFZiOC1NempPTWNXZlppOVJCRjByNkVCUFBKTmNxSW1mY3JoeUIzTFFBUmstUm00aV8tVXhOYkZKV3lFd014NVYwRXJBMGhWeDZhWG5XcGdzRTlNbXZqaWpSaEFFZG5XaTRZaFVBc2g5bkRYYkktdw?oc=5
2026-02-03	Google	0.0	Final Trade: JKHY, MSFT, SMH, QTWO - CNBC		https://news.google.com/rss/articles/CBMifkFVX3lxTE1GU2ZtNEx4bUVpYXo5X2phaDFBeU5RRjJsNXdtclEwUUk2ajhQaE0xVXNLd09jZmpGSWVDaGxjMW1rWE8wcDRHQ2EzOVVhUGRVVllnYU5VRG5vQkFFN1NtWEdRVmQtWWo3RUJ3SWZiV3kzS2ZxYUtieXplYi12dw?oc=5
