Date	Source	Sentiment	Headline	Summary	URL
2026-02-20	Google	0.0	Microsoft in focus as Citi reiterates Buy on Copilot momentum, Azure strength (MSFT:NASDAQ) - Seeking Alpha		https://news.google.com/rss/articles/CBMitAFBVV95cUxQMHlrYnc4MXJvZEhFbGdQWGdBbU1ybUNXTXIyZGRXQldnakQ5dUs5WlVkWXFlT3hhTm80bkxJY25INV9aNzJMZlNFWlBYMXJmcUsteENTS2ZLa1dqZnR5X0RhWUJ0cUtUVjRPVm5PemxJaGk0VzRNN2h2aEJCa0FicWZmb0lTVEpxM2lwX3lJU3k0YTk3YjNrdU5aZnBrZklHSmhVcW5OU0NTdEZacGZnQ2tJcTY?oc=5
2026-02-20	Google	0.0	Microsoft's Plunge Is A Gift (NASDAQ:MSFT) - Seeking Alpha		https://news.google.com/rss/articles/CBMickFVX3lxTE8tcnJEa0JkTnR4V3oxeklqTGFaenR6STl4UTNnWF8wd2FuU3NjcG1VbXBKZmhtOFJaZVc4QXZRci04bUlTenVORlkzQUFOeWhuSVdobGs0X040OVRFNEx1bHpyLVNZZ0FaSDE5MDlxSnNkQQ?oc=5
2026-02-20	Google	0.0	Microsoft: Why I Set A $370 Buy Order (NASDAQ:MSFT) - Seeking Alpha		https://news.google.com/rss/articles/CBMiggFBVV95cUxNdjhUZDNJcWQ0VWJuVGFtTW9mYlY1RnJNYlJRYjJUOXZYVGxBc2VXNnNJeXV4Y3h6MjRqWUNYWFhmRGxqdE9VNDNMaUZ5TXNJN0dVb0ZBeGdyRl9laEVEdGYyMU1SZFItZjV4UTEtR28tVExZbTFGbDJMYURuNWY2Q2JB?oc=5
2026-02-20	Yahoo	0.0	Microsoft’s Head of Gaming to Retire After 38 Years at Company	Phil Spencer oversaw the acquisitions of Minecraft and Activision Blizzard, but has struggled to keep Xbox competitive with rivals.	https://finance.yahoo.com/m/1bbf2d7a-1abc-355c-a75d-dbc65ed14f48/microsoft%E2%80%99s-head-of-gaming-to.html?.tsrc=rss
2026-02-20	Google	0.0	Tiger Global Management trims Microsoft stake by 1.07M shares - The Globe and Mail		https://news.google.com/rss/articles/CBMi3AFBVV95cUxOVld1bjBHYktQdXJwcHl4Tjl1MUpzSTNVQWVpYTE4NFExeXNsZWZ5QllzT0dPX19XMUFBV1BHMEZUcjluelVjOVJCb1hJSlJ2Ui1SQjVhUTEzVmVKeW1Wc0VURGVLUDVvMVRZUG1sUEhBWnNNX3ZMdG00djZ5VjJUTnRVS25ITS1yaUlFekQyMHBMRjJLTmx0ZURlc3RzaGhzVjNORjlZVXVmQ1AzQUQyZmQ0Vm16ZjVjZFBqekh4enduNTJjM2poZElxWkRRVVY1dzN4a2ZBUVZGRzZD?oc=5
2026-02-20	Google	0.0	Why Microsoft Stock (MSFT) Volatility Doesn’t Scare the Options Market - TipRanks		https://news.google.com/rss/articles/CBMingFBVV95cUxNUVdIeldmTXdYWDJnTGZEdW14akJkV0VWZ1d2ZkIzQVQzaU9SdmhfcmxGekJFVlVTcnRYVlh6ZEViTTFpNFIyZ0J2TktyNjJkTmxoN0JSTkJsVjhUMlhtQ3p2VmpIMGtKYW45VDJvNDcyNDV3ZU42MVRoT254MS11ZUtLeURLdmo1Tnc1dmszTFV4TVNybnoxSVh1MFdGdw?oc=5
2026-02-20	Google	-0.05	Microsoft (MSFT) Surpassed Q2 EPS Estimates as Cloud and AI Demand Accelerates - Insider Monkey		https://news.google.com/rss/articles/CBMivAFBVV95cUxQdzc4RndTQllGbnFDbXRBcWlidU40UHd5aUdVNjBkRmZ2TW1qS3pITVU0a0JuTUl4ZUxNVmg3anVEenk3Y2Y5ZUpnZ0ZzMmhjMmFGNy12VGRqU3ZfODJieVhXMVJYZlM1QnMtcHhTYXloX0lqUUhfaVBobjJ4bmFCUm1WUUx3Mm41ZFl0YktWeGNOcDIyREktZmZGY28zVkowSHgtUmdIQ3dUd29KeDUwcTRWQzdpWDJfZHdDMtIBxAFBVV95cUxOUXJ0MDNJWWVwcHpqZnozTGRHYWtYYVRzMVFOU29yUTQzU3RtT0lqZFZ2WnVvOXhWWG1ydlcwOFdCeXdxUHc5aUhKNFlQTlFGSXg1cTJ0al9fSXNCVnhCc3JWYUY5Z2gzZ2ZaWmVHQmktamItX3JySXliWjlmTmxBMU54Vm9WNDloeVE2WUsxc01MMVRTTzlfcmJVZjZmMmVRN1VuWVBGcDh0TDlZM3I3TU5UalhkQVM3bW9YRkt5NjhzYzV2?oc=5
2026-02-20	Google	-0.05	Stifel Flags Microsoft Corporation (MSFT) Azure Supply Constraints as Near-Term Growth Headwind - Insider Monkey		https://news.google.com/rss/articles/CBMi0wFBVV95cUxQZXpyY2x5VDlhZHFQY2JKc3FoaUVqSHlKUjJiVlBKT1NvUTRWQm1iUDJtVGR0Zm1KcGo5cGJsMXcyQlh4cWhTRmdIbjZzR1dTZU0zTmgwS2xaY2FHa1RlbXVPVHNuUDY4dkRNbHprYWZ5eDgybkdnWkpiRmRYTi1odkhqRnFmNXEzMHFRNG9kVXJsNVRPeldVRzhyb3JEV2l3MkhWazB2MzZJdGF1R1prNkV2U0h5Y2V5TkRGdmItZEp0MUd1ZFNIcmgwb1V1a09HeGRB0gHbAUFVX3lxTE1QT0NHN0V1anpKMGZKZndGQXdZMTRfdnBGY1lBd0dLSzRFSVplMi1YdDcwMHRuam9taVlDSHJiakVTc2F2aTRJUkVsOUpDclV6Zm03M3lKS3ZVNXJtdlNkeUY2aUVPNEtCbUdpV19IRHBvckhkS095aGZvdUNpRmpJd3NRUkdVYXlBZDNwWTYxbWFTSkNrQ2dQWFNjMWtCbWplNTdNQ0J5Uldkc1RSTVFQbF9wMXJpcFZFRTdMc1hYck5hck0teFRGOFVBa3QxRHJabTA1VUZtMFEtcw?oc=5
2026-02-20	Yahoo	-0.1	Xbox boss Phil Spencer retires as Microsoft shakes up gaming unit	Microsoft on Friday put out word that Xbox stalwart Phil Spencer is retiring, in a shakeup of leadership at the tech titan's video game unit.Spencer headed the Xbox unit for 12 of his 38 years at Microsoft, nearly tripling the size of the business as video games evolved from packaged software for consoles to subscription services and digital downloads on an array of devices.	https://finance.yahoo.com/news/xbox-boss-phil-spencer-retires-234434079.html?.tsrc=rss
2026-02-20	Yahoo	-0.121	Trump adviser drops bombshell on Meta, Microsoft	AI’s boom just got a new storyline. And this time it isn’t about chips. The newest issue concerns electricity bills, grid reliability, and water. Confused? You shouldn't be. Politicians in Washington are facing the heat to prove to consumers they won’t “pick up the tab” for hyperscale data center ...	https://www.thestreet.com/economy/trump-adviser-drops-bombshell-on-meta-microsoft?.tsrc=rss
2026-02-20	Yahoo	-0.139	Stock Market Today, Feb. 20: CoreWeave Falls After Blue Owl Data Center Financing Failure Raises Funding Concerns	Today, Feb. 20, 2026, funding setbacks put CoreWeave's AI build-out strategy under the microscope.	https://www.fool.com/coverage/stock-market-today/2026/02/20/stock-market-today-feb-20-coreweave-falls-after-blue-owl-data-center-financing-failure-raises-funding-concerns/?.tsrc=rss
2026-02-20	Yahoo	-0.167	Microsoft Gaming head Phil Spencer retires, insider Asha Sharma takes over	Microsoft said on Friday gaming head Phil Spencer is retiring after 38 years at the software maker, in a ‌major leadership shake-up.  The company named insider Asha Sharma as the executive vice president ‌and CEO of the gaming division.  In her previous role, Sharma led product development for AI models ​and services at Microsoft.	https://finance.yahoo.com/news/microsoft-gaming-head-phil-spencer-223102827.html?.tsrc=rss
2026-02-19	Google	0.5	Quant ratings on Coatue Management's top holdings: TSM, MSFT, META, AMZN (TSM:NYSE) - Seeking Alpha		https://news.google.com/rss/articles/CBMiqAFBVV95cUxNVmFmclR4U0RNNS1YT0ZweFhsYkpCQms5Wm1xN0NSVG0tcHhrVk5hVEdHYkxPN0VmNGlNMFRQVUFlaXB1NFNPdTl2Nk9DMGFZWUpiTzI3dW9mbW9lekUxR2xVcjRZTkgzX0U1b05MUGg4MGxEQ1lNbDFSVTlfM2J6c1RVU0dLa05KZ1poRE9NdzRodmMxVW5FcWpJemNFZzZrTVNkT0JQZWM?oc=5
2026-02-19	Google	0.333	Is Microsoft Corporation (MSFT) The Most Profitable Software Stock to Buy Now? - Yahoo Finance		https://news.google.com/rss/articles/CBMikgFBVV95cUxNVUhkS1hBWnJ5NS1TdzFjTHNsUXUwV3lNYkZOcTZWdEluaGV0aHhOZmVteU9RLWtPTUZlZktsVEpQeGhWMFJyTnJNZmcyVkc5eWRUYU9ZQ3J1Tk1qdEVPa3J3bmxKdUZTT2x4SkZLd0x3RW5FMXNwRlJsSkk4ejByekJ3WFhnajBZZGNuZFhORmQ2UQ?oc=5
2026-02-19	Google	0.314	Microsoft or Alphabet: Which Stock Is More Likely to Be a Millionaire Maker? - The Motley Fool		https://news.google.com/rss/articles/CBMijgFBVV95cUxNWWloNTVSb1hoUGpSQ0tISXNOY0dKT01mTXRmQ0JvaDZ1VHNzc2NQM2NpcWJ4Sk5tS2ZMY3hlY3E4ODk2ZUhuV3dFTi1ZVEh0dFpYSVdvMnNZTExfYno1MXdfVkZKeTVaZ1paWTdGMUliR1dwTzBQQ3ZNMm5MUzI3RjdUQTBnSWd2Y0s3MURn?oc=5
2026-02-19	Yahoo	0.267	OpenAI Funding on Track to Top $100 Billion in Latest Round	As the ChatGPT maker prepares to spend trillions in infrastructure investment, the overall valuation of the company, including the eventual funding, could exceed $850 billion, according to some of the people.  The company’s pre-money value will remain $730 billion, said one person, all of whom asked not to be identified discussing private information.  The first portion of the funding round will largely come from strategic investors including Amazon.com Inc., SoftBank Group Corp., Nvidia Corp. and Microsoft Corp., the people said.	https://finance.yahoo.com/news/openai-funding-track-top-100-030310241.html?.tsrc=rss
2026-02-19	Google	0.261	Down 15%, Should You Buy the Dip on Microsoft? - The Motley Fool		https://news.google.com/rss/articles/CBMijwFBVV95cUxPbEg3c1YtSWtNajJTTkt0QzFDMFVzNFNyMUxWWlJ2Wk1UczFnUVp4elkxcUZEMHZVaF9FUG5DR1RfSmhzODhyX0xHYWFFbmhVNnVqWGRYcGhpQll6YmNSbUFZSWpIQTRJcFowUWhJYWlKb1ViY2xQdTJnRGZIRWtfeExjeWN0VXVRSmJUWHZOSQ?oc=5
2026-02-19	Google	0.205	“Project Silica” Breakthrough Does Little Good for Microsoft Stock (NASDAQ:MSFT) - TipRanks		https://news.google.com/rss/articles/CBMiqAFBVV95cUxNU2k4NUh0SWkyWjNRLU9RdXhPSkIyTW1KYTNhM3JIYU1NQ01rZWluWmJONGctRlhVN1ZRZFJsX0lNX3l2Q1pLOVhIOTh2UEVpZDZlVDJqUzlqOFRkX1lObkxwczVCbUdHNERxTEtWODEyQ3pIMnZRLW45bklZSWJDTFNJT2V2UVhLSVpkUFoybzdUcGZ2blltWVV3TmV5bk5NSGlCa0FmcHk?oc=5
2026-02-19	Google	0.167	Nasdaq, S&P 500 Futures Edge Higher, Trump Speech In Focus: Why WMT, META, IBRX, MSFT, EBAY Are On Traders' Radar Today - Stocktwits		https://news.google.com/rss/articles/CBMixAFBVV95cUxQZVY3QzJ4S3hOd1hjUV85ekMtQ2NXOVllMjVYRkd6YUZYdTF4cnVhTmQ0UWtkaUlieFlZWXlZMGRSdnNRVEZkQzVRQVJrRV8xbDhJSkZ2aGlqd0VnUGlUaW8wd0VheXBBcHh6c21vU2JLVFZYT2ljMEVHeG1WUkQ4ZG5PQmpaVjh6cS1YaTFnOFFoUFR4aEUtQXNMc1pVZjRmOURqTzhaWmozQVZhQ3Y2QUZILVBPbFdQTTcyWjFYZ3ZfTEI0?oc=5
2026-02-19	Google	0.0	As Microsoft Extends 20% OpenAI Deal, Is the Bull Case for MSFT Stronger Here? - Barchart.com		https://news.google.com/rss/articles/CBMiugFBVV95cUxNT2wtTFg0b2lyYjRTeWZIdjlQUnVkRUZvUnVTdzJUOVJRaExYMjloX2NENlhtR2tUbUhOaGdOV3p6WXJQcnNQWk1peW9xZzVmeGxzallSRWJoVXlKOU5GR1hyU1NvV3N0cjhMX3c4ZGhWbEgxaFZjSVdyZkRoMVpqTjVab1lMUE1BTUdaZjI5RWVVMURyM1dCQkd2d3dJY0NWdW9wSlgzTzAtYXZpYXVmbGxnaFRFRmFkN0E?oc=5
2026-02-19	Google	0.0	As Microsoft Extends 20% OpenAI Deal, Is the Bull Case for MSFT Stronger Here? - Yahoo Finance		https://news.google.com/rss/articles/CBMihAFBVV95cUxPOFV1YkNrLUdGbzVYcTRYR2J1QnBMYW9pUVpZUVRuckR4VGJjbFdNN1RjR2dRdl9NXzdxNjdWUkFYcjNzY2U4Y3NQMDU3ay1lakF5WFlxNXVCOWlONy1WWlQ5VmM1NHY5c2V0elVUNXpaTm1VZDFKb25vRG5UZmd4X05jakk?oc=5
2026-02-19	Yahoo	0.0	Before you buy the software and Big Tech dips, take a closer look at this overseas stock market	Investors are possessed by a fear of AI and fears from AI. It's hard to know which fear is stronger, but both are already shaping the market. Depending on where you're sitting, it could be an opportunity. On one hand, you have investors worried about the impact that fast-progressing AI models by ...	https://www.thestreet.com/latest-news/before-you-buy-the-software-and-big-tech-dips-take-a-closer-look-at-this-overseas-stock-market?.tsrc=rss
2026-02-19	Google	0.0	Bill Gates withdraws from India AI summit (MSFT:NASDAQ) - Seeking Alpha		https://news.google.com/rss/articles/CBMihgFBVV95cUxPTjBTRjR6MlU5ZktKbUdJNGxVc0YzZm5OYWZqa05kMWJQNS1Tbm1lc2Q4Ymo5U0RrWExkejktNERIRlRCUWRJM3VBMXMzUXBJam03ZWJJSkJpdGdiZ1JISThUX3gyVFJ1a0FrVWZLM3RtY1pxRVJKQkFyQkNsczVBdXR1VmFKQQ?oc=5
2026-02-19	Yahoo	0.0	How Recent AI And Valuation Shifts Are Rewriting The Microsoft (MSFT) Investment Story	Microsoft’s fair value estimate has been nudged from about US$603.22 to about US$596.00, a small reset that lines up with recent Street research pulling price targets closer to more conservative AI adoption timelines. Long term revenue growth assumptions move only slightly, with the current model now using about 16.15% instead of about 16.08%. This reflects modestly higher confidence that AI and cloud related demand can build over a multi year period without radically changing the story. As...	https://finance.yahoo.com/news/recent-ai-valuation-shifts-rewriting-021542723.html?.tsrc=rss
2026-02-19	Yahoo	0.0	India's Tata signs up OpenAI as customer for data centre business	OpenAI will become the first customer of India's ‌Tata Consultancy Services' data centre business, ‌beginning with 100 megawatts of capacity, part of the ​global AI infrastructure initiative Stargate, the companies said.  Stargate is a $500 billion multi-year initiative to build AI data centres for training and inference, ‌backed by major ⁠investors.  The deal is a major boost for TCS, which in a ⁠strategic shift last year disclosed plans to invest up to $7 billion in a 1 gigawatt ​data centre ​unit in India.	https://finance.yahoo.com/news/tatas-data-centre-business-signs-030222356.html?.tsrc=rss
2026-02-19	Google	0.0	MSFT Stock | Microsoft Price, Quote, News & Analysis - TipRanks		https://news.google.com/rss/articles/CBMiTEFVX3lxTE1keURQWDIzdU9CR1NiMEFlSVQwbWwwdmIzbjMyOXNjbGNxejhIcnpUNGxfb2hQakxob2UwQVNyN19YeWtNbEpUSDlqalc?oc=5
2026-02-19	Google	0.0	Microsoft (MSFT) Key Insider Buys $1.98M in Stock — Bullish Signal for Investors? - TipRanks		https://news.google.com/rss/articles/CBMiqAFBVV95cUxQRVJlSWpmaDJ0eGxDQjRlRkFZLWhBTzNuV3lvemt6OVZyYWh4TkZ2bGZZS0Z2WUFoNWVkY05heGFKejNVVEg1MTlxMW1reDhadFZMMFJQUE5CN3ZZdHpmT0d2NWsydDhGRDU4U2l6OVB1SnU2Sl9kMi0xRkx4c1Y0VjEtb091TkJUSTBGV1UzbG5ld3ZRQk14M2R0Rk5FMzcyMHV0SFA1ZTE?oc=5
2026-02-19	Google	0.0	Microsoft Director Loads Up Millions in Stock Amid Sell-Off - TradingView		https://news.google.com/rss/articles/CBMiuwFBVV95cUxNcW9XcFNmeVItQWhMbWV5bVoteGRvLUNYQjV4Wk5la1p2ejNpN1prZnNtQ1M1YmNLZTJMTThYaHAyLWowZVVaSDNYNnk0NlpGUkVhaVhmOUpIalBoUEVYT1Bzck1xTUZMZVBRSmt3RVhGN1FjQ0NsT0xHdjV1emZNN1hVYklZOUdJUER2dV9TZXFoMjJsVjRkUS16Vlp4b2ZJT1VUOWd4ZW1GUjh1TXVzamQyaTRLeVZ0WFo0?oc=5
2026-02-19	Google	0.0	Microsoft Signals Commercial Quantum Breakthrough: Stock Implications for MSFT, AMZN, GOOGL, and IONQ - TipRanks		https://news.google.com/rss/articles/CBMixgFBVV95cUxQOGN1NUFIMUtYQVMyU2xNTWdfUFVwNkUzcF9TVWFSRUJYYlpWVERza3QyM3VjekFzb0E2TnlFSy1rczRtUnVxY3lJeFBKaGJjN0szcDU2QU1raTJ4V2FqQWcwbVhTU1NUSy1CdWJCMmJ6WlhFMmI2aHA5bTViOElvRnFIdXlUbkZIM3ZBYlpMdWhwdjV4anRPTGFrQXoteW1KR0w4OFBCUFpwQjZ2SmVJX1A5d0xST2R2MFkwTk1LME52bWo3cUE?oc=5
2026-02-19	Google	0.0	Microsoft Stock Trades As If ChatGPT Never Happened: Is It A Buy Now? - Microsoft (NASDAQ:MSFT) - Benzinga		https://news.google.com/rss/articles/CBMi0gFBVV95cUxNVnY3dkdwSHphTWR5TXdRVF9najYxYlRoTWN3enh5aWZNZ0htelJWWHFIMk0tanl3N0ZzU2o2aGlBbzEyUWZkd3BfT3Y4bGx0NWc2aXdsdG1pb2VCeUUydXp5M1JKcUZKeWxIb0RJSWlCajBfcnZCLW9XeVRaRDZ4My1zWHhMUlFTRXlXcjZBcXAteTlxWDJFMERUOE5XZFdEWnlaVnA4d0c0TWxIQUMtcHFYTVV5MUFCaDJlRWEyRV9OcEYwYjZkWUFwMk9ORHVuOFE?oc=5
2026-02-19	Google	0.0	Microsoft stock price slips after hours as MSFT goes ex-dividend and $50B AI push lands - Bez Kabli		https://news.google.com/rss/articles/CBMisgFBVV95cUxPYjZJUFFsOE5aaC1vWkNkcHpWVkFpbFljNWQtZ3NnYVJoUHhHRnQzXzhOMXNZTC02V0pVc1RycFlpQWVqVWotTmhRZGpTOFczMWlCTklSMWp3ZVN5WEtKd3ZCR2JUV2owMGFsT1ZRQ0pzX3pjNlpNZnVqTl81WjBFZ3Z6MnFHeVJ1SHFnb2syT1NSdzNyQUNPd0dKeHRuNUlnbUUwR2M0S280Y3pISVNPenRB?oc=5
2026-02-19	Google	0.0	Microsoft: This AI Selloff Could Be The Buying Opportunity Investors Miss (NASDAQ:MSFT) - Seeking Alpha		https://news.google.com/rss/articles/CBMiswFBVV95cUxQejRXbmxVTG5VUTJRTnV6OWhjenpxd25KUmdsRW9pR3VpMXU1a21TNnVrSy01Vk9HNDRseUJjMmoyNXE1bDlIOEwwRHRVN3lFOTFCM3ZrQ2tKWXMtbHcyUnFxSDN1dk50NW13ZzVROC0tOGpuZjlsVEFscmJQZFlTUEM2bEJPWWhEQ1VEUDN2cWJhTjNpNG9iNmF3NTNvTmxmZVVic0RPUnpaN29rT2g4YzFCQQ?oc=5
2026-02-19	Google	0.0	Thursday 2/19 Insider Buying Report: VERX, MSFT - Nasdaq		https://news.google.com/rss/articles/CBMigwFBVV95cUxOamphSlNqeERNdXBqY215aVBGM2VtZDh2RFFHWHlCaU9xNENPTnZ0cVREdnFDalUzWEI1WDV4SDB6WkdPY3ZlbG1ZZS1JNnEwZE5xYUxBeXJFbmRjWDMwT0RCMXVpbnpZa0dRd3RwblRoMldES21QTmpxT2dleGYtYkIwYw?oc=5
2026-02-19	Google	0.0	Why Microsoft Stock Could Soon Stage A Rebound - Forbes		https://news.google.com/rss/articles/CBMiqAFBVV95cUxNTzAwb0JvTHRyZ0N0WEZ3UkFGLTRSMDJQalJ6c0RNb0tZVDUxWm92dWRIRklNNWFaMzlOUDBublBMRjd3Z3k1VlVoVEQtVUdBNHlEQ3A0dW5jZ0hIdm5PNTd0Q1d3S2pwVWNZd3FoN2lkNnJqRWFtdjBfOHpGcWF1MWdDazBuLWZzMU5Id2g5dS1rU1A0amlHRGJ1SjU0aVZlMmtOR2F4SHg?oc=5
2026-02-19	Google	-0.104	Microsoft (MSFT) Stock Down 17% YTD as Director Makes $1.98M Purchase - CoinCentral		https://news.google.com/rss/articles/CBMilAFBVV95cUxNTWFfTkNoUmtBWGFJT0pLVU1IWV9tX25mMEJkdkMzbWg2R29tUWhGUHpyUm12TzZYQkt4ZWhhRml0UXBGMHk5QUtjV2xhaXVVbzZoSDA2YnJsSi1TV2puLXhRemlhcmZCOWRvTGwwemdnZXM5QXZOdmZPbDdLVkxoaDQtR1ZMbmd2RE8xeUVUbmdDcUNZ?oc=5
2026-02-19	Google	-0.133	The Dow’s Biggest Losers of 2026: Why CRM, MSFT, and UNH Are Getting Left Behind - 24/7 Wall St.		https://news.google.com/rss/articles/CBMivAFBVV95cUxPTVpqUmRLcTI1RFlsb2lhR20zeFo3MXpSbGtQSkg1RzZMcnZxajltS1ZYR0J2TUlEeTd5Tl9xSnloUldjYk8xNGtRbl9NMFNhV25tMVRKXzRPclZXcmdkUDBPM0RCM3FNR2U5TFJjU2NUV1JZTElLYnNwdW9HcEZ4R1QwcWF0R1NEamtJSll2Y3NOUXIyVHV0VVI2ekZSdnFfbkx0YUl0Vi1aN3JIRTlLcTkyWDBzRzdsVzFnTA?oc=5
2026-02-19	Google	-0.158	Microsoft Stock (MSFT) Shrugs Off Call of Duty: Warzone Mobile Failure - TipRanks		https://news.google.com/rss/articles/CBMingFBVV95cUxPLWZDMmg2X25vdlNHMmJVcTlMYWFubEtzWTc5QUJNd29Uc2kwYklyRWtvcHNkUFQwdjVVbkFmUzFIRGhvT0VJQi1iSHplYnBrXzlMWHRYRVJpc2Q1WXVoNUVnRW5LYWZqMThFa1ladVRLenRnQ0pxdk1XTGJvR25ETXlOMnRSRW5JeHprVVhacVNCbEhWLWsxRzhKQmpkQQ?oc=5
2026-02-19	Google	-0.16	Microsoft’s Global South AI Bet and Rising Scrutiny Could Be A Game Changer For Microsoft (MSFT) - Yahoo Finance		https://news.google.com/rss/articles/CBMigAFBVV95cUxPRDA0M2p1STZ1b3JiT2pYNWVRUGdyMm5VSXZwUy1xdWY4MzZ5UERFRWhGRjZJX0pjSEI2WEZ5dGp0QW01bTJtZi1zTnZWVXA2UGJ4RUY1el9KVVZWZU5CMFpuNE9TWURrcEk4MWp0ZVdWN0FKb0F1bE5WbWp4TDVsbQ?oc=5
2026-02-18	Yahoo	0.7	How Apple's Contrarian 'Nah, We're Good' Strategy Defies Amazon, Microsoft, Alphabet	Apple Inc. (NASDAQ:AAPL) is the odd one out in Big Tech’s AI spending race. While the rest of the Magnificent 7 are collectively committing around $700 billion in capital expenditure (capex) over the next year, Apple cut its own spending 19% year-over-year last quarter to $2.37 billion. The chart, published by A16Z, captures the gap visually. Since 2014, Apple’s quarterly capex line has barely moved. Every other Big Tech line has turned parabolic. Don't Miss: This AI Helps Fortune 1000 Brands Av	https://finance.yahoo.com/news/apples-contrarian-nah-were-good-193027661.html?.tsrc=rss
2026-02-18	Yahoo	0.333	Prediction: These 3 AI Stocks Will Have Tremendous Momentum in 2026	These companies can pleasantly surprise investors in 2026.	https://www.fool.com/investing/2026/02/18/predict-ai-stocks-momentum-amat-tsm-nvda/?.tsrc=rss
2026-02-18	Google	0.3	Stock-Split Watch: Is Microsoft Next? - The Motley Fool		https://news.google.com/rss/articles/CBMihAFBVV95cUxNbXV0QkxWeVlqb1FJOTZJaElPU2J4REJGNXg5Nzd2OUgtQndCMmNYRkJvdS1rdjF6blg1NGd0ZkE0UFhtdTQxWDRhOVBaY2x6NV9SSWRfSHpsLWNVUzFCcXpsWWNUZWlEMGUwZ21sWDJ2dEt6S0NBVEd1QTRjSk45c1MwTlQ?oc=5
2026-02-18	Google	0.136	New AI-Related Bug Does Not Dampen Microsoft Stock (NASDAQ:MSFT) - TipRanks		https://news.google.com/rss/articles/CBMilgFBVV95cUxPVldKQ05SbHppaFdWdzhqU0U1Zm1tUm1nelR1Ry1aTzR1RWxUZERzS0dLMmlGZjNIeGRoLW9ibVp0WUt4LV9WanJfbDB6SnpfZ2NsU1VNLW5hM2FXS2x2cUZSRWNsTkVId0lxQTI0dF9zTUxIM0JlM1Z1TXpXU3UzTHdTUkV1a1pPVndXLWJEUzA5eGFEQWc?oc=5
2026-02-18	Yahoo	0.0	Amazon and Nvidia Lead Mag 7 Rally	Magnificent Seven stocks gave Wednesday’s broad market rally a big tech boost. Amazon.com was up 2.4%, while Nvidia was up 2.1%. Tesla and Microsoft were both rallying 1.1%. Alphabet and Apple were up about 0.	https://finance.yahoo.com/m/9f2a2dba-948d-3072-a833-d28c193d8008/amazon-and-nvidia-lead-mag-7.html?.tsrc=rss
2026-02-18	Yahoo	0.0	Anthropic May Pay $6.4 Billion To Cloud Partners	Amazon, Google, Microsoft could benefit	https://finance.yahoo.com/news/anthropic-may-pay-6-4-181846102.html?.tsrc=rss
2026-02-18	Yahoo	0.0	Atlassian names LinkedIn veteran James Chuong as CFO	Atlassian on Wednesday named James Chuong as its new ‌chief financial officer, effective March ‌30, taking over from Joe Binz.  Chuong, 46, will ​join the enterprise software company after over a decade as the finance chief of LinkedIn, a subsidiary of Microsoft.  In ‌his new ⁠role, he will oversee Atlassian's finance and legal teams, the ⁠company said.	https://finance.yahoo.com/news/atlassian-names-linkedin-veteran-james-225054380.html?.tsrc=rss
2026-02-18	Yahoo	0.0	Capgemini Bets On Sovereign Cloud And WNS Deal To Revive Growth	Capgemini (ENXTPA:CAP) has launched new sovereign cloud and AI solutions across Microsoft, AWS, and Google ecosystems, targeting clients with strict compliance and data residency needs. The company has also agreed to acquire WNS, aiming to deepen its AI powered and data rich operations services for enterprise customers. These moves expand Capgemini's role in regulated sectors that require high levels of security, governance, and control over sensitive data. Capgemini enters this phase of...	https://finance.yahoo.com/news/capgemini-bets-sovereign-cloud-wns-181026073.html?.tsrc=rss
2026-02-18	Yahoo	0.0	Cathie Wood buys $14 million of megacap AI stocks	Cathie Wood didn’t hesitate when tech investors started flinching. On Feb. 17, ARK’s daily disclosures showed buys of $8 million in Broadcom (AVGO) and about $6 million in Advanced Micro Devices (AMD). That’s a massive $14 million combined push into two of the biggest AI infrastructure giants, just ...	https://www.thestreet.com/investing/stocks/cathie-wood-buys-14-million-of-megacap-ai-stocks?.tsrc=rss
2026-02-18	Yahoo	0.0	Here's Why Amazon, Alphabet, and Microsoft's AI Spending Is a Genius Move	Cloud computing is powering AI innovation.	https://www.fool.com/investing/2026/02/18/heres-why-amazon-alphabet-and-microsofts-ai-spendi/?.tsrc=rss
2026-02-18	Google	0.0	Insider Purchase: Director at $MSFT Buys 5,000 Shares - Quiver Quantitative		https://news.google.com/rss/articles/CBMilAFBVV95cUxNa0xoX1V6aWpNQTVfcUZMdTRMXzJPLUlsNVNPTVpTQ0dSQVFZNkJ4Y1U4d3NScDc5ejRRSFIzUGt4TTU2UDlzc3FTbFdBanBlTkkxZHhGX1ZhVldaSnQzS1gwRzh1a1I3S1RDMS1qV2hoTGdoQXRDWEtIVEo3cHlrV3BKWTV2TWFaOUtUamtFUFhPNm5J?oc=5
2026-02-18	Google	0.0	Investors Dump Microsoft Shares Despite Largest Earnings Beat in Company History - 24/7 Wall St.		https://news.google.com/rss/articles/CBMiwgFBVV95cUxPMmpzWFFFYVhGYWo5cjBoNXFxclV1MFY3dE55THpieFVuZENKWFZmVmpmQjBxLVFtaDNaZ2I1RnBHbkVaZTVBbmtwRVdwd1RXYTVQeWNKNUlfRG5SQXNBRjg5X2tJUjRyMUhndGVqdm52TzltOWpzOXlQeWVqR1hRd2F2YVJBbnJVcGw3MmF1YklqRFd4MGFiN2MySTFJNWREVUF0bkE2azJ0Zmh6bkgtZ21FcDB3TTJjZlhrdF9TSmctZw?oc=5
2026-02-18	Google	0.0	Investors Dump Microsoft Shares Despite Largest Earnings Beat in Company History - Yahoo Finance		https://news.google.com/rss/articles/CBMijgFBVV95cUxPSGhmS2xibjUzcVR0dVpYTkVINW5QUE5IWmNVOXFNNEFGS0lOVUhnTDhNT0JUajh2QzU1VkFIQlpVMnRFZkIzXzlDSkFmWDFaaXozckxhNXJSVWJFdEp5R1NIYU93blVaS3k0MVVVaDNqa01tZmNuS29ZOWhTa050ZDdUTldsa0NtLVVNUktR?oc=5
2026-02-18	Google	0.0	Is There Now An Opportunity In Microsoft (MSFT) After Recent Share Price Pullback? - simplywall.st		https://news.google.com/rss/articles/CBMixwFBVV95cUxPV2hleTdGZ0w4SzMyYkh5cXZ6TFBhR1ZDU24xb2NLeFZyOUs1cmRzRWI1ZWdnZWlYaHRFX1J4aW9wSXVUMEhaUXpOSGV4RjF1TWs3UUtJbmxPTGcyVVJzMmh3ZXJOYjl4dVNTcDNZdVhJMU5CLXVoQzRZaWo4OWh4dTF4VXM0QWx3dEV1TlROOXlQa09fcnZ1dTZXYXBCRFE3VHprWUZ5NHBNN2ZQNGFIQUVSc1d3czlvLTZvby1YVkNNNXJfbW9J?oc=5
2026-02-18	Google	0.0	Jim Cramer Says Microsoft Will 'Blow Us Away' As Stock Sits 25% Below Peak - Benzinga		https://news.google.com/rss/articles/CBMitwFBVV95cUxQdXotUWVDbk1adjlBMUpzSEN3S1RobkVJcm5qcE93bUx4cHVjSmhqcGNPWWtTZkliT0FVdmJoS05vSnlZeEZsYUxvMUk1QVpndE9saXhRUDQyWVBLVVZaVWhDRWNoRXVRSGNBb2ljS1ZEX3lIMnZjR3o4T19OZy0ybHRkR05JeDZRSjRUY3V4enl5QUFBSXhVc1BZdEdNajR0QWVUSF93ZldlV1BnaW8tMkZ6RTV1Wlk?oc=5
2026-02-18	Google	0.0	Microsoft (MSFT) Bets Big on the Global South with $50 Billion AI Buildout Through 2030 - TipRanks		https://news.google.com/rss/articles/CBMitAFBVV95cUxPS08xOFdRUVBaV253N2VIdkJORWZMVTBWdzVYSUM0aGUzTGlsLU4yelhLRlVPRVdSRG1iVnY0NUpzb0Z2QUFRdlkzd2xEMy04SWNweWR0ZW9uUnVFa0NFMkFhTTR0Z3o0NWVNMDVwVlA2Vkt0SWFGdzdRa01rSkFLbXJ3bmtyS1VKbWYyNVY1RjZhNDNjdTAyOGVEOHg0aFdIay1xeTc4bW9xcjVDYnFzVFBUV2k?oc=5
2026-02-18	Google	0.0	Microsoft (MSFT) Stock Quotes, Company News And Chart Analysis - Investor's Business Daily		https://news.google.com/rss/articles/CBMipAFBVV95cUxQWWhxeXNoQ3Riem4wdDhaZzA0SjA4bU1IVllkcEV4Y1V1eUFpTTV4Vllfb1VnSnBQV3k4VnBuUzlWb0dURDZ3V2pyQm83cUtuWU9FaFpSZEd0T1FQczZlNllPSFJVcUFKb1EyYUZVRW43UE9aMk1iOUtuOGc2UTk1QjA2QkFhXzh1YWhTSEF0ZW82LTdickFSY2ROeGIwelVjRHJqRA?oc=5
2026-02-18	Yahoo	0.0	Microsoft Locks In 20% Of OpenAI Revenue	Microsoft secures longer-term payout stream	https://finance.yahoo.com/news/microsoft-locks-20-openai-revenue-181728928.html?.tsrc=rss
2026-02-18	Google	0.0	Microsoft Locks In 20% Of OpenAI's Revenue Until 2032 In High-Stakes Strategy Shift - Microsoft (NASDAQ:MSFT) - Benzinga		https://news.google.com/rss/articles/CBMilAFBVV95cUxQaXJ2OXBHcHhsemYzbUZLUFJ6cFZzQWsyZC1yZFUyNjNuTGlkd3hydkFxUFltZzJyQXdJMHQ5VXljT3pWTTNXckVQYXltcTlQT0tON2NQbEJaUEY1bWUwbzZadzVuRHhkcHdCUGwzc3NGb3ViSXphb0xPMU45aTRTeHFFSjBkMTZORjZ1QnhwM2tES0NH?oc=5
2026-02-18	Google	0.0	Microsoft to invest $50B to expand AI access across the global south (MSFT:NASDAQ) - Seeking Alpha		https://news.google.com/rss/articles/CBMiqAFBVV95cUxQaDhaWDBZOVhad0lJaEphMVZkbW0tbVFHa2RaWW0wT0lpUXhucGJXYjdtVFprN2JXeVNMTzYxTFFYLXlNeURwQjZ4V0NzZnVMZlgzR19MVlVGaWxvOHZuRjg4RElZTTJYZjJHZlM0cFNEalVFTXB5b2lBRW5KSXVaTTlXSmZiTG1GSE1DQVhzM1R6bGlDdUh2VnlVcTE5VG5hZ2dNcFVwQlQ?oc=5
2026-02-18	Yahoo	0.0	"Microsoft’s Brad Smith says U.S. firms should ""worry"" about China’s AI subsidies"	"Investing.com -- Microsoft President Brad Smith cautioned that American tech companies should ""worry a little bit"" about subsidies Chinese competitors receive from their government in the artificial intelligence race."	https://finance.yahoo.com/news/microsoft-brad-smith-says-u-185313277.html?.tsrc=rss
2026-02-18	Google	0.0	Reassessing Microsoft (MSFT) Valuation After Recent Share Price Pullback - Yahoo Finance		https://news.google.com/rss/articles/CBMikwFBVV95cUxQNUZQSmotUWVhREdyd0NlV1NfY3pQcGNCdlJpMjNwOWpVRFVrMlJZaXdXQ2lMZnQtekVOREtWX3B0Z1JzRE5KWGxKTHk2c3ZtNmJXUTU1dDhOV3FSY29kTmtIR0lyZFMzbVN6NlhUR1QtcW9NVElKTlNRRWkzcjc5Uk1sOHp6TVRBdExTZTdPcmFSTm8?oc=5
2026-02-18	Yahoo	0.0	Tech Majors Help Lift Equity Markets Intraday Ahead of Fed Minutes	US benchmark equity indexes were higher intraday amid gains in major technology stocks, ahead of the	https://finance.yahoo.com/news/tech-majors-help-lift-equity-184346445.html?.tsrc=rss
2026-02-18	Google	0.0	What's Going On With Microsoft Stock Wednesday? - Microsoft (NASDAQ:MSFT) - Benzinga		https://news.google.com/rss/articles/CBMiuAFBVV95cUxNUFRrbkxzMEhWcXI1UVRkTVBtV0NKT19wS21TN2JUYlNUNjI5VWNfb0RXVlVHcVVjb1FzeGU5SWhqTEhBZUt0T0xBQWpYU05YNXR1R3FseC11LWFTWkNxQUtnZnlhYTc4VXUydC1sVW1Dc21Vc2V6OFZ1eHNuQm5xM1FLVWI1U0dJY0xWd3BrOXFYNHVJZ0kwanZvRVhDNTY4YWxYUWlHUVk5UDk4eDZBS19xNXVIT3Vk?oc=5
