Date	Source	Sentiment	Headline	Summary	URL
2026-02-22	Google	0.6	Could Buying Microsoft Stock Today Set You Up for Life? - The Motley Fool		https://news.google.com/rss/articles/CBMilwFBVV95cUxNb29HVC1idHRGbzYyd0xvelFTYUhZX2FtN0xCdlZuaGFYV1lacnhHNmlOODRRR21YRzNnYnBJdnMxajFlOGdLcWQ1YjV5eU1OUFBYQUVLSzdhLW1JQWxrRzJ3NzFjY1F0Zld5NzBPbi1YS09mdmgxaXJmQW8tY05QY2h5amJPN1pNNm9EOU1kdGs2ZVdNaHg0?oc=5
2026-02-22	Yahoo	0.228	"This ""Magnificent Seven"" Stock Is Down 22%. Buy It Before It Sets a New All-Time High."	Amazon is following a lackluster 2025 with a mounting sell-off in 2026.	https://www.fool.com/investing/2026/02/22/buy-magnificent-seven-stock-amazon-2026/?.tsrc=rss
2026-02-22	Yahoo	0.217	Citi Cuts Snowflake (SNOW) Price Target to $270 but Maintains Buy Rating	We recently published an article titled 12 Best Data Storage Stocks to Buy Right Now. On February 18, Citi lowered its price target on Snowflake Inc. (NYSE:SNOW) to $270 from $300 while maintaining a Buy rating. The firm attributed the stock’s 30% pullback following fiscal third-quarter results to a smaller-than-typical earnings beat and broader software […]	https://finance.yahoo.com/news/citi-cuts-snowflake-snow-price-122452309.html?.tsrc=rss
2026-02-22	Yahoo	0.209	CoStar Group, Inc. (CSGP) Lauches Homes AI	CoStar Group, Inc. (NASDAQ:CSGP) is one of the Most Promising Stocks to Invest In Before They Take Off. On February 17, CoStar Group, Inc. (NASDAQ:CSGP) launched a new AI tool called Homes AI. The tool is powered by Microsoft Azure and OpenAI. It allows users to communicate through voice and text, similar to chatting with […]	https://finance.yahoo.com/news/costar-group-inc-csgp-lauches-170920852.html?.tsrc=rss
2026-02-22	Yahoo	0.2	Could Buying Microsoft Stock Today Set You Up for Life?	Microsoft doesn't go on sale very often.	https://www.fool.com/investing/2026/02/22/could-buying-microsoft-stock-today-set-you-up-for/?.tsrc=rss
2026-02-22	Yahoo	0.125	Nvidia Wants to Be the Brain of Consumer PCs Once Again	Nvidia  chips for laptop computers are set to hit the market this year in products from Dell, Lenovo and others, a return to the consumer PC market for the leader in artificial-intelligence chips.  The world’s most valuable company by market capitalization, Nvidia isn’t expecting big profit soon from getting its chips into everyday PCs, but analysts said it wanted to keep a connection with consumers in an era when every device will be AI-enabled.  Nvidia and its partners hope to make PCs lighter	https://finance.yahoo.com/m/c0bbf3ad-5704-30f6-af60-dd97d22bfaca/nvidia-wants-to-be-the-brain.html?.tsrc=rss
2026-02-22	Yahoo	0.07	The next Nvidia growth wave is coming from an unlikely place	For two years, the Nvidia (NVDA) story has been simple: a handful of massive U.S. cloud providers racing to buy as many of its chips as possible. That story isn't over. But it's no longer the whole story. Nvidia's latest moves in India are pointing to what the next phase of AI demand actually looks ...	https://www.thestreet.com/investing/stocks/the-next-nvidia-growth-wave-is-coming-from-an-unlikely-place?.tsrc=rss
2026-02-22	Yahoo	0.04	Does Microsoft Deserve Its Decade-Low Multiple?	Microsoft (NASDAQ:MSFT) has integrated artificial intelligence (AI) into its products more extensively than most of its peers, with tools like Copilot embedded across its software suite and its Azure AI infrastructure sold out in key regions.Bullish analyses often focus on its potential to monetize Copilot through paid upgrades, but current adoption remains low at 3.3% ... Does Microsoft Deserve Its Decade-Low Multiple?	https://247wallst.com/investing/2026/02/22/does-microsoft-deserve-its-decade-low-multiple/?.tsrc=rss
2026-02-22	Yahoo	0.02	Wall Street’s Latest Bet Is on ‘HALO’ Companies With AI Immunity	After a three-year love affair with anything related to artificial intelligence, U.S. investors are flocking to the factory owners, fast-food restaurants and commodity companies that have seemingly strong odds of surviving the technological revolution intact.  The winners include  McDonald’s Exxon Mobil  and tractor maker  Deere  Left behind are the perceived potential victims of the AI revolution, a list that has ranged from wealth managers to software firms.  In the past month, the S&amp;P 500	https://finance.yahoo.com/m/9f1971f2-c0c6-3364-9432-b31cd2c830f3/wall-street%E2%80%99s-latest-bet-is.html?.tsrc=rss
2026-02-22	Google	0.0	Does Microsoft Deserve Its Decade-Low Multiple? - 24/7 Wall St.		https://news.google.com/rss/articles/CBMilAFBVV95cUxPSmlIUEU3d05QQW96UV9aMWxUWDJBaWMySVFGLW5COFZ5RmRpYVhIRTQyVng3V3B4Q1hlX0F2UjRnbWptckM2S0hUWEd3T1BjVzlZbWNqemtyZ2NMYmQ2V29pUjZmeS1ZM3htaklMNlNhdXduZFlJUVFOWGhqbnZLLVM5TGtob0xPNHpyZm53WXhpODVf?oc=5
2026-02-22	Google	0.0	MSFT Stock Today: February 22 – OpenAI Ban in BC Case Puts AI Safety in Focus - Meyka		https://news.google.com/rss/articles/CBMipgFBVV95cUxQbXhMRkdlTE8tSTV0djdOQmRLLWJMM19idzdVWFV0S2tKaWY1R1hPdm9NSi1OdE1fZU9qZk05ZGs3NXVaeUJYbmI5Yy1tbUs3cEppc2F5UDJ4REFKSEdLZmhncGZoMDlOMnhzNnpKSEpzUGNiYXJTYmVTQkdjWU1JVXJuenlVWUxVYnBrQjFfWVF2SmZhSHcxNFktOGM3ZlA1S1FLUWJn?oc=5
2026-02-22	Yahoo	-0.149	How Apple’s Lazy AI Strategy Could Crush the Competition	Apple (NASDAQ:AAPL) has trailed in the artificial intelligence (AI) race since its early stages. From the start, the company lagged behind rivals in developing large language models and AI infrastructure. Its current initiatives, such as Apple Intelligence and updates to Siri, have progressed slowly, with key features delayed until 2026. This pace raises concerns that ... How Apple’s Lazy AI Strategy Could Crush the Competition	https://247wallst.com/investing/2026/02/22/how-apples-lazy-ai-strategy-could-crush-the-competition/?.tsrc=rss
2026-02-22	Google	-0.2	MSFT Stock Today, February 22: OpenAI Valuation Soars on $100B Round - Meyka		https://news.google.com/rss/articles/CBMimgFBVV95cUxQUjZEZjAxUGEyMGJ0ZDBxbW1OeVFwczFqOVFIdHVRQzJNWXd5Rzl1YXZUTm8xb1RUU2dvZHlQaTJjUkFrRTlYeC1XUmU5bTYzYmR5UjFZclZQWE90dUVfRW9qcEtqZVk0NENKY1AwSDZHaEx2U204aGhCalJsMl9GSlA1X21NTUF0U3ZyeGM2SHNCMzd2OFpwWTVR?oc=5
2026-02-22	Yahoo	-0.2	Software stocks are sliding. Is it time to 'buy the dip'?	Shares of Microsoft, Oracle and Salesforce are sliding as investors debate whether AI will disrupt or destroy software firms.	https://www.usatoday.com/story/money/2026/02/22/software-stocks-selloff-microsoft-oracle-salesforce-nasdaq/88774908007/?.tsrc=rss
2026-02-22	Yahoo	-0.3	The Artificial Intelligence (AI) Infrastructure Stock That Hyperscalers Are Fighting Over for 2026	Big tech's spending spree is accelerating, but Nvidia stock is priced like it isn't.	https://www.fool.com/investing/2026/02/22/the-artificial-intelligence-ai-infrastructure-stoc/?.tsrc=rss
2026-02-22	Google	-0.375	Understanding the Setup: (MSFT) and Scalable Risk - Stock Traders Daily		https://news.google.com/rss/articles/CBMixgFBVV95cUxNLTgzRDQ4MkxxQ04ydVBsNUEweWI5S1QwVGc2M1ByVnhZNmRKYWt1TmpJelctMEV3d1RmMWNGNl9TUTlXalFtal9PUFRWZXotamI3VkJobDVLal9GVll1SHRJUVVOVzJJU2lOYmVBYzNFdUpJbldQQUE2alZRdl9DZ2g5SnlvSVVoTHZ0ak5IUHdELTQ3VUVTcmh0ZlQxZkZsYllMZzhlTzUzNkxaMExMVkxla0RHVWhMOGU0ZFFiWVhRUEtXNFE?oc=5
2026-02-22	Yahoo	-0.4	Here's Walmart's $1 trillion secret	Walmart remains no joke on tech.	https://finance.yahoo.com/news/heres-walmarts-1-trillion-secret-133058210.html?.tsrc=rss
2026-02-21	Google	0.75	History Says Now Is the Time to Buy These 2 Brilliant Stocks - The Motley Fool		https://news.google.com/rss/articles/CBMijwFBVV95cUxNaVhhLWZ5RlJyYUIyemJWLXY0bmF3WVRrYmxCS2pSYnpIYjdmNEl1QVFUZmVIWmg2UThXMTlRZkdvdUpBekJzWjFTUXVtVnlWUU1qMEpiazRXS2dsdmdfUG1XbWV4Q3lvdHlMTWp6RGM3UEVvcXVGb2VIQTg5VmdTSTNZcFlTbUotc1k3Q1FsVQ?oc=5
2026-02-21	Google	0.5	Analysts’ Top Technology Picks: Toast Inc (TOST), Microsoft (MSFT) - The Globe and Mail		https://news.google.com/rss/articles/CBMi3gFBVV95cUxNSXEySFZjdE9IXzkzWDZyOF9sbUt0M1c2WnVNcnBIYTR0QUtaT2VoMkNKVlpQbm53UDA5eVotUU9DUEhMT3R4UDlpdGZvMUhDdlBPSTV6VUFKZUViYVRyZjAxQlEwMHRoOHVQY1hseHFCZnAxU0pNa1J1Vm40ci1Gb1U3MkV6Yl9jTERRWXlmT1AxTUZqRXpOR1lTTThKUUFJc2FUdEo5UTdwY0o0R2dTbW0xX0hfOWk0ekJtOUVyUTFaeG9EQTcxNVM3OTUtSXFid0RpYVdTcS1OSEZadEE?oc=5
2026-02-21	Google	0.5	Insider trades: Microsoft, Walt Disney among notable names this week (MSFT:NASDAQ) - Seeking Alpha		https://news.google.com/rss/articles/CBMipwFBVV95cUxOZDJqMWFvMHpTME1QU3N2SlAyQjNJdVZVR0VXaW5mWWUxVW0xeDRZZDhRbzBqNEJVbUhqbUJ6N2ZDbVBqblFqblAxeGdORUxfeDlSU2xJa2JlUjIxdHpDQ1N1YjFKSGlEQ1dfMkxNU3pkMl9RWnpHZG10aEUxcUhITzJlTFAwZFpyWV9xRGVqb0pIN3IxU0VwSFhUY05LcDdUdmJ1ZVZaVQ?oc=5
2026-02-21	Yahoo	0.5	Where Will Microsoft Be in 1 Year?	Looking at what's next for the worst-performing Magnificent Seven stock in 2026.	https://www.fool.com/investing/2026/02/21/where-will-microsoft-be-in-1-year/?.tsrc=rss
2026-02-21	Yahoo	0.451	Nvidia Earnings Loom: A Closer Look at the Mag 7 Earnings Picture	Impressively, Nvidia is on track to bring in almost four times as much in revenue in a single quarter as it did in all of 2021. But are things as good for the other Magnificent 7 members?	https://finance.yahoo.com/news/nvidia-earnings-loom-closer-look-004600895.html?.tsrc=rss
2026-02-21	Yahoo	0.45	3 Brilliant Growth Stock ETFs to Buy Now and Hold for the Long Term	Growth stock ETFs offer a catch-all way to buy the dip in top stocks.	https://www.fool.com/investing/2026/02/21/buy-growth-stock-etf-long-term/?.tsrc=rss
2026-02-21	Yahoo	0.417	History Says Now Is the Time to Buy These 2 Brilliant Stocks	Microsoft and Nvidia haven't been this cheap in a long time.	https://www.fool.com/investing/2026/02/21/history-says-its-time-to-buy-these-2-stocks/?.tsrc=rss
2026-02-21	Yahoo	0.2	‘I have a chip on my shoulder.’ Phoebe Gates wants her $185 million AI startup Phia to succeed with ‘no ties to my privilege or my last name’	The daughter of Bill Gates and Melinda French Gates acknowledges her privilege, but says she’s building her own thing without their help.	https://finance.yahoo.com/news/chip-shoulder-phoebe-gates-wants-123300362.html?.tsrc=rss
2026-02-21	Yahoo	0.136	Is BlackLine Stock a Turnaround Bet After This Fund's New $20 Million Stake?	BlackLine provides cloud-based software that automates accounting and finance workflows for enterprise and mid-market clients.	https://www.fool.com/coverage/filings/2026/02/20/is-blackline-stock-a-turnaround-bet-after-this-fund-s-new-usd20-million-stake/?.tsrc=rss
2026-02-21	Google	0.136	Microsoft names new CEO for gaming unit (MSFT:NASDAQ) - Seeking Alpha		https://news.google.com/rss/articles/CBMifkFVX3lxTE5rTEZGQTBsX202M25sZVRHS0JTNE5BQTI5cklWZDBYcEo1YnlPbWRHUVh1NWJTdjBUTUhkVDVJZF9aSWsyT3Q3UkxUZm9DcElyWTVZd2xlNEFVelNYZWNQdE1nUmd1Szkta3pCMlBZS2xGN21tMDJob3RJWmNDdw?oc=5
2026-02-21	Yahoo	0.11	Ray Dalio Sours On America And Sold These Tech Stocks	Legendary investor Ray Dalio has repeatedly expressed concerns about the U.S. economy. He’s discussed the unsustainable debt and geopolitical conflicts and is concerned about the long-term economic growth. In the fourth quarter, Bridgewater Associates reduced holdings in the major tech stocks, raising concerns about the future of artificial intelligence and increased capital spending. Dalio sold ... Ray Dalio Sours On America And Sold These Tech Stocks	https://247wallst.com/investing/2026/02/21/ray-dalio-sours-on-america-and-sold-these-tech-stocks/?.tsrc=rss
2026-02-21	Yahoo	0.083	1 Company Set to Make a Fortune from the $650 Billion Data Center Buildout	Taiwan Semiconductor will be a huge winner as long as AI spending continues.	https://www.fool.com/investing/2026/02/21/1-company-set-to-make-a-fortune-from-data-centers/?.tsrc=rss
2026-02-21	Google	0.068	Microsoft (MSFT): New Buy Recommendation for This Technology Giant - The Globe and Mail		https://news.google.com/rss/articles/CBMi4wFBVV95cUxPZk1VS0Y4b2hCUDB4YVRkNmE3eHNGMV9adkVLOVQtd0RzYURrS0xvSXd2QVlhdHNnMjhIZTlOdm4yRU1POVFJZ2Y1QWR3bndKM0EtRG5pNFk4aUZEUE9iblBscnZITThyOEJ4M1RTdGxuZDFpdTlJQ3JXSDdLdUpubzN5ZVdXcTRJY2RjS2RScXRtTEFhd2RIeTJuRnBJUEJ5ZFlJaEluNGEwVG1SQ29LM0RIMzItcmlSVTcxOEc4anZzaFpSYUFtNlZrSmNGNkxDeU1SZTdaZVRtWFd2cmNrYllBOA?oc=5
2026-02-21	Google	0.0	Hedge funds make contrasting calls on Microsoft (MSFT:NASDAQ) - Seeking Alpha		https://news.google.com/rss/articles/CBMijgFBVV95cUxNZEhFTm9RTVR2ZUlYb1djcVJlWDY0Yi1zTmRFYXlsak9IcDAwdVlabHY3RXVrY3pFMDZEOHdGaVMxN2ZMa2xCVlJmQ0c4RlhIenNxcF9zNzAwalZfclVIN1EzY2EzWEZvdFRJaXZLdGRfWXF5YXRMZXlFU295cGstRktWelZ5Mnd4bzFpRmRB?oc=5
2026-02-21	Google	0.0	MSFT Stock Today: Asha Sharma Takes Xbox Helm, Console Pivot — February 21 - Meyka		https://news.google.com/rss/articles/CBMioAFBVV95cUxQTk1aZFVvOVFJcHhrUUhhSTJJMWFpNjFfYmI5SHJOS3kxcndPaGVWVUp1OTZBOVNZVWNqRDNHR1JVeWtrX3RkbGtyczJLbTBaUHJFdmdrV25ta1BwYUw1bEJkTnVLMWVuTzJkMGZoWm5zS0dxbmZqaXhSS2pPLUMzQmlteXBscFYzcFZwWmZIZUtJNjNhcFlPWlhvZkdIR0t6?oc=5
2026-02-21	Google	0.0	MSFT Stock Today: February 20 as OpenAI Cuts Spend Target to $600B - Meyka		https://news.google.com/rss/articles/CBMimAFBVV95cUxNOXBja25HWUNMQXd5VWs1MU9UakROX0FnUERPZGVpdnd2RlJhd2EzRVdMamtIMTl4dVdRWE5iUnFtSnBqaWNmVXpFSElXUVlMQy1Mc05qdzF2SHJaYUxTLWYyWV94R1MyUFJtWUl3UGF0NXc4b05ycUlHbDVEblp5dmRpdTZNS2hkd2dxN1RyeTRPMWp4UmZZQw?oc=5
2026-02-21	Google	0.0	Microsoft Corp (NASDAQ:MSFT): A High-Quality Dividend Stock for Long-Term Growth - ChartMill		https://news.google.com/rss/articles/CBMixwFBVV95cUxNUDZvZHhXSC1XS19PekswbzFOMHRyckNISi00T0Ixb0pWQk5zeEVkVS0wOTZMTzl4Mk9JRXFpSEgzcTFOb1RERDZaSmpZWGdKemt2UWhnNTNscVJNZ2QwbGlLYU9MeWdEZUE1Y1dCdjRTRWZfbF8xcVNoUlBLTlc0bFlYVmZJbGRVRGZhQU5GbTFZSmR0Ymh3UURsSWVYWExQRFdQZjhIdDVZN1ppaDBTZFo4QThscU8yUGVQOG8tYWptTGxmWkdF?oc=5
2026-02-21	Yahoo	0.0	Nextech3D.ai sees revenue growth surge in Q3 - ICYMI	Nextech3D.AI (CSE:NTAR, OTCQX:NEXCF, FRA:1SS) earlier this week reported Q3 2026 financial results that CEO Evan Gappelberg described as a corporate “inflection point,” highlighting 59% revenue growth, 20% sequential quarterly growth and record gross margins of 95%. Speaking to Proactive,...	https://www.proactiveinvestors.com/companies/news/1087729/nextech3d-ai-sees-revenue-growth-surge-in-q3-icymi-1087729.html?.tsrc=rss
2026-02-21	Yahoo	0.0	TransAlta Stock Up 29% as Fund Trims 794,400 Shares in $12 Million Move	TransAlta delivers electricity from hydro, wind, solar, and gas assets to wholesale and utility markets in North America and Australia.	https://www.fool.com/coverage/filings/2026/02/20/transalta-stock-up-29-as-fund-trims-794-400-shares-in-usd12-million-move/?.tsrc=rss
2026-02-21	Yahoo	-0.081	UBS hikes its Corning Inc price target on AI data center fiber-optic cables demand	Investing.com – UBS has aggressively raised its Corning Inc (NYSE: GLW) price target to $160 from $125 and maintained a buy rating on the stock. The aggressive move was driven by the massive wave of capital expenditure (capex) revision from leading data center hyperscalers. The analysts noted that Corning glass was set to benefit from the AI infrastructure buildout due to rising demand for fiber optic cables.	https://finance.yahoo.com/news/ubs-hikes-corning-inc-price-010359270.html?.tsrc=rss
2026-02-21	Google	-0.1	OpenAI Tempers Compute Spending Target To $600 Billion, Projects $280 Billion Revenue By 2030 As Mega Funding Round Nears: Report - Amazon.com (NASDAQ:AMZN), Microsoft (NASDAQ:MSFT) - Benzinga		https://news.google.com/rss/articles/CBMiigJBVV95cUxOV0RtakhUTi1YTmlIZTE5ejhVNjNOcTBpZnBGZDAzMGJzQ21jR0JfaDRTcWN4RGh0a01XNEVldlp4c0p6NThpS0xreDRIREVDMm9kTE1ScUdpZEdhellieElJTFRQa24ybHRJVm5OYlpSMFR0Y2lXc0RWMjlGWXliOExyYlpPT3R4TmNsTTc4bkdoUkduT2Fza1pJSmZhaHZEWENsOTEzZEU2R3drcjVyQ2E4bnlJZTkwQXdPdUhXWHM2Umd2bURvWUZnTk9od3RBdmdvVldvbU9ndk1pOVJDckJBTnZBd3pPdzUyNG9VS0ZQaVRoSC1XY29uV2xoTW1UZ3d3Z3FDUnBfdw?oc=5
2026-02-21	Yahoo	-0.146	Microsoft CEO Satya Nadella says Bill Gates told him his big bet on OpenAI would be a flop: ‘Yeah, you’re going to burn this billion dollars’	Nadella said despite the risk, “it was not that hard to convince anyone.”	https://finance.yahoo.com/news/microsoft-ceo-satya-nadella-says-160512018.html?.tsrc=rss
2026-02-20	Yahoo	0.7	Tesla to Discontinue Model S, X After 630,000+ Sales	After helping Tesla join the Magnificent 7, the Model S and X will be discontinued as the company shifts focus toward robotics and an autonomous Cybercab.	https://finance.yahoo.com/news/tesla-discontinue-model-x-630-220805203.html?.tsrc=rss
2026-02-20	Google	0.667	MSFT Stock vs. PANW: Choosing The Best Growth Engine For Your Portfolio - Forbes		https://news.google.com/rss/articles/CBMixwFBVV95cUxPQjhiYTQ2RTliTnVzSVRQbGl1Y3NiRHVHZVprclRFNG1XZHBPXzRQZUJUekF0Zk9LZG5UbTgzNjNsQWdCa2VuR3FqTnJMa2FMcVdweWpOOFNFQ2JfS0ZaUDc3SEZOQTlNQ01NVGJYbDdUSmhteDNGWGJicmVrWXk5V0JEVjJ4Q0lXQy0xWnIxc2Y2ei16MnBiTUJiclNnR3BGQ1FjVzhYc25ZUDNMSldYN1QzS1pRZjFEN3FVTzh6SHA0QkpxLUg4?oc=5
2026-02-20	Yahoo	0.517	The New Magnificent Stocks to Own in 2026	The Mag 7 is over, but these five stocks look like worthy replacements.	https://finance.yahoo.com/news/magnificent-stocks-own-2026-223300179.html?.tsrc=rss
2026-02-20	Yahoo	0.434	Stock Market Today, Feb. 20: Alphabet Jumps as Gemini Rollout Bolsters $185B AI Buildout	Alphabet rose after rolling out its Gemini AI model to enterprise customers and announcing a new Asia commerce partnership. The move suggests investors are growing more confident that AI-driven growth can support the company’s aggressive infrastructure spending plans.	https://www.fool.com/coverage/stock-market-today/2026/02/20/stock-market-today-feb-20-alphabet-jumps-as-gemini-rollout-bolsters-usd185b-ai-buildout/?.tsrc=rss
2026-02-20	Yahoo	0.4	After the Pause, the Magnificent 7 Stocks Look Ready to Lead Again	Meta Platforms, Amazon, Alphabet and the others have all seen their share prices trade sideways to lower over the last several month and now they look as a attractive as ever	https://finance.yahoo.com/news/pause-magnificent-7-stocks-look-222100593.html?.tsrc=rss
2026-02-20	Google	0.25	Alphabet vs. Microsoft: Which Stock Has More Potential? - NAI500		https://news.google.com/rss/articles/CBMijgFBVV95cUxPWEdkWEJpc1NYaXdabGZRSzNBTzZ6SGJjT29YN2YwQlVPZlJfR01rTWVsb2NKOHd0ZlZJdldhVmhIdnlvODltZlZoVGM1MFBVdVd6WVFYbzZiWkJ4dktMckd0bG0xejhzblR0LVlDSGhCOE13d1ZPUi0xVXZyOWc2MElsOFQ3YlMtaWxzMV9B?oc=5
2026-02-20	Google	0.25	Interesting MSFT Put And Call Options For October 16th - Nasdaq		https://news.google.com/rss/articles/CBMiigFBVV95cUxOOURQajItM2kzRFViRVNTaWN6TkVhZDdBb0lNS2xpdzJEYlV3SzZTQ0x4dXlCb3NpakVYNXpwdDA4UlFBLWZoM3hFbER5V19ocWV1SXRENEhmQ0g1VWlVdnVvSEtXU19jVDItSzFIUWVsY0xlTDNfUi1QSmQxQWpueUdvUlJHZHRIM1E?oc=5
2026-02-20	Yahoo	0.192	Top Stocks to Double Up on Right Now	The software bear market has bled into other pockets of the technology realm, and some stocks now trade at a rare discount.	https://www.fool.com/investing/2026/02/20/top-stocks-to-double-up-on-right-now/?.tsrc=rss
2026-02-20	Yahoo	0.167	Software Stocks Are Finally Stabilizing. They Could Bounce Back.	Any trader that wants large gains must take some risk. The risk is worth taking in software right now.	https://finance.yahoo.com/m/ea5a86c9-fc4b-3be0-9277-4182ed6d9b72/software-stocks-are-finally.html?.tsrc=rss
2026-02-20	Yahoo	0.1	AI Investment Shines in a Sluggish Economy	Even after accounting for the effects of the federal government shutdown, AI represented nearly 60% of the growth in the U.S. economy.	https://finance.yahoo.com/m/e99040e2-dbb3-3edc-9ddc-1281bc5467c4/ai-investment-shines-in-a.html?.tsrc=rss
2026-02-20	Yahoo	0.057	OpenAI expects compute spend of around $600 billion through 2030, source says	Microsoft-backed OpenAI expects more than $280 billion in total revenue by 2030, divided nearly equally across its consumer and enterprise units, according to CNBC, which had reported the development earlier.  Altman had said last year that OpenAI is committed to ‌spending $1.4 trillion to develop 30 ​gigawatts of computing resources — enough to ​power roughly 25 ​million U.S. homes.	https://finance.yahoo.com/news/openai-sees-compute-spend-around-223950561.html?.tsrc=rss
2026-02-20	Google	0.0	(MSFT) Stock Market Analysis (MSFT:CA) - Stock Traders Daily		https://news.google.com/rss/articles/CBMijAFBVV95cUxNTk51STVOU19tcV9VcnhZQnJQWXdGdjZxY1NmcWVnQVlQUUdIaEFHTlBSampSTHVib1lQUkdJVjV6Y2FIQ3JwUjJCcm5oUHlXaElyZVNRa0ZqV1hBVkdVRW9zdElsOHk3N1pfcldGdUowcFA0Ul9XcG1DZWE4c2VzRnVZOHk3bklBb3UyZg?oc=5
2026-02-20	Google	0.0	AMZN, MSFT, NVDA, SFTBY setting $100 billion on fire - thestreet.com		https://news.google.com/rss/articles/CBMilgFBVV95cUxOUlUyRjFIcDJkY2pJMThLbE9KUlJreFlab2FMTlhwOHNSV2ZCWFlpRkRuUWRsR1Y5S2phZ2NVelVuYkQ5RWVNQzJxUE9Rei1ZekUzMGhkY2QxcldvcmJmMGdZdmUxd09nOFhBcUN2ek1CdWFOXzVmaklmaDZFOVNHcG02R2JDOVBLRHJRRGNLZWEwS0ZkNkE?oc=5
2026-02-20	Google	0.0	ETFs to Buy as NVIDIA Nears $30 Billion Investment in OpenAI - The Globe and Mail		https://news.google.com/rss/articles/CBMi2wFBVV95cUxOS2gzaGhCaDBaZzhodjZsUGlFWFdNTkwyclNPOW90VDJ1Ml8xV3M1dE82Wmc1ZG05MjlPeTl0dEpxMmJBd0Rrck5RbFJXTmRtWUQwbDJPblhJR3BvSzRLVTJjTHNLWHVKbUdQZXFMeUFxdUFBZEJwUHI2ei1WYVdVZzViUHh0N1BDd0h2QlAtWEsyWEY0WC1WWHRyYUV3bU1aWGNSa25OYXFwT0tQcEtYQnRWYmZjY19mMF90alQzZDA0eHlYSERRQ3BPY0ZNXzJIS1lWZm5yRHV0VjA?oc=5
2026-02-20	Google	0.0	Gilder Gagnon Howe Trims Microsoft Stake, Sells 7,174 Shares - The Globe and Mail		https://news.google.com/rss/articles/CBMi3gFBVV95cUxPVGVTYm5JcWM4OEFOZjFfcXdueUUtVFRxTEYxNmZaVVNKZHlDUFN6eldiY19QTElhRm03WjIteEdKaXl3dEswem84d3VsVk93bTBNbmVUUlVnbGN5cG03azQyS2RlTU5uSVFKeVVDaHd1R0YtdlZTWkVZMnY3Z1BfNkVZMkhMUExjSm1VZkF2RTh3U1pBeXJXelNZSUg2UzN0ZHNyUkFnT0RkejlnZzUxVTlrZEI0UzQ3OFA5QVVlaFVaSkRndkNsUVkzUzRTSmg3aEZZX281MEZYTVdiQkE?oc=5
2026-02-20	Google	0.0	Gladstone Capital Management Trims Microsoft Stake by 21,789 Shares - The Globe and Mail		https://news.google.com/rss/articles/CBMi5AFBVV95cUxNRjN5V3lMR3d2YjV5SmpSNXF5cGtlbjVXd3FPVnM3N2Y1MHBNN3BERXFGdmxEZ1BpbkdsZFY2c3dHdktxT05INVRNUW5GQVVVUzNQNnRGT1F6a0plSHItVjdMN283R2pUSk1UT2lFSXVKUW8zc3k2bGs3aDBQUnhmTjhDUzBwSTktSmtKaUs0MXVQLWZ5UFZDWFJDSXBLbWxDbW51LUdrVVlvVmhfRlZjdzMxTFVrX1Z0aU9ibVRhWDZWSzdodWlMbXh4eHI0TUMtSUpDRzNxMm96Wm1HaEZKd1FkUkI?oc=5
2026-02-20	Google	0.0	MSFT Stock Today: February 20 – $2.5T AI Forecast Backs Incumbents - Meyka		https://news.google.com/rss/articles/CBMilAFBVV95cUxQRlFFMHZYRXVhaExDN05sX2VCUkJQNlFmaFZabHNSeWZqSG5FOTBYN3hhU0dWeUZScjQxWmZ1YkZsbzAxMFVCd3QzWlRTa0NHbHBiN3VKV3U5LXNEMDNrcFEtTm41M3JSX3ZrdFpyb0p1dlBWNWRPajg0SFdvWmVWaWpETlRmb1VEalBpVWsydDdzUWlP?oc=5
2026-02-20	Google	0.0	MSFT Stock Today: Retail Dip-Buying Climbs amid AI Jitters – February 20 - Meyka		https://news.google.com/rss/articles/CBMinwFBVV95cUxNRHA0NF9iV3pXVF8tNTZBcEc4cy15blVyVGRzRlcyY0ltLUo0a25Wb21YYU42ZHZzeTlIWFBlVnBScS1hVjJUczlzalJKQlNFQTBHUE9DUGc4Q0pBZnpXajk3NDFnR2hjQ2VJaU1GUGZScFNPZW9TVzc0b2lRS2huQXRkTnVKZUlacXNCanV0aEhGMlgyQUhpcUNQYmRZeUk?oc=5
2026-02-20	Google	0.0	Microsoft (MSFT) Surpassed Q2 EPS Estimates as Cloud and AI Demand Accelerates - Yahoo Finance		https://news.google.com/rss/articles/CBMigwFBVV95cUxOWU9wdWZMbWtuV1ItMXRWU2p5UWpsUEwzRzl0WjVtSURxaDIxeHZCN05NSDU4T0l0T0dCUUF3azFpbnBxZlNhZEd1MmsteVhMUnBzd0ZIZ3AybUtuU1dkcDNyWUl6V21wS3hwczUzalFGVkxNNG1JZk5OSV9JWWFPcDhaZw?oc=5
2026-02-20	Google	0.0	Microsoft (MSFT) stock price dips as $2 million insider buy surfaces; traders eye Nvidia on Feb 25 - TechStock²		https://news.google.com/rss/articles/CBMitgFBVV95cUxOVFVYNERLYTRjNWRTLXRKdk1yeVZuZjFNZ0RIalRQMTlIUnljWHFaVUhfX01tMmxjSzNwbGVyYmFvVzJHc0dVa2VrSVlLLUtqaWZyVVFMclc5UGRtUFlIcURXRnZLQVZfdDd3d1pXVnVzdGxwNlZpcDdRQXdPVU9sUUU3cWt3QXRsaW1tN3RaWFF6RXFKNXRzYmV1WG1zV2hRNGVnZkRud2hKRUtaM2t2cnJBSFdIUQ?oc=5
2026-02-20	Google	0.0	Microsoft (MSFT) stock slips despite director’s $2 million buy as AI spending stays under the microscope - Bez Kabli		https://news.google.com/rss/articles/CBMixAFBVV95cUxOR3lzeUhuUUFnakVxcjNzb2plRGxjZUxTM0ZpUTR5bUZPVnlrTjc0UDA3Qm90cTFmVjNBd3R5X1Q0UUVpcEJuQ1VpQU1SZlBKV3owcjdZbXBXcTR0R0FQdzJFempwRGZzLWF4ZUlqeEdOMVFBTHRsRzZRbUlEMG54akl6b0Q3UU1NUHBfQXVuOFBsZzM4NmhKa0NBWGVLM05IRE1GOF9tQmw2NHprZWlySHRHSjU4SXl4dkY3bDYyMmZJZjFC?oc=5
2026-02-20	Yahoo	0.0	Microsoft Names Sharma to Lead Xbox, Recommits to Console	Spencer, who has run the Xbox business since 2014 and was named gaming CEO in 2022 is retiring, the company said.  Xbox games studios chief Matt Booty will become chief content officer, reporting to Sharma.	https://finance.yahoo.com/news/microsoft-taps-ai-executive-run-202809602.html?.tsrc=rss
2026-02-20	Google	0.0	Microsoft Stock (MSFT) Opinions on Citi Buy Reiteration - Quiver Quantitative		https://news.google.com/rss/articles/CBMilwFBVV95cUxQZEpOTEc3Ri0zVlR1NE1vSThfVGdCdjZ6dEFpYTdnemZiMFhBWWZsT0Q4SU9MSVhwbVhNWmFXd21FNFFMQlBka2p5WjEzMkNZYUJKSXRFOVJmVDh5WGJ6RVRGdnpQWG5BZEE4MlhEZlk2MGpJYUxtV0VDd2t5Z1M4aVlJaGE1MU9pQk5SMXloVkdZT19xVHgw?oc=5
2026-02-20	Google	0.0	Microsoft Stock (NASDAQ:MSFT) Slips as its Prominence in the Carbon Removal Market Emerges - TipRanks		https://news.google.com/rss/articles/CBMiuAFBVV95cUxNdVRDMXE1MnBfZW5yUEVKSE5FeWQ4UV9BSGxHMXAtY0VQQUJjS1ZwNFBUUEdlR3hoUGFUcnp5UlY1Tko5VlZza1FsQmpTS2hpN0pwSlpDallfa0pSMmRHZW9ld09pWXhHUWxQSlNaT3FlZ2JFYlBPUEZUemNZOFg3V3M4QUpoN3NCX1dBMFg3VnlrUW05N253T3N4XzBKb2tGZkpGRzd6T3pYQXE4dWlqbU1VS3YwRnVt?oc=5
2026-02-20	Google	0.0	Microsoft Stock Forecast | Could AI Strategy Lift MSFT Outlook? - Capital.com		https://news.google.com/rss/articles/CBMikAFBVV95cUxNNFRPbS1MXzVKUnBiSzViS2JkVHJNcmQza0FLNElubXNlaFZEMC13THVWMkhJNVRtS0k0SmxETEtlQ2ZIaV90amwwc0ZYVGRRUm1hQ2NCbmtGV1BLZkVZclR6ZVZHS3JtancweFEwaWV4NEw0eWlnRTBaUjNycU9CTHZXUnlGcEJURW82TjVXci0?oc=5
2026-02-20	Yahoo	0.0	Microsoft Stock in Focus -- Citi Reiterates 'Buy' Rating on AI Cloud Momentum	Microsoft Leverages AI Tools to Expand Enterprise Software Reach	https://finance.yahoo.com/news/microsoft-stock-focus-citi-reiterates-205129921.html?.tsrc=rss
