Date	Source	Sentiment	Headline	Summary	URL
2026-03-03	Yahoo	0.19	Reeves seizes on OBR forecast to say UK economy is on the right path	The chancellor defended her plan as the ‘right one’ as growth forecasts were cut and the Middle East conflict continues.	https://uk.finance.yahoo.com/news/spring-statement-live-rachel-reeves-latest-interest-rates-083708478.html?.tsrc=rss
2026-03-03	Yahoo	0.167	Market Uncertainty! WBT Token Defies the Trend as Kraken Confirms Listing: 3 Resilient Assets for March 2026	Headlines about escalating Middle East tensions and conflict, leading to a global catastrophe, and World War III, led to a quick dip for Bitcoin that was immediately bought up. Is Bitcoin beginning to decouple from traditional risk assets? It is behaving less like a tech stock and more like a ...	https://99bitcoins.com/news/altcoins/wbt-token-defies-the-trend-as-kraken-confirms-listing-3-resilient-assets-for-march-2026/?.tsrc=rss
2026-03-03	Yahoo	0.137	Bitcoin ETFs See $458M Inflow: ‘Geopolitical Dip’ From Iran War?	It feels like the sky is falling again, doesn’t it? If you have been watching the charts lately, you have likely seen the Bitcoin price slide aggressively toward the low $60,000s, testing the nerves of even the most seasoned veterans. That familiar knot in your stomach is a shared experience ...	https://99bitcoins.com/news/bitcoin-btc/bitcoin-etfs-458m-inflow-institutions-geopolitical-dip/?.tsrc=rss
2026-03-03	Yahoo	0.103	Antalpha Platform Q4 Earnings Call Highlights	Antalpha Platform (NASDAQ:ANTA) reported what management described as a “strong fourth quarter” to close out fiscal 2025, highlighting rapid revenue growth, expansion of its loan book, and a sharp increase in profitability metrics despite a decline in Bitcoin prices during the quarter. On the compa	https://www.marketbeat.com/instant-alerts/antalpha-platform-q4-earnings-call-highlights-2026-03-03/?utm_source=yahoofinance&utm_medium=yahoofinance&.tsrc=rss
2026-03-03	Yahoo	0.1	Four Headwinds Stalling Bitcoin's $70K Breakout	Bitcoin pulled back from Monday’s peak near $70,000 as geopolitical and economic headwinds hold a recovery rally in check.	https://decrypt.co/359786/four-headwinds-stalling-bitcoins-70k-breakout?.tsrc=rss
2026-03-03	Yahoo	0.094	Wall Street and FTSE continue sharp sell-off amid Middle East conflict	The downbeat sentiment came after the US and Israel began more attacks against Iran, intensifying the Middle East conflict.	https://uk.finance.yahoo.com/news/ftse-100-live-london-slumps-middle-east-crisis-us-iran-israel-oil-gas-prices-091931875.html?.tsrc=rss
2026-03-03	Yahoo	0.058	Coffee Prices Erase Early Gains as the Brazilian Real Falls	May arabica coffee (KCK26 ) today is down -2.70 (-0.95%), and May ICE robusta coffee (RMK26 ) is down -69 (-1.83%). Coffee prices gave up an early advance today and turned lower, with arabica falling from a 1-week high and robusta sliding from a 2-week high. Weakness in the Brazilian...	https://www.barchart.com/story/news/539221/coffee-prices-erase-early-gains-as-the-brazilian-real-falls?.tsrc=rss
2026-03-03	Yahoo	0.014	Brazilian Real Weakness Weighs on Coffee Prices	May arabica coffee (KCK26 ) on Tuesday closed down -1.45 (-0.51%), and May ICE robusta coffee (RMK26 ) closed down -67 (-1.78%). Coffee prices gave up an early advance on Tuesday and settled lower, with arabica falling from a 1-week high and robusta sliding from a 2-week high. Weakness in...	https://www.barchart.com/story/news/542603/brazilian-real-weakness-weighs-on-coffee-prices?.tsrc=rss
2026-03-03	Google	0.0	BTC/USD – Upside potential after initial momentum up yesterday [Video] - FXStreet		https://news.google.com/rss/articles/CBMixAFBVV95cUxQN2pZcjU4Q1EwblU5dEE0ZHhkQ0ZaMXBhemlmZmFBb3BDa3d2RU1jVG9UQ3MtNGhPdC1SbWluZXQ3UjE0alpiejJRb3JMTkpWd1NFOG5sWFZrZmU2VV9iZDJ5eVlObEdJMTFRSk9CeFhmbUxSLXNKODh4cVo4QXN2YzdTQXVqamUxaTRUMTZHb1JMUWJ4REdhc2t6bWxXQV9lV3hadnk0N0JiTW1RTWtZRS1oY2l4MHVVdk9MYzRPTVR1bEE50gHKAUFVX3lxTE9wQmlmdThLcUNjYW5IOERBeEp6b1RJakNZTzJOS1U0UXJQZTlHWjVjLVVBekV4aXNMRkV0VmpjdHRubGNsdERuTy1yeVhMdFZSZkx0LWFTR1RJeUZlc2VXQkVQWExObWdLTXRCOEdtSElsSzVXT1dFZFh5Q1BBQVR4ZjlHVW9lMEFsZEhoUk9fYXNxdURNbUx6Z243ZDM3eHlrZ3dVWW56YURKa1hoTVRYdWVxaUFLelNYc0VFcnRJaEhLeGFDX09zX2c?oc=5
2026-03-03	Google	0.0	BTC/USD: Bitcoin Prices Whipsaw as Crypto Traders Seek Direction amid War Tremors - TradingView		https://news.google.com/rss/articles/CBMi2gFBVV95cUxNdjRyN2J4RkpvZ21CUXc3WFVsa1FOZ2pDdktSdlVDN05ELXE4ckhiNnlPWW02VFRKQmEta2JERDROS0JoVnUxVHlWVVA1MHZpYkZQUExKWlZmWlNPQUZ2OFpqT1ptUUUtWFF1cnM2djBzTnQ5QUZNajJPSXJqNVBtZ0NYQ3BtV3FSbThmR2M5aFJvTUxPN1pFVWhkRmlMS081dUE5Ql9qRV9qZ3pNMmc0d2R5V1B0M0JGVmlJSVhhNWZpenFsWUN1b1lleTAtWFFUdjhBVzFnLTU3dw?oc=5
2026-03-03	Google	0.0	BTCUSD Today, March 3: Haven Bid as Iran Threatens Hormuz Shipping - Meyka		https://news.google.com/rss/articles/CBMimAFBVV95cUxPUVlPWUlyVkk5aUFFVzN5U1FUN3hJTzhUbHJSenN5YXNmMUYzQ0JWbjNrVzU1eTg1bVE1bmdFUWFCZkRZYWFGenlXU05vOGZIN1h6VGxtNnNYaE9yY1c1MkhPeHBkLXRPcklMTTlBaE0wWUplVlhnU2dtTWdtZlZELTVpYVBRQlFUb21VVzA4MFNzZUFZMWN2TQ?oc=5
2026-03-03	Google	0.0	Bitcoin Price Not Yet Bullish as M2 Hits Record $22T - The Coin Republic		https://news.google.com/rss/articles/CBMimwFBVV95cUxOdXpNWHFEQmdjZXkxWUZ5ZTZCUUQ0cm5pN2ZKMVdmWV8xN1JIc2llOUthUF80NXF2U012N0p6dmlRVFFTX0JsTC0zcXJQZjlabUhMd3dkRWUtbDVkZTVGWDhhQ1hNM1R6a3lKdUtsUW0yUGFuRDU4TG9FY0R4S1lLenRmcnlkN016eXVGb241Vnh1bnJEY2lGRVM5ONIBoAFBVV95cUxPRWJZb2piNWhocjFzZEtnQzBHYUtweHRUR1ZCeDkxODhWZURwcUVYcWVPdmdJTVhzWUdVcFVKWjBRYTQtMnplWGtEUFVuSFdjOWJ4bk8xNjc3WFF0Y0VrWUpLXzNicFphcnVmcjNOVkxMOVQ4S3B3RUJCaW1TTHdtYW8wVkpkOTJqa3VJRmNpRWhrY0hEcXRZUS0wYkRqZ0t2?oc=5
2026-03-03	Yahoo	0.0	Circle Stock Extends Double-Digit Gains Amid Broader Crypto Rally	Circle’s post-earnings breakout gains continue to rise as USDC growth, policy shifts, and macro volatility converge.	https://decrypt.co/359772/circle-stock-extends-double-digit-gains-crypto-rally?.tsrc=rss
2026-03-03	Google	0.0	Crypto funds record inflows of $1B last week: report (BTC-USD:Cryptocurrency) - Seeking Alpha		https://news.google.com/rss/articles/CBMikgFBVV95cUxNVy1OMjRXeTVFTS1ja3lIbXNyWkRTb0RFalItMmhYSlZUMTFVVFBBekpJSnVLLW9kZ2pIUXFoeFlQZEVVSVJwYU5nTUlVQmR5bmtpakxPZElUVEkzdGJmUno4TmJmQ1h2RWp3bEZubXd2cXg0eks3ZV9vazFQVURUSGFJcHRSNWJySXFBWlJWejc2dw?oc=5
2026-03-03	Google	0.0	Forget Iran, Bitcoin's 2026 Path Will Be Determined By These 2 Factors, Jan Van Eck Says - Benzinga		https://news.google.com/rss/articles/CBMi4AFBVV95cUxQRlczZUVQMF9YTFcwbm01WjhyNHlkdzYzSGlsZXNiUnhsbWdrU1VSZm1UZ1p0Rm40Y2pNSW1IaTJnWElUb3FxRFVJNkRRT3hTUWRESVFDaTFEdTlldVhVSUMxdmFyOGVQbmhkY2Y1bEZVeWhsRThZLXZFQkR3Tm5GNVhVUy1NZzZCZzdzZ1A2TnlGQzNyVUJYc19pNlIxUUc3UmFRQ3hGaWpvRzRKbEJZWG9XWEtaMjZoS1BrMUhGTVFWNWl4SUVyWE9EQkxaa2FkQ0RNLXIxT2locmRMTkZ2cg?oc=5
2026-03-03	Google	0.0	Is Bitcoin's (BTC/USD) second $70k rejection a “buy the dip” opportunity? - marketpulse.com		https://news.google.com/rss/articles/CBMipAFBVV95cUxPdllqY1BQYnctcW0wcVFvRWVVcW5YV1RaYVhmWFF2MVpkbC1QR2JCOGU1TFAtUVktempZNTV1Y0JaWWpySWpicW5wSks3dGVFTDdxZnpILVFjZWN3MTgzSTh6eGRFU2IzLUg3M3NkV3ZYYXk2VTFBZVlUUFNvTGNGbEJPMGNNVnRaYkU5ODdmRTNCSkw0SWZxVkZPMUZXSnNnUXNBeA?oc=5
2026-03-03	Yahoo	-0.125	The currency market is pricing in a supply-side inflation shock	As war in Iran rages on, foreign exchange traders are adjusting to a rapidly escalating supply shock.	https://finance.yahoo.com/news/the-currency-market-is-pricing-in-a-supply-side-inflation-shock-165406892.html?.tsrc=rss
2026-03-03	Yahoo	-0.3	AutoZone Q2 Earnings Call Highlights	AutoZone (NYSE:AZO) reported fiscal 2026 second-quarter sales growth of 8.1% to $4.3 billion, but earnings per share declined 2.3% to $27.63, as management pointed to a sizable non-cash LIFO charge and weather-related disruption late in the quarter. On the company’s earnings call, CEO Phil Daniele a	https://www.marketbeat.com/instant-alerts/autozone-q2-earnings-call-highlights-2026-03-03/?utm_source=yahoofinance&utm_medium=yahoofinance&.tsrc=rss
2026-03-02	Yahoo	0.267	Bitcoin Dropping to $60,000 Could Crush Every Stock Inside This $1.2B ETF	Most ETFs give you sector exposure. The Amplify Transformational Data Sharing ETF (NYSEARCA:BLOK) goes further, concentrating in companies structurally tied to blockchain adoption — crypto exchanges, miners, Bitcoin treasury holders, and fintech platforms building on-chain infrastructure. That’s a compelling mandate in a bull market, and a punishing one when Bitcoin turns. Investors are feeling both ... Bitcoin Dropping to $60,000 Could Crush Every Stock Inside This $1.2B ETF	https://247wallst.com/investing/2026/03/02/bitcoin-dropping-to-60000-could-crush-every-stock-inside-this-1-2b-etf/?.tsrc=rss
2026-03-02	Yahoo	0.25	Dollar Strengthens After Attack on Iran	1543 ET – Treasurys sell off, sending yields higher, as the U.S. and Israel bomb Iran in an escalating conflict that disrupts energy markets and sparks a flight for safety.  1538 GMT – The dollar’s outlook depends on the outcome of Trump administration’s conflict with Iran, Macquarie Group’s Thierry Wizman says in a note.	https://finance.yahoo.com/m/66daf018-6363-3db6-b740-ad7330b68df6/dollar-strengthens-after.html?.tsrc=rss
2026-03-02	Yahoo	0.156	This Blockchain ETF Is Quietly Becoming an AI Infrastructure Play	Most ETFs promise diversification. Global X Blockchain ETF (NYSEARCA:BKCH) takes the opposite approach: concentrated, high-conviction exposure to companies building digital finance infrastructure. That focus has delivered a +57.9% gain over the past 12 months, but also a -19.6% drawdown in just the past month. Investors who understand what drives this fund will be better positioned ... This Blockchain ETF Is Quietly Becoming an AI Infrastructure Play	https://247wallst.com/investing/2026/03/02/this-blockchain-etf-is-quietly-becoming-an-ai-infrastructure-play/?.tsrc=rss
2026-03-02	Yahoo	0.152	Bitcoin Fell 36% Fast and The BITQ ETF Felt Every Bit of It	Most ETFs let you bet on a sector. Bitwise Crypto Industry Innovators ETF (NYSEARCA:BITQ) goes further, concentrating exposure across the entire crypto economy: stablecoin issuers, Bitcoin treasury companies, miners, and exchanges. That breadth is both its appeal and its vulnerability. With $412.7 million spread across 31 positions, BITQ offers broad crypto exposure that has been ... Bitcoin Fell 36% Fast and The BITQ ETF Felt Every Bit of It	https://247wallst.com/investing/2026/03/02/bitcoin-fell-36-fast-and-the-bitq-etf-felt-every-bit-of-it/?.tsrc=rss
2026-03-02	Yahoo	0.111	Bitcoin v/s WW3: Why This Isn’t a Market Crash and What It Means for Your Portfolio	Headlines about escalating Middle East tensions and conflict, leading to a global catastrophe, and World War III, led to a quick dip for Bitcoin that was immediately bought up. Is Bitcoin beginning to decouple from traditional risk assets? It is behaving less like a tech stock and more like a ...	https://99bitcoins.com/news/bitcoin-btc/bitcoin-ww3-fear-market-crash-portfolio/?.tsrc=rss
2026-03-02	Yahoo	0.111	ProCap Expands Bitcoin Treasury to 5,457 BTC — Closing the NAV Gap	Headlines about escalating Middle East tensions and conflict, leading to a global catastrophe, and World War III, led to a quick dip for Bitcoin that was immediately bought up. Is Bitcoin beginning to decouple from traditional risk assets? It is behaving less like a tech stock and more like a ...	https://99bitcoins.com/news/bitcoin-btc/procap-bitcoin-treasury-nav-gap/?.tsrc=rss
2026-03-02	Yahoo	0.104	Michael Saylor Once Said You Should Master This Technology To Get Wealthy: Bitcoin Billionaire Wants People To Set Their Egos Aside To Achieve Success	Strategy Inc. (NASDAQ:MSTR) co-founder Michael Saylor has been one of artificial intelligence’s biggest proponents, and not long ago stressed the importance of mastering the technology to generate wealth in the modern era. AI: Pathway To Wealth? In his keynote address...	https://finance.yahoo.com/news/michael-saylor-once-said-master-213015903.html?.tsrc=rss
2026-03-02	Yahoo	0.094	The Real Cost of Investing in Crypto: Fees, Taxes and Hidden Charges Most People Don’t Know About	Understand the real cost of investing in crypto, including trading fees, taxes and hidden charges that can quietly eat into your returns.	https://finance.yahoo.com/news/real-cost-investing-crypto-fees-172141182.html?.tsrc=rss
2026-03-02	Yahoo	0.077	What Would Push the XRP Price Toward $5 Or Back to $1	XRP is doing something strange right now as institutions keep buying despite the price falling. Since November, XRP ETFs have pulled in $1.24 billion with barely a red day. In February alone, XRP products logged positive flows while the broader market sold off—Bitcoin ETFs shed over $4 billion in a five-week stretch, and Ethereum products ... What Would Push the XRP Price Toward $5 Or Back to $1	https://247wallst.com/investing/2026/03/02/what-would-push-the-xrp-price-toward-5-or-back-to-1/?.tsrc=rss
2026-03-02	Yahoo	0.064	Bitcoin’s Wild Ride Makes This Options Strategy Strictly For Profit- and Thrill-Seekers	Bitcoin has been on a wild ride lately. And a wild ride calls for a wild options strategy. Here's how I'm playing Bitcoin right now.	https://www.barchart.com/story/news/519541/bitcoins-wild-ride-makes-this-options-strategy-strictly-for-profit-and-thrill-seekers?.tsrc=rss
2026-03-02	Yahoo	0.012	Hyperliquid's Token Rises as Weekend Iran Shock Finds Few Open Markets	Hyperliquid's token is trading higher on the day as traders use the always-on venue to speculate on ongoing tensions in the Middle East.	https://decrypt.co/359570/hyperliquids-token-iran-shock-few-open-markets?.tsrc=rss
2026-03-02	Yahoo	0.006	Why Is The Crypto Market Down Today?	Crypto market cap holds steady as Bitcoin consolidates, gold surges, and PIPPIN tests support amid shifting investor sentiment and risks.	https://beincrypto.com/why-is-the-crypto-market-down-today/?.tsrc=rss
2026-03-02	Google	0.0	BTC USD Tumbles As Iran War Rocks Market: Retail Defy Dip – HYPER ICO Nears $32M - ICOBench.com		https://news.google.com/rss/articles/CBMiugFBVV95cUxQeFhHZUNXUUl4S1VNeFBDQ3FDRUcyNVFoclNMTWZ6YS1lZnF6alAzbzJkdGlQdGxPa1VTSURkcVZGUEJhMWY4YjRYMWhkRW1teWFlNHhmekxsb2FzNnRMMFp5ZXpPOGYtdy14ME5UeDEwRTVmUk9qVjNaOS1Ea3gxQUs2R3BackNGbGNGQzlFSlVDUk5jNWRsMHhuREVwTzlhTGEwS1U1U29Jd2pyTm84a0JLM2hnZ3lKU1E?oc=5
2026-03-02	Google	0.0	BTC/USD Forex Signal 02/03: Bearish Outlook as Geopolitical - DailyForex		https://news.google.com/rss/articles/CBMimAFBVV95cUxOWVdacmhfTTVUM0MwVWhTdXVSNVB3WEZXZUNWTmVBT24yb2dIT2hERGpFWWIzMHctNDMtQlhEQlpKLTMzeHN6b0hyU1RWNmprV182ZnpST2w5QmZpWEFBNEZuekdpMllWbUg0dEdRRlMtTEVhVl9JNi1PRmJtdEJyM2tGeWl3X3lCLUF2Yjlvb1VNUktfU3B3TA?oc=5
2026-03-02	Google	0.0	BTCUSD Today, March 02: Gold 'Bretton Woods III' Debate Lifts Haven Talk - Meyka		https://news.google.com/rss/articles/CBMingFBVV95cUxNb095Rnl1NW5FVHhndklVY1p5el95ZXl1THVFWGVDMUs3My1HQUdMbW5rVVFBS3k0MzNsWU55NlpjUVktck9FSm94TFVuUXo3ZTN0NVRyZUk2eXV6RWRNbFpQdF9CQnFzMlNMY0FvZTRTeG9NQmlWMHlpYWR2NFZGMDAtRE0wRTBNVUlXeFZWZzQ4MEszVVo5R1dGSXFXUQ?oc=5
2026-03-02	Yahoo	0.0	Bitcoin Spikes to $70K as Trump Says 'Large-Scale Operations' Continue in Iran	The price of Bitcoin immediately fell following bombings on Iran this weekend, but then surged Monday as markets began to recover.	https://decrypt.co/359626/bitcoin-spikes-near-70k-us-operations-iran?.tsrc=rss
2026-03-02	Google	0.0	Bitcoin rises 5.2% amid U.S.-Israel-Iran conflict (BTC-USD:Cryptocurrency) - Seeking Alpha		https://news.google.com/rss/articles/CBMiiwFBVV95cUxNWjA5cGFwWFRmUWJ3Zl9JcFp1NDNFblU2b3NwaFY1U0R3QlpqRnRMN2NEam8yZ3VLSFhDVU9rdVVZZms1eHRLNkNFbXpCWTZUM09MX0Z5QlY2UVoyM3k0X3lPc05kNnNURXltTUtwZEhKUDgwODhfU1JOcG9RaGZJQTgyUTc3cFRsQWNF?oc=5
2026-03-02	Yahoo	0.0	China greenlights cross-border funds for Fidelity and JPMorgan AM – report	The approvals from the securities regulator came as China's central bank implemented measures aimed at curbing the yuan’s appreciation.	https://www.privatebankerinternational.com/news/china-fidelity-jpmorgan-am-cross-border-funds/?.tsrc=rss
2026-03-02	Yahoo	0.0	What the Iran Conflict Means for Bitcoin's Price	Attention has shifted to whether the Iran conflict remains contained, as Bitcoin traders weigh elevated oil prices and a rising gold price.	https://decrypt.co/359562/what-the-iran-conflict-means-for-bitcoin-price?.tsrc=rss
2026-03-02	Yahoo	-0.007	Magic Eden Shuts Down EVM and Bitcoin NFT Markets to Focus on Gambling	Magic Eden is officially done with Bitcoin Ordinals and Ethereum NFTs. The platform just announced it is shutting down these markets to shift toward “Dicey,” its new online gambling platform. It is a brutal, sudden shift that leaves multichain users scrambling while the company chases casino revenue. Update on @MagicEden ...	https://99bitcoins.com/news/altcoins/magic-eden-shuts-down-bitcoin-evm/?.tsrc=rss
2026-03-02	Google	-0.156	Bitcoin Up or Down - 5 Minutes Predictions & Odds - Polymarket		https://news.google.com/rss/articles/CBMiY0FVX3lxTE9kX1BOMzlTdW5rNkpKNF9rWnpCRnJxRWtmVzRyN05ZclFqS2VMaWpucjc5RzhteVNuQm1mNkRrUkxQXzhmWUQzSElfSkV2SW1iaksxUmtpTmdhZHFpekg5Z1hVbw?oc=5
2026-03-02	Yahoo	-0.25	What to expect from Rachel Reeves' spring statement	The update could impact future spending decisions but is unlikely to deliver fireworks	https://uk.finance.yahoo.com/news/rachel-reeves-spring-statement-budget-predictions-114815743.html?.tsrc=rss
2026-02-28	Google	0.0	Bitcoin Slides Below $66,000 As Inflation Cools Rate Cut Hopes - Seeking Alpha		https://news.google.com/rss/articles/CBMinwFBVV95cUxNdmtOWGFWb0FFWm02MktreGF2WEZtbkJJTXEyYmo4OTNSb3RzbEw3a1AwX05PUGZESktBZlRSZVNpajZRS2hDM2E0RUdqeEU5VzREUnZNUVE4UGNrdG9uUFRlNlFXMXpvNDI1TnBpMGw4Z0hRUlJkU2VCc2J2S2REQ0JJSjMwYmVkVU1uZnYxN0JtbUtwYWNPY0Jvb3RSVnM?oc=5
2026-02-27	Google	0.0	BTC/USD Forecast Today 27/02: Bearish Pressure (Video&Chart) - DailyForex		https://news.google.com/rss/articles/CBMioAFBVV95cUxOTURrZVZnZmcxcjg4UlNfVkJyNzBkMVZqRWR4cG1yUlhNZW56REZDWHZPU243WWFzemVUODU4SjRaV3g1MUdreGg2QkVfTGlHLWtZZ1RKa1kzM2pmTmVJUFA1TWZIOVFiUGxCdDJMbV8zbHI5WHUzUUVNMzJyRGFhQmg5M1BpbXluT1pvdkd4TUMwRkFCcHlobXNsdDFCZjNK?oc=5
2026-02-27	Google	0.0	Is Bitcoin’s 'Digital Gold' Narrative Losing Its Shine? (BTC-USD) - Seeking Alpha		https://news.google.com/rss/articles/CBMilwFBVV95cUxNOVJHc1NhbjVuZEFOTGRfdjFKMkpldWhrZmcyd2poVHEyZFB5VE1LZ2Z6eGppNVc2LU5TU19la0tmSTlINFRSZGIycklQM0RzS3ppR3Atam5YWG9fcVA5T3MxUFRvb29QQVpMeEhLRDdlTE5mOENCUHcwQVU2Tm0tQy1uai1qSzk4andBMndrU1BUN1dKTWJZ?oc=5
2026-02-27	Google	-0.4	BTC USD price today drops to $65,000 level: Why is Bitcoin on track for its worst month since 2022 crypto - The Economic Times		https://news.google.com/rss/articles/CBMikgJBVV95cUxOMXQwaEd2YVVULVJTVW96bHhYdTFSdVZaQ3RaQjd5YlBfUHpNakVERDlwdGNaajNzSG9QM1Y1bDVRNjV6WTVKcXZROXZYTzAweW8xejdHYm9nbzg4Y0JhaF9RdFRka3N2RlI2UGFmVFNKRmJReEJHeG9QaDJReUxCbkQ2ZDJ3d0c4MGFWRUJiX3lXTkdwNEhLWWZyTGlHUmdWdnBwNzZGSDQ0eXRNQmZHOHJxaElpcV8yYU1KMkxFOWQxalVPMENzZkZWTE1DajY0eU9lSWJPVGZ2bHAteUl0Q3NzSDFBT0VuNFMtbmFrYTRCX2treUp6aU9xOW1EbFBESDJJTVFWdzZ0U0dhMUt4VlJR0gGXAkFVX3lxTE5GcHZKMl9MYmoyQ1lGMUNBYm5vV0ROekZ0WnhpdmMwRHhxcXFUbWd2UVJ5bTlucUUyQTYxc3l0RDNXbzk5aGdISlZKbUZnNmtRWEFvWE1paWk0aE1jRDRzMFhRcm5lTHRoaW53WUFSNHFOWWt3MXlXU241SHRHWHRHSjJ5TDlFMHo5M0JHaHZ2Vy01MXBhdTRlcXIweEZfMFJOX1V0MVNNbjA2bktvTFd1VmZOQ3JKMGl3REVWUjM5elZGREh1T2hqMWp0czdEcXRadnVTU2xORzBlQ0dqM3pyTlRUQ0FRbnNGVmF5clBTdWtVYklKWWotY3AyVDRzb0FBdll1Ny1JdGoxSFNYWThtM21DSjNBaw?oc=5
2026-02-26	Google	0.0	BTC/USD Forex Signal: Bitcoin at Risk of a Retreat - DailyForex		https://news.google.com/rss/articles/CBMingFBVV95cUxONGlORmRuV2VLNzlYQTZGVTJzMmlFdFpOUE9Ob0lQM2RMVTBPaXJVZDRMX0ZncFpRc1Z4SktLRGtoVFVoODF5dVVUM2NNZEphMTFoNk1BLU9iVEdkeVQ1TnBxbExXc2RDUkJGdEJnampJYVhCOWkwT05kaU1Mc2FFbkxkZFllN1Q4Rm1XNFE0cUU2VlA1UGRaMXJfVERBUQ?oc=5
2026-02-26	Google	0.0	Bitcoin Mining Capitulation Nears End: Is a BTC USD Price Bottom Forming? - Yahoo Finance		https://news.google.com/rss/articles/CBMiiwFBVV95cUxPOTVtbFgxTjdtUVNNN0lYYmpPMS1XdjZQemxTZXNiVnZMMy1RZEdZWElQd21oendZWThzSWgzS2VSM25wV01tWUYtR0FIcmJzeFh6MnRmUlNGVVh5UW9pcjZNRzZyQndsVHMwR1hfV0pCNGdFbDZrOFp2UlVSYkwxM0FwNnAxN2lDVTJZ?oc=5
2026-02-26	Google	0.0	Technical analysis – EUR/USD, AUD/USD, BTC/USD [Video] - FXStreet		https://news.google.com/rss/articles/CBMimwFBVV95cUxQTE1McmJwb1BON0twcWVtVDk3TUFkMC1DNVlFUHhpb2tXck5sV0VSUGVCNkJvWk9MQ0FtUVpaOXBiMDdHdFVlXy1Fc0h0eU81ancxLUhyR3U4di15Q1NXRlBFamVhMEpxOE9wc2RqdTVMOXowZlcxdVZDRUdmaGhqbmNlaHQ3aHVVUVNlcFlWOEVtbU1kaW5QNXdQQdIBoAFBVV95cUxPRHRERDdRalJJb2FucjQwMHVKb0lYcm5MWlRuRUZrbWs2a3VGYThYOVViOG1JLUh6elNnVGNlaXM2QW5oS1JsdlpMRzFDWHRkWjRWa2RDS29PNEVXZkJQM1BOc0FVOHRFSldmSHBDdHA0MjNIT0NjX1FKSlNXMDZTTWl2aE1HTXV1M3BneGlzQThMbk5BTFNSVDkwM3JmMlVv?oc=5
2026-02-25	Google	0.038	Bitcoin (BTC USD) price today climbs toward $66,000 after sharp overnight swing — altcoins rally as crypto - The Economic Times		https://news.google.com/rss/articles/CBMiqAJBVV95cUxPVFRiX2p1X1JaUDZ3TmJFcHMyNkJWbHBGaWMyaEZWYW5IZjBiV0lFT1RwVEg5ZUEwaGt2blczTUtveVBteERidmZvbWlJMVZEdFZDcEh6aFI3MExfdmdndXpjXzRvOU5hdDlpOXhHMDdVSzloQk9aV3JBU1JOMzdXeGlES1VRS0M0NHhqUlNqeEQxLXJjZHhvUkxRY3h0TE1adU5lMzlWQk1QN1c0cDJMejl1bEZSV0J6WkdKTWZUUk9KZ3RWWlhTZU5NdEhfOGlGNVpCWVVOUHctU1BYNURqQXkyczA5YmR1c2V0Y003QWVyX2E4bXg1ZG9fYUoyb1Z2N01EYzNIMllwQkczOVk1Z3ZwTjNnOTRjbURFb1JpaGhCRXppcmRXOdIBrgJBVV95cUxNaGdJTDNMcjhwWTVnQlFwWkRVYmVwLTdhNFpfV2tFa0lVNkV0ZHBDQjdWaWpQS2R1cWE1WVQ1R00xaDhYZXMtWTFNVXB0RWlCV1pLRUtuMnlOMGs0d09VQjZWQjUyMHBRM0pMSW5XNGJ4R09EWk1IcXBqczc2LTNyV3g4WGxfZ2E1aGhZaDQ5NFZCSk1NS2JJVnFtVF82SjZZMjZEaGRiSmVDM015Nk40cGFmT090dXRqVnNzalM5eUxNRXp4T2RrNl92S29IbjRsMGZOZFNFVS1Xc1ZaQ2NldEpLc3ZzZU1yT241TjJKUmMxOWFISGkwY01uYVdnWU9ENlFCMHFFakYwZ1ZDT3c3UEtRV29Fd0RySTJZTW55RjEyNnhmaWdBb1VYU1Z1UQ?oc=5
2026-02-25	Google	0.0	Bitcoin Price Forecast: BTC/USD Bulls Wake After 52% Crash- 70K the Key Test - FOREX.com		https://news.google.com/rss/articles/CBMiygFBVV95cUxQaFQ4V3hQeXNWeks0cUNCd1gybk5ycDM4X0JWMGJ5LWxva2RHRF8zbElITU9OelVSaExNaWlGNC1YbkgxbVRSeFg5RDhtUGtKT2xrQzBrRnY5cEE3M0FoYV9CaDd2ZFR2RFlrS2RYY2tBYmhFejNaSnlsaFItMDk4S0JrY3g5QWs0eFFIdXBjdGJ5TnRRdk9tQTRQT3lzamtOZGc1RE9JM0duR2Qxb1Zfbm0xVktURVpMaHkwa29KaTRSSlB5QVEzRUhR0gHWAUFVX3lxTE9FY25pLVdIVE9STXlCWWJITV81cDV2WmVmQUpBOVZHTVQxT1JMV3A5c0Q5LXNhRUkxWkJyRVYteU9LOEhWbUlQcV9SWm1iUUpFZ3RZajZDZl9WVElTdHByMGQxVTAwNHU1MnJ4cDVlN0o2N1pRa2V3MmdCaVczRW9DSTNEdy1sV1RrLVNVYXZvUWVUZ3YzUWpOejh4LWhsVnRNcWQxbllZdzNfbnhfbzU3OWFIQy1nUWZEd2l3UmZ3VV8xdHBqczRLWHhfYXgzcVBISndEeVE?oc=5
2026-02-25	Google	0.0	Bitcoin regains some momentum, rises 4.5% (BTC-USD:Cryptocurrency) - Seeking Alpha		https://news.google.com/rss/articles/CBMiggFBVV95cUxObUIxWU1JNERyY2EyMFNrUFJfV3VtN1ZicjhITVZlNUpQYTkzcHoxeWxhdjc4RlVyM2ItaTlrV2dvRnBRR2pQQ2JBMkcwR0VyMUJFVVpXT1ItZGZtOElqZnBlRW1PTFp4cXFYR3NucmhIYlc3eVkxS0hTLWJoMEVTanlB?oc=5
2026-02-25	Google	0.0	Crypto Bitcoin / US Dollar BTC/USD Chart Hourly - Finviz		https://news.google.com/rss/articles/CBMiX0FVX3lxTE95Szg3MURHTGd1NkVYVmRiMDllcjRJWGcyeUNZZGZxbGpGWW1PUGhLYXRGSUwwd3lIRk9Tcm9DeW5SLWxZSWtzc2NRZERyai1OczRmZjRTcTd3Z180VzY0?oc=5
2026-02-25	Google	0.0	Crypto ETFs with highest short interest as bitcoin, ether bounce (BTC-USD:Cryptocurrency) - Seeking Alpha		https://news.google.com/rss/articles/CBMiowFBVV95cUxPWmJuSi1udVQ2ZHBZV2ZTajl0bDU0MXhzS2cwNXZhd19jdWhDU25pZlExcFBQX1psZU1jVFJRamEtdjhGbkh6azEyd2xqanAwSUlvdU5QWEZsSFFoMnBnYlBMU09jNWVIdjZTZGRLUlV1am92X2Z3ZG1RMWhpbGRvN29rYl8yRVNfZ2ktMVM5U29nX0FJT3hsNUxfdVY4RTNPZExZ?oc=5
2026-02-25	Google	0.0	Trump omits crypto in record-long State of the Union (BTC-USD:Cryptocurrency) - Seeking Alpha		https://news.google.com/rss/articles/CBMilAFBVV95cUxObFZvWlE1SGM4b3ZmVDh0RE1vZWJDYkhUQy1qZ3dsR2hDRUVnQTlsdldnR2NOZUVIX2c1UUtwbEo5NHA4RXNfM05vQjl0NkVKcE1pSkdFamYybFVUTm5fQUVONmY1dl9hLTdTWi0zUlBtS3ZBRnBfWXFyRVZlbW1CazZLTWQ1X0hIV2M2YmhVM3p5a0lo?oc=5
2026-02-24	Google	0.022	Bitcoin (BTC USD) is 50% down from its peak - where is the world's largest crypto headed - The Economic Times		https://news.google.com/rss/articles/CBMi7wFBVV95cUxNclBDTmFBM21nVkljZlJHNHhUc3FxdEhFclE5YUlEbHJVeWdiZzlONlVZalVGcThabHU1OFg4Zi1JMjNfeXl2Mnh3OWJxOWdBdF9kQnJ5QVFJakVKb0VpSElQLWo4ZkhCQmZrNlJydmlBMjAyaVpuaGZxeFl4SzJlSzI2Yl92WFhaVnhLM0pINWpDcmxSZHhVSHV5aWFQbDFGd0Z1TVctUzhQdjZPd2pYOUprNU04WDdqMzU2R0M2RG9FX2hkLWNjV2N6UmRLSzdfbVEyYUg2QUdoNFZTWTd3cldKMlllOVE0UTJWRlM2Z9IB9AFBVV95cUxPQmc1SHhxZWl1Zk9pZkdLMlNoTWxZT29wQVdXaWllSU15QjdWWTc5WjRSNVBZNlY3bVJxTG0wZEJfYU1qUU5MOHhwTFM3N0xyNEhmb29TWDl3WWxQbzRuTnhpbHFsRnlmUVd0UFpuNVhYLWs4NkxsaXY4VUJlanEtTW43b2xWUHJzbWtfSWhwMW5lMk1VejZ0dWtqcE5TMHVmM19PdFVKdlhmdGExYkc5NENsVXhLNnBWUjlPMUtnNXllY3JKZzEzcXB5Nks5VjNhNG9GM28tajZVR2NjZV90dXpPdzlieEpmNWpobjlTWjVWOEVG?oc=5
2026-02-24	Google	0.0	BTC USD Drops To $63K: $295 Million in Longs Liquidated - Yahoo Finance		https://news.google.com/rss/articles/CBMidkFVX3lxTE5DaUtudUVuem1yNUdzUFZ1ZlJ1ZU9OeFhQUk9MOGZxZmI3ZmpfdC1rRlYtRExYbFhUWnZQbmVYTjNtMmlCOXZxcXdYeHU0R2xOcW1NWExMaDltZWpBWnE2OG9jZW0tNnpFQ1NBVGQ3MUlHWk5DR0E?oc=5
2026-02-23	Google	0.0	BTC/USD Forex Signal 23/02: Signal: Bitcoin Price at Risk as - DailyForex		https://news.google.com/rss/articles/CBMinAFBVV95cUxOQXJaa21rWFlmTHVXRWRrYjdRSTJNRzBVYktYT1pVQW02S2NSVkw1dWhsMWxTa2NlVF9wcTdSNnJBTmpITUVJTHJPUENXSWMxWUZOMEFQOGVDRDF2M0l2dFZHNllrWVpYN3pNZUtab2NOSkRMdTg4cHdUb29ZNVdRRzRlNzBhSFVWOUdaeVVTYlpOTkF6YWN3WEpUeFY?oc=5
2026-02-23	Google	0.0	Crypto stocks fall as bitcoin briefly goes below $65K (BTC-USD:Cryptocurrency) - Seeking Alpha		https://news.google.com/rss/articles/CBMilAFBVV95cUxQMm1uc2t2TWdSdGtEX1BaZkhnRkZjMkZ5WHFmZGozT19US1Y1SXRXVVVwM0drRlRzaC05NEhFVGhFZWdvcnpNZ1lQMWxEVVBHZlcta3R5ajJWWW1QYlJIekRwdGNaRDhxMlV6OHd2blk5Z3I0Z2VtcDQ4MFJLZF9SMmtoWGJTSkx2SUhjbmRvTFZocG1o?oc=5
2026-02-22	Google	0.1	Michael Burry Says He 'Slept' on Bitcoin After Early 2013 Buying Opportunity - Yahoo Finance		https://news.google.com/rss/articles/CBMihAFBVV95cUxPUG5pcC1yWXlkd2VHSDFNUDJyX0lQTHF3N0k0OGlUaFEzNlpibzl1aF8tRGNLQmJUY0lfRE9uNFFuSktHSEJxQXdGRmNWVTY3S0RIUGVUbDZ4VmFWbzVoT3l0bnRvcUZHZ3RpVHd5dWhSaW03NjVveml1VVNlT3Z1NjMzWlY?oc=5
