Date	Source	Sentiment	Headline	Summary	URL
2026-03-06	Yahoo	1.0	Best savings accounts as lenders cut rates	Check the best savings accounts to find a top-rated deal that works for you.	https://uk.finance.yahoo.com/news/best-savings-accounts-deals-inflation-interest-rates-120112783.html?.tsrc=rss
2026-03-06	Yahoo	0.143	The $5 Billion Question: How Much ETF Inflow Does the XRP Price Need to Break Out?	XRP ETFs have pulled in $1.25 billion since launching in November 2025, locking 810 million tokens in institutional custody in the process. At launch, the assets went 35 consecutive trading days without a single outflow—a streak even Bitcoin and Ethereum ETFs couldn’t match. XRP (CRYPTO: XRP) trades near $1.40 right now, and the token has ... The $5 Billion Question: How Much ETF Inflow Does the XRP Price Need to Break Out?	https://247wallst.com/investing/2026/03/06/the-5-billion-question-how-much-etf-inflow-does-the-xrp-price-need-to-break-out/?.tsrc=rss
2026-03-06	Yahoo	0.119	Chinese Markets Weather Iran War Turmoil Better Than Asian Peers	Onshore stocks have fallen around 1% this week, compared with a more than 6% decline across Asian markets, even as analysts warn about the war’s impact on the region, including for China, a major oil importer.  The yuan posted the smallest drop against the dollar among major Asian currencies, and Chinese sovereign bonds have also outperformed major peers amid the selloff.	https://finance.yahoo.com/news/chinese-markets-weather-iran-war-063708794.html?.tsrc=rss
2026-03-06	Yahoo	0.096	Bitcoin and Stocks Find a Floor, But Bond Market Says Risk-Off Isn’t Over	Bitcoin (BTC) is trading above $70,000, recovering nearly 10% this week as global markets attempt to stabilize following a sharp geopolitical sell-off. However, while equities and crypto have established a temporary floor, the bond market is signaling that risk-off sentiment remains acute, with Treasury yields climbing as investors aggressively reprice ...	https://www.coinspeaker.com/bitcoin-stocks-stabilize-bond-market-risk-off/?.tsrc=rss
2026-03-06	Yahoo	0.029	Bitcoin, Stocks Stabilize But The Bond Market Isn’t Convinced: Will The Fed Cut Rates Now?	Bitcoin continues to hold firmly above the $70,000 threshold, extending its recent gains as global risk assets rallied across equities, commodities, and digital currencies. Bitcoin marked a near 10% recovery after a jagged week of geopolitical panic. Stocks followed suit, with S&amp;P 500 futures bouncing back to 6,840. While crypto ...	https://99bitcoins.com/news/bitcoin-btc/bitcoin-stocks-stabilize-bond-market-warning/?.tsrc=rss
2026-03-06	Yahoo	0.029	Crypto Altcoin Ghost Town: 38% of Altcoins Trading Below FTX-Crash Lows	Bitcoin continues to hold firmly above the $70,000 threshold, extending its recent gains as global risk assets rallied across equities, commodities, and digital currencies. Bitcoin marked a near 10% recovery after a jagged week of geopolitical panic. Stocks followed suit, with S&amp;P 500 futures bouncing back to 6,840. While crypto ...	https://99bitcoins.com/news/altcoins/altcoins-trading-below-ftx-lows/?.tsrc=rss
2026-03-06	Yahoo	0.026	AI XRP Price Prediction: ChatGPT and DeepSeek Say XRP Will Outperform Bitcoin in 2026	XRP (CRYPTO: XRP) trades near $1.40 after falling 62% from its July 2025 peak of $3.65. Bitcoin (CRYPTO: BTC) sits around $66,000, down 48% from October’s $126,000 high. Both are deep in drawdowns, but ChatGPT and DeepSeek both predict XRP delivers stronger percentage returns than Bitcoin through year-end. Where both AI models disagree is how ... AI XRP Price Prediction: ChatGPT and DeepSeek Say XRP Will Outperform Bitcoin in 2026	https://247wallst.com/investing/2026/03/06/ai-xrp-price-prediction-chatgpt-and-deepseek-say-xrp-will-outperform-bitcoin-in-2026/?.tsrc=rss
2026-03-06	Yahoo	0.02	Bitcoin’s 12-Year Relationship With the Dollar Just Broke	The Bitcoin price has fallen every single time the dollar has rallied since 2014. When the Dollar Index spiked to 114 in 2022, Bitcoin (CRYPTO: BTC) dropped from $47,000 to $16,000 over roughly 11 months. The inverse relationship between Bitcoin and the dollar was so consistent that traders built entire strategies around it. However, on ... Bitcoin’s 12-Year Relationship With the Dollar Just Broke	https://247wallst.com/investing/2026/03/06/bitcoins-12-year-relationship-with-the-dollar-just-broke/?.tsrc=rss
2026-03-06	Google	0.0	BTC/USD Forex Forecast 06/03: Bitcoin Drops (Video&Chart) - DailyForex		https://news.google.com/rss/articles/CBMiowFBVV95cUxNZlR5bDFRNzVXbFFTWHdXQWliRVhjcllCMkFSdENBdGVGZFRFTFluZnMtRGVTZ1FZaGVodU1HRWhiUnRVd1BPZm1xTkhZckhfOElnMWlLS0RveDBqa0tobG9ERm15RmZFeVdTR2ZLakdEZVlRX1VlcUstLXNydDJHSjVaa0VYU3pyMThSVk5PMl9sa2tteld4T0EySUZENEF0azBF?oc=5
2026-03-06	Google	0.0	Bitcoin slips below key level as investors brace for U.S. jobs data, Middle East tensions rise - Seeking Alpha		https://news.google.com/rss/articles/CBMiyAFBVV95cUxPeElHMVU4Q1VjanVJWFdkVkJmS0RJeWJDYnJsM1o0b1h1NHNZVzRWaWxKQzltUURwcE1kMUxzRkRlSHFWd0hjZUhsM0lvU0tLcGpWZzZPMHQ5Y1ZnLXNBM2t3WXVFZlZZbDV5RmFoU1JLZFB6bU5HS2FuZWZVMjd4M3ZzaUFIazZxSjhMNjRUb2RRdWlubUpfZndjd2tKN0tLb2JDRDdQQ2g2UGQ1WTVQLVZNTmdfZDBob1VDNTloajc2OHItSk9lOA?oc=5
2026-03-06	Google	0.0	BlockFills preparing for restructuring amid crypto downturn - report (BTC-USD:Cryptocurrency) - Seeking Alpha		https://news.google.com/rss/articles/CBMiqgFBVV95cUxPUHQ1Wkp5TWxjRTI3bi0zeFdjRVFUdnBQYUhHaWd6c1ZfYTdNNzZNOEswaGE0eVdwb2s5SVJlYTlzbzU2YXpSNDBrX1FJUE5HS1g3V3I3UEJ3b1dNeDNBMFFWcU9rdkNKVmt1Q2JScTA1TkVIaGI4dUdUNWxsNjlWTks5TWVneHI5TjZINmtDSWNGY2VaX2xDV2FnLWFDa2pMLXQ0RHYwOW0wZw?oc=5
2026-03-06	Yahoo	0.0	EU economy grows 0.2% in fourth quarter and 1.5% in 2025	Questions remain about how a jump in energy prices and threats from Donald Trump over ever-escalating tariffs will play out.	https://uk.finance.yahoo.com/news/eu-economy-fourth-quarter-2025-104954224.html?.tsrc=rss
2026-03-06	Yahoo	0.0	Rumble Q4 Earnings Call Highlights	Rumble (NASDAQ:RUM) executives used the company’s fourth-quarter 2025 earnings call to outline a strategy they said positions the platform for “aggressive growth” in 2026, pointing to product updates, a changing advertising backdrop, and a planned expansion of its cloud business tied to the pending	https://www.marketbeat.com/instant-alerts/rumble-q4-earnings-call-highlights-2026-03-05/?utm_source=yahoofinance&utm_medium=yahoofinance&.tsrc=rss
2026-03-06	Yahoo	-0.112	These 3 Stocks Just Bounced From Lows — What Wall Street Thinks Comes Next	Wall Street’s read on three of 2026’s most volatile names—Moderna (NASDAQ: MRNA), Strategy (NASDAQ: MSTR), and Trade Desk (NASDAQ: TTD)—tells three very different stories. All three have bounced off recent lows, but analyst consensus reveals sharply divergent conviction levels behind each recovery. Trade Desk: Cautious Optimism After a Brutal Reset This stock has rebounded 24.38% ... These 3 Stocks Just Bounced From Lows — What Wall Street Thinks Comes Next	https://247wallst.com/investing/2026/03/06/these-3-stocks-just-bounced-from-lows-what-wall-street-thinks-comes-next/?.tsrc=rss
2026-03-06	Yahoo	-0.139	US Grants Temporary Waiver for India to Import Russian Oil	A license issued late on Thursday covers transactions related to Russian crude oil and petroleum products loaded onto vessels before March 5, so long as it’s delivered to India and purchased by an Indian firm.  “To enable oil to keep flowing into the global market, the Treasury Department is issuing a temporary 30-day waiver to allow Indian refiners to purchase Russian oil,” US Treasury Secretary Scott Bessent said in a post on X. “This deliberately short-term measure will not provide significan	https://finance.yahoo.com/news/us-grants-temporary-waiver-india-055043829.html?.tsrc=rss
2026-03-06	Google	-0.186	Bitcoin price news: BTC suffers late-week $110 billion wipeout as Iran trumps positive developments - CoinDesk		https://news.google.com/rss/articles/CBMi2AFBVV95cUxOdllEdmZRdmtlZS0wNmx6T012SEt0alFEQjJUM2JLWG5tRVBOS0tkUTRCRVgyeXNGaVh1b0Q3WktjTGZkdVNOblZuaEVMS2lfVnJzelBmSUdfczNhb1AzY2dQUlY1N0FwTHE3Tk1Nb3FybXF6LUctalRwM0M1dFk1TjVYQU4zbGRxcklsUjJBV09mX0Z6SXBpT3lUSkZEWVAyMjhGNS05czA2WERtNzdxVzR1S2tyR29tVjRmemdUc092QlBMeDM1eDl4bXM5WUNRVHBaakM4UDY?oc=5
2026-03-05	Yahoo	0.283	Bitcoin’s Rally Falters as Iran Turmoil Lingers Over Markets	“When you add that news flow to a market which had clearly got somewhat over-excitable in terms of the de-risking and de-leveraging that we saw on Tuesday, you have a fairly strong mix to drive a notable reversal across the board,” Michael Brown, senior research strategist at Pepperstone Ltd, wrote in a note regarding broader macro moves on Thursday.  Bitcoin has tumbled some 40% since its peak of over $126,000 in early October, buffeted by geopolitical uncertainty and a lack of clarity on US pl	https://finance.yahoo.com/news/bitcoin-holds-firm-above-70-021030378.html?.tsrc=rss
2026-03-05	Yahoo	0.175	YieldMax’s MSTR Is A Nightmare ETF, Despite Dreamy Dividends	MSTY has one of the most eye-catching yields in the ETF universe. But the number that should be keeping investors up at night isn’t the yield, it’s the check size. The most recent weekly distribution was $0.30 per share. At the fund’s peak in late 2024, that number was $4.42. That’s a decline in the ... YieldMax’s MSTR Is A Nightmare ETF, Despite Dreamy Dividends	https://247wallst.com/investing/2026/03/04/yieldmaxs-mstr-is-a-nightmare-etf-despite-dreamy-dividends/?.tsrc=rss
2026-03-05	Yahoo	0.125	The Pound Is Not Sterling. 1 Trade to Make ASAP Amid Middle East Conflict.	June British pound futures present a selling opportunity on more price weakness.	https://www.barchart.com/story/news/586150/the-pound-is-not-sterling-1-trade-to-make-asap-amid-middle-east-conflict?.tsrc=rss
2026-03-05	Yahoo	0.074	Roundhill’s 50% Yield Innovation-100 ETF Is Waiting To Step on A Landmine	Roundhill Innovation-100 0DTE Covered Call Strategy ETF (CBOE:QDTE) was built for a specific type of investor: someone who wants meaningful income from tech exposure without simply riding the Nasdaq up and down. The fund sells zero-days-to-expiration covered calls on the Innovation-100 Index each morning, collects the premium, and distributes it weekly. With roughly $927 million ... Roundhill’s 50% Yield Innovation-100 ETF Is Waiting To Step on A Landmine	https://247wallst.com/investing/2026/03/05/roundhills-50-yield-innovation-100-etf-is-waiting-to-step-on-a-landmine/?.tsrc=rss
2026-03-05	Yahoo	0.072	The WSJ Dollar Index Rises 0.29% to 95.86	1531 GMT – The dollar’s recent appreciation is driven by the potential for an improved U.S. terms of trade as oil prices rise due to the Middle East conflict, Commerzbank’s Michael Pfister says in a note.  Higher oil prices therefore boost the U.S. terms of trade as U.S. export prices rise relative to those in the eurozone, giving Americans more money at their disposal to spend.  The “decisive factor” is how long the oil prices increase lasts.	https://finance.yahoo.com/m/ec753020-94d5-3441-b91e-ca4f1fff5375/the-wsj-dollar-index-rises.html?.tsrc=rss
2026-03-05	Yahoo	0.061	Is Bitcoin Dominance Back? Altcoin Social Media Interest Falls to 2-Year Low	Bitcoin surged over 5% on Wednesday, climbing to an intraday high of $71,890 before settling slightly lower, testing the nerves of bears and bulls alike. At the time of writing, Bitcoin is trading at $72.5k. Is this the start of a new all-time high run, or a classic crypto bull ...	https://99bitcoins.com/news/bitcoin-btc/bitcoin-dominance-altcoin-social-media-interest-falls/?.tsrc=rss
2026-03-05	Google	0.05	BTC/USD Analysis: Bitcoin Price Consolidates Above $70,000 - Action Forex		https://news.google.com/rss/articles/CBMiwAFBVV95cUxQV2RqRHhramtzVmxSX0FlUnN2aERFZ2lMb3hBQ1RuWk1pNUxEOEJ5cXFJYVJHZ1JlUFV4Z29tQnJqdTFaeExEZTN2Q1E3YUtJY3ZKY1dhVERkYXlKN1hLLUlRLWdvRm44YUdzQ1Z0MmNCLUJYbnVEbTJBSEV4eFFrNlUyY3JYc05JeDlvak5oZUg1NlRSNWlWdEZGR3ZERFppeVdfR3ByTWxJZl9hNGNWWTN3M0pwNmY2N191THNLMEQ?oc=5
2026-03-05	Google	0.0	BTC/USD Forex Signal 05/03: Bitcoin Surges - DailyForex		https://news.google.com/rss/articles/CBMimAFBVV95cUxQeUVQaTZOOVF2NEJoVDVBaDJVY3UwRm9Sck9qUDlsZVBXcHNZQ3hBaF9YLV9WN20xUmZ5VlAtQUc5b0pPclhBeGpVLVE3S0R0WUt1WUo2dEZSMDRtV0RJNEkyRkJ5ZDRqeGY0NEhnNFJrWDhjVTJsSTVWaGJPMUU1QmtiblBZMWdTUWw3X3dXcFpKRGRwZmxsYw?oc=5
2026-03-05	Google	0.0	BTC/USD: Bitcoin Tops $74,000 as Prices Break Out of Range. But Can It Last? - TradingView		https://news.google.com/rss/articles/CBMizwFBVV95cUxOZVhWeTdXemRyM0x4YjJiZlFLYjhxWFZHeVlLYXhaZTBNOGVqSWs4dTRnYl95NWVrQmNCb1VZY1lFdGhyYjJnTUJ6WnJpUlZJdk45QmtpYjkxMkNENHRBM0dIOEdFRHFsQUdQT3MyOGFmVk5wcTRvbUo4TXc3TVo2bUF6ZEQ2SGxZM1pycFFsZHhvVENiM0dLOGdPZHRDbjF6TExSVmgtaWxYTXNiM2pTczFWbmNXeHBsSU9veVZEaXptWFBhbmpmTGNlWFdPMnM?oc=5
2026-03-05	Google	0.0	BTCUSD Today: March 5 – NATO Intercept of Iran Missile Tests Haven Bid - Meyka		https://news.google.com/rss/articles/CBMinAFBVV95cUxNUWIwbEU1T0ZmdVQwd3laOGt4MVE0Z2ozRVVxZ0RIek0yMTRVdzZpNk5XWG5CWnVfWmE5RGNzWEd3SktPVzVqZkhPaUNUV0U4N0ZfTy1jb25SdWdNQWxaZU4td2JyUGc2cWRGazZHaVpzZUtaOGJZYjJuZThJczh6N19Qcm94U0lWNEJUQWhnVjdGZzFmRkRXUzJlcUQ?oc=5
2026-03-05	Google	0.0	Bitcoin Price Might Bottom Out in 95 Days If History Repeats - The Coin Republic		https://news.google.com/rss/articles/CBMipwFBVV95cUxOVXJkRlVmRWVpYnA1WWtvWk02Wm1rT3RIRmp1anJUMVpXWms5OWY0OGFMSmVmSWRoRWFNd09xUHZjUkNLTFBxS0tQNnYwb1pMZ282TnBXNEduZlJCR0ZqbGk2RWFYc0x4YXM0ellMUHhYMV9Ib05pSUFOYWhoUDhhTUtTODIwYUNCdkVWeC16eHVRRkJydEFqbV8zclZ2bUdOeWt1YnFRb9IBrAFBVV95cUxNWEQ3OEZJRzhuQTcxSUtkY0dZaUZDYWFESTE3R1RST0RoMG9ib3VuZnl6MGh4NTBQMHhwZVZOYkJUSHV5bVZ1RVN5T0pPLXJKN01YT3Jtb21xZ3lTMDJ2eU9BRmJ1ZGdXYmtLTGk4TEgzanF2ZWVuNW40T0hhS0lfeHBpNzdFN2lpaTF6WE1uYTlEakFRalljOGJFSFQzRERmNVpBRHhublVBOVFw?oc=5
2026-03-05	Google	0.0	Bitcoin USD Bounces 6.94% as Fed Rate Signals Spark Recovery - Meyka		https://news.google.com/rss/articles/CBMikAFBVV95cUxNYXpUTVFzTk50Nzc2am9XRDhtSzR2dkUycnhTb3lRNm11bHFrRlQ4UTJrRFc0RzFUTk5mSTNQU2sxemRXN1V5U0wxOURhTktpazZJb25nYTdLc1kzMC1XUVRzaUVGNUFVUmNsS3djMjBHZWVsdnlpY2xMUjZyWVFIXy1KeXBIUVZxWkJOOHR6bmw?oc=5
2026-03-05	Google	0.0	Bitcoin price rallies as Wall Street pours $462m into ETFs - Yahoo Finance UK		https://news.google.com/rss/articles/CBMikAFBVV95cUxQdTRQa283RXFCY1ctenYzN2gwdmltMmgtQUhURDFMUl9GLVR1a0tDU0ZoVU1ma1ZzZkIta0RPRGptRnRWdjVyWS04MFBFX0ZaaEhDYkJfWGdFdjhaQlZrUEVaS0x3N2Z3ODJWaHlLMGNCNXdKRmdSOXZuYVlYLUVrYjNWSDhHSUxQb2MyOGZya0E?oc=5
2026-03-05	Google	0.0	Midweek technical look – US100, EUR/USD, BTC/USD - FXStreet		https://news.google.com/rss/articles/CBMilgFBVV95cUxQbVRTeHh5b0xEUGVZcElBWUpiMHhCWV95RV9zVXQtdzZRMjJYcDVWN3cxdmRIWkJuX1N2SHktTW03YnhHOWRQT28xQm5Va0xzeHJvSTNfRHlyclhLWXV4bDJLdmU2MFp4QU5UWWRuSklfdEhpNjJGQ3JXdkxPNHdyMGNScjdnQ3pmT2lLMjEtOEtjclZYaHc?oc=5
2026-03-05	Yahoo	0.0	XRP’s $1.30 Floor: What’s Holding It and What Could Break It	XRP (CRYPTO: XRP) is trading around $1.40 after bouncing off the $1.30 zone multiple times since February. The $1.30 level has held every test so far—but rallies keep stalling near the $1.50 resistance before gaining momentum. Meanwhile, roughly 2 billion XRP sits in wallets that bought between $1.58 and $1.60, and those holders are waiting ... XRP’s $1.30 Floor: What’s Holding It and What Could Break It	https://247wallst.com/investing/2026/03/05/xrps-1-30-floor-whats-holding-it-and-what-could-break-it/?.tsrc=rss
2026-03-05	Google	-0.019	Bitcoin rally in danger? Why analyst warns oil price surge and Iran tensions could drag BTC USD price down - The Economic Times		https://news.google.com/rss/articles/CBMijgJBVV95cUxPdEUteVgxcTNTRVduN2c1MDl6Z09ldDFEUURIUmE2TWxaeVJIdWN2TFFtSXFJQ2xHdHExQ1VSM1dLaFQzamFuSHNaWTdIdUNYZEVJNkdlUWw4c0t3S2NDeFhXcEo2M1pGUUhxX3BJN0xyWnloZUZXN0t4VzdhV0RtOUxkbnVyNWFPbXFHMmNOTlpWSkdfSDJaZnJlc0Rwd2pPRmlETmlCaEl4WTN2ZlRmTl9Ud2ZxSXlmR3RuZUR0eXRabWRObjcyTmVCTUpGazZLc1BKMkxkTEtHNmlMckMyVXh2V3pidGxlRGd6UERSLWFDRmh4SFV1clA0SlRzcWxUQmVab0habDlpUkV1VlHSAZMCQVVfeXFMTk5hdTNzcl9UNFBwZmdhRlFEVmpRSWw0dUF1Ni1ZZEJWREY2ckNmWHBHY01WSEttb3d6NjBmbUtsY2tTZjZyTFNmaUxCY2pNb2hSNGgxVzREUW5kdlVLM1Zod21OcWNMeWV3Z0hoWWNwVVVGZG5MdFFYaVdjdjBySlZ5VVdUUURzcElGUXRKdk9pODJNbXJhcUpHVEhVd1hVaXphU3N5LTVsakpmR2RPV2ZKd3hhWE9VVU9EUUtBSlU0TG9BalhjLVpBWHhEOVVXdDdmeUltemc1dnhtaXpnUXdXLXZpOEVyQXRlWFFqSk5iMWNWN0NzQWtrUTJKQjI4ZmszRW12VHpWQmVleHNpMXBHa2s?oc=5
2026-03-05	Yahoo	-0.125	How Is Block’s Stock Performance Compared to Other Software Stocks?	Block has outperformed other software stocks over the past year, and analysts remain somewhat optimistic about the stock’s growth potential.	https://www.barchart.com/story/news/580711/how-is-blocks-stock-performance-compared-to-other-software-stocks?.tsrc=rss
2026-03-05	Google	-0.156	Bitcoin Up or Down - 5 Minutes Predictions & Odds - Polymarket		https://news.google.com/rss/articles/CBMiY0FVX3lxTE94TVRRSFBydDEwZDd0UDV5VUc1N2kxTTFzd3pmNWNVX3ZXOTJwbHZ5MWNWSFVQYlVUT1MzWVY1S2xudkQzTzVqVDBqcFZrNXQ0OEJVZ3NRdzhVUjI5N1JpZmRfVQ?oc=5
2026-03-04	Yahoo	0.25	The Smarter Way to Play a Bitcoin Recovery Without Touching Bitcoin Itself	Bitcoin has dropped roughly 22% since January 1, 2026, and anyone who owns it directly has felt every point of that decline. First Trust SkyBridge (NYSEARCA:CRPT) was built for investors who want crypto exposure without the custody headaches, wallet risks, or tax complexity of holding Bitcoin outright. Instead of holding the asset itself, CRPT owns ... The Smarter Way to Play a Bitcoin Recovery Without Touching Bitcoin Itself	https://247wallst.com/investing/2026/03/04/the-smarter-way-to-play-a-bitcoin-recovery-without-touching-bitcoin-itself/?.tsrc=rss
2026-03-04	Yahoo	0.156	Bitcoin Rallies Past $73,000 While Traders Venture Back	The spike - only the largest one-day move since last Wednesday - is indicative of the uncertainty that has surrounded the digital asset sector since prices crash in early October.  Bitcoin experienced significant short selling earlier this week as investors moved away from riskier assets and shifted toward safe haven investments, traders said.  “Short sellers were too confident that the market would keep falling and placed their orders too close to the market,” said Alex Kuptsikevich, chief mark	https://finance.yahoo.com/news/bitcoin-climbs-above-71-000-105923309.html?.tsrc=rss
2026-03-04	Yahoo	0.129	I Asked ChatGPT What the GENIUS Act Will Mean for My Wallet — Here’s What It Said	Here are the surprising facts the chatbot came back with about what to expect and what not to.	https://finance.yahoo.com/news/asked-chatgpt-genius-act-mean-100314219.html?.tsrc=rss
2026-03-04	Google	0.0	BTC/USD Forex Signal 04/03: Bitcoin Still Stuck in a Range a - DailyForex		https://news.google.com/rss/articles/CBMimAFBVV95cUxPMlljM2d3dGF0eEJibEx1b3M1UHo5ZDh4Znp4UkRlajdONExNR0JvZzVCQzRjWkJ6NEpnZjJQbWRIaFVGb1J3Nm4wVV9taWZFWC1OZWhVVWpfeFFNUVA3M3RSWlAzeW9BY21UZ2hzTkYxbHdaQzYzSGRxZjJ0V3IyOC10Tjk4YUpWM25JVlg0MW8yZEY2ZmR6dw?oc=5
2026-03-04	Google	0.0	BTCUSD Today: March 5 Breakout at $72K Faces Bearish Options Skew - Meyka		https://news.google.com/rss/articles/CBMilwFBVV95cUxPd1B4TjNPTlBBQWE3TURwZFI0eHdsQzNNVHdPZ0NBY3JrY3ItQ3JhaVBMN3VJYnNyVklKOW1VZFZhaW5pQjNscXNCVGJGb1BpZ3JJb2FOMzhNX1lLaGxpRHRBVlVsVl8zczlLMDR6MXpZTXRUenljTTRwaU94UnlLZ0h1Zk9pTWRvcnF1Tm9jclZsMmZkcU1B?oc=5
2026-03-04	Yahoo	0.0	Bitcoin Jumps With ETF Flows, Trump Blames Banks For Clarity Delay	Bitcoin pushes to month-high as ETF flows rebound. Trump blames banks for legislative delays. Cathie Wood, ARK buy these crypto stocks.	https://finance.yahoo.com/m/91c3549a-f81c-3979-a2ed-4eda1b83473d/bitcoin-jumps-with-etf-flows%2C.html?.tsrc=rss
2026-03-04	Google	0.0	Bitcoin rebounds above $71K, crypto-linked stocks rally (BTC-USD:Cryptocurrency) - Seeking Alpha		https://news.google.com/rss/articles/CBMilgFBVV95cUxQN29VVmx4MEUtSC10dnVkQmk4NWV6OFpScC13TEw3czVEanRDMFZFNW94YXJ6clQ4SDkxZUJHSXVJcFlxV2dPZHZVYnZEZzNRZXhfSHc4aUcxZHpadUM1X2xHNUMyMTN6SkxZY0duMllnWXN3ekJDNmNWTnhtQnFYclc4YlliS1FIeE1fQVFxN0xrX1poQlE?oc=5
2026-03-04	Yahoo	0.0	Bitcoin tops $73,000 as investors look for a hedge, crypto stocks surge after Kraken news	Bitcoin topped $73,000 as strategists point to crypto's resilience amid the Middle East conflict.	https://finance.yahoo.com/news/bitcoin-tops-73000-as-investors-look-for-a-hedge-crypto-stocks-surge-after-kraken-news-175357273.html?.tsrc=rss
2026-03-04	Yahoo	0.0	Dogecoin Pumps as Bitcoin Pops, Reversing Recent DOGE Losing Streak	Leading meme coin Dogecoin (DOGE) is outperforming Bitcoin, spiking 15% on the day as crypto prices rebound across the board.	https://decrypt.co/359967/dogecoin-pumps-bitcoin-pops-reversing-doge-losing-streak?.tsrc=rss
2026-03-04	Google	0.0	Every Metric Screams Buy - So Why Is Bitcoin Still Falling? (NASDAQ:IBIT) - Seeking Alpha		https://news.google.com/rss/articles/CBMingFBVV95cUxPOU5pMlhXcDY0NTZPd2d4WlBoU0wtZnZVcDdLVkJQRUViaFdIOE9mT0lobmdjUnNzZUxQNmktNXE5LWdTajdTLWdYYjVjQ1FrSlVQbFY4WXBOMUdaNG03MUhvdUt2QkQzdW8zaG9LcTJlajY5WGNpMVYyQUJJZWxwcEpqdXJULUZaM3I1VG5mRlVvaVpZYmszNnkyRGI1QQ?oc=5
2026-03-04	Yahoo	0.0	Millions could get car finance compensation this year. Here's what you should know	The City regulator has shared its plans to set out the final rules for its redress scheme	https://uk.finance.yahoo.com/news/car-finance-claimants-compensation-what-to-know-160837788.html?.tsrc=rss
2026-03-04	Google	0.0	Why Is Bitcoin Surging? BTC Price Tests $72K but Price Prediction Still Suggests 30% Drop to $50K - Finance Magnates		https://news.google.com/rss/articles/CBMi0AFBVV95cUxPX0F0X3BFUzZ1TlJnU0tOajBLNjFPQnpFUGlkbTJXRWRUb2syazJPYVBINHFTaVdnWldkcUtXNXZWTEs0ZXhiOElkOGlJZHFYRndRbHIxOFpZa3lWOEt6Y0pKa09ONDEyZWVDZ2dSZjAwMXNLZkFBTmxFZnJhTjIySlpBVC1RcE9tbnQ0Z3ZCZG1tX3dyTU1vLUxlUWgteGc1MDdHTTJnWEh4cFQzWkQxcGpOajdLMmR1NHFhd1RTZ29kMmNYa0NnU3NyVnJpVXhr0gHWAUFVX3lxTE9nazQyZDhfU2RmSlZmb1hEQTB4Y0JPTkNCNkxDLThMZUx0bXlNVjJZR2c2dmVidWVMOUZDY3hmNXVWNXRILVhqbE1iczVBRC1IZm42X1dfdEJSb2ZRZzI4SUZIVEsxNW0zRTV2d0lHSEwybWZIR3I4MUY0ZFkwV0IwSWxjYVBOS2xJMi1Id19YRFRtQnh4dHhGd25KRHdkMlFnNmM0UFVpR2QySmptdnYzZl9ZVVdYT195TFFETU9lUXlQWHJJR0g1NFdrWDFZeUxMRWhlcWc?oc=5
2026-03-04	Google	-0.017	BTC USD price today: Bitcoin surges past $72,000 as Middle East tensions rise, $506 million ETF inflows bo - The Economic Times		https://news.google.com/rss/articles/CBMixAJBVV95cUxNSkNTNXI2R3FieXphQURteFo1enhXNjg5VHZuei1iYXU3VUpJVzJ4MzhzektBQm1pN3lzenFvQkI5eENsZWFCMEFPTkxfNXFwRV80cFRhbWY5NmVsYnY3OTh5S3ljdml5cEpfSDU0YWdyQk04SWM1ZF9tM0hkNlJYVlpITlUxSUxEVVR4Sl96MXZWWHYwYW1Ybk9Mbkk2ODYzZWJRVkJ2SWVpRlZGWDRnTWZQRjl1eGpscFdxTWJnVXBFSTZyYVdpUFdnY1RQRklsajFUb0syN2VXeS1WWnFxVUZOd01vX2lvcWhrRUN0Nk5LWjdMcFZpTWc1MUFCbzUtYXdrZjUzOVRsc0k1aUxKaVdKR0FHWFBBNHJVd2Y2QkFjRlFuU0o1MEdzVTRQS0lxRWljd2ZUZng4N1N5STk0bnlOcULSAcoCQVVfeXFMTXNKVHp2T28xZnVhRmtGaXRTUXRRX3IzWmJ1VHBGZ09wby05TFM4VXJXT2x5aG9GWnBmd0hiM2RWRkxuY21NMmIzNHVRd0U1TnNkbThVZjM0YjJDNzNTbWtfc0tRZmtGUGo5WXBYaEROVFJDRWRZZnV0d3ZQTHdmOWdNbVppN0daLVk2dXd5NzFHU3g0OEtEMG9kZWFCcUR2bGFQTlI3VkZLUEZtcXpDcjNQVFlPUXVxQ3JRa0VWU1dWTmh3eUxRM3AzanhCOHloWTFxLTZhcG5GMENoUUtXOWIxLUJpNjBmQ21wMjZpQm1EVktMY2FfbkNwRzZBQndVTFh2VkxDWllFNEVZSGkzaUhGVGdkSHpHbzNYRDZQcXFQMW1odXZoalFCTTFOcUVsWUZzZEZwMm9UT0lGRldZclQ1bWNZbGFuX2ZR?oc=5
2026-03-04	Yahoo	-0.023	Bitcoin, XRP, and other crypto prices are rising today. What Trump said on Truth Social to boost digital assets	With tokens sliding in value this year, the president just weighed in on cryptocurrency legislation. It’s not the only reason for this week’s reversal.	https://www.fastcompany.com/91502477/bitcoin-xrp-price-rising-today-trump-boost-crypto-digital-assets?.tsrc=rss
2026-03-04	Yahoo	-0.044	Bitcoin Demand Returns As Gold Faces Safe-Haven Test — Why $70,000 Is Critical Now	Bitcoin price gains 3.5% while gold stalls. US demand builds, holders accumulate aggressively, and rebound signal stays active. What’s next?	https://beincrypto.com/bitcoin-price-versus-gold-rotation-analysis/?.tsrc=rss
2026-03-04	Google	-0.125	Bitcoin Rallies Past $73,000 While Traders Venture Back - Yahoo Finance		https://news.google.com/rss/articles/CBMifkFVX3lxTE52TzYycnJoOW9tZkRleElWajduS190alhoWmh2WG1kM0xGemdsVTdJS2RZZFpOTE8tR0RUa1pOMVVXNFdWSTU4cnBIZlg5VmJJZ2dwSU56S3FoZndpZzBmaWcydFY2QXh6RTU4NGplYUxEVm9EQlRkaWgyV1NmZw?oc=5
2026-03-04	Google	-0.156	Why Is The Crypto Market Down Today? - Yahoo Finance		https://news.google.com/rss/articles/CBMif0FVX3lxTFBzaVFWaEt3Wl92aXBkUXF1MVBMZVlzZTF3Njh3YVZtTjU1N0gxSHBsYTJFRERadUU0TVBuLTJNeENVOC16bEtRNmN1aHltckFaVmtmekxNdVBKTGFFaV9IMzRCSlhmTUNYMlBJMjM1dmx4cDJuZkdNVnJJeDlkbnc?oc=5
2026-03-04	Yahoo	-0.181	Geopolitical shock prompts risk reduction - Citi	Investing.com -- Citi revealed in a note on Wednesday that it is cutting risk across several macro positions after a sharp and sudden volatility event driven by geopolitical tensions.	https://finance.yahoo.com/news/geopolitical-shock-prompts-risk-reduction-132250528.html?.tsrc=rss
2026-03-04	Yahoo	-0.425	Oil prices jump as Hormuz tensions escalate amid Iran threat	Goldman Sachs ⁠raised its Q2 2026 average price forecast for Brent crude oil by $10 ​to $76 per barrel.	https://uk.finance.yahoo.com/news/oil-prices-trump-iran-hormuz-gold-pound-dollar-092120611.html?.tsrc=rss
2026-03-03	Yahoo	0.308	How To Buy Bitcoin and Win During This Crypto Crash	Bitcoin is down significantly in 2026. Learn smart strategies for buying bitcoin during the crypto crash while managing volatility and long-term risk.	https://finance.yahoo.com/news/buy-bitcoin-win-during-crypto-231705874.html?.tsrc=rss
2026-03-03	Yahoo	0.25	Middle East Conflict Circles the World’s Markets, Stirring Fears of Stalled Growth, Inflation	Oil prices jumped before reversing course after President Trump assured safe passage for tankers crossing the Strait of Hormuz.	https://finance.yahoo.com/m/f2e3badf-a7e9-30c9-82ad-8fecbe3f7981/middle-east-conflict-circles.html?.tsrc=rss
