Date	Source	Sentiment	Headline	Summary	URL
2026-03-04	Yahoo	1.0	Best credit card deals of the week	Discover the best credit cards to save money, earn rewards and travel smarter	https://uk.finance.yahoo.com/news/best-credit-card-deals-lloyds-tsb-barclays-073339470.html?.tsrc=rss
2026-03-04	Yahoo	0.129	I Asked ChatGPT What the GENIUS Act Will Mean for My Wallet — Here’s What It Said	Here are the surprising facts the chatbot came back with about what to expect and what not to.	https://finance.yahoo.com/news/asked-chatgpt-genius-act-mean-100314219.html?.tsrc=rss
2026-03-04	Google	0.0	Ethereum USD Drops 2.97% Daily—Can $1,822 Support Level Hold? - Meyka		https://news.google.com/rss/articles/CBMijAFBVV95cUxOU1RuX1Rzbm04MFpXWE84MHFLOG5MQlV3WEZoR3RnNFVZYUVGaHliX2ZpYnBzMjVRdW1oSUI5NkJ2VjdjMzVySEVqbEliSHFmV2J6bU5yMGtibGpxS251OUZIS2tONGxEMFpyY003cjNnQklmYWRTUnpYUHZjQmlKUktwaW94R18tLWlpSQ?oc=5
2026-03-04	Google	0.0	Harvard Picks ETH USD After Trimming Bitcoin ETF Exposure - Cryptonews		https://news.google.com/rss/articles/CBMigwFBVV95cUxOVXRMUEZDb21fQy1hQ2N4a3pQTmppcU9oZzlyM0RubHJZYmRXZjBqR1hVekY2b3lUTTZJU3kzbEE4T3l5X0NEUzFCMDZnOFgzenlSUUZUa1lOR1ZDb3B2cHljeXNJZzFuay1ta2ZHVlVhcTZua1QySDVPdlM3dTJ3N05JOA?oc=5
2026-03-04	Yahoo	0.0	Millions could get car finance compensation this year. Here's what you should know	The City regulator has shared its plans to set out the final rules for its redress scheme	https://uk.finance.yahoo.com/news/car-finance-claimants-compensation-what-to-know-160837788.html?.tsrc=rss
2026-03-04	Google	0.0	STETHUSD Slides 3.16% Daily as Lido Staked ETH Faces Selling Pressure - Meyka		https://news.google.com/rss/articles/CBMinAFBVV95cUxQTHpNdXota0pyRmJQblpSLTRjUFk0RTNXdHZmLVhEXzBRUjlYNnB4clNSVlJHRzJ3MUNMMmdNZDltZXNkbXBQLWtuYVZxeFhmXzI0OVY1SklxQUJUV0k2RlVQb1c0S3ppY19GWW5VNlNEaUQtRkdlNGRVRHVyTWw4ZXc2QUYzeVc1aVo4eEcwVHdHalZoOFlXRXd4eVg?oc=5
2026-03-04	Yahoo	-0.181	Geopolitical shock prompts risk reduction - Citi	Investing.com -- Citi revealed in a note on Wednesday that it is cutting risk across several macro positions after a sharp and sudden volatility event driven by geopolitical tensions.	https://finance.yahoo.com/news/geopolitical-shock-prompts-risk-reduction-132250528.html?.tsrc=rss
2026-03-04	Yahoo	-0.425	Oil prices jump as Hormuz tensions escalate amid Iran threat	Goldman Sachs ⁠raised its Q2 2026 average price forecast for Brent crude oil by $10 ​to $76 per barrel.	https://uk.finance.yahoo.com/news/oil-prices-trump-iran-hormuz-gold-pound-dollar-092120611.html?.tsrc=rss
2026-03-03	Google	0.25	Lido Staked ETH USD Gains 5.03% Daily—What's Driving STETHUSD Higher? - Meyka		https://news.google.com/rss/articles/CBMimAFBVV95cUxNeWFlcXJOY1BwWGFpWmtTRjNtalZ1NmVmclhON0VLTlViU284RVNTNF83TVNLWEoxbFo4VjVHdHJlTHBxNEU3ZmI5REw1OFRoRlNldm5aN0F0UGVTZGtKVEhLbS1tNWhXSkMtblg1MVdkLUIwQndhd0VUMkZQenVxNmRTaEhOblNkYWRucUJYMWswWUt5dTk0WA?oc=5
2026-03-03	Yahoo	0.195	XRP’s First Native Yield Product Is Live With Two More Coming: What Does It Mean for XRP Price?	XRP (CRYPTO: XRP) holders just got their first native yield option. On February 26, Flare and Xaman launched a one-click DeFi integration targeting over 2 billion XRP sitting idle in Xaman wallets, and Xaman founder Wietse Wind says two more yield providers are coming. For the first time, XRP holders can earn yield from a ... XRP’s First Native Yield Product Is Live With Two More Coming: What Does It Mean for XRP Price?	https://247wallst.com/investing/2026/03/03/xrps-first-native-yield-product-is-live-with-two-more-coming-what-does-it-mean-for-xrp-price/?.tsrc=rss
2026-03-03	Yahoo	0.19	Reeves seizes on OBR forecast to say UK economy is on the right path	The chancellor defended her plan as the ‘right one’ as growth forecasts were cut and the Middle East conflict continues.	https://uk.finance.yahoo.com/news/spring-statement-live-rachel-reeves-latest-interest-rates-083708478.html?.tsrc=rss
2026-03-03	Google	0.1	Ethereum Price Tests Support Near $1,940 As Risk Sentiment Turns Defensive - Seeking Alpha		https://news.google.com/rss/articles/CBMiswFBVV95cUxOMlhWdDRPQU9HUFk5ZXlCeU1UdVowQ1l2UlJaWEJ1QnRfUWc2UjZHSlo1VGdqc014dkpTQ0dVcHdHVDRfYTVtY1BoYk5QSkNvTlFJc3J6eVN0cWlvTDJ4d0JWcXR4OGxoam1CQ0FMRzBwUTMzTmhKdS1HX3dnZGJLLVFsNWZMYkVSa3F3c2xmajJ5Z0c4em9tSE9VeDl5R0JDWTRmTWFYTjZIbXdDbkZfSGthZw?oc=5
2026-03-03	Yahoo	0.094	Wall Street and FTSE continue sharp sell-off amid Middle East conflict	The downbeat sentiment came after the US and Israel began more attacks against Iran, intensifying the Middle East conflict.	https://uk.finance.yahoo.com/news/ftse-100-live-london-slumps-middle-east-crisis-us-iran-israel-oil-gas-prices-091931875.html?.tsrc=rss
2026-03-03	Yahoo	0.058	Coffee Prices Erase Early Gains as the Brazilian Real Falls	May arabica coffee (KCK26 ) today is down -2.70 (-0.95%), and May ICE robusta coffee (RMK26 ) is down -69 (-1.83%). Coffee prices gave up an early advance today and turned lower, with arabica falling from a 1-week high and robusta sliding from a 2-week high. Weakness in the Brazilian...	https://www.barchart.com/story/news/539221/coffee-prices-erase-early-gains-as-the-brazilian-real-falls?.tsrc=rss
2026-03-03	Yahoo	0.014	Brazilian Real Weakness Weighs on Coffee Prices	May arabica coffee (KCK26 ) on Tuesday closed down -1.45 (-0.51%), and May ICE robusta coffee (RMK26 ) closed down -67 (-1.78%). Coffee prices gave up an early advance on Tuesday and settled lower, with arabica falling from a 1-week high and robusta sliding from a 2-week high. Weakness in...	https://www.barchart.com/story/news/542603/brazilian-real-weakness-weighs-on-coffee-prices?.tsrc=rss
2026-03-03	Google	0.0	Ethereum USD Faces Seventh Red Month as Whale Selling Intensifies - Meyka		https://news.google.com/rss/articles/CBMimgFBVV95cUxQR0tNbWdKRlFJVUtyOU9LSm5STVk2Rzh3WDNsNDI4bm8xV1A0UE5YaVRveEVRMklQNEdRX011M1Q2YUozSG9xVEtGLU1MV1pWTlZ6enFYRU80OEsyTFh5b2d3MDAzRng1a2pCWFpYVkxQZ19uTzlfTlhRM0xzZUZKLVdOUzQxSDM0OXFTcDloRTlCdTN1UkZ0V19B?oc=5
2026-03-03	Yahoo	-0.125	The currency market is pricing in a supply-side inflation shock	As war in Iran rages on, foreign exchange traders are adjusting to a rapidly escalating supply shock.	https://finance.yahoo.com/news/the-currency-market-is-pricing-in-a-supply-side-inflation-shock-165406892.html?.tsrc=rss
2026-03-03	Google	-0.156	Ethereum Up or Down - 15 Minutes Predicciones y probabili... - Polymarket		https://news.google.com/rss/articles/CBMiaEFVX3lxTFB2cHhhWHdZb3U1RERrNjZMZ0UwMEJudGRCYzNfX2pmZFowYVZURzB2UG5OaUJVRUhrbWdqX25xT3c2MHc4WEk1Q3B0VC1hR3p5RFZLc3Z3dnRCN0pBRHFuSjdJVHg4aDM3?oc=5
2026-03-03	Yahoo	-0.3	AutoZone Q2 Earnings Call Highlights	AutoZone (NYSE:AZO) reported fiscal 2026 second-quarter sales growth of 8.1% to $4.3 billion, but earnings per share declined 2.3% to $27.63, as management pointed to a sizable non-cash LIFO charge and weather-related disruption late in the quarter. On the company’s earnings call, CEO Phil Daniele a	https://www.marketbeat.com/instant-alerts/autozone-q2-earnings-call-highlights-2026-03-03/?utm_source=yahoofinance&utm_medium=yahoofinance&.tsrc=rss
2026-03-03	Yahoo	-0.3	World’s hottest stock market suddenly blows cold with a 7% tumble	The KOSPI’s 50% gain in 2026 through the end of February has now been pared to 37%.	https://www.marketwatch.com/story/worlds-hottest-stock-market-suddenly-blows-cold-with-a-7-tumble-c1f15650?.tsrc=rss
2026-03-02	Yahoo	0.25	Dollar Strengthens After Attack on Iran	1543 ET – Treasurys sell off, sending yields higher, as the U.S. and Israel bomb Iran in an escalating conflict that disrupts energy markets and sparks a flight for safety.  1538 GMT – The dollar’s outlook depends on the outcome of Trump administration’s conflict with Iran, Macquarie Group’s Thierry Wizman says in a note.	https://finance.yahoo.com/m/66daf018-6363-3db6-b740-ad7330b68df6/dollar-strengthens-after.html?.tsrc=rss
2026-03-02	Google	0.2	Bitcoin price (BTC USD) nears $70,000, Ethereum and XRP jump: How did the crypto market cap gain $100 bill - The Economic Times		https://news.google.com/rss/articles/CBMioAJBVV95cUxQVzRwOGZKbTlmOU5tTDk0ZHc4d0JDWW10Nlk1QkxGMWJSbWJLc1dLVnF0RlR1QjVWNEpHUnhQOUU1R3B0SHU3RExNdUlrVWZOVTgwR1F5eUU5TXk5X0ZuMXZsYTdTaWhiRXR4V1R3NE51dUpYM21VcmpQa3pVcE1hOUZFQU4xN3c1b3Q1ZFVtd05KWENPSm43MHp1YlNmSGZ3UVJjZDZYbDcyeVJ3bTdFdzVzb1J6bE95b1l6S2tTajlGVDk1WDk3X29UOU9tWWhMYkFjLUtKWkt1N2NzaHd4eGNMbFBmcjVRZnJiZ0NZODhobm4yS25CcDd2X1pXUE15aERjd0w4YTNIUlJybW5rZ2RtVVBVWmdRMXAtalZiRFnSAaYCQVVfeXFMUERxb0RTMjViNnZHWllqTG1JYTZLeGo3OTY5VktDX1dGajhaWWQyRTdjeVNVWXV0eHRKSmdIYXJtZ1gzRUVBZUxjenNOQ09xd3o4S3d1S1VWWGRSVC03dzg1SjRYcW03UzVZTXZBcHJqRWFzdFBja0x6SV8yS0JPeVF6TWpIV3lkWWU1Z3FHWHNKaUFzU3llVFFnU1A4ZGZHTmNaenN5UF9FUFhqQXlabGRKWU1jcnhSM2x1SktjM0I5LV9XWkJjWnF2bHBQSXZwbGNYZzBYNWNLM2RXZU5LNHJfSE5ud2dmVmQ0amIyUjBkUlgyR1I5MDh0eU94NXU5WUU1eS16Qzk3cnJjcmVwaFpscTJudXlqNDVSdEFHYi1rbXdUc1B3?oc=5
2026-03-02	Yahoo	0.182	Dollar Rallies Most Since May as War Spurs a Rush Into Havens	Bloomberg’s dollar index rose as much as 1%, biggest one-day jump since May, as the currency gained against all of its major peers.  The Swiss franc and Japanese yen, both net energy importers, lost more than 1% against the US currency Monday, before paring the drop, as the US and Israeli military strikes pushed oil prices up sharply.	https://finance.yahoo.com/news/dollar-rallies-oil-surge-curbs-093155584.html?.tsrc=rss
2026-03-02	Yahoo	0.082	VanEck CEO predicts 2026 will be the year of corporate blockchain wars	VanEck’s CEO has a clear thesis for 2026, and it centers on a battle most investors haven’t fully mapped yet. The fight isn’t just about which cryptocurrency goes up. It’s about which blockchain becomes the plumbing for Wall Street itself. “I think 2026, this is our thesis a little bit is the year of the ... VanEck CEO predicts 2026 will be the year of corporate blockchain wars	https://247wallst.com/investing/2026/03/02/vaneck-ceo-predicts-2026-will-be-the-year-of-corporate-blockchain-wars/?.tsrc=rss
2026-03-02	Yahoo	0.006	Why Is The Crypto Market Down Today?	Crypto market cap holds steady as Bitcoin consolidates, gold surges, and PIPPIN tests support amid shifting investor sentiment and risks.	https://beincrypto.com/why-is-the-crypto-market-down-today/?.tsrc=rss
2026-03-02	Google	0.0	BitMine Buys Over 50,000 ETH As BMNR Breaks Out 9% - Benzinga		https://news.google.com/rss/articles/CBMirwFBVV95cUxNMlMzaFkxSFlrRzV2Qk5GZC11RWtyazkxZGVPZWM4akFyeVVaeFRnMmJ3OVo0M29lTGlVV1g3eWVHYWV2MlF2X3FoMzJJeUVjWnVwS0piYWwzeXl3eFdUVVlROHlIb0NERjFMTTROeG0xdVZiS21UMDlTNjBFb3RGRk5wdmVFR3l5VGtxdGtKek91OHBjNVNYR1Q2Q243blhvSWJwTHlEcl9FaS1FdTFj?oc=5
2026-03-02	Yahoo	0.0	Bitcoin Spikes to $70K as Trump Says 'Large-Scale Operations' Continue in Iran	The price of Bitcoin immediately fell following bombings on Iran this weekend, but then surged Monday as markets began to recover.	https://decrypt.co/359626/bitcoin-spikes-near-70k-us-operations-iran?.tsrc=rss
2026-03-02	Yahoo	0.0	China greenlights cross-border funds for Fidelity and JPMorgan AM – report	The approvals from the securities regulator came as China's central bank implemented measures aimed at curbing the yuan’s appreciation.	https://www.privatebankerinternational.com/news/china-fidelity-jpmorgan-am-cross-border-funds/?.tsrc=rss
2026-03-02	Google	0.0	Ethereum price Crashes While Supply Quietly Vanishes: Is ETH Supply Shock Brewing Now? - TradingView		https://news.google.com/rss/articles/CBMi3AFBVV95cUxQc3dkUy1yd1pVVHIyLXNJaGptbENheXJMWnlaZnNLZnNTQ3J5WHNWVjJLcWVOOERYWm83b09KUUxDZEIxeHZXOWZWcFRZc2R3Vi15V2NmTVZHcHFjVndQZGdnOVVmc1hQQzRxbzA2aV91RjRpY1diLTk5VUdrMmhMeGhHTnE3SERCYjVDWGFmb1p6MUplTHRpRGVCYnlDU25xa1ZRckNiTUYtcEVqT2R6aWh3Vm10azNYa3FyLXlfdWpsNEVVMmZnMlY2cl9vQnRzWGNSWHVVUUxGeFBp?oc=5
2026-03-02	Yahoo	-0.016	Bitcoin’s price is rising again in a sharp market reversal. Why the Middle East crisis has investors turning to crypto	After tumbling in the wake of Saturday’s attack on Iran, major cryptocurrencies and related stocks are on the upswing again. Here’s what could be happening.	https://www.fastcompany.com/91500981/bitcoin-price-today-why-up-iran-war-impact-crypto?.tsrc=rss
2026-03-02	Google	-0.156	ETHUSD Ethereum USD Down 4.87% Daily—Can It Hold $1,765 Support? - Meyka		https://news.google.com/rss/articles/CBMikAFBVV95cUxOdlpvTXFhSmVVZnMyNXZZcUJ1RF9UcUNoUS1jaEJ5TTYwVHBRVzV1VWtZVVViUlVvNWs2YkQzWUg0ZWM3SnNvMlMwSWZuS2NGaldHYzVYdHM1YkpTOHNwWlJfdHVfSnd6R2M1Ym5oNkZ5QzRWTXVhNjRwaVdzNHBzbkVSY0lJaWVfUzFxLUNHeWk?oc=5
2026-03-02	Google	-0.156	Ethereum Up or Down - 5 Minutes Predictions & Odds - Polymarket		https://news.google.com/rss/articles/CBMiY0FVX3lxTE5nelhJd2xxMk1SektuWnk5OVdKVGxwcUJDbHJUV2o2bXlDa3NYYXcwV24yemltVW53akFHU0F2dnBKOEpMR1otRDA0YUFUZ083SXIwZHZvcHV1d2Jwam4tRUEtYw?oc=5
2026-03-02	Yahoo	-0.25	What to expect from Rachel Reeves' spring statement	The update could impact future spending decisions but is unlikely to deliver fireworks	https://uk.finance.yahoo.com/news/rachel-reeves-spring-statement-budget-predictions-114815743.html?.tsrc=rss
2026-03-01	Yahoo	0.167	Safe haven Japanese yen and Swiss franc gain after weekend Iran strikes	By Alun John LONDON, March 1 (Reuters) - The safe-haven Swiss franc and Japanese yen firmed, while the euro slid as trading resumed after a weekend that saw the United States and Israel launch their	https://sg.finance.yahoo.com/news/safe-haven-japanese-yen-swiss-181819078.html?.tsrc=rss
2026-03-01	Yahoo	0.141	BofA sees a number of AI-related risks that could challenge rally in EU stocks	"Investing.com – The era of easy gains in AI-related stocks might finally be over. While investors spent the last year pricing the AI revolution as an ""upside-only"" win for corporate profits, a new BofA Global Research note suggests the market is starting to wake up to the ""double-edged sword"" nature of the technology."	https://finance.yahoo.com/news/bofa-sees-number-ai-related-005454749.html?.tsrc=rss
2026-03-01	Yahoo	0.111	Wall Street Turns to ‘Haven-First’ Strategy Amid Iran Crisis	Macro traders said all eyes will be on energy markets when trading fully re-opens on Monday.  Traders sought haven assets in early trading in Asia, with the US dollar surging and Swiss franc edging higher against major peers while the yen was little changed.  The possibility of prolonged turmoil in the Middle East and the ripple effects of higher oil prices are giving money managers fresh reasons to sell equities and shift into safety.	https://finance.yahoo.com/news/wall-street-turns-haven-first-095819929.html?.tsrc=rss
2026-03-01	Yahoo	0.0	As Coinbase Rolls out 24/5 Stock Trading, Should You Snap up COIN?	Coinbase is blurring the line between crypto and stocks with 24/5 trading. Should COIN stock be on your portfolio now while it trades well below its highs?	https://www.barchart.com/story/news/497008/as-coinbase-rolls-out-24-5-stock-trading-should-you-snap-up-coin?.tsrc=rss
2026-03-01	Yahoo	0.0	Bitcoin recovers above $67,000 as markets digest Khamenei’s death	Investing.com — Bitcoin (BitfinexUSD) is clawing back its weekend losses, trading north of $67,000 as investors react to the seismic shift in Middle Eastern geopolitics.	https://finance.yahoo.com/news/bitcoin-recovers-above-67-000-040142760.html?.tsrc=rss
2026-03-01	Google	0.0	ETHUSD Ethereum USD Drops 4.87% Daily—Where's the Next Support Level? - Meyka		https://news.google.com/rss/articles/CBMimAFBVV95cUxOZDU3QThTLWpJMTJLTXd6dFlfYUR6OHIteE9waTg2WjJmN0ZBei1UMjJoZmVCRFJVUnlFRzJOQnhxenlIV3dnNEdZZ0ljOUdnc1FJNmVDeXplNzBZeXBYcmV4TmVRNktYTjctYktKMmlfcEtNTXJaRFExdEM0bzdGazVFQUtKdEtKOUVDSjhSaTRtcVBZcThuTg?oc=5
2026-03-01	Google	0.0	Retail traders drift to stocks, leaving crypto without its core fuel: Wintermute (BTC-USD:Cryptocurrency) - Seeking Alpha		https://news.google.com/rss/articles/CBMitwFBVV95cUxOUmVodjFIVFlaMmlKVzFZQjl5YUlVa2xtdm9DUnFIMllMSm1VeHRQbS1MU1RZc0prNEhuTmRTY2MtVjh6VVk2eThlbFdlSEI0OTUwV2M0X0lQY3dWNlZCUldjSnR2TUhKeGFza3JxaVlPU3VoczFERTcybWZGTVNfYTlZUlAwSVBrSy1VdDJrZC0wemNqZ0NQWDBYUkpveDdoRm41eGZZMFF6T2tCNDFialZCUzJlMW8?oc=5
2026-03-01	Yahoo	-0.15	Tecnoglass Q4 Earnings Call Highlights	Tecnoglass (NYSE:TGLS) management highlighted record full-year revenue, a growing backlog, and continued market share gains during the company’s fourth-quarter 2025 earnings call, while also detailing cost headwinds that pressured margins late in the year and outlining its 2026 financial outlook. R	https://www.marketbeat.com/instant-alerts/tecnoglass-q4-earnings-call-highlights-2026-02-28/?utm_source=yahoofinance&utm_medium=yahoofinance&.tsrc=rss
2026-02-28	Yahoo	0.15	Crypto Market Hedges Iran War Risks With 24/7 Oil and Gold Trading	Perpetual swap futures, a type of futures contract that does not expire, tied to oil jumped about 5% to $70.6 per barrel on crypto-exchange Hyperliquid, while those for gold and silver rose roughly 1.3% and 2% to $5,323 and $94.9 per troy ounce, respectively.  The moves may offer some indication of how those markets could respond once mainstream trading resumes on Monday.  Silver led activity among perps for commodities on Hyperliquid, with more than $227 million in trading volume over the past 	https://finance.yahoo.com/news/oil-gold-rally-hyperliquid-24-131937525.html?.tsrc=rss
2026-02-28	Yahoo	0.05	Investors should brace for more than a brief military campaign in Iran	President Trump said Saturday that Iran’s Supreme Leader Ayatollah Ali Khamenei was killed by U.S.-Israel strikes	https://www.marketwatch.com/story/trump-says-massive-strike-against-iran-underway-bitcoin-plunge-offers-a-glimpse-of-how-markets-could-react-25d9ed1c?.tsrc=rss
2026-02-28	Yahoo	0.0	Bitcoin prices fall below $64,000 after U.S./Israel attack on Iran	Investing.com -- Bitcoin (BitfinexUSD) prices dropped below $64,000 on Saturday as news broke that Israel and the United States had launched attacks against Iran.	https://finance.yahoo.com/news/bitcoin-prices-fall-below-64-103637301.html?.tsrc=rss
2026-02-28	Google	0.0	Ethereum USD Faces -4.87% Daily Decline—Technical Breakdown Ahead - Meyka		https://news.google.com/rss/articles/CBMilAFBVV95cUxPYW5UYmI1cTZkUFdjQnlpOGl5Zkc2My0zeURQelBwWXNqd1QwYmd3Y2E2dEEzX1pOUVpnSmY5TVNBanBDT3lSSGRmWURiX29ObklDS3VRcmR0UXpBcmxwV0JMNWQwVkY0dUtXYlNaa3RtRHBROFlOc0hmanJ6dUhrTW5zOHVxMjJiZHBzZnhOZ2ZtSm1S?oc=5
2026-02-28	Yahoo	0.0	Robert Kiyosaki says the ‘biggest crash in history’ is about to hit — warns millions could lose everything	Is it fearmongering, or a reality check?	https://finance.yahoo.com/news/robert-kiyosaki-says-biggest-crash-150000627.html?.tsrc=rss
2026-02-28	Yahoo	-0.156	The Weekend: Tariff chaos reigns and Netflix tells Warner Bros, 'That's all, folks'	As Trump ramped up the rhetoric on tariffs, Netflix backed down from its bid to take over Warner Bros	https://uk.finance.yahoo.com/news/tariffs-trump-netflix-paramount-warner-bros-060054470.html?.tsrc=rss
2026-02-27	Google	0.0	Lido Staked ETH USD Drops 4.81%—Can STETHUSD Recover Above $2,000? - Meyka		https://news.google.com/rss/articles/CBMikwFBVV95cUxPR1BhTV9lR3lMbXZVYWFUMW5uLTBsTU91SzRRQ3IyWE1zNG1FZXFMU3FVUExyLTloVVpBSGthMElEeHQwZnEwejdUUWdSS3JFQjhobnk4anpvLVowU0xlSEp5aHdNa1FaOUdsZTJlOHd6c0FiZXlROXhRb0hvU25lTmsxMlpBcG1ZS1ZINXlZeDEtZ2M?oc=5
2026-02-27	Google	0.0	News Hunter BNB(@News-Hunter)'s insights - Binance		https://news.google.com/rss/articles/CBMiZEFVX3lxTFA5VzdhVTNqLVpOQzZFQ2FuVlhtcWhJTV9sMEJ1QVdaUzE0MzJwTzhHV1VNREdoUWkzOHVWZ1hNYUZvS0tic1JtODFnOE9sSnRCcm5IWFdVZVBfS2FLQjNuclhSMEM?oc=5
2026-02-26	Google	0.0	Ethereum Price Jumps Back Above $2,000 As Traders Reassess Risk Sentiment - Seeking Alpha		https://news.google.com/rss/articles/CBMirgFBVV95cUxPR1g3V29aanlXajlVcU5yRG5jX3RzTlZGNnpxNzFuNEVuUXoxTGd5ZGd4dDBpT3Q3ZEIwYTkyVlhVZzB1VXJLbWcyN085SXpma21fX0JQQUIzQUtsQnNVdW9nTU9yZ1htZlVGeUhkVDhHNFBORkZmUFRRQTdzaFdhQkhPLU8wUnU1WE1hdWNlckM2YXVsNmRUajBObmhzdmYtUFpWSkZnMGRvVDVqYUE?oc=5
2026-02-26	Google	0.0	Ethereum USD Drops 26% Monthly—ETHUSD Tests $1,400 Support Level - Meyka		https://news.google.com/rss/articles/CBMikwFBVV95cUxQRk1ZeF96MEJIRlh4ajZyamxuRGhaYnVJakhkamdWaDhmN0lKZlF3ZGplNjJvOE5GdTUwTGt0VWx3Y0pXVEpITURvbjhEWXctNjRYcEpQNFAwa0tGUlZIZWFWdHZFM0xIQ3QtcHZwb0piZ2lYRFBTaTZ5UEl6TnVSMW1rbGNULXV6UlVWeVFvSF8xNkU?oc=5
2026-02-25	Google	0.0	Ethereum Whales’ $18 Billion ETH Accumulation Could Be Hiding a Market Bottom - Yahoo Finance		https://news.google.com/rss/articles/CBMiggFBVV95cUxOajFpRGZiSy1oRUhodHZGMl9vRWZyWS1kQUNIT3BfRDdtQS1FOW8wU3ZJMFIwVDBlS1pFYU0wWUpmcWhxX0xoSnZMOW1mSEVJUDJ2dU42TkE2NHFWRS1zSWxLU091NklILVg4UHZ4clhLQ1FSdmtOTHdPNV8xaE9xM0t3?oc=5
2026-02-25	Google	0.0	Lido Staked ETH USD Oversold at $1855—Can STETHUSD Bounce From 29.75 RSI? - Meyka		https://news.google.com/rss/articles/CBMinwFBVV95cUxPa1JIREo4VHZ2WEI2VXRtVHJQeW1qaWpsdlZpWnMybkhtRU1qVVdTS19oTDcxR0I4Rm1SME5nYzVFdDNmd21xM2NrbGRyNmJwU2FlNjh1aVZPVzgxVjFPb1pUbHNTZ21FTHVYalYzRVlnM3Y3bDFheHh6N3pKVUxCaTNWZTNQX2RqMkFPZVZUOUdMMGhTR0RaZkNlSkpHWEU?oc=5
2026-02-24	Google	0.0	Bitcoin And Ethereum On Their Way To 2026 Lows: Is A Double-Bottom Coming? - Seeking Alpha		https://news.google.com/rss/articles/CBMiqwFBVV95cUxNUEl4OEd3UWtRZjRzbWV6MWhiY1VZY0tLX21kVFNSTjF3VFhyN2lMMXNkZmg3d3dKclFKWDhoRFRONVZVc211R0ZCT2pSXzhYMXdwUG1vaVVYRkNCaWozNjJSZVZpdGZTLXp3Ymdrd2U4czhnVHA0X2hVVXNBdlVIcHdyR0tPM3BTTXJXUGFPblZzcjlGRWVHMHpNbE1EcVRYbEZVcmlWVUtFd0E?oc=5
2026-02-24	Google	0.0	Bitcoin's Quantum Rigidity Is Ethereum's Biggest Bull Case (Cryptocurrency:ETH-USD) - Seeking Alpha		https://news.google.com/rss/articles/CBMingFBVV95cUxNajdodXJ2a0RNVFV6TTdmWFh0c20zTHdaSzZ1YXg1NWRqTXBYbkJ0d0d5WmFnbi1sUTNWYlBBV3VoVmZDcGJ1UUVJejgtMzNHNENFbWo2X0pmaHBsaGNpNm1HTThyeEhPekhZLTlqNmZxNDZHRGdnd05TcDlEN3dnbVVMa2wxdHZmWVdUQThyYndlLWhjX3VzcFRNMldIdw?oc=5
2026-02-22	Google	0.0	Ethereum USD Trades $1948—Can ETHUSD Recover to $2960 by Year-End? - Meyka		https://news.google.com/rss/articles/CBMilgFBVV95cUxPYWo5czVMajhqT3pWNWZOUXV3a2lJLXNMZkcwOExoMWVETjlMUmdvQ1dPb1lBWjE3dGpBM3RfUUlyWFc1WFYxcFdoTVpwQVlZZzJMbVhkaTZzRmFEdHh6ZjJhTU84R09EbkdwaElLbGstODdLMm1HZ2tpTGF0LVVtazVVSVRLWUhCM1FFLWo5X1BibS1oN3c?oc=5
2026-02-21	Google	0.0	Ethereum USD Drops 34% YTD—Can ETHUSD Find Support at $1,465? - Meyka		https://news.google.com/rss/articles/CBMijgFBVV95cUxPSlZ2bG0ybjEzMFVuVkExbWVfNEJ0cVM0LTU0eEdzTG5DYTMyYmRmMTdSSzJJd25zT1A0SXJhUUdhOTRCY1o0TnJTaGxZUTZOcXUtcDdkZkltUFp3ckRnZHR5cGFZalZLTi12VHVzemNLR0J5dDdHWUUzUlQ5bnBwbG01Q3JqZFNISlFDZ0RB?oc=5
2026-02-19	Google	0.0	Cosmos ATOM Ethereum ETH USD Defi Erisprotocol strategy - vocal.media		https://news.google.com/rss/articles/CBMiigFBVV95cUxNbFdDYXpSRHBYbWF3U0FJcU1YUDFVRUZsMlJIQkY4enJjc3lLcUgwWFFuUGRuMGhQTVNiYldDNDlVOE1TVmZYZVlJTG4wTzhXQ0hnSTRka3J2cVBPQ2ZhbGZjQkZxZzZTWUk3MGZjZDNBNXRleGJfX0l6UGdTZndqWF9YZFowdUZsT1E?oc=5
2026-02-19	Google	0.0	Ethereum Price Tests $2,000 Floor As Risk Sentiment Turns - Seeking Alpha		https://news.google.com/rss/articles/CBMinAFBVV95cUxOVm0wci1uRjg1RVJyNkJyc2tKNW91Nkp2b3VrSGNGdnRfTjRSeE41YW5MeVN5cHdSRk90QlhOVVo2UFNHbTRnT3d4Z2tka29JSk1VR193ZFRpWndsSEVyR3FzZFgwejBsQ3Bsb2RNUW1neVN5ZE5Tc3Fxa3U1Q3c0UmNmVVhGOURTaVhRSXJyZy16TVdnZkJEQ01CT2Q?oc=5
2026-02-18	Google	0.0	Ethereum USD Slides 0.16% as Market Sentiment Shifts - Meyka		https://news.google.com/rss/articles/CBMihgFBVV95cUxPZGxqRjE2UF9tSmVXejBJd3VDTzZsNU5aVFNESDVTMEg2dTFaR1hRY0xZenU3MUtCU3FiVUx3b1VWZUQ3dmhvZ29wOFRqLXQ0aUNEcUlhWDYzS3lqT1B4YkFCYjhPUmNDZFJCdlpscnNTblQ5b2pQWmxhR0RzaDBHbkhtZmdNZw?oc=5
2026-02-17	Google	0.0	Ethereum At Risk Of Falling Under $996 (Cryptocurrency:ETH-USD) - Seeking Alpha		https://news.google.com/rss/articles/CBMihAFBVV95cUxNMlR6X0pNWmhhcjUycGxKLUdWUXdNd3RlSW1xSkNUOFdHNjNCQmVvXzFVaWoycnZ5V2VuN0tDOGptZVhjNDBYMUVTSlZvMmg3ajl5MjN0cnJCT1pucFFMbl96d2FwWUs3a2tmUFN1dmJ1RWVZM2g0Y0hwcHYzVm8weWZwSGo?oc=5
2026-02-14	Google	-0.156	Ethereum Up or Down - February 15, 4:00AM-4:15AM ET - Polymarket		https://news.google.com/rss/articles/CBMiZEFVX3lxTE9uVFJrVVdkU29rLWtFbUUxZ1hfZkRnQ2NRWGVkQlhzUU8tZDlNLXpOWjBNTzhRd211TXFqa2NUUjNRNFdiUkg3VTBMZnYtem55VjZfRFB6WHFCSGFKMzVhc2NFYXA?oc=5
2026-02-11	Google	1.0	Best Place to Track ETH Price in USD for Australians 2026 - Bitget		https://news.google.com/rss/articles/CBMixgFBVV95cUxQQVdSQjcwNGJNakRZUm91dVZyZ2hWNTVoamFyX3RMV0VVZlRPS0xUanVRemZrY2JGekdhZnk1bWhmZVFJdmpPaWVjUjA1a19jMEI3SUZ4V1hmdnc3QlpWaUVnWE5mVno3N1hNMVYydURCMjBmRTBQR2pNUE9OT1dFTnhQcXp3VzE2TGlBeTNXb2pzUEx2UUN5dWJ5a2s4UmhaYjBST1BhTHpobU5VbF9xV3ZpaFFud1g5RzJ2WTU2UXhCclhuaGfSAcsBQVVfeXFMTzVTUjBhcFBUbVg0SGhMSWxIamxGT1JMSk5mbnRBM0NpT29NT01kd1o0WU1zTXFyTV9YVWF1bjE1LWN6OG82UmtKekFzTUQ5elNEem9sMFg3MGVFRjNkTENSZ3RybnNIeXE1Y2hqQ3lmS0Y5VThqUDljaV9vSmdnQ3pGcHlMTGJ6bUFTNnl2dFBWQ0VHWTE4Z2ptaC1NT1NDNnMzSHgzZ0ZxQXFvOXBNRm5qZ3Y2YVFoZFBTRkNrX0JWYXotYVpwZHNzNGM?oc=5
2026-02-11	Google	0.0	Ethereum Under Pressure As It Falls Below $2,000 - Seeking Alpha		https://news.google.com/rss/articles/CBMikAFBVV95cUxNR2dpek1wdG9UMUdDSzZ5dzZ6cmtrbHBDME04MnU5U3pxckEyVDNKMVc2WElsR0pmWmg0S253YjRROHpOMVQwLUFDSXItNXA4Sk1yYWlZYWV0aDBsWEJ1dEdLLVdkejRhbDdEaTk2eGo1ajVyYXBYdFJldHV1ZFYya3ppOVFtMGV3VU1IZ25wWGk?oc=5
2026-02-10	Google	1.0	Best Ways to Convert 0.05 ETH to USD in 2026 - Bitget		https://news.google.com/rss/articles/CBMiXEFVX3lxTE1EVmZ5WC1IUlhZNkNGc1M3TEhCU0ZFWXc2MUpqZXNRMGJMUDRnQUI0MFJRSk1mR2lQbkNmRWV6S3h4Vjg5VXpPS3V3aERiajNjWkFlVzRjLVRJYXRw0gFiQVVfeXFMT0NDX3Z5eHVCc2QzcmZkLW9lWnpybklJUnpjU195dkRfM1lsTU5peTBGTmVBT0dKbGZTbjJaM3E1eV9IR016alRScjBTdnV2S01KbHBMY1E5eXhyRFZ2RkR3b0E?oc=5
2026-02-10	Google	0.0	ETH, XRP And SOL Outlook: Altcoins Struggle To Bounce (ETH-USD) - Seeking Alpha		https://news.google.com/rss/articles/CBMikgFBVV95cUxPclVtQVF3VTN4bV9ISXhZOTVLS0owdTlwdlNRTC13Mzk2a2luSldEZWNmODlBNi1qaGlvSWNqWlhWdHVWdUo3cUlxMEFaeGF4aFQteGtscXhDYVFDR0Z5bUxyOFBKT0NiZ0gtalA1d0hDVzFhNE85cDZQcmJMNnN6eGIwODNGSHlWNGVWbEg1WW9EUQ?oc=5
2026-02-06	Google	0.0	Ethereum ETH/USD price history up to Feb 5, 2026 - Statista		https://news.google.com/rss/articles/CBMibkFVX3lxTE9jaXhWZVh5VGZyWmFWcEcwc2daTVdoQ2xDZVZ6R0hjcWw5Z0FBcWNZc21IcEc1Y2ZvWk9TY21vTmI4UFhUQkRTOUkwSExGZmJNOGROdEtjMHhLM3c1UC1KbDNQNG5zLVNoNHIwM2F3?oc=5
