Date	Source	Sentiment	Headline	Summary	URL
2026-03-03	Google	0.225	Opioid Crisis Grants now available through Iowa Attorney General's Office - weareiowa.com		https://news.google.com/rss/articles/CBMi7AFBVV95cUxQaGNHWVNuSUxPMVdZZlZRbV90RjF6VnJveU4wLTR6ZkZYMkI2WjlUMlVxaHl2LTRkblB0d1BSSm5pVXpJZWdEVkxmSkZQRlB0YjZGLXo5N2ctMXNLZURrRFpCOEo3ck1GX3R5TzRFTHRkYm5yV3BsQU8weFJ6VHlMbjBOUGhDc0g3MlFhUmNJMWxxa1k4aDVzMERJdXVCa2wxODFiVElmd1p4Nm4yYTZIN0xhNHJIVEFGMGNUalJ6Yl9RUm9MYWtZWXlFcDFwZktkS21YYS1UdjFZT0MteVFHcHlDTTZ2cFlOWGc2RA?oc=5
2026-03-03	Google	0.17	World of Warcraft®: Midnight™ Now Live! - Blizzard News		https://news.google.com/rss/articles/CBMijwFBVV95cUxPSy1IQkg3ODZMVDlaR0NiY3BBbW83OW1hTlQzdWFqaWRuRHRlQmNyWHp4cTgtbmg0WjVCcXFkaVMxNURhRWJCVWRXamduNW11eXRjREx0TkJQUlNvT0xFZ1JNeEdRWE1ZUEQ3aWdsNFh2ZHQyOTQydkhjVlBia2Q4cUgwSmJ3R1FWRE9ZajlJUQ?oc=5
2026-03-03	Google	0.1	The Middle East doesn't matter to markets as much as it used to, says Jim Cramer - CNBC		https://news.google.com/rss/articles/CBMivgFBVV95cUxNWVJONzZwUzZ0bjY3WHhOTWtYcTg3RHNJRGNqaHNWUU1Pd1VoNTlsSXpBckhsWHhlYVR0S1J2QjdnbGh2eVp3UWxNVTVPWGswOUNkb0NZWkVETDN0N295QjBuS2Jub3J6dU9qaWwtLVBvaGxLOF9pSk5vZ0otOURka29nWW4xTTVaUHNJYWtYTDEzNldFQjFhV2dRb3RweDQyWkgxdHJEaU9FaG9VM2FLbFRBaEhCWmVUZDJ1U0dB?oc=5
2026-03-03	Google	0.0	NHL Now: Fill in the Blank with Trade Needs - NHL.com		https://news.google.com/rss/articles/CBMisgFBVV95cUxObDJsMVpEZUtqbF9lYzRuZ0xCWENqVnZKWG5GTGJyN0RlTVVRQW1jYkptWm1kenVmRnIzVzlqU2pMclVLR3d5V25pV3lkcmIzREJMbHU2QUIyMmVXNjlMSzlkU3E4NGs5bHgzVFdGTmJmRUNtLUppQXJiXzJSYWMweUFWUnNvcnUtbmZpWDhuazZ0dk5WR3ZCeTRPb0RzZjVHT0VUMElXSm1VQUhnTmRXdzVn?oc=5
2026-03-03	Google	0.0	US urges Americans to ‘DEPART NOW’ from Middle East countries - The Hill		https://news.google.com/rss/articles/CBMikAFBVV95cUxNS2VqQnRkaUVJczdnem9JUU4tV1lTaHg0R1MtWjhtRHNtNmN1YXoyOHBJempwelY3M2c2a0p2cUZXQjBzQUpHSU9PM1dPbUVrY2NPN1U0SjF3MlJ5bUZSclo4T3FTaHVSdm80eENQWEZmT0g4ZkY1OVo0WmFMVkI3OWktZEVkV0Y3SzZIdjVmYzLSAZYBQVVfeXFMTzB1T194S1lmYnpDd1AxZ1FJZzdIcW4zSTBRTFRmWEdIdWQ0WmpWYmhya0Z2V0lZaUV4d1l0VVAyTVlIeWJVLWtmU1FVeHdjMFdVZVRZX184X3M3T29VSDVCeVZDbHdWRlVHcGxxMFQ1M0s1ZERaeHJvXzNLeU1iREJuQVVZdDdkSWRrUVRxNWdldnJQN1V3?oc=5
2026-03-02	Google	1.0	6 Best AI-Proof Stocks to Buy Now - U.S. News & World Report		https://news.google.com/rss/articles/CBMigAFBVV95cUxQWWNVSDY1cUR6NVFaalg0S2R1OXpBNUhZZnFLYUpNUUVGYnZxSVJhdGZPNnlMMXFZYnB3TnZXU3BPeVFVVHhqUUFCeVVWOV81SXNDRFlqYkVhaGIxMGZhUHJhQmtqSi0wd2FBUWNtWHV0WnFLNUNvQlV1TVpwTUhLNw?oc=5
2026-03-02	Google	0.643	Which gold coins are best to buy right now? - CBS News		https://news.google.com/rss/articles/CBMifkFVX3lxTE1FNVdJcHVnbzZLN1JMd2dmczB4ZXJubkc2YnVpRGdpbUluLTdiM0wyR2piOXNaQ2Qzb2t2SldhcDBPQkxoa1JqdkVpWndtVk96YWdxVXYxYUJjcm4wSHNfQnVVNW9sejFGb2pPVXdXT1UzOVZMbjFVM2dsdHR0dw?oc=5
2026-03-02	Google	0.5	Beaufort Co. residents talk SC Hands-Free Law; Tickets now able to be issued - WTOC		https://news.google.com/rss/articles/CBMipwFBVV95cUxQRDNzRzR2TDVKNEltSnVYa0tuakRQRGtWVEE4UFNSNklfU285SElnX3ZuRjVxUGRMTGkzMUlIeTNwcGxndzVCb0tpOU5ERDNKUGFNZjJTYTFTY1ppaGdJODZ1QVIwZUZIeS0yM2FSWFRaSWFUSnFTZkZoaGswUC1EV1FVeGVOejFndU1KbnpnVzlRZWhxbE9HZHJHd1FCZ1dkU2QyTGdJRdIBuwFBVV95cUxNVTNKTDU2SHlrM1J2cHdRNGJIcWJueG8yU1E2bkVwaVdwTXJRa2hiTXM4YjJDWUlsQmtfV0FCbEwtQVktWWZQLWk4dThVTXZGTmZiYzVQNWd0Z3FUaUcxY2dhZTJENUoyblRwUk8wZmIxbUJQbUFuS3hGZ2V5dDY4TVZiVjFrY3RsT3p1LUZZU21uNmRZN3c4Y1ljTUV0eEhsRW14NTdxakVVOGxUQ0JlUUZmb1FaelZDVWYw?oc=5
2026-03-02	Google	0.5	Connecticut worshippers sheltered in Jerusalem church amid missile attacks, now safe in Jordan - WFSB		https://news.google.com/rss/articles/CBMivAFBVV95cUxOUVczRkc1MTFkMGZGTzFrY1pjamZvRThmMHVFMnBZaXVNOUkyd3hUdEFvZHJYbHVGYk9teFBKUTdQanZkX284Ni1BQ0JFaVd5SHhKSWR6V2RYOGREdTh0cnR5QktMRmVUQmhRdzZpYl9MRm9CWjZhSGFTZjVhSUhObm92LXBVaGJNUVI1ZXphQzdWQVhlSXVjazI5XzVZRjVYN0dObENQalU2WmZCRU94WmF5VTVUV183TDFiTNIB0AFBVV95cUxPbENtM21fak5QRVdfTjAwdkxVNm9GT214Y0VCbGtINlZnTmw5TTJ2WHQ5dGZ3NU5oeURudXYzY1dTV3dzODdOSHM4Q2doOTJSa2dwY0xsRkE0aFhJRk1RZVBEZHhoYTI0UFVOdUYycllfUUYzUTRyVjZ1eFRYMVBFMHZmMVhSQXdaQUpGUDR4X3NUMm9WSS1EUU9RRExsMmZsZk41dGQzQlRhNmtpZ2QteDhpcE40alpNbHNiampLVmFyRVk5X0Zsa3V6RE8zYzJM?oc=5
2026-03-02	Google	0.443	Should You Buy Netflix Stock Right Now or Wait? - The Motley Fool		https://news.google.com/rss/articles/CBMikwFBVV95cUxPcC1IQUNMSUJmNVQ1OTlvWWVKN2ltYVFQaE9Va0trM1EzSlVGeHBfb2FtOEJOamFEV0VXVHc2anY3RjFPRlBCeGg3UnVpYVZvOGlvbU85cl8wNldBZEFFeEc1Nkl2ZEtwZmJzSWtRT2FPWWNlVkRpbWMtUFBPQXhuZ0xQNEJ0S3JmLU1rbk9LZWRBZUU?oc=5
2026-03-02	Google	0.443	The Smartest Growth Stock to Buy With $1,000 Right Now - The Motley Fool		https://news.google.com/rss/articles/CBMiigFBVV95cUxQUnp4SE4xZVJZeTVqN2k3Rm53dURWU21GRHlMeTZrYV9vM0hORWNKcE9pM1BLZVRTWG1SUmNET2gwYlNtSkJEb3hSY2lMTEc0QmNlZWsxaEFhaUluR2FCYkowVGpqNS12QTBBZmJVVmZpRWFrXzhUdVU0YU5kQ3VHNGpndkJKMGFNZXc?oc=5
2026-03-02	Google	0.429	Is it safe to travel to Egypt right now? Latest advice - The Times		https://news.google.com/rss/articles/CBMikwNBVV95cUxPN3pvY0VJYVJzeWxIRjZ0QVJsN1c4eHBDSEtzcXhwYk1xRWI5c2lXU0w3dDBNbFlpa2pPbUZTX04tZ1dkR1Q4RVhKZzFPOG5sM2ZkQk5DT2UzY0YyQ2ZPN3BLX1hhM21LUklzaElRWmRSZ2ctdU9jNmRHWU9FamdabjFFeVdJZnkxNEphUF9Cc1VUUVE4N1V4d3BtQ1NsbGU4QlQxaWQxbFdzMUswWG5xSE5WdkRldHoxWDRnRmREOWY2LW9sSnplLWNLY3VORFlRSWZWSk5od3pQaU5MRGJIa3pidTBjSm82bTUycWltLUtsazc2NEUtVE9TT1IzYkhVMkp0eS0wZkhEXy0wVHYzRUhBVkhGaTZwUFVBanBpOWRpczRmaDRlUXdFT1Y5eDRZcklGazhQdWF5eUN3NlJTN09DS0FnZFYtOGtwM09wMjZ6SmxNYVBZNW5hR1FNRWh1a0cxVXZLbnpNUHB2eTFkWnd4ZUI4Wmd6ZmRTWTFXeFNrdVJUSml5cV9ZWDlFTGktNE5n?oc=5
2026-03-02	Google	0.417	Plenty of warmth and lots of sunshine now, more mild air and some showers brewing soon... - WSFA		https://news.google.com/rss/articles/CBMirwFBVV95cUxPdEVsWEROMWVKaUdZMnc5VUxtSjJlb05TMWtvVm1KaTA4ZlpqeC1CS1VJNGlpWmNtQVhnUDdDeHh4eVNaWDFtd0tXNnUzMzgwUktUNU84MjVXYVJZN3R4UGg0NkQ4QnN0LVFDaUZHeXV3OHYxdy1WQmR6OXBJT1RyVm53SDFqNDVOWFpUa1Rvd2ZPN2hKMGx0Smtkakdld080YXd4bE9hNWpvLUEwTnhB?oc=5
2026-03-02	Google	0.4	2026-27 FGCU Basketball Season Tickets Available Now - FGCU Athletics		https://news.google.com/rss/articles/CBMiqAFBVV95cUxQakwxcS1aakhELUd0UXd0QVBWODhVLUkyck5jZU9DQkpzQXRMUGF1YUVEZ0VhMVZTRUt6Mk5yRW5CTjRaRkxPWHA2YWJRWmtTVHRhVDFRVHh4YUN2YkYzb3pMNlFTbnJ2d2ZKVVRvSDJoQ1RwMHdCQVN1SGFIc1FkU1NlcGlmOTlVN0g2V0kzeGJjNkNwUl9RSWVyU3VZODg3MDlJNnZkdlc?oc=5
2026-03-02	Google	0.4	Colorado fishing licenses now available for 2026-2027 season - Denver Gazette		https://news.google.com/rss/articles/CBMipAFBVV95cUxPdEh3aTd6TVh5NTdUNlJ5RVBCbEJKcF9TVGRWeWtUOTI0TkQwdVBLMEpVQmZGUm93S0lWazZmRXRleERraVRFX2o1WVJ2MXF3Qm5BUGhiLUpyMFlqSl9ubXUycXR3Z0lDdGx5OHMwMV9YQnNmUjdoUUFuYTRQU3NseFF5OEpacXVQckxXUnBWbkNzSDVEY3BtSUVRZ3dyRjNlNjUyYQ?oc=5
2026-03-02	Yahoo	0.4	NTT DOCOMO, StarHub, and ServiceNow keep travelers connected with autonomous roaming resolution using ServiceNow CRM	BARCELONA, Spain, March 02, 2026--NTT DOCOMO, StarHub, and ServiceNow keep travelers connected with autonomous roaming resolution using ServiceNow CRM	https://finance.yahoo.com/news/ntt-docomo-starhub-servicenow-keep-060000369.html?.tsrc=rss
2026-03-02	Google	0.4	Spring 2026 Explore Now Available - Prince William County Government (.gov)		https://news.google.com/rss/articles/CBMibEFVX3lxTE1iWHRvUmt5VTNLNDI1YlUxc2hGaDdlOFU4NjJJZktUSVMyUko5aE52N2d4YzBCenppS3ZMVk92ZzZLZjh0b21jQWxRNnhtR0dveWlMaEg3Z1h0LXZ1WGJIOG16b0c4bkcyaVhNSg?oc=5
2026-03-02	Google	0.4	Tickets now available for Heartland Motorsports Park racing event this fall - WIBW		https://news.google.com/rss/articles/CBMipwFBVV95cUxQcHhGZHh2SlJvOUFFNmJ3RmlUOEdCdldQUWJXWWlkUHdkam9JU0w0aFYzamJzQzA0bnZVVzVnMGZRaktLTktnNVJad3J3TEVMTlZ4a05sVzVKakNTRHVVNThFbDZKSnpTMlRJNktNUGJDVU5FU2tLZy1kVWFILURjVXVuaVhxN3hpYXljMFhCRkF2eDlaM3dIcGRfV3BoVEcxQk9WSm9ESdIBuwFBVV95cUxPY0VwdFpuTl9hLURxWlNrTFJ1amlnOTRxLThud1R6YjE3aW9kcVhuVjNsRkJVR1Yzb3BiM3U3MVI0eTBtMzQzMktKRWxtdy1UNUcwc2ZyLWdqX0FJbEltLWZoQ2pRSjRRZG1QZDM3LWw1VEVNQjgyLTZVS2NkdUhtSVJfMzZPQVFtaGVxbmluOG9SaGFrYU40WGhUNkhYQWY3bWhUMllOYjVwaTZ1OHg3RllPc2NEODNEQXlF?oc=5
2026-03-02	Google	0.3	More rural students are finding their fit at Northwestern - Northwestern Now News		https://news.google.com/rss/articles/CBMipgFBVV95cUxOY0R0TndUYmVRZ1JYNUJLNXpvZzFwMkI1ZWNhMXFmYk1nMkNONmJBRHJWM1RaZlNLQkY5TkIxbnQ1TnRXQW84VU4tSml0R2ZrVWxDdFhxVlp4ZjZLU3BPUjhqWGMzRmVZVXlkWDV3ZjU5cjAzbnVkR0RYd09FMjZOWHBqX21hUndsQnJDbnlYV1dEYjNwS1dnNlhhOTlRa3dUdVNQLVl3?oc=5
2026-03-02	Google	0.3	Vegas Golden Knights Foundation Now Accepting Grant Applications - NHL.com		https://news.google.com/rss/articles/CBMipgFBVV95cUxNbldOUVQ5UGJrc25SUWV6SWxETUI4a29oU2M2YTlsWVM0S3h3c2F0U0lEVkw1b2dlN014MTlFZ2NqQ2N2R3JyeU5VeVp5Umh4Zmhfd1EwdUhCVTZKcTUzSXJEQW9MTURCckdmaVJmNWg4OHVFcHVNc2pUeTA2cy0zMTllaHVKV3J6VWtsa1RBNlBXb3ZjU040bFBGZ0x2cjBJZUoyaXBB?oc=5
2026-03-02	Google	0.268	Now on Resy: Baro, Fat Rabbit, Lowerline, and More Local Favorites — Resy | Right This Way - Resy | Right This Way		https://news.google.com/rss/articles/CBMiY0FVX3lxTE0tNFQwYldScXF3d0ZRVDVNVzk4c2NOZ29JcllJalNXdm9Zakp4azEtbzBVNW5nNzdjYWdELXVXTTBfZVZCbHJzSW9PNnVnenUyTW4yRXI2ZzZDVnJxVDV1TGNVMA?oc=5
2026-03-02	Google	0.26	Yes, relegation is now a very real possibility for Tottenham | Jonathan Wilson - The Guardian		https://news.google.com/rss/articles/CBMilwFBVV95cUxQdWcwZVIxaW14V1BldGpGWFJSeXpVVXUwdEl0MkQtMkFKaVJsZGI5aUk2Mm9ZNE8ySndfdGJUOEw0VjNtdzROUFFnWDd2eDlHLUt2Y3R2ZkNWX1JMd2tKVDd2MzE0djhnMHFNVm5oUlRuOTd3MXRvMV9icU1XVXpzRWQ0eENoYk95RmI3YWpJdTNpUGs4S1BB?oc=5
2026-03-02	Google	0.25	Copilot metrics reports now return consistent usernames for Enterprise Managed Users - The GitHub Blog		https://news.google.com/rss/articles/CBMixAFBVV95cUxQNHd6NFB1WkczVWVmTDBRTk5lX2kyWFJnNTNJWDBlODB1VWY1NFNnZlVQSWVYbXFvbmFYMnFoX3lFcjhLcmlQcDNRUXJfQVpDMWZDRkxrWGhSNGNMZmJ2ZnQ4ZjRwQXBlUlR5dUJBeFhWbTh5TEtwbF9mZ0dLV2dBUUxqeDV2UXF3YUNlSlp4VjViTDZEcFNZOUt5M2xFNTRabFVxT0g5bGc1aDBvVTFkdEZKc1BuWF9tT2NvY1Z5MmJtTE5B?oc=5
2026-03-02	Google	0.2	Israel Was Ready to Take On Hezbollah Again. Now It Can. - WSJ		https://news.google.com/rss/articles/CBMiqANBVV95cUxNRGlNWXVUeDBpVk42dUNMM3FzejZhWGtEQXpuc2d3TTdVNUFKcXByZ0tvTFFTZjA2OHMzelRna19yOFJrX19IUnVGZmlDLXdYNm85RTllUHU3U3BNdloyU1dkbFRDdEJOVHM2czVwdnlNLXhsMndEMmtIXzRVRlhiZWlTdjRxZFc5OC1zdjBzS1ZqMUl4VENuWWUzREJNbm9TWU9Uand1ZVhKa1BfenpBQlNkVlR0Z3pBYmxqTE9aSWNwQ2ZjLTBGNXpMTlNid1dHX3pWakpOV3hRdVFXNFIxOVZpY1dqMmVFN01VcHFSeDNzODUyWlE4QjNUWlg0cHBLSkNMeEo5MHV1VlVLTVNFZmsteUpDSk1NbXZ4VnVYM2FOVXlSbW52cXl6SnRmX1FkbVVXM1pmeEFuNUJfUm5OVkp1TlVmVGk0cmhuTE9sVEdNY0VNTHhPeFVJdnJIRVg4YnRxdEh1RHY0NHdFZEVpamtRZ3Y3cGt2LVpHcDV2WGxsbE1jZlB4bUtucUxNdGRLcGRseWVwMkVpV1hra0huN1FOLXZTOWZO?oc=5
2026-03-02	Yahoo	0.172	The Speculation That AI Will Eat Software Companies, Let’s Clear It Up: ServiceNow CEO Pushes Back on IGV’s 23% Collapse	The software sector is having a moment, and not the good kind. iShares Expanded Tech-Software Sector ETF (NYSEARCA:IGV) has shed nearly 23% year-to-date, with a 16% drop in just the past month. The carnage was indiscriminate. The sell-off hit everything wearing a software badge. Gaming. Legal services. Brokerages. Trucking. Cybersecurity. The thesis driving it: the ... The Speculation That AI Will Eat Software Companies, Let’s Clear It Up: ServiceNow CEO Pushes Back on IGV’s 23% Collapse	https://247wallst.com/investing/2026/03/02/the-speculation-that-ai-will-eat-software-companies-lets-clear-it-up-servicenow-ceo-pushes-back-on-igvs-23-collapse/?.tsrc=rss
2026-03-02	Google	0.143	There are several accidents in Knoxville and the surrounding areas right now - WBIR		https://news.google.com/rss/articles/CBMi5gFBVV95cUxPVm1QVm0tVUtYMno3VGZlVV9DVmNIUDc3QjdBRGppSVYtRGRWY0k0SzNPQUEyZURrTVJFQ0FXUFJxYTc3Ukw4S1NBT1B3X0V2YU52a1B3eGtIVTlKTEVTVE84RVRiSjR2emFTMng1QlRWMFptMEpMWHFXWG0yY1lZRjZVR1puQ3doVzhMTW1qTDFqVUFRYVJfTjl1Qy05b0ZZckFzUGVxeXBCNWxER1JHbW9ycXZJOWRWTHpFdC0zdTVxS213TnFYOXFnUW1xdmJLU0RZU2dLWDBjaktaRjRTYTlSOUkxQQ?oc=5
2026-03-02	Google	0.136	5 new businesses + 3 closures in the Birmingham area - Bham Now		https://news.google.com/rss/articles/CBMiigFBVV95cUxNOHNPRFVqM09FWWIxZGs0UlhLUGlabkhqNEtoTUhDR3VQX2c1allidU1fQ3NnT2c4YUFwS2RobDRRQTZDcnNZRlJmZFlxRFVCUm90eWtJaGRneGxjUklFRC1qTlgwSktHOTNfUy00SW1UWkU0NDdYSjctSVhlM3pneTExVVRsdHdIT0E?oc=5
2026-03-02	Google	0.136	Gaza's ceasefire had momentum. Now, some fear a new war in Iran will distract the world - PBS		https://news.google.com/rss/articles/CBMiuwFBVV95cUxQOVRleG9SVU9DNHp6ckxxMmhndjN5dFdDREV1Q0RpR2U2Q25KMkloR3VMb1JiaUVTWHhLSWFDRml2Zl9ZNkZkUmo1SnN1OXUzekpvbXU4R1Eta2l2eVpCRVdyVUY3WGN6TXpYVHhTaWh3U2ZQSzBSZ1FsT2poSnI5REhfRnZIOTc2YlIxLXlMRWpOYTM2TG0wZF9md1ZNMllJeThrRGtzZFctNmk2TG1reUgxbnhqSDNnMUVJ0gHAAUFVX3lxTE5jN3V5MzFHVkNMRWJ1Ul9OR3pKVXFhcktBM2lYWTF3cU1ueUZRYzVfdXF1c3I4U1A3M2VLRV9UNS05aGVpSkRmUWpqMHFDTG14QXVhUUQ5UkZxR3UzTXpfbmlEa1VWTDEtb3ZaNlh4ZWRBUFdITUVEQ0RUS2VRTktHVU1XN2pjN2djaXFTaGMzazhEcXdwX05JeFhfVW5Xc2RlRDlXVXJaa0NSZHNZVjBCVEIxQ3dSMzVKVEJfXzh1Qg?oc=5
2026-03-02	Google	0.136	Paramount Won Over Warner Bros. Now for the Regulators. - The New York Times		https://news.google.com/rss/articles/CBMif0FVX3lxTE0xeGFYY3Q3OUtQM3hnN1czUjVhaUNULUItVTFGaVYzcFRfT3o0RkVRb0V1T2o2QjRoZTVPU2ZpSTNGUFB6LTBlQnptalJ5YTNHekNScVJ5Tk01ak8zMlF0UnYyamtOUFo0VXpuQmF5OFhQem5tNGNxdGdRUjZIR2M?oc=5
2026-03-02	Google	0.136	What Now in Iran? - The New York Times		https://news.google.com/rss/articles/CBMifkFVX3lxTE5hbTVHVVFXbjkweWFjN2lBYlNDYzRpcDRUVjFMdElyTmpJOVBGSFE2STRNSTBTYjN1TXlHemZ4OURnczQ4TFptRURLNmpvdV9rXzI3OFZZX3hnTmVTcUVsQnplcHZxR2ViUEVZWldtT3pEYmhodnJlUUlXOGJnZw?oc=5
2026-03-02	Yahoo	0.133	Lightspeed Makes a Big Bet on Self-Driving Trucks, Loading Up on 7 Million Shares of Kodiak AI (KDK)	Specializing in AI-driven autonomy for commercial and defense vehicles, Kodiak AI targets clients seeking advanced navigation solutions.	https://www.fool.com/coverage/filings/2026/03/01/lightspeed-makes-a-big-bet-on-self-driving-trucks-loading-up-on-7-million-shares-of-kodiak-ai-kdk/?.tsrc=rss
2026-03-02	Google	0.133	Penn State Men’s Hockey Big Ten Quarterfinal Student Tickets Now Available - Onward State		https://news.google.com/rss/articles/CBMirgFBVV95cUxNSFpnMGIwc3pObVV0MGdIU3NfU3ZVUlB0N3lhSmd5MVlwZ01JSlVDNUVXaUU5YnItUlZGZ2Z2V1NBeEFCcWREMkt1Q2JGaWI5ZjB3ZHdzOWdkY09YN0puR3VVOXVzem1DM2Y2TERzZjZ3Qk5Ba2lsalRWY0ZVaTR2bFpDWm5TQlp2M1J3d3BncjdIRlhCVHRMZW1iT0c5RnJBZlM5a0RUemkwR2tFM2c?oc=5
2026-03-02	Google	0.112	No one’s calling Max Fried ‘soft’ now. How the Yankees ace developed into a ‘killer out there’ - The New York Times		https://news.google.com/rss/articles/CBMinAFBVV95cUxNRm9qOVMxdFRocXNoNnBMak45b2ExRm1Vd2FxZkhhVUpZMno1X3RMbjZuYVBXQmpjVHN3WHJTcGZhYjJVTXZCMWh1TGFCOVRuOUZsMk84S19meDJBcUhzeGd2djFxRGpsRkZvZGJmdUFMNXdtTm1LMEJiVjZVRmw2WmNQdjBGdkFjck9TaDFCblB1SzgxdWZPV01wSXo?oc=5
2026-03-02	Google	0.1	The Thirty Meter Telescope Is Still Alive — For Now - Honolulu Civil Beat		https://news.google.com/rss/articles/CBMijAFBVV95cUxQV0pDeEtKTEFtNVpydkJxd0J2OUVsU3lCTnhBWS1JMTJ0dFFsVUZ3ZWw2Qm9EblhWVDVpTWJ3ZW90U3hhdUpqZzltSG1Xem02SzA0Y3NJVFJneUhFZHlVS2pEbGZreEpoS0tRV2Q2a2kyOFQzemNsSHQ0UHZkaml4UXkzekR0azlVUUoxcg?oc=5
2026-03-02	Google	0.099	New York Buy-Now-Pay-Later Rules Overly Broad? - JD Supra		https://news.google.com/rss/articles/CBMiigFBVV95cUxOdFhSazlCbFJxUWx0TWE0SXpsbXRSMzZ4UGJ2ZmM5ZkZRQ19lcmZmQUtodXF0OGttZXF6NlcyRFQzODhoSGFDTWMxVXVFOWxvTFF1am5BdWMtc0JZendERmtRMzEwUVZCdjhzcDFIZzNkUmJmdE9MQ19JNkgxaktkaEVCLVFabFROcHc?oc=5
2026-03-02	Google	0.068	New Exhibit Focused on History of Raleigh’s Fourth Ward Neighborhood now on Display - RaleighNC.gov		https://news.google.com/rss/articles/CBMiogFBVV95cUxQNHczcVVvQkxvdnhqTkZ6MzhfaTRaLTI2NE9Qdmk4LXdzXy1rN3piYW1FMWJCRUVTMGhMcVdtNWxVMHFpTzJrdkJFYXpDOEFqNU92NDJFMWJPZC1mVGFYUW1ldWVJcXdYNnBRLVdFVzBMQzFmMUF0bEQyQ3VreXMtYTdyUkpmaEtzT2xCRUVzVklLMWFibUdOVlBLd281TXNkcXc?oc=5
2026-03-02	Google	0.068	New proposed rules for buy now, pay later providers - Spectrum News		https://news.google.com/rss/articles/CBMijgFBVV95cUxOLU1rdkk3NTdGblhZMHJMc1hjb2c0dkpHcDdKd2JRYkpUeUtwNDNNUjd3SkZfUU0zSjdnTUlpc0xOYnJDYzdhdnZMV2J5NFNNeHo2cVJnU3RhMzNmTmJjSnR6Qm5HcDJOdl83blNxRGdwSVFrRzhLeXUwWXRrc2I4bGE2anpQdEl6YzFtUmNR?oc=5
2026-03-02	Google	0.068	The Last Days of the Apaches and a Search for a Nation Erased - The New York Times		https://news.google.com/rss/articles/CBMiiwFBVV95cUxPdVV0Tmoyc1hJLTA1dmJOcG1RWEJtSDVJcUp2UFlPVF9XUWt5T3l2Y2FGV1pRbC1NWk1aRTBzbG9jbWxid2JXNFl1SnNXT2p2bThWcTkxS2x2eXdScUN1cm1sTWJBUjIyLVZoNW5LWHFuMlZZNHZvY3NvblNPSUFybTNoYUxpYl9mZGQ0?oc=5
2026-03-02	Yahoo	0.067	Transformation as a Living Discipline: Deloitte and ServiceNow Report Reveals Key Trends Connecting the AI-Fueled Enterprise	Deloitte and ServiceNow today reveal the five key trends defining the next era of automation in the 2026 Workflow Automation Outlook: From Insights to Impact - Connecting the AI-Fueled Enterprise in 2026. This year's report pulls back the curtain on how leading organizations are leaving behind piecemeal automation and moving toward end-to-end outcomes. By centering trust in their architecture and letting CRM lead the way, organizations are seeing transformative results powered by intelligent wor	https://finance.yahoo.com/news/transformation-living-discipline-deloitte-servicenow-174500355.html?.tsrc=rss
2026-03-02	Google	0.062	Echinus Geyser is back in action! For now… - USGS (.gov)		https://news.google.com/rss/articles/CBMif0FVX3lxTE5wTjlhZGlTMWNsN2xkS2t3VmFycUFFZ0ZxS05KX0gtNlJQMXRzMmFkZDdjMnMxXzNMYTVreTVIclVRUFBES2tNS0xTQ0c3YTRpR250cmdlNERQdXVQVDZodVJUb3FTTk5wS3gxR2dxcGZ6dE1TQllJdWlIcy1RU2M?oc=5
2026-03-02	Yahoo	0.047	ServiceNow AI Push Targets Workflow Automation And Telecom Roaming Growth	ServiceNow (NYSE:NOW) has launched its AI-powered Autonomous Workforce and EmployeeWorks platforms, aimed at automating complex enterprise workflows. The company also announced a new alliance with NTT DOCOMO and StarHub to use AI for real-time automation of global telecom roaming issue resolution. These moves extend ServiceNow's role beyond internal enterprise workflows into customer-facing connectivity and telecom operations. ServiceNow enters this phase of product launches with a share...	https://finance.yahoo.com/news/servicenow-ai-push-targets-workflow-210702786.html?.tsrc=rss
2026-03-02	Google	0.033	Grow the Game: USTA Micro-Grants Now Open to Support Love to Programs Across Florida - USTA Florida		https://news.google.com/rss/articles/CBMisgFBVV95cUxNS05WQks2RlVFbnd1VUtVTVNwRzRqckFBRllEUWN3amI4a3V5SE1LU2gyc1BMY3JZaFZhcWJhMEtRNloyV0RsLU9POXZ4Tm1YRjhfeXdMdEJhekdXSE9LYWFsaTBjTVJHVDRtZWhDdVgtMEE0a2JlcmtKbXZhRkJ2UTBkZi1Ga2dfSkxrR0pLWjBhREJyWGZ2bG1oVVNfekVzZkRRY3hRcERlZVNWeFRCTzZB?oc=5
2026-03-02	Google	0.033	Now Arriving: Renovated International Arrivals Area Substantially Complete - Blue Sky News		https://news.google.com/rss/articles/CBMingFBVV95cUxQWlRYMmExZmhXU2tjQmkyM2YyNEd2bDcxaFZ0ZW1mZTgyUzRicExfNVZ4OVBJMW1mVDhYTDE1M1oxalVVZTA1RDN5cDZDSWVVX3A3bFBUVVo5dXpzTzAtc2VyeTVTZ3pEaUxqVUZuSG10V3p2bXA5XzBrLVptbFUxdnVSRk1pS1UyZUZ4T1VtRzY2REtDWmNVX01iWDB6Zw?oc=5
2026-03-02	Google	0.0	'Here & Now' Highlights: Jeff Wright, Charles Franklin - PBS Wisconsin		https://news.google.com/rss/articles/CBMijAFBVV95cUxQdmJXSDBWVk1xdnBJOEVqbnF5Ml83TkRDMDNSVE4wanN6bENlNjVUc0JkQVpYdjNIRmJBdk1oLWhIbnZqRmN5RFdjbVl5MUhVRFlaSThxNDFUa2YzVUYtd2xWNkk5NzQxSDFnOFJ0SWxQRWZrdG4tRXp4QkhyeEkxanpxRkdMTkVmME5jQQ?oc=5
2026-03-02	Google	0.0	13News Now 5 p.m. - 13newsnow.com		https://news.google.com/rss/articles/CBMiqAFBVV95cUxQNWVRdUVzSXUxUnZGbm1wN0RFeDVrUDFjQzlGVWh5amxIbWhvbFBBUnF6OTNmZnhGTHJPSUVCT2R6RHotQTJ6U3pXMUxHMENXemxyRVRLb2V3LUtMSTBYZ2tlYVd4VUVzTnR4dEtfaHg0dmp2VldIaTBjRzhnWG1EUmduMGJKMFRmUXk4SzlEZFBSRDZHaG5LLUVsQ2lpWU9ONjJUSjJFUkc?oc=5
2026-03-02	Google	0.0	Apocalypse now? - UC Irvine		https://news.google.com/rss/articles/CBMiYEFVX3lxTFBGNi1kalhxbmY3d3RCOEd4MXptRk5uVExzckJYaXEtZUV4c0E5Y01XMU9DdVhQY1VRYlFoeTB0MzhNVFVZSkRqV0lQWkd1X1N6VmVRX1ZMU2JMQVZBWDZRcQ?oc=5
2026-03-02	Google	0.0	Appeals Court Sides With Trump in Federal Union Fight For Now - MeriTalk		https://news.google.com/rss/articles/CBMilwFBVV95cUxNZzJoU3hIV2E0NzJLRVBFUmpTS1FfR3NyWXBjdEpVcDEzYjhKN0QwN21SdlBTS3U1QVowVEhFNjBMSXYyejdzeUFPdFZsd0I3STBVMF9yQWJ6dmtRQnhHR1N3dEQtN1h2VmZUZ0otb2FjaGREaEt6X3Fzd2JSRk9jaHJ1dU5zaHZOcS1sZVM1TU14ZlJDazR3?oc=5
2026-03-02	Google	0.0	Applications now open for 2026 USA Rugby Level 3 Coaching Certification - USA Rugby		https://news.google.com/rss/articles/CBMipwFBVV95cUxNZk12Y1phY2ZlOVlzNlRIWHo0bHhvSERFZGFSRC1xbjJuSGNYbDgxV0ZqRnc1TkJwZldoQkdmSFhoQnczaGJERGd3QjZLdGtSbUVpMUp3VUdzZkZyT0RVWXFyNHdjano1UmlZQkQ1RGVHZHNwODVrMTN2Zm1DRnhoTmpBNVRsS0d4b085WnNMUXNsOTlmOTBsYXJDaGFvYk5HRHF5TUkyWQ?oc=5
2026-03-02	Google	0.0	Award-winning comedian Alex Edelman to perform at Northwestern - Northwestern Now News		https://news.google.com/rss/articles/CBMijwFBVV95cUxQcmdWX1Bzb3c4NXlySlNkSHIzd3ZYSkhTUG1FWXh4U19CRVdUam1EVjgxY2JEQUVpRkNWQUVHZkc2MUNBVzVYTXV3b09pa2gydWdjVmdvYWR5eTE2b2FweldoVk8wRF9DUm1MeE10dnN1eFBsWGlUeFEtd2FvaXliZlJzdTNuVS05d05qTlZLdw?oc=5
2026-03-02	Google	0.0	Burgess Rd. bridge reconstruction delayed; completion now set for April 20 - WAFB		https://news.google.com/rss/articles/CBMiowFBVV95cUxOQ3NqelBiTng3ZHdWRTZhaXJqTEt5ZHU4MkgzZTNxeVdwTVM3Y2ltUVVZajY2dl95N2ZKSFppRnZtTUFSQ1lkbjJKY0pfdjBnTk14RXphRjZDMGtyN1VRN3lXZ3VTRjdFb3QzNzRMWF9uUmJxMFF5WTYydlY0QW83TVV6U2tpNlhQazdZMzIyX0dpWHB6X09vUGc2c05OWkFMSzJv0gG3AUFVX3lxTE9rWTlyZWdEZkJsMkhEYjdTZ09MYkZDOGZLOTI5a1p4cURoM1JRbWotLWthMUQ5dzFTenM2ZGFjNUdGRzhQMzN2bDRrRGdGRUw5MEpPdzdOUWlEbG1UaURYd1ZaRkZxOTZESEpFZWRLcmRyTnhvQXpud3ZrTHhnNTJVOC1NaHNKOVZjMTZZLWZGb3VucDM2OGFkWkNqT19EamtsT1pZWURxckUwZ3RMMjVFNnpYaS1mUQ?oc=5
2026-03-02	Google	0.0	CNBC Markets Now: March 2, 2026 - CNBC		https://news.google.com/rss/articles/CBMifEFVX3lxTE0zamxDa0otLUljc1FKbS1tWWVDYmdSMkRfbzdMZk1qdXI1bWN3V3BNT0pTS3NfSDNNNm55a0pSS3dMTVliX1ZrdHI2dnNNMVVpZTdoR1J6ck9LZlVhUm1wVDRYdkd0emdaMkZBQm1PWlIxTU5FR2NlMzBhT3E?oc=5
2026-03-02	Google	0.0	Catholic Charities of Northern Nevada urges now ineligible SNAP recipients to get help at food pantries - KOLO | 8 News Now		https://news.google.com/rss/articles/CBMiyAFBVV95cUxNQWhiTHl6aWptVFdaVmRxSlJNUXZFVElkUUh6dHBuQXEySDVwQ19zQWJ2c2pzZlZaMkVqd2VuVzVuT0did1RsZVQwTzNtQUtXR1JheFoyU2NqQUVCS2xmcm5UWWppZk9RRDRiUFRSckp3SEZGR2d0RzJsQkYyN240Q0FPLVBEMFJuRlpPblhEdERqVl81RVkzSV9Yd2pvYWE3OXNuOE1zVFdWMFpoNjMzb2x2X1o0SlprZWtoWUZhS1BhVUd1ajM2Qg?oc=5
2026-03-02	Google	0.0	Colorado Parks and Wildlife are now selling fishing licenses for 2026-2027 season - KKTV		https://news.google.com/rss/articles/CBMisgFBVV95cUxQZGhnOVFuaTFVX2hwSnQzZUc3OGVzSUFXdmdsTkt3NXVQTEpfc05jRmFXVFdBbWY0QmIzZzBVMFl2elJlQ29Sa0w4cDhhR1dDdlRIZGNnUHg4RDcyNlh3bWtpWTd2Y3JmX0JNaFh2ZXpPNzZOTnlOYVF0OWlObVFnYmw2NVNVZ2IycjJ1NlNFU0h5MmZDei0wLUZ1eDFNSVRwdXZyYWFmVTczM3BFQWVkZlNB?oc=5
2026-03-02	Google	0.0	Copilot metrics now includes plan mode - The GitHub Blog		https://news.google.com/rss/articles/CBMihwFBVV95cUxQVkJWUGpVOW9sVl9pcTJsN1Rsc1YwUWNMenloS0xHVXJJX1BOMk9RVEM3M3ptaWdsTTJFdExlTkdCYVlXZEdPWW8zSkJlX3l3TXd4R3FZSFVvX0lDRUp3RERJQ1NhY2JkUUdkNDgyWEwxN1dUQU5KOVg1UnYwVGpLbWFTa3RxWFk?oc=5
2026-03-02	Google	0.0	Daily Show for March 02, 2026 - Democracy Now!		https://news.google.com/rss/articles/CBMiWEFVX3lxTFBlQVRGaDhUSktFdkFZT0VsTUdLWmV0TDJucTl5YWNEQTB1RFFmRlJyNVZ5LThjczd5NTV3NmU0ampsc1JYV1dIX0s1elpoY1czbUdXV1lxdGU?oc=5
2026-03-02	Google	0.0	Data centers are cut — for now — from a bill expanding Oregon tax breaks - NPR for Oregonians		https://news.google.com/rss/articles/CBMivAFBVV95cUxObjRoTDhSM3N5UUpfSWYzVlhPdFpxaVVHNnhncGVOY0hodjhYc0J5cTlJRnFRSU1vRnk0MWJMMnRBUzB2dHNZQVAtSXpicGkwYXBSS3ZrLWJXSEk0bDdoNVcySEJSV1ZTSENnbGFVc3Y2OXVLX0VkeGtPcEtiZkN6X3BabW5VNmJQbTNlZWRBUFpFTHdVWHV6bkU5Q0pOeldmVkVVSUhrYWg5VmFlRU9Zel9McnBzbFdpMzIxSA?oc=5
2026-03-02	Google	0.0	Final Trade: XLE, ZM, CRM, DVN - CNBC		https://news.google.com/rss/articles/CBMieEFVX3lxTE9rLUIweHVaWW1KWktyd3A1SHlFX3VrNGoyZzFTT1E0Tk9OdEtVN3c4VjVXN2NQTXZNQ1FnRGxIOUJxd2wzVUNlQVlDVklQTXBFS0RjOGtsMjBMNF85dTV4LUVvNUk4akZXWmxnbUdRLWZIelRPLWtWUw?oc=5
2026-03-02	Google	0.0	Group caught amid Iran attacks now headed back to U.S. - Baptist Press		https://news.google.com/rss/articles/CBMiqAFBVV95cUxPZGpxRjZramJmSDJ3NkRPdjFobDhqeXB3VlVyNGlmbFRrUVlaTWxiemo5QWNlQlZTTE4tUU11MXVNNi1sY1doRjN3Q1F1ZkU0SEJLajhxTWlLeGFoTE4yQjBjWVNNT1J0YThBQUhITU9pZC1QYXZaa0RBWlRtOVlsYThTdHRBNUV2ODcxMHU5REFfQkdzc3pvZy00d3NFcENiWjJTM0lTcEc?oc=5
2026-03-02	Google	0.0	Hollister Avenue and SR-217 Roundabouts in Goleta are Now Open - edhat		https://news.google.com/rss/articles/CBMilAFBVV95cUxQMHBfcjIySTBrZXF0RTdfMmFpWnQwQ3ZRYnVTWHY4eXNUZzJyTWowcGRIUkxPNWc0SU5LR1cwTzN6MG1uYy0wSndfVUtvb1VRYUhRWlB1YWpzWWR6d0pCOEtySWh2Q1dMUWtGbzZ1dzZRVHZ4b1JGakNaSkN3Njd5YTlGY2t6akZxcERWZXdBWV9XNEZj?oc=5
2026-03-02	Google	0.0	Hoopfest registration is now open - KXLY.com		https://news.google.com/rss/articles/CBMivgFBVV95cUxOLUplN0ZJVTdHT0pYX2FEOXNCOFZScTB6cGI1bWw4anZOMGg0Z2RpS1dWVmJHQWlLNjdkMTRPTXMzV2dHeVIwUjJrYy1xbmlFV3IxX1dRRmFlUTJzMGFvZkg3dXp3eTNEMW9vclpFREZsWWJ2bGVvMmlSUXNjTFVEWllQVmlPZWJvTkx3ODFKSzJVZHpEQmJRTWg4ZHR6blhkTjFRUG8wUWx1YmN4emtTUlA2YUcxWmNYanRtS3Bn?oc=5
2026-03-02	Google	0.0	Innovators now and for the future - Irvine Standard		https://news.google.com/rss/articles/CBMiekFVX3lxTE5fT1E5MXoyamx4RUU2Rk1ZN0FRMHRNUmlhc0NVUWZtLWRueU1NMmRlelQ2LTB6V3NrT1ktaEVMblloY3FSWTB5QU1DT3JMdWl4TFh1ZkJ5dHpRSi1BZFBMRUNUcDI5WnE4ZFFadFF0MGV5UUlLSEZaelZn?oc=5
2026-03-02	Google	0.0	International Operators: NBAA’s Member-Only GA Customs Database Now Updates in Near-Real Time - NBAA - National Business Aviation Association		https://news.google.com/rss/articles/CBMiyAFBVV95cUxPOC0xWlVJb284U3lXdzNJRVlRZ3FQSjU3MlRXWEFyOVF6S1I0X1RHYmYxNEJMai1NdXpuclpPbU1xVGdKYjlURlBlM2p1NGJ6WVZQTGFtTmtPT0dxdkU1R3E0TnRZUmlINnY4b0VlWEFtS05zcUN4eF85T041emxtXzRkM1hkd0ZTYUtwd2tDZE5qSEZOTmxkM0QtclI3VmZYbWxXUThIbmdLUGx6dW1MeG92cTlQcFBMb20ySE01Mm1IaXNxVl9hag?oc=5
2026-03-02	Google	0.0	I’m a Runner Who Can No Longer Run. What Now? - RUN | Powered by Outside		https://news.google.com/rss/articles/CBMif0FVX3lxTFBQcVcyeUZENmxMdVQ0OU5CQ3BYVXVxQzZHNHV4VndZaEplX1d2NWxJUlRZbDl1aHJCOFFUUWhlWFNfZW1BUVNqcG9IQ3VDZmFiV2l4SW9CMnFHNmVIYmg4aUYwRGZETGNBSDEwQl9vN2owMjJoYTNyNjgySTNrWWc?oc=5
