Date	Source	Sentiment	Headline	Summary	URL
2026-02-26	Yahoo	0.19	Salesforce Eases AI Fears With Strong Outlook and Big Buybacks	“We’re well on our way” to $63 billion in annual revenue in fiscal year 2030, Chief Executive Officer Marc Benioff said Wednesday in a statement.  Wall Street was expecting $60.3 billion.  The company also announced a new $50 billion stock buyback program and increased its quarterly dividend to 44 cents per share.	https://finance.yahoo.com/news/salesforce-eases-ai-fears-strong-153613152.html?.tsrc=rss
2026-02-26	Google	0.188	Conference on Palestine originally planned at USM now held in Gorham - Maine Public		https://news.google.com/rss/articles/CBMitwFBVV95cUxOSkdnRGdSalNLRGtQNS1EVTNPTE5EdTVNdzg1aFMteWc4bEVDOWJTS3d5VUNPWHVqQ3dwbVNsOEZ1MUxNaUZrMmNEd3Rxb2ZjT2hxbnFlSF8xOFZkaGpOYURlbWdXR0pwTkVaSXBneEsySTd3M21qRG5mTUVUZmRBeDhsSEk0QXR5bGJ5UEVIb2hpdUF1N21aOXdDa1RVbVZjVjFaeVFPUXgzTS15YWxRNEJXeFZiSms?oc=5
2026-02-26	Google	0.17	Support a Streamer and Twitch Drops Now Live! — World of Warcraft - Blizzard News		https://news.google.com/rss/articles/CBMimAFBVV95cUxQM2RoWXRwV01TblY2dm5FSklZdnhVUHlGOUhzOVp6T2FxTmpUbTJlRElQbTY2UEJKRS1zb3VlT2JNNDZhaE5TMWQycDBXcEpqVVRFbnhHVnBuVGZSMzFtWGc2cnFfVXFFZTQzU3BwNTg5QUd6b3pORnJEalluUjN1dzFMOXg4bFFydTlmUDlWVE8xc0lvLWJWTA?oc=5
2026-02-26	Yahoo	0.167	Software’s Slump May Be Over. Microsoft,  ServiceNow Stock Charts Scream ‘Buy.’	First, the ETF, trading under the ticker IGV, has carved out what looks like a near textbook double bottom, occurring almost precisely at the lows it hit April 7, after President Donald Trump unveiled his so-called Liberation Day tariffs.  This month formed a bullish relative strength index divergence, with the  RSI  making higher lows even as prices pushed to lower lows.	https://finance.yahoo.com/m/031db01a-faa7-370f-84d9-2a87a4d87563/software%E2%80%99s-slump-may-be-over..html?.tsrc=rss
2026-02-26	Google	0.16	Register Now – Developing Leadership Through Sport Symposium (April 14) - Colorado High School Activities Association		https://news.google.com/rss/articles/CBMitwFBVV95cUxQNFhTWHBVd19CN1FDUDBQUUFYX05FNENTaEEwYVRGRThlbUdodS1PVEdBcTczSWp3N19rR2VwS2VIUGlNWXhHWUhVN1BmLVAzU2RZdVlVa0hiUnh2VzFqNlNVZmtFaUhUaDRHb25uVUxJRWxhNTZ3c2VieHVteDRvLVJHTGhicDdvYjZzVkU5UEVoclc2YW5rRVlHdERJa0htNUI5RHZOQXVfV3BPYXl1YWpnTzlSOWM?oc=5
2026-02-26	Google	0.15	They benefited from Pitt’s Student Success Hub. Now, they’re giving back. - Pittwire | University of Pittsburgh		https://news.google.com/rss/articles/CBMivAFBVV95cUxPNkI5UzRJWnFUMjN0Zmk2SFVYQVR0eWNhRkJhMHd6V09RRXJySUFPU3JYTjF0cXN2TTBLa0tabHNIUU9lUlVqcDRYX0FFSUtWRXpXSVdHamgtd3NodjVFUmdUZTZXZ0REMTluRWQ5U3V4US16akV5N3VoZXR3QzhsOTkxNU9XTXlNTDBtS1dCUFRWdm9OanZ1MW10bjd0OGlHaWdHQlJRcW5xVE5QNjZ6ZzJ4RzEtTGJGTDlMcw?oc=5
2026-02-26	Google	0.143	The Sickest Burns on the Internet Right Now Are Coming From French Bureaucrats - WSJ		https://news.google.com/rss/articles/CBMipwNBVV95cUxNeFJQZ0xVWndSSnBhbFVjZmN1Nm5wdXdZbVprbEt6T3c3R19rLV9tNVVrTklXMUdYQlZ1WmJvQV9zWVptcE11LWNDRDd5UGZTYWVON1dDRlhaa2x2ZGFvWHZWbHVYRnBESENUbmdnSVZIUV9pd1plV29SZ1hsNERoRnpMWVBFeFpKQ0Y2YUxDQjVLSzhMY05GcjF2a3dyTXNwSjRmd25nOTg5RGtnZFVyQXpQYWJKN2lUWWNWaG9kRjNuSktGQk84UVNkQkpYWkNrZkp5RUx5Um1OTUR2bWg1N3ZCWURjUlVFcGVFOFJIcUlERGwxUGlnOWJfaG1fYnp4Z25KelFSRVMxcWNqVWJFLWFLQlR3SXV1c1NkeGd2WG9aQlpZblRYcXhRWjhhNGlGZmdxV1lRQjRKdTNuQnFCTlBsMUR6WnNUTUxyNGdVNU5PMktaX2YzcXF1SEVFVC00VkJ5d0ZGNGwtekFHWkZ6VTNTTklGa2pKQjctazZHRWUxall4TUlJMnBNOHJ1ZUlmVkp6Q0lVWGxKOVlSZHY5dmJvcVJCWW8?oc=5
2026-02-26	Google	0.136	New information uncovered about the Broadmoor boil water advisory - WDSU		https://news.google.com/rss/articles/CBMilgFBVV95cUxQZHY4N1dNZjJEVkl6MUM0ZkVtblVId2VrM0RudVlYVElubzhMcmE3bjQ4Nkx5VENvcllBZl9nb3lEcnNxRFhkNzdYU2VlZUVwdS14ZmRzbi1lV3l1OXp5ZUVLTE9kQ0I5N3RIV1NIWkdSWklBRmVWcGxidDR6Mzd6bHZ0OUhsdk90QU1PWjVES212MHJwQWc?oc=5
2026-02-26	Google	0.135	Midnight Early Access Now Live! — World of Warcraft - Blizzard News		https://news.google.com/rss/articles/CBMihgFBVV95cUxPQUFOU29qcjFIc0dwUU9yX2x6VHdwLWJoRkN3dkg1TE1OZDhpUG9ETjR4VmJ1LTBPODRHNkRqNFktLTZkRDcxRUlnSm5JemZDdlhiUXBSVEpBa1B5b2txWk1RU2FXakVRWW4xZWFHSUFHalUxc3p4VTBWQW9QSUFHcDVpeGZCUQ?oc=5
2026-02-26	Google	0.133	‘Very Republican, very patriotic’: right-leaning civic centers now offer courses at US public colleges - The Guardian		https://news.google.com/rss/articles/CBMilAFBVV95cUxQNlJnS3FxZjZFejVKZ3ptc1VkX0lGNTNQckpuUVdaNUxsX0tnRXdfNm1sbVRoeG5TMk9ib3RUTkNoQ3FPaHJ6MjNCZ1p6R0pPeUlqajVtVGE0ZlRFVG9XVE44SjlGSzctRTlsdXpIV2pJUlUtN1BvNDlRX2M2YUJQLUxTWU9NR2IzUHN0V3pKQ2ZzZzZn?oc=5
2026-02-26	Google	0.125	Florida's first Black-owned brewery now open for business - NBC News		https://news.google.com/rss/articles/CBMipwFBVV95cUxPQmRWMkpiVGRlZ1p4YXVzZUVnVVI3QkhUSG5xUFdpeG16NFpMLU9RaHpFS1N5RGxOQW1rWUppV2M4dmlNZjRvNzNpOUs4cFJfMU1zamtIZVFuVnBuVVBiVEZRZkhSNmpPWUFsS000SEhYRlp3LUFfVUFma00xSHFqbHNDRUQwUENXVE5qMlBncnZoNURxMUt4TmxBemlIMURXeEo3SFI5UQ?oc=5
2026-02-26	Google	0.125	Gnarls Barkley is back with ode to 'Atlanta' album. First song out now - USA Today		https://news.google.com/rss/articles/CBMixgFBVV95cUxQWkR0QXBISzBZNF83RmVPQWdSRjl4LWEyREV4TWQ3aE9FUGVFcmtHQ2FtcEtkMTRXVF9yNkFZcUgxTTlQSG13RnNzRVRpRGFnblZJMmQ3UF95YlFFZGRHbVI5RHdjaVAyUFQ2RmZQaWJaVXJzbDNrb29wZTNfa3VTQjZnQmp1NTQyVXhXVlpfeERRVDJDNlQzTE1hVEVOQU95dHVBT2tMLTlNZ0MtdU41SjM3RVFHaGUyeGRINEZ5WjJuUU5VOUE?oc=5
2026-02-26	Google	0.122	Now Would Seem Like a Good Time to Think Seriously About the CRP - farmdoc daily		https://news.google.com/rss/articles/CBMisAFBVV95cUxPVzJyM0dNWG1Xd3RvQmhGQWF2OG9xa3BDMGlDeGJIVkljNDZFYkItZl9Zb0RWb19rMTZmQ1NNQ1AtWDAyR0p5YVZ1VU9vR200bDhHTXR2anZmNGR2NWZEZnRVWG9ETDFEX3pIOGt3aDJKREloa09uZXNEX0MwQzkzWHdFUjhYd1JRVk5uM2tLUE10RzVUclpDV3hSX19SeXR3blZ4UC1xNjZvc0Uxdko3UA?oc=5
2026-02-26	Google	0.117	Towerborne’s full game is now available - Windows Blog		https://news.google.com/rss/articles/CBMimgFBVV95cUxNblRDZVJLTHM5SEpCN1ZTQnBZZ0Iwa2pPV2x2OElGQmJ4aGZkNld3dEN2bjV2OTFxcWUxLXJPeWthcmtxQ3gzek83NWc1S29qOG9ISjlHQTdHblprWXRraWxJMkhJOVByX1d6ZzllWkR0VVNNY0RvT1l2Q0pqWEpxOXdjdDNJSnBDMVJCSXp1cEpDRHB5d1g1N1Bn?oc=5
2026-02-26	Yahoo	0.114	These are the winners & losers of the AI scare trade	"Investors have been favoring artificial intelligence (AI) infrastructure while pulling back from software (IGV), as US stocks (^DJI, ^IXIC, ^GSPC) navigate renewed volatility. Yahoo Finance Senior Reporter Ines Ferré chats with Market Domination host Josh Lipton about what's driving the AI ""scare trade"" and which sectors are and aren't benefiting from it.  To watch more expert insights and analysis on the latest market action, check out more Market Domination."	https://finance.yahoo.com/video/winners-losers-ai-scare-trade-204738495.html?.tsrc=rss
2026-02-26	Google	0.1	Indiana football’s Aiden Fisher dreamt about the NFL. Now he wants to ‘smell the roses’ - Indiana Daily Student		https://news.google.com/rss/articles/CBMinAFBVV95cUxNUlNCVFVfR2xYaTRKTWVHa2R6cm9kMEM5S0JyWTdoWmN5LV8zdGlTbVBlNWQtSjVRbTlrcF9tN0Y5cDI3NWs5WXVYaDloT29pbmxxLWQ1NGhYMDQ4UG1Ea0cxM3RHcnhLZnRwdVBDbUE3T3gzOEgzcy15QVpNNkhIYmp3WXpvQ3lrV19KM2tad0h3QnZrNjBYVTlINGc?oc=5
2026-02-26	Google	0.1	Is AI really coming for white collar jobs? : Here & Now Anytime - NPR		https://news.google.com/rss/articles/CBMijwFBVV95cUxOZmhMT2otYTZSRFBtb3ZzVTREcUFmX2x4VGRjeUZGU0F6X0JxdGRqWTQ3Wlh6VmwwSnZRb18zWVdTdVRfX29ocmZtemZVdmJSUEFPcEdlalc5MVFuM0NIRDNUUzk5OUhyQjZXazJidFNRemNIWjVFTVhLZEpaNmtabTZMdG41VWU5WDFBSGZYVQ?oc=5
2026-02-26	Google	0.1	Trump delayed a global carbon tax. Now he wants to finish the fight. - Politico		https://news.google.com/rss/articles/CBMirwFBVV95cUxNNWRYQlFJSzJ6REttQzR6czdtaVlhMTRqbmdXbE9GQlM5SHB5ZUdtTXdIcGVudWJtM3AtLUQ3TUV0VnBna2UteDdWRUVQR0pvcXVOZDRYOXpCa1Q3SHBzQlNOS21IaS1nY242T2s5WHJQdWZ1empGWVRHdjdiblFuMmQtaXp4bWRkXzRBbGxLTVFTVm9TNmdQTV9jb05BTGlrdjlHa3JiQS04b1g5SVlB?oc=5
2026-02-26	Yahoo	0.08	Is ServiceNow Stock Underperforming the Dow?	ServiceNow has underperformed the Dow recently, yet analysts remain highly optimistic about the stock’s prospects.	https://www.barchart.com/story/news/441401/is-servicenow-stock-underperforming-the-dow?.tsrc=rss
2026-02-26	Google	0.068	Current Reading Picks: Books We Recommend Now - New Orleans Magazine		https://news.google.com/rss/articles/CBMie0FVX3lxTE1MOUJBVXhQRi1qbGxjR2dCWXBZM3VOV2RZNmFMb2tUNzJvWUZfWlZROTV5eThLX05zS0RrMGFhcV9JeTNXdFREYVQyLUJvSDFEZmJNd0NFTTJKaE0waWc0SmZMSDYtWThVdHVPR2VKWGJQc045Tnc4ekpPbw?oc=5
2026-02-26	Google	0.068	New buffet opening in former Cantina spot in West Homewood - Bham Now		https://news.google.com/rss/articles/CBMilAFBVV95cUxPTUNadFczSE85R2tHS1F2SGJleHluQ0VaUEUzbUYwSHduWGdQZUtqeHhyR3lFZGRmS25CNXpZVTdxS2N1TXNDLWFYNVRUbzlHZmNMWWpXTktGdVJrU2Jacmt1bUh1ZDhWV05GMUcwUUVHSHpIVThEQzJxV3NYZjRwcUNEQktQVGVFRmpqN1dseElNMGx0?oc=5
2026-02-26	Google	0.05	Highway 128 now open near Navarro - The Mendocino Voice		https://news.google.com/rss/articles/CBMic0FVX3lxTE1pVjJhSFNDM3A3aVVxYVVpbVhhNEdld05OMV8xMm84TTFEVjZTRjdGNk9YR2Q4bG11ZU9uT0JieTM5aHFhR1lUc0NVdnRFaGYxeWpJZ1REbElFY2JRdEJjYnNoVzJBeDFsc0IwcEtKRkJDdTQ?oc=5
2026-02-26	Google	0.02	Volunteer high school lacrosse coach now faces simple assault charge after allegedly hitting student with lacrosse stick - fox43.com		https://news.google.com/rss/articles/CBMilgJBVV95cUxPalVMb1ZrSUV6dUxodlUtRU10cGo4eTVKV00za2NQYTlHZW9oMFFCbzZFOUtBZGZMUWtXUXU2SzluVUs2OHlUWTlJVmIyMVRoVXRRd2NQWU4yd09LUHp6MzF2SlpvelMwRGluQ0JEZlFuVlpDVS1FUjlqM3RDT2k5UXNrSWFLRElxaDFSMTR0aVIwcjJoRFNIckxpWVp2Y3IzNXRST21NYkMyYmpMY1JCV19td2s0WXdkUkpuV1AxOV9qbU1Yc3U0SFNhOVdNQ0tsYVBmN0JqNmZlaTlHY1ZYZl91VXBkeFFocThXQ2FKWXczQWJkMFhQNUVnYlRJaFFCVTYwN3d3aDNrNWpIdXFseW85LWdOZw?oc=5
2026-02-26	Google	0.018	Flyers look no closer to solving their center problems now than when season began - The New York Times		https://news.google.com/rss/articles/CBMipwFBVV95cUxOMTNNbElLQkJhTTF6Uk10SEdUY0h4T21DQ2JjWlF0V25qeWRnSWdBejJDWV81dGExTjNVYkxURkJtZEdPTjU5WnFhRGo4N1VBVV9Ba3BRejRTSHlCa1JwREZBaVc0NjJnQ0o4QTRJZDdvVVcwTXdGUElkUEJudXR1Xy1GMXoySjJBa1RIckU2OUdXMkc5NG51UzFQbE9FakdSUDNBa1NWMA?oc=5
2026-02-26	Google	0.012	The Pride Center Closes, For Now - New Haven Independent		https://news.google.com/rss/articles/CBMihgFBVV95cUxPSjAtQjY2WHdPUl9jYlJoOHhob2tVUUVtT2ZTbFE1SmRkTVFudzZUNVo0aTVxQmR2WTdPSUVERmxFZjJjcWJYSml3WE1TZlptSmdYS2ppRUVtU2I3eUEwM0lsNUdRc09yVUhnYUpFVlFVazMwNEZoeGVXaC05NFB3dk4tNDB4Zw?oc=5
2026-02-26	Google	0.0	$33.5M condo now for sale in Nashville - WSMV		https://news.google.com/rss/articles/CBMid0FVX3lxTFBkSllGdGw0ME5kRmJZT19aUWpVMlhBbGVjN096cFpHd19jR1BJWTA2VzZXOXhVSkpKRDMtX0lrTVpKamJGZ04yYXo0aXo5Vi1UTnNIUG4tTnlTZi01YU1YU1phd1dlVVg2eU9hbjAwT05hOFlCdUJ3?oc=5
2026-02-26	Google	0.0	13News Now 11 p.m. - 13newsnow.com		https://news.google.com/rss/articles/CBMiqgFBVV95cUxQOG1ZRGM2UkxkYkZibHJwOE15NHprRVVnM1cxNXNsM2YwX0NzQ0RwcGdnSDBCUnMyenN5N3ZSRDJGdGdvQUtFa3N1LXYzQm9VOW9uYnNDcVJWcjJMV0hkN3pVYUNQRmRYd1NwUzFicC1Ja0N6eFpJeXE0U3BaWEwwSG02dXQ2OVVlOVBmRjN5SUlkRGRaelpnWnpOTEVHbnR6eUNJcFdtRVBOdw?oc=5
2026-02-26	Google	0.0	13News Now Noon - 13newsnow.com		https://news.google.com/rss/articles/CBMiqAFBVV95cUxNS1FfYkE4bVE4bjFRZjE5MXp5LWtWd20yRkl3WWRGblVCYndiMXlpLU96QzBJQWdCUE1DR3NSWmFVYnZHTkpJRHI1eWlVNzZ5X0piQWNseklsZ25INGVWdEV3bVVqSmtTVDEwM09zQ24tT3dJbGhLVVVxaS1zaXhCQXNzWXA4dHEtVlZ2Y2RXVnFPZFpzbmFiNEszVjgySjlpYnRoMTJIZnI?oc=5
2026-02-26	Google	0.0	16 News Now at 6:30 p.m. Streamcast - Feb. 25, 2026 - WNDU		https://news.google.com/rss/articles/CBMihwFBVV95cUxNX3RaMTU4RVZ1NUxZMWFNdkI3WERLdlYxby16S1ZzTkQweGZwSXdndElfTGxnTUw3SUQ0TU5hdFVEZ1Z3NFFmUF9oSE54SHZ3SDh6SldrWXhBZkppSUlHTjVmUzBOR21keVlPaWNGakZhWHcwUV81YVB4bGNSMFZrOUNINXpiTGM?oc=5
2026-02-26	Google	0.0	2026 Loretta Lynn’s / On Track School Apprentice Program Application Now Open - MX Sports		https://news.google.com/rss/articles/CBMiqgFBVV95cUxOYi1zcld0eFVhbmJUbjE4SGgyckFNSE82UkxQaERjMnJmX3dMZ285UVllNGpab3RPdEphVEZnUGdHNkpTUmZKX3JoZXZqSFRPWlhnSTY1MUZzTHZTN19wR2RDV3BGYW00bkJvMW1LOW16LXlEYkttVHk5cnVXN0w3M1hZclRXMnM0Qjh0bGZiUHFIYU9vVC1NTUsyZ2NVRnB4SzhiVjFBVXZLUQ?oc=5
2026-02-26	Google	0.0	9News Now at 9 p.m. - Wednesday, Feb. 25 - WAFB		https://news.google.com/rss/articles/CBMiekFVX3lxTE1NX0ZkZk90R2ZUQncxSHlGYm1EUzVPekRzbDFhREpwemRLT3paVTh0NWZWcTFpQ2lwWGZrUlZNOEE3R3lPZEh0U1JhOUNxVGc2dzlvR2hTaERkc2lyVWV3YWQyYmxIeF9ZeFpzZlJTc0lNR0gyYVlrbTdB?oc=5
2026-02-26	Google	0.0	AI sexualized a California 4th grader's book report. Can the state safeguard students? - CalMatters		https://news.google.com/rss/articles/CBMi2wFBVV95cUxQVlAwTmExc0hTZjlWZERoWHlNNXhfLTlQRzJMR29WSUpJcFdqWTFCUV9hWXByT19pSDNjZGJNcTYxazlSVG05ZUNsRG1taWloUTdwa3RUWG5JNVd4b01SYXBKRkVPSDBEWDk1YWMwXzlaX0NCVElPZVNtR0NTRUczMjkzdWxpeW9wdlo4STlnRERmUVNOcmJnRVZRMkg5MUlHc0RFNkphc2JVRFR3MUZ1SkFXRWctSEUyYjhHNFZwR0taQ0M1MjR1cXVBd2hUNGswbHh0Q0hFZ2M5SVk?oc=5
2026-02-26	Google	0.0	All of Florida is now officially under a drought - WKMG		https://news.google.com/rss/articles/CBMingFBVV95cUxPRUJkWjl1YlE2NUFNLWlzSVJFNGFEbENucVhGcmxGOXZpQUNCMTRjd25sVDJnV0dRQnRpSTJIbGtmazFEVmdvbFJfSlc4MG83bFpTZnMzR2V4UjFrdjBVSWlpWVAxWW5xaVNpeVNMeVVfZEZDUmlXZERCRHhsYmJ6a2FDajdIRTRjU3ppSlJjdk9hU0xlNjZKOGtSemFMZw?oc=5
2026-02-26	Yahoo	0.0	Anthropic Excites But Doesn't Replace	Wedbush Calms Disruption Fears	https://finance.yahoo.com/news/anthropic-excites-doesnt-replace-114225557.html?.tsrc=rss
2026-02-26	Google	0.0	BNP Paribas Rises to Take Goldman’s UK Crown, For Now - Bloomberg		https://news.google.com/rss/articles/CBMiqgFBVV95cUxQTWZTRnhBMWZWSmpvcjQ0WHZ3R1p1anZyZ1ZvcW5VazY0bVZXZThMRzdieUpwNjJocldXbXBpTUpBeFpnVG1iTXFHNUtMTExxd1UtcU1EaEk4UUdXRWx0U1N3VlIzdlVNSUNvOUNEOEhucWVvUXZWd3ZOX3VTVFYzOHZPUm1JbkkxaEZzdkN0VFJFWTJlTVBCN280WEdTcEloSVNOdkRuOU9vdw?oc=5
2026-02-26	Google	0.0	Beast Industries CEO: Prediction markets are 'ripe for abuse' amid insider trading allegations - CNBC		https://news.google.com/rss/articles/CBMizwFBVV95cUxOZGVHZllBN2N2RUtCaVR4VUg4d3VJeGRBd1ZURmc2d1dnZ3BOYy00MktJZUc3bTV0OVhnZUk1WWRPbW5yZThVbF9paHFjcnVCMXhwcUpJeFRPbDk4Wmc5bVYxamJ6bjVrZ2RQVWZqSUVsTXVuUTRFTm91dFcyRldMcktGVkF2SFVVcmF6RF9xY2t3UHpscGNoX202VTM1QzVLckVOaTBQZmQ0YnIyMXNXUTdyaWV0bkpPM3AxUldQSmZOaXRBalF0TmhMbkNyVGs?oc=5
2026-02-26	Google	0.0	CNN, MS NOW & Fox News Ratings: Which Network Just Had Massive Month? - Yahoo		https://news.google.com/rss/articles/CBMiigFBVV95cUxQVzRtekV1bEloZEJjLVpnZ1R6UzF5SnQtZk9obWVfNEl3X2dzc0pocDNiRlJjWVdQWjVsb0ZLUUlOR2xwMnN4N2dPWXlueFpiLXh0blQxdE5YY0Z3WWVVdXBKYzZMa1JFNktSMkxocGUzb1FMNS1jYnJHQldYT3FZZmN5OVRvWFdkVHc?oc=5
2026-02-26	Google	0.0	Cheaper Cybertruck Appears Fleeting — for Now - Kelley Blue Book		https://news.google.com/rss/articles/CBMifkFVX3lxTE4yRm5pZHZWaXBHcW5HdXhHeTRQM0YxQ0lqbmVhWjFYVjgtN1NWVGZMNWE3UmZwN0RNeE90QWd2YkpVcDdoM0hqS3JxemthZVZ1cW5VcTVHalZzbmdVUGFpNEZMQUkzN2h5SU1ZdVRSekRYc20ySzcxVTVJUEJuQQ?oc=5
2026-02-26	Google	0.0	Clearing skies and warming temps... for now - KCRG		https://news.google.com/rss/articles/CBMic0FVX3lxTE1HcnVjMlNhVVo3ZTMyME95VEdYdGxmQkNXQkNHYzlPbmF6QkszT0lRQUxrdy1GU0tIYTZtT1kwSF9EcnpibnJsQkZqcmVmYXk0MGhWYjdhZ2pGaVVxWm1uS2NfRVZuY1BEcy0teG5fT0xNRVk?oc=5
2026-02-26	Google	0.0	Coaching Mentorship Program Returns This Spring – Applications Now Open! - National Collegiate Rugby		https://news.google.com/rss/articles/CBMinwFBVV95cUxOMlQ2WFpad3FIZWJIci1KX0ZieXpESHJyaFpfalRlY0RFUTFRLTJCY2RjWjJtZEdOZ3E4Tm15SHNmZVhxZVBQQ2dkbE96eGp3ZVlrN3hoVTVEa1NiNjE3LWNRb25nOXJRSEJrMGU1Zm5FQkdQeEpJS19Nc29RZS1PWDdFLWlUQmYzTUZTc2U4Q1M1aTRHM2ZmdGoza0doTEE?oc=5
2026-02-26	Google	0.0	Columbia University says DHS agents detained student after making ‘misrepresentations’ to enter housing - MS NOW		https://news.google.com/rss/articles/CBMifEFVX3lxTE1BdTAwWGZIaklmdWMzZDhna0ZvNGg0aG9JN09hS3FkSm1zd0pwQXVZa04yX192ZWRzV0FweWFyR2JtbHkxMGZDd3A1U3ctMzYtMEk4WGhlYW1Fdm1SVHlVZDRqTTJUSTRWRG5ZQlhNMGtwOTF0YU0tbm92QWI?oc=5
2026-02-26	Google	0.0	Crews continue to fight fire on Fort Carson which now sits at 30% containment - KRDO		https://news.google.com/rss/articles/CBMirwFBVV95cUxONGtQSVVpSU9wRWpGNU5KT0QwTlJXUWNRN242RGU0UVUtanc4a00zSnRQZGl0enQ0SFYyRkgtUE5Tb3FmVTJscUpwWHM0dmVxVEQwdS1hdDhvMWY0dEhCN0wtNFhELUcyVDR3bUl0dVFMOW5NdmZ2VTRjOVQ4bWlzenBCSlNtUGt4VmtDLXdiSnpLbFNySl9qOTVfdkY3dlJ2VUU4c1QybGM0SEF2aFNN?oc=5
2026-02-26	Google	0.0	Cuba Kills 4 Exiles Trying to “Infiltrate” Island by Boat as U.S. “Medieval Siege” of Cuba Continues - Democracy Now!		https://news.google.com/rss/articles/CBMijwFBVV95cUxQWTc3R1M3WVdXT3dyNUVfN05KeFR5UFFpbVFwN3ZtWkhNR0Q5akZpZ1ZqTnhqV0Z2NGYwcXdKYVAtTnNqVGo3SEVURlRZSFVNUmRzWkFqODlXMGhXVGVUcDRqaEhSQlU3SVJjMm1nTWtDUUZCdUxEcDRRT1QzSW1ES2pJNnk5WGNWaGtUeS03SQ?oc=5
2026-02-26	Google	0.0	D.A. Davidson's Gil Luria: Nvidia investors getting nervous about return on investment - CNBC		https://news.google.com/rss/articles/CBMiwwFBVV95cUxPaVJmREloOXVYcFFHbW5jNlB5RXdPXzFnUEdUYk9VUER6QVJtNzF1YTNkbk1GOS04OUxnenU4R2RFd1Z2VmRmU3BXZkNzZlNQSnVLZ3FlQ1JKRUZYdkxUSEhDVk02bjZDSi1XbjVzenVOSGJxOGdwd3A1clJjVmZ2QWN0dXRhQ3F1NXRvbGluYWlaS1BVaEZaU0pvcDRXRlhlNEJqVFgxSUlQbTNUdGRxVm5RaTczTGN6bVM1d180Ti1CZkk?oc=5
2026-02-26	Google	0.0	Daily Show for February 26, 2026 - Democracy Now!		https://news.google.com/rss/articles/CBMiV0FVX3lxTE82Zm1mZWNsZzVjQ1BOVmEtRmdaUFoyQ2FUMTlUYVBYb0gtV0wyZjlieDVUcFFjVFp2b0dzWTl5bEl5RjlNbm9pLTBtTkZMeHZORTNCRW9KNA?oc=5
2026-02-26	Google	0.0	Deadline for 2026 AARP Community Challenge Grants is March 4 - Maui Now		https://news.google.com/rss/articles/CBMilwFBVV95cUxNcDVUM1NYMTd5bFczUFpQWk53Q3dVTElXa1p6NHkwZWpmUnRJLWhWZkh2eC1XWktQb3dBb0JKZVFXWTl6ekhQd1VlQ1did0tDeGtkM0RuUFBlVmVKWDVfQXlIV0JVVUpiYUN1cjg2VWZuMlF6WHZVRENMeW4tS1RsbGl5cXlUVnZ4NnJPQ25FUG54VFBFUTlF?oc=5
2026-02-26	Google	0.0	Denver's winter averages 92 days now - Axios		https://news.google.com/rss/articles/CBMiigFBVV95cUxPMnRZQ1VMVkg4M0NiYXRQQ2RvSEpHV0dpOEZBX1l6bEhTR25KQV9hd2Y2MVY0eTdHcUlobVNUaHBVczNTNG1FcG42aE41RldHNFJ2R0NheFRxNFBfSFR0TTBTaU5UelByLWZvV3NsbEpiVTNjdWVwcU1yT0hJZnRkbGJSSk5FZTJwVXc?oc=5
2026-02-26	Google	0.0	EXCLUSIVE: MS NOW Names Scott Foster White House Director - ADWEEK		https://news.google.com/rss/articles/CBMifkFVX3lxTFB2VzNOeWpWM0JpcGViWWVDdXUtVHRVOGFwRmdPbHhoYUZjVHd1R1lxcUFuNkNJamFaUTVYRTVmdVdXOXdMUWJOa3Jrei0wR2JWUGh2b3QwV2F3YTd2YkJjdktiVkstQVpjZ0Rpdk0xTmNKdVVSdUttakVJS19qZw?oc=5
2026-02-26	Google	0.0	East Tennessee Children's Hospital now named after Dolly Parton - WBIR		https://news.google.com/rss/articles/CBMi5AFBVV95cUxQbm1OTVZodEd0M2tfTkQ3XzhJU25TNDRqdjdDNjRta2xuWmpaU3h3WGh0OUJnU1ZGY01jMzlpUTQxNkotbklKdzlYbGxOTTNzNGxVbnFKZUFKRmtCZ2Z1Ty1VQnJWV0FGeXN5UklRbmZIUGtVTlZMTUQxT29mS19KN01HQ1lRVW1JU2lnem1XNTZNY1NTbWJXcmcxTHFOSUF2NjBEYnlaRURid01YYXI2ang2aGc3OUw5UV84QVpkS3lWU3pzSkp3bXE3cmdtWGt0M081OU5PQmd1RVpTOVMzcWRmWDA?oc=5
2026-02-26	Google	0.0	Eni can now receive oil from Venezuela as payment for gas, CEO says - Reuters		https://news.google.com/rss/articles/CBMiqgFBVV95cUxNZWpvdXhEWlNhenBYVnVUZm1WUm9VelZ1VDdMVWN1b0xldFRwY1JlR25jYWNJdUVMa0hqb3Z6MFVESk5tN0ZtaklrelZOMUNDLUV1bDVLaWRDOWJuTzRMcXJLY1hKOFM2N3c4Tm5JZ1NGVk9oQWI2YThMXzhPZF8weWRzTXRLdzVTQUxWbGE1T3lRT0lHRjZEWGFEYkNxcWM4Q21nUnJCRUZJZw?oc=5
2026-02-26	Google	0.0	Even the CEOs are worried about AI now - Axios		https://news.google.com/rss/articles/CBMickFVX3lxTE9mOUFlaE40b0g5YzNudFRzWE1FUVI1a1lPUDRadmNtMU9TRnpPRDNMTVpLWGp4Ti1xR2tpUjlaeUhudUJNc1hLSk9YdVhNMmhMUTc5NTZuUFc1VENLMHRlWk1XemxSTEJxQ25zeS1tdjhYdw?oc=5
2026-02-26	Google	0.0	FBI fires 7 agents tied to Trump classified documents case, sources say - MS NOW		https://news.google.com/rss/articles/CBMixwFBVV95cUxOZkNLWXlnSVRrYXFmdEtuNVctSmJPT1hnSzNXLUhMSjVSSThRZW9BWWpHckltOEdTcTJsSjVhNlRPV3ZzOUdic19oOFUwLWROcjRpTXR2ZkFZMG5SUE1HbDNiNmZXZzZBNVZ0ak9kWXZjZ3NwYVlhdjFpTUh1Y0NydV8xbXZfOU1ZeWdDcWNrNnJHcnpycHNyc29RbS14eUt6WGFLSTBjZWQ4bTBvelRfSDNCY0hWWXJuaGxiYTFEZWY1dmFfeVlJ?oc=5
2026-02-26	Google	0.0	FBI fires agents who scrutinized Patel in Trump documents case - MS NOW		https://news.google.com/rss/articles/CBMidkFVX3lxTE1UMjFJamxra2tVSldLZFB3cGVQMFQxYWZ6bVBDcXVVejhGZENXbnV6b2VQdFU3NVJKVEJYNUdqWS1uaE9ZcGxHREN6WTBKWEhJTW1wall6Y3pLemt4NjlWdnpPZ3BJUFUtMjlDU1ZjUEF4QTR2Mnc?oc=5
2026-02-26	Google	0.0	Federal Government Takes Lead in Potomac River Crisis - WUSA9		https://news.google.com/rss/articles/CBMi0gFBVV95cUxPSnpoRWYxaDlMMDJyV3AtbmxubXQ5OURwX1NFSk9YWjNIX0tzeC1FUnMzWGxmR2lmdm10Sjk3dWFBTDJXMGJxelRQZHRsYUNzdXJWWm5YUHBzdmJaVHlEdE5hS2t0bUR4YW5fbGhnZW1JejhMTHRHOEJEODRNemNhVEx0d3ZqVG1oS0xiak9sRXpZQW1DT2JFRlBjZGlabEttSnVsTnpXZTVUNTRfN0tEX1VVQzdidE5EVnpqMXdZOWQ3T0hqUklabXlZUkF6VWRSQ1E?oc=5
2026-02-26	Google	0.0	Federal judge to state: Reinstate auto inspections now - UnionLeader.com		https://news.google.com/rss/articles/CBMi2wFBVV95cUxOTXk3bDZMWE5MWnRRMjh5dHBrRGljWldJMUd2Nzd1NF84TzF0QTh3ZHJHbjByQjdLcm0xcjA2bVduTmx0RE9zYXpnQnA2LVFMbThNYUl5Wk9lc3p6Umw1cG9xZ2pwLUdmYmJMLUpGVHJ5bWtXQzRJdkNpUnhIZVMzZmRnRTVkSjYxNHB1MjlYRElQM0E0ejBoVVlEZEk2MVo3MC0yUkRSX3BqdmY3MVVZX3BKWm9yS2xYamJiY1Z6czNEQmVoQnNfLXpzdEhQbC05THZhbGlIMDhMOE0?oc=5
2026-02-26	Google	0.0	FinCEN Rule, Rider Updates Now in Effect - | Florida Realtors		https://news.google.com/rss/articles/CBMiowFBVV95cUxOYXVFUmlxREpUdXpaeHozMGRtZFVLdGdvWVdjM3F4UmFqNDFpcDVxT21qVF9MQ0QwejNaLXJKWTZDQUtQeWxmMmhXVG95bzdXbkxSNFJmVTl0ZHpzbUFaNDZOeFF2MXp5Yk1YQlpnaUFtcEVTak93dXNERy1fZHZ2T2Z5OVl4QnJIX05ubXJuNlFPSVFfaUZCWTgwSnJIUEJRZzFj?oc=5
2026-02-26	Google	0.0	Ford now charging $495 to get frunky in Mustang Mach-E - Automotive News		https://news.google.com/rss/articles/CBMidkFVX3lxTE9NU2pGSkZCT1NTR1dmM2ZVOEFkeTNWQy1JVXd4cl9XV3VFUktRTE1qUlR4UzZaekcwcUEtdU5zNHlZR05TalpDbmFsU2Nma1k5MHdmOEZHOHE0YkhId1c2SlJaSndJal92QjQyZk5nQnNEaG9DNGc?oc=5
2026-02-26	Google	0.0	German court rules spy service may not label AfD 'extremist' for now - Courthouse News		https://news.google.com/rss/articles/CBMimgFBVV95cUxOZUVqN0wwd1h0bkpTTFRDT1o0VVd6MkJCQkVQcGE3QWFJM3pqaXJMbElqTVFhUlhmLUVYU1FHODRkRV9SalhrNzhzYUhBNjUtcHg5NERrZFRBVVk5amdRdmtqSVRaRnlCckZVMzNZVXJVRS1KMk50UkhvanFSS3FtVWctQk5OTm52dmI2LTZzaldkNENuODI4TGl3?oc=5
2026-02-26	Google	0.0	GitHub Actions now supports uploading and downloading non-zipped artifacts - The GitHub Blog		https://news.google.com/rss/articles/CBMitwFBVV95cUxPb1VpenN1X1RkbHJDdlNSQmtlcExCWkpXSzBRWnlwQWEzLXBVa3pPY0puaXZxaFFoUGY5RG5Ybno4VWxqTEliT0hVTFpnTHp4WG14QndkYzE4UzNwb3VkdlBTRVB5Ri1uVTM2aWtZVlJIaFVrdmlfX1BXcGlMWlhUNlMxTG1pUnVWMVE4aVJ5NEViUW01ZFh1U2QzSEU4cWhldTR1ZWhOcE9vQ1Vhamx0Unl1UVR3cDg?oc=5
2026-02-26	Google	0.0	Gristmill: All Together Now - The East Hampton Star		https://news.google.com/rss/articles/CBMijgFBVV95cUxOcjFqRmVTQVVvVExuX29yZDFWZzUxcXJZRC1ldURUSDYzS3V5MWpkMUszeS0yRVBOUGkwYmx1bjF4TEt4RmhxMms5c1FpZUlsUU1kYTFCU3U1QldxaEhhdUlqSmM3VW9sVFNZX2V0SUdteUNVNndQQXNodml3TzZwVFNSMjJQZjVLLUxlelRn?oc=5
2026-02-26	Google	0.0	Hannah Gadsby walked away from Netflix. Now the comedian explains why. - The Washington Post		https://news.google.com/rss/articles/CBMirAFBVV95cUxPOUFiN2xqaVRuVW5BS01VZGhPVFNodVBuaExyZC1mRDdCRWUxM1dhck9WT082SHJsUEItallxUW5yR1hBM1hJRE1Pblh0bUJGMEtsV2ZjNUxXTjB4anBmLXVfMWIzdzExMHl2Sm5iNUUxdUc5cC1jcFE5MzJaT0I0a0VhNHVBdExzNDdURG15eU5xME9kZ1hVQXppVlJaZkQ3N3RkV05tWlI1cTVK?oc=5
2026-02-26	Google	0.0	Happening now: Opening Nights at Florida State University Arts Advocate Award nominations - Florida State University News		https://news.google.com/rss/articles/CBMi2gFBVV95cUxNbWRxdTJERVBPRVhFV1BTa3UxeVJaZm1uR1hvNFFtOVVsNGp3WTR2eGd2bXU2TmFOODZCYWZfdzliS3JRNFRxZk9qYnNZNXVlMGhZSkk4cktIRGsyaFM2VHV4WlYwWGdRYXlmZFZzbG9aVENHeTFEbTh2Z3RwMDIzcEZaaGVvdlktZGw5UUVVX1AxbUxKQzVrSEF6RlE0bzBma1lzTTAzblNRMXpTYldGQjJWVlQ4bDFSdzJsMUFfRmxEV1FDQi1GeW55bTdMd1JJb2JkZTVVRmlDQQ?oc=5
2026-02-26	Google	0.0	Hawaii County adds monitors, sensor collars to protect dogs after K-9 death - Hawaii News Now		https://news.google.com/rss/articles/CBMiswFBVV95cUxQdlZXeUhkSXJnM3BZc0hhZUxnY1lEZWE3ZkFzVGxoU2x6MWtERkdpSF9SZjV4T1F3TVpVT2NWdmZncEtZankyUVdiQXYyc05RY2RacjBVOEllNzFSMVl4MGI4LW9KWmFkT0tuWjBqOXQ3azlLaHpwUnYxdVYxR05HRHI1OFpwQkFMWjdqdjlTV3EtSzFkczlod2NVNFdWY1pVd3lfX1p3TWFBcmtRRmY4Q29pc9IBxwFBVV95cUxPNnN0LTRzZS1oYTNIcWFQMlR2UzZIQjNwWm9qX1BaTnhjOXgwSkRxMFlfY1Rka2E0ZGR2UHhFaFhJby1fQnZfckVoZEVjVGxyd2M5N1V1ckxfenAwUjc4ZmN4YjZubnJhWnVEZUM2RnZkX3RzcWdpcVBYNWNSYkR3M3VnN3pOLW1id2M3N3F1UnFCU01lNmhvNUV1d0ZPZ2xXWTViTVFmWWtZOFRzUmRPb29rMzhEU3lhLVUtamRCbnRuSFlzbUlV?oc=5
2026-02-26	Google	0.0	Honoring a legacy: 2026 Tom Perrotta Prize now open - WTA Tennis		https://news.google.com/rss/articles/CBMikwFBVV95cUxNaVVXQWpZWnNRaEQ5dXJsb1I5cVRiVHZEb2xJenp6ZlIwWVpoaUdmRUVUd1MtSUs0bjFDUGREaV90U2M2OVZCay1VODVyUlFibjJYWmtGNzBUYzYwN29RMFNBTk5ueDFlbHp3MDU2ZV9ldm13Nlg0MmJPcWFPNUhSTldzcmtmUFNfT3RnUnI2RE53VkE?oc=5
2026-02-26	Google	0.0	How to gauge if the bottom is in for software stocks - CNBC		https://news.google.com/rss/articles/CBMimwFBVV95cUxPYV9heUZxSkE3Zl9YdFFKcm95MExvVlhtbnFBZVFSMUNlTEpNaXVnRGluVGIzYkh3SFFwdDRpRE8wdGVVWGFkR2hDRmttX0laYlI5Q2NqWnlPWkl0ZXM3bmhFQnl0eWw2cUdJS012SVB4RTBfUWlOdktWX1UwMTZrTHhqLU5RT2FPZmRpS2dpVThaWjRodGlObmpkcw?oc=5
2026-02-26	Google	0.0	How to have an 80s-inspired day in Birmingham - Bham Now		https://news.google.com/rss/articles/CBMiekFVX3lxTE5LdTgyM3QySGl3MjZFYVJmZGtjYmZ2bnRwcTd2ZnpyRDZjSWNYODRSdjNiTzB1VkNTRnEtdFZ2V1VqeXhhZ2RJOHBzOTY4NkthdWVWbi1uQkhEOS0wZlhBWFBMUmJETmhFb0kyUU1mVmhBMV9VVWNqUXlB?oc=5
2026-02-26	Google	0.0	ICWA Can Now Apply to Descendants of People Enslaved by Tribes - The Imprint		https://news.google.com/rss/articles/CBMimgFBVV95cUxNbmMxNmh4UlJPS3RCU2ptMERNeVllMzk4Y0RoSXctSWt5cHlKSVVwS3FqXzdvYjQwYjJaUFBCOHpvclpqVzdWeDhuU3NMY0FNSVFpOFd6RE5OZEk1SXFwaEtHdW9wbFNJd0tKbkJaRjk1VWFsMDBHYU9tbkpXUUdheEd4aUpyRjczVkphcjhpenh0eVBUS2ZrUmV3?oc=5
2026-02-26	Google	0.0	IEEPA Tariffs Invalidated: What Companies Should Do Now to Protect Contract Rights - Baker Donelson		https://news.google.com/rss/articles/CBMisAFBVV95cUxON1V4VjB5MjBrdGVHMlJrRFZDUHJXakhpYVp2cTdfRHpTQXdKV0Q3bWVFbVdoQUQ1ZXRfM253UTJrMXFyMTJsTlloaUNCOWZwMDJYRXRFUkl6WnVMM0tzbm1jeVpnMENlZVhDNng5TjRaWjJKWUpmb0R3Nm10ekF2QjdNTXh2c2ZCM3ZEX3Fpc2lMcEI4YjBheEhJRGRFRDhGX3M5amp0NU5hQzdxS2lJWA?oc=5
