Date	Source	Sentiment	Headline	Summary	URL
2026-02-27	Google	0.136	Eaton (ETN) executive receives new share, RSU and option awards - Stock Titan		https://news.google.com/rss/articles/CBMiqwFBVV95cUxQaG93N0swbXZFbUprMEhRblFISWVBUGdYbThrODlBYi1wcmNseWh4X3JZS3R2SmxDM2xuV2xqQXYzOEhyaUJwN1paWlQyR09GZVVsYUtZdlREd2ctYmhpcjZlMTVIVlU3OU40bV9aZGdNSzRFem16WTNIRnB4WlRqM0pMckFrQjItZjZ0NHFheTJOTTNEVml1a0JaVXBoU1R3bkdsLVgtRzlnOE0?oc=5
2026-02-27	Google	0.0	Decoding Eaton Corp PLC (ETN): A Strategic SWOT Insight - GuruFocus		https://news.google.com/rss/articles/CBMilgFBVV95cUxPX1lZaE5saVdERGR2M0htdzJ2TjY1SVM5WmFOSVE3ME10dk5tczFwV0hiNHVOMm5nWTlSaUFweW4tRDhnRDgxWDh4Q3daU1JPZUJqTmNwaVVfSkdiVzlrT05CV08yakZYc1FSTHBhU1pqMlJ6Z0wtMG94RmhmVUZsQmpNSnhpZE5IZE5zbUtJNnB3dmRmZVE?oc=5
2026-02-27	Google	0.0	Eaton (ETN) Receives a Buy from Bernstein - The Globe and Mail		https://news.google.com/rss/articles/CBMiwgFBVV95cUxNdm1DWFVnOWRidW53eDdtVmRRLUpwZ1dKajFhaldDdDg4Y2JEMU9ZcGE4M2FSdzVBR0h0Q3lmLVRISzE5YmZQcExBRGtnNDNRUllTRVBYWVBsSTFubkhhcWYxeUlWRjhEU3hxWS1Rc1VoZ1JTSEJ5V29weE4yVTNnTktnSXVIMjVMd2VraE9rRGlITE1ILTVXYnVPZ3UxTGlKN2I1Qk11cGlXTklVMGpMcFkxUzhjdWJBWTJYd3dILXlPUQ?oc=5
2026-02-27	Google	0.0	Eaton (ETN) awards stock options and RSUs to executive Awada - Stock Titan		https://news.google.com/rss/articles/CBMiqwFBVV95cUxPLTdaeS1OY2NCQ29hRzh1V0tzTFFuQnZ2SlBiNVZyLXdTR2ptUlZLU2NNb2dPNW5GVHRiUUxQWW1lS3dzNG4tZlhKQnNnT0pIczZlQWxpUnloRGdUdVNSRG42Zm1lUG9OLUtMZlpQbEtXLUhoSk9SWF9uallWMHd2bDRwMVFKOUFCMHhsVVhNRTVRYlFKcjAwS0NVcnVodTRSNVFpY2VLSWh6MWM?oc=5
2026-02-27	Google	0.0	Eaton (ETN) officer granted options, RSUs and withholds shares for tax - Stock Titan		https://news.google.com/rss/articles/CBMiqwFBVV95cUxQNmR4MGRWX3NfOHY2cmtzalYtUHR0TXJQendDbmdjSlhCemxrcmpvMWx1YmJ5QnBNdGtMUVNHaWU0a2ZRTWZpRkt4UVdsTmxETU9CWkJCX1NIempTXzg5OUhpMjB2RXFHSmNjOFRpVTJwazZLc0p3dG1NSlZCTDBuT0RFOFFuREdLZ0dSMXZSZUQ0VlVpOHdRbzBYcGFTaU9hSXZaa1dmMWl0c2c?oc=5
2026-02-27	Google	0.0	Eaton (NYSE: ETN) executive gets stock awards and withholds shares for tax - Stock Titan		https://news.google.com/rss/articles/CBMiqwFBVV95cUxNYmp0OWIzOU9qa0trOEN1RlhwUGVoQTlQX1BsMVRPTWVkaHpuWXRkcUtqYVJVNnEtcEg0UVVScWZWVi1NSnBGUlZJbHZGZWpzQlNqYnlJejdLZ2gyemtIbm9uNUpjemJjRF83Z0lQS0l5eGl4Q0NvWGRwVVdMZkswNnFlem1NODBscXdlZWJkTUhqc3l6NF9nTlFlXzd3ZkJFVkVrbE44aGplUEE?oc=5
2026-02-27	Google	0.0	Eaton (NYSE: ETN) executive granted stock awards, shares withheld for taxes - Stock Titan		https://news.google.com/rss/articles/CBMiqwFBVV95cUxPQjg0cjV2MG5wYXI4ckJkUnB1cnItSE5vTHN0RE5VSFlZV2xBVklMWm9NZEMzSk9YNGhPQV9BalZSWEczOTNJMFdmUnc5TjFGSlZKY2VJYklJcVJrWmpySU9tdjVvYW9wQkZtVUlaNmVlbXVtX29Zc2NSZVRMcloxbi1RYlgycnhzTHc4dlg1TDBnUUoza3V0NHZZOUVrdGcyZXNoSmdYbDQyaDg?oc=5
2026-02-27	Google	0.0	Eaton (NYSE: ETN) executive nets RSU shares, withholds for taxes - Stock Titan		https://news.google.com/rss/articles/CBMiqwFBVV95cUxQX01qVlR6dGwwc3AxT1pSaGk5cnJ2dzNYWTQ0T3d5Z2RMYWhLam5ZMjVNX2RrbFJ5WFdFd0R6eEhrOWxWYlNqLWstUHBJNDNpZVVCUWhsamtuSE9hUnNmaGliNXBLaWtacnlsbzF1bVMzZ2NYUzRNMDhpN2xwRmpDMTZtdWptR2hyMFdHRE9td3pLanpzLTdJR0ZIYm5tU3h3QnlreGpBeGZpNlk?oc=5
2026-02-27	Google	0.0	Eaton Corporation, PLC (NYSE:ETN) Raises Dividend to $1.10 Per Share - MarketBeat		https://news.google.com/rss/articles/CBMitwFBVV95cUxPMThkdGd6dWFyMDI5c0ZBbWFNSW9Nb2FWVFo4N1RaN1VuazZCaE9MU25GTXZQWFBhQnpGVW9KTnExeFNySGxDTXBQMEtrcVB6SjZGb0Q2Snk0Sm13SzNpSDRCVTJyc1hkeC13aC1VdkIwZmhMMnVCWjhXNzNwcFBvZEYwRElnVXVjQ3hhS1I0QVBuZlBoZVc1OVNwTVFVb0djQUE2NWl3MXNzc1dPZ042X2tfNHNrY1U?oc=5
2026-02-27	Google	0.0	What's Driving the Market Sentiment Around Eaton Corp PLC? - Benzinga		https://news.google.com/rss/articles/CBMiuwFBVV95cUxOM3U3Uy1IeThOdFh4NkRnaWpJVWpNeFBzZHNHWG41MEltQlh2N3hnZXNCY1BwV2xRd0EzbC16Q3pmLW5oaDNIUHlXaFRpRWlwZm15Zzl4WHFJRmJOSEEyUE9OLXlIUl9zV2hHRkFBQTFKakpiWER5Rk9tUFZVdFp5cldGVnJVUXEyTmpHeUwzODVCd0xnbTNNWVhfODZrMlBnMUlsUUMzUVZLNUtsQUdyaUJHcDFJQkFLM3NB?oc=5
2026-02-27	Google	0.0	[Form 4] Eaton Corp plc Insider Trading Activity - Stock Titan		https://news.google.com/rss/articles/CBMiqwFBVV95cUxPOEgzeWx6cTg5b3o3STVzbk1CUTVaRlhHWm1KNGRtMWtfLUxPc2Q4cFhCVmRkNmdaaFVXdFp0LUpRN1QtQXFES2pxUVlYYUJjVWRvX29aX1d5dFpUOG81eHU0QjVlNGpwR1M2Y1JuYm9nQU0wMzNMMi1NVTZQY3Zxc1ZhWllIek9OTWdFR25Sd09CdjBoZy1ESDE2bzR2M21EOUhnVkNxX2FvTUU?oc=5
2026-02-27	Yahoo	-0.083	This Industrial Stock Could Be a Hidden Gem (and Here's Why)	Hyperscalers are spending massively on capital expenditures this year, and this industrial power and cooling company stands to benefit.	https://www.fool.com/investing/2026/02/27/this-industry-stock-could-be-a-hidden-gem-and-here/?.tsrc=rss
2026-02-27	Google	-0.167	This Industrial Stock Could Be a Hidden Gem (and Here's Why) - The Globe and Mail		https://news.google.com/rss/articles/CBMi1wFBVV95cUxOeXZpNzJJRXlKVVEwNzM3ZDNXeW83NXJfTmMyYnJqMmUtMVlWUzJBVVl4bVZpeVI4QzhXcFdza0JGYnBGZEFFbjJWSVlxaUsyQ1RzSWRaOEV3ODZiTkdnb2lTRTJyWHRDU1ZuUkpOM0N1eGhGcVVlSk1aYXBXbEFsUTJyc05yNkZqR09fYlUyY2ctdS0wWUozVWxJTUduOWF4dE9rR0htUER1RVVzS2NNVktLUEQxY0NaeHBseGxZNEJfTGt1b1NrSFZvWUJmZmVERHB1UWJLOA?oc=5
2026-02-26	Google	0.5	Notable Thursday Option Activity: ETN, COIN, NVAX - Nasdaq		https://news.google.com/rss/articles/CBMihAFBVV95cUxOb2JyaDU5RC01bEYxaVUwaW50c29PN19hSHJzOHZUR3I5MmN4LWNHRUYtdnBkek45T3A3MnR4cS1LZFlzYXFhY2gzUE5UZUF2ZlF1SEk2WnBMN01lc3JwSldCbEVFTDM3b014Q3lVQUZyNHI1RmxWRmN2cEZGOE9nZWJQdXI?oc=5
2026-02-26	Google	0.433	Eaton (ETN) Boosts Dividend and Projects Strong Growth - GuruFocus		https://news.google.com/rss/articles/CBMilgFBVV95cUxNRWVTWXlFTlI5aDF1d29kLXE0d0JoSjVNRDRZZWpxTnNsXzIxYkxHOWpkRWxzUk1nVXlPOS1FTVJDaWpsR1I3MEl2MEI0TlVOVXJvM29HUFp5enB5M19uajd2QXI0WHhzVkkybHVab0FqLVpfQUV2UzNUdTF3T1gxV011Wk9Cak9UdXdPY0M0VTlRS0EweWc?oc=5
2026-02-26	Yahoo	0.267	Power Distribution Unit Industry Report 2026-2035: A $7.11 Billion Market by 2030 with Schneider Electric, Eaton, ABB, Legrand, Tripp Lite, Vertiv, and Siemens Leading	"Key opportunities in the power distribution unit market include rising demand for intelligent PDUs, integration with IoT for scalability and energy efficiency, and expanding edge computing. Growth is driven by investment in hyperscale and AI-driven data centers, especially in Asia-Pacific. Power Distribution Unit Market Power Distribution Unit Market Dublin, Feb. 26, 2026 (GLOBE NEWSWIRE) -- The ""Power Distribution Unit Market Report 2026"" has been added to ResearchAndMarkets.com's offering. The"	https://finance.yahoo.com/news/power-distribution-unit-industry-report-155500116.html?.tsrc=rss
2026-02-26	Google	0.214	Stock Traders Purchase Large Volume of Call Options on Eaton (NYSE:ETN) - MarketBeat		https://news.google.com/rss/articles/CBMivwFBVV95cUxPbHkzc0I2QjNNX2R0SVNtRm9tVkk4TEszNDlIVl9ldi1NWVRMRWd0U2dsMkNCQkxuSnJjQWVhRTNfZkgyYlkwd2JJd0VYSnpzTWJCSzJkNUI1TXFoUHlUVXBWNWdjbTdtelZIMjE2cjFTaTdSenpVLUoyMEdSLU5BNTN5ampSNkhpVDgxZlNoYzNrNEpiTlNHZGdlbVRiWW9HUWdsVWZHNGVtaFI1Wlh4T3pKSmxFSWJ1cnAzQWkybw?oc=5
2026-02-26	Google	0.2	Unusual Options Activity: ETN, TSEM and Others Attract Market Bets, ETN V/OI Ratio Reaches 1333.3 - 富途牛牛		https://news.google.com/rss/articles/CBMiqAFBVV95cUxONXZQQjk0UDQ1YnptNkFVT01HZUQwX05HNDB2M01hOTFOWTNPV0pXcFpKcWJOS2FNUDJwNkd5ZURMSTNjUTVPbWlYT2FSSG9lUW81RktjeWtUZV9mS0FnTkhxWWhQSDJObVJPaUx1Xzg2MzRVd08tYklIR1JVam1sbkZhSTN3cWZVV3ppZXVldW11eS0zNVduMkJyMzFJRy1ieTY5SWE2NnQ?oc=5
2026-02-26	Yahoo	0.183	Eaton increases quarterly dividend to $1.10 per share	DUBLIN, February 26, 2026--The Board of Directors of intelligent power management company Eaton (NYSE:ETN) today declared a quarterly dividend of $1.10 per ordinary share, an increase of 6% over its last quarterly dividend. The dividend is payable March 27, 2026, to shareholders of record at the close of business on March 10, 2026. Eaton has paid dividends on its shares every year since 1923.	https://finance.yahoo.com/news/eaton-increases-quarterly-dividend-1-184900959.html?.tsrc=rss
2026-02-26	Google	0.0	Assessing Eaton’s Valuation As A Dividend Hike Meets Electrification And AI Infrastructure Demand - simplywall.st		https://news.google.com/rss/articles/CBMixAFBVV95cUxOQkJiVHBsOTg4YXJxUFJCR3ZmNEk2XzZqMkd1MGtyZXdYZGZHSnhSYy1TUHRfYkZwSXVxVjRaMi1DVFl5SE9WeE9GRjRlUkJ0SmxTUGhPa2ZtOWpSUDEwQWlhSUU5RzB6RHBrVzJUQmcyQXhJa1RGcUNKR2gxbTJHbDVjOXZ5dkZKTnlQaFp0RVIwNUdjTGZMejlzUWhNVzNKSWw0VGRlTDhqcmtHMkxYZl9TZUgzaWhydWpKMXBMWHhTQm1P0gHKAUFVX3lxTE1WeUpLdkJ5bjkyQWdjSXIwckJZOWdWYmlLd2VTb2oxU0dyMzllbjlKX2ZHXy1NRkJoOVJPY3dKejAxMlRaMk45R1BqTzFiWmZMNE1BNmp4RUNDSldlMTVWdjItVkhhdEY2V0pLaFJPS21wdDk0Sm1SdENyblVWRFg5ejd5OUV2VGxCcU9Ba2F2cFN6MjE5MDJrWEozdzY1c0hQMGlrcTdZR2NFTzlLUkY5NUthRXZhbGhTWnAyaExISWdBd2gyZVIwUlE?oc=5
2026-02-26	Google	0.0	Eaton (ETN) Raises Quarterly Dividend by 6% - GuruFocus		https://news.google.com/rss/articles/CBMihgFBVV95cUxOSk52SHJIVndCYkRGMnVwSjk2VTdHYlZBWXkzSE1Ud1lrSWhRWENSZGxfd29Lc0UwejNWVjNlcFlwS2ZoRXYtOVNGZVJNXzBCX1g0MUZBSHpOSEZrdUxSSzJJbEVsZmFnTTZiSDdqeDR6UkpWdVBuNWF5YXp2SUQ5Z0pFMlNEUQ?oc=5
2026-02-26	Google	0.0	Eaton increases quarterly dividend to $1.10 per share - Business Wire		https://news.google.com/rss/articles/CBMisgFBVV95cUxPWE5EVFdIQjBnOGlQQldwQ056ZUdKTW1OdmJGUE0wclhoYm5QUWJ5MWlkeGZUZjRCeFNRcmdCRnlGbld1M3VrM0JjTDAyRF8xbEdna1RyMV8tZTB1bUhNTXlvVG81QkQzVzh3aU1OQlZVYXpFWW1aclYzRUFVanJ6NU93ZWtreDRtNXhTQW4wNFlDcXZadTQwLVE0U2xoRTJwcUpYOXcyV254cjRuNUI4R1J3?oc=5
2026-02-26	Google	0.0	Noteworthy ETF Inflows: GRID, JCI, ETN, PWR - Nasdaq		https://news.google.com/rss/articles/CBMie0FVX3lxTE9aMXdxVnBFSlBsbFloLTUwbEc2WHg1c0hrZmJyV0xJc05MLWNCX3U3bDA0WDd5WjQ2UlhraDZEd1Z5emRpS1NiN2pJbWpjbldqVUxlbDJwYl9hUmFSWXJIVnpzWnhOMDJJQTNhY1UxUE5CTjNScnA4SkFpdw?oc=5
2026-02-26	Google	0.0	Precision Trading with Bank Of Montreal Zc Sp Etn Redeem 28/06/2041 Usd 25 - 063679575 (OILD) Risk Zones - Stock Traders Daily		https://news.google.com/rss/articles/CBMiiwJBVV95cUxQVjUxX0NkZmF2dUM3azFYdTRwcUdFU1Rzb1RUSVM4cXEwbFRGblRvYzBtbHd2MVM1TllVXzNxcF9FcDZnUlBRYjg1UE1NdUxFTUMtLXJQU1NXT3UxQXROZEFyZ2VrZkdTbmthbmhTLTlMZ1RYWThKU1VBNmFQMjhnNWp0Q0JzLVRleDREYXl2Vnd2R0Y4MjltdFBvUlVqVmtpV3pUMVk0TEFVelF1Xzlnb3IwQUdIaUIxOE5ReEdoVVh6Q21jU2kxdi0wSVE0UktYcHNXekNva0RPeEVjYlpLejI5cjVrUVViSVBLcE44X3dwZ0RUYmVSWWdvb09weVNxZFpkM1FhN2xzYlE?oc=5
2026-02-26	Google	0.0	UK investors only have until April to add crypto ETNs to their ISAs: FT - CoinDesk		https://news.google.com/rss/articles/CBMiswFBVV95cUxNM2J2YzBSZmkwOVNMd1NPa2lLeTlhU2tUb25Ua0ozWTdUNGcyUUw1dktldmRiejh0RWxhTjM0c2JRdXBrTS1uWWM5STVGZXJaN0lJa1I0eWxCWWNQWExmYmRWMEhqMkFyaURWN0hwbUhqSHUwT1NYUl9EVDFTMVdLbW5wYU9OWVhLRXJVR0hKLWdPTlczMmhwWm5acldMbndycEd2Q1R1QkpBMDBzZjRYNDgtdw?oc=5
2026-02-26	Google	0.0	iPath Series B S&P 500 VIX Mid-Term Futures ETN - Corporate Bond (VXZ) Price Target Increased by 15.63% to 64.66 - Nasdaq		https://news.google.com/rss/articles/CBMivAFBVV95cUxORlNnSEtwX1UzUGJFejBXNVV1UDY4TnBoTU84V3BlR0R0b3VQRDBRVUVuaFpTdGozWUc1cXZxQ3otUlRDUzNjWEVKZ2I4N1I0Z1IxQk12ZWgyMmZNRl90a0Uxb2RKZmptWnlEX2hWb1YzWElLVGphSmN2ZmZpZGJ4cWJodDk4dmlxdmJGaE1yUzBOeUh3VEdHVVpsSzlkbmhsV1U2eFJXZUZyWmpPbmk0V1N2QlVDbnF5TWtkXw?oc=5
2026-02-26	Yahoo	-0.042	How Is Eaton's Stock Performance Compared to Other Industrial Stocks?	Although Eaton has underperformed its industry peers recently, analysts remain moderately optimistic about the stock’s prospects.	https://www.barchart.com/story/news/445062/how-is-eaton-s-stock-performance-compared-to-other-industrial-stocks?.tsrc=rss
2026-02-26	Google	-0.15	ETRACS Silver Shares Covered Call ETN (NASDAQ:SLVO) Shares Pass Below 50 Day Moving Average - Should You Sell? - MarketBeat		https://news.google.com/rss/articles/CBMi7wFBVV95cUxQSWlXSnJ4X1JiZktBeFg2b2g5VXZ4aldLUXpqYU0weDhpdmNPS2xmS0lVX092M1hXYmZ1eG1veFY3U0h5LTRDSk81dkQwcDA1MzZGSmM1eC1nMlpydVpsdWxRZ0JidmNoRWU4VDNFZkhjdnBwOHZaUmpMLVNrQW01TFBTMFB2dk01MVBoeE9XZW1LbGF5VlpkUm1HQmo0RE93QVp3RF8tbm1aUEZWdGdBT3JvMjVwRU93SFkzT2FBc1JkQzZKMlFqeGU3RkIwU1BSZGppVkhpMFNsdllUcEtsOGt2cGk4MTFadmJmRHVuRQ?oc=5
2026-02-25	Google	0.0	Eaton Corporation, PLC (ETN) is Attracting Investor Attention: Here is What You Should Know - Yahoo Finance Singapore		https://news.google.com/rss/articles/CBMijgFBVV95cUxNZ0c1TXNfNlJkSFI4SVlYZUV2ZUgtY2k0aUw5N2M2aUpjMXJjby1SSjllRldvTEhSNk5jOXZZdFRDcVVOcjBhN3BkVV9SUjRtc1J4RUM5UTRyMU1rMEtlS0FTWkNkWVJYUjBsQnNPWjM2eFlqY1IzWWszWU5NNVdHVmFpVWdZdUVxWE1PTzZn?oc=5
2026-02-25	Google	0.0	VPOL.SW VanEck Polygon ETN A (SIX) 25 Feb 2026 pre-market: RSI 20, bounce watch - Meyka		https://news.google.com/rss/articles/CBMipgFBVV95cUxOd0NrWVhVdC1VLW9YcXJXQXNoR0Z5NHNweFZPRV9acjJnbUQtTkhwbHFiWFR5aFM1dmlxUGxPQWJqc3ZsMTA4X0FsejhVY0RONFAwenVkQkt5UUZzWGhhUnNTbjY2QTc3TF91bGpGZk1naG52MHhkOWFScndWYlo2TkwxeWloeVhqd0U3ZE43cm9GRm9BUmQtcnRYMVp5cWFrZVFNaHpB?oc=5
2026-02-25	Google	0.0	iPath Series B S&P 500 VIX Short-Term Futures ETN (VXX) Price Target Increased by 25.46% to 34.68 - Nasdaq		https://news.google.com/rss/articles/CBMiuAFBVV95cUxNTjBlbEQwVWNXNWx6TG9nTGtZQmh3YUI1MWUtMm1wS3hiZG9vLVR0SzRqdU5OTlN1RThKbXJfSVBKQW5uY0Z3dTNOU0pEclBxWUlTOWdRU2dCMWotR0cxRWNPU05EWDFZYmxPOGJDZUtabW5CdjZTc0c4QVN3Qnc2UjM1MFFXWmt1S0xZZXV6d3JPODBZN2VFTVlDTnUtNVRkUzgwNzA5SGU1VUVXU2NTYzhxY255MHQ4?oc=5
2026-02-25	Google	-0.1	AMUB SEC Filings - UBS ETRACS Alerian MLP ETN Series B 10-K, 10-Q, 8-K Forms - Stock Titan		https://news.google.com/rss/articles/CBMiaEFVX3lxTE1lMVZIZ25jMmlacUFZZmc1STVlcEVXSXVybi1TR2g5QnA2OU9PYmdrNmQ5NlFIZWhzdkh0QkJxeTNXZTBhQkQ2Y3Jtc01IYkNwU3NBN0F3Rk9UbWcza0ppcDBBR3pjN0ds?oc=5
2026-02-25	Google	-0.1	Should Data Center Tailwinds and Insider Selling Shift How Investors View Eaton’s (ETN) Risk-Reward Balance? - simplywall.st		https://news.google.com/rss/articles/CBMixAFBVV95cUxONWtMRnRZLU9LeGV6aHNuV1NxSkVSNlhwSFg3MzVKMEZ2Nm5XZHVpaFhvcy1QYjNxSnBaUUcyUVRRRE84YWhXM2NpSDNBTk8tZFZmR2d5NEJQdWpUbXA4Rkh6Q0pIMXVBZmdkWXEzX2JXQWhUb19XWnFvNkZSaW1FVVRhc2FhZHh4YmkwTG16ZTRsOXFxRmg1VW1oVExHTW5QMXVoUEhaVGl4VG1TbnBBc0dTTl9FMllmeWNLVC0xLWtzWm9G0gHKAUFVX3lxTE9NM0hoR3BCZ0FXZXZZdV9DSEQ3a3JNb1RIUF9vMnlNSXl2SXlSUm9pNzJiZTJyVTdlLTJEVXNfNE4taG1Tc1BOV2xUZFRkdVVHYWpRcDRxd1ZnUk95UFNkWlRPczc0YnJaQ3JLcTZGMDZQcXVyeWJCQjhzUHNvZlZpNWJScXdKZmVVTmwwN0lfYjlWRUtiT2ZzM2hrXzdNb18wSUROek81UEZYZzU2blpLdC1WeU42MzVXY05HRHplNmtRQmF4T244Vmc?oc=5
2026-02-24	Yahoo	0.35	How The Eaton (ETN) Narrative Is Shifting As Analysts Rework Growth And Valuation Assumptions	Eaton’s updated fair value estimate has shifted from US$403.80 to US$407.53, a move of about US$3.73 per share that reflects refreshed modeling rather than a wholesale change in story. This adjustment lines up with a mixed set of analyst reactions, where some firms are lifting targets and ratings while others are trimming expectations around the edges as they refine their earnings and valuation work. As you read on, you will see how these moving targets shape the narrative you are watching...	https://finance.yahoo.com/news/eaton-etn-narrative-shifting-analysts-190941407.html?.tsrc=rss
2026-02-24	Yahoo	0.13	Is It Too Late To Consider Eaton (ETN) After 123% Three Year Share Price Surge?	If you are wondering whether Eaton's current share price gives you good value or is asking too much, this article will walk through what the numbers are really saying about the stock. Eaton recently closed at US$374.56, with returns of 13.1% over the last 30 days, 14.4% year to date, 31.9% over 1 year and 123.5% over 3 years, which naturally raises questions about how much future upside or risk is already reflected in the price. These moves have kept Eaton on many investors' watchlists,...	https://finance.yahoo.com/news/too-consider-eaton-etn-123-231510406.html?.tsrc=rss
2026-02-24	Google	0.0	Eaton (ETN) executive converts RSUs to shares and withholds stock for taxes - Stock Titan		https://news.google.com/rss/articles/CBMiqwFBVV95cUxPYm9LVnZROGNUMXNTcXJVaUJLUFVaZ25abUhhNGVZcERScEkzRHNTemhFS0loSU1MX3ZTby1QN2NiYUV2dGo3VzZrTGJaeHVXWHJDZG4tRWw3VERmR0VPdHUyaDVmUnZHcWdheXlBOHBPcy1KbFdaQ3djZ1JSTXZnRmIyQmU5a3g4dGtEbVR6RWJDMXQ2cld4WHhxYnVZS2tsV2VtLUFXQjZHYTg?oc=5
2026-02-24	Google	0.0	JPMorgan Chase Financial Company LLC Declares Quarterly Coupon on Alerian MLP Index ETN - Business Wire		https://news.google.com/rss/articles/CBMi3AFBVV95cUxPS2RHajZjUDNkTFBXRlFmRFhoVW1QcE42T3Vod0F0Yk9Bd3lQRTJmZWtBSDJpd2NRV0swaU9YVF8ycGlNOFFRaktlMzdWdmdIeExYSDRKemlvTEVSeWYwSXVSVDdsOHBlQzh3QVRVQTFNTnMzWkpZZUswT1VmenhZanFhSHJpbWI0LXE1S1gzMzVOZG9pTnJ3cGdoYlg2bDFtYS1YZjFHSTlEWVk1RnJBRUtNSURIMjF0YjJvQlVZZkF3eVZKeG16ZmhycVRsS1B4T2xfaUZZM2hwRW80?oc=5
2026-02-24	Google	0.0	JPMorgan Chase Financial Company LLC declares quarterly coupon on Alerian MLP Index ETN - marketscreener.com		https://news.google.com/rss/articles/CBMi1wFBVV95cUxNTjg5ckI1d3BSRWx5Yi0xMFkxOFNWdU56dF84N1BNQVZtbnRpNFYyWFllU1I2Nkh0WDY1ZWhmLUVKTHpGelBtdUV6NVJMLTg2ekp0MEYtcjhwYjIyRFJrd050ZVRqZllwU0RVQWV6ZTN5RXlUSDVXUW94dHQtWVJQT0R5VFdab2hqZEtLMVc0T1JDOGtDdi1jS0lySFZRVm5LYnUzaUtoRjBveTdIb3J5Qkd0ZDVFb19kUWx1WHJyQmlETF9zQ0J3RGlmWmo0bjJial9oQXZ0cw?oc=5
2026-02-24	Google	0.0	VanEck Sui ETN ‘VESU’ Achieves Landmark Listing on Deutsche Börse Xetra - CryptoRank		https://news.google.com/rss/articles/CBMic0FVX3lxTE5lNFJFbVlDenZPT0tfcWcxMzJvWm81bzlIVXBpYUZJaHZ5eDlnbE1hRFpMTW9FQjg4a2tmb2F2cjQtUEZ5Zy0tU1Roa2piVHBWUjhRZWw0X1RMdVpiS2g1SmFMYmRUYkhOTDcycERqV3ZtaFE?oc=5
2026-02-24	Google	0.0	Wells Fargo Sticks to Its Hold Rating for Eaton (ETN) - The Globe and Mail		https://news.google.com/rss/articles/CBMizwFBVV95cUxQQUJOQnFVSF9LSF9iRDJ0NDRocFNQSUJ2akYxZXhIdVdSS3FIQlhvMlJDLTNGQkZPbmE3NldCakEzdnhTdHlDaVhLQ0FxeHlMVWl6bHhJdWxPQWYxSGc2cEZGZndpdzZ5Y0o2dzUwakljc2hPY09DOFhiZUlsMkJZRDdHXy03bEZlSnlnUkx4VG1GcnR3aExCUEJnZHFIcXktM3FGejNXWFNrQVpSUmhnQmljemhVeEhwbGMybGNXUHU0M2NocnpabHNSM21PblU?oc=5
2026-02-24	Yahoo	-0.163	The Stock That Didn’t Get Crushed by the AI Doomsday Essay	Monday was a tough day for the stock market.  One factor hitting the stocks on Monday was an essay from Citrini Research, published on Sunday, that imagines a future in which AI devastates the economy.	https://finance.yahoo.com/m/d883cb34-99d0-3abe-b9a6-d3d89f15bcaf/the-stock-that-didn%E2%80%99t-get.html?.tsrc=rss
2026-02-23	Google	0.7	Wall Street Analysts Think Eaton (ETN) Is a Good Investment: Is It? - Yahoo Finance		https://news.google.com/rss/articles/CBMihAFBVV95cUxNb0ZhYnFjekpPemotTGhaeU9KQ0FqRTlRZEVlSFFGbUVCdkFiaEJ3Nm1aMmppS2lLZ2VWOVA3NW1vY2pTMnRNRVlINFdTOVJ4bjRLTTZaRVpDbnNPdUs3RG1NODV6aGF3clVIcWhfZnd4RlhIbUlVUDh5Y19BOFU5eWRFbXk?oc=5
2026-02-23	Yahoo	0.252	Wall Street Analysts Think Eaton (ETN) Is a Good Investment: Is It?	Based on the average brokerage recommendation (ABR), Eaton (ETN) should be added to one's portfolio. Wall Street analysts' overly optimistic recommendations cast doubt on the effectiveness of this highly sought-after metric. So, is the stock worth buying?	https://finance.yahoo.com/news/wall-street-analysts-think-eaton-143002624.html?.tsrc=rss
2026-02-23	Yahoo	0.243	RS Large Cap Value Strategy’s Analysis on Eaton Corporation (ETN)	RS Investments, an investment management company, released its fourth-quarter 2025 investor letter for “RS Large Cap Value Strategy”. A copy of the letter can be downloaded here. The RS Value team seeks to invest in profitable companies with capable management teams. Despite investors facing many concerns entering the new year, domestic equities delivered strong results […]	https://finance.yahoo.com/news/rs-large-cap-value-strategy-132131136.html?.tsrc=rss
2026-02-23	Yahoo	0.235	Clean Power Alliance Impact Report Shows Record Growth in Clean Energy Adoption and Resilience-Building Efforts Across Southern California	2025 Report Details Significant Expansion of Renewable Energy Resources, Customer Programs and Community Investments Driving Measurable Regional ImpactLos Angeles, Calif., Feb. 23, 2026 (GLOBE NEWSWIRE) -- Clean Power Alliance (CPA), the nation’s number one green power provider and California’s largest community choice energy aggregator, has released its 2025 Impact Report, highlighting a transformative year of strategic investments, community-centered growth and expanded clean energy solutions	https://finance.yahoo.com/news/clean-power-alliance-impact-report-170000674.html?.tsrc=rss
2026-02-23	Google	0.214	RS Large Cap Value Strategy’s Analysis on Eaton Corporation (ETN) - Yahoo Finance		https://news.google.com/rss/articles/CBMifkFVX3lxTE5ZY3BIWkZQWkhEUTZNWm1KWURoekhYeHhoRjVTaXV6bExZMWV3cVBGelRJdjhYa3Vwb1dxOUQ2dG9RMjAwZk1INUI1dHktZ0VGczVaZXhURW1PTWFJUERmZHhwSVA3TGFyQUlJcDgybVpqQmMwc1Nuc3BoQUF2Zw?oc=5
2026-02-23	Yahoo	0.18	GE and 5 More Stocks That Can Win as AI Shakes Up the Economy	Manufacturing and aerospace & defense stocks are turning out to be potential havens as artificial intelligence disrupts industries from software to financial technology and professional services.  “AI will enable a structural reduction in the cost of doing business for many commercial aerospace companies, supporting higher through-cycle margins,” wrote Deutsche Bank analyst Scott Deuschle in a Monday note.	https://finance.yahoo.com/m/42b6641c-d535-3518-85f0-2dcfdbaa2b61/ge-and-5-more-stocks-that-can.html?.tsrc=rss
2026-02-23	Google	0.0	ETN: Today's Analyst Rating by Evercore ISI Group | ETN Stock Ne - GuruFocus		https://news.google.com/rss/articles/CBMiswFBVV95cUxNaWZVU245elBxSTh3T3BzODBPUlNqX2FpTm9ENUt4N3FUZzU4UEJTbldlQzk2cGtOSG04b0hYaElmRk5weEFFa21zSEFsZ2VxMHVQRExkTUpyZDdTNGQ3aGFmRXpzNG10aEF1NjI4am0tR1RQUHVBOGdXdGxuYk8yd19ReFNUQy1aMlRoajVkdjNBazFjUkQ2SzNReVQ2dlJjU3U1V3VORS11eWMxQzQxaVR6UQ?oc=5
2026-02-23	Google	-0.156	$ETN stock is down 3% today. Here's what we see in our data. - Quiver Quantitative		https://news.google.com/rss/articles/CBMinwFBVV95cUxNbGgwejJldGxmQkJWb2VKd2ZtQkdrU1pHcDJhdTdka1B3c3E4ZFFOVzdtaFlsQ1RRaG9xeGtDMFQ1cXBteXJOZWFTcERRWnFmck9uSHgyODkxSjE3VW5XMlQwTFBqTmh1bVJLUUUwekxFaE9OeGk3WUp6UjdQUTdCUUp1RVZ4cTVoMmRMakVkYVFaaWRYNVE1QWhPUlp3Nlk?oc=5
2026-02-20	Google	0.5	Analysts’ Top Industrial Goods Picks: Eaton (ETN), UL Solutions Inc. Class A (ULS) - The Globe and Mail		https://news.google.com/rss/articles/CBMi7gFBVV95cUxPdTVXSk5QNnNoaWJsbkJEZmVuTDd1YkNuMGZ0bkZWQ1J3MTdaNDFKSVJKQjFpalZjZEtGekpTajZoUGFOUTBKaVJBX1dNSFI0LUg5ZGNBM2loaDBDVHB1MENqQ3dFOEZYeHh3dnNXUUdFbmxBOXJMWkxtTHpZT0J6RU9EVkxGa3pueFREZkpWTlprbUdYSEdXeGt4eTduTS1Qd0wtZjhMa0pkZzJWdkxISU5oQTVJOXRCcDg4c0JDa0ZQazUyb2E3eE1kX014NGxEVmJwWEpsQy01akZ5TS0wdlFUd2JBWlZxcmxTUm53?oc=5
2026-02-19	Google	0.0	Analysts Offer Insights on Industrial Goods Companies: Eaton (ETN), Cintas (CTAS) and JB Hunt (JBHT) - The Globe and Mail		https://news.google.com/rss/articles/CBMihgJBVV95cUxQSndEcWpJNTJ5dm0zeVNBMGJkdllNb2hIT2pEUlJqWnQ1NGJ0dEpLWFh2MlhMX2lHaUVWUGpzb3BJcFR6Mm5idVk1dnBWSHhYOVJva19rWkNKQ0w5WGlYdXhZS1ZVMnN3bHZNbGdYMUkzZm15bnRkS0EwN3NUNUs1QTBwTWRkdWdSRXRmVUlpLTg1NmVYZEFjNDVVTGsyQWpaeUFzeW1mSTBjSFNGQW5nMUlfakx6TXVkSGNvWWdxeHpsM1JabjhLMldKT0gwc05vOXlaX2tRRlZHdzlqQmp4U0pfVmdxbzJzZk9zdGFGTGZ6ejVPTmNOeVZtcWt2VnNCSU04cVFB?oc=5
2026-02-18	Google	-0.7	ETRACS Crude Oil Shares Covered Call ETN (NASDAQ:USOI) Plans Monthly Dividend of $0.92 - MarketBeat		https://news.google.com/rss/articles/CBMi0AFBVV95cUxQY2x5SFl0eml2dVh6WHF3UHc3MlMzaHRsTkZhM0ptYjRHaFY2bVdheUktYU5CMlBZQkEtRFpRNWk4YkhITTJYOGhlRmVEdlVXNU80S2tLUEtyNmdNcVExRlpkbHY5VGg3T1gwS3ZHX2I2eEJQR0tIU0R1OWw2S0wzOXdtdmNnWlNROUZSdEZGRzB1WlctNG93R2h1a3ltRV9nX3ViajB6Tm5IYXNhRmlxZ1IxS25LNktuT1RTa0N1NXhIaG5Ud1FmcmJIZWJyTENZ?oc=5
2026-02-15	Google	0.0	Eaton (ETN) is Still Buyable, Says Jim Cramer - Yahoo Finance		https://news.google.com/rss/articles/CBMif0FVX3lxTE5SSFlaUWw5X3BVV3d5TEN5SUluMEdqWkNxaWFBci1HaXZJR3ZUVDdaTThieHFtY3JVVGNHMG4tV1RMeGZnYUZzOTBwQnFTY2phX3JpeFd4djYzZ01mOHBkMDh6T2pzSjVwNk5XTGN0VzBjVzM2cTF6WlNIN2o3eUU?oc=5
2026-02-15	Google	-0.05	Eaton (ETN) is Still Buyable, Says Jim Cramer - Insider Monkey		https://news.google.com/rss/articles/CBMijwFBVV95cUxPaHczNjF3dUprdU1GNm5DTUowZDJwdk9lN0VONVdIcm9vU0lvWDl0V2stUmxacVRzSXg1RjhYSHo2NE9rZ2lwWjhVTHhFNXA3QktNUk9sS1FnYUFSNlNVanRHVmpnQ0VZNlE2OFlmNGZMZHd3VEx1U2JRdEtSYW1uZ1QtZG5VZjJlUTAtb1NaNNIBlwFBVV95cUxNR2JJNFdxc1h6R0pFUzJDQnpOZnFCVWdFSTRaeWNlRWdVYmxQN0VXUkdpcFFhRDJJNWJ3dnl5N05xZ015WFZ4cW54RHBkU1pBdnVmeURUZ3UtSkhDbWJVN0NId0lkcU9HUVQ0WklHcFd2TFFVYlBYMkRLRmFHSU11aHR0Q0xvS0dkVDdueG05MFB4cFJROUpr?oc=5
2026-02-15	Yahoo	-0.088	Eaton (ETN) is Still Buyable, Says Jim Cramer	We recently published 13 Stocks Jim Cramer Talked About. Eaton Corporation (NYSE:ETN) is one of the stocks that Jim Cramer talked about. Eaton Corporation (NYSE:ETN) is a power management products provider. The shares are up by 25.9% over the past year and by 18.9% year-to-date. RBC Capital commented on the firm in early February. It […]	https://finance.yahoo.com/news/eaton-etn-still-buyable-says-151220888.html?.tsrc=rss
2026-02-11	Google	0.148	Eaton (NYSE:ETN) Reaches New 52-Week High - Here's What Happened - MarketBeat		https://news.google.com/rss/articles/CBMisgFBVV95cUxQU1UxbkdoYVljUDhiYk85OVlpSHJxdGo1NjB2SDVwOTVZdmJES2c0b3owX1FFU09BblVjbXJqY01EajFzX1VEbHQxMkUxZ1Y1WERxVTBlN2FVQWNQb2tnMUVIS1YxSXNNdUZUSEpCZWZSNmd5RWlJbmVyY3lSMkxCNE5URG5BR2RZSGxrUlBSMnNzcFBWeE9laVNlc2VrNHZ2dEd2ekp5bWhnMndORVR5NXVB?oc=5
2026-02-11	Google	0.0	Eaton Corp PLC (ETN) Stock Price Up 4.58% on Feb 11 - GuruFocus		https://news.google.com/rss/articles/CBMinwFBVV95cUxNeEZlM1dIbUhrNHZqTS1uTFdVZURldXVxU0NxeS0zT2NSYnhkakFCZk9sLUR3bndTTnlOdVE4UkZ4Wlh5MHpiV0JHcU5aUDcwY3NSRFdQeEE0NmZTcGRFT2ZZajU3ZnBsdWFzZlZZeFR5c0t0YUFQbnF1b0hrdXJyZkozZExnaW1VNjMzWDIxWHd4TXRaZmtiQmtLYXQ5ZVE?oc=5
2026-02-11	Google	0.0	Eaton Corporation, PLC (ETN) Is a Trending Stock: Facts to Know Before Betting on It - Yahoo Finance		https://news.google.com/rss/articles/CBMihwFBVV95cUxNcFJQNVVXMGdkcVBxcmx1dnJLZ0tXUjNmSk94andPNmlBODdrdWZITXcxZTVfUmFPSnE1aEkxYTNnS0dCSDFFN3Nibi1yMVgtQXp0Q1dCV24xWjJYc3RiZmtUcFJiQVFmcWR1bjNIM3FLMmlHODlMMmNDX2NsSUdCamU1Wk96amM?oc=5
