Date	Source	Sentiment	Headline	Summary	URL
2026-02-25	Google	0.0	NEM vs. AEM: Which Gold Mining Giant Should You Invest in Now? - Zacks Investment Research		https://news.google.com/rss/articles/CBMiogFBVV95cUxQV2dkbEM4OWt6djlZNXZkT3ZyVEVvR2x2aFJoQ1E3YmRaWWZXbXF3TWRGcFhjdlFhd2FKUjNqYmtwbEJvNDFjRUE3Zmd4TTVieExCTnRaaDZ3Tm55QUxIcWN5QWEtZnhENEpmdGc5b2ZPeXhrcF9kaVZJR1Rzck1JOE5QdWg4MEJFc2RnNlNJR19jYXpFUHloblpWbm8zUmpwb0E?oc=5
2026-02-25	Google	0.0	Newmont (NEM) MD, Americas reports 4,426-share award and tax withholding - Stock Titan		https://news.google.com/rss/articles/CBMirAFBVV95cUxQbV9HZHdlUFVtZHF6d3dKd3ZYV3IyVkxxcU01czRkY1hDa2dNYTNOV1NlWWdyTVV6LXhJSUhSbDd5RWVqeG9NQzBTcFVMU0c1bUh0MnVac0VlNm1ZRVlxV2lHRkxOazBvRmFvZEUtZFVHdFhja244dkZFd2hhclVCRXJVR2VaU3RkRVZaWjJ6QmE0bnhkRlByQXBJdnZnc0hfNV8tMjBNZjlMRHkz?oc=5
2026-02-25	Google	0.0	Newmont (NEM) to Invest $800M in Cerro Negro Mine Expansion - GuruFocus		https://news.google.com/rss/articles/CBMimwFBVV95cUxPb0E1YzhILUtCbWw2ekdSVDNMcFlNOGN6QnBWRlI2VTF2dzRxYlBBeXpSNlA5Y1VEUllGVThiZWhOMTdLWUN5azhCRUpQSlB1QkpTOEF1dmJ4UGk2bkdZZWhRVWkzQTcyVzdCNDA0Ukd0UGMzdURUcEJIbVVSU1N2Si03REtGMk5aclo0MkhsRlZLTzQ0X3J3UUpIaw?oc=5
2026-02-25	Google	0.0	Newmont (NYSE: NEM) MD Rodgers receives 4,426-share stock award - Stock Titan		https://news.google.com/rss/articles/CBMirAFBVV95cUxQT1RxdFBGanR1Zlk0WlJoRHpJNnlxdVB3YkVZVDk3b0ExVXdETXVPaW0zZWFkelBON203ekREdmpUSnMzYnRBN0F3MzJhQWY5ZXFYTm1lYV9Td04zcmV4dTJQNmpnM0RiLWQzVTluNVlzZWlDa1BQdnNncFBTLXVrNWF6RGZRTzJ1UDBPNWxYNUlFNjdJb0ltaUZaZGZsMUt0dkJ3VzBvQ3hxZlpl?oc=5
2026-02-24	Google	0.3	Newmont: Not The Cheapest Gold Miner, But Still Worth Owning (Rating Downgrade) - Seeking Alpha		https://news.google.com/rss/articles/CBMiowFBVV95cUxPeWhrQ3c1REF0MEF0VFdsNzU4N1BWZE1vbzMyVTZ3a21VTXBKWS1pWTg1LWJBejBHNVFfVzQzaEg0RVBQeXlmYUQ3WDFJcVJaVE5LTDJpZzlrM2p2YUV3Z1lFZFVkMlpBc3Ftb0llMFVlYUJuMjN6ZUxhN2RtNE1va29NbjBGODhsWncxS0xxbkN5ekoxRTJMTlNUQkhLY2wtQWVB?oc=5
2026-02-24	Yahoo	0.138	A Look At Newmont (NEM) Valuation After Strong Multi‑Year Shareholder Returns	Newmont (NEM) has drawn investor attention after recent share price moves, with the stock up about 44% over the past 3 months and roughly 23% year to date from its last close of $124.25. See our latest analysis for Newmont. While the 1-day share price return of 1.74% and 90-day share price return of 44.02% show strong recent momentum from the latest close at $124.25, the 1-year total shareholder return of 186.91% and 3-year total shareholder return of 210.91% suggest investors have already...	https://finance.yahoo.com/news/look-newmont-nem-valuation-strong-001953066.html?.tsrc=rss
2026-02-24	Google	0.125	Newmont: Gold Is Too Hot To Handle - Mixed Return Prospects (NYSE:NEM) - Seeking Alpha		https://news.google.com/rss/articles/CBMiuAFBVV95cUxQMXhFc0dyc3BnQUk1V01JX1U3cWRvR1JOdGpBaWE5UDl2aHA3b2VNYnlnQ3VrWmhLR3N2aGJHVVd3RFJSQzFNdGstdnNuS0M2bU1sS0FOUWo0WmIydHdlSXp4MkF0OGtPNkhzaVljVGpYREFGeE5mUkxObUtGb2VGUjBnT0ROZmNtd1hSOTZpT0k5dTNXMkRjMkw3QnFzOFlZcFktbFdHd3BKaFRkc2hZRVFpM3Fzckt0?oc=5
2026-02-24	Yahoo	0.114	BMO Capital Lowers Target for Newmont Corporation (NEM) But Maintains Outperform Rating	Newmont Corporation (NYSE:NEM) is among the 15 Undervalued Momentum Stocks That Are Taking Off. Following the company’s Q4 results on February 19, BMO Capital Markets reduced its price target on Newmont Corporation (NYSE:NEM) from $145 to $140 but maintained its positive outlook with an Outperform rating. However, the analysts highlighted some concerns over the outlook, […]	https://finance.yahoo.com/news/bmo-capital-lowers-target-newmont-062310052.html?.tsrc=rss
2026-02-24	Yahoo	0.1	Metallic Minerals Announces Participation in Red Cloud's Pre-PDAC Mining Showcase	"Vancouver, British Columbia--(Newsfile Corp. - February 24, 2026) - Metallic Minerals Corp. (TSXV: MMG) (OTCQB: MMNGF) (FSE: 9MM1) (""Metallic"" or the ""Company"") is pleased to announce that the Company will be presenting at Red Cloud's Pre-PDAC Mining Showcase, being held February 26–27, 2026 at The Omni King Edward Hotel in Toronto. Metallic's Chairman and CEO, Greg Johnson, will present on Friday, February 27, 2026 at 2:40 p.m. ET in the Kensington Room, providing an update on the Company's..."	https://finance.yahoo.com/news/metallic-minerals-announces-participation-red-120000651.html?.tsrc=rss
2026-02-24	Google	0.0	Newmont (NEM) Announces $800 Million Investment in Argentina's C - GuruFocus		https://news.google.com/rss/articles/CBMitAFBVV95cUxNT2p3MjdDcVZaWDE0V3hNeEYtVVl5LWpJUDVsTldoOEVmMW9mNmtLU0pHX1Jkdnp3QVBFOGdlVldjMThBcFUxTDJYa29VYzJlbFpNR3AwWEFNUTVYWXk0Ul9IUFF0WFRhVE1RSExmTkVQZVZsRUJ6OXZ0NmhYa2tEWWJRa2Fuc2hxeWcyOUQ1M2dYck5KMmxIQ0hEV1JtVzVjYjc3VzhCN2RHM1FyUW8wX0p4c2s?oc=5
2026-02-24	Google	-0.071	Assessing Newmont Corporation's Gold Bet - Lower Risk, Limited Asymmetry (NYSE:NEM) - Seeking Alpha		https://news.google.com/rss/articles/CBMirgFBVV95cUxOZVRabGpMTkRlWjlNbzVQTExiVThyNUJZOHFmSHpVVHhKU1VVbTZ6UXRNYXlrVFhjUUhSRlJodENQUElVYmNCdk8tU1ZUQ2hpUkxVYlhwdC1NeVFfbjIweUFlQ0VURndocmlXTnl3X3M5bnB6c1VpRlZrWlFfWmxpMldXRS0ybTRncm5mU2RCT0NXWWRhbmVoUU1WZlVzZUdpMDd3RGVuaW5VYmxqcHc?oc=5
2026-02-23	Google	0.5	Newmont: 3 Reasons I'm Avoiding This Stock (NYSE:NEM) - Seeking Alpha		https://news.google.com/rss/articles/CBMiiwFBVV95cUxNdndCeUJndjJyMjZVc2VQRm1JOWljcGhVNzg1a0JINVB1Y1VBdS1OVjJsdHVQSG5jeEFWejMyYVR3N1ctVjJOcVRUeWliVWZ0RlY4akkwTF80eTdBOUlxdmdkUmZER19sZG1NQUo4cXpYM2pMUmhpVjZRTDBHaHYwXzZRbG83YlM3cXQ0?oc=5
2026-02-23	Yahoo	0.317	Gold Price Rises. Why Trump Tariff Fears Could Drive It Even Higher.	The price of gold was rising to start the week as heightened uncertainty about U.S. trade policy boosted the appeal of havens.  Continuous gold futures  rose by 1.8% to $5,165 per ounce in early trading Monday.  Silver futures  meanwhile, rallied 5.1%.	https://finance.yahoo.com/m/6cdf470e-d156-37e9-9194-4f193ebb68db/gold-price-rises.-why-trump.html?.tsrc=rss
2026-02-23	Yahoo	0.268	Newmont Q4 Earnings Call Highlights	Newmont (NYSE:NEM) used its fourth-quarter 2025 results call to outline leadership priorities under new CEO Natascha Viljoen, review what the company described as record earnings and free cash flow for 2025, and provide 2026 guidance alongside an enhanced capital allocation framework centered on a g	https://www.marketbeat.com/instant-alerts/newmont-q4-earnings-call-highlights-2026-02-23/?utm_source=yahoofinance&utm_medium=yahoofinance&.tsrc=rss
2026-02-23	Google	0.25	How Investors Are Reacting To Newmont (NEM) Record Earnings, Higher Dividend And Lower 2026 Output Guidance - simplywall.st		https://news.google.com/rss/articles/CBMiwgFBVV95cUxPVUJMVmU1bEZGNVFNWkYyeF9zRG1hOWdHV0xmRjVpZU1vM1BNY0xvZXRNQ1o1NlF1V0l1ckVmRzN6Q0JQVURtaV9ZYkYwYjhGbldaMkMxb0VvaEY1azZ6RzZwRy1iNFpGMjh5blJKVUdWRm11Zzluejk4VU9Pb2Z3T0Y2NjNEYkMtcFBlTW1HXzhhS0tJUzJBTldmOTBfVDlFNXZRc18zd3JaVXNtN0pNekxsTmJPS2NuVWJRZHFQRDNqZ9IBxwFBVV95cUxNZWtSQ0twaDc5WjNxQVgxSVhucFJaOU5qeXhhYjFQS0RxZTQzVVNaOFpDcGQwQVhkVUF3R3RzaFYyX05NTEgxOGViYVdneUptazlQTWpqWlVMbnJBUlBaMWNINFRKQXA0OWJMdVF0aGNsdjh3cnlzcEg1UUNoOFZWem9zOXkwZzVIRUxwaWJpRlNRUFFSQWtJUDJEVVN3RHJMdV93aHl6alJ3bEM2TFhyTUJxdVNmYmFKQlB4Tm9tSFdBay15TnBr?oc=5
2026-02-23	Yahoo	0.193	Trump's Tariffs Lift Gold Prices. These Mining Stocks Are Basing.	New tariffs announced over the weekend sent investors flocking to gold and pushed these mining stocks higher.	https://finance.yahoo.com/m/b3b33c57-2949-34a7-8e5c-d513197a7500/trump%27s-tariffs-lift-gold.html?.tsrc=rss
2026-02-23	Google	0.08	Gold Climbs Above 3-Week High As Tariff Turmoil Sparks Safe-Haven Rush – NEM, B Stocks Gain Pre-Market - Stocktwits		https://news.google.com/rss/articles/CBMirAFBVV95cUxNWmJlWUZiWVE1a1c4cFhyWGFOQTU4cE5OYlphZm1Lc0NuUnprMi0zNWVRUC1xdEUzRy04X2pITUhOUXFPcHNuTnM4alZDLXo4allyRmhrNkNmZDB2ZXVqdVp4c0RmTXN5c3BncmxsVzdGbEJmbTVMUGQtdHo4WlZJbE5kS2VPa1BCOWl1dHpYV3dVZEJKNmJsa2JCempfUW1RZEg4RzBDaTBhcHlJ?oc=5
2026-02-23	Google	0.05	Newmont: It’s Not Too Late To Buy Cheap (NYSE:NEM) - Seeking Alpha		https://news.google.com/rss/articles/CBMihAFBVV95cUxPSWFEQUVjcl90ZmxFcXZZYXZlZDVXdG5FWHNWTHl4Ymo5MlhQWjl1djdONnd3NkJGSFV5M3ZKZ0R0Z3BKVXZleVdPMkV0ZzRxNzJjOVFpWG9BQUt5WTYtMmhWeE0zZldoaVY1d2pneGN3VG1OX0pCVjhtNjZ0Uk12cWhlN1U?oc=5
2026-02-23	Google	0.0	Lansforsakringar Fondforvaltning AB publ Purchases 10,821 Shares of Newmont Corporation $NEM - MarketBeat		https://news.google.com/rss/articles/CBMi5gFBVV95cUxNOU4xQV91WDRPLTRSclp4NjM1b2ZvRWNNMk1ESzg1VGUzVUpwaFhMSEZRbDNKTThlRmpwQnZIQ09EN0ZPWXNSMHlVVGdCTW1FR1Bpcm9oQVNHaWVNX19Tanh5ZTdjaTc0dVM1eHpsdmxUNm9SeHl3RVlDVWU5MURBSXpfcXp5Z2J1aXFjWUViWWVFZG8wTHIydy16NmRab1BHSC1VNEVTZmJLcWgwejNkR3VxTUJzcWRfZERXYXl1MG9GZElMbGJ3TV9jaHRtTGJ1N1hZdk9ZSWZGUjdVaWtwMmNEeDNMZw?oc=5
2026-02-23	Google	0.0	Newmont Corporation (NEM) is Attracting Investor Attention: Here is What You Should Know - Yahoo Finance		https://news.google.com/rss/articles/CBMikwFBVV95cUxPM1JiQXQ0YXVoYWUxaEpyZkJ5ZWVpZjBtU21nbE15SVY3aDBGS2Y0aXFGb0hBSE9odWdna1ZRM1Y4N2RQTXVGWDcxWjQzVFRYUEl5WDdpWGFDYjlBRGdRVXpld1V3Z3lTTTNXeVV1UThWcjNCQmtST21yR2hZQ1lBSEFDV2JkTFdkSVJmNDB3SHptMGs?oc=5
2026-02-22	Google	0.0	Advisors Preferred LLC Invests $4.38 Million in Newmont Corporation $NEM - MarketBeat		https://news.google.com/rss/articles/CBMiygFBVV95cUxNMjZUdzdaQUVOUE1RMXlWV04tajk4ckFRZ1pnWkQ1dDlUY1UwZldKVE5GYXpuc3VPMUU3LWdrSEk0VGgzdEJGMEtzV2JmQnd2aE5VQlRPSmN5RXphZWtjMVBtS3VDMVYxa285eDhhUXptU0VBZllNZFZLRHYxS201QjF3WFBzUllMdkZXOHdod2dJU0x1Z3VoNHZsVWZkXzJwc0FWQmZTQ25hbTdsZjhpWHlKY3ZuaHk5NWgtcUlCcUg0UGJTa1pyYldR?oc=5
2026-02-22	Google	0.0	Tredje AP fonden Takes Position in Newmont Corporation $NEM - MarketBeat		https://news.google.com/rss/articles/CBMiuwFBVV95cUxOX1RTVkRIZ1NXeElHRi0za3loNHpBLThvYVF2ZTQ2MEROR3VGNU4yMldZSy05dnpwXzVFZVJpQW5OaDVCa3JtUDBSX1hKM2F5ZzA5WjRYMUdLZFFKNm9TLVJuNW8xZzMxVTU3cnExM25OXzYxQkwwLTdRRjZoZnkwZkxoTHh0VjVjbE9HOW53dXVPWU1hejJLMmJTVDBONURmdk5lWGEtNlVuQVY1dktDUXdHN3AwZEdtUzRN?oc=5
2026-02-21	Google	0.0	AMG National Trust Bank Trims Stock Holdings in Newmont Corporation $NEM - MarketBeat		https://news.google.com/rss/articles/CBMizAFBVV95cUxOeGNjMDBJc3c5RnlscG9RamlzeS1OYjIzcFBmU244ZkdhNklBZTRHNnVCa2ZiYkJ3U3NjRWstRHNmWlBocUxGUzY3aFl3ZW1aSWxuSG1HaGtKN3diWXZNM3o1aUJ4cElwbkxGUDVhNjFaX1I0dmhETEhEMzR0d3BIQzZWQjlMNFRQOEpOaF8wckpJeTdYMG93WVlxdENGcXREbHc5VmtKaEhCVVJ0OFBzRUpDS29GdU51RF96dW8wdzEtVElpUnk3QTd4TXM?oc=5
2026-02-21	Google	0.0	ANTIPODES PARTNERS Ltd Has $39.24 Million Stock Position in Newmont Corporation $NEM - MarketBeat		https://news.google.com/rss/articles/CBMi2gFBVV95cUxPckx6bnBTTTdRbGJGSGF0TktzcUhnTDdqV0FMRktJbkEyQ1FVcFlIR3czMUlIV1ZXU3FOUWRMWjRuamNEYktRRENBRXg1bFdyTU0zb1NaV3VCMjBGUHVteWxtMkMzYWVyZTVXcHZEcUVjZWNXWm8zSUF0dzFicnRFWHpHcFlSYU42RUVlSkdCejBObzBPWk45WGNQbzg3YVFuTVB3aWUxUUM2dUgwN25LdndCMWNGb0NNYUloQVF6ODlZU1dsVng0bEtCaWY0aV9TQ2d0aWtnSUYwZw?oc=5
2026-02-21	Google	0.0	Barings LLC Purchases 28,215 Shares of Newmont Corporation $NEM - MarketBeat		https://news.google.com/rss/articles/CBMivwFBVV95cUxNZkdqcDhGWjc1dmNQZDBaMjJKeUVkLUpnWXljc2YwVi01RG1Xc3hyMGFZNkh2YlRaUHBZX2NYc2pveVFfZHBsQ3dUY2lHYkI2T1p1TWxDTmMwNVJUaFNLQmFfQXlKTWJpNTV4dWFRSzRUZUhJeHlFZTVDUlREbFlwVkFJLVJoX2JZeVN3VDBZUmd6anRWSnBYU0cwNWxSVGZiQTN4ZkJFVm9fTU92bzJqTUhuQnktSXJDajAzWk16OA?oc=5
2026-02-21	Google	0.0	NEM Stock Quote Price and Forecast - CNN		https://news.google.com/rss/articles/CBMiT0FVX3lxTE9udzNKQXNuZHpTeUJ6ZkZGaFFHM19ReUZwX3l2Y05kYjQ4QXJxUjZGVGhWd0QzOEN2R21rWi1JZ1E3cTNqNkNsM05DTnd6S1E?oc=5
2026-02-21	Google	0.0	Newmont Corporation $NEM Shares Acquired by Sava Infond d.o.o. - MarketBeat		https://news.google.com/rss/articles/CBMiuwFBVV95cUxPNVBFUVdCOE1RWUlzWHJVR1k3dzQwcTZqb183NDRvdGx5R3pPX0haZDRJUDJZV2gwUi1xdG9EMXlqMHJBbkFUY21UYUFlSFIxWUU1TExkTTdTOXhwOE45TENDMFdNZW5lc2hYb3k4ZUhFYXpYaGpZOG9tZHRLd3A5cGJGYW9vcElSR2JNMDFsSmJaMzNXWjBXdFUzaXBVX3FkbmZqRnFZelhzb203S2hJQVZZdWxoVndPb04w?oc=5
2026-02-20	Google	0.433	Here's Why Newmont Corporation (NEM) is a Strong Growth Stock - Yahoo Finance		https://news.google.com/rss/articles/CBMihgFBVV95cUxPZUJsSXRDQXAtWXZOQ3dJRnFUMTE0Q1AtUWlvc2w0OGRpZG92VDdUenRGOWhISzVmSGR0cEdmRVVRUF9ZWjVvN0JCVzdHMU5adkxENGZlS0FNRF9UeW12V2pILWs4bkdFNE9MaEJWS2dnTWtlWlhTX0NGLWZpNmlmN0xMYTFJdw?oc=5
2026-02-20	Google	0.433	Newmont (NEM) Reports Strong Q4 Earnings Amid Gold Price Surge - GuruFocus		https://news.google.com/rss/articles/CBMioAFBVV95cUxOUlFqY1BNQmtnelhPOWRXZURJQy14VENnZ0RSQTlsYlhKWjZ4QnduWF9Fd29sR0xiSnhSa20zVWo2NzlFaEJNMkpNa2RncnZ3WGlYY2JvMEVuaU8zSmRVMThJdmdHUVZlejdVTjdRMUt1eUgta1hEUWtCX1lKMTlvYW9zRTRhVEozWDJjWG01bUZJZHQ0cnhJWDVBbmdiVlVO?oc=5
2026-02-20	Google	0.433	Newmont Corporation (NEM) Reports Strong Q4 2025 Performance - GuruFocus		https://news.google.com/rss/articles/CBMingFBVV95cUxPUnlEYlRCRVdnN2c5aldNeC0xeUJzZG1RMnEzMVFFZzc5UUlqN2otS0g4YlZxUElOcU80SjRYQlhfclYtdkNoNjFHMXoxR2RHWUlYUVBkWUxNcnNUc2ZLcHBFSDVMWFJ4WkFHbVM4RVNJallMOVpQZ0ZZNWU4aGlHV2RpbHA0dEFfTTJjX3UtaHNLMkNOeU41b2I3Y2dLdw?oc=5
2026-02-20	Google	0.4	Newmont Corp (NEM) Q4 2025 Earnings Call Highlights: Record Free - GuruFocus		https://news.google.com/rss/articles/CBMi8gFBVV95cUxPVUtWZW4xVDVYWDJxbjY2d09aclpVbGxkSUdGVUFsRVRRUnYtcE95Y2ZDcXFyXzRxU1A5VjUwYTlFZTZUdVJZUENSNm9MUGJkV0VrOGd1Yl8zZi1rZEZNYXVnek04VjlWYWJOTmFQa0cwUUprS3EzRi1kNjBJRUJkZGYxaDl0MjF2T3Z4ZlNlbW5mblV2U05GMjRrYlJVTGN1VjJYSW1vbTJ1MUo2VlFhQ0tNQWtTQzFjRm1wc2Y1S2JrN1drcFBtZlJqVlk4LXNFTHRSS0g1TW84SGpkNGtxQkEwTVdsc2dTOUtkUE95TUJuZw?oc=5
2026-02-20	Google	0.4	Newmont Crushes Earnings With Record Free Cash Flow but Guidance Stalls the Rally - 24/7 Wall St.		https://news.google.com/rss/articles/CBMiwwFBVV95cUxNNGRPWUE2NEg3Ymg5ZEstQlhzcWwzWGExV0psV2VaWXpSSDlJM29BczR5eWJBQkEyOGdvRHpDZVkzX3d6MDNNa3E0OHc2WDB5YjVkUnFzQ19GVGFlMHJVSjdnSlJzaG8wUzBGdjJuQTlLaEdiUzk1bmJrYkNLTVdjU3pBcGItLWd3SExUcVVveWdMZnltUlJ0RG4tRWpSSVY1cWEwb2RUSjZhR19nV2lTN2VJZWs2V1E2NF8wMnZQcnJyMXM?oc=5
2026-02-20	Yahoo	0.375	NEM's Earnings and Sales Top Estimates in Q4 on Higher Gold Prices	NEM tops Q4 estimates as gold prices jump 59%, lifting revenues 21% and boosting cash despite lower output.	https://finance.yahoo.com/news/nems-earnings-sales-top-estimates-132900513.html?.tsrc=rss
2026-02-20	Google	0.375	NEM's Earnings and Sales Top Estimates in Q4 on Higher Gold Prices - Yahoo Finance		https://news.google.com/rss/articles/CBMihgFBVV95cUxQV3Z6QXB0NkRkUTcyZHZQWnU1TEhsa3VEVGZYUTFoWnlpNWVNdlI3RkdnV3ktZl9IRmNyaHRmRTF4aS1UM3plQmtOODZXMWhRb2x2a1pHWE9mN0xOdE1ySjU5Ql9zdEFKN1pTRENYY1dCU0F2Y2VDV1UyMjJzeVB0OC1vLVM1QQ?oc=5
2026-02-20	Yahoo	0.367	Newmont's gold production outlook, CoreWeave falls on credit woes	Yahoo Finance Host Josh Lipton tracks today's top moving stocks and biggest market stories in this Market Minute, including Newmont (NEM) shares sliding over its weaker-than-expected gold (GC=F) production forecasts and CoreWeave (CRWV) stock sinking on a Business Insider report indicating lenders may be worried about its creditworthiness. Stay up to date on the latest market action, minute-by-minute, with Yahoo Finance's Market Minute.	https://finance.yahoo.com/video/newmonts-gold-production-outlook-coreweave-191000204.html?.tsrc=rss
2026-02-20	Yahoo	0.342	Newmont Slips Despite Strong Q4 Beat	Higher gold prices lift earnings, but softer 2026 output guidance weighs on shares	https://finance.yahoo.com/news/newmont-slips-despite-strong-q4-150035509.html?.tsrc=rss
2026-02-20	Yahoo	0.105	Stocks to Watch Friday: Opendoor, Live Nation, Newmont, Grail	↗️ Opendoor Technologies (OPEN): The home-selling platform's quarterly revenue trumped forecasts. The stock gained 7.5% Friday. ↗️ Live Nation (LYV): The live-entertainment company logged higher sales last quarter, driven by demand for concerts.	https://finance.yahoo.com/m/163bd79d-23fa-3ffd-a762-307fa11382e6/stocks-to-watch-friday%3A.html?.tsrc=rss
2026-02-20	Yahoo	0.1	Newmont Beats Expectations for Fifth Straight Quarter. The Mining Stock Is Falling.	Gold mining company  Newmont  posted its fifth straight earnings and revenue beat for the fourth quarter.  For the fourth quarter ended Dec. 31, Newmont reported adjusted earnings of $2.52 a share, on sales of $6.82 billion.	https://finance.yahoo.com/m/5163592e-ec99-3f76-9a4c-b377339b562f/newmont-beats-expectations.html?.tsrc=rss
2026-02-20	Google	0.0	BMO Capital Markets Has Lowered Expectations for Newmont (NYSE:NEM) Stock Price - MarketBeat		https://news.google.com/rss/articles/CBMiygFBVV95cUxQTlotcmNCNVVaRWxCWUtTX3Vqdm9aWUhZZnNxeG55b05PaTh0eUFHVVEwR2F0U25aZmtEcFBGR0R0MnB0MnNWV3RYalFUYmk3T2xtWDRUMk9lS255QUpxclJyUUZjWV8yT0RHMi1mUFNCazh1UTJwaFRvam1HdEdNYmU1QUR0Zi11SlJhS2s3VHcxZWlTZ1dCMWVNbEo2djVodllOT3VQQmxZYVFHWW5OcV9kWk9Ma0lyMUR5cE9fUGg3UE85SHRlRjN3?oc=5
2026-02-20	Google	0.0	Decoding Newmont Corp (NEM): A Strategic SWOT Insight - GuruFocus		https://news.google.com/rss/articles/CBMikwFBVV95cUxQLTZnU3RsejNrS1hieG9nV2lPdFhNVWdRc2JFMm9UcjVPOG9OdVFMWU1mM3J4SmxSbThzVkxSVUlmcDNORlBndEN5dXBxbXlibGZGUnhYZjhaNHhEOFYtU2NYQkNjLXFGc3A5dGRnV3V4SlFRTVVGMUlxSk1Xd0lCQThLM3NWdUxFQ0pTNVZMX2F3MkU?oc=5
2026-02-20	Google	0.0	Newmont (NEM) Beats Q4 Expectations but Guides Lower for 2026 Pr - GuruFocus		https://news.google.com/rss/articles/CBMirgFBVV95cUxNTEI2cTVrNVVkeWxndDNEaTkzNkJ1NVp2SV85ZkdOZ2pLTkkzODBCN0pyMjVfdnJBSTJuaE9sNURTZHJvNGZmRkI1eEMteDVFSlgwTDZYZjktSy1Ha29HbkFvcGdRLWh6bUNoTDl3YmJWbmZwaldRZ1ZGWHVJMDV6WVpSN1JSYk9jVENzb2pGbXZxdFdFM2Z1NzVfT09DRmVLdGM0dnEzMTVPZmc2blE?oc=5
2026-02-20	Google	0.0	Newmont (NEM) Issues Default Notice to Barrick Over Nevada JV Di - GuruFocus		https://news.google.com/rss/articles/CBMiqgFBVV95cUxNZFp1NjU5ekItUFlPTmtPSGRiZFY2RVJOT3A4dHV6NjlaM2oxMlh1Z1dwTU5ueC1lWG5DaWxSQUgyTkN0cURyc1FqODVKMjhRb1VCLThBaDJVRnVaMWhCbGZhd0dVUWdnWXYtMDlMbkhRRGpMcUkyY0lMSzRUelYzS0IyejRqb29pUjIycWtncFBUdXdZN2hhS184MlYwZ09wZ3E1UVIwTFRKZw?oc=5
2026-02-20	Google	0.0	Newmont (NEM) Reports Q4 Earnings: What Key Metrics Have to Say - Nasdaq		https://news.google.com/rss/articles/CBMikwFBVV95cUxOTDY0bGxfWU9IM0RET3JVM0E3TjItby1LZ2o0WlZORjd3RWxSMlVMaTcxb2RCd01Eem9XU3pyNE0taFVPR001NHJkTWVLVnRWNUlubUhlMTlHY3QydkluZWVySDFpWWJrb1ZRRk5CeDBwU01PNlBnMnVMUnlyMW9kVW9qN2RQQzRkb2s5NGgwZFVwX2s?oc=5
2026-02-20	Google	0.0	Newmont Corporation (NYSE:NEM) Forecast Lower Production - FXDailyReport.Com		https://news.google.com/rss/articles/CBMihwFBVV95cUxPeDNaMlFIbTc5cXoyVkV4VzY3ckltTDd2YzRWc3lDTGRyOE9mNEN3TjhHYjZtaFZWQ0l4RnF5SEtyR1dGMVJHLUVHTTNCaFozaU5kZHpJb0dNUWZXeERJMU5vZ0RjWEFfNkNoQWdBX1R4dl9vYnk1eUhXM2FGb1ZZM0o3eVZBb1k?oc=5
2026-02-20	Google	0.0	Newmont Corporation (NYSE:NEM) Plans Dividend Increase - $0.26 Per Share - MarketBeat		https://news.google.com/rss/articles/CBMiuwFBVV95cUxPbHRLd3c0cXc3N0lwVEx6SFJBbXZISE9fTFBDVERqdlF6Umd1SFVOSjZwbXFMR2VKS20zMmxySmYxSkFUVmo5WFd6Q2FKQnlfcDkxNjZwT0dIRFJkWTBfU0IwMDJYQ2JwSkdwcUI2ZnQ4NEpkeURaRjFtdkZVNmVydm4zWGdaX01rRjRWNkdnVWYydlB4S1A4VnBWd0hnb0Z4OVVXQk9RLUpZeU9Qc2FaWkV0MVhpNk1QR1Fn?oc=5
2026-02-20	Yahoo	0.0	Newmont Corporation Q4 2025 Earnings Call Summary	Moby summary of Newmont Corporation's Q4 2025 earnings call	https://app.moby.co/home/research/tools/earningsCalendar/earnings-newmont-corporation-q4-2025-earnings-call-summary?utm_source=yahoo_finance&utm_medium=rss&.tsrc=rss
2026-02-20	Google	0.0	Newmont Targets Margin Expansion Amid Record Gold Price Surge - Intellectia AI		https://news.google.com/rss/articles/CBMimwFBVV95cUxQenRqQVRhVE9tUmtrOFN0ZWNYWC1lR3phLV9nLVNDY0dfSk5TdTlMNUtLejRMdmJlbWxhclVvUVE0YS1pZG40RFMtWVg3b19fZVJ3YkltR2FrMzdjM09zNEZVQldKWVdfMXlFODNyOUo0cXFybUNoTndTUElCM0RKdC1LRm5ySzMxajl3Umg5U0YzUTZrRmUyMlFacw?oc=5
2026-02-20	Google	0.0	Newmont slides as investors digest 2026 outlook after Q4 earnings beat - Quiver Quantitative		https://news.google.com/rss/articles/CBMipgFBVV95cUxOcUJBc3g3Mk1FUU5ENndoeGhralBmbFlSTTIzRzZEN0hIZjhXd1BDMVJvUlJTQVpGWEdpNUkxSlBrVXlCbmdwSzdCSklSM3JMMjIxWDNIUUJ5QnhMYzZfTkgwZ3JUVWVSQlhNa2Fsci0zQkF5bXRuQ05jNHRRRmJMSEpWQ0VmYjY5Zk5xVGtzclBnV2lUQTNxYWpJaWs2QXhpUi1sRTFn?oc=5
2026-02-20	Google	0.0	Newmont slips despite big Q4 beat as lower production guidance prompts uncertainty (NEM:NYSE) - Seeking Alpha		https://news.google.com/rss/articles/CBMivAFBVV95cUxOc2VrTnFTaEZMaXFaNjVOQTJBTzZPZlhTeW1rSWJvYWVlY0hPRUlNS2JXWExIVDNLS0R6ZXhoU2tOV05mbkRwMjROcFJ5WkZwd2xROGF3bW16OVBjN0REX3dfVmRldng0WlpWX1RXNFZuMS1udEJ6T1Z4dDdialNEYVVDVjJQaG1nTGFlUERGNV9jdzVHNTVtOERwX3BsNFV3MkRBMWZFRWtxLWFqWFQzcVRMZ3dWSHVMUWlnMQ?oc=5
2026-02-20	Google	0.0	What's Going On With Newmont Shares On Friday? - Benzinga		https://news.google.com/rss/articles/CBMipAFBVV95cUxOTHItVGVaOWttN3lPVDNnWVJkY3ROTnFFa1dKMzhzZXViMVVJX0g5UjA2cnhIWEFfWjNtSk1WNHMyN3p4c2QzX1VJdjlUUWxGWlZOaEIzNjl3VTJmSWgtY1hlODJOaVhGN2VIQms3RjJkVzBFb21NbGthWHlVWTRKeG9xck1YN3BtWk5Sbm9KMjBSSTRzdVNWLS1mMWF1YWxKRlR4TA?oc=5
2026-02-20	Yahoo	0.0	Why Newmont Stock Dropped on Friday	The gold stock is falling, but it has nothing to do with the price of gold.	https://www.fool.com/investing/2026/02/20/why-newmont-stock-dropped-on-friday/?.tsrc=rss
2026-02-20	Google	0.0	Why Newmont Stock Dropped on Friday - The Globe and Mail		https://news.google.com/rss/articles/CBMiugFBVV95cUxNM0Rlb01BOV92dW9UZmt0WW1uaUJyUFFfeXQ0T2pGTXFxb1VwY3hEeEpjTTRGSlFmTEh3NEhXX2FzQ2R4Z01nOUYzSVdkc2tZTUVZSEJJX0tGUzhfbEJndHVsWXNLUkU0VWUxTVByemh4bVFhVnV6SmFEX1d6cXJ3YkNzU2lsSnRPajl4T0J4Y3Q5azUwUnI5aWJndk05NmxlUDEwWFpmbzIyR01fdDdRdGZDRWs3MFAxZlE?oc=5
2026-02-20	Google	0.0	XLB, NEM, SHW, CRH: ETF Inflow Alert - Nasdaq		https://news.google.com/rss/articles/CBMickFVX3lxTE5pRWc4TnQ2ZVA2T1RBSm9VUWFKdnY2Mk9qenFqV1AteEhJdk9wR2ladW1oWU0tRVNfTHl3OFd4dkppR3pWbmFBM2NuVFZ5SHdQamZEWjFiR01VUWRBOWlPcE1xdkNwdjBrTzJvamFTM1ZtUQ?oc=5
2026-02-20	Yahoo	-0.004	Dow Jones Futures Fall Before Big Economic Data, Possible Trump Tariff Ruling; AI Leader Climbs, Cancer-Test Firm Crashes	The stock market fell back on U.S.-Iran fears and other big headwinds. GE Aero led new buys, but there's no clear trend. Comfort Systems and Grail were big earnings movers.	https://finance.yahoo.com/m/47756834-4e30-3cbe-b375-51e97242a8bc/dow-jones-futures-fall-before.html?.tsrc=rss
2026-02-20	Google	-0.05	Newmont Corporation (NYSE:NEM) Q4 2025 Earnings Call Transcript - Insider Monkey		https://news.google.com/rss/articles/CBMipwFBVV95cUxNYTM3Nm5EMnhRMU92VklhQkZpVTNpalFIQWQtblVfNS10OHdtQy1OeXFwSVVrWGZqbU9XSEl1UzZBOWF0RnBBbHJhbFg5dFRSQ1pyQmMyZjJTOVVYM3VyRGN6RnRSTkZiNWNRT25XdGdFYkx4Tkl5Yl8yRFR2dkZiTkJxTFFBSXJ4Y1p1VEttQzJZVUsxY1V2WFdmQmRkaUEzSVZGWHVBTQ?oc=5
2026-02-20	Yahoo	-0.1	Newmont Sends Notice of Default to Barrick Over Nevada Joint Venture	SEC filing cites alleged resource diversion at Nevada Gold Mines, triggering 30-day remedy window under 2019 agreement.	https://finance.yahoo.com/news/newmont-sends-notice-default-barrick-150143208.html?.tsrc=rss
2026-02-20	Google	-0.104	Newmont Corp (NEM) Shares Gap Down to $120.71 on Feb 20 - GuruFocus		https://news.google.com/rss/articles/CBMilAFBVV95cUxQdFBUZW9QOTJ4NVVBUGRNaU1LV0VoUG9vaTh2ZjZvY05Cajhsa3cyQXhRa0UxVEJVZThrNTVzcVIxTDBEenAyVXNScnFkVGxQVG81Nmp2b0lYem1VZVNjVnM0Q1BoNjhoX1FoTjA2VjVvS3gzLXI3b2hwVU5OVFpaeG5Hb253VW51WnlvcWUzbkEtN3Ew?oc=5
2026-02-20	Google	-0.156	Newmont (NYSE:NEM) Trading Down 2.6% on Analyst Downgrade - MarketBeat		https://news.google.com/rss/articles/CBMiqgFBVV95cUxQVTZYU29WUDNhWXdDRWVSdThwNHliX1dRVmxNcUc5cjlWOWhsNGFUTzVRSmMtU0hsMDNtS05ZSWtTV3hXOHhMaEZoTldNVGpxM0RGVnZOb3ZuSW9LLW1OeE13Z0JOd05fdTlEYVZGM3dfejQxcVE2TDlGT04xSUQzOHlWOWx1YUpGTVA4b0RQeGdhaUtSWjhWY0pkWmItUXVoUHcta2V4U3Vvdw?oc=5
2026-02-19	Google	0.5	Interesting NEM Put And Call Options For May 15th - Nasdaq		https://news.google.com/rss/articles/CBMigwFBVV95cUxPLVA0SlFQdWlWZkdSN2xPWGdVM0FHNU1tN09iWGNhalpkUFdvYnpIUjVkSldXM0EtNUt6b3pPcUx6MzJYci01REduRlIyUFVhT25RdktjaUdMSUtvdk9vT1B2X1N0VmJFbkpjd1d4RjhIQm1pbzRFdlBfMmFpUlFZQ3dqdw?oc=5
2026-02-19	Google	0.289	Newmont (NEM) Reports Strong Q4 Results, Boosts Dividend - GuruFocus		https://news.google.com/rss/articles/CBMilwFBVV95cUxNbHdqdll2cHpjTTd5aHRWY3RfOTc3UUFkdzZUYmY4bTZBbmdQX1NxYmdkWHZJTnBCUi1uR3QtMjNIVUkwYUxtWWo0U3V2aEF6ai1GaV9HNmlaYzBKR1lFLW5tTEdUY3VJRWFEbXJ2bGtmdHRZTnhPNkp0RThTLUUteXR3M3V6N3FGcGJBLXhuYW9Ka05ZTzdN?oc=5
2026-02-19	Yahoo	0.28	Newmont beats Q4 estimates, highlights record free cash flow; Shares rise 1%	Investing.com -- Newmont (NYSE: NEM) reported fourth-quarter results that topped Wall Street expectations and outlined its 2026 outlook, as the gold miner pointed to record free cash flow and a strengthened balance sheet. Shares rose about 1% following the announcement. For the fourth quarter, Newmont posted adjusted earnings per share of $2.52, beating the consensus estimate of $1.97 by $0.55. Revenue came in at $6.82 billion, ahead of analyst expectations of $6.19 billion. Fourth-quarter adjus	https://finance.yahoo.com/news/newmont-beats-q4-estimates-highlights-223031302.html?.tsrc=rss
2026-02-19	Google	0.217	Newmont (NEM) Achieves Record Cash Flow and Strong Financial Pos - GuruFocus		https://news.google.com/rss/articles/CBMitAFBVV95cUxNa2NjSThuRU1uUUxjZURnT3Y4OGtXSklqOWFxdVNWLVlielFZTkZmQmlnb2xrVzk2V21PUWY1U1BwbGJHM1NIN2xzNXNsVVVMZnpTeEVOaWNUbVRkclBodW94dHBucl83eXd5d1JsTy1BTlNzbEVWaHoxM0pycUFXNTlOZmtXeWJ1ckhwVmRVVXFqRzhIcHNZUHp2YlQxMjNxTHdwU2dIdlpLZkNYdWZza0pJa3E?oc=5
2026-02-19	Yahoo	0.139	Newmont Reports 2025 Mineral Reserves of 118.2 Million Gold Ounces and 12.5 Million Tonnes of Copper	"DENVER, February 19, 2026--Newmont Corporation (NYSE: NEM, ASX: NGT, PNGX: NEM) (Newmont or the Company) reported gold Mineral Reserves (""reserves"") of 118.2 million attributable ounces at the end of 2025 compared to 134.1 million attributable ounces at the end of 2024, mainly driven by the divestment of assets in 2025. Newmont's portfolio includes significant reserves from other metals, including 12.5 million attributable tonnes of copper reserves and 442 million attributable ounces of silver r"	https://finance.yahoo.com/news/newmont-reports-2025-mineral-reserves-210800117.html?.tsrc=rss
