Date	Source	Sentiment	Headline	Summary	URL
2026-02-19	Yahoo	0.02	Newmont CEO Shift Tests Capital Choices After Earnings Beats And Deleveraging	Newmont Corporation (NYSE:NEM) announced that President and COO Natascha Viljoen will become CEO following the retirement of current CEO Tom Palmer. The leadership transition follows the company's fifth consecutive earnings beat. Newmont reports a balance sheet with zero net debt as it prepares for the CEO handover. Newmont, the world's largest gold producer, sits at the center of a sector that often draws attention when investors focus on real assets and portfolio diversification. The...	https://finance.yahoo.com/news/newmont-ceo-shift-tests-capital-160905346.html?.tsrc=rss
2026-02-19	Google	0.0	Inside Newmont’s 118M-ounce gold stash and 12.5M tonnes of copper - Stock Titan		https://news.google.com/rss/articles/CBMivAFBVV95cUxOdk5NTTNFQ3ExYzhOdUUtWGdfYUJMb0VIZkhOaUMzRHcxUWJHX3lHaFBFS0VrNkhTcmRld24tUHhvcEkwcXZ1cGRYOVBFMTN5WHR3bHJnSDR6bGwwWE43SEVpUDVXSmdLU0VXTnNITnlHcTVzWk1sa29NXy00MS10VG1WUGJkZHNjY01BTTJVbFMxR3dEUW1PZHAxZDlsMUtYSWFvZ0NqMWFVNVg5Q2thUm8yQkhhcUJPMmFlQw?oc=5
2026-02-19	Google	0.0	NEWMONT GOLD ($NEM) Releases Q4 2025 Earnings, Stock Rises - Quiver Quantitative		https://news.google.com/rss/articles/CBMioAFBVV95cUxQcDlsREp6YlhvdkNFNzBVY2JNMF9GVTAzLWdTekNxSl8teVp6b09OdlJFY2VWLW5Ddnh6X3dOOEl3Q05MSXZKQWYzY2N4X2JnVVBiVzdxQ3pQUl9PeFBrU05vTTdPUExvOWh2eHFBaWZsckJobUFVcUttbFdCbkJEY3N2cnVUc01YZ2tDU1dCNUxuSFNOQktLZlFRb0tLdXoz?oc=5
2026-02-19	Google	0.0	Newmont (NEM) Pre-Earnings Options Activity Indicates Market Ant - GuruFocus		https://news.google.com/rss/articles/CBMirwFBVV95cUxPSHBLVTdadHdvNVc1V2lHMnVtSWJTODZ0aDE2c1MwSEZZak1WdjVXek5kT29DT3pTTF9kaXZBT1Y2S2Nnd2o2VEhvUTlJek9PeGdybUk1TGkzRkt2SlBWS3EwaXhlQld3Y2RfanNwRGhjYV9OVUVibXJnVXBJRHh5dUdvWEpGR09Xb01ENmhQYW9LamFsQWk4OFJkOC04VU51T1dhSFd3WjhmZGVPQmZB?oc=5
2026-02-19	Google	0.0	Newmont (NEM) Projects FY26 Gold Production at 5.3 Million Ounces - GuruFocus		https://news.google.com/rss/articles/CBMiowFBVV95cUxNaDhpZkdMSkx3MlZ5V1pDNnNkN0NUUi05ak5OTDl2VEdtZFdVMGYyWUVhM3VFaXJkVkswc3hkcjlmZHZVOVpjZnlDS3ZqNkZlaXpHb2RNLW5YSjJSUzdRMW5oZ2dHZHByU0tSVVFGLU5ualU0OFhyb01UWTNHT2VPeC04ZTRMQm5kNWstUUJ6TmxLNkI2YWw3T3ZWdHlCZUJjZ2Zj?oc=5
2026-02-19	Google	0.0	Newmont (NYSE:NEM) Issues Earnings Results - MarketBeat		https://news.google.com/rss/articles/CBMimAFBVV95cUxQRkdVWVVYcWdoWUcxVmZmdnNUb2czeDZpMTFnaUVITU8zU1hDT040eEZINjV3Qm9sak05c0ZDY0ZQS1NSYy1WV2NMYjZkd0xNcWY2MXZaWm96TVFxRlBFN0dqaFcyb25hbUk0TWMtMlUyb0V0b25PV1NxSlpDRFhHb1RYWk9JUXhHNHRWdVY4UkxSaW5pbjlkdA?oc=5
2026-02-19	Google	0.0	Newmont Corporation (NEM) Beats Q4 Earnings and Revenue Estimates - Yahoo Finance		https://news.google.com/rss/articles/CBMihAFBVV95cUxOLXc2RlF2NG1CenBLblpwUk5CRElRT3lOd3lsZGxJZjQ5YnlVSGFlRXhBOXR0QzR5YmNsRHN3OGQ1ZXdUazN0ZnlaZTh3dm84T3hwMC1rbzhtT2tRT0g3ZFhxc3RzenFja2ZNX1p3TjRhRF9GM3BITFZTSjRZaUY5WTlWRk0?oc=5
2026-02-19	Google	0.0	Newmont Shares Rise After Q4 Results as Gold Rally Offsets Production Drop - AlphaStreet News		https://news.google.com/rss/articles/CBMipwFBVV95cUxQMXpzZVYwYXZVVEg3TDVIQUI0WVZIYkxSRGlRRERWQmk1MWFxRF9VQlBrOHdSenVwblJoOTZlNm01UEIxNWdJejY0RzRfUVRaQWplUlU5b0V0TVdOempCU0FmRVJZT3JfbWxlYXNGR016NEY1VkFTTHUzUmN4TzZUWGxGMlhBOU9KVXljQVgxUWJXQWVnZDZTN1RhWU5pb2FCS0Y0VERDUdIBrAFBVV95cUxNVmN5ekRXcTNmdUhHQ01EenVFZkpzOGZ1b29pVVRwQnRNeUlGejN0NTBRajQzNWRjdFdYRFVzM1hzRDFZZGgtZk1MOUs1eHZHRFgxa0pXZEczZk5VZExoZHYzUWdxdmprYWN5clF2N0RuUE9OUmF5YU83TDFzMm4xdDlSWEU1RGc5TVhkM1AtWVJBZXdaN2VSWWJGeEkwc2dRQmxIUjcyVFlxMkp6?oc=5
2026-02-19	Google	0.0	PNC Financial Services Group Inc. Raises Holdings in Newmont Corporation $NEM - MarketBeat		https://news.google.com/rss/articles/CBMi0gFBVV95cUxORDVjM1Q0X3Y5ZFY4SVJvT3Z3SEdVVzlzUVVEMWtpLW5NdnNuZVBoWmE1aUFwSjVtSVdOYzBaaWxzRHBabm1fRmIzcWdDM0tKTy1oejdtTWk3bldZRTFQX0ZQelVaYzY2Nmt6R2tZc2VtRnZhTmtrb1RpaXNCeWNXT3g1QTA0WXcwRDM3TDhHT1BYMXpjLVJHMjVHb25UOGNkN3JuM2sxSGNab1dVRkQwak42bG9NWnh2blVBS1dVSzVwd2l1YWQ0eFlRV2F0ZFJpUkE?oc=5
2026-02-19	Google	0.0	The Gold Standard: A Deep Dive into Newmont Corporation (NEM) in 2026 - FinancialContent		https://news.google.com/rss/articles/CBMi0wFBVV95cUxPM3dGRnpFeXpjcGI1b2twcmpTZmZKaVFXX1I2c0F3NU54bDFJLUFxX0ZHcTNaSEt2MS14RGQyaWk2aHk1QldaTHpZWVpvRTZVb1NoYkVBeW1CN2NkYm1mTWxyN3hOUmxZaDhmUXcxTWdycVhZSkpuN2p1UFludmZ2M3ctbFotRnpBYXRWUlFlX2JmcHVCaHRYMjFreS12LXR2WW9JVF94Z3ktLWdmUzFkNmpMeW1wWnNQdlQxNjVJN21CU3lZcXhoMThEeUtaVXlWdTB3?oc=5
2026-02-19	Google	0.0	World's Largest Gold Miner Newmont Reports Q4 Earnings: Details - Newmont (NYSE:NEM) - Benzinga		https://news.google.com/rss/articles/CBMiugFBVV95cUxNWENFT2l5NFZNVS1EcG9lRmFzaThaSkxjekNxWGtkNjQ1NlpUcnNkeG54ZFljMURDV3R6STd3c2tIQTBBSjN3SE1SVGtNQmRTeDAzYVpGbmRDQ2pwVEY0WDhfSUU0dFhrcThzWkszTzI1QmwyamRsX1ctOTkxcEN3MnRkanVfMlNPSWpkbjAwS0lHenF5dk10Z3hBN1JXM0E0QjhYWUFmbHVxNmNNbzVXc2VjOWhqNHFMVUE?oc=5
2026-02-18	Google	0.433	Newmont (NEM) Set for Strong Earnings Boost Amid Bullish Outlook - GuruFocus		https://news.google.com/rss/articles/CBMiowFBVV95cUxQYjZIbHZSdFI1YXFTSU4zanpzbnM0czZUYUxHVFNoaFg3N3QtejRpNHBDeUFzZFgzMElrdjNxUnlEWGttSmgwUFktdEVDOUl5V3Z6czRhY0NPbkUxN1RJQ3dkTXBMMVk4cThLTGRfWFN4RWZCaWEyNWdGNlF6ZVBwckpmNlBKZmlDMGNHTFlIVUVnMDl1U1FGaVZySGkwZi1DRFpj?oc=5
2026-02-18	Google	0.0	Gold Mining Stock Rallying Into This Week's Earnings - Finviz		https://news.google.com/rss/articles/CBMiigFBVV95cUxOa0pjMkFaS2U0Tm0xYU14WnkyQTlUNk1kWXdYbk81X205TXE1UFFYUXktdk5pMHFkMzdVSmhDem03TGFydzducjBENjJwS3UwUTNVV0NtejFadXRfME4xVXhXTExMWU5mNjVDeGQ1OWRMV3F2bUp3MktTN0h1YW1OVGhhNkpvbHlOVEE?oc=5
2026-02-18	Google	0.0	Gold Mining Stock Rallying Into This Week's Earnings - Schaeffer's Investment Research		https://news.google.com/rss/articles/CBMirgFBVV95cUxNc1FFOUViU0xwYzNtYkZHSnZaaHowd2Y4YWRJVTlMVTRHc3pxdFRkY052UnBBaFZNS0NtNTlVZEZfOGdLcl94SkVvcFVGeG5ZQXlkVGFXWTVCNndaWE9mNU11X2daT1gtUzl6VWxLZmdwbGZDLXZRb05LeENrMS0zdjM5SDB3d3Z2WHVPVnR1eERuS3NRMmxtRGdMN1dTV05jbllTTUNKZkZyaHNKRkE?oc=5
2026-02-18	Google	0.0	Investment rally coincides with renewables records in Australia’s NEM - pv magazine International		https://news.google.com/rss/articles/CBMirAFBVV95cUxOU2IycTBQQ2dXSThzc014WW1ZOTMxUW9YOTlLbEh0U1ZpOThnZS10QW1BLXZvZmI0VGE3blNHMWZ2SVZ3Ni1KRzVHUE1XeWFkcFRrdm9adWVaQ2JhVFNBYjNkcjdvNFhhWVYySndxSlpiZXBFTnl2NHl5dllWTGxKOGR0UlFKNHkxa0RlOVBJMHFkQ0lJWWI3R1FvVjJsalpjTUUydklUVDdZZ3B2?oc=5
2026-02-18	Google	0.0	Investment rally coincides with renewables records in NEM - pv magazine Australia		https://news.google.com/rss/articles/CBMiqwFBVV95cUxOc1N6M1psNDlyTGlpYm1TcFl1NGtxd3lIYlY2X1pZNnhtcVlpSHd5X1JmMk95eFBJZk11S2ZwaUtyZ2d3UFc3MkMzTkNRWFYwbUgxcHl5MmhmNGV2WENkQ2dXcEhQYmpEa3p6Qmh1VEhfbEFOMXFHRG4ycjZ0UW9TX0IzeUd1czJGVmxvMElUdnJIeWd5MGU3RE5La1JmZjF5UllETkNiejFDXzA?oc=5
2026-02-18	Yahoo	0.0	Kinross Gold (KGC) Surpasses Q4 Earnings and Revenue Estimates	Kinross Gold (KGC) delivered earnings and revenue surprises of +21.51% and +7.93%, respectively, for the quarter ended December 2025. Do the numbers hold clues to what lies ahead for the stock?	https://finance.yahoo.com/news/kinross-gold-kgc-surpasses-q4-231001138.html?.tsrc=rss
2026-02-18	Google	0.0	Newmont (NEM) Crushes Q4 Estimates With $1.71 EPS, Beats Consensus by 18.8% - AlphaStreet News		https://news.google.com/rss/articles/CBMiakFVX3lxTFAzb1I4eEEtUXlqbTFsMVAwYjlGQjljTEgtcFVoVUhZMGtOa0Zzd2FMLWQwUTZwX2tEdkt2TDd2ZjhCRmluNWdaeFRfbFNKX0c3UTZjbzJ1WXZ5eGllVFBqcXpSbHhXaFYxWmfSAW9BVV95cUxQb01NSnNDLXpoNkxzTl9KeEFWLWVNdnpLcndVaGcyR1lGQW9YNVI3a2V6OEUxOXYxSUdGa19qa3Y0alN5akx6ajVsVjlZRkFDYVctZGRRVnMxcmkta2ZxOXIxTFpsOWRmNEZRLURqWXM?oc=5
2026-02-18	Google	0.0	Newmont (NYSE:NEM) Trading Up 2.1% - Should You Buy? - MarketBeat		https://news.google.com/rss/articles/CBMinwFBVV95cUxNaXpWMnZySmxER2g2VXBlZndBY0V2UzEyek5PTE1vSWtiRTBiZEdDWUNjbFJFa1NTb0pzdmtaOVNaSnNJcncxMFdIMEVUZnlUeW1XOW54OWNTRkR6MjcwR0ZQbEtKU3piM05UZmlsV3ZnRlFfcGlmVkFaRURZajItdllZMTFvdFRVTlctNW5PcC11VUt0SmR3cXAxTk5zbGs?oc=5
2026-02-18	Google	0.0	Utility-scale solar and wind curtailment exceeds 7TWh in NEM in 2025 - PV Tech		https://news.google.com/rss/articles/CBMiiwFBVV95cUxPREtFVW1JMGV3VGlkQXlDM0E5MnJYMXowM0ZZTDJmSVJhZnoyQmhtZ3NERlRxbHhCcndTUWl4d3Zvc3cyN0dabWZiWm9oV1FITVltZHpKNVN4ZUY0OHpuQUdkdUFCWDdlMTRldEJZeU9QdW1BWTdXRnlMdUFxX2xlTDNTaE9VNkFoeWI4?oc=5
2026-02-18	Yahoo	-0.25	StrikePoint Gold Acquires Nevada's Past Producing Como Mining District from Newmont Mining Corporation	"Historical drillhole intercepts include CA-04, 12.19m of 5.00 g/t Au and CA-05, 21.34m of 2.02 g/t AuSurface samples up to 166.63 g/t Au and 61.80 g/t AgVancouver, British Columbia--(Newsfile Corp. - February 18, 2026) - StrikePoint Gold Inc. (TSXV: SKP) (OTCQB: STKXF) (""StrikePoint"" or the ""Company"") is pleased to announce that it has entered into a definitive agreement to acquire certain unpatented mining claims in the past producing Como Mining District from Fronteer Development (USA) LLC, a."	https://finance.yahoo.com/news/strikepoint-gold-acquires-nevadas-past-123000253.html?.tsrc=rss
2026-02-17	Yahoo	0.2	Gold and Silver Prices Fall as U.S.-Iran Talks Begin. Trump Says Tehran Wants a Deal.	Gold and silver prices fell Tuesday as diplomatic negotiations between the U.S. and Iran began in Geneva and as Chinese markets were closed for the Lunar New Year.  Front month gold futures fell 2.8% on Tuesday, to $4882.90, according to Dow Jones Market Data, while front month silver fell 5.7% to $73.447.  Precious metals miners were also lower, with  Freeport-McMoRan  and  Newmont  down by 2.8% each.	https://finance.yahoo.com/m/12e82b41-4985-3c08-83ea-a1e16dd33d11/gold-and-silver-prices-fall.html?.tsrc=rss
2026-02-17	Google	0.136	Newmont Stock Dips As Lunar New Year Reduces Demand - Benzinga		https://news.google.com/rss/articles/CBMisgFBVV95cUxPWHp4LTlTZ1Jwc2lLUnVlLU1mNXNSam5QSUU5bUNCUHRJckNOdXhjZkZNY1kyR3lTNHl0azNwZFZpZ3pVUVY4NmdCNnNQcnU3RzNrODNaeV8wbjlJZ04xLWg0U19HTVYyc05LQ01fZUZkYzdNa0NRLTJlZUpYR1gwZTVyVW0zckxZTFV0bXc1ZVo5alNIM1JFTEl6WlNqaUt4UlpmajF4THR3OHJITVNpNzd3?oc=5
2026-02-17	Google	0.0	A Closer Look at Newmont's Options Market Dynamics - Benzinga		https://news.google.com/rss/articles/CBMiqgFBVV95cUxPSmRkdGZMOFJkRnNrWks2VnlWSV8yTXRRTXRSbFgyS01Ya0J2ZnZsbWZWRWJJcEFrd0docFBnWkhNQURGSjNsQ3NwYWltb2p4MENGdW5CVV9ycGVqNnRkNDR0dGl1RmZvbWRfUDdGNm81dkhBNnQzNXBlS3A4VTRNdF9mQ1V5WEpqVUVXc252ZF9CbWYxYXhPRHFIbzdYQVduaU5tN2dnNXpXUQ?oc=5
2026-02-17	Google	0.0	Is Newmont Stock Now A Value Play Or A Value Trap? - Forbes		https://news.google.com/rss/articles/CBMirAFBVV95cUxOOFk3SGRqRFEyYUhpUncyWVl0dW1PTVU3Z3RiaEZoUGkyUW5uQUJ0aXh1TEpCOUxmVXVXc2t6WFhoR0toOHlfTl91bTBiT2M2V25OZGVxLXhaelN6VU5rYnlad0J1cExxT2lQU0g3ZllWUzEwUWhHTURmSWZPSl9rUmFObXVzVk9IV0tMeUJSaktHb1kxSVZUVVE1TERzNmhIbEFHSXhzY0dvTEEt?oc=5
2026-02-17	Google	0.0	Should You Buy, Sell or Hold Newmont Stock Ahead of Q4 Earnings? - Finviz		https://news.google.com/rss/articles/CBMimAFBVV95cUxQd2Y4OTBidm9rd3RpaTh6TXNIVDhJY2lHOXlMVmtzU3pkblFfd19xbHY5aWpldjF2TTVnWTVWaWVrRmVNUnhZMG9MaGgtRmdHSW1oSzZFSWh6dkhuT1V3bTlFS3pjaXlMNE9UQVJlUHF4ZWE0QktzcWE1SFlZaXY4UWdCSldlM1VuQXFYWkRXcWxKMHlacW5aSA?oc=5
2026-02-17	Google	0.0	Should You Buy, Sell or Hold Newmont Stock Ahead of Q4 Earnings? - Zacks Investment Research		https://news.google.com/rss/articles/CBMipgFBVV95cUxQa3p2eWtjQm1vYmpvNU93R3I4SnpuYWU0ZVlLalJHOC1TeGdQSlJMb0FzNFFXcDhjdzQ5dl9obzZLcEFpREpkR3lfU1NLS3BGa2lfTUcxU1dBUlhEekhPUm1va0l0TXktdGo3eWF4aFRWMVpvQ2VwNlB5RERydG1BTlFqNWpwbGRZU3o2QlRraGtKMV9pY3BfaHZram5McGRwOUJ3SG53?oc=5
2026-02-17	Google	-0.3	Is It Too Late To Consider Newmont (NEM) After A 169% One Year Surge? - simplywall.st		https://news.google.com/rss/articles/CBMiwAFBVV95cUxPZ1J0ZFl1aGZXdFhLXzM2a1BkU3BHZU03Yk4xMUhzeG1yZi1tWTR1N2NVSExnUmZfU3Z4OE8yNzhrX2hOV2UzeWhCMkxaUmlYYkhQSVRLV2ZKMlVvUHFaMzZOcFlTX0pGYW42cTZfdHpoS0F4di1Zd3BGcVd6QVllTU16Q1IxaTFCOVR6WHdNUUhpQmJ4bUdiQV9xTHlSak54aWdSZU9JOEhGWWpjWjd4ZG5vY1pPbjRHdlZvZGU2THbSAcYBQVVfeXFMUFhSQ0FyRlJSYmhDR055TjRfRjlRQkUwVUgxUGhGaERoNUdnS25vRExWYV96anRIRFQ2ZHBFd3c4ZklSY2t4WFhJaFAxdWdhYnZhWG9TM1VLRUl5Tk5YRXdkbVpqWnZjSzBNTThIbFc4UmhfU2ZDWHgyeU1LRFppNHVycjgwS3JkUzRyenFTX0hYSWhQNmpzLVk4ZUR0UlpsUUZnUktBaV9LVEZWU2RPNzVwZHZ2Njg3ZnIyTldFdm84Ym1DZmZ3?oc=5
2026-02-16	Google	0.5	Earnings week ahead: WMT, ET. OXY, PANW, NEM, MDT, DVN, DE, ETSY, CVNA, and more - Seeking Alpha		https://news.google.com/rss/articles/CBMiqwFBVV95cUxOVHFLOTA1blktZ1gxRzRqNVNZSlhjendtT0gybkR2VlRQelpoS2FWd3E5MHRPaWtvajlXVWowb0c5dEtVU3huRURKbkR2UDM1YzBNeUY1b3dpVTI4R0M0cnhQZFcxSnFGVlgyQmhEN0ZHWnlYTUEtLUlnU1lZZkhZWTV0dFZWVzZOUjl5RFY2SkRfZjdSTUtRRVQyX3FQUGJac3QxRnlsZ3poWlk?oc=5
2026-02-16	Yahoo	0.283	Top U.S. General Joins the Fight for Rare Earth Security	For years, the US depended on foreign suppliers of rare earth elements, but an all-American company is now looking to bring the entire rare earth supply chain back home	https://finance.yahoo.com/news/top-u-general-joins-fight-110000236.html?.tsrc=rss
2026-02-16	Yahoo	0.125	Is Allied Gold's Higher Gold Production a Catalyst for Future Growth?	AAUC ramps up output past 375,000 ounces target for 2025, fueled by Mali gains and a key Sadiola milestone boosting efficiency.	https://finance.yahoo.com/news/allied-golds-higher-gold-production-154700459.html?.tsrc=rss
2026-02-16	Yahoo	0.0	Here's How to Play Kinross Gold Stock Before Q4 Earnings Release	KGC is expected to have benefited from higher gold prices and strong production in Q4.	https://finance.yahoo.com/news/heres-play-kinross-gold-stock-125500022.html?.tsrc=rss
2026-02-16	Google	0.0	Nem Badger, Jr. Obituary February 16, 2026 - Bradford O'Keefe Funeral Homes		https://news.google.com/rss/articles/CBMiZkFVX3lxTFBHMEhLWXo0YTE5REJKWlFDdDFzeEh6WEoxY0I3YjQ5Qlp2elRRanZFUmluSkRsUlgxN002dGNzNVRMbkxyaWNEaldUWXVtVGpKR3ViWlZhU2V2Ukl2R2Y1cUo3dUxmZw?oc=5
2026-02-16	Google	0.0	Newmont Corp (NEM)'s Uncertain Future: Understanding the Barriers to Outperformance - GuruFocus		https://news.google.com/rss/articles/CBMiugFBVV95cUxNamF0cHZvRW9uRlJyRFlSenJDa2IwdzVuang3eUpQZHJGTjhpLTl5NWtuV3BXbjlYVU4yaTVQdWpaMFhLcGYtT2g1WW5BRDEtRUVKVkxFYVpOTHpGcHlTcnVPZDE4UmV6XzZ2aG5uTUcyUEdLUWJ5QjNjVWtIdWZYUzlJZEJDaTA2SGp1eTZQeF81UGk5aU9CQUUtZWdkWWpPX2VFalBDR0M0RmJQeGpYbXBlNDN4MnlCbnc?oc=5
2026-02-16	Google	0.0	Newmont Reshapes Portfolio As Ahafo North Lifts Cash And Returns Potential - simplywall.st		https://news.google.com/rss/articles/CBMiwgFBVV95cUxOc3FPR0NZMWd3UTZkdk5FdDcwVk8xd2NNR3dFTm8xYUFmSXNDRUhVbTMtRkZEdlc3R09aUVJyaFlZeXFlSXJ2aXQzamVyYjlZalV5M0RvcGRmdEVBX0dFaUxNZFliejJHSnJyR2VjR3h6bEZsaHc0Q09rQVI0R3BycXVXbDhfU2o2QnpXSkl1R2Y2Zk9ObFRNODR4UnhzRjcyRGJobDVfSU92YWlnNWhlWHlnNkdrS21yTlZmZHAzUHVCdw?oc=5
2026-02-16	Yahoo	-0.3	Is It Too Late To Consider Newmont (NEM) After A 175% One-Year Surge?	If you are wondering whether Newmont is still reasonably priced after its strong run, you are not alone. This article is here to help you assess what you might actually be paying for today. The stock last closed at US$125.80, with returns of 4.2% over 7 days, 10.2% over 30 days, 24.3% year to date and 174.9% over the past year. This naturally raises questions about how much of the story is already in the price. Recent news flow around Newmont has focused on its position as a major precious...	https://finance.yahoo.com/news/too-consider-newmont-nem-175-180605348.html?.tsrc=rss
2026-02-16	Google	-0.3	Is It Too Late To Consider Newmont (NEM) After A 175% One-Year Surge? - Yahoo Finance		https://news.google.com/rss/articles/CBMif0FVX3lxTE16bGtFRm9tajM1NHJ5b1A0RHRYNUlFLVYtS084ZzFTZlpyX3BGYk03dHV4cjQ5NFc0bWxlYkpuT0NmWkFPcEZoVWpoUE9GN3hlcklpYm9VYk9hX2FleU5MNzVWX3pDeTViU0p2TG5BT0lMeUYxY2M4ckd5U2VFXzQ?oc=5
2026-02-15	Google	0.0	Aberdeen Group plc Sells 309,366 Shares of Newmont Corporation $NEM - MarketBeat		https://news.google.com/rss/articles/CBMixAFBVV95cUxOTGZBUzUtN2NCSjV3bkVxVjJrOFdiSTBPZG1uZXcwblhxNG4wU1h5SjR2cTN3S0t1bTJEUnVoOUR4UEtmU3hBbkVpZ0RCeS1tSVoxaWl0Wk5Cckxhb0lEQnk4dGp2cUpvZWJ6RUR5Z3lqdWE4N0tnMnY4WjNNTVlXSjEtM05kQmE2WDRWVmRzT0p1Q3N2Vm5DQWFlaWMtR3J0Q2NlY2p2NmFaOWoxQ0VkXzRIdllmejRtS3F5cXZ2WUpZVkF4?oc=5
2026-02-14	Yahoo	0.1	Materials Stocks Are Surging Over 20% and XLB Offers the Easiest Way to Ride That Wave	Materials companies operate at the front end of nearly every supply chain. When construction picks up, steel and cement move. When factories expand, they need chemicals and gases. When consumer spending rises, packaging demand follows. The Materials Select Sector SPDR Fund (NYSEARCA:XLB) gives investors exposure to this cyclical sector through a single, low-cost vehicle. Pure ... Materials Stocks Are Surging Over 20% and XLB Offers the Easiest Way to Ride That Wave	https://247wallst.com/investing/2026/02/14/materials-stocks-are-surging-over-20-and-xlb-offers-the-easiest-way-to-ride-that-wave/?.tsrc=rss
2026-02-14	Google	0.0	16,468 Shares in Newmont Corporation $NEM Acquired by Florida Financial Advisors LLC - MarketBeat		https://news.google.com/rss/articles/CBMi2wFBVV95cUxQbkR5SzJPSjYzdjVya0NsY0pkdXJlRl9iUVBhSjA0YmJEbURMeUtDZWNwLWZBQ1N2LWx6S1psakcyQXp5bi14SzRCQ1ZTbUdtNTdZU3BtRHNSbXlOa25EMVJGUGU5M0FSWU9tSnF2YlFURlVmczV1RjJtSWtjdDJidWVNdk5neWxRRThqbENIejE1MlQwNGtqTlJWaGxWZTZiWWRjSlBNU0MxdE10bk55UnN5c3VhWkVScVZxbUd6MlphUlJkRGI2OWtWQm96cEVENS1HNDdnRFV4NGM?oc=5
2026-02-13	Google	0.433	Newmont (NEM) Valuation Check After Bullish Analyst Upgrades And Strong Gold Price Support - simplywall.st		https://news.google.com/rss/articles/CBMiwgFBVV95cUxOVkw4eUM1RXJpb1hxbV9MV3RnbDZBY2pYanJDd0tFM3ZSN2t4bWNZWnNhMnBfaTJHSWVwaHpLeUE4RU5uLXo5eEtPX0EybGQ1STFkWUlzM1VBNk9ZbUtDNHQ3T213UTVnWFFVTnhlVE9NUlZFSWVBZnpHV2pNZ2pTUWI1R3U1b08yV3otS2U5bGYzdnkyZHlxUTRaUWpYMDRhWU1PQzlhSm1IRlJockZYRDNTUXdiVmRFdWJDUGJoeDQtZ9IBxwFBVV95cUxPLVg5ZGMwNmRMaFZUeTYxSGFhaHRVQmQxdVhESVdxa1VSYjJoaWpTaGc2R2VoN3dHNXJwTGtmdFBmeG5LajNvRVRlUWYtd1lqUHNMeGNmWVZvYVJ5alo3dzNFNkVsTW1temNfaHczX2MzSWdhWHhITF9nNUVqZDRYX2l0NW51TFZQWS1Cejg0anNUZkdpVVNyeURSZnFxX3N6MFhxN0ljVG5NWVBxSHp0RDhmVFloR3hMN3lkbWlyTnFoTU8wcG5j?oc=5
2026-02-13	Yahoo	0.0	Exploring Analyst Estimates for Newmont (NEM) Q4 Earnings, Beyond Revenue and EPS	Evaluate the expected performance of Newmont (NEM) for the quarter ended December 2025, looking beyond the conventional Wall Street top-and-bottom-line estimates and examining some of its key metrics for better insight.	https://finance.yahoo.com/news/exploring-analyst-estimates-newmont-nem-141508803.html?.tsrc=rss
2026-02-13	Google	0.0	Has Newmont Stock Quietly Become a Value Opportunity? - Trefis		https://news.google.com/rss/articles/CBMiswFBVV95cUxNNExjSGlCS3FvZUFzUHpja3prQl90SWlyUUM4YUN4RHBfblNieURYWUptbG5sdjc0TmpFazR1c2pwTWxvUWxLRnBRVVJQejNJWlNUbEZ2MVJKOU4yU3RubUpQT2J2YjF4Z1NPZXVRRktabFdIUFN1Y2k0MXBnTVVyLXVwN0xkcDFCMmpxQmFxcU9vMFFkbGF2YzZIUEw2SGJlZEpkRWt6VlZQZnNJQkIzWjFncw?oc=5
2026-02-13	Google	0.0	Newmont (NYSE:NEM) Stock Price Up 6.6% - Time to Buy? - MarketBeat		https://news.google.com/rss/articles/CBMioAFBVV95cUxNQ1VJelY5M0RMazY5Rm1UUVkxd3EzRDV2ZURJSFN3RTYxN3c1UmZsYXlXeWhJSlp6Ny1UdnBfZU5hbTNIYi1OWmVsckp6VlY1dkdHMi1xaUItVFRIdUZqcEdNRUREdTBVNDJwVHRqY3I1VmlsNFBJNlNQcFdDNkpOT0NoTjhjb1l4dE1VakdoZXNZcWZMLVZacHZzaHFpY3dv?oc=5
2026-02-13	Yahoo	0.0	Newmont Pressures Barrick On Nevada Mines As Valuation Gap Persists	Newmont is pressing Barrick to improve operations at their Nevada Gold Mines joint venture, citing weaker performance and value over the past six years. The company is publicly stressing the importance of existing transfer restrictions as Barrick considers selling minority stakes in the Nevada assets. These comments bring tensions between the partners into the open and put added focus on one of the largest gold mining hubs in North America. For investors following Newmont (NYSE:NEM), this...	https://finance.yahoo.com/news/newmont-pressures-barrick-nevada-mines-171215946.html?.tsrc=rss
2026-02-13	Yahoo	0.0	Newmont Surges 73% in 6 Months: Buy, Sell or Hold the Stock?	Newmont stock is up 73% in six months as gold hits record highs and projects advance, but weaker production tempers the case.	https://finance.yahoo.com/news/newmont-surges-73-6-months-133200087.html?.tsrc=rss
2026-02-13	Google	0.0	Newmont Surges 73% in 6 Months: Buy, Sell or Hold the Stock? - The Globe and Mail		https://news.google.com/rss/articles/CBMi1gFBVV95cUxPbW1pQTZEamw4UWdoZkt6R09nZldGU1Rac19UVnFFUE5NaE1Ldy1KaFZQQ3U0N1pkSUpELVV6N1F0ZkxrT2pNQmNhMFM1WllyUURrcFh1ckJIYnBSNDNDa2NmbkgxNXBKRkhDVm1HT1JtYU9qdnRaUW9uVjV6NlNuRXMxQnMzU2FSb1ROWG8yeE14V0lvU0hidFVEZUgzYmhkMGlxRDBzS3pLbnF2NlpVeWhYQk1OWVZWUHhSY3lBOGRCb25aR2RvWmg1OThSRmhMOFB2c3h3?oc=5
2026-02-13	Yahoo	0.0	Retirees and Income Investors Get Paid Monthly, Plus 20% Gains With This ETF	The AAM S&amp;P 500 High Dividend Value ETF (NYSEARCA:SPDV) generates income by holding dividend-paying stocks. With 51 positions from the S&amp;P 500, the fund targets high-yield companies. SPDV delivers monthly distributions, paying $0.10 in January 2026 following steady monthly payouts that have trended upward over two years. Unlike covered call ETFs that manufacture yield through ... Retirees and Income Investors Get Paid Monthly, Plus 20% Gains With This ETF	https://247wallst.com/investing/2026/02/13/retirees-and-income-investors-get-paid-monthly-plus-20-gains-with-this-etf/?.tsrc=rss
2026-02-13	Yahoo	0.0	Why Newmont Corporation Stock Popped Today	When gold prices go down, so does Newmont stock. And when gold goes up -- so does Newmont stock!	https://www.fool.com/investing/2026/02/13/why-newmont-corporation-stock-popped-today/?.tsrc=rss
2026-02-12	Google	0.068	Fund Update: New $19.0M $NEM stock position opened by SUMITOMO MITSUI FINANCIAL GROUP, INC. - Quiver Quantitative		https://news.google.com/rss/articles/CBMizAFBVV95cUxOMlNHVXJrYjlyeU1CVmtlSVVJOEYwWmd2VzdtX3QwazJTR2VDY1Z3S1pxVjF2dW5rMFVjUFNRUkZrczIzUVVNUmVXWWtKMzFsRUVOOWRiTmdkVkwyMHRBdmhGUnk3Q2stZkpVYjJwa2NQakxOTklRN3hTV2VGN0xGWlpHeWhaNnlRWEVmc3JHT3BWSHFja1V3T3I0cVBVWlhVY2pWdzliWDhwMVdWY0U0MEtCb3BmOWNQMzFLVGl3Y0NOaks5WXRNQXJkWlQ?oc=5
2026-02-12	Yahoo	0.0	Agnico Eagle Mines (AEM) Q4 Earnings and Revenues Beat Estimates	Agnico (AEM) delivered earnings and revenue surprises of +4.91% and +9.98%, respectively, for the quarter ended December 2025. Do the numbers hold clues to what lies ahead for the stock?	https://finance.yahoo.com/news/agnico-eagle-mines-aem-q4-231502576.html?.tsrc=rss
2026-02-12	Google	0.0	LSV Asset Management Grows Stock Position in Newmont Corporation $NEM - MarketBeat		https://news.google.com/rss/articles/CBMiyAFBVV95cUxPN21BMjMzRVlQV2lZR1pmeDkzb2pSMEIzODgtYmdiMll2YXVndGNuYVlJc29pUTN5Sm9aQndId1dJYWRsZ1VFeS14ejNsS09UVDRXVElXZkd0ZGNPV2JNVDViV2F6LXBKbjRPai1SOEVMUk0wYlhGaUtzcm9iRGFhelRRamE1dGVmbEQ5Y0g2dXZLTzVtMEcxdnV4cVljS21QWTdNbHNOX2JlNlJwYTRBWjl1bFNDY3NfWWk5Nmw2U211U1dUTGQ3bQ?oc=5
2026-02-12	Yahoo	0.0	Newmont Challenges Barrick On Nevada Venture And Potential IPO Value	Newmont (NYSE:NEM) is pressing Barrick Mining to improve operational performance at their Nevada Gold Mines joint venture. The company is signaling it may use protective clauses in the joint venture agreement to challenge or block Barrick's planned asset IPO. Newmont has publicly raised concerns about deteriorating results at Nevada Gold Mines under Barrick's operatorship. The dispute could influence how any Nevada Gold Mines spinoff or sale is structured and how investors assess the...	https://finance.yahoo.com/news/newmont-challenges-barrick-nevada-venture-061008693.html?.tsrc=rss
2026-02-12	Google	0.0	Rhumbline Advisers Reduces Holdings in Newmont Corporation $NEM - MarketBeat		https://news.google.com/rss/articles/CBMiwAFBVV95cUxQeGJCNWhPZ0tPbXpuSWJZWWJ1TWcxVTNXTjFjUW40SmgtSlNLZlk0M1Z3SG10N1hYUTM1Z0ZvUklvVDFITWNwT0FIMWtQU3VmY3NsQWxXMzlOQ3dFZ1RUdXNtT3kzRllNYWVady1Xd004SGNHTTdkakZqRk9yV01wZ2JaS1VSNEhFZUo5d3k0bVBnU0FBUVNnbU4tZ1hHQ3h0NThrQnJLLWI5c0lTcDg5X0JrWDJYWm5Scm5NbGZuZXk?oc=5
2026-02-12	Yahoo	-0.1	Newmont Corporation (NEM) Earnings Expected to Grow: Should You Buy?	Newmont (NEM) possesses the right combination of the two key ingredients for a likely earnings beat in its upcoming report. Get prepared with the key expectations.	https://finance.yahoo.com/news/newmont-corporation-nem-earnings-expected-150009048.html?.tsrc=rss
2026-02-12	Google	-0.1	Newmont Corporation (NEM) Earnings Expected to Grow: Should You Buy? - Yahoo Finance		https://news.google.com/rss/articles/CBMikAFBVV95cUxQZEgydXhxVk1Ubi05eXRNTlZVRnlvTndUY05tbUtxRFNyVGlzOTdVbVI4b0stZDAtejFZZDN0azl4Qzd3M3FGcDBBLVUtblFBR1BqMk9MVUxvTE5hMGktZjIxWGdVRVN1Y1gyOWM5R09PLXBWbVB3NnFYSjA1TWk3ZXdCM3N4S05EZVhhLUw0U2I?oc=5
2026-02-11	Yahoo	0.0	Agnico Eagle Stock Rallies 26% in 3 Months: What Should Investors Do?	AEM rallies 26% on record gold prices and surging cash flow, but rising costs and a premium valuation cloud the near-term upside.	https://finance.yahoo.com/news/agnico-eagle-stock-rallies-26-131300833.html?.tsrc=rss
2026-02-11	Google	0.0	Newmont Corporation (NEM) Advances While Market Declines: Some Information for Investors - Nasdaq		https://news.google.com/rss/articles/CBMitgFBVV95cUxOOW0yNHJTN0pSS1NYbmlzZ2NzeTd5d3JDTXR6RW5uUVdFbHlma0tlUnBLdnlWTi1UX2hnSDl0RkZWUHFSMndYQW4tbW8tSWw5U0dGT2YtQ3dXMGlNc1poUW1JM2FRUkFYRVRKWXZUcnhnMFhMaXV2dU85N1QyakZrSjRHalU0UWdnYnVfanlJOTRfdnJWYmZLY0VqTjVMT2ZFZkJaS2hvVkpXRXlPLUNfRGQ0YUtaQQ?oc=5
2026-02-11	Yahoo	-0.167	Bank of America Slightly Lowers its Price Target on Newmont Corporation (NEM) to $134 While Maintaining a Buy Rating	Newmont Corporation (NYSE:NEM) is included among the 11 Best Mining Stocks to Buy According to Wall Street. On February 9, 2026, Bank of America slightly lowered its price target on Newmont Corporation (NYSE:NEM) to $134 from $135 while maintaining a Buy rating. The firm said that the adjustment followed the updates to its model reflecting Newmont […]	https://finance.yahoo.com/news/bank-america-slightly-lowers-price-232414940.html?.tsrc=rss
2026-02-10	Yahoo	0.0	Should You Buy Agnico Eagle Mines Stock Ahead of Q4 Earnings?	AEM's Q4 performance is expected to have benefited from higher gold prices and strong production.	https://finance.yahoo.com/news/buy-agnico-eagle-mines-stock-135300925.html?.tsrc=rss
