Date	Source	Sentiment	Headline	Summary	URL
2026-03-02	Google	0.16	Newmont Target of Unusually High Options Trading (NYSE:NEM) - MarketBeat		https://news.google.com/rss/articles/CBMirwFBVV95cUxNMjFBV0JmNV9jdE41MWJVYS1UQXlKeWQ3aUVjdVBJazBoMjJmYUJyaFptQ21yeGJ3MnNZMVVsOWxHeFlwMVoteGpGeWlVdThiOFUtWXUwcmNLajI4ZXd2NXJpb2c1blFXd281NG9FNF9OWjRBcFVJWlhVNllFTTFzSG84SlZiM1NWZ21PZ1Y1MTRidzNRQ0JKNjFucFVNZURJYll5TFVBTWVTLXJFZHFz?oc=5
2026-03-02	Yahoo	0.043	Gold Climbs Above $5,300 an Ounce. Where It Goes Next Amid Middle East Fighting.	Gold prices rose early Monday as investors flocked to haven assets amid heightened tensions in the Middle East. But it might be a false move.	https://finance.yahoo.com/m/a624c5d5-9c46-3e65-911d-6fd6144cf7c0/gold-climbs-above-%245%2C300-an.html?.tsrc=rss
2026-03-02	Google	0.0	Australia NEM solar retreats from peak as prices hit extremes - PV Tech		https://news.google.com/rss/articles/CBMi2AFBVV95cUxOaTduM3JvRmtKVlBlbmRzSTNGNWZleTBlV1lKWVBRUko1ZzN4UkplaEZVaURBcFZwdG9rX3BxbmpkdGIwSEU1TFQtX0FhOEd0Z0JwSkd0OHBYZ3B1bEd4ampkaGJ6dUJHMkRjYVJ1MHo2SWlhTVZJMGctUVpjTGtxdlZSYnBjMEM5aDItbHVJcUpkaFg0UXl3MjQ2eVdDMXBnMmFadVJteXMxbWh5cVBnQWRoSlhCbTA0TjRWQkV1eHdvZXNaM0FYYVJla2NlM3QxSWxQSUhacUw?oc=5
2026-03-02	Google	0.0	Elo Mutual Pension Insurance Co Buys 21,706 Shares of Newmont Corporation $NEM - MarketBeat		https://news.google.com/rss/articles/CBMi0wFBVV95cUxOeHNteGhTX1YwWHhNQTJXUGRCQWFCTEp3WVRURlBnT0xMVmxfQVhGOWl1WGdrU1NBUm10MXNfZFljcGhvOFVrU1M0YVZaeFNBS0J6b2ZaeGpVMmp2WWdEQXJqNkxDNEdJQzVVU3NiOXczbzlKX0ZBWWFiTFk1UWw0LUV4ckxuTVFRam5BellVNFJ1YkpuMlhZcnNSSHZWeHk5NkFtM1hDTEQyRWJLWlNKdzFDQ3QwQmVoMW9GaHVDX3JTbFBVN0toYmQ2SnFjWm0yTGNZ?oc=5
2026-03-02	Google	0.0	History Says Buy These 25 Stocks in March - Schaeffer's Investment Research		https://news.google.com/rss/articles/CBMipwFBVV95cUxNZTZqR3NnTUF6QTYzZ2laMEktdjBnbkRYS1BnbHVtR0ZzZ05LX0pOLVViVTFSaXRvWUpCNXhfVkVqRU83OHktbjJMMHI3RXgtMl9DVWlwODFTWjBGVzY4WXd6aWJISzRZRFZBNG95MDN5bUcyd3UwRzVBQTZyQWFrVWVENkRqRWtUdExTVXMzRXo3VUs3NnBrTTQzQWNrUldOZTdIUmwybw?oc=5
2026-03-02	Google	0.0	How Stronger 2025 Earnings and 2026 Output Plan At Newmont (NEM) Has Changed Its Investment Story - simplywall.st		https://news.google.com/rss/articles/CBMixwFBVV95cUxQX1NNNmhYSGlXT1VWZ2RaYng0THIyRFVCRjA5bEowUjA2SFlhck9GYnJfYU44U2Q1bURadzhBdUJMdkp6MEp3am03cWpwRTF4cFZYeVBQVVRSVUh0WUFKSmhfdzFRZVRCaU1HeFhMLUFsbzVlc2Q0cTdtTFFPcFBOejhEOHBLUlpEdHMzWXVvSWxlWHVKclRjN3pSalN3OFB2Z29BOXRzZVhPOVBvRUpXSW02YTk4cXFNeVFLVnNOU2VmSDZyLTQ00gHHAUFVX3lxTFBfU002aFhIaVdPVVZnZFpieDRMcjJEVUJGMDlsSjBSMDZIWWFyT0Zicl9hTjhTZDVtRFp3OEF1Qkx2SnowSndqbTdxanBFMXhwVlh5UFBVVFJVSHRZQUpKaF93MVFlVEJpTUd4WEwtQWxvNWVzZDRxN21MUU9wUE56OEQ4cEtSWkR0czNZdW9JbGVYdUpyVGM3elJqU3c4UHZnb0E5dHNlWE85UG9FSldJbTZhOThxcU15UUtWc05TZWZINnItNDQ?oc=5
2026-03-02	Google	0.0	Newmont (NEM) CEO Viljoen has 5,208 shares withheld for RSU tax - Stock Titan		https://news.google.com/rss/articles/CBMirAFBVV95cUxPNDRqV3VWODhqdklMUVM2ZUhfeXE4Q1d1N2h6OWx6SDB1dWRNbVEzLVBaV1gyTE1sSWZrUFFKV1liZ1o5eFRLT3E1M2tiRWdqQkozdks0Sk1aX1FLOWZ0MnNHV3U0MmhuR0lrVHJlcHd6YVZUcklQS1MtTEhXbnpWcnlOalNLdS1NaHZJTUdwbkZHVW5VT29OMWxwc1NrcmpmVTF4TnR4dFZlQkhu?oc=5
2026-03-02	Google	0.0	Newmont (NYSE:NEM) S&P 500 Jumps on Earnings Beat - Kalkine Media		https://news.google.com/rss/articles/CBMingFBVV95cUxPV2JueVRKTVdfajhCVS1ZYkVvdUtMU05wcnJFbkhXZ0lKRmpBX3dXc3lDam04X292bGhXTTNhVXdzNjB4Q1FnR1BQcE5yaktwZ1d6Q0pBaEtCSF9vLTRfUkc3ZHBoLXZKNXlNS0VONVhtSmhCcmdBYUpHaWlBUERaSXBKcEdwbHItM2g1a0NiMkNGUmhQU3V6dEJsdHZXZw?oc=5
2026-03-02	Google	0.0	Newmont Corporation (NYSE: NEM): The Gold Standard in a $5,000 Bullion Era - The Chronicle-Journal		https://news.google.com/rss/articles/CBMi4AFBVV95cUxPVXdBUGIyQjZnTVNpNzNOd1ZhNHh3dmkyeUZfYXk1MWtKUjliTkNQbDNSaUFwR0V1VWh4T0dEQUt0UVVPOFBONFl3NmNqZ0ZObVJINW1XUmlGdWg0dW9keWFTX1g1NWpncEh4Sm52azJ0a2F4ZERHdVdETUxHNkR0b0V5ckp4TUh3bmx1bmpmM3FhWl8xcldOQ1NwRDgtd3JpWm9rQnBTVk5idGxVMXdXbnpqUkZmY3kyU2h4LXhaVlBHZ01mbkpsNXBLbXFmdEtMLXZSU2VwU3BUUnRQVUdFOQ?oc=5
2026-03-02	Google	0.0	Noteworthy Monday Option Activity: JEF, NEM, AAOI - Nasdaq		https://news.google.com/rss/articles/CBMihAFBVV95cUxONVppb1ZRZm5ob2JETGdsMlV3TFllYWlhX2c1N19Id3hkQVJjYnlicHRBdVFjUzRORG1pRFh0U1ZUa3pHYzUtTmNrNTI0ekdIRk5pd0g1eC1FMkFmLWkyUFQ2U2l0eVlFWUJUNlRSMkkzMU5FYTkwbW9NbVJHRE5hc2VoN2I?oc=5
2026-03-02	Google	0.0	Waverton Investment Management Ltd Buys 23,139 Shares of Newmont Corporation $NEM - MarketBeat		https://news.google.com/rss/articles/CBMi1wFBVV95cUxOd2k2YWhiR0JDbVEwd2g0blVwbndIUTV1Y2RZNHAzQldEQW4zdlNxTUh2N1FiNnc3NTNxRzlqZWYtUTBPNV9jUTZzdm0tZEhrcm1iWS1NRmJ0THRZS0RlVHZ0amItajJoNVQ1Q0ZabmVjaUp5STJpb184Y2hRX3ZTVVZmM0lkTDNmXzJYbkdKS0NBLVJFZjdqSlBTb005Um94VnZWbFZMRXpJWi1CWWlvMzl2SUZ3Nkpjd1pjT2tFTjgwVWc2QkRSZ2tTZC1QM3V0RGZqb2dfdw?oc=5
2026-03-02	Google	0.0	[Form 4] NEWMONT Corp /DE/ Insider Trading Activity - Stock Titan		https://news.google.com/rss/articles/CBMirAFBVV95cUxNWTlnNzc2MTBjRkZERzZvNTJhRWF5Q2ZXckRLdUtYcEpVU28tV0tPaU1ZV3B2SnRmTUlHTFdIMEo4Vml2UFNKbldjR3lzZ2lPdzBSbjhnVFNhTi1oaDFuMXFPWm85QmRSOU5ReWVINGRPVVFYWjNSTVZIRGNpZjhScHhjbUpIa3E1THpvQkNsQUVxd2dISHpnY0NUTFJhS0V6SVQzdjRKb25HcVNj?oc=5
2026-03-02	Google	-0.1	[144] NEWMONT Corp /DE/ SEC Filing - Stock Titan		https://news.google.com/rss/articles/CBMilgFBVV95cUxPREVxTXZMWDhHWGNpOFdtRWE0dEVic05jOXpoRFJiNjA2djAtbUw2dmM5REdhTmRpUGNBbm9vcGdIM1EzMW9Uc1c5OXZsdXZLclZmSjJfdzF3X1V6amx2OC1id1p4OGprTW41bTdXaEZ4aFRsQnZsLUhQeGF1b2NtNmJUaHBxUW1pZWwwQXVadXE2NHA3eWc?oc=5
2026-03-01	Google	0.5	NEM.N - | Stock Price & Latest News - Reuters		https://news.google.com/rss/articles/CBMigwFBVV95cUxNMmhwUG9SeF8tLVFqSmN2b2lsekhRS0JRbDRfN090b1d4cFNYVEtHYjZJLVNCX3V1NEw2NTh2R2tSUkdpMU9UeVE5YnNHZk5UNUlHallPZEdadDBpUnhaRHJxS203bWVtTUNaRE8wVFM3Zy11ZEdNQUtSUnVFbi1sRHZQOA?oc=5
2026-03-01	Yahoo	0.033	Bernstein Upgrades Newmont (NEM) to Outperform, Sets $157 Target Price	Newmont Corporation (NYSE:NEM) is one of the Top 10 Stocks Warren Buffett Would Buy in 2026. On February 27, 2026, Newmont Corporation (NYSE:NEM) saw its rating from Bernstein upgraded from Market Perform to Outperform. The firm’s analyst Bob Brackett set a price target of $157. The research note cited the firm’s bullish view on gold […]	https://finance.yahoo.com/news/bernstein-upgrades-newmont-nem-outperform-150445303.html?.tsrc=rss
2026-03-01	Google	0.0	APG Asset Management N.V. Decreases Stock Holdings in Newmont Corporation $NEM - MarketBeat		https://news.google.com/rss/articles/CBMi0gFBVV95cUxPc0JZSm1LeW4tRkh3a1g5MVNhTTBKcGwySkd0aXlmZkNlQkc1NkctNXEwWGR5TDZyUDZraU1haWw4OUF0X2dsRnlXaTNISkNIcldzU0hlVHFjeXJ0aWJhTHRDdXJiR25nSTJhT2FUbDU2UFppWjhIMmUzYkVsaFo0eHZqUlprejA3ZnpRc1ZMRnJkNTFlMWpyLUdNSnBKd3ByYl9oUkhuaG8xdVpEQllFNDFGeUliYk5GakJsa0xiT1Job3ZfNHR1b0w2M1JicjZFeVE?oc=5
2026-03-01	Google	0.0	Bernstein Upgrades Newmont (NEM) to Outperform, Sets $157 Target Price - Yahoo Finance UK		https://news.google.com/rss/articles/CBMilAFBVV95cUxPRFdGcHRMQ0ZvaUlIVmtSR3EwNS0zQVN0dUVvcWJ0MElTTG1ackN5eWZvWF9uTG5XcGE1Vmp2RW5VTWVFcWRsdDFDOVhQaUMtcEM4U1FkdHVCOWFJNWsySGpFSE8tU0xPd1VveS1tbzkwYVYxRFdCWmZvSFBFWGZmSEJneGZiaGdnWVBWVTNLUHpNVGxY?oc=5
2026-03-01	Google	0.0	US Bancorp DE Boosts Stock Position in Newmont Corporation $NEM - MarketBeat		https://news.google.com/rss/articles/CBMiwAFBVV95cUxNbmY2QUdqVmtFR0p1ckVzMDRicU1Zc3hJUDVFejROUVJUYjlyRzh6b2tHXy1NZXZUYWo0M0NUUHZlRE9rYldSblBNQlNfa0Z5LUVsS0ZfNzZMNVJVM2xheU01ZGNMQ25oUktZRlppVjBJNm5pNWg2M3MwMy1vaURWVXVNcnNiWkJlN0RnVlBnLWlSUW8yczFqQ3FmTGI0N1ZUWUw0anFreGRQdWZzZzdvRDh0VUZ5eVo3djd2ZkpvcVE?oc=5
2026-02-28	Google	0.227	Bank of America Issues Positive Forecast for Newmont (NYSE:NEM) Stock Price - MarketBeat		https://news.google.com/rss/articles/CBMixAFBVV95cUxQVWI3d0wwdnZhZ3VDRlFhS200VG92V3FUQ2NKZkxWX0VxeXhPWGZJTnluWkg3NXdhVmhHaVJlZEVQVGVUdUtqR1B0cGJYU29WRlktRXRxUGtZZ0VYMmVfNWtSRnhZZ2VZX3JWanBfeUZyQ3hZZ043LTlKWW03Q0pDLW1SOVpnRzFld3BRMVczalZHakNBRE9tVmJDWW1IcGJDUVgyT0RuZWRKT2RxSU85eU0ySGFvTVlpOHNvV2d1LVVtZkI3?oc=5
2026-02-28	Google	0.2	Is Newmont (NEM) Pricing In Too Much Optimism After Its 208% One Year Rally - simplywall.st		https://news.google.com/rss/articles/CBMiwgFBVV95cUxQQjc4ZTFXdC1ieEtMbWVxNjJNNjJ1OXFnX0lMcnhuZkdmeTJoUWFPNmd2QjJDc2t6YXZGMDJUeUtNZHFOUEhKa05IQ3VBUUdBSS03ZE1OREx2VV9TeE5MVDNpSXB5SUZUZ2dIdXVnVm1zTjlKU3FteGFGSUVzaVl5azJDMXNBdk9nYW9Oek5wOU5tMWNmRngxdlhkX2dQMGlxOFhuZF9sTDNEWkk4a2JuSkdIeXhCZTFXX1AxcDZYYnVvQdIBxwFBVV95cUxQNGtrVmUxd3UxRWhWVUdkak1uODFmUkZOVE9wcjJNcm1fNjRFcGlyWVlSQUVyR2wxbWMyc2RNaXZjcWtqZUlJM3VmU19IMndZaDg5V04zQTltbE1sZzAzWlBwaWN0cnRIT0RXbV9BOXRac245SmJLTEZZU0x3aFY3OTUzUWgwZzJZLUFqSHBwS0ZMTmlnUjFQTk9iYlNCZy1FMDY2RmVSUU50ZmhSNkxyLVVkVkR4RHRSZzEwNGJKZDZNYk9jdWYw?oc=5
2026-02-28	Yahoo	0.162	Newmont Extends Cerro Negro With Cash Funded Growth And Rising Momentum	Newmont (NYSE:NEM) plans to invest about $800 million to extend the life of its Cerro Negro mine beyond 2035. The commitment is supported by strong 2025 free cash flow and a move to a net cash position. The company expects to fund the project without taking on new debt. For you as an investor, the key point is that Newmont is putting substantial capital into a core asset while its balance sheet sits in a net cash position. The stock is trading at $130.0, with the share price up 6.4% over...	https://finance.yahoo.com/news/newmont-extends-cerro-negro-cash-190932740.html?.tsrc=rss
2026-02-28	Google	0.136	Newmont (NYSE:NEM) Given New $67.00 Price Target at Canadian Imperial Bank of Commerce - MarketBeat		https://news.google.com/rss/articles/CBMi0AFBVV95cUxPWHdyMzJCTEg2T19TUFZXNUJUc0RNV1UwdDZpLUdqVVVuWE0xdXNNWTlHQ0xLWktDRkcyVzBMQXpYd2Z6SWNuLTU2UXMzNnB4bm5DMHc3eEVkVHBlNUx1cDRuLUhrQ2VJSk8zamNXQnlRN3NEMTU4UGl0WkNjRnlGdjc5Z0xySFJaS2xtVENEaExJWi1fNFlEVXRSWDhOWEI2WTVGRkc4M1RkQl9JejF1THV4aFZKUDdreXlKMGxhNEZWaEhGVGVudmhWeTF0cDl0?oc=5
2026-02-28	Google	0.0	Andra AP fonden Increases Position in Newmont Corporation $NEM - MarketBeat		https://news.google.com/rss/articles/CBMivwFBVV95cUxQeUEyOU5BNDJRZ1BVT0RNeUFYaGRfLXR3VUVNek9oRHRFUXVKWERaczRlclJ4T2Fka3NIekRza2s3bkhKUllQMWlNSnV0TXdTc2dxajl6b3BaakxUWFM5UTVIUUV0cWxFQXJzU0ZwelZxM2tIbm5WYW5CbkVYM2t1alVyTnhxNWZjY1BMaUZ2eEs3NXE4bF95Wmh0N1pJOVlyZWJVZjR1eUNmOE9DX1JiVGdtNC1heWhKWGJobHp3dw?oc=5
2026-02-28	Google	0.0	Fox Run Management L.L.C. Sells 9,452 Shares of Newmont Corporation $NEM - MarketBeat		https://news.google.com/rss/articles/CBMixwFBVV95cUxQNUMtSmIyS2VhbEZCWXhIMjNaUUVMYy1scTJaSFlzWXRXcm1KeU5vbzBycGhXbmtOZGpzR3lYWGFfaC1nU0tyelNyak1pSmpySWVmdThZVmh2d3EtWnJkRDB0OFZQdG9UY1drSXY2RzhySUJHNkZlTHB5djJBbkNWY0dkVnJyaEg5SDAtdWJlcUotMmJFRE9mTG5EWUs4M0NOeDJSYzRQYmtVTnpobHFFY1h2bUZhNDE2RzdaOEI5NlR2MDd6RXRZ?oc=5
2026-02-28	Google	0.0	Newmont Corporation (NEM): A Bull Case Theory - Finviz		https://news.google.com/rss/articles/CBMifkFVX3lxTE16YnN4R3BKOEtXWVNIVW96VjM2NG1UdFFja0ZOdHJLb0JkRVozVkN5bzlZZGlob3A0VGpXVlg5Vldwa0liakM2cXgxRkotcjFtanNDWWJEQjNhdmQwR0ZqT1BrVTZHQWlGM2pzVWtNRU12aHZMbkJfSWFnVUQ4Zw?oc=5
2026-02-28	Google	0.0	Newmont Corporation (NEM): A Bull Case Theory - Yahoo Finance		https://news.google.com/rss/articles/CBMihgFBVV95cUxQdGNRc053VE1WV0xBdy1OTVVGWVYzWDgzZXZBUFFqS294U2dZRXNSZ0RVeC1oZjAyVElZMHM0YUJMdjBFdkEzX3dUMTJpcnV1V2F1cmxwZXpSdU04bVQzak5zTUVEbWltUGZnbnpIb2pveFR5ZTNKOV9jMzVldEJvVnQtcUhVQQ?oc=5
2026-02-28	Yahoo	0.0	Newmont Corporation (NEM): A Bull Case Theory	We came across a bullish thesis on Newmont Corporation on r/AIPortfolios by manojs. In this article, we will summarize the bulls’ thesis on NEM. Newmont Corporation’s share was trading at $122.13 as of February 20th. NEM’s trailing and forward P/E were 15.66 and 15.82 respectively according to Yahoo Finance. Newmont Corporation operates as a gold producer. It also […]	https://finance.yahoo.com/news/newmont-corporation-nem-bull-case-165936580.html?.tsrc=rss
2026-02-28	Google	0.0	Ninepoint Partners LP Invests $927,000 in Newmont Corporation $NEM - MarketBeat		https://news.google.com/rss/articles/CBMiwgFBVV95cUxOR3VGeEQ3QXpEcGU1SWZ5eWNIaVVjU1N0UzRYeDFfaGVlVTVYQ2xmM0xuQlJVak5nc2FUNWhFS0FyWHFjSnhuWnhDTDY3UVNHV3p2Tm1xblE2TDRNcVZPWTNKYXVjd2x2WjY5b0J1MFZrUEc0cmtKQUdNUUR5Vmtuamd1MUVzMWlCaDczV2ZTaGdFWi15dF9BUWpxNkJlZTFJV2dQZ1BuU0czZzF4dWpmSU91d0J1di1nNDZzY2pnYlM2dw?oc=5
2026-02-28	Google	0.0	Wall Street Zen Downgrades Newmont (NYSE:NEM) to Hold - MarketBeat		https://news.google.com/rss/articles/CBMipwFBVV95cUxOdU9yVW83QWQ1M1lrczFGQ3N5RGlMZkgzcWRmU0Q5Z0R0Q284SzhfLV9KOWtNdWwwS3N0YUowbnVuR0JGLXowRWx5OW9EdUNvTE5KVFhRLTE4d0sySHRmc3A0TlVITG96R0VtZXZvSXNYMzRJT3ZqUmNPRlB6Z0hfQXFHRDFuZDNRQXJ3U1hMN0R4MkxUdDlHMHFHWFlyVlpnOFJ0Umx0SQ?oc=5
2026-02-28	Google	0.0	Xponance Inc. Purchases 22,930 Shares of Newmont Corporation $NEM - MarketBeat		https://news.google.com/rss/articles/CBMiwAFBVV95cUxQckkxU05JSmhXU0NtV3ZOamZKa2twUU5kVlRaYkxiTmNyMGt0dG51Sl9rLXJMcFBtZzFsSHFwYkFvdVhfRFB2SVlDNzNPakE4blNEQ2piSHpCbEhKbFNlaG9tR0N0cU14ODJ0SU5JeGZNelBEOHh5WW8wZGtFZER3WXJITmlvbjMzX1U5QUZVVG82R2ZQYld2VEhLSE5ocnhvVGNKZmgtTUhvSnVCUWEyNDdNdndCeHlFakpIODY4aGg?oc=5
2026-02-27	Yahoo	0.25	Bernstein upgrades Newmont on higher gold price forecasts	Investing.com -- Bernstein upgraded Newmont to Outperform from Market-Perform and raised its price target to $157 from $121, citing a sharply higher long-term gold price outlook.	https://finance.yahoo.com/news/bernstein-upgrades-newmont-higher-gold-143413148.html?.tsrc=rss
2026-02-27	Yahoo	0.225	Metallic Minerals to Exhibit at PDAC 2026 in Toronto, March 1-4 (Booth 2724)	"Vancouver, British Columbia--(Newsfile Corp. - February 27, 2026) - Metallic Minerals Corp. (TSXV: MMG) (OTCQB: MMNGF) (FSE: 9MM1) (""Metallic"" or the ""Company"") is pleased to be attending the 2026 Prospectors & Developers Association of Canada (""PDAC"") Convention in Toronto from March 1-4, 2026. The Company will be exhibiting at Booth #2724 at the Metro Toronto Convention Centre under The Metallic Group, shared with Stillwater Critical Minerals Corp. (TSXV: PGE). Management will be available to."	https://finance.yahoo.com/news/metallic-minerals-exhibit-pdac-2026-193600153.html?.tsrc=rss
2026-02-27	Yahoo	0.025	Should Newmont’s 2025 Earnings Strength and Cerro Negro Spend Require Action From Newmont (NEM) Investors?	Newmont Corporation has reported past fourth-quarter 2025 sales of US$6.82 billion and net income of US$1.30 billion, declared a US$0.26 cash dividend for that quarter, and confirmed 2026 attributable gold production guidance of about 5.3 million ounces. Alongside stronger full-year 2025 earnings and share buybacks totaling US$548.18 million, Newmont committed roughly US$800 million to extend the life of its Cerro Negro mine, signaling continued investment in core assets. Next, we’ll assess...	https://finance.yahoo.com/news/newmont-2025-earnings-strength-cerro-051224304.html?.tsrc=rss
2026-02-27	Google	0.0	Bernstein Upgrades Newmont (NEM) - Nasdaq		https://news.google.com/rss/articles/CBMib0FVX3lxTFBrazFkVXFGLVdjVG1idE1xTU9Oc2FkOXpncF92SUNRcnNwUG9RV0t6TFBjNFRXQ1hvRGVnN1pmMDJvakdPMjNjcG5uYVZXWTZlc1hLRDVPTE96R2pENzk1dEtQMlZDMllwNlp6b1YwQQ?oc=5
2026-02-27	Google	0.0	Bernstein Upgrades Newmont(NEM.US) to Buy Rating, Raises Target Price to $157 - 富途牛牛		https://news.google.com/rss/articles/CBMiqwFBVV95cUxONlRmWDYyR1V1TGxVdkVIaHBzdFB6N0RsWGVsUDVsYnpIbDcyanVxclBjUVg3dEdaUFZMOUtNeXcyWkRuVmpaaEFSemlsSXl0b2VyWWZ6NW1ZQ204TWpOQWxybnB2STlIVU1JS1JDd2dEZDV3YWREcnFqTXJnamp3dE00bkxGUDc0dFJLM2kycmRNLVduLVlTVmF4dmh4Tzh6NDgtbVV5SS03WTQ?oc=5
2026-02-27	Google	0.0	Bernstein upgrades Newmont stock rating on bullish gold view By Investing.com - Investing.com Nigeria		https://news.google.com/rss/articles/CBMiuwFBVV95cUxNdTlYV2dHdTFTZ3FCdEZqclhfWDh1cjF0ZEc1UVlXZ0tUdk5Od3VKMkJMQ05jVVUxMFJyMmpISkg1TElHZ3V1OW9UQVgzNF9RRUxzNnNvQW1MdVVvNVRlcUN6cmRyZ0JPTVpwOTZwckFXMTZCTGk3aXdVUHRVcnhfOTdld1VDMy1SVVVJRFlmN1pDVFBJenZRelM5YmtQTDFNNk1tRDM4TGctMGg3NWgyODBZa3F0SmljUzQw?oc=5
2026-02-27	Yahoo	0.0	CIBC Cuts Barrick Mining's Price Target to US$67.00 from US$71.00	CIBC Capital Markets on Thursday reiterated its outperformer rating on the shares of Barrick Mining	https://finance.yahoo.com/news/cibc-cuts-barrick-mining-apos-161031362.html?.tsrc=rss
2026-02-27	Google	0.0	Mark Rodgers plans to sell 4,443 NEM shares (NYSE: NEM) after vesting - Stock Titan		https://news.google.com/rss/articles/CBMilgFBVV95cUxQZHU0VFBrd1EyNnloUXdmUnMtcWpvYmwyV3AxXzdXZDFuVFIxRlY1bjdDTEcwQ0xSV3oydU5rb2l0aXk2NzdjZGxTV3N2NVBzWUctXzhpVW9peEtGVTBvY0JSN2hBeGpEVjExc0E0QWZBZFhKa01rM09vSzl1bkhNTlNha1dpQjFrQjdXeVdkMjJjQVFjaEE?oc=5
2026-02-27	Google	0.0	Mitsubishi UFJ Asset Management Co. Ltd. Purchases 68,283 Shares of Newmont Corporation $NEM - MarketBeat		https://news.google.com/rss/articles/CBMi4wFBVV95cUxPNFVlZ3ozRnZhT3JGWHhjdXNJWUstNFFzRmswMkVNc2w5UmdqOFM0UWFVcEw2OThQMWtGYVNCZ2RKZG12TkstUDRZRTFvT0pTSmdYTWktQU5oR053ako5a1BZVUJsQ3dmTTg5dmdhR1laamp3UUZEeXBkSTVjY0wzTFF2eGdIaV9HZlVIRDltY1FTYTFFNTJWcW9jYUZNV1d2SzJGOVRWclBKVG1Gd0lrTU5JQlFxdUxtQW9PUTBXdzk2UWJUTTV0UG5qa2ZTaVlmRXZiTGxCcmQ2R2JzdXdKLVBCWQ?oc=5
2026-02-27	Google	0.0	NEM Stock Upgraded by Bernstein, Price Target Raised to $157 | N - GuruFocus		https://news.google.com/rss/articles/CBMisgFBVV95cUxPblQxNmJSR1VET3BEdWNsSU1TZ1ZTR21CbV9WSXhaTE5ZWExNOE1OOXhRSS1uUDR0OVdQZlA4Vk4ycVMxZFEwU3hWMU90MzQ0S1lpSW5veE4tZEd4OGJ2cUxUMVJSc0F6Z0NXRXFsa0xJcjV0clNKZy1wd2xNaTJQWFZOQ29DUjhOaEUwZVMxWnNsVHp3YUEtM29kTUpMQXBZODdtbFdSd0diUXRFOFBtSjNn?oc=5
2026-02-27	Google	0.0	Newmont (NYSE: NEM) MD Rodgers sells 5,147 shares in 10b5-1 plan - Stock Titan		https://news.google.com/rss/articles/CBMirAFBVV95cUxPRkREc2tDWlU3SXNjajBid1N3VzBkU2hldGR5dnpsRE8zcnRYMTNFZUFGNkRscXJHYUZUZDNSVHJBUHQxcnNqemtIWVlub1ZncjRQQjNNSXQxTHkyZVI5M2lueTVoT0txcGx1YW1lTXprUnF6ZFpobmFSSXVsaW52bmtRRzN4dm1UeTZIQ1JjdnFQXzZmbUN3N0lsYjM0bmNLNUxmV0tYajBsVGl2?oc=5
2026-02-27	Google	0.0	Newmont (NYSE:NEM) Shares Up 2% After Analyst Upgrade - MarketBeat		https://news.google.com/rss/articles/CBMipgFBVV95cUxNbWpXMm1aaVJxZjh3VVpsR0s4RWxaTWxxaUpqb29RdnhITnhPZUtoQ3Vsdmpmd0ZFMHJKcUgtN2t2MHpOU0lST0QyNlpCNTBNcXJXSk9qQ0stNTlaTE5vaTFoYlVPNVJUb3hLZXVOdjhwbTV4ZnZKOVYyVXRvempUZEdta0JZZmRGOExKZ0ZCOHJqMTNxWThKMFNYazl5TXF6XzZCNWhR?oc=5
2026-02-27	Google	0.0	Newmont (NYSE:NEM) Stock Rating Upgraded by Sanford C. Bernstein - MarketBeat		https://news.google.com/rss/articles/CBMitAFBVV95cUxPOW8wTTdUZ3gwUDlKQTk5Nl93TmJGdUtLeGs5UVN1SmVfeHQwS3JRVjVZMFNHV3JLMWR6U1ZZV2NNNVgzNkJSN0pXYjluSXktYUdtSDhCdVRFczEtdzBwR0podjRIQXJXYUk0Q2RUdWs0bnFiYlFaWHZ6UmcybUUzcmVhYXZnM0JaOFc5Qk5lZHU1WVZ2ZTE4a1Q0N3hXLWZzLVh2MVRkdXp5U00tZnFOSWlPTlU?oc=5
2026-02-27	Google	0.0	Newmont Corporation $NEM Shares Purchased by Erste Asset Management GmbH - MarketBeat		https://news.google.com/rss/articles/CBMizAFBVV95cUxOUkgySW1KczI0QllLeldSLUZaVDdfQWVHZmZyUzg2TmVJdWdtcHNsV28takl5LXExZ1JsMFFPRm5VcGM0anRFb19hUDFNazR2T09UX0M0eThNZ3dGanhTQjhxeTR5TmRDbmZDMmtTM2V0QVgxTzJKbUY5OVUtWnFhaURPakwtc216QkZtb0lBaWQxOVhpNEFpSmUtQmlteEw2MlpsUUkyanNWUnFsNEVQZG0wSU51WUt3Q3hqV0UwX1FzME1zdUcxYzF1bWo?oc=5
2026-02-27	Google	0.0	Newmont Corporation $NEM Shares Purchased by Gemsstock Ltd. - MarketBeat		https://news.google.com/rss/articles/CBMiugFBVV95cUxOVVZqLUQwZ0tUaEs4UkFXYzVHUmhmeExoMXlhd283Y1VmZUJYZWd1WWx0N0VKRjNDQTlUeXAyX21PVU5GLUZVY3h1VEotSzIxUkN4TTczSy1ZRjdjUWpwUVU5dzl0dW9JaUZYTmJyV01WYnphb1BMZ01mX0tXYzBSRW8yc3dFSzhiYzB0Qk50amViVEpKRnUyc3paMlh6Tzlyc0RQalBxWlZxdkFVMDJLQ0xDaEEzQlg1RWc?oc=5
2026-02-27	Google	0.0	Newmont Corporation Registered Shs Chess Depositary Interests Repr 1 Sh Trade Ideas — ASX:NEM - TradingView		https://news.google.com/rss/articles/CBMiX0FVX3lxTE1jNTJJaF9TckdYZHpvS3lBTHlRLVhNXzdubnhUVFByaml1aGExSzNxOVBFNzExaVo3UWJqbU9WWE1veWdlVG1JWEFuRU5wNmVHTVFiem16ZkcwM3g1UXpz?oc=5
2026-02-27	Google	0.0	Vestmark Advisory Solutions Inc. Lowers Stake in Newmont Corporation $NEM - MarketBeat		https://news.google.com/rss/articles/CBMizAFBVV95cUxNQ2lWRnVxWndTd3hadVZXcE5heGNFY3hCWmhYbHhvS29qc0dzTTdtOFFmdmRPWFloa1ZKbURBWVNpV05DTDBZRExRNUZEbklfNHZwMTBnSFdNX1JHb1B5UUFHbGczWENyd01ma2J4eS04OWNPTW52djdEamR6V2pSUjNwQTYtQy00Qy1Fb3ZtOEFuc0lyLXBMb2Q1NGhJOFFZYWVpTkV5cHI2N09kMWZUNzVqQkFyb0xhWUVjQ2I5dmRhOFNhRzJuUV9pNnA?oc=5
2026-02-26	Google	0.433	Newmont Ends 2025 Strong — 2026 In Focus - Forbes		https://news.google.com/rss/articles/CBMioAFBVV95cUxOd1l1ZmlTUWJ5bkpOYmI0NXhMbGQ4a3p1dEswRHEtOGRJeUFCR3NORmxlODV6R1NGSEFaUFR4V2l6WFBXUzVjRGZ0X3RnM3M5RmtzRFhtRWhBTXF1VnhwTmRaYlY4bUFvZjJYWWg3WHFZQ1h0dWdobHA5Rm05dktwN21CSjNJV1hJZTFjTU81eEF2REY1aWJCRG9EQS1OdC01?oc=5
2026-02-26	Yahoo	0.25	Why the Market Dipped But Newmont Corporation (NEM) Gained Today	Newmont Corporation (NEM) reached $127.47 at the closing of the latest trading day, reflecting a +2.1% change compared to its last close.	https://finance.yahoo.com/news/why-market-dipped-newmont-corporation-225002549.html?.tsrc=rss
2026-02-26	Google	0.0	Intech Investment Management LLC Buys 51,060 Shares of Newmont Corporation $NEM - MarketBeat		https://news.google.com/rss/articles/CBMi1AFBVV95cUxPeWdJZjhNVkhhUVdObUttZHpPWUJsa1FiMHZDeE5BX21ET3A3VUVPZ3o4cHVXZ3c4UC1RdUU0YTVGQms0NVowZnYxeVNjSjBYcGo4aV9Bcm9uVEs0VWNHRXZKTXNQOExvSXNjUENMcG94T0MtWDluUU1rdVlyWEthSkk4Y182Snc4d0ptOEkyd2FoTENSbXp3dTVCQmhNb1l5alRNOC11U0I3OF8zY2hJQS1SdmZMUTItakVHRkJDc2lpWFo2VmtGd1V2VjdVQVdRVUN2Rw?oc=5
2026-02-26	Google	0.0	S&P 500 Analyst Moves: NEM - Nasdaq		https://news.google.com/rss/articles/CBMiZ0FVX3lxTE5maVIySG9vODEtMmwyZW9VbGpiSkxYQ1d6cU52V2VsejRoMy1MUk9sRzllUC1IRS1GSkxFMEk0akpxNkJrbEh2MU83VmpwdnBRYTIxYmtlSnVPRVItUnpWMzFxcEU5bDQ?oc=5
2026-02-26	Yahoo	0.0	Should you invest in gold?	Geopolitical tensions and uncertainty over Trump's tariffs are driving gold prices	https://uk.finance.yahoo.com/news/should-i-invest-gold-prices-123542208.html?.tsrc=rss
2026-02-26	Google	0.0	TD Asset Management Inc Acquires 69,882 Shares of Newmont Corporation $NEM - MarketBeat		https://news.google.com/rss/articles/CBMizgFBVV95cUxObU9KQjNGSi1UbmpUUXNMdktCSmlxMWF2bkpCemFWMWVjZ3JlTGsyWnhwV092LUlQdk9FbUtxbDltSFJOdnNxLTNnRU9sbXFBMFNjY0pJYVRVeWRiU0tTVWdPS1dKbmtKOFA4RE5tRzBORGw0MjllZ05sQndvSDhsbTFBNmpMZXB3VTQ0aDF2dTl4V0ZUSjhWemVoVmZVT3lVcnRueHlJd0xFSHZYamlKcTh5UW5zWjJtdGlCdDRCSGJIdHptc2pmWDRJNWx6Zw?oc=5
2026-02-26	Google	0.0	Why the Market Dipped But Newmont Corporation (NEM) Gained Today - Yahoo Finance		https://news.google.com/rss/articles/CBMiiwFBVV95cUxQeTBpUG9CUTkyeTZWYWZORXVYbVJ4LWkycmFUbWJPeGRwTmF3c3dZeGVCTXVDVmpXc1dwNjFQQ3ZPaEJ0Y3ZRUzlOQzNaTUR1MDYtVUYxdDZ2Qk1BeFhieDRrVjV6eWVVTXpRUzFrZGNtNmhBWVZEQmpycmZna05LRVRQUHo2Y3BvblZv?oc=5
2026-02-25	Google	0.443	Should You Invest $1,000 in Newmont Corporation (NEM) Right Now? - The Motley Fool		https://news.google.com/rss/articles/CBMilwFBVV95cUxOcndvc2hqVGlzVE5vNEw5VEdpSDB3QlVxNkJYZHd5ZEd4OHQ3NW10SjM1Nk5mZ2Q0bGdIbU5TQjlkV3lZNlRCT0kwWFdSMVc1b1doUFdXYktXb2R2ZHVZZ3EwYWdWOFNiaG5RRVFwZEdhdDFDeVY5aTUyWVhFc0t6STJjU3g3aUp1aHBoazJuWjA4bnRLcV84?oc=5
2026-02-25	Google	0.4	March 2027 Options Now Available For Newmont (NEM) - Nasdaq		https://news.google.com/rss/articles/CBMiggFBVV95cUxOM3k4LTV5UlRpQW1JblpkVTNMRk1mbTFfNHhSaklsMXV6TjlpM0NFSlhzZjQ1bUROMHNUQVhXVlNfeVFydmJXbmpNMEhhS0hNai1iNG1lU2xBbUNYdFBDcjVCRHVvb1pRMVJsVE5IOHhkbDExQmI0UDZuNXNHazA1azh3?oc=5
2026-02-25	Yahoo	0.393	Should You Invest $1,000 in Newmont Corporation (NEM) Right Now?	Gold stocks continue to look increasingly lustrous in many investors' eyes.	https://www.fool.com/investing/2026/02/25/should-you-invest-1000-in-newmont-corporation-nem/?.tsrc=rss
2026-02-25	Google	0.286	Should You Invest $1,000 in Newmont Corporation (NEM) Right Now? - The Globe and Mail		https://news.google.com/rss/articles/CBMi2gFBVV95cUxPaW1BZmgyLTRZZDZNWDFzelVoV0NXTUlKSEM3d09xSVhXbHZHa2JHYlNMUE5WeUdFN2VsTzc3TXVzdFVwOUh0RWxtMWRXeW91ZnNzLUhVUm9CalcxNmdFMndQcmNrNEJ6RTh5ODMyckNfYmxlTmh2U1BSQkwyMjQ5TGxTdjJLZGtHY3hFRFVTbU83R3lJUGZ3ZmVDYU0tQWhTYWtnUUdEbTJDaHFOMzNVS0E1VDlzd28ydGZzc1VuQWg3bDZzTTFwTHYtYmdCY18tR0IycWFnQ2R3dw?oc=5
2026-02-25	Google	0.286	Should You Invest $1,000 in Newmont Corporation (NEM) Right Now? - Yahoo Finance		https://news.google.com/rss/articles/CBMihAFBVV95cUxOVkJKb2NnXy0yU0NidEhoQ2RYOFdoN1E5S0NqelUwTVVieVNxZEgwZmRndFVaczZWQ2Z6X3NpQ3Y3UWdtQ2drbzVXN2xuS3dZaHJzd09fdG1rb0JHNXRlQXg5UklqYTlwVnRMSXdZS1RlN2RRYkZVRFIwRlJhbWdlb0QtdmY?oc=5
2026-02-25	Yahoo	0.146	LIFT Appoints Jeff Reinson as Senior Vice President of Development	VANCOUVER, British Columbia, Feb. 25, 2026 (GLOBE NEWSWIRE) -- Li-FT Power Ltd. (“LIFT” or the “Company”) (TSXV: LIFT) (OTCQX: LIFFF) (Frankfurt: WS0) is pleased to announce the appointment of Jeff Reinson, a seasoned mining executive who brings over 25 years of project and engineering leadership experience to the role of Senior Vice President of Development. Mr. Reinson previously served as Vice President of Operations at Burgundy Diamond Mines, where he oversaw the 24/7 operations of Ekati Dia	https://finance.yahoo.com/news/lift-appoints-jeff-reinson-senior-080500312.html?.tsrc=rss
2026-02-25	Yahoo	0.075	The U.S. Just Took a Giant Step in The Rare Earth Race With China	America’s rare earth weakness isn’t about digging minerals out of the ground; it’s about rebuilding the complex processing and magnet-making capabilities that power everything from fighter jets to electric vehicles.	https://finance.yahoo.com/news/u-just-took-giant-step-145900935.html?.tsrc=rss
2026-02-25	Yahoo	0.0	NEM vs. AEM: Which Gold Mining Giant Should You Invest in Now?	Newmont and Agnico Eagle strengthen their positions with rising cash flows and project expansions as gold prices stay elevated.	https://finance.yahoo.com/news/nem-vs-aem-gold-mining-135600493.html?.tsrc=rss
2026-02-25	Google	0.0	NEM vs. AEM: Which Gold Mining Giant Should You Invest in Now? - Yahoo Finance		https://news.google.com/rss/articles/CBMid0FVX3lxTE1FUkw3dTBlbWxvWjFLTGc5UUlGdnZZdDFFMUtMc1YtLTYyeEd2OXBTRmFGYnp1b0ZYOU4zcmc1M05aMzVEUGtOSExhc2JwMVBGdkZmdHZzQlZSNlc1U3BTU0ZZSUFjQjhMcVV2aGJuX2xZVHg0U1Nn?oc=5
