Date	Source	Sentiment	Headline	Summary	URL
2026-03-06	Yahoo	0.467	AU Registers 72% Y/Y Surge in 2025 Revenues: More Upside Ahead?	AngloGold Ashanti saw 2025 revenues surge 72% on increased production and gold prices. With strong assets and rising metal prices, can the momentum continue?	https://finance.yahoo.com/news/au-registers-72-y-y-180700770.html?.tsrc=rss
2026-03-06	Yahoo	0.322	Top Research Reports for Procter & Gamble, American Express & TJX	Procter & Gamble faces margin pressure, American Express wrestles with credit costs, while TJX rides strong off-price demand in Zacks' latest top research reports.	https://finance.yahoo.com/news/top-research-reports-procter-gamble-215100908.html?.tsrc=rss
2026-03-06	Yahoo	0.103	Is Newmont (NEM) a Buy as Wall Street Analysts Look Optimistic?	Based on the average brokerage recommendation (ABR), Newmont (NEM) should be added to one's portfolio. Wall Street analysts' overly optimistic recommendations cast doubt on the effectiveness of this highly sought-after metric. So, is the stock worth buying?	https://finance.yahoo.com/news/newmont-nem-buy-wall-street-143004415.html?.tsrc=rss
2026-03-06	Yahoo	0.083	Newmont (NEM) Upgraded to Strong Buy: Here's What You Should Know	Newmont (NEM) has been upgraded to a Zacks Rank #1 (Strong Buy), reflecting growing optimism about the company's earnings prospects. This might drive the stock higher in the near term.	https://finance.yahoo.com/news/newmont-nem-upgraded-strong-buy-170005667.html?.tsrc=rss
2026-03-06	Yahoo	0.051	New Strong Buy Stocks for March 6th	TFPM, NEM, INNV, MGA and HAYW have been added to the Zacks Rank #1 (Strong Buy) List on March 6, 2026.	https://finance.yahoo.com/news/strong-buy-stocks-march-6th-100900097.html?.tsrc=rss
2026-03-06	Google	0.0	Longfellow Investment Management Co. LLC Sells 41,000 Shares of Newmont Corporation $NEM - MarketBeat		https://news.google.com/rss/articles/CBMi3wFBVV95cUxNdWJXUkNSS1lyWTUwbU5aSktHWjl0c2NodlBJemgyVFlzb1lNTDgtaHZrODhpcnFTRDU2dURvOEZWS2lna2ZVMzI0WHg3VjAzSFFRVlBJZExCLUVmOVdxLUllNFJ5RV8yOWJsU19zbFhZczFHUHk3ZlF1RGdkb3p0ejVSYUNfRHFJNWpPV0pXbXZIOUhYSzFvQlBxWFpMRXVpN3FLRWJjMHFJYjFlSlRob3RRdmtXSVJhUmU1WktJbGZPc0VmNENsOUNuYmYydUhRdDZoYXBfWk9yN0JJZ25V?oc=5
2026-03-06	Google	0.0	Newmont Shares Plummet Amid Falling Gold Prices - Intellectia AI		https://news.google.com/rss/articles/CBMiiAFBVV95cUxPVG10LTFLTlZORzlQVll6d19fbEZTYUE2anNjbVljSDhpRnFySkJHMzFVZG9vcGdnRXZqU1VSMW9CVFNXTkdCbHBVck56NFpBRzFRQjRkR2NVXzljclNWaFlXWlJXMWltMVlxU2tRY2huMHdTZkpNSG1TWU5QejhMcXB0RnlRTjZv?oc=5
2026-03-06	Google	0.0	Newmont’s Cerro Negro Expansion Highlights Valuation Tension And Gold Market Risks - simplywall.st		https://news.google.com/rss/articles/CBMiwAFBVV95cUxNRDBXUWZ4Q09XRUNFYl81UjNROVEya29NVEV0WWhCRm80NDllVWg1ZjJYZ1c0bWtBel94U0xXRi1lQ2dYd1FkelpzMUxERHFmRWtUMXZVYmJhc0hkVmhaZ3dNM0R0VE5RZWNQRjR3REVfdGNTMmhRdVg4RXRPWW1Wb1hlaGtuc3RJVjRoak11cmExLVRjZDFFWGpGTW1UMmJ5d3ZNM21RSjU1c055OEpmS0dOc19zMFRlckNlLUx6MkbSAcYBQVVfeXFMTnFNMFY1bHppTkNtYkdQUWdHcUpGbFdRdTRFNHlkaVBRMDJ6OUVFVDExeVRIX0ZCcWZ0OGh1WTdwWXNwcTUyNTJJaTRES285UTVVT3QzZnY5QmxMX1owX3VVMUo4RzZxa2JLRlQ1TDlmYXIyc1hCdHg0VmJBSGk4Q0Z5TXdPRzBReXNDd1NPUGI3UUtlblNYNFF0VTQ4Y1hvTGJRcmxMa20tbndrTVlEUmlTWVlMQk54bTZuTTFsTXc4SmpBR0Rn?oc=5
2026-03-06	Yahoo	0.0	Why Newmont Stock Dropped Over 10% This Week	Should you buy the dip in the gold stock?	https://www.fool.com/investing/2026/03/06/why-newmont-stock-dropped-over-10-this-week/?.tsrc=rss
2026-03-06	Google	0.0	Why Newmont Stock Dropped Over 10% This Week - The Globe and Mail		https://news.google.com/rss/articles/CBMixAFBVV95cUxQbDVyYVFmMDBxUXVXcHVlcWtSRF9mcmpULXV0TV9wUk5sYzNYcXJ4ZmpnLTB4akw3OVhlY292T1UtZF9aU2NxWElua2l4c1lxeU8wTFhPYjhjRVpUaFhLVTF4TWVLbHAwb2IxZ3lNZ3hmMUd6eHJncjY2T0llRHNtN2lidDdTVE1aLWhneWlYc0tUWGpuTHdVUzh3NFVuRkdRVjdGRGUwUWx4WllNSTZhS2VucG9kTnNBN2FhbmNhc01UdDJj?oc=5
2026-03-05	Yahoo	0.5	U.S. GoldMining Appoints Imola Götz as VP, Project Development	"U.S. GoldMining Inc. (NASDAQ: USGO) (""U.S. GoldMining"" or the ""Company"") is pleased to announce the appointment of Imola Götz as Vice President, Project Development."	https://finance.yahoo.com/news/u-goldmining-appoints-imola-g-113000485.html?.tsrc=rss
2026-03-05	Google	0.5	Why Newmont Corporation (NEM) Dipped More Than Broader Market Today - Yahoo Finance Singapore		https://news.google.com/rss/articles/CBMiiwFBVV95cUxQVkRMdHBkaEFxLU9uQ3lLaTdlM25kWWN3MDFSdUtTTFdYZHQ4ZFlrS1BaVzJvU09SSW8tbjBvaExna055ZkdxRlBlUGxMV185SkZ1ajB3Y0dubWhBTFJTb1EyVHpXaFJxamt0dTJVTHJwaTRUbDNkaDJhYW5JaWJxb2tTcVlVaHRVbEFz?oc=5
2026-03-05	Yahoo	0.342	AU Surges 279.8% in a Year: Should You Buy, Sell or Hold the Stock?	AngloGold Ashanti's stock has soared 279.8% in a year, fueled by record EBITDA, strong gold prices and rising production, but higher costs could affect gains.	https://finance.yahoo.com/news/au-surges-279-8-buy-165300762.html?.tsrc=rss
2026-03-05	Yahoo	0.32	With Iran Sending Gold Over $5,000, the Best Gold Stocks and ETFs to Buy Now	Gold reached an all-time high near $5,400 following reports of joint U.S.-Israeli strikes on Iranian nuclear and missile sites, threatening oil flows through the Strait of Hormuz. WTI crude surged to more than $76 per barrel, its highest level in more than a year, amplifying safe-haven demand. With some analysts targeting gold well over $6,000, ... With Iran Sending Gold Over $5,000, the Best Gold Stocks and ETFs to Buy Now	https://247wallst.com/investing/2026/03/05/with-iran-sending-gold-over-5000-the-best-gold-stocks-and-etfs-to-buy-now/?.tsrc=rss
2026-03-05	Yahoo	0.283	Should You Buy Barrick Mining Stock After a 61% Rally in 6 Months?	B's 61% surge rides on record gold prices, steady project progress and a strong cash position, though higher costs may curb gains.	https://finance.yahoo.com/news/buy-barrick-mining-stock-61-121700217.html?.tsrc=rss
2026-03-05	Yahoo	0.147	Why Newmont Corporation (NEM) Dipped More Than Broader Market Today	Newmont Corporation (NEM) closed the most recent trading day at $116.09, moving 2.75% from the previous trading session.	https://finance.yahoo.com/news/why-newmont-corporation-nem-dipped-225003980.html?.tsrc=rss
2026-03-05	Yahoo	0.034	AI Stocks: The HALO Trade As A Hedge Against The AI Sell-Off	"After investors spent years pouring money into AI stocks, the newly coined ""HALO"" trade is gaining credence on Wall Street, as a hedge against the impact artificial intelligence is broadly projected to have on the economy, as well as on stocks.  An acronym for ""Heavy Asset, Low Obsolescence,"" the HALO trade aims to help safeguard investors' money as a new sort of safe haven: companies whose assets include huge and long-lived physical infrastructure.  The HALO trade includes stocks like Newmont, "	https://finance.yahoo.com/m/3b840792-2f5b-3ca6-ab8e-419c1767d4bf/ai-stocks%3A-the-halo-trade-as.html?.tsrc=rss
2026-03-05	Google	0.0	(NEM) Volatility Zones as Tactical Triggers - Stock Traders Daily		https://news.google.com/rss/articles/CBMivgFBVV95cUxNblpmbGQtLWc4V19qZEc0Mk9tbTRrdUVaV09WbTREaDVFTlQ1czdfYWZhZElyWG0yeXB1eW9fZUx6TmNCV1NvNFBxQzRPN2F6dUhPZmJFakkzMkIxMjdBT3VLTlg2TGN2QTJ5Vl9WM3pDcllOQzJ1cExZMjlpa0N2U2ZrRmN5UzA5TGxsODlrcWUwRkdEZTJ2cWkzMGF2bEdST29mZTBUMVNhRm40cXVGUXhnS2V3ckx2cnExd09B?oc=5
2026-03-05	Google	0.0	Applying Peter Lynch's GARP Strategy to Newmont Corp (NYSE:NEM) - ChartMill		https://news.google.com/rss/articles/CBMirwFBVV95cUxPOVBHSUgteFNSb1Z4Ujg2WjFsTEhscXRicnc2aktXSjZFOTNQME45VjlTYlpPR0VNbENxNUR6ZU9CUVZNRDgwbjZDU0xHaFF2djFUeE5Ndmg5LXRFb0tHcDI0b2xXVjFFVF9BX29KN2Vya2JYTHkweVZBS0lmOGRWbVlRUkhuVGNzYkw1UVNYSUU5X0cxbXJoQkZBcVZzNTdVSjNYd3NSaVZpaEIxLV8w?oc=5
2026-03-05	Google	0.0	Level Four Advisory Services LLC Has $2.86 Million Position in Newmont Corporation $NEM - MarketBeat		https://news.google.com/rss/articles/CBMi3gFBVV95cUxPc0xSdWxycEs5enRCN1k4TkFPS2UtbDlRLWZuV0J4NE9TSlMxVjl2YVJvMy1wbVBfNXRVeV9RNHQtYVdYcVRONkVoNTRucHF5VzRxTTVGemdISWVqVDRFdDBWNVRhM2hwVDJUN0JtLXhnVnUwd2F6WlE1d3lleS1wSk82clZTQXpweWlud2lvMTRDSHlDUlAzT2VRRUltSmxuYzJPVlJYXzdoWm5sZkw5dk9mU1gwT3lJWm5aR3Y1cVpVXzdrVHZFZmRCNVJGYmJKcHQzVEJFVzI4WXVOZmc?oc=5
2026-03-05	Google	0.0	Moree Solar Farm tops NEM capacity factor leaderboard - pv magazine Australia		https://news.google.com/rss/articles/CBMipgFBVV95cUxQb0ctVk1veXJKd2dNVjlNU2VBTjAwXzhoZ1UtTERqZVI0Zm1IbTNoTmE1eUF6Uy16R0N1RVhoVGp0a2Q0SkpHMlQxcXIyVl9wVkU0MlB0M0V6c0U3eGxrZ0xockRpNmZFbDVtWjN2OFV4Y00xVVZMbFl3QlR5SDQ3R3RhMmZKVDJpZjc5NHVCOHZieEpDbGM2dmRnZFhyNExGZGlndjln?oc=5
2026-03-05	Google	0.0	Should You Buy Barrick Mining Stock After a 61% Rally in 6 Months? - The Globe and Mail		https://news.google.com/rss/articles/CBMi4AFBVV95cUxQV1hMOGR4dnR0REYwNDNMOTRiZm5VN1NMR0d0ZVFwYUhFNlA3UEw3UGNNSlU2M2d2TUtlSkw4cnFibDhuOHhFSzZkNkNVR2k4ODdrNFhUOHZ3aHNCemtrVzJNczAtb29DWmVSQnRhb2xGYk9YenVNemNmWWVla0FpM0kxSUFVeVN6UFRGWmxJSzFqNEh3QVJFZkw5YU9RQXlGaTcwRVZhYTNrTFM2OXdLZ3Zfclg0VXI2ejBhSm51NF8zWVpxVGRhZzNqVGRuWG9JcFEzNVBSWTR0angyd21fNQ?oc=5
2026-03-05	Yahoo	-0.067	Gold Stock Newmont: Set Up For A Potential 35% Return In Weeks With This Strategy	Gold stock Newmont has the potential to generate a hefty return in a few weeks using an iron condor trade.	https://finance.yahoo.com/m/8fb77885-b700-35b8-beef-d0810a58d0d9/gold-stock-newmont%3A-set-up.html?.tsrc=rss
2026-03-05	Google	-0.125	How Is Newmont's Stock Performance Compared to Other Gold Miners’ Stocks? - FinancialContent		https://news.google.com/rss/articles/CBMi1wFBVV95cUxPS3FmR3pnZUNGWlRxZjBZY1BnRHZHWXlHN3NLUDdKengySmFUdzBnN2ZxYy04ckdCYzJ1OVZIUW1HSkxqSl9nYm55MzFCclI0aXNSNjF3SEdEdlFqYXVuWUJfaDBNRXpYeVkzb2pVVi1jdWJlUUVVTm9WcGYyZlFuYzNnY25hMldDUVVaWGVHSGxJYTZyQVhXdlEyQkR6Wkh0QVFuWE53bkF2N1U5QmFxVExVd3RfVWs1a3pOYjFUaWFKclZVOVkwZmIycjV5d0xPSkRSek52dw?oc=5
2026-03-05	Yahoo	-0.175	Newmont’s Cerro Negro Reinvestment Reshapes Growth And Capital Return Balance	Newmont (NYSE:NEM) is committing $800 million to reinvest in its Cerro Negro mine in Argentina. The company plans to restart and expand Cerro Negro operations, with a focus on extending mine life and exploration. This decision comes as geopolitical tensions keep attention on gold prices and the broader mining sector. Newmont, trading at $119.37, is at the center of investor attention with its Cerro Negro reinvestment. The stock has returned 17.9% year to date and 5.8% over the past 30 days,...	https://finance.yahoo.com/news/newmont-cerro-negro-reinvestment-reshapes-111213903.html?.tsrc=rss
2026-03-04	Google	0.35	Newmont Backs Cerro Negro With Long-Term Spend As Valuation Looks Full - simplywall.st		https://news.google.com/rss/articles/CBMiwAFBVV95cUxOVTZPV3N1MFhmMEMtQUxyOU9lSVFfejBsY2RzRTREaDc4cU8zQ3cybzM5Z3NNbmgyTXg0WGgzeG5wN3VpRTlkeW5DeTIzNVdrUXV0MURndElaUUJZeS1EaUhRT0hhNjJlNmZUMTRXX1ZtdlZQNWxnamFiZjBsdjRYaXZTUjRnT08tUi1LZUt5ZmZucmZwWU50QUJmbUJNQndhaXBlcy1wRGRnX29wZVN0dDQtaWdoSkthZnJqUGx4RjXSAcYBQVVfeXFMT0pZTjNpcmpRX0RDNXZKcWJ6UmhhS2h1TUkyRkZESFhQaXk5c2ZFZ3FiMkJXZWoySWN6RDNyU3BjRjdqZVZzblJqMnhaVElmMGhsZXB3dUo1ZF9hdlVXWnhENUVidXhYRUdFUERLdW4wUDMtb04yNTF2b01qeGE2ZW5LVFZGbTZXS3lpT0FrS2RINjBiWVNjZFBFc2RRLTN1dVBVcE0tMk9aOWNXVjlMZzh1bEYzcTNDQ0pNVEhPMlZWUkp5c2l3?oc=5
2026-03-04	Google	0.0	CI Investments Inc. Trims Stock Position in Newmont Corporation $NEM - MarketBeat		https://news.google.com/rss/articles/CBMixgFBVV95cUxQLUFocEJya1BobEtITlJjSUpVR2tRcmpITmJCcWxBcS1EeDd4OWNEWXdVb1I3NVNURWMwZE1VWVNtVUczTGhJZlNISHhIN0o3LUNxem9nZkJCZVQwV1g3VjBQM1A0WURvbGFTMmJjVl8xTXZwS3BTMno0MXdrUXpqalNqRzV5RGZDampxNlRkcEFzaFEtakdXamRMVDhGbmJZMUdZRnJxSXN0NlRRWDJTYVFiaXlVcUxOWjkxN3IyU2swaTdPS0E?oc=5
2026-03-04	Google	0.0	Check Out What Whales Are Doing With NEM - Benzinga		https://news.google.com/rss/articles/CBMingFBVV95cUxNMHptQTQ0TzdxMW9HbzljaGstLUlLS3lMemM3eDdaWFphV3YzQnJCM0E3NkhXd3lkX1FMU0ZaMi1PR0xmZ1lhc1RBMzBxZHNmTmx0NWZURVVSQ2gyVmZuNVRUN3hPYnd0T2EzWHVBVW5uaEYtb3I5eDEycExMdTZNZGVGdDEzM3ROS0x3SVZkQlY3SFlxYmg5djBjTmtGdw?oc=5
2026-03-04	Google	0.0	Newmont (NEM) executive Rodgers sells 1,361 shares in 10b5-1 trade - Stock Titan		https://news.google.com/rss/articles/CBMirAFBVV95cUxQMmc3SktBV2VSd3ExczVYT3FlMHo3dWd5anB0RE5EendPZnUyZlY3RjhBM05Oa1FVWTFDanVxYTl4S0JXZG80RHpUeUVzRDJVRzZTTGRxNVJnbTZwMkstUTNzcUxQTTFCUUg5NFl2M3J6OHNhRlRNSi1jcUxsUEN4U2ZVRjZKV1ZjZnk4cGFKT2diRWtOcUktS25lRWJPMldFSWNWTUJpbThBUEZE?oc=5
2026-03-03	Google	0.4	Assessing Newmont (NEM) Valuation After Analyst Upgrades And Record Free Cash Flow Results - simplywall.st		https://news.google.com/rss/articles/CBMiwgFBVV95cUxNVG1oQWxQRGlKRkF5TzZ2dTRFLXJPQnZEOVZndzVweHJsY0pkdG43bEFrOVhkX2pITmU1em5kdTNtUlI4V0RUS1VrcnF5YXJDdjg2dng2Q3UzTWRIaG1FX1BCdkplX3VaTlJWeVF5LThwTUNvZHBEZ3pjY3dPSlo2X05hbno1UXZOdUtsZlZmRi1SWWt6VzBBa0R1U2ZfMEUtcGNha1RGMHF6TXFVaWF3Y3J0NFdsQ21yN2tBUDdzbmRnQdIBxwFBVV95cUxNWFRxZW8zc1MtU0RVbjNFcW5yYkEtS2EwQ19JWGFLUjVUUDdBd2Z4TE9xendLX3cySGY0Q2JTcG9XLWFFWmRpaVVJQ3R4SnRSSUpLdnhsWmwtZ1ZvLWYwVnZVYW51dVlzTkNsR2lzZzZ5Mjljb0pnSVhEc0NxU1draEtsd2hJSGJkTUNyc2FDbUhXRGhZbEhuR2NiNVRmcDJXaVgyYUlfNHV2TkwwdFZpd0NRU1ZScnN0LUNSRjlqRFhkNl8zR2dB?oc=5
2026-03-03	Google	0.25	First Eagle Investment Management LLC Decreases Stake in Newmont Corporation $NEM - MarketBeat		https://news.google.com/rss/articles/CBMi2AFBVV95cUxPVnBfc2pfV2lnenA4aGJ2bzJ6UEVtWTFzeXNJbG93WTVHQkVwNnR5MGZXM3RnU0FlQ21obUhGOUNsOFFHbEpycVc2S1dXWm9jR3h2eUpWeGN4R3hObnJzY1BGVDRQLWpDT25WVklaWS1nWHRjZFprblRCQVMtX3NsMVl0WEFMdUttSjdteVBhVmFJZVRBbldhZWdsOFhSX3BlRHJZOW9KcUtFaFpKUEl2Ym1kVnlMSzEwT09JNGxRUndsZTEzc1MwVmY0bmNLYjdQSDQ4MHNLUDU?oc=5
2026-03-03	Yahoo	0.25	Middle East Conflict Circles the World’s Markets, Stirring Fears of Stalled Growth, Inflation	Oil prices jumped before reversing course after President Trump assured safe passage for tankers crossing the Strait of Hormuz.	https://finance.yahoo.com/m/f2e3badf-a7e9-30c9-82ad-8fecbe3f7981/middle-east-conflict-circles.html?.tsrc=rss
2026-03-03	Google	0.136	Newmont (NYSE:NEM) Given New $150.00 Price Target at Citigroup - MarketBeat		https://news.google.com/rss/articles/CBMisAFBVV95cUxPX2dqcUF3QnZ5Q092cFJmTFpJMXNHSy0zODRfSDhIemZBQ19EdkdIQ3FCUXlJaElRNW1RNGtpSWVqZjkwOUhuRVhtNmtrYmZLdmMzT2Mxb0pEa3dBVmFCbVM3M0V3ZDN6NW9WTkZuSlJVdGJJWHlUT3FOM09hOGZmV21FYkJJUG9rQ1hZbkJEMnVqbEk3RXNsamtaQ0dQUWtPNFUxSnhoT1FCYlNnOExGcg?oc=5
2026-03-03	Yahoo	0.108	3 Reasons Gold Prices Are Falling Despite an Escalating Iran Conflict	The price of gold pitched lower early Tuesday, even as the war in the Middle East ratcheted up.  Front month gold futures fell 3.5% to $5,107 an ounce, snapping a two-session winning streak, according to Dow Jones Market Data.  Gold’s decline would appear counterintuitive since it is typically thought of as a haven to geopolitical risks.	https://finance.yahoo.com/m/d5a2a055-ad8a-346e-95ed-7a7ccb6bf2ef/3-reasons-gold-prices-are.html?.tsrc=rss
2026-03-03	Yahoo	0.1	Why Newmont Corporation Stock Just Dropped	Troubled times are supposed to be good for gold -- but that's not how things are working out today.	https://www.fool.com/investing/2026/03/03/why-newmont-corporation-stock-just-dropped/?.tsrc=rss
2026-03-03	Yahoo	0.089	Is It Too Late To Consider Newmont (NEM) After Its 209% One Year Rally?	If you are wondering whether Newmont is actually good value at its current share price, this article will walk through what the numbers are really saying about the stock. The shares last closed at US$128.73, with returns of 3.6% over 7 days, 14.6% over 30 days, 27.2% year to date, 209.7% over 1 year, 216.3% over 3 years and 165.3% over 5 years. This performance has put valuation firmly in focus for many investors. Recent coverage around Newmont has centered on how this performance fits into...	https://finance.yahoo.com/news/too-consider-newmont-nem-209-043724328.html?.tsrc=rss
2026-03-03	Yahoo	0.019	Freeport McMoRan Stock Slides as the Mideast Conflict Hits Commodities	Freeport McMoRan  stock plummeted Tuesday, along with shares of other metals and mining companies, as commodities declined in a risk-off trade tied to U.S. military action in Iran.  Benchmark oil prices jumped about 4% by the end of the stock trading day, stoking fears of inflation and reduced economic activity.	https://finance.yahoo.com/m/c44d180d-8382-3142-be80-a547d3e19793/freeport-mcmoran-stock-slides.html?.tsrc=rss
2026-03-03	Google	0.0	15,000 Shares in Newmont Corporation $NEM Acquired by Strive Asset Management LLC - MarketBeat		https://news.google.com/rss/articles/CBMi1wFBVV95cUxQSEhkU2o5cmFfRVBQeFh6VFdROE1YRGNTME9MMFc4OWYxUk91ZlF3Q1dndHBqZUtrdjJFSlJ6b3ZnSUprVG16NWppRG10anR1N190VE5WUS1McHRaTDFDaTQ4M05rRjFOZk9yREVLYmdad0tVTWlDcEkzMHBQa0J4R2pHbUxVajYtSW5NdnN3QVhHaGRsT1locU4tMmxGY3Q2elJkMFYxaW52SGM3ekV3TEFSMXhqb0thd0JmaHZpWVRpRzFqMmFmRnF3MmR0bFYyRGs2S2JGSQ?oc=5
2026-03-03	Google	0.0	Citigroup Raises Price Target for Newmont (NEM) to $150 | NEM St - GuruFocus		https://news.google.com/rss/articles/CBMiqgFBVV95cUxOcHc5RlJ3S0xnQVJfTnQ1YjV0QU91ZVlSd3FuWEtGZzhCX1pnVmx1MkZiczA3LU9pWnl1MW9oSC1tVlh6VWRTcHR5X09wemJkOUhCZmc4ZDB1S0pGYi10ZzVnVGdPTlRqN05mUC1OVzRJVS1uWG9CMjVoczBNdkdRdlVuWDE4ejNCQ0s4TGwwdVBfSWZOb0o0bGwxNnFVNWVOU1dJcTlGeWxPdw?oc=5
2026-03-03	Google	0.0	Equity moves by Newmont (NYSE: NEM) EVP Hardy show grant and tax shares - Stock Titan		https://news.google.com/rss/articles/CBMirAFBVV95cUxQZG1YR3A1LWpBcENmRjI0MUxGQ3VfQ1BEaFhzaW5uVXZKeDZkWTZ2b3pVaTl6V01SOFh4V1A4akVMbHNlYi1rZHZPMHV4c1pXbVhLbS1VWmhTZXlzelNnbHN2RzV5VnFqcXdYdk9DOTRNMXJOLTdKTzEwbEtfYk9WMk1RRUwwZWpfOFpuby1JVXdpS2ZEdURGX3d5QnZ6UTF2WTV5d1ptdldUX1Ay?oc=5
2026-03-03	Google	0.0	Gold Price Drop Impacts Newmont Stock - Intellectia AI		https://news.google.com/rss/articles/CBMie0FVX3lxTE80MEd1a0FScnJFejYtZlV2N0VNanQ2VVNHZ19qeHF6TVBRNF9jTzZucm5uME0xa1E5OXcxUXlRaG9pMVNXeFpJS0lLRVlxMGhtY2p4SzNpMVJOSUVvTE1DMEk1VnVwOFBwd3ZVTkFjT0tPSUozYy1xdHIzcw?oc=5
2026-03-03	Google	0.0	Mark Rodgers files Form 144 reporting NEM insider sales (NYSE: NEM) - Stock Titan		https://news.google.com/rss/articles/CBMilgFBVV95cUxNclhYWGZkUnplT0JPSEFheVg0c1NSTXpzTXgxN2xpdVFoaUE0X19VbHhTcTloVHJuVUlOLU1wQmVzS29VOVJEaWJsYmxobC1JM1lHZGlscUZYMF9taW9rTVdITGRGamRLdlUtcDhBVnlWUkVjSmI0RFJMYUtKX0l4MzBDZ25kS3ViUFdnYV9mYkR0MnVQRVE?oc=5
2026-03-03	Google	0.0	Markets Seek Shelter as Gold Shines Brightest - MarketBeat		https://news.google.com/rss/articles/CBMiiwFBVV95cUxQRjh0a0ZtNEpVMkF2SXAyNFk0NVdoV0NXYk5KM0tQQ0hOWnQ4TTJyZGJDaDJtQTRUYUxPb09CQ21kSmNxaElNaGNMOW5CQ0FoMV9IaXg2c3ZRSXBDc1pkSTJRMnJINVBZMGp2dl9IYlctUF93WHVMVU1oUTk1WkdVb2JheHhDVDE2VXBz?oc=5
2026-03-03	Google	0.0	Newmont (NEM) EVP Peter Toth reports stock award and tax share withholding - Stock Titan		https://news.google.com/rss/articles/CBMirAFBVV95cUxOdWNiNW5JdkJMLVY1bzg4UDBkSEVmdWM2MzJWaHNsS0F2Ym1zV09GdW1abUhZNkxRSzh3MlRENF9RZmN0VmRyU1daYlp6LXVoYVhiYzgwRmdrdlBiNUhfa2pvb0RNZkpxZko1a2xiaEpOTV9UMFZuY1pHSFVPcjNWY2hhb1pTN1JWc1lRdnJJdURnalE0alBheWd0bUVzaVlDbWJwczEtYUNuTk5h?oc=5
2026-03-03	Google	0.0	Newmont (NEM) MD David John Thornton nets stock award and 944-share sale - Stock Titan		https://news.google.com/rss/articles/CBMirAFBVV95cUxOZ2E2cGcxeDdMRHZweHVCYmtoM0lubTd1VHpsdXQyNUFyY2NVbThpd1lpc0pYY3lRMXVvRk8wcGRCbTE0YzNUT09NQzJRNDRQLTZOZFFXNkVQZkpmMGdlZzB1Y3JmZ09DY1ZwWG1RRVIyNmVRSmpoUmxwU3MwR25xN0F6QW9qa2pCc2N5SjBIUEV1bkwwc21zbkJRei03ckQtWW4tZm5HTzhzbHl5?oc=5
2026-03-03	Google	0.0	Newmont (NEM) Rule 144 filing lists 944-share insider sale and vesting - Stock Titan		https://news.google.com/rss/articles/CBMilgFBVV95cUxONk9BUTRJbE9DMkNFUlpjd2JzcENwNTJCV2FWcjM1WTdwZGp6cktSSUs2elJ3ZUdIcm1ZN0pWWHR3N3k4a1BpamE1UWVMb2p2Zkk4LVM1UUxFUC1BV0RlenEyX25WcE5UMVZmOEZMOHJ2RzN0T0NjWFhmNDZUd0ctTE5TTE1Nc0RkeThfN3RCaEc3ckZWcWc?oc=5
2026-03-03	Google	0.0	Newmont (NYSE: NEM) SVP reports stock award and tax-share withholding - Stock Titan		https://news.google.com/rss/articles/CBMirAFBVV95cUxQa21UUUhnMHg0elI5MFl5dXBuc3ROLUxuU3J3Ti1CeGtOLV96eC1uTHhHRWE5MkFjMWxyTnJ2VzhYbjJYa1NoeVdaQ09vUkFvdlNfcFBBMDZPbWJyZ0NCLTE3UU9mUkRERlR3WDdVZnJ2RjNTR0ViQlR4VTFHUmwwWnQ5VDFVdFNzc25mRWZCS2dSb0ZPRFdmdW1icjVvRklMZlVBRUNxZjJYcThv?oc=5
2026-03-03	Google	0.0	Newmont (NYSE:NEM) Price Target Cut to $118.00 by Analysts at TD Securities - MarketBeat		https://news.google.com/rss/articles/CBMiwgFBVV95cUxPTW43RXBfckJJLWY4RDVIUllZcUxPTVZkRGtoYXhwX0FRcC0zMXB1OHkyRmVSQ2FUTmJRYmI5bkZFbE5WaTFDU09nT0ZiRWs4alpZVHE4alc4bktxX3dxV0kxRmR2TFFMZHpRcXlfd2VZMElnZ2tVOUxobU5UWm9lMXlvYmdjcHJpajEwX3hDZlJjRTFCMVhyRzE1RzAxUTh2M19EMTJmMVZtbk5RYzJwZFlORW50cXloOVJ4dVdXSTJEQQ?oc=5
2026-03-03	Google	0.0	Newmont Corp (NYSE:NEM) Meets Minervini Trend Template and High-Growth Momentum Criteria - ChartMill		https://news.google.com/rss/articles/CBMi0gFBVV95cUxPYTAzcnJuTk1COW1XbVZuMjdBNE9kMktHdjR3c3ZTTDNhVEttS0dadnJ5OGRPQWFjbDNGV3JOeGNUOVNLVjFQM1JVNWVzVktacDU0U3dGRl83UjNTanh1TGRGbDEyVUw1QjVROWhhanRhbmdyZEVPMnVadnBXMWdIQXhUUkVZeVcxZHdhRUVuX19Zb0hsTFFBTWtTcndUQVB5Z2xBc3BuLVBBYkhhdExPRUFYX3Q1eGhMUm9wWERDTmVvOVFiYjVzX0VWNElPTjFncGc?oc=5
2026-03-03	Google	0.0	Newmont Corporation $NEM Stake Raised by Sprott Inc. - MarketBeat		https://news.google.com/rss/articles/CBMisAFBVV95cUxOQ2RTVUV2TV9fbmdzOWZxcXU4N2lCdzB3RllkT1M5TGJkRFgyNFVTal8xbVdmSFdGT25ucVFVZWk1cXBmTXB2ejFoc0xwel9Kd2lTZWI4clNvdUJjV1U4MWQ4NkxWZko1MEk4ZDVhNGIyMU5TN0R2M2dOOWJqYl9za1lXN3hUTl9ja1d5ZmxoNGhmc1VMcTFxRmVnS21IMW1JUjcyVDBpV21BTWJBMUFKVw?oc=5
2026-03-03	Google	0.0	Newmont Corporation Stock Plummets Amid Falling Gold and Silver Prices - Intellectia AI		https://news.google.com/rss/articles/CBMipwFBVV95cUxOZXhVOFk4cDV3d2hVVzdibXlQeno2dmVRX0VrbUJpYldUcDFYLWRGYnl4ajEtcTEwSDJqSTB3REtSNWU0eHhIMWthMVdGdHBBbDdFcjY5N2lULWd5MTVMa21LTFBvY3Z0Mzc4cHI2ZGoxeW54bmdGWXpxUjM1SGVXVURmb0Z6X1VlTWh4b2V6NXUtSHh2X0lSN2d3TVRDN2dMM2lUazVraw?oc=5
2026-03-03	Google	0.0	Newmont slides as gold pulls back and traders lock in gains after recent rally - Quiver Quantitative		https://news.google.com/rss/articles/CBMisAFBVV95cUxNaUw1S0ZXcmc4RmlsTFFhdzRJVFNVTmN2ZFBRbFhFZ0hKdFVudnhwbGttby1JSEhfNjZFY3N5Zm9qQWI5NFRpQkUzWk5WUkJJSzJKLXUtMEtqZ1liZG1KVWdicUU3UGdJZDZlbGNMM2kwZExsaC1wcFRjaGIyRDd0d3BqcG41a1Npc3g2amJzbWtCdGNUbmF2Mkd1ZksxcmZlMU10ZEV4WWNnYWZUR1pmQg?oc=5
2026-03-03	Google	0.0	Victory Capital Management Inc. Has $414.27 Million Stock Holdings in Newmont Corporation $NEM - MarketBeat		https://news.google.com/rss/articles/CBMi5gFBVV95cUxPX19fNkVaRVpVYXQtMlZpMWQ0MkxpMWg1bnJOT2lORkdJcTdPNmFaYTJoZThSejlfVndJSXlPQjVjNlNIZ2hsNWplVU9QcUVLWEN1V2dHdlBleVdxSnBIZV9TVFRpcGxfTEkxNjFxNnFXeUpDZUg4aU9JX1NwNjZRX3FmSjJRbXNoeE1GdWUwSjF1eXdIR2JSTURBdzNEN0V1eWtKY3NnZURpZ004aUFPMlBVc1lpM0s4OUpGaTRab2M5NGstQjdFNVlJVW1sdGtpdUJ1LUJyVEZUZUQzTGVDVGpnRzhIQQ?oc=5
2026-03-03	Google	0.0	‘The market design must evolve’: Eku Energy on energy storage in Australia’s NEM - Energy-Storage.News		https://news.google.com/rss/articles/CBMirgFBVV95cUxQZ0VqVEdoMjFhN0JPa2ZWSFpCeERaQ0R4NEd4S2dWZWExY25nNGZLR0JVakZZdE5PeUNTWnk1TFdWaHRaRDMxeGllb3BjQ0xxUk85dzhlWFZIbkV2dnZpZUVqMThXOTY5b1VVVlhLNEtwazVFVnpGVjN4TXlCd0h6TXFSLU5fWUFQM3R3eGg3NVU4NEszbFd3Vm1HWDFSb3FJTlk5QUNNOW5fUlJyWnc?oc=5
2026-03-03	Google	-0.025	Newmont Corporation (NEM) Global Investment Strategy While Strengthening Reserves and Production Outlook - Insider Monkey		https://news.google.com/rss/articles/CBMi3wFBVV95cUxQMWVOVnNLZVRvS0M2b0tNY2dvZU8tdnZadmRSSkVjTlZTZmJrLUFfSWdPX0I5amIzTkFUZFR3eVpDRUQ5MjNRQUxSWHNQVS1CVDhKdFdaWHMxOWU5YTlzcTBWN0QyUVB3Y0c4eEM5bEF1SExORldwY09VQWRtNWRGU0NPUUtVRm15TGp4YlBZelJnQWM2WkI1VDN1VUE3d2pXZ0d6bXAyYXZMOTFUbXVCcWxrcUJsLU4wWGZoaEphTVZxUUJlOGdPaTNUYjNHUW8wOExlbVR0RGh5SUU1T25Z0gHnAUFVX3lxTE1HZ01nRXRUeGg1RC1DVE5pNGJvRG9icFlLSkN2RzBpdnhhQm4yQ1loeW8zcTQtWFVPVDlUbV9yelh4T1AyZktNUEZDQkpYN2RwSUZUQnlJRWExYlRFSGt5anFzenZ6YVRONzhVOTFyd3dlNWd2cVM4elU2aW9weC1ac1RRdnZhY2tfSzNjYl9sZG12Mm1QY0JHU2QwWTUyZG9kUVk2R1l1NzdDd19MS0pqZFVWcUV0alBoLXdfdmUzd1lva2N3eGR0dENxdy1ZdVJfaWhuR1p2UVNCOTgxb3dGR3B5Njhubw?oc=5
2026-03-03	Google	-0.156	Newmont (NYSE:NEM) Shares Down 8% After Analyst Downgrade - MarketBeat		https://news.google.com/rss/articles/CBMiqwFBVV95cUxNQ2NEd0VUSm94VVYyOXBFQnItS29VMnk0WE95clN0VDYzUGRaTTlHYUR5dUM3T3d0V0dkYmktaFRKQW41UE5yaXJhTlJURmxINTNTTWEyQjNfajRxMkV3Rjk4UTljQWlmWU9SX05fTnJYaGpYRW1jTEJUc20xUmFYNkZmSHhuNWxWT0dZd3dOWnR5WUdrYS1vM3RCOFdKTjY4dXlwaFpibmZjTVE?oc=5
2026-03-03	Yahoo	-0.2	What's Behind the Sell-Off In Gold on Tuesday?	Mining Giant Newmont Is The Biggest Decliner in the S&amp;P 500 Today	https://www.investopedia.com/what-is-behind-the-sell-off-in-gold-on-tuesday-mining-stocks-nem-gld-11918256?.tsrc=rss
2026-03-03	Google	-0.219	Newmont Corporation Stock Closed Down by 7.80% on Mar 3: Drivers Behind the Movement - TradingKey		https://news.google.com/rss/articles/CBMigAFBVV95cUxOaXQ2Y3ZIZUx3SEMxejdRc2x4TXlDaHphRGcwVUFtVkxJMll4MlVXcTlmYzAyakRoa1dxM08zZ0t4QWNOVVFBcm9QS0pwc253UXpNaDhDaUNlMkFmSVBxRXprTllabkhoeGRjTXNSUHI2RENnT1Z0ck5aSXFwa21RRQ?oc=5
2026-03-03	Google	-0.3	Is It Too Late To Consider Newmont (NEM) After Its 209% One Year Rally? - Yahoo Finance		https://news.google.com/rss/articles/CBMif0FVX3lxTE9MOE5jdXdmSU5NU2hGQ0lHWEJCQkNyQmNtRGFITEFoYVFGSzBiV3RILXI1NlFIUkpKZDkwMG1vcG9qZ2xVWGNWWmRrZHYxZDBIWXlFZjFvRS1sNmp6WUxfd0ZYTGhGd2N1cEs3ZjJUejNLRWxpMy10R1NGNzBDOW8?oc=5
2026-03-03	Google	-0.4	What's Behind the Sell-Off In Gold on Tuesday? - Investopedia		https://news.google.com/rss/articles/CBMiqgFBVV95cUxQeUlpT2lsM1FEMTFKLTNxdmQ3UEl3WVVYRmstMWhzbC1DTTNMRVI2VVZCcFRhbDlVdF82V0tBRjh4VWJMVldPRW9jalcxb2FYVGtXZ0twREdFOF9wSVBZd3g4NFRyVHltM0tjejRib1U3VUhLemU1WVFTS1pwVFVhb3pzYzhibkRCMUlRX1BSYlhVekxBRDk0YmFLWGhiajN3VzFiazFDZ0lyZw?oc=5
2026-03-02	Yahoo	0.167	Irving Resources Announces Further Drilling Results  at the Yamagano Joint Venture, Kyushu, Japan	"VANCOUVER, BC / ACCESS Newswire / March 2, 2026 / Irving Resources Inc. (CSE:IRV)(OTCQX:IRVRF)(FSE:1IR) (""Irving"" or the ""Company"") is pleased to: announce high-grade gold assay results from drill hole 25SY-003 that confirms a potential eastward extension ..."	https://finance.yahoo.com/news/irving-resources-announces-further-drilling-120000735.html?.tsrc=rss
