Date	Source	Sentiment	Headline	Summary	URL
2026-02-27	Google	0.0	Close Asset Management Ltd Has $43.54 Million Holdings in Eli Lilly and Company $LLY - MarketBeat		https://news.google.com/rss/articles/CBMi2gFBVV95cUxNZmpwUE9UYmxUNktMdjZJUW85NkxscWNjcUd3NEVPVlhxZVhQdVY5M2pQS19UWjN6Q21sWW8tcTA0RHY0U2E1SjJiN1pZX0RSazN2Ym5fWk8xUjI2WVVTLWM1d0dENFpZRFFmckRMeVFTNlZ2NEZIT2JqMVJGdXhiVm55emtsZEx1dmkySEN0VlZzbzdNRjBBLVlURkpRbWZkRnkwOXdDQlNXTDBiRHpiMkYtV3pndnZad1ZlanlQNHVVZk9PaDJzeXNqeVJCTE0tWTdENHBkRU9Pdw?oc=5
2026-02-27	Google	0.0	Eli Lilly Advances Oral GLP 1 And Immunology Growth Story - simplywall.st		https://news.google.com/rss/articles/CBMi0wFBVV95cUxQcV9MekVhNjVkckNfY2JQNWd0Y2xqa1l5bEhZamFEbmFfeVRoZlFpaXRSTVBUMnZwQmRjaDY4MUVrNDBJWW43alczaW9oNm1SOUlycWpvVzFwUDM0RVhMZ0tjNWFVdTdRTXZweUV0dXZVRWlQSUJ5bTRwMmFmMHBnU3E3SEtCODR0MWdrQ2wzMUtqSzdwdzhlbDF0dC1MNlhOb3pJWFpHMHRSQ185VFVyYXlzQmwxdU9qTVJzTjQtSnlRRloyMGJPQ2JBZDlwd1dzSTVv0gHYAUFVX3lxTFAzaW5xZ3RVSk9wVU1sYjc3elN4bTNuajVSalpRVm1uLXktWk1OU3ZVSDd2MV9Lanh6RFhhVkl0RG12d2dmYWRjeldzdDF3dVZWZ1hGbGtpeTFHZVlYc3c0T2ViSFdmV3poNjNqUS1QdkJvelFJc2dveklNVEo5OE43azhGZ1ViZ1Q1WFFDYmtxWjlzNDRzbXZKcU5HeUU1ZktNXy03R1FDN0Q0RGxSdU5fMnhEZzZBNi11WWJGMDFwY19oLTgtTTZCb0tUTUZOOEJmSF9IYUVVTQ?oc=5
2026-02-27	Google	0.0	Eli Lilly and Company $LLY Shares Sold by FUKOKU MUTUAL LIFE INSURANCE Co - MarketBeat		https://news.google.com/rss/articles/CBMizgFBVV95cUxOcXhGWEQwLWFPOXV5bUlqQXd1TThRZ3lfc0lvSHpLNWRNOFNtR09tdndTUjlNMHU3NGhodl9NUGpvLWtNRUdfN0VWbnF3OTJDUENuU016VGtzX2ZXLUVJLXFFRXVCWThkcWI0bG1LQklkQmpnMUxJdUhYQTltZ0pDQ3JrMy1pSmpvOEw3YmJPUUtYdEprMW5TR0RCbjc5ZVdIVXVHOWJPUnNMMDIwRnQ1X2tmbDE5ZFdUQkxTM01kQkExWUJidDh4RGlhcnJCQQ?oc=5
2026-02-27	Google	0.0	Eli Lilly and Company (NYSE:LLY) Trading Up 2.8% Following Analyst Upgrade - MarketBeat		https://news.google.com/rss/articles/CBMiwAFBVV95cUxNX0FEVVE4ZXVsNHlXX21KY1JOTWhzZG9oMDQ3WFFIbGQ2Yi1PQmlXWkhMOEJ4NEZUZm1QNUNrb19ZbnE1MjJWRE0tT2lIcjJZY1BCcVkxZ1NpcktMdHJQR3B0N0d3Zi14LWhvQllhcVFna0tDUWd4Tnh0Y3FtVnBjQUFyRWoxNUwySkIyQlZEWDJUQWtydkQ2WUQ0VUI1aW9xeV9DRDNreDdCTlFDX1JmYzh3MW5TRmVjR1ZySW5sMF8?oc=5
2026-02-27	Google	0.0	Generali Investments Management Co LLC Acquires 3,281 Shares of Eli Lilly and Company $LLY - MarketBeat		https://news.google.com/rss/articles/CBMi4wFBVV95cUxPdDJHUEFaX3Qwc0dvWV80bWhyN0l3REVsT3ZwWlJ4YmhOSTBhT1Z1VjQzN1RiOXhpY2FCaHEtc1dRQlRJaGdBYlNKeV9BMFlPNUgzV1VCZUFOaFNjbXdXY09uRFp5M2s1U05rVXJ3bEFhMk1FRHktejdsWTMzMzU5NGc1dGU2eUpJSmphUy10N3lDTmYyY3hTdUo3c3VHRTNJUHlZSmdkTzhmN0xRVHV1RTNDTXdNS3JHaG0ycmJtU0RRcGJVYlRjYnc1QmRJODA0VXpzRC05ZWpsOTF3bUh1c1ZXMA?oc=5
2026-02-27	Google	0.0	Hair-loss pill helps 42% of teens regrow scalp hair in Lilly trial - Stock Titan		https://news.google.com/rss/articles/CBMiugFBVV95cUxNZ0pGamMydFh0bS14SnJrNkdhSm1XTHNmSlRaM2M3Vzl3UHNteS1GRGsyOGg4cUl3M0RPcjR5TEJEcGpKdm9hSWgta01jZHU3RHUtV3RPR3Y1Vkk2MmZqa09hc2dDcGs1SjlNRlZ0ZTJYV25ZOEJwajBDMEktc2tFRllENkM0Njl6VzlBRTd5WGRISEpFWFVLRFFXM1duTnJqdkRDM2FNaGQzQ0lsbmdaWUp6SmVDbjM0WWc?oc=5
2026-02-27	Google	0.0	Handelsbanken Fonder AB Purchases 92,689 Shares of Eli Lilly and Company $LLY - MarketBeat		https://news.google.com/rss/articles/CBMi0gFBVV95cUxORGZNeTRhNXBaTjA2SF9aQWF4VUZGTG92ZGVlNE1xTlRZU3FZVEkzNldkdVZvcm4xYXBvNWdEc1NlUEdZbW11VGVTODU2aTNhaHNVVzlkUFl1eGRXcXM1clNnZXNJMjNaT05VMEdQQWFNeFBvTkQweDJGUElkUXJqemtTUzVTZ0VqQnZhTjNMdjZfVERrdkNsTl9DTlNUUW1SbFYwVmlOSVJKZ0hfUDJXYUhPZFhoZHFrU2dMMUFTSy1GblcydXJhZkhDXzFZSmRXWmc?oc=5
2026-02-27	Google	0.0	Integrated Advisors Network LLC Grows Stake in Eli Lilly and Company $LLY - MarketBeat		https://news.google.com/rss/articles/CBMizgFBVV95cUxOQ0N2NU9jVDBFSUFKVUxJTF8tV3JTZk9ZdkNtRHlZVWtmYWJ3QXI4bTlvWWpNR3ctSVdfcUN5elMwSXk4c3RlZ0NOM29mQm9wcTdKMkM5Y1ZqOGwydFBES0xJNlhQU1FVX0RpZlhiUzJyckRVeGxLWFNtWklheUR4TzlJLWZIWWlKazNkVkpsRU05YlM3ckJtZnlqM2RWR0dpU2oxZC1YZWxobUJvMXNPNFI4MmpGVkVXalVyMVNpekU4Z2tCb2N5TlNFRWhWZw?oc=5
2026-02-27	Google	0.0	Is the Market Bullish or Bearish on Eli Lilly and Co? - Benzinga		https://news.google.com/rss/articles/CBMitgFBVV95cUxOSFQ2UHFMY3RtTlFNbHY5dHo3NVVNNWY3ZklxLV9VSmJxcXY2OEh4UEwzMjJ4WWE0d3JSLTNYQkR0dENLOFRndVQwQVJXbjNhODlxSmI5OGdCWW4tcGY3Uk1Fd2hKS0U1V2JIejJ0dFlCZEstaGN0Vl9hb2d3U3FNZWJJNm1WOWNua1FxNDhxc0ZYYUZza0cxemxMSWFOOVJOdU1lQmFJaWZHd0lFNXN2YjJhU19Ddw?oc=5
2026-02-27	Google	0.0	LLY Gains Favorable Opinion for Olumiant in Treating Adolescent Alopecia Areata - GuruFocus		https://news.google.com/rss/articles/CBMiugFBVV95cUxPSk5XZWZoVVliM2x6MXRrVThuVzdoc0xXQmtNTUp2ZmJJRHNyTW9hd05JUWp6N3N6dzNXUWNwWmM0bmtNWC1neXVCNHEwUXI1NlB6NUxwUjhRblBOM181bjBuamY0bkhNVmI1VGRtLXBSclQxRDJpSXFjelRxS21HNDJXVjY1MjJzZUxwbUppRWZlREhXRjZ1eW5pbS14WFM1aURYeVJlWGM3U01NcTFncEV5UVZhbHdEN3c?oc=5
2026-02-27	Yahoo	0.0	Sector Update: Health Care Stocks Advance Late Afternoon	Health care stocks rose late Friday afternoon, with the NYSE Health Care Index adding 1.3% and the S	https://finance.yahoo.com/news/sector-health-care-stocks-advance-210229048.html?.tsrc=rss
2026-02-27	Google	0.0	TIAA Trust National Association Sells 6,331 Shares of Eli Lilly and Company $LLY - MarketBeat		https://news.google.com/rss/articles/CBMi1gFBVV95cUxORmhxcWlwbF9ib0Y0Q216UWdlanAyVE1mMkc4U1NwRGYxdjlwdE9qZF9CUzF2Y2NvRTFtWVBLa1hfWXU5X3dIYTFyd1lwZjFRU2hXRG5xMGJMWGFvZ2FVMkZUSHdtMXU4ZG1UckJLT2lORFZBVUNtVlpSaWw1T2hMSEdhVUFlZjYxczN1eUZDRHVENy01WUZpU2U4TFBvVmh1WjFYaUl2eVRpbFBEWGNMd1hXR2dQNXdjYWJvV2dlNXVBdV9hSV93M0xHWkw2Uk9BeE1GUXJ3?oc=5
2026-02-27	Yahoo	-0.004	Lilly's Olumiant (baricitinib) recommended by CHMP for approval of expanded use in the European Union for adolescents with severe alopecia areata	Eli Lilly and Company (NYSE: LLY) and Incyte (NASDAQ: INCY) announced today that the European Medicines Agency's (EMA) Committee for Medicinal Products for Human Use (CHMP) has issued a positive opinion for Olumiant (baricitinib) for the treatment of adolescents (ages 12 to <18) with severe alopecia areata (AA). AA is a chronic immune disease that can have an especially devastating social and emotional impact on young patients and their families, as early onset AA can be more severe and lead to	https://finance.yahoo.com/news/lillys-olumiant-baricitinib-recommended-chmp-131100371.html?.tsrc=rss
2026-02-27	Google	-0.4	Eli Lilly and Company $LLY Position Decreased by MGB Wealth Management LLC - MarketBeat		https://news.google.com/rss/articles/CBMizwFBVV95cUxOdmNwMS0zdUpyUG1OVVRUd214WkZQeWhEYktyYVJkcnRLcURwQ0VYLWM5TXI1Y0R5Rm4xOWZmdS1OQjhTZS0tSjJkYmRpSW9EaVdOQjhPclB5VDNNZEFPZGxpSWhkRWZlZzQzN3p5R292ajNPblZUYjVtYWdrLWExMEFWeWlIeFlaczNpLU5DZXVFZHA0UFpXVjZJeXV6THY5Vmx5RWZLdWtIRzFRZ0pHVmowZ1NONDBzT2xpZUgxd2JYSjZrbWxPeW84Y1JZMWc?oc=5
2026-02-26	Yahoo	0.381	Jim Cramer Highlights Elanco’s “Comeback Story”	Elanco Animal Health Incorporated (NYSE:ELAN) is one of the stocks Jim Cramer commented on. Cramer highlighted the stock’s terrific performance over the last 12 months, as he commented: I love a good comeback story. Right now, there’s a great one playing out in Elanco Animal Health. That’s a veterinary medicine company spun off by Eli […]	https://finance.yahoo.com/news/jim-cramer-highlights-elanco-comeback-204239949.html?.tsrc=rss
2026-02-26	Yahoo	0.278	ETFs to Buy as NVIDIA Shares Gain Following Q4 Earnings Beat	NVDA jumps after crushing Q4 earnings and strong guidance, lifting ETF plays like SMH tied to the AI chip leader.	https://finance.yahoo.com/news/etfs-buy-nvidia-shares-gain-165200077.html?.tsrc=rss
2026-02-26	Yahoo	0.275	Lilly's oral GLP-1, orforglipron, delivered superior blood sugar control and weight loss compared to oral semaglutide in head-to-head type 2 diabetes trial published in The Lancet	Eli Lilly and Company (NYSE: LLY) today announced detailed results from ACHIEVE-3, the first head-to-head Phase 3 trial evaluating the safety and efficacy of orforglipron, a small molecule oral GLP-1 without food or water restrictions, compared with oral semaglutide in adults with type 2 diabetes inadequately controlled with metformin. The 52-week trial enrolled 1,698 participants across four treatment arms: orforglipron 12 mg and 36 mg, and oral semaglutide 7 mg and 14 mg. In ACHIEVE-3, orforgl	https://finance.yahoo.com/news/lillys-oral-glp-1-orforglipron-113000896.html?.tsrc=rss
2026-02-26	Yahoo	0.218	Biogen Faces Uncertain Outlook for Alzheimer's Drug But Pipeline Supports Growth, RBC Says	Biogen's (BIIB) new Alzheimer's drug, BIIB080, has mid-year results coming up and its success is unc	https://finance.yahoo.com/news/biogen-faces-uncertain-outlook-alzheimer-171712526.html?.tsrc=rss
2026-02-26	Yahoo	0.211	OTF + Lilly Collaboration Update on Registration Response | OMA QI Scaling Initiative Gains National Response, Bringing Together Diverse Practice Types Across 39 States	Denver, Colorado--(Newsfile Corp. - February 26, 2026) - The Obesity Medicine Association (OMA) is seeing strong early momentum for its Implementation into Practice Collaborative (IPC), a program designed to help clinicians strengthen obesity care through practical, evidence-based improvements in outpatient settings.The IPC is part of a multi-phase Quality Improvement (QI) initiative created specifically for OMA members. It was developed in collaboration with the Obesity Treatment Foundation...	https://finance.yahoo.com/news/otf-lilly-collaboration-registration-response-130000407.html?.tsrc=rss
2026-02-26	Yahoo	0.19	Soleno Therapeutics Announces Retirement of James Mackaness and Appointment of Jennifer Fulk as Chief Financial Officer	REDWOOD CITY, Calif., Feb. 26, 2026 (GLOBE NEWSWIRE) -- Soleno Therapeutics, Inc. (Soleno) (NASDAQ: SLNO), a biopharmaceutical company developing novel therapeutics for the treatment of rare diseases, today announced the appointment of Jennifer Fulk as Chief Financial Officer, succeeding James Mackaness, who announced that he will be retiring from the Company by the end of the first quarter. Mr. Mackaness will serve as a consultant to Soleno through the end of the year to ensure a smooth transit	https://finance.yahoo.com/news/soleno-therapeutics-announces-retirement-james-130000701.html?.tsrc=rss
2026-02-26	Yahoo	0.175	Jim Cramer Recommends Eli Lilly over Novo Nordisk	Novo Nordisk A/S (NYSE:NVO) is one of the stocks Jim Cramer commented on. Answering a caller’s question about the stock during the lightning round, Cramer said: Oh no, you don’t want to be in Novo Nordisk. You want to be in Eli Lilly. Novo Nordisk is really good at cutting prices. Eli Lilly’s great at […]	https://finance.yahoo.com/news/jim-cramer-recommends-eli-lilly-145642576.html?.tsrc=rss
2026-02-26	Yahoo	0.1	Eli Lilly Says Orforglipron Outperforms Oral Semaglutide in Phase 3 Trial	Eli Lilly (LLY) said Thursday its experimental oral GLP-1 receptor agonist orforglipron outperformed	https://finance.yahoo.com/news/eli-lilly-says-orforglipron-outperforms-153805407.html?.tsrc=rss
2026-02-26	Yahoo	0.1	Hims & Hers: The Telehealth Growth Story Younger Investors Can't Afford to Ignore	How fast can Hims & Hers grow without selling GLP-1 drugs? Maybe a lot faster than you think.	https://www.fool.com/investing/2026/02/26/hims-hers-telehealth-growth-story-for-young-invest/?.tsrc=rss
2026-02-26	Yahoo	0.088	Lilly’s GLP-1 pill tops Novo’s Rybelsus in head-to-head trial	Orforglipron, which could be approved for obesity next quarter, proved superior at cutting blood sugar and body weight — but at the expense of higher side effect rates.	https://www.biopharmadive.com/news/lilly-orforglipron-rybelsus-diabetes-study-results-glp-1/813209/?.tsrc=rss
2026-02-26	Yahoo	0.076	Novo Nordisk's China Obesity Drug Cuts Nearly One-Fifth Of Body Weight	The United Laboratories International Holdings Limited (TUL) and Novo Nordisk A/S (NYSE:NVO) on Tuesday shared topline results from a Chinese phase 2 trial of UBT251, a triple agonist of the receptors for GLP-1, GIP, and glucagon (triple G). In March 2025, the companies inked an exclusive license agreement worth over $2 billion in upfront and milestone payments. United Biotechnology is responsible for the development of UBT251 in the Chinese mainland, Hong Kong, Macau, and Taiwan, while Novo Nor	https://finance.yahoo.com/news/novo-nordisks-china-obesity-drug-043113091.html?.tsrc=rss
2026-02-26	Google	0.0	Eli Lilly (LLY) Veteran Joins Soleno Therapeutics as CFO - GuruFocus		https://news.google.com/rss/articles/CBMimAFBVV95cUxQWDFRSzlpb0pzWExvYjhTY1hOaVdaWkt0WnVkeFVYblpnakprM0cxRGxnQzREWmdlSEJMVmZ4NmNkcnZTMG0xVTNYTW9xLUtlLVpueE9hYklDcE1JWVFIQU5hZjhrdl9QSjJTVFJUb01GRnVmTGgybzZsaXUtcWJvaUdpOExzMm1SbzNyYXZqMEdHc2FxWTNqNA?oc=5
2026-02-26	Google	0.0	Eli Lilly stock price slips as Zepbound KwikPen FDA nod and Novo trial data keep LLY in focus - TechStock²		https://news.google.com/rss/articles/CBMitAFBVV95cUxObFJ0SmZsYlBGbG5Wd1g0WXJ1eGJlQTRpWVlpaDU4cWhRWHVUajV4X2w0aDRGQzEza2JyZ20xMDZoSExqUlVQR1pMWGVWUFdWMU1HY2NFZnJNU2dxcVF0YmtwNUxWSTdrbFNwOTJPN2YzaV9TbnE5WGE3Z3dMamE1N2t1SEtna2NqT1BnMnBQVmQ4RV9kdlloSUVrMUc2dHNIS0xrYTV3dXhjYUYzUlhUNE1SNTg?oc=5
2026-02-26	Google	0.0	Eli Lilly’s Orforglipron Trial Data Reshapes GLP-1 Growth Story - simplywall.st		https://news.google.com/rss/articles/CBMi1wFBVV95cUxQbFpCOHVZYVRiSXFoakV4RmdTcnpnbmNWZ0tObVVXUldzbm1HLU1iVkF4bnMyeUU3VnZGRDFhOXR5LTdVRlNHUS1UT0hfdnh0c3pTdnRXMThSd1luQjloVkVucmZYVHNXdFBFZ1NDVFpOSzRlQ3FzbUlkYkNxaTJqVTM0U2VqMmx1ZF9iUU9FVzZnZWREM3pRR2xXRTZsTFZyNFNCTGlPLXlrN3RKWDJCUFM1emhlUXp4ZHQ4djRDWmd5dmQtSWZjTHYwWDZpQXJyQnF5cVFVNNIB3AFBVV95cUxQTDdyWHlnU0hvTFFSbWFGWE9ZSzRrX0VaNlZrRnVsNzBUVFU0V2lROGZyeUVnRlRNdmxoUTBMeF90cUFIZ3M4eGxZOEtFdW1KSkp4VjdsSUZLQjByZ0Qyd1dwSVlfODRHYWMwcHN4Qno2M0w1SjFpMXZjRlQyLUlVbU1XUWdtb0l6NC1ha2NjSjQzYklHcEJjRHBnVDJvMEt1Y1V3N3JMT2FNcGZ5QmpENXpLTUxOOGdEMkF3Tl8tRHF2azFaa2thNW9HTGoyRVpQbVBSZkRiUFFIeE04?oc=5
2026-02-26	Google	0.0	FDA plans staff bonuses to accelerate drug reviews (LLY:NYSE) - Seeking Alpha		https://news.google.com/rss/articles/CBMijgFBVV95cUxPZjZZMTVVLUxyZkRNYm14TFdoLW9JS3hubk1USDROSllsVmEybUlqbHdlMWpuV3diT2ZWTTVGcTI2eHZ2WFQwa3JvZEFTQm9VTDVXUTZGb04zN3A4Si1OMVNkN0tqNG9HQklBY1NnOGNaRlYzMU40NWNpU0VFWVNjVlRVd3lrbnpoeUR3U213?oc=5
2026-02-26	Google	-0.1	Eli Lilly and Company (NYSE:LLY) Stock Price Expected to Rise, Guggenheim Analyst Says - MarketBeat		https://news.google.com/rss/articles/CBMi0gFBVV95cUxPanlaQmVhS2VBbVJaSmttVmJOV3ZsTy1iaUF4RVU4b3RXdmtKdVQ4djZhTUJJNUVsdmlRWU1zMDhNSk1qV1ZVdjc0RERBRFAxOXdLT1VkZWlTaUp6dUZDcjU1VkpLWVZLMEthMUdOaFNvOVg3S3NsUlRqOVJZZXByS0dQYnFMNC0xSkdFcmh0OFFkMVZlTnVLTmUzRUhkNUJqZGkxQ3VhRy1MbkJXZXNFTUl6Z09Dd3N6Mlo0X0E3NlVFTll0VUNFX1lhd210YmZsZmc?oc=5
2026-02-26	Yahoo	-0.169	Why Shares of Novo Nordisk Stock Sank (Again) This Week	The weight-loss drug innovator is falling behind in the industry and facing major pricing pressures.	https://www.fool.com/investing/2026/02/26/why-shares-of-novo-nordisk-stock-sank-again-this-w/?.tsrc=rss
2026-02-25	Google	0.5	Why Eli Lilly (LLY) is a Top Growth Stock for the Long-Term - Yahoo Finance		https://news.google.com/rss/articles/CBMidkFVX3lxTFBuTkZSVFVRaWptN2l2VzlOUlBWcVdhamFmNlJFaGdEU0dmZ2xhU3dGVHFDTWhReVdWMXgwaFJfVnFCc21CMjFLSXFrR0NiQkszTDFzWEl3MGhQdnpkSnhFQnRjX2VxcWwtMnBLeE1KSXNvUnpOVVE?oc=5
2026-02-25	Google	0.333	A Quick Look at Today's Ratings for Eli Lilly and Co(LLY.US), With a Forecast Between $1,250 to $1,300 - 富途牛牛		https://news.google.com/rss/articles/CBMijwFBVV95cUxQOHIzU0pkQ21tc084SUdJc2lUNnQtNkVuV29ZWkhFY2Y0WmtOaFJxRUZ6SU5OV2ZFdkkzZnhybzl4N0JqMXBlNUptX2VWTTFUaTJYN0JHR2tqaXIyX2ZHa3hNSklfYWktNG9tSXV1RUtEdzJRdmZkRkNWS2NybzFnWk5Td21oS0J4cFBicVhjMA?oc=5
2026-02-25	Google	0.227	Eli Lilly (LLY) Releases Positive Results From Phase 3 VIVID-2 Open-Label Extension Study - Finviz		https://news.google.com/rss/articles/CBMiugFBVV95cUxPM1RfVzRmNTF6blF3YnQ4VklURUF6eElIcl8zWjJYak42d3Foc1VQbmZxVmNNNlBGY3lDSUdxemxvZzNFSWgtSGRLU2p2dUNyYm9WdVFuZW5PeUs0TlhKdk1yU29pODFuWG9xaTNhcUhLdnNOUlJwVVFLd3VycHNOdXFMdjk3VElFRTBJZUJvbXppczV2SnpkdVl3SGN0dnE2MG5fRmZ2elZla2pTYlNVRlIyVFdKVkRIdFE?oc=5
2026-02-25	Yahoo	0.218	Stock Market Today, Feb. 25: Novo Nordisk Dips After Announcing $2.1 Billion Partnership With Vivtex for Oral Drug-Delivery Technologies	Investors weigh steep GLP‑1 price cuts against a multibillion‑dollar oral obesity push, fresh analyst caution, and a new partnership, today, Feb. 25, 2026.	https://www.fool.com/coverage/stock-market-today/2026/02/25/stock-market-today-feb-25-novo-nordisk-dips-after-announcing-usd2-1-billion-partnership-with-vivtex-for-oral-drug-delivery-technologies/?.tsrc=rss
2026-02-25	Yahoo	0.136	Lilly's GLP-1 Blockbusters Drive 2025 Revenue Surge: What's Ahead?	LLY's Mounjaro and Zepbound drove 56% of revenues in 2025 as obesity demand surged, with new launches and Medicare access set to fuel growth.	https://finance.yahoo.com/news/lillys-glp-1-blockbusters-drive-134000159.html?.tsrc=rss
2026-02-25	Yahoo	0.042	Novo Nordisk Resets Obesity Strategy After CagriSema Miss And Vivtex Deal	Novo Nordisk's CagriSema weight loss drug missed its main target in a key phase 3 trial, falling short against Eli Lilly's rival treatment. In response, Novo Nordisk agreed a $2.1b oral obesity drug partnership with Vivtex, aiming to develop next generation therapies. The company is also implementing substantial US price cuts for Ozempic and Wegovy, reshaping its obesity franchise. Novo Nordisk, traded as CPSE:NOVO B, is facing a reset in expectations after the CagriSema trial miss, with...	https://finance.yahoo.com/news/novo-nordisk-resets-obesity-strategy-221240820.html?.tsrc=rss
2026-02-25	Yahoo	0.031	Eli Lilly Just Took 2 Major Steps Forward in the Billion-Dollar Obesity Drug Market. Here's What You Need to Know.	Eli Lilly has seen revenue and earnings soar in recent years.	https://www.fool.com/investing/2026/02/25/lilly-steps-forward-in-obesity-drug-market/?.tsrc=rss
2026-02-25	Google	0.0	1,868 Shares in Eli Lilly and Company $LLY Purchased by Vawter Financial Ltd. - MarketBeat		https://news.google.com/rss/articles/CBMi0AFBVV95cUxNTkxic2VaeHdEX3l1eURXQlNSLUFCWTZ2LWtELWpDbVkzNUNQRV82N296TE1OY0lLSGl0NmtISm4yZ2JFb2hqeXZoSURQaHZ3TkttXzF5V3VPNG8tY0xSdWFNRU1ManhFOThabktGSGxJb2FoTVBPeDh1QWgydVNQVHRWNHNRbjhkM2ZCTFktZ3VGUmdLbENVRFdUUWw4UVpVOHNBS1JrQi1naldiQzczYXR5aG9FTF9tcWxRQ19PUlA1cXc1TFh1aFJrU2pfcmxy?oc=5
2026-02-25	Google	0.0	Assessing Eli Lilly: Insights From 13 Financial Analysts - Benzinga		https://news.google.com/rss/articles/CBMivAFBVV95cUxPdFZScVZ2WmpiSzlOUWlTMzRqRUZHeDMwOUJSZXM1eW80bUpDN1M3aEY4UXp0M2x0bXBuekVkVG9NbTEwU3lQS1daYVNiMTFJMTBCX01IdFR4VEUzcklvQmNBVkx4alFWS084emVYc3djYTB1SjNZSUc5ZFQyX09hU0I4ejhkelFJQjNPbWNOX25pV1poTUM1UHBDVEpkUnRaS1lGSW03NDFlbWhaRV95ODFmWUpsODR6VVcxYQ?oc=5
2026-02-25	Google	0.0	Eli Lilly (LLY) Seen Resilient as BofA Downplays Novo Nordisk GLP-1 Price Impact - Yahoo Finance		https://news.google.com/rss/articles/CBMif0FVX3lxTE9GUklJUGtFUU5RMENvLW9pcXFBZ3RSbzZPRlFFa2lCaTk2NGFnRkVwYWlHa2dFT3E1VjB5TWhnVmNldHM4Mm8wSlBOaTdhbWJDOTdTcjFSXzVIOUNvNEtxRkJaeHhRdDNpUEYyVmlJcUh4REZBeE95NndyN29ZOUk?oc=5
2026-02-25	Yahoo	0.0	Eli Lilly acquires Orna Therapeutics for $2.4B to disrupt CAR-T market	CAR-T therapies have changed the oncology space, but their cost and complexity have confined these treatments to specialized cancer centers, with price tags of up to $400,000 per treatment. For the millions of US patients with B-cell–driven autoimmune diseases like lupus, that model is not ...	https://www.thestreet.com/investing/stocks/eli-lilly-acquires-orna-therapeutics-for-2-4b-to-disrupt-car-t-market?.tsrc=rss
2026-02-25	Google	0.0	Eli Lilly acquires Orna Therapeutics for $2.4B to disrupt CAR-T market - thestreet.com		https://news.google.com/rss/articles/CBMisgFBVV95cUxOQmEwd0VINnlYUmJlY3ZFR3dHcXZFTEtpY19lMmN3eURtUjE4NjV0ODNlcGxEWm9TSjFjSmxMa3VtMDZ1cDhjc3RNaC1lSU9yekJySkVNcWNXSWt1REJ0elBCZ2dEUHdZNnJWTkZ1dDBTeGd3V2xqVDVwRzlweU44SnhNVWkyVkJ2QUU1WlJ0SE0tWlpoNGV4T0xpWGgtZWhSdTVXY1N6V3piQ29ad1FHQ3dB?oc=5
2026-02-25	Google	0.0	Eli Lilly and Company $LLY Shares Sold by Jag Capital Management LLC - MarketBeat		https://news.google.com/rss/articles/CBMixwFBVV95cUxPSUlnTThSeFdhTXhXMDRWTFRvYnAtdVMtcEhkR1htNEU1c0RHZExjMXBObHMzNEptVXRCanBHQl9Mc05Sa3lWRVJONEFzckRIVFprV1lyVVpTVjNqV05KOWRWSnA2d2dKTHNTS0ZYQ1VneXNNUld4ZDk2VmtaU1YtbFlSLTZjeUZvXzdFeGhtTThlN21WYl93RXJJY19CU24yaUkydVByTTc2V01WVTROM21tZ3hUWVA2LS1oai1CYTREWXVobERF?oc=5
2026-02-25	Google	0.0	Eli Lilly and Company $LLY Stake Reduced by TD Asset Management Inc - MarketBeat		https://news.google.com/rss/articles/CBMixgFBVV95cUxNOTBid3o1MjkwaVU2dFgyQWpZUlAzQ2x2WTctc0l6dFJaRGVmS2NUb1VyT2gyMzFIZnpuRTlFLVdkbWUwVnZ4M0U5bnZFT2FFR3U2OUpoQlZxdXItVkY5emV4d0xDaDdSUDZHNG55V0RYZnN1bmpmdDJZVEhZMGJ0cWlKTU14MTZKX2FIQzN5bFU2MmwtWEh1cUh6NXZnemJ2RGVvdEEwWERkcFlzam1rMkxVMFljOHl3bFBLbE5Rc0tmVlZKcXc?oc=5
2026-02-25	Google	0.0	Eli Lilly stock price today: LLY slips as Zepbound pen rollout meets Novo’s trial, price-cut shocks - Bez Kabli		https://news.google.com/rss/articles/CBMivwFBVV95cUxQZTd3SF9oRmZSTFJ5dXg3TkdhQThsZzVRV1BmOGtmRmFLV0VKWE9qSVhrNC1ZS3dFaVBybFFFWlQyMGcwVjNrZk1mZk5neEh4dzR4X1ZsRl9qd1gybVB2bXVYRjgtWGlucXQ1bllEaEZkUWVCYjZlQ25ValozZ0ZiVExMNkdmYjNwZ0FwU0RBLXFfTy1BSWEtekpaaElaNF9OYUhVVnhCekpGc1VQaHlxZ1NXUElERUdqRm1PYjhhTQ?oc=5
2026-02-25	Google	0.0	Is Eli Lilly (LLY) Pricing In GLP 1 Growth After Recent Share Price Pullback - simplywall.st		https://news.google.com/rss/articles/CBMi1gFBVV95cUxNMU8wU05EQ2FkOEl4alBrNDNPR1NpT0s5NERHeGE2R1F6Z2I4WENfdTUwZnplN1NuTms1OURnd1JwMEU0ODVVd1A0VC11UzU0NVBSbHRfQVktX2NwUVM5SlZ2Y3JtTENuUml6REplWEFpeElrZVJCcFFiSm5mektJZUpRLU45WjhHWHV2SG56U2k4VmRfVFA2YzdhdzF6bjBkc0xHUzBHQWY2S19nazhWbW5LbmpNTU4wREpQNUdkc2FCbUNCcmpCUnRDenZpeVNWV2dHdGJB0gHbAUFVX3lxTE9zeXhzMDQ5cXl2a2RDWGk4MnNwbnNhXzI5WUpiZldHdW1lV3JNZThKMkhuR2VCaDFwMjBjYVlqTnV2UWRnVnJRTDJHanZGYkRNYjRCeGpfQVVqazNCWjlucnpSSjZOQ3FBLS1Sa2dBMF9Md211ZHJSYXR2bVEwMnhxZlNTRXNuWmdtVDBNTGlkWlJ1X05yTDBUSEJBRHBSdkVZc29yR0RSWEJUUk5HNmZDaGZiUDZVdGFIUWNDejBjRUZpRWtyNlYxTVF1bDZEVnFNVmVYSFUwa1FlZw?oc=5
2026-02-25	Google	0.0	LLY: RBC Capital Initiates Coverage with 'Outperform' Rating | L - GuruFocus		https://news.google.com/rss/articles/CBMisAFBVV95cUxQbFoxUWZPbUh4WmlyeUQ0V3llc2pJcjcwOWhiaGh5WXRBblh2czQzVlMzU19DVXYyQXl2cVJCTzI3cFgzZ2p5a3pBeW5RYzlYZ3h3QWlmNVJkbkdRSFFRNmpQaWFtUlFrbUs0X0tjRU1yNUhyU0lvOE53Zm5pNzI0SXFNY09sMWFlQzBkSUZ3YnlubTBNcGE2eXVXOFpUUXhGT2Q0bE54YjVsLWF5WEVXVw?oc=5
2026-02-25	Google	0.0	RBC Capital Initiates Coverage of Eli Lilly and (LLY) with Outperform Recommendation - Nasdaq		https://news.google.com/rss/articles/CBMiqgFBVV95cUxNczNqWnp1bUdIYW9SbzYwMmQ1MWE4dmtvZnhLNGpJN3FWMU9sS2d4bFFUVGZ2czd0cklhM0hxcUdKNlZURmtZWXRTQzdhMXVhRzdoWGczbURnRHpPcHMxTkpjQ0lHOGNCcE5UaG5UWkRXdVRod1VLM1NDeXlkU3V3SWRHelVPbEZsVzh4QXJ3VnFCZEdOSFVrLXRtLVZsZG9tZXJnb3dTNkZaQQ?oc=5
2026-02-25	Yahoo	-0.017	NVIDIA Announces Financial Results for Fourth Quarter and Fiscal 2026	NVIDIA corporate headquarters NVIDIA corporate headquarters in Silicon Valley Record quarterly revenue of $68.1 billion, up 20% from Q3 and up 73% from a year agoRecord quarterly Data Center revenue of $62.3 billion, up 22% from Q3 and up 75% from a year agoRecord full-year revenue of $215.9 billion, up 65% SANTA CLARA, Calif., Feb. 25, 2026 (GLOBE NEWSWIRE) -- NVIDIA (NASDAQ: NVDA) today reported record revenue for the fourth quarter ended January 25, 2026, of $68.1 billion, up 20% from the pre	https://finance.yahoo.com/news/nvidia-announces-financial-results-fourth-213100479.html?.tsrc=rss
2026-02-25	Yahoo	-0.05	1 Reason Why I'd Hold This Weight‑Loss Drug Leader Through Any Market Crash	Although pegged as a weight-loss stock, this drug maker's core business has long been diabetes.	https://www.fool.com/investing/2026/02/25/1-reason-why-id-hold-this-weightloss-drug-leader/?.tsrc=rss
2026-02-25	Yahoo	-0.069	Novo Nordisk Cuts Wegovy Prices in Half While Its Stock Sits Near a 52-Week Low	After finding itself some unwanted attention this week, Novo Nordisk (NYSE:NVO) has dropped 22% in the past week and 56% over the past year, now sitting near its 52-week low. As a result, Reddit sentiment has followed along with this downward shift, sliding from a quarterly average of 56 to a weekly average of 43 ... Novo Nordisk Cuts Wegovy Prices in Half While Its Stock Sits Near a 52-Week Low	https://247wallst.com/investing/2026/02/25/novo-nordisk-cuts-wegovy-prices-in-half-while-its-stock-sits-near-a-52-week-low/?.tsrc=rss
2026-02-25	Yahoo	-0.125	Why Eli Lilly Stock Slumped Today	Investors worried that the company could take quite a revenue hit due to a competitor's move.	https://www.fool.com/investing/2026/02/24/why-eli-lilly-stock-slumped-today/?.tsrc=rss
2026-02-24	Google	0.5	4 stocks to watch on Tuesday: HD, AMD, LLY, UPS (SP500:) - Seeking Alpha		https://news.google.com/rss/articles/CBMiiAFBVV95cUxOMFJka1JwY2lrRW1zeENwRW5Sa1FnN0xkdmJGVXpidXVpWDNndFVuSkZ1dXBzeVB4eXowM2daNWtZbWZlZ2k0RHVSeXJEdFEyY1UzeGcwbVRMemktTUhOMXA5SVZSbmd6eDdrVEhOR0ZMeFZUYjNiQW1VY3BINm9MMTByQnE2LTA4?oc=5
2026-02-24	Google	0.0	How Investors Are Reacting To Eli Lilly (LLY) Expanding Zepbound With A Monthly KwikPen Amid Rival Trial Setback - simplywall.st		https://news.google.com/rss/articles/CBMi1wFBVV95cUxNS3dTZjV0ZVBOYnJFeU5zNFRRaG9LVWxYM2dVdDRaTTl1TlprdlBBS0RXUG9zQUNTNDloRER6bGZDTjhoeEhDb0xEcHllQ0Z5Q1ZsRW1OVm91TklLV0ZDcERIUExmVDdTSlBVVjR2TlVMXzFVWkp6dENKbmhiSVVhSGJUV2x1aGRURi1rMmxteTRqdGZIaW02LWZEUlFHMlkyajZNMGhhMFhNcUVfb004a0o5bDVlWEl6WWpkaGdPb3NNeTR6am9kQkpwbTQ1b21OZUFjUTM5ONIB3AFBVV95cUxQMjFtSHB1Zy1VbVZYRmdJV3lSM0p0Yjh2cll0ODNvby1WTmZHVVJ3V3hWRGc3NHZVY0lXeTZlbVo0MGs4SFAyRWFodWhqRmh0SUxrREJHMWxDOUM3dHRiNlFjYk00MkNRbG9Wd2ZuMTN6UGVEcVhPclVJS1NIeHFMQkRwWV9UdzNlUC1Zd1Y4QmtKY2Y2a1J4M1lpRDFGSGFoQXlrTmpnT3owN2xfNXpGUnNJbU5OUDRsYkFjajNEdXRjWkR2Vkl3WVhtMF93aDhoczQ3REFoaENfTURz?oc=5
2026-02-24	Google	-0.156	Eli Lilly and Company (NYSE:LLY) Stock Price Down 1.5% - Time to Sell? - MarketBeat		https://news.google.com/rss/articles/CBMitwFBVV95cUxNM2F4ZVJhd2VUNm5vLWdsUlVMNlNOZTVHN0lTUGt3V1BqYVMtbXpBQnhwcG1NQ0c3NzZpZ1N3Rk9KeEMwTW1walV2OGlaamZFYnVLajJWeVdwVjdzQ2xDbDFHcDdwSldqOVIyZnQ0aFdNU25PMEltbFlDTjhaMzJHTE5KTUw3dXhucENuQjdYMDhaRC0yWWNVNnZoenJWYmhDTElocno4YlJieXZ3cnIxNWFBekJReDA?oc=5
