Date	Source	Sentiment	Headline	Summary	URL
2026-03-05	Google	0.375	Eli Lilly’s Nvidia AI Deal And Pipeline Progress Versus Rich Valuation - simplywall.st		https://news.google.com/rss/articles/CBMi1gFBVV95cUxNYTBoN0hZMlE2VG5XbDJCanBGN3MzZ1J2UFVXZDh4bVY4Mi0xRW8yMTh1MXJjM1JhLUhxNXNJYzVhTGFsTkUwaVh1UkhMakVvc2hJZGhwU2pyT0ZPOTUwTDJuVWQtSUlyaTlHMEtvSFpRS2NMWGkyaF8wS0JIdkFiQVd5U2xjYmItWS1LcDdyWTFfeEtRbC1hRGR3Z3ZPM2M1X2pjMGMzb3J5SVVmLUJDR0l1YVlNN0psSlg0QW42WFlBdGwxNFNSekYtN1pLLW9URzFSUWlB0gHbAUFVX3lxTE0xRWttYkczVTVaU3JDT1FUVmJ1QUozbGxkWUxMU3RVX09qSFBrNkdycGYxV0RBVVBfd29YYUZFdWRwLTFjdHlBVzNaM1RnMnhRSVdDQ09KaDNlcnhGZmdZdzRORFlRYU42RFVPLU41ck9VSlVKd0c3aXJYQXhtYTRYRkg5alNJUTFBZnFfLVRiQXJuOUlCQ3Jubm1ZY2xhNHo0Y1A4MHN5TEQ0am5XOVJ0YndvTjdsNHN0SDBlbUdsT2hVTTRlOUNEMDZPVXVJMGdLUXZkdUctckU0OA?oc=5
2026-03-05	Yahoo	0.291	Lilly targets employers in new bid to broaden access to obesity drugs	A service tailored to people with workplace-based insurance coverage represents a new way for Lilly to bypass insurers and expand use of its popular obesity shot.	https://www.biopharmadive.com/news/lilly-employer-direct-glp1-obesity-drugs-zepbound/813891/?.tsrc=rss
2026-03-05	Yahoo	0.214	Eli Lilly Expands Obesity Access As Oral GLP-1 Data Shape Growth Story	Eli Lilly (NYSE:LLY) has launched its Employer Connect platform to help U.S. companies expand access to obesity medicines for their employees. The company also released positive phase 3 results for its oral GLP-1 drug candidate orforglipron in type 2 diabetes, in a head to head trial against another oral treatment. These moves come as Eli Lilly challenges Novo Nordisk in the fast growing market for obesity and oral weight loss medicines. Eli Lilly, trading at around $1,003.57, sits at the...	https://finance.yahoo.com/news/eli-lilly-expands-obesity-access-130712114.html?.tsrc=rss
2026-03-05	Yahoo	0.139	Chronic Rhinosinusitis with Nasal Polyps Market Shows Strong Upward Momentum During the Forecast Period (2026-2036) as Demand for Advanced Therapies Rises | DelveInsight	Recently published Chronic Rhinosinusitis with Nasal Polyps Market Insights report includes a comprehensive understanding of current treatment practices, chronic rhinosinusitis with nasal polyps emerging drugs, market share of individual therapies, and current and forecasted market size from 2022 to 2036, segmented into leading markets [the United States, the EU4 (Germany, France, Italy, and Spain), the United Kingdom, and Japan].	https://finance.yahoo.com/news/chronic-rhinosinusitis-nasal-polyps-market-223100924.html?.tsrc=rss
2026-03-05	Google	0.136	Eli Lilly Targets Employer Coverage Gap With New Obesity Drug Access Platform - Benzinga		https://news.google.com/rss/articles/CBMizwFBVV95cUxNU1FwYUVuZ0RuU3RjYmJBdmtxeXYxbVMwdzFCSlh5SkNVTk5JVTM3d3luRzlKOWRzeUpPSXplejNTZlp0T2lkLUxtOHNUc2M2OTB0cmpVVlJaX2VJUzFEcFJmNXBqdUJBSWZWeTJ1VHg0OG1yYk9hVWpQOG03QXBuR0x6TzlMWlNxUVJxZ2FranRPOWtua21YTDJYN2doX0hGNE5pcUtvRU5mN2QzWXRzMTJ2ekREbjZnUkZ2OWF1cDFndGZCeURGTkZvTy12Uzg?oc=5
2026-03-05	Yahoo	0.133	Swarm Oncology appoints Bernhard Ehmer as Chairman	Company announces manufacturing readiness and financing extension ahead of first-in-human clinical study London, United Kingdom, March 5, 2026, Swarm Oncology Ltd. (“Swarm Oncology” or “Swarm” or “the Company”), a biotechnology company pioneering novel T cell therapies to achieve long-term remission in patients with advanced solid cancers, today announces the appointment of Bernhard Ehmer as Chairman of the Board of Directors. Dr. Bernhard Ehmer is a physician-scientist and veteran biotechnology	https://finance.yahoo.com/news/swarm-oncology-appoints-bernhard-ehmer-070000808.html?.tsrc=rss
2026-03-05	Yahoo	0.125	Third Annual Bio-IT World Venture, Innovation & Partnering Conference Returns to Boston May 19	Cambridge Healthtech Institute today announced the agenda for the third annual Bio-IT World Venture, Innovation & Partnering Conference, an exclusive gathering of more than 200 senior-level investors, corporate executives, entrepreneurs and startups, with a focus on connecting capital, technology, and science to accelerate drug discovery.	https://finance.yahoo.com/news/third-annual-bio-world-venture-152700635.html?.tsrc=rss
2026-03-05	Yahoo	0.118	Stock Market Today: Nasdaq Cuts Losses As Dow Still Falls Nearly 800 Points; Eli Lilly Hits Sell Signal (Live Coverage)	Stock Market Today: The Dow Jones index dropped Thursday as oil prices spiked. AI leader Broadcom jumped on earnings.	https://finance.yahoo.com/m/a4d246a3-8f4f-3c5d-aa72-53d45a667a26/stock-market-today%3A-nasdaq.html?.tsrc=rss
2026-03-05	Yahoo	0.045	Lilly Employer Connect platform launches with over fifteen independent program administrators offering tailored obesity coverage options to expand access to patients	Eli Lilly and Company (NYSE: LLY) today announced the launch of its Employer Connect platform, introducing new options to help close the access gap in U.S. obesity care. Lilly's platform expands choice, empowering employers to coordinate with independent program administrators to develop flexible, transparent solutions that enable employee access to obesity management medicines.	https://finance.yahoo.com/news/lilly-employer-connect-platform-launches-110000558.html?.tsrc=rss
2026-03-05	Yahoo	0.011	Lilly Stock Down 5% in a Month: Should You Buy Now or Steer Clear?	LLY's shares fall 5% in a month amid pricing fears and obesity-drug rivalry, but booming Mounjaro and Zepbound sales and a deep pipeline keep growth hopes alive.	https://finance.yahoo.com/news/lilly-stock-down-5-month-131200638.html?.tsrc=rss
2026-03-05	Google	0.0	(LLY) Price Dynamics and Execution-Aware Positioning - Stock Traders Daily		https://news.google.com/rss/articles/CBMiywFBVV95cUxQbUlmZm1SaHBUcWNySWRFX0ZacjV3N3JVUkRoSk9DUFlicVBpSkJQamJsdURvQ3dpY19Oa2lFdzZSbVQ3Q3FBNXM3YVhRbW5rOVFIcGkyXzJuVGpWWmRMVDFjMjc1VV9SSTl1UW1iUDU5RGh1clhCM2hZdDlEQ3VtbzVzWlhlbURjVUl3SlFZUjlkVWV6UlhrbUZDcmtFUGppaUwyeTV0cnpCNWJycEtyb25KaGxlendkaEtIX3BWblFJNURwejYyZjR5Yw?oc=5
2026-03-05	Google	0.0	Cambria Investment Management L.P. Purchases 1,026 Shares of Eli Lilly and Company $LLY - MarketBeat		https://news.google.com/rss/articles/CBMi3AFBVV95cUxPTW14RFRMWnJscV9JMVBadUVfVnFNUGliWkRDTno4cFd3T1BqMTZuVV9uTjNqd3UwNTdvUmN3S29heVlNQUhLa3cxa0hDMF9aNmpLbzdwZUc0cUg0d2dLaFowdkpZcFZidVJmeHhTRk03aFEyOG1JTTNFU1l2WTFJbC1FS3hlSlY5WW8zdl9OdFl5eWt5TVBJU05LTVhMRHZ6V05wVGVjVGt0RHgyU2RvYkZabV80NHlyTWFrS2dQVGM0cFl6WjZGVE9qODJEOWV2WW9OS3ZLUFJMWWhD?oc=5
2026-03-05	Google	0.0	Can Eli Lilly Stock Withstand These Pressures? - Trefis		https://news.google.com/rss/articles/CBMiqgFBVV95cUxNWEtuSTY5T2Zsay1yNTZOSjlfZEZfdHVBWkx6cWNtc3B2NV9yamF5eDUxa2JkNWNiczEyTWV3T1VMZng1d014b2JVX3JzUnRvWUZuZWxGQlN4NmJ2amU1RUM5M2MyS2UxZlBpajdqdDQxdXpNTHIta2JyUGw4M3dVV2kxNWVzdExlU0VVMkpGZ0hCV2g2SWIwNUFMZEw0T3ZLREVmbF9TX3FYdw?oc=5
2026-03-05	Google	0.0	Corient IA LLC Acquires 1,000 Shares of Eli Lilly and Company $LLY - MarketBeat		https://news.google.com/rss/articles/CBMiwwFBVV95cUxNMlA1M041bWJTaXcyaURqNkxEV091MWpFTVh5SE9GTmtNWVNDU3REQmZZZ2dYNnRZN2ZZUTljYTV3b21OWEd2eGVCR1JhT05ORzRDM0FERXFBUHUzWXZEUnFCWUtqS29FOHhKMWpXOXFQbXZTOWx5WXoyWDJqT2hoVHk1M1pJYVV6dkV0d1VScmZLWHpNTTFkZDE4THN3OV84RDl2empiWDA5WGR5Sy1qb2JzbFJEWkJ4N0hUNWFpUWlCY0U?oc=5
2026-03-05	Google	0.0	Crossmark Global Holdings Inc. Sells 1,008 Shares of Eli Lilly and Company $LLY - MarketBeat		https://news.google.com/rss/articles/CBMi0wFBVV95cUxPb2twSThiWGpoQkNhOWRMbkNPaVE0bF9NeE5RQk1GRDl3empTbWpYMjJoVWpjWEQzTzkwUjNKcGtGQWJaaERVLXREZzdaVnFxajdfS19sdF82RUpQTGs0alZ3X2c1ekpFRXdBYldHTUhXRWVsZG4zQU9CaW1KNVg5QWhlVWQtWm9UbDcxN1JFVGhOUmlqRVZjTi1lYjRiUmlBRHZ6aHNfbjlEVXJfTlhlQnlrWTg1cDRmNDhwSllWb2hJU0VoTU05SS0wSXRfY3VEVnQ4?oc=5
2026-03-05	Google	0.0	Eli Lilly (LLY) Launches Employer Connect for Obesity Drug Acces - GuruFocus		https://news.google.com/rss/articles/CBMipAFBVV95cUxOcVZSVTJaUkdVV1I5UHZVbmtVdXhJQlVWek5obWp3Y0V2VWZHRXczTkJlVzZPQUthb2NBMFBLNGJzWndkR3RtUnBqNi1qMU5MTWRnQmY4RjRFR0N0S1VuOFpJNlRPeEFXZTUtWllpT1Y1cTcxUGN3U0I4WTBUUl9xT0pYR2F1amtKeFprdkRpT256Yl9sNUpjU0pRVXR4LXBXT0ZULQ?oc=5
2026-03-05	Google	0.0	Eli Lilly (LLY) Launches Platform to Expand Access to Weight Los - GuruFocus		https://news.google.com/rss/articles/CBMitwFBVV95cUxNdlJ4N21GMXp6MUZ1V2JoYVp5ZmZDanZTWnZKNkYtWUVDeW8yT0k3OVVSbXc2Z2c1aWs3bnNsRmFFTW04THJuVGRjUzFQeDc5LXRsTEJIRGxXQjVvNlFNTWFCVGk4anVnakc4V3FPQTZLZlpxMlBCMjZXVVV4cGZ5d3dTVV9uZkcyalVHOURqcW1Oa3ZBYy1RTEtuT0JvNDdjWU5TTTdvMTVHdTZtbWJmcmRDZXdyNnM?oc=5
2026-03-05	Google	0.0	Eli Lilly (LLY) Unveils Employer Connect Platform for Obesity Me - GuruFocus		https://news.google.com/rss/articles/CBMitAFBVV95cUxNdUkzemh3ZlJ2RDhlQ2RWSnVFc0dFZDJMdThRTzNiOG5RMFRqcVRXR3p2S3dQUWg0QmI4RzFCSG1aRVJKTUU0d2RiLXNlblhlZFJ0eXIybjNPdE5GTXMtS0x2MURLSVdBd1E5VHNBYm40TmhzTDJkZGpPZWFFcGxxakdHTlA5dVRUNkc0VXVJZDBQTk5abnVIcDVzM0F4TVNyYWJWcUNFekZYLWE1eWpKeVdPN18?oc=5
2026-03-05	Google	0.0	Eli Lilly Stock Can Sink, Here Is How - Trefis		https://news.google.com/rss/articles/CBMiqAFBVV95cUxQYUZWYnppOVZ6bjFhVjk0eVRTTTl4WHplMXVSd0ZJeUZaTlVKM2RrRk16b3pMTVBzTnhNNkFZaDZtXzZ0Z2Q5bGVkTlF5WEtkMFpib09rcFdpWDZDcEtSUFplZFctaFcxbHpZZW5fel9nVnc5VUs3VUFScjQxM1ZSRVg4dTNVWm1KYzVYTDhhZlQwM2h6c2pVYXZ1dUQ0WkhIdDRxbk9NSEY?oc=5
2026-03-05	Google	0.0	Eli Lilly and Company $LLY Shares Acquired by Davidson Capital Management Inc. - MarketBeat		https://news.google.com/rss/articles/CBMi0wFBVV95cUxOcng5WEJNUktvYXdfMVNCdmxKTzBhSjVCMWVQWnJsVm5PMGg5clNkeTBPMzRNYnI4Zm8xVHl6YXVQWUlvejluc05mYTdMOEhyZmc4aDZaQ2pJWU1xY3pOQWZDVGc5QzdidVNoM3ZKSWttYzd3ckEzZWtQMXZGSnJTbG9oMk5fMTJ1SG85aVpKcklPVVo3Rk5id2JSbUszOTZIT3J1dUJuQTR4YzhScEh6QzNxTGdyNG40NFFyLU5MV3Y4ZFJxRjNiZnluYTlmSnk5SVNj?oc=5
2026-03-05	Google	0.0	Eli Lilly and Company $LLY Shares Sold by Orion Porfolio Solutions LLC - MarketBeat		https://news.google.com/rss/articles/CBMiygFBVV95cUxOVnNRcEJSVmU5QmxPY19FckNub1NIQnFCVGluS09MdDBSU2c1QUhQbDlIUnpaVnB4eUtPWTdBTDVnQWo2R3lSN2hmcnB1NVBHOUtkbldoWHhiN0NSbExTRnlfd2ZkSXR2N2dOMGpseFYzUEhuVTJUeUkwWXJNV2ZpX01UbGFzaThDaUk3aXJzMXl1OU5BV3JZNVlmVkdwMk01dUgwc3N1WHdENHJaei1zNW9zN3dLMG93UXlNWXVkSy1lRlREYTdtazN3?oc=5
2026-03-05	Google	0.0	KCM Investment Advisors LLC Raises Holdings in Eli Lilly and Company $LLY - MarketBeat		https://news.google.com/rss/articles/CBMizgFBVV95cUxPeVljeHVmZGlPTFVXZHVRcEVhVlJHTlVDLUNVVXo2TzFvSS1ZQkhhYVdLaGxiRjAzYXhWQTB4cEx5aF9sX3VrX05yZzVBVGs5cHhpWERtRGd5VjNob2JvN28ySjVvZHppZGV5cklaMEp0ZmhBOG5PYjZGWER2T1NBSUVxTV9RMjZiY2wyTzRxYWhMTjl5ZVlKd0hiMHd4VG0zYU9EekxVZF9iN2huT1RDV2d2Q3lDRkVFVnRpV3V2NWhnZzVhdGliOGVwa2VuUQ?oc=5
2026-03-05	Google	0.0	Lilly program to drive employee uptake of Zepbound (LLY:NYSE) - Seeking Alpha		https://news.google.com/rss/articles/CBMiigFBVV95cUxNc01nRGQxTm9rNnZtWFQwQUtlaF9tc2t3YlJpTllxUjh2cTBPODJIT19UdHRfUGlvdEI0djExSTRTTjJwRFBIelc5V3ZMSjh4c3l6bGUwSDRCRVl2MVdJdlJWbVJkOXZ5bzIzaHU1Q21TY2ZhVEZ1aklHVHJETkRCWjdXTHFXRDZUS2c?oc=5
2026-03-05	Google	0.0	Quantbot Technologies LP Cuts Stake in Eli Lilly and Company $LLY - MarketBeat		https://news.google.com/rss/articles/CBMiwwFBVV95cUxOcGNUT09SbGxpRURSb1dsU3lyb3lJSVF2V2FkMDNHWE51UW9PbnBIcUtIUWpkVjIzVTFyQlBMbm5KYTV6S2txUDl6UjJWOVp3UUlzc3U2WUpMX3JYX3BjN1BfYV9IWTNIWGhlR09rbFNkZTliZUQxdENIQlpDLWNRVjJVV3dBN1J5QkNiM0N0U0ZldVdLcUxVaTFlOGRoeHBaSVZxVUhyczk1cWhMaDRENGlvMWI1a0hZNFl5bldsWGhoQk0?oc=5
2026-03-05	Google	0.0	Stonebridge Capital Advisors LLC Acquires 8,003 Shares of Eli Lilly and Company $LLY - MarketBeat		https://news.google.com/rss/articles/CBMi2wFBVV95cUxOdDdhRThqVDA2Q2hYelBpaDNGd25GTEx5ZnA0OXBMUk5oUTNfT2FxcjBMZG1DbHFUM0Q4NDVXUW5RcXZ3R2hLTkN5ektvd1NjSUZTR21ET3BUb1JUalJ2NzZvbk94OHFvLW9xenZ5aXRQVGZUOUctX1g4eFBCa0NTVlFTWnZPODFuVHpHeDBIa1RqVFpOU1hHRjlhenY1LTRaUEg2RTNRc0loZE5GQUNOR18xYUZXNWVsODZPamdkWlE3UWtqcjZtSHR5aEdCTjBDcnJkMDNWanlTRXM?oc=5
2026-03-05	Google	0.0	What Are The Biggest Risks To Eli Lilly Stock? - Forbes		https://news.google.com/rss/articles/CBMipwFBVV95cUxOOXY1Szdob0Vuc2hJVGpYSXNXYzVWdjdERkRTdHk3Mm4ydC1ZeVdnSVhrZ2VBWHkxYndSUVF1bjZtbHNnUTYzQ3BhdDFySzZXREZZSjVkbnRmV3VfYmpoVVpwV1BDQ0hMRV9wNlo0bzlDRjJuTUh2cjdNaVNPWGVhb1ZhZmlIdXRnT0w1VXk5TkZqbHNyNzBEVFhsaHp0eUlmckw0TFNBcw?oc=5
2026-03-05	Google	0.0	Your Boss May Soon Cover the Cost of Obesity Drugs. Here’s Eli Lilly’s (LLY) Plan - TipRanks		https://news.google.com/rss/articles/CBMiqgFBVV95cUxOOU9TVHlFdzhsaTBNdFJ2WW1vTklJWVoza0FONDQ3R3FRcTRmOV9KcE1iR0dnU0lBQV9qSnBQNS1UZC1sQWVqM2hXWTZKYjh4bU5fc0RQR3hTNlE1bEVjS0lXOWtUeFBiNE9VV0xjYU1NeXVFbmNHcWlRcUM1b3BJU19vLXV1SlZVOWs0R1lvR1NUR1F5aWs5TzJwemR2OF81SURfM0JsbnR1Zw?oc=5
2026-03-05	Google	-0.156	Eli Lilly and Company (NYSE:LLY) Trading Down 2.1% - Here's Why - MarketBeat		https://news.google.com/rss/articles/CBMirgFBVV95cUxNc2tIQ2hxbnExM05IT3NweGg3TDRPcXpWSjlSWWhla3dmVFpoUmhoSnJ3Szk0ZVlCUlk4ajZIVW9kYVVKMklrV2lwakpNcDRMbUxjbkw1czVYLTRUWWVPcHAyWTdiTXVDTHpfSXE5LXZhem4tZGVZQ0FpTDNRU0hLdzFiMVJCbUZ6MWVISHBNMGFBNzdyMWRldjRFcmRHQzdLdURSTEFhYzRmdWdpbkE?oc=5
2026-03-05	Google	-0.312	Eli Lilly’s TRANSCEND-T2D-1 Trial Completion: What Retatrutide Could Mean for LLY Investors - TipRanks		https://news.google.com/rss/articles/CBMi2AFBVV95cUxPUXBpOFZhbmV4QVhkTVlJbFpLam9ia0RUVGNQY0Ruekp3ZlJ3Qk0zeHJueHJNeFd1ZTJ3SExSM3QtaFRCNmlIWW5hZFZYVEtHZzZBX210RzdhVmJ1NE9ZV1RKalY1c2MyZnZQZVFLUDdmZkdLckYxa3FMcFd5TjBLeTB2d1liTXVoSi01Y2VJWnRkLWFqQUNCQVVhdW5DcFhZSU1aY2xnVXM3NHppd2syRll3Z1Zrc0p1VHluVVRqYy1zNGNtSFEzcGJ3TWw4SC1rd19UYjRIMEU?oc=5
2026-03-04	Google	0.542	Here's Why Eli Lilly (LLY) is a Strong Momentum Stock - Yahoo! Finance Canada		https://news.google.com/rss/articles/CBMifEFVX3lxTE01Uk01V19pWFA2VDJpSjRpdURMNk1wRW56RThlVEFXWDNtdWlOUmFKSmllRlhCZUlFS2FtajJZV1RCTUc5WUFyYjJZYTNhakdZRmVWTF8tRUhSdWdiekhSUF80V0lGN0wzemhsX0ZjdTg1X1M2VFdjcHd1cHQ?oc=5
2026-03-04	Yahoo	0.5	Aktis Oncology Details Radiopharma Expansion, Fast Track Win for AKY-1189 at TD Cowen Conference	Aktis Oncology (NASDAQ:AKTS) used a presentation at TD Cowen’s 46th Annual Healthcare Conference to outline its strategy to broaden the reach of targeted radiopharmaceutical therapy beyond today’s most established targets and to provide updates on its two lead clinical programs and manufacturing and	https://www.marketbeat.com/instant-alerts/aktis-oncology-details-radiopharma-expansion-fast-track-win-for-aky-1189-at-td-cowen-conference-2026-03-03/?utm_source=yahoofinance&utm_medium=yahoofinance&.tsrc=rss
2026-03-04	Yahoo	0.456	Here's Why Eli Lilly (LLY) is a Strong Momentum Stock	Whether you're a value, growth, or momentum investor, finding strong stocks becomes easier with the Zacks Style Scores, a top feature of the Zacks Premium research service.	https://finance.yahoo.com/news/heres-why-eli-lilly-lly-145004588.html?.tsrc=rss
2026-03-04	Yahoo	0.308	2 Top Growth Stocks to Buy in the First Half of 2026	A decade from now, you might be very glad you did so.	https://www.fool.com/investing/2026/03/03/2-top-growth-stocks-to-buy-in-the-first-half-of-20/?.tsrc=rss
2026-03-04	Yahoo	0.298	Eli Lilly Pipeline Updates Support Valuation Case Beyond Injectable GLP 1s	Eli Lilly (NYSE:LLY) received a positive regulatory opinion in Europe for Olumiant in adolescents with severe alopecia areata. The company announced successful Phase 3b results for combined use of Taltz and Zepbound in psoriasis patients with obesity. Eli Lilly reported significant progress for its oral GLP-1 candidate orforglipron versus Novo Nordisk's oral semaglutide in Phase 3 trials. Eli Lilly is adding fresh momentum outside its flagship injectable GLP-1 portfolio, with new data and...	https://finance.yahoo.com/news/eli-lilly-pipeline-updates-support-011434415.html?.tsrc=rss
2026-03-04	Yahoo	0.222	Jim Cramer Says “I Should Have Pulled the Trigger on Regeneron”	Regeneron Pharmaceuticals, Inc. (NASDAQ:REGN) is one of the stocks Jim Cramer looked at. When a caller inquired about the stock, Cramer said: Oh man, you know what? I should have pulled the trigger on Regeneron when I sat down with them at the JPMorgan conference. I realized that the Charitable Trust should have owned it. […]	https://finance.yahoo.com/news/jim-cramer-says-pulled-trigger-150927854.html?.tsrc=rss
2026-03-04	Google	0.2	Eli Lilly Unusual Options Activity For March 04 - Benzinga		https://news.google.com/rss/articles/CBMipwFBVV95cUxQempSYmNLWmg5VUJDbEFKalFmYWEyY0d3bmZEQ1luTnhqcVRYUUdKYTNBLVktd0RaMHQ5N3BSZ29Fak9LZHo0RmlrTGRtdzdMejR6VEE3VEdIMkhXUHB4cVQ5MDZlSDZsel94S3hidnltRl9udU9CMDNGQkxBMUE4U0FGUVkxUXlDV1RZbC1kMlFvNjdwRFBpN08zMkk0NEFZSTgwU19NVQ?oc=5
2026-03-04	Google	0.181	Does Lilly’s Broad Pipeline Wins in Obesity and Immunology Reshape the Bull Case for LLY? - simplywall.st		https://news.google.com/rss/articles/CBMi1wFBVV95cUxPcXhEeC1BR0g4a25hQnNNTnJEOHpJWDJQbnlIcGxZa1YyTnktblFrU0NkbFVmUld5NFpjdHRxNGtzRFQxNlloTnhfVWp0ZEhCZDg5Tmg5YVZudlVnVDh4S2J3TUl1MFVSRWk2S2J2RnRfYWtyazlWUE13Yk1ETlp0dHZkQnlZWFF5ZFpKU2dXUGhfOHFfLVlrUjFidHRWU0VIb0N4S0xNZ2gwLVREdTdNdzB0VXFWaHZWRV9ObW02UTFtbHRpeTlkeHp0MWZOUldMeXZVQXRNc9IB3AFBVV95cUxNNjNEX3lycWh4OWRERUlWamFRUmJWYUJoQkxjbTVHZEVUbXpIeWZfVGg3ZEF5RWdMbkF6VG5zTkxrWk9Ca1UzS3dITUtFU1VtQjNFMlB1cUpNQTJEbHEtVnRESHJGbDZQYk1NWW9iU0pOaXhTNjEtdGFDXy1vYW1aXzd0MUotT0U0THFPWWtQZFBxRlJtNTVfSE5EeW5mWVR6YW1nUmlRWTA5a2RFemlrdThJNm03Z2tMSkFjdHY0X0RBZVZkN1dpa3ltSk5iVnZWWVEwck5ocmdLVWVo?oc=5
2026-03-04	Yahoo	0.18	Forget AI. This Biotech Stock’s Taking Off Right Now	The market seems to be falling heavily out of love with the AI stocks, and for good reason: CapEx is rising at a staggering rate, especially among the Mag Seven AI darlings, all while the question marks surrounding ROIs get bigger. It’s easy to predict how this will all end. Such heavy CapEx and a ... Forget AI. This Biotech Stock’s Taking Off Right Now	https://247wallst.com/investing/2026/03/04/forget-ai-this-biotech-stocks-taking-off-right-now/?.tsrc=rss
2026-03-04	Google	0.118	Richard C. Young & CO. LTD. Makes New $13.88 Million Investment in Eli Lilly and Company $LLY - MarketBeat		https://news.google.com/rss/articles/CBMi3wFBVV95cUxPRlk0aFloZ1YtZ2hLbDhFTVJLOXBXQTVoRVhxTHBFQS1Fc1lkS1lJczZRWE1NYk5Yb3BnZnd4dkFLLTlmTG44Z056OTRiTnk5Z0NoRVFfWlJhd2Q5WFM1a0ZUak5xQjhqS3U4WlJDVGpVWEppSXFzLTNJMGxjQjZwSjhDWV9sdU9oNFFrTWdwYi1NWUp2MGNqeDRVU09raUlqeVlrSkNsNFU5MmZoZ2lzSlhSQmo2REZNWGM1V28wcS0waUtmemk2SGg5OW9VQXd3bVdjVzBfdnk3aXdWdmZN?oc=5
2026-03-04	Yahoo	0.083	DIA 2026 Global Annual Meeting Reimagines the World's Leading Life Sciences Forum	DIA, a global non-profit organization of life sciences professionals, is bringing a fundamentally reimagined and future-focused Global Annual Meeting to Philadelphia from June 14-18 that builds on more than 60 years of scientific rigor, regulatory depth, and cross-sector collaboration while redefining how the global life sciences community connects and advances medical product development.	https://finance.yahoo.com/news/dia-2026-global-annual-meeting-181600261.html?.tsrc=rss
2026-03-04	Google	0.0	Cresset Asset Management LLC Sells 2,664 Shares of Eli Lilly and Company $LLY - MarketBeat		https://news.google.com/rss/articles/CBMi0gFBVV95cUxOeG5Cc1NuYUlMSW9pSmd0WXZ6bGpEV1ZIZTE5Y003cFRfSTRRWjZUMnBlQUZ6Z3JzQXpQVEJSSHM3S2J0NW5GN1N1eDZzOFl6OWNueGY2THoxRjRONjIxVkp5b2UyNWZnZVZmdXo1cHNEazdWQTZzQmEwWW5NU3JqNkJ4dXFMVEEwVERrM2g3OWJWZmVETWZSZXNWN0Rpc0xtRXM0NDl1SjNwMGxBdWM0anNsYURyVXhRSU1HRVNaRUNvc0lPVFN4bDdEUHVmS3ZSelE?oc=5
2026-03-04	Google	0.0	Eli Lilly & Co (NYSE:LLY): A High-Growth Dividend Stock for Discerning Investors - ChartMill		https://news.google.com/rss/articles/CBMiwwFBVV95cUxPSnotS0E1SmRDUXo0djFGTkxvNG5xS28wVTV3WEJfV18tb3VrdUs1YmlPbi15bWV1a1VEbmVlemE4WW1teEs3VmJqZUNMQ2pVMlpWcGppX3ZGdm1XRnFPYkZGUlZlN1hkbW9oM0RGd2dOT3ZqRGI1bXhNWXpITm5HUzY3S0lWMGRtdzF5Qk54a3F1Z3djbmE2ZVFFdm1fcV9fTHhDb0VTZjdDQUcwUkN0MUpNTE9SV3ZhaXhYU2R5RTZiSUU?oc=5
2026-03-04	Google	0.0	Eli Lilly (LLY) Q4 2024 Earnings Call Transcript - AOL.com		https://news.google.com/rss/articles/CBMic0FVX3lxTE1OVXgzZGw3YmNwMGJxUkNxR2dTNkVvY1RhNWdxU1AwSVcta19KbFdNbnZpRENZQW9RM2xqNnR2dHdjZWN4R2hkRDdYQjNNaTlwVzQzcXhNLVVrMFFlWTU0Slpsd0U3M3RrUDJNVDg0Z2VBS2c?oc=5
2026-03-04	Google	0.0	Eli Lilly (LLY) Stock; Slips Again Amid FDA GLP-1 Ad Crackdown Concerns - CoinCentral		https://news.google.com/rss/articles/CBMiwgFBVV95cUxNcGY5UjZRb3oxQ1JKd24wTVFuOEJaQ1JmelpkVEp1TGFHeTkxN2N6cExDQld3NlFiQTdwSFRTdWRmWmV5N3FvenAySjk4ak9jQk1XalFjWWZ2b3p1SUVuNWMtTnNDQ0E2MVEwZ0czQWM3RVdUb2UxUW5LbVdSdzdmenBOVUJIZG9GUGZfTDR6THJvOEZrbzh4WVBsYk41M2dGREx2Z3pTQXpvaGhtSVhhSDNZV0VZUFVteHQyUzlQZ3I0QQ?oc=5
2026-03-04	Google	0.0	Eli Lilly and Company $LLY Stock Position Increased by Dimensional Fund Advisors LP - MarketBeat		https://news.google.com/rss/articles/CBMi2wFBVV95cUxNbldPaFNRcjlUaEhNdXRucEt1SXV0eDZWamwwZ3gwdkl0TDNLaHB3RHVENUxoeHF3RGp1RXFpOUxIcjZHbS05X1FCeVNVOC1kVE1kVTRYYndFWmxWYUhaTkhBTlE3aXdKdXliWmhMd2pVQjRwSFowbEJUMndRUDZ2by1ZaVROTDlGRTRnb1ZaZHg4MjVwcDlZRkFZSDRaVlN4M19yU095YTVKWFAxeHFtZ0JpQVNKakcwYjdfRWYzZGN2Szd6X2R0bnhENkd4U1piakVhOTZSUE1EZ1U?oc=5
2026-03-04	Yahoo	0.0	Hims & Hers Slips as FDA Targets GLP-1 Compounders	Agency sent 30 warning letters over marketing of compounded weight-loss drugs.	https://finance.yahoo.com/news/hims-hers-slips-fda-targets-171821410.html?.tsrc=rss
2026-03-04	Google	0.0	Picton Mahoney Asset Management Lowers Holdings in Eli Lilly and Company $LLY - MarketBeat		https://news.google.com/rss/articles/CBMi0wFBVV95cUxPZTZDU0tmUlJqeVZSY3hsWDVDZDlnX3lIU3RHTFQybXAzUXc1QVJNZHM4Z1U5Z3Q5Nl9Sd3pkOEpQLW9BSUdQU2pjSW1lUkw1Y1ZnQzkwVW1CR2JmMjdiUVBLYi1wZzhSZmdqR1lxSUNXeV9Bb0tJVVd3WEE5NUNpbXJXaDlybDVLeHdqTjFZNy1UTjFOWGZHT3dNN3g1UEQtdTNlWk5CNEZvQ050bHJHOGxuWHpmWHZVYTlodkhsQUhSY3h1aDhSVURXTU4ya3NEcDZv?oc=5
2026-03-04	Google	0.0	Ventyx Biosciences completes $1.2 billion acquisition by Eli Lilly, delists from Nasdaq - Investing.com		https://news.google.com/rss/articles/CBMi1wFBVV95cUxQMVN5aDlRMmxsQjRsMUxOQTZtdngzMG9PTUJQd1c2cjhBOVdGX0FQdkhIN1BjbjBVM0JjRVdIUmtnWU1pMjRBeVNXSllHZUtSNDhEa3p4NDNEUzZPay1IWFBuUy1DWktsS2pHc1I0WnZZbHU0OHBwbGZIUzVKVXFvX3BPX2FuMUEycWlMclcyNFdQaUhKa0hNcEVJc1AtWE5aZVdObm50VlpGVk5peXZiWl8xRzVaRGpleFlRYUVPWjE5U2xJRXJsbUg0NEdTQ2ZTR2ctX3pqMA?oc=5
2026-03-04	Google	0.0	Wisconsin Capital Management LLC Has $3.87 Million Stock Holdings in Eli Lilly and Company $LLY - MarketBeat		https://news.google.com/rss/articles/CBMi6AFBVV95cUxOVnBXUDZIT1U5QVVuSF9PeVRpcDZ1d3dTaS14bnNXT2JyV01qOWx3SkRIOU1wdWY3ZDZaTThvdks4eVAxUEV4RzVIcm5LaTc4bzZHN0x2WmUzUFVLby1FOUFERVNkcndiWXhhdmhqOV95REVWSHBvLVpXRUVjckY2WTlRX0RyRktURTNMT2hCamkzaWxvMmlIWk5OT2h1V01kTUR2Ri1WZkdaZEdxeklOeEZLWWNPWE1GSnd5TGdNd3RZMmZpdTRBN0xCS0N0Y0JDSU9ZX25TRW1RWGdMaWdiUVhzNl9MVEpf?oc=5
2026-03-03	Yahoo	0.5	Should You Forget Eli Lilly and Buy These Unstoppable Stocks Instead?	Lilly is leading the pack in the GLP-1 race, but this isn't a sprint, and you should consider more than just weight loss drugs.	https://www.fool.com/investing/2026/03/03/forget-eli-lilly-buy-unstoppable-stocks-nvo-pfe/?.tsrc=rss
2026-03-03	Yahoo	0.433	Zacks Industry Outlook Highlights Eli Lilly, Johnson & Johnson, Sanofi and Bayer	LLY, JNJ, SNY and BAYRY ride strong pipelines and M&amp;A momentum as Large-Cap Pharma rebounds in 2026 despite pricing and patent risks.	https://finance.yahoo.com/news/zacks-industry-outlook-highlights-eli-094600250.html?.tsrc=rss
2026-03-03	Google	0.136	AR Asset Management Inc. Makes New Investment in Eli Lilly and Company $LLY - MarketBeat		https://news.google.com/rss/articles/CBMizwFBVV95cUxQTXE1S1RGSGlZdGlkWGVtRWFVRTVFQjc5ZWVhZmljWUlkSmlMVGRvRGIwdWpJTmV5ZFFaZkppd05xZFJXQUhBSFZ0bDZDSTNhS3NqRVB3WlBONTBJcEk5NWtNMGIwNWtCTE9rbVVhVnlGUjFFWnVKLWhtSE9pcEdzTTFBNElTYzRuVWo2SzlHR0tVYlpSR3RFeFFodEkydmVHZG5EeXpfVjEyd2tKSDVmdkZaeTZEcXd4d1Q3aVphc3BWblhUUnJKTWpwTVlTQ00?oc=5
2026-03-03	Yahoo	0.044	Eli Lilly (LLY) Valuation Check As Momentum Cools After Strong Multi Year Run	Eli Lilly (LLY) has been drawing investor attention after a stretch of mixed share performance, with the stock showing negative returns over the past week, month, and past 3 months, despite a positive 1 year total return. See our latest analysis for Eli Lilly. At a share price of $1,017.97, Eli Lilly has seen recent share price pressure, with short-term negative returns contrasting with its positive 1-year and very large 5-year total shareholder returns. This suggests that momentum may have...	https://finance.yahoo.com/news/eli-lilly-lly-valuation-check-100845935.html?.tsrc=rss
2026-03-03	Google	0.0	Becker Capital Management Inc. Has $16.54 Million Holdings in Eli Lilly and Company $LLY - MarketBeat		https://news.google.com/rss/articles/CBMi3gFBVV95cUxQNVVSOUlfVWhEVjFRdHlpSWdvdkgzRkVTM2RVRzFrU1BhcGpvNXV3NndGUFpQTUlvc2ZOZU5ITUwyeGxtZGRXUVhYYmhyaWNfVGUzR1hMWEUyNVdrVXJYTmg3MXZQNlhaeDY4TW53ZWZIeXlIRWVkZjJMLU1BVzdjY0llOWlsc2hUZjJ3MjNoS09iWUlIekJSbUd5bjdkVEZCOGxrZVNJS1FjSEEzWVZTMmpRVzhtS3piajNWeVhrZHBTaVQ3eWtwaE9HRnZMZUllbVBKQ3ZEOHQwMzNnZFE?oc=5
2026-03-03	Google	0.0	Buying LLY at a Discount? You Are Getting Paid to Do It - Trefis		https://news.google.com/rss/articles/CBMitgFBVV95cUxQWTcyM2RVam5SRkR1NFNYY3Nwd1pqY25XN0s0RVpGZndkMjQyOHNvTzdrSXhRSmxlNmlDWHpUZm1jZmdlZDNzYVdMemVINU9ETHBMRHk0TmpqdXJ2LWp1Q2U2d2UzU29xdldINVcxWGRiVHFRNGtQakFseTQ2Z3lmRWFCMS1MVGpxQzlNYWVFVUw4RnFfZEtOREhNLVNOekJBODJPU1VOcTFMX1hhUE1rQ0J5enJHUQ?oc=5
2026-03-03	Google	0.0	Eli Lilly (LLY) Monitored as FDA Targets Telehealth Firms for Mi - GuruFocus		https://news.google.com/rss/articles/CBMitwFBVV95cUxQcGh0OFQ5MEZhQmhPQ2g4bW9SWTBEMllpRkVPTHVMbFNzMEpob21NNk54aENnNm90NnBhYjAySjc4YUgzOTRoNE90UmlYYnVYVDdnbnd3OVFxNzhhZE51ZmRzQ3UxbjJvR1VIelMyT0JDc2VjcV9wdVZZRDc5YlpHeE5UVUZWdVlfbFduQkl2X0dDQnlYVkpxX0t1bVRZV3pSYkdrRmpSWkEyaUg0UGdxNlFLaWx2dG8?oc=5
2026-03-03	Google	0.0	Eli Lilly (NYSE:LLY) Advances Biotech Scale Across Obesity Gene Editing Nyse Composite - Kalkine Media		https://news.google.com/rss/articles/CBMiyAFBVV95cUxNVUlWc1F6Zk8zNkdGOFAwdHRCcXJZZm11Y2R0Sl94UjFlMUUzTEd5aEMxcDRYY2FhenFJcnNHcWNBRHI1c1FtZ1RCR2M2WjNNeUJLVDZDUFliRXA3RE1fUUxQOFcyTWNsbnF1dUxiNjkzMzk3ODFLTUhFMGRJdlhQWmFIeGVLY1Q3SFBTZzBoVy1BSlJuTWxqbTZLQ0ROTkdmQ0VRT2h3OHAyYUdtdlAxckhJMlI5b1ZfYU1DYldNWWNZVDF5dVdRaQ?oc=5
