Date	Source	Sentiment	Headline	Summary	URL
2026-02-24	Google	-0.5	Novo's 'Flashy' Ozempic, Wegovy Price Cuts Unlikely To Impact LLY Stock, Says BofA - Stocktwits		https://news.google.com/rss/articles/CBMiygFBVV95cUxPVmN6dmR3WjI5eThiOENDRl9VMlhyb0NxTmVyblBhN1U3ZFV5ek85Q0xUVkE5YVZ5dUFINFpVakN5Q0ZNQkFfcUlNa2RhZmhRZGUtT3BLZHBOVTRIM0tBQTVINHhiMUZLVjA0X0V6eXAyNEMwYTQwVGdCaEp2UnpZOVFHcFZGY0FQbnFENGI0QlBmZ3pnTFIzOHNVSmZhSGpCcGp6dV9CWUJITmF5U0U5VE16WXZaLUZLN0ZxQ3FJQnZXWW5GWEpoWU5n?oc=5
2026-02-23	Google	0.433	Barclays Begins Coverage on Eli Lilly (LLY), Sees Strong Position in Obesity Market - Finviz		https://news.google.com/rss/articles/CBMisAFBVV95cUxPcTFILW9kNFhTTTNvY29KT25Yd0JGV2Qzd2ZJRjZxd2tLWnk0YlQ2eW12ZlFQTTlrUWJnSmFTdmNPRDdqbUJwLVEtamxsdmRaUzA0eFVKUnA2b0NvX2E4bTJrNlFYRzdLbG45MXZ2UDJ0WnBSYjFGMEJWUWNIcjZZLXEwR3Y4QS1pTUctaHpCcF9MckphbjctOEdIaWpyYmxKdjFNWW5VZUtQOHl3bmtsRQ?oc=5
2026-02-23	Google	0.3	Eli Lilly Trial Wins Broaden Growth Story Beyond Obesity Drugs - simplywall.st		https://news.google.com/rss/articles/CBMi1wFBVV95cUxQYVZYdmJTTmM4b0F2dFpJUDh4RUMzZi1ZTm9kTktkclRtbmx3dm5XVjZHRG8ydFVuWUNMZ08td1o3UXhzWnpRZzhMUE9TMndrSjdkYWg0VFRCbG90NVkwdGMzcDNwZE5ZZ3R4TThRczZuWWtLY0diYWhOOEFwNERZUld3bFBxVHFqbGNxU1NldGo0VFRUdGkyd2R4ZTMydUNsRkpVUDVRcFhGOHVoWEV3ZlBmVk9KVDVMMktidUlEMHJQZnBCODFUQjNURVpTTzFSakxlODRta9IB3AFBVV95cUxNOHFVMjc0M3ZSYnpIR1lhVVVKTVlQS0ZpSTNHeVhNWE1GblZJMy04UzM1dzIzeEQzcEtmNXFPNlRlV20ta0t6dkJFVGJScHRLYVNyWFBmTW1HWkJ4dy1fXzg2Z2h0WmNneHlEOEx4UUVaZ1g0ckNCOGluRE00cXZVMkFqYVBCZURCeHdpVmQ3NkZWdldKM0dDalFmRmQ4X19rc3Y0VWZtdGs3bzB2alZWZVBDVnJkZUxWSUY5NTRnTjFsQnJYMVVPNE1oZzBLQXVjUEVoenVxLTRRbm03?oc=5
2026-02-23	Yahoo	0.136	Equities, Treasury Yields Fall Intraday as Markets Weigh New Trump Tariffs	US benchmark equity indexes and Treasury yields fell intraday as investors assessed new tariffs anno	https://finance.yahoo.com/news/equities-treasury-yields-fall-intraday-191014456.html?.tsrc=rss
2026-02-23	Google	0.136	New Zepbound pen packs a month of weight-loss shots into one $299 device - Stock Titan		https://news.google.com/rss/articles/CBMisgFBVV95cUxQTXMzeDhKZHJUVlpXSUpKRkdFUXR5ODlsZVF4aERXRkoxSVh2RkU1ZmhydU1pZHNSSVF1Y1JoTE1mZDVEbl9KcWdoQjJITFBodjl2Z2NuYzR5Y05KU2dyeG1wejkwSjNaQUtCbGU2RllsSElMWEtwUDhES2lLbUZDclNPTm5KTjFPdVktempFeElsYml1eDdacExTVEFLcE82Y2RKdjExcEJiTmZsTlQxWjBn?oc=5
2026-02-23	Google	0.105	Eli Lilly (LLY) Expands Pipeline With Positive Trial Data and New Licensing Deal - Insider Monkey		https://news.google.com/rss/articles/CBMivwFBVV95cUxPMGhjbU4zMGFOLTNXU2lFTGswaHRCZ1FvU2xEZGtCSm5NZnVfU2FrTnNBcE1BZDFwWjJNRndXT09fMk9iMEhXaHNuNWw2ZU9nR0RjNkZSWC1RVExpTzF1alY0elFEd0dWTTY3cGFkcXNCOEg4cTBnWkdVV2g1NmdKNmctTGRPa0FDT3NBTTBUUVhWd01lanJkbk5peDhYdW0zTTQ1VXJmV3IwcW8tOEk5SDBzM2twR25NeTBuYXVKSdIBxwFBVV95cUxOdDhTZEFwYjNPMzdsODdUVWtkVi1tUW9LVENXLWVVNkFqZU5NUGtiSkhCNHEtNHhqVkstbkthcGY0SE5hNTNZUy1pY2JsV3V4U0ZSREVXa3pxTHhwbDQ0cjFYQ2pCanJfSDRoRUthVDhjOU9aeF9LSzJDTU14VlIxaG1RWEl5SnJLRlNoczRWdjZTWnpsS2xTYTNydklOWEM2aFAyYzJmVU05czhTaHFGWGJvU3N1SlB0YXlyRXQ2cnRnenRZbUdZ?oc=5
2026-02-23	Google	0.0	Eli Lilly (LLY) Stock Is Up, What You Need To Know - Finviz		https://news.google.com/rss/articles/CBMihAFBVV95cUxOczBYR09XV01pbktWUmtycVRxeXJvZUdreUpaUDIwT0hCOUxsc3VJN01fR0xLUUFBZXMySlp1UXVMVk1hYW95QTRPWkxHSTRRNHRnQjhCMS02NENYNy1pczFrS0RYcVpjLU9ob0RFZXdXOVR5TVlfYVlQQW9fOXFGN3RvQTI?oc=5
2026-02-23	Google	0.0	Eli Lilly (LLY) Stock Is Up, What You Need To Know - StockStory		https://news.google.com/rss/articles/CBMirAFBVV95cUxQaEU0NzdWS3d0N1ZSbWVMZDdTVVVzbC01akFkZzNmRnRmNmNHdi1vaEJIUE5MaTZUVEt3alBfNG8yWV9RUFFvTG4td1FHcUp0QXE5dlF1aU1BR1VTNnRQcmg4LTBZcVd5eDFueEw3UzA0SmRSVjRkcjNGaFRTYWp4QWpqNnZYWWtjOXVkSU5KZ0hYUkJuSkFMSVJ5WG9weGYwa2wxcUxrQmhWWE5w?oc=5
2026-02-23	Google	0.0	Eli Lilly (LLY) Stock Is Up, What You Need To Know - Yahoo Finance		https://news.google.com/rss/articles/CBMiekFVX3lxTFB3b3o5MWZ6bFpLYmFVM2xDMmtVZFJDRWRsckRjVXNCMm5Fd1otaF9kQmJZRmM1UlZmS2kwemNLT2M4YUQwWk1QekNfelZNaWFDWVZybFV4SXJoRy10NXdfa0xGaUtCeW43VS1KZVBGdkZSdFZYSm9vUGxB?oc=5
2026-02-23	Google	0.0	Eli Lilly (NYSE:LLY) Development Updates Drive Buzz As S&P 500 Futures - Kalkine Media		https://news.google.com/rss/articles/CBMisgFBVV95cUxQTTRLdkd3bGNYeXFIeVM2VW9waUppei02dVlpMVMzMHQ3VzlsNzgwN1d5ZWZ0bi1GNDB1T1RwdXo4ZXBnWmwxSkExX0h0QUdySlhxNV9MQ3J1bHpsRDA4U0NQVkxTWlcwQW44UjU4OGpPZ05QRXhkblN3eml2UE5BbnU3YjcxaEVvZE9sX1hubDV1N2V6ZFVtUlRTZXBNVl9VQUFLMVhlWWs1ZzVocFVGN3JB?oc=5
2026-02-23	Google	0.0	Eli Lilly and Company (LLY) Surges 5.1% — Developing Story - AlphaStreet News		https://news.google.com/rss/articles/CBMiYEFVX3lxTFBnMDlJc2JQdndDQmRMLS1pN3Nxa1VjQXdfaHJaT2pIUFkyMUVTcVZtaGJ3cUtwUVhsS3NWRnBHUWJhRzFLR09oMzd6amVrV3g3Rm5XcHJBcjNCUDc4c2JaRNIBZkFVX3lxTE5jc29pd01HZ1MtbkRTWEotTWliOFl2NWNjWXNjSmwtWVZPSVpRUXpJSEpoZTVWR0FnTGpzbVNySkQzUXhjQjNTMlV0a2l2S0tQYnJFWjhGX1pkTEtrM1Q1QnNxSkdfUQ?oc=5
2026-02-23	Google	0.0	Eli Lilly rises as rival obesity-drug trial data strengthen tirzepatide’s edge - Quiver Quantitative		https://news.google.com/rss/articles/CBMiuwFBVV95cUxPa3JDalRNXzNZMUhBaTB6UnhCVHRBUVNiRE1uT2RmTzgzWXJxUm14U2lZUVBtVDFoOWgzZHpWa0xYaGw4SkhZd295b1hBMTZMckt3b1hQa2xUcFJpX3l5YjU0Sm1YNl9uSUJBNXFCX096cEd0WF9faEE3TGRVU0hnVlhUcWJ3N2l5TEN2UzZXWUxVMWdCcnZEZUpRMFpHR0ZZZl9rVXNXZEdVNm5PNzFGU3owa2twcWlicjVN?oc=5
2026-02-23	Google	0.0	Final Trade: LLY and GDX - CNBC		https://news.google.com/rss/articles/CBMidEFVX3lxTE5kV295ZFBQakVwNkNocnVkSkFWZzlIb0tZeEV0Q1lSX2tHNnlPMkJ1S3RDRlhjUUd1Wjdwa2tPMmZpYjZfU3d0YXNUbHZKQVJTUnNWQ1VMcE1tNnN6ZkFzT3NTbmxRamFwSFQyYS1nQzYwWkxt?oc=5
2026-02-23	Google	0.0	How The Eli Lilly (LLY) Narrative Is Shifting Around Obesity Leadership And Valuation Risks - Yahoo Finance		https://news.google.com/rss/articles/CBMihAFBVV95cUxPM0RTWmxmMWZ6alhTenJYQmM1b0pIOVIxWncwSUhvOWk3c1ZZME5pMGpUTk82VFpqalN2UVFMbVBqYVpFQW85d1pXZkJndDlwbF83X2xwVXlqT0lOSk43bzU2SDNXVnJrZVRSMHY1X1Joam5BOXFoQ2h2WnVBUmctVldScTA?oc=5
2026-02-23	Google	0.0	Instant View: Novo’s CagriSema setback may shift investor focus to M&A strategy, analysts say - WKZO		https://news.google.com/rss/articles/CBMiugFBVV95cUxPT2o1a2I1cEZ3Sl9CUGZ0MVZaNTdVcUZXVXAzcnRqQTM5MlRDNGVUZ3hTNGhjRDl2dE5zZWw4bWVZR2pkaUxtVzJWMTh3RHlSTEpnNjlXMnJrbVZPdDlhSzNyeDc4aVdmd3E0Wm5LckJ5SWY2V09XUXE5Y3ptZ24wOGJoVWFITXI3WHUzVnZmYzZnQjZ6VzRDQVNBZm9ST0pzVmhZd21sRTFobVNhaWJ3c2dxT1k5S2JOYlE?oc=5
2026-02-23	Google	0.0	LLY Stock Quote Price and Forecast - CNN		https://news.google.com/rss/articles/CBMiT0FVX3lxTE9BaS1CbmRhaWdiSHo1UVJLMVlDQ3ZYN3ZCaEg4QUtoUmJKeEw2R1Ryek03SjhFdFd5R1RLV3BXaFRGcUFjVHdjdHNzTExNN2s?oc=5
2026-02-23	Google	0.0	Market Today: Tariffs, AI Jitters; LLY, MRK, WBD in Focus - GuruFocus		https://news.google.com/rss/articles/CBMilgFBVV95cUxQN3g0ejBZWHhaQXFkOC1vejgwbW5LQTNMRDd4M1YxcDh3dTJINDdxblBQWnVFUWRNY0MtRG1XUXFNa0NfbVBlYWNabEdNY3ZWeV9xUGV1YlhBdmNFSE9MMFo1Z1JfOUVqWEVBM2R3a25vNDdDc2JncVBBeVJLMkdOX3RiSmhOekZhYjUwQTRjMWg5MjBqUmc?oc=5
2026-02-23	Google	0.0	Novo Nordisk (NVO) Drops 13% after CagriSema Misses Eli Lilly (LLY) in Head-to-Head Obesity Trial - TipRanks		https://news.google.com/rss/articles/CBMivwFBVV95cUxNRkhTVkx5c09YYW5YeWRQY0JQd19EQXluMS0wMFVnS09Jc2ZSYUxfbDQzNjhWNWItSTlzcFJXT0I4azBoTndSRWgxSzd4NjgzbFBjMmNwRjl0aE56azFxWHFJUmhYWXNCeUQxeUc0aG9Bbzk5Mk9pemphTGk5NWFYMTg2RWkwLWUwOXRXU1YzVnVwVWwxdUNoYlBsRlVkVG1LRjJ6OThSeG9MRmtRSWdvVE5pQ0k5TWkzY2dzemJmSQ?oc=5
2026-02-23	Google	0.0	Novo Nordisk's Loss Is Eli Lilly's Gain - Benzinga		https://news.google.com/rss/articles/CBMimgFBVV95cUxNam5zdW1pM29ld3MyTWNsUXNEaTlOZEtabnBDalhFV2VVMFl6aXhuYkZLaGpweHZKREpHYmJHUTRsYTFEaGZIbG54aU00NWJ5RGsyNEVDcEVISHhYcVpyVmI4S2QxdTgxQmRhb3JqLUtYdjNfV0hiQVAxTzQ2eUM2VVhYTWdWTGVmVlRhakVhaDltWXBoYUhPZEdn?oc=5
2026-02-23	Google	-1.0	Novo Nordisk Stock (NVO) Tumbles in 'Worst Case Scenario' - Eli Lilly (NYSE:LLY), Novo Nordisk (NYSE:NVO) - Benzinga		https://news.google.com/rss/articles/CBMi3AFBVV95cUxQelZ0T05VX1g2UDNGREg0SWN0c19aNVh5dGFhUl9KU2U5bFRER3RqbDNPTk51cy0zcGw3WVljWUhpeHdpUjI0Q2FOOUFwNVlYZEdtZU9QZW8yTG5Bd3YtRnY1bVBWM3R1ZEhOVkJGdEV1ci04ZXFmd0pFYUFDdlFBQVZhaEhDQ2gwcFY4aDNtZ19CZEJxenNSWHlES1Z1cWMzZVRzYm9hdVZoN2FsZU43VjM0WURSWDVHbzZtZEFmWG8xemQ0SmIwckdINjlzRXo0d1hjcUpLUHFGcEJv?oc=5
2026-02-22	Google	0.0	Eli Lilly and Company $LLY Shares Purchased by Princeton Capital Management LLC - MarketBeat		https://news.google.com/rss/articles/CBMi1gFBVV95cUxNMHU5bXFiVnIxdDByWW9vWG5aVWhVaTcyMzRYYm5DRHNWQnlyYmUwcXZ1bDdDeHNwSG40Z19wV01mUk1laDlDZ25ON3dHTlZ5NW1OdXRrZjdhbkw4S2JZSEJlcmVvSVNRMlR5bHZXdHRyV2xib3d5UThYUTd5Yl9CelZNWF9VUEhELXZZM05xTmt4ei1qdFY2Ry1HcVF4VV9HdW9SNDZRSk1jeEh4dVAxVVEtSTdXWWJ5YkhUYnU3QWE1TkF0d19zX3JidFNLdWdJQmFLYkdn?oc=5
2026-02-22	Google	0.0	Eli Lilly stock slips into the weekend: what could move LLY next week - Bez Kabli		https://news.google.com/rss/articles/CBMimgFBVV95cUxQTTJsVmVBcGZDazlENWVoZjRybEUwNUF2M0VXNVNQbDFIZ3BENjRxZWp3NGVHb1J5V2VIbGpxLUg3SUFTWDlwblZwdmEycnYxRW9yTURGcHdBNFlzanFEeno3V1ZrdXRkZDRCSk8wdVpCTjB2bEdqMFZyb3FpS0o2Rkl0cktEQlctSVNpb0k0cDBvbEMwMnFXSkVR?oc=5
2026-02-21	Google	0.0	Why Eli Lilly Stock Jumped 40%? - Trefis		https://news.google.com/rss/articles/CBMilwFBVV95cUxQeV9rQXpXdWdSZnQzRE5LeGRFSkhsc0gwSHg3VWE0dXFPRTZKVmhzVlAzdE45Q29MaS1DWlZWMnJnemMzcm16emNFaWoxMHB2Z0ZFRTVRY253aGRWOThzS1hYcjdiS0VtcE1uTEtfV213bnZGWUpXMG9rNVdaWXc5Tnd6eXE2R3doTW9Ra2RCb2V6QlplRnJV?oc=5
2026-02-21	Yahoo	-0.008	The Stock Market Just Did This for the First Time in Nearly a Year. History is Strikingly Clear About What Happens Next.	Market gains have left some stocks trading at expensive levels.	https://www.fool.com/investing/2026/02/21/the-stock-market-just-did-this-for-the-first-time/?.tsrc=rss
2026-02-20	Yahoo	0.457	3 Market-Beating Stocks to Consider Right Now	Companies that consistently increase their sales, margins, or returns on capital are usually rewarded with the best returns, and those that can do all three for years on end are almost always the legendary stocks that return 100 times your money.	https://finance.yahoo.com/news/3-market-beating-stocks-consider-044338795.html?.tsrc=rss
2026-02-20	Yahoo	0.431	Eli Lilly (LLY) Announces Positive Phase 3b Results for Taltz and Zepbound Combination Treatment in Psoriasis and Obesity	Eli Lilly and Company (NYSE:LLY) is one of the best growth stocks to buy for the next 20 years. On February 18, Eli Lilly announced positive topline results from the Phase 3b TOGETHER-PsO trial, which found that using Taltz (ixekizumab) and Zepbound (tirzepatide) together provided superior results for adults with moderate-to-severe plaque psoriasis and obesity. […]	https://finance.yahoo.com/news/eli-lilly-lly-announces-positive-002809244.html?.tsrc=rss
2026-02-20	Google	0.227	Berenberg Bank Issues Positive Forecast for Eli Lilly and Company (NYSE:LLY) Stock Price - MarketBeat		https://news.google.com/rss/articles/CBMi1gFBVV95cUxNbnVIWmxDd0MxdkpuV09JdDB1UDJQcUpLQUstMENTSzJxaFBLOTV1STlLakROSUxBT1c4OHJDZGxlOW51WkZGUmRpRmJEa25uSlVWSEJuaGdwRHpubXpLcHloWlc5TWdCUGxZNWU1NWpqWnZlS0NxU3VxRzJFa045QUVqbi1mU0NCSzloSWF1SnpYOVYycGVlcU9CUHBOREZXRW13c3QwaERtSnhUYkVzNHo4bkdSU2F3dkdZNHBjeEtUZzFHd0pINVVpX1VIMDF6dTItSXVn?oc=5
2026-02-20	Google	0.0	Barclays Initiates Coverage on Eli Lilly (LLY) with Overweight R - GuruFocus		https://news.google.com/rss/articles/CBMivgFBVV95cUxPTGpVZlF5MTJPMGJrRHdhYnBiRE9GdG1faGVpcU5FYWd0bkF1TTlzWkxCZ0Fid0FEZm5pNkhvSnJYSDJZNGY0dks4Y3JJNExhYVlyWkIzQWNvTmRoZVNzYV9vTVpDbEFXUXhnLUx0Q28xUHF5Z0w5d3l5dE5SalRUYjdTbmJTei1oVWl4bUpqWHpvV01hOHBMX2VVN05DNUF4VmZEUDNLUE83ek9KcTdTYzl0TlctWUxaUWdZdnJn?oc=5
2026-02-20	Google	0.0	Eli Lilly (LLY) Expands Pipeline with Clazakizumab Agreement, Reuters Reports - Yahoo Finance		https://news.google.com/rss/articles/CBMiggFBVV95cUxOTU1IeVc2aFpyZHhyWDZHMUJOT3ZxeF9ZQi1qclVPaHhqaWFfcmdXNk9pemRWNWttd3g5MFZXUUpIeUZocnMzZXpyeGJqSTJ6c2NlN2pEcVFxLU5Zd3ZLQTV5OUo5WXE1R2RMXzVQUDlUMjUxVUJOakhhOXhWaEI2b0lB?oc=5
2026-02-20	Google	0.0	Eli Lilly Stock (LLY) Rises as Company Reports Progress with Crohn’s Disease Treatment - TipRanks		https://news.google.com/rss/articles/CBMiswFBVV95cUxQaGR2aEl6SkszYW5ZeGVYNTlmb2FuSzl1LXVVYmM0YzIybk9RTFZpQnZIMTZORzg2YVR3bVRTNzk1RFYyYnI5TGtSVFZNbGJnazJhVjhmS2xMMVdmWmxJWXZKMUtSRTI5OG5lSnN1c0NrcEx6ZG9vLXVVb011djRfaEMtQ1pFaWowNlNLQlhEa0lsVWdJb0NnV0Q4NThHdHNMdGtxOVM1QWkyZzEzNmpLaDlmMA?oc=5
2026-02-20	Google	0.0	Eli Lilly and Company (LLY) Is a Trending Stock: Facts to Know Before Betting on It - Yahoo Finance		https://news.google.com/rss/articles/CBMiggFBVV95cUxPQ3prMjhUdU5ObkZ0dXh2SzhSVXNsRUdGd1lLUzNTNWR6cHdPU0pVWWxPTFNoSDF1ZUdpZ2hSWFZTZTVLbjdxZ01qdHR4RGY0LVg4UTlrWENIOEp6U0x1MW9xRDN6Ny1iWjNUeGRGNEJ5eVBoUnNpSDRZRzBsbjh1Q2Z3?oc=5
2026-02-20	Google	0.0	Hemenway Trust Co LLC Acquires 5,752 Shares of Eli Lilly and Company $LLY - MarketBeat		https://news.google.com/rss/articles/CBMizAFBVV95cUxQSk1MRk9kRG5jS0FfUzJPZUdMb19JV0NXcWwwYV82Z3Z3WkF3SGpCbWlVYVVvdXJZb1JnNGhuQUtraGhqX05kbzlGV1BBd1R6bElIdFZmLTB3MkRtUXJ6UHU5QjZJYmNDd19qZ1hjT0NwMS1IdHlMMVVFYWRNdzJvcmpTcmhjWDdKTk5ENUt3eUYzV2RfR3pQN21nYjFkR1pMWW1JNTFhWjJVUTlJYnlyelJsbWtzbjNVZ2NaUlpIQ0lNYjRIODZmdkNkTEg?oc=5
2026-02-20	Google	0.0	Somerville Kurt F Acquires 1,990 Shares of Eli Lilly and Company $LLY - MarketBeat		https://news.google.com/rss/articles/CBMixwFBVV95cUxPRzdmZUdoaDU2aXJUZ1l0Vk92SXg4OFNXWGxURnNNa0pXSXo3OWd0VVphX0Q4U3oyNWdodDJxR1hqenJ1dG5CdmhlSEVFT1JKaTk5OElEd2luV2JWRjR6cF93bVg2VXJ5cEJNZmUxYVlTaC1hNVlLYjBzRjhvamtqRUZQV2dzTEFBOVdKaXkzcHM3RlhVbjlEVFdaekVKWFFuajAtV3VqRkdZb1JFdWo4ZzV1Nl9MTjdzalh6RU1vZHYxUlRPMmpj?oc=5
2026-02-19	Google	0.227	Eli Lilly (LLY) Reports Positive Results for Omvoh in Phase 3 St - GuruFocus		https://news.google.com/rss/articles/CBMipwFBVV95cUxNLXR4a29ZQl9rdW5zRkh2WWdBOXRfYTdKZDFCeVNIaXc0MnQ4MjB5UDdUNzZSVUJEbEJXVDlxZmwtd0VwTDhOb19vS2lSRFFjWkgxWUZaOVlILUJDenA2N3J1ZENGZXJYYXFZUnYwNHZkQkkwaWptdUFHSUcyUzNGU2szemJVXzVtM3p6VFI1bnJ6eTJtU3VqMWlfekVmYUItM0V3eThzRQ?oc=5
2026-02-19	Yahoo	0.178	Warning: This Skyrocketing Stock Has a Hidden Risk	Eli Lilly is leading the pack in the GLP-1 weight-loss drug market, but this good news won't last forever.	https://www.fool.com/investing/2026/02/19/warning-this-skyrocketing-stock-has-a-hidden-risk/?.tsrc=rss
2026-02-19	Yahoo	0.173	Global Business Leaders Explore Responsible Leadership in an Era of Shared Challenges	NEW YORK, NY / ACCESS Newswire / February 19, 2026 / Chief Executives for Corporate Purpose (CECP) Discussing responsible leadership in an era of shared challenges, leading CEOs who are a part of a coalition of more than 200 of the world's largest ...	https://finance.yahoo.com/news/global-business-leaders-explore-responsible-224500097.html?.tsrc=rss
2026-02-19	Yahoo	0.15	Eli Lilly Trial Wins And Gene Editing Progress Versus Current Valuation	Eli Lilly (NYSE:LLY) reported successful results from the TOGETHER-PsO Phase 3b trial combining Taltz and Zepbound for patients with psoriasis and obesity. The company reached a second key milestone in its CRISPR-based gene editing collaboration with Scribe Therapeutics. The LIBRETTO-432 Phase 3 trial of Retevmo in early-stage RET fusion positive lung cancer met its primary goal in the adjuvant setting. Eli Lilly, trading at $1,020.56, has seen a very large 3-year return and a 424.5%...	https://finance.yahoo.com/news/eli-lilly-trial-wins-gene-011549892.html?.tsrc=rss
2026-02-19	Yahoo	0.137	Overlooked and Undervalued: Why Novo Nordisk Stock Deserves Attention	Novo Nordisk looks attractively priced even though 2026 is likely to be a tough year.	https://www.fool.com/investing/2026/02/19/overlooked-and-undervalued-why-novo-nordisk-stock/?.tsrc=rss
2026-02-19	Yahoo	0.027	Is It Too Late To Consider Eli Lilly (LLY) After Its Strong Multi Year Rally?	If you are wondering whether Eli Lilly at around US$1,020 per share still offers value, this article will walk through what the current price might mean for long term investors. The stock has had a mixed short term run, with a 0.5% gain over the last week, a 1.7% decline over the past month, a 5.5% decline year to date, an 18.6% gain over the last year, and a very large 3 year return that is more than triple the starting point. Recent coverage of Eli Lilly has continued to focus on its...	https://finance.yahoo.com/news/too-consider-eli-lilly-lly-190838789.html?.tsrc=rss
2026-02-19	Yahoo	0.001	Patients with Crohn's disease maintained steroid-free remission for three years with Lilly's Omvoh (mirikizumab-mrkz)	New long-term data from Eli Lilly and Company (NYSE: LLY) showed Omvoh (mirikizumab-mrkz) delivered durable efficacy through three years in adults with moderately to severely active Crohn's disease.1 These data from the Phase 3 VIVID-2 open-label extension study were presented at the 21st Congress of the European Crohn's and Colitis Organisation (ECCO) in Stockholm. Additional data presented from the Phase 3 VIVID-1 (Crohn's disease) and LUCENT-3 (UC) clinical trials showed Omvoh-treated patient	https://finance.yahoo.com/news/patients-crohns-disease-maintained-steroid-171500571.html?.tsrc=rss
2026-02-19	Google	0.0	Assessing Eli Lilly (LLY) Valuation After Recent Share Price Pullback - simplywall.st		https://news.google.com/rss/articles/CBMi1wFBVV95cUxNM3ZIaU1NeU5RSkVwTnJqR01nY1VCWkFRSmIyR3JwZFQ4aXZjZW5GajVFNzlNVTdjWlBkdEFPNjZnZDhpYXJyeXFmcUg2OHZLUGJnVmtoemVFMm1UakFKd19qV1RtM3c1MWMwVWJ5SEs5anZSZWN4NS1TUHA0YVpMV1JXQTN1eWlyQkxrUGVJeFlvcjN6RUM0RmJ3clJXZzQxREtXV29xcE90YS1Xb3FtTWl3VGx0R0QyTXVQemJvZWc0ZEd1bWVIbTVLVjEwN1c0OG81THk3VQ?oc=5
2026-02-19	Google	0.0	Burling Wealth Partners LLC Boosts Stock Position in Eli Lilly and Company $LLY - MarketBeat		https://news.google.com/rss/articles/CBMi1gFBVV95cUxNYnJpNV9McTJOdWMxNEVwMkl0cnlVZHFDOHRMX3Y2V2FtZlA2cmphQnVhZFduNDgxVENXYTVqQndzSXpJQTlwb2dmY0xYcWx3X3h2akhZS3llREw3XzJyZzJXUVNheXNxREo1U2UtT0RqWFRvWmNwbmF4UXdKYTFOLWUxZDc4Njc0aXdBVngtRUtCN1NCc1lFUjVjMm9Ebl9WS0J0RlQ0U3BPVVdPZHpubzZjb3ltM2V5WkgzZkVPdHoxb0tkTklnNklNN0VVLWwxM2Y1OVNn?oc=5
2026-02-19	Google	0.0	Comgest Global Investors S.A.S. Sells 89,083 Shares of Eli Lilly and Company $LLY - MarketBeat		https://news.google.com/rss/articles/CBMi0wFBVV95cUxOMy1oa2trU2syU3RjOGh2WllyLUxpd3hBQVlCd3RDQ0dnM01hMTJHdnhVWk9xcFZ6cWhwZzRTVHJkekZSUS16bFNWSDhZOGVDbGQzR1F0b1BfMmJneHRKUkNfYjNpeGFJOFNkaEhINjVRM3BMbTcxQXpXbGhSOUVXYVFqU1BPTVVyQW95dHlWTjJ1WVQyMnVxM2ExS0F2N1RyRjJoQmtfbjZUZWxFWTRObDU0LXNHVFV5bF9WU0dqczZvTG9Oa2VuMG5BeEprQko0M0xz?oc=5
2026-02-19	Google	0.0	Cornerstone Advisors LLC Cuts Stock Position in Eli Lilly and Company $LLY - MarketBeat		https://news.google.com/rss/articles/CBMizwFBVV95cUxORV9pdGllN29US3lfbFVkSHN4T1FsRVMtR0MyZWc4N0w2bnhuNUtHS0cxUGhYODhZYm5yQnZGdmdlYnBuZmp5RlMxSWlOMmRUMm9hejhNVlJjNHJQM2VMc0JyRGJhWkhTeGlxNXlCeEZtREJuVUpDQ3A5ekVYUldHUzVBMzB4OVlHM2c0QmJLZlFLcC1LSXhpV0VzM2d0eURYelFHMGJRaUxUOGJ6aEt3TkFpemU3ODRIYmluTUJEd2U4Y1pLYl80RDBnVGdiaEE?oc=5
2026-02-19	Google	0.0	Crohn's patients stayed steroid-free 3 years on Eli Lilly's Omvoh - Stock Titan		https://news.google.com/rss/articles/CBMivgFBVV95cUxPNEpDXzBac3RuU08ySWFhS25DcUtXWHNjTTFxcmh4dGFXZ2p6X2tzbEpOS216d2RqSDBpMlBWRmlMMmZ5bjZkTDhVSWxoMVZJdE9CTHRqUm5pNWg1eGlVTUROWVZ3Wmx5MklMa0hTdGFyRGs3enYwOFZLWDVQVl9Mb1lsV1hrdmdjN2JJSGI0TDA5UFdNWGcweUh6M3QwNmV6cUF4dmRzNWJTZkstbGJiVXotQVg3bkgzRmhOSGFB?oc=5
2026-02-19	Google	0.0	Eli Lilly (LLY) Showcases Long-Term Efficacy of Omvoh for Crohn's Disease - GuruFocus		https://news.google.com/rss/articles/CBMirAFBVV95cUxNWWJKM0ozNXVOb21HaHZmd1g2TlhyUk8wbXJnN1dreXhrNHRJTEVrSHdHQ2tXUHd3UlgwdFRENGRCNVlCVmtmd1NnbWpTX2hiMlA4X0JzRlI4UV9CeFRBbnY2TnBxNmFrUE9oaENvbUpUME43ZjZnRGhnR2l4Q2UtVFM4VFRoZlBfVGttSG5Ub3V3dnR0VG1VWXg1Y1NzdVA5U040UlB4UXlqZ3VD?oc=5
2026-02-19	Google	0.0	Eli Lilly and Company $LLY Shares Sold by Alberta Investment Management Corp - MarketBeat		https://news.google.com/rss/articles/CBMi0gFBVV95cUxOcDBlMm5fWmtmQWpHbjZTQW81cFM3a3N5cTVGR0dXdWZZdEhCRG1iR1NFdHBieHNtNnBJaTZBRmZSNXU3WVdGRU1tTVh1UmUyV2RPamxvZnpqSFZvRGZrMmtwandseDFzSVYwd1l5SGU0UFoySnFyMFlONlc1TXNJYkxNQXZWRXItOGFiNnlKdVVUOThROXQwS0JTMEt1V3RGd2RiNUpWS3A5eGpPcFdwQWxaeV9iQTYxN2RWVnFfeHBRYUh1N1VmZDhRTVlLenZZbVE?oc=5
2026-02-19	Google	0.0	Eli Lilly and Company $LLY Shares Sold by Cumberland Partners Ltd - MarketBeat		https://news.google.com/rss/articles/CBMiwwFBVV95cUxNVW8wUlg5b0Yzd0dCOXl0M09hNXo1eFJFWlRBZHp6WGZXbWxFd0dGbWlHRlZSay1NN20xYXFmRmJydnlwb29taDg1TjQ2ako1OFRDVEZjVEpBV1BYcXdjd1I2bUlBamdBbkYwbV95M2t3czd2WkVURDRkWDdoZHZhSGZyMGR2cEZNRVViUmVtc0k5YmJyREc0U2lHNFF0aTVqQjY2T2tPMDFrYWR5czRSMFMycFFtMkFoRUNEN2Z5SlBuM0E?oc=5
2026-02-19	Google	0.0	Eli Lilly and Company $LLY Stake Boosted by Harold Davidson & Associates Inc. - MarketBeat		https://news.google.com/rss/articles/CBMizwFBVV95cUxOeFBPeVJQeUJ0RzJDOVZORUNJdVE2TFlBSVQ4Q0gzMmtxcWg4RDVJTGVUU3pJYjJ2VkZzQ3N5TGJtWTRRcVBwVTV6a0lQVXZ6UW9GdWFTbm10alA0RUVoclV6WlJMYXJxVXduZmVVWmtnbGhMMzJ0VUtEckVVeDEwR2xwWjFaZ0I3UGhRbUM0bW85Qy1ueTZRMVQ1ZkVwdFVIV0p3a1dyXzRLR1dmNHFUeUpZclNzX3Q0ME02Z1BpV0pUbG12WlFsSU1TWFJ0NkE?oc=5
2026-02-19	Google	0.0	King Luther Capital Management Corp Increases Stake in Eli Lilly and Company $LLY - MarketBeat		https://news.google.com/rss/articles/CBMi2AFBVV95cUxNTUNHMGNfWFN2eFFwVGk5MGNhQkFYNTNzVS0xR1QxdnFKR1pBbktUOWozM1BXQU5SdWVWaHhfTWthNWNWM2kxZF9xUE1JSUs4SzJpX2ktMS1TY1BoejFNR1pMTkIwUGhlVWxQckdNRFU2LTU1Z2hUV2t0U0Y3bU9Ua0w5ZVpqb1ZMZnVDdXU3WWxUa3dBbmFOdkwyZEEyUWhZUGRIcHRzby1qUkxGanpkc2FIbnVNOE5jQnpULTc2ak5uYm1qZHpHM0R1amVPZ0F5V0dHUzktX1Y?oc=5
2026-02-19	Google	0.0	L & S Advisors Inc Cuts Position in Eli Lilly and Company $LLY - MarketBeat		https://news.google.com/rss/articles/CBMivAFBVV95cUxQTHYzcy0wbHBFTEl6MElEMFdoejN1cV9oY1BwVmpNaVVWcVpzLUJHbFhEZWp1S3hMNWYyU0gxVzVwRFlMS1pQc3piX0RTQTgwWUtVTjdBYWZWMVNzdkZEWWw3RFBkSlJIMHJGN2Y1UjFmVkdGbGdDb1hYV295eC1DU0plZi1CMzlDaWM4X2xXM1ZSSEhUaVJKWTYzbGlodFJucHR5SThRZnZER2pRR2FyMDBCR1M3Skc4aFFaTw?oc=5
2026-02-19	Google	0.0	Ontario Teachers Pension Plan Board Cuts Stock Holdings in Eli Lilly and Company $LLY - MarketBeat		https://news.google.com/rss/articles/CBMi3gFBVV95cUxNbWppQ3VoNThDVWVMUGNmejEzQjlPaVVNVWV5UHB1RURYcFVCTVdVcXR5ZEtOamJaZ0pKTWZVc3J3ZF9uYlFVS2s0NEQwSGVCeUxhQXJoZDg2ejV3T25tOHJmOTl3ekJZX0pzbDhoY2hUSGxvRlRfVUFPYTVQRGhsbk5mdHZsc19JaWlnWWJJN2VpZ2RwNEx2bDdQRFhlNzZ0UFpkanNDS0k3MUs4U2ZvMDREcWZxNFp0dDdaS2hOVDFBNC0yR3REQVFzNnBwRG1rUXRuSW1KTXlDWmdySkE?oc=5
2026-02-19	Google	0.0	Prediction: Eli Lilly Stock Could Surge 45% This Year - Nasdaq		https://news.google.com/rss/articles/CBMihAFBVV95cUxNYk5iSUpMTkp4a2hZbHI5VWlzS1V6Y3VFTG5oNkdpU2R2Q2tfSnVxSEpreXFYX2JCZnl4bXM4TXJmcVRvNEhlVHpXcDViblFxQlNrRGNVS1lONkY5U1dxSU9DaVJWSTRLaFpVUVBNRC1xcGU1SkxzaXNuTnZyNXZESEFnN1M?oc=5
2026-02-19	Google	0.0	Synovus Financial Corp Reduces Stake in Eli Lilly and Company $LLY - MarketBeat		https://news.google.com/rss/articles/CBMixAFBVV95cUxOYnJwTmJzdjBObWdGejBmdFh0T2Rvb0VSa1BsemZjSks3bGhVT1lmbkNsdjFaX19EQWNQVlJPTXJ2UzlITmNCS1NPU3lySnc1VW9JTkdlQ3Q1LTU3ckxYMzFkcEczWlY3QnpZRnN5a085YVY1REltTzFHYUNwMU43NjY5aWNpUnNWRDNVclNpUlVLNjRXalQtSS1RV09aa21IX1BwNkRTYnF5eUQzOWhiQVFqWEZMZjNnTDBheWdKMGVVSzc0?oc=5
2026-02-19	Google	-0.4	Eli Lilly and Company $LLY Stock Position Decreased by NewEdge Wealth LLC - MarketBeat		https://news.google.com/rss/articles/CBMizgFBVV95cUxNZXl3dWYxdXZzN0Nzc2VJbXZiZExzcUl1VG9ib01xc0RycHBlQTFNenlwbWxjN0lXeUhrWWowSGFKSjR6V1A4Rnp3bTBwbU52LUt4R1hCNkhtX09SZWd0b3haRE9LUUFGTjZIVmVROUFVbnZoeTBWZEJvRW54ZnI0TzRMRkRkZm5sWENwRTlwSjRaaWtPNW5aX3k0SWFIdlIzZy1PTHZMZGNoQy1WeXpiQkxUYWtpQ3Z4WG9NUW5BU05lbDhGd3pTR2NHdTdNUQ?oc=5
2026-02-18	Google	0.289	Daiwa Securities Group Forecasts Strong Price Appreciation for Eli Lilly and Company (NYSE:LLY) Stock - MarketBeat		https://news.google.com/rss/articles/CBMi5wFBVV95cUxPelFROGN1eVhPR1VYYm1OS2ppOFNTSTJicUxHN2Ztd1Job3pEYl9nSnQySEtCTHdTZ3NyTC1PZGg0V2w2MjJBcGsxSml2aG4xVC1fYVJfZVpDNUFCekhMSE1yYWZ4R2JIY1Y4azBJZDJHbEJadklpTWkxekMyU0dFeldIWmtCaE1sbThFaTVEVjV6TldjMVVZUVRKXy13MFdiSkx1RE1QTU5oUms5emt6R2dydVlhUUFqektlbVZsUUNvVFJFcUhMSW5UbWF4YVV6MERVdktNMnpndldMME9OOUZxaExjX00?oc=5
2026-02-18	Google	0.214	DFAC, LLY, V, MA: Large Inflows Detected at ETF - Nasdaq		https://news.google.com/rss/articles/CBMifEFVX3lxTE92em1DeFlFZENmaUxoeDRyMU9yY09QVzBfd29RWnN1M0xmSW55anZYRlF3VzFqcVgtdmRtNWRwdTR6bFFkX1dRNE54V0JlWjhkQ191cXMyb092d2JGcjFZbE5UTm51RmUzYWt1dVBkWTFfY3lhNVVMNS1UTUc?oc=5
2026-02-18	TIKR.com	0.214	Illumina Stock is Down 80% From Its All-Time Highs: Can It Recover in 2026?	Illumina stock is down 80% from its all-time highs, but recent Q4 2025 earnings show promise with revenue beat and clinical consumables growth. The company completed the SomaLogic acquisition, adding proteomics, which is expected to contribute to revenue growth despite some EPS dilution and margin compression. A TIKR valuation model projects an 11% annualized return to $158 by December 2028, contingent on sustained clinical consumables momentum and successful integration of SomaLogic.	https://www.tikr.com/blog/illumina-stock-is-down-80-from-its-all-time-highs-can-it-recover-in-2026
2026-02-18	MarketBeat	0.15	Advisors Capital Management LLC Purchases 260,742 Shares of Pfizer Inc. $PFE	Advisors Capital Management LLC increased its stake in Pfizer Inc. by 12.1% during the third quarter, acquiring an additional 260,742 shares, bringing their total holdings to 2,411,463 shares valued at $61.444 million. This move comes as Pfizer reported stronger-than-expected Q4 earnings with $0.66 EPS on $17.56 billion in revenue, surpassing analyst estimates. The company also declared a $0.43 quarterly dividend, equivalent to a 6.3% yield.	https://www.marketbeat.com/instant-alerts/filing-advisors-capital-management-llc-purchases-260742-shares-of-pfizer-inc-pfe-2026-02-18/
2026-02-18	Google	0.125	First National Bank of Omaha Purchases Shares of 10,013 Eli Lilly and Company $LLY - MarketBeat		https://news.google.com/rss/articles/CBMi2AFBVV95cUxOMHpxUjJGeC1qU2NmY2lKYWlXRnMydTNmVnZCaWFOdF83QmtkdFN4bGZOLVNsQTVfdzlsakFkZUFUVy1HcW1CMnF4ZVJULXptbEZMbmRGU2dWNHNqZGZCWERSVTJKUS1kLW55OTZFa2djY2Y1QnNGenpVcmZkQ1BseEk2eUZMX0hoTHNWdlo2TGprZ1M0ejQ4bnVrUlhGMnNrOGhnSVQzTUg4S3o4VVNfcllqYU1vZk1UUHU5RlJmX3pFbUIwcWN3VG9Wa012R2lkZ0lrTzZXN0w?oc=5
