Date	Source	Sentiment	Headline	Summary	URL
2026-02-18	Yahoo	0.0	An Alzheimer’s startup emerges with $175M in venture backing	Backed by Wellington, Sanofi Ventures and a division of J.P. Morgan, Korsana Therapeutics is studying a treatment originally developed by hub-and-spoke biotech Paragon Therapeutics.	https://www.biopharmadive.com/news/korsana-alzheimers-amyloid-beta-plaque-launch/812443/?.tsrc=rss
2026-02-18	Google	0.0	Can LLY's Next-Gen Obesity Pipeline Sustain Growth Amid Competition? - Yahoo Finance		https://news.google.com/rss/articles/CBMiggFBVV95cUxNUU1RR2NQLW85eVVpUmJzSFVKQmdWSTJaa0U0dnV4Wi1MUU4xaVFrUmJkOTlvUHFfMGxST2gxdEJfT05FT2plenRnOV9fdm1GaHh0cTA2eG9JdUpxLVdjcWgxR0FqNnYzZHlQNXFwY21xM1JwUDB1Ri14LWJrSFRKLUFR?oc=5
2026-02-18	Google	0.0	Cercano Management LLC Trims Stake in Eli Lilly and Company $LLY - MarketBeat		https://news.google.com/rss/articles/CBMiwgFBVV95cUxPQXc3RDNZanR6UXEwUzdQRHd5LUN3dzQxb2RIVWFvc3VCQ01WSWRPZ3FycmZlVldCRU1BcEpWdWlvSTZGMERIWmRtVDQ3SmlnaE41YjJhUmo1eXZwX1NPemxfblU0bXFscUxyb25ZOWxxT2JVUS1UdFdtMEhkOU9VNGZ3STJ3Z1JwTEFmdXg3TGFFQjFSYWpCdWdGYk9VQzlmN3NVM0d3MHhEODNHOU52TWlYT0xFV1NpV0c3dUhtcjBDdw?oc=5
2026-02-18	Google	0.0	Eli Lilly (LLY) Clinical Trial Shows Improved Psoriasis Outcomes with Combination Therapy - GuruFocus		https://news.google.com/rss/articles/CBMixAFBVV95cUxOY25kUWhiTXVvM0lCZVo0SjJUMWtFMm5LOVJucFVHZ0t6U3Q3OUlxc0hhOUhUNWhzOWNDSG1lNzVKcVVjc09tS2dDLUNNTjJOUmx2SURYUFB4bTUwbXhqb2lIWG5fZmJZc0dESTNjbHpUQVhwOUMwaEViQWlZS2tIdXRBRDRJVlhxZVIwMDhLVHUxTE1VTXB2TkNTcVRCbGVkQ1FWV0YzbXF0QmowSDZuSGloTnJlSGd2WUp0Ym9ZM3ZWa2Q0?oc=5
2026-02-18	Google	0.0	Eli Lilly Trumps Novo Nordisk In GLP-1 Race - Multi-Year Growth Prospects (NYSE:LLY) - Seeking Alpha		https://news.google.com/rss/articles/CBMisgFBVV95cUxQYVZaM053WmxuSmU2cUdFWkh4RVE5M2l0RU9vQk1Bb0k0ZVdFWVB6UzNFN1hid0NjamhzQWd1cXZERUNvVDU5anJZOVVqMjdtMTM0ajlVS0xQVG9hMGZDeDFVLVpGNlllNEk0eGZmOE1iTGUyMkpUV3B3ODhhQnQ0NVRrQmpnN1lnYTJpTzVWTFRSZEI5dHhDZjhpbExtdnRNazFhUFBYeHBvRFpscjVQdGh3?oc=5
2026-02-18	Google	0.0	Eli Lilly and Company $LLY Shares Purchased by M&G PLC - MarketBeat		https://news.google.com/rss/articles/CBMiswFBVV95cUxPSW9WQVpJUC0xRVZ4Z3hUU0tob09hclZ1Y2pQb2VXUjdxaXprUEJVR01DeFJqVDNjcjdrVTluWmFZTVg5bFRBbXYyNi1pa2hRS3JXc1lrNFRlSWpOM1NDMkIxNHBVX1hBUllIYnpVSGIwR21hYkVSbS1nRHdzMmk5OTA1MEE3ZUp0OTlMVUhCNE5DYkxxNmNqNjRkZDNDNVpQYUxnY1ptLXVRakR6NnVEZmxCZw?oc=5
2026-02-18	Google	0.0	Eli Lilly and Company (LLY) Gains as Medicare Expansion of GLP-1 Weight Loss Drugs Eases Pricing Concerns - Yahoo Finance		https://news.google.com/rss/articles/CBMifkFVX3lxTFA0X0FNTzZSNHk4UEdpX3BGNU1FOGdGT2FDQkxaeWwxaGp5bEFjaFhNZk9LSzBZQWZfeXNrNkp1U2pDVmFUWVN4SmQtOW5wQ21EbTJhSGNTMWxkcll0TEJ6cGxGSFlXWHNYVFdIQVRXREppM1RWZlV6ZC0yT2t3Zw?oc=5
2026-02-18	Google	0.0	Jim Cramer Discusses Eli Lilly (LLY) & Weight Loss Drugs - Bitget		https://news.google.com/rss/articles/CBMiY0FVX3lxTE40Z2duSnVpMjZzNU1GVEVKcWVZWXl4QlZrSWkyS2RBTnJwcmY3X0hzcmw4SU9kOTNWTXZHS2VOTHI3TmFEcmNXbkZrQl94UkhybjJOcGpwckZEc19sSkJDZkR0c9IBY0FVX3lxTE40Z2duSnVpMjZzNU1GVEVKcWVZWXl4QlZrSWkyS2RBTnJwcmY3X0hzcmw4SU9kOTNWTXZHS2VOTHI3TmFEcmNXbkZrQl94UkhybjJOcGpwckZEc19sSkJDZkR0cw?oc=5
2026-02-18	Google	0.0	Jim Cramer Discusses Eli Lilly (LLY) & Weight Loss Drugs - Yahoo Finance		https://news.google.com/rss/articles/CBMiggFBVV95cUxPUm8yRkdqekNPdkJYUUJHSHZraklNblpvODJfaElSU1RZVlRpd1dYTnh2Q1F5YnVQQ1BjdVkwYUtsUWlMOHRoS3lHQm4wd0ZRUUU2X1B6czMwbUYwZ2xkcVJYNDhzVURIZkZSblh6MUVLU24zcHJQbTlRWlJMUTd5RXZ3?oc=5
2026-02-18	Google	0.0	Lilly says Zepbound-containing regimen succeeded in a trial for psoriasis - Seeking Alpha		https://news.google.com/rss/articles/CBMikAFBVV95cUxOOEU4ZS1KQWFtRVJQbzd1eEc3Nm1iQ3RMdkpQNXpQRTdvTlZic2VzMHlvOEJhYjlLUlRDeVRMY1c1ZW9jUmRjelFNRmEtUXI2SVZwUXJrUElONGgxU1JrMkxOcmJqQjFTWjIzTzROLTY0M0J1MXBUZVBQVnFnT1dhSVlBRU9LdXV3UUlsdDlNWTA?oc=5
2026-02-18	Yahoo	0.0	Lilly to pay CSL $100M to license monoclonal antibody targeting IL-6	The Australian company will retain rights for an end-stage kidney disease indication currently being tested in a Phase 3 trial while Lilly explores other uses.	https://www.biopharmadive.com/news/lilly-deal-csl-100m-license-monoclonal-antibody-targeting-il-6/812455/?.tsrc=rss
2026-02-18	Google	0.0	Psoriasis patients saw clearer skin and weight loss with dual Lilly drugs - Stock Titan		https://news.google.com/rss/articles/CBMiuAFBVV95cUxPUW1PTm1HMmVtY0lrME9MOTBtYXVDaUw0eEhtM05LZ2xNQVZaRzUwX0o3bzQ4ejFnMFVaTUdiT2N2bDk2cnBwVnZsMy14T3BjYmk5VDd5eVVhbmwyNmIxbVFDWk9WbDBzOF9sNWduY3FqTDItMjlQeWFTN1VSa3I3VkZFZ204bFUwcFRONUg2Tms5Qnd4eXZ0LTVEazlCN0tSZWFkWlZZR21uMmpxTnJjeG01Q1F1RFhr?oc=5
2026-02-18	Google	0.0	Syon Capital LLC Has $10.11 Million Stock Position in Eli Lilly and Company $LLY - MarketBeat		https://news.google.com/rss/articles/CBMi1AFBVV95cUxNX2ZSUDlULWk3TXJlR2VfUWtzX3AtSG9SbjYwM3E4T0hsb1h4bVU5bHVFRk5UMDZlZS1hY2xSa3hPQmJ0dUwzYVFhZE1oME5mUWhJc0lQUHVvQmZVa1owVFowbTZUQ2ZNakQtMklBRnBXR0Z1UjR0eGNGQzNZM1dfdWs0T0hQOU83QmhzS1VDenhwME9pQWNEN0I0bEd1SW9pZmZUUHBGVzBDT1JZWk1jZU53M2syempMNzZqQXozQWNLNUszdUZidmRMN1BlV0RITXppdQ?oc=5
2026-02-18	Google	-0.05	Jim Cramer Discusses Eli Lilly (LLY) & Weight Loss Drugs - Insider Monkey		https://news.google.com/rss/articles/CBMinAFBVV95cUxNWEs5NVFWQVhZeU1SSjhWMDRUZDhBeDBTOVJrLW1SbnY1RXoxbjlHOUlSZ0R6UnpYMlNGVzQ4SEpmaHNGOEw5d2NHZlM4ZGtQQ3U4QmdmQTh6b2dzUHFGMFJmLW9UeVA2N0hubV9KTUpIQnJvSjlPUEo3X014QmZWMGl5OE8xMWhGeHJyVnlLTkYzcHp4NmFTYmh3dDbSAaQBQVVfeXFMTUV1WVJ3enJrbDlPb2R3UEZveTRJNW1rU3RVSEpUOW50NlhiSmJKN0hPdDI2UXphQmp0YmJKZV9iM2ZPZGhrZFJ5TTFRMDZKRmpGbWVneE9tM014NnVXMnJmdWJ4cURmVGlWNDhXVWFSZjg2enp4WHM3a0s4c3N0OUl5LUxLWjZMRUpTZTQtQ3V1LU54ZmRhZF9YekFhVzFZT0hwT28?oc=5
2026-02-18	Google	-0.156	Eli Lilly and Company (NYSE:LLY) Shares Down 1.4% - Here's What Happened - MarketBeat		https://news.google.com/rss/articles/CBMiugFBVV95cUxQc3pYM2lrSHdHRHdIT1NpZXFEaF9zRjJ1MXhDZHpwa29vNkwyZzhfb253alh0R3puMWJ4cEljaXUyY29RaHFNQzlrZnY0YVN4Uk11Sm93V0lQejBIM0huLXlpSGtXalhPNGtsUDd6cnVYbG41TjJ5UmU3SG15QUNHSzZpWnlYZm5LbUVlTVlSZmVneGdmOHRjUkR5WFl2aEJieW1JTm5GNGpJM1d6OGk3aFduSE0zQXFIOXc?oc=5
2026-02-18	CoinCentral	-0.235	Eli Lilly and Company (LLY) Stock: Dips After New Psoriasis-Obesity Trial Data	Eli Lilly's stock saw a 1.65% decline to $1,018.92 following the announcement of positive Phase 3b TOGETHER-PsO trial results. The trial demonstrated that a combination of Taltz and Zepbound significantly improved skin clearance and weight loss in patients with psoriasis and obesity compared to Taltz alone. Despite the clinical success, which offers a comprehensive treatment for these comorbid conditions, the market reacted with a short-term dip in the company's share price.	https://coincentral.com/eli-lilly-and-company-lly-stock-dips-after-new-psoriasis-obesity-trial-data/
2026-02-17	ChartMill	0.701	Eli Lilly & Co (NYSE:LLY) Combines Explosive Growth with a Bullish Technical Setup	Eli Lilly & Co (LLY) is highlighted as an attractive investment due to its exceptional fundamental growth, driven by therapies like Mounjaro and Zepbound, leading to high EPS and revenue growth and strong profitability. This growth profile is complemented by a bullish technical setup, indicating a potential entry point for investors as the stock consolidates within a long-term uptrend. While valuation appears high and debt is significant, these are seen as common for high-growth pharmaceutical c	https://www.chartmill.com/news/LLY/Chartmill-42056-Eli-Lilly-Co-NYSELLY-Combines-Explosive-Growth-with-a-Bullish-Technical-Setup
2026-02-17	Google	0.6	1 Reason I'd Buy Eli Lilly Stock and Never Sell - The Motley Fool		https://news.google.com/rss/articles/CBMikwFBVV95cUxPLUs2N216MG1ySjdQVWE2QWlfdFdsbDcwUGNGYUpITUVhNTdINlB4ZW5FNDd5ZWtKQUVSMDBON3l4YndnLWJ6VE5SSFdaT1YtdktPWG91ZFZoT0pxc0I5UXNkLTVxYnFfbDdmZkp5WjRXZERSV2hiRVJJeE9nV2o2UkE2YXBYdno5b2x6UlA2Y2dtN3M?oc=5
2026-02-17	CoinCentral	0.544	Eli Lilly (LLY) Stock: Company Stockpiles $1.5B of Weight-Loss Pill Ahead of FDA Ruling	Eli Lilly has stockpiled $1.5 billion worth of its experimental weight-loss pill, Orforglipron, anticipating FDA approval in April 2026 to prevent supply shortages similar to those experienced with its previous GLP-1 drugs. This proactive strategy aims to compete with Novo Nordisk's oral Wegovy, which recently launched with strong sales. Eli Lilly, experiencing significant revenue growth from its weight-loss portfolio, is also investing $27 billion in new U.S. manufacturing facilities, primarily	https://coincentral.com/eli-lilly-lly-stock-company-stockpiles-1-5b-of-weight-loss-pill-ahead-of-fda-ruling/
2026-02-17	Google	0.533	Eli Lilly posts late-stage trial win for Retevmo as adjuvant lung cancer therapy - Seeking Alpha		https://news.google.com/rss/articles/CBMiigFBVV95cUxOaGdTb2VpZk5wdWZ4QjVMU00wWEIzYlNybG9hWjNnSGRVdTd3aFIwOENiTDRXTUZxM0JvSjBjU0RBcGRPUXlJcUNwWTZOaUJVTnhYSkVoLTZ4SXJaOVJ1bHItSDNfc05PanFuRXh3Zm04V0M3dGxxb2dnRnNHR0V6ZV92bFgweGF3ZEE?oc=5
2026-02-17	Google	0.5	4 stocks to watch on Tuesday: SHOP, LLY, GIS, NCLH (SP500:) - Seeking Alpha		https://news.google.com/rss/articles/CBMijAFBVV95cUxNRkJoekxseVZQb0xjcF85Rk5VMEZoOXJvZ1dFU2ZwM3FDWWJUc0ZUNE5Cc1o4YWI2Z2NUVTVRZDB1ZnZsQVpacldtaFBLdFYzSjR3U0JLaHdvZ3BwTWJrLVNibWZzZVJ3cno1bmxkSk50M2FJdVBid1djX0FPMEl2dGZpaFNsUE41M0d3eQ?oc=5
2026-02-17	Yahoo	0.5	Kymera Therapeutics Stock Up 120% in 1 Year as Fund Adds $3 Million More	Kymera Therapeutics develops targeted protein degradation therapies for immunology and oncology, advancing multiple clinical-stage programs.	https://www.fool.com/coverage/filings/2026/02/17/kymera-therapeutics-stock-up-120-in-1-year-as-fund-adds-usd3-million-more/?.tsrc=rss
2026-02-17	MarketBeat	0.497	Merit Financial Group LLC Grows Stock Holdings in Eli Lilly and Company $LLY	Merit Financial Group LLC increased its stake in Eli Lilly and Company (NYSE:LLY) by 6.3% during the third quarter, bringing its total holdings to 34,469 shares valued at $26.299 million. The article also details increased holdings by several other institutional investors and provides an overview of Eli Lilly's recent financial performance, dividend increase, and analyst ratings. Positive news includes Eli Lilly's AI investments, positive clinical trial results for Retevmo, and preparation for a	https://www.marketbeat.com/instant-alerts/filing-merit-financial-group-llc-grows-stock-holdings-in-eli-lilly-and-company-lly-2026-02-17/
2026-02-17	MarketBeat	0.497	NEOS Investment Management LLC Purchases 28,031 Shares of Eli Lilly and Company $LLY	NEOS Investment Management LLC increased its stake in Eli Lilly and Company by 37.4% in the third quarter, purchasing an additional 28,031 shares to bring its total holdings to 103,020 shares valued at $78.6 million. Eli Lilly recently reported strong quarterly earnings, beating analyst estimates with significant revenue growth, and announced an increased quarterly dividend. The company is pursuing strategic growth initiatives, including a $1 billion investment in AI for drug discovery and prepa	https://www.marketbeat.com/instant-alerts/filing-neos-investment-management-llc-purchases-28031-shares-of-eli-lilly-and-company-lly-2026-02-17/
2026-02-17	Investing.com	0.49	Jefferies initiates Foghorn Therapeutics stock with buy rating	Jefferies has initiated coverage on Foghorn Therapeutics (NASDAQ:FHTX) with a Buy rating and a $12.00 price target, highlighting significant upside potential for the biotech company. The firm anticipates a key catalyst in mid-2026 with the release of phase I dose-escalation results for FHD-909, a SMARCA2 inhibitor targeting non-small cell lung cancer. Other analysts, BTIG and Stifel, have also reaffirmed Buy ratings due to the promising cancer pipeline and recent $50 million equity financing.	https://www.investing.com/news/analyst-ratings/jefferies-initiates-foghorn-therapeutics-stock-with-buy-rating-93CH-4508027
2026-02-17	Yahoo	0.45	Eli Lilly Reports Phase 3 Win for Retevmo in Early Lung Cancer	LIBRETTO-432 shows statistically significant event-free survival benefit in RET fusion-positive NSCLC after initial therapy.	https://finance.yahoo.com/news/eli-lilly-reports-phase-3-220014948.html?.tsrc=rss
2026-02-17	Business Wire	0.403	Scribe Therapeutics Achieves Second Success Milestone for In Vivo Program in Collaboration with Eli Lilly and Company	Scribe Therapeutics has achieved a second success milestone in its collaboration with Eli Lilly and Company for the development of in vivo CRISPR-based genetic medicines targeting neurological and neuromuscular disorders. This achievement validates Scribe's proprietary X-Editor (XE) technology and strengthens its genetic medicine portfolio. Scribe is eligible to receive over $1.5 billion in milestone payments and low-double-digit royalties under the original 2023 agreement.	https://www.businesswire.com/news/home/20260217933275/en/Scribe-Therapeutics-Achieves-Second-Success-Milestone-for-In-Vivo-Program-in-Collaboration-with-Eli-Lilly-and-Company
2026-02-17	Barchart.com	0.262	Hypoglycemia Pipeline 2025: MOA and ROA Insights, Clinical Trials Status, and Key Companies Involved by DelveInsight | Amphastar Pharma, Eiger BioPharma, Eli Lilly, Novo Nordisk, Xeris Pharma	"DelveInsight's ""Hypoglycemia Pipeline Insight, 2025"" report outlines the current clinical development landscape for hypoglycemia, identifying over 10 companies working on 12+ treatment therapies. The report details pipeline products from pre-clinical to marketed phases, including their mechanisms of action, clinical study status, and product development activities. Key companies mentioned include Twist Bioscience, Eiger BioPharmaceuticals, Eli Lilly, and Novo Nordisk, with therapies like Avexiti"	https://www.barchart.com/story/news/240385/hypoglycemia-pipeline-2025-moa-and-roa-insights-clinical-trials-status-and-key-companies-involved-by-delveinsight-amphastar-pharma-eiger-biopharma-eli-lilly-novo-nordisk-xeris-pharma
2026-02-17	TipRanks	0.255	Eli Lilly Stock (LLY) Rises on Plan to Invest $1 Billion in India	Eli Lilly (LLY) stock rose after the company announced a $1 billion investment in India to expand contract manufacturing operations and introduce new products like Donanemab. This move is part of Eli Lilly's global expansion, driven by the success of its weight-loss drug Zepbound, and leverages India's growing importance as a pharmaceutical manufacturing hub. Analysts currently rate LLY stock as a Strong Buy with a significant upside potential.	https://www.tipranks.com/news/eli-lilly-stock-lly-rises-on-plan-to-invest-1-billion-in-india
2026-02-17	Yahoo	0.227	Eli Lilly (LLY) Valuation Check After Positive Phase 3 Retevmo Results And GLP 1 Growth Momentum	Eli Lilly (LLY) is back in focus after reporting statistically significant Phase 3 results for Retevmo in early stage RET fusion positive lung cancer, adding another clinical milestone to an already closely watched story. See our latest analysis for Eli Lilly. Against a backdrop of strong GLP 1 obesity and diabetes demand, upbeat 2026 revenue guidance and ongoing buybacks, Eli Lilly’s 1 year total shareholder return of 24.1% and very large 5 year total shareholder return of about 4.4x suggest...	https://finance.yahoo.com/news/eli-lilly-lly-valuation-check-050614389.html?.tsrc=rss
2026-02-17	MarketBeat	0.221	NJ State Employees Deferred Compensation Plan Increases Position in Eli Lilly and Company $LLY	The NJ State Employees Deferred Compensation Plan significantly increased its stake in Eli Lilly and Company (LLY) by 6.1% in Q3, adding 1,050 shares to reach a total of 18,210 shares valued at $13.894 million. This makes Eli Lilly the fund's ninth-largest holding, representing about 1.5% of its total portfolio. The pharmaceutical giant recently reported strong Q4 earnings, beating estimates with $7.54 EPS and $19.29 billion in revenue, and raised its quarterly dividend to $1.73 per share.	https://www.marketbeat.com/instant-alerts/filing-nj-state-employees-deferred-compensation-plan-increases-position-in-eli-lilly-and-company-lly-2026-02-17/
2026-02-17	MarketBeat	0.203	Eli Lilly and Company $LLY Shares Bought by Balentine LLC	Balentine LLC significantly increased its stake in Eli Lilly and Company, acquiring an additional 2,426 shares to own a total of 4,042 shares, valued at $3.084 million. This move follows Eli Lilly's strong fourth-quarter earnings beat and positive FY2026 guidance, driven by diversification efforts beyond GLP-1 drugs, including a $1 billion AI drug discovery investment and a planned weight-loss pill launch. The company, which has a market capitalization nearing $981 billion, is seeing positive se	https://www.marketbeat.com/instant-alerts/filing-eli-lilly-and-company-lly-shares-bought-by-balentine-llc-2026-02-17/
2026-02-17	Google	0.173	Eli Lilly Shares Pull Back 4% Despite Strong Q4 Results; What Analysts Expect Through 2026 - TIKR.com		https://news.google.com/rss/articles/CBMitAFBVV95cUxONDZpZmJNWWxBdnNYQjdLcGlFTzZSMFhWcFJGalhtNmlPRENXOGVKVUtyTlhwWFJ3amtUeEYzdTAyYU1qQTFna1B3Y05XS3hfRm1mLXd6ZDQ1eWNTS21BS3psaVBWOU5PY2FaSzY2SnRzaU1waDBVN214RmhrV3FEbWRFczYzZjVCMGg0QVpTVVJxYTg5YUhpR3dxOWNNWHZuMzc1QmYzUk9xVVltYll0TlRLNl8?oc=5
2026-02-17	Simply Wall Street	0.135	Viking Therapeutics Expands Obesity Pipeline As VK2735 Nears Late Stage Trials	Viking Therapeutics is significantly expanding its obesity drug pipeline as its injectable VK2735 nears late-stage trials and an oral version moves towards Phase 3. The company also plans to file an IND for a new amylin agonist. While Viking (NasdaqCM:VKTX) is currently operating at a net loss, its multi-asset approach in a large market dominated by Eli Lilly and Novo Nordisk could offer diverse treatment options, making future clinical readouts and regulatory milestones critical for investors.	https://simplywall.st/stocks/us/pharmaceuticals-biotech/nasdaq-vktx/viking-therapeutics/news/viking-therapeutics-expands-obesity-pipeline-as-vk2735-nears
2026-02-17	TradingView	0.084	AbbVie Down Since Q4 Earnings Report: How to Play the Stock	Despite beating Q4 earnings and sales estimates, AbbVie's stock experienced downward pressure due to a decline in oncology drug sales and weakness in its aesthetics segment. The company has successfully navigated the patent cliff of Humira with the strong performance of new immunology drugs like Skyrizi and Rinvoq, as well as contributions from its neuroscience and oncology portfolios. While facing challenges such as Humira erosion and a struggling aesthetics segment, AbbVie's robust pipeline, s	https://www.tradingview.com/news/zacks:df65d823f094b:0-abbvie-down-since-q4-earnings-report-how-to-play-the-stock/
2026-02-17	MarketBeat	0.074	Shell Asset Management Co. Has $1.03 Million Holdings in Pfizer Inc. $PFE	"Shell Asset Management Co. reduced its stake in Pfizer Inc. by 54.8% in Q3, selling 49,152 shares and retaining 40,506 shares valued at $1.03 million. Other institutional investors like Peak Asset Management LLC and Community Bank & Trust Waco Texas increased their holdings. Analysts currently have a ""Hold"" rating on Pfizer with a consensus target price of $28.00."	https://www.marketbeat.com/instant-alerts/filing-shell-asset-management-co-has-103-million-holdings-in-pfizer-inc-pfe-2026-02-17/
2026-02-17	Yahoo	0.0	1 Reason I'd Buy Eli Lilly Stock and Never Sell	A robust pipeline is essential for a buy-and-hold pharmaceutical stock.	https://www.fool.com/investing/2026/02/17/1-reason-id-buy-eli-lilly-stock-and-never-sell/?.tsrc=rss
2026-02-17	Google	0.0	Analysts Are Bullish on These Healthcare Stocks: Eli Lilly & Co (LLY), Palvella Therapeutics (PVLA) - The Globe and Mail		https://news.google.com/rss/articles/CBMihAJBVV95cUxNRmd3RklVQWNJUFR1TUNjYUF1TTdOSlNQQTdNRlJLRHlCNzhadHhudTdJUHZtUXN6SnJJcklzMzJ4RUtiZmlwSmRzQlBJbHl4UURieVhCTEhyRERJVFM3N194NFJVLThmeEhobndYaGs0SThfSncwQU4yTm9iNFphWXdVeHE0ZW0wN0RlTTVGNHFMZ2FkV296UE43SjA0OXNfejVQR3JVNWFZVER2X3JLV0JqTVc5NDZSanBXMHhuY3l5ZzZWalJ0NWNnc3d5cm9ZbUVheENaRUtNYU9QdUlEellZWEE0eFRUNU5zNERqS0xZZzFIaFVxZEE0SHlRQXpRdXQ4SA?oc=5
2026-02-17	Google	0.0	Arvest Bank Trust Division Has $6.88 Million Position in Eli Lilly and Company $LLY - MarketBeat		https://news.google.com/rss/articles/CBMi2AFBVV95cUxQSkRaODFMZUc2ZlF4WVNwVEVtc09tT2hVMnJHdEF5eXlyU2ZhZFo2bmJqU2tqSEJSNG9sQ3FHTVI3bDJMdFJWMHA5cDRZNXFudVE2c0d6aEE1WVc0aUpRR080aWZFdEg3TGpFUHhLQ0tKeGVNb0wxMmxiX2NFX3NkV2JfdmRubFFZSjNMNFRzUWY5NFpTUDhvTUpRWEJfczR5VlRJWkk5emo0ZmpqT0hnMzFxcjNEdEdjLThKU1B1SDF3SVUwMTdMWWRvZi1rbDY0S3RtdjdKQm0?oc=5
2026-02-17	Yahoo	0.0	Cogent Biosciences Stock Soars 346% in a Year, but One Fund Just Sold Off $4.5 Million	This biotech firm develops precision therapies targeting rare genetic diseases, with a lead candidate focused on oncology indications.	https://www.fool.com/coverage/filings/2026/02/17/cogent-biosciences-stock-soars-346-in-a-year-but-one-fund-just-sold-off-usd4-5-million/?.tsrc=rss
2026-02-17	Google	0.0	Eli Lilly (LLY) Expands Global Supply Chain with $1 Billion Inve - GuruFocus		https://news.google.com/rss/articles/CBMitgFBVV95cUxOLWpOa1FTaEZFVFpNZ2RzT0dVYTQ3UVF0U2g4R1NKTTNBQmtqa3lSdDg3Rk02MVVCeVAtRFV0TWNTdHJZY2xKN29JUkFWcFQ2Z1pDcTNHMFZsdTNQYXE2OFR3M1ZGZTdDdzNheDlFUEhhTGJfUU5Vb2ZsRHg3ZWZ6S2lNdVhxdGlWVzk3UFdlZGVwWWZHMVNZai1VblNDNHNVdU9oLTlYR3MwdGtSNkdzMHBMMGJudw?oc=5
2026-02-17	Google	0.0	Eli Lilly (LLY) Secures License for Clazakizumab from CSL - GuruFocus		https://news.google.com/rss/articles/CBMimgFBVV95cUxNc09uU0pwWjJTbDUyc1lmSlhNaWpMVzZ5SXNkT0l2TjAyN1A4UDZhakFMZC15bmFpMFFrTDVlNkxObXE3U3Q5VzQzQWg2QUcxemhVeHZDa25yUjk4WkM1eFVHWnF3VVZXX09pckVpUlNkaDdfQ1R0U0UyMF95YXVtVU5pMnNWQVV0UHVQMFFqdmF3TFR5dXQteG93?oc=5
2026-02-17	Yahoo	0.0	Eli Lilly Preps Oral Weight-Loss Launch	Inventory ramps ahead of approval	https://finance.yahoo.com/news/eli-lilly-preps-oral-weight-221209942.html?.tsrc=rss
2026-02-17	Google	0.0	Eli Lilly and Company $LLY Shares Bought by Balentine LLC - MarketBeat		https://news.google.com/rss/articles/CBMiuAFBVV95cUxNbkNuSW9lUG5BZkpGay1hTWtzbzR3ekhWaVNJcTBzLUszazBCbkxoMkNKRkZaQV9HaV8wQ3UtNjVYeFZUenpNcmwtdjVoVmh0aUlqZmdlbDdUTFQyTGhOYkJLb2RUeGptaTRkdmZZZ0VqRnZJZTBVYlN0MzQ5Y3JfNTF3bUdJcWI0VXc4b2Jjb2ZEbVRDSldGWGVsV3VxNUJoY2g5SzBncHZieXNSOEJiNUhlZFoxcTZS?oc=5
2026-02-17	Yahoo	0.0	Structure Therapeutics Stock Up 187% in One Year as Fund Trims $8 Million From Stake	Structure Therapeutics develops oral therapies for chronic diseases, using a proprietary platform to target G-protein-coupled receptors.	https://www.fool.com/coverage/filings/2026/02/17/structure-therapeutics-stock-up-187-in-one-year-as-fund-trims-usd8-million-from-stake/?.tsrc=rss
2026-02-17	www.marketscreener.com	-0.087	Certain Warrants of Mangoceuticals, Inc. are subject to a Lock-Up Agreement Ending on 18-FEB-2026.	Certain warrants of Mangoceuticals, Inc. (MGRX) are under a lock-up agreement set to expire on February 18, 2026. This lock-up period, which began on December 19, 2025, covers warrants held by executive officers, directors, and significant shareholders, restricting their ability to sell or transfer these securities.	https://www.marketscreener.com/news/certain-warrants-of-mangoceuticals-inc-are-subject-to-a-lock-up-agreement-ending-on-18-feb-2026-ce7e5dd9de81f723
2026-02-17	Yahoo	-0.156	Agios Stock Down 16% in a Year as Fund Cuts Stake by $5.6 Million After 50% November Crash	Agios Pharmaceuticals targets rare blood disorders with a marketed anemia drug and a focused clinical-stage pipeline.	https://www.fool.com/coverage/filings/2026/02/17/agios-stock-down-16-in-a-year-as-fund-cuts-stake-by-usd5-6-million-after-50-november-crash/?.tsrc=rss
2026-02-16	Eli Lilly	0.482	Lilly's Retevmo (selpercatinib) delivers substantial event-free survival benefit as an adjuvant therapy in early-stage RET fusion-positive lung cancer | Eli Lilly and Company	Eli Lilly and Company announced positive topline results from the Phase 3 LIBRETTO-432 clinical trial for Retevmo (selpercatinib), showing a significant improvement in event-free survival for patients with early-stage RET fusion-positive non-small cell lung cancer. This study is the first randomized Phase 3 trial to evaluate a selective RET kinase inhibitor as adjuvant therapy in this patient population, supporting the importance of early genomic testing and targeted treatment. Detailed results 	https://investor.lilly.com/news-releases/news-release-details/lillys-retevmo-selpercatinib-delivers-substantial-event-free
2026-02-16	Bitget	0.448	RIGL Stock Rises 59% in a Year: Time to Buy, Hold or Sell?	Shares of Rigel Pharmaceuticals (RIGL) have surged 59% in the past year, significantly outperforming the industry, sector, and S&P 500. This growth is primarily driven by the strong performance of its drug Tavalisse, which accounted for approximately two-thirds of total revenues in Q4 2025, alongside contributions from oncology assets. Despite competitive risks and trading at a slight premium, the company's positive financial guidance for 2026 and increasing analyst estimates suggest continued g	https://www.bitget.com/amp/news/detail/12560605202181
2026-02-16	Google	0.433	Robust demand for Eli Lilly and Company (LLY)’s obesity and diabetes treatments drives strong investor sentiment - MSN		https://news.google.com/rss/articles/CBMiigNBVV95cUxPWlF1b05kNDdaRV93LTMxZ1RVaGlBV2xwVmN6VFlBNlFaeTJGdlNPVXhxZE41eHc0a2lYVkg3VHJOdVdmOTBfNExZTlZwTHpfYXdBdzIyRnQxZkxOeDltbllSY0J6MmhmMk9JRTh4N1B4UUltR2tjVU02djRvRGs2akZqY1NFcnlONXVBRE9uQ0UtSDEtMlhkUkFPVTFkOEQySDBsaldzTHA5bzktWU5JdmlqWW5TWFlSWTRpcm5hNDhXaE1xbXBfM1lramdrUnRoUG1TNGxBRUlMbUs3V3lKUzJESWM1dzBMMmpMSW5yQURkYkFlelRuQzV1azV1UTZWR3pZSGc4NXdqUV9vT3lOQmFTaTd2SVBDS1JHb19zbmY4TF9qdmxfbjc3d19uV1p6dHNnZ3pYbU9YRWFNamdYYlljemotblhXVHJDZjl6UWZIWGpOYkFwT2Fsa1dyemR1ZjZPYTJrazhnazVOLWpQYlByMDBCUC0wWEtrNXozLU1xRUJnTFZIeFJn?oc=5
