Date	Source	Sentiment	Headline	Summary	URL
2026-03-05	Google	0.0	Morgan Stanley rates VEA as Equal-weight - marketscreener.com		https://news.google.com/rss/articles/CBMimAFBVV95cUxPMXhhc0p5YjZ2VmxISFY3ZU5TV250OTVrMVNDRFVKSlcxa0d6QW9tMXg0WDY1UjdNOVFwYUJJQ01pLUNOX2g1a0pHOEZfNHhCSTV4Z3RxLXhwMjNCZGZPcjYydU0yb1Y0clFXam5ubEs2aDRoMDBWWUVBaUFOUXctNHJsbDQ3VF9ncnBpamFRdnFNYzdTbVhMZw?oc=5
2026-03-04	Google	0.0	Buccaneers' Vita Vea: Workload boost in '25 season - CBS Sports		https://news.google.com/rss/articles/CBMinAFBVV95cUxPNWVzYVNFUHFFbGdISE5PUE5CckM3WHFVdDlUR1RUV3pzcnBFWHFCY2lPY04xcXgwRzRBakk0SllSanlYWENCYWdOTUlmY011TEx5aWQtYVZmRHBxci1fNGRHUXV2M2x2ZFROd0RNRFBBdDFjOVRtQ2J0ZkhBNm5GOWxJN2U1YTdXUDRMdlhub0I3TkhXczByRzgyYjk?oc=5
2026-03-04	Google	0.0	Vita Vea News: Workload boost in '25 season - RotoWire		https://news.google.com/rss/articles/CBMilwFBVV95cUxNcDBieHcweDRIVzQ4MlV4WmhRSl9ZbzFhUGFrU1hqbVlobUt5U0hUUXdKZzNNMUtrYVBBNmZLVndDQUxWMnk4Q0NmSE10Y0JuNnF5N2Zfam5ycUpaeS1LQmhxVEFlNWxhbEkycVRKUnFNYW9SV0o2RVlULVdINExyZ2ZuSE9tY21pMGR0S1ZSRE5EVlpOYkdj?oc=5
2026-03-03	Google	0.4	Buccaneers have been handed a golden opportunity to make Vita Vea even better - The Pewter Plank		https://news.google.com/rss/articles/CBMipwFBVV95cUxNU2lrdGY2MWIxRGpRLTh0VVNVY0g0bkRIWHlaWXl3bUR5Zk9xbVMtQ0tCUGVhV2FHMVhLVzVjeGFOdXhxOXpDZWNqaUdfYktpVDhEQzBvZElXZWpsQzhIbnF5R3FQcDVheDlhZnhsX2NEOHpybDBIQXZXTWw3OHNRcTFYQlFxeWllYnNDT29KdnZVakx4aHBacTJIdnRWZmtYMmJUbENOdw?oc=5
2026-03-03	Google	0.0	The Bull Case For Viva Energy Group (ASX:VEA) Could Change Following 2025 Loss And Maintained Dividend - simplywall.st		https://news.google.com/rss/articles/CBMi0wFBVV95cUxNN0ZyMWVubmt4WmJjZFR0TXV5Ui1FZ1E2QnJEVzhtSEF1OVNvLXdvS2ZZZm9ia0ZQRVd5LXhzaHJFOTRZdnhXVVVfQnAtOFVGbG52QUlaUkZUeTdMRktyY0duWnY3Zl9RenhZZlg2cllTenRsZDU3MXFmWnVKLUNXSjNqckFCNzdGQUNVMEZlNU9zdDlGRzAyWExGY3BnSDVmT2ljNkZmM2VSX1d6ZHNkdV8yRHZBaGVjTWphYXZfWUxkbzdhOFh0YkFJN25Xa1ZZM2xr0gHYAUFVX3lxTFBoc0k0M0FLVWpmbEFycFpyY3lZZm9vMkdvQWE5Zl9qb3gzNjZmYzQycC1ndHU5ZWpmWl9YYzAwVTBYaGowc1dPSm9oaTJnV3RFU0xBRXAyaTdwWk0yR0tzZlp3ZnA1NnFWTWhfT016OUdvUHNRN2lyQkRqYW1pWEtuRUtEQlRxNUxJcXZWWjRiRzNPUExsRFBjbEY2UFlHTjhEczA3SVFQY0Z2M1VvRmlqeWZQc3JuMjhDb3FWZzhiQ2ZsdlV6NTlkVTRGOHpDUEljYUlGZ0w5OA?oc=5
2026-03-02	Google	0.031	Jason Licht gives Buccaneers fans a major update on crucial defensive starter - The Pewter Plank		https://news.google.com/rss/articles/CBMijwFBVV95cUxPTktVTUs3TVgtdDRUY0VKX1QxbE5sOE40bl9VbjB2cGFLeDZwajF0dnZxay1paFMwSXZZTHBYYWFhdUxhQmpZVDV6MGFjQmtvcVdWSmNsUGdWSVJXVkNqZzZFZWxtd3JrZW9iQ2JvT2t4TTNjbWxhT2QtVndXY210em52Q0VzNXY4d2FjODA1QQ?oc=5
2026-02-28	Google	0.35	A Look At Viva Energy Group (ASX:VEA) Valuation After Full Year 2025 Loss And Dividend Announcement - simplywall.st		https://news.google.com/rss/articles/CBMi0wFBVV95cUxONXRMSzB3VkxpOWtzcmhSSi1IaW5OTUNOUTAtUklhNzY0QldMc255VWhYUElxYzYyVjQ0LWdHeU1Qbk5ENWNsdHl5WlVBa0pfcThZZkRZckthQ3VldkNJUmRRZnlXT1VrWDJyYXZsSXNLekF3MVhkSjNpOXFSWWs0YmxMTE8tbmJrU1NUa1d4UlYyVVlDVVAyTjhta0t4X0w5Y3pjN3E4c2JFR1NsQmNSUmhQN0doUFlmZVNJemRIaXdPVEt6ZEVKNGVuMl9QeklDaWFR0gHYAUFVX3lxTE8xcmc4ZW92ak01RFZxQWZPMkgxRE9GbktYZmhJaUFGR01WQkd4STB2RVBPRjhqR2czTHBDWUU1QVJlV3BWbE1MNjBlMlluNVBZTkRaSmNyRWJCOW1pU2NVSGJzbWVLdDhrQzd5bHBRVko2ckk2UV84VXczTFoyUU1XUnBxdnRtc3d6dGtHcG9NTkw4cHJ1MjBBdUFoZzlOUjVHV19IVjgtRUJFT21ndUFfUmxfYWxRdE1FN0RjR0JWaGxfSGppeGpmNWlaaDN2cXdrU3RxQ21XNQ?oc=5
2026-02-28	Google	0.0	Official Site of the National Football League - NFL.com		https://news.google.com/rss/articles/CBMiY0FVX3lxTE9OcDBQQVFxT3BYY3BXRlhJWGdlZEMxakFzYllUeWFrM0ZRbmgzYlJCaXA1c3NBdllCVTlQLWhiV0gtTVYxS3BheTgxaV9VSFk2X0JHc29KUUJtUFZOSlVqcE9tRQ?oc=5
2026-02-26	Yahoo	0.234	Trump’s New Tariff Threat Makes This Vanguard ETF Best for the ‘Sell-America’ Trade	Since President Donald Trump rolled out his landmark “Liberation Day” tariffs on April 2 last year, U.S. equities have come under pressure while international stocks have rallied sharply. This phenomenon — known as the “Sell-America” trade — does not mean U.S. investors are actually abandoning American assets. Rather, more capital has been rotating from domestic ... Trump’s New Tariff Threat Makes This Vanguard ETF Best for the ‘Sell-America’ Trade	https://247wallst.com/investing/2026/02/26/trumps-new-tariff-threat-makes-this-vanguard-etf-best-for-the-sell-america-trade/?.tsrc=rss
2026-02-26	Google	0.0	Could Any Bucs Player Be A Cap Casualty? - Pewter Report		https://news.google.com/rss/articles/CBMieEFVX3lxTFBidHlnUE8wbjQ5VExDVXJoelVtWVBUaVdoQlRNU01tVVEzVUtBSFBJVUgxYTRJbUtfR0Q5blJLelBNR0d5REMtWGVSUHRsWHJWU3NNdzZqY1luaC1yQ2lLdGN1NzlxTm9raElYd202dzhBTVpiZ0ozSA?oc=5
2026-02-23	Google	0.533	VEA vs. SPDW: Which International ETF Is the Best Choice for Investors? - The Motley Fool		https://news.google.com/rss/articles/CBMitgFBVV95cUxQRk5CNkQyWEFycXVpY2QwblFPeW1JV0dXV1BZV1RsSkYwRGwzVUhROU9JcXhpREp1V21IMGJRaWlCeUNjVG1EMkxMTzJHdE9DMWx0RGlmcG52RmdVemtGS2Q0REZpdmdFelFEYmdmWDNwYzI4MjNwZmx6eW81RTVuMGZCNmU5R2hBZFAzSEp3VXZheWkzR3lkZ3IyaGtOVU5KVTZENjdRNVEtM2xPYi13aWl4bE9IUQ?oc=5
2026-02-23	Google	0.5	Latest Buccaneers Offseason Cut Projection Involving Vita Vea Makes No Sense - Sports Illustrated		https://news.google.com/rss/articles/CBMiwwFBVV95cUxPRlp0cFl6WmlTTThqTUZHemVvYldpaGtZeXo2SzVCZzRuell2X2E3Zl9xVzlsajNSTlo4aUVTQlpENHExdTRadUZoS0YwcUc4T0NXOV9VYVBiTWdlT1dkaG1RTDBQNVZEdUtJMWoxY1BaaWZvX3pXR2NRZ2lBNTZaZ0NQLWZXVEZqaXhWRFFFMngtYUdpS3pKSzBqUjI2bFp6MzgwbnZ6OHlRUzUyTkt6TmxxaHlNU1d6dmNoZ3lZNEI3OHM?oc=5
2026-02-23	Yahoo	0.375	VEA vs. SPDW: Which International ETF Is the Best Choice for Investors?	Explore how differences in holdings, risk, and yield shape the appeal of these two top international ETFs for portfolio builders.	https://www.fool.com/coverage/etfs/2026/02/23/vea-vs-spdw-which-international-etf-is-the-best-choice-for-investors/?.tsrc=rss
2026-02-23	Google	-0.062	VEA: Underlying EBITDA (RC) fell 6% to $700.9M, with a net loss after tax (HC) of $421.1M due to impairments - TradingView		https://news.google.com/rss/articles/CBMijwJBVV95cUxOTVRYd2lidVMteTNDaTRoakxlQ3JkaTVvZTFKRnJzWVhMc0ZIUks2UTdoeVFyME40aHVFLTNBQTNWWmxaLVc5SjFwX3NrcTBJSWpNNEdCdVhmZi0yRXNSR0xMc3FlNmotX2d1NmYzaXdkMzVIYVNGTldzSzNTeWRSMVRBTDJMYk5Pa3ljeXlpYWhZMzF3Vm9ueG5WU2d1UF8yY0VUV2ZqTjNpSE5UazF2SmR1cVlQWTQtUEFhZkpiaWtSVU9xVjh5QWVfTUZlUHBtcTFleXlqQUtISGY2eDFHZGpIc09xR1FES1VhWklYbTZCZ2Q2am92UGE4SUZrd2dIdVhYZUV0UC15bmF4YWNJ?oc=5
2026-02-23	Google	-1.0	Bucs Predicted to Make ‘Shocking’ Move With $71 Million Pro Bowler Vita Vea - heavy.com		https://news.google.com/rss/articles/CBMijAFBVV95cUxPakpFUk9Hblp3RzZmVGh6U2R2Si1Lc3g1eW1fT0dlcWVxLVJuUXZKbFBXQ2JSYkF2Y1BWNmFDSFY2MHNqUkk1ZVV0NVJfaHJWRkdSZHE2NXhsOTB6OUdkd1lPTWNhT0llbmlOLXRLV29feVNvTXh4SVM0VXFuX1BETER6bVVNa3h1SVZJaA?oc=5
2026-02-16	Google	-0.133	Vita Vea is active for the Buccaneers on Sunday - MSN		https://news.google.com/rss/articles/CBMinAFBVV95cUxPX0YzUzUyRlY0aUc0cW9URTlBMklqa1J0azNRX1YxZGZoN25OLWlKczNtZVEtRGdZRkhlaTd4MVFUNHhBOXpNN0ppX2JGU2Y4ZGROYnVoanVIVGQwS2NJM0xJWXlkSzlyUC0tQXlQS2FYMDBXSC10Ylo2SXRxNkRWRXZmcWxQUEZJVkpPMmZFdGpjMm1pR1hlZ1B4NmU?oc=5
2026-02-14	Google	0.0	VEA PE Ratio & Valuation, Is VEA Overvalued - Intellectia AI		https://news.google.com/rss/articles/CBMiWEFVX3lxTFBFaWc4T3hwTnBib1prX0t2cEhtV0dod0ltN2tsQUxLRHZwRHd5SnprUGlyekJpdVN4ZWxXT29jN0p1YTZERndzUllEUGF0VmJiTEhvLVdPUDc?oc=5
2026-02-12	Google	0.0	Na'Vea Gauthier | 2025-26 | Women's Volleyball | Ohio State - Ohio State | Official Athletics Website		https://news.google.com/rss/articles/CBMiigFBVV95cUxQZnVvSWYzaU9DQWd1UFMyaTJKRWhxem0yUjVLSU9Qd1lnNUozMXI3SGV3V2paR1N3N3Znbl9TQjVqNUVSUDhhTlRkYzhvc2ZHS3hWUWt0a0RIUWppV000RmctR1BNOTEwWm9zeVNJTjBqZDYwUm5abmllOVlIRXg2MVctSGFmNXpFamc?oc=5
2026-02-05	Google	0.05	Precision Trading with Vanguard Ftse Developed Markets Etf (VEA) Risk Zones - Stock Traders Daily		https://news.google.com/rss/articles/CBMi6AFBVV95cUxNd3BwWVY0OGdkWjRLQjZPcVVLZmtCeU9HS3JiS0lyS1BIcWxucV9GWTRBdl82R0xtOC0zNWFOVF9rMjlBSmFHTmVvVGhWeDQ3NmVuYmk1dVN5blNtRnBnUjVqa0xRcl9Qc0xOZ2ZocUUwTlJpSDR0MFVtZnFLeDlyTjd3S296WHlQSnlXTzI0S3ZJRGpzR05pVjlJR0NNd282cVlrQlZZdjdJZFJxWnlPX2E4YlhoUE45WnM2SFRzaU42MHBRNHpBSHlaVU9WUnlDOWtQQkNROXZxREVlaW5jM1BacmF1MWxE?oc=5
2026-02-03	Yahoo	0.079	Why Half the World’s Market Value Sits Outside Your Portfolio Right Now	Most investors own U.S. stocks because that’s what they know. But when half the world’s market value sits outside American borders, skipping international exposure means ignoring companies like ASML (NASDAQ:ASML), Samsung, and Toyota (NYSE:TM). Schwab International Equity ETF (NYSEARCA:SCHF) solves that home bias problem with a simple, low-cost wrapper around developed market equities outside the ... Why Half the World’s Market Value Sits Outside Your Portfolio Right Now	https://247wallst.com/investing/2026/02/03/why-half-the-worlds-market-value-sits-outside-your-portfolio-right-now/?.tsrc=rss
2026-02-01	Yahoo	0.211	9 Vanguard ETFs With The Lowest Expense Ratios	The Vanguard Group of Valley Forge, Pa., is beloved for its low-cost, index investment strategy. The firm offers nearly two dozen exchange-traded funds (ETFs) with expense ratios of only 0.03%. Here is a selection of nine of the most popular. No. 9: Vanguard FTSE Developed Markets Index Fund ETF (VEA) This international index fund seeks ... 9 Vanguard ETFs With The Lowest Expense Ratios	https://247wallst.com/investing/2026/02/01/9-vanguard-etfs-with-the-lowest-expense-ratios/?.tsrc=rss
2026-01-29	Google	0.1	Dermatologically Tested Skin Oil VEA Nasal Film Oil 20 Ml - Vitamin E Enriched, Fragrance-Free, For Sensitive & Compromised Skin, Dermatologically Tested Post Treatment Skincare - umlconnector.com		https://news.google.com/rss/articles/CBMikgFBVV95cUxNeElUdTItaWVoUTFlUlU5LWROUFg2Y1dvM0pBckFCSjBmR2VvVEY5X1ZwandxQlFFZWR6MlNPa0s1WUhZak1UMS1rcXpfMFJJa1g5ZFYySG5maXpjYXdZY2R4dDVQdGpEblUyZEJnbkFjalBXbzhEdHk5Z0NDcHBxdW5hQUdVN0RZdXBVaTRvbHFnZw?oc=5
2026-01-27	Google	0.0	DOL Vs. VEA: Different Approaches Result In Similar Results (NYSEARCA:VEA) - Seeking Alpha		https://news.google.com/rss/articles/CBMinwFBVV95cUxPTFNOWGpscEtKTzYyZXZ2QlhqczctZW54MVk0ZW1zS1lxN2hHUnBwdlZVUUVqOFJUakNuQWFwUTVuR0JoZUxJQW91aW9xQnJyNml3RGFNd2xCOXgySVByNms5dVZzRElWVGFCZVlIMndtcm02WXhyWTBpdTNiR0tVNFN3dU43QkRHSDI3M2FMbjRoWVNoSkREXzhNN1NxejQ?oc=5
2026-01-24	Google	0.27	VEA vs. ACWX: Cheap International Exposure or Full Global Access? - The Motley Fool		https://news.google.com/rss/articles/CBMirgFBVV95cUxOV0xxWkhESDlfZUY3MFYtZHhDRWdtSkRsNTRrMWgxRXRHa1dyS1RlT0w5al9SdDJ3SU5IODhwN2tiZzZVekphek5GOWxINm5nUTR2R21oenQxYkdxU09ydmQ5Mi0tZGRiRWRENlQ5Q0FucEdDWWJ2dlBkUF9HZkhwMHJhOEdtUmJVb3Q5VkVtTVpRNVZRRUpKanE0NlFyU2JYMVQwVDNHOTZWY3JCRXc?oc=5
2026-01-24	Yahoo	0.125	VEA vs. ACWX: Cheap International Exposure or Full Global Access?	Explore how key differences in sector exposure, holdings, and cost structure could impact your international ETF strategy.	https://www.fool.com/coverage/etfs/2026/01/24/vea-vs-acwx-cheap-international-exposure-or-full-global-access/?.tsrc=rss
2026-01-22	Google	0.0	Michel Nkuka (Lumumba Vea): «My hand raised is a message to encourage the players» - Sport News Africa		https://news.google.com/rss/articles/CBMitAFBVV95cUxQVWlNNUFDVFN0WmNuYldXMUlEVGVlUy1Ed01HRElndG5Id2loaHlnY0YzLUZERVJRMEZYajlFcWp6d081Z0h1M3ROZGtXYlR1RmdreW1qclkwVVQ4YUVTaVlOYk5IbGptUWNlcVhzdExpSUxxRWZRdk0zeVdOMEFkejJiVW4xZ0Z6cFdXWDRXd2w1TWlMUkZiWHpIaUxSc2JLZTZJUW9EN05laWlVQ29xYUxDOXQ?oc=5
2026-01-21	Google	0.0	Fund Update: 1,850,728 $VEA shares added to COUNTRY TRUST BANK portfolio - Quiver Quantitative		https://news.google.com/rss/articles/CBMiswFBVV95cUxOTU92QllvSlE1bmMwNFZEa19zcnhaZ09Cd0JCaGhlSk9ZdUpYck9KWU5abWZta1R6elZwLW1kcTd6aklPejltaHFRREoxM0xtNHRIMGplQXkwY3dXS2Q1ZDFleklpZ095VHJnWkRUdWNwTnlZQ2JHT2FTNjVNTXRMRG9ZdGFRb0NncVA2TUlaYzlEZE9KdDNpNVl1YU1VS3JXTmtxNmFILUdHTnpjYjlvN1JtRQ?oc=5
2026-01-13	Yahoo	0.233	3 Established Income ETFs for a More Defensive 2026	Three income ETFs stand out for 2026 in the midst of economic and interest rate uncertainty, giving investors access to either bonds or international stocks.	https://www.dividendstocks.com/articles/3-established-income-etfs-for-a-more-defensive-2026/?utm_source=yahoofinance&utm_medium=yahoofinance&.tsrc=rss
2026-01-10	Google	0.0	Virginia opts in to federal Education Freedom Tax Credit program, VEA condemns move - WRIC ABC 8News		https://news.google.com/rss/articles/CBMimgFBVV95cUxOd0FiZHoybHczZE5ZaFNTZE8waGNrdGJhNjJKTVJleXNJejR2Tmk3bTVPdDIzODhrSmhYRy1tZlRIZWhWa3hjNUoxZmpudVFCYUtodktMT2o1cWEwWFpKb2dFdjh6dDd4R0JkSDRSdUtoa2YycTBHUC0wZTRjMDlpZnVfV0VMeFYtYXhyZzEtRjJrZUlFUUtON2VR0gGfAUFVX3lxTE5hT1ZHVXpoTktTZkxZTjNJTk1xT1ZNYjQwOUp3NDJaOXR2enJTczhKM0FjUXEtWDlZNjkxSXh3ejRpUTJ4dVEza2J1eFVYWXhkTlh3WDJ4OWMzTmpZeE83TDBHQUlLc2swNzhZTjVia2tfdUttRUYydWxWUi1xVFNwam00X1ZJdkF0VlBaM2lRS1RtLXpVQVk3Y3RmS3Bndw?oc=5
2026-01-08	Google	0.0	DR Congo superfan Mboladinga ‘Lumumba Vea’ leaves AFCON as a hero - Al Jazeera		https://news.google.com/rss/articles/CBMiqAFBVV95cUxOQUh2NGpFOFRoSjBraWdlWHd5Y1kyb3VJaDR3V2NtUUprblM2dDIzeEdxeno3VGV5Z0sxYjdXM3ZNX2RPZkcyVEg2UlBmSXQ5V2NCUGpORVRTRkdnbzk2N2lWV1QtS3h1Vm5BYmttYzJ2SHhtdVRCeHVmVHdQWGhZZkJGM19FOE5jdEFYdWFQNTlzN042Tkl2RGxNTkFtQ010VXlRdjZ2bUPSAa4BQVVfeXFMUDBVQXN6S3FJem9qZFljOU51OFo4eDgxNGlaZ1NHSE11bWtOdGt6Vk43c21wckFSdThPbzVRN193NUxLRVFvQk9yRTNMeWJiVi1YamlVVHNxa2ZzN1drX2MydUxTRXJhTWU4cVU5Vnp6OWFDcFI1dUM4VFZQOEFkUVR3eS1yMUdETXdqUG9ZeUVBVTFUZHkyUEtRbVZCdmR2blZxLVdGUUhSWUN1SnVB?oc=5
2026-01-08	Google	0.0	‘Symbol of pride’: DR Congo superfan Mboladinga leaves AFCON as a hero - Al Jazeera		https://news.google.com/rss/articles/CBMiqAFBVV95cUxOQUh2NGpFOFRoSjBraWdlWHd5Y1kyb3VJaDR3V2NtUUprblM2dDIzeEdxeno3VGV5Z0sxYjdXM3ZNX2RPZkcyVEg2UlBmSXQ5V2NCUGpORVRTRkdnbzk2N2lWV1QtS3h1Vm5BYmttYzJ2SHhtdVRCeHVmVHdQWGhZZkJGM19FOE5jdEFYdWFQNTlzN042Tkl2RGxNTkFtQ010VXlRdjZ2bUM?oc=5
2026-01-07	Yahoo	0.218	iShares ETF Might Quietly Be One of 2026’s Best Buys	After a decade of US equity dominance, the iShares MSCI EAFE ETF (NYSEARCA:EFA) has shown strong recent performance, marking a potential turning point for investors who watched international developed markets trail US counterparts during the past ten years. With major investment firms highlighting international equities as attractive for 2026, the fund offers valuation discounts, higher ... iShares ETF Might Quietly Be One of 2026’s Best Buys	https://247wallst.com/investing/2026/01/07/ishares-etf-might-quietly-be-one-of-2026s-best-buys/?.tsrc=rss
2026-01-06	Yahoo	0.273	Is Vanguard Developed Markets Index Admiral (VTMGX) a Strong Mutual Fund Pick Right Now?	Mutual Fund Report for VTMGX	https://finance.yahoo.com/news/vanguard-developed-markets-index-admiral-120002568.html?.tsrc=rss
2026-01-05	Google	0.0	AFCON finds its icon as Congolese supporter becomes living Lumumba | Daily Sabah - Daily Sabah		https://news.google.com/rss/articles/CBMirgFBVV95cUxQaGw0THF0N21ObEgtdlRJdzlia2NzeXVMSF9xbXFmdDJJWWZ5eE1xQTJoTzc1cGRBM3d0QjFJVm9CZDl2bmdESHVZaEJRYWUtNHpiNThkZVlrMkZITFVSZmNEN3dodWZ5NGxzMUNCUk1wZ1Q0cXFTUWIweS1PckJmNjYxSHM4V3NMaVh3emNqYkQwU25vVkxIeUVIMDRXQ2k1d0w1Z3ZFQVJVYnJqd0HSAbMBQVVfeXFMT0pCenNDUUJHcHl3WTBTVkN3MUV0Mk5Kdm5jV3Y5MmNDTGp5UlJMVWR5c3VLaVdRS0ZyczdCZ1g0SGZqeDNWUzBXOTRCMk9CZ3Q4bGxHREFhUEdOblhVU2ppZnpySUtLVlR3RDl5RWo4dTBmbVgtMG1tc3MzajdDek5sdWxtcW5feG5DME5WRV9qbnBRWExpTjl3SDBTYjRFdTk4cnJvb2lCa3MwVVE3NTBvdWs?oc=5
2026-01-02	Yahoo	0.124	2 ETFs I’d Buy in Response to Goldman’s 2026 Investment Forecast	The biggest takeaway from Goldman Sachs’ 2026 investment forecast, at least in my view, has to be that a more active approach might be more worth considering over a passive one, especially if you subscribe to the belief that the S&amp;P 500 is destined for 6.5% in annual returns over the next decade, which is ... 2 ETFs I’d Buy in Response to Goldman’s 2026 Investment Forecast	https://247wallst.com/investing/2026/01/02/2-etfs-id-buy-in-response-to-goldmans-2026-investment-forecast/?.tsrc=rss
2025-12-31	Google	0.275	Invest Outside the U.S. With These Top International ETFs - The Motley Fool		https://news.google.com/rss/articles/CBMipgFBVV95cUxOd2hRcGNONEg1eEN4YUwtbnZUNXloUEJDa3hrazlVM1lobWpaT0tsZy16S0k0ZzB0NlFhckViWTBSVTE4d0hKRnNPT09nZV9DSlc0NUZoVjh2Si1sV1BVMGdtZTZXckVnd2RpNXNUN2pJNnlRSEl5cU5EcWFvRWNRdTJTbjNLZ2NlSFlLbUdVbzhCZmlBTDc2Sl9lS09sV1RLY0dTdkFB?oc=5
2025-12-31	Yahoo	0.167	Invest Outside the U.S. With These Top International ETFs	Compare how fund size, holdings, and portfolio breadth set VEA and SPDW ETFs apart for diversified investors.	https://www.fool.com/coverage/etfs/2025/12/31/invest-outside-the-u-s-with-these-top-international-etfs/?.tsrc=rss
2025-12-31	Google	0.0	DRC's hero: Lumumba's look-alike steals the show at AFCON 2025 - TRT Afrika		https://news.google.com/rss/articles/CBMiZEFVX3lxTE05Um9kSmVBeE1faDVMV3lwNEtGYjl2NEhTYzlZVjVXR1lvbU96Z1MxNF9JXy1GWmV6LUtOaXc5YkR2R0J5cGhYcnV5NUYyVVh4OXIweUF3d2RObkRjNGFkVHlHeHXSAWpBVV95cUxPc19MNjJfNmhvYTdXckx3Y0taZ2ZmNlRFb0s0RVYwRURtajVrdVcyTXVmM1JDX1lCTVdZYW52YXlSXy14bHEzWGZ6SzdGNW43UFd1QWVlWHkwOWR1ZGFBcUNJZmxVQVRWa1Nn?oc=5
2025-12-29	Yahoo	-0.062	Best-Performing Country ETFs of 2025	EWY, GREK, EZA, EWP and EPOL surged in 2025 as international ETFs beat U.S. peers, due to cheaper valuations, policy stimulus and diversified market exposure.	https://finance.yahoo.com/news/best-performing-country-etfs-2025-130000811.html?.tsrc=rss
2025-12-24	Yahoo	0.125	This Market Event Hasn't Happened Since 2019 — What It Means Now	Global stock, bond and commodity ETFs all outperformed cash in unison this year — the first time that's happened since 2019.	https://finance.yahoo.com/m/be16a562-636d-355e-bdc4-fdbfda2f7343/this-market-event-hasn%27t.html?.tsrc=rss
2025-12-24	Yahoo	0.02	VEA vs IEFA: How Index Rules Shape Developed-Market Exposure	Both funds target developed markets outside the U.S., but they follow different index rulebooks. Those rules determine whether Canada and South Korea are included and can ultimately impact how an international portfolio is built	https://www.fool.com/coverage/etfs/2025/12/23/vea-vs-iefa-how-index-rules-shape-developed-market-exposure/?.tsrc=rss
2025-12-24	Yahoo	0.0	Top-Performing International ETFs of 2025	International ETFs like VEA, EZU & EEM outshone U.S. peers in 2025 as cheaper valuations, diversified exposure, and stimulus measures drove substantial gains.	https://finance.yahoo.com/news/top-performing-international-etfs-2025-160000314.html?.tsrc=rss
2025-12-23	Google	0.6	VEA vs IEFA: How Index Rules Shape Developed-Market Exposure - The Motley Fool		https://news.google.com/rss/articles/CBMiqgFBVV95cUxQS2FhSXpYelVOWGQ2eldpeG9KX3RfOE83aWhHcFNNQTd2eFhtVXhkU0lSUlVGR2J5S1Q4MFJaZE9HZXdNZEhIUS1udG8xb0V3Zm1VMFhremNhZ1JCd21fM2RERXpaVFJtcGFWTl9JN3IwZmt1Z0oxcEdQbXdHUm9pNnNmVlpjaktMVlhqRXU4NVZvcmJ3VXpKUjZnZU9BMDlTOVAzcEc0dnF0dw?oc=5
2025-12-23	Google	0.0	VEA vs IEFA: How Index Rules Shape Developed-Market Exposure - Yahoo Finance		https://news.google.com/rss/articles/CBMieEFVX3lxTFBvMnFTTnBzbTdyOHFTaktCenVyR250THM0MGhHOU44M0tRemMyQUd1ZTFFeF9RaWZBWWV1UmtDQTllT3B6WGItVDlCMUlXTEd3Q3M5T0xFTWlONEJwcUVNSWJGMTN0bm5QeXBRcTBKUGZ2MkVYYTVqcA?oc=5
2025-12-19	Yahoo	0.151	2 International ETFs That are Crushing the VOO and are Worth Buying for 2026	If you haven’t thought about diversifying your equity portfolio internationally, perhaps the performance of non-U.S. financial markets might have you looking beyond the S&amp;P 500 for your next big investment. Undoubtedly, the S&amp;P has done just fine, now up over 15%, with a potential move to the 7,000 level in sight if investors can shrug ... 2 International ETFs That are Crushing the VOO and are Worth Buying for 2026	https://247wallst.com/investing/2025/12/19/2-international-etfs-that-are-crushing-the-voo-and-are-worth-buying-for-2026/?.tsrc=rss
2025-12-18	Yahoo	0.117	Vanguard’s Other Index ETF Has Absolutely Destroyed SPY and VOO This Year | VXUS	While most investors obsess over SPY and VOO, Vanguard Total International Stock Index Fund ETF Shares (NYSEARCA:VXUS) has quietly delivered 29% returns through mid-December 2025, crushing the S&amp;P 500’s 15% gain. For a $558 billion fund charging just 0.05% annually, that outperformance represents billions in additional wealth for investors who looked beyond U.S. borders. The ... Vanguard’s Other Index ETF Has Absolutely Destroyed SPY and VOO This Year | VXUS	https://247wallst.com/investing/2025/12/18/vanguards-other-index-etf-has-absolutely-destroyed-spy-and-voo-this-year-vxus/?.tsrc=rss
2025-12-17	Yahoo	0.05	2 Vanguard Index Funds to Buy Now -- They Can Beat the S&P 500 Over the Next Decade, According to Wall Street Analysts	Vanguard index funds that track stocks in developed and emerging markets could beat the S&amp;P 500 in the coming years.	https://www.fool.com/investing/2025/12/17/2-vanguard-index-funds-buy-beat-sp-500-wall-street/?.tsrc=rss
2025-12-12	Google	0.0	Vita Vea shows up on offense to help Buccaneers score vs. Falcons - Yahoo Sports		https://news.google.com/rss/articles/CBMiggFBVV95cUxOcGxqaHlsRFRnMk13OGtCYWRfb3laUmw5NEdxWkJpd0xyaVQyM1A0WmFGaDBaLVFMSHZIb2RiazhpY051YU9ETkpZbk9yZzRIbk4yWjlZNXhsd1UtZ1JnS1hDcUNiNTRQWDcta2stMUdkN2JzRmJNanN3Y1NpSVF3ZjFR?oc=5
2025-12-08	Google	0.0	Vita Vea Climbing Bucs' All-Time Sacks Chart | Data Crunch - Tampa Bay Buccaneers		https://news.google.com/rss/articles/CBMiogFBVV95cUxObW1reUNMZkhOZk9wZVV4cE9Nb3dlZTItZlh4ZjJRZmE2cm5vRHBRT3EyOGUzdUZKTUxGZnRiWnl0X1RkXzVTQ1NUN1NfdFBhR2ZqVHVsa0dPVUdNVFJiUm1mX2ZLRTV2azJ3MUdPcFRNQm10Z0NVc0xERjlJRk1senZ4NENsM05QVlBTbXZ6MlFsNUFzMEtYUFNObk9tMjVIeXc?oc=5
2025-12-07	Google	0.136	Tampa Bay Buccaneers nose tackle Vita Vea sacks New Orleans Saints quarterback Tyler Shough for a 7-yard loss - NFL.com		https://news.google.com/rss/articles/CBMidEFVX3lxTE1SVkJWYVFSdmpkV2xBNUh3Q0dQcWgzSnBJeWNjamphQkN3OVhWZ01mSl8tLUhsX3JSdHNRX0EzenZEZko0eWtHUGN0UndKQjN5cjBqSlZOMVk1dFNOQmg5VXotdld5dm9LaV9nYmpsMnhGVmhy?oc=5
2025-12-05	Google	0.136	Tampa Bay Bucs Vita Vea does weather live on Tampa Bay 28 - Tampa Bay 28		https://news.google.com/rss/articles/CBMirgFBVV95cUxNNVRpWmltczNSbzd3a2wydC0ySkhSRHIxRndwRGx0YmtwUTdtZXN4a0FYOTRnTmN6WjRMZGFUM3Ixd2NVc2hyV0M1ZkRLZ1Bjd21kNXMxYXc4SjY4Sk1TSGtSQ25zelJ5Y2NDcWVjUGNoTVUyZXlYVW4za19YdnNkdW92cVVabUlxZ3Q4YzBST1RJZEFjYnpxLU9lV1NCVHZ1WlJnS2pwaktQSTJzM0E?oc=5
2025-12-04	Google	0.1	SPDW Over VEA: A Comparative Analysis Of Developed Market ETFs (NYSEARCA:SPDW) - Seeking Alpha		https://news.google.com/rss/articles/CBMiogFBVV95cUxNS0V3eEdXZ0drRzR4REV2X09VXzc3SnlhRnFYdm8yOGVjU0VsSDJWQjkxMjVocXIzWjFiTjJlcFNaNG9MZE5qNGRid2UwYW5oYV9NV01nd0NkOU83dW95UTFWQlNHbnkzQUk2am1OX2U5T3IydjNFNV9GNzBsb1hLNTVlcVFXeGQ3eFRhYzI2Y1ZGVjQwM0RkVG0tb25yVUJUZXc?oc=5
2025-12-02	Google	0.3	"Todd Bowles Trying To Keep Vita Vea ""Fresh"" - JoeBucsFan.com"		https://news.google.com/rss/articles/CBMigwFBVV95cUxPNkxNbnhFYUxSMktZSThmUmVrWVItWktZU2ZtVEZldzJEVEx5UmZibk96Z25GR29QZ2hPMlRBMTZ2OWozT3BfX2E5WVlKN1g2X3dFQ053SDBjODJNaHNUMFk0T3N5cWhXZU5zNkVxdWI3LUlxVTNGYmhWZjJvUFZTby1wbw?oc=5
2025-12-01	Google	0.0	Vita Vea passes elite company in Buccaneers' franchise history - Sports Illustrated		https://news.google.com/rss/articles/CBMirwFBVV95cUxNMXljb3NET2tsOGFjU2YxMGlYa1Q1SnNzdW9TZmZIRGxWVVhHQ1dFRVNUalNMT2JQVVhjcjFOR0Fmd1BDajlZWU9XamlnZFhIM0VaNnRyNWV0X3hKSzg1cldrSGNESC1uV3UyZXFPYmxzTnpCQUVmZV9sU0gxZWJFTXFBaWhnU2FSb0R1cDkyU3F3VzFkZlFhV1VXMWp4NkxNZDIzRlc5SUJtX0ZpeDNF?oc=5
2025-11-30	Google	0.5	Vita Vea ENJOYED this sack 🕺 - FOX Sports		https://news.google.com/rss/articles/CBMibkFVX3lxTFB5bEl1VV9EaEFDUnNLel9VNXpGa1UtTDN4UkgzbWlaWUtlRkptY0stUjM1ZTlicUxuVy1OME1rWkl3MUNQandwYTAwZnBXSm1RTjJDNlRwZlAwOEh4ZjZaekp1YVlQZXNlb0dUdXZR?oc=5
2025-11-30	Google	-0.107	After losing 16% in the past year, Viva Energy Group Limited (ASX:VEA) institutional owners must be relieved by the recent gain - Yahoo Finance		https://news.google.com/rss/articles/CBMifEFVX3lxTFA2cnpKaDQyN2RFU0RIVEU5aDhiUHVtVS14NFN5RHhSVkMwcjFjSU9Xdy1UVnJjTVRTcEtocVpyZS0xcXJOT1NVdG1OZGNFQ015NHVrTFRvMzJEMVQyLVpUN3YzSjFjRFppWTlJMC1lMk82VERXTjdwR09QZnY?oc=5
2025-11-29	Yahoo	0.475	The 3 Best Vanguard ETFs to Buy in December	Vanguard remains one of the top exchange traded fund (ETF) providers in the market. Founded in 1975 by John Bogle, who is ultimately credited with founding the exchange traded fund (ETF). In addition to providing a range of other products and services aimed at institutional investors, one has to marvel at the fundamental change the ... The 3 Best Vanguard ETFs to Buy in December	https://247wallst.com/investing/2025/11/29/the-3-best-vanguard-etfs-to-buy-in-december/?.tsrc=rss
2025-11-29	Yahoo	-0.006	Here’s How I’d Allocate $100,000 in Capital In This Topsy-Turvy Market	The current dynamics playing out in the stock market are really hard to describe right now. On the one hand, there are pockets of the economy that are red-hot, with hundreds of billions of dollars flowing into high-powered growth trends like AI that are clearly propping up valuations across the board. On the other hand, ... Here’s How I’d Allocate $100,000 in Capital In This Topsy-Turvy Market	https://247wallst.com/investing/2025/11/29/heres-how-id-allocate-100000-in-capital-in-this-topsy-turvy-market/?.tsrc=rss
2025-11-28	Yahoo	0.24	This International ETF Might Be a Better Buy Than the VOO or QQQ	The international ETFs have had quite the impressive year, outperforming the likes of the Vanguard S&amp;P 500 ETF (NYSEARCA:VOO) as well as the Invesco QQQ Trust (NASDAQ:QQQ) so far this year while rolling over far fewer bumps in the road. Undoubtedly, time will tell how much longer the international ETFs can outperform the S&amp;P 500 ... This International ETF Might Be a Better Buy Than the VOO or QQQ	https://247wallst.com/investing/2025/11/28/this-international-etf-might-be-a-better-buy-than-the-voo-or-qqq/?.tsrc=rss
