Date	Source	Sentiment	Headline	Summary	URL
2026-02-22	Google	0.0	(ISRG) Movement as an Input in Quant Signal Sets - Stock Traders Daily		https://news.google.com/rss/articles/CBMixgFBVV95cUxPLVl3VlFMME5MUmN1VGZGRDN2REJFNXZjeWc2MmNmQ3pBaUJ3aDhxbUpUUk9tZS1Lc0ZESlpVY1NieXRYTUZDZ1NjUU1CejMzSW1GYkpBMFdkNlh4cXFsNjJYSlBicU9oZ2htclNOS3JzWHZlU3JXZ2hVN0dsQmR0b2RoU3MycEVpeTRHU193MXZnd3ZuR2tfWXRCMjZYX24yRVcyN0I2Yk9WSTdoelJhWHllN3FuVWJnSUExdG9lXzhlRjNGc1E?oc=5
2026-02-22	Yahoo	0.0	Intuitive Surgical: This Robotic-Surgery Leader Could Keep Compounding for Another Decade	The company's years of beating the market aren't over yet.	https://www.fool.com/investing/2026/02/22/intuitive-surgical-could-keep-compounding-for/?.tsrc=rss
2026-02-20	Google	0.0	ISRG Intuitive Surgical (NASDAQ) pre-market $499.53 on 20 Feb 2026: AI-enabled devices guide outlook - Meyka		https://news.google.com/rss/articles/CBMiwgFBVV95cUxOeGcwc0QyMnVTY0dQRGJ1c1VmQk9Qd2d6QWt0TU1xSjRDQ2RrSU10Nk1aU0Z6Rlc5cDdPWkp6UDd1TDFQdUNkc29jb0ptUlNkWmZHVWNSR3ItMTZIb2NzT1R4NXZweFRXVWEydDZBcFBsd0lnZXNsaF9xRUtsN19XcjQwX2EzekVabjhGTmhMd1pVN2laM1d1TzFtdlA5akw1Rm9jZVJKWDBObVRnZ0h0TUQtR3lQa2NRYWlERGhJZXJzZw?oc=5
2026-02-20	Google	0.0	Intuitive Surgical Stock at $500: What Is the Market Signaling? - TIKR.com		https://news.google.com/rss/articles/CBMijwFBVV95cUxNamJMZHNvaG8tU3RoS0J0Ukc0ZHdaWEdRaDlsTjJaVlNiVTBoZGd6QWVhSlBEM0xjWTdjT0xZMTB2Q0xxcG1yYnpUX19tYkwtcEE2YkRqTDRZRHpVZ2RhVGVmcDNMNlZqbFhFZDNTTFRNT3J6NGxVWVNBcm8yY0ZkRWlqNDB1LWVrN2FKRi1Ybw?oc=5
2026-02-20	Google	0.0	Intuitive Surgical, Inc. $ISRG Shares Acquired by China Universal Asset Management Co. Ltd. - MarketBeat		https://news.google.com/rss/articles/CBMi4AFBVV95cUxPODgwalZrRlItSGc4bXBQUEhSTWdqZHZiWTQtdEFha3FOTW5LODJkanFEMjZhcVU4TS01WnpNUHpKMldNeDJhSXY4TlZhdmx6aWk4eGFtNUplMG9qckxxQVdibVpSbzRBcUhKLXhkNnotazZ2aDBZZE1JelFnY25tMjd2c1NtQV8yWUV1ejVmSWw0ZWU1RVJod0hXUEdtSkt4cmxhbkJDYTF1SFRQdHhYRWdOY2xpRlEwTXQtNFVxU0ZrbFNzc0FMWmRjRjhZWmpxbU9jV0NpaTlHR2pxVjVjSA?oc=5
2026-02-19	Yahoo	0.152	Is It Worth Investing in Intuitive Surgical (ISRG) Based on Wall Street's Bullish Views?	Based on the average brokerage recommendation (ABR), Intuitive Surgical (ISRG) should be added to one's portfolio. Wall Street analysts' overly optimistic recommendations cast doubt on the effectiveness of this highly sought-after metric. So, is the stock worth buying?	https://finance.yahoo.com/news/worth-investing-intuitive-surgical-isrg-143003598.html?.tsrc=rss
2026-02-19	Google	0.0	Axxcess Wealth Management LLC Cuts Stock Holdings in Intuitive Surgical, Inc. $ISRG - MarketBeat		https://news.google.com/rss/articles/CBMi2AFBVV95cUxNNmNPTXdJNGE3bnM1Z215Y3Y4NVBnWmM4UlVrNGllbmdiYl8xQmZTZmFEMkIwOHRydjBibWZyeGFxcUNvTHZ5eTdZM3BHSzItT2UzWHJmUUtlNXdWVTE1RE0xQ3Y1REpxeVdScGt0cVUwdTRSUlF4amFGR3VwV1NQZ3Iya2ZOb2dUM0ExU1daRDBUQVNzX09VWXVQdGZFOS04RXo5eUJBeWZzS0pxR0RULVJ3ZXd5eEpYUEVCT1ZYU0ZocDZTMmlTTnpmU0pUalQtWWpEWWJmRnE?oc=5
2026-02-19	Google	0.0	Comgest Global Investors S.A.S. Sells 6,341 Shares of Intuitive Surgical, Inc. $ISRG - MarketBeat		https://news.google.com/rss/articles/CBMi1AFBVV95cUxNelJRX0tWZ1U5UDFFODBEMDFYSkF6c3huQVFZSTFoNUZWbjB6dzZzOTExYVNqaFVjQUd3RGJCOXRJZ042WU4ySFBiRVpoWkZWYzFCV1VZbFBoRFRHYTRqLXBDVlpLeXBiQzFzaW5fU0ZJaWh0U004Qkt0UlJJSmxhbmNQSDIzN0NnbGxKTmVGNzFIeWhHdnBWUVo2UElrSjJWVWsxeEFlR0VuaG82QkQ3NjB0ZC1WZWlNc2I0WEJCRllHdnhlWGtVLTIzVmtYcTBwRWFYcg?oc=5
2026-02-19	Yahoo	0.0	Could Intuitive Surgical Be the One Medtech Stock to Hold Through Any Market Crash?	This stock has climbed in the triple digits in recent years.	https://www.fool.com/investing/2026/02/19/could-intuitive-surgical-be-the-one-medtech-stock/?.tsrc=rss
2026-02-19	Yahoo	0.0	ISRG's International Growth Outpaces US With 35% Procedure Volume	Intuitive Surgical sees international procedures jump 23% in 2025, now 35% of total, outpacing U.S. growth and reshaping its long-term expansion strategy.	https://finance.yahoo.com/news/isrgs-international-growth-outpaces-us-160100134.html?.tsrc=rss
2026-02-19	Google	0.0	ISRG's International Growth Outpaces US With 35% Procedure Volume - Yahoo Finance		https://news.google.com/rss/articles/CBMijAFBVV95cUxPaTdFNW5NN0g5ZjM2amhqcDBYUEdJaXRwaF8tbjFYMHJfT3E5dmZzVF92TDdmTG1JS1JzWm55MlZJYlhHNnBXLW91c05pdWFMMW5WY1hramx6Qmh2azJES19ZejZ5UmRTQ181WXdiLTNKRk43UjdoWUNfRHFuYXpuMW5SUjZtbkFIZHBUTg?oc=5
2026-02-19	Google	-0.12	Is It Too Late To Consider Intuitive Surgical (ISRG) After Recent Share Price Weakness? - simplywall.st		https://news.google.com/rss/articles/CBMi1gFBVV95cUxOSk05MWdzdkkzWVlRdnEwUkJHNXNhOWNzSjJfejhyUU9Kd3QyVTVNQkx5R1hfUE5EQ21zWHFjcDBWWlY3cDFjbkpVMUJFbk56bjZqX3BUV2IzUlNndThvYURvOXZHd0ppcGtYb3didFBXNlg5UlVla0plTEpuMkp4SzkySXhTWm9lZGdfMU9Nc3pMNU1ad3RBM0Z1WFp5VWcyWmxPQTk4d21KSW54ek90VlNKdkZPd2tKclAwRkd2NkhUaEdZclY5b1FtdTAzZUptUng0UFNB?oc=5
2026-02-18	Google	0.0	Intuitive Surgical, Inc. $ISRG Shares Sold by Cercano Management LLC - MarketBeat		https://news.google.com/rss/articles/CBMixAFBVV95cUxOR0g1WEdQV1N4UWVFRHV1THRlazZlTTZjLS1vaTBkY1BoOEVpeHQyRWNYY3lVdGlVZlBjbFctQzZhOGZid3JJRnBQUFNtUDZHbG83WEtwNEhjZ0czajBMR2tybW9IaW1ZOHZfa1B2N2hCeV9IN0pDbUZKaVdPNHJfZ19vNjV5NjN4d1FYSEhqeEhhaldPNGVXdWl2NzBGUlY5alhkcHdiQzh1TUFVelRnM1F4R2NxMDhrSFgzZGtMU3RtemtQ?oc=5
2026-02-18	Yahoo	-0.106	Intuitive Surgical Revenue Growth And AI Push Shape Robotic Surgery Outlook	Intuitive Surgical (NasdaqGS:ISRG) reported 19% year-over-year revenue growth in fiscal 2025 Q4. Growth was driven by higher procedure volumes and increased placements of da Vinci robotic systems. The company is expanding the use of artificial intelligence across its platforms. Recent AI efforts include work on robotic bronchoscopies and lung biopsies. Intuitive Surgical, the maker of the da Vinci robotic surgery systems, sits at the center of the shift toward minimally invasive...	https://finance.yahoo.com/news/intuitive-surgical-revenue-growth-ai-043707255.html?.tsrc=rss
2026-02-17	Yahoo	0.25	Intuitive Surgical, Inc. (ISRG) is Attracting Investor Attention: Here is What You Should Know	Recently, Zacks.com users have been paying close attention to Intuitive Surgical (ISRG). This makes it worthwhile to examine what the stock has in store.	https://finance.yahoo.com/news/intuitive-surgical-inc-isrg-attracting-140003160.html?.tsrc=rss
2026-02-17	Yahoo	0.045	QDEL Expands Immunoassay Portfolio Via Lifotronic Supply Agreement	QuidelOrtho inks Lifotronic supply deal, adding 70+ assays and new analyzer platforms to boost global immunoassay reach and recurring revenue potential.	https://finance.yahoo.com/news/qdel-expands-immunoassay-portfolio-via-161200671.html?.tsrc=rss
2026-02-17	Google	0.0	NEOS Investment Management LLC Raises Holdings in Intuitive Surgical, Inc. $ISRG - MarketBeat		https://news.google.com/rss/articles/CBMi1AFBVV95cUxOVjM3QXRiZHU0THVzSl9ib3dHT0R1V3BDTFVxQlVvbUVLVDhudWN1cF9pWFFrYUpGSnNma0l1UjdFZ1dZOE5OVG1BTk44MnhOQU9vdTVzYWRPclhUVEZrTVQ2SHgtMXR4QUk4X0FFWF9RUEpiLVlxeXl6Wm4wLXZKOWQtNzR3WGlZOFNYZzRSNlRmRW1JTzBzR3lCNkt4WGxHZTQwaXE0enVJZktWcGVxQ2Z3N0ExMlF0a3FlVG5qXzdRcXlnRE56aDZRc0pRUFRCVW4tVw?oc=5
2026-02-17	Google	0.0	PNC Financial Services Group Inc. Sells 2,193 Shares of Intuitive Surgical, Inc. $ISRG - MarketBeat		https://news.google.com/rss/articles/CBMi2gFBVV95cUxQRXdFTy1yNmtOMDdTRjc3c1hnLXFPcVNGVzl2RERUY2VtSXh4dTc5dFlIQkE1R3ZobXU3NjhKNVFmWTZsemJnRjdQaFAtWHNhTlB1S3NjWkVHamdZSTVwODFkd042V3FlYWhLaUZfSm4yS25LWW9FZ01fWGI0a1U5YXYybzJrUS1GRkFleGx0cXN2MkhGTUppX0d4QnctSGl0d2FpblFFeUtqNW93NWktSVBEZVZHemVBT0ZQXzZOcVhBU3cwbnpoYnZvdXRMby1RZGw4SXZXeVhvQQ?oc=5
2026-02-17	Google	0.0	Rep. Gilbert Ray Cisneros, Jr. Buys Intuitive Surgical, Inc. (NASDAQ:ISRG) Stock - MarketBeat		https://news.google.com/rss/articles/CBMixAFBVV95cUxNTDhTTjRQZ2xTWEQ1X3dHeHBCdjVGVlNhd21GSVlZSWlhejM2MWtNaGdfWFlvdXJfU1lLMElmWnA0eFhlX1NYMlFsckp2VFpzQ2RpcEt6bTFSeFBWNW43dWsxb0h5Ung5NXBDamExcE5pVV9PT3haTVFCSldSY1pqRklZd09nWXJsdmVhQVhTOC00OGtCbExTVV9xMmlCMkZBNEFxNWlNczZwZHpyLXBQNVF1QUcwdUNtcnEyME55aHJCYWth?oc=5
2026-02-17	Yahoo	0.0	Tempus AI & Median Partner to Add AI Lung Cancer Screening to Pixel	TEM teams with Median to add FDA-cleared eyonis LCS to Pixel, boosting AI lung cancer screening and expanding its imaging portfolio.	https://finance.yahoo.com/news/tempus-ai-median-partner-add-162000559.html?.tsrc=rss
2026-02-17	Yahoo	-0.05	Medtronic Posts Better-Than-Expected Earnings. Here’s Why the Stock Is Falling.	Medical device maker  Medtronic  reported quarterly earnings and net sales that topped consensus views.  Medtronic  on Tuesday posted fiscal third-quarter adjusted earnings of $1.36 a share, narrowly beating analysts’ forecasts of $1.34.  Medtronic’s profit declined from the same period last year on a non-adjusted basis, slipping to $1.14 billion from $1.29 billion.	https://finance.yahoo.com/m/230db64a-3a23-3d05-8231-8bbc82a1e0e1/medtronic-posts.html?.tsrc=rss
2026-02-17	Yahoo	-0.094	What Are Wall Street Analysts' Target Price for Intuitive Surgical Stock?	Although Intuitive Surgical has lagged the broader market over the past year, analysts remain broadly bullish on the company’s long-term growth outlook.	https://www.barchart.com/story/news/249166/what-are-wall-street-analysts-target-price-for-intuitive-surgical-stock?.tsrc=rss
2026-02-16	Google	0.55	My 1 Top AI Healthcare Stock to Buy and Hold Forever - The Motley Fool		https://news.google.com/rss/articles/CBMilwFBVV95cUxOOE5CNzZMUmdUS0ZFZE1NRnJHVG5fWVNtU0RCWkROTGxUeUEzaHlZQnJOSkxuWWdyTlE0SXJNWDd4S0hydGstZG4xV01tS016LW5SeXlxakd1NHl3M3FEQVRlU3ZiZFJHWHZBTWcycmVMb1ljMEJZXy1aU2xWZmJxQk1MY2ZlM0taS0JxbE5ld2hzUkJYNk1v?oc=5
2026-02-16	Yahoo	0.25	TMDX Wins Full FDA IDE Approval for Next-Gen OCS ENHANCE Heart Trial	TransMedics secures full FDA IDE approval for its OCS ENHANCE Heart trial, clearing a key hurdle and advancing its push to expand heart transplant use.	https://finance.yahoo.com/news/tmdx-wins-full-fda-ide-155200995.html?.tsrc=rss
2026-02-16	Yahoo	0.164	CareDx Reports Positive Data for AlloHeme in AML and MDS Post HCT	CDNA shares climb after AlloHeme data show early AML/MDS relapse detection, backing its Transplant+ expansion into cell therapy markets.	https://finance.yahoo.com/news/caredx-reports-positive-data-alloheme-163200402.html?.tsrc=rss
2026-02-16	Yahoo	0.117	My 1 Top AI Healthcare Stock to Buy and Hold Forever	The stock has averaged annual gains of nearly 25% over the past decade.	https://www.fool.com/investing/2026/02/16/my-1-top-ai-healthcare-stock-to-buy-and-hold-isrg/?.tsrc=rss
2026-02-16	Yahoo	0.01	Intuitive Surgical AI Push And Global Expansion Tested By Rich Valuation	Intuitive Surgical is integrating artificial intelligence into its robotic surgery systems across its platforms. The company reports strong global procedure volumes and continued growth in minimally invasive surgery adoption. Recent investments are focused on expanding direct operations and deepening its presence in key European markets. For investors watching NasdaqGS:ISRG, the story is not just about surgical robots; it is about how those systems are being upgraded with AI and scaled...	https://finance.yahoo.com/news/intuitive-surgical-ai-push-global-211059938.html?.tsrc=rss
2026-02-16	Google	0.0	3,555 Shares in Intuitive Surgical, Inc. $ISRG Bought by Mmbg Investment Advisors CO. - MarketBeat		https://news.google.com/rss/articles/CBMi2AFBVV95cUxNbktZbjBaNTlnNFBxVDd0VVgtVko3dUt3LUtqUlFYQlR3SFQxNl9fd0ZQZ3JncUhhTEthVmxuQ2puem5kR0R6Q1hSQnE4VzJQcUFtZ1E1WnlwZVdQeVNDOURod0owR044V0FzRDU5eXdHd3BwMDZSdG91UU5URFZrMlBfUmtUN1p2MUR2NzREaEY0cjZWdFdrRDZJTnBmMjdKOGEyZlQtTy1MZnIyR2E3ZU9jdmg2U3JiVGt4TXNMZmpZMnkzZE1wblRJZU5SNjZIb0Y5M3RNYWs?oc=5
2026-02-16	Google	0.0	ABN Amro Investment Solutions Trims Stock Position in Intuitive Surgical, Inc. $ISRG - MarketBeat		https://news.google.com/rss/articles/CBMi2gFBVV95cUxOV2VzbFp1MkZ5ZnVZa3FJMEZ5WEJ0VHA2RlU2ejNCc25wT0hncnpmM1ZUUi1qdWdMZVhxWXVVT0RSYjZ1MFRYUlA2UGVfSUtBRVNzN2tEeDVSaWtQYlZKdmlhY0RKVTB4OVlOazZSMlFaT1BmcWpiU0FiejFTenJVUWhvN0x2dTk5bzZGOGtIX3N5bDJDQmk5SkJURU9LaGFhUXlmbW9FSFdMSktieG8yNlMxVlludXhlblBFeWtrdnlQbHIybjFNTlZJdDh6bmNPS1lrRWxIZC1vQQ?oc=5
2026-02-16	Google	0.0	ISRG (Intuitive Surgical) NASDAQ pre-market $485.84 16 Feb 2026: AI edge in surgeries - Meyka		https://news.google.com/rss/articles/CBMirgFBVV95cUxPTWZvNXNxaVhqWlRjVkhrS2ZTZjEtOFZ4UzJXQWQwWEJjamlJdUNtWVhCakl1azFXQlE0TUt1cVp5eFlTOVFzYWtyR1BhUC15V25VTXlQelRVb0JGRlJHRVdMM3c3SWZWX3h4aXQ2VzlLXzN2MXA2YnM4WXJBRHBIMFlWcTRjMWNtQWZIeGlYeWhhZ1ZoaFR1TW5hMVV3RTdJU1ZVbF9lOEZtMEVxN0E?oc=5
2026-02-16	Google	0.0	Intuitive Surgical, Inc. $ISRG Shares Sold by Fifth Third Bancorp - MarketBeat		https://news.google.com/rss/articles/CBMiwAFBVV95cUxQRmRxazVPYWlEOHlqek5YQ0pPZ1lrcEpudFlVTUFRMjVMcG9ZY1luNVU2RHJJT1JTZTlIaWRJYnpVNXhXNklvZlZxd054c1VIUTg2b2Fia0cwYk13RURjem9SS1lnbUpfQ3RoUU5QQ0t6SDlZNUVuc2JzcWdfZFhRd3pueWlGNlVVNmh6bXUzSG8waXAwSkJxcnI5LXM4OExjOFVWRGhEb3lPejBIXzN2dFQtM093dlFtYWNpaElJcTQ?oc=5
2026-02-16	Google	0.0	Vanguard Group Inc. Purchases 263,828 Shares of Intuitive Surgical, Inc. $ISRG - MarketBeat		https://news.google.com/rss/articles/CBMizwFBVV95cUxPdEJ5N0xCME1tcDh2UWNPdGtlSzVPdFdLNnZZMVJyd3ZUYlFRTzFFQXNwSndINHZ0bmJkSzg3djdZeTItZ1hVUENtRUtUM0dIUFRnQXZINDJGRXc0V3Y0MXMwdlVTa3RQdWpqQl9kZ2VJRjJCQmRBMlF1M3VXaV9HQk84bnhseVRRNF8tN09WeDhMVGk5MUdwSEF3NVVIWEJOcDdwakhBWG9lODFXTUxZUGQ0SGxTZ0FmSW9sR3NzN3ZLVGlNTzBPa1ZsdVBSeGM?oc=5
2026-02-16	Google	0.0	Zions Bancorporation National Association UT Purchases 3,437 Shares of Intuitive Surgical, Inc. $ISRG - MarketBeat		https://news.google.com/rss/articles/CBMi7wFBVV95cUxOUW9zcml1ZHdnd0NYQ2xjeFZGTFJRdUVoV1QxZC10dEFtLU9KOXNSWkQtQ25yY25FaHRyUGcyLXRSSGc3MFp4bjNjbjgzLVRHR0Zvd1N1V1dpZGE1NXlYYU9YYzQ1cFVISkl1N3FlQVJJN0JsUVpJSnFNRGFQdWhMaFlnbHQtUGxNbk5obXFwcUV1YWJ0SksxT3NrZ3ItRzM5bEhvdnpkS0dJM2w0R2V1TC04LXJpSWZvLTNFMmctNmp4TWF0NVFhMkt2dG5KR2c3WFliNE9WTmZFTDY4RHZNT3BIT3k5NEJLdVhKOHJFVQ?oc=5
2026-02-15	Google	0.289	How Strong Procedure Growth And Capital Returns At Intuitive Surgical (ISRG) Have Changed Its Investment Story - simplywall.st		https://news.google.com/rss/articles/CBMi1gFBVV95cUxPU3dXaXREWFg4SG1DS1ozNlVsWDIzd3BKeXNKRTlUQkZfM1VkZm1CZXBUa2pVaUJ3ZkxrMnRobVJtaXlSUWxhRjdsLWlyN1R3eWRxRGw1OXBob3pta1VZd25sLUZpMjJWcGd3Q1dycmVlN2JNM3hIOVA3eGlfSGxRdlh4dFRMM18yZllWTWVsMkpwd25pclM0elA3Zndqc18wa3lGcFpJRVFyYTBKckdiVF9QTlBjb2wwamEzU3JBdzVjeVZMVjBWYzJZUXdoejljRlZRd0hR?oc=5
2026-02-15	Google	0.0	Aberdeen Group plc Grows Stake in Intuitive Surgical, Inc. $ISRG - MarketBeat		https://news.google.com/rss/articles/CBMivwFBVV95cUxQY0FaelNGMHJ3QkZxN1g5U1lEd0tva0l3TWlJS18wbDloOTVLVWdjc19OQ3NMbVkxSDlNUXNHbFM2ZEhHZklmMjhoYjB0a0hHckxTM1BhSUY1cDFVYjNfMlF3Rmx5andRdjZNTllfTjVWY0VvS1FPSlNJdjhKSWZoTmdTUEU4X0hWalJodXUtVV9PU0p1N2stY3NiNF82UTF4T29Xa25YV0UtbnlEdXk4TEZpVWFoVnVxRG5fdFpqMA?oc=5
2026-02-15	Google	0.0	Illinois Municipal Retirement Fund Sells 2,333 Shares of Intuitive Surgical, Inc. $ISRG - MarketBeat		https://news.google.com/rss/articles/CBMi3AFBVV95cUxQOThJcW9FLXRPdndMZndOeVdXODNuRVlrd2dkY2I5bHlYTWxKRGN5bG04YXJHZU5QRmxwcVQydWtqeC1YeGItSmRJNFhNVy1PVlNCVDhwb1kzN0tpMzF3ZndDRFBPNTlidVRNYTZqSGhUT1FhS01aMk5hbGZMdFBTQVNPX1Zia000dmpaLURQdWZKY1cyUEl2dE1VTUlyY0NDdjNId0FVYzRlUE4wZFVUNEhmV1dUZHAzLWl0U2Z1ajNvRlBrN2lsNzI5TkZVbkZQXzZVVlF1M0hvSE5L?oc=5
2026-02-15	Google	0.0	Shell Asset Management Co. Sells 24,907 Shares of Intuitive Surgical, Inc. $ISRG - MarketBeat		https://news.google.com/rss/articles/CBMi0gFBVV95cUxQSVJvb21IeEdsRlEzUzdPeEdmMmliWmEwXzJiQ1BMSEwzVU5yOGcwa0hteGw0RndxQzJGWGxMTkROWWx3N29ad3RHcGlEdTJ5T0Z6Tzl6UF95dHc3SmJZeWNCQ2kwZnFlSkNvWm5TWVNFOF9tZm4xbUEtaG9reDVudktVeHZTaGVuTlhieUVuU0ZicXRNTE1zZ3RSODBRWWxMUmp3blotdTFzQ3lySjlaMzhZbVlUbzhpTWlydTViRUdlbWowN3RPQ3ZxNnA3NFptWHc?oc=5
2026-02-14	Google	0.0	Assessing Intuitive Surgical (ISRG) Valuation After 2026 da Vinci Growth Outlook And AI Recurring Revenue Update - simplywall.st		https://news.google.com/rss/articles/CBMi1gFBVV95cUxQRXRtQktKNFJkaEFWZXF1dldvLWY0ZU9vVXplaUtCV2JnaXhGbHVUQkpRWGJIdmFFMnpnZF9pVnFpV1RxQXpyMkhUaFBsLW5ySVRVRXBlSU9oaEx4SU42YXF1eDJvM2FOd2xyRGdseFN2YU9OMjc4c1c1bVVISjJTTEtFWVUyQW1Ocnl4enkySkpNX0t4dk9fUHJSZm5BWXNaN2xYMy1lVHJ2cWY3Q3ZhdlgyUzhLTFNNNEFMZ3BPXzZwQTlfTmZHMnRyMkY3U1FDYW92ZFh3?oc=5
2026-02-13	Google	0.0	ISRG Intuitive Surgical NASDAQ Pre-Mkt $478.60 Feb 2026: daVinci5 adoption key - Meyka		https://news.google.com/rss/articles/CBMipwFBVV95cUxONEhxR0k4NFUxU005TENtbEVsTHpJRUdCdHAtbVljd0tWcDh3V21oYWRJME80Y0lwQjk2aldNMlNWcHlPQ09hNm0tNGZyY2FBdzBsbUZMUTNZVXVVbUwyUjJUcWlNdkt2TENoak9mdW43cmR4MjY4RERNZlc3WHNyN2tKc0NhMlB5QkFOVnVhdmotTzBSOENaNHhQclBCN3hmYXVIU2ptRQ?oc=5
2026-02-13	Google	0.0	Intuitive Surgical, Inc. $ISRG Position Lessened by Prospera Financial Services Inc - MarketBeat		https://news.google.com/rss/articles/CBMi2AFBVV95cUxQMjlBT2pHLTNVbWJiV1RINXJHa1NYMWZJbE1kOEVpRERLUzFCUTQ1OTJULTlHVW5wTmNFamtOa0dBM29kcGVQLTMyQzRBUzFsQnNoMkZJcmMzUkY4NzRhMUVYa0J4Y1ltQkl5WTNCMGFDUUtVQms5SF9EWGEzSFBjNHF5TTZwQjdJNEhNX3NrY0Iwa1lxcUhkRmVud0t6dGdKWmJweWhiYUNBeHVmc2hGM3dscy1YODBvZlAtU1JnUFFiTElkdjg2N0dkM1JDQzFKNmQ0LTJqY3M?oc=5
2026-02-13	Google	0.0	Intuitive Surgical, Inc. $ISRG Shares Sold by Atria Investments Inc - MarketBeat		https://news.google.com/rss/articles/CBMiwwFBVV95cUxOUVM4enZWaFRzQVZqMzgycTVOckRMTTZISkU5ZlJKUGJMV3RwVW5jQmFGYXN5d2xrYW5VVDltZkx5eDBVckdpendFZXBDUGg4clNoWkpaR0pUeG8wVDRfa2Z2RHhRLVRvbXAzdWhDTjFSWkY2NGMtS0dLUlhJd2VrdVJodXlIeGZPVnhuOXVSVFp1dEJWc0RLN3c1M2o2MkJwaXJrRS1wMjZydlpNUV9vRlo0MnBQSU1kLTU5YXYtUlJYbk0?oc=5
2026-02-13	Google	0.0	Will ISRG's R&D Focus Following Solid Earnings Growth Drive Demand? - Nasdaq		https://news.google.com/rss/articles/CBMinAFBVV95cUxPNVBSSG9yUUk0RmltWHdveGltTTVkdER0aE1VdmFCY2s2NDh2SkNDOEhsbnQ4TE9uYnFIV3hoQVExTTVnUXlOUFpiTERNeHhTekFmX041YW4yMHlBOGtITWpRRXZZUDdoWW1mT19URjlfaHZqSmZ4Xy1RamI0anllYmVNb3piVXpOblN0RXgxWEt1amt0WlhCQmc4V2Q?oc=5
2026-02-13	Google	-0.156	Intuitive Surgical Inc (ISRG) Shares Down 3.57% on Feb 12 - GuruFocus		https://news.google.com/rss/articles/CBMipwFBVV95cUxNbUtnZkdlRGtaSWE0WVBINGIxVW5KajhLY0I2aHF0TUZCSkptRUNOdmowYVRiNFEtMGdvZkRZcnRscXR6ODZqdEtUb05jWFpqR2tETzhLV1ZXRnowNlQxM1JSRzZaeUQzc0h0SF9IR2N2aEFFWGRtaDBtSE8tVXBlMWtETWh3c19JT1JXYlhjRnJ0ekVqWDhIaFBIZEhCZ2ZjbmFrUlBHMA?oc=5
2026-02-12	Google	0.0	Fund Update: 266,380 INTUITIVE SURGICAL (ISRG) shares added to CALIFORNIA PUBLIC EMPLOYEES RETIREMENT SYSTEM portfolio - Quiver Quantitative		https://news.google.com/rss/articles/CBMi8AFBVV95cUxQNHFUTFBveXZ4RFMtbjFrck5TOUxMWlRzVW9ndi14eUotRkRSTzVQd0Q5dkt6djh1NF9WOG92T1NQZTRaOEFINVBJSnB3WmFXYTJaNmo2bFB0dEs2VzFpdXIzeS11b3A5YUlzcnp5N1ZKcDRscW5JbDEyR3hkRWxiUTcwYjRZalJWY3RpU3FGbUZFN3ZQZ1lLdjdnUExWLUpuT3E5aDd1dW9oTlluWjVBOGpGTWhYSlJhT0NpdmI3Yk9IZlVjZHl1TzdwUlJIcTdiS3FiOWFRdkVOM1NHTFdFcE9XN0FFczBXdXZTTElaZEQ?oc=5
2026-02-12	Google	0.0	Oversold Conditions For Intuitive Surgical (ISRG) - Nasdaq		https://news.google.com/rss/articles/CBMigAFBVV95cUxOTnlZWkI5cEw3SnlaZmk1UTYtZ3p5a2FjYS0tOXNZenpxdXZhMnlEM0x2OHdFQl8xNHd2THAzbndldVVHVXB2dTRXVFdPTkNweDQ4ZDRCbkVQOEZTRTBkUE5nZGsyUzZhY1h5Zm1OcDJRdUQxTFFLU2xlSWtKWkdXUw?oc=5
2026-02-11	Google	0.0	Intuitive Surgical (NASDAQ:ISRG) EVP Sells $51,938.25 in Stock - MarketBeat		https://news.google.com/rss/articles/CBMirwFBVV95cUxNem5oWkhpb1hYR2dmRTF4WGRiV0ptdVh4VkRuODVuc2Q2cEVjbUczRXhvRDRpNGVrTFRKcG1sY0lkTm5IRXVCVG9wOVFJdlRPN29Scmozc3Zyc0ptejNjVmktVFdPbUxVcVN4SENYZWQ1UjhBUi0yYnFYbnp4ek5fN010LTBlSXV3LV8yb0NNSndiY0l2Y09MRUdpUC05dEN2M1ViNjdlaHdnU3BETTQ0?oc=5
2026-02-11	Google	0.0	Is Intuitive Surgical (ISRG) Still Priced For Perfection After Recent Share Price Pullback - Yahoo Finance		https://news.google.com/rss/articles/CBMiigFBVV95cUxPcVFOeTEyaXNNMURBdmhPbjVncFpCUnkxcUduTXFHSHgtNzBMakgzMVlHUV8tZFkyS1Jrd09OMUVuMVdBUjRBNWVieGpUSWpvWDJOMGVRVjBuS0VkZFVERUFpbmU2eHRwdmREOVRpTE92NWphdE93OGRtQ2hYNE5KME5TV1Q3Zl80ekE?oc=5
2026-02-11	Google	0.0	Should You Buy ISRG Stock Despite a 13% Fall in Three Months? - TradingView		https://news.google.com/rss/articles/CBMitgFBVV95cUxNUUZNckpqWUdsa0tJdmtLRXVUbUJ5VkpIc1lKZWlac1ZISXVNR2h2dTliR1FPSVJCZS04WENsNHMtdWFxRndodmlCRGFDVXhkeFQ0RFN1Xy1qeFdMU2cwSlJIMDM1S2w3bm94NVNiOGtCcm4wYWxyWGtCT2xfTWNlekJtaUh1RzBPMW1YR004X3NiUWYzNnNVMFpOd2tITk1GSWIyb29BbzFveElub2JYMW0tWDNiUQ?oc=5
2026-02-11	Google	0.0	Should You Buy ISRG Stock Despite a 13% Fall in Three Months? - Zacks Investment Research		https://news.google.com/rss/articles/CBMiogFBVV95cUxPRjRUWDlNTWxXNTRaeVhqUnQzd0pNZUZMbmpJMV9acGhmR3pKUWlPeGNjOUg5T0NFVkp6bzdLUWw1U1c1TUQ2R3Jveld5bE9LUXc2NE5pa2d1ci1qcGtENGlISlN6YlRIN1dBUEJsc2tRbjlpYUlrZmxwRDFEeGZiSGhjYjB4blhqZlFBZFRTb2tKckVkSVBUaTAzXzJiTGRrcnc?oc=5
2026-02-11	Google	0.0	Wealthfront Advisers LLC Cuts Holdings in Intuitive Surgical, Inc. $ISRG - MarketBeat		https://news.google.com/rss/articles/CBMiygFBVV95cUxNTWc3UjA0LUotTHFjRzN4dE1kZV9JN09wSEdkbk9JOVNGTHhpckw2cUpMSmQ0RW83OVE1QlZKeldVemx1eDAtZVhON3h5Q0FHTTVndlYyWlVkZnduckRCaXRTZGljLUpoZ1VPUHlpUE8tTjZJYlVPWU84dzkzWDZaN0xlR0NkZ0lNdkNSSmJXUHJ3MGFlekxLQ3hWdnlGdzRwSEhKQmVKQkx5SFlzcTQySms3RW9Wb2NDLUJaVDlrS2ktWlNmQ1Q5MHRB?oc=5
2026-02-10	Google	0.0	Johnson Investment Counsel Inc. Purchases 2,550 Shares of Intuitive Surgical, Inc. $ISRG - MarketBeat		https://news.google.com/rss/articles/CBMi3AFBVV95cUxOT01VUlBDUlBmMU50OFJjZjVqQ1ZpdHU2dEV2WEFoNnNDamQyZ2c5dGFXNzg4TWdMeG55VWdKMEtCR0xqREZ1X0JnZEY3OHdSV21sZmlTYS1KdXBuLVlJNnVkQVBBNTN5RXNfcjNBdExuRzdXaVVYRVM0VE9GTTRxYTdYajZhemt5U3pOMVdQOUpla2NHaGZsZVgyQmt4cWNabXNVSmFtY210NnJGbVUzVF84RjdxcmJ2MWdWdmxWd3JMSHlHbmRUbUFsa1M2b0lkN2w4a0FQWlhXc1R5?oc=5
2026-02-10	Google	0.0	PODD Looks Smarter Buy Than Intuitive Surgical Stock - Trefis		https://news.google.com/rss/articles/CBMitAFBVV95cUxQc2xwVmZSQW0yZXNwc3RnODYzc0l0NEZhU2gtSmFGVGNpeEs0VTZqLWtfcjVjaEtQUWJFVmxpeHhWcjVPM0xaWjRiek9WMm5JX3Q3eUM4al9qOGxyVnJOX25IejRPbXFQUGRCcUdSbGYwdXVmN1RDWkVhMW1fbVhqdDhzWkkycWJvRzVfRHFjMmdxMS1KS1NWTG9mQnpOcFpTQ3FRYXdjaUpTSXEyemVJaDJqNW8?oc=5
2026-02-05	Google	0.375	Intuitive Surgical (ISRG) Earnings Growth And 28% Margin Reinforce Bullish Narratives Despite Rich P/E - simplywall.st		https://news.google.com/rss/articles/CBMi1gFBVV95cUxQeFFiQy1sTFdVNVBhbGxqRGtQSmd4dkExOV9QMi0zNGV5ZWRjX1M1U3EzYXQwLW1lSXNPOEFzcnZrXzExRFJpTHF2ZmlOV1FqYVl5QTg0eWc1cVFqd3FGcUg0bWVnaURIb1h3c2p3ajNoYTBGSmRTN2JTV3huVGllS2RaSnJ3QjRPQzFvTVFxc0FESHNSWGtTZ19vLUJrc1hCQmFpNnZnQ19LWDV3bTh5U0xYOXQ4MmNGOWUyNDVFX2VlUndpMHNsYXpWbEhlUktSZ2dKQzdR?oc=5
2026-02-05	Google	0.0	Assessing Intuitive Surgical (ISRG) Valuation After Recent Share Price Weakness - Yahoo Finance		https://news.google.com/rss/articles/CBMikwFBVV95cUxQQzVrTFB1ZHpWbVdIVXpQbjgwN3RTMTNDanppLVl0U0RFN2hjVFU5T1ZyaGtGTkYyaFdGdEZyYjhFeEZxQWZVLVlQTXdmQkpVVFBaTTBRXzVVRHhQbHBDQUtFNjhQanBwLVdJVTN4ejRKazN2c0x3OEhBSk1HWDNEOTZMTFJ2LUhBcTNGQmFpS0FxV3M?oc=5
2026-02-04	Google	0.1	Intuitive Surgical stock price steadies near $480 as ISRG weathers Wall Street jitters - TechStock²		https://news.google.com/rss/articles/CBMiqgFBVV95cUxNNFlQNGY3Nl84bTFwcnZmam5CcEl0MGZqb3JHbHlMS0Z1bzcwY3pNYTNfTHFfaVgwZURodjQ2ZUlCVjNPNGxWQWdLVlVtX1ZiTmdsLWQ5aHBpTFZuR29yUHlZSVhRTzZDbkY0eUZLOUlYUTB4SGFFSlhtaVgtNFlmSXVhT1h2d21iWlZWQTVqcTVZa29mODBjM0Fvck1iV1pta0ZZNGpRdDZqQQ?oc=5
2026-02-04	Google	0.0	Intuitive Surgical: Buy The January Selloff (NASDAQ:ISRG) - Seeking Alpha		https://news.google.com/rss/articles/CBMiiwFBVV95cUxNcUhST2drNU5tRHFvMHc4YmMtZEh5UjdVbEVPbll3OTZvejRXSEdzejc0VEp3OVNsaGRWUVBPY1JqYWNZa3hKNmtiYmtheDdYOFhKTnprMkltODZpUTJVaVE2TUViMGoxWFBsR0NkNzF5eWxIdm9KQThuQVZnVjVsTUkyWTYwUkRDOGVj?oc=5
2026-02-03	Google	0.0	Intuitive Surgical, Inc. (ISRG): A Bull Case Theory - Yahoo Finance		https://news.google.com/rss/articles/CBMihAFBVV95cUxNMUdJZ0lQbFJzVTFiMWJpMXcwZ1NETW5iSWJLaXpXLUlMcUV0RW13VEx4VGVUYTlJOWJRWlhsallzeWVZaHFCWkZPUjVveUFraG40T3dCS2VmeTR4UGl3M09DM3k0SWVCVkdfMFhlbTh0XzRvZW94WktwU2x6TWNvOUppUGo?oc=5
2026-02-03	Google	0.0	Is Intuitive Surgical (ISRG) a Buy as Wall Street Analysts Look Optimistic? - Yahoo Finance		https://news.google.com/rss/articles/CBMihAFBVV95cUxQODVsb3YwUWk1dWFJVjYwT0p6enBhRk5QQXVuXy0wS3ZETGlBbV9oMjc0QUs5N2trUERQdW9yZjdHWVhXQVdIOVpHWFJ6VDdlcThYT1ZPb3N0S0ZBcl9VZG5YbVJmRmNFNFdlbXZSNUJmc2pFLW16eEJpSW5vQzlHbC1vUW0?oc=5
2026-02-02	Google	0.0	Intuitive Surgical Fell 6% Last Week. Here’s Where the Stock Could Be Headed in 2026 - TIKR.com		https://news.google.com/rss/articles/CBMiqwFBVV95cUxQVlVUdFpVV01waVoydHUxRWFUa2YyZElkZjBYS2F0Ym83emdWa2tpTDdQUjFUb2pZUkRQbU5Qb3pNNDVUU3V5V3hsM2FUcU5wTXF0ZUJFQVMxV3d3YjNBY2UzZUtMRklOaHdnSFlzM2dXVUtZa0lWSVVzX2FVaFNHektHaHlfYWlvTzh1NUo1UlZMMkdSNmRoUENnNzY4UFpKdlU1a0dsbDhTcEU?oc=5
2026-01-31	Google	0.4	1 No-Brainer Stock to Buy on the Dip - The Motley Fool		https://news.google.com/rss/articles/CBMihgFBVV95cUxPME44ZUQ4WDVYQlZKTTJzZEpoUHRjelo4NHNYVDhhSUFmVExoOWYtdXd5a3RrMWY0X3dmQjB4THQ0bTJUUTVXMkR5aW0zOWJ3dENKbDl0ZWt4UmtCbDBiNjhqSXNUVkhsWUdYR3NLck9WRFd6bHdhQnc0YXZWMVFiblFoWnkwZw?oc=5
2026-01-31	Google	0.0	Intuitive Surgical Inc.'s (ISRG) Long-Run Growth Underestimated, Says TD Cowen - Finviz		https://news.google.com/rss/articles/CBMipwFBVV95cUxOU1RvQURmUEswWk9aeFFqMXR6cUl3NG1PbzN4cWd2cm9PQzBYLXpJMGRScGJtOGpmcW9zc3dNNVBEWFlyYllQMXpfcVpCRWdsdi1qaXQ3VUFLVmhMa2xiTGxxNkpldnVsMW54T2pRSDhIZncyVTl2TjNYRUxoU3paSTc2Y2NkZFczVTk1cld1TU43SElTSkg1RkliTGpIbGkyMWJ3QnF1aw?oc=5
2026-01-30	Google	0.0	Bull of the Day: Intuitive Surgical (ISRG) - Zacks Investment Research		https://news.google.com/rss/articles/CBMihwFBVV95cUxNLU1Ud2dib0xrYTNvU2ptNFVockdfQ2tVV0pCVlR0bFpaMWRRTjhIcndEdWZiQzVDSDFvN0NGeVViNHV2Z1Bpb3JYODFGc3JsSTAxQjRZYXNoYVBucC01UkpLZXZhUlEtWV9KOFlvY1V1enRkS0JKRFF5aWdqWGZZTTBiM0UxR1E?oc=5
2026-01-29	Google	0.289	Analysts Split on Intuitive Surgical, Inc. (ISRG) Valuation Despite Strong Operating Momentum - Yahoo Finance		https://news.google.com/rss/articles/CBMiiwFBVV95cUxObzIzSUNlOF9wWkNOSFpCMG9pOHJQMVFSNndqN2lWbHJBNFdiOUVSYmRBUkh0RlpVZnZwYUpqTXFPbGNIYkEzQ09sQkREampmMU4yTFlsZENVTkZscW1OeHRtZVc5ZHlzSTNVbElqbzdBcmZXRUJjbzZRbEZRd1JZbUlVWDVUMWYwaFdZ?oc=5
