Date	Source	Sentiment	Headline	Summary	URL
2026-02-13	Yahoo	0.0	Why Stocks Are Making Gigantic Moves All Over the Place	The explanation starts with the fact that many industries are undergoing changes, substantially altering their profit outlooks.	https://finance.yahoo.com/m/5d95cd69-85c6-34c4-8ed0-bac1b89e8ad1/why-stocks-are-making.html?.tsrc=rss
2026-02-12	Google	0.23	Vertiv Holdings Co. (VRT) Hits Fresh High: Is There Still Room to Run? - Yahoo Finance		https://news.google.com/rss/articles/CBMifkFVX3lxTE45UnBTb0lKdTZrNGdwRUtYenpwWEo1YmxJZUxaeXFYZUNKWkQtZl9uUWhnSXZjZC13Q1RjUWdmYVVTVFNDaGtfemdfV3otRDNqcFlzcDRsbVZORy1zT0F6TkZKMHYzLXd1R2FBWTk4TlhGNG9mek1MVFRFS3JiQQ?oc=5
2026-02-12	Google	0.107	Vertiv (VRT) climbs to all-time high on earnings blowout, double-digit growth outlook - MSN		https://news.google.com/rss/articles/CBMi9AFBVV95cUxOQ1oxdDBaQ1VOWXVjdXVpSll2S0JYckpfZnIxQTgxb3R3QnV5RC1kVV9hNWFjN1p4YWFicTktNTNaSmVkcV9hbnl0ZXVwb1pYejFwZGJkclJFRlgyd2FCSnhWOUJ2ZVJoRXVhQXpnOTR4M2dldlNaaWY2LXZrQ092SWpwNGNBUE03eWNfRFNhUWFydk5zNUROcEJ6djUwUng2V3JuLWk0cE5HSUtzdkNqcGREUEk1RlBGS29MUXFxZlNLVVlfUTRKV3E5dk1XeWNHV0V1X0lKa1lmQ1F3ZXpaeXAxWHdFRURXU2x6aUNLR3Z4NThy?oc=5
2026-02-12	Google	0.0	Ada County makes preemptive strike on VRT funding proposal - Boise State Public Radio		https://news.google.com/rss/articles/CBMipgFBVV95cUxQaUFlak1MRGI2TE5UdWk1Tk1QODR6VDhCem0xZnZvVC04a3pJMjktT29UYzMzTnVMdTk1bXF0dzhYcWpkVERzZ3Q4WjNjdnlWc180bXgzYXJCcDJrVTM3TVNmUjZfVGJ6M29VeGtwRGhsZTY2VjEwOFU4SGEzZ0duM0xfNk0xeUJxN0d6SmRoQzVOM1IxV0RkZDFmdFBJdWtMdksxRHF3?oc=5
2026-02-12	Yahoo	0.0	"Is Vertiv (VRT) a Solid Growth Stock? 3 Reasons to Think ""Yes"""	Vertiv (VRT) possesses solid growth attributes, which could help it handily outperform the market.	https://finance.yahoo.com/news/vertiv-vrt-solid-growth-stock-174502997.html?.tsrc=rss
2026-02-12	Google	0.0	"Is Vertiv (VRT) a Solid Growth Stock? 3 Reasons to Think ""Yes"" - Yahoo Finance"		https://news.google.com/rss/articles/CBMigAFBVV95cUxNeGRwX0Z2Q3BzRmx4dDNVWHU1NjBLYlZfM3FiVzF5UXdOREw4YXFzaGc2cl9SZm51QVp3MjBUeHJNanZQdDREWmVVUmZoVXltay1sb0hvSnBuX0hmTVFpMmFkOUxuOWtLWUIzNGxOZEZhSU04eHZzM2lhSkRPYmFadw?oc=5
2026-02-12	Yahoo	0.0	Vertiv’s Record Quarter Sparks Questions On AI Backlog And Valuation	Vertiv Holdings Co (NYSE:VRT) reported a record fourth quarter, with triple digit organic order growth and a backlog more than twice last year. The company secured multi year capacity commitments tied to AI driven data center build outs. Vertiv is investing in advanced cooling and prefabricated solutions, including OneCore and SmartRun, to support large scale digital infrastructure. Vertiv steps into this new phase of growth with the market already paying close attention. The shares...	https://finance.yahoo.com/news/vertiv-record-quarter-sparks-questions-201518536.html?.tsrc=rss
2026-02-11	Google	0.6	Why Vertiv Stock Is Skyrocketing Today - The Motley Fool		https://news.google.com/rss/articles/CBMiiAFBVV95cUxPc0hrdW4tX05yTXpBZEJsNU85ZTRhUFR6NEpkZjFydjBDelduQ3V6aHBVMjc2LTYyQjAxZkdvcF9vOHNUMkdsVTRUdkplQ0dOUlFkQlI3em5VUElTM3pWNEpFTUFfcGtHcmQ1UmpxeW5abm9vaVFqMlhCOUhVRlVNRG1TdHNiQThm?oc=5
2026-02-11	Google	0.25	Stocks making the biggest moves midday: Acadia Healthcare, Vertiv, Moderna, Unity Software, Generac & more - CNBC		https://news.google.com/rss/articles/CBMinAFBVV95cUxORmtsM3BMeXgwdVBhc3k5QkdiUTFMLUdRNU12SlNkNHlnQlpqRy0xLVZ0UnFIbjJoVHZCblR1VmlRdThvQ1lTNnE0UHNiUUphTWtReGUzaVR0eHRTUXNlQWw3RFp0OVJqSXpERTFtZUNEbkhSMTdPMEwzSG5FRXY1QmxaYkwxd3Nxb0J3a09ZYXdvRGd4VV9BUEtsVmY?oc=5
2026-02-11	Google	0.178	Vertiv shares surge after strong earnings and AI data center growth outlook - The Economic Times		https://news.google.com/rss/articles/CBMi5gFBVV95cUxPRzJMZTVPWnhDbFplbThlT1c1a0FFaDY1X0UwaWhHVXRuTUp5b3E4cnBYM0NBQXFYSUY2Z0xPR0dkbHYxVDNxcFlKdTRVYkR4NjFVQ3NuMTdMdjVxVzZkS0hCUVdaZnFCTHNmeU9PMGc1YmpYbHFrTDh1X0Z3MWtMRzhMWHk0RUFNV2VmeGt2Q3VVRHVLazh6Y0RXNjk5eGpzQVJoQUt3b0Z6RFVDY1BjZ0k4cE1DNGxjX3NTdWpzT2FtZ0N0NVdmU3F6MVBDdHA0cl9BUG1DYS1GU2hiY2FYREFtTkZBd9IB6wFBVV95cUxPbzY0T2RaRG90M1lGZ2RZRFgtYW1abTlLSE1KMEhrOEZjUkpmcTAtSzctVFBvTGoyMkdCLVNiRTk1c3czSEhrR2p2akctSXpuZjctWlctbDRFVEpWSjI4SjBNR1piZGxCbGM3NDR3dU1kbFBrU212U3V1eHpiSWVjRl9WLVhNNDZlc3F6Q3I0T0hDYzJ2RW95dDRKaFQtWHdjR0VpREZOaVpWX09kNzUyVWFVd3JQN0tfU1RwWWRQTm1XWkVzUzhidjY4VGYtY3BxOHhxMjB4ZXkxc1NhbWxCaHdLZmVXdWp0Z3Bj?oc=5
2026-02-11	Google	0.1	Vertiv Holdings Expects Q1, Annual Results To Rise; Stock Up Nearly 15% In Pre-Market - Nasdaq		https://news.google.com/rss/articles/CBMiqAFBVV95cUxOVG5YNDUtVEFGY3liNkloSzhQcHZncUMzMFhMU08tMzdWMXpfVUU3NHoxQ25CU0dfZXd6TmxiX2RxOWJ6ckVDUjJaWGo2OHRaa1VQbTI1cURvV2lJMWt3OXZFeUEzUFJxT05jWTN2SGJFaWktQVJmbWpTODlZZERMZ1pvS2lwYzVyQkV1aW5iQ09fZnpqVWR0OWdmeHpSUjIxcXRPc1dScDI?oc=5
2026-02-11	Google	0.0	VRT Earnings: Vertiv Stock Explodes 23% as it Silences the AI Skeptics with a Monster 2026 Outlook - TipRanks		https://news.google.com/rss/articles/CBMixAFBVV95cUxPZF9ieVRaY3RoZ0xCMTZncWhtWmd5UWVTeWpWejZMa2hIcW5XQWNiM1V2RVFuVU1NLWYzQUhGSW05b2FRN0pmVkZhSEg0a3pMSHJLWV90dmNnZDZvS20tQ3NLSklBNWF6UkJJREIyejdJZzVnMUxLNXQ0N245WjBJemZaX2xFN0pkY1hSeDFxQTZjSV9CN0t3cUNrcGZFMGJGZTVVb2ZqRktMb0czOTk3TWtNUkt6enFQd1JGenBtUXBDdmNF?oc=5
2026-02-11	Google	0.0	Vertiv (VRT) Q4 Earnings: Taking a Look at Key Metrics Versus Estimates - Yahoo Finance		https://news.google.com/rss/articles/CBMigAFBVV95cUxQbTNBQzhkRmRLNHBmUkliRFR3Nm5ZLTRMc29saTAyZDdoT1ZyZzdaTlIyemF1TlljT3FGWW8wWmp5NnVwdV9lcEhFcVFBWUk2VkVtV0M1RFJwM0dOUkV0Qm5BLVF4SXdRdFFvdV9wUzhYNTE5WVJNU05Va3VIUmRWaA?oc=5
2026-02-11	Google	0.0	Vertiv (VRT) Shares Skyrocket, What You Need To Know - Yahoo Finance		https://news.google.com/rss/articles/CBMihAFBVV95cUxQN0E2blY1bmlXbzJuc2ZrQXZhTjRMV1VwZkx5MTZlQlZTc05Ba19hekY3M2xtblpsRkUzR0FVN1J0b3dtM1lKcHM1QTVjc0NrMXBVVTlpWHM1N1oxZWdVMTdNcnkwbF9GRV8tTDJDNFVBY2dDM01NSlFhUWhVSXh0bFVScm0?oc=5
2026-02-11	Google	0.0	Vertiv Holdings Co. (VRT) Beats Q4 Earnings and Revenue Estimates - Yahoo Finance		https://news.google.com/rss/articles/CBMif0FVX3lxTE5GRkhmaFZZSEhxckxqcnV3VUNCYkY5bzZWSkxkcV9Ea3dyQlpKWmdIZUhneVA0a0s4VEI4ck1mSUR6cFhhNE5UMjlIY0pjU01hYmpTaGt5YVlBMGxsNVNiTlVaVEZpQzZ6MWNQMHFQdnlUMGhMMjJ0c1NoZFlWNWs?oc=5
2026-02-11	Google	0.0	Vertiv’s (NYSE:VRT) Q4 CY2025 Earnings Results: Revenue In Line With Expectations, Stock Jumps 14.3% - Yahoo Finance		https://news.google.com/rss/articles/CBMie0FVX3lxTE9XR1MxM0tsbVFUSFI4SkE5V3BpRklkTUgzaUtFVmY4OXZQTmt4QnFTVm5BTXVaVHlJWmVXSFVwanJmVVVoR25yYmpTSDBsM0Y5VHZkVEI5VXM0TmdxUEdfdHFhR3VReG1hSGZVT3ktdGhlYU9QU2hmb2VYWQ?oc=5
2026-02-09	Google	0.289	Assessing Vertiv Holdings Co (VRT) Valuation After Strong Multi‑Year Shareholder Returns - Yahoo Finance		https://news.google.com/rss/articles/CBMihAFBVV95cUxOcTVOZ1g4Z201LTFzTG90LWNFbng3d2dYTlF0aVZwV2JCTFd4RkYteVlJb0k2Y1owdWRQNmZSRWo1VWd6cUt6alpIZkN0WWRuaEZHRml3RjVHZWxVNGpmZWk5ZF9odUhsWDNTSTRfclpiVGtMcUtMdEtYclYyWF9yZHBSWFc?oc=5
2026-02-09	Google	0.0	$VRT stock is up 4% today. Here's what we see in our data. - Quiver Quantitative		https://news.google.com/rss/articles/CBMingFBVV95cUxOYUVWVGxBeFJud0xCZkZ0M0x0WGx3QnpDUGVxZGNoalF1TU1VamRqUTl1Mk1qQnQ2aExScmhKUERWVHhvbDM0Z1J4aThac0EtZG5UZXRVUG9Fb1RYcGdFbklVbC1IZm1DYlhvMUJZRFQzQnJSSFByMDFGVkw2T3c4R0NvZEFPUGRPOElSNDViWEtpMWxacXU4dUhjaDhWdw?oc=5
2026-02-09	Google	0.0	Robust Financial Growth Lifted Vertiv Holdings Co (VRT) in Q4 - Yahoo Finance		https://news.google.com/rss/articles/CBMiiwFBVV95cUxPeFlJaUdXMW0tRC1GUkVYVHJUTzlhOXEtTWNMQmw3UC1xRkdkMllFcmRDZUZVdFI0NU5hNWloWk1QRW9IeWxuYjZUbEJiRXI4UXkyeFpTVUdfN3JuM2JyTS1QMlZkMFFvc1l2UF9DZURYNFlCNUo3OXY3QkZQc0E2UHF5M042WHUxYUNV?oc=5
2026-02-09	Google	0.0	Vertiv (VRT) Reports Earnings Tomorrow: What To Expect - Yahoo Finance		https://news.google.com/rss/articles/CBMiigFBVV95cUxOVDc0WWdvNGlINDE4aFhtTEVhM0IzYmxRS183aEhHLXFGaHZGdjY2eUtyUGI0STI4cmRLbXRjNzdENlJmVW1iVnh1QkM4WWMtSnl5R2plNkdZS181WmVkemsycHZlRko3T2k2bTBOVVc0MEs1b2tJNzZVa3pFVWRvM0tNckdBQXMxLUE?oc=5
2026-02-07	Google	0.0	Vertiv Holdings Co (VRT): A Bull Case Theory - Yahoo Finance		https://news.google.com/rss/articles/CBMifkFVX3lxTE8tR1B6U0I0N2lvcDI0OFRPbHgzUmNNNFNIelJMMlhzRHc3R3l6SHl1YXpxaGNwYzQxRm14cDVZSEdIbGFHMHJSdC1qWVAyZ0dHQjRpSElJX2psLWc5ZXduVU5Dei1pRDRvT1E5OElrZE11RElUWWRnY0NndjI2dw?oc=5
2026-02-06	Google	0.0	Vertiv (VRT) Is “A House of Fire,” Says Jim Cramer - Yahoo Finance		https://news.google.com/rss/articles/CBMifEFVX3lxTE5kTEs4M3o1ZFBlSS1LamR1dU5LejJDYVN0Y0h3VzZ3UEFoSzhjRElyNmJrdEJXN2xjZkRLQ2FsbUhHejZZQ1QzdWF4U1dyUEpIcXhhVnJzUnB5NnlwWUZDMWF4YXItVGZjdWExZWhrV3pIRDExZXB5eV9iWFg?oc=5
2026-02-06	Google	0.0	Wall Street Bulls Look Optimistic About Vertiv (VRT): Should You Buy? - Yahoo Finance		https://news.google.com/rss/articles/CBMihgFBVV95cUxQakFDcmc4eGMyZWloQjhrM0hxeGNFZXZHUU92TGJKSTlTc2k3ajZzNS1tR0E0T2Mwd3FiWHgzMHNNNWNXaWRZYTFTUDVCb3VmaTRONjBzOVdCMFdsMVlFaHZlYjdGRUQ1cFBhVFpHaUVJVjF2Wm4tZkxWY0pqN3RrcEM3YllXdw?oc=5
2026-02-05	Google	0.053	Is It Too Late To Consider Vertiv (VRT) After Its Strong Multi Year Share Price Run? - Yahoo Finance		https://news.google.com/rss/articles/CBMiggFBVV95cUxOcWlSc0dsUllhOUdodHB3ME5KTXhrcXhQX2xOTk9WdXllNS1EOUtyYVN5M0ZxWGJWN2xrQ29JVXBScE9XRVJpbDNTc1BKMGttRUFuQjFERjU2U2kwNzhxbzVnNWgzWi15eVlnUGNKS0JzM05Udl9wQ2tlMEI4NWh6ZGZn?oc=5
2026-02-05	Google	0.0	Vertiv (VRT) stock slides as AI jitters hit data-center plays ahead of earnings - TechStock²		https://news.google.com/rss/articles/CBMinwFBVV95cUxPdGFXRW5YSFNxakJuQ3dVdURyTmhvYm82NlFPVVBJRUVMT0p1ZlF2RWctQmZuSVZ6aEdoUTlnUXJ5VWYtbnljUEtpLUZNUThyaUZfdkkweEx0cVU3MGlrWDdzY1JKZUMtUmJmRVFFRzJLeHV4LWEwUzFKemRyYjdfWkhaQmNEOTUtb1lqSzlVT0FXV3FjUVdjVEpZODRXT28?oc=5
2026-02-04	Google	0.35	Vertiv Holdings Co. (VRT) Sees a More Significant Dip Than Broader Market: Some Facts to Know - Yahoo Finance		https://news.google.com/rss/articles/CBMifkFVX3lxTE5Na3V1bUlpQnJWd25zVXJuVVB3LWpYM3lBZTk0ZG05X24wZjZWZmhRMTJhcWlZWXQzWGY4b2RveG8tRnRfZG1sdGluRmI2QnpVcldiZ21HbUotNWZ0bjNla1g4eGZ4UXZMMVpWYmlaeW5DM1NVckoxR0NGbTVJZw?oc=5
2026-02-04	Google	0.0	Vertiv Holdings Co. (VRT) Reports Next Week: Wall Street Expects Earnings Growth - Yahoo Finance		https://news.google.com/rss/articles/CBMiggFBVV95cUxOQVc4UTZFWE9jeWZ4ZDV4SV9fejN3NThPd3FKejc3Nkg2RTMzVEN2VFMwUVEzcU83YWhvc21Da01xbE5rVDN4eXpQQ3gycXhRcnVQLWFxYmFNUFRGTHBXZ2NMb0FNUlVUTDYtTnc0SGs4blE2Q2ZpeFlBZHRhbVRJYzJ3?oc=5
2026-02-04	Google	0.0	Why Vertiv’s (VRT) Role in AI Cooling is Gaining Strategic Importance - Yahoo Finance		https://news.google.com/rss/articles/CBMid0FVX3lxTE9mR0M2TDlfbUdGdVozWjRIQ3RmVkw4bE1kZ0ZiRTI1bmhkSjNnMVFrRXc2TnZvTmdBek9QVnpmbllnRjg0bV9BLTJaYnp4VFdEbG5nWml6R2pvNW1aclktNExBbFVYV2FkY3lBYWJZRnA4VnhzTE0w?oc=5
2026-02-02	Google	0.5	Vertiv (VRT): 3 Reasons We Love This Stock - Finviz		https://news.google.com/rss/articles/CBMiekFVX3lxTE8zU0JIdkdrVGpWRlZWRGROcDVJSGE2bmc4QTlTRG0tcGQ1eHV6MlVGRTdXSndwdEVTUld4a2Y2RkFScWh0MzhoS01wa040TVZpaUFYdTRjNjVTekJfVG9jXzlyVXY3YUlKU3pHdnJJbXZPeFF3T05qUF9B?oc=5
2026-02-02	Google	0.5	Vertiv (VRT): 3 Reasons We Love This Stock - Yahoo Finance		https://news.google.com/rss/articles/CBMie0FVX3lxTFBZN05uUEpfUFNfUnVRVWMyVjAzTU83NzFKcDRGaDZDMzRmdFQ4aGZ4TXZsd1hMMG9YdndjUl9Ya2EtVWZJZU5WWVoxM3pFZHp5RTdhTzdibXM0ak1zVE9lT29MazVuVm5nYzlMeXN4QzhzLVhYUjdwUnZHQQ?oc=5
2026-02-02	Google	0.015	Should Vertiv’s New AI-Powered Data Center Maintenance Platform Reshape How VRT Investors View Its AI Strategy? - Yahoo Finance		https://news.google.com/rss/articles/CBMigAFBVV95cUxOZURaS0duQmR5TlhIZjlPUzlKUnZZcFo2b3hXUDYxV1gwZzdSbFJiMFhSaDZlelpHd2x5dnFUTlA1eWVZSnJTMFdJbEpXRVI1TVRtNnRseW5WNmpFRTkxZUU0NGxHZW5FQ2YyTDN1cFMxMTd0MGEyYTY2MVpITGF5OQ?oc=5
2026-01-30	Google	0.0	Vertiv CEO raises alarm on heated AI hardware problem - thestreet.com		https://news.google.com/rss/articles/CBMinAFBVV95cUxNUkhjbUpwckZWU0dUOTBrb3RNWlQ4VG9zTjA0X0owTTdIdExTbGdzMTk1LWZPNE9HdzY3b1RvTUVnT25RbWhGSnpKbDk0Z3k1ano2X2s5Q2h0c3BETDIwcWJXV2xrMm0ybjNjRmR2X1hlYVJjakpHR3RsMXd6MVBrSnNXMEE2ek9uM0ZpZzNpY25QODdzVEZXbDBtR2g?oc=5
2026-01-28	Google	0.0	Does Vertiv Holdings Co (VRT) have a Robust Long-Term Outlook? - Yahoo Finance		https://news.google.com/rss/articles/CBMifkFVX3lxTE1IdWRzTTFobUtLbUFELUlRT1VkSGZ6emo5MlppX0xFQm5uZ0NqVER0ZEJ5c2k1VmZwVnhPN3F3LTdCZXY4c05OejVkWjlyYnIxUzZRZTh1Z0RnRkh0bll4Z2J4cjB6SHpkcWxLNG94RU9KS2x0LWhSVVBCeXV4Zw?oc=5
2026-01-28	Google	0.0	Vertiv Holdings Co. (VRT) Gains As Market Dips: What You Should Know - Yahoo Finance		https://news.google.com/rss/articles/CBMif0FVX3lxTE5oalpaN2pYaXVDS3g1UldWOV9jUFgtWmJMejlZUlFFSXMwcTVqMlc1Q2tyejI2RHBmTmZ4blJVeEg2QWVsdFNwNUd2TldiczNpS01RQW02cDF5dElfcWlzdWZRcGJrQVlKZ25VUy1wN1I1ZFFFaUU2RkFwa2pRNmM?oc=5
2026-01-27	Google	0.333	JPMorgan Favors Vertiv (VRT) Holdings as Top Growth Pick in Q4 Sector Preview - Yahoo Finance		https://news.google.com/rss/articles/CBMiiAFBVV95cUxNMC1velNZWnF1eUdvWFVXVGMxT1FVVWduNlFhTkI1emZUQmtGbU9HUm1TY0JGZFRRUG5QU3N5TzcxVG5GdkdBcnNhYVUwUW05VEdzdUlKdmxEd2xwbTVJaWhXNUJxUXVlY2VuaUdiTTlaLVpLTUpiaHJ1ZGpTZmJ2SVd3SWRzVkdN?oc=5
2026-01-27	Google	0.0	Vertiv Holdings Co. (VRT) is Attracting Investor Attention: Here is What You Should Know - Yahoo Finance		https://news.google.com/rss/articles/CBMihgFBVV95cUxQdVVTSGwxMmg2OHlvdUNRc2RDTVI4YVZ0aExSRmZGOENVOFpxNUR2RFBFZTN2bkxXV2FKOGt3cUQ3T2t6Q2didzRlZENxekdiYmJEQnZDck5lTTJncVl1Y0Jaa05pbjJzQjg5T1F0VmpRNEVNNTdGX1Z3UjlOMGZsajg5UkNqUQ?oc=5
2026-01-23	Google	-0.067	VRT Stock: Is The Data Center Infrastructure Leader A Buy Or Hold? | 2-Minute Analysis (undefined:VRT) - Seeking Alpha		https://news.google.com/rss/articles/CBMiwAFBVV95cUxONGlRc1kwcVg3T2taTFdfdl9jbnRncWlWNkNmSThNVFp1MWJRTjEtZlhtTjhsaHRCUFNlMkZ5WERqdUtkVnRDQktwZ24ybXJsRHp5Ml92SlgyNy1XbXBLZTlNSXRud0c1SllQdUNjME9yZFNwS3dfMlBlVXFJVlNVQXRsV2ViSXJMSXByUVdsbVpQaFdabEVfdGpUOVhLUl9oNm5iQWxKN2JFZ0VEUnpjeFhZbG5HbjJBbk1EbjVfQng?oc=5
2026-01-21	Google	0.317	Is Vertiv (VRT) Still Reasonably Priced After Its Strong Multi Year Share Price Run - Yahoo Finance		https://news.google.com/rss/articles/CBMihwFBVV95cUxQZWF4YVNRdWY3a014V29BUjNLRXdfdW5zU3JldUw0X1ZfNFUtNFB4WWRvLVJNTlM4b3lMR3VLOUgtUUZ6OExfT09OWHU4MFRxZU9wbGhsSjdDVzRlYW9oR0ItcHp2RTA2Q3FGM0hNa3dQN2VNVWN0REFfeDM2dXNLZXJfSG5QUUE?oc=5
2026-01-09	Google	0.0	Jim Cramer Reveals When You Can Buy Vertiv (VRT) - Yahoo Finance		https://news.google.com/rss/articles/CBMigAFBVV95cUxQTV9lZzBFRG5DYTFPY0otMTlLWUhBLWd0bHhkVWJvdmxUdG1vRXBwa3p2NWxSWkF3Xzh4cEhhdW5TMm9ObjVTdlVkUnh1aFFySHNZallpUS1fdkdBUTVMcUNIQ3k4VGc4bWM5Rjh6aEVnRDN2UEgtUmNmTGx2S1BOWA?oc=5
2026-01-07	Google	0.2	Vertiv Holdings Co. (VRT) Registers a Bigger Fall Than the Market: Important Facts to Note - Yahoo Finance		https://news.google.com/rss/articles/CBMihAFBVV95cUxORVVVTFhmVXBjX0xYMHZDd3NWMV9kUWVYQUljNzNYenVLY2NHa3ZrWlMtUnp0Vk1zSkRUR3NmTjlQSFI0N2cwc2g4SW00OEpXME5uRmNjR0hpa25ybFdoLTBOLVdpTXVVOHhHUGd2STBIaU85VWRLOHVYY25sajhXRjRST0w?oc=5
2026-01-06	Google	0.0	Barclays Turns Bullish on Vertiv (VRT), Raises Price Target to $200 - Yahoo Finance		https://news.google.com/rss/articles/CBMihgFBVV95cUxOTEtzendKcG1zazVnbzZucXhSY0lGaFEtOVFYRENsc3RhTUphbXZTM2ROd0hRMXFzeU9UTDdzRGhsUlhKdTFuemZnU1dwc3EwdUZocm43UWRCS3dJS0FGVzlUT3NUTkp0MXk1dWxZd2EtUlQ3SzB5ajVYV3oxaXdmWm5DX00ydw?oc=5
2026-01-05	Google	0.2	Is It Worth Investing in Vertiv (VRT) Based on Wall Street's Bullish Views? - Yahoo Finance		https://news.google.com/rss/articles/CBMihAFBVV95cUxNRVdnWFE1VGt3cFRwRkFrSWJHamRkVVhNa2JLa2E2RUU2dHZpc1J1Y3NYNXI2Q01Ic1pFTTl6Z0xKUWF1SkpsT2x4MkwxWWdqa1RvclplMlktZmw5azZlWVVTbHRTU0JockduUTdZZlFRcVJqbkl6Z2FPSllHeFVZcjhOMnk?oc=5
2026-01-02	Google	0.167	Vertiv Holdings Can Go Higher In 2026 (NYSE:VRT) - Seeking Alpha		https://news.google.com/rss/articles/CBMihAFBVV95cUxNTmhScThDcWdUNGZ3S00wWlZEYi1rVjBEX3o4NWFNOXN5UHNWWmZ3MzNaOF8tM3BrSHc5WEpLVDFUbmJWYUdTVmtFckE2cEQ2TVpIZk1WSUd2a2RyZVhIN2Z6YXdZNUNHdUQ0THV0T0JBNjlKcHJRWnFFa3FFN29ydHMzMWs?oc=5
2025-12-26	Google	0.0	3 Leading AI Stocks Investors Can Buy for 2026 (NVDA, AVGO, VRT) - Yahoo Finance		https://news.google.com/rss/articles/CBMigAFBVV95cUxPQkJ6YnAzNF9UMmNrN0hsV0JfbTZSdWc1MXVoOGY3dFY5NG9YbFZKd0FrdTE3RFc4RHBHdjNTSEF2UzRONXBRd0lCYUthWWxBc2dramlHTHBXSkJRYTlBRmhEWmNPcjlIUjhsNjJLNGFFUVZxcWJnZ01kcVRPdXpoTg?oc=5
2025-12-22	Google	-0.067	Vertiv (VRT): Reviewing Valuation as AI Data Center Backlog, Orders and Liquid Cooling Demand Accelerate - Yahoo Finance		https://news.google.com/rss/articles/CBMihgFBVV95cUxQOVY1eHlBNldZSUs0S1NGTlNoNmN6UkZGaTdseEYtWmdsTWJTRkxaYXVuRWtPMWRKRVFlZUhlNTB6SHdDT2pzQ3ZmV2FsRFhlQm1kSGRGTXpVN3hPWGRaMXpuWlp4WWU1UGRHa0xrLWZrcktBTUw2dDVqOUdfQU9XQjdUTTRfUQ?oc=5
2025-12-18	Google	-0.067	Is Vertiv (VRT) Using the Hut 8 AI Project to Redefine Its High‑End Data Center Edge? - Yahoo Finance		https://news.google.com/rss/articles/CBMid0FVX3lxTE9scWJuUlB0ZlkzMmxZMXRBSzlRRGZweklyZWdDTE5zc2JJbmktSlJfU2ZPMUdDNzB6Ri1uNXJJSnlOSXRKbHctLVV3RWg0eDlhYzNVTzRsbXc2cm9OdHVRQWMwUndoOHY5S1FqRjhxYko3bGJTRnQ4?oc=5
2025-12-15	Google	0.0	The Vertiv Pullback: Ignore the Noise, Buy the Data - MarketBeat		https://news.google.com/rss/articles/CBMikAFBVV95cUxNb2JPRjIySVFUemhSbmxXT0JvaVNrSlNvQk4wNld1NnVpWWxFSU50NHpxaWwzTlJaSEU4V2x0Um1rTEhsOWRrbDFCRmFKMnV4eW9CNG8yckhOLXI1UEQ5dF9FbTdWdk5aWm5hd3BicGlfZzJyY3V6RFlyeF8xRnVDV2ozR1NaOWJsYngwZGJYU1A?oc=5
2025-12-14	Google	0.0	Vertiv Holdings Co. (VRT) Is Set to Benefit from its Acquisition of PurgeRite - Yahoo Finance		https://news.google.com/rss/articles/CBMifEFVX3lxTFBSaXVyd2NWTWxGTGVHa2hITk1JR0R3VHNJVUZzbnc0cXR6MWpzbWpWa0NadmZ1Uy1VRXdNSWZPVlJmTTRya0RtdDBScmRNejhyWGZidm1WaXFVMUNYZUctS0VWRFBhMC00Ukl2WUFRNEZjUkVnZWJRdWxtY3k?oc=5
2025-12-12	Google	0.2	VRT vs. SMCI: Which Data Center Infrastructure Stock Is a Better Buy? - Yahoo Finance		https://news.google.com/rss/articles/CBMieEFVX3lxTE1oTTBTb2dqVGhGdXBmaDN5RE9qRVU2Q1A0V2hnTS1uWkd5TUMzYndPNEthVDA2Y21wWHd5MFlVZ1lidVZTUjl4ZnUxY1dYaE5NcDVFeFU0dGZVWW5xOVJGTTNyMi1jZkt1REhEUU4zdl9HTE82cFh6aA?oc=5
2025-12-12	Google	0.2	VRT vs. SMCI: Which Data Center Infrastructure Stock Is a Better Buy? - Zacks Investment Research		https://news.google.com/rss/articles/CBMiqwFBVV95cUxOdVRnNU9PZkNRSHB1RVZMb25PZGg1Y2VZZkxtWUJEUC1FUG0yOEtwTUFsR3RST0xYSzd2Z1V5YjdnbmVXMmVRaFJSTDcwd1lOVndGZjVPZjdqTzkwN1NxUzZmTk1aVE9MWHUwdElNYmpSd0ZicWZUSXpVWENwTnZpVWpDTWZuX2NNV3ZNWmR1RmhEcEROWERhS0syTTd6SE45RTFiMVBoTVhDaEk?oc=5
2025-12-12	Google	-0.104	Why Vertiv (VRT) Stock Is Down Today - Yahoo Finance		https://news.google.com/rss/articles/CBMie0FVX3lxTE1VZHBlb2tmVndqQ0lDNW9tWTE1UHBQcEdiRjVDWm1uZkR2dHd5cVVOdlg2QzFfT1dCUlE4QkhYQ0ctbGRQYWtpMW9KVnRveE9ZNzFrTkxDUTdMeVFFYUNmdi1yOENobmcwTXVrbDVlYXpXdDc1REUtLWNIRQ?oc=5
2025-12-11	Google	0.0	Vertiv (VRT) Cut to Peerperform as Wolfe Sees Balanced Risk-Reward - Yahoo Finance		https://news.google.com/rss/articles/CBMihAFBVV95cUxNVEZ0WE45OU5qQ2ZGYy1CZXRBZWY1YlozWENCeDdYT3ZhbUxFMGlUVUxGVnotUHBBdWNKUE9EM051TkY2SkRMNUkwVVQ1SGxEWk05QkRwTUQ4RzJ3aUtLWllIbDJTRGFBVE9EMy1qRXpsR3duN05iUHJjc3g0VlR5RVJBTTA?oc=5
2025-12-10	Google	0.16	VRT Rides on Accelerating Data Center Growth: A Sign for More Upside? - Yahoo Finance		https://news.google.com/rss/articles/CBMihwFBVV95cUxON29ySzNCTUJrZVZXY2NzXzBMcFhyNXhuUTJhTzA0OUVIMnhSNGo0UnNDSGE5Z1JRM3JqVENrek9vNTBEWTl0WVQySlRiQi1KRTR6NTJJZUVGYllGLWlrdzdNSm1UTHRxUU5hTjRUY2otU2RzRHdEeFNCenAwVVd5bUctVk9yOUE?oc=5
2025-12-09	Google	-0.156	Vertiv (VRT) Stock Trades Down, Here Is Why - Yahoo Finance		https://news.google.com/rss/articles/CBMif0FVX3lxTE5KbWkyZWNmQWpvaGtQWFZaZ3VHTmlhU2JHSmNsdy1vWjNjOXpQVmpIR1B4dXZPODRycmJDcW1LdWhtbmtadEhPcUZhU0lWV1MtMTVqckExVWJBcUxwd2lOOU9SaF9jOFJEQWEyMnNIdGlPU212NDl4aWY0bWpLeHc?oc=5
2025-12-08	Google	0.2	Vertiv Holdings (VRT): Revisiting Valuation After a Powerful Multi‑Year Share Price Surge - Yahoo Finance		https://news.google.com/rss/articles/CBMijwFBVV95cUxOUVlkNjZJbXdoRFFIamZpeG1ZaWVmYUFhVXkxOUJsLTFUVnRsNUJ3VU1XS1h2c0U4aS0zOGdROHZtNG1mZkVsc3hESnQyWXh1LWctUzdER1N4aVBRYzVvWGl4U0hqOE5pMGNmUFlubklXTlEydkFLeGlZcFF6RTNid2dGX0VONXFPVnVPZTBSMA?oc=5
2025-12-08	Google	0.0	Vertiv’s (VRT) Expanding Markets Support Barclays’ Equal Weight Rating - Yahoo Finance		https://news.google.com/rss/articles/CBMiigFBVV95cUxPaFZ5S3p2bVlPRU1YMmlTVElOVFF3MThuakcwMWV5MGNIOWV0U1czQ2VFMFNYTXF2aUoyR3Q2RTA2NHVmTFNjUmRBVmJKNGx3UWZMdW01d09kRklyRFNTN3VZTDlZT1FCQTNpWWdhVVlKNXJjVzEyUU5SeWcwbzg0ZVhnbDlHNlpvWnc?oc=5
2025-12-07	Google	0.24	Evaluating VRT Stock's Actual Performance - The Motley Fool		https://news.google.com/rss/articles/CBMiiwFBVV95cUxQbXJ5eVp2MFFUUkozV01HMTdlOUp2Q1ZUTVV4MldBVEVrTWxkaG9nN291Sk1yN3dSTzZnaWc1RGtoMl9scTQ5bEI2RW92aGFVcHJHVkU4Sk1EWjZwYXBEazZySVgteHI1NExKNUJqaEZNOW5VVC1yQ0Y5aW5VNUltdEUzWjFEOGdzMllz?oc=5
2025-12-07	Google	0.0	Evaluating VRT Stock's Actual Performance - Nasdaq		https://news.google.com/rss/articles/CBMifEFVX3lxTE50MGstbTlLRWVlTmdhV2NkS01oN0pfUldqeTlqWlk4RG5RRVhZYk92ZUlfMlduWUIzdnowaDlsODNtMTBsOXA5dWowQlFzdHlMb2lJVE1jcFloeVdtLVlKR0lxVDRvNjRIUDFtektNUTI4dm5XWDNpTTRjV08?oc=5
2025-12-04	Google	-0.067	Vertiv (VRT) Price Target Raised as AI Data Center Demand Accelerates - Yahoo Finance		https://news.google.com/rss/articles/CBMiggFBVV95cUxPN1pjaVRaX192RXIydllGZk1IcmwzQTR4NW1Xb3pNaEUwVlk4N1pDY0k1azgzRk9jVkRNaUpsSDFxUzBDNXBLYWJMclJQMlJCZnFCczhVcko2N09qdHdDa0dYS0hJS1NRSTh0aXhPdGVCZzNHaUJpbjJXb2xob3ZPTFZn?oc=5
2025-12-03	Google	0.0	Bull of the Day: Vertiv Holdings (VRT) - TradingView		https://news.google.com/rss/articles/CBMilgFBVV95cUxOUnl5UHV6TU1tZmtXdGtoeHFtY3RpY2l5Y3ljNDZoMEJIUV93THhJTW5sUnZlREs0Si0zSkFxYXp5VlJnbzRBejhQU0FLLUpyazk3OVZBazJuWUtRcDA4ZDNMLWV4alc1Y05KYjN5REVSYmVxN2pvWVJKRC1NTl93dGJOQVNaeHhoX2JzVUl4X05NcnNPUkE?oc=5
2025-12-03	Google	0.0	Bull of the Day: Vertiv Holdings (VRT) - Yahoo Finance		https://news.google.com/rss/articles/CBMif0FVX3lxTE4zUU5ackxvV3pvUzlYMGJUMmY4b1duaWRVZTVXWW43cnRyWXF2VldOQ0pLQ1VCRm1oVnA4N2ltaG1FeUNVeXNMdTJLamREUDhZTWtzazY0UkRkcUt3c3IzZ1o0QXY0Mms1TnVoWTRXdHFaYV9GWXNfTkhfRWVKU28?oc=5
2025-12-03	Google	0.0	Bull of the Day: Vertiv Holdings (VRT) - Zacks Investment Research		https://news.google.com/rss/articles/CBMiggFBVV95cUxOemhRX3NMQnZpSTh0ZFdXTG9NaFJmVW5fcmR6Z013NjB3aVpwZ3d6NnNYZzktaVhsZzVyQmYyVkRJSkhYaGcwa3RJbS1keFZ6eE9JLTQ2WTE5XzNwc2F4NmY0TTRmRmtIRFlEd1ZTMmVHbzdFeXJWd1ZtRVdWdURoQk9R?oc=5
2025-12-02	Google	-0.067	Why Vertiv (VRT) Is Up 5.7% After Announcing a Strategic Data Center Power Alliance with Caterpillar - Yahoo Finance		https://news.google.com/rss/articles/CBMickFVX3lxTE94MDJCWGJvM1Y1UmgxeTIzRmhhTXVtVjkzMmRtLTh0eHRGUTd2b0xlSkdsdVQwNDAzakhKV3E0Ry1qR3hSS2xFU2syYU1EX3NYWEdsTG0zRHlhdS1lbVJJeTltYm84SUVUZVhZd0IxbG52QQ?oc=5
2025-12-01	Google	0.0	Vertiv Holdings Co. (VRT) Is a Trending Stock: Facts to Know Before Betting on It - Yahoo Finance		https://news.google.com/rss/articles/CBMigwFBVV95cUxPaVo2M3BlYVNjOW85ekRIVVhWZTI0SDR3UnFLRkQ5d0gzTHlaYXJFX0dTa0NFM0RqbS01ZWZiMzZtaEl2Z3V4dDJhM1dEWU5lR2tsZHJONVRzMEFvdHhHQjctTEE3dWR4b05wZnY2Y09LVGVtN3dZTzhPa1YzZWRaaFpBTQ?oc=5
2025-11-26	Google	0.0	VRT Rides on Accelerating AI Infrastructure Demand: What's Ahead? - Yahoo Finance		https://news.google.com/rss/articles/CBMijwFBVV95cUxObjl2YmdZdUNrVWdoUUp6SGE5TENsZl92ekRRQ1NHckxYc3dTbmVpSk0wVEFZajA2VVdSaTlYSG4xbktFZVdiaWd5MV8tSUJEU29IN0pzQjBjUFJoRm5aU2hFLU1MZk5ydk0wc1JtYzFqSUlkc1M0YldpM3ppdDR3TmxNeXRhb1k2RU5WckRGdw?oc=5
2025-11-23	Google	0.0	Assessing Vertiv (VRT) Valuation Following Recent Pullback and Long-Term Gains - Yahoo Finance		https://news.google.com/rss/articles/CBMijwFBVV95cUxQMEhic0FfbVZqbDBhZENVVjhFZkF0NTNqUmozTkdTLUJyRFh6aURmUWc1R3B0dVo4WmcwelM0ZWduVjMyOVo1aFFpc3BvMjJGb0E0MERyUDVBYXZ5ZU9xb3BucUw2cjB0WXRBWGtiUmhZWUFkNXFjWXhyVE1CY2dvZ2Q4N1YxSVBVbTl3T1pvdw?oc=5
2025-11-21	Google	-0.062	Vertiv (VRT) Down 12.9% Since Last Earnings Report: Can It Rebound? - Yahoo Finance		https://news.google.com/rss/articles/CBMidEFVX3lxTFBrRVlDVEQ3QV90TC05bVFNMkFpR29OUFJvSVFSeVc1aW5PaXNhR1lIYUVTanNoMVNrNG05TnhYWTNmTHFVU3JGa3d4YjlPZnhSbTF4SmV4SXBjamV5WGNmLVlqa1hYLS1sa2hPZWJmMWdyX1NE?oc=5
2025-11-20	Google	-0.104	$VRT stock is down 5% today. Here's what we see in our data. - Quiver Quantitative		https://news.google.com/rss/articles/CBMioAFBVV95cUxQdGtuSVphUm55czJnb3VrNmJYZkp4S0ZlRkwxbXdUeWNSVHBYaEZEM1BXZTNwblIwaHJ1cVZhVnhtZVVJNC1TOEd0blJpRzdZNTMwdkFkMWZJNmJuV1p3S1BXUEtyYWQxWXJwYmpMay05dFRWWkQ0YUNMYWxST2I1RFJES0E5TzVMTGt6ZllZdkR2RXFjRTkteU9lWDVGNEw5?oc=5
2025-11-18	Google	0.333	Could Vertiv (VRT) Gain a Competitive Edge in Data Centers With Its Latest Power Partnership? - Yahoo Finance		https://news.google.com/rss/articles/CBMihgFBVV95cUxQYzFDV0t6R1NGWEE3WV9Mcml4R1RsSm1XN2ZEMG5JTGRrTUhpR1dkQ0tNZVB4WU9nUHVodTUwWGgwQU9PenFxbGlkTDNGUFZKWGduMzEwV3h6Z0d1YXBxZE9kSGkyYkRKdmZPZzRhemJCZ0NKd1FCNy14M0ZOdlgyV2ZIQmlCdw?oc=5
2025-11-18	Google	-0.2	Investors Heavily Search Vertiv Holdings Co. (VRT): Here is What You Need to Know - Yahoo Finance		https://news.google.com/rss/articles/CBMijwFBVV95cUxOQ3lRbXNfMnVTdmVBMmo1LWd6dV9zdDlqb1hOS09xQVNFYlpVam1mZFk0cUFzOVR3ME1KSW4wdXFtMWdSSU5ScW0zcTE0VFNrWVcxLVlEV0ZFT1lHdGhFZDU4a0l4U0tVV3ZsR2hCaEk0VlJTc1NXRFVXN0tlUUlhWWM5QXZfZzZCQVlHRlBJVQ?oc=5
2025-11-17	Google	0.0	I Think of Vertiv (VRT) When I Think of Data Centers, Says Jim Cramer - Yahoo Finance		https://news.google.com/rss/articles/CBMifkFVX3lxTE1sQURKQ0RGYmw4S0JSb05aWDU3Nk1ZODhRVVkzeldKLXptYnRXU2YyN29DUWw1NXNJYWItZ3l2Tlp5RXJGUnViN1NQaG1rOHhOeDh6RlBESXpoTGVqNDdickRTNEoyMGFEWmk0RTY5dTl3NTR3V3VyWFliU2s4dw?oc=5
2025-11-10	Google	0.0	Here is Why Growth Investors Should Buy Vertiv (VRT) Now - Yahoo Finance		https://news.google.com/rss/articles/CBMigwFBVV95cUxPNHRpcHJzOEQ4NDQ5bTJfY05EV0ZOcDFNQnJkb2ZkZ1pOZG1td1BUX254NEx5SmE3QV9iUnZGX285XzNOVXI3MUZWTk5UUUpFZnVnbEdHSkpGMVEycU1LdTFQTFNVR2x1amZqc0VWRXdkYzhFTDgzbHlpRVF4d2VrSzY5MA?oc=5
2025-11-10	Google	0.0	Is Vertiv (VRT) a Buy as Wall Street Analysts Look Optimistic? - Yahoo Finance		https://news.google.com/rss/articles/CBMifEFVX3lxTFBiZWtNRnk5dElieE85S0txakh0MmI1cnBNcWNSU0xSNERhZGItb1oxRXVzOVROeldmSnVCa1RzX25TSEV3YzlkT2FIa294SXRBYVdfYlRUa1JvVUNRSHBlOWJfUWpFeEZhck16VFRGRW5aQ2d2WmRpWFFiVUs?oc=5
