Date	Source	Sentiment	Headline	Summary	URL
2026-03-02	Google	1.0	3 Best Profitable AI Stocks to Buy in March 2026 - The Globe and Mail		https://news.google.com/rss/articles/CBMiywFBVV95cUxPSFRicThvMW5VU1FhMm84a2VHaTVqMkdwVEFKa08yQng3am1ic2xUSlEzWXBTOFkwMk1NSG4zTE9McGJmNUFocGpiSGxscnd1dHhlRThfcWItY0M4NkFHY3QwWmtXeWRweXh0dXlSeXFDN2t4SjNEZUpvNkJiQnBsM1BzNUM3SExYdm0xMVJoTFg4WnlKeGt5WTRwcFVHR3dscWpHcTlzeG5TOTVOVzZqU1UwZG53V1ZqZUFfcjlLbGFvZ1lmQzhMak9Ccw?oc=5
2026-03-02	Yahoo	0.475	Goldman Sachs Says Hedge Funds and Mutual Funds Both Love 5 Top Stocks	Goldman Sachs is the acknowledged leader in the investment landscape on Wall Street and worldwide. The firm’s top-notch research department continues to provide institutional and high-net-worth clients with the best ideas across the investment spectrum and is likely to do so for years to come. Founded in 1869, Goldman Sachs is the world’s second-largest investment ... Goldman Sachs Says Hedge Funds and Mutual Funds Both Love 5 Top Stocks	https://247wallst.com/investing/2026/03/02/goldman-sachs-says-hedge-funds-and-mutual-funds-both-love-5-top-stocks/?.tsrc=rss
2026-03-02	Yahoo	0.419	3 Best Profitable AI Stocks to Buy in March 2026	NVIDIA, Micron and Vertiv screen as top profitable AI plays, boasting high net income ratios and strong earnings growth outlooks for the year ahead.	https://finance.yahoo.com/news/3-best-profitable-ai-stocks-200000391.html?.tsrc=rss
2026-03-02	Google	0.4	Men’s basketball plagued by free throw struggles in double-digit home loss to DePaul - Marquette Wire		https://news.google.com/rss/articles/CBMiwwFBVV95cUxPWGJ3bHZvWnJwYzdwTzhWM0RuSGRMeDJkY1VCdFpMQnNScmtlVWE2TmFjUHFzemJKZzVVZVhoaDlwZVNwQ05pMXJ2RXlaQldWNXpNYlk1bTJqVHViRF9HLWFXczdKYmtYM2YyVVBWSFhNcm8zd2FoWWVVNjYzME82M1FiRV9qRFFtX3VQZGtaaWFfZjZZTlNFN3NNU05sM3JlS2FnNVBzc0VZbHRkME55T09WSkhXMFd6czBXS0pVMHhXSGc?oc=5
2026-03-02	Yahoo	0.15	Vertiv Holdings Co. (VRT) is Attracting Investor Attention: Here is What You Should Know	Zacks.com users have recently been watching Vertiv (VRT) quite a bit. Thus, it is worth knowing the facts that could determine the stock's prospects.	https://finance.yahoo.com/news/vertiv-holdings-co-vrt-attracting-140006287.html?.tsrc=rss
2026-03-02	Google	0.0	'Bachelor Mansion Takeover' stars Tyler Cameron & Tayshia Adams reveal dream 'Bachelorette' picks with 'VRT' - Page Six		https://news.google.com/rss/articles/CBMiywFBVV95cUxQRU1GQmNEb1lvQnVmRjJ4MndsNGFlX1huZ3pfSmdTclY3cEI5N3pfZVdxdTBiVkt0Zkk0ODR3T2VVR2ZtMnZvVkdLbVZLZFdzc2ZDaE4zWlN3TEJ6cThuejZRX2RBNEJNUG1IX1p5UDJVTnFGS2VsNVpmU2tQSm9UYUJmVzhiMGltYVUxdlVFN2NsRlpFRWxHdHFqUmlpUHlvY0NEUVY1SzUyZ3Z6QTBDUktfTGQtRnJEYldlZ0JOYkJoTEVSVHBjY25kZw?oc=5
2026-03-02	Yahoo	0.0	3 Reasons Why Growth Investors Shouldn't Overlook Vertiv (VRT)	Vertiv (VRT) is well positioned to outperform the market, as it exhibits above-average growth in financials.	https://finance.yahoo.com/news/3-reasons-why-growth-investors-174503705.html?.tsrc=rss
2026-03-02	Google	0.0	Vertiv (NYSE:VRT) Stock Price Up 1.1% - Still a Buy? - MarketBeat		https://news.google.com/rss/articles/CBMinwFBVV95cUxQY3lvZ2hwN3RCLVpreUN5R2NTYThza3l5YjR3cWZzQmwwUnJQMjFQRWNmY3FIdnIxbWZXZE10UUVnak1oVEhJLXdIOUllLXlITll3czMyWWE1eTJIZHJwdDhyNG5fYlpWamNkRFZfMGVmX01BLWluMFUxZHd5ZnljZTdxVmNadjdQOWxCeHdkT3pROVlpZ2lJN3VTOWhPV3M?oc=5
2026-03-02	Google	0.0	Vertiv Holdings Co. $VRT Stock Position Boosted by APG Asset Management N.V. - MarketBeat		https://news.google.com/rss/articles/CBMizgFBVV95cUxOclFuQ1d2QzlBT1lCRmw3NU1WWWxIMVY0VEl1Z3NRMXpfNTVIdU82QlRMRjdjclB3N0hiNXY3TnhTeTZFNnN1eXdmcFY5djU0UldJWEt5WERYMkVuenFlcFh5Q0VDMEwxT1BTT0pBb3EwaWF3R3A5Y2VGUFdmeTV4ZGZ5d3FKWEtGUVRLODdBS0lfT0RBeHhoTkt6R0tmeW1wbmNkNlFGaTZxME8xQ0k4Q09Kd0wwM1p3QlVsTGVacU44a19vcU1xbGlOOFViUQ?oc=5
2026-03-02	Google	0.0	Vertiv Holdings Co. (VRT) is Attracting Investor Attention: Here is What You Should Know - Yahoo Finance Australia		https://news.google.com/rss/articles/CBMiigFBVV95cUxPQlpjWW5Tb2JSdjA4cjJFTXdhSHhQbzh0ZnRVcUpteHloRUpWeHdvbjBEanhyUGlSdVMyN01ENmlyUVdTTHFLNGZkOXdKZHJsdmxKMjFWeHhzZUNLQ190TFJUUFo2YmdIV1pYUTl0eEpFbmdndFV2eTZpX3FSckNFVWhBcFNIYVJSc2c?oc=5
2026-03-02	Google	0.0	Vertiv Stock Price Rises 1.1%, Analysts Remain Bullish - National Today		https://news.google.com/rss/articles/CBMirwFBVV95cUxPM29RN1hKZmNsV0ZfN2E3V0J5UHhMOUdmVEFHbmFRZ3QxLU8wTkJpcENZWmN3RDlPOEVHdkhOR3EwQ0wwVHYwT3BpS3BMalFHLVdmbURmdmpDbm93QU8zSGNsdFRDQUIxRHdzYU1kYVpNU0Q0aEF0TkhjX1cycktqbnU5Uy1ubWpwcThKcHVsMXJzZXQ3d09MR055b3ZfUERnMEtwdTlmMFl3LTVFLWdR?oc=5
2026-03-01	Google	0.0	Banco Santander S.A. Takes Position in Vertiv Holdings Co. $VRT - MarketBeat		https://news.google.com/rss/articles/CBMivAFBVV95cUxPQk9Wakd4bEJKZnhEMHBrZUtTanI5eXRTc0Z3VV9IRk1pSnFiYm5RUDlTcGExaVcyYjZmazRmR250MHRrV2JkaDNVWF9VM2dlWU5sXzJTSXBXMWF4RjBZTHhmRThBUVphb1ZSUnAxYUVWRWNGRTRjTFNhdjhyUnFLWDVJUE9OTXMxZTYxXzhrNWctMThoaTJsR3dSQXM3Y2pDb3Zjbm1PMzYxZFU1aHhScGhOOGh0bkVZQVhCYw?oc=5
2026-03-01	Google	0.0	Mitsubishi UFJ Asset Management Co. Ltd. Grows Position in Vertiv Holdings Co. $VRT - MarketBeat		https://news.google.com/rss/articles/CBMi1wFBVV95cUxPTFpmUHhPcGYwOW1hWVktcnpfTGZiTk92eUFlRGhYeFpaSUFzdC1SSnFUZGFNV19aV2NQWVBSdGNidDlCMHRBT21xQUVxQUMwWHhyN1NZSDZJQ3dMTWZJeEpJMVdDd2NDaHFXNk1jelZjLTJTTjVnb1RnTXRaeFBheno5QXBCSVNPdG1QMFphb0lGS1ZwbGhKdW81d081bFcwWmI1M0JxRVRyRjJoNmVjNDBYZURabHQxVV85VjJ2MURibXhDc1BHa0lrMERoVVR1T1E3TFZuTQ?oc=5
2026-03-01	Google	0.0	Vertiv Holdings Co. $VRT Shares Purchased by Intech Investment Management LLC - MarketBeat		https://news.google.com/rss/articles/CBMi0gFBVV95cUxOamlNbVhkRzc4RTJYSlVjT0hlOUxRTjhvT3RoandyUG05Ny10UVpQenBjdlFOZ0JmUFZJVjlseXJma1gxbG9kTUkwMjR0bllNNlhSbVhMOHplbkxIWG45RHlwUmg0LVc5cTBLek1faTRnTmplZGxibzk0OUxwWFJ6OVdWNDJlNW9IWDNRQmlCa1NCdXhhYzVjNnJIcnBfWDc3c0dLdmR3ckxEU0RyMTdwa2FMbjNkd3ZzVVhLY3lUNkZtZmpfZmtZVnVzb0hqdGRTRkE?oc=5
2026-02-28	Google	0.0	Andra AP fonden Reduces Position in Vertiv Holdings Co. $VRT - MarketBeat		https://news.google.com/rss/articles/CBMiuwFBVV95cUxPRUhRQnh2YUYzeWxodHktV2phdkxfdGRkbjRmRzB0NlNTWGdBMS1NQUMybElZWVBlSUxoTmxNaVlBM1RnWHk1MEwycVNJX0xyNk9ZTkdESGFFTEpqa0kyQ3huMnZfWHFaSFhnWnkyX2ctSVhqXzMydkhDdWlSNzAzc01GWHhZMVVfOEx5T0JLeUI3ZnprLWxMMWZxa2VzZmJoUUpoel8wa1BRcWZIdlFlSXBNeHd2YU1xQ0hn?oc=5
2026-02-28	Google	0.0	DNB Asset Management AS Has $17.28 Million Stake in Vertiv Holdings Co. $VRT - MarketBeat		https://news.google.com/rss/articles/CBMizgFBVV95cUxPVnVsOFk0NzVQeEp0Vlg3NnRydktldlF2VDB6N3A4V3htckYxMmR6Vk9qOXJnSTJ4NkY0WFlNTUl0VlladzR4dWs3N1dHMlByS1dqUHc0b1U4NVB3SGFxeDY4dFJsZTkyaU5qb2xwQmU3U3d2RzdCa0dGZkx5NHBOa1dxaG9oQlpvcE1yWW5CaGhnR0Y2Y1l0UHI0ZnIxVlJZUGpqelAwVFhZU2M5YVV5NE0xLWNDejBBazNValNEbkU2bkJqRGN6ZVdkNUt3QQ?oc=5
2026-02-28	Google	0.0	Keystone Investors PTE Ltd. Buys 105,422 Shares of Vertiv Holdings Co. $VRT - MarketBeat		https://news.google.com/rss/articles/CBMizAFBVV95cUxQLUE4NHVHVWxOZi1Bal9iVTR6X1lsLW5JdW52RFpTQlpuR29nSkM0eE5vSWZoNERGb1p1M3p6NW5zQnduTjNVN2NzNFhHRHVJMFZGamNkRmNxQ2dIZzE3U3FfbHhManJvWjNxdkllZXB2d3BHcG9EMFRxSEJOdExmSzRJNVZxYmV6Nm8tQW02OG9oNTRmX3M5ZE1wZE8xYkRXSXBHc09lZkJ6Mlg5b1RjSG1vVzQ0S2s1b00taVFicG9mUjctMWJFc2F5N0g?oc=5
2026-02-28	Google	0.0	TIAA Trust National Association Buys 34,689 Shares of Vertiv Holdings Co. $VRT - MarketBeat		https://news.google.com/rss/articles/CBMi0gFBVV95cUxPTFZhTG5JZnRQeURXekV1bEp5ZDhnOVdfMnlJTW9oRzQ4S0plMmxubmlRSmtKZmtjd3VNdm8tSnRXV3NVMFBfX3Z5SUp0RE1TZXplNG1IemJpclNhaEI2V1R6TmJVbVZOQnhjbTFGdzJ5Rk5IYkFnTUVOSTZVemlOU2U5dWRsV29lVVdrN2J6ZDFaQ1RmbHBXVnd1S2FsY3NVa3lDb1dCVklpOGtnQXB6MHpjWkdXcXBxZENnNVdpSDN2bG14WTdGZ2tzU1RFc04ySUE?oc=5
2026-02-28	Google	0.0	WealthTrust Asset Management LLC Purchases Shares of 6,440 Vertiv Holdings Co. $VRT - MarketBeat		https://news.google.com/rss/articles/CBMi2AFBVV95cUxPRG1MOVhMa29nUmhxQjhjdW4zQk1FZEpfTFp5ZlU4UXh5SGRMR19vcnRYR3RYcnFNQjhweE1KWW93MUI0bGhxa3NDVHRfb2RSSDZadFVlMTRhR0dfZVY4V0lzMlpwMVE0OThHZFlydmhjcWkwM3JjZ3FjT1pvcUF2MXZHXy1lc0lQdG9nZFJLMVRKai0tWjZvVGxxenBxclFxWkx3aDVpazhCTllsd2twVU5BZUNtaWRVMS12em84QzlXaGdpSXRhT1g0OGhiUWJBWGxFUzREX3M?oc=5
2026-02-27	Yahoo	0.433	SOUN Posts In-Line Earnings, Strong Revenue Growth in Q4, Stock Up	SoundHound AI posts 59% Q4 revenue jump, in-line earnings, wider margins and upbeat 2026 outlook, sending shares up 3.3% after hours.	https://finance.yahoo.com/news/soun-posts-line-earnings-strong-143600500.html?.tsrc=rss
2026-02-27	Google	0.193	Vertiv (VRT) stock slides as hot inflation data rattles AI plays; new Hut 8 deal in focus - TechStock²		https://news.google.com/rss/articles/CBMiqwFBVV95cUxPR213R0gtRzNuY29mS3dyeTBrNHVaZUtudzJySGFwMlNzZlB3SDBVVUVDRmFmSjlyMzhkaDdTRnpvX0EzUF8tWV9RSFkzaktTMWxLY251aXplUHhfS2tvUFNPY1BHeTdCWVA3bDRnMEhSMlBxX1ZYNGUwWkhnVkJEZ2paTjBRYUM1VnlDSHdKY1FFZHA2Zml3RzA3SjRDMjhaMThyTWtfOE02RG8?oc=5
2026-02-27	Google	0.0	Handelsbanken Fonder AB Purchases 16,683 Shares of Vertiv Holdings Co. $VRT - MarketBeat		https://news.google.com/rss/articles/CBMizgFBVV95cUxPSExhd0pQdFB0REJ5Q3JncjNiUC0tVzVvVHR0X1VsdzlwOEdjVThUNmJvQlVzbjYwc0d0RXpUVzViRkFFQkJjYVd5ZVNBTktxMmVLcnFTbWZhTnpGLVBGckxyaW9HVmxucVNMX1lzekQ2OWhDaWpXQWs4U1Nqc2M0UkowdHp6cnByNGpJZ0lCLWt1c3dDZmlyUFUtNXNZNE8tenR4V2d4VE9GaEZqSHZCczROeDJZSEVhSlpER2F3a1N1aDY1YW5hWVI4MVRlUQ?oc=5
2026-02-27	Google	0.0	Telligent Fund LP Buys 7,000 Shares of Vertiv Holdings Co. $VRT - MarketBeat		https://news.google.com/rss/articles/CBMivgFBVV95cUxPaHZUdEZleHJXcDQ3b3AwMUVLODE1aXEwT0hkcW1mREQtcHMtd25UbVZ4NVlJNGk0OVJtWGlMTmRGWHBvSEJzX0Z0eGJrcUJwdHVIbm5qSUo4S2I0ZGtvdlpkYUk5WGpTb1FvWkpUVjRKUkU0YjJ2SjFMUGpkdVdfams3WHdVTklJaDNiTTVTcGhVZDM4SUtoV1RZNE1YTW5nMmxvamFJUjZTMDdQN3Z3V0JmQzdQX2wxVm1zSG53?oc=5
2026-02-27	Google	0.0	US Bancorp DE Buys 32,885 Shares of Vertiv Holdings Co. $VRT - MarketBeat		https://news.google.com/rss/articles/CBMiugFBVV95cUxONnFNcVlLMU5mZ0RiczhqWDhIOGVxclNRT3FFZnpZZHd0Y3NDWUZtNEJ1R05sTmlQS21TTTNBaGFha0xHbk1iQ0VUV25PcTBsTUMwTWk2Y05VNWhFX0RQbFVPX1pndklfeDVDWWhIRkhteFNfWjZUcWVBVnQxMmJkeUVEOFVVWWtrQ2hMWWdudTdOQW5DUk5PX0dULTN0SktXSmpueGN0cUFVUE5RckJGcTlnbG1CUHNsbWc?oc=5
2026-02-27	Yahoo	-0.095	Vertiv Taps Hut 8 For AI Data Center Growth As Valuation Stretches	Vertiv Holdings Co (NYSE:VRT) has launched a physics-driven Digital Twin platform and the Vertiv OneCore integrated modular solution for AI data centers. The company is partnering with Hut 8 to support rapid, scalable deployment of high-density AI infrastructure. The new offerings are aimed at cutting deployment times, managing costs, and easing scaling constraints for AI data center customers. Vertiv focuses on critical digital infrastructure, including power, cooling, and integration...	https://finance.yahoo.com/news/vertiv-taps-hut-8-ai-002759962.html?.tsrc=rss
2026-02-27	Google	-0.156	Vertiv (NYSE:VRT) Trading Down 1.9% - Here's Why - MarketBeat		https://news.google.com/rss/articles/CBMimgFBVV95cUxQd1hKbmN6bG0tMVl4Vk92cGNkNWdsRE93dDhxaDA0Y1ZkekRMWFpaVTdjS2VLaWs1TUFwM20tUXhHZkpQa1htaDJKdjZDUTRNX1lhTWN5MW1vaHN0QzV6Mm1ZWC1RNXBhTG1UcUE5OHl6alVhOWU0ZFJVSjlzaW1MR1dwWXgteW9aWGR6WFV6dXBYWXV2R2NnTDB3?oc=5
2026-02-27	Google	-0.25	Amanda Frances talks navigating 'RHOBH' drama — while clearing up reality TV past — in dishy 'VRT' chat - Page Six		https://news.google.com/rss/articles/CBMivwFBVV95cUxOeE9kWkhpVzZuamc3VEVONkpXOVA5R21yQ3haV1pRTEtpZFVWTkhEZ1BXTlFiN1AxRFZDNlNOS3BxWFRmNlVYdGJ4QjF2bV9DTVpxamJBRDZCaGZ6SFZCb0U2SC1UUERpLXNwUE5NUmxKOXMzOU9MM0loUWluT0JNWDJLeDZGT3pRVzRLb0RIZU1rMy1aSndBcjJIMDlMdkxhWFc4Y2k3QzVhLXUxb1h2N3R2d0ZxWWVNQnVSX2Zpaw?oc=5
2026-02-26	Google	1.0	Best AI Stocks to Buy Now and Hold Forever: Nvidia-Beating Vertiv - Investing.com		https://news.google.com/rss/articles/CBMirAFBVV95cUxPc2ZBMk5ucGFFZmo0MUhIWjFIbmt1eGFRU2ZoR2gwNUFsejU5SnRXUkFoR3VQWEJicHN2UXVVMlZkVWthUk1Qb1U1TktVQUFkYWhOV2V5NHp4eEZqYU42ZDMzbHF2YXZXazNTei1qVEtzU3JTem5fdjhxdEx4Qk5ma3N3LWRfTnZ6YTQzaFBKOU95ZHV5T2FKcG11LXJYVExINXJReXo4c2pUeGc4?oc=5
2026-02-26	Yahoo	1.0	Is This The Best Growth Stock to Buy Under $300?	Investors are shifting from hype to execution, and Vertiv stands out.	https://www.barchart.com/story/news/446526/is-this-the-best-growth-stock-to-buy-under-300?.tsrc=rss
2026-02-26	Yahoo	0.543	Jim Cramer Says “Vertiv’s the Best, I Love Vertiv”	Vertiv Holdings Co (NYSE:VRT) is one of the stocks that was on Jim Cramer’s radar recently. Starting the lightning round, a caller inquired about the stock, and Cramer commented: Well, Vertiv’s the best one. No, Vertiv’s the best. I love Vertiv. That’s, of course, the chairman of that is Dave Cote. It just had a […]	https://finance.yahoo.com/news/jim-cramer-says-vertiv-best-150312753.html?.tsrc=rss
2026-02-26	Yahoo	0.267	Power Distribution Unit Industry Report 2026-2035: A $7.11 Billion Market by 2030 with Schneider Electric, Eaton, ABB, Legrand, Tripp Lite, Vertiv, and Siemens Leading	"Key opportunities in the power distribution unit market include rising demand for intelligent PDUs, integration with IoT for scalability and energy efficiency, and expanding edge computing. Growth is driven by investment in hyperscale and AI-driven data centers, especially in Asia-Pacific. Power Distribution Unit Market Power Distribution Unit Market Dublin, Feb. 26, 2026 (GLOBE NEWSWIRE) -- The ""Power Distribution Unit Market Report 2026"" has been added to ResearchAndMarkets.com's offering. The"	https://finance.yahoo.com/news/power-distribution-unit-industry-report-155500116.html?.tsrc=rss
2026-02-26	Google	0.2	Vertiv Holdings Co. (VRT) Registers a Bigger Fall Than the Market: Important Facts to Note - Yahoo Finance Singapore		https://news.google.com/rss/articles/CBMiiAFBVV95cUxQZG50UWdjcDdSZy1FMWNqU1I2OXJxX1d2bkJ1emxaRDFuNzdSRkROSUQxWnV0S0Q4Rl95OG8tQktGdXo1RzNKdHVtaXlwbkpoeDdLSEVMcnU4NDZIR2V0U0RHVmplb09IcTgwaG1MY2xUcmlnLXBQUVlYNU9teXRETWJIczczdDlW?oc=5
2026-02-26	Yahoo	0.183	Vertiv Holdings Co. (VRT) Registers a Bigger Fall Than the Market: Important Facts to Note	The latest trading day saw Vertiv Holdings Co. (VRT) settling at $259.23, representing a -1.13% change from its previous close.	https://finance.yahoo.com/news/vertiv-holdings-co-vrt-registers-224501700.html?.tsrc=rss
2026-02-26	Yahoo	0.119	Vertiv Industrializes AI Deployment with Digitally Orchestrated Infrastructure, Collaborates with Hut 8 to Scale	Vertiv (NYSE: VRT), a global leader in critical digital infrastructure, today announced a major evolution in high-density data center deployment, shifting from traditional static modeling to a higher fidelity Digital Twin platform. This technology-first approach accelerates the deployment of its Vertiv™ OneCore integrated modular solutions, enabling operators to scale AI factories with unprecedented velocity and precision.	https://finance.yahoo.com/news/vertiv-industrializes-ai-deployment-digitally-130000236.html?.tsrc=rss
2026-02-26	Yahoo	0.029	DataBank Adds Two New Board Directors with Deep Expertise in Data Center Infrastructure and Technology	DataBank, a leading provider of enterprise-class edge colocation, interconnection, and managed cloud services, announced the appointment of two new members to its Board of Directors: Rob Johnson, former CEO of Vertiv, and Daniel Sturman, former CTO of Roblox.	https://finance.yahoo.com/news/databank-adds-two-board-directors-150000906.html?.tsrc=rss
2026-02-26	Google	0.0	'The Valley: Persian Style' stars Golnesa & Tanin tell 'VRT' about the 'blessing' of falling out with Sky - Page Six		https://news.google.com/rss/articles/CBMixgFBVV95cUxNQ3AxcXFiVFBDQnAtSjMzRTBabUVVTDFTUEZNeEg3dDVzZG1tUERONWc1X3hBTC15T0thM0VtSEJzdVZzZW5od3BNN2FQRndNVF9lTnB4eEpJNk5TYWlUdlJvT0xOUE9EaWdTb0pUQ3lXaHRRMDQyVXpveEZGS1pfclRCejV0SlhqcXlmOVF6VVRqVmpnc1loaV9UdnBhaWk5by1kd0R4NU1yT3NiMjdDdFQ4SDVqZlVuTGZ4SmdSdzI3VGJEWFE?oc=5
2026-02-26	Google	0.0	Canyon Co. cities discuss future transit programs, funding - BoiseDev		https://news.google.com/rss/articles/CBMi3AFBVV95cUxOSjh6ZkFWMjgySXZIejRwb1RqWVhUTWFVVm9Nc285ZHBId1czNno2bGV3YktCbkpXNlJQN1N6UEp2R29WTEg4S1hQRnYzd2tyRXRvTEhGemZMN2g5QjBETGozVVBYaFpFUWMtYkpkdUh6SlZYRzNVamlLOTk0OHl3TVFGVUJPRzREcGw3dWVJLXhhNjNEQ2c2M3MtRjFzUVo2eGdqM1Y3UUhPN2Z5aXEzRlBHbVV3dzNuVW80SFhHZTlad2pHM0F3NzhBTFE5Y0c1a09KNTZWTW9SeGVY?oc=5
2026-02-26	Google	0.0	Clearstead Advisors LLC Buys 4,716 Shares of Vertiv Holdings Co. $VRT - MarketBeat		https://news.google.com/rss/articles/CBMixgFBVV95cUxNSF91VEZSOXM1dFJIMjZRY0ZrblI5OFM2NTFwN3dtRWhhY19XSXJZYlFGRTE1OTJpWlZEdjl6dVh2QkxnZXpHWkZJUlo4clg5QmJkbUtGRUVOd1pyNmpBckc1dE9EaWpzSGxwSExNWU1USllWd0tmSTZjb1dBY1dBMXZzb3o2U1Y1Tkdrb0todHVTSmZQdlh0YWJJdHp5Q3B5RUFvZjFORzk5Nk9HMlRvZF84S014cVpDUko1bmRqWERzanY0OHc?oc=5
2026-02-26	Google	0.0	K.J. Harrison & Partners Inc Acquires Shares of 15,000 Vertiv Holdings Co. $VRT - MarketBeat		https://news.google.com/rss/articles/CBMizgFBVV95cUxQenlzd29XMVZoVjZ4bTNmLUFBb215akFkOUxCZFJ0REEtRk1kS292MU1FLUxPa1BsSERUbGFqQVhMU2lRRGV0NnhPUlh0Zk5WUE1XaUlsTzdMSzhlRnkzQld0bElTQ3JrQnBHZlhpU1VzYzBXY2daWkxXS2xOVTFSTm1PbVY3c19WWmNIVlJWT0M3UGM3QUFUSjlrc3o5NnFCcjdMYkRneHdTMXlYQlZwXzN4UTdyY2g5dDB0dlptbFNDeGhvT1dkdzdDajlfQQ?oc=5
2026-02-26	Google	0.0	Sumitomo Life Insurance Co. Acquires 7,400 Shares of Vertiv Holdings Co. $VRT - MarketBeat		https://news.google.com/rss/articles/CBMizwFBVV95cUxQVWNab1h4V2hwZEM2aWhfdUx3NFlyeE9iZnZNT0dPRmNaTUl4VF9QRWdWdlhsczRpdXRRSXV2dURDUUVPOVVkMndXNFlFaVBIZUh0c0VxT0pMQ0ItajB4clhfdVhsT3gxQThzQnQtMm5tSWtQWWs2QkU4R1BEblk4Y0xRSTB2WUdyN1A1dXBIMzdGNXo0U0ViX3RvYXhMLTliMlBwWUJUd0lNbHhFOHI3NHlOM1pidWFBUDczUDU2VVVoMXlDT3MzSDVxX1ljNmM?oc=5
2026-02-26	Google	0.0	Thornburg Investment Management Inc. Cuts Stake in Vertiv Holdings Co. $VRT - MarketBeat		https://news.google.com/rss/articles/CBMizgFBVV95cUxOVjJOR2huTWwzNHRaLXpEVndLWmVkb0RaVWFzS05qRUxXUi10ajVTTWZsMDZPbTBzczRRWU93bVNEMFRXaGFHQUpjUVh3NV9yMUJ5RTE3NXJ2cU43SlNFcks4bWZGRXZnYlUyX081WmR1YTdLNmY0b0JyNnUtd20xaGVfanEtelFRV3VaQWl4dXFhSXNXUkFwWFZVS092ZVJzUEdxQnR1UkhaeXZrd2t2MGswQkVmSXpIYWFKbXhEWlVsLVZQN3p3X2NJZ0xBQQ?oc=5
2026-02-26	Google	0.0	Vertiv (VRT) stock price dips from record as AI valuation worries bite again - TechStock²		https://news.google.com/rss/articles/CBMimwFBVV95cUxQTGdlVFo1Q1FJbkxHU2dZOTJnbzZyN1QxVFpIVlFXZnlJOTVLZVNYcmpPbE41OExPblBnMGthV2F1UnQtajVhbmlJcFdGS3NISGp6a3YxS0Z1Ni1IRWxiQzRyODZhMUNIS2JMckx4QlhweXpVWHRySkdWMkJOZjNMaTZXQ3B4Nzktc1dscUlqZlgwbmV6ZGVFV3BWUQ?oc=5
2026-02-26	Google	0.0	Vertiv Holdings Co. $VRT Shares Sold by Westfield Capital Management Co. LP - MarketBeat		https://news.google.com/rss/articles/CBMizgFBVV95cUxPX0ZnTkg1WXNxM294dThkZi1rTjhzcXJuY1RfUUVVdDRiYjBaVkFweV9nMVRUUE9ORFJRV0dla1ZWYUNGSG4wei1lVDAwdWk2UjJHdXNCcUJpeDFvdndzN2p0WHNDcFlkMXRMTjdtTHhaUnBjSFc0Qk1sVnNJT2hFWFJubDl1QUZ4T2xEV3A1b2llUF83ZDlTVV92LXNLeF9PcTlzSjZfLWs2ODJhZHR3bmltbGItdWlFUTlCZmgxMlhFLU9XYU56ZklYWjNqQQ?oc=5
2026-02-26	Google	0.0	Vertiv shares slide as investors reassess data-center cooling demand and competition risks - Quiver Quantitative		https://news.google.com/rss/articles/CBMiwAFBVV95cUxOZHJhNHh0UWtTNnVBaUFzSmJ1a0ZDQzhXb3hkQkwtNGh6dTBqa1hyNkRVV0UtbnVrT2wyaXZWNU9KUjdpT2t3YzNUbXZKNUVVYnJUeE5IVTdra2dycXZKWWxseFVXdHFUSDZWbEJJMXlFYVdBQnlsMWVMckd1bmtNbU14TXpFRG1MZWdaaXhuMHE0Q1NoaUFOVUg3RnE2ZVNham5hOG9FZVBHLWUxTFY5SURQeUdjYnUxNU1uOWxkU28?oc=5
2026-02-26	Google	0.0	Westpac Banking Corp Buys 28,520 Shares of Vertiv Holdings Co. $VRT - MarketBeat		https://news.google.com/rss/articles/CBMiwwFBVV95cUxONWlScTlWa3BvU1h1OTNBOHlIWW1KeEFZMWFKTTJMOHd0cFV4RmhlOUtJTllWbjJabkVWaDg0UzdZSHA3Rk1ueVJabWxZbXc3dE5SSkRTSEVsT2l2eDVBQjRlbXJOaFNBT1lSekFET0hMNmxMS0JsTFZvMGp1Tjc2SEltZkxINkV3ZUVWbUhVWXExU2R5ZGhWMlBqbmVzT3RDa1I1T1FNd1JJMXQ4S3NIWVZBal9wSGRuejVJbzJkamM1c0U?oc=5
2026-02-26	Google	-0.156	Vertiv (NYSE:VRT) Shares Down 1.2% - Time to Sell? - MarketBeat		https://news.google.com/rss/articles/CBMinAFBVV95cUxQVk1ibTRQMnJNMlRiUW56VlRxOS1xcnpZaC1YWFBmN2JhWlVmMFVqbHFKaUM4cWVybDJVSXg2a3M3QUVXMWhENjlPbVdneXJHVjY4XzdtSEhUOEVyT25mc1VDM3lKLUotd2JnYVpybWpPLXB4RmZmQjRGRXhPUFVYTGNfQW11RmJyNVZCX2V3Rm5kM0sySkdvd0pYS18?oc=5
2026-02-25	Google	0.25	Vertiv (NYSE:VRT) Trading 3.4% Higher - Should You Buy? - MarketBeat		https://news.google.com/rss/articles/CBMiowFBVV95cUxQVVF1S1l5S0pPSlZ3bHpJaVZGX3NCV2FRcm1POEk4cXR1YUl5czVWZU5oSk5Ra0QtcTExMHVpai1KczZ1R3FTM2cxVExOMVE4bUpOc2FoV2xuaGczdFJRcXA2Z2ZXZ1JhQjR1VzRnN2dVZVNNNDYwUDg4Y2lIR2pNbGUtczN1MzFPMmZyX0lPRHpTdEZuMy1jSmJmTUc4SHlzWW00?oc=5
2026-02-25	Yahoo	0.239	A Look At Vertiv Holdings Co (VRT) Valuation After A Strong Multi Year Shareholder Return Run	Why Vertiv is on investors’ radar today Vertiv Holdings Co (VRT) has drawn fresh attention after a strong run in its share price, with recent returns over the month and past 3 months prompting investors to reassess the stock’s risk and reward profile. See our latest analysis for Vertiv Holdings Co. At a share price of US$253.15, Vertiv’s recent momentum is strong, with a 30 day share price return of 38.72% and a 1 year total shareholder return of 175.85% sitting on top of a very large 3 year...	https://finance.yahoo.com/news/look-vertiv-holdings-co-vrt-161044850.html?.tsrc=rss
2026-02-25	Google	0.0	'The Valley: Persian Style' star Reza Jackson dishes on dating and season 1 drama with 'VRT' - Page Six		https://news.google.com/rss/articles/CBMitAFBVV95cUxNMS1TY0N1NDJEQi13N0NHNXVUV3d2U2U4YXZjOG9Ea29hNWVHU2VPM3dYQXRTQk5EbHBVZUdkNXZMQzczMHdMUGQzRXl3MzN1dTJxU0lma1d2NFVVSFo5Z0g2cVphSExnUWVmM19HY2hmYnBJdWhINXV0NzRLNWZwRUdGOWVqVFlFbDc5cHdKbVhkYlBFNl9zUjlUaWNmRUFOUVBob2ZzR3FIY21Uemh5QkdkNGo?oc=5
2026-02-25	Google	0.0	Dakota Wealth Management Grows Stock Holdings in Vertiv Holdings Co. $VRT - MarketBeat		https://news.google.com/rss/articles/CBMizAFBVV95cUxOMVVUUUpCLWdTTjFRRktDbWhnZ0tKWExwd3hrekJuWnFGbEphUzVIbzV6Vnp5QjUxSXhpNWZNdW1lTUdGTUpUQXlIdlRlLXo4VW5vM2RmcWlWejNGWG1ObVI2RWhPOUJjUHlGMVIxN3lPNWJ3WTR2eDVYN3dSWWVTekZwcHJaLWRnaUFkRGpqTjVaRkJKNW9kYWY4T1dLaHdtREpkTXpPc19oWnJ5RTEySks0SlYwQnZrXzQxR0hGYWgxQ2RlbHgyenA3bUo?oc=5
2026-02-25	Google	0.0	‘Summer House’ recap: ‘VRT’ talks Jesse & West’s fractured bromance over Ciara drama - Page Six		https://news.google.com/rss/articles/CBMiqwFBVV95cUxPM2hxZHpLWnhsX2FZLWViVU5hOVhWRm96ZUNleHZxSWZIZWpodVNOeUpROEZUUGpPTDZ1MVdWajNzemEyQW0wbks1cy0tZDQ0MG1xR3VIM1BmRFlENU5hUWhXbUZIb0k0T2hyclVpeWl1S0tzTVdlenlRMjJLTFVqUWtOVWxrUWsxbFFzNTZQZ3hJOTB1QnBaS2FLYWQ3eDdfVHV5bzBFdVJZdms?oc=5
2026-02-25	Yahoo	-0.125	AI Stocks At Crossroads As Nvidia, Snowflake, CoreWeave, Salesforce Step Into Spotlight	AI stocks have been volatile with earnings reports due from Nvidia, CoreWeave, Snowflake and Salesforce. Here's what could move shares.	https://finance.yahoo.com/m/dfce46f1-9661-3cb0-951a-90da2c45fff9/ai-stocks-at-crossroads-as.html?.tsrc=rss
2026-02-24	Google	0.444	VRT vs. APLD vs. GEV: Which ‘Strong Buy’ Data Center Infrastructure Stock Could Offer the Best Upside? - TipRanks		https://news.google.com/rss/articles/CBMixAFBVV95cUxPUWxkUms0bGk1Q3VlUnBZSVFhbG04YUx6QWJ4NFQxUDg2TTVRdzBWS1lCLWthZ2hWQ1lNRzFMTGJISTN6XzhGNk5TTS1jOGNubXJ1Qnl1cWYzV0h3OWYyWkFzMUFrbkNTTjlXdm9KTEZ5akprWXRkQl90bFFMWWFjdFVnSjFzYlZwRmZoTC16SENvcEU2QWNRWTFJRzhOdEZ1ZURMaHlSUFpQWnlfV0thclZHaDhLVkVqczE4cDRwb3MxakZj?oc=5
2026-02-24	Google	0.217	A Look At Vertiv Holdings Co (VRT) Valuation After Its Strong Recent Share Price Run - simplywall.st		https://news.google.com/rss/articles/CBMi1AFBVV95cUxON0J6a01XbEY3RXI2bkM5b3JIZXdza3d0dzNlZEZ1YmJHRlc0U1FtZTNrUkNOZ3o5YmpERWI4aGE2aE5ESXRlMnVXekpyWFROc2cyOHlKWXVvVnJQR2FDU0pfSldqMEhZTWNZcWM5WGRYUkpNaF9YVjVIbEQzMmdxTEZBN0dCUFJzaWZkZVFkdXo4Yk94RENQeTJ0N1RFSFAzZ0VhQWszNVB2VDFsQzNvZFQ0RE5FbWxqQjZmY2p1Z2d4aUFFSVV1dlZ4UXdpMTJEMVZ0UtIB2gFBVV95cUxNbGhMZXd1RkdrQWdyY0h2QjRNU1RUQjMxdEpYMHFpTkVJU3lJQUEzNHhlaXo0b1cxaHBORkdhTEhZd1lPWUpjWEVYcVgwRDFwN0xSRWpUSjZ0d09RWHJYOG1sRFNKVG5sdUdLdnpteTFlNTJGSXlwTUI5LS1ndy1OcDRfR19XZHJfWXFmLVB2MVhxY2RoT1JwQnFSSjFqUFYzMjdvMWNIUnp2YVdsSlVoTVlTVTRFME0wQ0NxNVhUd0dlZlhib09QelZxQnF5TXI2REQ4MnFZQVVFQQ?oc=5
2026-02-24	Yahoo	0.111	Vertiv Stock Bucks AI Meltdown As Data Center Boom Fuels The Nvidia Partner's Strong Outlook	Vertiv stock has formed a short stroke pattern with a buy point of 255.54. Shares gapped up on earnings on Feb. 11.	https://finance.yahoo.com/m/c36d910c-cade-3708-a7e3-070a9fd4c49d/vertiv-stock-bucks-ai.html?.tsrc=rss
2026-02-24	Google	0.1	Carl Radke talks dating, ‘Summer House’ drama and ‘DWTS’ dreams at VRT’s ‘Soft Launch’ event - AOL.com		https://news.google.com/rss/articles/CBMif0FVX3lxTFByZmlkVVFHTk8wWVJKd2tmM0hLRXhmUlZuQ0wzTG9UOW04LW1VRUxoZFIzazZiT3J5dWNscmNnMzFESnZHenExWTBBcG56TUFGYjlFX2NqZk5qbzFDZWw1dDlhTUtUbkpnSFBhVk5PLXdEVXQydVVXemhTTTBzNjg?oc=5
2026-02-24	Google	0.1	Exclusive | Carl Radke talks dating, ‘Summer House’ drama and ‘DWTS’ dreams at VRT’s ‘Soft Launch’ event - Page Six		https://news.google.com/rss/articles/CBMiswFBVV95cUxQeXdKT0ROVDlSQ2YwZGNZc0JsTUZ6VmpncXhHcnZNOFdWTVducjh5MTBLVTM2ZmUxU2ZSSnlyWVI2Mm95RTdfUGh3M1pTZWdHTjdpU1BOZE8weG5laGotZ1I1RjNYNkVZb053QUVUV1IzTkUxMGItZjdwOVdMMVhpVVlEU3c5TlRDYWxMbDB0Smt5OWRGSnNfNUVIUDBRT2FDZnFGYVNzbEFVdG54U0NOMmhXUQ?oc=5
2026-02-24	Yahoo	0.041	Is It Too Late To Consider Vertiv Holdings Co (VRT) After A 170% One Year Surge?	If you are wondering whether Vertiv Holdings Co at around US$245 per share still offers value after a strong run, this article will walk through what the numbers are actually saying about the stock. The share price has recently closed at US$245.42, with returns of 4.6% over the past week, 34.5% over 30 days, 39.8% year to date and 170.0% over the past year. The 3 year and 5 year returns are very large at 7x and more than 10x respectively. Recent attention on Vertiv has been shaped by ongoing...	https://finance.yahoo.com/news/too-consider-vertiv-holdings-co-071254641.html?.tsrc=rss
2026-02-24	Google	0.0	Cornerstone Capital Inc. Buys 6,273 Shares of Vertiv Holdings Co. $VRT - MarketBeat		https://news.google.com/rss/articles/CBMixgFBVV95cUxON0JBMTRwd1VGNTRDbklYcm0wYi1XVnNaSVljdmtlcFhzU25KQUlSNXBOVldMbHhaV2xoSktHWjBNaFczeUdKSHVsRGpvRTFLY2hyVXl3X3FhS2szdy0tRXVKN0dCYnlYSTM0SmRwZkhVRXp6SWZTeEhlU05NdFMzZDJWR1VXQUN1MXhWTmhzV0d4cGpaREp5bnY3WnktM1JGWnNNUWRBaHVnc2IyX29aWGtHR3FINWlGTlBzS1g5NFNyWXVWeUE?oc=5
