Date	Source	Sentiment	Headline	Summary	URL
2026-02-24	Google	0.0	Dana Investment Advisors Inc. Sells 21,801 Shares of Vertiv Holdings Co. $VRT - MarketBeat		https://news.google.com/rss/articles/CBMizwFBVV95cUxPUTNHbm1rZGVwdFV2bmVGdUlQQWJ5UWFIZW4zWHVxOWxDOV9TNmVaOE9FajRQOTk5cW9Cc09KRkRpZUFfb3JQQnEtMUREN2VndTMtNHA1R1N0alVNRURqdV9SV19HRmZMaFAwWVZuOVNiRVU1SEVYd0poY0J5Ri1KQjZkR1JrWHU0SDF0RWIwWDJJTGNRdzlQZGNPT3pyTkR4aGhSWmxZcW14cTdqZkdCQlBIclRaNWM1NzdoWnJHR0dOSThZMzEzVUNvQ1VhazA?oc=5
2026-02-24	Yahoo	0.0	The Zacks Analyst Blog Highlights Amphenol, Western Digital, Vertiv, Lumentum and EMCOR	Amphenol, Western Digital and Vertiv ride a $650B AI capex boom as data-center demand fuels massive 2026 growth across infrastructure plays.	https://finance.yahoo.com/news/zacks-analyst-blog-highlights-amphenol-153000933.html?.tsrc=rss
2026-02-24	Yahoo	-0.163	The Stock That Didn’t Get Crushed by the AI Doomsday Essay	Monday was a tough day for the stock market.  One factor hitting the stocks on Monday was an essay from Citrini Research, published on Sunday, that imagines a future in which AI devastates the economy.	https://finance.yahoo.com/m/d883cb34-99d0-3abe-b9a6-d3d89f15bcaf/the-stock-that-didn%E2%80%99t-get.html?.tsrc=rss
2026-02-23	Yahoo	0.367	The Zacks Analyst Blog Highlights Taiwan Semiconductor, NVIDIA, Vertiv, Albemarle and Axsome Therapeutics	Taiwan Semiconductor, NVIDIA and Vertiv ride a $650B AI spending wave as clean energy and biotech fuel 2026's market split.	https://finance.yahoo.com/news/zacks-analyst-blog-highlights-taiwan-153200469.html?.tsrc=rss
2026-02-23	Yahoo	0.291	2 Large-Cap Stocks on Our Buy List and 1 That Underwhelm	Large-cap stocks are known for their staying power and ability to weather market storms better than smaller competitors. However, their sheer size makes it more challenging to maintain high growth rates as they’ve already captured significant portions of their markets.	https://finance.yahoo.com/news/2-large-cap-stocks-buy-045115147.html?.tsrc=rss
2026-02-23	Yahoo	0.284	Here are the five companies that $9 trillion of funds agree on right now	Vertiv has been a top holding among hedge and mutual funds in the first quarter of this year so far, and a lucrative one.	https://www.marketwatch.com/story/here-are-the-five-companies-that-9-trillion-of-funds-agree-on-right-now-4ac77fc3?.tsrc=rss
2026-02-23	Yahoo	0.18	GE and 5 More Stocks That Can Win as AI Shakes Up the Economy	Manufacturing and aerospace & defense stocks are turning out to be potential havens as artificial intelligence disrupts industries from software to financial technology and professional services.  “AI will enable a structural reduction in the cost of doing business for many commercial aerospace companies, supporting higher through-cycle margins,” wrote Deutsche Bank analyst Scott Deuschle in a Monday note.	https://finance.yahoo.com/m/42b6641c-d535-3518-85f0-2dcfdbaa2b61/ge-and-5-more-stocks-that-can.html?.tsrc=rss
2026-02-23	Yahoo	0.103	Brokers Suggest Investing in Vertiv (VRT): Read This Before Placing a Bet	Based on the average brokerage recommendation (ABR), Vertiv (VRT) should be added to one's portfolio. Wall Street analysts' overly optimistic recommendations cast doubt on the effectiveness of this highly sought-after metric. So, is the stock worth buying?	https://finance.yahoo.com/news/brokers-suggest-investing-vertiv-vrt-143004344.html?.tsrc=rss
2026-02-23	Google	0.0	Lansforsakringar Fondforvaltning AB publ Buys 6,526 Shares of Vertiv Holdings Co. $VRT - MarketBeat		https://news.google.com/rss/articles/CBMi3AFBVV95cUxObWp1Tl9fNExCUW40dXlLcGlvN2ZJY054RWVMZXZYdkY0a0hGNU9WX0ROcUd5Q2JCNGtoTHhCVFJRYjJsNzU4eVMxYWhnOHc0NkhGZkRwSTcwYmpmRTNYY0V0UERfRFJzbzJET0RBUTEtWFBHYU1wZVF6bDBvOXRwa3c0MDJQNHdybTlFdmUzWDE5NE9lWWRqQUl1Z2RfRDl1WjBrcDIzSVVacExPRkRRSDFxaXU0UU9XZHNublRaUE1JLUpFR0gwemVaOXo5d1BCU01qbFBHSXlGM01r?oc=5
2026-02-23	Google	0.0	Private Advisory Group LLC Has $11.14 Million Stock Position in Vertiv Holdings Co. $VRT - MarketBeat		https://news.google.com/rss/articles/CBMi3gFBVV95cUxNLUpZdW9JV2NQTXJmNEhpdE10QVI0SjNIblBnNzNGeUtUSWZEb21heWt4NjFLMzBoZHVPTFRWa1hEb3gtV3M2RG8zMWQ3MVI5SG9McVpiV3dtTjhkQ0pLSzhfVGlOUVJKdFl3TDd6NnNSRUNuYnA5THdVN2wtUnk4WmFtNTNiUTFYVjROUVowMnBMSU4yQklhQV9kVndzOWI0VEpOaDhod29hSU5vRUJlZXlNM21sR1VMRXpNbHFfSmZvY0RXSkJPMF9wVkpDTnowT3dFSU9TeTVnZUllb0E?oc=5
2026-02-23	Google	0.0	Vertiv Holdings Co. $VRT Shares Acquired by Sigma Planning Corp - MarketBeat		https://news.google.com/rss/articles/CBMivwFBVV95cUxPbHQyTXE0Q3FaLUpLUnFhUWhHYVMtRU1LcElkZVlhcUdsRC15SUNaRzZJcDFCcGZxTjBrYnNJZmxvRzBzOVRzSWFvWkdyNkJlWnExSkdxRnc2RXNmcVd4YzFjTmxYeVp5cWZyREZoUWlCYXZDT1d3bEVaUkdZNnhDeHF2QXNvUEVHWWd1czRyV2RCc0ZpNElPMnprZmpJUE5INnRQZnhxUFR1NEtJbWY0NzRpeHlSUlFxd1dzYjhKUQ?oc=5
2026-02-23	Google	0.0	Vertiv Taps Nvidia And OneCore Modules To Target AI Data Centers - simplywall.st		https://news.google.com/rss/articles/CBMi1gFBVV95cUxQbGI0QnZjNmcxeU5PaW40elJYY0RWXzBuQTh6c1FQbUx6ZEJGT1U5MnU2QVlUOW1QVG1vRjdKWGN1RkRRQ09JRTZHOTVKckRNd2RkUEx0MmxyMHZPTUotMkdqb29XVnBZd2NwUUJvUTItNjc2b0dzZFZfa2NlekM0QUdwaXRjSW1WT0RoX2g2djVIMkVkYVdYOHRCd2NMOE0zSnE2NjB2aXdnWWFXM0VMZzk5MEJOOGdsVkg2OXpyOUNFdDVwanhYYm84TEdTaVRYSU9oVE1n0gHbAUFVX3lxTE5oVzRYTlZpT3V5OWx2ZnNEWXlaelpoX3dJaWkzRFQ0d016NC1XZUppM2pFVDRWSHF1T3JGSENwNmxYZGo4Rm93Rjd0TnMwZEFxRGEyZEUtZGFqcmhLRXlXbVdscnIzQ0NtQ0t5N1l0OUszS1BFUEItaXNmVTc3azF1aXlFWmJpaW16d215aXJiSHc0U3d0STFqQ3l6eG5lS1puSi05YWdBaWRIQ0V3WUNyeW1zV0hma0Q3MS1QbFdyQkE1bF8xUFphRmNrU0hYSlpERnRQdjNpTURWVQ?oc=5
2026-02-23	Yahoo	-0.025	5 AI-Infrastructure Giants to Buy for 2026 on Massive Data Center Boom	APH, WDC, VRT, LITE and EME are five AI-infrastructure giants poised for 2026 gains as enormous capex by hyperscalars fuels massive growth across the ecosystem.	https://finance.yahoo.com/news/5-ai-infrastructure-giants-buy-135800309.html?.tsrc=rss
2026-02-22	Google	0.6	Vertiv Stock: Buy, Sell, or Hold? - The Motley Fool		https://news.google.com/rss/articles/CBMifEFVX3lxTE5jUFlQWTBxLXd4Z0RsaUVYVEZQaldKVHJJeDhJZlZZYkFXdUxiaUszRC1seTZEVWY5cF96M1JyTFZuUzV5bXpvYmNyY2dZcUNtZE1IVDgzX0h5RVdHY1pKRXFBdGNMOEtpZVNIM09yU0NISXRMeHVNbVFrLU4?oc=5
2026-02-22	Google	0.25	Top Wall Street analysts are bullish on the growth potential of these three stocks - CNBC		https://news.google.com/rss/articles/CBMipgFBVV95cUxPVlFvUFpRa2JUTTBFdDhDM2ZMT2FqTnRIMkRHTEtxRlJHTXZGRnJnY0hNRUVTV05lTENjU0JVS1NSTTBIQW5hUEJZN2NfaVFINUJEQVQ0d3E3M0pwbk9ONjIydHp2SWtSYnJydUpwTThGQzRLV0RXMUVGblh1MWlRR0paSm9SOU5yaERCMUwxblNXNWplZHRuTk9XdE9JSjNuSnBpUTdB0gGrAUFVX3lxTE9TUGZZazRVX0tFaWQ2YVlHN1ZTTzAwVk9ybEt3aDFmZVNOZzlFcXBNckRybmlJNVFjWlBqcXVCbHU4clF6Tm83U1lPbkJoT2lWSm1jckdpclE2ZTd4THE3RGZkWV9ZSFpBVTdITUtQbXpLVWVOdGNvVWJ6dlVKTF92cldRNzFGQ21GV3o4QWk0X2JZWjZXUU1GdU9Udk9YVXZfR21tUDJ0M0QtMA?oc=5
2026-02-22	Yahoo	0.167	Vertiv Stock: Buy, Sell, or Hold?	Vertiv has seen incredibly strong demand from data center operators for its cooling and power solutions.	https://www.fool.com/investing/2026/02/22/vertiv-stock-buy-sell-or-hold/?.tsrc=rss
2026-02-22	Google	0.0	2 Large-Cap Stocks on Our Buy List and 1 That Underwhelm - The Globe and Mail		https://news.google.com/rss/articles/CBMi1gFBVV95cUxOUE9MSk9CQjFaQjF0MTd1UlhHUjg1Z3d2NkRsa2ZxWmFLaS1DNFhYYUszRDRmaHVaOU4ydVh6RWtPMXlHZ3JsMER2bE1UclVyMjQ3MXpoWlUzc0NpcmFrWUpkUXR4RmFoSGc3MndWZDlvc3h5X2lQNm5TUlVueHdJM1FLYjQtSnJPNWJoTnBYMzNTelRNaG54dHFSSXVMbkpZOUw0Q0pEV2pkSmJ1VnFDZFZyWWFnOG5MckdMckdjUGZXUWJ1WGprQmdlTVBLSlUtbmZsdlBn?oc=5
2026-02-22	Google	0.0	Gardner Lewis Asset Management L P Takes Position in Vertiv Holdings Co. $VRT - MarketBeat		https://news.google.com/rss/articles/CBMi0gFBVV95cUxPZzdSSVVoVVhySWN0U2hKVnFfZ2lMOWtOcmtwSkpTdmNlR2R6bkREVE1RNTBYSjNOZTg4UTM2NGY0QkFMeEJTcFg3WElyM3FkUlRnclY0Y1hqRmtXUFNXVXh5RWJDZkhuZnc3SXhFaU1QeG8xc250S2pDWHdESzNBWXN3N2U3X09rOE43T0VxWG9IMHJxMTJLcE9zQmc3TVAwQnRNd0N5WkJvajR1N19XbWlfMWZJVHh3b1Y5SVdjc3pyUVF2bzZfWWtnUkdYT0swemc?oc=5
2026-02-22	Google	0.0	🇧🇪 VRT pulls commentary team from Vienna ahead of Eurovision 2026 - That Eurovision Site		https://news.google.com/rss/articles/CBMiqAFBVV95cUxPLVRzVWFYeDNYUVBHSWFFaFV3QWtUQTJTR0NqZC1OQ2lQdS1INzAyRzBNTEU1a0dHWmpGaDNvNkE1VE1VckR3Z09jdkx0ckZRcnMwQXRHQmZXQTRQdkdDRzFRQ1hHX3NvbzdGVUplQzM1cHdUT1Nqd2VqWWtCaWVHdFBTalIwcEdMUFU4OXFMUU5MZVlyRnlFX1FsT2kzSF9VR3JFSXJ2c1g?oc=5
2026-02-21	Google	0.0	CenterBook Partners LP Takes Position in Vertiv Holdings Co. $VRT - MarketBeat		https://news.google.com/rss/articles/CBMiwgFBVV95cUxPWGVyUFkzX2JSSERHYkw2U21sMTlrdkNQSGp2bm1MTVpXLWNLNnd0TWRtVlJNc1VIRXJ3MEZTS3hHQ05zTVdiNU0xejduT2VudHVQempGUTN6RXVXLUZkeUZ0SEpnQkN4Y1FQMm5qRi1jQzEtX1FaRUZqR3VtdUtvTHRRelB0UV9aMU5lSXFWekdRR0JSTDV5bGYzbzNCcmdMbm9tVm5qdk1OWmVYVVlJekR5TkZ2bFZSV2Q5YTd4RVZKdw?oc=5
2026-02-21	Google	0.0	HighTower Advisors LLC Raises Holdings in Vertiv Holdings Co. $VRT - MarketBeat		https://news.google.com/rss/articles/CBMiwwFBVV95cUxQTGhyeGRkTTdkRHJuYWw0b3Zha2FhZzVpM0x3c2FsUnVrVnVxNmJQbWdRM1FXYmk4QXZERmhZWnBUZVQ2Ui04UElrMWVqaERyaE9rSHA0VGV3YjNoWVdDcGtMM1NLckltMDVHRDlRSXJaV08zMTFEOXlpNGk4SjRBV1czblg1TTBaem00a25VZE5sSERad2VDVWtpa2g5ZEM5NDIxaFJNZ2JGQmpPajVQTms5M214TDBCdWFHRExHV2REYU0?oc=5
2026-02-21	Google	0.0	Raiffeisen Bank International AG Sells 150,985 Shares of Vertiv Holdings Co. $VRT - MarketBeat		https://news.google.com/rss/articles/CBMi1gFBVV95cUxPS3JTYWxLdUhSN0ZLdzFaVmJMdXBfek4xdjlBX0dqU3VrMXB1X2Z4THdrTnhSV0hrY0dTUEhHT2dQRFdCOFFlLWNnaDc1VERhVkZQZ3ZFODdiYU5PUGN6MGFKbGJUcGxOLW9McDZLM1dWeG5GQXg3aGlDTW1ZemFvY180U2hkTV9CeFdwU0tCR2hfVnBhV29TdXdtMkJEVTZ4ZTA4OXBaNmpSdkhzelNmT2w5LUJMbkJvTksyVmtUZDAyQThXLWpXOUhxOWJYQm4xcXVaYm5B?oc=5
2026-02-21	Google	0.0	Vertiv Holdings Co. $VRT Shares Purchased by Tredje AP fonden - MarketBeat		https://news.google.com/rss/articles/CBMivAFBVV95cUxNYWJyWHkxbXYxLUxDYTlBSFdGY01PYk1DM01RTW5xWjE5MmwyaWhEME1TNXB4RmxFTTF2UHZMSFlaNGVhSC1Jb0JqbXFoaGdTZ3ZJQjZMRi10cWw5TzQ2d2FRUUM2ckVtWUl2bVUyREFtNVkyMHNweWpVUHFrM0FMclVaZm5oaWR0QUY2M0ZDc0dORGxBbEl1M2J5LUZpc1NSV183bEFxUDNjV1hLeDdYYUhhcmM1WkVfMjVENQ?oc=5
2026-02-19	Google	0.375	'Married to Medicine' star Dr. Mimi chats with 'VRT' about drama with Toya, Quad and King's breakup and more - Page Six		https://news.google.com/rss/articles/CBMixwFBVV95cUxNYzhZeXhUTUpMQlRNNlBsWWJEZkVULW9NemthTVV3RHFzMF9MV2ZiTC1CWTctZkFMOC1iclphUHRBbk5KUkFDZkxFVXk0TWgyV0x5VEJVb0R0cDAtRHZhaDBYYTlOUVNMcmxMTVkwR1B1REVfNjdITS1hSnowZUo4TVJsV2xGTWo0Q0dLaG04N2xoNnI2RFdPR2pneGJHVDBjcDB0QnY1cDVrRE9HdVRYbmpXdWlMSDFzQ1dhZk14YTduYTNLbW1B?oc=5
2026-02-19	Yahoo	0.374	2 Mooning  Stocks with Impressive Fundamentals and 1 We Brush Off	The stocks featured in this article have all approached their 52-week highs. When these price levels hit, it typically signals strong business execution, positive market sentiment, or significant industry tailwinds.	https://finance.yahoo.com/news/2-mooning-stocks-impressive-fundamentals-044235022.html?.tsrc=rss
2026-02-19	Yahoo	0.122	1 Data Center Stock That Billionaire Philippe Laffont Is Buying Now	A marquee fund’s new stake highlights how essential data-center plumbing is becoming in the AI arms race.	https://www.barchart.com/story/news/307283/1-data-center-stock-that-billionaire-philippe-laffont-is-buying-now?.tsrc=rss
2026-02-19	Yahoo	0.051	New Strong Buy Stocks for February 19th	BKD, DVA, VRT, WASH and GBOOY have been added to the Zacks Rank #1 (Strong Buy) List on February 19th, 2026.	https://finance.yahoo.com/news/strong-buy-stocks-february-19th-103000626.html?.tsrc=rss
2026-02-19	Google	0.0	Alberta Investment Management Corp Buys Shares of 38,200 Vertiv Holdings Co. $VRT - MarketBeat		https://news.google.com/rss/articles/CBMi1gFBVV95cUxPeUNwMkVSTnlKY3lJWC1xVnItSVVJQTJXQlEyRVZuUGRPS2xMNFJfM0xMR01OcHpBaHZBd1pkZDcwcVNxdDhYYUpaVzJWU01YVTFuM1l1aGgtN0lBQzlsNFFPLTFVSUMwdjVuT2hUY1hGQ2xOeXpYZU9YSlViVDN5WlMxNXVHVUlVRFlCUmVlUlRjaFF4Y3F3aUJtcjdmbk5lUk15TjlxdjNXR1p2YzVENkxDUTFCcm1xRFZDdVByRUxlMDAxakh3Zk9WeWlhb1dTMlZ1VlBn?oc=5
2026-02-19	Google	0.0	Vertiv Files For Debt Shelf Offering, Size Not Disclosed - TradingView		https://news.google.com/rss/articles/CBMiwwFBVV95cUxNMDJnUDN4TWtkRWRxQ2haNmNLaGUxeEZGcUwwWTZiY3VYZjlESUpRTnpFZXVjSzgzVUh5YTJIWW5kNkFJQzdlMUQ5NDJEc0UyZE5sRzdqWE90SDAwUXVrN3o0WnBRaDNGUjB1TldRdHBNZDFRTVZKbzQxLWdtOUN4YkI3cU5YXzdzMTBENFhPQ2JWb1BHdXUzZXIyc19yZ3duVWZ5UEhLQ2I4QWdyNTk4elYzRFdxSHdTTXZocDFXc2ItaHc?oc=5
2026-02-19	Google	0.0	Vertiv Holdings Co. $VRT Shares Purchased by L & S Advisors Inc - MarketBeat		https://news.google.com/rss/articles/CBMivAFBVV95cUxQU2ZMRkxHZXVzckxiSGVSLUdBRXdPOWN0LVR5VHB6UzQwV3R3MEhIYVUyNVdqQ3d6OXZJU0FJN1BiRGs4bkR2RXltdDM2dVR1RzFRdkoxTEIyZV9sdTJJdXlvSXUzTTNoRld3YjNwanliNEY4ekpCMmRteVJlOHZqR0EwdU80MEwyaEZES1Mtd09TMXhiMjlpQmNtcFZ0OE01d3JDcms4VDFxZGxqRGhWbmlDbVgyNGRrRVlYUQ?oc=5
2026-02-18	Google	1.0	Best AI Stocks to Buy Now and Hold Forever: Nvidia-Beating Vertiv - Zacks Investment Research		https://news.google.com/rss/articles/CBMiqAFBVV95cUxQUTJSeEl0NEpJN0FIRktHRk9jWDh0b1M5S0kwWC1WV2phRjNwT1NBVzNxb2FCQUtKZExHNmNYS1ItUHZQRHN4TWFJaHd2eC14OENYUTBaOUhPbnVMYkhDSk13Q1paeWxvTUdsT19LaC1yMmNYQ2JCclRJelBMa1BVbXcyc0h3VEVYM2N1cVFkTE9nYUlOXzhPaGt6ZU5saWFZc1BqYWpvWE8?oc=5
2026-02-18	Yahoo	0.547	3 Cash-Producing Stocks to Keep an Eye On	Businesses with strong free cash flow tend to be more adaptable and resilient. Some of these companies shine bright by using their cash wisely to strengthen their market positions.	https://finance.yahoo.com/news/3-cash-producing-stocks-keep-043334716.html?.tsrc=rss
2026-02-18	Yahoo	0.5	Best AI Stocks to Buy Now and Hold Forever: Nvidia-Beating Vertiv	The AI infrastructure stock's upbeat 2026 outlook and Wall Street's reaction highlight Vertiv's (which works with Nvidia to solve AI cooling challenges) increasingly critical standing in the AI arms race.	https://finance.yahoo.com/news/best-ai-stocks-buy-now-201900310.html?.tsrc=rss
2026-02-18	Google	0.5	The Top 5 Analyst Questions From Vertiv’s Q4 Earnings Call - FinancialContent		https://news.google.com/rss/articles/CBMiygFBVV95cUxPaTRTQk9CMTh2alMxZTN5czFPeU92Y0Vka3N1MkxBd1hMYXF4M2dmWnh2VEQ1Z0c5UnQ4bTNFSzJrUlhpTE15c0lKSm9QLV9ab25fM2RNc0hzcEpBenNSVmo5MmZTd0pkT2wycno4SXFqUDhYeWpLNTZobGI4RmZtQnpPSzRNbElwQXZ2UlJEdjFQZWM3YkZMOG5LakdpT2U5dm9tbzlrVDBLM0pIQWpxWHg2S0F5RG1DbjJQclZBZElDeFBqbkFscEx3?oc=5
2026-02-18	Google	0.5	The Top 5 Analyst Questions From Vertiv’s Q4 Earnings Call - The Globe and Mail		https://news.google.com/rss/articles/CBMi1wFBVV95cUxNUmJ3VDl1cGVJZjBMOG9YdGgyWHl5bWlsNHhVWWNoVk04UXNCMEN0Tk9YTTh4d24zc1BoTGF0YU5SU3h3dTNsN251UE04SWZTQ2xDa29xd3RkRE5qZVBheGsxS2JNRTR2VVdZc2NBVU1CM05KYlNpTnhzX3dCZGxkSFp5LXNVd0llVm5aOGhMdmdhUkpGVkttS2lvSENTVTBfNjh2ZXN6OG9YX0hsdWtFam15aVktNEFTWWhxeHhhUDlmR1dVYzdkUnhmX0g0LTNMMXNIZ1UzVQ?oc=5
2026-02-18	Google	0.433	VRT: Prefabricated and liquid cooling solutions drive growth as margin outlook and investor sentiment remain strong - TradingView		https://news.google.com/rss/articles/CBMiqAJBVV95cUxPRVpPaG45dnVadjhLWHhjSkZwdElmczdiZF9ZOGlxTUJ0cDlob0FwQVJtUlRvVDUwc2czLXhNcTVvcDNJbENTY05zTVg5YVlVekhER3ItZnZPYXl0UzNvYVJTU1VybzZ3OHpwOFdZdzBlbjdPZ2hXVXFkNE91aVlsM0pzS0t5ZWFpS1lrSlZqZ1RDRUNfUUxoYVpJYXM2T0VyS1haeUxGMGtocUV0NWVQNkZSZmV3QW5ud0dKb0k2VHJ3eENvQWRGQ2ZtT0dwWnRjdk55SzhobFV4N2pyc21seTZxRDl5X3VNbld4cG96X2c3X2tESm9xTzZ1clVkNERqZGJ5cm4zMkNpdk9ZV0JYZ2VidFAyZHVpZmRraTJZeVZCU1BrREIzSg?oc=5
2026-02-18	Yahoo	0.276	The Top 5 Analyst Questions From Vertiv’s Q4 Earnings Call	Vertiv’s fourth-quarter results were met with a strong positive market reaction, as the company delivered robust revenue growth and exceeded Wall Street’s non-GAAP profit expectations. Management attributed these results to exceptional demand for data center infrastructure, particularly in the Americas, where sales surged and large customer orders drove a significant increase in backlog. CEO Giordano Albertazzi highlighted that “fourth quarter orders were up 152% year over year and up 117% seque	https://finance.yahoo.com/news/top-5-analyst-questions-vertiv-053851301.html?.tsrc=rss
2026-02-18	Google	0.2	APLD vs. VRT: Which Data Center Infrastructure Stock is a Better Buy? - Yahoo Finance		https://news.google.com/rss/articles/CBMieEFVX3lxTE9xN0VKX0gyY0FUVXRZUXNsMEZDNjZVSjZvbVNuVmRzRGFaNVVEMGlmVjFiRjVVQk5kalgxV0hfUkJqbDRHT09TaGlTTS10NmJqTmxzU3ZZR3BmdVhWUTViSktJYnVKZlJWeVFUcVBzMlppUTRndlNHWQ?oc=5
2026-02-18	Google	0.2	APLD vs. VRT: Which Data Center Infrastructure Stock is a Better Buy? - Zacks Investment Research		https://news.google.com/rss/articles/CBMiqwFBVV95cUxPeWdUdUVTRXRreG12bFhkQ2ZheTROSFV2ZURwNXQ1Y2I3MDBTVUlfckVDQWpKdVpsUkk5bzBSUURwYVVfY1k1YzA4VDdwMW81WVpfbTBkWjN2RVlZeS1sNXhRTzdxQ05NV211ODRtLXRkX3RSQTRtWHV5SmVkckNta3FsUmI2N1MzU0xkbzk1REtoSjNCTlh2a29YY0p2Yk91QmlfRUdhNGJnSlk?oc=5
2026-02-18	Yahoo	0.15	This Artificial Intelligence (AI) Stock Could Be the Steal of 2026	Investors looking for an AI stock that's growing rapidly and trading at an attractive valuation should take a closer look at this name before it flies higher.	https://www.fool.com/investing/2026/02/18/artificial-intelligence-ai-stock-steal-2026/?.tsrc=rss
2026-02-18	Google	0.136	Drew Sidora teases new 'RHOA' season with 'VRT' — and gives update on friendship with Porsha Williams - Page Six		https://news.google.com/rss/articles/CBMivwFBVV95cUxQdmJ2b2w5WFB5b2VvQjJDUmMycFhTTnFGMWJtWS1PM2VXS3NXV2pVRjJHZnN3NEtpWFdURjVtMmVTV1A0RnpxR3dIbm95NmoxYWk4VVROclNaVFJ3QlAyUDlheVQzcEpKV1JUMHQzRzQyRnRPX1lXVlRpa0tiTnR1Y3JOMGFINDlPQXhwNUZkWFU0V2N5QzYzeS15RjItbVJzMUs5S0NJMWpnQVEwdlAtYmlaVndBcTdCVTdDMnhBZw?oc=5
2026-02-18	Yahoo	0.075	APLD vs. VRT: Which Data Center Infrastructure Stock is a Better Buy?	Applied Digital's multi-megawatt AI lease pipeline squares off against Vertiv's end-to-end power and cooling stack in a high-stakes data center race.	https://finance.yahoo.com/news/apld-vs-vrt-data-center-145300916.html?.tsrc=rss
2026-02-18	Google	0.0	Vertiv’s $15 Billion Backlog Is the Loudest AI Signal in 2026 - MarketBeat		https://news.google.com/rss/articles/CBMingFBVV95cUxNOGwyUmpFcWpUOF9wdUc1di0zbTNDYS1BbUVraFVDbm1MMkU3YUx0ZVJQcUZHdG80LTNTbWhFN3lGSHFUeEN6WGVjSTZWNDk1UUpCMU4wLWx3aFFjNi1FZFAyQTQ3RmtSTXV0NGpjWkJ5MThYbFh3cEVsUzhiMW5POWpPOFRFYzlQQlUxTVcxQzlObWFFekJ2UVp2NVlydw?oc=5
2026-02-17	Google	0.5	Exclusive | Melissa Gorga, Salley Carson and more reality stars get flirty at VRT’s ‘Flir-Tea in NYC’ event - Page Six		https://news.google.com/rss/articles/CBMiwgFBVV95cUxPeFRwbVRSQW51bml0TVUwbC1FQXl5MmxoNExQUFB6T2c3aWxVLTVrQV9QOEtBNk1EdEVoWXZSZHNIZTZDdTBSSzluVEw1MHVpb2tzLTh5R2tEa3dmWnBEbk8wejVrenhNYkthaHcydE1obGF6WXFra2NWQ3VVdC1ONDVnOG1ONlRJRlJGbmtrZFh2ZjJTNHZ4Q2ZUUTFiS1drVWxmQW5CTUtudVVrckFfNUVMTS1KRHhuZmxMXzVENEg1UQ?oc=5
2026-02-17	Yahoo	0.256	Vertiv Gains From Strong Orders: Is the Growth Thesis Strengthening?	VRT's orders increase 252% in Q4, lifting backlog to $15B as AI-fueled data center demand powers strong growth momentum.	https://finance.yahoo.com/news/vertiv-gains-strong-orders-growth-162100849.html?.tsrc=rss
2026-02-17	Google	0.25	Watch: Melissa Gorga, Salley Carson and more party with 'VRT' at $27 million open house on Billionaire's Row - Page Six		https://news.google.com/rss/articles/CBMiyAFBVV95cUxOQjktWVJ0R2d5ZktRdnZmLVB6b2otSXpSSkF5aUQ5NURFZ2dJUU15TmFzaEZIRmJnRkFhOEUwbW9rTGdWWkJEeFZZYm9yb1N5U0N3YkVBSk5mZ19xMndnd0JrTVBPblNscl81UGMyRzVIclM5QV8tWkhZMUtQLW4zYmRTYTRVOG13b0ZHLW9INHRwSk0zQVZnblRhUGNURWdEbW1XZ2ZTQnpOODdSY0tFRjNhMS1QYlRWX29XTTY5VlNUbVo3WWpxSQ?oc=5
2026-02-17	Google	0.0	Vertiv Holdings: Blowout Q4 Keeps The Bullish View Intact (NYSE:VRT) - Seeking Alpha		https://news.google.com/rss/articles/CBMingFBVV95cUxOWGZJUFNjNlBieVJkSDZFaktGNXZ0aFk1WlZOd0c5eTN5NTZScU0zcXRQUjFHU2RmZ09od1IzUXRWcFBGUk95dk14el9Mc0lCTXYzNkZSV050a0FUME5acEFaT3VMdmRQQzdMcXZobG9aNWNYN3BQUVo5TFZFUDNkMnhmM1dPR0JQZ0o1U0VJN3Z2bi1NbG1WTFBxMmw5Zw?oc=5
2026-02-16	Google	0.1	Analysts See Further Upside in Vertiv Stock (VRT) after Stellar Earnings - TipRanks		https://news.google.com/rss/articles/CBMiogFBVV95cUxOVFRRUkxxclNqY0k0Njc0WXVNaVFWZlVHOUxsR1RmQmxZVUotTXRXTnNMWHpsY2M3cXVqbEhON1BYZndHU2hOa0RoMm5FZUR4Wk51Y194YkFVRm5tSjNnNF9ZUkxxekxXaVJGMjNkUzNVRGxvdkM5WllQNHR6MUZTLThzaHotSlBBeEVOdnFLbV84U3BIVW1wWlkxTUJFUnRGbEE?oc=5
2026-02-16	Google	0.06	Vertiv (VRT) Upgraded to Strong Buy: What Does It Mean for the Stock? - Yahoo Finance		https://news.google.com/rss/articles/CBMiggFBVV95cUxOMjEya1hKRE0xMVptcUltYUd1TmNTaXdzeEo3cGxkOGk2UzRBZGFjYjB6VFYyMGo3bFI5LWRDRFJ0MXBUNGdjT21yZGg4LTRraU1mb1ZaWUlLMjFIN0ZMYTRlTzkxeXVyblJLUkVXUXpVNjlpVzM0OE5SOFota2o4ZjF3?oc=5
2026-02-16	Yahoo	0.001	Vertiv (VRT) Upgraded to Strong Buy: What Does It Mean for the Stock?	Vertiv (VRT) might move higher on growing optimism about its earnings prospects, which is reflected by its upgrade to a Zacks Rank #1 (Strong Buy).	https://finance.yahoo.com/news/vertiv-vrt-upgraded-strong-buy-170003722.html?.tsrc=rss
2026-02-16	Google	0.0	Vertiv Holdings Co. (VRT) Is a Trending Stock: Facts to Know Before Betting on It - Yahoo Finance		https://news.google.com/rss/articles/CBMigwFBVV95cUxNUU52U29jOVJZcjZzSFpmcjBxTzRvb1I0OXdWSTgxQnVfRTBPSnZEY0J5VjdHNThNXzlTOUFWT3NHU1JEN3hxTVJyd0J6dTd1SzR0c0RiV1kxQ2gtV2gxZkVCTExfbWxnRk9WUXZSRDdGRWRkVDloYzFjUVJxRkk1dHdVdw?oc=5
2026-02-15	Google	0.6	Vertiv (VRT)’s Orders Were Incredible, Says Jim Cramer - Yahoo Finance		https://news.google.com/rss/articles/CBMihgFBVV95cUxNek14eWZrTk5mUzlyRkV4aFFWNk9ScTFVclBDa3lEVXNJRmtXdVZVbVE5QUNqS2c2MTkyc2hzdEIwUVQ3dEVmX1RySEdGWWxkcll3MlFxcmFic0V6OXZTZWJ1SXk1akxBaF9PX0lTbGwwZm9taF90WVlVcGJHUVNnMjBCTHFBUQ?oc=5
2026-02-15	Google	-0.4	3 Cataylsts Behind Vertiv's 20% Weekly Jump: 252% Order Growth Fuels 2026 Guidance Boom - 24/7 Wall St.		https://news.google.com/rss/articles/CBMixgFBVV95cUxNVHVMLTFxbFdtNnc2eDhhZDVWMXZwRC1RUGpWdmxBREh4bHNnTW9WY3M0WXRwN2hlX1p2M1NOZGlVVU8xM2ptZl8yZWREYjVfaU5FV21fZG9GY2hrZGQ3WEdBNjY1LVBLLWRPcTJMaDluUDRESER5clBNNDBFZjFNSGEtUGNVMmJ6aERXaURmMS1aVERLWEpwM0FQaFJKQzJoZGp5WHJiRk05U1BKLS1rbnBmOURQb1E1OXdLWUdXYm1SUTZHZ1E?oc=5
2026-02-14	Google	0.433	Vertiv: Robust Outlook Predicated On Strong AI Capital Deployment - Seeking Alpha		https://news.google.com/rss/articles/CBMiqAFBVV95cUxOd2tNU25qbXFaSmFIaENXNFV1RzBBSjl0b3daeWV3UWpkWWxWMXdTUjR1OXVkdVF0RnJSTXBSdFMzNWlNdlc0RFlOMTJ5LTR4cmJWQ3ZXX2pwc1NkLWhzY290cjN2Mk9DRWRPR1lhNGRqM2tDREQwTGFvampVemxBV3lzWnpOclZvcE5wZ1hHUVhYMHc4ZDB1QVN0elplXzdQX0todUNtT1k?oc=5
2026-02-14	Yahoo	0.138	Vertiv Rides AI Data Center Demand With Record Orders And Rich Valuation	Vertiv Holdings Co (NYSE:VRT) reports record organic order growth and backlog linked to AI data center demand. The company is expanding capacity with new facilities and higher production output for power and thermal infrastructure. Vertiv is pushing further into AI and liquid-cooled data centers through investments and acquisitions focused on next generation infrastructure. Partnerships with large technology and data center operators position Vertiv as a key supplier to AI-driven...	https://finance.yahoo.com/news/vertiv-rides-ai-data-center-150839462.html?.tsrc=rss
2026-02-14	Yahoo	0.0	MarketBeat Week in Review – 02/09 - 02/13	Stocks were headed for another down week despite encouraging economic data on inflation and hiring that continued to support forecasts of a strong economy	https://www.marketbeat.com/originals/marketbeat-week-in-review-02-09-02-13/?utm_source=yahoofinance&utm_medium=yahoofinance&.tsrc=rss
2026-02-14	Google	0.0	Vertiv (VRT) stock price heads into holiday week after S&P upgrade and $290 target call - TechStock²		https://news.google.com/rss/articles/CBMipwFBVV95cUxPZ2hsZ1RVemlDSkVDd1RMMVZpNWwzMnVMdWpDUG1sTGs2TEE0SW1SRG81ZEdtX05BV1dfaW9wajJnQ2dhc09ORW5EUXJaQWdTeXA4QkJRRkNVeVJRUVpsNzE5YjA0dUk5TUxfV29BSmI1bW9Ba2ttUHZiVlU5bWdDYTlrVmJuSnU3ZDcyZUJjZFJzclFPdnBURmREOV96c2IwY25tNURINA?oc=5
2026-02-14	Google	0.0	Vertiv’s Record AI Backlog Puts Valuation And Growth Assumptions In Focus - simplywall.st		https://news.google.com/rss/articles/CBMi1gFBVV95cUxONGY3RzZKRlI1V1VBal9CY3F6akZzeExoTXg2VDBuWTNtMEVjNVNxR2Z6aEVvOTVsb3RFWDlocU80UjJRMnNYWlpCRFltbS1KU0xHSGpyM1dsdERIY0dmMVRGakYwSXRtYTA4cGxLMnExNDdpUGE0TGZDZTZWVFZmNmJJSWRtaGRYWUdiempWODE2NVRFU0w1MVIwRHJHXzZfbnlXdEVjWEFhbVd0MFpibm0zRVR6U2JHd3hHZXdYbmVablRtV3plMVUtSjlkNVRHV29SWVdn?oc=5
2026-02-13	Yahoo	0.5	See How Inflows Make Vertiv an Institutional Favorite	Huge earnings and data center demand see Vertiv Holdings, Co. (VRT) shares rise 1,360% since first outlier inflow in February 2023.	https://finance.yahoo.com/news/see-inflows-vertiv-institutional-favorite-141517624.html?.tsrc=rss
2026-02-13	Yahoo	0.394	GM Stock Can Move Higher After a Strong Year, Says Analyst. Plus, Cloudflare, Vertiv, and More.	RESEARCH REPORTS These reports, excerpted and edited by Barron’s, were issued recently by investment and research firms. The reports are a sampling of analysts’ thinking; they should not be considered the views or recommendations of Barron’s.	https://finance.yahoo.com/m/efdceb6e-171a-326b-9b3e-63d676fb2213/gm-stock-can-move-higher.html?.tsrc=rss
2026-02-13	Yahoo	0.16	Why AI Stock Vertiv Zoomed to a 52-Week High This Week	The AI data center play expects significant growth ahead.	https://www.fool.com/investing/2026/02/13/why-ai-stock-vertiv-zoomed-to-a-52-week-high-this/?.tsrc=rss
2026-02-13	Yahoo	0.0	APLD's Energy Strategy is Evolving: Can it Drive Further Upside?	Applied Digital ramps up on-site power and advanced cooling to ease AI bottlenecks, aiming to speed campus energisation and boost compute density.	https://finance.yahoo.com/news/aplds-energy-strategy-evolving-drive-151500898.html?.tsrc=rss
2026-02-13	Yahoo	0.0	Stock Market Breaks Key Levels Amid AI Disruption Fears; Cisco, AppLovin, Arista, Vertiv In Focus: Weekly Review	The still-divided stock market started the week strong, but the Nasdaq and S&amp;P 500 fell below their 50-day lines amid AI disruption fears.	https://finance.yahoo.com/m/f8c6edeb-6851-3cb3-8557-caa2dd7d2df9/stock-market-breaks-key.html?.tsrc=rss
