Date	Source	Sentiment	Headline	Summary	URL
2026-03-05	Google	1.0	Best ETFs to Invest In, According to AI Analyst, 3/5/2026 - TipRanks		https://news.google.com/rss/articles/CBMijgFBVV95cUxQMk1QZ1ZXSXdPWnZmcnQ2bGN2MC00QVRPNjZtRUJjMkpGSUFENktNQmdrTEsyRVNQM0pFLWV0d3BzOXVfZEEzYm5MZnVQaEwwTkxNcUYwUVNCVDU4SUJRSi1JdGpRVzIzaWRpVmVmN2ZXd2NhdG50X0RSeFZhcWx4aXk4LVdhcmxYNGJVZzB3?oc=5
2026-03-05	Yahoo	0.266	3 Total Stock Market ETFs to Buy With $500 and Hold Forever	Total stock market funds make some of the best long-term investments. Here are three that combine broad coverage and ultra-low fees.	https://www.fool.com/investing/2026/03/05/total-stock-market-etfs-to-buy-500-hold-forever/?.tsrc=rss
2026-03-05	Google	0.214	VTI, AMZN, GOOGL, AVGO: Large Inflows Detected at ETF - Nasdaq		https://news.google.com/rss/articles/CBMihAFBVV95cUxPUkpwbzJEdnh2OXVPdnZzZkgxcGM0Y0ZoN3p4dDdlLWQwUWVLSkNybXBqY0xocWhqWTBaSnZlTUZnVER0bjA1eVdadEZsSjN0Q1dPRGtiNDJweVFvdEhPRHN1THVMNG05Yl95Z0xLWDB0UU5uSGhNRGY2T3Fvc3RSeE15MFo?oc=5
2026-03-04	Google	0.487	VTI vs. SPY: Which Popular Broad Market ETF Is the Best Choice for Investors Right Now? - AOL.com		https://news.google.com/rss/articles/CBMid0FVX3lxTFAxbHlJTjRhTDNyOUcxMWhPRWpUc3NPR3oybkxKVHJXb1hJRGd0b3hsd19vMjd5WkJQcnRabGFQdnpKZzFDY1ZyUXZhNzBRQWh1T0RJNE5HamU1cHRVRFJHbWtKUHZXWWVWeVk3SkYzSmt5YWlMa1BR?oc=5
2026-03-04	Google	0.0	Vanguard Total Stock Market ETF (VTI) Daily Snapshot—3/4/26 - TipRanks		https://news.google.com/rss/articles/CBMikAFBVV95cUxQTVNfc2JXUEI0a1RJSkRrWk1xSUhfVXNBamhhVkRUT05wVkNVenEwbEJWcUZBTy1SNjkzb0ZaNTlWZE5oalFFTHZXbjdNaEtWYTYtREFFTFdybHJXckJRNUhhS2wxcTlodGZVNUx6Vnh1RVgwVkhWX2JwMVFMeGFILVBBV0VwdFNOX1ZRUmlyTDk?oc=5
2026-03-03	Google	0.062	ISVBF (iShares) vs. VTI (Vanguard): Comparing China and U.S. Broad Market ETFs - TipRanks		https://news.google.com/rss/articles/CBMiowFBVV95cUxPczQ1Zm50NzdoQ25SZUd5a2ZBVzkwLU9XT3ZleTBXOTFMcFFpSS1MUUExZFRmWUM1cFlrenZqMERiaDEtR0g1Y2k3eUxVZ2QySFVKQVZLQ2tLaFU3c2NyZklYNnFuQk5Ca1hJa3lQd0VsMHdFOGEtOEc5N1FnNUpaSUNYY2tGOGtLSDJxTkFicTc2TGg5b2JvWHRZOXZlQnJGdVRR?oc=5
2026-03-03	Google	0.0	VOO vs. VTI: Which Vanguard ETF Is the Smarter Buy for 2026? - TipRanks		https://news.google.com/rss/articles/CBMikAFBVV95cUxOSldXNVBfTlpFZDdETmZhd29Wbjl0V3FiM29PQWk2UGhFeVRsb2l3d1hiLXZzcGVZRVViNnF2RndIYklaT1dleHgwaXBGSHduQXktRlM4UmExczV5YndQVkRGNGJWQXU4VGJUUVRfLUxyUXBSeUE0emFLV1czd05kcmw2dnVseW1sVzZ4SmQySzA?oc=5
2026-03-03	Google	0.0	VTI Stock Today, March 3: Mega-Cap Tech Slide Drags ETF Lower - Meyka		https://news.google.com/rss/articles/CBMikgFBVV95cUxPa1pqeFYxWFQ4a3lDWkIyRS1zU3BXcG84VmZnNlAzaWRpal95RE1WeWZ5MEFLTEdEdTNjNFRpSlp2VGNvZDhjVHdQUFh6T0NWWFk0VVJFT0ppbzdPU3NBLUQ0c25BN1ROdDdCTjVjTEJLWVR0TEJIS3F1VUxTc2tGR0RaZ3FOaEVYUlhiWjNkRnYwUQ?oc=5
2026-03-03	Google	-0.078	Why Is the VTI ETF Down Today? Daily Snapshot – 3/3/26 - TipRanks		https://news.google.com/rss/articles/CBMiiAFBVV95cUxNemExMktZUVRJeldJeG9DbWpYODExQ19UWmJWMzcxSmE3UmpSQlRjX3ExRFhUNmJRSlE4WnFKa081VEN5Y3VMSGhwRllzY2ZRTjZNUkFxWE9LTktYTmRNbVlnei16bmxWSjZFN1dCTTdiazR1WDVPaUM5Wm5qak1fVWl6SlNSZzcx?oc=5
2026-02-27	Yahoo	0.24	Is Vanguard Total Stock Market Index Investor (VTSMX) a Strong Mutual Fund Pick Right Now?	Mutual Fund Report for VTSMX	https://finance.yahoo.com/news/vanguard-total-stock-market-index-120003658.html?.tsrc=rss
2026-02-27	Google	0.0	"3 ""Set and Forget"" ETFs That Could Fund Your Entire Retirement - 24/7 Wall St."		https://news.google.com/rss/articles/CBMipwFBVV95cUxQRmNpclVVeWpXcUxkd1ZQV2ZQZlc2MzlOUlRuQTl3S3g5a3o5MjVGQXNfTXotdkFnSzdxNDBCZEFLQmUyNVpKREd4MGpyUXlzakxYZVVrRHozQmNWckpxOXNhOXBXMVhRcWFBd2JVcXpNXzNQSFlLY05oVFJSM3VHUFQ2OGhPVTFoT0dfUmxCZmI0bGY1Z1ZabnVxcHpJVnZBakFvWWxBbw?oc=5
2026-02-27	Google	-0.156	VTI.CN stock down 66.67% to C$0.005 on CNQ 27 Feb 2026: risk and model outlook - Meyka		https://news.google.com/rss/articles/CBMiowFBVV95cUxQc2N5Y3IzOVhBT21QLVljdU1wcDJTYmt6N2JWMzdlYk44eDdOUGNNMjVLcEl2V0ZtdmZhM0RfR296ZEprREgxamVyeEVtU1R6TXFQcUx4bjdTM2tLU2FqMnp2Q1JzN1BPTEVvSU96aFpwY2FaNGJNa0NwZU4zTFR2VXptNjlmM2p4djlxeW9ZRzBJXzhad2ZNU0FzeUMtdXJqb3dn?oc=5
2026-02-24	Google	0.167	VTI ETF Inflows Hold Steady Despite AI Sell-Off – 2/24/26 - TipRanks		https://news.google.com/rss/articles/CBMijgFBVV95cUxObUowVGJNZFVyb2pYVDRCamlhOVBNWlJPWS1OcFlMQ0dhNnhPT0phTXhyVVJjbWU5Y3lfVGNoVkZ4WUhZd2NvNFBPNkFKZXhEb1REUHh3SUJESXRjMlZWQWJNWlIyV2xmU2J6QkV0amtCYnV2TDhVTUFFdHBQRnZPM0lqYkNTWmYzSmFrSU93?oc=5
2026-02-24	Google	0.0	VTI is up 0.5% today, on IBM stock price movement - Quiver Quantitative		https://news.google.com/rss/articles/CBMijwFBVV95cUxOODBOZDItWHM3UlFLWGkyZDBBMDE4V0MtTFBxNlI2OUZyNVNrYVBUMlMtYllLUXp3RzAwWElnR0tCa3dEMk5ULUhuaXVzWGphWkNTZVJVQkduVnJ1aFNBS25EeHp3cnhZQUd3OVd3TWd3ckFFM3AtVjlSbFZmeDl1enFiQmwzNk8tdmpRSm5KMA?oc=5
2026-02-23	Google	0.331	How Broad Market ETFs Like VTI Can Support Long-Term Portfolio Stability - The Motley Fool		https://news.google.com/rss/articles/CBMijgFBVV95cUxOMFp4VTJxcERaNG4tQ3lobTlENjJ3SndZY2dRRDVlOXBQWFNsY3VaSWg3MFZpbktzRjNmZmVpMm1tbHRIWjJjTGdiZC1RUC1WMHVGbjNQV0pGcUNGUHhUanVoUGhoelFFMnhKMVhsbTFndnJnUVhnVzFJcG1QUmxXWHdEbXY1ZzZNSjBsVGdR?oc=5
2026-02-23	Yahoo	0.19	How This International ETF Could Complement a U.S.-Heavy Portfolio	Many U.S. investors focus solely on the S&amp;P 500 for their portfolio. Adding international stocks makes it built better for the long term.	https://www.fool.com/investing/2026/02/23/how-international-etf-can-complement-us-portfolio/?.tsrc=rss
2026-02-23	Yahoo	0.107	Smart Move? Institutional Investor Exits Position in This Vanguard ETF	A wealth manager recently dumped all of its shares of the Vanguard Russell 1000 ETF.	https://www.fool.com/coverage/filings/2026/02/23/smart-move-institutional-investor-exits-position-in-this-vanguard-etf/?.tsrc=rss
2026-02-21	Google	-0.2	VTI Stock Today: February 21 Snapshot Pages Show Missing Data - Meyka		https://news.google.com/rss/articles/CBMikwFBVV95cUxOZ1F0RFRBUTAwWFM1RGlXYnRGOWlZbllMZjZ2YUJHVWFFNHkxU1BhUGg0TTd0VThjcW8wX0JYckxKcXFTMy1PZ1NPWnFCVFY3WEJuanVLSTJETEhkT2hLSnJpbDJFeVk5UXZfWlhxMFJVeUpaZVF5eXBFNFNua3dkWFh3aWFSdHZPXzZNUm9oUDl4dTA?oc=5
2026-02-16	Google	0.25	VOO vs VTI: Which Vanguard ETF Is Better in 2026 for Long-Term Investors? - EBC Financial Group		https://news.google.com/rss/articles/CBMingFBVV95cUxPU2F2RVdOdkh3TDZWRDlvUlhYWllDNnJrS2hTX0NBdHQ4SDVObnoxVC0zR0tUQnJyYUNiV0k0dk03NGNtVTMyYXZBT2gyZEYtM0syN3V6MWVnZDZjMnR3SGIweDBWTjRWZmlOa0ctTTd0Y1IzTk9NUXJPNWdqT3ZUc3JMVUJPbU9yeXBGbk5sdU5Rb09BLTFYeHFGM2lxdw?oc=5
2026-02-13	Yahoo	0.0	The Only 3 Vanguard ETFs You Need for the Next 30 Years	Investors often overthink when it comes to building a long-term investment portfolio. With multiple sectors, companies, investment options, and alternatives, they tend to chase returns and forget about the long-term investment growth. Whether you’re a newbie or close to your retirement, if long-term investment is your goal, consider investing in exchange-traded funds (ETFs). While it ... The Only 3 Vanguard ETFs You Need for the Next 30 Years	https://247wallst.com/investing/2026/02/13/the-only-3-vanguard-etfs-you-need-for-the-next-30-years/?.tsrc=rss
2026-02-13	Google	0.0	Vanguard Total Stock Market ETF (VTI) Daily Update—2/13/26 - TipRanks		https://news.google.com/rss/articles/CBMijwFBVV95cUxPWDhTQi0wck9neUk0QUJpYUYzUWVoSWVYcGRZUnhaazZhcXExdzBJWWdyT09FdGdIY2J6X3d4ZlhBOFRUbnNqQXBaeGtQMnV4WXN2Z3ZHLVJ4Yi14d3U3THZ6RkN6UndMTmZJSGFsRVBqWkZkckMxU2VIWk1yeTRDbkdZQnYxZV9jdWFmWW1RNA?oc=5
2026-02-12	Yahoo	0.219	Everyone Missed Morningstar’s ETF Quietly Beating the S&P 500 by 30%	Most investors treat broad market funds like a set-it-and-forget-it decision. But what if your core equity position could be engineered to favor companies with stronger balance sheets, higher profitability, and better momentum without abandoning diversification? That’s the tension FlexShares Morningstar US Market Factor Tilt Index Fund (NYSEARCA:TILT) was designed to resolve. A Smarter Core Holding ... Everyone Missed Morningstar’s ETF Quietly Beating the S&amp;P 500 by 30%	https://247wallst.com/investing/2026/02/12/everyone-missed-morningstars-etf-quietly-beating-the-sp-500-by-30/?.tsrc=rss
2026-02-11	Yahoo	0.137	VTI May Hold 3,500 Stocks, But Three Companies Control Nearly 20% of Your Money	If you want to own the entire investable US stock market in a single trade, VTI does exactly that. Vanguard Total Stock Market ETF (NYSEARCA:VTI) holds more than 3,500 stocks spanning every sector and market cap from mega-cap tech giants to small regional banks. It’s the closest thing to a set-it-and-forget-it equity position that exists. ... VTI May Hold 3,500 Stocks, But Three Companies Control Nearly 20% of Your Money	https://247wallst.com/investing/2026/02/11/vti-may-hold-3500-stocks-but-three-companies-control-nearly-20-of-your-money/?.tsrc=rss
2026-02-11	Google	0.0	VTI vs. VGSH vs. VFMV: Which Vanguard ETF Is the Safest Bet in Today’s Market? - TipRanks		https://news.google.com/rss/articles/CBMimgFBVV95cUxPMVZha01xSzhNSGJGdnFVaGpXTE1WWFMta0tnTWtkZV9kTVJJa01abW5YdWt4cDlzXzFzVXgxNVpWVHZLZUNkQ0h6TGNFcGMyeWl1TTFuZUZGZ1BEb3VBMnFXRFp3VXJIZUZ2RVlseDhUNFU1bkJfbjhwQlNsZmpMRWU0MWpQd3lqbWU5cWgxMlpfZXM4WG1zd1NR?oc=5
2026-02-10	Yahoo	0.118	Vanguard’s Fund Is Destroying The S&P With Blistering 38.4% Run	If you own U.S. stocks, you’ve likely questioned whether international diversification still makes sense. American equities have dominated for years, and many investors wonder if adding ex-U.S. exposure is worth it. Vanguard Total International Stock Index Fund ETF Shares (NYSEARCA:VXUS) provides a single, low-cost way to own virtually every investable stock outside the United States. ... Vanguard’s Fund Is Destroying The S&amp;P With Blistering 38.4% Run	https://247wallst.com/investing/2026/02/10/vanguards-fund-is-destroying-the-sp-with-blistering-38-4-run/?.tsrc=rss
2026-02-09	Yahoo	0.481	"This ""Set It and Forget It"" ETF Could Make You a Multimillionaire With Almost No Effort"	The ideal long-term buy-and-hold ETF consists of broad market coverage and an ultra-low expense ratio.	https://www.fool.com/investing/2026/02/08/this-set-it-and-forget-it-etf-could-make-you-a-mul/?.tsrc=rss
2026-02-08	Google	0.55	VOO vs. VTI vs. VTWO: Which Vanguard ETF Offers the Best Upside in 2026? - TipRanks		https://news.google.com/rss/articles/CBMinwFBVV95cUxOVEhkb1FkQjl5eG9pZzF2VnNENGx2ekR0bXUzazVZV3AwcGFPTHVZb0hJTVE3SnVtaDVEaWRFYy1EenhCeHliNXpuRXRDelJMdW9BR2NDeW94N25OekxKZlNTckVFWHB5bGtFNVJrcTFkYmdTY0p2U0R1aHd6VV9nakN6VGVPNUVvNmlOMVlxdHp6cU9NNTBvdlJKdUZOY00?oc=5
2026-02-07	Yahoo	0.51	VTI vs. SPY: Which Popular Broad Market ETF Is the Best Choice for Investors Right Now?	Explore how differences in cost, diversification, and holdings shape the appeal of these two popular U.S. equity ETFs for investors.	https://www.fool.com/coverage/etfs/2026/02/07/vti-vs-spy-which-popular-broad-market-etf-is-the-best-choice-for-investors-right-now/?.tsrc=rss
2026-02-06	Yahoo	0.345	Why I Am Never Selling This Broad Market ETF	Many people use the S&amp;P 500 for the core of their portfolios. I think broad market ETFs are a better choice. Here's the one I own in my portfolio.	https://www.fool.com/investing/2026/02/06/why-i-am-never-selling-this-broad-market-etf/?.tsrc=rss
2026-02-03	Yahoo	0.238	Smart Investing: How to Avoid Mistakes & Build Lasting Wealth	LTCM co-founder Victor Haghani discusses a better approach to long-term investing.	https://finance.yahoo.com/news/smart-investing-avoid-mistakes-build-224200833.html?.tsrc=rss
2026-02-02	Yahoo	0.395	2 Vanguard ETFs I'm Buying Hand Over Fist if the Stock Market Crashes in 2026	It's more important than ever to ensure you're investing in the right places.	https://www.fool.com/investing/2026/02/02/vanguard-etfs-buying-stock-market-crash-2026/?.tsrc=rss
2026-02-02	Google	0.0	Reduce VTI And Extend Your Equity Exposure With REGL (NYSEARCA:VTI) - Seeking Alpha		https://news.google.com/rss/articles/CBMimAFBVV95cUxNZEw3ZExxN0JPNzRmLTlheTd5Ym05QVJJbDNVSzk2M00tZ2pqdjhhcXQzRjRtS0NKbnNIaTRGTXpyS05jQUZYWFlvVjE2MjFERzBxWmFfU3JVLTVCblZ5OFlmVXJEWldjOFM0Q3hIMldpLVBuVXFJb1hCb21kM1lWT3daZzBZay0zdktIbGlaUFNFa25lZXlwMA?oc=5
2026-02-02	Yahoo	-0.15	Vanguard Slashes Fees Again, This Time on a Quarter of Its Funds	The pioneer in low-cost investing now has an average fund fee of 0.06%, or 60 cents on a $1,000 investment.	https://finance.yahoo.com/m/dd49cd25-79e9-3fc1-a1e0-09a727730e2c/vanguard-slashes-fees-again%2C.html?.tsrc=rss
2026-01-26	Google	0.2	The Only Index Fund I Would Buy and Never Sell Is the Vanguard Total Stock Market ETF (VTI) - The Motley Fool		https://news.google.com/rss/articles/CBMilgFBVV95cUxPY0MyTG1YblRSM2FOUmdlY0dSUmtQTFlickd5bWVoZElCbFJiQlRJaVhpR2dhamNJbFVXeUJfb2twQmtTZEZQcWlKYmNUdHVwOHNNVXhEMTNmT2JzMUZfRFk0bE9mUklqMGJvTjQwSlo5anRVaS1rVUxqcWs2bDZOU29FQVktb09vSl8zMXNrSjJSVjROcWc?oc=5
2026-01-21	Google	0.0	VTI: Sell America? I'm Not, But Here's What Concerns Me (Downgrade) - Seeking Alpha		https://news.google.com/rss/articles/CBMiowFBVV95cUxOSjQ4Vi0zbjlQTjZadGVkNHk1eGpIQ0d3azl3dFpSTVF5bXVDRHNyc083bXNfbHZTREJrLXlDRmxnRWZ5eFVfYlBnSEF5bm4ycml6cWR0M1FvZUhwYjdWdzhjUlMwdFV6MG04NVdxZFkzS3lsajZTOUZacEpLdmtaWG5NLWxLWDJJem5ueDcwNnNaVlA1ZWhFeWNUUmRhYzZvTWRn?oc=5
2026-01-18	Google	0.367	VTI vs ITOT: What's the Better Total Market ETF Buy? - The Motley Fool		https://news.google.com/rss/articles/CBMilwFBVV95cUxNbUdabWFlWkpNOGo0WVhrRjhqMTFib1ozSkNnLTNWY1Y2UmpKb1Q5YjZqR19mcW5QLVlmelI5M2xlSUNIenVmMW1QQlppVDVtekhpUnZXOTg0T21femd2VHJSa2NLeWV5TjhGV0dIdDNkM0FjSVlaSzVSQXZ1TWlpVE05dVE2VG9CYWZ5Z05wTmVTVVVDSlJv?oc=5
2026-01-18	Google	0.25	VTI vs ITOT: What's the Better Total Market ETF Buy? - Yahoo Finance		https://news.google.com/rss/articles/CBMiekFVX3lxTE5HNVQyQjFTLV9nMU1JcUg0bUt5T3k3aEt5QWtQcHlaWG02VXU5TmZuSUFXVG8wdHpqckpQVjM1ZDdkbTVYbElpNlRpZWxfWnFpZXkwaFk0TTNGeGd2MGV0dmc1eWNYSEJzU3hYQTlLcGp1LUdvdW9tbHNB?oc=5
2026-01-17	Google	0.5	VOO vs VTI: What's the Better U.S. Stock ETF Buy? - Yahoo Finance		https://news.google.com/rss/articles/CBMieEFVX3lxTE96TVdPZjZ2SHJMSExnS1NTNU5YVXVkM1NQMF9sSXlWcjhXNkFBM2gzdlBPNnNCTzZIbmJRVE8xcWFlMjFPQUZvYVk3cHE0SHpKMjlvZV80ZGVVY1A3b1E4NFJONDZsQmhqS0RJOERRMjEtTkFxSWszWg?oc=5
2026-01-04	Google	0.4	VTI vs. ITOT: How These Popular Total Stock Market ETFs Compare on Cost, Returns, and Diversification - The Motley Fool		https://news.google.com/rss/articles/CBMi3AFBVV95cUxQbzdDOHlCQlh4bE5JOWVPZFZrcFhXeXptcjY0YXVaU01yTkV6WjBIc05NbmZpLTQ3djRqZVo1X0NsZ25McENJdmZlcDQ3VEpyanpadmdhMjZnQ3NaV25WRUNaM3dQT1laX1J6WVhFcjZsZndpVTVDTWN1SGdIU2xoY19LM3ZpV1c4dTBEdjFuNTRYMXR5YWxyWk84dlRkTXdnRWxLd2tMSWI1Z2RMc2UxMG1JdHgxSEFzX2ZvNDlVU19pT25aVlBxcEI1VFZQZlBmRnc5SktkN3o5MTZK?oc=5
2026-01-03	Google	0.3	Looking for a Total Stock Market ETF? Here's How VTI and SCHB Stack Up for Investors - The Motley Fool		https://news.google.com/rss/articles/CBMiygFBVV95cUxOOWFxTWF2V2EyWjVOWmZkZm55dEhzTldLYnp5Y3hrcjRFYmFnT29ldE9Tc2xHbkRvcFVFVjhaOWdzajU1Y2drWHIzT0dTZE9BLWhiNUpvLVYyTG9HTEk2Sy1GRzlWb0ZWT1JveW15bDdKMGx3NXRCOUlBSEtUU0N4RVhyOTBNSW1ZT2dxWEVzcE5kY2JpdGNpZXRsZVBDMU1OYjZOZWxPbDBfWTI0WGh5ZkdOa1VER1RwTGFhc29YNjE4SENuRnBweTF3?oc=5
2026-01-01	Google	0.4	VTI vs. SPTM: How These Popular Total Stock Market ETFs Compare on Risk, Returns, and Cost - The Motley Fool		https://news.google.com/rss/articles/CBMizgFBVV95cUxOUXVOM1hCSXR4cW9GaDlucTBoNnBTTUwzWE1PXzhoemFGZnkyd1FnRm1TRFZpeXQ4bEt0am4wRVRkOF9PN3hOSU9uLUIzYWdWYXRJOTFmaVRlWm1ZQ18tdkQzaG9Pd0hOa3djWURsZDQtX2pzNDZZM0RpU201b1RyMjFhX0ZXMG44UVotM2lsQ2RDcUxXWnZpT2JndHZvdnFLWV9hSWNaYThqOUpqX2pNNW9xRnk3NWk4YmVEVHVHVGNBVTRpdGxEX2lnbl82UQ?oc=5
2025-12-31	Google	0.3	VTI vs. VTV: How Total Market Exposure Compares to Large-Cap Value Stocks - The Motley Fool		https://news.google.com/rss/articles/CBMiugFBVV95cUxOTUw5Ul9ONFRwTFdobVZaazVOaG1YdXVxQ0FQTnBlbmpEWFE5OW80bFVCcG1Yd1c5VWxzZTdmczUzNmMtWGthc0hoMkYzbmdMejY5YjhNSFEtbGN1TGl4TnY3RENlSGJldU9mcTBiYXJNcGZHMFNjdjkwLTdxUTYzT0ZYcVdieEJ3SVpoZjJWY01RVlU4cWtaaGpTem9iUS01MHNHNXhRbThiUWJ3TXMyWV96QWpRYWd3SUE?oc=5
2025-12-31	Google	0.0	VTI vs. VTV: How Total Market Exposure Compares to Large-Cap Value Stocks - Yahoo Finance		https://news.google.com/rss/articles/CBMieEFVX3lxTE5jV0FIb0xvWk9udEpTY2tBR0NmbTVYMUp6V1JWZzliUkhFMjlHQWVoYUNvV2pOUHkyVkNCNU5FVV9JRGV4Mm5KSzFUdjZvOTJ2eFpOQWU5SjIzQXg5OVF3MmR2YklucEpBVTFsYjlhbFJRMlhmaU5IMw?oc=5
2025-12-21	Google	0.6	Why I Am Never Selling VTI -- Even During a Market Crash - The Motley Fool		https://news.google.com/rss/articles/CBMilwFBVV95cUxNbzNGZUw5S2EzeTNaY0JKRFllbmNnTTZ0UEt3RUpBcWo3ekJvVlRYdmVIZDBJeVd6T2NZOTFyTUpaUDRBNllub3NFdGIwYjZOenc5RTJGYzktRWJad3JQYnR6VTRPd2ZmNXhwQXVBZl9fbFlFU1laOUZweG93STVlTmVlSnIzc1lGclRoeWFyRVdkTEc1UERN?oc=5
2025-12-11	Google	0.0	VTI ETF Daily Update—12/11/25 - TipRanks		https://news.google.com/rss/articles/CBMia0FVX3lxTFBfYUFvLU15SHJuVDZWNy1fczVreVRmaGFCVmZsd0JMelhLd2N3YmRhVm9kVlpRbTZhMDZndU5vaVhTemo5ZUxRSWI3WHRvX2RkLUJpZnh4RS1RYWliTko3MGZLeE1OajN2VUFr?oc=5
2025-12-01	Google	0.3	Want to Become a Multimillionaire? Put $100,000 Into These ETFs -- Including the Vanguard Total Stock Market (VTI) -- and Hold Forever - The Motley Fool		https://news.google.com/rss/articles/CBMimAFBVV95cUxQSUZQUWE4cER2anBMMFp4ZkttdVBldU5oaGpkZkQ4eDJsZFVpWGE5MUNOdU9DRjhZb215TjVPbExteWpRTlVnV2FlMU9UUlVEdUdibjIzRUN1SkV0T2RycER0WFE5OVNqMzVCcEQyWGx5Sy1pcGtkNFhrYmt4LW9FUFBVOVpGZzF2Tk84MlNPaTlFQXozcjJodw?oc=5
2025-11-26	Google	0.0	Sell VTI And Buy VBR To Diversify (NYSEARCA:VBR) - Seeking Alpha		https://news.google.com/rss/articles/CBMif0FVX3lxTE01R0VmTlUzeXBJdmZidWp2cDFhaGFDY01IdERRZUtpU21pSjBGZ040WE9xNEpQTThlNExzZFFkOTh5eUoxSFZlamUzaUxYSXpDb3NYQ1FKYkJndTNDMGlQcGluMUdNYXFJeUdONXVKaHQ1Mm5IWlEtSFNzR0wyemc?oc=5
2025-11-24	Google	0.0	VTI ETF Daily Snapshot—11/24/2025 - TipRanks		https://news.google.com/rss/articles/CBMicEFVX3lxTE5GSDBBbDBuUWdHbGhGUG1mZmk5bjZWT1RwYkFTdnJyOGVNWWJ6ZTdDZzRBdExQbjNCdTRKSnVNWWVpQlJURUhtT3hWMllOdXRxeXFXa2pkUlRnQk1RbTctM3dBc2tic2tGaW1ZSTFVVmk?oc=5
2025-11-23	Google	0.367	Here's How Many Shares of the Vanguard Total Stock Market ETF (VTI) You'd Need for $500 in Yearly Dividends - The Motley Fool		https://news.google.com/rss/articles/CBMilwFBVV95cUxNbVFmNXpWUGdPYk53TmFnaDFDVFM4MVBLdHBpcHYwQ1JXY1ptMk9kOVZoQUUxRUp1UmZrb1BUMnFITkJ6UmJURUoyRTdsUVhBY1NhNlNmYVFrT1MwRXdSQ1JkNTBSRmpyU3hVZ1dNUWJzbTFYclZ3WEJoODBoeGhJWnhLWk5CaUo5TWxiaFJhc0xiN3ZLYTdB?oc=5
2025-11-19	Google	0.025	The Clear Winner for Building Long Term Wealth, QQQ or VTI? - Yahoo Finance		https://news.google.com/rss/articles/CBMidEFVX3lxTE83YkNBTERGQVUyRFFud3VheEhRaTFKeWF2RVZWeTRZN1NWWGZ0dGItajNHdDJkejdkMmVFdTZBQ3lIWHk1dlhCd1R0SmlmV3NqUmZYNUFoNy1Dbm9STUxMZm0xS0F4U0NQTE1UeDcxdURUdHdU?oc=5
2025-11-17	Google	0.3	VTI and SCHB Both Offer Total Stock Market Exposure, But One Might Have an Edge for Some Investors - The Motley Fool		https://news.google.com/rss/articles/CBMi3AFBVV95cUxOZWljNTBXMXRDdjFGMEJKSXU1MFp3b194a25RMkdmZ25waWxhdmR4c0llYzBleVdfdy1tV25uc2NNTE1qMnVhNlVrUUhlSm9MTHZQMzZOS1Rtbm9mclNGQmRCRWdzQ1E2STM1b2h3UHBqaGhManlNcE9DLThrNmhkMzBTRGRMUXlyVDBWWXh5UW1ld3BFbHpsR3J1NHM5b01TeUdhX1F2Y1JuSE9iZHdYVllmQXpiamM2MXdXc3NhYmd5TGFjZ1FadmdOWFNvVFViQ1htQVJsOGxzVzVu?oc=5
2025-11-11	Google	-0.05	These Dow Stocks Have Crushed the VOO and VTI in 2025—Here’s Where They’re Headed Next - Yahoo Finance		https://news.google.com/rss/articles/CBMifEFVX3lxTE1LZmxCdVFaRUlYOFA0Q09DdzRhVDNGWHpyQm9WRnZuN19hRlg2VG0zRGN4NVR2UUFjdExzSjBILTJxNXhsTmxROEkwRGR4R2VSbmdGbXlNZ2NTMm9OQ3NsenFidHdYRm9BYlJjRng0VzBMQk5nTWNYS3ZqbmY?oc=5
2025-11-06	Google	0.45	Why VOO and VTI Still Win for Young Investors - ETF.com		https://news.google.com/rss/articles/CBMihgFBVV95cUxPaE90enlnbjJUTkJLaGozY3h0VnUzRlZQaXFxRkIyLV84MkQzVFh1aml0X3RvUFc5V2wxbnRwLVZQcXUtMDRhSlJuT2JxN2N3b01zXzkzZUxITWI0eFNoelBweGVCenBFVG9CWHRaa2FOaDRJX3N4bmMta2FZZFlJSFlKYURVdw?oc=5
2025-11-04	Google	0.0	Did You Need VTI Instead of VOO? What History Says About the Differences - 24/7 Wall St.		https://news.google.com/rss/articles/CBMitgFBVV95cUxNNlVjcUxtbUNNX0s2MkFRR0lLNlc2TDJKandXNndpM3pFQV9JUWxVRXJZcnRrSml2WVN2MEZyQ1BSQTM3TXJJaHpOcWNpdGpqOXZlX0pVVzczVl96ZWZ2bURNazNWT0lvWkFWQkEyYWNvSjlhUFhseUs3ZXRKQ2l2eWs5cy1jaHdJSzlERUEyYVFnSlFwdEZqQmZFQXN1ZUxXU3ozbEpJeFJtQ1F1b0NCQWUya25EUQ?oc=5
2025-11-04	Google	0.0	Did You Need VTI Instead of VOO? What History Says About the Differences - Yahoo Finance		https://news.google.com/rss/articles/CBMifkFVX3lxTFB2eVhnNnVHRlBzeEFOSHlscXJrOU1hX3pJT3h4RnJ4OXAxeDRjWlhwNlhDS1JvTzVWWGMyX0FEYTdLV2RzN1Z5c0t0dEtYTTdzbUNwMlZNMEtqdURNZXRVVHJTRGgtMWZyUXlOZXlIakkweWxNelg3MENhVlNzUQ?oc=5
2025-10-28	Google	0.4	VOO vs VTI: Which Vanguard ETF Will Win Over the Next 5 Years? - 24/7 Wall St.		https://news.google.com/rss/articles/CBMipwFBVV95cUxPbXZZOTFzRm41SjlRNkhheDVLY19EWXhldzExM1hrdTNFY1lFMTNfRXBSbnVPMFozUlNibmNzMkxKZ3d0akNvWHVJbzRVX0VNdzV4UC10UDkxVW9nM3ktV1lHT2NveVRESmptcFZselpYUjluTWxHeURFMVhTbmd0ZXI5dHFfTUYyT3BURHdZaDFFQkpfTDRDb2o5VF90eHJfTVZLbmJQdw?oc=5
2025-10-28	Google	0.4	VOO vs VTI: Which Vanguard ETF Will Win Over the Next 5 Years? - Yahoo Finance		https://news.google.com/rss/articles/CBMieEFVX3lxTE1leW5MaDJVc0ItcWhLdjZRZmNZZTVQN0ZFQk05d0daU3U2V0lac09Wa3pTVHRuTGRBQ2Q3LXJxSzN1ZDY0bjJvV2s3TWRlMEhPN2h1dUdEZVlTdnV1UXg4eTllVkNWdlctM3pWY3FLQlFjdU5haDZyQg?oc=5
2025-10-28	Google	0.35	VTI Offers Broader Market Exposure Than VTV - The Motley Fool		https://news.google.com/rss/articles/CBMilAFBVV95cUxOWTZDTGRsY3c5dlgyZ2ZhNDQ4M3A1cFdOWHlQTTRRYkg0Z1dWUXdUdWRCMHpacHJoc25EbFNRaVNHaHpIV3Rqa3g1aFA2aGZJOFhFRnZGOEZHdzZQalVTQldsQXQ0X3BqU2NxcVdZTTR3TEFmMXE2bm9aQXdkZVlneDNrMEotLWtJVGs0bjF6Zkd2bnYx?oc=5
2025-10-27	Google	0.0	QQQ vs. VTI: Which ETF Should Be the Bedrock of Your Portfolio? - Yahoo Finance		https://news.google.com/rss/articles/CBMid0FVX3lxTE5TU3lIVzJwNXFmWW9JT1FUTlZGR1lOY1NwdWQ2eEsyQTliZXJPb0J6andfU1l6UlliakswczZRTVo3RUFNVFM1LUNrenQwMGtQZXQyVWFZVEVUUVNOOGNwLXY4cUk0c3E1dU9uaE02Tzljb1czaEt3?oc=5
2025-10-16	Google	0.0	QQQ vs. VTI: Which ETF Deserves to Anchor Your Portfolio? - 24/7 Wall St.		https://news.google.com/rss/articles/CBMinwFBVV95cUxOajR1aDRuMXFqQVBDYWFmTDJDTXo3aGhfenFjVURxQXh5NGFmenR0SkxtUGhpN09RaUhvQ3JoX0VKMC1DdXlfNV9COGRpVWdIbXlkcWJtVEVObEgzMUpaN1lWOXFDYU1fa2wtUFo4ZHBrdTE2eXN1dkhsb3B5cGF5eC1ibWc5T25hclJrM1pNOVZzS1hEMzBabFdhaVdNSVE?oc=5
2025-10-15	Google	0.0	VTI Vs. IJR: The Case For A Concentrated Small-Cap Bet (NYSEARCA:VTI) - Seeking Alpha		https://news.google.com/rss/articles/CBMimAFBVV95cUxQa0s1Q1VGS19hQWlDMXlqZ2xYVklOTXVBaDZzb0xIcnJsX3pSc1p4MGpuWGVzb04tWEZmaC1iVkdMTTJ6ZVNpNlI4aGZfNk1qZWNCakE1aDhxWGtwM05lZG5PcmJZcExTMTdsQmp5eHdnYzlUa0x0dFVNMW9ndmQ1bDFWeGMtdHJKLTBHRHhWNzhCSDcwX1RSTg?oc=5
2025-10-06	Google	0.0	S&P 500 or Total Market ETF: Is VOO or VTI the Smarter Long-Term Play? - 24/7 Wall St.		https://news.google.com/rss/articles/CBMisAFBVV95cUxOWl9ZNGFxWU1waTFIQUxUb0ttaXZUWUdxQmRzeWhqUTBTRjVwQ1pUVWVIUjN0UHpCczcxQU9tSEdDcEM0VWpCNEFaOC1uVXlYV2JjM2V2ZENCb2dYbXY4Wnc4MTFHSGFjRHZ5aXhUTVY1SFIxeEp3LVB3ZlczUzE5b3ZoUVdlaWZfSE5WODd1b3ljYzlob3hILUZUaHZrZTdOUVhDOFlsYV9BN0dZSDliWg?oc=5
2025-09-26	Google	0.2	Prediction: The Vanguard Total Stock Market Index Fund ETF Will Soar Over the Next 20 Years. Here's the No. 1 Reason Why. - The Motley Fool		https://news.google.com/rss/articles/CBMikgFBVV95cUxQRzV1Mkxfd3BHTkVVUlpxbkNYNWM4X0c3Z19YendIay1La3lWdDg5N2diZWxnRGlHeEFmZDJYaGJnUktjWm9URzVJT1dqYUxxbzZHUFhTeFdKWmJZYm9rUWxyUHFQSGFjdVRENjduRGRiMjFNVVVuRVBJWjQxT25aSElPUjlEUDdmb0NXN3E4UUNSQQ?oc=5
2025-09-04	Google	0.267	If You'd Invested $1,000 in the Vanguard Total Stock Market ETF (VTI) 10 Years Ago, Here's How Much You'd Have Today - The Motley Fool		https://news.google.com/rss/articles/CBMilwFBVV95cUxOaVA3dlY0NTdrSDFjUlZiOGU4a3VDU3pQZldFRnA1NmprRDZBT0lXOWVablpqV0Q0YlNRMHVvLXRfQVFaOEllVU4xdmlOLXVoRXkxTF9PODZhdHBvWTlBNzhEcTFLd2N1SDdOWnc3THZ1MUFiQ2NhYzF1Yi1DTm1BcXgyZ2xuYUVFYi1TQXJheVZJVVJoT0pj?oc=5
2025-09-04	Google	0.0	VOO vs. VTI: Which ETF Actually Delivers the Smarter Long-Term Return? - 24/7 Wall St.		https://news.google.com/rss/articles/CBMisAFBVV95cUxNQWlrdHlaU0NaOE1qZ2VOekNfWGFnUUw3bU92SzJ1YWt4NUJwM1J6ZFI4ZkdBRXcyR08wa1JDUVV5aDBpeDRzSUxRM1dGWkpZNGVPRC1MTE5DMmIxU2hnbEM1MVV2T1ctcGduQ05uVk9MNE5VS0xETi1MX1czQzM4dUE3bjJkc25HM2pacm5ZeThMTmdGV2V2ZnhLUnI3dkZRZzFERHBqbThSdlJtYXdnZg?oc=5
2025-09-01	Google	0.0	Fed Developments And Their Potential Impact On VTI In September (NYSEARCA:VTI) - Seeking Alpha		https://news.google.com/rss/articles/CBMipwFBVV95cUxNZmdLcDRqajhtckRTYkl3Ynl2a3ZxemlLeHZFbFNwNU5GS3J5TVExTk1iNmtTMmVRcmFkVjlWVjhiN216alFEQS00Qk02NE5SdDllVC1pbW4yVDJPTFlRalRFNzBvWHNoOWhDdWNvV21zWUVkQ2V5cVNmNEN4Nlk2NWRRZE9MeEpHQ0xXR19WZThseEI1dl93VWRQZnVmOXpkQ005YTlpbw?oc=5
2025-07-26	Google	0.5	VTI: Important Considerations For Those Contemplating A Position In This Popular ETF (VTI) - Seeking Alpha		https://news.google.com/rss/articles/CBMiuAFBVV95cUxPY2pUcTREMFI2NU15c3M2ZEthZDFmSDA0a2VEekJWWTFkR3I1QzNjRmlYQjBsaEowRGVETWZGWnNXWUNwTjZZUER5THlzUnJOX3JReE4xRGJ4TmMzTU4yTXlOQ1JIREF4dnF0dFJlcFcyUEY1QmJVUlZ6RUN0bVB1NkxyX2JNajJBNy0yajhvNzRRM3UtWHpHWUNCRU50OVpIR2VZc3Q1OWRMMkhabVZaaTJTUjRYa2I0?oc=5
2025-07-01	Google	0.6	$1,000 in VTI Could Turn Into $12,385 - The Motley Fool		https://news.google.com/rss/articles/CBMihAFBVV95cUxPSG1FQTFwOXJfN2t0UXJnWllYZ2tJZ1VZN1ltSDhlQ195b3cxbXlkQnRIQWp4S0IzbDVVckcweXJZdzdwZFl4UnZGcUdZR05NNGRpaV90RGswSmRFc2Ntdm9qTEZTLTZkOW50cHl5amYzU1NZWHItMkdUR2ZYNmc0eWlsWEo?oc=5
2025-07-01	Google	0.0	$1,000 in VTI Could Turn Into $12,385 - Yahoo Finance		https://news.google.com/rss/articles/CBMidEFVX3lxTE1XN2VTUWF5VjBUVWkyNnF3bHhES1d1R1hsdjBzaC01UW5td3lrdHVZaTRoRGZpVFg0Sm52bGZ3WjBHMUpXQUd3NzM4dWpaYjR6NG1Ba09qZFpsVUV5XzRJTldhT2U4RVhYeHRGQTZOVW43SFph?oc=5
2025-06-24	Google	0.167	Big ETF Inflows of Last Week: SPHQ, VO, VTI & More - Yahoo Finance		https://news.google.com/rss/articles/CBMie0FVX3lxTE9kbXFpTnFma0hTRHp0SkE5Z2JqYWtldFAyRDVkdVAwOEJWdVdNTU5wbjdkd3lvdUVMWjhaVk1kbW5jYmMtOHp0T3AyUWx0YWZGZnVWaWVvZ0N3S0N2a0xWMGZmd2I2LUFKOWM5QjRwUWtSSW9aNHZXMWNHVQ?oc=5
