Date	Source	Sentiment	Headline	Summary	URL
2026-02-19	Google	0.133	Uber to spend $100M on fast chargers for Waymo, WeRide robotaxis - Tech Funding News		https://news.google.com/rss/articles/CBMidkFVX3lxTE94bGdKYVRjZVRITnpwZVdmWVRlNERlcldmUHlWcFRhemVnVjFaOVRKVXlLLWl6WVFPREp0VDU4VHpTWWp4WEg2dGhHc19vRWlLV29LX3VENXlrNnRLTm9pa05OdW1fQy1CUGZQX0IwUF9tV2x3VUE?oc=5
2026-02-19	Google	0.12	Uber: A Rare Opportunity To Buy The Future Robotaxi 'Winner-Take-Most' - Seeking Alpha		https://news.google.com/rss/articles/CBMipAFBVV95cUxOVWdZelkwS3FKcmFTd194QWZjdElXWUlTMW5JY3RRQTFHWGt2eEZWWHN0MmlXc25jSjVJdjBVYTVxRmR6MlNEc1U4cTNQLVZNVFlpZHprMW1ueWdvVkJvd1ZVUXFENWtNT3FSRmN3Yi1oUUZMdmN0TWUzUWxFbTlIcWFQRFJ4WXJZRzdQWWRjS1VvTWwtWXZiUGc2VkNiWjRldEI1ZQ?oc=5
2026-02-19	Google	0.1	Mother arrested after deserting her 2 young kids in an Uber, police say - KCBD		https://news.google.com/rss/articles/CBMiogFBVV95cUxNZGhHTC1ZNHVvVUM4YzFLR2EySndEMmNaVGl5VXpFaFl4QWR6eGxXc2tqLVYwUGNQLTUzTERfMmozV3JHOUEtbThwN3NpTTFhYllLejhQTkdOZFZ0MkZNM3l0UEg2V09WR2k2NmwwYzdTQVY1a2IyVlRIWU9PbUFscUtmU1JscFVDNzQxbDB6a3NpSHZQend4aDlqVTNYU0RILVHSAbYBQVVfeXFMUDhzU2lYcWRhQmttbEZjbGJHQTFJY0IwSTB0eWI2ZmhfUGdEZENra3pzS2cxLWdVUU1xaEtORzR4aDBDZ0hrb0tpWUplYU1OVXBDWWp6YUFTbDd4eG1IZjd3MnYtR2FRWVJ6NldEeEVCMzZkc3IwUkVsMmhtMHRWSTlpYjBDZzZlZnM0TUN0UkdHNExWNmFFV1J3MUVUWWdqdi10eWI4NlZTWjctNG9Pb0xBZGpvbHc?oc=5
2026-02-19	Google	0.091	Uber Moves to Enact Stricter Background Checks for Drivers - The New York Times		https://news.google.com/rss/articles/CBMiqwFBVV95cUxNQmN4VGRkQXJCQXNFRDgzS1ZxXy1SMGlzNW1EVHAzODJpVkk3R0R4ajZCajlQc2locFBIOEVPY1gybzhUcEVfcUJ3RUJ4QVIyQ09YTHByMm1haGJyeFJLR0V0V0RvM0FFX0l0YTlmdVlpYTQwM0hYbVhyZ3FEZmFiMDQyZGlmNm9GcThMTG5QdWZIQWxDV1Y4VlhjeUszYkgzalRHekxTUmRZUXc?oc=5
2026-02-19	Google	0.067	Bodycam video released of mom accused of abandoning her young children in an Uber with the driver in Sunrise - CBS News		https://news.google.com/rss/articles/CBMiqAFBVV95cUxPazRTdVpPZDdYMUxqMU5CNWVQVU9raDlIbkw5cUlhZ3hkeDJpVjFZRkZUUFBsVW02dDlnZ3N2eG1laF9ZRzJaU3cyb3FLc2JLTExLMjRZdFBHb0M0U0RvZ2RYa1pIYXRFaXczNFlURVJvRFdiZGtFYThqU2YxTkFJck9jLUNBOUNCdjlGQjhQbEJMcU5SZkFyR2tBWjFYem14VjhHZks3M0Q?oc=5
2026-02-19	Yahoo	0.014	"Intuit TurboTax Delivers the Ultimate ""Done-For-You"" Tax Experience Powered by AI and Human Intelligence With Uber Rides"	MOUNTAIN VIEW, Calif., February 19, 2026--Intuit Inc. (Nasdaq: INTU), the global financial technology platform that makes Intuit TurboTax, Credit Karma, QuickBooks, Mailchimp, and Intuit Enterprise Suite, today announced a strategic campaign with Uber Advertising to close the gap between taxpayers and trusted financial expertise. As part of the expansion of its Human Intelligence (HI) service network, including nearly 600 Expert Offices and 20 immersive stores, TurboTax is providing customers wi	https://finance.yahoo.com/news/intuit-turbotax-delivers-ultimate-done-120000803.html?.tsrc=rss
2026-02-19	Google	0.0	'You deserted your kids for 2 hours': Mom can't explain why she allegedly left her children alone in Uber while she walked around town - Law and Crime News		https://news.google.com/rss/articles/CBMi8wFBVV95cUxPbTZ0c2dvMEFtbWd1eDJORjhyUzhKYlVqOVZhSmVJWUcxbjhNbHpsRDQyRTFEOFpQMmpScE9aWGRGTHJaQ0RnUDU2QWxMRGJiVGZmZFBscW5lQUhET2JqT1JGZ1lfM3JWc1RSUXUtVWdjaXhGTVNvZUxpNlphQ3l6dm5ndGlKYjNIS3ZLWEdoa1ZoQkQwN3dmemMxcEFWWk1tTXhhSnBSMEl6Y0FVN2Vnb243RDhQdmhNUHhvaDJ3ckdLVktEbUY2Qmh4YnZ2b0wtUVB1Y2FTOG10SWQ0S01ZYnltU05tWHlNR0F6Y3hWUFp6MWvSAfgBQVVfeXFMTzZrSDduX3U5azFFYnZINnUxb2lQWkhvaWN2bmd5eXBrbnhOWVF6UENsb0VNd0hoYXF4dzliSDBBTEZ1b3VfamwzQzJNemsxdlBPSWN5LVZ3WUpjQmIzR3dlcUFYRE1xZDBUMkZUb3laMGF0Um9lM2pTSjI1WDNmcVJmUm9zTzdtdERpYUw0QW9FaFo0N3YxZk4wMTdUd2hvU0V1d2JNbHJ3cUJNY3AzNDVYZ283d1ZFUzdPTEk4US1EdFJiMmhkTEkzRlVaVUd2bWxYeEc3aTJ2Z2c3Y3FxbTJLME9ZY29tQ3NYaDI3eFJLVE1WX2FIN0Q?oc=5
2026-02-19	Google	0.0	AI for investors - MLQ.ai		https://news.google.com/rss/articles/CBMimwFBVV95cUxQX2pkaHJ6Y3F2OVF2MHYzSDRoZHZZa0s2dE0wSGtjSGVKX1RUOVo3eEFjVm1wWU5FNVM3MzZYNU1ETHZhcmRmR2x1RlktS21ZRmlHYW1VR20tdWxpTmtQOHIyRzRUTzZHNjViWGZpbWo5QXY3dXhsa05qbGZpRWFvTTVHQVJ1azBvbGFGNkNTUW8tWGVLcUtVajBjcw?oc=5
2026-02-19	Google	0.0	Bodycam video released of mom accused of abandoning her kids in an Uber - CBS News		https://news.google.com/rss/articles/CBMirAFBVV95cUxQOFQyVG51dkVSaC1TZlBPcXhmMDVvcUlzWWpwVzF5RXZ2S01oZkFzTVdGUzZZQWIwbXU0Smprd09LRVpoU0hBdlMzZDV4enlaRlhtMjBlT2JBcmVMZkM1SVJLQTRpQTlzRzdIOTl4UVVpYVE2alJaLTBNYl9ZZXlDY1BYQTUxc25JYV9STGdPNmRtblpxYXVxdDBLSUEweTQzazdMR1M2d2pna3Zj?oc=5
2026-02-19	Google	0.0	Charlotte Uber driver says he was asked to pick up 5th grader at CMS school - Queen City News		https://news.google.com/rss/articles/CBMiwwFBVV95cUxPTFpKTXpQSnQzdDBNZDFIc25ReFYybW1sbE9WakFpVDdaXzgzTlJ1UFlkZ1g4UkpsOU1PeEV3SzdpMHB6cUdYb0pBdWZTTHhYdVExRllHSmROZ0xldndRdy11LWtqTFdwX3p0aS1zV2ZwVEx2ZzRaU2dmUlFDRVBjZXFsQ2NJTnBmem1ZTGR0X0lfRzFZRUhoYzh4eG5jMHZpMEczQXhDVHhZNllwcmhKbWgtUFdWanhmbVJFc1p5S3Q1eWM?oc=5
2026-02-19	Yahoo	0.0	DoorDash Stock Jumps. Earnings and Revenue Both Fall Short.	DoorDash reported fourth-quarter adjusted earnings of 48 cents a share, compared with analyst estimates of 59 cents a share.	https://finance.yahoo.com/m/81acb6f4-dca6-39a8-9774-fb2dbe38ac05/doordash-stock-jumps..html?.tsrc=rss
2026-02-19	Google	0.0	Florida mom accused of leaving her kids with Uber driver for hours - WFTV		https://news.google.com/rss/articles/CBMitgFBVV95cUxPYktIZXAtTEZnVnJ2OXdMNFRYdF9wZ2tGVHpndDN1ZURKRWdkNmw3VVNoTmJwZ0thYkQxU0xGQUpZdHk0ZmVtMU1ORmNMazJwdTdET01PMjBLWl9ibVZzdU9zVzhRRHVQT25FRUttZGV5T19tbFFiaUI2M3paamhQVWFYMnZZNFAxdWtXMHF1TTR3WEI5b0lMQ2JFeXQ4bnVUcUlOX0RJZnhwUU5kelpEMHF4NFNJQdIBygFBVV95cUxONU9yM2ZjTEUtY1RCZEJoWWVxX0hEMWszak1JMDYxVENvNmYwYm9DdXN5TUZualRIVnpfbGpHM1RIMXBfMUp2b1Z1bV9BWWFkc0dxZkZXVFFEXzVra05iMDg4YS1BaVR5YUtrc1h0MXpzTXU4SlFoT3dBUTc1Vk1sMWFPcl9rajBwN0R1T3lFclU1RGRFbXMxU2JqWGJZM25JWXA4WDZ4X2JaVFpZS29qTkdsMWdCWFFIU2tpMEo4T1NiUjNJc0JjbFl3?oc=5
2026-02-19	Google	0.0	Florida police confront mom accused of leaving her kids in an Uber - wtsp.com		https://news.google.com/rss/articles/CBMimwFBVV95cUxPMDBtSDhMc2VUckpLU1U0anduMEdEaFVuRGlRWGNaNzVjMm1TOVhBVGhCTnBwZnRlajZMMVRxTXBUVFVUT2ZvcWxfLTZnbWJPMUxnanpPOGFLSDdfbDRpWk4wMVFudXlwY3dyWHpBZG51UmNtSUEySU52UEVpYVpwQW04Y0RzZDg4dnZ2eFFMcnZWaUhtSEVlc2FBWQ?oc=5
2026-02-19	Google	0.0	Mother charged with child neglect after leaving children inside Uber, police say - WSVN		https://news.google.com/rss/articles/CBMitwFBVV95cUxPcU11bkwwWGdjZW9jODhuYTAyWHQtNmFfSXlQZ1dhbVRPRGx1cG1lazUyUGp2ZUNqWFE3eWlfOXB5bHJIcU9UemFCenBHYnhsN0VKM0RNelpvQ0dyRG9TZ2FuX2JFbk1BQ1lhdWs1NjNKOTVpSno5WDNxd3k1T2x5c3R4Z1VtNEstQVFOWGpBQmlja3hjMXBxVjVicHREeWtUcGV2YlVWVHVmVUxDSDVIMnh1NnR3S1U?oc=5
2026-02-19	Google	0.0	TurboTax will pay for your Uber ride to a local tax expert through April 15 - Stock Titan		https://news.google.com/rss/articles/CBMivgFBVV95cUxQREM3N0hfWTF1alJFa0IxWkpHSWVGRWIxazdTSE5jNW1TQjk5VWJkcWhLeEVCaUczc3IzVHd3VnY3TDg4TFJPVmNTUl9NQ0ZMSE1GMy1EdWpWVEtKLUs1RF9TdE1CXzdrNnVGTEdlYlp4dWd3M1pORUVhcXJmMG9ONVhRWk9LRWNJcW5VSkZEMk9JVWoyVVljeWJyaS15c3dnY0ZJbHVlVUV4dUFCZ2JBWTY0RWRhaUpseElXR0Zn?oc=5
2026-02-19	Google	0.0	UBER Stock Quote Price and Forecast - CNN		https://news.google.com/rss/articles/CBMiUEFVX3lxTE5RVm5Qa183UW9qSWoxSktibFcyRloxRHZaU1dPWUFQZTdmQkJBRGFmNVJGNnR2Y3RyTEFwOVNGbEFIdWllcHdnRDlIeEpIUjFv?oc=5
2026-02-19	Yahoo	0.0	Uber Expands Life360 Deal to Enhance Family Travel: Upside Ahead?	UBER expands its Life360 partnership to integrate teen accounts and real-time trip tracking, aiming to boost family travel coordination and engagement.	https://finance.yahoo.com/news/uber-expands-life360-deal-enhance-134600012.html?.tsrc=rss
2026-02-19	Google	0.0	Uber commits over $100 million to build out robotaxi charging network - electrive.com		https://news.google.com/rss/articles/CBMirgFBVV95cUxOdFdTQjdRRTdIWkVsdXM3VnRfOFFMdG5lU09QWUFpRXJvems0b05FbVFqVXlxU0JJVU5VWmRicDVMdjViUWhnbEk3YU5uaTlrSHVRWWlaSnM0ZHBRX3F5NHFVZVVxTTJrUlgyTzVQNG5MZlAxV1ZJaE1sbm9vSzViUENqM3hzOTVTZ1VvU3E3UHJ2MFJxU1BwaFlLSzNPc0w2SENyNlVwSXRxRE9xYVE?oc=5
2026-02-19	Google	0.0	Uber moves to enact stricter background checks for drivers- NYT - TradingView		https://news.google.com/rss/articles/CBMizAFBVV95cUxPb3hUMmZDbjVmc1B3T0gzWW5aelhaWFlBSk9lLW9wNGpGSmk0RUdIY3Z4UWJuSm5zOVc4ZFlleUIwRloxb29xRnBlLXpWRXIzT3hsalI2NU1ZQTlNUmV0SUhIanNpYVZMaUg4anJzdUk0NHNxbVdwTHZzVEtCSWZ2bnVYNGNLbTQ3R3lPWlZtS2Jid3gxZEQzcFM3TUE4UUsyb092WDhZVXVua2JiaXJNaDdEQTNKRTVsb1I1Vm1kRS14SF9kZ3JRZWNCNzA?oc=5
2026-02-19	Google	0.0	Uber to Build Fast-Charging Hubs for Robotaxis in Bay Area, LA and Dallas - eletric-vehicles.com		https://news.google.com/rss/articles/CBMiqwFBVV95cUxPT0VUaGVGRDlHakd6TWg2QnlMWE5rQnZmb1ZxMkxNbnpHMXUyN1dKUUwtS1FoVFJWZFhOR3RMWmlsVXBYU09IZDZDQWpaY1RTNWpNamNOVkpnVm9YemZlbEJyRHVsSFlTWVkxZGJBTDNDb3p0TDFjQW9UelAySS1RdjBpLUt6NHotU0lXamNmWnREZk9fQzJ4eHhpRGJ0bllONU5VRUl1eWxKcDQ?oc=5
2026-02-19	Google	0.0	Uber to invest $100 million in robotaxi charging hubs across US cities - CBT News		https://news.google.com/rss/articles/CBMiggFBVV95cUxPZlF3Tjh1TXMtQW5LVlpRTkNRTHpOQjEySS1QY29SZ3FUS1hvc0E4NXlhNzU1UVo2MFVnaGpRVVJSalpkeXVYRUxKNjFRajdKcFJSQkdPSWVaS2ctZnRpVW5ocmN3Q19NNHVSd3ptQ21xdDlvd0xMV2Z6NXkxRzlDdjl3?oc=5
2026-02-19	Google	0.0	Uber’s US$100m Robotaxi Charging Bet And What It Means For Valuation - Yahoo Finance		https://news.google.com/rss/articles/CBMiggFBVV95cUxQallMRXp1UEdzdk1TbFJfckxiNXJ3NXRjOW1qcXhTMU5rU3MxSXdyRTNwR0FBVVFjS1BWWmlZX01CSldUb2I0b1NHOGJkckVxcC1VUjZPVFFFQWJRRE5RUGUxRUJQZXZobU1BOERkdmpKUUIzSUFZdll4VjFlc2F2dGJ3?oc=5
2026-02-19	Google	-0.025	Video shows police confront mom who allegedly deserted 2 kids in Uber - Action News 5		https://news.google.com/rss/articles/CBMisgFBVV95cUxQMmVtUzZmTDNjUFZoc0FwaVNndHZIV29adzZheFFzaHBxSThKYjZVMTdYaHBTWHVteWtLS0s4Z3N1cjRuTk1uQ1R3Y0lpalRsSkoyanIyQ2JtTURuRFhpUldwVGhzc2o2V1JFZ1FUNkVlODhyVWJFMEJTUkhPSjR5RWtLOUpFeXJqMEtXZXcxUk1hdnFETWZCWC1NdVB4akRNQWVtUVpfdkNIQUVFLVNMbkpB?oc=5
2026-02-19	Google	-0.116	Left behind: Are disabled New Yorkers waiting longer for rideshare pickups? Nonprofit and corporation argue over study - amNewYork		https://news.google.com/rss/articles/CBMihwFBVV95cUxNVTM1X25rRFlNcEpobGs1Yl9mMEVoZDdpRE9aS0ZTQ3dIMlI0ejhTc2xibktfOFRfaE9KQ3E1UXoyXzZZLUtJellycXhtd2RwVHMzM2tHYU9PVVBNRVpFOWZFcVJVQndKbGQtbkNhRWVHRFR6bTRidXNGNzEzNEhiaWV5RzZXVG8?oc=5
2026-02-19	Google	-0.2	Uber to tighten driver background checks after report on criminal hires - The Independent		https://news.google.com/rss/articles/CBMipAFBVV95cUxNeUtQN1lXNWlmVUFueTkxNmQxbEEtMDBMbGpILTU5TzU4bjJUUS11ejFTTmpCTzBIS0Fzc0FWSUgxdTFjXzIySzhfZ0tkTEZKM0FUNk55akFHc3RWSE55Z21mSkg0V0dSNlpEZWRsUHNWU1lpQ0M1R0lIVjV4VmZTVnhwaEh3VjFZNFp1bVVoR3Ezb1JrUjVaZ09EaEZleVJaZU5TMw?oc=5
2026-02-19	Google	-0.275	Uber in hot seat as probe finds violent offenders were cleared to drive passengers: report - Fox News		https://news.google.com/rss/articles/CBMiqwFBVV95cUxPS0c0QzNtUF92bHN1XzRTMVY5Q0c1RFBFU3drdmlRZURUcTkwTnpRU0FrT2RrVzU0cDhIWG1iU2p5VjQ4Qmh4VFBmYzlubksyR3hfUVJweVUzVXZNUGRUWi05SGUzQzZnOXFweC1TLW9WdUZIU3FBU1NuLTNxNVNaR05RTUFZMVoxbTA4eFFKNWJ6TWtXcXpNWFNFMzk4RzVHU3Z3czVuYXZhTnfSAbABQVVfeXFMT2FIWEVrOVVhak5jejZzRnZ2RlB0d1I3YXl3RG9CdjA3YmQwdldMb3pPUXlyX0EzOEkwdzE4S1pfR2RkN2J0S05pSWpTRy13UTlVd29wZ2hpVXVPYnVIbUlHWDBwV05PYlUzV2wyajFhU0FZVTVjdjctTy1EakprZkpGSC13V2pNZy1uazlDZVg2azdVNTZLcTNZeGR5dk91QVRfdnktT1htWTA1YWVldzQ?oc=5
2026-02-19	Yahoo	-0.379	Bitcoin To $10M? Major Crypto VC Founder Says 'It's Not That Crazy'	"Bitcoin could reach between $5 million and $10 million, according to Electric Capital co-founder Avichal Garg. ""It’s not that crazy,"" Garg said on an episode of the “When Shift Happens” podcast released on Feb. 12. Garg said his forecast is..."	https://finance.yahoo.com/news/bitcoin-10m-major-crypto-vc-191357476.html?.tsrc=rss
2026-02-19	Google	-0.533	Uber is moving to stricter background checks for drivers after report details hiring of violent criminals - Yahoo News Canada		https://news.google.com/rss/articles/CBMihgFBVV95cUxPM2JoeDZMVHV6eklCU0hoYlVFTFYyY3ZkZW9YMWRaTFpOYkYtdE1yXy1yVDg4QkpCUHJZNm9oQXJTUThzSHNsTlBCa0xZVW1vaWdmdXVtQnNJSnptdjc5SlVDSXFFclU1QVBnc0N4NzVTS1U4dUhhTDFpdWx5QTFLNWtaWjFfQQ?oc=5
2026-02-18	Google	0.4	Uber to invest over $100 million in autonomous vehicle charging amid robotaxi push - Reuters		https://news.google.com/rss/articles/CBMi2AFBVV95cUxNOGFpQXpqZW9uMmxhLVFUQnliY3JtUWJoZU9FbDI0MnhNTnI1azdSalhhT2h2dTlLRXVwSzhfZzJEazFPdkJ1Z1lZaHNtbFdIRUwxTTkxME03QlVBYmFtRUNYN01NSTdvZWc4VFJNVG00Z2Y0d05RVW5pUXpOZE9MWHB3SWlQYnhRS0hKR21tdlh4U0NnaVNPbHJsemZwMWFscDB0anpUTE03a1N6YWk0ZEtqOHh6NXdqRjh3alQtWWFjc056WU5rTHhYN1U4TU5lNUVzN0czVTc?oc=5
2026-02-18	Yahoo	0.267	Uber offers incentives for EV chargers, Wendy's stock surges	Yahoo Finance Host Josh Lipton tracks today's top moving stocks and biggest market stories in this Market Minute, including Uber (UBER) offering new incentives to install EV chargers in US and Europe, and Wendy's (WEN) stock surging as activist investor Trian Partners considers a buyout bid for the fast-food chain. Stay up to date on the latest market action, minute-by-minute, with Yahoo Finance's Market Minute.	https://finance.yahoo.com/video/uber-offers-incentives-ev-chargers-190803023.html?.tsrc=rss
2026-02-18	Google	0.267	Uber to invest $100 million in autonomous vehicle charging hubs for robotaxis By Investing.com - Investing.com		https://news.google.com/rss/articles/CBMizgFBVV95cUxORVhSeDhyclRTRk9fUG1qMGgwRjVIc2hySngxYWRpOGZiR1dpdkpjLTlSN3c1N3M2U1F6SndTQTFqWmp5ZF9RWDl2SE1Zc2dvWFBkVS1zRFZfNEVYNXJVdnlUMzYzWXVqSjFWY1g4WncwNnhLbnUzY0JfLXhHX2ZMbzhTa3VUUFgtY3gwNm1mT0Vob21yWUNyMXpfaWM2cDZ4SGpFV3VQZm5VSFVjUnZKTnZhUW9wUjhLWUh6TnQxVmRTUW91X0F0S1NxWTlfdw?oc=5
2026-02-18	Google	0.2	Uber Has Big Plans for Lots More Robotaxis and EV Charging Stations - CNET		https://news.google.com/rss/articles/CBMikwFBVV95cUxQSXZJYjJtd01BdTlFZHFITk5neHhYcTdZNjNxeFo3aVhLbkllRXJNYktKeEpZR21tZ0x0cXVMNTJTdTNWWU1uU0t2QmluckJuUWNPTXdVLWRyQ3U0N2o3dzZ6bDBmYU8tQjZRR2xPQnQtWmRqODl6THN4Qk11OHNIazNuMUVjRFl2MFJEa2szUGRTeWc?oc=5
2026-02-18	Yahoo	0.154	Uber to Invest $100M in Autonomous Vehicle Charging Network	Company expands robotaxi infrastructure across major U.S. and global cities.	https://finance.yahoo.com/news/uber-invest-100m-autonomous-vehicle-182845533.html?.tsrc=rss
2026-02-18	Google	0.136	Uber Will Offer Incentives for E.V. Charger Construction - The New York Times		https://news.google.com/rss/articles/CBMiqwFBVV95cUxNMThkOEhuT1d2SlNDN0s4ZUtJQUtSM3YwQ0Q4SFpIWDNPZkdjTjJZc2NjSFg0UzBPdy1KUlEwY0N2S1F3X2VFVnduVUprU0R1dWt1SDUtTmNCWk5lOFpxek5nTm16TER2NWhxaUt2NHRVeHVrUXE5X3pfUURnUExYVGVWYUFfU1NEYlZBejNpYk5XNy0yS1ZWYTk1OEppbEFRUDh3QWhHdnNIT2s?oc=5
2026-02-18	Google	0.1	Uber offers incentives for EV chargers, Wendy's stock surges - Yahoo Finance		https://news.google.com/rss/articles/CBMiiAFBVV95cUxOY0Q2OERaOUJKWGhDb2RrQk9VTy1Rd0o5ZjRqQXR2S0lrVThqaC1LdFRPRURzbWJvUFBVcGN1VFVmNjBIeW9yaTRDYkJpaV9uMXJTM3p6dzhCb3FkNjRIbDdpd0VnZ0FmS0tYbEhhWEx3V25oR3lpU0xjMGU1MUV5NGs3OVNfVkxp?oc=5
2026-02-18	Google	0.047	'You left your kids for two hours.' New police body camera video shows officers responding after authorities said a mother left her two young kids with an Uber driver for hours. Emily Sabogal, 32, was arrested Friday night on charges of neglect of a child without - facebook.com		https://news.google.com/rss/articles/CBMi3wFBVV95cUxPX1dwY0ZISTBXV0h4SUVqZnpZNEdhU3lvbFNMaGtVV2I4Q3NLRlBsSDhRUnBqZ0xhX0NPcnUwdjlUSUt0RjhHVXBLcVBNNHF1bEJMRWxrSWVmVVBESXZscURsVHFYUHNJM0R5VFR6dTQybnIwZFVDV2dOMHkxZkFYVGV2RUJWT0U2dDd6S04ySHVPUFVuUGt1ZUZfS19oRjRGaFpBdENfb2FzcWViaDVyMlBnNHlmTWhzS2J4azdxNlhoaWRwSW44TTJaU2VXOGhRTWNHOFN4OE0zZkY0Wmhr?oc=5
2026-02-18	Yahoo	0.016	David Tepper’s Appaloosa Trims Alibaba and Adds Micron, Alphabet in Stock Reshuffle	Appaloosa’s single largest increase in holdings by dollar value was for chip maker  Micron  It acquired 1 million new shares, for a total of 1.5 million valued at $428 million at the end of 2025.  It also bumped up its  Alphabet  holdings to around 1.8 million shares, valued at around $560 million for the same period.	https://finance.yahoo.com/m/75b1b427-f441-38d7-b3da-3b0705b22f78/david-tepper%E2%80%99s-appaloosa.html?.tsrc=rss
2026-02-18	Google	0.0	Bodycam shows Sunrise Police respond after mom allegedly left kids with Uber driver - NBC 6 South Florida		https://news.google.com/rss/articles/CBMixwFBVV95cUxOd3ZOTEtzSk8zREhUdl9LRFR4ZTVvRVdETTR0UDlJVkdncTRyaEhoQlRKY0VtYzlMN3B0Ulp2akk5X1BtclhxWTBNM3JzRElKSFNYY19CV2hvMnF4LU4yMHlZaFo0NU8zbjRNbTlZNTNiRkR6c0dBMXp2V1VFNDZqTGRXNG41NXdxY2R2T3dnX0ExV3o3Y0dKWmNJTDFUR05zRkN2OFh6ZjV6RXdVcDZsVkxrWlB2U0F6bzNKNzdMUVNtckw2LUNJ0gHPAUFVX3lxTE5ZbzZYQU1BakZsc3c4dzJGa1B0QnNBSU9OaGg1R1EtQ3RtMHMxRTVYYzFkdjZYZ3p2b2pzR0ZZRUt1cmI3bFliQ1pSTC1rYU1lMUVOQktqTGt2SjNOMzN2ejJMTVcwb0lLU0lyLXg2RkNncUZ4cDItS0VONDl1Xy12cEY5NElDNjQtN0tkVEpDQ3hEZ2t3YXNZMnF1cnd5SkpQOUI5S1lLZy1tQ2U1eFBVY0oxc21LcWRROWptaG5WYTRtZFRYelFMRXNRcG5VZw?oc=5
2026-02-18	Google	0.0	From Rides To Robots: Uber’s Path Through The AV And AI Era (NYSE:UBER) - Seeking Alpha		https://news.google.com/rss/articles/CBMinwFBVV95cUxQOVp6NzhxUzlPMHJHcm1oS1BVOHNNT0ZJMExiNkR6R2hYZVBUNnN4R1VtbmZSemRGN1lvUElmWV9xMjBVaU1TOVBaemV0QmNHbGstUWRRVnNpRUV3S2diaXoyQzFZUU5uMi1wSEVEZFFFY3kxR25KenRKR3hHWkpZV0kzd3E3NzJidnlzNjlDdFFIWHpaZkk4eEVtX0cyazA?oc=5
2026-02-18	Google	0.0	Guggenheim cuts Uber stock price target on valuation concerns - Investing.com		https://news.google.com/rss/articles/CBMivgFBVV95cUxQN0xTdlZ0dm16ZXAtaEtXY05HNDhSZlYyYmJoenVjSDlmMkcyaWRjSC1NSF8wRE5jd1RtZUJfbjUtaGFmUk1qcFpZd1pRRlE5c3ZOaVVBb25JbC1NMEx0Ym9CUndialo2ZXhKenlOVkRuOXhjU2d4UDJ2aTU1cnFaaVJDZTYyUkhWWlpPTllnbjJpaklBZXJhODV0OW1zZFdQQnpzakJ5Y2JCaDJHX0Rqa1Q2LWZiSTBSSkxiRkN3?oc=5
2026-02-18	Google	0.0	Quant ratings on Bill Ackman’s Pershing Square Q4 holdings: BN, UBER, AMZN, GOOG, META - Seeking Alpha		https://news.google.com/rss/articles/CBMiugFBVV95cUxPclQyaXVIR19LdVJDTG5odnU5c2FWeURVM2s2czhMZU02N2lFa2FlMnhWWmJ6dnFIVFlIRENuT0lNcm5ZLW1PLVpJYTJjcUJXelo5SjJQWWttWlJybDlyMU13NEw3bGVJVmtDTWg3TTI2Q0t5MjBWTnFuR2twQVVYWW9rT05NYm5fWUs4QkZ2QVFlSjIxa2w3ZFBmNVRHbWJPd3FmUnpVc2pHVVlqa2FVTDVGZjA1QU9lUnc?oc=5
2026-02-18	Google	0.0	Rideshare drivers deliver a petition saying Uber, Lyft stole millions in wages - Audacy		https://news.google.com/rss/articles/CBMinwFBVV95cUxOc3JYbmhRZmxFZVRwY3NwcGdoR2R0aVVPeml5cHE4YW5QUEF0N0t3cFRsbjFXNFllQVdkUFc5R3lKSWl2M3lBV3RjM0IzaE1Tcm13T1dCLXdXang1N252UW1wSGd2dzB2VFlza3FhckZaQXN6R1JuVE9ONUlxakxESmJMdXpKSGdha2tnZXkzSnhoR09uTGFOQzRDcmlsR2s?oc=5
2026-02-18	Google	0.0	Tech Bytes: Life360 expands Uber tie-up with in-app ride tracking and teen account integration - Proactive financial news		https://news.google.com/rss/articles/CBMi9wFBVV95cUxQT2xxS1NKYjZxUHJRelgzaGhtRkJoY25kM2M2MEl3QUFMTHF0X1RKT3lIaWJ4eEpUenAyTGM4VTc3Q2JBU21aV3AtX1BFSTI1amRvQzcxWHBXakg5Rm4zMmZvaHQzbkxDU1ktZ3NibkVwUkwyX0Y1UmhCbEc1MUVOdk9RaVhvVmZuQ2s2NjY3UU5BYUFwT3NrLWZKV2RrTFdkSi1pYzI4VUEtdWhabG9KSGJpXzR5aGJoR2lzSVYycjR6QnZoVlNsV2dIMkZLYTJZampuWTRJdVJ4NDE3Z1drX0pZMVIxUGszMTAyTTVEb1BuVV8zUnQw?oc=5
2026-02-18	Google	0.0	Uber Is Sinking Over $100 Million Into Charging Stations for Self-Driving Cars - Gizmodo		https://news.google.com/rss/articles/CBMirAFBVV95cUxQd1FRZjVkdVdvVUU2Y3BxLUU2SXZOMzFTdlFCdmtvbXpYaEk3SVVzckJQUk5ZeFdmaEJjR2JOUF9wRkV3M2pQbVB1bS1XNjRFRURRSUtVU1BUMzRoN1lyVERCRGpIWUk4RkdfSmo5NjZVc09ONlk3cVNlYWwybVhNLS1xVkpaNGtGUzZCMVpUa0E4aU9wVm1xMXFySkVZaS1XR1N4M3ZRR19rS3RV?oc=5
2026-02-18	Yahoo	0.0	Uber Pours $100 Million Into AV Charging	Robotaxi strategy moves beyond software	https://finance.yahoo.com/news/uber-pours-100-million-av-222705009.html?.tsrc=rss
2026-02-18	Google	0.0	Uber Putting $100 Million into EV Charging for Robotaxis - CleanTechnica		https://news.google.com/rss/articles/CBMimAFBVV95cUxQV3h1aDdpdjhUajl4amF6TkVrVm02eVc2YkVHckRta1hKaVZSQ3cyZmtaMXItRlJZSTh3S253V09FZXRQQm02My1QS29PUG1BUFRHWU5mS2ZBV3ptTC1na1FIOGtxMTI4M0tydVdPa1djaElqSjVQR0o3NDl4cXdLcTRMTG9pYWhHWmUtS1lzT3NTbjlvOF9Cb9IBngFBVV95cUxQZzRQc05HS29IWEc5LVQ5MERkT0VNZnFWTEMwNlVNNUVqMFNmZzMyakZaQTZWVHlxX2FyWDFyenVwXzlKM2lpbDBCME5IeDJIRHEyRnZzODZUREZkbU5COTEzbHZQVzFseHhGVU5OU1M4MTRIbmZRRXJfZlBiVUkyQnM3VUhBT3hiaVlpbTE3M1pjZWtLeXQyYkF3N0ZrUQ?oc=5
2026-02-18	Google	0.0	Uber Will Spend $100 Million to Build Robotaxi Charging Stations - Bloomberg.com		https://news.google.com/rss/articles/CBMiwgFBVV95cUxPS01rTlE0WkRaNU03WkVJM0xSdldya1RQOG9sb2VVNFEzdV9oZU1tY0dXQzRlMmVkenFjejJfODJNZlEtUmNYSWphWTBaYlVOdTBUcjg5N2M2SjdVNEhsOFRkdGpWZS05b0JGNTJCb1pSN0FzYUEwMWp1eEVPam9pQXJIbFBhVzducjFMLTQxUmx3c2k5cWdTaTdmNHJLNkJpVkFyOUlhdEtRVUkxMHpNMmZ0ODhUcFgzcmJlMEhTY2t2UQ?oc=5
2026-02-18	Google	0.0	Uber bets big on EV charging for both its drivers and future robotaxis - Yahoo Finance		https://news.google.com/rss/articles/CBMitwFBVV95cUxQbEJuLWd6dVJZeWVjbTA3dlEyUnpqS091Z3VJdVVBa2FEeWFueG9TdmtFd1dwRzRLdFR0SjBXdGFxazNmVjg5TUJmcDdLMkVXdXdLNlpHbnVDbWhqaDZXTG5UWlo0OUktaEV2by05X1A4VVdJMks3bGNvYjZNTHFFdFVlZW5PaUNfOEtNMHByYXlia3FRRklqaTZfSERkcmYwS0dDTFlTdVdjRDdTakpkdjVId2pHSlU?oc=5
2026-02-18	Google	0.0	Uber comedy-drama about Palestinian, Israeli premieres at Berlinale - The Times of Israel		https://news.google.com/rss/articles/CBMiowFBVV95cUxNc3Jzc3g5UmMxdVJOaFVkVUJUUXRzTFhFNkF6T3EzUmlzWnRlNmxwdXNRSTQ2MDh1bHhEbTBQaW5OQWExdklwRVU4XzF1dnZyX0wxTGpVcm5pdXMwMWV4aUVkUm9sMlB5TDFyMEhQaW9YN181TEpHR1RuM1F1Y1VCdFA4VG9KdXFzOFNucW43VXlhM1JqUzFqdEQwakNqM2FsUEw00gGoAUFVX3lxTFBnUjZVcDlyUTlvNUNDT0lSVFdCNjIzaE8tdlZ2b3NpS3hqNFR4Wi1UN1NteWs4YUJueG1UNy13MDlZT25BNEcyai0wbGFNMFRkdUtMOWEtMDNiUk9PdWJBeGxhSHE3dWJOLUctTVlLU2JVSHdHd0VzSUtnbkZYZTcxV3JENmZUT2s3UUJkb1c0bzBSa2tkaDdjVmxBRm5jejZCc1JONTZUSA?oc=5
2026-02-18	Google	0.0	Uber commits US$100m to robotaxi charging infrastructure - Automotive World		https://news.google.com/rss/articles/CBMimAFBVV95cUxQdUVYMzZxeGRJYXdTYjBFbEVtOXNraFJ6UFBNbThJSjR6N1lneVd4X0pUa3FDanB4OFMwX3o1dHZ0Mm95dlJPbjhBN1hPNlNMc3VaRDNlZlV0bjU2WDA3cDBfUXVfczU3eVFYMXpueGV5aWVhRllKQ29kMkVYLU41VHpqVFNfaDc3ZFd5NnZqd0d6ZTF2S215ZQ?oc=5
2026-02-18	Google	0.0	Uber introduces phone-free airport booking kiosks - Cities Today		https://news.google.com/rss/articles/CBMigAFBVV95cUxPemF4clVhcXBzc3BZMUwtY2djeWFKclV6aDhPNkpsUUswQzNjWWR1U2dQaVRuNXJudk9lVU02WkZGaG42by1LQW1xU09XMUFuOE4yWE9sM3RyNnBzY0h4OEJydGJnNG1zM3IxQ1ZUVWRFTXZDYjFlT1NPOWN6eFFiMg?oc=5
2026-02-18	Google	0.0	Uber investing $100M to build network of fast-charging AV stations (UBER:NYSE) - Seeking Alpha		https://news.google.com/rss/articles/CBMipgFBVV95cUxNSEgxNWdlRXdmR3hqTm4zUmZ2dngxUkFKYW5ENlVlWGZmZWVnMjZwT2NzMGU2UTd6MXhULUFERjJPWTJneHV3LUZUZVhVeUVCXzExbFNnc1BTT0tYSWVGalp1TUdNWWNoenlBYVRMd3h1S3VkSmZNX0tPc2xLNmJWUVhqSU1PRDVwN0JQRnZvdGVWdHhTbUJ2SElsTmQ1M3lHYlFobVNn?oc=5
2026-02-18	Google	0.0	Uber to Invest $100 Million in Robotaxi Charging Hubs - Autoweek		https://news.google.com/rss/articles/CBMimAFBVV95cUxPa0tqczR1X0ZUNC1majhVc2ItTU9TNXVmSjNLaXJVQ2w0dy1fOG5SbDVkWERzTkx3eGVvWFlKV3IwUXE4bjNENVozSjE0Q3QyZmp4cmw2Zmt6M0tQX2ZXRGUzQk1ITS1ZM1hTdlhXaWhyNmJIZDhZbmREVnhhNnpTNkRWbm5wUjJqLXA3VlhwckU5Y1BfN3MzNw?oc=5
2026-02-18	Google	0.0	Uber to spend $100 million on charging for electric robotaxis - Axios		https://news.google.com/rss/articles/CBMic0FVX3lxTE5mNDVPbWFtbXVxN09YX2RhVC1jZUczdkcwS3BzRFBzXzkwZHhzMEhJT3ZBZVpwTUFYNl9INzRGODFlUS0xS1hQLXFTeTFQc0c1eTFxellybTdYV1kxX19tblpicWh5UzRDQzdFNTRSa2xQdXc?oc=5
2026-02-18	Google	0.0	Uber: This Makes No Sense (NYSE:UBER) - Seeking Alpha		https://news.google.com/rss/articles/CBMic0FVX3lxTE1JZjBKRERRQkJzWUU3TVg1TnN5MmY1UGI0UWRmVDNlZm5UMkhncEhKbmpvWmkyQlFLaVBSRDdJQ1Uzb3pDUnNLWTd0UDQtNFZlOWhISzhZX0tYb0lKQmpXajBjNDNJUmh3LXlCWEJHZU4yV2c?oc=5
2026-02-18	Google	0.0	Video shows moment mother accused of deserting kids in Uber is confronted by Sunrise police - WPLG Local 10		https://news.google.com/rss/articles/CBMi1AFBVV95cUxOZkxud2R5NmFhS1k1TU9FZThoZGE1Vjc0aGRmZG5OQk9UcTRYSHoxblpaU3hjYWl0ZHRJaTM0a2k3b244MG1PaWtxWnA5Z1lVX2ZaZkNoWllZMF9oWjZOSGdORWlpR1lxM3JOcENJX0liWHhyMnlDaXdNY0NTMXZ5bnpaQkRQXzItMEh0eVF2Y2pYYVp4cEFMWFNfRE54WTVkZDZHU21pcjZTLWxvWjJ3MFBOVmNLc3lOdVhyT3Y0ZHotYmpKYjBjX1RwbHpEU2wtVEVIYw?oc=5
2026-02-18	Google	0.0	What 23 Analyst Ratings Have To Say About Uber Technologies - Benzinga		https://news.google.com/rss/articles/CBMiwgFBVV95cUxOZUYzVXpoYVVUVmh3N2RUZU0yemc5ZFZZR1Nkd0RzTjFqZnlkdXpoN3VqQ3NSczc0b2pFYnNjUXlHQjNlMTlraGtjN0UyZkJ4ZVR3VkFnR2xJbmllaS1FeldkLTZQMmJlMFFpYTI4cFZJQVFkaGlxR0NiYk01ckJuTm5Mb20wcDBhQzIyTnJ0Zndmank4S09pZ1hsaHh1bkxTb1pUNEx1QUliTm9tNWhHdjJoU25ONmhmaFhhWjltYjRTdw?oc=5
2026-02-18	Google	-0.3	Behind the $6 charge making your rides to SFO so expensive - SFGATE		https://news.google.com/rss/articles/CBMid0FVX3lxTFA1RWViQnV1N09iZUxjX0RRRW5VMlpLZE5LY2lNOUN1QVRwNFBkNHo0RkhJWlNfXzNhb1NYY0NfZUF2RDdwQkhpTWV2bV8yZ3g3cjloX0NoeU9BWUZvNVpPSGU5QklPb3VMMkNlZ1RNWDlnY0pnWk5V?oc=5
2026-02-17	Google	0.333	Uber and Life360 to allow for greater platform integration (UBER:NYSE) - Seeking Alpha		https://news.google.com/rss/articles/CBMinAFBVV95cUxPcW1fbVZ5N1d4bEdFeEpOSXhYY1J6b3ZfR0twNnp5RUdybWQ5ZDFXN3UycGhkQi1ITTZzNGpKSG9fVVJZMXZiNUpqT0pWX0dnbThuLXFwVHBvNWZJd1NoazJCS0dvWDc4YWxnNVN2T21SX0dYNDcxRUxEbVpoOExDTXJsLW02R3BIeDBhWmtaRDVYTHczZGZRX1BfWDc?oc=5
2026-02-17	Google	0.0	Global investors stay 'uber-bullish' but warn companies are overinvesting - Reuters		https://news.google.com/rss/articles/CBMisgFBVV95cUxNYWFMTmgzUUdUTGdQNW5tRXJXMEtzZUFmNVlZel9TYUZ2LWZXeGIyZ1V5THMtZjVIa2hZbWtpbjRMNTlwZG1DRUM2VWpVdFN3SE9QTUNxUl9UMU9zT3V1aHdYSGsyV0hiLTI2RGRIc21IcEYxaW44ZUdKRmM4MXBDZVBieldvdmhrcWVpN2RYRDF2aTh1NnFJUWpva1k1d1R0M1ExcHBaM1hZVEhJOXFlTmFn?oc=5
2026-02-17	Google	0.0	Morning Bid: Sleepy 'uber-bulls' - Reuters		https://news.google.com/rss/articles/CBMiggFBVV95cUxNM0ZUUE1vbWkyRzdEcXBNN0IweHFpMmdHeEZxcnJlTXBqQTVLdUJMTERoUkdwWUo0MjhXYXh3TXRneHd5OGs5Z2RRRWVreUp2a3Z3REZubnd5cExpUlpCUFZISlFpUnVzdE1PVzJSYnF2QmlRdGZDZWV6dDM3YUFjaVpB?oc=5
2026-02-17	Google	0.0	Uber and OpenAI Retool Rate Limiting Systems - infoq.com		https://news.google.com/rss/articles/CBMibkFVX3lxTFAtUXg0OG9FRjRJMWlGaWdLa19GVDZPaThtUWlvQ1NwMzJfUjd6ZFBjWFpQVjFOZWRPa3M4UDlmQ2pnbWltLVc5d0xhLTBWS1hCN1gzU1cteXAwcy1IRVVOV0s5Tl9kdzZ2bjhwQmhR?oc=5
