Date	Source	Sentiment	Headline	Summary	URL
2026-02-22	Google	0.013	See the Northern Lights for FREE with Uber in Finland, Book Your Spot Before It’s Too Late! - Travel And Tour World		https://news.google.com/rss/articles/CBMi0wFBVV95cUxQa2ppNl8wbXM1VkRKdVlCejA3eEJabnBvZHNsNDUzWThpWWdQVDlhYm9rRWNCam13NkNCcmJZSmNDMkdFNHJuNXdGZS0zUmxmRGcwX2NvaHlzVVR3N3MyQ0dva3ZMblh4dGhJSkhXaWZBanpOd3dNRFdudUFMZ0dqYktDcVNBeFdmM3ZwcksyZXhPaGV3ZzAyNGNrRVhnWW9kY1E1UzZVYzFvTjZreFU4VVNVOG5tX2JlWGZWTjA5QXBtTVZmV1pVcXJmVk5tTFJvaHhr?oc=5
2026-02-22	Google	0.0	4 ways the Kalamazoo Uber shooting changed Michigan, rideshares everywhere - MLive.com		https://news.google.com/rss/articles/CBMiwAFBVV95cUxPUEFUdVFfejhvNFl5WTA3alNsYTZHT3JRSlRtR1Azd1FoX1VMdTZ3ZVhRNGE0NmpabTdWa0NJWlNFdXFqT1kzR1N6dUR3MU4zLWtDTXhIekQ1Qzh6Uml2VE5CZWdYalNvcDJ5QVQzN3R2Wmo3VkFFSUkwWGt6ajhzSVJxM0JKMDlqR0MzS1dMOEotbVRqVlNheXlDcXgwQkhIQjZiWDJ4MTZGT09wQ0JfU3pPeHlmWWdxY2JxUWJoZXXSAdQBQVVfeXFMTUpINHF6NUl3eXVsZWI4MkY2aHdBR1BjUTBVWmtlS2FyTFhtbzZNNUJTY2M5V2stNThpVzZqYmV5elF2M1BqNjN3SUxEWUdkRVY1RFFCTWMyeUgtMEUzXzFuQ0JIeUxkMVFmWk9oTmVVSWh5NVUzUHp1NEFNdUpQbktsak1SNDJUcmtVaFE3M3ZWeUxSUjN6REV0TmNLbWdrUTJXdjV1cG1ERk5TdHVEbDNHNnBrQVRqa3ltaHFUaDVGTGlJUERmSXR6MzUwaEtEdXBhc3g?oc=5
2026-02-22	Google	0.0	Delhi-Based Uber Driver Completes 50,000 Trips, Reveals Amount Earned In One Month - NDTV		https://news.google.com/rss/articles/CBMiuwFBVV95cUxOMVN6bWRqdHhDNEI0eTBQRklQZVZtWWNZbV9mZ3h2dHpGMGZiMnFhZk5XQjhxRzl0MTZrVGRIUV90NjNhbUstSm9uWGR5d2ZIaDd5R0NXcE5GOFhpcURwMG8zNElrZ01aNmVqcF9sT1N3aVMwc09naW5majVfc2lNX0NZVFhjWjA4NWoxQW1qYVZzNm8wVURXQlhGYTJ3QlVxb0J5a2lsQUw1bEFvSHV2WW00SkcwNnpfRGdz0gHDAUFVX3lxTFBNaC10QVF4STJRWlhVNFpxd2t0dENGVFJwVHF2bTNiY2NkV3JPZ0JBNm9xLWxQWVJNQVpiWVo2aE9QclBoeUFoTUppSG9iVExpSHhPZDhiazNWQmhxNGtKcFp4c2wyMTJNOEdCTFZUTVM2RlVGOTItbzNIWDV3X250QTVXSFN5c1JrNEFlYmZKMXNoeGp3TWRodE5Nd0VBZUVFREhraHpJZGtGVGJBN2EwcFh5a1J3bUtvTzNvR3l1bk1XSQ?oc=5
2026-02-22	Google	0.0	Lawn mowers on demand: Bunnings joins the Uber Eats menu - AFR		https://news.google.com/rss/articles/CBMirAFBVV95cUxOS2hsc25nVnUtenNyd3JjMU4yVkMtbllJZXctN2lreDhJZjFVQjVZN1lUeW0wRkpUV1gxemVOcjJuNG9aWW5uLUhQNlNGZkUzTGJnMjhyenBKcHBFUW9qVG93MXB2ZlBUaTRNTDgyVW9UcmoyWGlBbTY1SnlzYU5NRHUwdlZKT2pKQkZaR3Z2Si05OThUX1lUUi00SEgyM2xUTVREUE5mNTI3TXpw?oc=5
2026-02-22	Google	0.0	Uber Invests in EV Charging to Power Future Robotaxi Fleet - National Today		https://news.google.com/rss/articles/CBMivgFBVV95cUxNcW04a0dRWkFGcm5ISUhGX0VQU1V1Z1RTLVZERGR0enBVckFyUzRRaDR6TWtCMUh2S0NRSVAwQlQxTV9ydDRibld0SDcwNE96elVOcDVOcDQwNkxaQTZQdUE1TFlWVkJmMUhhMXpyU1htNERqNGprOF9UVGNFNUMweVE1Uk4zbmJIR2E3RF9qc0hrSHZKaDNOYVdWcHZ4a09YYlN3QmVGU19zNElxdzNkQmdWWTlQZnFSaC1FVmp3?oc=5
2026-02-21	Google	0.0	8 things boomers do in Uber rides that drivers notice within 30 seconds - VegOut		https://news.google.com/rss/articles/CBMirAFBVV95cUxPU0lGMjNCWGdqbTc5Y3IyZmE3Q0xucnB5SGlMLWNqS0UzOTdKZ3BRSTAzNkU2c193d0phNFRjQWRZcUo5WDBlY1JTWC1LNHdQc2pVdEtBWTNwQjlCRDNjbEFsYmhnWHc3bFJrWHVEWFRiQS1JN3h2dlc2Y1pQMVZkWFMzcWdMOHUzOVlGZ2xlRUlTbVdnMWF2aTZ2N19uV3A1S1RCbkwyR1JWWFMx?oc=5
2026-02-21	Google	0.0	Bilal Fawaz: An English boxing champion without a British passport - BBC		https://news.google.com/rss/articles/CBMiZEFVX3lxTE5QLXc1UW9XYzd4clpHUVRwb2lVMXl0UE13VGFJSldyZXhtYXc5ZlNKNE15Und3SWJpR0N2NnRzeHByX25STm5OdE9UVWhaeElPalo5RFRtXzhMZGNHOXp5TnFKQlU?oc=5
2026-02-21	Google	0.0	Tech Program for Seniors-Uber & Lyft Transportation - West Newsmagazine		https://news.google.com/rss/articles/CBMixAFBVV95cUxOSUxpbFo0dTRkTlM2M0xRUWhFTW05Ykt6UWs0Y25aZGZrU1JBME9PQmFLWkc2S253WThlWWFjNnBQN3dLVjRKakcteFBuVDkwR2pub2hpNEQ0eWJybGgtQjRyOHBfUzFDS0N3OTlIOXRRcFl2TXNSbENsaHYycDJMSC0tS01uVHNJeGJGekE4YnNHcEMtTDhrYmpOSjRPOUJSYWRGZFdid1hURFBjcVRFR19fRW5mTDFKS2YwMktpNncwMEhE?oc=5
2026-02-21	Google	0.0	Uber Eats campaign, ‘La que pica’ celebrates Mexico City’s spiciest salsas - Mexico News Daily		https://news.google.com/rss/articles/CBMib0FVX3lxTE9yTG1qR0d2MlRlQTJrT3dlNHhTdGFJV2p4YmZTRnRVVHBKS2dZdEthSmN0RHN3ZUZpRTA2ckZBMlNhMXBxRXJUcFFFVVZfU3FnNkYyUFlhWEktaFpOSGVTa2ZFQkZ3QkFHdHdJZmNwYw?oc=5
2026-02-21	Google	0.0	Uber Technologies Stock To $96? - Trefis		https://news.google.com/rss/articles/CBMilgFBVV95cUxQTEZjWEVLUWE2b2JaM0VGNFNDcVVPY2ozUFMwQUpWMlQtcElSU3VUQnVYcVVEWjIwVmttSDhxR0psZHh5Sk5Zc3BaRXNDSkU5bkFIV25XUks3bEJFTURkWHJmUi0tZW5Mc3VNcHA4TzRHWWszbjhxU09YR2RYR2V0QmJTMWVqOVlobjhLbFJ2clFaOHhNVWc?oc=5
2026-02-21	Google	-0.067	Mom Arrested After Allegedly Leaving Her 2 Kids with Her Uber Driver for Hours - People.com		https://news.google.com/rss/articles/CBMi2gFBVV95cUxOeEJiUGt3Z0lvNE5SaXJCQ3gtWTZqeTBYMU1ZakdERWt6cUlkYjVGOXhFLUt6ZXhBMmJfd25sTjZwUThxYmw2dGt0b1RNeGExcjFsV0NacEducFBVRWpwTlRJTDdFU0ZQc0ZaRFRSRHVjdjFraTdvTGJNR2VOVzA0SGFqTUlRdE50b0wyNDZnbWthX0dUNnZ1TW0zNW9XdmpBTjA1cXNLaW5yNlZLWUZkV0VVNlhuRTIzcXMtNjBLQVY0X1haOTV1NjJXa0w0bndFdnNxT0wwQkpzQQ?oc=5
2026-02-21	Google	-0.1	Mom Arrested After Allegedly Leaving Her 3-Year-Old and 4-Year-Old with Her Uber Driver for Hours While She Went to a Shopping Plaza - AOL.com		https://news.google.com/rss/articles/CBMihAFBVV95cUxQLWJuLUdPdjkxeG5XUFhLM1dGVXdkVWFDSExpbFJhb21wbWpvTkNxTV9WbnBjWU1DSDV5d1JiZzVPWlZrbHlSeFVOMXUzWl9QVk5EeFdwbDlCRnhTS1ZsYTNHMmJVWERpbTVSSnR1Z2pPQnRqMWdrLVpUUGt4S2dFSEZBME4?oc=5
2026-02-21	Google	-0.125	These gig workers are quitting apps like Uber and looking for full-time jobs or other side-hustles - Business Insider		https://news.google.com/rss/articles/CBMinAFBVV95cUxQeVh2YkNQc0ZNWHZpc0NJeTcwejRFMkJFSjFTamN1V2NqUGY1UmpBdTJzZHFLWXJhVUM4dTcweUJUNG50WnNKYk9QNUpmUkpjT2lVTWpjanRTeWc1Y3NHMVRGbU92VFA5cFFjZ3NTRmlzbTJVWEMwNzJZcUt4SUpTcFB1ZDhRaWVGTWdTVkRPcW9LSUNjTGtSTTA1TXk?oc=5
2026-02-21	Google	-0.15	‘Grief lives in every memory, so does love.’ Family holds 10-year vigil for Kalamazoo Uber shooting victims - MLive.com		https://news.google.com/rss/articles/CBMi6AFBVV95cUxPWTdkaEVKM0NMR1VaZXpJUEUyOFM1ZXV3ZWFxR011OGN5THhRQy1IS2taTU80TFZqRlBFdTFFaU5fOGZnNnNWblhxMnZWMTRJZ1dRcmRIM3ZrQzFMaG9rTGRQdGptMGx3emRQTlZJclAzMWVvbmM1VVRNVURjN0ZYOEZiM1c5aVBsVUFJVm55dEk2U1IwSkE4YUVMRTFxQUFfdW93MHRTS0lRclRBZlhpdjRjYk80clhpQXpVemFEM1pvRnhxWmNhY2xHUkFjVXFUazdNelg2VzdKaGx2QWdBSDJCZXVpSDN30gH8AUFVX3lxTE5nSl9JR0x6TlZYWHhCVEdIRzhTQ3NuLWNTcmZIS2U2RlEyZDBqaDQtWDJMR1FOcldwOHdTQmJ3cmRwTnRVV2ZncWRMako1X3VGQUFsN2lqOHVmTnBOdzFUREItZDlpNnZTbnpWUmozUXpVdFNwRVNwQnJQYW9WYWxid1J3aGFzSW1FZHFBeXJkRW5qWGRVMHJmZGktc3dfMXNrMXBiNS1Fb0FzRk5FY0hQRFNJd0x5Y0pJaC14am5UWFpxWmxKTGFDZ3dKMTdRRGpwZlZzSEJnTjFhbHVsN1FFLV94Z1ZQcUREdEZKTUQ5QlE4Zm1ONDlRUWdvRQ?oc=5
2026-02-21	Google	-0.182	Drunk mom abandons kids with Uber driver to go drinking - New York Post		https://news.google.com/rss/articles/CBMimgFBVV95cUxObktvaXRkM3hCRGZsMDREMDU2RUl3Z3FRNnpNWE1qUEdfblZaX1BnWkZMX0xITVBGdVVoWTk3UGhfeE54S1FNdEFZRTZ5MFZfbkhpQm5ZaWFzYUJ4LUxZYk1rTDFhRlIta3FyRjg0UUE4S25aUTFfNy02a2NNRXJfNnpKQjM1LUhiSWFCYlh6LVU5M3NXU1VKODNB?oc=5
2026-02-21	Yahoo	-0.25	"Say Hello to the Tech Superstar That's Staring at a Multi-Trillion-Dollar Opportunity (Hint: It's Not a ""Magnificent Seven"" Stock)"	This company's CEO just eased investor concerns about what appears to be a big risk.	https://www.fool.com/investing/2026/02/21/tech-superstar-trillion-dollar-magnificent-seven/?.tsrc=rss
2026-02-20	Google	0.8	Great: Uber Eats robots are delivering food in Philly - The Liberty Line		https://news.google.com/rss/articles/CBMib0FVX3lxTFBGUV9jUkhJSTlwT2IxTjhTcWN1MnlxYmdsdldUNHpRY2g0WWhMSldCdlpkOU5YcUlfMHZPMURJbmh5YVVaZ294WjYyNjVENTctcFg1cDJJa1FJeDRUMFF2N1d0cmcybzEwb2lUUlhsYw?oc=5
2026-02-20	Google	0.5	Google Maps, Apple Maps, or Waze? A former Uber analyst shares which app is best. - Upworthy		https://news.google.com/rss/articles/CBMickFVX3lxTE4xZVpQa0xUanBvbjhhMmJYeVp0eXoyVnNab1Bod0N6a05HXzlqOGdrSXRndDlqRHk2NzZ4WGMxZy00VzVIQVJkTVl0anlaVDJEVHlQTnI4eHQzR2tiMWk4UkhwX0ZxbmFFdjJTbFltRHN1UQ?oc=5
2026-02-20	Google	0.5	Lyft Must Share Driver Records In Uber Sexual Assault Suit - Law360		https://news.google.com/rss/articles/CBMinwFBVV95cUxOOUdOOHg3WGp3VzdrS0pFRUxoTm43dVlmcjFsWkhJSW56VURZYTNyMmR5TjBpVkRPZHR2MVlxdFpBbWcyYi1oU0o3WktJQ1hvRURRcENpVmhOMnB3LW56bWRmSDZEc25pR3hGUmp2MEUtYUVRZ3d0akFyay0xTmlJN1JwSUhVZXNjSjB6cUdoUjdCNVNGWmhxWHNUdUJJX3fSAVZBVV95cUxPUlZiUHhMYnowMTZ3M3Y1OTRINWRhdmF0YVBnT3YzZ1RoUVF2SUpzXzl4dDJ1MWMydjFZeWR5enFaWTh4SUJYWGEybll4MXhsNXlubld4QQ?oc=5
2026-02-20	Yahoo	0.5	UBER vs. LYFT: Which Ride-Hailing Stock Is Better Placed Post Q4?	LYFT or UBER after Q4? Earnings misses hit both, but valuation, buybacks and price performance may tilt the scales toward one ride-hailing stock.	https://finance.yahoo.com/news/uber-vs-lyft-ride-hailing-143300460.html?.tsrc=rss
2026-02-20	Yahoo	0.417	Baidu Inc. (BIDU) Boosts Global Ride-Hailing Presence	Baidu, Inc. (NASDAQ:BIDU) is one of the best emerging markets stocks to buy right now. On February 10, Baidu, Inc. (NASDAQ:BIDU) joined forces with Uber Technologies to launch the Apollo Go autonomous ride-hailing service in Dubai in the coming month. The autonomous vehicles are to operate in select locations, with plans to expand across Jumeirah […]	https://finance.yahoo.com/news/baidu-inc-bidu-boosts-global-165501101.html?.tsrc=rss
2026-02-20	Yahoo	0.358	Intuit Inc. (INTU) Launched a New Campaign with Uber Advertising	​Intuit Inc. (NASDAQ:INTU) is one of the Best Dip Stocks to Buy According to Hedge Funds. On February 17, Intuit Inc. (NASDAQ:INTU) launched a new campaign with Uber Advertising to make in-person tax help more accessible by bridging the gap between taxpayers and trusted financial expertise. ​This move is part of the company’s strategy to […]	https://finance.yahoo.com/news/intuit-inc-intu-launched-campaign-201325810.html?.tsrc=rss
2026-02-20	Google	0.283	'Come pick up your kids!' An Uber driver called the police to report that a woman left her children in the car for more than two hours. Body camera footage shows the children inside the car while the driver explains what happened. Full story: http://on.nbc6.com/L - facebook.com		https://news.google.com/rss/articles/CBMi3wFBVV95cUxPcGlQeEZEX0JCaGhZcUwtSzVQWFVyVHc3VXJ0ekh4SW1LSkVkaFg0dVVxUlZPZzlFWUVHNVhkWXlHX2FrTnMyV1dROFVIN3VqajhDVDJUMVNacElha2djMTNHb242RmJCNXpEYW1QdHNEMjdiMHF0a0VVWC1QcWhlSU85T3VxalM1SEtaWmhEbkJsVHBSb19kMUgyTERZeFIxM2lBeUYyb0xyQmFLSkY5V3hhS0g1Wk9WSGN6Tkg2WUZZSEZGdXRIZDhtY3ZkZnRidzJMUjhOYlhlZnJLV0FR?oc=5
2026-02-20	Yahoo	0.25	Here is What to Know Beyond Why Uber Technologies, Inc. (UBER) is a Trending Stock	Recently, Zacks.com users have been paying close attention to Uber (UBER). This makes it worthwhile to examine what the stock has in store.	https://finance.yahoo.com/news/know-beyond-why-uber-technologies-140006533.html?.tsrc=rss
2026-02-20	Yahoo	0.156	Uber (UBER) Price Target Maintained Following Strong Revenue and Mobility Growth	Uber Technologies, Inc. (NYSE:UBER) ranks among billionaire David Tepper’s 10 favorite stocks. On February 5, Susquehanna reaffirmed its Positive rating on Uber Technologies, Inc. (NYSE:UBER) and maintained a $110 price target on the company’s shares. The firm stated that Uber Technologies, Inc. (NYSE:UBER) had “a solid quarter overall” in the fourth quarter, with most vital […]	https://finance.yahoo.com/news/uber-uber-price-target-maintained-084514615.html?.tsrc=rss
2026-02-20	Yahoo	0.133	Klarna pursues ‘Uber’ style customer service model	“If AI can do customer service, it means it’s going to be the cheap customer service,” Klarna CEO Sebastian Siemiatkowski said. “We said the future of VIP experience will be the human connection, the relationship.”	https://www.customerexperiencedive.com/news/klarna-pursues-uber-style-customer-service-model/812763/?.tsrc=rss
2026-02-20	Yahoo	0.067	DoorDash Delivers Fresh Profits with a Soggy Forecast	The delivery giant’s revenue in the winter quarter climbed 38% compared to the same time last year, for a total near $4 billion.	https://www.thedailyupside.com/industries/consumer/doordash-delivers-fresh-profits-with-a-soggy-forecast/?.tsrc=rss
2026-02-20	Google	0.065	Uber Eats, Workday, and Bet365 down right now? Users say services not working | Hindustan Times - Hindustan Times		https://news.google.com/rss/articles/CBMi3gFBVV95cUxOZHY0M05ockdmYl82T2hpNk5RalBoRjYybkg5MnVUOEI5aEFvTnljZ01BZkw5WGhhNHpUS1BlbWMxU0JYazZyMWVxeGFNUWJid3dSZGpRaWhORDZ2QWQyd1R5MnBGb1gwVVB6SUdncG1LTGxwMzE5WnFBYVk0RWp5TUFRTkJ0ZEsyN2hZQlVVTzR5ZmlvVHR6OVN4NlBVcEE4S0hPcWt5THpYUzJnNUd1ekkxd0lhTmRkWnQyQ0dYSTdwNDkyN0dpQ3VRSkxtZVlyTXBGRUVqRW9oSHhVNWfSAeMBQVVfeXFMTmlhN0tuU1pobmJpdi1la0tJWDd3UWU3Y3d1czlPbmx5aFk0T0FhLXIxRWpnUVpJdzQ0X1hrMVhpNmg5TzNWZV9rMm1WNVFfVElVSXFOY3ZidWJsQkJyMkQxNDJKdHJ3TExSZ2EtLWhwWk5uLXlva0cycHdoNlhNZ2t5ckdjTEgyN3paQURRcHBJZVVvQVdGc3M4ZW1YSmlaNTFfbkpEYVNNMGo0bnlsQnptWWRobmFtN25zXzlzWDA2UDZtNTVYRW9XY2NGa3JPRmdWZ2NtV1dZZkVzZ0YwekpSYzA?oc=5
2026-02-20	Google	0.031	Obligatory HitchBOT Joke as Uber Eats Tests Out Automated Food Delivery in Philadelphia - Crossing Broad		https://news.google.com/rss/articles/CBMizAFBVV95cUxQV0Z0QXJORlVWZnEyZEdjRkxxcEhpeFYzSWFVaDVJSGl1dlI4ZWg3YmRuaUpHUUJDeEJKd3A3QVBaRmg2WE44WXhGcVVmUENJZk10cm4yWXBzb3NsOWd4YngzZC1uOTJ3VFMtbGhXa0ZPZmhrX3V4R0dXRG9wZ09jcHpnaVNyWmRjQk5iT1l5TXBMQmNJdXkzb2M5OEQ1WUFDa3Y5YjNWWEdUMTFGVXNLc2JDTFN4WXVSX2NZNjN3THV4c3dNNnEwSGNxNlk?oc=5
2026-02-20	Google	0.0	Allego, Uber cut EV charging costs for taxi drivers in the Netherlands - Mobility Plaza		https://news.google.com/rss/articles/CBMiUkFVX3lxTE1DOFkySC12MFNlU1pvT3pXREMyYjhNSzdzbXVGb0JaNGExTjEzZXk0UFlaVmJ4bkIzUm50SU5pR29kNlVveHAxelo3NzRVdkRtYWc?oc=5
2026-02-20	Google	0.0	Block Adds Amazon, QuickBooks, Uber Eats As Partner Ecosystem Nears 1,000 - Benzinga		https://news.google.com/rss/articles/CBMiwAFBVV95cUxNckdSVmx0Q2V3dU5xYjFCTGlIM2tYV19TOHhxMC1rczFWejREMWtZNW9ZSk1qMi1kLXEwMnVuaGllOFlISW0zYjdUVmRHUUlEaXZpbzhpc2pfQUV2Zmpvc21MdnZtQzI0TjN0S3NnX1B6WXRSWmZBMDZVMWpmU3VWUHBqcC1sY1ItWHRtOVc1RXZqbEZWNUxVdTRtUXplRVRXUDQzcUJ2UVRrcm1rNHJYR010eTgxZW1Wa0JwVHp2SVE?oc=5
2026-02-20	Google	0.0	Consumer watchdog urges deregulation to let Uber-style ride-hailing expand across Ireland - VisaHQ		https://news.google.com/rss/articles/CBMizAFBVV95cUxQeFQyR3l4TEN0UmNkS1lfMVp0TFJkYkxTalVOTGh6cGVwWnhiOUkxdmp2ZzNsNE12Q0JUbU1iN1lCWG5GZXJSMFNDN1ZVS2tyaVRlckFkUEVhRzk4OU9vZlBUMHZLZUE5TEJjNmFPQlh2N0pNdnAwSXJuT0FjVWt5WlRDZXBaNW5nLWtHODVlaVNtV2xBanpXVEFsM3JKRjRad2N1QlZfbHFuazIzbTlhUjRXeVpSOEVid3Y3RHpzZ3NaUmFXckdUT2hpZ3g?oc=5
2026-02-20	Google	0.0	Florida woman who left 2 kids with Uber driver for hours tells police ‘I’m just a mom’ - wfla.com		https://news.google.com/rss/articles/CBMiugFBVV95cUxPaGJBcGI2NzVkOHhvdk5KUVpTT0N3Zk02MFlxdTVzNUQtZlVoelR1QXNVVDF1em8zSkJ0Q2lZeElnLUVRZFhzV25WaTJjc09MY1ltOEFYZzFvYThGR210RjZ4aG8tVnI4akx0aUFodU5Va3JDc3dUYWRBaWhVV0NsV1VpUi1JS2ozSlZDNDc3RUJrbWJwWl9CbHc0WkZjMlJQR2ZoSVBBVHFfQ01ON095bEZUTldKem8yVHfSAb8BQVVfeXFMTmN3RFpnX0RfSUUyaUpGSkZhd3FBdGRhR1pwZC10SThBNWN0VUc5VWdiU2pVejA5M25rSEtsODhiNW1YQzRTM29hX1VmT2RXcjl2dXdSMW8tQlRqS1lySVVmcThlM25GSmhXY3RpUW94bS1yOHdCem5Oa29DT1VBVG9jSHROLWJIbkM0SkY4bkIwMjBKV3A0bHc3LXdFd25YUlRPOHZfYVpETWV2SGZTSzRxWWJjWTQyQTVpQlN4ckE?oc=5
2026-02-20	Yahoo	0.0	GRAB Share Price Increases 3% Since Q4 Earnings Release	GRAB's fourth-quarter 2025 revenues benefit from growth across its On-Demand and Financial Services segments.	https://finance.yahoo.com/news/grab-share-price-increases-3-165300525.html?.tsrc=rss
2026-02-20	Google	0.0	Here is What to Know Beyond Why Uber Technologies, Inc. (UBER) is a Trending Stock - Yahoo Finance Singapore		https://news.google.com/rss/articles/CBMiigFBVV95cUxNbENFalJVclNEdzJOTWNfVkJaSHh3eGYxR1UyZFZlcTJ0eFNsRjZqWHhIS3RGMXdMVHJZNlFyczV1ajNid21NTE55cnYycENjOEFpZFJXRzFzQ0NzTWN4bzNiVXJoWEoxWEMxNTZLbVBlakdKcWhsQXFSSVNvRWYxa0J2ejN4T0JJOWc?oc=5
2026-02-20	Google	0.0	How to hire Uber without a phone - Payments Dive		https://news.google.com/rss/articles/CBMif0FVX3lxTE9aNGNkcFRzQzByc2RwTFVYMGlhYlBLUmcwYUxXajRWLXRINHJ6OTFrZk5pdGdpazc3SENmR3BNOGZ2VUxPd3RoUjk3bThGWGJxZjV3WnQyNWJFMWp5VHY3MEhjVTN0ZTAzOEtic2tVMmJwaGFiT3R5TzhXdzQ3cTQ?oc=5
2026-02-20	Google	0.0	Man says Uber ride ‘went South’ after driver realized he was actually a man: ‘The reason women don’t want men Uber drivers’ - The Mary Sue		https://news.google.com/rss/articles/CBMiY0FVX3lxTE9OT21fc0YzLTdqa3FHVkkxQWd4bWlNY1FCQTBxbDVYOG0tX3pEdjcwWjJOdUlLTEJiQ1hrQ1ZSRkFYUEVLMDNTcmVqdTQzMGoyZGpjSmNmY1pfVGw0d2M1WUY5MA?oc=5
2026-02-20	Google	0.0	Remembering the victims of the 2016 Kalamazoo Uber shooting - MLive.com		https://news.google.com/rss/articles/CBMirgFBVV95cUxNcXEwekk3S0tnemtLMFhuTkpDclJDNWlQaUp1V3lxNXhYdFF4b3EtZzhOd09iODBxdE9LemYzOW9mclBFdHdud0p4U05JSTFsak96N2VobnNBV19rV0REUjAyWWlHNHZVOWRDa05HR1ZXckFRZ3NKX2xLXzZ3SW1MLVFVYm4tQXJsOGhJQUttVVI2UU4wR0hqNGRSVTVRYmphNE04TDlCU0N0cGlOY1HSAcIBQVVfeXFMTURwdzdRQXprZXp3QndNeXF4cTBCcll5ejFNOTNJa0JOOURoZERJb1M3VXBab2FyeExQZXBvQUZ5WnMtWDdlbEs4SE8zSTYtN2ZRY3JtWHJ6MVZXc0l1eGk5Qzc0TUVZeXhxLWhUd053SDBkYWhYM0FZLTRIeVlsRGRCTGVfdy1NbUxKelk4Wm9xSFYyZnVCdkg0VkFZLVRweFRsYUxxUmJIUVp3YmJTem1CQnoyOEpCYW5HN05ldGpfaEE?oc=5
2026-02-20	Google	0.0	Soon you can catch an Uber to see the Northern Lights in Finnish Lapland - Vogue Scandinavia		https://news.google.com/rss/articles/CBMif0FVX3lxTFBjdk1BcjBFdFY1RExXX192TTU2MTZOcDQxRkhEaDBJcURJU1NhbWJ4STZhbmdCYXZ0RlU5dV9KNlFHMnBmbmVzRDBIUjNwdkNqNkxnMjRDTFFtNEpna1U4NWhTZVFBZ19qTmpHWUI3U3BVR0NaczVER25naVh1N1E?oc=5
2026-02-20	Google	0.0	Today marks a decade since shooting spree in Kalamazoo by Uber driver - FOX 17 West Michigan News		https://news.google.com/rss/articles/CBMiywFBVV95cUxNNXBLejJQZ2NUajcta3RhMW5CQXNhOG5wbG5HNmd4OVQ5akRDenFFcFVQb2c5YVhPSUlVS2FIeEpveDJ6aUpkTHQtWVpCdmFhek1QQjFQcWg3dUZhR3BuanFjSUhQR1NWUlNFdXhpTjlYLVR3R1VpOThRSE9JQmZINzg3Z1BVci1zMWNxZ3dTb0IzV3B4WC1SOWUwOFRnNldzb2ZId0Fjby0yR0p0bmUtMG95OUhnVUdCWjVvNnhEdll0VFVQS0c0eWR0MA?oc=5
2026-02-20	Google	0.0	Uber invests in EV infrastructure for its drivers - EV Infrastructure News		https://news.google.com/rss/articles/CBMipwFBVV95cUxNcTRPVzd5THVmTFlWRGhZN1FwLV9DOGwycWVUR3Jjc01BUE0wMUZ3M1FXOFV0OGVUMWlVU2NGQ1ZLZkw0bEhFQUFSTmpVcDdGanNEY1JocWtEc3A4cnBSZkFrQXAtRnFwOXczd1FvNXBTMTJ3Szg0bDZDWFhnbFA3WUIyWk9ac190U1haM3lianpaN0k0Qm5YbTlERDZtUk5seUtjRXZzOA?oc=5
2026-02-20	Google	0.0	Uber launches limited-time Northern Lights-spotting rides in Lapland - Euronews.com		https://news.google.com/rss/articles/CBMiywFBVV95cUxNand5SW5ibldwTzhXc2FXZU53Q2RlQVAtaXNGcVZMdkRBd3NUVW8tWnFnM2hnajJ1RW9UWWNFcG5LeVVHYlpKUjBtWnpYcXJrVUtOSW9pajhXSGxseTk1YjlVR2pXNWxFdGprTXZBbTZQeTB2SGE5QkVnbm9ycnhnWTU3RDZmenRvaTNCWW50YU44cGFMV3RIMzNvb1JnNXJ1aUZHcWJJdFByeHB3UlFPVWdib0NlSHJjcGpacDJVclhuLXk1VDVaZnR5SQ?oc=5
2026-02-20	Google	0.0	Uber to Build 1,000 High-Speed EV Charging Stations in the US, Europe - Thomasnet		https://news.google.com/rss/articles/CBMibEFVX3lxTFBCWlVoNmRVQWtGd2xoWUNOcWRoNGQ5LXh6ODhfNmlyV1lTdGx2aDBNQmNOQ1pGcG1OMVhPVzRiV0JTamNYZlFQRDdkcXZadXI2bmRtemx2ZGN3NjJydG14OGl0N3lrNkpqM1JuSg?oc=5
2026-02-20	Google	0.0	Woman arrested after leaving kids with Uber driver for hours: police - WFLA		https://news.google.com/rss/articles/CBMipwFBVV95cUxNZy1VQmVCQkhCZ1NPQ052VjhWWnFEc3A1SlI3cTZJa0ZNYS1KZ0MwTklYQ2FMdG01c3JFX3JKZ25VRFZtWi0ySmFwUE0tbjBrdkpOdW1OVVJxcXoxcHdXbV81TmFkS0pxSlh0RThESTRLcm5ZcGRQLXpxcl93Z0M4ZjQ0cUdvUGljaFJTQTVyZ0pMZmpXWlNhOWEwYTRiOWFoc3FQM2hVWQ?oc=5
2026-02-20	Google	-0.078	Uber Eats and Bet365 not working after internet hit by Cloudflare outage leaving dozens of sites down - the-sun.com		https://news.google.com/rss/articles/CBMiigFBVV95cUxQTXZ5WnM1RkxFSko1cEo2aWUwSUh6c3diNHlwMVZBcXlzUzVZRmg3QjhlNHZLOUVybWhvQjBhcVl6SlJsdi1VVjBfS0hDSkRWc3BseHdndW5OVWRxcWQxRlp4cjZBeW5OZlY0QXBqbGRURkVSNkJkRjZFVEpxQUhvNUhrWnk4SE4zYlE?oc=5
2026-02-20	Google	-0.083	Uber To Offer Air Taxi Services In Select Markets - Black Enterprise		https://news.google.com/rss/articles/CBMiZEFVX3lxTE4zVjYwTjMwRHBTQmt3V21tdkM1LUtFSUdWOHBxZHN5R0xkRlRXX0VCcXVkc3pTUjNEMG9pNEY0cU1lYUVwMGhCcTh6UjRLbHJKQTFFX3ZKZUFtWEpRaFNTTEtTUno?oc=5
2026-02-20	Google	-0.104	Uber Cracks Down on Driver Background Checks - Newser		https://news.google.com/rss/articles/CBMilgFBVV95cUxQSnB5RDRKbTk0eE1DY056akJ6UTkxY2R5ZW5vMWVkbDBKTm5UUXdNR2N2R2ZWaEtTQzJTTk00S3o4Q01DcWxkZEVkQlR5R1o5YnRKdUlTRnNFZ1hMakh2MW1YdHVRVWc4aDhNaEFBWjE5RHNSVFhsX012cE8wcUlhQ2tGWkNZOE5mbVl4MmlCY2NWV0NVUkE?oc=5
2026-02-20	Google	-0.104	Uber Eats Down for Thousands, Downdetector Shows - GV Wire		https://news.google.com/rss/articles/CBMihAFBVV95cUxPakhNVGZrWkp1emJqR2RIdEZzbmJNMjIwenM3U0c4eE9zNDlnbUdXdlpSSGFYOFBBZFRYMGg1YXFvaU14WEpuMFZfNW5wRnpHT2xuUDBFbEF6a0hBVlF3QzM4ZmNnc0pLcU1LcTJjLXBaNmtnZS1nOVBHQ2F2c0lqd2xCTlg?oc=5
2026-02-20	Yahoo	-0.2	How to hire Uber without a phone	Payments processor Adyen and rideshare pioneer Uber are installing kiosks at airports and hotels for travelers without the app (or those with a dead phone).	https://www.paymentsdive.com/news/how-to-hire-uber-without-a-phone/812535/?.tsrc=rss
2026-02-20	Google	-0.2	Uber: Market Is Likely Pricing It Wrong By Ignoring Its Platform Moat (NYSE:UBER) - Seeking Alpha		https://news.google.com/rss/articles/CBMipAFBVV95cUxNZDRkTUM4ZGYzbUNQOVYyYnFuVFBwRHhkb0ZoXzBXeFVtZ1RsZkFYcU9pbjYxWGd6R1lzWk9HSjdpbHhqVW9mMjVhYjVSaUZxVHUzMmJzOTBiSEZOQ2ZON3JYSlhZa3l2STA5Nk0yYmMzWmpoVG90VnVHWjNnVy1USVZsYU5uVGxpX3RBa0Q0eDdNLWdnaHJTMFdqQWpkYWx0NVJKUA?oc=5
2026-02-19	Google	0.4	Rovaniemi is getting Uber-powered northern lights chases – the free service launches in March - Time Out Worldwide		https://news.google.com/rss/articles/CBMic0FVX3lxTE5jTHZRR1hQaWZKRV9XblJ0TUUzbThkRF9wYmRmV1hJc3VVejkxLUxOeUZ4eGVjcUFMa0FVTjVRbjZIZUNKYTNaZ3pnb3BYUjdTQkhUMF9ZbkNZSVVhaWtTTzUwQk1oeGZiOG1jaV9NSGVUejA?oc=5
2026-02-19	Google	0.275	How an Uber shooter victim family wants to honor loved ones at 10-year mark - MLive.com		https://news.google.com/rss/articles/CBMivwFBVV95cUxNbGZ0YlVBU0JwU2VGclAzYUFlVGJWaU4wMTlEOThKUm1La3Z3TDAwTWI3bHB2dnQ3MzQ5Ni1MSmtON25wMGc2RXlwRHRJS09oTW1RZE9pWUw2V1pPWFNray1nbTc3TDJaM24xX0FSSXRNSWtVX01OSzRCZE1VM2YyMHh4c2F0WTk2dXF5Rlh0QnpaQThiWVB5RGV4eFJicjJsN3RjTkhBS1JtUGhfWnRYbjZaSTd6ejJYaThrN0ZmVdIB0wFBVV95cUxNV3ZrRmZySUItQnhPQk0zTlUwbDVYcjdRbDRIdjVmQTY3and0bG10ckNmMHI3Zk9Jam45YmNNVklPT3NleERIVzVqM2ZTbTIxVHVnb0hHU3ZnSFhWQVJzd0pVdnJvTW1ITmxMc2JHR25EYWhLMW5JRmduanFBX2M2OU1ObVhHSFJabk5jX3dmUlIzV3N5ZS1yUXFkTkJ6RklackpXa09FRk9EYXdNX052and5djRMTnJ4RXJrclBhQTZ6VlV3dnhCUDlVODBPQ3Bmd1RJ?oc=5
2026-02-19	Google	0.267	Turbotax, Uber offer free Dallas rides for tax filers - CW33.com		https://news.google.com/rss/articles/CBMigAFBVV95cUxNQ1FkcmREZWIydmxadTNjYlNlcXA4aHNTRzF6SVNFa2NUNUVjelFheEFmQ192MVRGMndSTGNlRjhrWmFQSUVqQ29YNTREY000Y2M0MTdRNnJHbElpbGRoQk1hSktwNlh4N3dDNE1uSEtEaXlLNEh2Tmt1UVlwanFsVNIBhgFBVV95cUxPVDJSU3E4NkF3My1tdVMyZXVFSXhFZlNFdTJ5Sjd0UUJWTTRDUm1ZdDdnZ0pCUU8ydjdLSGdJLUhjeHFiWGZvcUJXR3BLTUJURFFZaVVwbHFjUFBkdXB3VnhXYWZFb3VlZWJfTXNEb29GQlVtbHR4d2lLaldYcFJyd1UtUzVHZw?oc=5
2026-02-19	Yahoo	0.228	Uber, Latest Victim of Disruption Panic, Still Has Role in Robotaxis	Uber  can’t seem to emerge from the shadow of what’s to come.  Robotaxis are barely off the ground, but many investors already see the market as a two-horse race—with Uber not among them.  Waymo is offering full commercial service in six U.S. cities, with a dozen more slated to come online over the next year or so.	https://finance.yahoo.com/m/8722d53c-f32d-39db-a596-af25208e404b/uber%2C-latest-victim-of.html?.tsrc=rss
2026-02-19	Google	0.212	Uber, Latest Victim of Disruption Panic, Still Has Role in Robotaxis - The Wall Street Journal		https://news.google.com/rss/articles/CBMipwNBVV95cUxON2E3SWkzdWN4ejZvTHh2T1NhbG5Hc1hQNTZlUENpTkFjSUFpTzhGS3ZTMzQxSkd0dlFEYkR6dUpGa0pnSnR6ZFZieGkyQ082a3FkLUM2MlJ5SjRncnZzeV95blB0bU1tNzFYajY4WkE1dTcxNjlFVzZZNC1sOG50RVRhbG1qSGpxQ2gzaGQxbW5NOHYtUWxoUmdKTTlCZXo0dEM5blRmYV9tdnRoTlROdTFZV3MzWnRyQnhUbjZrSTlxVG50a0MxbHBYVWxVU2lCd25CclhMLVhJMDVucm9Bc2ZJSUxTajF0d2VpcFpBSXdZZDBCRW9RWG9WTzBfU3lnTU1DT0tOVlVJdTZla0o0QmhxWF9MbzdHZDhDSWdUT1hVazV4Tk4xcEx5bV9LWXdSbTM4YzdvWEJEZTdhdWNMemYxUG9HUUNTUWVJN0pVVkpRZjN6ZXFUYkMyWWk4cFBuLXJ6OUpLOWdoeURYWlFfM0xuRFVkY1ljMS1VT1llaWpmUGxMVnIzNzFUYXhqU3hmTlpqZTNOQlhxN0FJOUdqREVXaEdEM00?oc=5
2026-02-19	Google	0.175	Watch the newest commercials from Uber Eats, Ensure, Old Spice and more - Ad Age		https://news.google.com/rss/articles/CBMixwFBVV95cUxOdC03TThmMzBlc1RibnVrd01rWDlvd1R5NjItaXFRWGg1WVY1bzJZdzdmZVk1VndlaG5XYy1GSlJ2dFFaUENvSEV2aDdjM2ZLb1NQTldKOHB1MDJLUUFGQ013bHBVaml5MmZEam84bU1MdTZpbjdyVDJuVTNtT3hvMDdhN0lDWXR6YUtkNVBnbHN3eWtiUEhoUmV6d0l6QjRGdGQ1bDg3a0lOb0d6blI5ZmNWVnM1Z18tdVBNa2lIcVpUMlpndXZj?oc=5
2026-02-19	Yahoo	0.16	Uber’s US$100m Robotaxi Charging Bet And What It Means For Valuation	Uber Technologies (NYSE:UBER) has announced a $100 million investment to build autonomous vehicle charging hubs in key US cities. The company plans large scale installations of DC fast charging stations and is partnering with multiple global chargepoint operators. This move is aimed at supporting future robotaxi operations and responding to competitive pressure in autonomous mobility. Uber Technologies, trading at $72.77, is putting fresh capital to work in physical infrastructure tied...	https://finance.yahoo.com/news/uber-us-100m-robotaxi-charging-050952826.html?.tsrc=rss
2026-02-19	Yahoo	0.138	Adyen (ENXTAM:ADYEN) Valuation Check As New Partnerships Highlight Expanding Enterprise Reach	Adyen (ENXTAM:ADYEN) is back in focus after a flurry of new partnerships with Mesh Payments, Gargash Group, Medius, and Uber, highlighting its role in corporate spend, travel, and global enterprise payments. See our latest analysis for Adyen. Those new partnerships come after a busy few weeks that included full year 2025 results. The latest share price is €997.7, with a 7 day share price return of 10.45%, contrasting with a 1 year total shareholder return decline of 44.72%. This suggests...	https://finance.yahoo.com/news/adyen-enxtam-adyen-valuation-check-200810998.html?.tsrc=rss
