Date	Source	Sentiment	Headline	Summary	URL
2026-03-05	Google	0.0	Ex-Dividend Reminder: Astec Industries, Equifax and Star Bulk Carriers - Nasdaq		https://news.google.com/rss/articles/CBMiogFBVV95cUxOUk5vQkhvaGd0MmxxZkM4TzdDSkdhaExqSERQUml6al9uWThpcVRJX252Y3QzLXJraXdVeVB6M2dsVGNoSlIwX3NYX05neDFqbWJlbklKSXdMbWJoTVBFNnhQOUVzYng2M3JwdEhTV3lBV241bHVSQi1sWHVRdkZUVWIwVHZmSUo0dGNmaWdtV1ZaZ1VqaHhtZGtQSVpDMXhFTkE?oc=5
2026-03-04	Yahoo	0.0	Star Bulk Carriers Corp (SBLK) Q4 2025 Earnings Call Highlights: Navigating Profitability and ...	Star Bulk Carriers Corp (SBLK) reports robust earnings and strategic initiatives amid market challenges and opportunities.	https://finance.yahoo.com/news/star-bulk-carriers-corp-sblk-010306294.html?.tsrc=rss
2026-03-04	Google	0.0	Star Bulk Carriers Corp (SBLK) Q4 2025 Earnings Call Highlights: Navigating Profitability and Strategic Investments - GuruFocus		https://news.google.com/rss/articles/CBMi8wJBVV95cUxPcUxYa2dhbHlmUjRSOFFwQlE0b0hJcnZyZWRtVmdXeHJlN2FoeUFpbGZtRnJrTUxyOFNQTmRObGJJemJ4YmRtT3lhLUJiVHNNbzRYTE5fSld1LWRFemU1bEVpN3lxUnRJdWlfbDllY1c5ajJfeDRGRTlTblE1NnlvM1hRUmp3TEZfUWFwTUl1WWNkc3o5WENWVTFJUmpMREs3cE13VjAtWVJsVDI3T2VmSU1Pckc2Zmxjd2MxdVZyN2U0RU5faUtWVHFWRzh3U2VIbllKTzhOM0NveGVTQ3htSTF5N25LTjBhd2ZZLXBLWkVKYjBjLTdGRFExVmpkcUd4N29tOEFsM1hUQ2wzNm1nUm1VdWRqNjl6dkFaUVRrMEFJV3pPQjgwYjlLZ2ZjRkRpaHJJNTVqZU9WTlVDMFEzUTBTbnE2cjUzdk45LTNvdmVVYWpBQ1ZXSmEyeTBSR0xua3ZMLVNuU0dSd0VVa3dtVEF4RQ?oc=5
2026-03-04	Google	-0.078	Star Bulk Carriers Corp. (NASDAQ:SBLK) Short Interest Down 18.2% in February - MarketBeat		https://news.google.com/rss/articles/CBMiwgFBVV95cUxOZC0yTG9DWHVEQ2FQbnlHcU9COHhuNERmQjl2aWVVS2V5LXdlS2Z2aTBMNERMY1l2R2J1Zjdoak5ydjJCekJzTGtwM0FXQ1RHc0RuWUZaY3lmcnFfQjZZazljVGdOYVpEZ2tORjVuMnEtTWl3ZGpaYW8xYXVRS1BicWJfd21uZ00tWW1rQ0ozRjhzVHlESHJFUjdzeUpTQzhCSHIzcUlPWmxPSWlzN2FiaGVIVzM5Vy0waE1abHRKbUo4dw?oc=5
2026-03-02	Google	0.148	Star Bulk Carriers (NASDAQ:SBLK) Sets New 52-Week High - Time to Buy? - MarketBeat		https://news.google.com/rss/articles/CBMiuAFBVV95cUxQNUwyZUpJdDVvM0ZHZ281MDhmTzh0U0NJSjU0T1JYX19kSy1oZ2gzRHdjaTBZeGJpMTJCejlqRWc2Tm5UNm9WZDNUNE1taW1RTWF4VC1RZFg0bGttQnlvMzBUOUFPeFBtX2pFUEJFSkktVGIzNy1FOS1WQ0JWaTlIMDR6ZHlFbmtuaGZqM2hicnN0TnZQcWFBM2RiMUZVZWczdXNiQW1nRUcxOHdManBORHpSVFMyNThG?oc=5
2026-03-02	Google	0.0	Quant check on shipping names as Strait of Hormuz crisis intensifies (SBLK:NASDAQ) - Seeking Alpha		https://news.google.com/rss/articles/CBMiqgFBVV95cUxPeU1aQkZJRzB1TjlCTU1qQlBmRWprOUswclJfcl9RcVJrWElkVWRoSmo2M3A2OVdzMzVJTnM5S1pNZDc3U3RsWWRrYjhrMzl6engwNHdXU3kwUmxhT052bnpMUlM2bGZxS3dNSnhWb3k5NlBMMjNyaC04Y1p5cnVEdUNMUlNKV1paa1EwNEFJT2l6WVpSWTExRV9vM2lVRXk5eF9SdFVBRmduQQ?oc=5
2026-03-02	Google	0.0	SBLK Financials: Income Statement, Balance Sheet & Cash Flow - Stock Titan		https://news.google.com/rss/articles/CBMiVkFVX3lxTE5VTnZvV3VNTEtHOV9RYjFhNENCWGFBMUp1dDNralFqVHpaLVE3bFdaUkhiVnZTVjh2Q1BSblllemc1X3ZPZUtDOUpWdFRaWUw2VmRKWHNR?oc=5
2026-03-02	Yahoo	-0.071	New Buyback And Dividend Plan Could Be A Game Changer For Star Bulk Carriers (SBLK)	In late February 2026, Star Bulk Carriers reported fourth-quarter 2025 results showing revenue of US$300.59 million and net income of US$65.15 million, while its board declared a US$0.37 per-share quarterly dividend payable on or about March 19, 2026, to shareholders of record on March 9, 2026. Alongside these results, the company completed a prior repurchase plan and authorized a new US$100 million buyback program, signaling continued emphasis on returning capital to shareholders through...	https://finance.yahoo.com/news/buyback-dividend-plan-could-game-060654315.html?.tsrc=rss
2026-03-01	Google	0.217	Assessing Star Bulk Carriers (SBLK) Valuation After Strong Recent Share Price Momentum - simplywall.st		https://news.google.com/rss/articles/CBMi2wFBVV95cUxPTGgzUUNtSmpoRy13empsaHh4aWl4UG9PZjMzNGdSbEtkbjZfNWNLZGFQd1M1ekd4dWc2YWlESXdSY21wX3ZZbFZUbngtV3FPcDF5M1JsQnJsdFNVSEpwWkpuZkZOeEJfYU1HYm0tVDF4aEVHRkJXSFJ4NjQxb093OVVkUXItYm5YYUVvQ1Z4T3VZSzF2QjBKLVZqbmZXamJibzBYTXlxbHp4anNMNlB0ZWFMMXFoLUtrWU5DTWZQY2kySkpBYk5ZQzZIckVLcnh3aVplMm4weHJ3Y1XSAeABQVVfeXFMUDNZSG1VN0pqcFVyalkyM2FrV0Zvak5RaWZuaFFUd0g0bVJwS19uOWdQNUZFNlRVZXBZZlpITEJpVjIxZklzcjVyTWdJYlhVOUhVYlkzWDREUXZqWWQzVURTMk5HVlp3akxMbW0zcEZ3UWhOYVJ5eEs3ZmxmM1VrTXMwX2swTWRDVy16TmVid0lxR01GczJhMk4wSnFpV3E5YzdqQnc3UXlTTWc0SmwxR0NCWlJxMFFLdmI1eUJVZjZ6ZDZGOXBtRmUzbjRVMzBOYzZsbk9fSGxZamlnbzhkVEU?oc=5
2026-02-27	Google	0.16	Star Bulk Carriers stock hits 52-week high at 25.83 USD - Investing.com India		https://news.google.com/rss/articles/CBMirgFBVV95cUxNZlExRVVXWjIxbTJwU1EwLVZfMXNQY2RSTXdjaDl5bmhrT2FNQlZSZTV0eEdrMU96bEtRc0UzTnViWE4xbXRhckhoNWFiU21wdEcwVUJNdktkX0dRSFRCa1M0VTRfUzBoUUk3LUplYWNJdzlVQmJjdkk2WWRqMjJHeGpybkxnQkJJeXpnWmlpQXhCTl9jT2J6ekpabV9nRFJ2S2w4SHVkUHo0UmN3UHc?oc=5
2026-02-27	Yahoo	0.1	FRO – Changes to the Board Composition	Frontline plc (“Frontline” or the “Company”) announces that Mr. Ørjan Svanevik has resigned as Director of the Company. The Board would like to thank Mr. Svanevik for his considerable contribution to the Company during his directorship. At the same time, the Company announces the appointment of Mr. Mikkel Storm Weum as a Director. Mr. Weum is employed as an Investment Director in Seatankers Management Norway AS, responsible for Sale and Purchase, Newbuildings and Projects. Mr. Weum is also servi	https://finance.yahoo.com/news/fro-changes-board-composition-213000157.html?.tsrc=rss
2026-02-27	Yahoo	0.073	Star Bulk Carriers Q4 Earnings Call Highlights	Star Bulk Carriers (NASDAQ:SBLK) management highlighted “solid profitability,” continued capital returns, and a strong liquidity position while discussing fourth quarter 2025 results, alongside updates on fleet investment, environmental compliance initiatives, and dry bulk market conditions. Fourth	https://www.marketbeat.com/instant-alerts/star-bulk-carriers-q4-earnings-call-highlights-2026-02-27/?utm_source=yahoofinance&utm_medium=yahoofinance&.tsrc=rss
2026-02-27	Google	0.0	Star Bulk Carriers Q4 Earnings Call Highlights - Yahoo Finance		https://news.google.com/rss/articles/CBMiggFBVV95cUxQekw3MDdUZWd3Y3ZOSzhELUR6eVJTYmh0M2cwM25sTnNJa1pDRzdGdFp2bmhRbE1rbExQS29BVHhUUE5DOGIyMXFJV3ZMekVGa25Db3ByZXp5VVdMX1RZR0hrQ1V4ZnhPRGZKUC1PTUk2VVg0c1VfejJpSGN3QUU1X2NB?oc=5
2026-02-27	Google	-0.05	Star Bulk Carriers Corp. (NASDAQ:SBLK) Q4 2025 Earnings Call Transcript - Insider Monkey		https://news.google.com/rss/articles/CBMisAFBVV95cUxPV3o0anI5bzZjY1ZscDRIR0VIRkQyZWhXa0QyYTB4X1ZXQmdrMUFBTjZDVEZta0lIQzRwLTVtRTNGY285Rmh2TW5FWnpoR3RQRmltb2V0VW9Ra19tNjVFWnROS3FWRUhzbVNrWDJXVUVndDlucXhPczhubHo2N19RcTlONzJjLVpqX1lRaEFnS3RiSXQxenRMZm03bkI4RUVES3l6NnhNb284VzFZRDU4dA?oc=5
2026-02-27	Google	-0.3	Is It Too Late To Consider Star Bulk Carriers (SBLK) After A 71% One-Year Rally? - simplywall.st		https://news.google.com/rss/articles/CBMi2wFBVV95cUxPS0IxMDlSN202b0k4RVNOOVdQOFZOZ3RfMnlwc3ZBYzZwSldaaEstc2JuRG5LOW5pN0hIV2RKeGd5OFN0UTVTaWxwN1FwVkV1dmRUcWI2Zl9OMXU4NkxJRFIzd3R3bEtRV3NIWFdGMmNJSTZEWXZGUm1oNHBkdVl1bHpCWDlBZ3VsNjRhNDZ2MlJRYjFJZ0x6aWt1SnQ3WGMzRmZ2UERfZVRaYTF6LUxPZG4xeHpoMWlXXzNKSE4xRnlUcW9FbmpNNFV3dS1iX3MyYWlUc3Z2YXEzenfSAeABQVVfeXFMTnhVc1NHanZiWERpNTJISkFpRUd5aGJwODl6eUxaNVVJN3ZJU2loZUlmMlN1OGQyR0ZhOUd3TnU4WkVTTDFsd3ZYVWpVcGVZNjBnSnlZaHlndVFmYXN1Mm10U1FCQkFyOTFPMU9uMXRFOWNmZGI5VHpYcThUV0NVdnRNQ3JlZEpMdzYyUE1IeG5iQzNCQjJMbUVBS2ktQzBhYmNpSHV5ZnF2MV9uMWFWTW42YkNDd1lwVDZBNnVqY1VqZU1Nd1RlRnMyb0VtY3ZESTFWdU1Nd1Ztb0JhdG9IcWU?oc=5
2026-02-26	Google	0.33	SBLK: Strong Q4 profitability, disciplined capital returns, and positive market outlook highlighted - TradingView		https://news.google.com/rss/articles/CBMikAJBVV95cUxOclYzb3hDNWlDclkyd2hZZXdScHVJakFKMGVveVBGSy1CUmNXbGQwTVMwMnpGQXBUcGstNElDMnZ6Uks2ZlUwOGE5ak9KQmNwSld2NUhhS1pneUg2TFpjUkJiNVBlTXQ2ZUx4anVEdm5GN0pzTkhxdlRKblZOOGwyVEo2UFg2V3g4a3JjUU5LVVVIem1idXAzVHd2Zm9acVJGMHJxakRNengxaFRkZ0R1czhKSnJOemsxY3ZwUndRLURmYy04UnR4SHNkMm4xak1PdjFZNG9Ja3RGRFFFMy00OVpCdkpkSFdIaTdTb3NaSjVxWDBPcWJXaDFMblowOFExLWJBd0lKMXNnc2doR3FUdQ?oc=5
2026-02-26	Yahoo	0.322	Wall Street Analysts Think Star Bulk Carriers (SBLK) Is a Good Investment: Is It?	According to the average brokerage recommendation (ABR), one should invest in Star Bulk Carriers (SBLK). It is debatable whether this highly sought-after metric is effective because Wall Street analysts' recommendations tend to be overly optimistic. Would it be worth investing in the stock?	https://finance.yahoo.com/news/wall-street-analysts-think-star-143006846.html?.tsrc=rss
2026-02-26	Google	0.0	Earnings Call Summary | Star Bulk Carriers(SBLK.US) Q4 2025 Earnings Conference - 富途牛牛		https://news.google.com/rss/articles/CBMiqAFBVV95cUxPcjI2SENaNWtKVkZmbmNyeldZa1RWZm1TUU91Q1BrTjR3TjFxUloyQnpsWGZ4VlhoQ19CRWJHb2hpWG5KYmlBamo3V2Q5emJadFNfd0ZCOXZmekZveDJXQjVrNmdsSldYcklhbm9TSFpVMWpGNkFHT1B5Qml0RDRMbTVFckFXUF8wNkVreFRvellIck5EcUJUWk1ESF9nVldYTXVYendrTm0?oc=5
2026-02-26	Yahoo	0.0	Star Bulk (SBLK) Q4 2025 Earnings Call Transcript	In today's presentation, we will review our fourth quarter 2025 company highlights, financial performance, capital allocation initiatives, cash evolution during the quarter, operational performance, our continued investments in the fleet, developments on the regulatory front, and our perspective on industry fundamentals.  Turning to slide three, the fourth quarter was characterized by solid profitability, disciplined capital allocation, and continued balance sheet strength.	https://www.fool.com/earnings/call-transcripts/2026/02/26/star-bulk-sblk-q4-2025-earnings-call-transcript/?.tsrc=rss
2026-02-26	Google	0.0	Star Bulk (SBLK) Q4 2025 Earnings Call Transcript - The Globe and Mail		https://news.google.com/rss/articles/CBMiywFBVV95cUxPXzFVNDlMUkI3WXQ3Z1drdEpBc3ZKdExWRzhFc3FJcGxwOG12MmE2UE0tVjVoOUNsbklTd0FaWWR3cmRWOHBYU3BwZ3l2MmJHTUI4NTktanhZQ2E2RDlNWExibFBnVktxeTFUNjBsa0F4dFdaWGtkdFR5OWU1UGVBRHhXNDY0Q2g2a19jNXpZRU5OeTNiTHFrVlFIMlRXOTMzTTM4b0ozRk9Vc2EtQ2RabzBzdXoyQy1FOGRqOE9GSmtfSGt6Z1g0eHI3bw?oc=5
2026-02-26	Google	0.0	Star Bulk Carriers (SBLK) Announces $0.37 Quarterly Dividend - GuruFocus		https://news.google.com/rss/articles/CBMimwFBVV95cUxNblhSQTdTcVNDVTRaRWlvREpoRm5md3htSnBndDJXUUF3ZTlEcF9xN0xhSmNHZ1ZjWVIySThIN0dWZmhKSkNyNVNrdUJaTlRKYjVWZkoyVC1PV0stSkxhVHRpTFB3MXh2MEhielA2cXVaVDlxbC0tdmxyNV81clNvenVZVXNqd3N4NjZkM2tzazVral9kWmlGb295TQ?oc=5
2026-02-26	Google	0.0	Star Bulk Carriers Corp. 2025 Q4 - Results - Earnings Call Presentation (NASDAQ:SBLK) 2026-02-26 - Seeking Alpha		https://news.google.com/rss/articles/CBMiqwFBVV95cUxPWWZoRmRDNk9fZTVaLUFHTkZSd0dyRmU5TVY0ZHV4QXZmX0NQeEZUTENWREl3QXJodDJabHZrWU9OSS1rVjFkWm1BcXU2Sm03NW5BdVUxYThlMHM2bG1RZkNzQklOQWNtcmp0VnJ2dWx4bnUydVYxUzlrNFI3elZ4VktxalpXNDltcHhxNE11T2ZJb1ZHSHpMV2hUUnk5Z3kta3hZMlBxWkt6ZXM?oc=5
2026-02-26	Yahoo	0.0	Star Bulk Carriers Corp. Q4 2025 Earnings Call Summary	Moby summary of Star Bulk Carriers Corp.'s Q4 2025 earnings call	https://app.moby.co/home/research/tools/earningsCalendar/earnings-star-bulk-carriers-corp-q4-2025-earnings-call-summary?utm_source=yahoo_finance&utm_medium=rss&.tsrc=rss
2026-02-26	Google	0.0	Star Bulk Carriers Declares Quarterly Dividend of $0.37 - Intellectia AI		https://news.google.com/rss/articles/CBMikAFBVV95cUxQUWxVbVVoTWtLTWxLeHIwYS1lV1loQnlFRHZ6d1ZmWGt5YzdIQ09oUnU5ME1COHBhOHdKaXUwYm1qZXJLc3NmUVE0YjVWSDVWbUw5bW9BeGVKR0VrUHViemtzTE9sLVg4Vnk0VzEwRldyRjhQQklzSDlHYV82ZXkwa1NNSFFaVU1lb1RGeXhDUTY?oc=5
2026-02-25	Google	0.0	Star Bulk Carriers (NASDAQ:SBLK) Posts Earnings Results, Beats Estimates By $0.10 EPS - MarketBeat		https://news.google.com/rss/articles/CBMizgFBVV95cUxNMWs0SFM4ZVNsOGJNNWNORGdOME9wN0tfOWhtUDZ4R0NvaGYzRVVRZnpLRmJVNHctOVM0cU1INlNYNUxpdFM3ZUVRc01GVzJZSmFSZEVqQVFkRjE2NHNwWVQxczR1X3JnaFhGS2pleTRYS2tOdVIwaHZQMk0waXB2ZHM4aXRFWHlPUzB4R1RnWlpUS0FxMGFqOWVXRlpzWURfbTJrTUVQdkRBMmJsb0g5M0ZhdGRrRWFxaHJzOXYwOGVRUmZoRHNFSGd3N1RqQQ?oc=5
2026-02-25	Google	0.0	Star Bulk Carriers earnings beat by $0.02, revenue topped estimates - Investing.com Nigeria		https://news.google.com/rss/articles/CBMisAFBVV95cUxNdkJ2S3l2WUMwTkQ2TnVJOURaSk5Jb0NsMTBDRjRwdEU2QV9xU29xbnZqaW5fUkZJYmoxZ2lpaWd3WFp6cGJXbk5xV2ppMF83ZnVheGZlUTJkejJzNkQ1dTlVd3ZhTndjQ0Jhb052dVYyZmxtdWdvQnMzTDRlRm1RNkdHbDVfYkFtS0pKX1d1Sm01RVFpQmoxTkxidnFzdHkxQzV5bW51eHNpR3FnbGR1SA?oc=5
2026-02-25	Yahoo	0.0	Star Bulk Carriers: Q4 Earnings Snapshot	The Athens, Greece-based company said it had net income of 57 cents per share. Earnings, adjusted for non-recurring costs and stock option expense, came to 65 cents per share. The shipping company posted revenue of $300.6 million in the period.	https://finance.yahoo.com/news/star-bulk-carriers-q4-earnings-224438572.html?.tsrc=rss
2026-02-24	Google	0.0	Star Bulk Carriers (SBLK) Q4 Earnings Preview: Key Expectations - GuruFocus		https://news.google.com/rss/articles/CBMioAFBVV95cUxPUlpRUEdQVVYwZDlQU2FQWG1XWEF2RktXOVhqNDZmMTlVR1dmWjhPLVVpbHNRaDZTRjJBZGlwNmVfam5WNktIY0FlYUR5NXQ3NDhOb0xHXy0yTTBZakQwQU1aVk0yMnktd3FieERTX3dZR0NnczMwRlJFamZEbHpTX3ktakxPSEVqVExuUTFFdjZ1em1LbjZOajVITW5ONEQ3?oc=5
2026-02-21	Google	0.0	MSN Money - MSN		https://news.google.com/rss/articles/CBMiswFBVV95cUxQWG1aWVMza19HeUJXOEtiUHlxaEJwS1lIT08xZk5iS1MyU1pjX1dYODhFMml6ZURrOHVTMmhuNS16VUhqenNVemZmQS1XZXNnbDVGSy1JQkMxc1l0d28yQVJaaDBlS3J0Y1hYOEpiVXowU0NnenRFekRhcUQ0WWJjbklyWnZJNG1tekZTSFFUZmUwS0QzbW5UY0VEd2hQenFnNm56aWhXRTFEYm4ybE9zV3hPYw?oc=5
2026-02-19	Yahoo	0.078	Star Bulk Carriers (SBLK) Increases Despite Market Slip: Here's What You Need to Know	In the latest trading session, Star Bulk Carriers (SBLK) closed at $24.99, marking a +1.13% move from the previous day.	https://finance.yahoo.com/news/star-bulk-carriers-sblk-increases-230002856.html?.tsrc=rss
2026-02-19	Yahoo	0.023	Star Bulk Carriers Earnings Beat Raises Questions On Durability Of Demand	Star Bulk Carriers (NasdaqGS:SBLK) reported quarterly earnings that exceeded expectations, reflecting stronger than anticipated operating results. The company is seeing higher shipping demand as geopolitical disruptions reshape global trade routes and extend voyage times. Management highlighted the impact of these trade shifts on vessel utilization and freight activity across its dry bulk fleet. Star Bulk Carriers operates one of the larger dry bulk fleets on NasdaqGS, carrying commodities...	https://finance.yahoo.com/news/star-bulk-carriers-earnings-beat-181258163.html?.tsrc=rss
2026-02-18	Yahoo	0.053	Dry Bulk, Gas (LNG/LPG), and Tanker Shipping Industry Leaders Presenting at the 20th Annual Capital Link International Shipping Forum - Monday, March 9, 2026, New York City	NEW YORK, Feb. 18, 2026 (GLOBE NEWSWIRE) -- Senior executives from leading Dry Bulk, Gas (LNG/LPG), and Tanker shipping companies will present at the “20th Annual Capital Link International Shipping Forum” on Monday, March 9, 2026, at the Metropolitan Club in New York City. The event is organized in cooperation with NASDAQ & NYSE. Mr. Joshua Volz, Special Envoy for Global Energy Integration - U.S. Department of Energy, and Minister Vasilis Kikilias, Minister of Maritime Affairs and Insular Polic	https://finance.yahoo.com/news/dry-bulk-gas-lng-lpg-150000410.html?.tsrc=rss
2026-02-18	Google	-0.1	Star Bulk Carriers (SBLK) Earnings Expected to Grow: Should You Buy? - Yahoo Finance		https://news.google.com/rss/articles/CBMihAFBVV95cUxNY3FQWWFLX1lzNmlFcDR0NnNyZy1rLVhOa3Nfa1R4eFY3ZlpZTXhncWJyVmtyY29iRjFGenJpNm9hQUJzLXBXbmFUdHQzVGRZTDJsZEc4QTg5R0llQm9JckkzSHd1QllnZlhEZUk2dXR5enNyUkFKMTRrZlJ0a0xVMXBhc1E?oc=5
2026-02-17	Google	0.148	Star Bulk Carriers (NASDAQ:SBLK) Sets New 12-Month High - Should You Buy? - MarketBeat		https://news.google.com/rss/articles/CBMivgFBVV95cUxPY01pMEtDRnphZG5jQXBiZUVVcUJTb0kxMEZ1MTlCYkFBbmRjbHhpWVh3cGNjZjdScVptN2t0TE1aRjlmUXVKV3lhWGdqNWRINlZFX2M0d3JUdDhPTkkyT2huZFZWQnpTd2FLSndWY2F0Z09McnlpQjd1QXZ2dW9RMUl5UzFtbjlTZGlYVi05QTV3S2RGV1VndllKYkFtQmItTFF5eXFMWGc5b29XY1lBejczVjl5al9vSE9Rdi1R?oc=5
2026-02-17	Google	-0.078	Star Bulk Carriers Corp. (NASDAQ:SBLK) Short Interest Down 12.5% in January - MarketBeat		https://news.google.com/rss/articles/CBMiwAFBVV95cUxQbjNLSGUzUVRBVFNMYlZ5RW9fbWtWWWZKRmI2YjhubUFXaFAxLVFPRkJ4dnZWWDBhNkFjRW5OdmpSX0JtTEVyaXdjY2tqMElsQlZFa1doUmNnX25ORnpjbVJ4NUNGVThkeV9YNWRSTmxQLXNCWERBbWRFc2gwX1lmelN3a1k5YWtRcHZZbHNGNkNub3dJRDNMSUZXcTlOWndobjJVV29WVkRxMmxEMmxBMkpYTU5sR3FzZU1rREtCM3c?oc=5
2026-02-16	Google	-0.075	Star Bulk Carriers (NASDAQ:SBLK) Stock Price Crosses Above 200 Day Moving Average - Should You Sell? - MarketBeat		https://news.google.com/rss/articles/CBMi4gFBVV95cUxOVzZRM3hjd19fSzZzT2tOWmZjZkhGQ1VTQUlkNi1NRWYzeUtZMmxZRk1STGZJRjNQMm1YX2gyZEFjV2l5WkMwWVZIUnd3UW9rbVZDcjh0TTJka0xwY01TSmFNNWtXTlZiTlM4OG11MnlkWllfSDJGQmdPaWZVY2hDWE90bFNFcmt0eFhDX3NYN3pPT2NqNUNsRVpSVVZDbmdmc01EWEFKSDcyV3N0cm5rZ3BjdlJZNjBWRVd3cUZNTldSSXRpZzlWb3JnTzZLUFl0eWsyUDdQRF9QWHpWTUIxMzBR?oc=5
2026-02-14	Google	0.1	Should Star Bulk’s Earnings Beat and Longer Routes Require Action From Star Bulk Carriers (SBLK) Investors? - Sahm		https://news.google.com/rss/articles/CBMi6wFBVV95cUxOak1QXzR1b3U5VTVib3NwRzFHUzV1UXVtVDU0UXI5QTRuU3ltM1B0T0haZGxXMENUV3VrTkFmb2pxaWhoU3I0WWRFWGUybl9IY2thUWQ1RFlLbkFTMEQybXdGRERIQTFpWjA2Zmh1Nk1QM1VvUGFQMkRMcFo2ZGc0bGJqc1VXd0hYS250TVZ2cDEzRXk4d0lQdjRFR2t0emVPM3JlUXBOUTlySWZ2Zkw3UXVVMGxnbGJkYXVoTm1BTXRSYUU1eUlBd3g5ejViV0R1b2p4NjJRLVhEYzRhamVwRENma1hqQUdtbm5n?oc=5
2026-02-12	Yahoo	0.4	Here is What to Know Beyond Why Star Bulk Carriers Corp. (SBLK) is a Trending Stock	Star Bulk Carriers (SBLK) has been one of the stocks most watched by Zacks.com users lately. So, it is worth exploring what lies ahead for the stock.	https://finance.yahoo.com/news/know-beyond-why-star-bulk-140004732.html?.tsrc=rss
2026-02-11	Yahoo	-0.106	Should Star Bulk’s Profits Outpacing Revenue Shift the Risk-Reward Balance for SBLK Investors?	Star Bulk Carriers recently announced it would release its quarterly earnings on February 25, 2026, with analysts expecting earnings per share of US$0.59 and a slight year-on-year revenue decline. The combination of projected earnings growth and a valuation below the shipping industry’s average forward P/E has sharpened investor focus on how efficiently the company is converting revenue into profit. We’ll now examine how the anticipated earnings jump, despite softer revenue, reshapes Star...	https://finance.yahoo.com/news/star-bulk-profits-outpacing-revenue-121440665.html?.tsrc=rss
2026-02-10	Yahoo	0.327	Star Bulk Carriers (SBLK) Is Considered a Good Investment by Brokers: Is That True?	According to the average brokerage recommendation (ABR), one should invest in Star Bulk Carriers (SBLK). It is debatable whether this highly sought-after metric is effective because Wall Street analysts' recommendations tend to be overly optimistic. Would it be worth investing in the stock?	https://finance.yahoo.com/news/star-bulk-carriers-sblk-considered-143004531.html?.tsrc=rss
2026-02-09	Google	0.148	Star Bulk Carriers (NASDAQ:SBLK) Reaches New 12-Month High - Still a Buy? - MarketBeat		https://news.google.com/rss/articles/CBMivgFBVV95cUxQRVkwQXlLSzRDMmRFWVlhdlkySjNXZERBTkRqcjJRSTVqdl9RcUlYTlh1V0U0TmNiUmhPZFBMTHFIM2lmX0ZJNHFYb2tfdE5lNDlsUWJpU2x5czExUEhHREVHd1A3TVh4c2dJbGxQVkl3Q0VMblVCT0dHTUxQbkV3SWNqOS1EVjNhbFFRNjJ2OGtRbWdkVWU4ZEdBQTJBd3lyY3U3WElSeWpMcmNybUlESEpxVUtkcng2Y0RSZEN3?oc=5
2026-02-09	Yahoo	0.0	Star Bulk Carriers (SBLK) Exceeds Market Returns: Some Facts to Consider	In the closing of the recent trading day, Star Bulk Carriers (SBLK) stood at $23.29, denoting a +2.51% move from the preceding trading day.	https://finance.yahoo.com/news/star-bulk-carriers-sblk-exceeds-230003518.html?.tsrc=rss
2026-02-05	Google	0.0	Discipline and Rules-Based Execution in SBLK Response - Stock Traders Daily		https://news.google.com/rss/articles/CBMizgFBVV95cUxPZjlzZ0NSRDJJR3dPenk1TWNULXNpRTZUZWZqeExWN0kyS3dqNzNnalFLU20xS2Rfb09IWVdPNk13QzU0SFYxcGxsZVRjSzg4WVFlWG12bnlTLUxKRU81N2FockJQS1haWTZXbWw4eEFJRE9Gb3NwcENuWGE4THRmLWMxS2RtS3VTcTlOWndtT0ZSN1dyczVtT0loNEpsYlZPYk5NNGxLdmRfOGk3Y01PZDg0ZGRzRHdIMWNLdkNOMVVGTWxTOF9pcHpMc2dydw?oc=5
2026-02-03	Yahoo	0.147	Star Bulk Carriers (SBLK) Declines More Than Market: Some Information for Investors	In the most recent trading session, Star Bulk Carriers (SBLK) closed at $22.59, indicating a -2.25% shift from the previous trading day.	https://finance.yahoo.com/news/star-bulk-carriers-sblk-declines-230004717.html?.tsrc=rss
2026-01-27	Google	0.217	Assessing Star Bulk Carriers (SBLK) Valuation After Strong Recent Share Price Momentum - Yahoo Finance		https://news.google.com/rss/articles/CBMihgFBVV95cUxOMTlGWGpWb29adGdaa1QwZk9tSlZUeXBhT2w3S05kVldlVjdITXVOcnE1bnlQNW0xZE9ieDFEbTJpT3ZkZktWNUFULWJsMGE1OVBOY3hDWEgxWEVweHE4V1JRQlJQRzFiQ2VGV004dXVtR0RGcHB6SVFWdG8xdUJUWUVRNWk4QQ?oc=5
2026-01-26	Google	0.0	Star Bulk Carriers (SBLK) Outperforms Broader Market: What You Need to Know - Nasdaq		https://news.google.com/rss/articles/CBMiowFBVV95cUxNSVl1M2RudExBVFJfSEZVUFVsQnVadDd5Q0tBaDhwbWdxSzd6OXBiVjBCVEVwVGlLX0FJZDA1TzRXLUJ3Uy1reVFsS1Z3U3lIYi12SkktNzEyV2dQU0lEako0cWZkLUx5UW5RTlpwQm1oUUNhc3E4WDBEaXlrNjRBRkNCcWNrbWFSdmdZN2hWaGt4T1lXZXlpczlOamNZa3ZEeWM4?oc=5
2026-01-25	Google	0.0	Behavioral Patterns of SBLK and Institutional Flows - Stock Traders Daily		https://news.google.com/rss/articles/CBMizAFBVV95cUxQWTJzdEp3SUxneVJwTW5kSjltOWVaTjQ1RmhFU0E4NER2d25mYVhQZU5qYWFqUXU5dkVVOVZmbTV0SzZubXYzdDdlVGdZTmpyM3pZNXBqdmM2alJoTHlhRUtqRlprR3JwN2g0U3JmcEFqSWdweUNQVEdRMGZic3c0Um04QkVzN1hiQ3k3eGoxSUw5akoyUWJNTi1MTktKTURLMlVuSlo5VU1rRGFRb0ZHUTdsQXBVUEN1VHdLLVNXazBrWEdTcHptN05OdTc?oc=5
2026-01-23	Yahoo	0.152	Is It Worth Investing in Star Bulk Carriers (SBLK) Based on Wall Street's Bullish Views?	Based on the average brokerage recommendation (ABR), Star Bulk Carriers (SBLK) should be added to one's portfolio. Wall Street analysts' overly optimistic recommendations cast doubt on the effectiveness of this highly sought-after metric. So, is the stock worth buying?	https://finance.yahoo.com/news/worth-investing-star-bulk-carriers-143004307.html?.tsrc=rss
2026-01-15	Google	0.125	Star Bulk Carriers (SBLK) Rises Higher Than Market: Key Facts - Nasdaq		https://news.google.com/rss/articles/CBMijgFBVV95cUxPRUpLWUhRaUdZSWhueWZvS25GVEhHS0taYnVTem9WbjN6Wmdrb3JUX2FzcUJrWE1EWjM3WGhrX1FRcDVwZTB2NTlZenpDQ0FvREg3SEl6S0E5ZzJUUDdXd3lZXzlvajZwc2M2LUZucU9BQWQ5NWNFV1JaMjhrUUQtcnRHZHYtUFZLUTU1bXdn?oc=5
2026-01-15	Google	0.125	Star Bulk Carriers (SBLK) Rises Higher Than Market: Key Facts - Yahoo Finance		https://news.google.com/rss/articles/CBMigAFBVV95cUxQWVZPWW9qUWo1cXM4UzE1S1M1b2lmS0hJYVk2TmdOSWhaRFJsekdDOXduNWdyT3VfbUxSWFc0bnI2SmotYzUyUXdQR2F1bDN2ZEg3NC0wUUM2RFpxZjlGcGZKYnJDbFE3VVQ1QW44Z19DMHN0ekt0YTFvbnVyaVdfdA?oc=5
2026-01-15	Google	0.0	Star Bulk Carriers Corp. (SBLK) Is a Trending Stock: Facts to Know Before Betting on It - Yahoo Finance		https://news.google.com/rss/articles/CBMif0FVX3lxTE9SRV9nLWpMUE9SMHUzMjNGUnd5V0EzajdCY05ISUo1TTY2cTBWY3BndFIybGE1eDl5RzVMck85MExRTVEtdWlPS09yUjRYQ3FiaXB3STJtbTBVejJuOFNTYWY1Um16Tkx4ZlMwOUd4QlZBeTZ0LTlUZDVFWjd3eEU?oc=5
2026-01-14	Google	0.286	Are Investors Undervaluing Star Bulk Carriers (SBLK) Right Now? - Yahoo Finance		https://news.google.com/rss/articles/CBMikAFBVV95cUxNQ0dZcGZKLTlXd21JY2E0b0YtN0pqWHJpaEZnNDdNZUVaaVo5VnhEenhhMl9ac1pHTGs1TUhROUxxU21LS0F6a0VwQnRtX3UyVWxsMjNjOXpaeEZicTE3cGZrSUpkNTZzT3BIS0c2d2Q2b0tMR1YyZmFHTlZNaG5kazFaYlR0cmo2cU1KUk41VHU?oc=5
2026-01-14	Google	0.0	(SBLK) Movement Within Algorithmic Entry Frameworks - Stock Traders Daily		https://news.google.com/rss/articles/CBMiyAFBVV95cUxNTEMxZ1dpNmtacWhJUHNvOTh2c2tLQUdEVlRXU3dOcjk0bjZkNm1fSG9JUU53ci0tcnM1M1NqTGd4c0V3TE8tVmhQQ3A2UTZZQ0VOUVNqeE1qT0dwcTRPajRnSXp0NURkU29NaHZpSE9DYlFPZ1M5NWFIRmx1ZDItYVpkVjdrWTNVSGVMRk9PUFRyZ1VuUnczdGNxOFpOU2s5RmVneGc4dVd0SGsxMGZRTWZRSURiMi14ZUhDMEpjeVFLalFCdXpUTw?oc=5
2026-01-10	Google	0.067	Is It Too Late To Consider Star Bulk Carriers (SBLK) After Strong Five Year Run? - Yahoo Finance		https://news.google.com/rss/articles/CBMigwFBVV95cUxQdEs1blR1bi1naDU0YThkY0pVc0tfelpzaWx4NFphNGFCQVYxaUs2Z3BsUnR3SUxCNVV5VUU5MUl2eE5kZmRRbU5YR2REeXlZazZtRWFJUk0wMUxwbjlKdFZMTzdFN1hjTF9lVC1WbWtZQnNsY0ZVMV81MlE4QnRVV25Baw?oc=5
2026-01-08	Google	0.0	Star Bulk Carriers (SBLK) Beats Stock Market Upswing: What Investors Need to Know - Yahoo Finance		https://news.google.com/rss/articles/CBMigAFBVV95cUxNUldpdm1rVW1RVTdnNXhmdTRnYkZtSjVvbHd1SnhXQUl0Y1d1c0NoWWcxc2Y4OGhEN2N5dG5jRUVzMXRKRmRGQlZqemxMajJYR1Nva0owcUd0UEE2UUR4Wm5WZ3VReUZOaGJBcmZVWUhETF82eEtGRXVFbFlQUTFUNA?oc=5
2026-01-07	Google	0.0	Star Bulk Carriers (NASDAQ:SBLK) Takes On Some Risk With Its Use Of Debt - simplywall.st		https://news.google.com/rss/articles/CBMi2wFBVV95cUxPcXRyT2lkRWJ5U2xYTmVibDkxUHhZZWxwNTA0ODZKdGIxTVk5R0lZc2N6TXNpVVR6U2NjNk5lVUtfd1g4TEw4dWI0VXVCckdWeTdSai1lWWJScmwxNVVXb0ZhZWZfSFdONXVWend0Xy0zeFFSejB4VzlBcUhBeUNlc2NMdHRRaktfUkV3XzJBTHUxUE9JRUtMTnIzTzhreVVCczN0QTR4dTdVWWUwZm1vSU43NGV2UV9WblRCSzdBYlN5c19rRnBiZE5ubjRqemUycDUzUjVKQW9uMXPSAeABQVVfeXFMTXhiNlFQQ3lWMHJFY2xMMlpkaDE4djNNXzZsREQ4N2NUNHFQRzRKZ21PZ1dTTjZhM1RZMXYyZFVoaVBFWnFCeVY0NEI5a252TnlUUVlnM2FjSl9WenhkU04teEdUYm1IVWVCbkpCaFZ0bnRiTkpYZFV4eWRSeDBrLXJ6blktU19fNzNLaXJQZEJJUDZSMnEzN0c0UjNsMUpUQzdBS3I0b2lWT0dKSjRFNUZBSjRqZ1J5Q3NSaWotWVphcFNYR1dTS2ltOFFQTFoybC13QURDeks3eTN6UkdLTUs?oc=5
2025-12-28	Google	0.2	The Return Trends At Star Bulk Carriers (NASDAQ:SBLK) Look Promising - Yahoo Finance		https://news.google.com/rss/articles/CBMihAFBVV95cUxOOWUtVFJHT0M2cnNFTElNNUFPV2hGeE96c3psb3ZiTV90OThYbktGb0liaFJUNjhuS0V5TmlnYWJzWXk2RGVkRmZINFo4TDNDM1pJNkRjQzZBNnFiSGl2dmF0WU9hY3p2ZHNuNVVtR1N6cFppelhzSkp5bEhyT01sU2xGX2c?oc=5
2025-12-26	Google	0.0	Star Bulk Carriers (SBLK) Rises As Market Takes a Dip: Key Facts - Nasdaq		https://news.google.com/rss/articles/CBMikgFBVV95cUxQc2dRNGxKa2RGazQ0d2w2X1RFeVhNNDFCMEp0QlZnR3FxTXM2Z1F2SGxvMXcybHItZXF6Vl9lQWxWNnl5dmN5OXBYamZqc29fblptaHN5aFBpS2w3ZGNDTlY0bVdqZ2Jtb2dKQlo1bmJFb09UcDZvOU1QNE1wOVVMTnUzZjlyc2Z0MlVYVE5nVkJ6UQ?oc=5
