Date	Source	Sentiment	Headline	Summary	URL
2026-02-20	Google	0.155	Yankees: Gerrit Cole dazzles in first live BP session since surgery - Empire Sports Media		https://news.google.com/rss/articles/CBMitAFBVV95cUxOMGV2alZzalBUMlBnSHdjcU50UEktOHk5QnU2Vm95Y0thR3BDaFZ3X2Z3a0NZbEg1VU51bU1ESTRkaVRZRGlwZWFCODNNTVl1SFpRWm5KbXh6QXdKXzVNYlM2MHBWTzFHa2dvQW5lOG1uX0lWLUhQZExfYW43M1V3YmoyaTNCMXB1S1J2ZUxTY3hMZk9pbFFjdHU3dEMtYnJveTY2SE5iQjZSWEtRTUFhejlkX0Y?oc=5
2026-02-20	Google	0.136	Ryan Weathers in live BP at Yankees' camp vs. Ben Rice - Bergen Record		https://news.google.com/rss/articles/CBMiygFBVV95cUxNVFlRYXE3SGJTNkpnXzhtN0k4OWZBVmM3ZHFhZGp6LTVqUTdNMkJ0Ul9idE5oeHBlV3F5SURfTTV4MUV3UHBRSGU4dTB3WEZwV29ZUE9mRklGS1pQaF91cmMxQUtxMXlaMDJFdTNnVlhzdnVQYWp5N2lQS25MdDJQLXBlTDhVOFZxOEZTLXprZjUyQzNVODJvRG5wbElJbU5KOTVKY2xycGdzWWlCOXRBZmVSZDZ1UzdHT3VUZDB2RmhxT01KNUFReDdR?oc=5
2026-02-20	Google	0.091	Aaron Judge vs. Gerrit Cole during live BP - Bergen Record		https://news.google.com/rss/articles/CBMiuwFBVV95cUxOZC0yeWZROU1WbUtlajk3NmdON3ZaMi00dEh1Umhfam5SdWJGQTdJRHM4M3E5anlmSlpKYUxQNnpiYXFYa21INlhsTnFaSTJjWmtqa25acU0zNVZSRkNWRG5jek9QeDRiQ1NBVjZTeG9WWDVVTDRsazFTbi11Z0pMREJ1WkhuU2VDaXUzSzVoUURzR2VxbGRDTF84dVNiVUpzbjV2eVdNQW5KUjE4MTl3NC0tbDN3b19yNHBJ?oc=5
2026-02-20	Google	0.091	Nolan McLean on live BP outing, rock-paper-scissors competition with Juan Soto - SNY		https://news.google.com/rss/articles/CBMinwFBVV95cUxQS3RMY3pFdXZxNzdMZzRsczNzanNaLXRtTUI1VlhGenNmV053RWx6dDV6TElCbi0tQWZPdU56clpXQVM5dG9pcERJMWZVRUREbXhEY0VDam9jT3NDVkF5YTN4X3JwQTNlcF9KaEtQY2tQUDJWX1FuczV3eEZfdEhGWlBkdGxkbFRWODFqaVMzUEs2R250aVJmbFZiYkdCYmc?oc=5
2026-02-20	Google	0.083	Drug-impaired driver crashes into Athens BP station - Classic City News		https://news.google.com/rss/articles/CBMiiAFBVV95cUxQcHVVeDVBT1JKdjg3dGdUQldsNlJ6NFZyTGdnNnpodTBUaEV3OG1HcF9DZjFSTXhlSkJMdmc4SDBRdVpVZDRCd3RVaG45U25ZcTlQVHBBeUlvLThIcUdrYndxSUpNY3Azdm5naFVkZDJPZ0ZPY1BiTG5BQlp2RldEeVd4dTQ5U1RZ?oc=5
2026-02-20	Google	0.067	BP stock price dips in London as oil holds near $72 and dividend timing bites - TechStock²		https://news.google.com/rss/articles/CBMingFBVV95cUxPNXVmcnA5WnZiM2xXSExrbjVrX18zclVWeUhZU2JPY2ZWOE1abXRGaWtNMWVqNkVINi1zbDNDd0loNWtiaHFYUkZRZGNvbTd4TEN6YVp4aE1FZVc4NjM1RHBwYS1Wc2drZXhseDhTS1pGNU9LWlhsYnRVb0FWc0hMQ3hCR3NpZFV5Nk1OZ1U1Tk93a1RHbWpndElTTm1qdw?oc=5
2026-02-20	Google	0.0	Aker Solutions awarded long-term MMO frame agreement by Aker BP - Yahoo Finance		https://news.google.com/rss/articles/CBMihAFBVV95cUxPTmtjU1l1MTQ2VmZQbTJObTRJR3hSU1drZ1NuQ0UwelVWLXcyMEF5NHRRS2wyNmw0aGRxeDg4RURhc1JmOHlIVEJEM2dlbWdHU3BsWXZ4YjU4R2JMVlRvcnJUSVBZMHI0aXpGd1RDeWVJaHBnX09fUjdVZllhVHBEMjdHb1Y?oc=5
2026-02-20	Google	0.0	BP seeking six-year union contract, extended strike notice - Chicago Tribune		https://news.google.com/rss/articles/CBMiogFBVV95cUxNSDA4blhocGl6cU5lZmhUZUl2VmV5SFJZd1dFSm1MZmFjZFo4aG9sSDFIN19pVXpvZWQwMGZmaG5oQzhQenRsbWVpdlYyYUlTbDEzYmMwd2lXTDJINkU4TV9oMzdPS01YbmNxTExUNWd5dVBMXzlac2RrVXVqa0xkTURTSjFtOGRHdUhBMi14TlRRX1VDTjNsckJFcUFTNTl1Qnc?oc=5
2026-02-20	Google	0.0	BP, union remain at odds over contract for Whiting Refinery workers - Inside INdiana Business		https://news.google.com/rss/articles/CBMiswFBVV95cUxPLS15V1JVeC00eWZsSHZscC12Q19mT01SMmN6QzhwZHI3S1g0Y0xGX0daclFwdHRLcEhZdGFfb1NJY0pZZGRlalJhTUJ2eGtYdFY5c2lHSWx2MFpZbl9SZkdPQWtWNFpFZlM3RF9JRXNlcThTSzh1QWRCQ2NyNFNlM3QtQ292VkJyUEJpYXR4YVRfM3Iwc1ZQM05aR2taMUItODRHRFJEbC1KUFRCVHFkVDA2aw?oc=5
2026-02-20	Google	0.0	Baduanjin, a Traditional Chinese Practice, Lowers BP - TCTMD.com		https://news.google.com/rss/articles/CBMigAFBVV95cUxPbjRYTzJncWswczdZVEE0MVZDeUFmQUxiMUdBVVZmSWpzbFducDdxbElDaE9OOUM3QURBem1IdWRVOGk3bng5azNtYzVLTlhKc0ZnV3Q2SDZqd19ESVpjZWtqdUEzeDBTbmdINmZGNmxDazRLLTVtVXluaDcteURLMw?oc=5
2026-02-20	Google	0.0	Central Indiana severe weather: Storm brings hail, tornado - IndyStar		https://news.google.com/rss/articles/CBMi6AFBVV95cUxNanNCd0xDMEVwWXRnbksxZkRwMDhQRExnWEpPYURKTDRHcVBRQ0xFNWxwdWFIWkp0RmYwLXhhOHdzcy1WYXRBVVNyOTNneTRmMkZpWUMxZkJFaGRZTXpCS05LejBhS3pjb1JjcXRDcmV5emtURDN4aEhLVVhtSVlLdzV0REw1bmRBdVR6ZWItS3JVQ1p4U3NhMWRLQjBTcUFnbXVhVlEzRUJpMEhzb0RVTUsyemNRMU92TEJCLWtFVFBzc0cxcXZJQTBPZXBBYkNLLUxzaG0zMTdHd3J4N0dyUTZDd2RobG5K?oc=5
2026-02-20	Google	0.0	Gisèle Pelicot Picks Up the Pieces - Air Mail		https://news.google.com/rss/articles/CBMibkFVX3lxTE0wWEZUTTl1cEMzNTBLQ0VtNGhLMGZGRi1vNm5YVXhGMmRmbFpNRk83ZXBSRjFha3hBMkhXZjZnRlFZM19LLXA5aDNyT21EMzRZUy1lLVEtNElKUEotWEJqM0REWFp2Uk9panRrZ3l3?oc=5
2026-02-20	Google	0.0	Imai wows at Astros camp: 'Never seen a pitch like that before in my life' - MLB.com		https://news.google.com/rss/articles/CBMihgFBVV95cUxQT0ozeU1oQjdhSkJkclNvSDVCdlpJV3ljMDBnSGZsQTdFWjVHRDVMc21RX0RTbGg2TXdzNWQ5MzBqenZtdkFQQ0VLSFZib1NSLW5wbEdnUWh3dWVtY0htcEttcXEyS1VrdDJ4dlpsMnQ1VHhDWUI4LTh4azRzLXhRMUJFRUFVUdIBkgFBVV95cUxPQ0FYbjFBRUVrSXdLbTBUeXo1OXROckdWSTZ3d3dDSjNsZjlSY0FubGNEODJGbHk3ZTdHN3gzZ2RGV1NSMGdUWVJhMy1hVTlsTTlWV1dabGJFUmZ2R0tDUUY4TEZuTHl1TUdmaVFLaTB5MGJ2ZlljX1ZOV1hHRUp1cDhDMFFBQkhIVzk4RzZCTkVBZw?oc=5
2026-02-20	Google	0.0	Laredo BP uses drone to apprehend 6 undocumented immigrants - KGNS		https://news.google.com/rss/articles/CBMimgFBVV95cUxNMzIweFdad2kwY1p4RXZ4Zk1NYmpIVjV4YXNUSjgtNFVVVHF2amphRVgtNnNZZEI2ZklMM2E3Nlo2aTRQYWJzTnA4Q0l6c1RqSHJOOG45MmU5TENEa252OFdQTzRMUDVuRXlUTll1anN3MWRVT2RWOWpWUFdzQU4zaTdTbGI2NkcydTZ4ck9feWRURXNicld4TWt3?oc=5
2026-02-20	Google	0.0	Multi-agency drug investigation targets two BP gas stations in Wapakoneta - Hometown Stations		https://news.google.com/rss/articles/CBMiiAJBVV95cUxPMXh3OXVTejlEMHNsWUxZQmxKdTVrejJUdGZHRjlzcDUwbDZ6OFJ1aXY0RzFtUmhqdTFjSm9YOEk5SXRYT0hNNHB0UkNtTTBDRUU3dnpCRnNEZFRlOHA4UWtGeHpyV1hMTlJ0cFdrU1ZvSWRETm9MNUM4S2E0TklweEZHbHltT215cnZZWjk1THB6bTJxSWxOWG5fdjNsNHJ0TnVLcUh5TnlTc1NnWnRyM2JaRUFzZS1Bb2xHUmZkRTg3SFpwWWx3Ymkxa2xFZkFzWTdMcGVid0tpQ0Fna01WTndNTHY0MkRtR21ZQ2R4eXotTVVDM1JuUWF6Z0c2ZUs1Z09VTXVmWnY?oc=5
2026-02-20	Google	0.0	Potential strike at BP refinery is a test of labor leverage in a changing economy - Crain's Chicago Business		https://news.google.com/rss/articles/CBMirgFBVV95cUxQSXZqN2pFR21jUVB6YnJiTWVOOTRBZjh0YU5kc0NyVTRFS0psNkF3VjFkMUlOckU2YVQwNi0ya0Rjd0U0QlVBMmhDZXY3Nktpc3ktbk5aM2JfNFotcTcycmwycDN4NUs1clNaVVZROTZ2YTREVjdYczRwaGQxNmFhU0h2aGE2TVVrRXVjVmdJSW1rYWhZVE5NSm11bmVEZGRRZ0NtSVNiNF9pTnVpYUE?oc=5
2026-02-20	Google	0.0	Red Lake State of the Band Address provides retrospection, reignites future fights - Bemidji Pioneer		https://news.google.com/rss/articles/CBMiwAFBVV95cUxOcDF0Q3RKZDUzZU9MMjluT3dMN2RJeUFqUnh3RDFOcVF1LVZ5U2FZQ1J1X0ZhWV9yTHlOM1FROWRTZFhmQlZKZC14RndYVHBEOTF5UVVzZTZRM2pvc05qbHFnUWxSbXRBdVFsLTdEU2xSOFk5RkRFN1dXRW1vbl9tWV9pdHA0STV5amx5eG96SlpOWDdGVW90dGpvaEtPTTR3ZUdTUzRieDRaNTFrdC1nNnpkRzNCM3d3SHFGNzRGbjQ?oc=5
2026-02-20	Yahoo	0.0	Shell Gets U.S. License Boost For Dragon Gas	Venezuela field could feed Trinidad LNG	https://finance.yahoo.com/news/shell-gets-u-license-boost-150025325.html?.tsrc=rss
2026-02-20	Google	0.0	University Research Reveals Queen's 'We Will Rock You' as the Catchiest Song Ever - AOL.com		https://news.google.com/rss/articles/CBMiiwFBVV95cUxOQzd4Ty1UdVYzNy1nRm5YbzAtN2dkcndSNnZ2M3YxbmR6N19EVHdDWVJfT2hwanVsVXhlT0dzQWp4RWRBWjNFV094dFBnMlhnS0JYNGhsdnNYbVA0RFhXZ09kdGRRMnpNOWtvbGVRaHZCcU1pZllkVEFuZlJRMUhCbGtZcjhFYmZIQlpj?oc=5
2026-02-20	Google	-0.015	PHOTOS: Bronx BP Gibson hosts Black History Month luncheon - New York Amsterdam News		https://news.google.com/rss/articles/CBMiogFBVV95cUxNVnV4YlNNTXVabUNWM3hxSTlYOFpDQUxwdWMtR3BST0tCQW0wd1dzLXpXTG1PbVZRSVYyVHo4WVNvOVBRUjdya183RFB2cTRiUm4yVnZ2andsRGd1TkhJYkFoVzJyNXA1SFh4VE1uWWR5NUt3ZUZZMFVTUVRxMFZTejB5OFBTR25DWlBYc1NURFdjckIwRGlfLVhQY01oaXNxbFE?oc=5
2026-02-20	Google	-0.048	Incoming BP Boss Brings Resolve, Limited Patience for Drift - Energy Intelligence		https://news.google.com/rss/articles/CBMickFVX3lxTE90NHlXN0xmSHpJX0FJcFdIdUZiQk1OaVdxQlhkQm11NTA3VmR3MzR1SFAwek16dk1keVl0R2VMdEZiWEhSdFJjU2RGcFgtN0o0VHNsd1B6UWhKaWdHVjB5YllYYVdpdEkzYk9RTW54QkVUdw?oc=5
2026-02-19	Google	0.8	Addy Brown makes return in Iowa State women's win over Arizona State - The Des Moines Register		https://news.google.com/rss/articles/CBMijwJBVV95cUxQRXNSeWVoN3V1Qy1qM0dTOXNkWDRXbmhPSUZvOWlvNTJRMEhGVXV4NER2ekY3LXhGa0NDemlRX2I4ZTNEZmxpNDlnZnVHaXZHTUR2ckVsaVJBZkNMY1VXNkM1amN1WjRXRWJuUVRKMGoyVVFBTHNpWkt5UlFoRWhEQ1lSNGZweVB0RGZCQlYzOVZZMGVhSzFOZ2ZkZjdnUDF2bVVQOW5SZ25FcE9GX1hFTllZaVFTVE1fT3lmdHhSd1ZtR3A4cEZsdmo2Wl8ySDBoTXk0WV9MR2NZWW9sNmxxNS10UEtPb1VXWF82UGk5WWhnMWt0S0cxYUQzT1VhZzRHN2JfX3huTEg2Z01Dd3JJ?oc=5
2026-02-19	Yahoo	0.4	BP p.l.c. (BP) is Attracting Investor Attention: Here is What You Should Know	BP (BP) has been one of the stocks most watched by Zacks.com users lately. So, it is worth exploring what lies ahead for the stock.	https://finance.yahoo.com/news/bp-p-l-c-bp-140003744.html?.tsrc=rss
2026-02-19	Google	0.4	Despite dominant win, Texas Tech women's basketball not talking Big 12 title - Lubbock Avalanche-Journal		https://news.google.com/rss/articles/CBMi-wFBVV95cUxOQXpLdVVVWTlnSnRkcFhzVTZoVkZ6LTJRTUpSOTIwemdJS0c2am5yNW5TUTFUUVJjT2lmSkdzUUVTVFBSVk9BQXM0SWNDQjNNQnlYRlRTc2hweTgza1E1OHFjVEZuaXUxYUR2a2RYNVVRRGMwUmdFOXhfU01oTGdWN0oyTzBTTVVvdmV5UEtoRmg2MWRBclpTNXktMWtlTy0wMmhzN1ZXWHlaa1EzR0hnRzAtaFJKWTBtWkQ3NHFrMkQwSGgyOGFnMERabGR6NEowb2VIWDFqc0V0RGkzMnlEUWNQNEZUVFJ6WWpfbUFUZmtSdDlheFV5VXdBWQ?oc=5
2026-02-19	Google	0.4	Snow, ice, groundhogs. Oh, my! Freezing weather inspires a warm meal - Bergen Record		https://news.google.com/rss/articles/CBMi7wFBVV95cUxNTkJZbTZYMHU0dm53UkhnbUQwT1RiS2NkMlBMU1V1MDA4Z2FsVEU2U3FpMkV0UHNmMTdCWGd6OGVja19jeHFVTFYwWlhzTVFCdi1RcWFUMjhvTmctc3kyUVN6N1ZvOUU4dVRJa3lYRFlUOHdhMTRNTm9OWGNzVGQwcjRyOUJiaTJrSFphYUNUNlJpajc2RHFGOFVhWUd2MUxmLS1Fb09XTVhqeVpVdWJkZkhnNXlJT19sNGJSR0J4TkxxdncxRGdobmVGQVhwZVoyWFFXQXg2Qm9RNWFMUWU5bU1TOURfMXFQRTZpM1d6cw?oc=5
2026-02-19	Google	0.4	Texas Tech women's basketball routs Baylor for second win over Bears - Lubbock Avalanche-Journal		https://news.google.com/rss/articles/CBMi8wFBVV95cUxPdUZ6RHFRYWhxVHp5aC1xT3U4bGJUZUtuZWhqeHgyOVM1OEkzWmRlRWw1ZzIwcy14UlFlM0NGMUlJbjBYRW5CLW5vQkVKdFZQLWhpd2ItWENXYXVkbkppdkdNSzhBakczYjhHbWhKbFYtMWR0MWNSSXlHcE5wZDgzZ19jOGYzV1VxaEVWVVltWGlnMVNfS2I1Q2tzck02QXBuYjdQdXpOdnpjZXZ6cHVub2RLZ2NNVEZuOXhIeUhjN2RMcXhCMWg1X2l2VUZNblZrWEpYRlY1ejVTcGJITlpMdGZsRlUtME84Y0ZjZUJ2QnJHTE0?oc=5
2026-02-19	Google	0.371	The State Street SPDR Dow Jones REIT ETF Could Soar If These 2 Things Go Right - The Motley Fool		https://news.google.com/rss/articles/CBMimAFBVV95cUxQbVpEaXhzUnNNeGpOdm1mMTNsTzlCNU1ReDhYMnVOZVI1YzhZVHh1cW4xWF96c0F2OGV5MGpnV0JrVng1Ym1QOXRaSU5wM2Q5RGdDaWVuUUowV295YlE0MTQ5a2o5YUxkTDdmd1pvQ29QQTBlQ3VCWVp5eUJQYmxsQVlIdGx1VWJ1TlZwVHFSVFBqZlJzakgzXw?oc=5
2026-02-19	Google	0.333	Team USA men's hockey: Top 5 performances vs. Canada of all-time - USA Today		https://news.google.com/rss/articles/CBMitAFBVV95cUxPTHJ4WGhHVmc2WUJkRGgtU3FiMmVQVEUzcFdjUkFmZUNpeEpDTHFtWGNUU1I5OGk5dVRUSkc4RkFBTlVUbVI5MDRlOTZnbXN5eW05cm52MEpHWHZSTjFPczZSRFUwbkJJM0dwcnRVYzVwNmdKRWhvdDJZc21RdXMwVEJJUDZMb3BOQmo5NHBMUXMxQVdoSW1kMnhBc3JMWHN4OF9fTEdRSTZ4V280dnNWaDhLbXI?oc=5
2026-02-19	Google	0.3	MLB’s top prospect launches first spring HR, and pitcher's reaction says it all - MLB.com		https://news.google.com/rss/articles/CBMif0FVX3lxTFBOMWF4ZkpMazVmbmdTamtrNXo3YUY1WEhmSjFYSmpKMEhaQ0lJLVAzQUZpLXdmVEVvRm1qdzBXM25uYTNDaGhob3JwRjNxZ2lkTTJINl9zV3dOcW42MmR5ck04OGd5dG10UjBacUdoY1ZlR2IyWXVoTjVvQWtOOXPSAYsBQVVfeXFMT2JYbVRfQlF5VEhZd3N1NUVsZ0pEdDl6VDRJY1JmMFhNWmc1cFVZM3FZS1MtZ1hDVnVGTW56MWRLNmRUVE9rYk80bXlpS0hIandfRjBxMTBZNjd0dFFZMllmRlJDVXdEbTloS1BneWZKUG1zM2k1ZU45TWFfSTVkWTR6c0RQdXQtVTkzNA?oc=5
2026-02-19	AD HOC NEWS	0.295	BP Stock’s New Twist: Why Wall Street Suddenly Cares Again	BP is attracting renewed investor interest due to its decision to increase shareholder payouts and temper its aggressive green energy commitments. While its earnings have been stronger than expected and share buybacks are ongoing, the recalibrated green strategy has stirred debate among investors. The company's strong US presence and dividend appeal make it a dollar-priced value play with global energy exposure, positioning it as a potentially attractive option for those seeking income and expos	https://www.ad-hoc-news.de/boerse/news/ueberblick/bp-stock-s-new-twist-why-wall-street-suddenly-cares-again/68592715
2026-02-19	Google	0.267	Mikaela Shiffrin Didn’t Just Win Gold. She Changed Her Entire Story. - Outside Magazine		https://news.google.com/rss/articles/CBMipAFBVV95cUxNbGpuQndNRmJ6TVVZNUFuNTF3LXJlcmJOMUxyVUNBZ1lnQmg3cUtXd3d5LUxqUjY1NERXSS1zZDFDZ3V1RnBXQTVlQS0zcDQxWHlPOUdfN1ZzT3E2ckRZazVMTUVSRld2Mnh2Ukg0Tlh0N245dV9TbVNsRTRWRk56aVFHdXhmU1FRbk5RLXEzQUtBclhmcU1HV0J1Rm5fZTRGTTAzZw?oc=5
2026-02-19	Google	0.25	Jaylon Tyson after Rising Stars: 'In the back of my mind, I know I’m better than a lot of those guys' - HoopsHype		https://news.google.com/rss/articles/CBMi_wFBVV95cUxNLXNqcTRhQ1dGZHdhdmhkczUybXBpUlQ0ckF1UnZ6dFllZGpyVFJZSzRoaDdYRW95UWVET3pPLTZRZTZWZXA4N0REN1B4S3NkR1ZwQUE5ZzlUdUNFRld2Zy1lZHRDd0VxVEpNNlBWSEY4aVVacTY4b1ptNWM0MnoxYmN0MmxKNVIxQmRDcGtIRVRVTVcxakxaT1VXSGlXSlAzUXFmYWk3YjNVQTJMZXhLeEpVMUlua05fY2oyME1McVprOEp6U0M1dllfVHR5Qk9POXU5TFUxOXJSVDQ1TFYydFJuay1ZcmxsVmxZYjkxb1JPQzlfUW9SbzRUUHo5RzQ?oc=5
2026-02-19	Google	0.244	An IU football fan comes clean | OPINION - The Herald-Times		https://news.google.com/rss/articles/CBMiwgFBVV95cUxPSlk3eGlxOGoxYnVsbFFFZG5DdXl0RDZkWF9aS1YzS09Sb0drTHlyc1h4U2dRbkU1aTlYelJpRzU0UFNGQmpGMEZCcGhZNjBQOFRncThMbGUzM3k5VnJBVm9QR2lodV9BRm9UanBmUFRYdDdzYlBYNFJ5VGZqczVvdGZPeEIycGhHSFYwa2NRbW96TGY5OTNoZmtydkhoSjZSWHczWDBjWC1BWVc1ZmtVcENiV2VsX0Jld0t0N1hsY2tkZw?oc=5
2026-02-19	Google	0.233	Mario Barrios vs. Ryan Garcia: Full card, how to watch and stream - USA Today		https://news.google.com/rss/articles/CBMirgFBVV95cUxPVElsLV9YSkZOX3ItazNndkZueTBlUlpsTllqWXRtamhLcmtjQktDbGtTZUxNdzlpQlN1UUV5bEVidGtEczVOemstbDBfMmRtT3pTQm9xSGl0aHJmLU02Y2NvQzVOSlZKX2o5Zl9xOWR2ZURCSEZSVjZhR2FmVnFGOV9sZzlZOUFKVzNpanE5Q1Rmd2lXSFE2b0lsZ01RTS1PR09mQnlyaXd2TnVNNkE?oc=5
2026-02-19	Investing.com	0.186	BP stock hits 52-week high at 39.51 USD	BP PLC ADR's stock price hit a 52-week high of $39.51, reflecting an 18.18% appreciation over the past year and indicating renewed investor confidence in the energy giant despite mixed Q4 2025 earnings. The company maintains a robust 5.13% dividend yield, having paid dividends for 35 consecutive years, but faces recent analyst downgrades due to concerns over oil prices and its strategic pivot.	https://www.investing.com/news/company-news/bp-stock-hits-52week-high-at-3951-usd-93CH-4514067
2026-02-19	Google	0.136	Kodai Senga News: Reaches 97 mph in live BP - RotoWire		https://news.google.com/rss/articles/CBMimAFBVV95cUxNc0ZJVDVuZzEyc0FJTFNJVTBjVmRWTG41TF80WFJ1aGV0Ml9YV19mSG1OcW9TUVlWMW8zUjFJSmw1TDF5X0lZVzlVaWg2aUUyelhmeUprRFFjV05MZlB1OFdJSVZSNWxHUmhvZHUyaTZtenNNUm9BdVRyM2J4NENGQmFvdTlaNzd4dkdRS0VpV0ZhSVduVHNJOQ?oc=5
2026-02-19	Google	0.133	This company wants to lock Tennesseans out of the courthouse | Opinion - The Tennessean		https://news.google.com/rss/articles/CBMingFBVV95cUxONG5aaGZ3R1pOUFRxY2RXYnBCaVhXNExCUFVXdjRDcHhUWGpveTJwQ1ZYRm5RSkotT3U1NlhMcXNEelBlc29reks4dGtmS2M4VW5veEYyNHNYV2pmaUhEMXhHcnR0U040VHdFX0Z4WV83M0JzR0VIWjl3WWNBSURRU05qZTBFTVNKbGsyVDhNM3djam5xa1JzYnJET2ZfUQ?oc=5
2026-02-19	Google	0.12	How to watch North Carolina high school playoff boys basketball: Bp. McGuinness vs. W-S Prep, Feb. 19 - USA TODAY High School Sports		https://news.google.com/rss/articles/CBMihAJBVV95cUxPaTk2dE1VV1JYWDN2VG5ZNVgyWjgtWkdVdVpucHRaSEgxclZXNXRsbkp0MERFQ09xZEJUUWtuckFRbFVEenRxRFdIenA3SGs4N1hGS1JNV1JuMFlJS1Z5X0tNeVRLMGZ2WW10OWdGNVNFLVhxZm5XQ291eW5rUERrbmpTMGZSNU5mQlY0d0pCaGZ1ZWFXOHVrRElraGhlRGlSb2s3YzJQU3JQZ3FMQWJ5RWN2S1JXRkdjM1BYRzJsaFJHclFxZldyT1lnNTh5a1VxUFltWFFpTzgwUFc4a2p0eHUtY2c1aUZxRDRLcGp0c3hyN3gyUThjQ0tIZUJqU3dZczVUSA?oc=5
2026-02-19	Google	0.111	Jaylie French redeems late ‘collapse’ as Warroad wins latest OT chapter against rival Wildcats - Bemidji Pioneer		https://news.google.com/rss/articles/CBMi0AFBVV95cUxOT1Z5cGVRSlJRXzFHNmluVFhxWkFiMmJKLTQ5T2V0VnIycjVhUnpHMEU0SHE5aDRKUXBOd0NveEpOVGh4TU9fcXNpTTFFeVJvMC04UkxRdTlsOHlUX3lZYUFCSlpJZHl2OEFvYzZ2VDJXWDFKa0NJSzRZY2x5WGFFY2JyOWJLVDBaMllJakdWeE1kZnJaQXFmbDAzX0djR3NGcnhfTWNybW5xRUpCblNOTjg2RkJGU1VtV0s5bjRuN29VNFJQb3B5LWpUUS1WZ1FC?oc=5
2026-02-19	Google	0.107	BP Target of Unusually High Options Trading (NYSE:BP) - MarketBeat		https://news.google.com/rss/articles/CBMipwFBVV95cUxQdm1NSEVPYjF0R2hNYXlCTXJYYXh2d1hrQ3ZjWm5Mc1JueE9mRHRLN2NrbEFIMWFJYmlpNjJXN0toUkZqMFo0NlU2ZjR4ZGlKWERsWGdNTjU2M0lZS0RlS0tXOTFsdWVVOFBtMkFxbERRQVZidVdtREZBUkFkdVJ6dlpYSTdOYTd4bEo5a2lCbGdGQ1dlSE9rU3Vpdmwzc0U3Y3V4VjRYZw?oc=5
2026-02-19	BP Global	0.107	Shareholder FAQs | Investors | Home	This page provides comprehensive answers to frequently asked questions for BP shareholders regarding dividends, share management, tax implications, and lost documents. It covers details on ex-dividend dates, record dates, dividend payment frequency, reinvestment options, and specific guidance for both ordinary and ADS holders, including contact information for registrars.	https://www.bp.com/en/global/corporate/investors/shareholder-and-dividend-information/shareholder-faqs.html
2026-02-19	Google	0.091	Mets' Kodai Senga: Reaches 97 mph in live BP - CBS Sports		https://news.google.com/rss/articles/CBMilgFBVV95cUxQdWNIeEhyRGl4em1GUmF2NGNzM3ctd1ZFV1JVVk1yZEdaVGM5NUFzUWJyb2d0V0stYVpiSGZ4NVA3REZfSlgwWUZ4anhwYVYyR250VG5EbEVvR1A5R3Fud2pBR1hJN2hnQTNZRTc2VVNsRm5NZUE0bjZEeVhsYjk3YnpIMy1lcWlYQTdURnl4dmxlTU52Wnc?oc=5
2026-02-19	Google	0.091	Scream 7 Might Set A New Record For The Slasher Series At The Box Office - AOL.com		https://news.google.com/rss/articles/CBMieEFVX3lxTE1CdEp3dmJOM3ZZMjZLNk9ybTg1Z0xxc1ZxVHp4RURyYWp6X2NkRG5pZFU1cElNTnJMT1hNUEsxeXNVcHVPU3ozNjN1Q1pfcGpicjlsYVQ3bFVCLXdEZVMxdE55RHlpX193Nm55NnJ5NmRhd3g2SVljNg?oc=5
2026-02-19	Google	0.068	Former Arby's on Patton Avenue proposed for new drive-thru chain - The Asheville Citizen Times		https://news.google.com/rss/articles/CBMivAFBVV95cUxQWWlFQXZHemxvOGJwOS16dlEycnoyUk5VT2tuUkVyYnpVSUlacjhVbnFWSndWeXZNekp5dDI2MENFNkNzUWJLVjdscWgzNld5SWdiX1VtX3hzdk1TMVBMMGRCaGlOa0pTR2pCNFNTMlJ6TC11UjhUaEhsOFhfV0JKYW1TS2ZxRTk0QmJIMVg3aEg2SzEyd0ZobS1OZGNkLXlqYUxnY1dPSXNwbTY5Z1VuQ21EV1QtZ29maTd3bw?oc=5
2026-02-19	Google	0.067	BP offers to save 100 union jobs in exchange for pay cuts, union says - nwitimes.com		https://news.google.com/rss/articles/CBMiiAFBVV95cUxOWndNN2pacnk1dDgtaTJjZXJ6bjdaRW5obXNnQmo0N25sVEozd2JpUDlMN25LZzZDRWJuc1lDV0piUUlRZFBZRXBIczI1SDZzMHZBQUhHUzJzalUzNVhFSFRHd0w5NXdPUGdTTDFCcXZ1U0NhWllENXV3UzZIRkgtM0ZjVWN5Vlpq?oc=5
2026-02-19	Google	0.05	When will the snow end in Binghamton? Historical data offers clues - Press & Sun-Bulletin		https://news.google.com/rss/articles/CBMisgFBVV95cUxOZkt6LVh1OHRqUTA4RFJJQzc3MGdUY3oxYm1uU1c1bThYX1hrTEQ4SG1CZHVkWUpuWko0YnlsQ0NtR3Z0RUxnN0Z3NUVXbUl5SHVWcUo2SWlQb1JFUGlQUXpYT3cyOFVpUUFZc2hxTVZXZGJ4bmhEcHRNVE9tOE1DdHE1ckpKY2tqOUNWUzlxaHJMMDRVa1I1YXF1ZTRxSEdaOWtPMjVNaV9HSVNxWXFraGNn?oc=5
2026-02-19	Google	0.025	Shia LaBeouf Raves About Church, Sex in Wild Clip Recorded Week Before Arrest - Yahoo		https://news.google.com/rss/articles/CBMioAFBVV95cUxNTG93U0N0WGFwUzZqWVc1R3FDNmlGb0FoaVJnYTQ0TDhrVTEyQkRaYmpuRm1sT2I0cS1xQ2ZyRHBTUENlWjBBRWpFcHpKMzl0UFh3NnB2Tk9WdmRRV2xqUm8wQWttdEhpWU42cjlGbFJ3LW5VclctNTVtVG1Wa0dzQktBLTJGSkhUOUNHS0ZnblJSTEVZdGVKQnM5RWhwZ0lD?oc=5
2026-02-19	Google	0.0	15 Wilmington actors who are well-known for big TV and movie roles - Wilmington Star-News		https://news.google.com/rss/articles/CBMiiAJBVV95cUxQZFFlWHBuS2gtT0xlckJxb21CQUxQMmNtaWRYem1fVkhWanZzUzFKR2xYMFJ5RFJjdW15bUxKLWRra3FyT3Jscl85MHB5OUJZWEVCclRZMng4aGE2UDhkY09VYVdFNG1Oam1pZzBnWTlXc1o2UEpmVm9ucnhKaDZYdDdad1ljbmFuSThyTjZsRWU4TWlPaHJ2Q0I1RDlXTkNLMm12TlVxNll2V1RieEt0ZlFOUjJXUmlpRGFONUhQdVltM1BzVExwRmEtSE9jR3pqNk84OFA3SzgzTWFoMkF4MEtZWlVaQmRfSVZ0bHVXNm52eWxrRVduRDB1NVBhb3p1OWhjbktlMFE?oc=5
2026-02-19	Yahoo	0.0	After Years of Buybacks, Big Oil is Drilling Again	After years of prioritizing shareholder returns and low-carbon initiatives, major oil companies are shifting back to a growth strategy focused on expanding reserves and production as long-term demand for oil and gas is no longer expected to peak before 2030.	https://finance.yahoo.com/news/years-buybacks-big-oil-drilling-010000641.html?.tsrc=rss
2026-02-19	Google	0.0	BP (NYSE:BP) Rating Increased to Hold at Argus - MarketBeat		https://news.google.com/rss/articles/CBMingFBVV95cUxQTU9MZ3VsUk9QMHR3TTVDdkpsVnJOeXVsXzBGanNFZGZoQnVVSXYwa2NUSnFtY1pRRUM4U2pwS1dJZF9UazZDaFN5U1hkYV9Lb0l1dHQ4OEJwN25PYjMzSndJcHNXWFZFbDhwMmItbXBVVDFudTJETWNTUV9lS0hBZ1VJNmFGQkpGUHNoaHVGQTdXUGt0QW05UlBtZnd2dw?oc=5
2026-02-19	Google	0.0	BP - Fairfax Times		https://news.google.com/rss/articles/CBMihgFBVV95cUxQbHdxZlplVVczemh0YUE3bFQ4MmdINmExaFlRdDJqTXBQUkRtaWJUUldzX20zY1p5cDFWSmNiVkZvRFROazU4TWRjeFdvM2ZNLURBQU9LZUxaY25JWWZWdzBCMlV4MktWbGM0V3ZnbnhNMmFRT2JQRHNHQzRpTldtSUt3UG5RQQ?oc=5
2026-02-19	Google	0.0	BP ADR Trying To Close In On Key Technical Measure - Investor's Business Daily		https://news.google.com/rss/articles/CBMimgFBVV95cUxQWjZjdzdYUlRzS1V6WkRtSWM2MzFXSl9HVXRkbjg5TTg1dHR5YzdPUTdwWEFtRDlJNkV4UmxQNU9uY2dTd3NmbWQxNTZoNVdkeFpCYWlQVHA0aGNaNllRLVJ3V3lxM3J2SWF1NHM1YmJXdEhZcGlPQlhMa3pUdjFPdlJ2M3hfbzZsUVd6UHRtZlMzeVJfWXd2ODJB?oc=5
2026-02-19	Google	0.0	BP Girls Basketball Teams Adversity - Hi-Line Today		https://news.google.com/rss/articles/CBMibEFVX3lxTE50OXJUMFJQV3lTeVk1SVFSODhtRWdKbC0wVlRtakcwdGhacl9HSnF6QndLTEJZRHROLS1TSXQ0QmNFNkZtYW9jeS1zb3ZQYzBqQlBzV0FxTmdjQTZLbEdMSi1MYUp6SUhnUTJNNw?oc=5
2026-02-19	Google	0.0	BP Targets Across CKM Stages - Conexiant		https://news.google.com/rss/articles/CBMie0FVX3lxTE1UZnJKeXFKUXdVUHprYk1JZGJuV1liQ1RER2RxekxYSGZJY0UzZWtfaEQ5NkptNm5MNE92d1llb2VlcDBsRmhGcENqUzJiMGl0LUhDZ085aDk1MG9STVVRdG03YU5ud25CLU1SREpyMV9SQXdkc0VCOWtOMA?oc=5
2026-02-19	Google	0.0	Bp Confirms Oil Discovery Offshore Angola - Ocean News & Technology		https://news.google.com/rss/articles/CBMiggFBVV95cUxNSU44ZHJhQ2p5NkdtYnhZN3FWclBKX3lYMmdoemRydjNfZE5rTmN3UDhCMFFiUjJ2akN6WEI1UTZYYUFPTHl4ZVk5ZVhITzU3XzlHa1Rfdzd5STlqLU5yNHhRVkk1UEt1VVZuWHZuMFBCZ29MdXBsdkJVRVBXZVV2MWt3?oc=5
2026-02-19	Google	0.0	Bristol-Plymouth boys basketball's Aisiku scores 1,000th career point - Taunton Daily Gazette		https://news.google.com/rss/articles/CBMimgJBVV95cUxOUldkLVdNa3VlRnVFcTllM1NMdzBFYTcxeWVKTTBQdDlNUklDM2xWdWtpRGFqejFJVm9KWW9mRXRjYjlHWFBQeEhFTjU5OTdiTFFMUDF1VnIwZ3hOSm9TVTlQLUpZQWFlSENXZ3hyTDRSMTdIRjNWakVnTDBTZ1pMUHEwM3ZlVl9TcVpEMUhUSWhKUUhhV3VaNzM0S25LaWUwLXFVMDNpN09YWkZFaEhSd0hDWHljWVc1LXg2eldQTHZBUXdoZWowR3cyYzlKazZvbDF0MUtDa2FkWFZIX21fRTlXbDhsdG5fNXJqVzB6RlBWTG5TeVdEbkphV00yLWFYcWpPU0ZyWUxZZmtiQ0F0VnpyQ0tkRnVPMFE?oc=5
2026-02-19	Google	0.0	Carbon Neutral Fuels select Johnson Matthey, bp and Honeywell UOP technologies for UK SAF plant - Hydrocarbon Processing		https://news.google.com/rss/articles/CBMi3wFBVV95cUxOV2hrSGk4LVZqVEhBc1p1UmU2eTFmanE1N01xZXBVWnpxNHBpUTZ4LXRIdDItdlZXLUJnMGtPY191UHhXQVR3dUExLVc3emNxVGZHMmpNeXpxXzFaZXdVdnhUbGlDTFl6clQ4dmdKMnl5X1EyYUNIQk9PQWVuOWY3S2ZlWWhFaHNoTUNjd0c3RTJ3b2Nsa29YLUhMSlFySUREamItQURteTFkZldlcVR3c2ozY0owcF9xNGlQd3g0NmRZVmNGZ3NWYXlHUGVrdl9LNGkzNzNjUEQ0OHJnUWxv?oc=5
2026-02-19	Google	0.0	Chelsea news: Jose Sa challenge on Joao Pedro was a penalty, panel says - BBC		https://news.google.com/rss/articles/CBMiZ0FVX3lxTFBtVlo3ZXhZdktMV1pkU1dCYmxrYjBfQzV0d19IMW5nY2VQX2c0Rml5cEdYQ1V1NVN5TDRGZTFSaUZ4LXdCZ1pydXNJR2VjY1AzV0FKSThNZzBGdHNJQ2tRazhNdVFWQkU?oc=5
2026-02-19	Google	0.0	Fatal crash closes I-69 southbound in Fishers during morning rush hour - IndyStar		https://news.google.com/rss/articles/CBMi8gFBVV95cUxPQU53S2NURzh3SnVxX2pTdkFtVGQzMkswM0dIU0hvNlVnOE9HbE1WV3F1eFVET3cyLTZZVGJRWm42SXo2TXEzVmltUEtWZ3ZiUXNzNU9TSjItYWVoTkQ1SEdpanVrSUhWZmdPMlhrUkswRk5MVXpkZ1F4UDN0aTNfUEZ1aEd2SnB2bHdDdnV4alRLaFZmcGZwNkdILVptY2dselBObnRnSXFpbEpQX1RBbXFWTnI5U3JmTFU4RkJRTTlnRjBfR25jd0xubzYtdkU2THJNR25VWWp3bFpST0daZHFVV1hqcktDclg4TGttNFJYZw?oc=5
2026-02-19	Google	0.0	How Szoboszlai became Liverpool's key man - AOL.com		https://news.google.com/rss/articles/CBMihwFBVV95cUxOZjdOalVqWEJBSEg4UE05cEgxbDBxZ2hPUmJ6ZkxGVjRoWlRZYkp0WWMyWEI4V0I1dnV5UDRrZEpNeGdUVXRGRHp6cHdITXc0dmJHdmFLMFhUTENMa3I1aGNfM2daRjZneUFSZFBEbS00OXBvREp4ejhGU2JLV0FOU245djhHVUU?oc=5
2026-02-19	Google	0.0	IHSAA girls basketball playoffs: Ranking the 16 semistate semifinals - IndyStar		https://news.google.com/rss/articles/CBMi2AFBVV95cUxOSHZ4S3BQUnhRbmVCTHBuOHhUV3g2WXlzQUxFbkVYdU1CeTBESGNPcWVsMjZ0cXJrT2RXek0wbjJMS0cxTDNiYndlT1FYTkFWVkQwenZGTEFBWW9kM2pDRGVoME1aNEM0bzEweGdwRnYxeUlnV09iNzJpX2N2djdqLWdOM2JnVkU2UlVWVHUtQmVZUWhQeXBqZ1RSYjZPazRqcWRtTDZBcmJXTW8xSy01bkRCWDVUVm5rcUVjV1ptZ0NiY2dRaUdUZlFIeEptT29uSnMxRktxTFo?oc=5
2026-02-19	Google	0.0	Incremental value of 24-hour central systolic blood pressure based on blood pressure phenotypes for target organ damage in non-dialysis patients with chronic kidney disease - Nature		https://news.google.com/rss/articles/CBMiX0FVX3lxTE45SU9DakU0YVpRc2NaS3FUUjU4WXBTQVlFNkZBLWR0WHpVQVhjNnNObmw0Z0luWXFCZUQzNGtIT09zM1NtS0s0SlFXUndWNTJHakV2Rms4UV9SakFKNUV3?oc=5
2026-02-19	Google	0.0	Inside Addy Brown's emotional return to Iowa State women's basketball - The Des Moines Register		https://news.google.com/rss/articles/CBMi_wFBVV95cUxPRnJqVUV1YUJ5SEdtZEpxb0F1NGJBNXNKZHlPaGdLUWN6Q1QxMFFIaGJfOV9hcnlzaE5UbFdqelVaWnBDbkllc0lOMUtkS0Vvd2JJdE10TE44ajVEVVdUa05IZlkxREw2SnpCOGdmZG1qdkM0OEgxVGlLT1prR2Zxa2dIQ3JMUHFYSVRMLTBWSXh1SWgzUVFBcmpxN0RxczN0czVzaEktcE9jX0pmdzVOUHVzankzRjB0VWQ0UG90UDU5UWJhdGlpVlNOeDNxZ2dQNVJiRG03bXJjOFQ1WmdfN2hodDFJN3d0MXRIVVFnZUtQRWVBWHE3S0lORzdLc3c?oc=5
2026-02-19	Google	0.0	Interstate 80 reopens over Donner Pass; WCSD on two-hour delay Friday - Reno Gazette Journal		https://news.google.com/rss/articles/CBMimgFBVV95cUxQcWduektVTkVJSG10WXhBLUhHY2Y3SFV4QmQ0b0IyM0NOaGVhRFl5Rkc4Ym9hYXJPZFg0c0loZDlrMVlEblRraE0zd3RVM043VVFqVnZ5d0hWdkJQSExTZFp5RHNncGlUSUtud3JZeUw2c0N0Q2ZQZGZoQ0xZSkhyYjZyQmpmRExGczNIS0tKMXJIVDl5dWZXdHl3?oc=5
