Date	Source	Sentiment	Headline	Summary	URL
2026-02-19	Google	0.0	Shareholder FAQs | Investors | Home - BP Global		https://news.google.com/rss/articles/CBMiqwFBVV95cUxQOG1KYjg2c1J1anpEcTEzZk9ERHFxdWV0SGl0ZldrR0lnUkRhdm05bEVjTnJyVkM0Rnl5QVdTYXZ1MWp1dFBkNFlPeTBPYXdZdDNubC1SeEFLMkwyRndQRVZla2VQaXdpRmNQcXZkcnFxZnU4RlVpZjFEMjBNakM0R2Jld2F6ZVZWOTVsaEVGWE41bGNDbkZ6Wk9FN1BzNmVTSHg0cW5PSS1jQzg?oc=5
2026-02-19	Google	0.0	Tennessee defeats Oklahoma basketball - Vols Wire		https://news.google.com/rss/articles/CBMihwJBVV95cUxPZTZhTkZvcGV0TF9jc3pIRlR1Rm5wQzN5ZFZSNkFfVlJ3Y3JoYTRhZFNuQWxNZ3k1LVJRVnJWdGRGenR1OEhjLTlxNjVUQzJuYTVTV2l1VVNhTkhFRE1XYnAyUzBlSEFhZmFTN1BVYUtpUG5uekloWTh4TU1ObEVjNnhEaHZ3YTB5ZVZuc0pOSUhlell5MkpLRnUyYUpDb0pod3ZlTEthUGplak5mMGN4QXBXT3JlUTQ2ZmJhekZQVVRRSEpneTZFeUVQNk90WFQ3WUJldWs3ejdwaG5zeHVVdnJvdkU4WHd4OWFYMGhhY3luUGNZeEh6YXNXRFhtX2o3SGV0SGl2MA?oc=5
2026-02-19	Google	0.0	Thursday BP: What would be the darkest timeline for this season? - McCovey Chronicles		https://news.google.com/rss/articles/CBMisgFBVV95cUxPNUZDVUlKV2lHTU05azlGd2dDU0JqMkI2cmdLUTdrMW5qNUwtVDdSdmxYMG5BOHpWWmlvbi0xVXZ1ZTFnMWhzYTBuWVZhcmFab01URzFuQ0xEYmtOZUxlejctbUlKc09jQlBtWXRzTWZfV2Z4RGZRSUcySk9VVXR3cGRKUzh3MVlNSlJrN3IwaFlJZzQ3QmZBZTVpQ25hS1ZTNmItWldJOVVSOFhkYmptWF93?oc=5
2026-02-19	Google	0.0	What Gen X Thinks of Millennial Metalheads - PopMatters		https://news.google.com/rss/articles/CBMiYkFVX3lxTFBHNWxlZ0hVZk4xWXBmaHlBWDJfelp6VWJNVmJyRmFKcUlKMGdLMHNlbGRsQW9jM1dGWTJKZmZ0cmV1TnNCSjdOY3BwRUp3cmVYMHRJMUlwR29vRTB3VWdkZXh3?oc=5
2026-02-19	Google	0.0	When do the Winter Olympics end? Closing ceremony date and time - Cincinnati Enquirer		https://news.google.com/rss/articles/CBMivwFBVV95cUxOaW9maHJreUNLSW1rVkFGZjI4RjJsUDRTYklqei1wUXBCQ0hYaV9uaGIwdXREa250VnlVTW8zMzhVUUN4RUgtLUJMWkxkcFQwYy03cUxlYXVSVU5CY29BNXhtVnV6eHE1Mk9ZZWt3VXZXcnlCbHpNWEZDaTZtOF9yUHZHa0RQSjN2U3hYSFMwR3k0enE5cVFkdmZ0UkZmTFA5Z05UVzVUbHdTTEtabUJ2Nl9ZV2NOWjZuaHhCWXVrYw?oc=5
2026-02-19	Google	0.0	bp Azerbaijan vice president honoured with honorary Officer of UK’s Order of British Empire title | News | Home - bp global		https://news.google.com/rss/articles/CBMi1gFBVV95cUxPUE0wV0Z1SHNNWkN6VzJsSlZDc05TRW81OE9EanFPVVFmMjdMY2syaVpQZWZqcHBuUTdyQ3ZZc1pKbnFCVUhYQnh6UTZPS2I4dmtqUFdSVlFIaVA4c2FVcDZUX2NXSG1FN0NvRTRoSjgwRk56QnpnTUJXX2tRQU9ZM0lwYzRTUkxCSFBJdEozNzhZeU9YdHhOWGM2RjJFVmFFU281anRDZFZXako3WmRzZFUyNTFDT0djVjdxMGRMT2J2MkI2M3ZJLTVoOEtVcXRSbXBWWTJn?oc=5
2026-02-19	Google	0.0	bp renews its offshore operations and maintenance contract in the Caspian | News | Home - bp global		https://news.google.com/rss/articles/CBMi1gFBVV95cUxOZXdGa19hYlBESFU5Nzc2WXAwQTU5Q2E3bzQ1ZVpJMm9uYnc1VWdrVGR0MlVvU1VjMVBMMkxjUmdZVXhOSFd3NEw2V3RHc092SEgzVXNMRGhmajRpd1FKSFRscjFPcGdjRnF4VzJ2TkVaLURGSlNjeFdaWldNUzVqNHVVMjFPLS1KYVFvaGFkTFFtMlZQcWFyTWVqMGVSSmZ4cEZoUG0tNTdTZmYyUUhuenJ6dUNtNmc1UHZMaXR0VTFlVGVCQUtXODNRSE1rVGF4ZkFVMWVR?oc=5
2026-02-19	Google	0.0	bp renews long-term offshore O&M contract in Azerbaijan’s Caspian Sea - World Oil		https://news.google.com/rss/articles/CBMiqgFBVV95cUxQTHpwMVB0b19rM1o4SVpwc0YxRzg4bWlxSTBPS2pHV1RzRVE1YWV1VkZjRXl3UWFjWENpVTZyYUhKZlNfOVRNU1FxNFZBYnl6U0l0YU9mbUE3cTV1S2NkZmh5aWExWklwSnV0NFlWYk5qUVA1RUZXclRRQzNUUk5uamhyVDlVdUg1a0JzUVhwN09Pb1ZiZkFsVE9oYmtUNGNFZndvNFM3TTFsZw?oc=5
2026-02-19	Google	-0.02	Weekly sports quiz: How long did Dyche last at Forest? - BBC		https://news.google.com/rss/articles/CBMiW0FVX3lxTFBOUVhGSmtkNEdiaUIzYUpUdzdteTJmZEdaT0ZUTExBYmdoWWktUWV0YUU5T0dGNXBBZVdKR2hNRUVPYS1XcHpOYi02VkowUXBfVEl2MEg1VEF6YUU?oc=5
2026-02-19	Google	-0.025	Bitter rivals clash as US women's hockey eyes Olympic gold medal in final against defending champion Canada - AOL.com		https://news.google.com/rss/articles/CBMifkFVX3lxTE5URUp5RVJobTBkalZBZzB5dkFRbWdfNFltSzc2UlhQcUZXQjZPMUxBZ0E3SzloRjA2bG1OYV9KMVVoNUllYmZkNU1xdTY4Smt1OHktU2hOTUFtRHZ5blFXR01ZbHRhUHJpSjJCZTFxRkFnZzZmOU11emJ1dmRHdw?oc=5
2026-02-19	Google	-0.05	Isolated storms, colder temperatures expected in Memphis this weekend - The Commercial Appeal		https://news.google.com/rss/articles/CBMixwFBVV95cUxQbVNBQWtJbkt3T2VWMlAtbXdGdWV0cmwzcDdCSUtaR0JXUVZjRkpQQVRCbWdDcXhLcXpST1pPbk93czVnZE5HZzY5LTVvRHFJSnpvZ2JZYXE0WTdjU0R5YzJrWUVPV0lMRkN2TFFNV3ZscThna3RacVV2WEJrSUpRTFR6X3IwdjRDVGRVNWNSa1ByY2lRa2tDQ2tfNlhkajRucmNKRkh5blNwa2xOWFNUdUFLQlExdU5YUDduWVNkeTdjdVpoZUVj?oc=5
2026-02-19	Google	-0.05	Rhonda Dorgan's friends honor shooting victim, 'the mother of our group' - The Providence Journal		https://news.google.com/rss/articles/CBMi3gFBVV95cUxPOHNSVUVVeTljVWs0Ykw1WkllNXhtdU1kWjVQbngzZHY4MHY4dVE2akY4TDh2ZEpmYjYtNmdyakdaVWpFb0hZN2FKR3RvSUtDMTIzLVg4YXJ1Wkt5UXRaVC11S1hYUkQ3V29zZHYxVmFwMTFmN05OT2ZnVVJBQmNEbVMxcFhfWWpqZEd4S1ljSV9xTDhHQUxnemcwZTlTTEM5NWdKWjNFX2lPTlFSa184QUlmTmZJb1NreWNScGpfZDFqczlTdzAtdHhGekVmU01qOGMyZ1luNDRycVdCcWc?oc=5
2026-02-19	Yahoo	-0.06	European Equities Traded in the US as American Depositary Receipts Decline in Thursday Trading	European equities traded in the US as American depositary receipts were trending lower late Thursday	https://finance.yahoo.com/news/european-equities-traded-us-american-160611893.html?.tsrc=rss
2026-02-19	Yahoo	-0.062	Repsol Plans to Triple Venezuela Output After Securing U.S. Approval	Spanish energy company Repsol plans to sharply expand its oil production in Venezuela after receiving authorization from the U.S. Treasury to operate in the country.	https://finance.yahoo.com/news/repsol-plans-triple-venezuela-output-193747656.html?.tsrc=rss
2026-02-19	Google	-0.125	Gaza Board of Peace Meets Today - Council on Foreign Relations		https://news.google.com/rss/articles/CBMibEFVX3lxTE5YQTFGQy1helBRdkNFZWhmOUtjVGRVTnBpdXFfTUJuUG1GWTRHWl9HYzFFblQySzlTVGhKQ2JodnlMU25kTjNrdEN5ZkVvZWNUT2w2Y1UycXFmUVBrZk1ZNTlBbVJUakZYRlRjNw?oc=5
2026-02-19	Google	-0.133	2026 Genesis Invitational Thursday TV coverage: How to watch Round 1 - GOLF.com		https://news.google.com/rss/articles/CBMigAFBVV95cUxNalpVaXI0d1JQSUU2bG1XQzVUUVp0SGptOW5fMlotcGE5RmhFbjdlSjl5eHd6MGJmdENUczNYR2tnZjFaS04xSlV5emdGLUlVUWx1d0l5UnFLX05sVkp0RzFOaU1ya0djQndnU29jSFZSZUxTbW9XTXhBMnlabUhzTg?oc=5
2026-02-19	Google	-0.133	Steelers legend Mike Wagner dead at 76, Art Rooney II makes statement - Steelers Wire		https://news.google.com/rss/articles/CBMiygFBVV95cUxQRWU0a3lmYjlfMmJWeU5zZTVRd1pZY3UwRHEtRXp0Z3BEMXFQbk1IdkUtNkNBZzlDVGFqVkJNYTF1aE5ISG83LWdCaE1VSE82VkEtOU5BclFtNVV1LWxrd2JMU0stWEs0X0h0M3U0WWpLNHpsbDNXeTg1eXhLQkh2blVLQXFTTV9Lc1FiWVdIVkk2Mkk3M2RiY1RVandTbzNac25SMTdQcGdDVFMtRkI2T0VZY2V2TWQ1Z1BObE9ZZ3VOMnRNTEJtcFN3?oc=5
2026-02-19	Google	-0.2	The Global Health Reform Debate's Dangerous Blindspot - Think Global Health		https://news.google.com/rss/articles/CBMimgFBVV95cUxPeGdDYS1FaUJXdTZGNVBCMFA0NFFlUm10dGhIM043OWl1Ni1VdkRVbm95d1llUktVVl95Mno0RlVMN3ZWNV9vSlBJMTQyN3dpNk41OEg0WVByalg4NFdCUWtCYTJvOEF1YVFqcHp4ZnBVd2plQlh2d3FqYzhxV01fLTBPTUVOeVNxU2ltOFVUaWZ2ZnZSbU5FNHR3?oc=5
2026-02-19	Google	-0.259	Despite tough finish, Chris Gotterup still atop PGA Tour FedEx Cup list - The Palm Beach Post		https://news.google.com/rss/articles/CBMiwwFBVV95cUxQYXJlVUZqanowRlFZRjhLei12bkxCVkZKLTVCb2VPWjlhSHBBbHZiaGdtRkhjN0ZkSk94UkJpdFJPYlVpalRmZmJJLXJWanUydUpMdjV4QXdLUElaUllPbTB4TDg3d2UxdXJGZnNrS3NCdEJXbnlxZ25MM1V0VWM4RXZpa185MDA1VVlwWlhOS29hRS1DcUdoOEtfRkR6RXk0cXlLOTV3MTE2WlBJSVVqWmlUM1pELWFXZXBxQmVnSW1qbWs?oc=5
2026-02-18	Google	0.325	Recapping latest live BP, updating Holliday's hand, Jones arrives as guest coach, and more from Day 8 of Orioles camp - MASN		https://news.google.com/rss/articles/CBMi5wFBVV95cUxQcnBuSjVULVBrUl9DWnl1YzU1RER1WGR2VWNxcWlkanR0WWlkR0lJOWhiR3pJcmstMlk5eFFRdzFLZEE4TUZMZERGM3FFTDlBaWhtcTlzRjlaUWRuZnI4X2c5ZFZBQS1vY1Q3cDE4YjlMWUFmc2xuYzVJQ285MmExMnVUZmlDRUFhdDBtNmpiSHZNNDhydTcyVUdVRWNhVUVqbmNrNS1aUGdlRVdyZG1kU2tuZHZocnZqNk5yUGdfczVyblBLUkQxYllTR0VrWFIxanRrbG5kME5JMTJwbXMxRGUxa1ltM0U?oc=5
2026-02-18	Google	0.193	Rays get first taste of ABS system during live BP session - MLB.com		https://news.google.com/rss/articles/CBMikgFBVV95cUxQS3dJb05uaHpBRHV3RHN2NFZsR1IyTzVBN0J5R0I4VzY4Mm5BYXk2eFNSakNGV0hRdlg2Z25vUGEwOTJsS1RmWUd3TEpmbHJ2RDdHU0xmcTVXS01SWHh0clJoSjE1Ny1fb2I5eUFJQ3RaRW84Q1BxMGF1ZXZmeDZZbWc4Q24zWW9mTUxJZ2NMbU9NZw?oc=5
2026-02-18	Google	0.136	Shohei Ohtani throws live BP to Kyle Tucker - MLB.com		https://news.google.com/rss/articles/CBMieEFVX3lxTE5MbExRZ05lbUxaY0pGak1vbmtmdXpWQ2NFMW5LODd5STU2UnJNR0ZubDNwelVsWkg3djFDSGt5TTBqR2ZhaFlrTDhRX3o1Y1Q4SlZ5Q3hUSzhNZDctMmQwLTV3MEZmZTc0ZUV0SzhUdGo2cVd2Y0VTbw?oc=5
2026-02-18	Google	0.136	Shohei Ohtani's live BP against Pages, Tucker - MLB.com		https://news.google.com/rss/articles/CBMiekFVX3lxTE1RdkoxaWNveGViUGYwTFppU1RzQWVvTWs0ZnZZVGx2azctRm51bnh1amI5QzVMU2QtSzI1dy1uQmJ2amtYeVhjcFYwbXpFRVdfZ01odllidlNrUG1WVEk0ZGFEMHlGMHZrZGlqd1pZMkJDNGExaEppeENR?oc=5
2026-02-18	Google	0.136	Yankees' rookie Ben Hess strikes out Aaron Judge during live BP - Bergen Record		https://news.google.com/rss/articles/CBMi1wFBVV95cUxOcXF4UW9yWUg3ckZfdW9XQWhUUUVuS1dhUGdaZ1BqaEx5Z2xhOVZaX1VUbmhyekZjYVlqb1VLWThkLTA4Q1pVSndMRFVTSUZtbVNWNHJ3WlRFcmpUSDhTOEpvcUdxZG5GYXZmR3I3WjhHcVFjc1JUc29aT3Q5ZV94UFpZUzRGd1Mza0lQUWRjcFBxZ0NRMDhIQ2lRc0hPUTZvdzZUZHVBNU1QVHFSeEhmN2VKeEJMZ3h5UTA1TFZNWXgxMDF2dkpNSDFfM1ZlVGo0NHFtU3JaQQ?oc=5
2026-02-18	Google	0.133	NJ weather: Snow forecast for this weekend. How much snow will we get - Asbury Park Press		https://news.google.com/rss/articles/CBMipAFBVV95cUxPWjFZSTlXTU5pTnNUcVdlSm9ka3luajhlX1pLWk5RaTU5RVhVc2Q2dVA0MTNOSTFHeGlGemtTbWpWYjhvY09BSFl2b2hDdmMtc25fb2NocnJyMmJiNV9TcG9FWWhHS3Nud1RKRkc4dkZRejdPTmQwM0FtbXJwNzJyN19kTlJOLUNrcDI5dFlibHd6aE9FYXZUOEZaNmhGYmp0OWFyVA?oc=5
2026-02-18	MarketBeat	0.02	BP PLC 9 Percent Preferred Shares (LON:BP.B) Stock Price Down 1.2% - What's Next?	BP PLC 9% preferred shares (LON:BP.B) experienced a 1.2% decline in mid-day trading, falling to GBX 162 with significantly reduced trading volume. The stock is currently below its 50- and 200-day moving averages and shows a negative P/E ratio, alongside indicators of higher leverage and constrained liquidity. These financial metrics suggest a potentially elevated risk profile for the security.	https://www.marketbeat.com/instant-alerts/bp-plc-9-percent-preferred-shares-lonbpb-stock-price-down-12-whats-next-2026-02-17/
2026-02-18	Google	0.0	23,000 products sold under Sysco, Gordon FS recalled for plastic risk - Greenville Online		https://news.google.com/rss/articles/CBMi9AFBVV95cUxONjRfdzZfX3hXYlJ2TmlicEhmbWd5NE1IRjE1dkRFekNTUjVwSF9NX2pkN1JPcWswTUoweUxWUHdfTjhzYUpDYWQ3TVRuUVJwVHFQUFlwOGxiY0VIZVNwd3RxN2ZCODRmcnRfNEZZNmVkYXUtU3l0djdrS1dtRFBRSWF3UUp6Q2JaMkRieUoyWHhtNGxZcE9uN2VQUy1WekQzNTdoNlJyX1dHUjRveTk4UkJfa09pNk9CZ2Z2LVlVdXVmSmk3cnJxZy04RlhDSUtSQ2lJdF9mZ3FUV3JFdnlBbXJNTDl0UDRibU1odThJZFBLR1Zu?oc=5
2026-02-18	Google	0.0	Analyzing Bears' salary cap casualty candidates in 2026 - Bears Wire		https://news.google.com/rss/articles/CBMiuwFBVV95cUxNZ1RUZlJwYVNaQjd4RmU0dWVObEJFRjBKd2RxaWtqdWtBYlJ4UzI3ZHgzSUFpNDJNaDBvZWEzc2pHY3NTNjVGUWFMVDlGMDJNOGZOM0lDUWU1aC1RenZyN0NFUUd6TWRxUkZfX25LUXV1NEdTRWRoQXZ6WHpUTGkzcGVoMEtuQkFwYWZpWThqSWg4dUhacjc1dndjN0pxOFg1YWY3ZWRXS25DamZzaG1XbXlRbFNqejlxb25J?oc=5
2026-02-18	Google	0.0	Anthony Kim's LIV win: Where does his comeback rank among golf legends? - Golfweek		https://news.google.com/rss/articles/CBMixgFBVV95cUxNeVpnYkR2aTdPQTd5NXVNSUxhVnZvSF9VZTNadF81VjFUWV9sV3Q4MU9OZmxXTHlGTjZOY3BhMnl3RTljZVVHM0JBeHk4TVlxQXB4d3I4QzJxYkdVcXJDSGVVOVdZdHAwdWVPZW1IOHFwNmtOczN6V01EWjNFTjU1WVZkb2ktN1FOR0RhUExDZ0pYREY1NE56MEZWaWNiNVh0ZW1zZGVDM29mbXpEMV9GQ2EzSzNDb1NnUjVHbTl2TWNXTmtDOHc?oc=5
2026-02-18	Yahoo	0.0	BP Gelsenkirchen Sale Talks Put Portfolio Shift And Valuation In Focus	BP is advancing plans to sell its Gelsenkirchen refinery in Germany. Sale talks are reportedly ongoing with Klesch Group. The move follows BP’s recent divestment of Castrol as it continues to reshape its asset base. For investors watching LSE:BP, the potential sale of the Gelsenkirchen refinery comes as the shares trade around £4.6045, with returns of 5.1% year to date and 5.5% over the past year. Over five years, the stock shows a 105.6% gain, while the three year period reflects a 3.2%...	https://finance.yahoo.com/news/bp-gelsenkirchen-sale-talks-put-051219650.html?.tsrc=rss
2026-02-18	Google	0.0	BP Gelsenkirchen Sale Talks Put Portfolio Shift And Valuation In Focus - Yahoo Finance		https://news.google.com/rss/articles/CBMigwFBVV95cUxOMkhWLUI4c2lzT2pQTTN0d0k5SGRIZUZNV3pxM0FabVF0NmhRd0hkTWpjRW0xZnIydGIyZG9TMWN0Qk9NZm9jZ1d1VVNOa1ZyNi1jcTMwblBycFk5WmNycWtMVmRUMXVXanhGZnhNYWlwSGREcHVJX3ZKT1hMX1YteGhJQQ?oc=5
2026-02-18	Google	0.0	BP Whiting workers denounce USW betrayal, call for national strike to defend jobs - World Socialist Web Site		https://news.google.com/rss/articles/CBMiaEFVX3lxTFAyQXlhMmJ2QnltLVlJVkhBR0c2UmNzWGVzS0tvcWRIRGJiSzBDenNWYkZhQkJ1Q2hkallwY0RLU1plT1R0Rkl0SHF5Y2RGWFdNTTRyTEN0RlhfbzFkeHlKbUNOZ1lIYzJn?oc=5
2026-02-18	Yahoo	0.0	Eni Unveils Energy Discovery in Block CI-501 With Murene South-1X Well	E unveils the Calao South gas discovery offshore Cote d'Ivoire, which is estimated to hold 5 Tcf of gas and 450M barrels of condensate, its second-largest find.	https://finance.yahoo.com/news/eni-unveils-energy-discovery-block-163900627.html?.tsrc=rss
2026-02-18	Yahoo	0.0	Key Factors to Watch Ahead of Par Pacific's Q4 Earnings Release	PARR gears up for Q4 results as estimates point to a sharp EPS jump, with lower crude prices and a positive ESP hinting at a beat.	https://finance.yahoo.com/news/key-factors-watch-ahead-par-153400635.html?.tsrc=rss
2026-02-18	Google	0.0	NASA will retest Artemis 2 moon rocket after discovering fueling issues - AOL.com		https://news.google.com/rss/articles/CBMiekFVX3lxTE5MUm9ITkEtdDFQM3p0RWE1S01rYVB4enVMellFNzhwYVdVclMyeUVzWGlzRTJ6WXZHNV9ocGJaNVRHT1VZajNYeE5ZbVhDTzNaVm9vQzU3VlV2cWVDc1BjeUdZWmF3dHNOczFKSUhiLVlaLWlUbjdBa3BB?oc=5
2026-02-18	Google	0.0	Playoff-bound stars highlight Girls Basketball 4A-North All-Region Team - Reno Gazette Journal		https://news.google.com/rss/articles/CBMi1wFBVV95cUxPRzhOR1hBa3Vod01zaVdJeTlydWd2M0gweXVFby1fSDdtMFExdkV1X19oVlFYTXZfTU51TVN1dGI4MWswVFdpQzBOLThUSlJzRGZfSG02d0s1dzdfZ2dUXzFUYllyVkNta21kTXdyZkhzMXhydFpINlBEQzdzMVdFeXdfLTM2RmZaVG9WbnExRmxhY3ozQWkzMFBobG9XZWRhNy1RbWRPRFUwMUpNQXZYbUx4R0lya3BRVHVZV09mNi02TS1rUnM3STBUZmk2b084Yi1ZWFd3RQ?oc=5
2026-02-18	Google	0.0	See photos from Ash Wednesday service in Salem - Statesman Journal		https://news.google.com/rss/articles/CBMi0wFBVV95cUxQNFIwTkEwYllqNVA2akY4TmJZaDl6QTZhM2VTdVhOQ1JLdUM4UWYzRDk3U01Bdm5sRmNCOWYzZENDS1NYRC1TV0U2VnpnVnViTzVnSzlIQlRzcjVLSUlVbEhRQTdZZ1V4aks5djVHT256bkljeG1jQU1xTTRxODF2MVFzNjNsRHBnRTF6OG5NV1h6azJESTVjRmJPMWViOEx3MDBObnFXNHpWYW5rZVpSS0ZILWN3Mm9nZHh2YzJEdldKMDQybl9KZ2diYVlLWU81bWUw?oc=5
2026-02-18	Google	0.0	Seth Greenberg: Mick Cronin's behavior unacceptable, inappropriate - Cincinnati Enquirer		https://news.google.com/rss/articles/CBMi8AFBVV95cUxNb1pUWHVVTEhmTDNRV25RaXg0N041RFJscnVldU5LYTZGTnlJbDYxOC1uazBOa2J1YUloczdxNlJMN3Nla3JodkV3UnNKRHVObG1tUXhBSjhweEhleXV4OVV0cFNJUUdUNC11ZnNQUHpkTHo0TmlyUVR1alBEeHpYSHNoRVFsSVlUanBGNExSelV6MkpNa3p0MW9yRUxmSm9YWlRzeWVpMkRmWlRsVU44U09pd1daUmc1N3JnTDVaOWpBZGN5UW9sdUJyMk1BeWN0TjQtbmJxdDhqYXB0Y2lZXzZWTGdKUmZ1d1VtN2tNamM?oc=5
2026-02-18	Google	0.0	The two sides of the Steven Jamerson-Mick Cronin sideline interaction - UCLA Wire		https://news.google.com/rss/articles/CBMi7gFBVV95cUxPYlpDYVJlN2E4UW9uUUZybGY4bEhDTkRhandweGloQW01RmZnSmVRWVF0VVBmQ0VfSGlpODFTVTVGWFdmc1h0bGF4c1dXcFhRQi0wUmRVT0NiQXo3cEJjSkswVkZLVFAwSHN0TjJvZTMydDgtbExFeGJFLVdJQ3Q0eGdHczFBYlMzeDlIeW5ENVVFQ21na3Bjbk01bzNEamlrVzd4VnU3SnBsRHoyUmhSbG9QbTlvRUw4YXRMaXJjOVZoX25rSEdybnEwdHU1Sy1KT2hPT3F3Z1F2QkoyRk95dlFjdmVJMmhyOXo5OVBB?oc=5
2026-02-18	Google	0.0	WATCH: Mitch Marner backhand goal advances Canada to Olympics semifinals - USA Today		https://news.google.com/rss/articles/CBMi9gFBVV95cUxQUTdET2FRc3FJNVA4eFJPU2oxRi1TLTZESGFKZHMxTHRBS1VHRjVkdzBjVks5NW40NmpQY0x3QW80LTVXM0hwVXdybjFpYjV5Q1h6MjcxSWVaeXhOaFloUzVLYkFCeGtqd0hmaUFlQVppNGF6WThiVUhhcDhaQy1RVDlIZDJaTllpVjc4X2xWRXpWSkJ3ZmgyOFZjQTh5MkRTUDlkb1ZES0t1czRUclFjRGg0Yk5MaUtVb1NnWWJfNFphWkZnTUZlbV9GVnB0S1FtUzNfTXBWSVdMVXd5RVBlblc0WnlmYmo4YUl2XzZhaklYWGVBVHc?oc=5
2026-02-18	Google	0.0	Watch: Bodycam footage shows moments before Boylston man shot by officer - Worcester Telegram		https://news.google.com/rss/articles/CBMivAFBVV95cUxQS0l2RDFIaVU5ekhtSnkyTGdfa3dmOEZwb2ROR0Z2aExSTllBd19sVWhSTUJCQ3lUUzNBc1lCS2hJWWU5aU9YRWFrZUFYTVE2N0ptVC0yMWEzNWl0OF80WHBQZ2lPT29UMXZrSEJ4VGlKbzloTDVKeVMwQ05ETzFPUi1jY1hGZy1tdmdrYjU5UFFKajB3U2lBWjhHTnhtSnBFLWs0Tmc2Z1RYV0szbk1vOHFZWHRtSTJCaEdybQ?oc=5
2026-02-18	Google	0.0	Wednesday BP: What move would you make if you were GM for a day? - McCovey Chronicles		https://news.google.com/rss/articles/CBMiswFBVV95cUxQNFFVZUNQcl9WX0dYU1JaYnJELWwwVS1tYVVlNW5XUEJjcFJLQUpQZE1lVjlZVnpzeEczRWwxYk52amJwb3dqcEpoUkhMeGlkV09DanFTbElzakpNYjFFQy02bmdHN3pPRGRXaENfYnBYdDEzdWx4VDFmNFZVc3pKb2I2blQ4TWNwYXlUTEU3dFRFNWp6dER2a09XekE1Tlp1OU5oa0NqQ3JKeXdJbVRKbnFMTQ?oc=5
2026-02-18	Google	0.0	Will winter storm hit Delaware, I-95 corridor? Here's the forecast - The News Journal		https://news.google.com/rss/articles/CBMirAFBVV95cUxNMVU0TFFUUFFhX2d0MllLNU9UR3htdFNrZklSUXNQWm8yVU9HM3JOZWdoV3Y4c1lsOGZCVW5GMWJQc3VhOGt0UnBjMHRibmt4Z2NXUFlKWEJTZGEtSko4R01EQkVfa0JHNkZtV0QzQU5RVU5BZ1VLdzVNLXBuODJtNkc4dXB1SDZoWTV3UC1aRUt2dk5fNHVGNWk4cmdaQTdCdGZDY3VuV3hFX3gx?oc=5
2026-02-18	Google	0.0	Woodward, Beaver county wildfires spark state of emergency in Oklahoma - The Oklahoman		https://news.google.com/rss/articles/CBMiwgFBVV95cUxPbV9xZEZETnRIcWVtSWxUQUhJbzdJR3R5QmozVmFBcnhoUVNrQ21jSENndTRVc0REOXRiT0RUcWtkSWdOdndIMWFsTVhVcDU4TE1wTy1MQTYyRG9MaUJGblJjRGpjcWFsLWtwWEhvWXJYYW1fSkgwcjQybGw1UVdZZzZqdlRQQXUyMjNmdzFIU1lKYVlGRmRfSVFPWVdSMDd4dFQxUDlWdjliYWdYQTRsTWt0T20zWW8xSE9uSjBVUnh1UQ?oc=5
2026-02-18	Google	-0.04	Winter Olympics 2026: Meet the white-haired grandfather behind Jordan Stolz's golden rise - Yahoo Sports		https://news.google.com/rss/articles/CBMi3AFBVV95cUxOcW8yY2Q3SmJsa2tDS1BjMTFmRG9YUXRoUnJHSWRXUmk4SmtQSnRvME9va1U1QUtmVmdUanZSMWFCUF9HdERNLWlkaUM5QS16SE12ODZTeFBwNG5ycVJ2T3Y3cUZCZ01CTE56bml4RE9GT2dVbmxnWGtjWDV5M1FCbE9iUFZWY3NFUjBlVGt1LTRuelRvb1pqcndxVzBLalYzY2xPaHdsSWY5eExGamc0STY3TEswNDFrMmM1ZXJIRGlydEpSd0VLN3ZSZ1A0MHN2TS1VMmNvN0Zyd3lI?oc=5
2026-02-18	Google	-0.083	Jeffrey Epstein's ties to politicians, business titans and other figures - The Detroit News		https://news.google.com/rss/articles/CBMi2gFBVV95cUxQdkRlU2ZLVkRHamg3MUVlWWgxZm5VTDRtVDl3UDZsOGYxNjcxVVNLREYwSTdTeHJPb0NTSlFfT2dQdzJac1J3RDRzZWF4VXViVzlmSkt6Tm02OFpOdGdFeGRRRWhFS093bm5DSk1RY3JUNV9NN0pXQVB3RC1sX3ZXd3hQLXdnQ0JzRHVRaWdKN1NOd0VTUWFFMW55dnVoS2NxYkNWbGlaQ1hidjNpOUo4QmE2Y2RtbjZtdWFWQzlFSUVtazhnNnRLMXlpbGUxOU5IMHdnNjVnRnFrdw?oc=5
2026-02-18	Google	-0.111	North Providence Black church arsonist was Pawtucket ice rink shooter's son - The Providence Journal		https://news.google.com/rss/articles/CBMi7wFBVV95cUxORGxnMDd5OXlRMDJ2NkYxNWgwZThIR3JVWGxZaHd3X1hrTllEWkw5R0F3UHMyc19vT2FDalFvX0ZpWC1BRHpvdDE0TDJNeGdtQTN1cmliNjlvYW56ODR5SDhpVUtCVjhUa0xTanljLXNlMUFiTnJVWV9BUEdUR2ZRc0FoSDlDMzM5clRWRmllSkptMDJMM2YwWDZHSUh1SENkWWVCTFVtY2pGYUhCSGxHb1hvQXo1d3R0SGFiRkZkU0RXd29fZ2NPZEZISG90Vm05WERDVVh2a2dQVVNjekVEdkZlWmhtdWdrMnlONG1Dcw?oc=5
2026-02-18	Google	-0.125	UCLA might not fire Mick Cronin, but coach could seek other jobs - UCLA Wire		https://news.google.com/rss/articles/CBMi8wFBVV95cUxPZUVYa1p1LVQ0Z0JHUzh6TXdZaFYtTUVnSmRyb243UjJsWFBtUlpPb00tZzFtNkV4dF9EbGhsTWhzYk9GLUFULWNOajZQTXpEaG1LcHpldGRpNm1TMURHbjZNYUQ4NmN1d3FsYzRQYnhWM2QtV1hwR280TG9ZUTV2MFFMZV96b3FTWXdVelpRLVRVclN6bmx1UEFmeXJNUGxkYnBzWGR3YTJiUUwwWWR0Z0ZyS3AyLW0tWEUxc2ZReFh0MWVsOXhaU2JSRHFoNFBEamNnQXhEclZ3Z0k2dUpqNGlEcDJiRVBCSm9IVDcxS3FhbDQ?oc=5
2026-02-18	Google	-0.167	GM makes 'relatively small' investment in Ontario for next-gen trucks - The Detroit News		https://news.google.com/rss/articles/CBMi0AFBVV95cUxOYXlvMU1TV1VzemdpMEFPRFFjelNYdUxHbmk5TXl3X2g4RjY0djI4alhMOUlJanhXTm1BWUpxVF85VU1FcGZWX0NtTDM2VUR2aUZybjdJLUdnVlR5OWlxbkFNZ21vTkJpQlkyRG1CandWWTJOUFZEZEVGV3VQdFFjTmsxdW9oNWhJUzhCYk9XYzBpeWx2LWpWc0s0Xzk3MWxiSTJSMmpwTUMzblZTM1Zqamp4Qmh0WXI3ZWJCYnRSQjBnZlZxTWxNdU9VN29CZTRX?oc=5
2026-02-18	Google	-0.25	'Imperfect Women' On Apple TV: Why This Kerry Washington Thriller Is Already So Buzzy - Scary Mommy		https://news.google.com/rss/articles/CBMilgFBVV95cUxQNjVwc24tTWxUQzI1VHlvcGFUY1NwMHV3WG1nLXNRdjd2S2N3MEhGR0dvb0FKamR6V3lJNnpaVWxOTUdCT1lfN3FhdVpYeV9iQjhDdFZBdk10VWFpc1VORTRTSU9wdGIwRUI5VWRtdmFJOV8wRC1CQXNnYlhDaEIxSUxSVDBDRC1CRFJZdDh5a0YtVWlZSUE?oc=5
2026-02-18	Google	-0.375	‘It’s a really dumb idea.’ BP slams plan to put affordable housing on College of Staten Island campus - SILive.com		https://news.google.com/rss/articles/CBMizwFBVV95cUxNcXJuN3BFMmJDYUNUc3B0TzgwdDg2SEgwS0h5WGJJSkRpa0lqTGdHQTljWU5IM3lwVkhOcGpfTGhyQTJQTVJ5TG5LTFQwS3FVQzVBY015VWdLQzEtdjhDNmhxLWxsLXdCbmpNRC1kOTZyUU5kZGNSUy1TNnh1SjlkTFlQejZhdXhmOUZ0cmtoV0xsUGtyczk0YWxpbDRlMHlDMGwtZWQ3UlZJaXo5WWZYanlSeGVvLXVuVUUtR0dZcnZWWUotQlluOTY4S3hSTW_SAeMBQVVfeXFMTjViOHQzdzR5REVJWGppd0NQelliRFJPSVdnN0hqLWFCenJNWnFTbFVYRElReDg4VTR2ZFU2NHVDM0JSUWJnN2p1OXFVYVlHbzlWQW9PWEVWX1Uwd0JnRl9WMGdNNlZUbU4wT1d5bjhIdDc1cmRQMjFyekF6YXJmbmo4LTVwQkRxQXUzYW5aSVQ2a2syaUtSN3ZQRjhvRXh1ZEVDam1BMTB6ZHpJNk5tWXdfT0NsUGxLQmU5aG05Z1UzQ0hWNk9RZ0ItNm1VZzBkaWk2NWJYaFlISXdWeEhTYW1rSDQ?oc=5
2026-02-18	Google	-0.6	Konnor Griffin’s ‘crazy’ spring training show continues with mammoth BP dinger - Yahoo Sports		https://news.google.com/rss/articles/CBMijgFBVV95cUxOYlU3bWxMZUVOU1FQQWhzMFB1dnFzeU4zRmxQSUduMmowQm1BOXlZc2ktRzMwU1RzNFpMeHk5MGF2anBqR05RX2tSdGV6NlF1Qng5M09TQmQ0eDBEeHlLcHk1T0pxNlVwYkpGS2ZfeGNZRkJvWjUzSWVSY2laMzYyd1pqakszQWtyZnY1aUlB?oc=5
2026-02-18	Google	-0.6	NWS: Rain, warm-up, then cold in Metro Detroit; snow up north - The Detroit News		https://news.google.com/rss/articles/CBMiywFBVV95cUxNaWlZZGJPNVRvd2J1bVpPaVdPNE8xR1p4Z1FicW94QU1RbkYwdDlVLVNfUGpsYkcySlRwN25HRHJWSVZaNExrUVdRS3VLLVZ6bjVJTE9XbDY0WmhUcmtIMlJZZENUVkpqWlpJSEdhZjNHaEhSZU96d3VXZ1FNM1ZpOVNwTVBHdUlfbVRkWnZJX205U2g2RTVLbERWNU9YbDBnYmRwakVTOHlKV1Q1Yl8taWdhMG1Wc0pEdnkwb0FUeElDTm9ILVZJNVRwdw?oc=5
2026-02-17	The Globe and Mail	0.285	Citi Reaffirms Their Buy Rating on BP p.l.c. (BP)	Citi analyst Alastair Syme maintained a Buy rating on BP p.l.c. with a price target of £5.25, citing Syme's strong track record in the Energy sector. This reaffirmation comes as BP reported improved quarterly revenues and net profits, though another firm maintained a Hold rating shortly after.	https://www.theglobeandmail.com/investing/markets/stocks/BP-N/pressreleases/254982/citi-reaffirms-their-buy-rating-on-bp-p-l-c-bp/
2026-02-17	Google	0.2	Aker Solutions wins five-year MMO contract from Aker BP - Yahoo Finance		https://news.google.com/rss/articles/CBMif0FVX3lxTE5nQVdYQVRYdDdBTzViLTZTeEs1QmZiTVpRNFhNVFJIRnpjWFB3bWdsMzhNQU5kUmpHZkdaYjhrczhuQURlMzJVMUVOdm1TN3ozTF9jLXBtNGZiSGw1T09Qay1qbC1tNk1NSk9za3VvT1A1bEkwRmhibGxaZ2phekU?oc=5
2026-02-17	Yahoo	0.15	BP's (LON:BP.) Soft Earnings Don't Show The Whole Picture	Shareholders appeared unconcerned with BP p.l.c.'s ( LON:BP. ) lackluster earnings report last week. We did some...	https://finance.yahoo.com/news/bps-lon-bp-soft-earnings-053130805.html?.tsrc=rss
2026-02-17	Google	0.062	BP plans exploration drive at major US Gulf play in 2026 - Upstream Online		https://news.google.com/rss/articles/CBMisAFBVV95cUxQZnFmc0FyalFEdG9oQ0dIcFJIdldYLWFpdmJ3SkxHWm82Q0V2MGsyeXJNN09wbUF3eVhldUlWVXJqRy1Yb1RwMFphVlB6ZTdyemFZU21ndHBWNmxpeTV5R1pNU3RNS0xidy13cUs0MWpTcS1Sb1hLX2dVbmxtUXBKRnBUbTYtWHM5RGtZa2xxMmVuSXRaMUVpSWRjQi02djZyT19wSnR5dFVNajVwRWQ0bA?oc=5
2026-02-17	Nasdaq	0.041	BP and Eni Expand Angola Footprint With Algaita-01 Oil Discovery	BP and Eni, through their joint venture Azule Energy, announced a new oil discovery at the Algaita-01 exploration well offshore Angola. This marks the fourth oil and gas discovery for Azule Energy since the beginning of 2025, strengthening the upstream business models of both BP and Eni. The proximity to existing infrastructure suggests potential for rapid and cost-effective development, although the companies' upstream segments face pressure from declining crude oil prices.	https://www.nasdaq.com/articles/bp-and-eni-expand-angola-footprint-algaita-01-oil-discovery
2026-02-17	Google	0.0	BP and Eni Expand Angola Footprint With Algaita-01 Oil Discovery - Yahoo Finance		https://news.google.com/rss/articles/CBMiggFBVV95cUxNRlBtWGw3Y19jdmdUMW5ZWWx2Mmpra1FYUWhXcHhZdncySGtoZ2U3cTUwV1JVVHY2OVhKODZOLUtBWUYtQWp6eFNNSkdpVXlsTl9JRWM4aE94RllRbTh4YkJqLVAtdnk3UDlvMmh6VXhwbGQyXzVhUGhOamRZS0VEQ0p3?oc=5
2026-02-17	Google	0.0	BP and Eni Expand Angola Footprint With Algaita-01 Oil Discovery - Zacks Investment Research		https://news.google.com/rss/articles/CBMiqAFBVV95cUxNcktkbWtxNkxrSjZicDV6LW5TZTVMbXo4MWtQUFJvX2VZSEV2YWdiNGdpQ01OY1d6QURZdnpvejRoWnJzVnF4TEE3TGxuZmpjQVVIOVljajdMRHBnRmpXcVVmbWRySXM2T2Z4VHN4NGt5elFlQXNQZzNxTndVQzJiZTl1MXVqRE1odzlVMGJYanFoV1lRUHFBVXg5bUQxUFgxOWphWnJUMEQ?oc=5
2026-02-17	Yahoo	0.0	Big Oil executives under pressure to spell out growth plans	Big Oil executives are under pressure to spell out their plans for future growth after years of cost-cutting and heightened shareholder returns...	https://finance.yahoo.com/news/big-oil-executives-under-pressure-050012498.html?.tsrc=rss
2026-02-17	Yahoo	0.0	Cenovus Energy's Q4 Earnings on Deck: Should You Exit or Stay Invested?	CVE gears up for Q4 results amid softer crude prices and rising capital spend. Can the stock rally hold?	https://finance.yahoo.com/news/cenovus-energys-q4-earnings-deck-152200943.html?.tsrc=rss
2026-02-17	Yahoo	0.0	Fizzled Out: Heard on the Street Friday Recap	There were some concerning signs within the inflation report, including service costs rising at the fastest monthly clip in a year.  The Supreme Court could rule on President Trump’s tariffs shortly.  Goldman Sachs’s top lawyer will resign over Jeffrey Epstein links.	https://finance.yahoo.com/m/88fe507f-c3b7-3efc-af0b-27debad4b1ec/fizzled-out%3A-heard-on-the.html?.tsrc=rss
