Date	Source	Sentiment	Headline	Summary	URL
2026-02-17	Google	0.0	Just a £5,000 holding in BP shares could generate £1,807 in annual income for investors over time! - Yahoo Finance UK		https://news.google.com/rss/articles/CBMiekFVX3lxTE1UaUFTU0l6RGxkdlFVdHV4NUgtNUlnWVJ3MlFlUVFLY2YxZWJXcjVib01hQ2ZyNVpLVjF6Ul9CZTN1cUFxZDhVczFQN3lPdW9DUEhZV3VuTVJaMmhkcndxTFRicnJfdU40czk5YU9lWHhZRFc0YmFKNGZn?oc=5
2026-02-17	Google	0.0	‘Nostalgia, measured optimism, and a forlorn feeling’: Bp Matthew Kukah on 30 years of Ecclesia in Africa - Crux		https://news.google.com/rss/articles/CBMi3gFBVV95cUxPUkVNeVhCM0taM2cxdlFrcF8xdTc5d215VjBscnhCZ1BjWlVSYTZnUmEtVTdmVE5yWFV6Z2sxVFBMaThNLXMxWEdSSEJueng5a2UzZ0ZIeTZHQmNkTlQzQU9fTk5rcnpkYzI5ODdobGZwaE9kMUFDb25WUFVzd29XRzJFZnFFREFiVGhFdWZhZUdZUnhtU2MzSGM2dWxJeUhNc1NjSFFHZXF2ZzlHbUtyam02ZDlibVZVdGdmeUh1RWhPSnoxMENudm5JTnZjNlhfcUtEYk5wR2pBd0t0X3c?oc=5
2026-02-17	Yahoo	-0.231	CS Analytical Expands Pharmaceutical Raw Material and Finished Product Testing with the Launch of RM Analytical	CS Analytical, a trusted provider of high-quality analytical testing services, today announced a significant expansion with the addition of raw material and finished product testing capabilities for pharmaceutical, biopharmaceutical, and related industries with the launch of Raw Material Analytical. This strategic service launch further positions CSA as a comprehensive, one-stop analytical partner for manufacturers operating under global regulatory requirements.	https://finance.yahoo.com/news/cs-analytical-expands-pharmaceutical-raw-082100340.html?.tsrc=rss
2026-02-17	Google	-0.267	BP Is Running on Empty As Energy Giant Scraps Buyback Program - Crude Oil Prices Today | OilPrice.com		https://news.google.com/rss/articles/CBMirgFBVV95cUxOdm9JNEMwWjRqWHRpTzNnMjVleGo5N3puSWw3b1NsQW1WblY0YndJMXV5VmstckNWY0tYM2EzYUE2TmpTWUtuYzRGVmxiOTR4Zy1NcS1KbXJVb2oxZmk4NXZySXlJUmU2SkJUbC0yTmt2ZjFUanU1VEpubHY4OEZQODFuUmgwUkpNcG1mclBWMUFiYnlBWTJUMmlaaVlCUFlUd3VyVERWNC1PQ2I2SEHSAbMBQVVfeXFMT2R6U3VZM01xSGVxdVI0eUsxUHBRczVnWlJXX2J1SUxFNm1JZ1dVNVFNSkpjRkFPNkxHNDRXc04taWZNZXE0czZyaS0yelNEMTBySzZFMDlLd1hrMW03ZmRzLWczdE85WXdhdW9IclQtRzBIXzRsS3JLbTFjckZiTnRTcUd5VEc2bmczVHl0c1RQSW5iazJpc0VTRXlyUWwwemVuQ0xZUWh2LXNZOFpObHNJY1U?oc=5
2026-02-16	Rigzone	0.345	BP, Eni Discover More Oil offshore Angola	Azule Energy, a joint venture between Eni SpA and BP PLC, has announced a new oil discovery in Angola's offshore Lower Congo Basin, estimated to hold about 500 million barrels. This discovery, named Algaita-01, is the 23rd in Block 15/06 and is located close to existing production facilities, making monetization swift. Angolan authorities have lauded the find, emphasizing its potential positive impact on national production and state revenues.	https://www.rigzone.com/news/bp_eni_discover_more_oil_offshore_angola-16-feb-2026-182986-article/
2026-02-16	Google	0.295	Yankees Notes: Carlos Lagrange shoves against top sluggers in first live BP session - Yahoo Sports		https://news.google.com/rss/articles/CBMijgFBVV95cUxQek9hOEd1emtRNFY1cFZkVHhKYU1KNEgyeER2UFVsbEkxN2hfU21WQTFsLWZ2ang1RW9KQXgySmhjOUdOSE1GVVlTd21XSzQ5TWJfQXljbXZnRk1MVGlTMXA0c1Z2b1psVENIYlpfNEc3dl9kS3N2TnF5MktzaTFDdTRsam9RQXlKNWxQRC1n?oc=5
2026-02-16	Google	0.193	Dodgers' Tyler Glasnow: Throws first live BP of spring - CBS Sports		https://news.google.com/rss/articles/CBMiowFBVV95cUxNX1BmWERBcHdoRG9TUWdDaTU5a3JuM2Jnb09kUmdfQktEd0RYZHU0R1F2TGdkOFFhVVpId2xuTzZURVpFYzNWVFpuRFQzXzRsaEVCX0ltRUlOZ2tzcE9QaU1RZjBKZ0huVWVYRlhSdEVERFdtdzhmYzRiUkF4VVZUNEpWVURkOUlVU1VSRVdibnUzQmN1b0ZCMmlRell6dVkzaFNZ?oc=5
2026-02-16	Google	0.118	Hours after Tom Pohlad inspires Twins, Pablo López’s early BP exit shows team’s fragility - The New York Times		https://news.google.com/rss/articles/CBMinwFBVV95cUxNV3pkVFJrOTJzbzRTXzdwUjVjWnM1MkFQNzdjb1RzQkoxRXNIMDk4OWxfaFJKY3QxcFNMYlkzU19CaHY3TGlKc3hEaDhtZV9qc212WWllQ2dnYjYyckdMa1FwU2IxeW5zLWFLdEV2QU5ITnIyRzkzQS1pc0lpUG0waWVNZ3dlVjhQeXNFdlY4eGJtMktwdm5TTzRmRjNpV2s?oc=5
2026-02-16	Google	0.037	Twins' López ends live BP session early due to elbow soreness - MLB.com		https://news.google.com/rss/articles/CBMihgFBVV95cUxQY0ZGNXk0UVc4LW1EbTNiWFZtTDVRamlBSzlibktZSFJoTGxBeFZpZmJ2QzlQYnJodXVzQzJnYjMxaFl2LWtOdVZESzVFaTVxbGtOUENmbGpmaW5vdGRGZElfWjZSdnFXa3dIeF90VjFCZ3FWSEo2OE9pbzY2alQwRmdMeFp0dw?oc=5
2026-02-16	Google	0.0	5 things to know about union rallying to save jobs at the BP Whiting Refinery - nwitimes.com		https://news.google.com/rss/articles/CBMiiAFBVV95cUxOa2pJZDFwNnZLUW9CWjNaNUpmNW5NaWNSS2FMdEJnSWxIODZLS1NybmE2Z1UzYmFRSHVGcmp0ZFhnR2NDcEJXVDcyX3NnUmU3bjFTT3FUR2pXYklBMlZIczc2aC1BTW9oWlVSUEJTMUh6em50MVRtTlhVTHlraXRPZDVmdUtUXy1z?oc=5
2026-02-16	Google	0.0	Aker BP awards long-term MMO contract to Aker Solutions for North Sea assets - World Oil		https://news.google.com/rss/articles/CBMiswFBVV95cUxQa1VzZVVaNGxkTldYTFo0bnhBSEFlSllNWW1SZUNZdER4cEltc3FyRG1La0pwUlVFNTVFay1SOEFFM2tPX19GZ0xRb2hXU2xhVzJXTTJhbHhDelhpaFRkekpaWDA3dlp6ck9ZNmlUbndKMlRxS0VrOWJuVzZaWHNCOEpPMENJSnktUW9FeDBpM21hSFpIaTNJamJDYUZjb0tNZ1U5VDh3cEJIUS1CZ3M3QS1WUQ?oc=5
2026-02-16	Google	0.0	Aker Solutions awarded long-term MMO frame agreement by Aker BP - Aker Solutions		https://news.google.com/rss/articles/CBMiuAFBVV95cUxNa3plS2dLTGFfdUJjVTlYenVIaTlqWTBpMDRxb2pHZUxpbVNqbXlZM2tmejlKbjNIbWhuX2ZVdjVRMlEyNnJwMFFBa2ZCTlVIY1BmNEZKSHlkUWI3RHhkQWRiTUl6RWFlS0kxNlU2SjVNcnRDSHc0aUVpNWxTSVdIYkxEekItVEFIUXoyYWpBbm5vOFZkTVZQWGZaSkRRbEZNaU52YnlKVTBET3JQRTNXVjZwMjdkSHBx?oc=5
2026-02-16	Google	0.0	BP Whiting Refinery workers in Northwest Indiana hold rally - CBS News		https://news.google.com/rss/articles/CBMiiwFBVV95cUxQbWphMmx0cFVfWmlXQ3V3U0lSNGh6SGgtZmRVemt1TXlBZVRIT3FsdkJyX1YxMnN3MXQ4bEhrUXh2QmY4ZWk2djhiRWhEOUhtZVk5WkdXSWJ4WG9hVkVlRTh0T24yS2EzZFQtRXRYUE8ya1p0OTZXakZJVmNINkxxaGlNeTI1THdqSW5N?oc=5
2026-02-16	Google	0.0	BP and Eni offshore exploration well hits 500 million barrels of oil - Upstream Online		https://news.google.com/rss/articles/CBMiwAFBVV95cUxNLUVJdkFfNGU2VmxqdTVBTlNGT2VGa1d4ckh1QTdudExDcTB6YU1WRnJvRkJfZE80UXk2dG1PSkY1OGVLMXk4WjlEWXZIRU9IQi1rWU5wWXZVTkFYZ3Q3NVJRdE1GY2NHRjhDRDZoTmJFeTg1VktlQzZ6YnpVWkNTNU9KbXl1LUNVeFRRZ2xGaUlTWk9OdXUzeGlVUzVxcmhqMk9pQWJfZGxIdlR6dHZsVnJfQzg3NkFTSGFYa0FSMnY?oc=5
2026-02-16	Google	0.0	BP sanctions Tiber-Guadalupe oil development in the U.S. Gulf of Mexico - Energies Media		https://news.google.com/rss/articles/CBMie0FVX3lxTE52azMyeEVRLTFaazZCY1NJNmxJM0JuVXFVNEc0bEFndXprazJzdDlraThXVkNzRXRMN3JDaEdrS2dvRV9PMTU0c0FGY3o0ZzlKNUxxMkpYcjNSYmRTVVc5S0xydU41cy1lclJieW4xb3puazVrZmE2M0ZmYw?oc=5
2026-02-16	Google	0.0	With strike looming, BP Whiting refinery workers rally to defend jobs, wages and safety - World Socialist Web Site		https://news.google.com/rss/articles/CBMiaEFVX3lxTE1UR19laERxS0pCVHRsLXB1UFIweEdGRGRsYlFSa3BnMFhFaUx1ZVRFQklpRkJYaEpLWl96YXhnLUpaTE9sZXQ2NURnOXlMVDRfb2pubTBPNGpjYVU4aVJBaWZFb191a1Ff?oc=5
2026-02-15	Google	0.5	Mariners pitching prospect flashes intensity in impressive BP vs. starting hitters - The Seattle Times		https://news.google.com/rss/articles/CBMitgFBVV95cUxOWlJtX2pPZGo4Y3FIX1lVVkpXVHp0M3pRcVc4aWhZTTd5UVZwS0VwS3hNSG5HVFVrYXFIdF9aZ3hwVmk0cWhoVXZOR2hJdVUxZlRHOUVsS0VubmJBNlA1NUhfak1ZV0VrdEVsUTljaVc1SDVXV2RlY01RcnpiYmVPREJHSGx6cFlrYXBWYklzZlR0dFZ0UGpoN3NyM3QzTEZhVW9mM1NOOFdLd0x0Yzd3ZVZhTUFxdw?oc=5
2026-02-15	Google	0.136	Hunter Bigge’s live BP session another step toward return to Rays - Tampa Bay Times		https://news.google.com/rss/articles/CBMirwFBVV95cUxNdHltSXNtbG9EbUZES0F2TTY3dHNtRjM3Vk5kM1FvTmJZZkVYSmJlMWhTSVd5eDg1S2RwSUZFSGJPNGlzdFkwV21UY0FuSjVaYWctOFZUaHNSdHdkTG5yZkxZcF9feTExa2NtbWZTV0g3YkVYMmhHdnlIbDV4V2JBeVB1NVIyU01UNmw4Y2Roanlxekk1WFlFZC14dUFtMjl4R1RVbzYwUk41WW1XV1pJ?oc=5
2026-02-14	Seeking Alpha	0.401	Eni-BP JV, Azule hits oil with 500M-barrel well in offshore Angola	The Eni-BP joint venture, Azule Energy, along with partners SSI Fifteen Limited and Sonangol E&P, has discovered a significant offshore oil well near Angola. This new find is estimated to hold approximately 500 million barrels of crude oil.	https://seekingalpha.com/news/4552201-eni-bp-jv-azule-finds-500m-barrel-oil-well-in-angola
2026-02-14	Yahoo	0.4	Does BP (LSE:BP.) Look Attractive After Recent Energy Sector Headlines?	If you are wondering whether BP at £4.61 is offering genuine value or just looks cheap on the surface, you are not alone. This article walks through what the current price might really say about the stock. Over shorter periods BP has been mixed, with a 3.6% decline over the last 7 days, a 3.9% return over 30 days, 5.3% year to date, 4.4% over 1 year, and a very large 5 year return that points to a share price many times higher than it was. Recent headlines around BP have focused on its...	https://finance.yahoo.com/news/does-bp-lse-bp-look-230944303.html?.tsrc=rss
2026-02-14	Trinidad Express Newspapers	0.337	US clears Shell, BP for Venezuela	The US Treasury has issued new licences (General Licences 49 and 50) that permit Shell plc and BP plc to resume oil and gas operations in Venezuela, clearing the way for projects like the Dragon gas field. Trinidad and Tobago’s Prime Minister Kamla Persad-Bissessar welcomed the development, viewing it as an opportunity for regional energy cooperation, while former Prime Minister Stuart Young raised questions regarding the impact on previous agreements and negotiations with Venezuela. AMCHAM T&T 	https://trinidadexpress.com/news/local/us-clears-shell-bp-for-venezuela/article_e66f86c4-5a00-46f5-8d90-bc1df70dd95b.html
2026-02-14	MarketBeat	0.25	BP p.l.c. (NYSE:BP) Short Interest Down 34.2% in January	BP p.l.c. (NYSE:BP) experienced a significant 34.2% decrease in short interest in January, totaling 8,045,280 shares by January 30th. This reduction leaves only 0.3% of BP's stock sold short, with a days-to-cover ratio of just 1.1 days. The company also surpassed Q4 estimates with an EPS of $0.60 and revenue of $47.38 billion, and declared a quarterly dividend of $0.4992, indicating a 5.3% yield.	https://www.marketbeat.com/instant-alerts/bp-plc-nysebp-short-interest-down-342-in-january-2026-02-14/
2026-02-14	Google	0.083	"Why Karan Johar Had To ""Take An Extra Dose Of BP Meds"" After Watching Shanaya Kapoor And Adarsh Gourav's Tu Yaa Main - NDTV"		https://news.google.com/rss/articles/CBMi7gFBVV95cUxPTnBaX2RkVXdlZkRHNzJzb3FIellQUU14NW1tdGQzdzVXdkxTM1hIeXF3dzlIUk1vVlIxVkEzbTNmN1RNR0ExemxibTlEbDYza1N2RlpoWlR2SjE0QW15VElfQ1IwUlctUEQyZkZNdk9qbHdFQXBRU1IwNHNKNXFNZTVNQS0wdkhYaWVyVTQzREc5U1BHNUJNeHVqZ3hoMl9ESWVnLUlfYnB6OGt0bFA0c3l4UlBmSFA5NWc2WFlBaXhTVGtoU1F6bXdLRzlMLXF1eS1idWZGN1A3YkVQSWpfdjF6WHZKWDhBX21WNFR30gH2AUFVX3lxTE94SElObml4VDdFSFgyb2xCWEF0WGg5XzUwck9waUx4cjRPeFhzTkVmSU1rMUdhNElLRDYtOXdaRV9HeFZqWDQ1UE1xTUw3RklWNWc0NlB4V015cVBQdjhHbTd4a3d6Vm5uQmZFa1hSQ29hcUQ5ai1vaXJVYjlyT201aHp3dVpTT1VvTlgwaTV0SVczMFdZMGdLRnpfWFRGNkI0NTh1cDJVYkdFcUxYb1NDTV9hUVhvS0QtVDJtTFY1c3MtdHhMMk8tcTR4MUlYNnVmMV9tOHhNVDRUTnJhanZVWHNTZXhmWHZxWm9HZng2dWhxRjZTdw?oc=5
2026-02-14	Google	0.0	Hundreds of USW workers rally to save jobs at BP Whiting Refinery, fight proposed pay cuts - nwitimes.com		https://news.google.com/rss/articles/CBMiiAFBVV95cUxPaVBlLUpXbkQ1ZFYwZWdfb3hhQjlHbTA5d1hHUkh2eWJJbVRFeUlReFppWkpYWmVCcnNvTThFeDRGYWZ1UW9KRElDWWhvM3dXOHZ6em00UHZUVFBzRWxzXzV2MXZ1ckpoUDFSM0hhVVN0UlIybjR0emgyVXdHZmV1RjRWeFVpaTVj?oc=5
2026-02-14	Google	0.0	Hundreds rally at BP Whiting refinery amid contract dispute - FOX 32 Chicago		https://news.google.com/rss/articles/CBMilAFBVV95cUxOUlBNVWdLUUFJTmQ5d1JQc2JIUlp0SGQ2V3IwVkFXcEJPX2VYTU5YYUtzT05ldzFnWEdub3lYQ3hKd1ZrcWNWNWFGR1hjTXh0MkxlUVVkNHlKZHZYaFBfT2M2REwtbHBILUlmb0h5V1JIcEQ1SUV1d05sVWxhdWRWVG9zOEd2aDBjNjVJbkNDTm9UNXNO0gGaAUFVX3lxTE1iY2ZKTDhpQ1B4c0xadGhpX0NneTduTFVXbkpPc0lrcGdjZXVoblpTR05sY092ZDJBTjJQUGYzOFZFU0NFN0lsQWFkV1lQSkt1UkgtWm1ZdWhvaG1IR2JMU2s1QzBRNEdlRVpMZFF5UzdCWFpkUW1FRXJxQkZCMmVIN3NpSUJVSUQ2NjBZV0doaS1Md1dPTDgyakE?oc=5
2026-02-14	Yahoo	0.0	The Weekend: Data-driven market moves keep traders on alert	Key data releases focused on the US and UK economies kept traders on their toes this week	https://uk.finance.yahoo.com/news/economy-inflation-gdp-jobs-property-gold-060034185.html?.tsrc=rss
2026-02-13	Yahoo	0.5	Trump Greenlights More Oil-and-Gas Investments in Venezuela	The Treasury Department issued licenses Friday for oil companies including Chevron and certain European rivals to operate in the country.	https://finance.yahoo.com/m/f9e5cbd5-6d23-3e92-9325-64ddcc5e7fa5/trump-greenlights-more.html?.tsrc=rss
2026-02-13	Yahoo	0.099	US allows oil majors to resume Venezuela operations, broadly okays new energy investments	By Timothy Gardner WASHINGTON, Feb 13 (Reuters) - The U.S. eased sanctions on Venezuela's energy sector on Friday, issuing two general licenses that allow global energy companies to resume oil and gas	https://ca.finance.yahoo.com/news/us-allows-oil-majors-resume-151828938.html?.tsrc=rss
2026-02-13	Yahoo	0.0	Exclusive-Venezuela's PDVSA selling oil only to individually licensed companies, sources say	HOUSTON, Feb 13 (Reuters) - Venezuela's state-run oil company PDVSA has refused to sell oil to companies without individual U. licenses in the past two weeks, four sources from companies seeking to buy cargoes told Reuters, limiting exports and preventing the country from draining brimming storage tanks ‌faster.	https://finance.yahoo.com/news/exclusive-venezuelas-pdvsa-selling-oil-170637369.html?.tsrc=rss
2026-02-13	Yahoo	0.0	January CPI shows inflation slowing — but not housing costs	The cost of housing, stubbornly increasing, is affecting consumers' perception of overall economic health	https://qz.com/january-2026-cpi-inflation-rents-mortgages-housing?.tsrc=rss
2026-02-12	Yahoo	0.5	Here Are Thursday’s Top Wall Street Analyst Research Calls: BP Plc., Borg Warner, Generac, Kraft-Heinz, MercadoLibre, Pfizer, Shopify, Valvoline, and More	Pre-Market Stock Futures: Futures are trading higher after a wild Wednesday that saw the market rally hard on the open on the non-farm payrolls print that blew away estimates, despite a significant decline in government jobs. However, the “buy the rumor, sell the news” cliche came in fast and strong, quickly turning the rally into ... Here Are Thursday’s Top Wall Street Analyst Research Calls: BP Plc., Borg Warner, Generac, Kraft-Heinz, MercadoLibre, Pfizer, Shopify, Valvoline, and More	https://247wallst.com/investing/2026/02/12/here-are-thursdays-top-wall-street-analyst-research-calls-bp-plc-borg-warner-generac-kraft-heinz-mercadolibre-pfizer-shopify-valvoline-and-more/?.tsrc=rss
2026-02-12	The Globe and Mail	0.342	BP p.l.c. (BP) Receives a Buy from DZ BANK AG	DZ BANK AG analyst Werner Eisenmann maintained a Buy rating on BP p.l.c. shares, which closed at p448.35. Barclays' Lydia Rainforth also issued a Buy rating, while UBS maintained a Hold rating. BP p.l.c. recently reported a quarterly revenue of p48.39 billion and a net profit of p1.16 billion.	https://www.theglobeandmail.com/investing/markets/stocks/BP/pressreleases/190366/bp-plc-bp-receives-a-buy-from-dz-bank-ag/
2026-02-12	Yahoo	-0.2	Does BP’s $5.4 Billion Write-Down Signal the End of the Green Transition?	BP (NYSE: BP) just confirmed what many already suspected: Big Oil’s renewable energy pivot was an expensive mistake. The British oil giant took a $5.4 billion write-down on its green energy portfolio in 2025, including $3.5 billion on solar developer Lightsource bp and renewable natural gas producer Archaea. The company suspended share buybacks entirely to ... Does BP’s $5.4 Billion Write-Down Signal the End of the Green Transition?	https://247wallst.com/investing/2026/02/12/does-bps-5-4-billion-write-down-signal-the-end-of-the-green-transition/?.tsrc=rss
2026-02-11	Yahoo	0.5	ExxonMobil Stock: Buy at a Premium or Wait for a Better Entry?	XOM trades at a premium to peers, but strong Permian, Guyana and refining gains raise a key question: buy now or wait?	https://finance.yahoo.com/news/exxonmobil-stock-buy-premium-wait-155200939.html?.tsrc=rss
2026-02-11	Yahoo	0.5	Need To Know: Analysts Are Much More Bullish On BP p.l.c. (LON:BP.) Revenues	Shareholders in BP p.l.c. ( LON:BP. ) may be thrilled to learn that the analysts have just delivered a major upgrade to...	https://finance.yahoo.com/news/know-analysts-much-more-bullish-130515466.html?.tsrc=rss
2026-02-11	Renewables Now	0.126	BP trims stake in 240-MW Azerbaijan solar project, selling 10% to MVM	BP has reduced its stake in a 240-MW solar project in Azerbaijan by selling 10% of its share to Hungarian energy company MVM. The article, however, does not provide additional details regarding the financial terms of the transaction or the specific project name. The primary focus of the content seems to be on other news items rather than the specific details of BP's divestment.	https://renewablesnow.com/news/bp-trims-stake-in-240-mw-azerbaijan-solar-project-selling-10-percent-to-mvm-1289563/
2026-02-11	Yahoo	0.083	European Equities Traded in the US as American Depositary Receipts Slightly Higher in Wednesday Trading	European equities traded in the US as American depositary receipts were modestly higher late Wednesd	https://finance.yahoo.com/news/european-equities-traded-us-american-160500825.html?.tsrc=rss
2026-02-11	Yahoo	0.0	BP Buyback Pause Puts Capital Priorities And Activist Demands In Focus	BP (LSE:BP) has paused its share buyback program as part of a broad review of how it allocates capital. The company has withdrawn its payout targets and is reconsidering how much cash is returned to shareholders versus reinvested in the business. These moves come alongside a major review of BP's direction, ongoing leadership changes, asset sales, and pressure from activist shareholders. BP is one of the largest integrated energy companies globally, with significant exposure to oil, gas, and...	https://finance.yahoo.com/news/bp-buyback-pause-puts-capital-181203833.html?.tsrc=rss
2026-02-11	Yahoo	0.0	BP Should Prioritize Debt Reduction in 2026 and 2027, RBC Says	BP (BP) cut its share buyback to zero in a necessary step to slice its $60 billion debt and prioriti	https://finance.yahoo.com/news/bp-prioritize-debt-reduction-2026-173059269.html?.tsrc=rss
2026-02-11	Yahoo	0.0	Elliott Management builds stake in London Stock Exchange Group	Activist hedge fund Elliott Management has built a significant stake in the London Stock Exchange Group, as the UK company contends with fears...	https://finance.yahoo.com/news/elliott-management-builds-stake-london-104451020.html?.tsrc=rss
2026-02-11	Yahoo	0.0	Equinor Buyback Tranche Tests Balance Between Cash Returns And Profit Pressures	Equinor (OB:EQNR) has started the first tranche of its 2026 share buy-back programme. The launch follows Board approval of a broader buyback plan aimed at reducing share capital. The move comes shortly after the company announced a substantial repurchase programme for 2026. For you as an investor, the new buy-back tranche puts fresh attention on how Equinor is using its balance sheet to return cash. The share price stands at NOK265.2, with the stock up 5.3% over the past week and 10.6% over...	https://finance.yahoo.com/news/equinor-buyback-tranche-tests-balance-081534862.html?.tsrc=rss
2026-02-11	Yahoo	0.0	TotalEnergies Slashes Buyback, Boosts Savings Target as Lower Prices Hit Profit	TotalEnergies  said it would reduce stock buybacks and step up cost savings after lower oil prices hit its fourth-quarter results.  TotalEnergies said Wednesday that it would halve its quarterly buyback to $750 million, with planned repurchase shares valued at between $3 billion and $6 billion for the year as a whole.	https://finance.yahoo.com/m/6fd17bd6-9e16-30d6-be2e-91aaec8f1fd6/totalenergies-slashes.html?.tsrc=rss
2026-02-11	Proactive financial news	-0.298	"BP backing out of buy-backs was ""inevitable"" but leaves better value elsewhere says broker"	BP's decision to suspend share buybacks to prioritize debt reduction has led to reduced broker targets, with UBS and RBC acknowledging the move as necessary but highlighting potential challenges. UBS maintains a 'Neutral' stance, citing BP's premium valuation and expected debt increase. RBC, with a 'Sector Perform' rating, believes that while it's a long-term strategic decision, it makes the equity case more sensitive to crude prices and suggests better risk-reward opportunities exist elsewhere 	https://www.proactiveinvestors.com/companies/news/1087194/bp-backing-out-of-buy-backs-was-inevitable-but-leaves-better-value-elsewhere-says-broker-1087194.html
2026-02-11	Yahoo	-0.375	TotalEnergies Cuts Buyback to Lower End of Range on Weak Oil	TotalEnergies is the third and last of Europe’s top oil and gas producers to release earnings after Shell Plc and BP Plc published disappointing quarterly reports.  The company has a lower ratio of debt to equity than its European peers and kept quarterly dividend unchanged.	https://finance.yahoo.com/news/totalenergies-cuts-buyback-lower-end-084630873.html?.tsrc=rss
2026-02-10	Google	0.3	BP suspends share buyback plan in fresh sign of oil price pressure - CNBC		https://news.google.com/rss/articles/CBMifEFVX3lxTE40QmJsTXBRdnJfcUhUaXdSWGVXcHJMS192R2VnUjljYjVjY1gzVFgyOEFpVlFmalN6TGhkSW1yWEhyYWYza2J3WUlJcmtoekVNeFBmRXJ6bUY3dTFuWmMyaTV1b251Z01BbEc1aEJJYTdRUmJRVktTMzhVVWjSAYIBQVVfeXFMUHBuLS1nUTA2bDl0OUFVUDNxNThBMVQ1N1NXem9JTDdOUnhSU1g3eXEyN1ViRTgtV3hxMHF5U0VKWE1wWGtJTjNkV2FJd08wTjRuVWhUNzd3blRldzB6a1lyNF94Mk1KZndhdDhBTTRVeTB0dXRLOXlBNHFkV0d2ZlZfdw?oc=5
2026-02-10	kare11.com	0.285	BP: Q4 Earnings Snapshot	BP PLC reported a loss of $3.42 billion in its fourth quarter, translating to a loss of $1.33 per share, though adjusted earnings of 60 cents per share topped Wall Street expectations. The oil and gas company recorded $47.74 billion in revenue for the quarter and a full-year profit of $55 million on $192.55 billion in revenue. BP's shares have seen a significant increase, rising 13% year-to-date and 22% over the last 12 months.	https://www.kare11.com/article/syndication/associatedpress/bp-q4-earnings-snapshot/616-b9455657-3721-41eb-bcff-5ffcbef1cae1
2026-02-10	Google	0.196	4Q and full year results in focus: Strong performance – building for the future | News and insights | Home - bp global		https://news.google.com/rss/articles/CBMiqwFBVV95cUxNZkJNNFJXZ0NTY3pjXzJCbHhQRVNGYlJ0aHBUbG5vSUMxVjZKa2Rjc3NHNTEwMm1VeWVGYzQ0WDUzdWltWThHOVlkdG0yTGdTd21HTFdzakJYS2FtdzYtV0NubzUtdkloeVRpcEtlWVU5NEdTVXVFNXpmZVdYckJhdkJGbVl2VkhFOHZFbm1qR2RIZVRNdlpzZFNIN29PRDA0VlRuRWhhOVBmMWc?oc=5
2026-02-10	BP	0.158	Fourth quarter and full year 2025 results | News and insights | Home	BP announced strong underlying financial performance for Q4 and full year 2025, with an underlying RC profit of $7.5 billion despite a weaker oil price environment. The company reported significant operational progress across upstream and downstream sectors and has decided to suspend share buybacks, instead allocating excess cash to strengthen its balance sheet and support future investments. BP aims to accelerate balance sheet strengthening and maintain a resilient dividend while reducing capit	https://www.bp.com/en/global/corporate/news-and-insights/press-releases/fourth-quarter-2025-results.html
2026-02-10	Google	0.136	BP Suspends Share Buybacks as Profit Slumps - The New York Times		https://news.google.com/rss/articles/CBMie0FVX3lxTE9Sb3BEd29Wa1AtM1R6QUFORzREc3gtdlIxS3A3SkhNUEVBV0RrTlczZmF4b3Y3UDdXaUtLZE9SeFJkaEtiWVRiQ21ldVNBNDRNR0hhblZ0c0xWNnBpTDFvbTFtMFRRTXR1Ymt6bXQ1Ymw3M2drNlRQMWE1TQ?oc=5
2026-02-10	Google	0.104	BP becomes first oil major to suspend share buyback plan - Financial Times		https://news.google.com/rss/articles/CBMicEFVX3lxTE13UURkVHB0eEM0bV9HSUpZN1F0eVBsN25sUUZoZVZnd0RpaERCTjNjVnM1UVBkaUhxN29rSllQVzZfYzh5NmFPRFB5RHZtSG0wQ3ViWXF3blFhTEltTEV0MHVhNzVSTUpsLV8xMVpQcWk?oc=5
2026-02-10	Yahoo Finance UK	0.015	BP suspends share buyback programme amid weaker oil prices	BP has suspended its share buyback program after reporting fourth-quarter profits in line with expectations, as crude prices dropped below $60 a barrel. This marks the first time since 2020 that the oil major has not initiated a quarterly buyback. The move comes as BP faces a challenging environment for Europe's oil and gas sector and aims to reduce capital expenditure and increase structural cost reductions.	https://uk.finance.yahoo.com/news/bp-suspends-share-buyback-weaker-oil-prices-072406214.html
2026-02-10	BP	0.009	Fourth quarter and full year 2025 results | Investors | Home	BP announced its fourth quarter and full year 2025 results, highlighting positive progress on growing cashflow and returns, reducing costs, and strengthening its balance sheet. The company reported a 4Q25 underlying replacement cost profit of $1.5 billion and reiterated its commitment to a resilient dividend and strengthening its balance sheet by suspending share buybacks and allocating excess cash. BP also announced a reduced capital expenditure budget for 2026 and significant strategic progres	https://www.bp.com/en/global/corporate/investors/results-reporting-and-presentations/quarterly-results-and-webcast.html
2026-02-10	Google	0.0	BP - Forbes		https://news.google.com/rss/articles/CBMiTEFVX3lxTE1DdFZYaGRvaWdjU3EtVG4zVnNqRFhCZUpQSUdIcnBFZDdDcTZXMWg2LTVfcDhCSnRMMzk0M096dHM0SjhLT2J2ajUteGg?oc=5
2026-02-10	Google	0.0	BP Suspends Share Buyback Amid Overhaul - The Wall Street Journal		https://news.google.com/rss/articles/CBMi-gJBVV95cUxQR1BCclB2TFVPOXEwUEROZ3oxNXJZdWJ1SUk1YVJib0UwVE1Jall3eDh5UE1iZXNHR0VLdElKOVYwbEJTdkQ3Xzgtc1ZUNjU2ZE5ORVU1NldkTFMtc3BPcHl2dElTdXRPQ013Q0hKaTZKcHVGSWVLYU9fUVdSX21kOW56RDZIeVV3ekRyaXFpVFpIVmNOQmJndnhzdkM5MmJFcEpqR2hkNnlIZ3RnSXl6THdDX3Ytc1MzV2pCWGpfTUpQQ1VWWU5wREJMTXQ2TTVYZlNrVzNLNmhBSTlKd2l2bXFZbURYMnVLczZhdDdQUkFFSGZESWNLY3JYcmkxUDdXZmNKa3VqMDlKUW5aUGVUVFpGd1RlQVM1V1VVNTNGX3NXUlJGaUtaemhiYk0takdhb093Y3I1c04zWnI4aEVQcnlCVEZ4Q0VzUE9pZS1vWGZkcWFaSHBVcmZfX0Rac280Umo3SnZYcGJOd2x1T2xaeTM2ZlRZeXFZTWc?oc=5
