Date	Source	Sentiment	Headline	Summary	URL
2026-02-26	Google	-0.7	Turkey and BP Reshape the Balance of Power in Northern Iraq - Crude Oil Prices Today | OilPrice.com		https://news.google.com/rss/articles/CBMiwwFBVV95cUxOTWR2OGFORzZMNDdTREJuN1FpSFRLTC00STd5bC11SVkteW5aTXRURkRlWTRRRzlMSXJnbFBSQmVTMS12dGZsV0M1YVY0RzkxQTdOZGFiWkJ5TUQtZ2NlNGFDbzZSS3h0RUZCMS12VVBFcjdCeWVTaVRVUDNydEZVMUs0dHZ0cTRaMHJOMzNOTUpDWUZWTnVuOWJrY29WNllucXc0NGJXWDFCYUUzbXFVS19aZWs5a0czQ0p3TFk5YTEza2fSAcgBQVVfeXFMTU01VHktb1BCWFBrZzdRWExFOHdYTE9DZVpidE1EcE4tbk9pNmpPZ1dDZ1ZSZE5tYk1sYXpDR2hsYjZSMWVxNXltRjdtT214Qlp3dzE4eklBNVliWmtIYm5xQUxDOFN3OGJQZUt4R1cyY3ZVblljSUY0SlhzdGRqTGJ1LVZwVWFUeDhwUWx4ZjhNcmdjTFhvNmxuUlFJTzlRRUxqVmVzNVFIYVBxRGM2bVRIa0Vodk5ROFh0LU5WT05wdEtJeXk2MnE?oc=5
2026-02-25	Google	0.45	Lambo's BP station on east side of Mattoon becoming a Casey's - JG-TC.com		https://news.google.com/rss/articles/CBMikAFBVV95cUxNR2JvaWZUWW5KT2x5SGlqaDMyS1VqdElFeDhhdHFpOGZFN2ROTllLRG5ZeEVtclZjemRULUlpNUVvUzA1TnVHYTNNeDM4V2UxRkdrQnE0TWotQk94ZlNKRWRkbF9ZSDBmRVR2UXZadjJFNzJrS0ZaOUg4azF0YTdMYUhRZFNTSDl2SnV1dWRnUGg?oc=5
2026-02-25	Yahoo	0.367	Clean Energy Fuels Corp. Q4 2025 Earnings Call Summary	Moby summary of Clean Energy Fuels Corp.'s Q4 2025 earnings call	https://app.moby.co/home/research/tools/earningsCalendar/earnings-clean-energy-fuels-corp-q4-2025-earnings-call-summary?utm_source=yahoo_finance&utm_medium=rss&.tsrc=rss
2026-02-25	Google	0.3	Eidesvik wins PSV extension from Aker BP - Splash247		https://news.google.com/rss/articles/CBMicEFVX3lxTE50NVZVMHUtQ2xoOGUyV29LRzlOUTFDZEYyUXkzQm1vWElaeU5QbDhjaGlNOENpUXI0NkpkYUVWbDNyZXF0dUtTbjN6eFZPaFViSWZQSE1NVDEwWUhteXJMSXhZVEJUVnRlNldRMlFkNHA?oc=5
2026-02-25	Yahoo	0.25	Eni Advances Angola Portfolio With Ndungu Field's First Oil Production	E kicks off Ndungu oil production offshore Angola, targeting 60,000 bpd as the Agogo hub ramps up toward a 175,000 bpd combined output.	https://finance.yahoo.com/news/eni-advances-angola-portfolio-ndungu-154700532.html?.tsrc=rss
2026-02-25	Google	0.25	Eni Advances Angola Portfolio With Ndungu Field's First Oil Production - The Globe and Mail		https://news.google.com/rss/articles/CBMi5wFBVV95cUxNZndqV3RnOTNEZktQUllTcTg3a1VXYnVUR2M0dlhkZm90cFJmUlBIUjBnazdycXRQS0hjdlF2c3A0MmkxbnlWbUVuU1RaNnk3WkozRHZjM2c3ZXJSTlowTnhWbnNGaHdqUTBwOENkdzM4dTJjRUQ2NjF3c0tQckp4S096THNqRzl5ZlgtZG1RU0FYU1VYUXpyMEVCd0dTcm8ycWpKcHVrRUZxMHhFeWN0WEZFVXY3RnZMNTEtUWF4S21HTmw0aFdRa2lLT1VKTmJzWE5LTEdmek8zS3NtcXhha2NmNDlPbVE?oc=5
2026-02-25	Google	0.16	How to watch Oklahoma high school boys basketball: Lawton vs. Bp. McGuinness, Feb. 26 - USA TODAY High School Sports		https://news.google.com/rss/articles/CBMiiAJBVV95cUxPSnR5cHlRLVl1YTNVQ2Jkb0o1X28tSTVnWklDQkVhQ3JRV0stUk1NY3JBT1NSbmNaWXJBZlFGTG52RFRRWTBiUGJVYVhJdGdIQW5XVDVxMmVOd2RLQ0tjYVRidEFfVG43ZS1HMWpTNllWRVRlRGtwX2hLa2d6MHJ1aEZ5cnBKZUJKRUtXYkVwV0djdU5zNDYydHJFdnQybXdYaE5QYThtWndzOFhqby04SkVzRDJBaF82TnVHRkFWYjF4c3RNQ0lERHZGeURNZE5Zc1lfNTZzTTZGM21LMndmWXFwcWRreUVlYW81RHdvbnRKRk5tUTFlNG1Ycl9NSTVSY3JMRzZyWjQ?oc=5
2026-02-25	Google	0.16	How to watch Rhode Island high school boys basketball: La Salle Aca. vs. Bp. Hendricken, Feb. 25 - USA TODAY High School Sports		https://news.google.com/rss/articles/CBMihgJBVV95cUxPdmk2RVJndGhIWm9Zd3JFS1Y1cjJfcmFwdFZOWFk2UHNVaWNMckJsbjZUN01LdjJXSDRPNVBsT0o3MUJ2NXI0MzgwMGNMalFfTm1TbFRWcjRfdmFpUWhvd0ZEVnozb3N0S0NNcW12SnZuRnN4cGxLX3IxY2lqa1BwWTNpczJlMzZnTG5Mem9oM2NGb0RJQnZET3c3eDdxSU9lN0NGZWJBdmdScEY4ZDZkZkJCT2h0VkVnQl84aFU0V1dXa1g3b25LeUlTZ1REQ0xra3pBVV9WWWtlMkVGOWV5MUhFMUt1VmNoQTYxRk9Oa20yQ3A2bmo4azV4QnJqYnJyWmxjWFh3?oc=5
2026-02-25	Google	0.16	M&A News: GSK Snaps Up Canada’s 35Pharma for $950M, Boosts Pipeline with High BP Drug - TipRanks		https://news.google.com/rss/articles/CBMirwFBVV95cUxQSk1uYTY5NllmYjZwZ1BLMEtaZGZyTTdjNmZzZ0lURXFrT1RMcUJwc2szY3dvRHdWZ2ZmTll1ZzFrYVdQeGpra1RxUktFU2NpcDhHOFFFNmNLRXlmNjZSNzFpWTZyZ2hmRUVJVTNISUU5dVRoNEpkNkxZeXhhekwxMHpnX2R2a3JkYjhWbEtWUURqQTRYSjFrNDhxTGNJdVVZZVY0X1pyY3VfZUphUkdF?oc=5
2026-02-25	Google	0.143	How to lower high BP naturally in 2 minutes: A cardiologist explains! - Indulgexpress		https://news.google.com/rss/articles/CBMizwFBVV95cUxQT0xMRFlPX1pTNGEtek1QbW5hSUFHWmZudHdPTGQwZWJfNG41ektsUUR1aXhJRE0yWENfcmJBMmQ4RnEzTUdIelp1TFpDcksySzdDeFZaRmd0V1VZVkFocXZ2SmYzdkhXWExzV2JmNUxHWUhqNGF6T3hIbi1kdzJ0SkpQWGNIcVlWM3h6MVdwb2h4bGppNTg0LU5JWVFldEhJN2c4ZkY0elU4aVJQdzJ5cWt0UzI2bTZIVF9nV1NZNFB6R3VqcnZyOElNN1hVZDjSAdwBQVVfeXFMT0ZPRDRGQkNLbEJPR2IwTWZFcEtWUXVoNEk2ODh1VXBZQ3VFeHRfemM1b3ZKLUxaSzBRbGU5V0Q0OHJIdDFsOGN1LS0yMFZ6cGM1cmdtMVpydWRsSmliWFNwbHZxZk43X0FJTXMwTkRzcHQ5eUtCaWRFOXFqVjNyR043Y3RzSDZ0RnJoTUc3UmhZN1VPVG5ZTHRCRXd4OG5MXzFZN01fbFhfUUlyYUR5VzkyN1NINmRrbnRadTRTXzRSWVM4M05pTVhkb3ZWLWVEUzFVUGk0RWlCejJ1OQ?oc=5
2026-02-25	Google	0.0	5 things to know about the BP Whiting Refinery offering workers a 13% pay increase - nwitimes.com		https://news.google.com/rss/articles/CBMilAFBVV95cUxQZzZSNk9oVFc0S0JBOWpRQzRIMWRsUTVkc3Z1TDBxckd3Ukx4a2ZVcVcwVWdSX2I4Ym9XSWdqRXRsWkNJWjFDdHNobmNVWFVTTVZ2T1Y1ZXNMMHFta0FTTVVSM1NNUm5RSlBVUmd6ZUFGZVUwdXBCUWd2WXpPeXBLTTZaclIxeFB0VTNvREMyLW0tMGFq?oc=5
2026-02-25	Google	0.0	BP Fallon Rock’N’Roll Wizard Vol. 1 - PoPville		https://news.google.com/rss/articles/CBMie0FVX3lxTE1nMktocVBVZHlfNkRtcnRkb3FibzlFTXBRSHgtYkpnc3hCbkp4aHc4RmZxN1VVQ3FpN3BmWlZuSDN4SG02VWZrc1FDOUlkM0dRQXVmYUVLUzUyQmhqY3h0Rk84eEZfeUlCZkVaSHJqc2tSNzJ1VjE4MkY1WQ?oc=5
2026-02-25	Google	0.0	BP Pauses Share Repurchases Amid Strategic Reassessment - AD HOC NEWS		https://news.google.com/rss/articles/CBMirgFBVV95cUxObVhZX2hVRzZYdEZYb0VoTTNkaDFXNzUyd2ZsYjEzN2N2MHk2VGZLVmtJWm56aW81YlJIRU1HdzVHb2FXNDI2UUpNdDhIRXNhSEIzU1pfVHRheVhfSHJzOUNLRUZUNWFUY0RzclAxa1RzdHQtMTVJeC1Hbkh1ZlQ0eHN1QTA0TFBHRGZPTDlKU1I2aEYyTUxBNWNYODdQMG1Rbnl5R1lqSzZwaENuLXc?oc=5
2026-02-25	Google	0.0	Bemidji Chamber Column: Our voice is stronger when we show up together - Bemidji Pioneer		https://news.google.com/rss/articles/CBMitwFBVV95cUxQWUxtQ2VkN1EzaW03UXp1S3dBY3VKSkhvcll1ZU80dHNtSWotNjA4WkhRaE04WVhKbk9UcXN5OTlqYjlvNjBFbHQ2Vm9ISUluS1B4aGZQaDNQQzZkSkQ1bHlUdjJfNkxuQU9TMkpGNVBGN0szd2E4TDlGdVVwX2ZsV1dQTGhfLVEyMG85N1FVNHJubjlCMXNwODhFNWQwSmxBUld6MHVVVWdNRW9yNlEyQ1ZNNm04aEk?oc=5
2026-02-25	Google	0.0	Gators record volleyball four peat - BP Sports Niagara		https://news.google.com/rss/articles/CBMidkFVX3lxTE5lMzBGQ0w1MmpXQTBxdW4tbW1aY2dnN2RIRTRQbFFUU1M5eU5jU2NyeDhBV2o1QVlTZGc4NTI4cU5McC1GMl9JM2xkVUNMOTZvbkRfRG9FbU1MNVJtMnoySTNES180RDBVSnJHRDFyMFA4MHFHd0E?oc=5
2026-02-25	Google	0.0	Lightsource bp Sells Selected Solar Portfolio to Aula Energy - Energías Renovables, el periodismo de las energías limpias.		https://news.google.com/rss/articles/CBMiqgFBVV95cUxOSGJGUnQwZDFuUVl5RXZwQ3NVc3VKc092eU52eUh1S29Kd1I4dlRDUmVMMk5NWV9qUXFPeGRaNzBlTEdQY3lsQVMtN1JmbnN0dWh3c184bjJOcG03MVpiOWp0TnRHMWJEQzN3YWtlR0hkcW5zY1htNEtDZ0hac1A2RmpZb1NkbEt3MXJnRjhkUTZhVXNiSjU5NlhmV2NLVUZUWklFNWFNS2REZw?oc=5
2026-02-25	Google	0.0	Public invited to BSU Sings! Day concert set for March 4 - Bemidji Pioneer		https://news.google.com/rss/articles/CBMiuwFBVV95cUxQVUtVVUV0enhMYWJqYWliSmJneUFmX2Q4cEpKUTV3OXJDb3JEUDVINXlEVDdDV2VDcTNDVENPVXBYd1dqbU9TbkpfVFl0UWhoSG1SaEh5UlJxMXR5S01Zdm50TTdhY0k1cUFfVmVCM2o5THJ5ZkN6cll4MzloeWNLb3JoZW1uRGExUWpwS3JSaXY0bUlnLWJ1M2ptWld4RmpZa3U5NUxMU05JYVYxNFhzekZ5V3A3VjBUd2gw?oc=5
2026-02-25	Google	0.0	Wednesday BP: Where should Luis Arráez bat in the Giants lineup? - McCovey Chronicles		https://news.google.com/rss/articles/CBMisAFBVV95cUxPRFplUEY5UlJqSm9Rd2RYeTUzY21FY1dPSWxvZ0dSRjctX1dSaS1OdE8xNTJjbi1oRURlUUtVcm5Femc0NllhTDlWcjZmanUxVFFZcVdLdWVLT19LOVdjSWFuczg4anNvT1NVMUdHcmZhQW1jYWstdFkyNHdSM1I3ekRYMFFGaUk2MmlwbjB5eXEtOEdjVU9hYVoxYVh4QlhrbldEQ3EyYlJmOElEYnJDLQ?oc=5
2026-02-25	Google	0.0	bp Confirms Oil Discovery at Algaita-01 Offshore Angola - Machine Maker		https://news.google.com/rss/articles/CBMikwFBVV95cUxQbWdHdlIyOFhfeG5QR09MMkJseHlPODhyXzNOdzNyaFpxRkU0SXhyZmQwUElHZk5oZ25TS2syLUVaYUF6UGZjczd0VWhxRGF5T3ZaeE5fcl9IdUVaZXRZQmRUTzV3QTc0Z0REakZCVWJZQVoyd292M0Y1aHRLcGRXOGpfRXFpNEhOd0dmMUxXNG1yRzQ?oc=5
2026-02-25	Google	-0.025	BP PLC (BP): Navigating Shifts in the Global Energy Market - Insider Monkey		https://news.google.com/rss/articles/CBMioAFBVV95cUxPcVYzaEYyNzg5WkVhSmFwNVdxVXlLVWVWeWNKaU5waHBnZHhyNHFyblE0OHE4U2hRRXhjS1BLcHJkcDgtdi01ZXBJeUh2VDROTUM0WkpUZHE5T19JbEU2Z3ZidFN3REhqaFRfcjVjZHl5a3RGemRfcWVMY2xyTjMtNDJ6R2Q5cEFOczF2blV5ZkdlcVpVTzF3UGl1amM0V29l0gGoAUFVX3lxTFAtcDIyNUozaGdUZHEzTWRpSmFyd0JEamtFLUxzSjNEQWRzcHJjYTU3U3RUbjR1UnJId3ZoWV93UFgyQzJlVVF0a1VLSHk1M2ZSM1dDR085TXJoemNqMk9lQTlacGVxM2RkNU1QMFpzU3Jlc25vMmh1aTczUlA2aTE1dW51UGpFMy1FMjNqQnB2NEtNSm5NYjlzUDM0bmJYRWRQaldVVUJTWg?oc=5
2026-02-25	Yahoo	-0.165	$56.64 Bn Biomethane Market by Feedstock, Production Process, End-use, Region - Global Forecast to 2030: Market to Grow at a CAGR of 28%	The global biomethane market is projected to surge from USD 16.50 billion in 2025 to USD 56.64 billion by 2030, experiencing a robust CAGR of 28.0%. The push for a circular economy, stricter landfill regulations, and volatile natural gas prices are driving the market growth. The thermal gasification process is rapidly advancing as it efficiently converts diverse feedstocks into renewable gas, expanding the biomethane feedstock base. The industrial sector leads in application due to decarbonizati	https://finance.yahoo.com/news/56-64-bn-biomethane-market-144200575.html?.tsrc=rss
2026-02-24	Google	0.5	How the Bash Ice Fishing Derby became one of Bemidji’s favorite winter traditions - Bemidji Pioneer		https://news.google.com/rss/articles/CBMi0wFBVV95cUxNTkNLZ0JrMjJRS2JkMU5DTzlrWGx0eUxoZ3FQMUlUajhaX1pYd1ZvLV9xeGZvcGVUdG9YOTdfMXVSX2xjeUNyU1p1RXVlbXRyVkM3VFpwZkdfc3JnRW9TRG1oVGNhcU0tXzRWRngwUFMzUlJOWVhVZnFkSTRmUlBGRVBvUmJGb3VYYm5BTWFSSml4NFk4bzRtbm1yM1ZkdzVUV3RqUWhONTJ2TzlJenVJR1UwRm00Y2lLN2Y4cElSa1dabENReC1Nb29YUGF6aW81VVBn?oc=5
2026-02-24	Google	0.433	BP Marsh flags year of strong portfolio performance - Sharecast.com		https://news.google.com/rss/articles/CBMirwFBVV95cUxPUDN6Z3BnTEh6SnJvQnd1U1VnY0JSQVF3NklaZW1kVEtHMXkyWlAyMWdIYXJMaE02cUV4TGQ0UGh5X1hyZ19JRmtmWjFCaG03ZmN2dW0wMHNhYkRGcy15NmFSZGpRRktOMi1tV1B3TE9ma0twWWtTRkJ2TmtwRlIxNElyenRXeVpzeEVjRVA0OFFoVTZ5Ukt1bXFnb3cwTk41S01nd3piMkRWakE1RTU0?oc=5
2026-02-24	Google	0.25	'I ain't ducking': Trash-talking Bassitt bests Alonso in first BP session - MLB.com		https://news.google.com/rss/articles/CBMiiwFBVV95cUxNRWh6MW5YUDBab0l1czdaQ1ZyLW9YR190amdRTmUzYlFqZlVoZFBfS2MyeGZUaUI2QzZjdkxrOFp0TDdGeTdBRGNZWjk5SWhyQlhTOVZOcHVfOElXazdYWDUtSGRvTUVmTE5aaG40dEd2VjBoSUJ2Z05BRzJ5YXQxVG5UdmpJZzUycnBB?oc=5
2026-02-24	Google	0.214	Lightsource bp in Australia finds a buyer for large solar and storage portfolio, pivots to hybrid generation - ESS News		https://news.google.com/rss/articles/CBMi3AFBVV95cUxQUFN1NUY0NnYtaWh4dE9XNG5xOENSTHRCSDdmaXlHUVhhd3dMcWtnM1doZmszdGRWZzNYbWJHN3ZfeWVKU3lKUHdJU2ppSUd0LUZQQ0pyOUxhSXBSTUhnaExhNmNtdDByd2ZEeUJPUHl4U2x4aWVpY0RRZEF4WTJWQVVIQ3Z4MzJqeW81enYxUmlObVJtd0lOM0ZydEhzVW11dVVjaEE2YW5XeXlHRXNXOVhjbHpzVmp4TFVEUUtEQVd5Rm5RbGNmOUJ2RGJJTnZ4SGlDZnpLcEFZMkJZ?oc=5
2026-02-24	Natural Gas Intelligence	0.178	BP Pushes Trinidad Gas Projects as U.S. Licenses Open Door to Venezuela	BP plc. executives recently discussed advancements in their Trinidad gas assets, including the Cypre project, one of seven major projects brought online in 2025. These developments come as U.S. licenses potentially open avenues for Venezuelan natural gas, influencing the dynamics of the Atlantic LNG facility which is currently experiencing challenges with feed gas supply.	https://naturalgasintel.com/news/bp-pushes-trinidad-gas-projects-as-us-licenses-open-door-to-venezuela/
2026-02-24	Google	0.136	Chris Bassitt tosses live BP at O's camp - MLB.com		https://news.google.com/rss/articles/CBMigAFBVV95cUxPak9GWFVmSkx5R1ZEWWd6TWk1ZWxHSGxORm1RRlBOQmVjZHQxblZsQ1V2THp5NlNUdmlYbGdMXzJYR1Y5dXRkS19IRUdZUjFtT2x2cENhNWRKQ2NEU0J6YmpFNUVHN0liZExqZ0hPaTRzZ0l2WF84dmxFcFN1MGZuRA?oc=5
2026-02-24	MarketBeat	0.116	"BP p.l.c. (NYSE:BP) Given Consensus Recommendation of ""Hold"" by Brokerages"	"BP p.l.c. (NYSE:BP) has received a consensus ""Hold"" recommendation from 23 brokerages, with an average 12-month target price of $37.35. The company recently reported Q4 EPS of $0.60, beating estimates, and revenue of $47.38 billion. BP also declared a quarterly dividend of $0.4992, offering an annualized yield of 5.2%."	https://www.marketbeat.com/instant-alerts/bp-plc-nysebp-given-consensus-recommendation-of-hold-by-brokerages-2026-02-24/
2026-02-24	Yahoo	0.094	BP Weighs Angola Growth, Solar Sale And Refinery Risks For Investors	Azule Energy, BP's joint venture in Angola, has reported a fourth major hydrocarbon discovery and started oil production from the Ndungu field offshore. Lightsource bp has agreed to sell a 1GW solar portfolio in Australia, reshaping BP's exposure to large scale renewables assets in that market. Workers at BP's Whiting refinery in the United States are threatening strike action over job and safety concerns, raising the risk of disruption at the site. BP, ticker LSE:BP., is in focus as it...	https://finance.yahoo.com/news/bp-weighs-angola-growth-solar-001858138.html?.tsrc=rss
2026-02-24	Google	0.05	BP Pushes Trinidad Gas Projects as U.S. Licenses Open Door to Venezuela - Natural Gas Intelligence		https://news.google.com/rss/articles/CBMipgFBVV95cUxNN2dUUE9pSldWSU5xd2VEenRxR091ZGpWZW9GbGRDSDZiODhYVEdEdE9yM0JSVUhQMUU2UU5zd2NzNFpIWTlBYWxfUU01TXFpMkdUdDdVc0cyOG42NUoxdDdQa21qMWNZelozampsQ2xhQTN3ZDZWLWVjNW5XMjExUVQ1eTN3OE82WFJVbGRZWXg3LThaUldxanQ1VzJ1TmpLRGlia0Fn?oc=5
2026-02-24	Google	0.031	B.P. Marsh & Partners Says Overall Profitability Within Insurance Distribution Remains Broadly Stable - TradingView		https://news.google.com/rss/articles/CBMi_AFBVV95cUxOMVFabkVpVElEXzg2M3hma1o1OXZYcnJnZWF6VjNmcndNaVVZZ3hTR3REWlc5UnlBZGg5ZnRreG52aUpWemJHbk12S0dCb3NYdXh5ay1ocUFQQkVNLWlrUC1xVG41cGxPLWx1S05PUVFDQm9ueF9OdU9BUm5UOWJFOEh0emJ4U19pZFZucHJzNVl2N1MyWUIxMDYxY0UyN0J4eEgtdkhwU283aGEzb0ZZOVRUSWVNbHBaM21kOXIyTXNBMnBEWEZhbXlnM0ZhOHBNbjdHUmVTNFFpZEpUOVBQTWs2bFBGakFZNV9vbXRGTHBBajFYV1dJcXBmU24?oc=5
2026-02-24	Google	0.0	Air bp signs agreement with Airbus for aviation services and fuel supply in Europe - Biomass Magazine		https://news.google.com/rss/articles/CBMiuwFBVV95cUxPZWNuMGJHMUdXQk9aWl9KN0IxZHcwR0RReTFiMzNzOVM3NUd6dlA5WlkwYVJzQjl1NmNsemR5d2JyQ01BdDVPZnl1cGx3ajIySnVXQTdBbnkxQTNtdVN6eWoyR3JjeHg5R1R6NEt0UmRiRVU5T0xQUDFxcElvdm5lT3JxUWo1Z1NGcUJaR3E4QlFqcFNpcnVQQ1YxYmxHalFHbk1LUW4wNzVoWS1sYl9feGo1X0piZzhVYUNv?oc=5
2026-02-24	Google	0.0	Aker BP must overcome the most difficult barrels to keep production above 500,000 barrels - EnergyWatch		https://news.google.com/rss/articles/CBMickFVX3lxTFB0cXZJMmFBYkF5LTl4OXl5QkxOWDZFOWM3TDJxZlFjMGRXNHkwRjA0SEtvZE5TMnJna3V5cDlmbWtYS29YSjIxQVd2THFDb0RVVXgwbm1aTThRUzdPbzhFYjZmdE0zcGxoZWxvZ0d0bUdtUQ?oc=5
2026-02-24	Google	0.0	B.P. Marsh boosts investments and payouts as specialist insurance portfolio delivers - TipRanks		https://news.google.com/rss/articles/CBMi0AFBVV95cUxPSjNGYnpHSnVIblpSVUt2RVUxX0twcUNoSmtfNi1SRVlBS09EM1R4ZkVhd1RqSzUzb05ob2hfZ2p0WmlPR2w3X09yVTd5Q2NmTmFHMkJuRzdBTGlfUTMzRVNZWWJIVmRNLVptaXdyNjRCRE91ZWdmVXQ3VjA3dWpDbVBvOTl4OTR0X1c3TU5IYWsweUY5TWFIUFJhTmJGa2pyb2VqM3I1VnhFemV3VzN1ZWVOeVNDOERBZEk2NDZWRUlseklXOFpNdnNNNHo1Y0J3?oc=5
2026-02-24	Google	0.0	B.P. Marsh reports £30.7m in disposals, plans £13m dividend - Investing.com		https://news.google.com/rss/articles/CBMirwFBVV95cUxNSmlNeHg4UHFjWm54RzZ3eF9mc3ZKNTlGQTVobTNHYTk4WFNKWkVTMFA4bXN5d0R3VHFSREtjY2ZPNXVzcFhMU0xzS3lINjJLQlRsdGE4bmlpM19fYjFZcVpSU2F5VDRyQVVoVVRlcnF3MHJWc0dtalhZUXhxZDF5WC1oMmJJOTA3QTF1OGRqS3NBMUhlazhyMXowczZkZDhXQkpaQ0tmWEFuVDd6ck5r?oc=5
2026-02-24	Google	0.0	B.P. Marsh views sustained M&A wave as strategic opportunity - Reinsurance News		https://news.google.com/rss/articles/CBMikgFBVV95cUxQamVnTTZEWUdjOUVhOWhNaWt0QXpLbFdoa3RGQklLQ2J6VTJmNEpMNUhlbGdGdmhpaEdyc2VzdVNNRlRiSlV5WG52dE03S1RhWVI5dWlVZ2dXVlVBMDlaY1pVWjE4TGFkUm4xdDZRb0lNc3lzcWYybmxEWGVkcVFKSUNBLWgxQWg5MHlpaHFNcWljZw?oc=5
2026-02-24	Google	0.0	BP Hits Pause On Buybacks As Earnings Forecasts Dip - Finimize		https://news.google.com/rss/articles/CBMihwFBVV95cUxOY3Z5bTBCeTBya1lpRW0tb01wRGJCNG9PRWdkekpWZ0RTWDZUTEJQMDZkYm5UNlFvcU5pWTZLUFlRc1Y5LWlmUjJLYkgzcjdNb1JJbDdiX200WHdZYVJtVVpHVVUxcEprWHhSMDFqT1NudHZSb2JoU1NMZnAwdFc4djlDVUNJUFk?oc=5
2026-02-24	Google	0.0	BP Marsh has nine sector startups under review as cash tops 49.5 million pounds - theinsurer.com		https://news.google.com/rss/articles/CBMiwwFBVV95cUxPR3JzNEw5S0hmdy04TElITGZ4UkppaGY1R3JnTDNXdXhRMUhYN3RmbXkxcms1aGJTNzdrbkRjbXduVDV4dHRhMjBDMGJjYTkzYVRqZ1R6TUNsb3k1Zjl6Q2JfMm5fRlF6RXV1dGFyR0xoQlk2OTFZWnc4U2p2OURzZWl1azhTZ2duRWhjU2RHUFJmMlpmTEVVcnFxU0VJYl9PQlRuaUVkV2M1MEc4bm1VZUhldlVWLTU1UjNUMDcyeUxfazA?oc=5
2026-02-24	Google	0.0	BP p l c (NYSE:BP) Neutral Consensus Stands As Desks Weigh Strategy Updates - Kalkine Media		https://news.google.com/rss/articles/CBMitAFBVV95cUxOeGd2YWlYOVRQNlBLUEdTdXJ0U0dkZ2QxSXRuZ1czS1VUOWp6N3UyVlg5NmdramIwdmFEaG1EcHJjSk9lZXdNV0xXNGFuWDhwLXVUaXBRb2dNNDllLWs2eklZdW8zOG1UWEswQjdNbXZmd20tbWx0TlphYWhoS04zRzd1VVdDZWYxbkFwbVdUOHN5cjZSZHEzYkVyOW01c1FsWUZkcng0NlZnTjdEZXFZcUxUNHY?oc=5
2026-02-24	Google	0.0	BP pushes ahead on Manakin-Cocuina gas project after sanctions relief - Oil & Gas Middle East		https://news.google.com/rss/articles/CBMid0FVX3lxTFAtVGhGdnZmSENxY1UzYmZieGJwWGhKZ0NxMlZaaGZLZE9fYVNZQlMxZkJuUm5sUEYyR1FUMkJVOE1wcHlxamhOZENZQmhrb1RTYzVoZzJhM3lfT0R3bTI3RnBKYTQtZkkxb2tvNW8zWldSaFZUR0Jn?oc=5
2026-02-24	Google	0.0	BP rips move to re-open NYC schools after blizzard, points to challenges on Staten Island Tuesday morning - SILive.com		https://news.google.com/rss/articles/CBMi2AFBVV95cUxQcXBOREVfQkRzR1pRX2lqMHZaR3hKTTNrSW5tOVBZa1d3QW4zNnBxNTdaYkJrbmNJNmNLR19JTnNhZzA4RjJMRmc4blJ3eHU0THN4b1ZobUFhSkRmMGZtdlVuZUpneVRQdXZ1STJPYmlGM1Q5Sl9JYmJrcW1Hc0czdUcxT2VocXp6bDBXNHBiYjZiRDRMeVJORE9reUl4YWphVUJ2QS1CZUZGMHc2TldRenN3TFpqSW9Kd0huZHRyZUdYZjJKYlA5SzZwMzZ4V2ZIMUZDVmdhTmbSAewBQVVfeXFMT3Fqa3RQLWJ4YVBub1BMWG1pQmhBMG4wV3hoVDgwNUR4WUF5ZEpCSTYwNlZrN0hIc2Z0MUlZYUQ2NjRBLXNVeTdHYWR0dlpZNXBycjJSQkJkdlZKdFBBSm5pa0V3NUFQVVdSaFN2RmhSeTRIX0k2ZHg3NEJ0TjdmU0pQNW15MjdDRXdYWFpUZVhDazE5NFY0WXAxVURSQVZxUmhlZWQ0N2ppY3pnSllSN0VWaklHMFhybktzLWZZbnlFdmNCcmJaQjVxQU02STNER3JZY2JvSEJGTFBNTzlTSEg4aGcwc1JhVVJibk0?oc=5
2026-02-24	Google	0.0	BP share price rises as oil nears seven-month highs — what investors watch next - TechStock²		https://news.google.com/rss/articles/CBMinwFBVV95cUxPQzYzbUZqaklUV1I3VGFiNjZaU3Fla2Vfc2FKLXVyMjdoTzNpRE1LNENVQmhieHhULWpiYUh2amNXQzA0SWVuMWlBMXcwMy01b3haXzhrSVZmeFVFUFp1bkVtdFVRTmdmQ1FJMVJyR1ptdUJ5WFhMTEt4Tjl6WG90TVNRSnI4bXpwNElmeGJrV0tDMGxQcW5IR1JVVUVVX1U?oc=5
2026-02-24	Google	0.0	BP's Strategic Pivot Prompts Analyst Reassessments - AD HOC NEWS		https://news.google.com/rss/articles/CBMirgFBVV95cUxQb0gybVl4UjIwM0ZabVhTSkVtNE5UclpwSjduUW5mYjRMSTJwRjBJZmFJeXlBT05CWllWWWdCM3EwamJFUXA1emZfNDJPZnEtNVRtM3hmNGUxaUFkSGwwbHFjb1k3REcyeDBuMmw5UkVNVnJmY1pSRVdNd1lUTkJmODJaVkFtRmlmSlhpQWxmZjY1aFhtVFNrMGRDd09rT0FZQUt4TkYzODlMcl9aOEE?oc=5
2026-02-24	Google	0.0	From Cabinet secretary to doomsday president: What being the designated survivor is like - WRAL		https://news.google.com/rss/articles/CBMiwAFBVV95cUxPVUJudHlib3ZYN25oMkNQUnRLQVhaVFNjTWNnMHN5U2JoVFR5RWNCam4ycV9WWXdNV1dUYXZMQ2lqU2d2MWdZMjVKakZKdF9zQUpybHpnaXhQODlWSndNdUpFWC1kQnFrem40cUhpTlctZ3IxUXl5akN5Tmt0RHZLQ1R0TUV5OHVHbE9JdlRMZWt2Y1N5NnRCZENwbHFoa2x2aHpYT2EtaW4wUHJYX0l5YlVxc3BqWG9hNVBwMUUwcTg?oc=5
2026-02-24	Google	0.0	HELLENiQ ENERGY and bp Extend Strategic Partnership in Greece Through 2035 - Machine Maker		https://news.google.com/rss/articles/CBMirAFBVV95cUxPdzFuR0VxSzJLc0lHcDBfeVZub01sTzFfQzVTVGIwSE0yQUZtRmo5X1VHdlhIam44dzJLV2tBeWhaNlJjc0QwSEIzVWdtZ1J1MWx4b2VSd2QtOXZ1OVNKVEtTaGttY1h4a281bWFWcWNLWGdYc0ZQNHljeTJaNzNrek5samttaDVEZTJRRDk5LW5WaXp2Rm1vajlWMUk2dlBjbE9RYWZKVFV6S1JD?oc=5
2026-02-24	Google	0.0	Headwaters Quilt Guild to host meeting March 3 - Bemidji Pioneer		https://news.google.com/rss/articles/CBMikgFBVV95cUxOMHR6czhJQ2dwd1FmbmFJNFI0YlJKQVB3azRfTUdMU0pWbEI4NWdNRTk2S1h3dGhGaUw1U3dMY3JYaFgwWVVsY1J2WWNiT2E3NHZRN3RDTHFtZVh2Zk9OS09Jdjhzc1RIVXZqeHlfOWM3NnNKbGdzQllIUnJoYUJEUWNBVnRGLVdTVHNzT3pfc0ZZZw?oc=5
2026-02-24	Google	0.0	IBD Rating Upgrades: BP ADR Shows Improved Technical Strength - Investor's Business Daily		https://news.google.com/rss/articles/CBMipwFBVV95cUxQNm5tbV9HajdQMlE3NVZvcjF0bUVLdExWUmJmQ1JhODRlSXB1dTNqZkZQbXUzSUxxSm9iYTgwZG5iZ0lxRUpGRG94NGsxbGh1R1gyeV8xckVqekVFdGdXUU1LazdINjdzSGJSMGRZRUd4cGhyQW5sR05VeExyTWFXNlh5UnFHYk45ZWpaeTlxbHV2MTRSSVl2YlJmcEFKZzBpOTc0M0tUOA?oc=5
2026-02-24	Google	0.0	Insurance sector consolidation ‘accelerating’ in 2026: BP Marsh - Insurance Day		https://news.google.com/rss/articles/CBMioAFBVV95cUxPN1NJNS1mLTdVdXRPaXRSaXJCeDhWdWFIVXVqUmtJN0JRVklSalIwMHlSRnMxYVRLMTlLbEZGZ0dnMGdrMmJJdjN6bXYwSnlYNVpIUUVmMm9QUW05UWhtVFN6Qk9ROFJhblYyaEk2S1lzalBsM05nQTBWMEkyTU41aE9kVlNhY25VM0wzUXkzT0sxSXNGWEYtQ3M2T3dtMENh?oc=5
2026-02-24	Google	0.0	Lightsource bp sells 1 GW solar portfolio to Aula Energy (Australia) - Enerdata		https://news.google.com/rss/articles/CBMiwgFBVV95cUxNN3RvOTF0MUNLbHRPZzdJRjBLYkw3MU1kQlBaeGhWQ2QxQjVJbFJwQVJ4d2VMUXVJSkRtX2VnN3BRRWRSYl9hcTlkOUVIZ29RTmVwNDhMZTc3VEhyR2FDYUZMT2EtazRoUnVJdDVqTkRFVXI5OEZNQlpNaVpoUjVNTFVZdGNrYVRrUi1sMjZLM0ozTWhEQ0NSYUFhWmRSOHE2aGV0Sm1hc2VxV3M2NXFjSkNoSDE1aUg3TmxHQzFvVlFrdw?oc=5
2026-02-24	Google	0.0	Lightsource bp sells 800MWh of co-located battery storage in Australia to Aula Energy - Energy-Storage.News		https://news.google.com/rss/articles/CBMiugFBVV95cUxQWG14dWJlUmhEOWM1V1ZjN1RFYVhjLV9ldktJZVE1MDZQNzRjdkJqc21yTTNyMWRkM3FFUFJxZHpuaEpBSjl1aHpLUGNiNkFTR1Nsa2NoNERJU2pCTzN5NVB3M1l1Ry1ZSE1teG9iWnJJNjE2QXhqelBJOFdXcjF0RkZsR3ZkYk9NdlhnWU5fMm5lcE95T284ZUp0U21mbmZKWmt4RHRrcWVfNi1ZMWRUZ2VHNlJKSG9RNmc?oc=5
2026-02-24	Google	0.0	Tuesday BP: Who would be to blame for another work stoppage? - MSN		https://news.google.com/rss/articles/CBMirgFBVV95cUxOYTRoc2xHS2FIdGh3LVhlay1uZlBVSk9xSXpWZzFIU1JBQjhvQ2dfRmlqS3dYVFdJWlItVDhJdjBJUnlEdXFrWElfN3N6R0o0bERHLTNjMGowUlJUaGpIS1hNRFhwZWJrQmsxMVRySG1aeVg2UDcySUVGQ2d1ZHZzamtUeGl5XzZVUHVHcnFwNmRCVW90LVliUVdYcVRSYTk1LXpWaU5aaG0yWlBPN3c?oc=5
2026-02-24	Google	0.0	Tuesday BP: Who would be to blame for another work stoppage? - McCovey Chronicles		https://news.google.com/rss/articles/CBMivgFBVV95cUxNS0RvdkFKdk1XaTdnZXg1UlVZdEI2aThWTGZmY2NhTlBTQ3dpZFNiTmd5SnpJOXhlOVJpaFYxaUNWbkJCUFVhVGdCR3BkSk9yOGxXRS0xNmx4Q1VuV0JTWXN1Y1NYSVBGMUYxOFYzRXlnaS1HUlJxSkI1NVlvazVEUnNJLUhmYy1qTFJqMXduX3hCeWRtMTdha0t1b3lfY2x3U1I3N1RYVTcwWTVlN09uYzRKc1NUcVpwWGdBNENB?oc=5
2026-02-24	Google	0.0	Wrestling changed Mercy McIntyre’s life; Jacks prepare for individual state tournament - Bemidji Pioneer		https://news.google.com/rss/articles/CBMixgFBVV95cUxQcFRBUW9lVDdNbFpCVGd3UHZxajk5QnVoUXkxTklCTEpGeXpPbGpjRUFITHlmSGZ6M2pYZ0NYMHNlYzJGMEtoRTlEa1Faek9naWJLbG9PSk15X2paQUtGaVBPVE1tTHlBSlJoNFpBN1JWU1diMHA4NzBMRWg2UXh1d2dWbmhaTFFHVGpVSzg4anZvVklZd29tTkNQUlRqWjZ6VmFFYzFzd291WEIzVFUyTml3ZlE3dnhoMFpPOExabmpoWEtfQ0E?oc=5
2026-02-24	Google	0.0	Yankees' captain Aaron Judge takes BP at Dunedin - Bergen Record		https://news.google.com/rss/articles/CBMiwwFBVV95cUxPR2p3MVM3QXFTakd4Vk5zcUJ2a1dEV29vckF0YmlnMXNUdDNEMGNILU16VHJ4cWRKSTgxOGY2Nmh6YnUxbGY1ME41b3VzUWlqWjA3R1BhQzlaVm50UmtabXdGWnBVYW9na0JZZFlQTEFfZGx1ZTFaNHZZbXk0Mzhid3hQSkh1WUF0VE9oci1RQ2JhbTcyNmx1U0NmLVUzdkF4X3NBb09ibGRLU0ZlcnRxcTZaa081bWc1Wk90OV9rVEZJQUk?oc=5
2026-02-24	Google	0.0	Your Watch Will One Day Track Blood Pressure - IEEE Spectrum		https://news.google.com/rss/articles/CBMia0FVX3lxTE5CZm5QN1lsWk9QcExNN09HU1VJYS01eXhEZk1reWFCOU01Vkotb3BtZ0Vib0hzcUtVal9tazhjZ0pTeFhwd0xLcmRxOHlCNEJ6X2ZNS1NBTDh3NnBKY2hIOTV4VXdSWXRLVWg40gF_QVVfeXFMT3R6bHlYdGNCaUExRG5WR1VvZjFzRUNlTlNOblIxT2FRc3I5dVhPenhTYS1EZDY0d2xUYzA0MmhNWkFPLXRiRWEycG8ybEJvUTJmQjQzZ3V1SE1ITm9lNVZYSk5uUjR5WGVVY0dibEMtM3RHWlROMFhIVXlKWXNTWQ?oc=5
2026-02-24	Google	-0.125	B.P. Marsh - Trading Update February 24, 2026 - James Sharp & Co.		https://news.google.com/rss/articles/CBMidEFVX3lxTE02VDNfWmN0TlhCN1Zuc1FFOGp0V3lPOUhHWjNHRUVHZHVSWmFfVFhsSEN6Z2xxRURlbHpwNjZuWnpLdHk3STM4MHlyMFFzdXoyN1VHQTZKZFdxR1VjTTlLb3NQTmhGZDZra3NMdVZxQWs0RGc2?oc=5
2026-02-23	Yahoo	0.3	SM Energy Announces Divestiture Agreement Worth $950 Million	SM announces selling South Texas assets for $950M in cash, using proceeds to cut debt and fortify its balance sheet amid commodity swings.	https://finance.yahoo.com/news/sm-energy-announces-divestiture-agreement-160300893.html?.tsrc=rss
2026-02-23	Rigzone	0.235	BP, Eni Fire Up New Field offshore Angola	Azule Energy Holdings Ltd, a joint venture between Eni SpA and BP PLC, along with its partners, has begun oil production at the Ndungu full-field in Angola, part of the Agogo Integrated West Hub Project. The Ndungu field is designed to produce up to 60,000 barrels of oil per day, with the combined Agogo and Ndungu fields expected to reach a peak output of approximately 175,000 barrels per day. This development follows Azule's recent declaration of a new oil discovery in Block 15/06, estimated at	https://www.rigzone.com/news/bp_eni_fire_up_new_field_offshore_angola-23-feb-2026-183044-article/?rss=true
2026-02-23	AD HOC NEWS	0.212	BP Shares Reach Annual Peak Amid Geopolitical Tensions and Strategic Renewal	BP shares recently hit a 52-week high, driven by geopolitical tensions fueling higher oil prices and a significant contract extension in the Caspian Sea. Despite strategic shifts, including a drop in underlying profit and impairments on renewable energy projects, the company is solidifying its traditional hydrocarbon business and reducing net debt. A leadership transition is also underway, with Meg O'Neill set to become the first female CEO in April.	https://www.ad-hoc-news.de/boerse/news/ueberblick/bp-shares-reach-annual-peak-amid-geopolitical-tensions-and-strategic/68604723
