Date	Source	Sentiment	Headline	Summary	URL
2026-03-06	Google	0.3	3 High-Flying Stocks Worth Investigating - StockStory		https://news.google.com/rss/articles/CBMipAFBVV95cUxPcUgxLVotSEFpVUNYdXBENW1uMkVDVnRhTzk5d2lRcGp5TTFDLTB1YzQ1N0lYWkJrTHljeEVtRHpUZHpEY3RxZFdXdG5zbGhCM1lCTW40VnhvX2doSFZzV0p3WUw1NWZQemhKUkxjUFNQY1ozdmhxektHcUxOclV2N3VDNUNsWkxYYThMdTRnVXlFeTVGOTQ0Ym1yYm5uUXdJcl9qUA?oc=5
2026-03-06	Yahoo	0.267	Where is KLA Corporation (KLAC) Headed According to the Street?	KLA Corporation (NASDAQ:KLAC) is one of the best semiconductor equipment stocks to invest in now. KLA Corporation (NASDAQ:KLAC) received several rating updates in February. On February 26, Citi opened an “upside 30-day catalyst watch” on KLA Corporation (NASDAQ:KLAC) and maintained a Buy rating on the shares, setting a price target of $1,800. The firm believes […]	https://finance.yahoo.com/news/where-kla-corporation-klac-headed-100955542.html?.tsrc=rss
2026-03-06	Google	0.0	Noteworthy ETF Inflows: SOXL, AMAT, KLAC, MRVL - Nasdaq		https://news.google.com/rss/articles/CBMif0FVX3lxTE1xU1BnbzJvVjZxUGFFMjRiWl9oM05tbUhFRGk3QTN4LXVKMDFXc2l2MXZHUVpuRDNPNUdaUHVwZjJwd29FTGtSdTVLQnk3a2xnWkllSllXeGdKYmZ1T2lFNFBEWEY2OW5vRUVWS2FXcnplTTlseU9pZTF2SlRiUHM?oc=5
2026-03-06	Yahoo	0.0	Stocks making big moves this week: C3.ai, ADT, Xerox, Corning, and KLA Corporation	Check out the companies making headlines this week:	https://finance.yahoo.com/news/stocks-making-big-moves-week-173437581.html?.tsrc=rss
2026-03-06	Yahoo	-0.032	Why KLA (KLAC) Is Down 6.2% After Iran-Linked Chip Sell-Off Ahead Of Investor Day	In recent days, KLA Corporation has been caught up in a broad semiconductor sector sell-off linked to geopolitical tensions in Iran that pressured chipmakers globally. At the same time, KLA remains a focus for investors ahead of its March 12 Investor Day, where updated long-term goals and product plans are expected to be outlined. Against this backdrop of geopolitically driven sector volatility, we’ll examine how renewed attention on KLA’s process-control franchise could influence its...	https://finance.yahoo.com/news/why-kla-klac-down-6-020952887.html?.tsrc=rss
2026-03-06	Yahoo	-0.122	3 High-Flying Stocks Worth Investigating	"""You get what you pay for"" often applies to expensive stocks with best-in-class business models and execution. While their quality can sometimes justify the premium, they typically experience elevated volatility during market downturns when expectations change."	https://finance.yahoo.com/news/3-high-flying-stocks-worth-125937851.html?.tsrc=rss
2026-03-05	Google	0.7	Wall Street Analysts Think KLA (KLAC) Is a Good Investment: Is It? - Yahoo Finance Singapore		https://news.google.com/rss/articles/CBMihgFBVV95cUxOeDJTSW5UNXZDdmNtWnlOWXl2Mi1zaDcwb1lQSVFYYWF4OFN0dGVmc0lOY1NDOW52cG1IOURIR2dvanV0VkdwN2hkMlFBdmhYUHh5Nk1wY09aNVYxaDRuell6YW5RRFdHWl9ZN3NiNUIwMVNHb0w1MDhjbnpLcWtjUG43UzZNUQ?oc=5
2026-03-05	Yahoo	0.252	Wall Street Analysts Think KLA (KLAC) Is a Good Investment: Is It?	Based on the average brokerage recommendation (ABR), KLA (KLAC) should be added to one's portfolio. Wall Street analysts' overly optimistic recommendations cast doubt on the effectiveness of this highly sought-after metric. So, is the stock worth buying?	https://finance.yahoo.com/news/wall-street-analysts-think-kla-143004248.html?.tsrc=rss
2026-03-05	Yahoo	0.25	Here's Why KLA (KLAC) Fell More Than Broader Market	In the closing of the recent trading day, KLA (KLAC) stood at $1, denoting a -3.37% move from the preceding trading day.	https://finance.yahoo.com/news/heres-why-kla-klac-fell-230003274.html?.tsrc=rss
2026-03-05	Yahoo	0.247	The Zacks Analyst Blog Highlights Berkshire Hathaway, KLA, CME Group, Natural Health Trends and Good Times Restaurants	KLAC rides AI-driven semiconductor demand with strong share gains, while BRK.B and CME face mixed pressures despite solid long-term business strengths.	https://finance.yahoo.com/news/zacks-analyst-blog-highlights-berkshire-083500372.html?.tsrc=rss
2026-03-05	Google	0.2	3 Promising Stocks to Consider Exploring - Bitget		https://news.google.com/rss/articles/CBMiXkFVX3lxTE94NWlqbUZOS1ZhY3RiZTVDMW1xaUstZ3pvS0FJWk54MkFZakZlMDN3MlFPVUs1eHVzc2RjZVZFRVl1TDk0SEVZSmdENkZDVkUtbnp2QkFTcmtXaGhDWHfSAWNBVV95cUxOOUJtVWFna1h2Y0xvM2ZQYVctYUZhbUduM01LcjRaRzJJZ2FDNzFMcHZjc0Exb1hseHJjc1B0VmwyMlVJWDFVR2pSODdHWWp1STFZR1lzNWNtWjVhLUNJc0dLZkE?oc=5
2026-03-05	Google	0.033	Why (KLAC) Price Action Is Critical for Tactical Trading - Stock Traders Daily		https://news.google.com/rss/articles/CBMi0AFBVV95cUxPblhDZm1ib0o4LXFuYy1TQnpfUzJXWkNsaEcwWUhsYVIyTktUSFlKTmdUdUt2ZHQwV2t4NzBONlNuMllTMFRqZk5VX29SMGZ5SHdRd2d5elRnOUQ5YWFwdnZKYUxUa08taUVUdlFTQnpMVXpURENXQTdmMUlhVEVGQWVJQU5lQU0yaWJlTDV3ZnN4VmZtdXhJUWMtOXNVRXVhRFJGblVFa09MSk8tOFhKOF94MFk5SVhLdVlvSmpkMDlvTDBPNU42eHNzOWNVNVNv?oc=5
2026-03-05	Yahoo	0.015	KLA (KLAC) Just Overtook the 20-Day Moving Average	Should investors be excited or worried when a stock crosses above the 20-day simple moving average?	https://finance.yahoo.com/news/kla-klac-just-overtook-20-143502547.html?.tsrc=rss
2026-03-05	Google	-0.15	KLA (KLAC) Just Overtook the 20-Day Moving Average - Zacks Investment Research		https://news.google.com/rss/articles/CBMikwFBVV95cUxQZU9jSUpoQk1YYktqa3JKcE0zVE1VU2tFRzNJX3N0Y3hyTktJZGxkTzlWcXpMRUI4aDk5YWhiMnEwaVdsNENtZmtGVDBkcXhIaVpiRnFKUUVKLTFoUGpKRFFkQUw5c3FqSV9kQm1vbExwVHV4TlNMdkc1Z2liSHdBZDlGUk9QeVVTQ1hULVpkMFEzR1k?oc=5
2026-03-04	Google	0.0	KLA Corporation $KLAC Shares Sold by Fisher Asset Management LLC - MarketBeat		https://news.google.com/rss/articles/CBMiwgFBVV95cUxQamFMV29nMlZUQkNBVzY1RFhpbDFoaExzT1RLbGVLdnc5em0temFFNk1FUHNJcGFDZlp4NUFLdTZ3NThUYXVwMk95elRGdHNmdjM1bGVReFJ0b0RzRDc3d3g0dERYRU9rOXlDSTFKSTJ1eTdlSHhkWTZTcVZQR1lwdC1fVUh3S3FiTTVxMWRJZjdDUDFBMEI4ZXB0RVBJN1pwTUdWLW5fX0VGcnBBdFNyZWRBdDI2c0JtNXg0dHBVNU56dw?oc=5
2026-03-04	Yahoo	0.0	Teradyne (TER) Up 7.5% Since Last Earnings Report: Can It Continue?	Teradyne (TER) reported earnings 30 days ago. What's next for the stock? We take a look at earnings estimates for some clues.	https://finance.yahoo.com/news/teradyne-ter-7-5-since-163006189.html?.tsrc=rss
2026-03-03	Google	0.227	KLA Corporation (KLAC) Placed on Positive Catalyst Watch Ahead of Investor Day - Yahoo Finance Singapore		https://news.google.com/rss/articles/CBMijgFBVV95cUxOY1BWR2lxUXFETWxzd0owSnlTVGw5dUxvOUdMcFM4cWVnRDlROTlvZHRqamJvSDllTC05R0MtZEx5SzhSX0Rhb1VDT3JWZGpiSTVTTUVpenpGc2hHQlJWcFhiOEVwVW5sVXRPcUMzM1htY3VxdDJTVmJHbERTV3pBc0dVenYzdGVWLWt4UEhn?oc=5
2026-03-03	Google	0.0	KLA Corporation $KLAC Shares Bought by Teachers Retirement System of The State of Kentucky - MarketBeat		https://news.google.com/rss/articles/CBMi5AFBVV95cUxORXZvMXMtTnBsR1lGNHFaWmEtZDVlT0ZRYTA0RWhobzlzTGdmSWhXWVpDSy1qa3FFRzJMaFFZRzRVOXlIM1JFM1cxLXBCRzFyeFd4dVdHU3E0UWFrLUJBWmJaZ3ZrSDg3MUN3SThlNnlPNkQ1d09OWXlFZTN4YU1odW9uaDJqdjNaVk9LNjZqREM2TWh4S1NqZVdlZFg5MnhZay1oQk1hQjF1ZHBKdGcyWVFFUU1WRlJPTWE3S3Vmb0ZiQWtaNWliLUlVRFFlbXYtVjFMcm1QdVhPME40VG9jR0pHODk?oc=5
2026-03-03	Google	0.0	Why KLA Corporation (KLAC) Shares Are Trading Lower Today - TradingView		https://news.google.com/rss/articles/CBMitwFBVV95cUxNZGFCV1pfMEpzWUFWc093YTRXeEkxVXFsVE5meVRIaEE2T2JBMExsYkRfY3FDeG95R3l0dHM3LXd1bE5ZZWJiMkZMel93TXNXU0RiVVQtWXhnR2duVW1DemFvVWhXQW85ZWVrRjZhSVU3QVF3QTlCRm93X3RCX2w0M3pTb292RVhDdzM5V0gtWUdKLWtFLW9NcFBUb2c0S3BGM3hvUHlmdFpGUDNWbWtQdjBfOTVocnM?oc=5
2026-03-02	Google	0.0	Bahl & Gaynor Inc. Decreases Stake in KLA Corporation $KLAC - MarketBeat		https://news.google.com/rss/articles/CBMitwFBVV95cUxNeDBVREVObUFyX05SQlB3MU1nVnJyZHFLdzgyOE9GTEFfa3NzRThlV1JtOVdWbkZmQkQ4TG5Fd2lnQ3NFd0NieU1XNFpONFRFMU1nYUo2QjZfRXVabmEyLXlleWlubGM3N2taUzF5d2Jnc0tfaVlkWU5BQk83SEVoMzl3SEVnMGZJUllTYTNZVXoyTDlhM25HdnZDQjdCTXMzUmh6c1NVVFBTUG5DcEVHVjdROHNyZ2c?oc=5
2026-02-27	Google	0.0	Close Asset Management Ltd Takes $133.21 Million Position in KLA Corporation $KLAC - MarketBeat		https://news.google.com/rss/articles/CBMi1wFBVV95cUxPbTRQQ1ZmWDhCeWM3LVcwUElmRHN0cFhrMlBCelhsUmRMWlJYU3Fqc2tsRmFDUmJESWNETXBQa1ZPYU10RmZhdTZ4dTNDLWpQdWVTclJqeFFTWFhIN1VmVEExc0k1VDRRdU9LeHY3aXpLU0V2c1V5bDZPajV1cm5nWXc0MUNpVHE3eE4yeWJqX1ljdDNpTGc4S1EzR3pHc1Z0aDVzN3hOYTNGOXJUbFV2UUhRU0lBeTh2V1NWdXExc2pEUXZobUNZTVBCTVBXQkJZYnk0cmdQcw?oc=5
2026-02-27	Google	0.0	Did Citi’s 30‑Day Catalyst Watch Ahead of Investor Day Just Shift KLA’s (KLAC) Investment Narrative? - simplywall.st		https://news.google.com/rss/articles/CBMixwFBVV95cUxPT0pEdkRzYnFXbXJwb08ySFhUa1YtTDE0d3MzTFZCdmNoQm9CRFZkNzZBR3VqOXZrSlo0S0Fha3pXZ3UwcG9OOTFpTmY5OGEtMmk4MnZsc2JXb0RhbzBaVV90cDJQOURBU2s2YWVmVldQNXhTLU5QWGxQVkdXOXVpUy1MUkZjUDBsN090eWFIaFBhRVJPVExVVGt5cXRHNVVhbXJiY3dsTWhmQm9fUWh2TGd2amt4MVRuTG11T2d5SndMM3g5aWln0gHMAUFVX3lxTFBDczZjZnJzSUhpWG9WUU9aVU1ZR3pJbEsyREZCWFZncHlUMTlna29BV0d5N0FvSUZicWdaRjZIR0Uzb3NuSUlYbWVGSFhBOGJHb1FTemFNNUwzcDZZNHFkRms4UFVKc1JLcHdvMXp4bVR5NkVVWjZzQkRJNlJ1VEVxd0g2TWNkY0M3Q3Mta2hDUDlUb3NVQlFlamxTbUN4TVlNeHdtM042ekVnaC1UczNuVUtIcWxSTU9zNEhTSzUzdTZkRHpqZEdVT0dVYg?oc=5
2026-02-27	Google	-0.075	"KLA Corporation (NASDAQ:KLAC) Given Average Rating of ""Moderate Buy"" by Brokerages - MarketBeat"		https://news.google.com/rss/articles/CBMiywFBVV95cUxPbU1JU1FtUjNtRXF0Z1BCaGhibnotZHYya3d4UzB2ZU12cGwxbDBzVl9Hei14S2VJVTBpektYbkpkWmFyVUNlSWFhSHowR3lQVmZPbU1BNU0zaFMwNFpRWlQtMWRqRXRmYXNpUUhDRzhCSDd3SlljdHhrdmtNS0JxTnlyQ1I1dWI5MnFyd0ttU2puTUdrZThjV2pFY2VyUGVFU1BmMFRZUmdock5GZkxHVFhpOEVTVmtIZEpURmdXNlM5YkgxRVlsbnQzZw?oc=5
2026-02-26	Google	0.5	Notable ETF Outflow Detected - IWB, INTC, ABT, KLAC - Nasdaq		https://news.google.com/rss/articles/CBMihAFBVV95cUxQdDVrVUoycUdqTkw5ZlRzMmx5NHU1T1BOVFdLS3p6OGNfOHFyRU8ybWFpQzdLeG5nZ3lncVEtV3gxOERUQ0dibDFpTkZDU0stdUd6dTVCMWxKT19BTkZ3Z202emNHbzJHTTVlZmx1Y240eFc5cWlGOG1wUFJPVEx4QmdNMXM?oc=5
2026-02-26	Yahoo	0.169	KLA (KLAC) Valuation Check As AI Chipmakers Rally On Nvidia Earnings Optimism	AI optimism and sector move lifting KLA Today’s rally in AI related chipmakers has KLA (KLAC) trading more than 3% higher, as investors position ahead of Nvidia’s earnings and reassess semiconductor equipment exposure tied to artificial intelligence spending. See our latest analysis for KLA. Beyond today’s move, KLA’s recent share price performance has been strong, with a 90 day share price return of 33.44% and a 1 year total shareholder return of 111.02%, indicating strong momentum around AI...	https://finance.yahoo.com/news/kla-klac-valuation-check-ai-030917158.html?.tsrc=rss
2026-02-26	Yahoo	0.136	Investors Boost Semiconductor Spending Forecasts for KLA Corporation (KLAC)	Aristotle Funds, an investment advisor, released its “Growth Equity Fund” fourth-quarter 2025 investor letter. A copy of the letter can be downloaded here. U.S. equity markets reached new all-time highs in Q4 2025, with the S&amp;P 500 Index rising 2.66% and the Bloomberg U.S. Aggregate Bond Index increasing by 1.10%. Within the Russell 1000 Growth Index, […]	https://finance.yahoo.com/news/investors-boost-semiconductor-spending-forecasts-125750727.html?.tsrc=rss
2026-02-26	Yahoo	0.118	Citi opens positive catalyst watch on KLA Corp ahead of investor day	Investing.com -- Citi has placed KLA Corp on a 30-day positive Catalyst Watch ahead of the company’s 12 March Investor Day in New York, citing expectations for a stronger long-term financial model and potential product announcements.	https://finance.yahoo.com/news/citi-opens-positive-catalyst-watch-132357701.html?.tsrc=rss
2026-02-26	Google	0.0	Westpac Banking Corp Acquires 932 Shares of KLA Corporation $KLAC - MarketBeat		https://news.google.com/rss/articles/CBMiwwFBVV95cUxQWkRjakdoaXd6d1VUVHJjdm1sUENQbURXRFcwa3g0UnpHRnNIZ3cyT1dUTzZnUnNYLXIwb3haVWJiUnQ0Ty1kZlZoTUFqc1hqMVk0eExJU0U4QW5xcFBnbm1IalBSWE9NbGF1Tzh6ZHZaMVNxZDBYZlFsRzdVYWlzVmhhbTF5NlhndUMxZkNwMmhiSjFOZ1lFbF9OUi1ZRUZ6V0U1ZHI1d2JUTUtNblZqSmtsWDNDeWw2ZXlyNWVXcWd5QWc?oc=5
2026-02-26	Google	0.0	Why LRCX, KLAC Could Outperform Teradyne Stock - Trefis		https://news.google.com/rss/articles/CBMiqgFBVV95cUxOZVF2LWNYS1hzaXBEcVhhX0xtZDBoZGc4MmJTRFVFVDdRRjBRQTRrZ2tySjk1VFh3UWFQS01RQlF3TTlTdnplRkFpRDVVZlZrWmRuMXVhb3FBNWxnTVpsQ2ZYcndOU0k3aHk1YnU3M0o5NmJFcVNhY0RhTkxUYWJFdzJsVnZqdzRBSWlscWp5ZWJVRWlqQTI2UXNITU53RHBhV3JRNkgzS0VLdw?oc=5
2026-02-26	Google	-0.05	Investors Boost Semiconductor Spending Forecasts for KLA Corporation (KLAC) - Insider Monkey		https://news.google.com/rss/articles/CBMiuAFBVV95cUxOQjgxN0RMdUdVWGhuZGtSZTQtclVyRFFocTN6OF9oTkhZVGQtUzlPSkF5TTRrQ1BRaFdDeS1fWkVFdGl2RzJJVkpyUnJzdTZIcHJaTjJwLVJCNzFXbEd3QXlueHVySVFtVXdoU29TNDZkdlJuYXhwX19iXzdXZjIwTjZqZlZ4bDhRdUl6WjZaZ0ZBbmtRNkY5T29VSTEyQVEta2xQSDg4d1NhZFJERTRwcGJCNVRQcW9m0gHAAUFVX3lxTE9wcUQtcmd4UldidWRZaW1TSHZhVmdydnR2djJnS2hObEo0eW0tSXAzSlhNamNTQ3l5ZXBSRmQwZFFPSGtqQ2EzSW5oLVJHODlYaG5ZZVRkWGE3cWg5SzNNdkhBaDREdENfVE1QemxESTUzV3o4M1JpT0tNSGk0aFF4Q3JJelF0VU93VVFHMmlXRFlNeEpnaVllT2lFU0RXWnJvYUhaQ0ExS2h0TGtWdl9PaTdoMU5uX0J3ejYzbFdKOA?oc=5
2026-02-26	Yahoo	-0.07	The AI spending boom is creating winners beyond the 'Mag 7.' Why one sector could see big gains.	While the market has long been obsessed with chipmakers such as Nvidia and AMD, Morgan Stanley argues that the real value is now migrating to semiconductor equipment makers — the companies that build the multibillion-dollar machines used in fabrication plants.	https://finance.yahoo.com/news/the-ai-spending-boom-is-creating-winners-beyond-the-mag-7-why-one-sector-could-see-big-gains-153820672.html?.tsrc=rss
2026-02-25	Google	0.444	KLA Rides on Strong Advanced Packaging Growth: More Upside Ahead? - The Globe and Mail		https://news.google.com/rss/articles/CBMi4AFBVV95cUxNWDhDRzlUZDlDUDhlaVFMUnZmNXB6dDdhb0ZlanlzcjVnb0hERTVjVktfbUlQTDRiRUI3Mk10YTViZWZwRlYybTFjaUtscEtWTmdqWlNaNlQxdnZnaGJiMDhxZXZwMlN0eXZMekRJVzhQVWhsbXA4eVViYmw4c1NydUtqUVNaN0p1aVBpZ1poQUZ0bHhETVpUbE9yTUxRWWxTOGRSSjMteU5rdElLcmZZMjN0TlRvTW02THFVM3ZJZUtzeDAxSlBSRzFsRkFLQWs2VFNrU3kxRFZnU19WaGp2Qw?oc=5
2026-02-25	Yahoo	0.433	KLA Rides on Strong Advanced Packaging Growth: More Upside Ahead?	KLAC rides 70% systems revenue surge on advanced packaging and AI chip demand, eyes mid-teen growth in 2026 despite margin headwinds as 2nm investment rises.	https://finance.yahoo.com/news/kla-rides-strong-advanced-packaging-160900645.html?.tsrc=rss
2026-02-25	Google	0.167	Pay Less, Grow More: LRCX, KLAC Beat Teradyne Stock - Trefis		https://news.google.com/rss/articles/CBMirgFBVV95cUxNbmdoc1JpMXRiQlpNQ2VMR1M2bEpaQ1NNLWdFZnI4X0NRMWxrYUZtbGJWa1R2YkF2S2tNSXNxb3MyNHk4T3BxME1RM3J0RUpJR2pOX0h4dDlVWk0tTl9IVGFjNTBodzFfZHZDT3MwdnpQU01mVVJMSE9ic1VkalhkMUx0VExyQmhrQlFJWERpdzRleERyX3hwMGVIdVpKWC1ua2lkNms0NzJaXy1ydVE?oc=5
2026-02-25	Yahoo	0.03	Can Foundry Strength Keep Lam Research's $5B+ Revenue Streak Alive?	LRCX's AI-driven foundry surge pushes revenues past $5B for a third straight quarter. Can the Systems segment's growth keep the streak alive?	https://finance.yahoo.com/news/foundry-strength-keep-lam-researchs-130800221.html?.tsrc=rss
2026-02-25	Google	0.0	KLA (NASDAQ:KLAC) Price Target Raised to $1,809.00 - MarketBeat		https://news.google.com/rss/articles/CBMinwFBVV95cUxPajhMNEUyZmRTdmpKTE03eHhTSlNxdjR4Q0kxanVYaTR5TGFOeEdHaGt6ZWlHUF90bDlvR0UwaGNrMks5UE8xVG1fZW81Q3lSMGY0cHlINERVZG9FNW85cFdsV1Z5TlJjRmVyaFdCLXN3MWJKSVp4QUtvOVFmSm1NLXBWbFFJOTZtR0tlX0pfZDY0aHI5XzNQckdKZ1NxaFE?oc=5
2026-02-25	Google	-0.3	Is It Too Late To Consider KLA (KLAC) After A 109% One Year Surge? - simplywall.st		https://news.google.com/rss/articles/CBMixwFBVV95cUxNZ2FQNnpoMmFOUUx1NlZsZVRxT0Vnb3hRMWtYRWlhMXlreS1yeW5rSjduVnBWM0lpc0tEdG1nZGZMQ3JnNFhKOEJ0MGFQdVRyYkpqNFIydW5tOVRITjNiaU1PMzQ1WWlsV2lIaFQtZUtNNWJDRlNKa1JDNW4zMFMtOWFMWGllaEFRMHpQV0k3aVVvNlV0ZTJiUGNLeTlpMGlDY0p3UXVkSnAzWWFBT3RsaEV4N1RoaDEwN05INEVrRkZsWFZGaXRV0gHMAUFVX3lxTE9EdkVGVUY0aDhyU0ZsZ1pGbUhnSXRlSURpQ1Qyd0I0Q1VnaE1lSEdtbjcxSkVnUDlLekVnbGcwYW9zYVFVcXN2cXJfSVdxXzZQMXR6czdsbjBWS2hkcXRjMUlhaHFOMXM0ZUJmTWZhX09uYk05b29sVUdBR1M0ekhGZWVfVjVnTlVVUVFBLTlrbFBEWUVMM3F2NHF6bHRGYk55elBKWlVSbWpyRWd6c2JwRzc1VXNVb3Z0bFF3WUhJQ1JZa2VGdHN0WGh2Tg?oc=5
2026-02-24	Google	0.283	Reassessing KLA (KLAC) Valuation As Strong Recent Returns Meet Mixed Fair Value Signals - simplywall.st		https://news.google.com/rss/articles/CBMixwFBVV95cUxQQXg5TFNOTlcwY1pyNWNuQ1BLOUlaamhSQVJmOW1MS2NCdTFYVEpRbm9oVFVsSGRLaUt2SzhZaDBEM1o3RGloM29TSWUyNlVWRzlhR0RpY3ctVjdfQUxCdTU1M3dUWHVhczEyNC14Ym0xVXFTaTN3Y2NLTW5hczQwSWM5bFVheHp5bjJaRlRxVDV5cmhIOGtzVHp6QjJMSjZZUHp6Smx0Wm1meDBtbk8tU1BoQ2JQb2NKcWlSekxjZnB5a2gxLThN0gHMAUFVX3lxTFBPRHhUeDh4bWFWZkZfRlI0a2ctSGtGWVFwUU5fM2lpM1VpY01XMzRhSFpQZTJ0TjBITGlna0FHdU5jZElBZXVDemhZcUE3czJfT1pJMTFWdDUxZkZpWGZTY3FzWXdpaUtZeW1SeW94U21sdnhMTWhiSU5WYjhpb1I3NTN2ZjR1Ty0yQmZ4ODdTd1lzRXplSGNvdEUxX0hUTUl2U3YtZU1YbjRQaUo2XzNXR0FVdy1INUdRcENQVV9LNTJQVFh5TnNaMGtJRA?oc=5
2026-02-23	Yahoo	0.333	Astera Labs vs. KLA: Which Semiconductor Stock Has More Upside?	ALAB and KLAC benefit from AI-driven chip demand, but KLAC's process control strength and packaging momentum give it greater upside potential.	https://finance.yahoo.com/news/astera-labs-vs-kla-semiconductor-155600427.html?.tsrc=rss
2026-02-20	Yahoo	0.65	3 Growth Stocks to Stash	Growth is a hallmark of all great companies, but the laws of gravity eventually take hold. Those who rode the COVID boom and ensuing tech selloff in 2022 will surely remember that the market’s punishment can be swift and severe when trajectories fall.	https://finance.yahoo.com/news/3-growth-stocks-stash-043244040.html?.tsrc=rss
2026-02-20	Google	0.0	3 Growth Stocks to Stash - Finviz		https://news.google.com/rss/articles/CBMiZkFVX3lxTE5NTGNFZjRhemxiSkQ0TTVKMlFNWWJYWEZ6b3dXczVYS2JKSW96UXFDU3RTQXBYOEwyX3M4NFFJeUFMSHgzSFVoczFEb2dIT2JXenNyNUhOWFJzcnFweV9xTTJxNmdEUQ?oc=5
2026-02-20	Google	0.0	How KLA Stock Gained 90% - Trefis		https://news.google.com/rss/articles/CBMimgFBVV95cUxPcVBhR0QzRnpVdmVlSDNWbmdrczRpemdxc3o5Zlo5UWl0ZUhNUVloU0w2Uk5BcDlRanFJdkZSckVrRDcwTXNPYzAzNkVyV0JTVUFWcHNxem4xUXNYRHhrbm9lUXlkb0Z4eU1nS1lNYThpamRyMGZlRGpyYlNjc2FjYTU3RTB3bC1xQUxKUFBjZTB6clV2WmVseXJB?oc=5
2026-02-20	Google	0.0	KLA Corporation $KLAC Shares Acquired by BNP PARIBAS ASSET MANAGEMENT Holding S.A. - MarketBeat		https://news.google.com/rss/articles/CBMi1wFBVV95cUxQR0dkNFpNSl81SXd1My1UUGFOdlU3N01CYTFTUUdMbWFCck1oTUp6ZTZKZi1lTmhSSWY4NkVXNWFJUVVnNFloaEIzdVROQm1MSVlOT25pdGh2Z0V4ZzVabzhGV2VmWXlFeDFieXM3TFJ4Vk13bENmaFc3RDN0eUs1SGxqbDJKQkR3bmpwRUExMUQyRFNXWFBNNW95U1RvWHFOTlk3ZzcxSWdvSWhOTEdobDd1eU05OC1oRDBGaThtWUg0UENZVG1YdjJsbUc0TlNBVmxDdjVHYw?oc=5
2026-02-20	Google	0.0	Why KLA Stock Jumped 90%? - Trefis		https://news.google.com/rss/articles/CBMikAFBVV95cUxPQnNBYjljZDMyN3BjTTZJVU9WVnEwZXhYc2pHcVgzTFdKUXhZTldoMENzclNGdjFtVkE5SUtHQVZ2U1VHV21tdEljT0g4LWpHcGpya1dhMGJwU2RnZkFPR0RyTU9NdVZOekxTTVdGY3JnaDRSYTRWcVd0QmN3Vml0Z1FNR184SERjdmV5MFFma1Q?oc=5
2026-02-19	Google	0.1	Here's How Much You Would Have Made Owning KLA Stock In The Last 15 Years - Sahm		https://news.google.com/rss/articles/CBMiwgFBVV95cUxPdFc2VDNHVU5LX3J6WU9qV1c0VExIdmdQQ2JsUkVBRXpROFNVYlZvem41YXdITW8tQjdtSXZBcVZ2ZFV1TFdVRkRERV9wdDNiRV9YQjNFbGxxa3N0bDB6UGhTaFh0VTBoQTFVZ2tvYlE2REpPVFZFVGVTTDVyYmRhQXJqSkQtdGF2VkhsYWYzc2dsZWRlVEJVX3pvZGtaclE5Z3JQUmlBclhzNVktWkRVS0JyWXNqWFFJQ0FRdm9iWmpVUQ?oc=5
2026-02-19	Google	0.0	KLA Corporation: I Would Take Some Profits (Rating Downgrade) - Seeking Alpha		https://news.google.com/rss/articles/CBMipgFBVV95cUxPcl95M1gwY085ZF9pcmg2bC1zTVpwdnhRelBuakh1cGx6OG5BUmZmYy1zUHdwUkhLd2dJWUxRX2d0SHJzRDNaZkpwZXNGZklDX0hCRkZnRGxEN1Uxcjh2dW5QZEpsa0RxbmVfWXZDMGNuT3I0NVlDZmhZUkJzckJPS2pMckhPWnNDV0stR0h5U3pyVUdfYWUzMVRXRDFmX2p1SENJeXNn?oc=5
2026-02-19	Google	0.0	What KLA (KLAC)'s Reaffirmed Dividend Amid AI Demand Means For Shareholders - simplywall.st		https://news.google.com/rss/articles/CBMixgFBVV95cUxOZTdLQkwwcm1OX3NjSTl4SV9KbjJ3TVhRYS02MWI4M05fRTBSV21GZHo1SVdfNHAxM2lhajZJYjlZanloZWhkdm4xa1VsNFBJdGV5NU5PNDNjYjdNWlVWeWxpb1VXY05LbTI3VEcxendWV1V3YUlvanh5RkFfSTRISGNiSDJoVUJVYlI2N2M5amFGNGxpYnowOWFnX0JlcE1fbTEtelJfWG9aYmRBaUExUUlpajlyN3FXWkhJZ1dmS2l3OFB4bWfSAcsBQVVfeXFMTm9NVEF6a3JFaGFMZDhzdDBoMXNWVHlPOEZYSGxSRjR6YThzVEtJaGRfWU01VnUwbjJVd25SVHViVzUxZ1k3WHRWWlZjV3EzaHAydFMzdDVsandkYURSRFcybUhkMVh4bUhtcEVMLTNMU3RpZ1J2c1JxdlpUQkJzWlZKcWlWcUF0VVJlV1pwVWtDdlJaLUpXMXNkS2s5SjNTMlUwMV9ndG0zNEh5YlA3amZtdUVmbWhBcTFoTFlSbWhUSXVRZUhBUVpyUGc?oc=5
2026-02-18	Yahoo	0.5	This is the most under-owned megacap tech stock, according to Morgan Stanley	Investing.com -- In a note to clients on Wednesday, Morgan Stanley analysts revealed the most under-owned megacap technology stock.	https://finance.yahoo.com/news/most-under-owned-megacap-tech-122746844.html?.tsrc=rss
2026-02-18	Yahoo	0.5	What Are Wall Street Analysts' Target Price for KLA Corporation Stock?	What target price have Street analysts put on KLA Corp’s stock after its latest earnings release?	https://www.barchart.com/story/news/279626/what-are-wall-street-analysts-target-price-for-kla-corporation-stock?.tsrc=rss
2026-02-18	Google	0.0	KLA Stock Surged 100%, Here’s Why - Trefis		https://news.google.com/rss/articles/CBMilwFBVV95cUxQdV8zZ3ktaFFMU2RaUzB2SXh6anRkQjZvMTBQWUFjX3AxRkVvWGhjbDRyWjlJdDRPSTB1cm1tc1dlTDRTNXJYZm9hdGROa1JLNlA4MHRiaHRJOWltRUNHQ2IwQmg3bzYyQTFuSTduN0ZBRDBmNlJnaEo4UldxZXRPUzVTenFRSEdQTE95eEljSXpINjZId3Zn?oc=5
2026-02-18	Google	0.0	Noteworthy ETF Inflows: QQQM, KLAC, GILD, ADI - Nasdaq		https://news.google.com/rss/articles/CBMifkFVX3lxTE80OHpqcmN5cUVwaU91SWJIOFl4d082c3VPY0huS1BNQmNWRG9qUVlwVDk4MnNSRTJleUp0dTJtQ2s5V3liLVVoVEFlSWthV0U3eHl2Ym9EcmoyQU5fRWNXMUhhRl9jaFRfaVBWYndBc3ZXeWtWUDYzb2tGaHRLZw?oc=5
2026-02-18	Google	0.0	What Is Happening With KLA Stock? - Trefis		https://news.google.com/rss/articles/CBMipgFBVV95cUxPQWJjVDJQVm54cWk4c3dNOWYtQTNBaEQxb3pORjRudEhKU09QLTllZ1RyNE5WQ1Vmdzd1NTI4bUtlN2pxNnpISHMwdDM4MG9DZXRKT2VHTUNQZkRlWTV1WmZpdHZnam8wenhyMmNIWjFuQlk4amtlZjZKcTI2Tk1sMVRhVEZJazRlZU1yVDBZTUllYWg3SXlTWVJkekJuaVVQS20zaVBn?oc=5
2026-02-17	Google	0.525	KLA (KLAC) Is Considered a Good Investment by Brokers: Is That True? - Yahoo Finance		https://news.google.com/rss/articles/CBMiiAFBVV95cUxNU3Y2SHE0TURmTnpfVGV0NUE0S0RjZldXbzNnN1VHVExTaTNVT1JuWDdUS2NocVR5XzlVaUcwTi1NVWF2cWNmVTVYbmh2Wm5qSjd3cmF2M09nVndKcXctMzlmVElkUkwxZGtlS0cyaDZnXzBEM3BJZWcwSG5wb1lkU3ZoRVkwS1ZD?oc=5
2026-02-17	Yahoo	0.5	Applied Materials (AMAT) Seen Winning Whether WFE Growth Is Market- or Share-Driven	Applied Materials (NASDAQ:AMAT) is one of the AI Stocks to Watch. Applied Materials (NASDAQ:AMAT) is gaining renewed interest from Wall Street as analysts view the stock as well-positioned toward growth whether the market is market-driven or share-driven. On February 13, TD Cowen analyst Krish Sankar raised the price target on Applied Materials (NASDAQ: AMAT) to $450.00 […]	https://finance.yahoo.com/news/applied-materials-amat-seen-winning-120135930.html?.tsrc=rss
2026-02-17	Yahoo	0.327	KLA (KLAC) Is Considered a Good Investment by Brokers: Is That True?	According to the average brokerage recommendation (ABR), one should invest in KLA (KLAC). It is debatable whether this highly sought-after metric is effective because Wall Street analysts' recommendations tend to be overly optimistic. Would it be worth investing in the stock?	https://finance.yahoo.com/news/kla-klac-considered-good-investment-143003154.html?.tsrc=rss
2026-02-17	Google	0.25	3 Big Reasons to Love KLA Corporation (KLAC) - Barchart.com		https://news.google.com/rss/articles/CBMijgFBVV95cUxON0NxUEIwcGF3U2Jhck4tS0U1ZnMxVERWYnRhQVl2NzJEOFRKQUJaUm5BQ3lLZUpUWTNlQmUtYXRIaWZfc1Z2ajVFR05LT183QW1Ua2hCLVZmUWJoaFRBX2xkUmh0OURYU0RfOWV0M0ZVbDNrdkxJTkd6SVQ4ODlnbjdCNFhXbWxoejlkMTFn?oc=5
2026-02-17	Google	0.107	KLA Corporation (NASDAQ:KLAC) Sees Large Decrease in Short Interest - MarketBeat		https://news.google.com/rss/articles/CBMiugFBVV95cUxNdm0yNXEzT2ZhUGtTVDJQcFlKMFo1QWluOEpPd1B1TXpmcS1uNG9XUFFGRVhadl9Jem5SU3M5OEJkQUJ6b2RpakxEMWNsMy1UN1V1dVUtSWJnZDdObl81OTFBR0tmN25WeVBTT3pEWDR3NVNCSUNHUE5ReGtvSUQzTE1BX3FVMzZJN0I4bWNmTkI1cjhGRVREeWp0YVZxSXJObXhtREtOb3dUNjNkTHFOQUVwcG1odjFBNGc?oc=5
2026-02-17	Yahoo	0.078	Is It Too Late To Consider KLA (KLAC) After A 3x Three-Year Surge?	If you are wondering whether KLA's share price still reflects good value after a strong run, you are not alone. This article will help you frame that question clearly. The stock closed at US$1,470.19, with returns of 2.8% over the past week, a 6.2% decline over 30 days, 15.4% year to date, about 96% over 1 year, and roughly 3x over 3 years. This naturally raises questions about how much of that performance is already priced in. Recent news around KLA has kept investor attention on the stock,...	https://finance.yahoo.com/news/too-consider-kla-klac-3x-231246074.html?.tsrc=rss
2026-02-17	Yahoo	0.0	3 Reasons to Make ASYS Stock a Sell Even After 94% Rise in 6 Months	Amtech Systems soars 94% in six months, but falling estimates, pricing pressure and cyclical risks signal the rally may be running out of steam.	https://finance.yahoo.com/news/3-reasons-asys-stock-sell-161500867.html?.tsrc=rss
2026-02-17	Google	0.0	Crestwood Advisors Group LLC Cuts Holdings in KLA Corporation $KLAC - MarketBeat		https://news.google.com/rss/articles/CBMixgFBVV95cUxPSjYyYW5WbXhOTnRwY0tyMEgtYUFOY0J5bnZKZXIwVmFPaXhiUWZaYS1ZMlg4UTZOY09lWXRsLVNqODNJSFNsbnVBRE8tbWlmNHNnVVVoOGl5N0h3ak5MTlhXTjBGOTVEQWd1ZHFCS2FOUFl5c1B1X1RWMDREbVl3RnQ4ZXpkdWRScXc1bS1hOUhqb1NaLWI5NkZVMF9nZlJLRzVNWnZFZUZETlR2emd1Mm5aOVpqMVlzNENfYk9OWHh0ZjB6Nnc?oc=5
2026-02-17	Yahoo	-0.029	3 Big Reasons to Love KLA Corporation (KLAC)	KLA Corporation has been on fire lately. In the past six months alone, the company’s stock price has rocketed 65.2%, reaching $1,459 per share. This was partly due to its solid quarterly results, and the performance may have investors wondering how to approach the situation.	https://finance.yahoo.com/news/3-big-reasons-love-kla-040505939.html?.tsrc=rss
2026-02-17	Google	-0.3	Is It Too Late To Consider KLA (KLAC) After A 3x Three-Year Surge? - Yahoo Finance		https://news.google.com/rss/articles/CBMiekFVX3lxTE5kRXNGNVp5ZWQxTWprZV9yMDNJaHJXcXF3QXR0c0JlbS15elo3Z1lIZ0dtVEkwZzJJQldjMFdyNlJrdVBtUEFocmZQQVk3Y2o1UVM1T05ZRGljWHJJWFBjUEJEVDRpeW15MzVTTks3TjgyOGl0b1BaZ3lB?oc=5
