Date	Source	Sentiment	Headline	Summary	URL
2026-02-16	Yahoo	0.433	Teradyne Surges 88% in Three Months: Time to Buy the Stock?	TER stock soars 88% in three months as AI demand fuels semiconductor test and robotics growth, with strong Q1 guidance adding momentum.	https://finance.yahoo.com/news/teradyne-surges-88-three-months-154100590.html?.tsrc=rss
2026-02-16	Google	0.25	3 Big Reasons to Love KLA Corporation (KLAC) - Yahoo Finance		https://news.google.com/rss/articles/CBMid0FVX3lxTE9melBuSGtEY1JEYzg0YS1pVng1VkpWX2g5QTV3T3NhbDU1TkwxWWZTaHRZZ3NRR19NbXVMb0hxSG1YNHFSLVZJVnFhNFlocThNZl9JYjNNZUVHakxxUmRhY0V2U3dINGZnRkN2Y180dDlmWF9VdE13?oc=5
2026-02-16	Yahoo	-0.375	Amtech's Weak SFS Demand Continues: Is Profit Growth at Risk?	ASYS faces profit growth risks as SFS revenues drop 12.4% and losses mount, with FY26 tagged as an investment year.	https://finance.yahoo.com/news/amtechs-weak-sfs-demand-continues-165700248.html?.tsrc=rss
2026-02-14	Yahoo	0.2	These ‘safer’ chip stocks have boomed this year. Is it too late to buy in?	Valuations have risen for many semiconductor-equipment producers — but some are still relatively cheap.	https://www.marketwatch.com/story/these-safer-chip-stocks-have-boomed-this-year-is-it-too-late-to-buy-in-98a3e509?.tsrc=rss
2026-02-14	Google	0.0	KLAC PE Ratio & Valuation, Is KLAC Overvalued - Intellectia AI		https://news.google.com/rss/articles/CBMiWkFVX3lxTE5Sb09oSlBvbXNUbk1jTUMxZHZpaTNGd1ZlNzdiSnVNZGNVcXd3TWI5cXJ0cm5RZExsMHEtODdaY19TUjE2ajJKaDFZNUVDZjlTZXdvUkpnSGZMZw?oc=5
2026-02-13	Yahoo	0.067	KLA Market Share Gains Offset Valuation Concerns As AI R&D Expands	KLA (NasdaqGS:KLAC) is reporting strong and sustained market share gains in semiconductor inspection equipment. These gains are linked to its leading edge inspection technology and industry leading gross margins. The company is using its robust profitability and cash generation to fund shareholder returns and AI focused R&amp;D in Chennai. KLA, a key supplier of process control and inspection tools to chipmakers, sits at the center of the semiconductor equipment sector. Its recent market share..	https://finance.yahoo.com/news/kla-market-share-gains-offset-190929988.html?.tsrc=rss
2026-02-13	Google	0.0	Ex-Dividend Reminder: KLAC, Jabil and Wabtec - Nasdaq		https://news.google.com/rss/articles/CBMif0FVX3lxTFAyVHpWSzNEVDNZejl1VWZwbFp6RnBIcmZlVDlNQWtHaTg1d09aRUJldEdiMXA2aExlRHJGVVY5RkJ5MXZsRGtxdklSQ3lKbWVORXNNS2luQlVpUzd3QWFFa29ydUdheFkyWFg0MXNRc1B5dHB4MFdpcENjT2hmX2c?oc=5
2026-02-12	Yahoo	0.6	Victor Peng Joins Rambus Board of Directors	SAN JOSE, Calif., February 12, 2026--Victor Peng joins Rambus Board of Directors, effective February 12, 2026.	https://finance.yahoo.com/news/victor-peng-joins-rambus-board-210500113.html?.tsrc=rss
2026-02-12	Yahoo	0.25	2 S&P 500 Stocks on Our Watchlist and 1 We Ignore	The S&amp;P 500 (^GSPC) is home to the biggest and most well-known companies in the market, making it a go-to index for investors seeking stability. But not all large-cap stocks are created equal - some are struggling with slowing growth, declining margins, or increased competition.	https://finance.yahoo.com/news/2-p-500-stocks-watchlist-043612592.html?.tsrc=rss
2026-02-12	Yahoo	0.0	Applied Materials forecasts upbeat results on AI demand, memory shortage	Applied Materials (AMAT) forecast second-quarter revenue and profit above market estimates on Thursday, betting on a boom in demand for AI processors ‌and a worldwide memory shortage to help drive sales of its chipmaking equipment.	https://finance.yahoo.com/news/applied-materials-forecasts-quarterly-results-210654984.html?.tsrc=rss
2026-02-11	Yahoo	0.0	KLA Shares Drop 15% Post Q2 Earnings: Should You Buy on the Dip?	KLAC sinks 15% after weak fiscal Q3 guidance and cost headwinds, but booming advanced packaging and AI demand keep its long-term story intact.	https://finance.yahoo.com/news/kla-shares-drop-15-post-165700060.html?.tsrc=rss
2026-02-10	Yahoo	0.4	AMAT Climbs 8% in a Month: Time to Buy, Sell or Hold the Stock?	Applied Materials shares jump 7.6% in a month as strength in wafer fab tools, advanced packaging and AI-driven demand supports its long-term growth case.	https://finance.yahoo.com/news/amat-climbs-8-month-time-163600277.html?.tsrc=rss
2026-02-10	Yahoo	0.331	Lam Research Stock's High P/E: Justified Premium or Too Pricey to Buy?	LRCX trades at a 38.14 forward P/E after a 175% rally, but AI-driven demand, strong margins and $5B-plus quarters fuel confidence in its growth.	https://finance.yahoo.com/news/lam-research-stocks-high-p-150000625.html?.tsrc=rss
2026-02-10	Google	0.1	Why KLA Stock's Rally Is Far From Over - Forbes		https://news.google.com/rss/articles/CBMinAFBVV95cUxOUC12dzZfWWxBb0FpdnktbEV5RWNCWVpCaFAzd0VjaUhfNTRUQkc5MnFId0dfdzJva0hpTE9ZNi1Jb3h5Sk5ubXJNWXFQSFBMQlA0dS0tRDFLWFg5QWNrdFBiYnNuN3RXQXpvRFN4Ykowemg2SW54NVJDalFsZlN5QWhuYlhMWi1Rd3JzZmJYQkpLUEpBT1lfUXlzT0s?oc=5
2026-02-10	Google	0.0	Avoiding Lag: Real-Time Signals in (KLAC) Movement - Stock Traders Daily		https://news.google.com/rss/articles/CBMixwFBVV95cUxOdVdLTEU0MW9xeVpDZW1hS2ZrRmVnRFlqdjhiWm1ZMTdmTzNRRlAzTXFoWlItZHcxVlFFQ1NkNFAtcEltR0cyODJZZXBnSktlUjk5Q2N2eElkVVAyLXliUWszSF9MYkhfS19mV2hTYXBKdlV0U2tYeHdnY1ppb3ZTbzdiQTR0VzI0U0YwQTZvZ01xXy1BWXgxNGhTd1NXZ1dGOVdpV3Q3eG94RWRvWW1GSlFralNXLUZiWjV5TmxBalYtcm1lZ0h3?oc=5
2026-02-10	Google	0.0	KLA Stock May Still Have Room to Run - Trefis		https://news.google.com/rss/articles/CBMiogFBVV95cUxQSkNfb2Y0N05aN2E2RlIzQjNITThBZ3hHenpMRlI5T1ljQkwzU1JtcE4xbVJJNWRwTzJ2SUd6SlpaamNfaGpya3luMlB5eWFydzFvRkZnRVZ3RWhrSTRHcmFZZHFva2xTR2xDa0hXT2ZwRHJVbjVMY3VVUmlpYW5hMXI5UHQ3V09aSmtTOGpZMGQ3VUp1UDNRVEhZR1BSQUh3YXc?oc=5
2026-02-10	Yahoo	-0.067	KLA’s Robust Q2 Results and Cash Returns Could Be A Game Changer For KLA (KLAC)	KLA Corporation recently reported past second-quarter fiscal 2026 results showing higher revenue of US$3,297.15 million and net income of US$1,145.68 million year over year, alongside issuing guidance for third-quarter revenue of about US$3.35 billion and GAAP diluted EPS between US$8.07 and US$9.63. In parallel, KLA’s board affirmed a quarterly dividend of US$1.90 per share and the company completed a multi-year share repurchase totaling 18,859,237 shares for US$9.06 billion, underscoring...	https://finance.yahoo.com/news/kla-robust-q2-results-cash-181149082.html?.tsrc=rss
2026-02-08	Google	0.0	Citi Remains Bullish on KLA (KLAC) Amid Persistent Phase 2 Upcycle in Wafer Fab Equipment and Potential Upside - Yahoo Finance		https://news.google.com/rss/articles/CBMigAFBVV95cUxQUTMwYXlrYkxqbXNuMmpXN3NmYlN1N1BmSHdrYjRDbnNELXU4MEJocm1nWEU5ZDhFcTNubHRzZnMtdjkxdHBSV016WnZRbzlYZHo3SUdIbF9tRnNwUE96VFIwOXluQVNXQy1FVWhRczYtaDVldUVzT2dXeUV0QlRfeA?oc=5
2026-02-07	Google	0.0	KLA stock price jumps 8% as chip rebound lifts KLAC — what to know before Monday - TechStock²		https://news.google.com/rss/articles/CBMinwFBVV95cUxQOE5hMjY2OVZ6XzF5eWxKLUVWMmJUQWtwUDhNYm5ETTRCNzkxTGRxQ0ZkS0lvMzIycmw0Q3RVNExYZFVSNjlnQWZSTzkxcWd5NkRNZ0F1eHp0cTkwNy1DWm1DV2FjUXN2UWdFc0NBaEZOR3R4Z3Q0REVnYzUwR1NibW5QZVgwQVVZdTQzYmpwLXJTamNVNnEzZnRMSW5nVmM?oc=5
2026-02-05	Google	0.123	Assessing KLA (KLAC) Valuation After A Sharp Pullback And Strong Multi Year Gains - Yahoo Finance		https://news.google.com/rss/articles/CBMihwFBVV95cUxOSmtjdjRYZGVSZjBLNXdKTkdxSll1WkZtVU5STFVEV3BISm5kdFA5LW03MnBsbmhKVXVXSWJiLWVuMnJzTWdPbkhXQTl3ZkJXc1dab0oxREtPdkxhUXRKa2FReVZUQ3ZkMmFIa3FUUzM0RVJNdV9PVExpZHZxbGhjV1pxNi1qaWs?oc=5
2026-02-05	Google	0.0	KLA Declares Regular Cash Dividend - PR Newswire		https://news.google.com/rss/articles/CBMilAFBVV95cUxPbFk1RTBKaG1nTjloS19nYjNZblBZQmxQYnEtZkR5OGRNazh3dF9LaXpMclMxc19YdENwVmRoNDBVbXlwU1VhQVVnYV9OVVRuLUthdVlUM3dHNEhCLWRib2V0UHY3ZGJiRmRvdzZhd3V3ZE14cHIzckpOeFZycEllOXY5YjhFdHpRVXQ1MHhiQkpyUWJa?oc=5
2026-02-05	Google	0.0	KLA shareholders to receive $1.90 dividend; record date Feb. 17 - Stock Titan		https://news.google.com/rss/articles/CBMihwFBVV95cUxPa2xfTWxFUTJmdVVSbW5kX21LSDdJTzVFZkhfS2puT3YtWHlXcHdROXI3UjFwUl9XMjJXWTJwOE80c09Cb09ZdWhaMlczbmRidThSRUg4ek9TRlRWcEJ6aHZSbEVjbUJWQmFYdEdfcmEwWHVEUDcyQVlEZXRoUjdKamRiUUlCWXc?oc=5
2026-02-05	Google	0.0	KLA stock rebounds after ASE flags big advanced-packaging push — what KLAC traders watch next - TechStock²		https://news.google.com/rss/articles/CBMisgFBVV95cUxOTG5HWkJHMkwzYS1uZ3dNclpTWllBUF9NTlRFLVJraVM3Qm9ZU2o3YUt1aENENThpSi1LQzItTFl5TzhhbDFfVkp6Zm91NmtlM0xudmhHSC1pSHFjTV9US0NrMUxXRk9uRUI1eEJhM3pFdWJoVGN6NXdzbjR3dmJiejVLcG1rTEZjQkNrbVNGV3A0bTFhNFYxSExZZ0ZuOE41UHFmRmo5a2h2TmJxUzdIMzRn?oc=5
2026-02-04	Yahoo	0.0	Cirrus Logic Q3 Earnings & Revenues Surpass Estimates, Rise Y/Y	CRUS beat Q3 EPS expectations as revenue jumped 24.7% on smartphone demand and a favorable device mix.	https://finance.yahoo.com/news/cirrus-logic-q3-earnings-revenues-152300246.html?.tsrc=rss
2026-02-04	Google	0.0	Why KLA (KLAC) International Revenue Trends Deserve Your Attention - Yahoo Finance		https://news.google.com/rss/articles/CBMihwFBVV95cUxOcl9rVG5YM2dBSV8yS2VEU0ZPQlNFZ296T2FrS042WTJHYlR6UW41ZjRlT0RtazhQdll1RXBVbkROMjJDZjlrRDA3Y3FtTkh4YVNaLTRDY2FXand2UmdwV1diLVVHVXd3ektidVN5Y1pYMmtSd0dEdVlVWmU2YVItYzY3ZXRWSWM?oc=5
2026-02-03	Google	0.0	Citigroup Maintains Buy on KLA Corporation (KLAC) Jan 2026, PT $1,800 - Meyka		https://news.google.com/rss/articles/CBMimAFBVV95cUxNdWF3U25JdldaZGNBQmxZeFMtc3JJVlRnbjZHTEY1Q2JDNF9JZE1UdEtyZ04ya0RfRW5YSU1vQndKcFJ1bE5FWjR4YVlJNE5yVklfQWZQMVp1Ym5nLWJyTW4zSTZ2R0RJaGhpUWNzUFFxMURVZzBPalpvTXlqdkZvLXcxNUU3OFJ2a2dZSDNsUTVWcEYwRTcwYQ?oc=5
2026-02-03	Google	0.0	KLA Sank After Earnings—Then Analysts Started Raising Targets - MarketBeat		https://news.google.com/rss/articles/CBMinwFBVV95cUxPOEZQOGUtcXpoV0Ewcjh5dW02MFpWT2l1WFRJcjRfcVNhY0tRdHNoalJuU1MyYlAxZ1dHaklGZnN2SVFobnhQV0F2QjFrR3FlYXpwMWhNaHh2WER3TUQwc2Rkc0tzQnlDcEF5U3BBcTNiRHJXemRXWWh5MXo0WWxtR1dhNDVkSlBHSWtfa0pfMVNTSkpDcEEzdVc0WmdSX28?oc=5
2026-02-03	Google	-0.104	KLA Corp (KLAC) Stock Price Down 4.14% on Feb 3 - GuruFocus		https://news.google.com/rss/articles/CBMiigFBVV95cUxNY1BHR2tGNVNqeW90WXc4UUFBUnktVllBN2FYdUlvYjhtSENkd29zczk5T1NoVm1FazRMb0hSallmc2s4b0VQcnljY1ExbktTa2g4emNSZVVzczhYOUV5S3B4bFZaUmFEXzhyUmtscjdVN0pjSURacWZRTHZTU2VaQ1locWY5Z2ZPWlE?oc=5
2026-02-02	Google	0.0	KLA Corporation (KLAC): A Bull Case Theory - Finviz		https://news.google.com/rss/articles/CBMiekFVX3lxTFBpWHk0TVVMTkVGRW9GMFJ6N0FIenAyREdQQ1doSkVJUDJSM21BbkUyMmRxUHp1akhra21fNFBXb0oxSDFha2VlV2lGQUVlbWVHcW5VUXRDVWVLYU5nMTgxQ1VnQmpLcExwUXZmMHZJLTJDd3JvNjJNTmx3?oc=5
2026-02-02	Google	0.0	KLA Corporation (KLAC): A Bull Case Theory - Yahoo Finance		https://news.google.com/rss/articles/CBMiggFBVV95cUxNS1VTVk9Ic2I2RWhSbndObkM5bXd1OUsxZDc3WkcxdjhNX2h3WDFCOFFpQy1CMXJQRUtQbWd3Ty15RExQcFF2QlZBalBCRFRpRWw2Q1pFckozQzl0dG5UOHJBQ1p2RFk1R3k1S2NmNGRnZ2ZKMkk3emlHSzdFN3YzeTFR?oc=5
2026-01-31	Google	0.5	KLA Stock May Have More Upside - Trefis		https://news.google.com/rss/articles/CBMiogFBVV95cUxQUFAzZXczaFkzQnZZQVpKeHlqYlc4TE9yWDNPVnkyWmEyVE5LbHdqakFSc2N5V2pxZUwtVkxKdFBYQkJ0RzItZGxJbks1X1YzbjMzdG1MZ01GZ2pnVmlLZlAyZEpJbHY5TXp2UkRRclBORmM3NHdRaE0zZkVTYzROYlh3ckJtcm0tajVtX1N1X05HVkVqQkdXMmd5RzUzZGVxQXc?oc=5
2026-01-31	Google	0.467	Momentum Meets Value: KLA Stock Could Be A Good Buy - Trefis		https://news.google.com/rss/articles/CBMisgFBVV95cUxOaFVkLXVSWERsNGFCRld3N0EtekZvSnFwb0pOREszT2lJSnBoay1TdU9UN1hzYmJ5cDZlLUloZTA3VVlyOTRGaDlpS2lndUstYkNQNm5pTzl5Z2ZPUmozaUFSSlRucHNZRzJYelNiM0lrUzFIS0QxUFNpMWJJcVl5LThwLXdOSDMyNWUyR0RtZkphTDRSbmhKZ0lUQ0RtcFkyYjZIZ09Bdi01OWVjeUlnbFBR?oc=5
2026-01-31	Google	0.0	KLA (KLAC) Net Margin At 35.8% Tests Justification For Premium Earnings Narrative - simplywall.st		https://news.google.com/rss/articles/CBMixwFBVV95cUxQMWJRY1ZHSnZHZXA3ZE1udW0ybGZVLS1QaUtiWEEtNEJhZUNyZTNhajJ5TjlFUFV0ZlJtRU83UnVrNXoyQzVQLW81QnIwc0hQOW5RaG1ubnZJdE5xYUxCTEhFeUdkVUpDZkZQcnN1VXQ0R0RtbjAyS0lDaXNfRWJwWXlqenZiSmFRVzh3UGZRQlc3QUJENDA4MkxGV25QX0dObXhfSGdXOE5HU1lLWGw0bkFUcndleUdUdkxKRkd5SG9abmctWkVJ?oc=5
2026-01-31	Google	0.0	KLA Stock (-15%): Guidance Disappoints, Sparks Profit-Taking - Trefis		https://news.google.com/rss/articles/CBMitgFBVV95cUxPc0hFbEc2c0xjeVBwUG5PRDRUZnVXNnlaSWNld3VjREE0MlF0X21ZVF9iRGk5RzdBXzJMOWhhOHk3b2dEbzVILS01ZVUzZG55bVVLdnRtbjkwTXBLYjN5QkVYQm8tVlNHb2Njal96WHE2eXhRUnpEOW5VUENYMHlfOF81ODQyVDZzZlRDbjJJWDVJV29CbndBTElEQWtjM2NmOEU3aDc5blRVd3VRaUVDYmlDVmxZZw?oc=5
2026-01-31	Google	-0.05	KLA Corporation (NASDAQ:KLAC) Q2 2026 Earnings Call Transcript - Insider Monkey		https://news.google.com/rss/articles/CBMipgFBVV95cUxNNHlNSnpiSlVEYU50dWNIaXo2YjZXU2dsRGlhSUViYVNLd05KbWZsSUhLTHJRMjQ5RGZVSVdXWXg0RnJNenBRNFpEVEJHejNPRWhoRTltS09CLWw2ZFhGUnk2WWdlNjhIbktpdzIwY2pjcmNnUzYtSVhjWk5JV2VHWkV0bjJQWFlRbW94XzYzbjlLdFFuY3hJSkQwTEpzeHBkRHRIaHRn?oc=5
2026-01-30	Google	0.6	Why KLA's Stock Crashed Today - The Motley Fool		https://news.google.com/rss/articles/CBMie0FVX3lxTE0tV2Q5bUExd3QxcmhFQml3SjZVUzJoeXg0S0VMcWNiUW5COVNuLVVNSDZGck1neWdoWmZ6TklsMnRacmFVcDZCYnNyWmlLa2wyRGJneUllWGZwbkhyekFKM3BlSjVMdnFKRHpvampOVUZ4bGNTN3NYcVNfZw?oc=5
2026-01-30	Google	0.5	KLA Stock Dives After Earnings Beat. What’s Hitting the Chip-Gear Favorite. - Barron's		https://news.google.com/rss/articles/CBMi-gJBVV95cUxOQXNaNTJlVDBWTDc5ZlhtdnZUT3dQV3Ric1dUcUpqQlgzZmxKaEo5MWg5UGlyWjRaY0tSN0pKY1ZMQkRnTDd3VWd2YzJaVWJ2UTFYZ1lZSzBuV0cwNU94VWhWWlZreUhLYVpTNFI0cFRyOUplcmxuOUU1NVRoRW1LRTJ6VXY3ck55bGVHbVhySjRrU2hEWWZscW5neHhveDl5S1Y3OUFXVGlYWDB5QVNmck4wVk9sc1NySklieE1PLU5xQWZhVlp6cHBlTjU1N19LVzYtYUJEU1FzeHJuNjhXVEtJOWNXZWhWZ2hIVTZGLXNFM0hSb2tDdnpFTXhZLWdiRjRlM1JJblBPNzd4YWo5LTkyVmpBaHJjdnNybjR4aml1b2tRYlpMZlhvMTdMdm9fVzAyOXg3aVU2WEdhVENmYkQ3R3pJZEx2M2RlRm84aFlRRlBuNF9VQVZqWnU4ZFlDWG9oWUNvU05zRGdhbjl2NXZESWtJYUF2ZEE?oc=5
2026-01-30	Google	0.333	KLAC Stock Surges 12% With A 5-day Winning Spree On Record Earnings Beat - Trefis		https://news.google.com/rss/articles/CBMizAFBVV95cUxORWtfWVFNMVdLUlhEbUg4bjQ4SWdsVW8tRlpJU09jMFFQTXRkUTF5NXhoMWptcHFFRnR1NjBTZGozeGF5OHFlRjZoeHFHYmlVT0RIN0pWLV9PMFFjS3k0ZlRsUmgtUngyQm5TT2U1eUFURzc0NC13NE9feEI4NUpCWElkY1NvZUhrV1lWYmczMnA5YV9kb29aYVNnRmNIRlQzZGxvd0R0a0NVb0NVQlE2TUZDUFgwWFdqTE9FY1RTdGRjX0hSd1lNSEM2a0k?oc=5
2026-01-30	Google	0.068	New Analyst Forecast: $KLAC Given $1700 Price Target | KLAC Stock News - Quiver Quantitative		https://news.google.com/rss/articles/CBMilgFBVV95cUxQNVFKN0dSY1cwQkU3WHpPeG1aSmlBMUhWNnU5dExXaktlX0JZSUJTUnZTdVR0anJrNm5RczhJWnlrVU1Ca3VlaFpyamR3YWFoeHZpcUJNLTBNdGh0b1A4djNaNFAxODcwdEFHeURQa1JuLVNtdjZNc295SDh1Ni1vNTFGaDVRUklpenljTUg3OFhvdlFCckE?oc=5
2026-01-30	Google	0.0	Check Out What Whales Are Doing With KLAC - Sahm		https://news.google.com/rss/articles/CBMimAFBVV95cUxNZDZvM2JWZFE0Y2RhTlJMd1hJMnhIOFFDZTQ3djVIS3NERHQ5Uy0tSkF5cFRzQWp5RlZwTFNUMlY0Sy03NnU4Y3ZUcjhXdS1HYkU1YnBsX3R0QkhDNEN1UURwQUhraTJCWmUtU2gwRUtjaWpBd1NPOGxTSDVWeGJTUndIbkp4RGM2eU1BN2lhVlFSaW5hME00eg?oc=5
2026-01-30	Google	0.0	Chip-Gear Maker KLA Tops Estimates But Stock Falls - Investor's Business Daily		https://news.google.com/rss/articles/CBMiiAFBVV95cUxQeFBCZkFHTTdLZTNWRnF1bW1YYTBLOTRMRExZcWdleGpaanVscXNYR29oX0tOaktFZDNWeERGb0loNkFOb05LWUZSY1o3V3YxN2hSSFJPNFJwVXlCTHg3MDROMjRpbWxhSjM4cmVCTkc5eFVPV1ptZXM3bUFVSmhjMEJTbWlyWkVy?oc=5
2026-01-30	Google	0.0	KLA (KLAC) Stock Drops 9% Amid WFE Outlook Concerns - GuruFocus		https://news.google.com/rss/articles/CBMikAFBVV95cUxOWDJpLTVaSkhQbzEwTUZzbjI4cnExOEJ2RWlXVFFVY283TTdBNmFVMVVjYXBHUTFJaTVjZ0lsMGRjS2o2WUdfcUp3UXVwMjBsUXUzRVRIYnpSYm9MZm5UQUluNTRSTHFzM1YtYUVvaTdMVUpWLTg0UlNCSzdEZDZhRENsNVZSMVgtTFpzWmNETHM?oc=5
2026-01-30	Google	0.0	KLA (KLAC): Cantor Fitzgerald Raises Price Target to $1850 | KLAC Stock News - GuruFocus		https://news.google.com/rss/articles/CBMivgFBVV95cUxNM0p1RzlReFRMWmozRmtGT2FpMFVTT3dWSXVOUmtlSWpyVnNNVlNYcVQxdWxWWHFlbHlCLWVFZW1qUVpxVEMxU0dXSTMzWTNReEJQQlJ5YktaNThzRTRlTUVDdGRiMktncFAzcDFKTGZnb0hNTGJBUmdIcmJuTTFyWHI1OXNRUlY5WTJMNVAtcmdrNXFDSy05cjRHTlR3YUFZSGZsOHZkWG1uVUhVSkpVOXJVODdBZWVhbnpwWm53?oc=5
2026-01-30	Google	0.0	KLA falls amid WFE outlook concerns despite bullish stance from analysts - Seeking Alpha		https://news.google.com/rss/articles/CBMirwFBVV95cUxNZlZ0OWlOODF3UTBoQkhzazFpSlFqUDc1d2VIZk5uTS1ldmNQVHBaZzVOSDhfaVVjckkxRDA4THFSSGRQRmNYWFBHQUlxa1U3OVZJaGQ0WEJ1U3BuY2d0R3VDV1lzamNtbGZHamx3T0NkZkJNVzc0eEtCQTViZnFmTmIzX1BZd3JCdXR4OXA2SFJQMXdaOUI4ejcxbDJCS2owOXFRTHQwdEhGb0tRTTNZ?oc=5
2026-01-30	Google	0.0	KLAC Stock Is Falling Today Despite Q2 Beat And Slew Of Price Target Hikes – Wall Street Explains What’s Going On - Stocktwits		https://news.google.com/rss/articles/CBMixwFBVV95cUxOeGx2SXBLYzJvT2pPdk45RFlLa1NFZVJxSmYtVVI0Q1BtaDNWNnM4dTJvNFlVT0p2aW10Z0VKMkhJZ1RQZVNvZU00MXB0RjJlU0FLLXZpcTYyNGdBVEgyaDVhNko0WlR1M0xhUUxWOTJzbGNGMWY5MGhXcVNUQVFZMWVyVlBUbkx1NkdPTVpBZGtlVVdHanJXbjlOWTZHeVl4aXo1Vy1vclRyR19HYWV0NlI5VGtBZzlfMEhMa0RCaGdvbFdvTl93?oc=5
2026-01-30	Google	-0.156	$KLAC stock is down 8% today. Here's what we see in our data. - Quiver Quantitative		https://news.google.com/rss/articles/CBMiogFBVV95cUxOWFBGY0IyX3VranU2clFSSGU2U29DN25ic3dranlnY21aZzI5ZVlXbmpHT1FrUEFocEc1Y2RBczJXZGdTc3d5TlB1cGdDaERRb0NhTVpkUnBrdkRJU1I3VWp1c081X01yMXRKLV9mUVZDUWRScDZkbFRqclJFZEhEWmxOTzFuVTlpSmpXOG1RUzNyZDBpUzg5UFhwZ3cxeExtNEE?oc=5
2026-01-29	Google	0.0	KLA (KLAC) Beats Q2 Earnings and Revenue Estimates - Yahoo Finance		https://news.google.com/rss/articles/CBMifEFVX3lxTE4tUUNUSW9RcVIxUDNxVlNtUy1iaGVQeG80ZnNENkcxdHlaQnpnNFNKcmI3NHJOM3M3eWV1MFdkZEU5U25MLUZnNlp3VjJlanRGUF9kQllfZXZTSDQ0MmU1c1ZvZnRlVXBxb0ZsUk9QZkNYM2FqUjdYLUNUZHQ?oc=5
2026-01-29	Google	0.0	KLA (KLAC) Q2 Earnings: Taking a Look at Key Metrics Versus Estimates - Yahoo Finance		https://news.google.com/rss/articles/CBMifkFVX3lxTE1vR2YweFlsTXZfYkdYSmE3SkZOUWRXN0VOcW44d3VrRmV5V2pOMnFsVDJoUGx5VVlEdWg4dnQ4WGM0MzYxSF9NdUF6R01iV0MzNmJjZGZNTXAwbHhXRjlmcHFDTUZMVVdXSEhOYVpMTWUzVjJmb1l4OVNHVzJnUQ?oc=5
2026-01-29	Google	0.0	KLA (KLAC) Shares Drop Despite Beating Q2 Earnings Expectations - GuruFocus		https://news.google.com/rss/articles/CBMiogFBVV95cUxQYnRacENueFlGNmVIWkQ3X3gxRXQ2RlZpa2ExeUZzVUNNc1I0ZTNMa0YtV2lxWWVmUXVtdHB1UlladUVMZGZSMWpoYXdEdzRMaFJvaTJTdGFaMGw5S3ZEUjQzQy1fTVY1M3g4M1BXQWtjbEs1QVg4TU1GaFBycjFFck93anhBbTh1ckhNOTBKeTFhZ2FNTHZneE9aODBLUWdqN1E?oc=5
2026-01-29	Google	0.0	KLA CORP (NASDAQ:KLAC) Reports Mixed Q2 2026 Results with Revenue Beat and EPS Miss - ChartMill		https://news.google.com/rss/articles/CBMizAFBVV95cUxPRGtiTlBnSUh5VHZfRDFnQ01ERUhGdVAydGpQTWt2R1RHei1EelloRm85VjI0ejVnUnlsRDExV3hLVmtnVE9fRktaVVhQV3RoSXRmUG1Cam1icVRSZHpJaC13U2lqVlZRSUdMcVVDLW5YcUpTeEFocDhYa0lxUVBSTFNqRV9TeUNDdzl2NGVzeFk4Mmc2TWZpeXpXQVRFYjRMUjBQTS1kODgtQ1dvV1RhNGFjbkFuVm5FN1huenlZRWd0ZmZqTGM0Q3RtcmI?oc=5
2026-01-29	Google	0.0	KLA Corp (KLAC) Q2 2026 Earnings Call Highlights: Record Revenue and Strategic Challenges - Yahoo Finance		https://news.google.com/rss/articles/CBMidkFVX3lxTE9CbHRiMkFVSDZZUHFMMFhOdUt3V096WmpDY1k5Ujk3clFjRHYtWDB1c193LWRnV0gtS2l5ZUg5WHc0anVKU1M3TjFFNXJ1YWxrblRpenBhTVBzd20taDF1dHA5VnotYTdqTldDczZfdDUzc2Y5c1E?oc=5
2026-01-29	Google	0.0	KLA Corporation (KLAC) Stock Falls on Q2 2026 Earnings - Quiver Quantitative		https://news.google.com/rss/articles/CBMilgFBVV95cUxOaDVzSElsZnNIUkVHdlFBV01zNmhCMF9MRFNPZ1htRTV2b1RuZ3NjUUJ5OGlVZjlYTkwxUXExWEFWbi1XUlV3RTdoX2pSSzNjSWdsU2tEenFTUjNtSWhXS2RYMWFTTnJrUnp2U1A0Ny1Ec29iWFFNU2dsd0tMS0pRYUNsdXVCQl9CLVB0b1hoZlhVUVpRVVE?oc=5
2026-01-29	Google	0.0	KLA Corporation (NASDAQ:KLAC) Beats Q4 Sales Targets - Finviz		https://news.google.com/rss/articles/CBMiiAFBVV95cUxQYjVnU3UyQ21za0NzUWFHOTR0QkQta2lfamNxZDRFc1RWN29kUmQyTTcwRG4wdmdkVUt2enYwUzlNWHlxemZuekF3bGZKYjFnWU1ITFZ1Qi1SOWd3TV8tVmlncy1MV003Q05ZRTBvekpDTXA4X3hwWUhrWDdkUjJyY05DLWRzSTQ4?oc=5
2026-01-29	Google	0.0	KLA Corporation (NASDAQ:KLAC) Beats Q4 Sales Targets - Yahoo Finance		https://news.google.com/rss/articles/CBMihgFBVV95cUxOdFk4M0RzVlhWeTUwREJxVmsxMjRGcXVoVUNfbVpBenVibWJSMEVGekUxd2MxNmlHc3Z4WmQ1UU9OZXpTNW10SjZMVlJyejBsMnFSTlhJQjJCWmF0YUNHM0h3S2VycWpFMlJneEpmVDM0Z3dFVC1YRDVkMlBZcXBGT24tMjJKZw?oc=5
2026-01-29	Google	0.0	KLA Corporation Earnings Preview: What to Watch When KLAC Reports Today - 24/7 Wall St.		https://news.google.com/rss/articles/CBMitAFBVV95cUxPNW9JbGg4ZlJsbmdDbXlwQWFTSzVXSnB3OUhlVDJ5dWxnSmdsQlRzWGI4Q3A5eW5NRWNCeGhUaTNmY1RzclVXWnVDMk1CaGtDbV9HaU5LQTNPRjJvRGxqcVBNNDF4X25kZXNLdVprMkZxY0dVNzBxc0EtUHlaejhDUHhIT2FIT2lack5Pel9mNkFQTjJXRjVSLTg0OWpUWHU1YkpKVnE1OTZtcXhxeHJTX2EtcVQ?oc=5
2026-01-29	Google	0.0	KLA dips despite Q2 financial results topping estimates - Seeking Alpha		https://news.google.com/rss/articles/CBMimAFBVV95cUxPNm9BaF9SZE53UnlpTmU0M0k4ZDluS19uWXU0dGNPbmw4bmVQWjc3WExVbE9uM0tVcjlvNTR0bEVYVF95dVVjQ1hCM0NYeDlGVWpSWHZLaWZwQURqMG1iTFh1ckgzZkVmVVJlQy0xSHZCU0N4X2tsMnBYN2VDbGpIV2JOQzRld0hzUG9jUUt5SWtTY1lvR2lFbw?oc=5
2026-01-29	Google	0.0	KLAC Projects Increased Revenue for Q3 - GuruFocus		https://news.google.com/rss/articles/CBMikwFBVV95cUxPMnRUaHNLd25fRlJYZTU3OTRYN2p2bmxvbDFNMXNmeXk1RXhjVHBiMzluQ0V4TjN4VFBHR2phRk9lRl83VW9wbW1yMndlNWRiVzhlU3JxSUlfTThOX18tdm94OTZxNHlLV0tMb2RMcTNYYTJZXzJUY29maUFHZXhzY2ZJRmhaU29mWWd3OXd1LXA1a0E?oc=5
2026-01-29	Google	-0.05	KLA Corporation (KLAC) Gains Analyst Support as Revenue and EPS Forecasts Rise - Insider Monkey		https://news.google.com/rss/articles/CBMivAFBVV95cUxQaHdDNHNVbXFGa1ZuZEhBc184RktmMnRCQjdwX1VRQjE3VEd0VHprYWVuQ0dNU2pGb0J3c2VXby0wV1c3WVJvYjI0d3JrQ0FrYWNXNU9Fak1MUnRKcXpHT1lnSXN5NmZ6TjBBRmZKQmt6NmNlMWhNVzlYdzdoR1U1Q3h1c2tLMTY0ZXNvSGNjVmFpekhVVVgzXy1WQmU5MF9xaEF5OUcyRmxLQXVXMUE2OGRxU2hWQ1ViNmFvd9IBxAFBVV95cUxPNEg2ZWhqR2hpZy1xaXZWQkRYcGtWckk5a1pZZlBJN2xDeDBKckN2RkFNVHhNcFROcDMzdzYyd0V3aThlZVJXaXZxLTdfTXQ1M2FteWlNNXJwTHhHUUQ3Ui11OGxPaTlXUlBGd01MNHZFMVpYMmtIQWlwM29ZZ3NmbGIzeEU0MHdMYlltZW1OS0FBNVdmM1FILWstNXBTdXJyV3NuenQ4VUNRZ1gzcXh2YURYR3lqMnAzSmhFcDl3eWFrSE1v?oc=5
2026-01-28	Google	0.289	KLA Corporation (KLAC) Set for Q2 Earnings Report Amid Strong Tr - GuruFocus		https://news.google.com/rss/articles/CBMisAFBVV95cUxPT0cxS2VfOE9ZVVppRUszWldiSEtvS0JOeVpqUzR2S1FSWkxWam03SWIyLUZ0bC1tVnlnSmhTU0VrSlZvbVVjVk91blNjQVdSbktFMkl3UEEyeGlabzhDSkVOREtrVWRyLUVMcjl2M0Z3OHZ4ZmhHYVdla3ZocnVOeTFYcS1kYmt5VEhSN2xXNTZCSTMtTTc1QjEyWi1vdzlwRnYtazlSRmhQdDNiZ05CUQ?oc=5
2026-01-28	Google	0.0	KLA (KLAC) stock price slips as traders brace for earnings after ASML’s AI-order surge - TechStock²		https://news.google.com/rss/articles/CBMipwFBVV95cUxPUE82VVZpQi1uMjMwQUxzbF9naUU2X1djbnRBNDU5NGp4bDl5c1p4UmRieU0yNW5IYU5vYnlVdVJIcl9Jc01jTk1nMGhiVjVZYkxZVmxLZUNocTZwMFpjWHlFNm1LZ2hybE5Zc2hfZW4xcVNJUGRSdmstM2Q2TGsyTjhpa2ptU204UkVvVldHVWN4NWtmZmNpcUNuZGpkLXlZRmJLOGJVdw?oc=5
2026-01-28	Google	0.0	KLA Corp (KLAC) Has a Shortage That Can’t Be Met, Says Jim Cramer - Yahoo Finance		https://news.google.com/rss/articles/CBMiekFVX3lxTE84V0RyWHg1REJnQVEzeG4yNlhKYk55OTNOOWhmN0hmMVc2QnBubTdIMWg3QjlhZDBYQ0xyTlpUd1pXbFZpdlMwTW1XVjNnX09zYTNYaTFaQ0pDSUE0ZmE5THdZTmxCal81anVLWG5mUVN1UV9iNjEyWXBR?oc=5
2026-01-28	Google	0.0	KLA Corporation (KLAC) Gains Analyst Support as Revenue and EPS Forecasts Rise - Yahoo Finance		https://news.google.com/rss/articles/CBMihwFBVV95cUxPdGpxbGVXbUp2WGNfWER0NWp2aU5vbGhaOVpmTHZubW1OZ0RHdFdEdWZwN0RUQXg0MGwzbmpXbXpNbjBydDR0UG40UEVEbDZrWHhTRy1NbnkxS0NWYVg0ODE1SHNOVExpZHNjb19ib25NU1hhRWpJOGpxaXVhNDdmVFVhTE5GQUk?oc=5
2026-01-27	Google	0.25	KLA Q2 2026 Earnings Preview: Recent $KLAC Insider Trading, Hedge Fund Activity, and More | KLAC Stock News - Quiver Quantitative		https://news.google.com/rss/articles/CBMiygFBVV95cUxPc19kNEU5U29DX19BeHF3TVZjMmRGdEdXbkRsTGRCcWZBdENGV3BfcTMxcnJWa25ibHphSFdjNjdqSUZUNXlrRDlPWG1naVZvNUVKRE54Z1piTk10MmIwOFVrQVluMFhBNGtnRGsxVHVMdE9DemVqZHJZSUJJV3FKOXhvQUY3M1Nxak9iQXFiSTJmS3gyUC10MXJlMmRJbGJlNFVPcjhycUpZcWZ2allHOTZmSS1iNVhhT19BU1R5WDFjRUlxejlTRl9B?oc=5
2026-01-27	Google	0.0	KLA Corporation Earnings: What To Look For From KLAC - Yahoo Finance		https://news.google.com/rss/articles/CBMihwFBVV95cUxQNDBENVZPSGZORXZFY2Z2ZmI2REFuLU9XX0hZSUxqb0pQa0pUdHFTaVpnb0d4WjItYjFFbS1WZzVqOHA5RzVQLTJ2ZFI2enJ3YlNHNTU1cC1rRjFPSkROQ1luLWRwMWNxaFd5c2xTUXdFbkVvUDcxbWVvRXhIRDR5V0NZbTl6TTQ?oc=5
2026-01-27	Google	0.0	KLA's Q2 Earnings Loom: Should the KLAC Stock Be in Your Portfolio? - Yahoo Finance		https://news.google.com/rss/articles/CBMifEFVX3lxTE9hbnVGb1lEX3FxUkZuVDc4UGFGZGFXTWgtYkROSmxDQ0NwZHpOWXgzMkxZaHpTbHVXaDRSUll6MmJvZHBOemJ5eHE3UE9ReFVSUXlQa1ZDMHlBNjlNZ0NFWGoyQ2dlQ052Z3ZVdmswLTJ4TDBzLTBwRldmdVc?oc=5
2026-01-26	Google	0.0	Countdown to KLA (KLAC) Q2 Earnings: A Look at Estimates Beyond Revenue and EPS - Yahoo Finance		https://news.google.com/rss/articles/CBMiggFBVV95cUxQRXUtcW5tdDBVMHVQMFhjTUUxU25EMVZEYU5ocWhUSGdoRFZNOGlINVhRLXhLMldLMVJjeV9hUnZWRmgxYkNNcEt2cEhIWERKblVZU1dldjVmY0ZkYURJaUhxRW5BOVluOTRrSkxRQzBOSEZJUlBtTXkxUENDYzhKQWVn?oc=5
2026-01-26	Google	-0.2	Is It Too Late To Consider KLA (KLAC) After Its 121% One Year Surge? - Yahoo Finance		https://news.google.com/rss/articles/CBMie0FVX3lxTE5YRzA0cWw4V0E4MlIzVkczMUZ4cGRqc1BMXzJWU0I3X3VndnI1YjJ0VGFjQmR2S3ZGN0U2NnJLN2ljT3Jpeldmcy1Oc0t6dVJoSlFoOXFNMHlOS00xVEQwTGVWTEJEWU5GbTdrSWVOcmYzUFd3WWpUOUQxcw?oc=5
2026-01-23	Google	0.5	Better Value & Growth: LRCX, KLAC Lead Teradyne Stock - Trefis		https://news.google.com/rss/articles/CBMirwFBVV95cUxPYjFqZDYxdlRqb2RpMmpfYXRXRm5RRkpkLWZuWDBUX1l4ZnBMRmF0TjR5ZjR5QS1YcUhJMDdmX3FhV3ZPeVhuc2s1OWVYUWtsZjJyRVJxc0lXYXgzTlVtSkd1UXM3bHFoSEcxTmkza21YbTJha0lMVTVOUlFGR2w0Y2YwWUIwcFQ4aWcxM1J2MzVHcXE2Umlmc2pIdFd0N214RTFsVEZfU1NodnE1SkdV?oc=5
2026-01-22	Google	0.0	KLA (KLAC) Reports Next Week: Wall Street Expects Earnings Growth - Finviz		https://news.google.com/rss/articles/CBMimAFBVV95cUxOUVhVUUFfSVFIWGkyYjUyc0F2VFdzd3pCWEp1TWxmaS1JNEdTNU5QRi1rakV4cld3REVrUzNLVFluaVQ3dWh3aVVPU3huY0dWbjVUV281cGdyUFI4YWJSdWNnWlBTc1ppaG1VYk1USXRSLWJUOXZwQWlEd24yalRvN0VkWFgzcDFoVmlBclhENFdkSDRCMWt4Qg?oc=5
2026-01-22	Google	0.0	KLA Stock To $1,081? - Trefis		https://news.google.com/rss/articles/CBMihgFBVV95cUxOTG4tRGJTd0NPQ21ubHBjZ3F3VEhDWjI2dFRNVFZXaTd3RlgwYW1YanJZMUtrenlEWExaZ2JCaXVMMmFBVEhRbklRamY1R0diNkxjcDlmcElBeVZsS1BQUFd4VUFJNG1DUS1jSG1uN3ZOWWs2c0lQRUNxRDlPY0M3TXRqQTBRQQ?oc=5
