Date	Source	Sentiment	Headline	Summary	URL
2026-02-25	Google	0.2	HPE Integrates Juniper Routers & ProLiant Servers to Accelerate AI Modernization for Operators - The Fast Mode		https://news.google.com/rss/articles/CBMi4AFBVV95cUxNOGtoWl9TVGk3bUx5Vzl5SFhDekhvZnVrUHVXLVRiSHV5QjhLajNGTVZULWxZcVRZbGZDdWpJN2Y5VGdYc1FUQVFWRDljeEhnV2VxZUJLbnV6NHVnVEMzWnF5bUVpbGNHem1FcGdwWVBRdW5Kbm91cVZsa0RRcHZVYXlyUm5pcUUxVjJPaHhna05aOGhoQWxKT3RtN0hQWVpfZ29vbnBPME1SU2ZIR2Q4TG9uc3U2cGRNZ2xaUXgzOGdjTlUtdGw1QkNSYklVTk1jQVBaZlBjWXpPOHRZVWxNUQ?oc=5
2026-02-25	Google	0.0	HPE launches AI‑native telecom kit spanning core to edge - DataCenterNews Asia Pacific		https://news.google.com/rss/articles/CBMilAFBVV95cUxOTzZvelVrN3FsSW12aFZfR1NfRTl3OUFUNDhqdVBzOVp3b1BoSTEweG5TVnBOaUJfQm94OXZaR0pvdW52WU95QnNiTkJmd0p4bmxETGNzZXF0cm00dkI5XzdmSmF0eW54SEd0YnphM1dTUXZ3UU1CV09ZaDEzajh0b0FBOEN4Y1dqM1NTd3hFRlNDUUZJ?oc=5
2026-02-24	Google	0.8	Hewlett Packard Enterprise Balances Stadium AI Win With Governance Scrutiny - simplywall.st		https://news.google.com/rss/articles/CBMi1AFBVV95cUxNMkNYYkZiMC1ZS01zbXJSOUlKcld2bWI0bXZBZnZNWE52Nk5CTWtFUlk3Z1U2YUloaUJ0MFROM0xRSW45N1F0U0NvSHhBd3VMWFkyaDhUQktDeWE3T3lGZ0g5Tk9lTVFfb3BfUFRXQjJCd2NQd050MlNVMzZRa2N6ZXNMVUhib2tiUl96VWEtQ1F0bGtuV1R0cVNXejZkYW9GWmNRemhYSnNiMDJ2NUh5eHRzQTJLUTZUQ1RUa0lBTjZXNXhpYS1QbnJxUWhYN01fc1N4VdIB2gFBVV95cUxObER4Tnp5bGpfUWdtbG1yZDVta0RYSW1vOTVkcDJ1RFBLcmVuVjlQQ2RadmNVeWt0V3UzNVQ1YndhdmJRcHJGYnNydms3VF91T2NvckJZM0s5eGVrNk50U1lQSTRLRnJnSXBqTS0zUWhnQUJKWWVMUHBTak1SejVWTGRQcUVrRXh0TldOc3YtX2MxLTlCZF9YWXFVRmE5a2ZOMy1uSjA3dVZHR2R3azYtTk5zdVhnZjB3WGR4WWVjUWx2T29qcjV3NXRDS01reWlpSUhfNlZKcFRmUQ?oc=5
2026-02-24	Google	0.5	Cisco's Networking Revenue Growth Picks Up: More Upside Ahead? - The Globe and Mail		https://news.google.com/rss/articles/CBMi2gFBVV95cUxOVVprRjRMdy1ScHZESkNvTlJhdjR5dXU0ZDhHbWN0MkNYVDdDelFGSVFWeDRKdl9DeE1ZeEJtcXpxVklMaElwX0lKQVNNN1BTenJCOFNSMFFLSVdubUQyVmhZTWVLbW5ZMmtvR1BRXzZaVjZvSzd3SloxNE55M3ZGaUk3dzJ0RTFkZEQ2YkZUNl8yTXEwUGlsRjdHMkVUSnFiT1dKQkhuaFNlWU1FbHcyOVpYUmx2SEZzbVQzb0d1TmtSWHJuMjQ5SWJFSk8zWFBfc3FxR0VVdlJWZw?oc=5
2026-02-24	Google	0.5	HPE jams more Juniper networking knowledge toward uncorking telco AI opportunities - SDxCentral		https://news.google.com/rss/articles/CBMitgFBVV95cUxOX0dBWDBUemM4LWdKV2g3WTV0MkNaR1RXYVNMM25JUUd1R05JajVVX25JTTdWWFBXY3hEd3doUmc5em9DY0xRMUcyMGVyMEhVS29QbG9seWhGMWFMSi1ydnVTUW1fS0Z4UzdCOTZVRVdGalo0OENhU20zdU9uRFVJZ3JianYtcmlPYURDZUlhS2dZQVpVSGlNaFJzY1c5WHBjNlhCX1dncDVtd2Y0WGtmQjhKaFZpUQ?oc=5
2026-02-24	Google	0.5	HPE touts latest Juniper routers to provide ‘full-stack’ for AI - Fierce Network		https://news.google.com/rss/articles/CBMimwFBVV95cUxQem94RVRhZDlqeUdSRWpzY1JDR1J5WW1PQm9qZFRRakJJSGplaEo0QjhmVmFiZHNHeV84UmFMVGMyaHdMNDkxVHhjU3F2OW10TmdPcDJ6RVNnTWFubUdzemlUWEtGUkl4aFIzWHM3MlFHUVpIUlJVT1BlSXg3N254bDJCaEJFUlZjRW13RGtab2JlSy13RXF5ZkpQVQ?oc=5
2026-02-24	Google	0.5	HPE’s latest Juniper routers target large‑scale AI fabrics - Network World		https://news.google.com/rss/articles/CBMitgFBVV95cUxOcnBKeWZ6VGt4c3E4TWNJTXpMUXZnUmlOazlmdmx0TlRnZmFIWEZvU09JR09zWktjVk1ETFdtVjE5WTE0a25FYU83V0FndlJVeWFPcU9vdFk2UGdNbDQ2Y0hwU1VPYVBZU3ZlMGdPbmhPVzhFSlhVV3NZTUVIZS1NZTVweTlQQkVtVHloQXNtT0J6aDJ4TVYyREpCd3M0TERuWkozdExHNmFHcHJlZFNIaEw1RmRVUQ?oc=5
2026-02-24	Yahoo	0.35	Cisco's Networking Revenue Growth Picks Up: More Upside Ahead?	CSCO's fiscal Q2 networking revenues jump 21% to $8.29B as AI and campus demand fueled six straight quarters of double-digit order growth.	https://finance.yahoo.com/news/ciscos-networking-revenue-growth-picks-153200835.html?.tsrc=rss
2026-02-24	Yahoo	0.291	HPE Accelerates Service Provider Modernization with AI Infrastructure Innovations at MWC 2026	HOUSTON, February 24, 2026--HPE (NYSE: HPE) today unveiled new solutions across networking and compute in advance of Mobile World Congress 2026 that accelerate modernization for service providers. With the new products and enhanced capabilities, HPE’s customers can build and operate their own AI infrastructure with low-latency, high-capacity, AI-native solutions from the core to the edge.	https://finance.yahoo.com/news/hpe-accelerates-provider-modernization-ai-140000979.html?.tsrc=rss
2026-02-24	Yahoo	0.25	DELL Gears Up to Report Q4 Earnings: Buy, Sell, or Hold the Stock?	Dell Technologies Q4 performance is likely to have benefited from surging AI server demand and more than 30% growth forecasts amid PC weakness and competition.	https://finance.yahoo.com/news/dell-gears-report-q4-earnings-172000128.html?.tsrc=rss
2026-02-24	Google	0.136	HPE unveils AI-ready Juniper networking for operators - ChannelLife New Zealand		https://news.google.com/rss/articles/CBMijgFBVV95cUxQOEFXbVZZRWd1RmtHYi1oWmVBdWJEUFhoYXVWZmMwLVRuVXRvWGNIaWlBNnlvRmxXbUtDYVRVTnl3emlnTlVYXzFNTHZrenE1c0dEQjFGcnRIU3lobWRvNG5PcXFEZC1fSU1wRW9oN0owVDVXRndQSlI1a3REZmR1NC1SZ3k3TmMyaFlsUFJR?oc=5
2026-02-24	Google	0.0	Critical Flaw In HPE Telco Service Activator Allows Unauthorized Access, Putting Telecom Networks At Risk - Cyber Press		https://news.google.com/rss/articles/CBMic0FVX3lxTFBqNFV1Tl85R1Nvd0pidTROR3Q3UW5tXzBBR0FzQThkS24yNjJUeTEzWVRJTXUtQ1NXVFhlOVR6ZmlUbWNpaWZMSUhUYkN2N09YNUszek8zT2xxRWlkSkR3S1BmQTVvSk1Oa1ZOc0E4T0lmV2c?oc=5
2026-02-24	Google	0.0	HPE Accelerates Service Provider Modernization with AI Infrastructure Innovations at MWC 2026 - marketscreener.com		https://news.google.com/rss/articles/CBMi3wFBVV95cUxQbVkwMXlhWUx6bE9JMU9sTklBd0ltaG5INW5EX1VDN280MnpkMnlxakRNTkczQXg0Q2ZpYUpKVEpyQlk5VHNVejVWV1ZwMXN4M0lLSTFFYmNyMDc1a0dSVUI3WWRsbEZpWFlMMUw0Y2pUWnJvanVZUmdpQjM4RnBXYjFCdXNtMzdXTWdMQ21LQnl0OHhCcG1JcXMwY0pFY1pKTVZIei1GTzNoejFCOU5Mc2d4akVkSFJWM1d3Y1BZN29rOFV1ZkNhSmdWOUIxcHpGYVFRMGF4OURHdV9VcC1j?oc=5
2026-02-24	Google	0.0	HPE Stock Falls -12% In 5-day Losing Spree On Analyst Price Target Cuts - Trefis		https://news.google.com/rss/articles/CBMi1AFBVV95cUxQeTlEU0RhVHZKMFJrUFBOSmgxSFZ4VjhWUWpveEFwblVwZ21UaVJYSjZpdGJMZmd6dC1vWFZ4WDljQVNtX1NyUS1DZGRQRi1RMDVoSUxPVjBsXzF1eHNfMGJ1UHBBaU1za2ZuVFBCNDY2cXpPb1BpSGhBUm1vM2pZNmtSLUVoc3pBMGF5LW9mU2lNcy1kSVNUZUNZSE8xSXVJcUhRLVZPMUwxTHJCT0FVVkdSaGxkcGJGQnJVR2VmWUJzLVVzUWhvLXVCZ3VUTm1lN3hOXw?oc=5
2026-02-24	Google	0.0	HPE escalates networking battle with Cisco with super-sized sales team: report - SDxCentral		https://news.google.com/rss/articles/CBMirwFBVV95cUxOMHU1RTh1WWRtcGpHWnRjZjhYZjB0SlRTZE15a1JlZ2hIQ0NuOXlkWFJBSjBrLUpwd29aMHlJdHIxLUxTNzAwUWFUcF9tdDlJdlpxekVpMG9MTUR0eHd1bW1iVDUyS0dKeGV0N0NEMm53Q1k2RG1aQlprZlBfSmxJNHNDZDE5blozemI4bkVGb0xLZUo5WS1pSVdkdDJJQWdraWs5WC16ZkpBejZ5Skk4?oc=5
2026-02-24	Google	0.0	HPE expands AI-native networking and computing portfolio for service providers - SiliconANGLE		https://news.google.com/rss/articles/CBMiqwFBVV95cUxPM2V6d00tNVpmTmUyeWhCQ2toLW5XZEpuaUNQbUVVOG00X2RpbjBZSTVST2JKT0xtSTh2aHhwMFplTkZON292d29CQ20tb1VnUmZPTDJTVHExNkxnTF9jZDdBbXNiYnctZ0YxR0JBSG9lNXRpYkE5Qk95ZnZ4RUZLaTNGem9zbV9zdS1UZGk5MnlPTV9KZDlVN3E0WjBqN0J5UFFsbXk2cFBseGc?oc=5
2026-02-24	Google	0.0	HPE shakes AI network foundation with Juniper PTX12000 series - Techzine Global		https://news.google.com/rss/articles/CBMiugFBVV95cUxNbHlxWVo5Ylh5U0swcWlsQUR5WUM1QnV5UVNZaG5rN05BZ1ZVVFFOUmtrZDlDeXlVdlZONTlRNEpTY2ZyRTUxQWtRQXJHTVllaGZrMWdOakx2R2p0SnZpS3J0bmd6a3IyZnVaRlY5bzNGTmpLVE9wdjM1R3NxQm1OU251NkRPU25HYXZ4d3JQaGp6bV8zNUM2eTM2MkcxTFlZcmtib0w1bjQ2YzBybFR6ckJpemdCTk1INlE?oc=5
2026-02-24	Google	0.0	Hewlett Packard Enterprise: Network And Infrastructure Integration Set To Deliver Growth - Seeking Alpha		https://news.google.com/rss/articles/CBMixwFBVV95cUxPRHNWRUpCZDJpMGhLcVZqTWN5R0NqZmdBTktrSk5DMlRFc1VPUGt4eFdkbERRbkNKZVhJMHVndTdTYTUzUkNuRGFXZXFFRmx4UFF0VjNPQ1kwa1NoV0w4UEc5QW9jZWVOaVA5T1ZfVXpiU0FucXYtTXRvdHdTanJ2amNGMVc4TWNPZ3ZSSGJVdjlkYm93LW1JRk5zalVlR1N2VjlMdVdNQTBUaG40RkNITzlGanJKaHBYOVhQRnJZN3NOdk1GN3VJ?oc=5
2026-02-23	Google	0.8	HPE’s Jeremiah Jenson On Networking, SASE Channel Investments And ‘Great’ Sales Alignment In The Field - crn.com		https://news.google.com/rss/articles/CBMi1wFBVV95cUxNMHh5dlEweDZnMEhjaGZZNHdjQ3RLV1FIWXlvVG5SQ2lwNjU3dUpOZ2VrRHN4U2NKY283Z0ZhZ0hNOXBFbkpNajVia2RUcjh4SDEzd1llN3ZwdEU3RGFabGxLc2dNYlc1NXN4aWxPczhQcnMyeGF3TGZNNjBlLXdyOW11M21CeDZoZkw4azd6cGpweFdFYUhIZFFHTU9XVUhCNlROVXRlX3cwTmQ3UDkyOTNWOVFVbk92SzZfQVNGSEczaFVOZkVJS0lxV2txYk1BWnlEaVl1OA?oc=5
2026-02-23	Google	0.2	How Do Investors Really Feel About Hewlett Packard Enterprise Co? - Benzinga		https://news.google.com/rss/articles/CBMixgFBVV95cUxORXJXU2xuNEdZcmQ2UWVoOTkxSWd0X1diMlpSRW1vS2szR2FBaWxKUWFqSENOeENfbFpQQlBKV3YyQ0tGZjBFOTQ4cTJobHJXYllic1dsalhIajFEVFppT3ZwekFwRVQwNThPdGxjd090c2ZhVWJiLWRETFZHVUZ3UXI0LXBrZmp5OWFhOFRLdXRRSEpRN19fWkdIOFlKekJVOE1YSkFaRDJpVjc1X09pcUtQRDJ3bjdHTmRfUFF2TDJ3dkYweVE?oc=5
2026-02-23	Yahoo	0.146	IQM, a Global Leader for Quantum Computing, to Become the First Listed European Quantum Company, Through Merger with Real Asset Acquisition Corp.	"PRINCETON, N.J. & ESPOO, Finland, February 23, 2026--IQM Finland Oy, a global leader in full-stack superconducting quantum computers (""IQM"", ""IQM Quantum Computers"" or the ""Company""), and Real Asset Acquisition Corp. (Nasdaq: RAAQ), a special purpose acquisition company (""RAAQ""), today announced they have entered into a definitive business combination agreement, which will result in IQM becoming a public company and listing American Depositary Shares on one of the two leading U.S. stock exchange"	https://finance.yahoo.com/news/iqm-global-leader-quantum-computing-124900362.html?.tsrc=rss
2026-02-23	Yahoo	0.08	Zebra, ManpowerGroup, Magnite, Fair Isaac Corporation, and Hewlett Packard Enterprise Stocks Trade Down, What You Need To Know	A number of stocks fell in the morning session after the Trump administration's announcement of new global tariffs, reignited trade policy uncertainty. The move came swiftly after the Supreme Court ruled the previous week that the president could not use the International Emergency Economic Powers Act (IEEPA) for such duties, a decision that had initially sent markets higher. However, the administration invoked a different authority, the Trade Act of 1974, to impose a 15% global tariff for up to	https://finance.yahoo.com/news/zebra-manpowergroup-magnite-fair-isaac-165055296.html?.tsrc=rss
2026-02-23	Google	0.0	HPE Has Doubled Networking Sales Team As It Moves To Take Share - crn.com		https://news.google.com/rss/articles/CBMipwFBVV95cUxNd09uVl9NUDU2SjhsRGxQTVBBNzZDcGVLLWN5RUtXeGtCOW5VQ0FpcGZPX0F0cWlTSVRqbUtGUFpnMHVZRjZzNDJleXpCZlJDbHZ6cTdsSVRfV1FJZFgwdFZlVFVDU0FRbmxEOGdpbVlkOEJhOXJFaC1IMGdoVUZUNEhndW50Z2tRZDRjcEpHRndIZ1NNeVhldnBoMG5oMDBydmdqQ19CTQ?oc=5
2026-02-23	Google	0.0	HPE Security Alert Shows How Backend Bugs Can Break CX - CX Today		https://news.google.com/rss/articles/CBMiqwFBVV95cUxPTktSNVFiVlFnZWdkMGxxTDY1blVJYXkxZzRBaEVSNFJ0cUlDc0xDMC1tbFdrRFlRa1lJRzdCeFMxR0hrQkhnUUZHUFNwdGJvaW5WR2pWaW9BTVdVTm43ZFZmSDJxMFJBSnZSSW5USkVKMjZvcGJhdUd5QTc4d0pCcjhoaGtUcHZOaU45X3IycDk3b3A3VlFVU0FFd1ZEYzJ6SFRJMTdoa3JpeGs?oc=5
2026-02-23	Google	0.0	HPE Telco Service Activator Vulnerability Allows Attackers to Bypass Access Controls - gbhackers.com		https://news.google.com/rss/articles/CBMiX0FVX3lxTFBfMktKMmlOQjJrZl9qQVFkVGpCREFQM19yMk9nQjQ2M1FFY1o3cmhkSG1nYnNORzdYLWJMSE02NTRZcUpKVFh0d2dZQWxySlRKWmZ1aVh4MS03S0Q2OG1R?oc=5
2026-02-23	Google	0.0	HPE Telco Service Activator Vulnerability Let Attackers Bypass Access Restrictions - CybersecurityNews		https://news.google.com/rss/articles/CBMifEFVX3lxTFBpZWVEbUtmWmJsQ1BNTHZQN0FubVVaX3dNN0M2QnR4LXlMUWFqN0lncnR6RmhXNTZaLUdFZFl3UXFfY2Fod2wyTjQyVmFVcnZTVzJYU2NPMld0NjU4cXV6WFhxVUppY090Ny1lV0tMa2hyZmRvRmlaNXFvdkHSAYIBQVVfeXFMUFFOSzZtWnMzNk5zY0VFajJuZi01OGpKTXB2SER6RnAySTljbkU4OWh0WDY5TnFVOGxXTVQwZEc5em9MNVBnU1lOTHluQmdiZFBmRnlmX0NvTWx4YmswcENNU2RWaDZfa2I3YzlmbndjQ256a0wtczh0elRxOUpsZlZrZw?oc=5
2026-02-22	Yahoo	0.067	HPE Price Target Lowered to $23 on Cyclical Concerns	We recently published an article titled 12 Best Data Storage Stocks to Buy Right Now. On February 18, Morgan Stanley analyst Erik Woodring lowered the firm’s price target on Hewlett Packard Enterprise Company (NYSE:HPE) to $23 from $25 and maintained an Equal Weight rating. While the firm anticipates “a solid, if not good,” January quarter […]	https://finance.yahoo.com/news/hpe-price-target-lowered-23-122644719.html?.tsrc=rss
2026-02-22	Google	0.0	HPE Price Target Lowered to $23 on Cyclical Concerns - Yahoo Finance		https://news.google.com/rss/articles/CBMifkFVX3lxTE1tNG1LTGZITmc2N3pLS2oyQzFJel93NEFGQThmNTNKU1FnOFk1djBRaFhhNGo1TXF6TFBFMzdKWGlYT01ySUJSbktqZWFlTnBYbTNXZW1wZDlEZHpzbTVWVG10X2NnV2hhc0hsSzZCRG9oNTF4cGFyMThkMEQwZw?oc=5
2026-02-22	Google	0.0	HPE bets on AMD 'Helios' rack-scale AI and puts Ethernet at the centre of scale-up - iTWire		https://news.google.com/rss/articles/CBMizwFBVV95cUxNNS1idER1V0FrR1hYMnJfcndDM0NVQkgtUVVITmdIWTlDc1FVcFZCVmlQOFlnXzhEajJ5N2x5MUZyZXQyUGd5ajRLX2NwS2hlb2RSRGw3QkZXSVZjaEpfclMtRHhCLXFTdWoyUHNEeEN5dTNLTm85WmJwcVh0OFBDMHAtalliSHFDX1NPN0c2S2R4ejg5cVdVMExoNzZBdTdoNWFhZ2h6X2ROQ09XTEtlVGFiWjFPLVlKWW4yR3BPcU84MFJYcjNvNnhFbHVCMGc?oc=5
2026-02-22	Google	0.0	HPE says 'AI factory grids' are the next phase of enterprise AI - iTWire		https://news.google.com/rss/articles/CBMitgFBVV95cUxNa3ljSzFEWW9BeTNQTEVhMzV5S2xEQnZxVFBqQW5PQ0x6aExJOVl3aWtFWVNLdUlqZ3ZkOFZHLXF0OEk2LWZqbW5sLWJuUmF5YkVHUUtzMnVCX1piamZ2MUxKckRsRXBSRTB1dzNuUE9RTFpSVld3ZUZQcnpvN0Ywb3BNdEZ2RmdwMzlyM21XOUpJM2pwWEpIVmk1anZpZndmWmdGcVJkNkJvZHZyd3NrSDRHTGtyUQ?oc=5
2026-02-20	Yahoo	0.5	Cisco Stock Rises 17% in 6 Months: Will AI Endeavors Fuel More Gains?	CSCO rides a 17% six-month surge as AI infrastructure orders top $2 billion and networking growth accelerates. Can the rally continue?	https://finance.yahoo.com/news/cisco-stock-rises-17-6-144000219.html?.tsrc=rss
2026-02-20	Yahoo	0.5	Citi Lowers PT on Hewlett Packard Enterprise Company (HPE)	​Hewlett Packard Enterprise Company (NYSE:HPE) is among the Best Affordable Stocks Under $40 to Buy. On February 17, Asiya Merchant from Citi lowered the price target on the stock from $28 to $26, while keeping a Buy rating. Earlier on January 13, Goldman Sachs upgraded Hewlett Packard Enterprise Company (NYSE:HPE) from Hold to Buy and […]	https://finance.yahoo.com/news/citi-lowers-pt-hewlett-packard-083525359.html?.tsrc=rss
2026-02-20	Yahoo	0.228	Nvidia, Dell, and Apple Rally. Tech Goods Has Shifted Assembly.	Shares of tech goods makers rose off their morning lows on news of the high court’s ruling.  Apple, for example, had spent years beefing up its iPhone manufacturing capacity in India, and was able to shift that output to the U.S. In its first quarter, Apple’s products gross profit margin increased by 1.4 percentage points from the year before, despite the tariff headwind.  Apple stock rose 0.6% in midday trading, after being down as much as 0.9%.	https://finance.yahoo.com/m/9f6c1336-ef98-378e-b3ae-4d19d7fb539e/nvidia%2C-dell%2C-and-apple.html?.tsrc=rss
2026-02-20	Google	0.0	Alford to produce docs in HPE matter - Global Competition Review		https://news.google.com/rss/articles/CBMijgFBVV95cUxOUllwX0MtRUJ6VlpWQXBsR3pUTjJjdDdjRWdTRGx1aDlOWmItWHNBRy1fMUhsbkZsZHpIOGMtNkFadVVQR1VaVGdGVF9vdWxHX0pqLUJGaFEyZTJqd1pQMG5zS0FxZUFXdVBvaC1paU9xWjlWWDg0ejRoUVVtSUZSZXZLRG8xblQzZ09LUi1R?oc=5
2026-02-20	Google	0.0	Analysts’ Opinions Are Mixed on These Technology Stocks: Analog Devices (ADI), Hewlett Packard Enterprise (HPE) and Cadence Design (CDNS) - The Globe and Mail		https://news.google.com/rss/articles/CBMisgJBVV95cUxPSWd0VEhmUzR4UXYtX283aTBnemxoekxsakFVdXpkdGsxY25tMDlmbmN1dWF0aHZhRjQxdjVyWWVGRnlJaHZwWjRDWkNxcW0tWW03Snk2UTdTTXM5MlhIaXBlUko5MWtLTUtBYk1JWVNPRzJXZVc5WHdETDNmQkY2cXZJY1RYRUU1dUREM3FyT1l1ZmJHOGRGMFp6SHRtcTJ3ZFU1bWdCMEpZWUw0VGxvdEhRbHN2Q3NIb0F4WXgtQjNuT0pnNjY3NDhBNHpVaHM5Q0F0RFdjemc4dnBjN1ZNaWRwUXVKWkpTcjZjMzZ6X1VidmI1VzFXM0ZBWk1WOGc3MEpoaHZOcXExSjI3Zkl4V1R0MEZfYWZiODJ6emtZMG9hMkZ4ZnI5Vno1U0JUckJGdkE?oc=5
2026-02-20	Google	0.0	Citi Lowers PT on Hewlett Packard Enterprise Company (HPE) - Yahoo Finance		https://news.google.com/rss/articles/CBMiggFBVV95cUxPNTRUSE5LOFZ2aDBUVFktTXJZREFJWkx0WHFDVUtQMmdPdWJHWks3Mlkyd2NQalVzQkEyeFFMQVliMDc2czBBdFFhU1UxS1c5MUV5XzJqZVR0NGlIS2NnX1NXTFh3TXkteG1hSG96bE56Y0UzLVBZZzZrRkdsNzFRMU5n?oc=5
2026-02-20	Google	0.0	HPU men beat Asheville, setting up clash with Winthrop - hpenews.com		https://news.google.com/rss/articles/CBMi1gFBVV95cUxPWXhSV0FPM3FOSEFhSnJ0dzNaM0pFNENmRE9HUlZvSXR3MExuR3hLbTVfc1EwSE5jREI4aDF4Y1FONnhCWDlkUjNlRVdPT1RQb0tHR3BIN0wzR1dsTnBLYW9ZbXdfd29wYzY3R25iTU1oQWhXdFB4SmdvV2dNZ0NDUkxOZEFpVmdsTHFPQW52WkZwcHBtT0xBUFZhc1ZUUUV6SzRlWlk5cFFuaE5JdU01c0ZRSVVqcU90WGFxaS1jb3h3Rmd1OW5pY282dWhhRWh5MDhDeUt3?oc=5
2026-02-20	Google	0.0	NEOS Investment Management LLC Purchases 58,394 Shares of Hewlett Packard Enterprise Company $HPE - MarketBeat		https://news.google.com/rss/articles/CBMi7AFBVV95cUxNNnd4alBRaDVRZkMyYlZqZElLRkl6NzJvaUFWVmhBUkNfUDBvZjRJdHJDQkVFSEh6eE9nVWk0am1xT3gwQkNYSE5ZZVNqbmwtS1YtemZvc2JOcWpPRjJkWklycGJMek1NaE05RjJRMXEwSjM1Y0NwNzgzWXdMcTVLZnBlVGs3RE5GX2FOcmFLZEdxNnlBRzJYOW5ZNl9KZTRxT2hmMTNlS0ZldWZXcjZqX3otT21wdl9hWTk3dFpOUE9aR0s3UzE3eTB5ZUZtdFFFeXR5QUlVaDBUSWJWQUJEYktWX0FQaDQtdnFBZA?oc=5
2026-02-20	Google	-0.05	Citi Lowers PT on Hewlett Packard Enterprise Company (HPE) - Insider Monkey		https://news.google.com/rss/articles/CBMiogFBVV95cUxQT050NjdnLWJGcFg5WGRjSi0wVGRwTFNFWG9IRVd4Tk5CNUFmNjRyakFvVWVaZnBCaUZ6TUhvdlRDVUpQbExHQ095YTdDWVE3YmtmUkZSMUl3dHd6THdocHJXc29GdktFMjBmYzc3bmRsZVdWeW9aVVE1UnJhYUUyUXI3MjlEZmotZERRQkpPQ2ZydURleW40cVRQc2gtNFRsbHfSAaoBQVVfeXFMTWFxUzltV3VQbnRzOHE4dXV6V0llQUc4Q2M4ZW1LeFpaS1Q3UjdreWh6ZXpTSVc1cmFOaU5CYUFyZDRjTlEyVWlFS0RLVU52alJhRFVtbXYxUEQwYUI4MVAxSlYtM1o1Q3ROOFh3OTdZNl9HMnhQb1JtN3MxTUVuZVZnaHVMbFJSb1dkX2hNX0txeHRmbXM1bHhrZDlFLXV1MWNjbHdKVFZybnc?oc=5
2026-02-19	Google	0.4	Is Hewlett Packard Enterprise (HPE) Attractively Priced After Recent Share Price Pullback? - simplywall.st		https://news.google.com/rss/articles/CBMi0wFBVV95cUxOVmVlMThRMVVZakhBQTROYnFranRMeE5UVHNRaTY4dnJZY05HUnVMMjREVWVFNE53bndtdXhSb3ZtX2t1eHF4Z1BFeG1BdmlZZEYxMDR4Y1pLaWJMckZfMDc3Z0YyTHVaZ055NGFEWHV6YnFnazQxeFlueURCS3pCcWEwZFhFMkxWM2x0V3VNem94bHdEMzREQWhVbEdIRXQ1NHVFR2dlVUttSHBsUlI3VDU4SHFpczlGNmlRMjd6VkpycEtJYndkcUNPMU9MZFlyZHp30gHYAUFVX3lxTE5kdDlabVVEM3BuMjJVZFYwYnNDc0pZM3NGY0lSUnlEZWdrNmM3UVBfTzdoT1QyQ0N4RFhiQ2M3T0NHenQ2dTBETlJoR0FKWTdCTFdKTWpNZWptVjJSNm1aRDBMN0RMYng5SG5EZS1uMGpTZ0dyMHV2d0p0QnRTdmo0MTM1NHp3dFlsNndHc2JxX3pjemF3ZHpzQkFvLUNrOWJXQm1KYlhTMmVkMTBHRGE1aV9OeV9fVnE0YlBJSE1IRVdKd3V6bFUwYk9SYnZEbDBmQkxycVJJcg?oc=5
2026-02-19	Google	0.3	Trinity wins dual-team wrestling title - hpenews.com		https://news.google.com/rss/articles/CBMiwgFBVV95cUxPbmlvNTBsQWFodEZXS0FiUUNzTTNBX0xKUlB4R2lVRl9UV1hEaWZReXBUQjZuWXJqRTYxMzVEaW9wM013QkR3ZFRDSWdyUEJRcm42OVV2WGM3Q3QzUXhUUlF4bjVDVDdYZTVZYW14eXI1NWxvVVExTGRGODZ6ZlpBMWlRRzNRU1BsSFlwZWUxWnpfWndFU2N4WXFtOFpzdG02SkR0WXZ1cGFFM2x2TWlLU1BWNU56TGZfZW9id04tTlZDdw?oc=5
2026-02-19	Yahoo	0.048	Stock Market Today, Feb. 19: Super Micro Computer Surges After $40B Revenue Outlook Reignites AI Momentum	Super Micro advances after pointing to at least $40 billion in full-year revenue following record quarterly results tied to AI systems. The stock’s sharp jump puts the spotlight on whether the company can keep converting that demand into stronger margins.	https://www.fool.com/coverage/stock-market-today/2026/02/19/stock-market-today-feb-19-super-micro-computer-surges-after-usd40b-revenue-outlook-reignites-ai-momentum/?.tsrc=rss
2026-02-19	Yahoo	0.0	Can Arista's High-Performance Network Software Fuel Its Future Growth?	ANET gains a competitive edge with EOS and CloudVision, delivering AI-ready, automated networking for enterprises and hyperscalers.	https://finance.yahoo.com/news/aristas-high-performance-network-software-133200381.html?.tsrc=rss
2026-02-19	Google	0.0	Can Arista's High-Performance Network Software Fuel Its Future Growth? - The Globe and Mail		https://news.google.com/rss/articles/CBMi5gFBVV95cUxOclFITWpIbmZxZlMzTGJtQjZDcS1CcHN0X2VkRVlDQzZMNDAtMkJleUFWRXozMFhkWFllVFlNb3hiUHlsdmhKTzhSNTVyMVg4NV85QkFRNnlTbXR1cVVvN0pVVVhQSDBmQ2pmM3NvcU1rV2s0OWE1X3pBc2VGVTlnUjdaNDd1Qkdla2VSeXNXb1V4aDFlNGY4R3FsYkhfSEowclh5MGR0dW1ZcnU2WGpwaS1uMXhvRTY0WlM1eHp4V3RybmEwQ25iVWgzWXF6Sm5rSUFYVllPVVFoM1IxVC1iSGozS0lrUQ?oc=5
2026-02-19	Google	0.0	How AI Is forcing storage back into the enterprise conversation - theregister.com		https://news.google.com/rss/articles/CBMiekFVX3lxTE5mWTZOWHo2ZFhqXzZBWWk5YjlteVRBX0xEbzZqSDFpWlE0cFRWcWdSZms0UGdBZ2RwaDNKbVo5N2ZsZjdRZ2NaVVh5akhLWU0yNDRlaGVNaUhma240SXVLeW9hWk5wTVVtMi1yNXlQRnpPYlZoS2YxMFFB?oc=5
2026-02-19	Yahoo	-0.179	PartnerOne Continues Investment in AI with XYPRO Applied AI Technology	XYPRO, a PartnerOne company and market leader of security and compliance solutions for mission-critical systems, introduces Lionel, an internal AI assistant designed to unlock institutional knowledge across the HPE Nonstop Compute ecosystem. This marks a major milestone in PartnerOne's applied artificial intelligence strategy.	https://finance.yahoo.com/news/partnerone-continues-investment-ai-xypro-150000515.html?.tsrc=rss
2026-02-18	Yahoo	0.35	CBTS Announces Comprehensive Technology Solutions for University of Kentucky to Support Infrastructure Modernization	CINCINNATI, February 18, 2026--CBTS, a leading provider of managed IT and networking solutions, has entered into a contract agreement with the University of Kentucky to deliver a full suite of technology services to modernize and future-proof the institution’s infrastructure.	https://finance.yahoo.com/news/cbts-announces-comprehensive-technology-solutions-150000860.html?.tsrc=rss
2026-02-18	Google	0.0	Ex-DOJ antitrust chief denies 'national security' misrepresentation in HPE-Juniper approval - SDxCentral		https://news.google.com/rss/articles/CBMivwFBVV95cUxOakNIOEVTZXFyMkhNRmIyZk5TWGZhb2V5eGw3UGlTRUhlUTB5TThfU1JoNXoxdExBcWhtendwWndxM2M4V1BsNWEzYWlyNXFXM3BsQ29PQ2FnbmhuZ2Jwa3QtcEQ5YVA0bXY1dlhBVXpxVVB5cFNFYTZhT3B3aFJRVmRHZk1HeDVlcVd2c3h6RHg2ZXRLUzZRZ0NNYzUwVHlPV0NXUTlWMm5vYlVfVXU1a3NWRFJJa040ZzI3cHRTNA?oc=5
2026-02-18	Google	0.0	States accuse DOJ of withholding “substantial” HPE docs - Global Competition Review		https://news.google.com/rss/articles/CBMiqAFBVV95cUxQd0VQUjBFa2h4V3c2d0g4YzdWU002cTRJa1M3My1ZUFAyUEMxUmJQZG9sbTI2eTc0azRqV1FYSmtJOHdGcFFHU19FMHE4MWR1czlySkxDUi1Nc3QxQWVEdXRyVzE5elNNcDR5Mm0yMGJ3ZEhPM1pMUHo5V054c2tFS3FhdzhYSXRwRHU1RnlwUVdVWmNoRXc3b0pHZVVodDluaVhXWDB0dng?oc=5
2026-02-18	Google	0.0	Trading Systems Reacting to (HPE) Volatility - Stock Traders Daily		https://news.google.com/rss/articles/CBMivwFBVV95cUxPTHBEOE1iVExqQ3JpLVBtVnZzUUtjb1ExUUk1ZGYtTzRDUDg3VzVfdXU4R0tEZWhvUnNCZGdfUnB0WkpYWk5PTWdja1pHdWQ5VlVWTlpGOTF5V2o0UFlfdlV1VkVCdi1IQ1lIS2Z6NE9aaGtSR0w0dUplbElaeF9kdmF3VTZ5TldiQU5acU9zT3hXQ1ZfeFhCMDFBOXNmbHNqTFpibFJWNGVSTEJkNUhabF9WQ1RuQU1fNTI1ZXlkOA?oc=5
2026-02-18	Google	0.0	Vanguard Group Inc. Acquires 1,336,940 Shares of Hewlett Packard Enterprise Company $HPE - MarketBeat		https://news.google.com/rss/articles/CBMi3gFBVV95cUxQbGJLX0l3QXFwRlhzNXl6T1FvWXMtSXF1cndBajFMZUFKQ19UYXBiRHdaUlNyamMySWItbW0tZnB4bXFQbTJ3X0c2NFdKYWJPTkg1OFhvcGVSb0tZRE5fLW5PWkdMZzRYanNKNXFIYVZFMWkzcEFWV096WEhZVFhQaHB4dHBjam9UdVo5UWs3LWh3UnBSRm1mSHotSW1lcUQxaTZnZHNtLXh6UG5yZTl0NHMzNlRRTWRDVVpCb1Y0cU11aERKQmFYdUlqdncxWk5lNGlSbEpuNnBTV2dFVFE?oc=5
2026-02-17	Yahoo	0.256	Vertiv Gains From Strong Orders: Is the Growth Thesis Strengthening?	VRT's orders increase 252% in Q4, lifting backlog to $15B as AI-fueled data center demand powers strong growth momentum.	https://finance.yahoo.com/news/vertiv-gains-strong-orders-growth-162100849.html?.tsrc=rss
2026-02-17	Google	0.0	Citigroup Lowers Price Target for Hewlett Packard (HPE) to $26.0 - GuruFocus		https://news.google.com/rss/articles/CBMitgFBVV95cUxOZElFMjBLbVVIZ0E3TVlrTVJ3X05CaGFhb0RxOVg3ZlJQdnRWZ2pWNUNaNGx1LUFzOU9VVW1ROEhzejNPMFE1TWpVaV9sZE5BcG1uODVqM09sZUdabFJCUHdoT3h0TFNFQkJWc3A5TmRSTjJuQU45cjJqc2d3NVhjaENVVzBGLXhwZUcxaEVwNW05b3hVUG1LNE9jb2N1bnRNc2NxUjZIb1J1eXFUc0tkWTdQWmIzZw?oc=5
2026-02-16	Yahoo	0.293	HPE Self-Driving Network Enables Transformation of Riyadh Air Metropolitano Stadium to Enhance Fan Experience	MADRID, February 16, 2026--The Riyadh Air Metropolitano Stadium, home of Atlético de Madrid, is advancing its technological transformation with the implementation of a new intelligent, self-driving network infrastructure based on HPE Networking solutions. The project, divided into two phases over the 2025/26 and 2026/27 seasons, completely modernizes the stadium’s communications system and marks the beginning of a new era in the digitalization of sports infrastructures in Europe.	https://finance.yahoo.com/news/hpe-self-driving-network-enables-135500589.html?.tsrc=rss
2026-02-13	Yahoo	0.043	Hewlett Packard Enterprise Reshapes Growth Story With Juniper And AI Shift	Hewlett Packard Enterprise, NYSE:HPE, has completed its acquisition of Juniper Networks, reshaping its networking business and broadening its role in large scale deployments such as the 2026 Winter Olympics. The company is also rolling out AI driven automation across its finance organization, aiming to change how it manages core financial workflows. Together, these moves reflect a shift in both HPE's external offerings and its internal operations, drawing attention from customers, partners...	https://finance.yahoo.com/news/hewlett-packard-enterprise-reshapes-growth-061402145.html?.tsrc=rss
2026-02-13	Google	0.0	HPE Warns Partners Of ‘Price Adjustments’ On Server, GreenLake Orders In Wake Of Memory Price Increases - crn.com		https://news.google.com/rss/articles/CBMi2gFBVV95cUxQRHlnbkFFemVraTFKUzZST0dUNGF5YVg4QUIwVlFUWEU3d183MnlUY0w4NlZQVzNCZEpaZW1oS2FtTmJUY3R0R0p0QnY2RDVybVlDOS1UWDA1NklBVThhZmFsUjA3cjZYNExLaGhOdkNFT1lMSUFBOGZtSTgtOXRNN21EdXZnNXlwXzhYMUY1dFhhNzBYX1dmMDNDNWtmN0dyYUpOdWoyMGlkWjF3ZWNDOEVKZ2x6Nm0tbjVIYnhsMVc1SVZFTWl4bllyVlg5aXR0cHNSWGFrdHhYZw?oc=5
