Date	Source	Sentiment	Headline	Summary	URL
2026-02-13	Yahoo	0.0	Is DOJ Antitrust Chief’s Departure the Triumph of Lobbyists?	The Live Nation civil suit was brought under the administration of Joe Biden, but carried forward under the Trump administration.	https://finance.yahoo.com/m/0218f505-22bd-3d1f-899a-e553a545cdd9/is-doj-antitrust-chief%E2%80%99s.html?.tsrc=rss
2026-02-13	Yahoo	0.0	Should You Buy, Sell, or Hold Vertiv Stock Post Q4 Earnings?	VRT stock dips after Q4, but explosive AI-driven order growth, a record $15B backlog, and upbeat 1Q26 outlook keep investors watching closely.	https://finance.yahoo.com/news/buy-sell-hold-vertiv-stock-162700810.html?.tsrc=rss
2026-02-12	Google	0.091	CFOs as transformation architects: Deloitte and HPE envision a new era in AI-driven finance - Deloitte		https://news.google.com/rss/articles/CBMimAFBVV95cUxPNEljVVhvMUhFeXRNS1pja1hzNl9JNUg2dWJLMG40ZnAxdHdRcDdjZXV2cURyZXNBM25WRlNpWU9mMGhDSEpPWm1YcjVSS1lOeG9EUkd4NVV1cTM4TWd2TUFIc0dEdlR0REJHVUFjSTdEME9HMnc1V2ZmUmlsdUpmRkZId3V1MklCR1FvMXZLTTZlSlR1aHhTeg?oc=5
2026-02-12	Google	0.0	HPE turns finance into the front line of enterprise AI - Fortune		https://news.google.com/rss/articles/CBMihgFBVV95cUxQX0F5NTdNbjRiS3NXU1JCVG1zUXdrYUJvSXY3aVVYNlZMSGZLSmVsellvT0hXcnN6cXoxN1ZKSkdiaWw4ZGNCR2VpRkY2SEo5OGV2ZDNXQlE2NWZHSUkyNVFPUExhU2lMZm0xWDRCMWh3X3RjbDlub21UMEk5UFQxWkt2WFVCQQ?oc=5
2026-02-12	Yahoo	-0.1	How HPE’s CFO used AI to transform the 100-slide Monday meeting her team spent all week preparing for	Marie Myers discusses an AI platform designed to rethink how finance operates and how a CFO leads.	https://finance.yahoo.com/news/hpe-cfo-used-ai-transform-133158879.html?.tsrc=rss
2026-02-12	Yahoo	-0.156	Cisco Memory Chip Warning Sends Down Dell, HPE, Arista, NetApp Shares	Cisco stock, along with shares in rivals Dell, Arista and HPE fell on Cisco's comments on higher memory chip prices lowering profit margins.	https://finance.yahoo.com/m/8f2b6911-5092-3c90-a33b-67ee7bf060a5/cisco-memory-chip-warning.html?.tsrc=rss
2026-02-12	Yahoo	-0.156	What Trump's DOJ shakeup could mean for Big Tech M&A	Andrew Harnik/Getty Images Gail Slater, who has led the Department of Justice’s antitrust division for the last 11 months, is stepping down. She said she made the decision on her own, but multiple news outlets report that she was pushed out by President Donald Trump’s administration. Her ousting could mark a turning point: She has been a vocal advocate against tech monopolies and reportedly butted heads with Attorney General Pam Bondi and other high-ranking members of the administration, particu	https://finance.yahoo.com/news/trumps-doj-shakeup-could-mean-224846810.html?.tsrc=rss
2026-02-11	Google	0.136	HPE appoints Neil Dover as new Ireland sales chief - ITPro		https://news.google.com/rss/articles/CBMilwFBVV95cUxQaDhBek1KZjJINjBXN0FlY1FPXzVGanJ2aTNsSlM0QVhqd0tXcWcyWk9RRDV5UDlId2tfbFAzcF9JNHpKbkRUUWdpVkdGeTN4VkZNM2Fsd25IUWJuQk44Xzh0MUE4dDByejhVUm9yYU5pVmJKeGQxcVJGVGZkRFRicU9wVWVxbmJDVzVnczdvTmhxbTVFLWM4?oc=5
2026-02-10	Yahoo	0.284	New Research Finds Only 5% of Enterprises are Fully Ready for The Great Virtualization Reset	HOUSTON, February 10, 2026--HPE research examines how enterprises are responding to changing virtualization needs amid pervasive licensing changes.	https://finance.yahoo.com/news/research-finds-only-5-enterprises-140000758.html?.tsrc=rss
2026-02-10	Yahoo	0.0	Assessing Hewlett Packard Enterprise’s Valuation As Healthcare AI Claims Solution Gains Attention	HPE’s healthcare AI push and what it could mean for the stock Hewlett Packard Enterprise (HPE) has drawn fresh attention after Iterate.ai and TD SYNNEX launched Generate for Healthcare, an AI claims recovery solution that runs on HPE Private Cloud AI and HPE ProLiant DL380a Gen12 servers. See our latest analysis for Hewlett Packard Enterprise. HPE’s recent healthcare AI launch sits alongside other company updates, such as Raymond E. Ozzie planning to leave the board after the 2026 Annual...	https://finance.yahoo.com/news/assessing-hewlett-packard-enterprise-valuation-211433360.html?.tsrc=rss
2026-02-10	Google	0.0	HPE goes for gold with Winter Olympics network performance - Computer Weekly		https://news.google.com/rss/articles/CBMipwFBVV95cUxPdTV2aEl6QXJWYWozdmE1Y19kRDdaRThwMmZ2bFVadDdPRXd3WTMwWm1ubXlIQ3VLekV4MnFqUDAwXzV5QzF5cENWRV81dGdpNU83QnhUYkM1ZWpGT1RSckNpM1RfY2FrRHhXR201NEN1cG9zX3lVeXBnLWhwX0E0SXMtUWhwTEQ0Qk8tQ2dRbUN6SUtla081eUlXMGdlSk9sLUNfYUtDMA?oc=5
2026-02-10	Google	0.0	Hewlett Packard Enterprise Expands AI Role With Healthcare Claims Partnership - simplywall.st		https://news.google.com/rss/articles/CBMi1AFBVV95cUxOaU9laGZuQ3JEdGI2ejhJdW16UGlQZGRGTUY0eVpkQVI3cm5TdjJ3UG5Dc2NKSEJWLW1LVmtjTGZWd0QzZWlqVTJhQ05tMS0xdEJNQVJ4MDBPc1ZsU25waEFiXzd1eXhFN2JCb2FXeDFMT1lfZDhKTHdiS2JGZENRUzRSVDFXR1U0ZXAwd3hCZnBlVDEtMVlRLXJOYVBWbzJKM0hDcTVWcy1kTEdYN3ZDejZIczdoQVFjVWgzbXAtN2N2ZUN1Q0Y4NlQzT0ZqeTF4cm4xag?oc=5
2026-02-10	Yahoo	0.0	Is HPE’s (HPE) Healthcare AI Push Quietly Reframing Its Core Infrastructure Investment Narrative?	Iterate.ai and TD SYNNEX recently launched Generate for Healthcare, an AI-powered claims recovery solution that runs on HPE Private Cloud AI and HPE ProLiant DL380a Gen12 servers, while Hewlett Packard Enterprise also disclosed that director Raymond E. Ozzie will not seek re-election at the April 2026 annual meeting. The healthcare-focused AI solution showcases how HPE’s infrastructure is being used at the heart of complex, data-heavy workloads across fragmented hospital systems. Next, we’ll...	https://finance.yahoo.com/news/hpe-hpe-healthcare-ai-push-231407944.html?.tsrc=rss
2026-02-10	Google	0.0	JEDEC Board Presents 2026 Distinguished Executive Leadership Award to HPE President and CEO Antonio Neri - Business Wire		https://news.google.com/rss/articles/CBMi8wFBVV95cUxNZWFxdzQ0Ukg0U3g4al8wQ0ZIZXpBbWlqdmxfQUFuUTNXUDdaY0g4cjMzbGh3WVpKdzVaX3pHTXBEamtHMmdTVzZFZi1DYlVjMTFiN291R1VRTl9CcW50dXhSb2sycXcxLUZKblhiVlFjckJLMkJBdmVtLW1Ua0dLWnpDajlHUkVnbnJOSURtSjNqYkhXY0IxVVNpbE1fR3hlYUJSTWYtb21EdkVjOVp3c0tyTm5GRWtCWUREZmxVcEZFWUNFVENySkUzY3oteFM4UVo1U093djN2VS1uRW53aGoyTk1Gc29wSWpwSjhhSFY2LW8?oc=5
2026-02-09	Yahoo	0.0	Cisco Q2 Earnings Loom: Buy or Hold the CSCO Stock Ahead of Results?	CSCO heads into its fiscal Q2 report with revenues seen at $15-$15.2B, rising AI networking demand, and shares up 35% year over year.	https://finance.yahoo.com/news/cisco-q2-earnings-loom-buy-174300461.html?.tsrc=rss
2026-02-09	Yahoo	0.0	Does Qualcomm's Solid Q1 Earnings Warrant a Portfolio Re-Look?	QCOM posted record Q1 revenues on IoT and automotive strength, but supply constraints, China risks and soft guidance cloud the near-term outlook.	https://finance.yahoo.com/news/does-qualcomms-solid-q1-earnings-141400693.html?.tsrc=rss
2026-02-09	Yahoo	0.0	Kentro Promotes JT Robinson to Chief Technology Officer	Kentro, a federal IT solutions firm, announced the promotion of JT Robinson from Senior Vice President of Technical Services to Chief Technology Officer (CTO).	https://finance.yahoo.com/news/kentro-promotes-jt-robinson-chief-143400001.html?.tsrc=rss
2026-02-09	Yahoo	0.0	Should You Buy, Sell or Hold ANET Stock Ahead of Q4 Earnings?	Arista Networks heads into Q4 earnings on Feb. 12 with steady estimates, new AI networking launches and a premium valuation, leaving investors weighing hold versus caution.	https://finance.yahoo.com/news/buy-sell-hold-anet-stock-170500923.html?.tsrc=rss
2026-02-09	Google	-0.048	HPE ProLiant Compute DL345 Gen12 review: A truly EPYC single socket rack server - IT Pro		https://news.google.com/rss/articles/CBMi0AFBVV95cUxQWHRtQ2RwS3EtcnZNSmJBQ0RHUUZfbm5peDFYOFU4YnNhdHgyYzMyV0NJQ3JpWVBXSl9EZ284SFM1bVlNb0dCQWJRck0xRUFQMHBKTUJqcW5JVEdkdTJOVVpuZDNXclhidnRBWDN0bWRPZjcwRlJ5X2o1d3FSUklXcG1TcEVXdERRaW1tZm00dWNaaTVlbDE4aHJPTExwMnZaby1PcjR5a1d4Smk4QnVJa0FlckhKOVZ5TGxOQ3J3VUlvSUI0dExOUVVHa0s5MEZY?oc=5
2026-02-06	Yahoo	0.0	3 Mid-Cap Stocks We Find Risky	Mid-cap stocks often strike the right balance between having proven business models and market opportunities that can support $100 billion corporations. However, they face intense competition from scaled industry giants and can be disrupted by new innovative players vying for a slice of the pie.	https://finance.yahoo.com/news/3-mid-cap-stocks-risky-044455540.html?.tsrc=rss
2026-02-06	Google	0.0	HPE chief AI officer on the line between AI and automation - Information Week		https://news.google.com/rss/articles/CBMirwFBVV95cUxOVlpMRldFZVhvcmFTMURmMTV0MDNwa3ZtU1RBbHJJYVo5Q3h3ZC0zZjQtYWVaSm85Y0l0YnVQVWQzcjlPdkdQTTVYSlBZMDdPbmpSM1doSmlSM0UyWTEyWDdYUWpITk1nOHdDSFFXR1U4RXlyc1d0ay1VbmlYVzlMVmd2LWdPU29sLWQ3TGl2SHZlcm85QnpZbzc4OHpNaDI4UGpzZUNGNndLem5icjYw?oc=5
2026-02-05	Yahoo	0.0	Why Analysts See Hewlett Packard Enterprise (HPE) Story Shifting After Juniper Deal And Margin Risks	Hewlett Packard Enterprise’s story in the market has shifted more in tone than in raw numbers, with the model fair value estimate holding steady at about US$26.44 per share even as the discount rate edges up to 10.49%. That small change reflects a slightly higher required return being baked into the model while long term revenue growth assumptions remain anchored, a balance that lines up with a mixed research backdrop where optimism around the Juniper networking deal meets concern over...	https://finance.yahoo.com/news/why-analysts-see-hewlett-packard-091537117.html?.tsrc=rss
2026-02-04	Google	0.5	HPE ProLiant Compute DL340 Gen12 review: An appealing alternative to dual-socket Xeon 6 rack servers - IT Pro		https://news.google.com/rss/articles/CBMi7AFBVV95cUxNN0FCX2x3M3AxTTMwcDRtSS1xYkdkTkl4ZHRZUk84WTFTMTZFSExkQ1p6MXVKOU5SUWFBMmFQREJPNndBYXBoOTNPb1d4VVkzb1lWVWpkSEpheGhKLTFiSUZPS0ZDc2liUnd3SVhIcy1tWFZwNTM0bEw0eHMzaS0tVjN1bm1GV0lmSVh6bDNvTThIaDRsa2daSnlGQ01paWpNeVRKTjJTSU5zM1BBOHE5bUdnaWZfS3dDWFVmdW01VUpUd2NscXJTYlh4WWMxWFdRQ0l4dERjUGZuSUVnSHgwckF1MGkzMWpKWUFsSA?oc=5
2026-02-04	Yahoo	0.333	Stock Market Today, Feb. 4: Super Micro Computer Surges on Blowout Earnings Fueled by AI Server Demand	Today, Feb. 4, 2026, investors are weighing blockbuster AI-server growth against margin pressure, mixed ratings, and execution risk.	https://www.fool.com/coverage/stock-market-today/2026/02/04/stock-market-today-feb-4-super-micro-computer-surges-on-blowout-earnings-fueled-by-ai-server-demand/?.tsrc=rss
2026-02-03	Google	0.11	HPE to Present Live Audio Webcast of Fiscal 2026 First Quarter Earnings Conference Call - Business Wire		https://news.google.com/rss/articles/CBMi3AFBVV95cUxQRWRVUHZuSnFPSTlJQXE4T3RJVEE4S2pFRkhQZ3VkRm1sODdyVlhrN2VoaVFTUHJBZk9mUDJocGd4dVJfNXdtTHJMMS1Cc0pNU3E0aU50SnRBZG81UWp0QmdLeDJoaWxoeFRuNFQwVEp3eUNkTmVyRlhsOEw0QWl0ZjBNQUlKQkdHTWU5TDFnUENlVVdlcDQ4bUw0NGV3bEgyUkJjcDhvTW9ZTFdKZXZNSlMyZ2dQZDNSeDdzLWlpTTJYa004cWY2TnZKejBVd3RDTFBONllBWkVFVGlP?oc=5
2026-02-02	Google	0.0	HPE Judge Allows Depositions of Company Lawyers, Advisers - Bloomberg		https://news.google.com/rss/articles/CBMiqwFBVV95cUxQdTNpNDBucjdacFlSVHFOUWVMMXVacEd0M0hNVS0zOEZRVnhWUnFWZHhQYXJNNklaRi0yU1NrWXlmYThKZ2lFNENmcDkxUDY2amJmQzVBU0J3VzZvVVQyTVlmSzU4R0NKQVYtYjJkRjJDMkNielJqTXNFdkQzcnJVMThHdW54TjNoRHh2UEhSb1BDRURzQVNzbUhoM1JKRG1MVS1jbzhLaWc5b3M?oc=5
2026-01-29	Google	0.0	Iterate.ai, TD SYNNEX and HPE Launch AI-Powered Solution to Help Hospitals Reclaim Millions in Lost Insurance Revenue - Yahoo Finance		https://news.google.com/rss/articles/CBMiekFVX3lxTE9YY0VtXzJLeWVHZjhDNjR4N195X29od3pRV3NvYnZvYnFQS1hoT1VGUHBDUVZHdHZFMnZ2OWs1UzRfREo1ZlFzVnNteGdBOFJjVFRqQnBrYjEzM1UtM3VYM21MclZWaTlNTWlHV1BnNUM5TkgtNDNEODBn?oc=5
2026-01-28	Google	0.0	AO Modernises Network Infrastructure with HPE to Strengthen Customer Experience - CX Today		https://news.google.com/rss/articles/CBMipwFBVV95cUxNUWVZUnRXMWp3THc0NXE3aFFEQW4zTV94em1HUzRXaWdzcEc0MjZiZ0tiWWF3N3lPY1lVcUs4UGNXOWwzVzN2RTE1ek1MSUVrMXNhZzhTbF93OXJKM3JKLWpRLXRVd1k1MjE0TVN3Y3Y5b1oxMkFxLVlNN3pNUk01Rkw3aVh2VGFPZGc0eUNFYnltbFBqb1k0ZF9tNmJ3YmJYLUpSMWc3SQ?oc=5
2026-01-27	Google	0.0	Assessing Hewlett Packard Enterprise (HPE) Valuation After Recent Share Price Moves And Juniper Synergy Expectations - Yahoo Finance		https://news.google.com/rss/articles/CBMijwFBVV95cUxQWDJMUl9SMUZCNFktckRYUElENTVqWEt0Y2d0TDhubnotRlVTUEZmcjBfSktkZjJtQV9Xd3hlX292dzkyT1dNVFFYUm1QeVVVQnNhX2EyZW9IZGt6QWhOTFN5VFQxcmNKYzA0clM5X3N6bXhuRmgycm9tV252VS0yMWFiajN4eklMS0hPc3pOOA?oc=5
2026-01-27	Google	0.0	US Judge Allows HPE-Juniper Merger to Proceed Pending Final Settlement Ruling - Law.com		https://news.google.com/rss/articles/CBMivgFBVV95cUxOUm43WGdyY1YtSmZ0bFg4ejFJLWlUYVBabWpkcW1JSVVxOWc5NWVLRU5Oc1RDWF9BYmFwY0pvQlB1WVFGQzFNRWtDWDZrVEMzZUZMSnNuNTNfUUc1NWRGS0FBa2o1dnd6OGZ6bzlSdVhncUctOTlGeWNPVHRsYVo0YlhpVU1icmJyUjdhQzNvZXJSeWxZRTlIcTlUVS02ZkhYbW9HbTRjcjdMNzJIdEQ0Nl8xcDBSRl9CSTJCVTln?oc=5
2026-01-23	Google	0.0	Does HPE’s (HPE) AI-Native Retail Network Push Reveal a Deeper Edge Strategy Shift? - Yahoo Finance		https://news.google.com/rss/articles/CBMid0FVX3lxTE0tMHRwLTBJRllXenZ6Z2hic2VpajAxVFFwalJCeHliYm12ZlhXdEwxaVctd2FkUXNEV0g5M0RQQTNqTzFCcW5vaFhvOVNpdlotUFJ0Uzk2TVJvdkIxYlFLZ19fMWo0bmNpMGg2Qi1nRG9vVGNtX2pr?oc=5
2026-01-22	Google	-0.062	HPE Q2 solid due to AI demand, hybrid cloud - Constellation Research		https://news.google.com/rss/articles/CBMijAFBVV95cUxPXzNHQkN5ZW5RdVhYcU52MV9OcGhYQ21raldzd3F0T25xT25yU19qbEx3TUUwOW8yVzdVaFk2TDE1NE1NVWdKcWlkRWNFczVVVmZldEZETER2NzlsR2U4Sm50UU9rSXFndWpvQktLSGp5dmFRdEhEV1JxazkxLWNMQVhzYndhWnhCRG1GaQ?oc=5
2026-01-19	Google	0.0	3 Reasons to Avoid HPE and 1 Stock to Buy Instead - Yahoo Finance		https://news.google.com/rss/articles/CBMidkFVX3lxTFBaWEw4VFlTNkZ5SnhLRlVtRFdyWFhPcXdsUW1xZjkwSXRBVjNNVy1PbGNDYVdhNGxUUFJRc2xDNHd5d0Jkc2sxRVBld0poQnpUWEhCNEpxVm9XSHFuMEQ3YjUzVWF6dWdHa3ZKQ1l3MFV6cWdIX3c?oc=5
2026-01-15	Google	-0.067	Patch Now: Active Exploitation Underway for Critical HPE OneView Vulnerability - Check Point Blog		https://news.google.com/rss/articles/CBMitgFBVV95cUxPQWZXRnB4ZnJxc3Z3NC12Q3hVUFpncEV4c0twNWFNWWlaUDRKN3UtZ0MxZnRiajk3OTNRQTBJVFJlOGktUllVNXFBZUtsM215d0FQVmNhandDLUFnN1pSVWtXUk5wdVVjU253YVZ0TnM1ZmVRb2EwV3pMOEcxWEdJYVlWM0F1UkJpYnpzd3hSTWZDbUF1SnZ5TjNETGpqUlNoTVNuaGluXzhsTFI2aUZ2Qm9Db3ZPUdIBuwFBVV95cUxOeTI4OEZYRTVBaEc1OHVlWFUzOWFyNWlCN2pLR2xVVTlhcThvTjVBd3dmS0hwcERLajBvc2phZjVoLWFDemZtOUptWjVxZ0lsbU4zcDhWMnhwdzY2LTJXTHN1dmJWWWZvNXpFc2FkSDVjUkJaQ0t2elJVRGNoUjJKWl9nNEhCVDh1aTZPNm5Tc2kxY2lYWVBCMGh6MG5ySzhnVWNiR1dPekpidUN4MEZNQnJmR0kzX3gwNkln?oc=5
2026-01-09	Google	0.0	What is HPE GreenLake and how does it work? - TechTarget		https://news.google.com/rss/articles/CBMimgFBVV95cUxOTUJleDVEZm1Ec09ZYk1pbXFDVlQ3aHpHSzZwLXlvLUYzWmdyV1JXdjRfdFNpS3BMMDZBelZBb1FQa252V0ppNEFwQ0YyZkJ4ZGhhSm1jWXJ3LW9QOFk2eVcxRkU2MVFybmFRekVXRUxXNEt0Zkg3LVNqY2E0RDRHdEpxRmRDNHJPbjEtTnVseGNaRlBnejVRdWx3?oc=5
2026-01-08	Google	0.0	Critical HPE OneView Vulnerability Exploited in Attacks - SecurityWeek		https://news.google.com/rss/articles/CBMijgFBVV95cUxOZzlhTEhTX3VRYkVZQ2ltQ2xYME1PemZaaXJpYk5ybTFCYmc1eVNiTkJQM1BVclF2QmpmS1Y1TVpBX1F0NEhxR3NqcGpwZU5TRnFwVkR2UkFodjVSNm8xc2c4ckE2aFJoVjZtWXVrYVlRU2Q3RTFzTV9WOHliY2RJdDBkeHNVRENwb3loZnF30gGTAUFVX3lxTE1NLUpqNjhCRGNrMzI2QWJFN2N4T2h5UW1EQkl4NzI3RUlOTmMtRW0tc3MwOHNneUt2ZTU1NW43MTdBN0UycDBUc3VPRlZOU3JRbGRCa3dULTd5RFZOa3BxdVpiYXNLTU9yNkxzM2NlamppRTVnam1GcEFqdk11TkVwLVNqdmxmeno4N3NCRzJXclljSQ?oc=5
2026-01-08	Google	-0.017	Maximum Severity HPE OneView Flaw Exploited in the Wild - Dark Reading | Security		https://news.google.com/rss/articles/CBMimwFBVV95cUxNb3UxcWZPWE5oOUY4Q2VkRmxYbk5yVXlnbHdwTU1OMEhqaHJuQ2JELWk0ZzVXUU51RkVSNEFBaVpKVXR2cEtHeVNpZ3JPaDZlb1dsYXZ6VmxsaDQ4OWJOVWZXZTd0dmF5SnBkQUg0LTZCZ05acXhNOEpjUXJTUVM5RlRIU3VsWGg2QVk3NUwySnlsNXR1WTd5VkFOSQ?oc=5
2026-01-08	Google	-0.089	CISA Flags Microsoft Office and HPE OneView Bugs as Actively Exploited - The Hacker News		https://news.google.com/rss/articles/CBMif0FVX3lxTE5zcVFHR0NLOS1LN0Y5WGNVQUVHeUJpckhBQkdMclBuN1cxb3lON3lFUXBFeUF6MU9XWjlvQkZtZDhQRjBCUnczQ04xSHc2ejZkWlN0dVBYTkk5b3l2ZXJHOE84OHlxLXB0ZE5PRzFoYkJQSlJXQXR1eGpfZ0VqOVU?oc=5
2026-01-08	Google	-0.133	CISA tags max severity HPE OneView flaw as actively exploited - BleepingComputer		https://news.google.com/rss/articles/CBMirgFBVV95cUxNUGlHVmNpZGN6QzFQQWVXLXVVSGhJT1dtbDRlY1pjMzJpVy1CaVl4X3F3ZkxhNHNPa2tmaVZBaURvVVpPUGZuX2ZJV0R6dTAtdDROd0FxXzhSZk9idHN2ZjhvRUs3SHVqTjFMaHlkT2x1UHhxUzVHcWlxWXNENFRqay1Cb3RhX3p2VHhKV1VTbGM3MWdhNk9pQ2VOcG1hNm5BVWkwd0libVUzc0lTV3fSAbMBQVVfeXFMUGo1Sy1ES24tSEg5ejlwcVREdE9INEdSWXpIQjJwekhQUVNIREhvZV9BN3E5dWlhLXVSOTFoN2FQTVl6Y0NQNmk3ZnpXSnpDdkRzN3YtZTNJUnhLUFozVjNaa0xhVXZXRjUwdjNUUXQ5VjFxT096TXFaOF9GRTNCRF9VYlNYUmpZR0pyM0x0VGpuS3U1M0lSQjIwYmxrUkxLZURYQWxySzhfdW5FUm1KQlo5Tnc?oc=5
2026-01-06	Google	0.0	HPE Juniper Channel Chief Gordon Mackintosh Is Out, Replaced By Networking Sales VP Ben Fallon - crn.com		https://news.google.com/rss/articles/CBMizwFBVV95cUxNRWNZQ3BQRTVPR0Y2UWdfOGljeVczOHVQa2dFd3lTSFlfM1RuZjJCVnMzY1J3NnUxZXM0aEVINC1hTVdhZThqNWpPWHoxOTluUzA0TVBhVzR4OHNxVHJOOXNMOFpaNmJBQmNwb0NEbkxqR1k4RlZyR2FwWlYxZ1hDcjBBeUxsclZ2Wkk5b1FhazZwc0hkYTk4M1pfYllZLXNXY1JvaFNJYU4zQXhYX01xaFczZHBONGxxd3Atd29zS1pWa0VwOGdhTWJNZmxqVlU?oc=5
2025-12-25	Google	0.0	HPE’s Juniper Deal and H3C Exit Might Change The Case For Investing In Hewlett Packard Enterprise (HPE) - Yahoo Finance		https://news.google.com/rss/articles/CBMie0FVX3lxTE1tdzJKWlRrM3lpQ3MyUUk0aXBPVXMtV1hEaUh3cUxVZVFFaUhmeXZkR01DRXdhYjBUYldKbXZib0FTYXBaVzA1T0huWXNXdTBxNVY5YUhWeEZIUkUxZ1d2a1psNHpORkx2OHlKOUZ6bUt6bTBub0JzZU9EYw?oc=5
2025-12-19	Google	0.48	HPE tells customers to patch fast as OneView RCE bug scores a perfect 10 - theregister.com		https://news.google.com/rss/articles/CBMia0FVX3lxTFBmcU43Y1FNdzU2Yko4RmhMOXZZTVZFdEpsU09YeG9OZ3BaYzNaLS1lZmozUHdhckZNbHhmNG1kTnNoaVVZaDM5cDFKVFlzSU13WU10THRaendWYmRpQkdIZmQzQXdkYkdDdkRn?oc=5
2025-12-18	Google	0.0	HPE offloads its Telco Solutions business in deal with HCLTech - Fierce Network		https://news.google.com/rss/articles/CBMilgFBVV95cUxQdFdSMm9aZlA0N2xobkdNSGYzS3NVWFFNaS1OVmZKX0JFdmIxTW1DY1V3cFQxbDhabHBiVU9kR0RUemhRdmtlZnNva2hINjRWUDk3ZjVzdmxCY1FGV0RiU2hLdzA3WlNwN0ZuQzR5M0lfZ3NBWDRhd0haRFFOQ2U1NjN6Z3Y4TWpIekp1SG92ZllxMjRKTmc?oc=5
2025-12-18	Google	0.0	HPE warns of maximum severity RCE flaw in OneView software - BleepingComputer		https://news.google.com/rss/articles/CBMiqgFBVV95cUxNa3A4SmxmQng1TDlBNEdrcEhGWFNaNUpfVGlfQi10eTNXX3R4NlpBVi1EMGhBSVRtYUhCZHVmNzdyS05XcGNzTDJlUHVaaUZ6by1rUE9DXzBBdXhwWXhuTzBTNkRSWmwxb01RWUpkM3hxTFBNMzVCLVNPeU4zSUtsY3RPMDRLaXRIWE5kd3FHMVhBdjlwV1hMOG1sWE5jalBqVVh0akdGOUUwd9IBrwFBVV95cUxOc3M0QVZ3blBMQU9uVEtZV0tYdlBOSThVYWhUNUExOU54OXFFclJJcWxQZlJVY0ZjVThjdTBxbWJYQXlUQ2VFRnZJR0V2Z3F1ZzlzOVJJeDBJYm9wR2ROenp2Ry1tdGpYcHJTN1ZmaGZXejFQTVF6cHdPb2ZjX1lqSThzWFV6RFBkUjZvNHlxaENBVUxRQjBXVDdVQ2EwWGxLSHhwMnhoekhUbFJQdDRB?oc=5
2025-12-18	Google	-0.067	HPE OneView Flaw Rated CVSS 10.0 Allows Unauthenticated Remote Code Execution - The Hacker News		https://news.google.com/rss/articles/CBMigwFBVV95cUxQM052VVlhUWNlTXhCcXFkbzRQYVRGZnlCdzVhVWlDVjh4Nl9kNmlvLUxkeWtIZElORnUzT1hFZWxTb2lKSXM3SXRwalJoeERxcmNTYmtxUkNzMS1Ya1JxUDUyZmJoR3liTnhJMGZ4clo2UC1wMGdxZGMyeWhpYi01XzBtWQ?oc=5
2025-12-18	Google	-0.3	HPE OneView vulnerable to remote code execution attack - csoonline.com		https://news.google.com/rss/articles/CBMiowFBVV95cUxPT1YxNXp0R2Y2bURraHZmck1SUjVKQ1ZzVkhDOGJadFBCX0FNc0ZaelJzZTNubzVmT3FIWTEzMTV3dllvektsZFFfZmlkeER0Q0dGb05tYTlmbnpoS3V3QTZFSTRuVzhmSkhGdGFRLTBGMEt5LUNmM1FRY2JERHh0cDdmd09BVThHamNnUE9OWUlsalhFWmNxa0hETEgzOFpjUlA4?oc=5
2025-12-16	Google	0.0	HPE and Spark NZ partner to redefine hybrid cloud operations - telecomtv.com		https://news.google.com/rss/articles/CBMitAFBVV95cUxNRS0tZGVtQlNCRFhRMl9ybk1ydHlMdkRpelV4MV9hbk16ZXV5QVNhNERFMUE1Y2NHQzdkX0psbnlzamRMRW1tR0x4bE4wTUltRG1odDlGRjBxV1pmS3RhazIyUjJnSkFLYlMycDFZN21ZYTZ2dElMd2F0UW5HMU5nX3N6WlhhYUkzaklUbkJsSkN3OFhGSzdFNjJLMUx4Y3U2eHNTUU4xeUhUX19ya0lrRFF5ZGTSAboBQVVfeXFMUEJtLU5heWIwQVNhNmFPUEJjR25rdXI3RTc2UkF1MnYwbWVEaVdPTnBwcnNDVm14OXJtbUsyU3dWcThEZE0tZmJnaTJMa0J1VEhCaklsUVBKR1VaVnNJOE41WVpQTnhNRXYwbjZiLXF3aWtoaDI0MjlUNjNlX3ROeUtoRzdtRjJqRG55WlYxRk9UTmNYOWVqckpKcThIQUdtNGI4T3BaeFJyTFlPV0s2enVYd1Jjb2ZjZi1B?oc=5
2025-12-11	Google	0.0	Cisco CFO Mark Patterson pokes HPE’s Juniper integration impact - SDxCentral		https://news.google.com/rss/articles/CBMimwFBVV95cUxPc0FjRmh5RnBiaFB1YU1HVHc2THF1UTNkcnF3VXkxRXdNQXo5OUpaUG54ckkxM1I5ZTVuX3BLS2lyLTFGRUw5cjhuSEg4a1h3VnpvTXRoU3pKZk5XUDlTbnNwNW0zcUFMd2dyZzdPbDdocUhxZW16SFI0Zy1sdm1IQ01BcDM2NFl5MFRzMjJLTmRjSEJMMFNvX0ktUQ?oc=5
2025-12-11	Google	0.0	HPE Challenges Huawei’s Campus Switch Market Share with Addition of Juniper, According to Dell’Oro Group - Dell'Oro Group		https://news.google.com/rss/articles/CBMipwFBVV95cUxPakxMa012NGhaSDZYcG9YNVNxbmVBSE5rMnZGbkJoVVE1RkI1TTNVcHlRbmZtcURKU3JWVjVHZ3JTdE14NVk5QjQtTXM1eXRzcHRwMnFWQ3Vva0RFVkd4VEFKbWhJblJKM3dpYjhiZ29idFo3dDk2dnpsUi1sMW5ucHZxQ1pPU2Jpa2lIM1d1WmZVdzI3aEFZTlFfM3hibmZwcW8xcUdOVQ?oc=5
2025-12-11	Google	0.0	HPE dukes it out with Cisco, Huawei as Juniper muscle kicks in - Fierce Network		https://news.google.com/rss/articles/CBMikAFBVV95cUxQdF9DRTEzaFM3Wm5IdE15aGVXSTdQR2FtV21sTVdPLUQzeXdwcDRjT1FRRGhiZU1QTlpZZFpka1l3RW04bURDeWhsQUNUSXNkN0xZOVpEY2JKbDVqWDlJX21uR0dvSDF2eklKRmJmWHVBcjEyT0dWWjRqby1NSUR3bW43bG5hRm1ReGVENi00elU?oc=5
2025-12-08	Google	0.0	Hewlett Packard Enterprise (NYSE:HPE) Is Increasing Its Dividend To $0.1425 - Yahoo Finance		https://news.google.com/rss/articles/CBMiiAFBVV95cUxOUEpKTnJxWEJvTk5sYUp4dWM0U0NQVWV4aEJ6Y3hOY05GSV9TQUtnUFB0UVpERXkwRTFsRURqRzA0d09ESFN4amdteUdIckdkWkNkMF9mTE16dmdpa2NYaVZaRVlGcjlJN1VBNnFpckF6OWhIbC1xNEVOaGlsNkNaVTFHN2NRU19H?oc=5
2025-12-08	Google	0.0	Unleash AI is HPE's trusted AI ecosystem - SiliconANGLE		https://news.google.com/rss/articles/CBMihgFBVV95cUxPcDJ3dHdBN2dBM0htUVYwcFpRTWs0WUNXMm1wR1YxNktEVXBtYVJrYXdpeHluYjdPdnB3REhkOGVCWU42U2lsZkFDd3BaUUlySnprVl9fUkszUUMtb0JDNllxamd5QkpBZXB4Q1htdTYxU2hZZmQ3NllVdzRuM2lkSzEzcEx5Zw?oc=5
2025-12-05	Google	0.4	HPE CEO Antonio Neri On Aruba-Juniper’s AI Advantage, ‘Amazing’ Network Switch Innovation And Partner Growth - crn.com		https://news.google.com/rss/articles/CBMi3wFBVV95cUxNd1pqejVPUl9vdDB6dTc4N0ZaUDhBR21XQXhlTTRybVE0dmpYX0g2S1VTUVZYNnlzQ3loNWpwMEJWTXB1YTZYMW5US1NqR2xkbEwydV94R1o0S2ExOUdNQWdqbU1zMUNlbG9hTzA3RGRTcEswSWZaM0tVRm5JMS02Sy1iZGZCelk4NXNaUVJOZnRka0doNmtVRFp5VERjazlZMmFhTU9ROXdqUjFUb0p0VHFkVXZNSVF3UkdkSE5Hc1hLb2VEdVpQRkpSdnBobzFHSHFpU0ZTd2Utc3FJOFBz?oc=5
2025-12-05	Google	0.333	HPE CEO Neri pleased with quarter despite AI revenue delays as stock bounces from post-earnings dip - CNBC		https://news.google.com/rss/articles/CBMiakFVX3lxTE5hOWtLNUZsVmRTNUQwZzk1MEwzWVRsSnFEQVoxNUFnS08tcVNRTEwwaFdlc1M4aVYtQ1V2RWlzRGJQb18tZ3JKSi1DNGg1dS1ZREkxTEVNdjNHUnB3NUFTb1NDbTlzaHBLX1HSAW9BVV95cUxQV2FVSnZRVlBoYm5PZkFDUm1hV3E3N0dxcjZxS3R2ME1HcVBuWEwyRHQzbU56T2NYWDQzQ2VDSmh4dHJRMXJKOWpVbmsxTEtXejEzVHJ5M0FEQ0hiem5RRU92eXZfRDBtLTZvTWlwSEk?oc=5
2025-12-05	Google	0.067	HPE Stock Tumbles on Q4 Miss and Soft FY26 Revenue Outlook - Yahoo Finance		https://news.google.com/rss/articles/CBMie0FVX3lxTE5PZS1wT3MzZXd2MjZXMWNCb2hnZ0FJWW4tdnpTS2VuNkZnUnJMbkZZQWEwMzgxVHBpLVdwTUJHLWc3LUNlQU5Ba0ItTkhIUVUyVUxtU0hRTlBNUktEQ0QtdG5hQURmU1Q4T0pJU25JUTZDbDRTcEZEcGM5TQ?oc=5
2025-12-05	Google	0.0	HPE Projects Sales That Miss Estimates on Delayed Server Deals - Bloomberg.com		https://news.google.com/rss/articles/CBMiswFBVV95cUxNam10QlRCZ1lzRUtvWFJNYmYwSVBvR3RzeFRqN3JuSTlmc3l3blBPQnR6SkZ2LUgxR2dIY1k2dkVlRTVuNU52cXN4RU1ZNlAwUXJETnlUZ0t1dkQtVUtYRXVqeE9zOThhOUZBNEJQYUptRlV2cWFrOXpaeXFtcnVZMDdpMktBN2ZhTFptcloyMktIaDNKdHd4VFc0SmJ1NlFsUHRtcC1IZzVpenhKdnVTYTV4RQ?oc=5
2025-12-05	Google	0.0	HPE Q4 Earnings Surpass Expectations, Revenues Rise Y/Y - Yahoo Finance		https://news.google.com/rss/articles/CBMiigFBVV95cUxQLUlRUUFTNUdxdlVvd2lmZ0hEaVhnYlhTT3R2OVdJbnY0YmgtcjBpQVc3MGhMWE5hRUhSZER2YTJoa1JnVW9ab2xScTRBS0ZncHp1dU9WSHFWamRzTDRObkIzQTgySVFERDllRl9UdTAyUFNKUWNYaVBtbkxzNTVHeUdzTllaQ0lTQnc?oc=5
2025-12-05	Google	0.0	HPE's $3.2B AI Surge Sends Profit Forecasts Soaring - Yahoo Finance		https://news.google.com/rss/articles/CBMickFVX3lxTE81NUR3OUJrYmxDZm9tMW15OU15cFB3MzBWT0xNV2hnbEpTemszUzA5NUxCMjhzMEZLckg1RTVDMWpDellDa09XMmIzYThpU1hZbWllWFd3Wk1YcmpoY3FXZVBOelJIbEpzRWp5OEt6Qklmdw?oc=5
2025-12-05	Google	0.0	HPE's server and hybrid cloud revenue go into reverse amid historical hardware splurge - theregister.com		https://news.google.com/rss/articles/CBMiYEFVX3lxTFBCS1ZLWTNSaUpzVjZRRGFfQ2dZZWEzNmJ3c2s4c2hKT3JrNm1DY3lrblBGcU11T2hMNjRxRVBwcVZyR1NHam8wMkhmVVZta3hvT2x1dUFrRG9nQmZ6YjNIcQ?oc=5
2025-12-05	Google	0.0	Hewlett Packard Enterprise Company (HPE): A Bull Case Theory - Yahoo Finance		https://news.google.com/rss/articles/CBMijAFBVV95cUxOdlRvcG14UTd0SmVwZlBDTjc1TDRjQi1OUVYtRG9zSlhTUVRSR1U0cm9SRkdNcWpOSHRjaDVUaUNFeU41ZjV2UXo4dFlZaE54UkZnWmNudUZfLXpxY01VQmk4N05laGhQOGE4eXJ2dlV3aWtoYXRwdXBMbFhkSlRJakZfV2tGc3Nua1pUUw?oc=5
2025-12-04	Google	0.25	HPE CEO Neri highlights first fruits of Juniper takeover - Network World		https://news.google.com/rss/articles/CBMiywFBVV95cUxQWTNxOHhkbF9oV0dyc0pJU0FLMzRaV2x4MjVXMEZOaWI4YXRrWmhqaEFtM1dJdGYyU0xVNElBam1SSjVYUWFkN0wyU0dWYlJOMmxaOHdfUlZaZm5hVHZndjlKNm9BMVBiNDNlRlhNb2ZEMG9TUTdJN012Mi0xMUZIaklJNWwwdXNEdTJVZjl6aEpjcFpxWU1ORkhOdURZLWtIblpkWGNlQXZoYXVXUk9ZWTNSX1l4TTlzNHZnalhmOGd4bEk2SENmN1Izbw?oc=5
2025-12-04	Google	0.008	HPE Fiscal Q4 Revenue Light Amid Weak Guidance On Delayed AI Server Deals - Investor's Business Daily		https://news.google.com/rss/articles/CBMiiAFBVV95cUxPUml5cU1mbHI1S2FuaWNydVF4aUVSY0FtekFqS0pvYnI0V05vdF95RW83OGkyNzBNYllsX2VLOHVZWW1JNmtzQlZzaVBLSnREcmlIWnBuRWRwNGFlWUp3cjA2cWl1TUNxTElOM3RWVV9JdlNHckt0ZlhzVW9GOUxlV2NjMVFkR3ZB?oc=5
2025-12-04	Google	0.0	HPE Announces Sale of Its Remaining H3C Stake for $643 Million - Yahoo Finance		https://news.google.com/rss/articles/CBMihAFBVV95cUxNaWZwcHZuWG9iakc3UDlVbmhGeWZvOEt6UnpHWTFqR1p6Q1ZOdE5RZXhmaXVUTjE3T2g2aXd6aVFQS2lndzlmcm8wSmFuVjZUOExVVE14SEl4VTd6ZlRiTVVuVkVNMnNvS1ZySEZVakJ6QllScGFQNWp0SjYxTzhvVFQ2ckk?oc=5
