Date	Source	Sentiment	Headline	Summary	URL
2026-02-18	Google	0.0	International Business Machines Corporation $IBM Shares Sold by M&G PLC - MarketBeat		https://news.google.com/rss/articles/CBMiygFBVV95cUxOQU5KZTJxalBBLV9yeTM5dTZheWJTMGZ1blphOWlhenh4SV95WFVyczJUWU44LUprTnlDNWVQNFFEZWV5NENIZC1pVzRDNUtqb0hWR2hnYVVCVjN4cFFvemEwMUhLTDRqYldqMXVOQ01fQTJSZDFsODhTUDktS1ZyVmFqbUxvbEJJUHY2amFMbDczWkVUMlV0VE9aa0lpRVlLdXAtaHNzRjhCVWh4cUVZTkVzazlGMTRicUVKTERuR240NG0yVkZtc3dn?oc=5
2026-02-18	Google	0.0	I’m a Computing Dummy Who Tried Quantum Coding. Here’s What Happened - Gizmodo		https://news.google.com/rss/articles/CBMinAFBVV95cUxQdHhyZmNBWUo1NWNCWnc2NlZ3UzZacmNtN3pydk5CdTdqU1BzaHFUMlJyd1JIZmFtWDhPYWVOOGwwaXdUTEhfZjhwS3FsYkJvSlVMa19odkFWaVRPaHhnWE1yVkdvVzg0NDdhclk2NEw4SnRNRzJjRWdsd1dhOWU1ZXNRSjdNU0dRZjd3Mzlzb0xoa1BLaDJta2dRN2I?oc=5
2026-02-18	Google	0.0	Lifting the cover on the IBM Spyre Accelerator - IBM Research		https://news.google.com/rss/articles/CBMiggFBVV95cUxQVmdMRkdodTBlX2RGel9rREVPd1NuNkdVRFYwdWN5ajR1c0lMTzlXRzBnM2E0UTMtLTJFTlBTdE9TWHNZSXhTclo1Tm55TG4yY0g1VWVsWWFmTEVyb3Z0ZDJoZE1BdUVST3BmZ3MzanIwVDRlM1l0RWVOZDk4cmxSZFFn?oc=5
2026-02-18	Google	0.0	RIKEN and IBM demonstrate quantum-centric supercomputing | IBM Quantum Computing Blog - IBM		https://news.google.com/rss/articles/CBMiX0FVX3lxTE5XRGJQZWtEdzU3c0lDZldoMG9DSDk2QXJTTXpwemZpRXYzM01XVzloNjhFMnQ0UzZWWnBGSnVvNWJJOGRGOExLOHJydlhHY1NPYmJQNjVFT2lNb0dVN0p3?oc=5
2026-02-18	Google	0.0	Scaling facilities operations with IBM Maximo: How Mitie handles 3 million monthly tickets and 30-minute SLAs - IBM		https://news.google.com/rss/articles/CBMilgFBVV95cUxNekRsSjEySXdRT3BJNXlZUjM0ZDZnLWNvb05FNWZiazE4WnRybldxN1IwRFpKakhzendGclBvQWNnaUJRVGFXNWhhV1ZxMlltTF82cDRlMzJ5NWVVUlJSVXI1UmFWVjRqSkVBQ0VlNGlXSmlkWlBod3EzRm1Ld1ZwZzktdEE4TnQ1ZTZDcUZ3VXg4NFFYTFE?oc=5
2026-02-18	Yahoo	0.0	Stock Market Today, Feb. 18: Palantir Technologies Rises After Mizuho Upgrade Highlights AI Growth Potential	Today, Feb. 18, 2026, investors weigh fresh analyst upgrades, new AI alliances, and a bold headquarters shift reshaping Palantir.	https://www.fool.com/coverage/stock-market-today/2026/02/18/stock-market-today-feb-18-palantir-technologies-rises-after-mizuho-upgrade-highlights-ai-growth-potential/?.tsrc=rss
2026-02-18	Yahoo	0.0	Tech Majors Help Lift Equity Markets Intraday Ahead of Fed Minutes	US benchmark equity indexes were higher intraday amid gains in major technology stocks, ahead of the	https://finance.yahoo.com/news/tech-majors-help-lift-equity-184346445.html?.tsrc=rss
2026-02-18	Google	0.0	The augmented operator: Why the last decades in operations have led to AI - IBM		https://news.google.com/rss/articles/CBMiakFVX3lxTE1YaElUdl9YckVuZnR3NE1uMTYxdG5nYlpNLUNmTFhBNHVKQ19IelFxTW9PVTF0U2tFTzlRb3QzbEdabm9UMkhvQ2xNd0RjNTVvS3VCTUE1Q3AxTHZMay1JVlU4VElxZnZOZ0E?oc=5
2026-02-18	Google	0.0	Transform business productivity with AI Agents for IBM Cloud Pak for Integration - IBM		https://news.google.com/rss/articles/CBMiugFBVV95cUxQSzJCUVhUYTBTc0QzdHl1TjItWHViaFdpSGFnRm1KcXZ2d1hEUUNDZ3N3RXJNZVpwSXpYMk9FLXA4aENsWkd2YnQtVXg0ZzRoazJaRFludzNvWHA1cENxdkVSX0xlTWZGX3VybzlEVjZZS1RtaE55OWRNWkxMaDZZR29QSnNENVFvb3ktemxnSDk2ckxlYUpXTmFndmF3dUpUZkhjZW5PRS1mU1doYURTZTU5WHFmbmlPTFE?oc=5
2026-02-18	Google	0.0	‘India leads global innovation’, says Macron, points to CEOs of Alphabet, Microsoft, IBM, Adobe, Palo Alto and Chanel - Mint		https://news.google.com/rss/articles/CBMihAJBVV95cUxPQlJHZUsza1RSTkJsUzlyTDh5S3V1eGFqLUlfY01sMDN5NlRKTDVXWlN3QzNYejJKZEcxbFVFNFVIZEdaYUd3NXFRZC1hV1kzSzFpWGdaT2lmOXdPRmJRTGxUT2ZDNDlURG9LUzFVVjRCbTk0T185eTMwckFnVEZtYThVNE5tcFlpNFM5MEhuallUbF9HME1Va0ZMd2s5MUtTZkVSblNTSUEwZVpBQkRGdFl1aDlrOHVKc2tBNjZwSzJwam1EUm1HWlo5ZU14Njc1YU5xUWlpamk3X0M5QXlPdmJ1bVpOdDlHdEtLU3FrVkNmMGpGQmwtZDlHTXc1aEU3ZmN0S9IBigJBVV95cUxPUTFYY0M3QXJDYl9pS2dHa2Znbk9lOXBldEJXVUxoUjdyS1ZLOV9VcjA5TUJZNlVNN3hRUDBXdTF3bmhmZWhtejhBbk9vUWhZdE85clRERkg1eUF4ODNIeUlKYWxyOVpHMXFwMkRDNFpzNHpNZW44UzRJaW1XRWYzUDEtVnVHWDVYdlBlODk5S3pCcGlHYy1TdmtOYUo0UFNPZ2JiMDZVUlpidFZvT1dfTWhXMU1sVFZaOU1SNEhCbEpmSVEzX1FDeFlrSUdRZjVNenY1M0FkdjhURUgyWWdUWVN4NkZqVUZYNjFZSDIzaTZUSjV1Y3RCNkdNa0RVVFYzeldWaTlmNEJBZw?oc=5
2026-02-17	Yahoo	0.5	Top Analyst Reports for AbbVie, RTX & IBM	AbbVie leads today's top analyst picks after beating Q4 estimates, while RTX and IBM also draw attention for strong results and growth drivers.	https://finance.yahoo.com/news/top-analyst-reports-abbvie-rtx-211300445.html?.tsrc=rss
2026-02-17	Google	0.5	Top Analyst Reports for AbbVie, RTX & IBM - Yahoo Finance		https://news.google.com/rss/articles/CBMiggFBVV95cUxQcFptM1k2YmpwX0l2c3NUSGZXX01xcGEwYWducllqODU3R3FFOEM4VTgzRkNJZHExQzU4U2MtcWtFLXNrU0hTdk5ZT3V0WjN1MzhPNGFJRWNlMUV2anhjaDgwWjB1QkNyMFU3UklEQnBPSjdNeHRxOHNTbU9NUWFqSGZ3?oc=5
2026-02-17	Google	0.433	IBM Stock Slides despite Strong Backing from Five-Star Analyst - TipRanks		https://news.google.com/rss/articles/CBMilwFBVV95cUxNdjVDXzhpYktuNGtReFFDWk16ZDViejhVYnFxcG0xaGI3M3dDZEtXaU9fT3NsckN1Y2dvS1pyY29YanFkUlFlaTZGY2ZqOEU5Y04yaWo4WU10ZGFyTFplcHV2cFVCS08yQ2gtQnYtZFdsQ2wzenIzUUVJdU1DUE9qQzFuOVp4ZEtVczlsREpZMDNiSldobjRV?oc=5
2026-02-17	Google	0.136	Confluent agreed to sell to IBM. Now, it is moving to a new Bay Area city. - The Business Journals		https://news.google.com/rss/articles/CBMirgFBVV95cUxNYjhMNllUbDRUMWg2TjF4S3FQellRZUFQb0p3VVhGLWVtRjNkT190TGJVQnd0OTV4QXFSd3BkR2I1UHNiUUNic1FrZzRjMVVMU1NMMW8tSVhhVmJGNktyRXdETVdPeHVSc2VGUXFnWWNqU29Ba1cxb0Z6bFphcWpYd2pmTUNNYTNKQnY3S0QzWFE4QzRBWHdxYVRYTVhtdnB5NDhuZGtsRWpDNHFNSEE?oc=5
2026-02-17	Google	0.0	IBM's free-cash-flow goal of $15.7B for 2026 appears beatable: Evercore - Seeking Alpha		https://news.google.com/rss/articles/CBMiqgFBVV95cUxOeWVLa1I1ZGVnUEMzTXZ5RDVDbGZNbklOc1ZBaDBlTlZISVBzRldybjZSaGFtcTlyZmdBYUZjZjF6NFNIZVlfdlJ1eHppVTd5NGw3Vk9nMzZoMFBOMU1IN1ZGbXIwYXExMVlsSzJjQTB4M0FLYm43U1ZGU0R2LVc0WDVjMXkzb1d6akRIbkpZeXNmSnM3bGVlcFdOSHdsNnhpZnZXblhNT3g1UQ?oc=5
2026-02-17	Google	0.0	Strengthening IBM’s proven enterprise software for the AI era - IBM		https://news.google.com/rss/articles/CBMinwFBVV95cUxOZDZQQUhQQmZZSkdKSFItVGowT1B1bHhVSGkyS1F4RmNldWVnZ0tPSzEzaHBXX2UwSmxLcVhKVVBtV0lTOTc0ak9OcDlFUER3aDJIREhHMVR2NWNNQmRmVndiRlBqWmRJeFBXZFZEazY5azVocjN2Q0haNno0WVFfdFZva3pDSWU5TVNMUm9YbnRmX0o5UjQ5QjFaTWNjNTg?oc=5
2026-02-17	Google	0.0	The biggest data trends for 2026 - IBM		https://news.google.com/rss/articles/CBMiZkFVX3lxTFBrQ3RCSU43NjMyYUJEUk0xSTMwQl9VVmhLX01wNzBFYnRGMktqNU0zRUJ4ZjdUejVodmVma1cyWGNhQ084a1Jyc1hHY0dLcDBWcThRVkJCdldEdGZtdEpJNEVIWlpRZw?oc=5
2026-02-17	Yahoo	0.0	Thousands of CEOs just admitted AI had no impact on employment or productivity—and it has economists resurrecting a paradox from 40 years ago	In the 1980s, economist Robert Solow made an observation that reminded economists of today’s AI boom: “You can see the computer age everywhere but in the productivity statistics.”	https://finance.yahoo.com/news/thousands-ceos-just-admitted-ai-183249115.html?.tsrc=rss
2026-02-17	Yahoo	0.0	UNCG, SparkNC and Guilford County Schools launch landmark partnership to prepare students for technology careers	To bridge the gap between K-12 education, higher education, and the global workforce, SparkNC, UNC Greensboro (UNCG), and Guilford County Schools (GCS) have launched North Carolina's first SparkHub. This new learning environment is designed to connect high school students with innovative higher education experiences and in-demand technology careers.	https://finance.yahoo.com/news/uncg-sparknc-guilford-county-schools-201400725.html?.tsrc=rss
2026-02-17	Google	-0.8	IBM stock suffers worst weekly drop in six years – retail calls it ‘generational’ buying opportunity while analysts remain cautious - MSN		https://news.google.com/rss/articles/CBMisAJBVV95cUxPc0FoeTBmWkdIWDByVk9XMlk1OVJDTjJ0WG5HU0ZBN0s1d2l0ekxUMGV2aDF4ejBtRndKaGhEVkU5MlI5WnI4U0ppWmdmSkhzRW9PUDZRSnh3RFBUTl9SbGRTMi1Kbmtxc1RaVVBsNmhwYXIwRXQzQU05TlU3RUZOLTZuRHhSNnNBT1RzN2tJT05wQ2dMVnpCb2FOQ3RwNXhiVnQ2WVhzcjc2anlDWmlIUWlZLXVJQnFPeXhQWXFZdnJ2Wk1FQ1NwdUloUDJ4Z3c4V1FzakVYWTRPdndQNkhBekY2VTY4X2JvTUJlTWF6eG5JZlNDSFQyanQ4al9aSjk5VWZsQjBlWnNnSnpvclhIa1NfVUpiNE54UFhleHhmbVJlZ1dXOENRbGhkTXJDcDNX?oc=5
2026-02-16	Yahoo	0.5	IBM vs. Intel: Which AI-Focused Stock is the Better Buy Today?	IBM edges out Intel with stronger estimates, cheaper valuation and hybrid cloud-AI momentum despite fierce competition and margin pressure.	https://finance.yahoo.com/news/ibm-vs-intel-ai-focused-132000518.html?.tsrc=rss
2026-02-16	Google	0.25	IBM triples entry-level hires for 2026 despite AI adoption, bucking industry trends — Chief HR officer says that AI can do most entry-level jobs, but work still requires a human touch - Tom's Hardware		https://news.google.com/rss/articles/CBMi5AJBVV95cUxNM0o4VDdXQzFfTEhhd2s0cHZsYmlOcVJvUnVRYjhSVk81eGVMRmFRSmV3cEpsLVZUT2JJVGhYVEstYjdiNVZaNXN1UDZyd2tPbXVHSWxLZEh3dGxwS3N3ZkVLOFFhdUhKalhCWG8xSFg3alN4d09uellLX3pPc3B1VUpKRVRHVW5HTENRSDIxNTJQekstYTZVLUl6QW9iY2EtVlZ3QlEtMFFzY09pZi1kaVNCa1NuZGpMbjVGTXpDdmh4OVdDb2dvZHBQbEpjd2FTVnZTZ29ub0p5Yzh4VFNpeVQtODdhYkNXeE43VFVzN2IxR3dLY21LVldTbWhNbjRabE4tbTZTNThRbzl3emdQY01PU1RTMDYwMkRMRmFENXhVdEoxY3RJRjIxam5RVWFuVUE3TWVYZVRkOFNTWlIxbm1LVFBld3prMVJpbVVmWW0yVnhUTGE0ZV9MYTlLSDRvTHZ2cg?oc=5
2026-02-16	Yahoo	0.218	IBM AI Criticism Tests Value Of New Storage And Defense Wins	IBM (NYSE:IBM) is under public fire over its AI strategy as influential market voices question the company’s direction. At the same time, IBM is rolling out one of its most significant AI powered storage systems in years. The company has also secured a multi billion dollar defense contract that leans heavily on its AI capabilities. For investors watching IBM at a share price of $262.38, the debate is not just about headlines; it is about how sentiment matches up with execution. The stock is...	https://finance.yahoo.com/news/ibm-ai-criticism-tests-value-200928996.html?.tsrc=rss
2026-02-16	Google	0.218	IBM AI Criticism Tests Value Of New Storage And Defense Wins - Yahoo Finance		https://news.google.com/rss/articles/CBMif0FVX3lxTE15MU0zc1Z4bG5jQmFaQ0UwVkI1UzNfRXloaEZIdFFTVE1IWjZUUWEzOWNCTktSLWxrNDhsbU11elVnbEU1OVhEZG9lbk5xZUdXU01UVkdXa0hyMTZ4SHl4UmFwMnRPNHNDV2pKMnhvMUpiZlFMMUgtLW1Pa0Q1THM?oc=5
2026-02-16	Google	0.136	IBM AI Doubts Grow As New Products Launch And Valuation Discount Widens - simplywall.st		https://news.google.com/rss/articles/CBMi4AFBVV95cUxQY3A5TzZURzN5bDFyTlhWMlpsRS03MDJmbFk5ak9mcnEyUVpOZW9RMENWYXJSYW5wdy0tUjdETzBNVlRtRWJ0Nzk4WWg1anc5V0dtVGh4SU9Zam05QnRnelJ3eG93dEZYLTB3RVVJYzM5RlZRVGEzdGFBMGpZVzczOVIyUGFNRl9BdFFhTDV2dEdNeURqQVdwVGhsZ01TMkwxempYRXBUS2t5R0UzUEtnQXVCV1Zmb1lpdWs4bFc1S1FFN2dHOG90a3YzQ0dZbHlIRXBRaVZDZXhfZ1dHbFRrcA?oc=5
2026-02-16	Google	0.136	IBM’s New FlashSystem Might Be the Blueprint for AI-Driven Storage Resilience - The Futurum Group		https://news.google.com/rss/articles/CBMisAFBVV95cUxPV1pWMjg1ckRYX0xWZDRrMkRnb290WWI3ZUxUWjBaUllvdHVBblRQdW85bGZpalhOcjd3WF9XcjJqbkpZSlZiOUNoSUtKODJCNUg5NGVHRlFudmltOTltT2t6OWZXMHdEeVlzSFJKWF9iVDhUVUdDbGpUUFVPenJMeHdfdTNSNV84VEI4WEh0SXQ0UkNkRXRQRlhuTTh4SVlsNlBZRzNWMzlFUHZ4RmNFZw?oc=5
2026-02-16	Google	0.1	IBM wants to take entry-level jobs to the next level - Morning Brew		https://news.google.com/rss/articles/CBMioAFBVV95cUxONTUzMUI2OUx6VzdwTmxWRDlqSlFBUmdLSDNGaHl1eVNTbGliYmtTdlRKdGVxWTJ2OTJUZWZUZXZ3VU1HTFZPTHhKek45S2NRTzVvdzhFNXpzT1lDc2tZU0prcm9Nb0xXUTdndzI4UGZkUGhSbG53c2VHbXJyaEZ4bnpJNGNpUm8wV1ZZMk00UUp4dDR2MFkyVGRCZEdFSWZy?oc=5
2026-02-16	Yahoo	0.0	Confluent Shareholders Back IBM Deal As Valuation And Growth Stay In Focus	Confluent (NasdaqGS:CFLT) shareholders have approved the merger agreement for the company to become a wholly owned subsidiary of IBM. The approval followed a special shareholder meeting, clearing a key hurdle for the transaction to move forward. The companies are now advancing the integration process as Confluent prepares to operate under IBM ownership. Confluent focuses on data streaming software that helps enterprises process and act on data in real time. For IBM, bringing Confluent into...	https://finance.yahoo.com/news/confluent-shareholders-back-ibm-deal-211004115.html?.tsrc=rss
2026-02-16	Yahoo	0.0	Global Neuromorphic Computing & Sensing Market 2026-2036: Intel Hala Point (1.15B Neurons), IBM TrueNorth, BrainChip Akida Commercial Scale and Rising European & Chinese IoT Players	The Global Neuromorphic Computing & Sensing Market 2026-2036 report unveils new frontiers in AI hardware, spotlighting brain-inspired processing technologies that offer unprecedented energy efficiency. As data centers approach 3% of global electricity consumption by 2030, neuromorphic solutions, led by giants like Intel and BrainChip, promise transformative applications in AI, IoT, and more. Explore future market dynamics, key technologies, and competitive insights for strategic growth in this r	https://finance.yahoo.com/news/global-neuromorphic-computing-sensing-market-093000515.html?.tsrc=rss
2026-02-16	Google	0.0	IBM Plans to Triple Entry-Level Hiring, Even for AI-Exposed Roles - TipRanks		https://news.google.com/rss/articles/CBMimgFBVV95cUxOOGMxY0taVFVlQXZpMFVQd0hTRzBDODNNS2ZacUFXTDV1RnBnU1lUMmpJTEZmNTZzcmJFWnRIZDRVbkoxaG5ncGxsU25rX0dnemJUWG15MmVlbUNkSWhyZnVrUXJZcDdDelhQd2ZuVVk2RXdBV1Zmdk5mSWZLNFlLdFJMMGVkaGI5MzgyZU5iQnlVLXRucmRCRVB3?oc=5
2026-02-16	Google	0.0	"IBM says it will triple entry-level hiring for roles ""we're being told AI can do"" - TechSpot"		https://news.google.com/rss/articles/CBMijgFBVV95cUxNZEgweVJ3d1VrclJUR05nNUw1RE5WLU5RNHhmSWtBdDdkb2FvcmY1a0ZKb0RNZ2JJNGE3YktlcndicFZJc01JeDhISUFjYWpPWmUtVmhsVDlpV2ZuQ0g0Rnkza3d3RExFVGhIWjhwMl8ySURmX0NjdE1SU01iZnRwZnJpRG1rcEd6aGZjRmh3?oc=5
2026-02-16	Google	0.0	IBM to triple entry-level hiring in US - Computing UK		https://news.google.com/rss/articles/CBMiekFVX3lxTFBfY1VmVC1XT011SGR0clV3R2NIb0NoZ2RMVDQ1Y0ZRelU5UmdURE9LREtYNmVwa2lHTkNKRnBZd3FnMGZ3VVB0d1lPeGpndlJ2SUJzVDU1Z0tvZ0xMeTZjR2NvN1llYzQ4RTFyZjhVMDZBTFNfWlhsa2pn?oc=5
2026-02-16	Google	0.0	Retrotechtacular: Mr. Wizard Jams With IBM - Hackaday		https://news.google.com/rss/articles/CBMifkFVX3lxTFBWOFZ4TE13ZHYtdEZnbHlkX3JCRUNHOEZ1TktxRTdxTHA2SDUtWlI3R2NCNUdoRk5tdkV2TTV3VGdvZ25mUlMtR0hsaGRnSFNDRTE4NlJGY0hWNUdXTC1lX3pWa3AxWGV1V005cVdfdmJIcE5XQ05wU1I2cnVtUQ?oc=5
2026-02-16	Yahoo	0.0	XRP Gains 2.6% As a Wave of Ripple Partnerships Are Announced	XRP (CRYPTO: XRP) is trading at $1.4731 on Monday, up 2.6% from where it traded a week ago. Overall, the token trades 19.6% below its January 1 price and 59% from where it traded during July. Looking across the broader crypto space, Bitcoin (CYPTO: BTC) is trading at $68,674 after declining 2.3% for the week, while ... XRP Gains 2.6% As a Wave of Ripple Partnerships Are Announced	https://247wallst.com/investing/2026/02/16/xrp-gains-2-6-as-a-wave-of-ripple-partnerships-are-announced/?.tsrc=rss
2026-02-15	Yahoo	0.0	IBM Expands AI Focused Hiring As Shares Trade Below Valuation Estimates	IBM (NYSE:IBM) is tripling entry level hiring in the US, with a focus on AI fluency and durable skills. The company is redesigning entry level roles to emphasize customer engagement and work that is less exposed to automation risk. IBM is positioning early career talent as central to its future workforce plans, despite broader tech sector caution around junior hiring linked to AI automation. For you as an investor, this move provides another data point on how a large, established tech...	https://finance.yahoo.com/news/ibm-expands-ai-focused-hiring-091019228.html?.tsrc=rss
2026-02-15	Yahoo	0.0	Is Quantum Computing Stock Going to $0?	This quantum stock may be more hype than substance.	https://www.fool.com/investing/2026/02/15/is-quantum-computing-stock-going-to-0-qubt/?.tsrc=rss
2026-02-14	Yahoo	0.1	Accenture’s Dividend Won’t Wow You – But Maybe It Should	Accenture just paid shareholders $1.63 per share on February 13, 2026, marking the latest installment in a 20+ year streak of consecutive annual dividend increases. But with the stock down 41% over the past year and trading at $224.08, investors need to look beyond the growth streak to understand whether this 2.6% yielder still deserves ... Accenture’s Dividend Won’t Wow You – But Maybe It Should	https://247wallst.com/investing/2026/02/14/accentures-dividend-wont-wow-you-but-maybe-it-should/?.tsrc=rss
2026-02-14	Google	0.0	A Look At IBM (IBM) Valuation After AI‑Related Tech Selloff And 4.9% Share Price Decline - simplywall.st		https://news.google.com/rss/articles/CBMi4AFBVV95cUxOUGd2VkxoQWlGSEN3REt1MEVKU0ZNQXEzeWpzS3pzUEF4MGI3UW1CeTdtS2JMOXlPYm9leW42V3RENkNDcmlzUUxtcUJSMVN0UmRGY1VEX1ZLdng5NFV0Wjlqc3p2V0dsLUNIMFBrd0N3aGJBdVVwdE9ZZzZhTGJfMkhmX3RSXzlfY1dTdFdEM1RTVnM5bjFYcm05dkNJQWx5RkhUS1F1NnB5ZlE5STRTMzFEVktyel9Pbkd5MXFULVZfYmJLUHk4ZWtTNkRXTl8xTGdPOVBoR19FTTk5WTRrVg?oc=5
2026-02-14	Google	0.0	Blockchain Goes Big: FedEx Joins Google And IBM On Hedera Council - Forbes		https://news.google.com/rss/articles/CBMivAFBVV95cUxOMVJxODU4LTZZeXJlWk1YRzFselYwZlNsN2NmanBuREQ4WV9pZ0JqSnNZckw5TzNpdDFGN2ZPcGtuenFqRm5PV0NTU2RsaElDS0dKS3ZtTzlvUGNZUkxBbFF2R2VYV3poRTE2RFA5RTFHczBkWVhaU3BtajAtVDVzb19sd0JIYWNadFV1VWY0enJ4UGsyRFk2ekpEVUVxeXgzamZqeXFUSFFwWEZZX3ZEYlN3U01iUVZfelllWQ?oc=5
2026-02-14	Google	0.0	Designer Kate Barton teams up with IBM and Fiducia AI for a NYFW presentation - TechCrunch		https://news.google.com/rss/articles/CBMisgFBVV95cUxPT2ZHUVp2bDhPQkFJTzl5S3NpNFhjOUVuajdSalN0eW9kSUtNdjItRWcwZTJibXlpVW9VclJIUVRQbV9VWkFVTEg4dkRMTFBqYXlGdHZsckNFVElBMzVZNk9qYkRSd0FWQzRNanl2YU9VR1QzZmF2X1NVNFZPS2dDWENienN5aVl0SXY1ZkZ0MFZKUkpXZHFMRXcyWGk3Snc3ZF9yTXM4WU9QV214dndzQWxB?oc=5
2026-02-14	Yahoo	0.0	Phonographs, Player Pianos and Betamax: The Inventions That Transformed Entertainment	These 10 technological marvels had cultural implications that its inventors could barely have imagined.	https://finance.yahoo.com/m/a5b11ac9-f2b5-3f68-81ae-f025966f95b5/phonographs%2C-player-pianos.html?.tsrc=rss
2026-02-13	Google	0.0	IBM is tripling the number of Gen Z entry-level jobs after finding the limits of AI adoption - Fortune		https://news.google.com/rss/articles/CBMivAFBVV95cUxPTTM5SXFBemtpc2FNWHRSQjY3ZVJuZVdfRHhoX1hDOU9aTTAxUGF0VzRjZG1qVUhlVFpUQTNIZE8tQ2tvazI1MkhKajZyMUduWjN6dmZ5VFFrUE5kekppd3lTdnVSOGhNWUpYamxrNTJ1SGNqWXIzOVZJZ2hCWks0NGQ1Q1hHNTZ4OFNsMk12dnNDMlVIVFdIa2N3LVVkeHNtemhnOGFDU3dMQ3Iwbk5QSURKNG1sSlB3OUxrVQ?oc=5
2026-02-13	Google	0.0	IBM plans to triple entry-level hiring this year because of AI - Axios		https://news.google.com/rss/articles/CBMiXkFVX3lxTFB0bV84cDJ1WHUzY19VaXJxeTNaU1hoTDlSYXpVSnYwQUZsOWpxd0VtNDRpeDF2Yjdsa0Mwb3B0SWM0dlNxbmU0a2xYdUc1MWhDSzlGMHFtQTU4MjNWWVE?oc=5
2026-02-13	Yahoo	0.0	Rigetti Roadmap Targets Commercial Quantum Systems As Valuation Flags Undervaluation	Rigetti Computing (NasdaqCM:RGTI) has outlined its updated quantum hardware roadmap, highlighting targets for higher qubit counts and improved fidelity. The company is reporting progress toward commercial grade quantum systems at a time when investor attention is focused on real world performance and use cases. This effort comes as competition intensifies from large technology firms such as Google and IBM, which are also investing heavily in quantum computing hardware. Rigetti focuses on...	https://finance.yahoo.com/news/rigetti-roadmap-targets-commercial-quantum-061215569.html?.tsrc=rss
2026-02-13	Google	0.0	Short Seller Jim Chanos Calls IBM an AI Risk, Not an AI Leader - TipRanks		https://news.google.com/rss/articles/CBMilgFBVV95cUxQNGVNYnQ2Uy1ybHZySGxSMEFWQWQ4Y0dxckJqN1JoazlJdmRhZkFFM1plemhjRFloUjh1RmRld0NlN0plWHZ4Ui1QTTc2cFplbzVfT0JsbDd0MVhiX3Vja05ibTl3U2tqQzZLa2hGOFpSWVZibW5YVlVORF9BUmJDa3hKM3ZqclNIbmJBeWgtbVQtamlDV0E?oc=5
2026-02-13	Yahoo	0.0	The Year of the Defender: Why 2026 Demands the End of Siloed Networking and Security Teams	INE Security Introduces Cross-Certification Pathways to Build the “Hybrid Defender” and Reduce the $1.76M Risk of Fragmented Technical Teams The Year of the Defender: Why 2026 Demands the End of Siloed Networking and Security Teams INE Security Introduces Cross-Certification Pathways to Build the “Hybrid Defender” and Reduce the $1.76M Risk of Fragmented Technical Teams Cary, NC, Feb. 13, 2026 (GLOBE NEWSWIRE) -- As digital infrastructures grow more interconnected across networking, cloud, and s	https://finance.yahoo.com/news/defender-why-2026-demands-end-153000549.html?.tsrc=rss
2026-02-13	Google	-0.15	Turning IBM QRadar Alerts into Action with Criminal IP - BleepingComputer		https://news.google.com/rss/articles/CBMipAFBVV95cUxQU3NvVGN3V29RQm5kV3JhY0gtckMxVnBDM082dFY2clpJWGhaVDNSR0xNUVpXVFc5Ty1hNTROeE53OFlKQUtHbmdnYW5QbHpnWmg2eTVtQVJlcHRUSGlSNXZYQm05Qkp1SXBGZkk1WjJxdjI1UGlqU21rMm94RWs1eFAtM3EzOTdqeGJjNDBWNHJva2dCeHNGWXNQbl9RQ2RWNmpqYtIBqgFBVV95cUxOV3hfWTk5NFhFVVU5WFZ2WE9qSlFNSGI0NEM0TzFpbmpyQk52ZDZYUWJoeGVUZ1BxQk55TGViUkxOTEFBbGMwemNGcTlYdnJ1QnF2VVo0dG8tNklKa0FzUmZuZmJlMXRmdGNYSG1CbHUycHdmU2ZKaXQ0RHlJbHZ5U0d1RGxtci1JSW04c0tRWjk4NnJzMnF1SjlkVHc3ZDZBT1R1cHhTenB2UQ?oc=5
2026-02-12	Yahoo	0.393	2 Reasons IonQ Is the Top Quantum Computing Stock to Buy Right Now	This early mover in the quantum market has a bright future.	https://www.fool.com/investing/2026/02/12/2-reasons-ionq-is-the-top-quantum-computing-stock/?.tsrc=rss
2026-02-12	Yahoo	0.0	Equity Markets Drop Intraday; Oil Slumps	US benchmark equity indexes were lower intraday amid notable declines in the technology, energy and	https://finance.yahoo.com/news/equity-markets-drop-intraday-oil-185916111.html?.tsrc=rss
2026-02-12	Yahoo	0.0	IBM to Triple Entry-Level US Hiring With Roles Recast for AI Era	“And yes, it’s for all these jobs that we’re being told AI can do,” said Nickle LaMoreaux, IBM’s chief human resources officer, speaking at a conference this week in New York.  LaMoreaux said she overhauled entry-level job descriptions for software developers and other roles to make the case internally for the recruitment push.	https://finance.yahoo.com/news/ibm-plans-triple-entry-level-204809938.html?.tsrc=rss
2026-02-12	Yahoo	0.0	IBM will hire your entry-level talent in the age of AI	IBM plans to triple its entry-level hiring in the U.S. in 2026, but these jobs will have different tasks than in previous years.	https://finance.yahoo.com/news/ibm-hire-entry-level-talent-232317039.html?.tsrc=rss
2026-02-12	Yahoo	0.0	Stock Market Today, Feb. 12: Palantir Faces Valuation Scrutiny Despite 70% Revenue Growth	Even after 70% revenue growth, Palantir's premium pricing remains under scrutiny as investors weigh long-term AI expansion against elevated expectations.	https://www.fool.com/coverage/stock-market-today/2026/02/12/stock-market-today-feb-12-palantir-faces-valuation-scrutiny-despite-70-revenue-growth/?.tsrc=rss
2026-02-12	Yahoo	-0.25	Wall Street Marks Worst Day in More Than 3 Weeks as Tech Leads Sell-Off	US equity benchmarks logged their steepest single-day declines in more than three weeks on Thursday	https://finance.yahoo.com/news/wall-street-marks-worst-day-215945192.html?.tsrc=rss
2026-02-10	Google	0.215	IBM Introduces Autonomous Storage with New FlashSystem Portfolio Powered by Agentic AI - IBM Newsroom		https://news.google.com/rss/articles/CBMidEFVX3lxTE9FcERzQ0lNUFlTTkJZRnBNVXI1V0VYRnBJY3FMYVd1QlpIMTdiTjZOTzdJT3I1UzB6U1g4SXpwMEZZalVTU3ZJZmp3cVl1SnVLY0ZqNTR4aHZjSXo5bEZaMk1oMGF1RXh5d1dwdEs3YmxOSkhP?oc=5
2026-02-10	Google	0.0	IBM | Founding, History, & Products - Britannica		https://news.google.com/rss/articles/CBMiggFBVV95cUxOVlFvQTBWZnExQ3lTY2l4bmlzWGlZcmdNQnlMdm13dmk0R0VLMVktdFlIdFN1Q3hNOHdUbGxHQ2lsWVNyZGhoendqeEVQNHdhZW9OMkFNcHNjek80NE1ody1JeVgxUmEzeWdHbFFhSVRsMFl1a3dqbkdWSnJEWVM0WnJR?oc=5
2026-02-04	Google	0.0	IBM Opens Global RFP for AI-Driven Solutions Shaping the Future of Work and Education - IBM Newsroom		https://news.google.com/rss/articles/CBMivgFBVV95cUxNZjNTRnNMQ0V6RTBhVlQzREdSRTQyTTkxdDU3LVFCeHFHREZsR2E4cGJaMnhZdnJ6cDRRel9IanpMaVlzeFBGVjQzOG9NdXlWeUpCR0RvdXJjbnM4WkFwUlExRHB2X2xfMHlZTFIzeHpMLTE2ajhvWXZUN3hhYVJiVG9hZ1NtMjMyNVVyYzdjTW12YmNrXzA1OURRWTcwSEZvc3llbHNQUzFIOTRMMnNlYW5UdEN2TEVIRFliYUxn?oc=5
2026-02-03	Google	0.375	IBM CEO reveals when they’ll know if quantum computing is successful - CNN		https://news.google.com/rss/articles/CBMimwFBVV95cUxNU1JEbVg5YkpjR29Id1AxTEpzSDRGQ0NzekoyZ3BabVBlVWV2TFZMYWEybDB5bmlnUUVFRlQ1cG1aV2o2eDlSY1hsQ0VNY3lHdU83REJaVjJXcmZCSG5lQksyLXByeVNXSUIzVmxzbUxMSHhUeHVnaEVyQVhBWmNjbnpYT2E4bFFvcHJ5R05aTlg0S29ZMlppVy1WRQ?oc=5
2026-02-03	Google	0.0	What Is Claude AI? - IBM		https://news.google.com/rss/articles/CBMiVEFVX3lxTE5CTThNdHhIbXZWOThUTGRIUTdlMmJLYWQxaFhGeWxWNktDejdmdDY0V2FlQjJpckhnbWpQdERJWDg2Vmg1TjJPZWRlSHB3a1BiLXRhRw?oc=5
2026-02-01	Google	0.0	IBM exec says Trump's Fed pick will 'overhaul' central bank policies while bringing crisis expertise - Fox Business		https://news.google.com/rss/articles/CBMiyAFBVV95cUxOMzBHcEM5Y0pZVEs3TXNydE02QnpLNFY4WkJNRk9UWEhCNmw3Wm1uVm1rRVFzQ0Vpb2c5YWZtQkRhZlNRT0JsY195N2hiT3FXa1U1dFozVGVIaHNWZm1qenl0QmpZU2l1RXRFeElFRHdVOTRDWWJ1cmdMeXVNeXl6cGluNWV3ZXFKM3JqMHNaTExCVmticG1KSlFLZDNqNUlzUDJSdkJxZk51R3BuM200b1VjRkVrZ1ZkeVdhLWV3MG5wMW1jdWp5RNIBzgFBVV95cUxOX182UUJISEFycVNGeklsQTVNSXRuWmdrWlNZMERBTnZHVXRTZFB5dlpuSlpmbU44QW81SUFLRzE0N0JJYzR4Rllfa1JMUEVoaW5LY0EtcTJYUzM4TmZuQkFNenpoUUoyczlnSXFWcnVUdHpUbjItY2RUSlNhenl1R0JOSWhHYVZBWjZDYUVhbWRxRm5QS2tPTWV6M1M1NmVlaU1aUVA1TEJveXRka3ZhN1hHY21qRTBCUDJuQ3pUZlZYZ0N3OUZsak5VZE5hUQ?oc=5
2026-02-01	Google	0.0	Ponder This - IBM Research		https://news.google.com/rss/articles/CBMiXEFVX3lxTFB1bC0tV0Y3ZlJwNTBCNmgxd21uYWg5T1Q4MHdLS2tHNDh0MVh0ZTdaMEhRaUdZaXFPLTlVMWQ0VVc3SDZOM0JKLTBLSWJXaTVHMjdYdjl1M3RDMHhq?oc=5
2026-01-29	Google	0.0	How IBM became an AI darling - The Economist		https://news.google.com/rss/articles/CBMif0FVX3lxTE9pOERid1FNODFCUGpna3YzY0RkeXd3Q3FUZWQ5MWcwRE54S2JRZ0hXYV9vYlp5SGhpTE9fVkF4SjhKSUwyazNGU2c4bC03dTVSek44Yl9taVZjYzBIdWdidkM5dzd5dXYwUDlZdmtQQk4xUm50N2lYbTdlSFFSMkU?oc=5
