Date	Source	Sentiment	Headline	Summary	URL
2026-02-22	Google	0.307	RBC43 Replacement Battery For APC Smart UPS - Genuine CSB Battery Pack | Compatible With SUA2200RMI2U, SUA3000RMI2U, Dell & IBM UPS Models - umlconnector.com		https://news.google.com/rss/articles/CBMimwFBVV95cUxNclRuUjVxbVNsOVZXYmI3aW5MRi1ObEdtZF9DcEdVWjZKczZtbUZUcjdKTy1wWkhremJzeVBNVVY0Y210MVN2WXJuNVV1d2drNVVhVGNqcUxpcGFMcUZOcm51ZFlJSVVxTXlLcmdJTDBHNkhGeGZqN3F4cHdicFFORF9SUzBCVGMwM25wWmRBNmNCcno2TXhTUDV2Yw?oc=5
2026-02-22	Google	0.018	"UP CM Yogi inaugurates IBM AI GovTech Innovation center in Lucknow, says ""India reached new heights"" - malaysiasun.com"		https://news.google.com/rss/articles/CBMi1gFBVV95cUxPTHVON25LaV8zUzJlX1lxc1RhV2hRdEdhbUlIYkE3UUpYVFdzNzRTcjA4OGRQektsOUVwNmZXYjQ4dE5ZeDltVTBDVFUwVG9zdmtHRk9WZjJlVWVGOC1abWtuMU0xQ2M0bzRpOTY1dmlTUWZ2ZGdYYTVDNnU4VWVSdzlPNGFOWHF6WXI5WG9vRHdYV0RHVGVrZnlTNjFlWnoyY1g1NUxjTE1nMXNwVFViUnJJODNWTG52czhpWmVUQTRPS1hRcDluNW5uTXVMcUZ5TmJjN1N3?oc=5
2026-02-22	Google	0.0	(IBM) Volatility Zones as Tactical Triggers - Stock Traders Daily		https://news.google.com/rss/articles/CBMivgFBVV95cUxOeEs1cENRemJocHppeUVWaFU0LXBHcWhEOFc5Z0NXcDhwNWY2UEZhMlFpc0c1WDJ3MHRmUVlSWV9zRXpDZWxsellsazhpV2J6LWtJeVhRQXVOQ1lLMFRKZlhWYi1YcmFmdmRMNERDSW9JRGJmeE5FSmx1eG9YWkp6cDNRMV9kT193aFU5NHRZa0hJUUl6aUpibktKTmU2Q3E3MC1MMjdlOWYta0IzSTBOb01LRGdUVXBYVEQ2dzV3?oc=5
2026-02-22	Google	0.0	Inspire Trust Co. N.A. Purchases 5,000 Shares of International Business Machines Corporation $IBM - MarketBeat		https://news.google.com/rss/articles/CBMi6AFBVV95cUxQUGNqNHFNSVVVZ2RwTDZVZkV0VmVqNUVIeU5YaW1fNlpDT3dGNXBFaE9XM2xFR2RtYVlkLWxrQVBoVUozdjdmNVJuSnV5TnBjVGVnQUdhUlNrWXN4U3owRWVwZ0ZvdEZRV3hZdWJtNno2QUJSWU1Sa2hKVUxBclRnMl9DN3Z2RmNtcUoxX0VqVXh1WmJBS1VnQ1EzUmFnd3RJb1V3d0cwY0M3ZTNSTXF4OXRHOE1ySFNQT01YOVJfMlBFOW9UTjRZVTZPSVRqbzFTZTVMeVpWMWVqaHdUUDVIUjlPT3l2bXlM?oc=5
2026-02-22	Google	0.0	Sigma Planning Corp Acquires 3,111 Shares of International Business Machines Corporation $IBM - MarketBeat		https://news.google.com/rss/articles/CBMi5wFBVV95cUxPRVRZQWZZNW9Bb05EeElscG9ZN0g1YmdTd0JWSkFzcmd1d3NMSS1CZVViUXZKUXBrVUNRYUlnbmZlUlViLUVhMFVCVG1IXzdNRWNqellPYUVvX3pDekN3MlhsLTlhU2hOLTJpS0NNRlh1TC1IYjNSdk9pUk9MVXlWWWFtc0Npd010U0NwVXE5WkU3QnZtd1BGSG5rVzFyc1lpb1JtZmdxV3VRNTMyR21BR0lvaldhaHQ2V21mODlXcXlwcEoyalJRcEloYjZzc1M2NjFZeUVjX0NQdHJISnk0ZmpjRkhvc0E?oc=5
2026-02-22	Yahoo	-0.028	International Business Machines (IBM) Cut to Hold on Weak Consulting Growth and Infrastructure Slowdown	International Business Machines Corporation (NYSE:IBM) is one the Top 10 AI Stocks in Focus on Wall Street. On February 18, Erste Group analyst Hans Engel downgraded IBM (NYSE: IBM) from Buy to Hold. Despite IBM’s positive AI outlook, the firm has flagged slowing infrastructure momentum for the stock, weak consulting growth, and financial pressures. These factors, […]	https://finance.yahoo.com/news/international-business-machines-ibm-cut-164836572.html?.tsrc=rss
2026-02-22	Google	-0.033	IBM Launches AI GovTech Innovation Center to Accelerate the Future of Digital Governance - CXOToday.com		https://news.google.com/rss/articles/CBMiwwFBVV95cUxQc2pfSjZKRXBEamMxYUR0ak9aUUJ1REJNbFRjMGl1Z01YMmtPWV85S25iVG81eVVtY1JHVE9iNzdMMU43QnZtY3VPSWNXaVBDa2lDWWtieFpxYmxHZExRakxpU1pXTTdaU2hpN19MUElLWGc4UWhDcURKM3R4MklCbzJyUEY5STVfcGkyN1lOdEZkejhtZjBPbkl5NlFEOFJJbTc3MncwVXlKSXF2V2E4NjRqX3o2aW5iOWtONWdYcmRhUlU?oc=5
2026-02-21	Google	0.05	International Business Machines Corporation $IBM Shares Bought by Empirical Financial Services LLC d.b.a. Empirical Wealth Management - MarketBeat		https://news.google.com/rss/articles/CBMimgJBVV95cUxPT1JtSFptVEFZU21xeVltQmthWHIxcVJZRDdFQlhDWVBCNzRCNWlEVzhyRERac3lSRVNJZ0t3SGtrZFczby1NMzlIenRNcjlmc2lGcEZadVY5RDRyTHhiSTkxeF9abUhPbFJQQW1CZUtpSWNmaXBDTUNoNXluZ0ZvNk9OWlp3cEt6QndLYS1YTzdBVTJ1bm9EMkNhX0ptXzNQRDJ6OFRUWXdxdmNPb3hzWkQ5TlFsUlRVeUdSZ2VkU0dUNm1vbWRLd0pqQTRRMUxZcnFmdlBSQ2VTWnZKS3hNYzcyVTIzakowRm5UaWtOS1FLcndGazN6cHBjRU5QYTJjVnAtWkZkX1BBRGhpNnF0VThCX3RXZ1ZBOUE?oc=5
2026-02-21	Google	0.0	Convergence Financial LLC Raises Stock Position in International Business Machines Corporation $IBM - MarketBeat		https://news.google.com/rss/articles/CBMi8AFBVV95cUxQQkQ5Rm5CNXdCV2FBVWo5N1QzYjR0alZpYktaRm9rbmxMX0JDV3FBZnFHQjF2VEduc1c2NG9EemwyS2dKbHgweWpEUWcza0VlMGpSMnVuQUhTbDlTSlFBeDV0a1AyaWZNYXFCYlRvaElnYkZVckZSS29GSkZOUm9LS2xld2VyRVhNUy1tQUJTQ2Vpc19WQ1Q1VlNwWFBHOURMRXQ0VkNpNlFXN255VjhVdmZydUV1amlDVWZMbmU0aGtsRVd4TFdFMUFwYUFOYjN2MU5BOE5fbkpockVPTFlLV1dkd0NBMWRCbTVPSkpaU2E?oc=5
2026-02-21	Google	0.0	International Business Machines Corporation $IBM Shares Bought by Journey Advisory Group LLC - MarketBeat		https://news.google.com/rss/articles/CBMi5wFBVV95cUxNUkM1VHp2RXlpamstb0tYMXAzUjZSRDdMbFBoRml5YWUzSEVGbUlSVEQydTdHc0xYUE5velNNelJjT05YWmVIUWI3amVOd0lnWEJYSGhJWjVoUXVYMldTRktwbmJOYkNYb2VaWV9Cc2IyaXhGd1d4X19ORHE5YXFNRjdrMW5wc1hKLWU0RkVQV2NfR1hnSVNZYWE0MWVvUGFZcHZmdGkxdkk2TTR2VGhOZEpCVm5FMHFXUXFQNFp3OVd1M0xzbnhzTGs5RmRfZk0zRjZZTDl5QW1obkpzdk9HVkZJRjNnX3c?oc=5
2026-02-21	Google	0.0	Is the Options Market Predicting a Spike in IBM Stock? - Yahoo Finance		https://news.google.com/rss/articles/CBMiiAFBVV95cUxQWm5IVHFPV093NHp5cUFpWEo3TWNIcm5jV1BtNnRRNXgtVXF6VE45TUxMaG5ySlhsWmdlR3JnVU1CVmZYQnZ4c3BuWVhaaDJ0aUhYWVBhSzBjM1FUMlhFSXRSQ0U1WnVFeTgwMTlTd2hKUXlsa1BRR3MwUW9QR2hBUXA1cUk1WS1P?oc=5
2026-02-21	Google	0.0	Is the Options Market Predicting a Spike in IBM Stock? - Zacks Investment Research		https://news.google.com/rss/articles/CBMimgFBVV95cUxQeEFwaklEckZQamd3cUdQb0liZ25jRjkySFVlOHdDS3BLVTJOSDR0NUxvalR1YlcxSDQxcV9kRVRwNFp4TTk4cXVFWVlnZjlvaVlLaEJoWjRsTVlOX1FmbXl2Qi1rZTg4aDFNcmFiRGxxT0ZNX29GdDh3Q0NmRm5OMEhfMDBjanRwY2VVc2t4Szk4SzRONUMxX3FR?oc=5
2026-02-20	Yahoo	0.0	D-Wave Quantum (QBTS) Joins Southeastern Quantum Collaborative as Inaugural Member	"LOS ANGELES, CA - February 20, 2026 (NEWMEDIAWIRE) - D-Wave Quantum Inc. (NYSE: QBTS) (""D-Wave"" or the ""Company""), the only dual-platform quantum computing company, providing both annealing and gate-model systems, software and services, today joined ..."	https://finance.yahoo.com/news/d-wave-quantum-qbts-joins-193000782.html?.tsrc=rss
2026-02-20	Google	0.0	Frisch Financial Group Inc. Sells 4,303 Shares of International Business Machines Corporation $IBM - MarketBeat		https://news.google.com/rss/articles/CBMi7AFBVV95cUxQWnlnU0ZUcWNiMGZXb0xMdUdVYkhNbkZsYU5hek5FTE9LU2tJVWdOX0Raelo5TTFNczIzNHJlbThtczRNUmQtMFVfVHNxSUtsZUxhNFNFYTA1OFpXMDJGb01uRDYwdEUtXzdyMTFaZ0M1aGduaVhQeGU1LWZDQ2l0OTNVXzVVRnl4MnNiS0ViTERaYzBaemhpMXE0ZV9QS0ZqeXVwbzVBdlZWLXZhYW96LXE1SGVOX1VoMllzVlJad2tkVmhXRE1KTm5CVEE5NXBIazkzVkF6aWcyVDJHVktvZFgyUnpNRW42eVZnZA?oc=5
2026-02-20	Google	0.0	Government of Andhra Pradesh collaborates with IBM, BharatGen and NxtGen to scale impact from India’s AI - IBM		https://news.google.com/rss/articles/CBMi0gFBVV95cUxPMmtpVzYyNTNBdEJXdDBVWFphZzFKVE1WMlNQU05oZl9SaFR1SmN6WGxyOGQwbVUzdTQ3bXNGM3hBWi1EZ2V3dUZMQmotaXJPd25uVzdRaXE1UlVPZ2ZwMWlOVXJNVXBTWnhfeC1WWHMxZ3JqUEp2dGg3YjN0Ymp0aHBvT1l6NkpyM1BZSnhSS0FQT1RkMElEOUhpa2tXTS1tY3h1M25QMWJWb1ZXaUMxSTVZYXZmV1RNYlRyV0JmY24xZS1zWk1SRUwtSl9XbDFEdEE?oc=5
2026-02-20	Google	0.0	How Low Can IBM Stock Go? - Forbes		https://news.google.com/rss/articles/CBMiiwFBVV95cUxQLUhWUXhlRUhxcXVLdmRwbFZOMFZSZkhCcTFmR3dpQmcyY1VCN2JDNE1xckVXRS16VUMzTHVjemt0TmY5aFFfNHNGLU1Dd3o3cEVnN0FfYThFSkx3cERnUGdGakVZU3dyOVFSZ0FBeUh4dHNyWWhmUy0ybF9VQm43dHhoUzZvMWtzZFBV?oc=5
2026-02-20	Google	0.0	IBM MQ AI Agents to accelerate issue resolution and improve messaging resilience - marketscreener.com		https://news.google.com/rss/articles/CBMizgFBVV95cUxOOENWVkUtYTNzUmRUVFhBamVKNk90NTNoamRxWVVjUHQxbXRiNWZiVldoaWRhaUdIM0xqUUktS1lDNFlZa0NsZ2hwR2ZxMTA0MDhhVkI2VnhWWnNUTDBPNm9IUHB5cVVpZGhMSGx4NndTaFU3bkY4b1ZwY0tJQlplbFdiMXk3Yk1OUEZCTGNXRWYyR19MczI0LWlieFR4RnMxWDRqcWlUcng3WjZyU1NFN2xxQ29Sb3NWZTJRWkRYQnJkYVVObzlZTUUxdFR0Zw?oc=5
2026-02-20	Google	0.0	IBM’s Duality Accelerator Drives Quantum Software Growth with SQK (2023) & QodeX Quantum - Quantum Zeitgeist		https://news.google.com/rss/articles/CBMicEFVX3lxTE9kMEhxWGFsVktwbEdUQWxQRFBreEZjd2M1Y2JhNGdaLVhfTGR4RmlHWDBnZnNYeDI4TGtmZ2NjWWRDX3JXN3lVbmlabmFhbDhjcVllS1dkbllXUEw0WEhoQW5oVFJRcE9tdnMtMDNxLUM?oc=5
2026-02-20	Google	0.0	What is a hierarchical reasoning model (HRM)? - IBM		https://news.google.com/rss/articles/CBMibkFVX3lxTE01ZjkwTEJnb2R3VEVjVjhRMXpPMFhQVUtINzFKdXd6OTVta0liSF9QV2JGajBVVXBiSmRQLURfSGljT1pCcFd1bGN5MWlrU1loUkJSQTBid3ZEcy0yY2xtd3oyMmM4ZnE5VUhURlBn?oc=5
2026-02-19	Yahoo	0.643	The Best Stocks to Invest $10,000 in Right Now	Broadcom and IBM are all reliable long-term plays.	https://www.fool.com/investing/2026/02/19/the-best-stocks-to-invest-10000-in-right-now/?.tsrc=rss
2026-02-19	Google	0.629	The Best Stocks to Invest $10,000 in Right Now - The Motley Fool		https://news.google.com/rss/articles/CBMikAFBVV95cUxPYmh1SkxvaTdhRU5aUDZ4NVA4dkFFVkZtY2l3RHIwOTBUajIyYVJyOGhEVEhMcko3cnYzeW1lUVhoTUZyQkR6b0t0WGlZb3N4WHVUdjQ1RUZNNUFRTjY5eVVsajRPSFMxazd3Y2lmRl9pbV95Ulh0dG9NVElKWGExWnhQMHQxMkxTTC0tcjFST3o?oc=5
2026-02-19	Google	0.55	2 Top Quantum Computing Stocks to Buy in 2026 - The Motley Fool		https://news.google.com/rss/articles/CBMikgFBVV95cUxQNm9MZDdxTk9IdFg1OE5mTHd0WG5OUk5zMDJ3d1c1RmJtc2VNcWh6RGtia2JfMXRJdDRjc2dnNmdWdmdBYWZ6Z3AydGN4VHNZaHpzT1VES1M3bzRlVF9aeU1veVQxNHhOY1YtYmJuSmhTVDZOdmhLWnpmaWpQc001aFhTM0hxM1ViUmt5ZUhuRTZWdw?oc=5
2026-02-19	Yahoo	0.5	2 Top Quantum Computing Stocks to Buy in 2026	These companies are poised for years of revenue growth ahead.	https://www.fool.com/investing/2026/02/19/2-top-quantum-computing-stocks-to-buy-in-2026/?.tsrc=rss
2026-02-19	Google	0.4	IBM MQ AI Agents: Messaging for the autonomous era - IBM		https://news.google.com/rss/articles/CBMikAFBVV95cUxORjYyOFFhdnVhLXZKcG03OWlRZ2M4SExQUGM0bWRrTjNfMi1UYUNhV3BqQ0R6c2tvWGpROXQ5ak9IckRURkRlVFRIRjFvS1E3dXFPdUVGUklHR29YWVY1VlNvbjZ5NmpzdmU4dF9jdWo1Y0VaeXJuM2pobzhNaVRfLVZYSjZmajZ5R25PbWtsRnc?oc=5
2026-02-19	Google	0.267	IBM Brings Autonomous Agentic-AI Operations To Enterprise Storage - Forbes		https://news.google.com/rss/articles/CBMivAFBVV95cUxONW1MTkIxaG51WkpfeGwyVnQySjJaWDFFbGFEZ09POHpMZFUwemVUZ3RCMFVHYi1IRTJjRE1ZYUVkTllMUUIyM2hkODl5MkRlNzNaN01zeU1jc3BucHgyWE9UZFNIYVFpNGFzT0NvTUVleTB2ejV0S2pmOHhidGVlY28zdW5SbTc2RXhBaFBHYTl3NkRZS2hVdkpkRGxiR1JhUjhidnlqM1cwandNNVNqVFZDSTBQMDNFZTRtUw?oc=5
2026-02-19	Google	0.136	Introducing a new AI agent in IBM Engineering AI Hub 1.2: Higher-quality work items, faster execution - IBM		https://news.google.com/rss/articles/CBMivAFBVV95cUxOaDdtMjZHdG9uRkdpZzh1RmRWMHJoZWNOQnFHbDlKNUQ3S3pFUU5PQ3FlSmtBQ2xBYVlzeHNEMVczRzdjWElzNDdIUmk2NDRUQ1kySnpPRTgtVHpZa0I3MHg1YTZMS0dHQk03ZzQ5OUVwOHZKelVnU1ZDM3JQWkx6Nl9oSk5ZZlV1ZHRvc1RBekZHSzZpWnUyZjl4ZjI2U0lWWFF6d25aeWNfbVhFaHRMRXd5MUhNWHpqWVNGeA?oc=5
2026-02-19	Google	0.0	Announcing the IBM Db2 Developer Extension for VS Code - IBM		https://news.google.com/rss/articles/CBMilwFBVV95cUxNaDdDQ0Y2Y1ppYkZZd2JISTNjQkpxMDlMaXR6S0lKMExUS2FOLU1vQmJDa3JQNUxaUHRiNVAyMXhqNVVGMVhfRVhWZ2NENXoxOFdTZFdEbF94ekZEczFKVjN0QzVDZ1JsVXRXSDVtU2l6RzY2NDJuMUdidVlQTHRaUVFITEVYclpzS2pST0MyWk9CZFZvMlJJ?oc=5
2026-02-19	Yahoo	0.0	D-Wave Joins Southeastern Quantum Collaborative as Inaugural Member	"PALO ALTO, Calif., February 19, 2026--D-Wave Quantum Inc. (NYSE: QBTS) (""D-Wave"" or the ""Company""), the only dual-platform quantum computing company, providing both annealing and gate-model systems, software and services, today joined the Southeastern Quantum Collaborative (SQC) as an inaugural member, along with The University of Alabama in Huntsville, Davidson Technologies, IBM and Alabama A&amp;M University."	https://finance.yahoo.com/news/d-wave-joins-southeastern-quantum-120000215.html?.tsrc=rss
2026-02-19	Google	0.0	IBM Hiring Strategy – Company Plans to Triple US Entry Level Roles in AI Driven Shift - capitolskyline.com		https://news.google.com/rss/articles/CBMif0FVX3lxTE9iNmxPSlJUWjFyeWZBZGJVcUlLTDJFY2Y1T2dSclVuYTc4c2ltODR1OHlsUkFSYVRiQlpaaGRxOGx0djNpVFJHNFlsMWRYSDFzdFh1anktWkk5NGhBVExsQ1NMbjVxa1pILS02b0Rqd2tuVUZOcTk0bDlkY3cwS1k?oc=5
2026-02-19	Google	0.0	IBM Ventures Invests in SQK and QodeX Quantum for Specialized Software Development - Quantum Computing Report		https://news.google.com/rss/articles/CBMiugFBVV95cUxPaTlfZXAyX0VOOWtKb3gtbl9QS012dFdjcU1pdmJWb01oSzRpbjV0dXpfSjF5Z0FQNUFYWV94T3FXUzJTWVdCY2dTcUR5ek5lV3pUT1U1ckNDRUpJMUliNVpzMFM1OEJnZlpwcF9Bd2VqeFhlTkZKYUozYmxDZWN0MGVDaS1wcERxNkZtVWFsRFpFbjVZMnN2OTJ3LVQ0NkUwazF0NU12cGFZVm1oU2dkZWtwRVVhLURZMVHSAb8BQVVfeXFMUDk2RjlNNTRjSDJzZFRLOUlpQUZ0bEZOd1ROMHJOM3VkaGV5cVNHdWZKMHJxaEVBWVdZRXBUbWo0Z0hPclRramRrUWV5QjhoQUJLZW5vSTlIQmRMYzB2SV9yUmRCaUJOaC1MQ0gyb3BxeU9UZHUwcEdDVjVsTHVFSFVBWkhTTk5JWDFST3dkYkxjQTBvNmhmeHhMUWt2VUVLNlpvTHBZbGl3OXpiY1NQc2h2QWRGY0RVSzFNT25jeE0?oc=5
2026-02-19	Google	0.0	IBM Ventures Invests in Two Quantum Software Startups to Accelerate Quantum innovation - The Quantum Insider		https://news.google.com/rss/articles/CBMilgFBVV95cUxPbWN3czBUdFRsZUVtdDNkZm9hSjFEdFdNUmViYlJXcUpIZGRsMHY0RXVHWUl3UnBvQkNtSFZOS193QzB1Unc1aDdFTmRiMkFwNVg5bEloejdIN2ZWUmRFSk05Q2ZxN3dYWjVkZGxXcnZBQVR3SFpyRExBZVZzM19wWUJhR3dwelNlU2d2dnQ4YW5FRHUySmc?oc=5
2026-02-19	Google	0.0	IBM looks beyond short-term AI gains, tripling entry-level hiring - cio.com		https://news.google.com/rss/articles/CBMiqAFBVV95cUxQekY5U3hXWHZNVEFRWmFJU0dmbFlQU290cGlXNW5HMTNLTXZFYVRZYTE5UEctSnJvcU95YTBiZ2E2RmxwUDhnQVRXS2EzUTdyODljbzFJT3ZZdldUTi1iVkx5eTFfaWUyQXlfeUNtc3RjTzg3bkJNVTRqaHA4OFhNRjFEckFobkNZSVVjZVktM3FSQjhTODU4SEdCY1dtY1pKbDA3aDBZZGI?oc=5
2026-02-19	Google	0.0	IBM rewrites entry-level jobs as AI hiring surges - HR Executive		https://news.google.com/rss/articles/CBMif0FVX3lxTE5UU25SWnZMNnlhdnRQMjNlUklXY3p1N3h5S2hRRW02MEgwQWZfelJra0oxYnozX2FBcVBCcFZLTW13NllYcl9vSERaeUNqcU9NM05BZ0QydGI5YzZiVGJNdjY4ZUpCM1U2SnNoRFd4VzV1dktSOTlyQnZ5X0Y0SkE?oc=5
2026-02-19	Google	0.0	International Business Machines Corporation $IBM Shares Bought by Alberta Investment Management Corp - MarketBeat		https://news.google.com/rss/articles/CBMi8gFBVV95cUxQU2VWZWp6VEFBMU1ERWdxT29JdFgzUzdPSXFlV0NmbEpVSWR3aVZDUGtURTBrSTZvNnRMZnk4U2g3WUdxMHJNVkUtNC1EQ0phcVNwbXBjYUlINXJwSlRoOE5CbDR5RE9rSnlhTDRvcXhGU0RuVTdvN0MwcF9VM1RuUV9qU2gtUEQ5dnNDZ2RUajFqNEZ2OWNWVGpuVHM3QWFvbVNMVk1RUmhTUVVDZDVxV0dMNFMzaHpGdWhaRkdTa1EyT2JBQ0pjSWJmcXFLeWlpUXBCN2RhLUJIc2N2eV81UUVlWnNqTWZTR2xQRHdJd2tQUQ?oc=5
2026-02-19	Google	0.0	NewEdge Wealth LLC Grows Holdings in International Business Machines Corporation $IBM - MarketBeat		https://news.google.com/rss/articles/CBMi3gFBVV95cUxPb0p2Q01KR2xxbllwQ1hBX2hoYzJVS2V2SXA3dktoQ2pTVGRmTlFxTkZ0YXNkTThHemNXZjBHM0RPNHNoQ1g3TFJUR2hJVE5na3Z4OEEyTzFuWXJoaHRNQm5zdWphN0w5YTl1NFRiNVZHSzdDNUo2YUJaLWkyVWY5ZDVjRDh0UEVrR1RVUzdfeV9TTDVYb3hCelo3MzVKWXVndUdfaHRzb2tJM2laZ2loOGxOMDl2VUpKSko5UGxfQndUYTd0dTFMc0oybzBranNabTQ3a1hoMXNQeWVQWUE?oc=5
2026-02-19	Yahoo	0.0	Will Datadog Stock Sustain Growth on Rising AI Cloud Monitoring Spend?	DDOG rides 29% Q4 revenue jump as AI observability use soars, with 5,500+ AI integrations and a 2026 outlook signaling sustained growth momentum.	https://finance.yahoo.com/news/datadog-stock-sustain-growth-rising-144300289.html?.tsrc=rss
2026-02-19	Yahoo	-0.01	How IBM’s AI and Quantum Infrastructure Push At International Business Machines (IBM) Has Changed Its Investment Story	In recent weeks, IBM has joined the new Southeastern Quantum Collaborative alongside D-Wave and regional universities, unveiled an AI‑driven generation of FlashSystem storage, deepened QRadar integrations with Criminal IP, and was selected to support the Missile Defense Agency's large SHIELD defense technology program. These developments collectively highlight IBM's push to embed AI across infrastructure and security while reinforcing its role in quantum ecosystems and mission-critical...	https://finance.yahoo.com/news/ibm-ai-quantum-infrastructure-push-200902857.html?.tsrc=rss
2026-02-19	Google	-0.033	IBM Ties AI Storage And Quantum Workforce To Long Term Growth Story - simplywall.st		https://news.google.com/rss/articles/CBMi4AFBVV95cUxQbU15ZVBuamVZLWxCYnJvSGRtV2FKbi1pY3A2RXNDa2xvanZQOFNUT3hOUXJSS0c5MV85eWFFc0x2SFlFVUd0aGlBR3kxSjF3TV9RZlVyRnZYQ1k2R3A4cFNtQ1N1STVFZHluQWdyem93Mkp5QzRBUXpEWVVTYnduVG9GeDlJaWlJdjRtWlg0eG85WjhHUm1MclBnNnc2a0FnRTczMkZVSGwxUHNCYWZJdEJXM3UzY3BRY3VOdDdud1JIWmtybnNleDhaQ3RQRHI4cVJLbDZCZXBxdFNlX241MA?oc=5
2026-02-19	Google	-0.078	International Business Machines (NYSE:IBM) Shares Down 2% After Analyst Downgrade - MarketBeat		https://news.google.com/rss/articles/CBMiywFBVV95cUxNMkhfbXltdUg3TTU0TUczaFlHU0ZEYzJaLVVudU1ZQVhBTmdYQWJXb0Z0ZlRCWWFfUTREZjF4LVkxREJsSTlSaC16TnM1aFVyN3N1bG5QVGJTM2szT0ZldDFFRUFER2lTSmVtQkFPMFJiS2plaTVTLUJjVEc2TEJ4blRiNHJNby1tSk5vRTBDRlBTdFhUdlNhYW1vNUtLVnVsSklvZmY2RUxrQ18takhwcm05NTJBdEVXSU5FMTdpV1hUNmhsaEZ2aXVaMA?oc=5
2026-02-19	Yahoo	-0.15	Competitor Analysis of the Artificial Intelligence Market 2025: Recent Developments, Company Strategies, Sustainability Benchmarking, Product Launches, Key Persons, and Revenue Forecasts to 2033	The global artificial intelligence (AI) market is projected to soar from an estimated $184.15 billion in 2024 to approximately $2.53 trillion by 2033, driven by a CAGR of 33.83% from 2025 to 2033. AI replicates human intelligence via technologies like machine learning and natural language processing, which enhance industries such as healthcare, finance, and manufacturing through automation and data analysis. Key players, including Microsoft, IBM, and Amazon, are leading this transformation by in	https://finance.yahoo.com/news/competitor-analysis-artificial-intelligence-market-161500385.html?.tsrc=rss
2026-02-18	Yahoo	0.625	IBM’s Market Cap Collapse	IBM (NYSE: IBM) ranked No. 1 by market capitalization in the US in 1985, according to a study by Axios. By 1995 and 2005, under legendary CEO Jack Welch (who retired in 2001), GE was the world’s largest conglomerate and ranked in first place. GE was surpassed by Apple (NASDAQ: AAPL) in 2015 as the ... IBM’s Market Cap Collapse	https://247wallst.com/apps-software/2026/02/18/ibms-market-cap-collapse/?.tsrc=rss
2026-02-18	Yahoo	0.5	This is the most under-owned megacap tech stock, according to Morgan Stanley	Investing.com -- In a note to clients on Wednesday, Morgan Stanley analysts revealed the most under-owned megacap technology stock.	https://finance.yahoo.com/news/most-under-owned-megacap-tech-122746844.html?.tsrc=rss
2026-02-18	Yahoo	0.454	Storage Technology: How To Find & Own America's Greatest Opportunities	Storage Technology was the leading maker of data-storage devices for large computers and saw a massive runup in the 1970s.	https://finance.yahoo.com/m/3852ce9f-4744-3361-9b56-93ff363925ad/storage-technology%3A-how-to.html?.tsrc=rss
2026-02-18	Google	0.233	Clients rank IBM among Top Enterprise Software Providers in 2026 G2 Best Software Awards - IBM		https://news.google.com/rss/articles/CBMixAFBVV95cUxOMVp4VkM0T1lrVWFUa3lhNDZVV3lSWjRMbnZvMTIyTmN2bHdwRDBpa21jRS1DdlFhOUU0YzVSYlMycU14RS1nQmZjMHFEY3RMZkFSVWxsQzlNU3o4bWdIajlNc3JfRjBndmpySVpKZTZQeXdsWTNlOE05Um1jcE42bC1pQXlidlhoYjE2REtmZzZYem9ZeVZkZXpLeTdyblNyekVzTjV5RGtKRXFPaDdlcHRrNW5SR2FZU3JubGo3Znl2cXEz?oc=5
2026-02-18	Google	0.2	Announcing 40 years of AIX: The autonomous foundation for the AI critical era - IBM		https://news.google.com/rss/articles/CBMiuAFBVV95cUxOOTdlWUVBNzZadndhdmgyWmg2ZlVJTjlJVGIwQ2FvU2tybGI5bjc4MUFQd1ZhU2ppSXF2a0VBQ0RsOTRPZlFnaEZwcXRWRHpPT05LUW81Y2ZQTkdLWXBVbmRGbjNDWTFMLXhBLWNpZTFCWTJIdUhQQkhIZEd5UEg4SnZ0YTl4cUdscmZ6clNjZ2l3dkRwTGxRWG9yMmk4ZEVxVHpmcklJVlJpTGhJbExwZTF0RWZCNUNO?oc=5
2026-02-18	Yahoo	0.15	A Look At IBM (IBM) Valuation As Short Seller Critique Sparks Fresh Doubts On Its AI Direction	International Business Machines (IBM) stock has come under pressure after high profile short seller Jim Chanos questioned the company’s artificial intelligence focus, criticizing an emphasis on marketing and consulting instead of core technology development. See our latest analysis for International Business Machines. The recent criticism has landed during a weak patch for the stock, with a 7 day share price return of an 11.46% decline and a 30 day share price return of a 15.49% decline...	https://finance.yahoo.com/news/look-ibm-ibm-valuation-short-130805470.html?.tsrc=rss
2026-02-18	Google	0.125	International Business Machines (NYSE:IBM) Trading 1% Higher - Here's Why - MarketBeat		https://news.google.com/rss/articles/CBMivAFBVV95cUxNUUlacXBuU2xVRkFLNXRsYnJBYnFPX2tWdVozMTFTalAyT050VlB1ZnlmYTZHdlpRS0xjVHUxd0QyVkdhejhmbnJpUW0yZDRfdnFONnM5WEpxVy1EWE5vSTk5SDBYZTZsQlEwbnllalhkLUx0cjlYT3pUVUg2aXk5akxLbkRkQXpvSHNNZG5PU0lHSDV6U0xYOFczMnJ5R2dzVlJLS2NRbFh6U3pyeUxQNFM2WFZIYThaN0l3SQ?oc=5
2026-02-18	Google	0.091	A new IDC report: How AI is reshaping enterprise networks - IBM		https://news.google.com/rss/articles/CBMilgFBVV95cUxPc0RGaW1EazlsZVBqaEdMU3hHNkVPZWZ3WU1jMlJuajFhQlkyS3Q3RThwaTFmd1FyX3VfSjVEQ3FoYTI3eHp2eF9aX3ZNRExSejl1MWRuZF8yWTF1MFRlalBkb21nZ24tNWRMQjl6Y3E4OE1MSzcwRGVMVDhiazF4WFh1YjB1WjVidVcwUVVwbk9CdHVIcFE?oc=5
2026-02-18	Yahoo	0.087	Exclusive Thought Leadership Event TLFT 2026 Returns to New York City	iResearch Services, a leading global B2B thought leadership agency, has announced the return of Thought Leadership for Tomorrow (TLFT) 2026, the premier invite-only event for senior decision-makers shaping the future of thought leadership. In its fourth-year running, and following the success of TLFT 2025, which convened over 100 industry leaders and 27 speakers from organizations including Google, Morgan Stanley, Salesforce, LinkedIn, IBM, KPMG, and Deloitte, the 2026 event promises an even mor	https://finance.yahoo.com/news/exclusive-thought-leadership-event-tlft-112100019.html?.tsrc=rss
2026-02-18	Google	0.0	5 key FP&A trends to watch for 2026 - IBM		https://news.google.com/rss/articles/CBMiYkFVX3lxTE1xQUhHbWtFY3FtWWtvVXpWbGlReXNBRmU5TkxhZjdpaUkzRnpwb0piY1lmVE5Ja0owdjJoclRJUEFhMkpfQ0NhNkdPYUJaQkg5ekFyaUd3VzRMcjZJZEduYzVR?oc=5
2026-02-18	Google	0.0	Achieving Monitoring Consistency - IBM		https://news.google.com/rss/articles/CBMiWkFVX3lxTE9CdnMxZGxDWTJwbTU1MkNidGw0OUxoX3NONEl4SGR4STVNenpjaTdtWWxEdU92amVXdEpMMzNhMm53N3RtbUZObHAwRE1uaDZFZ055WjYwcE5SQQ?oc=5
2026-02-18	Google	0.0	Big Blue’s Renaissance: IBM Shakes Off ‘Legacy’ Label with $19.7B Q4 Beat and Massive AI Momentum - FinancialContent		https://news.google.com/rss/articles/CBMi-gFBVV95cUxNbDhpei12aEVYMmJtSUVUT1lOV0lubTk5OTdTYllzSXZWZ01sRzNkLU45Z2NvY1ViSndrYXVZVlJpOFRDNHlrMEo0cnhadmRDdlVsRUprTmp3X1c5V0puQVJud2hsdHJyVG1kZnBnOXVDbkNvV2d1bDlpaVdZbWhHVHBfcExJazdGTWVwQWNubFVZbUxFNHhveEZHMm1YdGdwd0hjNmJYUE9BbnRSdUdaMWtmOGJRbklBVDlDaDVNX2RTRDRqNXFjUDFpZ081NXk1cm4tcmc1R1RYVjgtVmctLVhuS0JjNFdwd3ZGTnZKN3RuSEtRVkJaUEd3?oc=5
2026-02-18	Google	0.0	Bridging the trust gap: How government CIOs can transform citizen engagement with AI - IBM		https://news.google.com/rss/articles/CBMinwFBVV95cUxOM2haNU1JcnNrOXlNbHFPWXRjTEFzU21IX05iNy1pdkxiaTRJZlgycTJGMFJmdkJZWS1EZjFvMjlHT1dOSHVLYUtqcHBaQXdGSHR5aHRrY05adWJOQWxhYlozYWFZazlHd1dnaG9rbVNZczBDZ1VCcjEzZFpkRnlXQ2daV0hCc3BBVFdHZ1RGWGpMM2plSXN1Y1hFVTVHVlE?oc=5
2026-02-18	Google	0.0	Bulgaria’s national switch, BORICA, scales next-generation fraud prevention with IBM Safer Payments and IBS - IBM		https://news.google.com/rss/articles/CBMi2AFBVV95cUxQa1NvWlVKOGc3aW5FQmVsQXM4X09senNZR09pT2kyTTRndDd3engwOHN2YWZwaXZCMEpPX1YtUHMwSWFPVW9fUTJwT2EydWJYZEZjbDBZNFpFYlpIU3libDM1ZS01WFBlQTBpeHBmM2s2RlZRYVE3UkFvbllNenVJUWZZSG54bzllMWJ4Mk0tYzlIaFphTHRqdFdJdG9GNVhFdWxMajVTMEpwZDMzamp1N21ManFpb3dacGdCd2ZlZGRxdFphQ3R4VG12WExXQ2VuYnRGMjdMUVI?oc=5
2026-02-18	Google	0.0	Corporate America Is Rethinking AI Workforce Needs, Led By IBM - Forbes		https://news.google.com/rss/articles/CBMitAFBVV95cUxQQ2ZsNngwblZKMDRKbnFYSDVKb0txNUhWR2ZUcy15cGdMeUFYaEc0X2lTSGtKQkVyWFpjd2RkNjZwTUJ6Zy1VOG5peEI1WHcwUmI4ZXVpRmkxTldsb29RQWFLTEFJRVkyTWg4RWlQX1VzQW94YkU2b3pKQVE2b0ZBVkpqZnptTlR0YkZWR2V5NnY3MGFxNUk0Y3RuR21vS191MFFJWHZkeXZ5LURoVVR4SmhWcWk?oc=5
2026-02-18	Google	0.0	IBM MQ AI Agents to accelerate issue resolution and improve messaging resilience - IBM		https://news.google.com/rss/articles/CBMiugFBVV95cUxPRmd5VXlOOXp3dEZWUVZLQnU4SlJTdUxrbUM0ZUFWRnprMDVkMTUwekIyd1VBQzI3RXduXzdiLWJITWNScDBxemJNX0ZoVWF5aXpMQVZXZXU3c29XeXFvZFFSeDJuWHpwNm5vM3J6blE5UWliazFhRUVsNW84dU9WNnAwMFVaaVpZOUxxRk5QWlVvRTdEUGVpZTRBMWxwWEt0aC1GUHZjQU1GOFVQNXdYM1drQXYyNHBiRkE?oc=5
2026-02-18	Google	0.0	IBM Ventures invests in SQK and QodeX Quantum to accelerate Quantum innovation - IBM		https://news.google.com/rss/articles/CBMitwFBVV95cUxNbTQySERTbWpmWXRrMnlsZl96WXZuVWFZQ3FVNnM4N1ZLX3RKOUQzbUJrM2huS3BvOVB5UVhFODB3RnowZ1UyTGR2Z2VmRXFuTUxkbmJpd1lMWWJuNmJsR3ZFR2tzUUVZaW1OeUpNWnRPRE1yRlllVnlSU0JCS253cHdmV3ZlSldkeG9vYmY5aC1IdzdOcFRnYzNVTVJvaHJiVElZUUFOdWVMdHBtTzUzYWdoamJyQjA?oc=5
2026-02-18	Google	0.0	IBM’s Market Cap Collapse - Yahoo Finance		https://news.google.com/rss/articles/CBMieEFVX3lxTFB2TVc0SmVDUjBWYlNpT2FneU4tZWRiN1RMRWtEajY0YjdyenVyUGVVcXNzSk5lTEZfOF9GczNaOG5PeHlqcHVQNW9BTlF6cFZwYnRCd2MzQThJR0ZkcTRuSUk2M3N1RFliUXM2ME1hSGVoYlpVa1JyYQ?oc=5
2026-02-18	Google	0.0	"International Business Machines (NYSE:IBM) Downgraded to ""Hold"" Rating by Erste Group Bank - MarketBeat"		https://news.google.com/rss/articles/CBMi1gFBVV95cUxOTDV0TlV2Z25TbDYtZnlSMnZmUzk4NnR5S3hiY1RvNlAtM3JlMEViLWRYaHc1TU1GT2F3dzNvc3dHc240eVNiNy01ZkZIbklCUlZJb2F2X01va1phaFA3eHpGcVJ6YlVGUlV5bWhzZXE1dGoxVkFhNWJNaENrdzgyR0VxSVJuM0dOX2VrZy1CWnF0andpcDNxTFNQQi0wNFpUOTBwTjNjSGxBZGF4X3dFcktITmsxV2Z4eWtfMDNGdzlBbXhkaTlTQnBhRFpZQ1F0TExFcDJ3?oc=5
2026-02-18	Google	0.0	International Business Machines Corporation $IBM Shares Purchased by Advisors Capital Management LLC - MarketBeat		https://news.google.com/rss/articles/CBMi8gFBVV95cUxNWnJucE16czM2eXRhQnpBNjVsQlJPbDhianpjcTV3ZGFTVUpwR29HdFp5OHVIYWNZRjdPalpXQUpxZWpsQ1pKMjJ3SVRZa0RPaHJXemFYcm5CcmlyMHkya3dJSDBYVTlkR1VJSUNpWWN4Yk9haExqbUQ2VkcwaTd0REpwZHM4dF9hYTZDamNFZHBDU1F0VUtHdEpaTFZhQWpYYzF3ZzlTMXhsbnRjVmNkeHdWcU8wa0laRDgxdGYyWWpIa0pOeHFsSDREejdZcXlZZnQ2bWx4MkRiaTFPakY0UDIwMS1iNVNEODA5RHB0U01XQQ?oc=5
