Date	Source	Sentiment	Headline	Summary	URL
2026-02-21	Yahoo	0.267	UBS sets bold $6,200 gold target as Middle East tensions rise	Investing.com – UBS just released its latest House View report in which it focuses on the global commodities industry. The report outlined the investment bank’s latest gold (XAUUSD) price target of $6,200/oz, driven by geopolitical risks and a conducive macro environment.	https://finance.yahoo.com/news/ubs-sets-bold-6-200-072919875.html?.tsrc=rss
2026-02-21	Yahoo	0.237	Fortuna Mining (FSM) Climbs 12.6% on Higher Gold Resource	We recently published 10 Stocks Outrunning the Market; 3 on a High. Fortuna Mining Corp. (NYSE:FSM) was one of the best performers on Friday. Fortuna Mining rallied for a third consecutive day on Friday, jumping 12.57 percent to close at $12.27 apiece as investor sentiment was boosted by a stellar earnings performance last year, coupled […]	https://finance.yahoo.com/news/fortuna-mining-fsm-climbs-12-161436998.html?.tsrc=rss
2026-02-21	Yahoo	0.071	Resolution confirms broad gold at Horse Heaven and flags tungsten potential - ICYMI	Resolution Minerals Ltd (ASX:RML, OTC:RLMLF, FRA:NC3) earlier this week reported final assay results from its 2025 drilling campaign at the Golden Gate Fault Zone within the 100%-owned Horse Heaven Gold–Antimony–Tungsten–Silver Project in Idaho, confirming broad gold mineralisation and...	https://www.proactiveinvestors.com/companies/news/1087657/resolution-confirms-broad-gold-at-horse-heaven-and-flags-tungsten-potential-icymi-1087657.html?.tsrc=rss
2026-02-21	Yahoo	0.0	Bitcoin’s debasement trade has yet to start, says Bitwise CIO	The current crypto bear market could see a definitive shift as soon as the second quarter of 2026 as institutional players re-enter the space.	https://blockspace.media/insight/bitcoins-debasement-trade-has-yet-to-start-says-bitwise-cio/?.tsrc=rss
2026-02-21	Yahoo	-0.011	Crypto holds steady amid inflation outlook and geopolitics risks, Nexo says	Investing.com -- Cryptocurrency markets traded in a narrow range toward the end of the week as investors stayed cautious ahead of key U.S. inflation and growth data, with macro uncertainty continuing to shape sentiment, according to a note from Nexo analyst Iliya Kalchev.	https://finance.yahoo.com/news/crypto-holds-steady-amid-inflation-210029867.html?.tsrc=rss
2026-02-20	Yahoo	0.367	Newmont's gold production outlook, CoreWeave falls on credit woes	Yahoo Finance Host Josh Lipton tracks today's top moving stocks and biggest market stories in this Market Minute, including Newmont (NEM) shares sliding over its weaker-than-expected gold (GC=F) production forecasts and CoreWeave (CRWV) stock sinking on a Business Insider report indicating lenders may be worried about its creditworthiness. Stay up to date on the latest market action, minute-by-minute, with Yahoo Finance's Market Minute.	https://finance.yahoo.com/video/newmonts-gold-production-outlook-coreweave-191000204.html?.tsrc=rss
2026-02-20	Yahoo	0.269	i-80 Gold Corp (IAUX) Q4 2025 Earnings Call Highlights: Strong Production and Strategic ...	i-80 Gold Corp (IAUX) reports significant progress in production and financing, despite facing operational and financial hurdles.	https://finance.yahoo.com/news/80-gold-corp-iaux-q4-210141958.html?.tsrc=rss
2026-02-20	Yahoo	0.25	PAAS vs. EXK: Which Silver Mining Stock Is the Better Buy?	Pan American Silver and Endeavour Silver are riding a 143% surge in silver prices, but production plans and valuations set them apart.	https://finance.yahoo.com/news/paas-vs-exk-silver-mining-170800625.html?.tsrc=rss
2026-02-20	Yahoo	0.228	Centerra Gold Inc (CGAU) Q4 2025 Earnings Call Highlights: Strong Cash Position and Strategic ...	Centerra Gold Inc (CGAU) reports robust financial performance and outlines ambitious production and investment strategies for 2026.	https://finance.yahoo.com/news/centerra-gold-inc-cgau-q4-210050463.html?.tsrc=rss
2026-02-20	Yahoo	0.217	Eldorado Gold Corp (EGO) Q4 2025 Earnings Call Highlights: Strong Financial Performance Amid ...	Eldorado Gold Corp (EGO) reports robust revenue and cash flow, despite challenges with the Scurries project and increased production costs.	https://finance.yahoo.com/news/eldorado-gold-corp-ego-q4-230142574.html?.tsrc=rss
2026-02-20	Yahoo	0.212	Explaining President Trump’s Reaction to the Supreme Court Tariff Ban: More Tariffs?	The Supreme Court banned Trump’s emergency tariffs, but he announced new global tariffs. Here’s what it means and how markets could react.	https://beincrypto.com/supreme-court-tariff-ban-trump-reaction-explained/?.tsrc=rss
2026-02-20	Yahoo	0.212	Update: Gold Firms Above US$5,000 as Reports Show U.S. Inflation Rose in December Even as Q4 Growth Slowed	(Updates prices.) Gold traded higher midafternoon Friday, firming above the US$5,000 mark followi	https://finance.yahoo.com/news/gold-firms-above-us-5-190005215.html?.tsrc=rss
2026-02-20	Yahoo	0.173	Gold Holds Firm Near $5,000 as Fed Split and Middle East Risk Lift Safe-Haven Demand	Happy Friday, traders. Welcome to our weekly market wrap, where we take a look back at these last five trading days with a focus on the market news, economic data, and headlines that had the most impact on gold prices and other key correlated assets— and may continue to in the future.	https://finance.yahoo.com/news/gold-holds-firm-near-5-193014581.html?.tsrc=rss
2026-02-20	Yahoo	0.129	Precious Metals Settle Higher After Tariff Ruling	Precious metal futures closed higher after the Supreme Court ruled President Trump’s global tariffs illegal.	https://finance.yahoo.com/m/e773cc4b-68f9-3069-ad6c-c56433814fbc/precious-metals-settle-higher.html?.tsrc=rss
2026-02-20	Yahoo	0.105	Stocks to Watch Friday: Opendoor, Live Nation, Newmont, Grail	↗️ Opendoor Technologies (OPEN): The home-selling platform's quarterly revenue trumped forecasts. The stock gained 7.5% Friday. ↗️ Live Nation (LYV): The live-entertainment company logged higher sales last quarter, driven by demand for concerts.	https://finance.yahoo.com/m/163bd79d-23fa-3ffd-a762-307fa11382e6/stocks-to-watch-friday%3A.html?.tsrc=rss
2026-02-20	Yahoo	0.091	Hudbay Minerals Receives New Ingerbelle Expansion Permits for Copper Mountain	Hudbay Minerals (HBM.TO, HBM) on Friday said it received key permit amendments for the New Ingerbell	https://finance.yahoo.com/news/hudbay-minerals-receives-ingerbelle-expansion-180404633.html?.tsrc=rss
2026-02-20	Yahoo	0.083	RBC Keeps First Quantum's Outperform Rating, C$40.00 Price Target, Following Taca Taca Technical Report	RBC Capital Markets on Thursday maintained its outperform, speculative-risk, rating rating on the sh	https://finance.yahoo.com/news/rbc-keeps-first-quantum-apos-164457466.html?.tsrc=rss
2026-02-20	Yahoo	0.071	Gold Gains as Traders Mull Next Trump Moves After Tariff Ruling	The Supreme Court said Trump exceeded his authority by invoking a federal emergency powers law to impose his “reciprocal” tariffs across the globe as well as targeted import taxes.  The ruling invalidates a large portion of the tariffs that Trump has rolled out in his second term.	https://finance.yahoo.com/news/gold-steadies-near-5-000-053020768.html?.tsrc=rss
2026-02-20	Yahoo	0.062	Will Rising Gold Production Support Allied Gold's Performance in 2026?	AAUC posts record Q4 output, beats 2025 guidance and lifts 2026 outlook as Kurmuk project targets major production boost.	https://finance.yahoo.com/news/rising-gold-production-support-allied-165100320.html?.tsrc=rss
2026-02-20	Yahoo	0.03	TSX Closer: The Index Completes a Hat Trick of Record Closes, Buoyed By Commodities and U.S. Tariffs Ruling	The Toronto Stock Exchange closed a record high for a third-straight session on Friday, again buoyed	https://finance.yahoo.com/news/tsx-closer-index-completes-hat-212152256.html?.tsrc=rss
2026-02-20	Yahoo	0.0	Hudbay Minerals Inc (HBM) Q4 2025 Earnings Call Highlights: Record Revenues and Strategic ...	Hudbay Minerals Inc (HBM) reports robust financial performance with record revenues and EBITDA, alongside strategic advancements in copper and gold production.	https://finance.yahoo.com/news/hudbay-minerals-inc-hbm-q4-230118636.html?.tsrc=rss
2026-02-20	Yahoo	0.0	Why Newmont Stock Dropped on Friday	The gold stock is falling, but it has nothing to do with the price of gold.	https://www.fool.com/investing/2026/02/20/why-newmont-stock-dropped-on-friday/?.tsrc=rss
2026-02-20	Yahoo	-0.104	Gold holds above $5,000 as Trump's blanket tariffs get struck down, Iran-US tensions in play	Gold rises as Trump tariffs are struck down, with Iran tensions in play.	https://finance.yahoo.com/news/gold-holds-above-5000-as-trumps-blanket-tariffs-get-struck-down-iran-us-tensions-in-play-191254710.html?.tsrc=rss
2026-02-20	Yahoo	-0.25	Bitcoin and Ethereum are off to their worst start of the year in a decade—but some see a rebound in sight	The year-to-date performances of the world’s two largest cryptocurrencies are some of the most bearish on record, according to data from CoinGecko.	https://finance.yahoo.com/news/bitcoin-ethereum-off-worst-start-170110665.html?.tsrc=rss
2026-02-19	Yahoo	0.178	Assessing Bunge Global (BG) Valuation After Strong Share Price Momentum And Modest Estimated Undervaluation	Bunge Global (BG) has been drawing attention after a strong run in the past 3 months, with its share price moving alongside reported revenue of US$70.3b and net income of US$819m. See our latest analysis for Bunge Global. The recent 30 day share price return of 12.95% and 90 day gain of 31.22%, alongside a 1 year total shareholder return of 78.87%, point to building momentum despite a softer past week, with the current share price at US$121.77. If you are looking beyond agribusiness for what...	https://finance.yahoo.com/news/assessing-bunge-global-bg-valuation-002351652.html?.tsrc=rss
2026-02-19	Google	0.143	Gold prices bounce back above $5,000 on safe haven demand - MSN		https://news.google.com/rss/articles/CBMiqgFBVV95cUxQQWlmeDlxaTRIZUpYYkZ4NThyZGlmRmRMYWxDNG5rLXNBYk9VQVA3RHVlcmZDV2EzSnExM3loYWlHZ2dTbl9tSDEwYVBXRnlvc1VsTkF4MlpzTEJNYmFqanM1VDhReXpjNkZERGUzR1Z0bXJEaC1rWXUtS1VZOG5KQVB4Z1dWemM0ZHYxY3padV91emV1WTlfR1dzU1RSVGlId1dqOXZ0UEhUUQ?oc=5
2026-02-19	Yahoo	0.136	Assessing Matador Resources (MTDR) Valuation After New Quarterly Dividend Announcement	Matador Resources (MTDR) is back in focus after its board declared a quarterly cash dividend of $0.375 per share, payable on March 10, 2026, to shareholders of record on February 27. See our latest analysis for Matador Resources. The latest quarterly dividend comes as Matador Resources trades at US$49.63, with a 1 month share price return of 15.88% and a 3 month share price return of 22.66%. The 1 year total shareholder return of a 9.74% decline contrasts with a 5 year total shareholder...	https://finance.yahoo.com/news/assessing-matador-resources-mtdr-valuation-043438486.html?.tsrc=rss
2026-02-19	Yahoo	0.0	AngloGold Ashanti Expands Nevada Footprint With Augusta Deal And Growth Focus	AngloGold Ashanti (NYSE:AU) has closed its acquisition of Augusta Gold Corp, adding assets in Nevada's Beatty District. The deal expands the company's presence in a key US gold mining hub and adds to its project pipeline in the region. Investors now have fresh corporate news to weigh alongside the current share price of $108.35. For you as an investor, this transaction adds a new piece to the AngloGold Ashanti story, on top of a share price that stands at $108.35 and a value score of 5. The...	https://finance.yahoo.com/news/anglogold-ashanti-expands-nevada-footprint-011624989.html?.tsrc=rss
2026-02-19	Yahoo	0.0	Asia shares get tech lift as Iran, rate uncertainty loom over markets	By Rae Wee SINGAPORE, Feb 19 (Reuters) - Asian stocks rose on Thursday, supported by gains in technology giants on Wall Street, while lingering U.S.-Iran tensions kept oil prices supported and left	https://sg.finance.yahoo.com/news/asia-shares-tech-lift-iran-015951760.html?.tsrc=rss
2026-02-19	Yahoo	0.0	Hecla Mining Leans Into Silver Focus With Record Results And Exploration Push	Hecla Mining (NYSE:HL) has agreed to sell its Casa Berardi gold mine as part of a shift toward a silver focused business model. The company reported record financial results alongside this portfolio change, which includes a smaller debt position. Management plans to allocate nearly double the capital to exploration and pre development projects, with a particular emphasis on Nevada. Hecla Mining, a long standing precious metals producer, is sharpening its focus on silver by exiting its Casa...	https://finance.yahoo.com/news/hecla-mining-leans-silver-focus-061209502.html?.tsrc=rss
2026-02-19	Yahoo	0.0	Hycroft Mining Resource Upgrade Fuels Interest In Project And Funding Outlook	Hycroft Mining Holding (NasdaqCM:HYMC) has filed an independent Technical Report that significantly lifts its measured and indicated gold and silver mineral resource estimates. The report also confirms robust metallurgical recoveries, supporting the potential viability of processing and extraction at the Hycroft project. These findings represent a material update to the project’s resource base and processing outlook that is likely to be closely watched by existing and prospective...	https://finance.yahoo.com/news/hycroft-mining-upgrade-fuels-interest-011501065.html?.tsrc=rss
2026-02-19	Yahoo	0.0	Kingman Receives ADWR Approval and Mobilizes Altar For Phase III Drilling at Mohave	"Vancouver, British Columbia--(Newsfile Corp. - February 18, 2026) - Kingman Minerals Ltd. (TSXV: KGS) (OTCQB: KGSSF) (FSE: 47A) (""Kingman"" or the ""Company"") is pleased to announces that it has received approval from the Arizona Department of Water Resources (""ADWR"") of its Notice of Intention (NOI), authorizing drilling of seven exploration holes for Phase III at the Company's 100%-owned Mohave Project in Arizona.Following approval, the Company has directed Altar Drilling Inc. to mobilize to..."	https://finance.yahoo.com/news/kingman-receives-adwr-approval-mobilizes-020500481.html?.tsrc=rss
2026-02-19	Yahoo	0.0	Pan American Silver Earnings Beat Sparks Guidance Hike And Valuation Debate	Pan American Silver reported record Q4 revenue, earnings, and cash flow, supported by higher silver and gold production. The company raised its production guidance for both metals and increased its quarterly dividend. Management highlighted progress on major growth projects and a continued focus on shareholder returns. At a current share price of CA$79.53, TSX:PAAS has delivered a 133.7% return over the past year and a 296.9% return over three years, with a 90.8% gain across five years...	https://finance.yahoo.com/news/pan-american-silver-earnings-beat-043659120.html?.tsrc=rss
2026-02-19	Yahoo	0.0	What Barrick Mining (TSX:ABX)'s Mali Dispute Settlement And Loulo Extension Means For Shareholders	In early February 2026, Barrick Mining resolved a long-running dispute with the Government of Mali over the Loulo-Gounkoto gold complex, securing a 10‑year extension to the Loulo mining permit and the restoration of full operational control in exchange for withdrawing its international arbitration case. This agreement removes a major operational uncertainty around one of Barrick’s key African assets, clarifying long-term access to economically viable reserves and reshaping the company’s...	https://finance.yahoo.com/news/barrick-mining-tsx-abx-mali-011752200.html?.tsrc=rss
2026-02-19	Yahoo	-0.4	Gold steadies in thin trade, investors await US inflation data	By Pablo Sinha Feb 19 (Reuters) - Gold prices were flat in thin trading on Thursday after rising more than 2% a day earlier, as investors waited for key U.S. inflation data that could influence the	https://sg.finance.yahoo.com/news/gold-dips-dollar-firms-ahead-033609272.html?.tsrc=rss
2026-02-18	Yahoo	0.5	Alamos Gold Q4 Adjusted Earnings More Than Doubles, Hikes Dividend by 60%	Alamos Gold (AGI.TO, AGI) was up 1.1% in after-hours New York trading after the company on Wednesday	https://finance.yahoo.com/news/alamos-gold-q4-adjusted-earnings-222757573.html?.tsrc=rss
2026-02-18	Yahoo	0.5	Equinox Gold Delivers Transformational Year with Strategic Merger, Record Production and Revenue, Portfolio Optimization, More than US$1.1 Billion in Debt Reduction, and Announces Inaugural Dividend	VANCOUVER, British Columbia, Feb. 18, 2026 (GLOBE NEWSWIRE) -- Equinox Gold Corp. (TSX: EQX, NYSE American: EQX) (“Equinox Gold” or the “Company”) is pleased to report its unaudited financial and operating results for the three months (“Q4”) and year (“Full Year”) ended December 31, 2025. These results are preliminary and could change based on final audited results. Equinox Gold’s 2025 audited consolidated financial statements and accompanying management’s discussion and analysis for Q4 and Full	https://finance.yahoo.com/news/equinox-gold-delivers-transformational-strategic-223900163.html?.tsrc=rss
2026-02-18	Yahoo	0.5	Mining Company Soars 30% After Study Finds More Gold, Silver Deposits	Winnemucca, Nevada-based Hycroft Mining soared 30% on Wednesday after a new report found it had far more gold and silver resources than previously thought.  After paring back some its earlier gains, shares of Hycroft Mining finished the day up 21%.  Hycroft Mining recently commissioned an independent report, which it disclosed on Wednesday, that assessed the estimated amount of gold and silver in its deposits.	https://finance.yahoo.com/m/5b178c2d-289b-36f7-83a0-755cb1e5fa87/mining-company-soars-30%25.html?.tsrc=rss
2026-02-18	Yahoo	0.5	NexGold Named in 2026 TSX Venture 50 List of Top Performing Companies	"Toronto, Ontario--(Newsfile Corp. - February 18, 2026) - NexGold Mining Corp. (TSXV: NEXG) (OTCQX: NXGCF) (""NexGold"" or the ""Company"") is pleased to announce that it has been recognized by the TSX Venture Exchange (""TSXV"") as a 2026 Top 50 Company. NexGold was included in the TSX Venture 50 list based on their strong performance from December 31, 2024, to December 31, 2025, in which the Company's share price increased 155% - from $0.69 to $1.76. NexGold's market capitalization also increased..."	https://finance.yahoo.com/news/nexgold-named-2026-tsx-venture-222300787.html?.tsrc=rss
2026-02-18	Yahoo	0.35	B2Gold Reports Q4 and Full Year 2025 Results & 2026 Guidance; Achieved 2025 Gold Production and Cost Guidance; Record Annual Revenue in 2025 of Over $3 Billion; Gold Production for 2026 Anticipated to be Between 820,000 and 970,000 oz; Q1 2026 Dividend of US$0.02 Per Share Declared	VANCOUVER, British Columbia, Feb. 18, 2026 (GLOBE NEWSWIRE) -- B2Gold Corp. (TSX: BTO, NYSE AMERICAN: BTG, NSX: B2G) (“B2Gold” or the “Company”) announces its operational and financial results for the fourth quarter and full year 2025, together with 2026 operating and cost guidance. All dollar figures are in United States dollars unless otherwise indicated. 2025 Fourth Quarter and Full Year Highlights Consolidated gold production of 303,029 ounces in Q4 2025: The Fekola, Masbate and Otjikoto min	https://finance.yahoo.com/news/b2gold-reports-q4-full-2025-225000811.html?.tsrc=rss
2026-02-18	Yahoo	0.133	Mineros Reports Fourth Quarter and Full-Year 2025 Results – Record Annual Revenue of $800 Million, Net Profit and Free Cash Flow; Production Guidance Exceeded; $42 Million Returned to Investors; 2026 Growth Strategy Announced	"MEDELLIN, Colombia, February 18, 2026--Mineros S.A. (TSX:MSA, OTCQX:MNSAF, BVC:MINEROS) (""Mineros"" or the ""Company"") today reported its financial and operating results for the three months and year ended December 31, 2025. All dollar amounts - other than per share amounts - are expressed in thousands of US dollars unless otherwise stated. For further information, please see the Company’s audited consolidated financial statements and management’s discussion and analysis posted on Mineros’ website"	https://finance.yahoo.com/news/mineros-reports-fourth-quarter-full-225900594.html?.tsrc=rss
2026-02-18	Yahoo	0.08	Lundin Gold Reports Further High Grade Results at FDNS Including 91.3 g/t over 20.65 Metres and Expands the Mineralized Footprint at FDN East	"Lundin Gold Inc. (TSX: LUG) (Nasdaq Stockholm: LUG) (OTCQX: LUGDF) (""Lundin Gold"" or the ""Company"") is pleased to announce additional strong results from its ongoing conversion and near mine exploration drilling programs at the Fruta del Norte (""FDN"") gold mine in southeast Ecuador. Following the declaration of inaugural Mineral Reserves at Fruta del Norte South (""FDNS""), continued drilling has further confirmed and expanded high grade mineralization within the deposit. At FDN East, where the Co"	https://finance.yahoo.com/news/lundin-gold-reports-further-high-230000281.html?.tsrc=rss
2026-02-18	Yahoo	0.0	Alamos Gold: Q4 Earnings Snapshot	The results surpassed Wall Street expectations. The average estimate of four analysts surveyed by Zacks Investment Research was for earnings of 49 cents per share. The gold mining company posted revenue of $575.3 million in the period.	https://finance.yahoo.com/news/alamos-gold-q4-earnings-snapshot-222025608.html?.tsrc=rss
2026-02-18	Yahoo	0.0	Basic Materials Roundup: Market Talk	Find insight on mining stocks, Glencore and more in the latest Market Talks covering basic materials.	https://finance.yahoo.com/m/2b38198c-b6a2-3fea-9ec2-21b73ceff450/basic-materials-roundup%3A.html?.tsrc=rss
2026-02-18	Yahoo	0.0	Kinross Gold (KGC) Surpasses Q4 Earnings and Revenue Estimates	Kinross Gold (KGC) delivered earnings and revenue surprises of +21.51% and +7.93%, respectively, for the quarter ended December 2025. Do the numbers hold clues to what lies ahead for the stock?	https://finance.yahoo.com/news/kinross-gold-kgc-surpasses-q4-231001138.html?.tsrc=rss
2026-02-18	Yahoo	0.0	OR Royalties Acquires a Portfolio of Royalty Assets and Says Its Fourth-Quarter Adjusted Profit Doubled	OR Royalties (OR.TO, OR) said Wednesday said it agreed to acquire a portfolio of eight precious meta	https://finance.yahoo.com/news/royalties-acquires-portfolio-royalty-assets-221643673.html?.tsrc=rss
2026-02-18	Yahoo	0.0	Torex Gold Reports Q4 and Full-Year 2025 Results	"Record quarterly free cash flow generation has enabled full repayment of debt while continuing to return capital to shareholders(All amounts expressed in U.S. dollars unless otherwise stated)Toronto, Ontario--(Newsfile Corp. - February 18, 2026) - Torex Gold Resources Inc. (the ""Company"" or ""Torex"") (TSX: TXG) (OTCQX: TORXF) reports the Company's financial and operational results for the three months and year ended December 31, 2025. Torex will host a conference call tomorrow morning at 9:00 AM."	https://finance.yahoo.com/news/torex-gold-reports-q4-full-230000779.html?.tsrc=rss
2026-02-17	Yahoo	0.433	Assessing DRDGOLD (NYSE:DRD) Valuation After Strong Growth And Upgraded Production Guidance	DRDGOLD (DRD) is back in focus after updating investors on production guidance to June 2026. The company indicated that output is tracking toward the upper end of its 140,000 to 150,000 ounce range while keeping unit costs within guidance. See our latest analysis for DRDGOLD. The production update comes after a strong run in the stock, with a 90 day share price return of 27.09% and a very large 1 year total shareholder return. However, the 30 day share price return shows a 1.63% decline,...	https://finance.yahoo.com/news/assessing-drdgold-nyse-drd-valuation-050557070.html?.tsrc=rss
2026-02-17	Yahoo	0.318	Shares fall in Japan, while most of Asia's markets are shut for the Lunar New Year holiday	Japan's benchmark Nikkei 225 index fell about 1% on Tuesday following a U.S. national holiday, while most markets in Asia were closed for Lunar New Year holidays. U.S. futures declined and oil prices were mixed. Prices for gold and silver also fell.	https://finance.yahoo.com/news/shares-fall-japan-while-most-041631335.html?.tsrc=rss
2026-02-17	Yahoo	0.3	Golden Gate delivers gold, tungsten results for Resolution Minerals	Resolution Minerals Ltd CEO US Operations Craig Lindsay talked with Proactive about final assay results from the company’s 2025 drilling campaign at the 100%-owned Horse Heaven Gold–Antimony–Tungsten–Silver Project in Idaho, USA. The results come from the Golden Gate Fault Zone, where the company has reported further broad gold intersections and a significant tungsten hit. Lindsay explained that the 2025 program totalled 14 holes and more than 10,000 feet of drilling, delivering multiple gold discoveries across the Golden Gate target area. He highlighted broad intercepts beginning at surface, including previously reported results such as 253 metres at 1.5 g/t gold and 189 metres at 1.3 g/t gold. According to Lindsay, “almost everything that we drilled this year ended in open-ended mineralisation at depth,” pointing to strong expansion potential. For more interviews and market updates, visit Proactive’s YouTube channel, give this video a like, subscribe to the channel and enable notifications so you never miss future content. #ResolutionMinerals #GoldDiscovery #Tungsten #Antimony #IdahoMining #ASXRML #HorseHeavenProject #GoldStocks #CriticalMetals #MiningExploration #JuniorMining #DrillingResults #PreciousMetals #ResourceStocks	https://finance.yahoo.com/video/golden-gate-delivers-gold-tungsten-044513512.html?.tsrc=rss
2026-02-17	Yahoo	0.136	Gold Slides Below $5,000 as Lunar New Year Holiday Mutes Trade	Bullion fell as much as 1.4% on Tuesday, having lost 1% in the previous session.  The metal had rallied briefly on Friday when modest US inflation data boosted the case for the Federal Reserve to trim interest rates.  Lower borrowing costs are a tailwind for non-yielding precious metals.	https://finance.yahoo.com/news/gold-holds-near-5-000-235833830.html?.tsrc=rss
