Date	Source	Sentiment	Headline	Summary	URL
2026-02-17	Yahoo	0.05	PRECIOUS - Gold falls 1% on firmer dollar, thin Asia trade	Feb 17 (Reuters) - Gold fell 1% on Tuesday as thin trading persisted across major Asian markets due to the Lunar New Year holidays, while a firmer dollar also pressured prices.	https://sg.finance.yahoo.com/news/precious-gold-falls-1-firmer-014733902.html?.tsrc=rss
2026-02-17	Yahoo	0.0	Agnico Eagle Mines Pairs Record Results With Dividend Hike And Growth Plans	Agnico Eagle Mines (NYSE:AEM) reported record 2025 financial results and raised its dividend. The company outlined long term plans targeting 20-30% production growth supported by higher exploration spending. Management highlighted significant debt reduction and indicated openness to acquisitions as part of its capital allocation plans. Agnico Eagle Mines comes into this announcement with a share price of $216.59 and very strong multi year returns, including 27.1% year to date and 128.9%...	https://finance.yahoo.com/news/agnico-eagle-mines-pairs-record-043313879.html?.tsrc=rss
2026-02-17	Yahoo	0.0	Benz Announces Acceleration of Glenburgh Growth Story: >250,000m Drilling Planned in 2026	HIGHLIGHTS: Funded to accelerate Glenburgh exploration through 2026A$94 million pro forma cash following the recent A$75 million bought deal2025 geological work has transformed Glenburgh into a coherent district-scale systemThe granted Mining Lease is now resolved into three major gold camps, each large enough to be a substantial gold project in its own right2026 drilling to be executed across all three camps:Hurricane Camp (Hurricane, Zone 102, Zone 126, NE3): high-grade growth drilling and...	https://finance.yahoo.com/news/benz-announces-acceleration-glenburgh-growth-034100465.html?.tsrc=rss
2026-02-17	Yahoo	0.0	Gold Falls on Possible Position Adjustments Before U.S.-Iran Talks	PRECIOUS METALS 0136 GMT — Gold falls in the morning Asian session on possible position adjustments. Scheduled talks between the U.S. and Iran have raised cautious optimism that diplomatic channels remain open, DHF Capital’s Bas Kooijman says in an email.	https://finance.yahoo.com/m/7842b50c-65ce-30f9-8285-503ad807c13d/gold-falls-on-possible.html?.tsrc=rss
2026-02-17	Yahoo	0.0	Stronger Production Trend and Cost Control Might Change The Case For Investing In DRDGOLD (DRD)	In August 2025, DRDGOLD Limited reaffirmed production guidance for the year ended 30 June 2026 of 140,000–150,000 ounces of gold, with cash operating costs of about R995,000/kg, and now reports it is trending toward the upper end of that range while keeping unit costs within guidance. This combination of higher-end production expectations and disciplined cost control, alongside recent earnings and revenue growth with upgraded analyst estimates, has sharpened investor focus on DRDGOLD’s...	https://finance.yahoo.com/news/stronger-production-trend-cost-control-020629656.html?.tsrc=rss
2026-02-17	Yahoo	0.0	Why Are Traders Betting on $20,000 Gold Price After a Historic Crash?	Record gold call bets and surging metals speculation drive volatility as analysts debate market direction.	https://beincrypto.com/gold-metals-speculation-record-bets-2026/?.tsrc=rss
2026-02-16	Yahoo	0.286	SGDM vs. SLVP: Should Investor Choose a Gold or Silver ETF Right Now? Here's What You Need to Know	Compare how risk, cost, and portfolio focus set these precious metals ETFs apart.	https://www.fool.com/coverage/etfs/2026/02/16/sgdm-vs-slvp-should-investor-choose-a-gold-or-silver-etf-right-now-here-s-what-you-need-to-know/?.tsrc=rss
2026-02-16	Yahoo	0.167	Assessing Furuya Metal (TSE:7826) Valuation After Its Latest Half Year Earnings Release	What the latest half year earnings mean for Furuya Metal (TSE:7826) Furuya Metal (TSE:7826) has just released half year results to 31 December 2025, reporting sales of ¥43,900 million and net income of ¥5,011 million, with basic EPS of ¥203.85 from continuing operations. See our latest analysis for Furuya Metal. The earnings release appears to be a clear catalyst, with the 1-day share price return of 6.49% adding to a 30-day share price return of 67.20% and a 1-year total shareholder return...	https://finance.yahoo.com/news/assessing-furuya-metal-tse-7826-180648763.html?.tsrc=rss
2026-02-16	Yahoo	0.136	How New Targets And Mine Plans Are Rewriting The Story For Galiano Gold (TSX:GAU)	What The New Galiano Gold Price Target Is Telling You Galiano Gold’s fair value estimate has shifted from CA$5.38 to CA$5.77. This move reflects updated work on the company’s long term cash flows and required return, including a slightly higher discount rate of 7.41% versus 7.27% previously. Some analysts view this as research aligning with their latest assumptions on revenue growth, which now sit at 28.55% instead of 25.59%. Others emphasize that the higher target still depends on the...	https://finance.yahoo.com/news/targets-mine-plans-rewriting-story-231131713.html?.tsrc=rss
2026-02-16	Yahoo	0.0	BTU Option Grant	"VANCOUVER, BC / ACCESS Newswire / February 16, 2026 /BTU METALS CORP. (""BTU"" or the ""Company"") (TSX:V:BTU)(OTCQB:BTUMF) announces it has granted a total of 4,000,000 stock options to directors, officers and consultants of the company exercisable at ..."	https://finance.yahoo.com/news/btu-option-grant-183000652.html?.tsrc=rss
2026-02-16	Yahoo	0.0	Copper powers profit surge at Australia's BHP	Australian resources giant BHP reported Tuesday a jump in half-year net profit boosted by demand for copper to meet the world's need for electrical power.Copper is in demand as countries expand electrical networks to harness renewable energies.	https://finance.yahoo.com/news/copper-powers-profit-surge-australias-232515694.html?.tsrc=rss
2026-02-16	Yahoo	0.0	Forget Gold and Silver: This is the Metal to Buy in 2026 (And 3 Stocks to Play This Trend)	The precious metals sector is one which has provided investors with incredible returns thus far in 2026. In fact, for the past two years, the gold and silver markets have outpaced some rapid returns in equity markets overall, making this one sector speculators and traders have stepped into in a big way. There are plenty ... Forget Gold and Silver: This is the Metal to Buy in 2026 (And 3 Stocks to Play This Trend)	https://247wallst.com/investing/2026/02/16/forget-gold-and-silver-this-is-the-metal-to-buy-in-2026-and-3-stocks-to-play-this-trend/?.tsrc=rss
2026-02-16	Yahoo	0.0	Hedge fund manager predicts Bitcoin to $50M	Back in 2009, when Bitcoin (BTC) first launched, few could have imagined it would ever approach $100,000. Today, it might be trading around the $67,000 mark, but just last year, King Crypto climbed to a record $124,000 in October. Still, one hedge fund manager believes that even six-figure prices ...	https://www.thestreet.com/crypto/markets/hedge-fund-manager-predicts-bitcoin-to-50m?.tsrc=rss
2026-02-16	Yahoo	0.0	How Sibanye’s Renewable Deal Could Shape DRDGOLD’s Power Costs And Value	Sibanye-Stillwater has secured a large-scale private renewable energy supply agreement intended to provide long-term clean electricity to its South African operations. The deal comes as the South African mining sector rapidly increases use of private renewable power solutions. As part of the Sibanye-Stillwater group, NYSE:DRD may be indirectly affected through its power sourcing options and group-level energy strategy. For you as a DRDGOLD shareholder or watcher, the key point is that the...	https://finance.yahoo.com/news/sibanye-renewable-deal-could-shape-200718930.html?.tsrc=rss
2026-02-16	Yahoo	0.0	Lacking Money, Russia Turns to God in Push for African Influence	The apricot-hued building with its curved dome proclaims its affiliation with the Moscow Patriarchate of the Russian Orthodox Church on a sign in Afrikaans.  The interior is adorned with icons, rugs and candle stands, things more familiar to a place of worship in, say, St. Petersburg than South Africa’s Western Cape.  The continent has long been a target for Russia.	https://finance.yahoo.com/news/lacking-money-russia-turns-god-220002028.html?.tsrc=rss
2026-02-16	Google	0.0	Moore GCF names global corporate finance chair - International Accounting Bulletin		https://news.google.com/rss/articles/CBMiggFBVV95cUxQWnhLb3dhT2ZDcUtiSm11REloS0pXb2swV2Flbm1qYW9sc1pXTnVTV2ZXTlI5VDk4eWdfb09TWUpNZUk5QXdnMF84c1czanJza2lJRkd3Q19hcEt0bHh2TWNnRWRTdEgtSkRRRndEUjNVZDViVVBmWE5xVXczWXRnbEp3?oc=5
2026-02-16	Yahoo	0.0	Northern Dynasty: Update of Timelines for Summary Judgement Case	"VANCOUVER, BC / ACCESS Newswire / February 16, 2026 / Northern Dynasty Minerals Ltd. (TSX:NDM)(NYSE American:NAK) (""Northern Dynasty"" or the ""Company"") and its 100%-owned, U.S.-based subsidiary Pebble Limited Partnership (""Pebble Partnership"") provide ..."	https://finance.yahoo.com/news/northern-dynasty-timelines-summary-judgement-213000709.html?.tsrc=rss
2026-02-13	Google	0.0	GCF announces commitment to mobilise $100m for Chad - EnviroNews Nigeria		https://news.google.com/rss/articles/CBMijgFBVV95cUxNTU90MkpuUUp6S3oydUpIZXQyMDhETUVER2U4VGNCRzc4UnB4bmZSNVp6b1F6V0NieldvWWlyVTZJVEUtQlZGQlFIMmVnUHBnVDM3ekduWVc5VEZjelpEWktRYzc5YV9CbUFodV9NZUdpRWVrOWZfYlFFSm96VDBoMUM4QkdtdVNhX203ZlBR?oc=5
2026-02-11	Google	0.25	FAO, GCF kick off first supervision mission for Region 2 climate project - The Manila Times		https://news.google.com/rss/articles/CBMi1wFBVV95cUxNcC1uUUh2WWlKamxxTDJQR194SVVybDJURjkxT2JkRmVtVG5heUtEZURldHY5S3hyX3JWWGJ4NmNZUDRIU1pvUXRvUDNFVzY0QTFCQnlValBibWg2dnl4aExfYUgzSHhpM1VTX0Rvbmx6ZFMxN1k1cDhxeXNEblptVzFXRUdka1YzTjVxSU85ckJRTW8yQ19ScEZCeDd2ZWtlNnpEX1B6RWN1ODVqRVpNRHRJSDBveEx4NEZBN1dvY2EzYlRyU21RbFJKT1pSQXY3Ui1iUkotd9IB3AFBVV95cUxQam1ON3RwWTZQZlE5ZE9uS001aDg3OGtpN0VaZ184REpoN3p3NmRYTkE2ZHBYZnZYb3lCLUJSWjFvS2NuN200TFBsaVh6ZVJTQ0NRQjZjUkRfYjFCaHdicExmejdJZ1prWHhPbk5aWWtqemozcEpyWUp6azU2T3BQYjd3Z3l1bjBIN3Z6cloxMXhuY0c3SHQtSVBua25sa1pBQ3B0V3RQa1hVS25BQW9kVTF4eFNRRXo4ekJYVE1zVFk5aUNrV213T2VQbWpQYjZ2eFpCZlBrMUJfWmFy?oc=5
2026-02-02	Google	0.062	Gold plunges below $5,000 amid broad sell-off - Yahoo Finance UK		https://news.google.com/rss/articles/CBMimwFBVV95cUxQbm9oN21sQXVRaU1FemhlUENuNkFVUmQ2Y091Y1htbjVWRG9zOGJxd2xnaVZzQXBpYTd6MDJLVlR1eWpJUGF0X0VhZGttM3JoMk5PRFAyXy1qWndrdjA3WUJJSlhPQ3VDX2gwUEp3cFVwdEV6RHg5R0ZaWE56WUlvSmxUdVNoNDNqa2NCcFZWaXEzWjJvM3l0THpuRQ?oc=5
2026-02-02	Google	0.0	Gold prices plunge: 'The dam broke' amid Trump's Fed announcement - Yahoo Finance		https://news.google.com/rss/articles/CBMigAFBVV95cUxNaGp2eUpndVU2Z1NsMllSS1BrbEpRMmNYODNUdzZvcUU2QkdWX1U4bjN2WVBKOURDTW15ZUd6RS1jZmNVYmVWZXBNYmNTekJxTVZhSHNUNHFkSGJPa1JJSFVScm9oS0hnUjdZRW00N2dYMG1ERi0zcmd4ZlpCNDZsQQ?oc=5
2026-01-26	Google	0.159	New $2.3B giant joins top ranks of Memphis private cos. - The Business Journals		https://news.google.com/rss/articles/CBMioAFBVV95cUxOS29OQzF6NlBaVllPSm9wM25pZkR4d0ROdk93QW5OZ2pmYXE0UHhuaTlNQ1hNbHRRVlBDUDFuVm5nMFVaY0NfcTFSOGhEeGxscUExSFZjMHZOYUF4cU5maVhfTzlENC1sMHR3bnlKblI5LXBUVDdpNldBMnFFTHdWbkJRLS12Mi1XWERkZGdTcl9DTDUyXzdqR2N4My02d1FE?oc=5
2026-01-26	Google	0.0	Will gold prices hit $6,000 this year? Have your say - Yahoo Finance UK		https://news.google.com/rss/articles/CBMihwFBVV95cUxOTzRCZndNR1dPd196NkZnMVJvRVc4eWdFbHNhNHdybHJzazBLeUJlWTdtaHhwLVRnZ0JGdU81SXQxT1VIaGVsTlN0WHVaSkpad0FUTVZhV3lXeGktVVBnaUoyVjROZ0RKRFNxazRzbXpaWW5rWU1tdFNfTXBwc2lMa1k1S1RRUTg?oc=5
2026-01-21	Google	-0.25	Gold prices surge past $4,800 on jitters over Greenland dispute - Yahoo Finance UK		https://news.google.com/rss/articles/CBMimAFBVV95cUxQZTdYNnV3dnBQZTVkVmZ2T25jWEJxRzVlQ2ZLYVVfRXlTSlRRN0FmNm1EaDh4TzVaNEw5SmplZ184ZnJsMTFobEFRRmNRQ2lvbzBlTU54LVlHZUUxTGE2cEcyczFrUlVQR2ktZFAzakJyUDlGSGFka0xPTlJRa1VVaDY3WlpHcDBKc09fSEh3enV3cmk5LXlXWA?oc=5
2026-01-18	Google	0.0	GC=F Today, January 18: Ahmedabad Gold Hits Record on Safe-Haven Bid - Meyka		https://news.google.com/rss/articles/CBMimgFBVV95cUxNZmxSTTU4b3dfRTB1YllvS2diRkJfTl9vaGFZRzNOdDduaU9zckRJM3F0QVA3MDZEaDRJYnFMUDdnMDh0cW5oRnhCQW9FOGMzQWZPRTYzMFFTemE0aFRKZlR6ZE5xbGFnWWxYWHdTLUlhTm1RNk5NS1FvM29VWm1LenNrOUlrcU9DYkIySkd3Z3QybmFzRXJDR0Zn?oc=5
2026-01-14	Google	0.0	Closer ties, progress forged at GCF’s Indigenous Peoples Advisory Group meeting - EnviroNews Nigeria		https://news.google.com/rss/articles/CBMisgFBVV95cUxPenh5M3NWOHhrNndOVER3NlBqaUg1dFBya2M3cThtejdtZUs4dTRuczFlZUpXN3d3c1BjMllzS3BoMm9jOFpDTmFRdjhmYXJ1d1JhdTIybW9aNy1GMmhpclhsYkVfM1lBLXZ5WVJFOXB5Sk9sZk8wdmhoS0llNGs3cGdlWnVIZ2VjSUo5MnJuQVR5RU5uS3prRVppMWZDeGV0bFFWS09lbTV3UXFWNHYzMVVR?oc=5
2025-12-24	Google	0.0	Stock Market Today: GSPC 6,914, GC=F $4,508, NKE & DVAX Lead Movers - TradingNEWS		https://news.google.com/rss/articles/CBMioAFBVV95cUxQQ0Jwd2lNZEtCdVVkMDJJWHB1U3JMN2VUV2JxT0R2OWVJbF9qNEFOS25aekl6Tk02LWNYbnczbkRqbTd6MkphRnhUUUxXM0V1bW5sOG03aFk3M0RuVjVxQ28xY1pmSFFZQTc4WHFJWTdXRXFiZFU0V2ZOMUx1M0hyc3lYV182aHdPeU85ZFJzWEFUb2FFeTlPZXlNQy1MN0pR?oc=5
2025-12-21	Google	0.0	GCF: Strengthening Thailand’s climate adaptation capacity with Readiness support - EnviroNews Nigeria		https://news.google.com/rss/articles/CBMiswFBVV95cUxQd2tqcHVSLWwwdW5uaFJFd0dGYU1Jdll3eVZXeVRFMklUMV9iNWduZ25fZmViYVB5RWZYZnJybXJFb3NFbzRPaThNUWVxZm0tS0tyb1V6YXdSQldmU2o4VXBudi1IWFE5Rm5UT1V1V0I5eVM5WGJSVE5zQjRCcU5FMU02YVZIY2Vpa1pTcXdJOUFXRXlsbHFLNXdWRXdLQzUtTHFjNmFFTjVyWGdfTmk2MHZUNA?oc=5
2025-12-05	Google	0.075	Apply Now: Green Climate Fund (GCF) PAID Internship Opportunities for 2026 (more than 30 positions open with monthly stipend of USD 1,600) - Global South Opportunities		https://news.google.com/rss/articles/CBMi4gFBVV95cUxPd0t2Ukl1TGZFTjFNUWM2cVZodmxTY3NEaW5Xa3EzakpERUgyTlM5bFg5czVSU1RTSU9fdGNsTGo0X1l2TlBwVTBaUk9hc1E4VVNfYzJBS25wVENTNzdhUVZxcl9HQlZ5YTRCVXZ1MTR1TVBDZmRoZzROeEpGSF85alAtZVM5NU93N0UtMVpta3VuQ1pNVXlISHlnQmhTOGJ0YjhTUjFJOXlNM0g3eEw0YmM0MzNlWVBOQVdxNDd2dzNGaW0wNGpldEJjc2xVQ1RWOXJCUjYwYVB0Q0pnRUVQaS1B?oc=5
2025-12-05	Google	0.0	DOE-GCF IRMF Training - environment.gov.ag		https://news.google.com/rss/articles/CBMibEFVX3lxTE5UTnR6VWhoeUotaUx0LW5qdlhuWHFCeGExUHZ5VUsxYWcyWVh0RVZjTjI1dW15TExmN0hkSFp1SUFvYld3UnVPM2ZfdnFHcHg5RzMzOUFMZlJWX2U2N2d3dWdaMUdreGprdXFKSg?oc=5
2025-12-03	Google	0.136	Tonga Advances Coastal Resilience Efforts as New GCF-Funded Project Moves Into Implementation - United Nations Development Programme		https://news.google.com/rss/articles/CBMiyAFBVV95cUxOZGNHbnVHRW50TmoyVmU5d21NUzhyQWtYd1hfWEZEQ0V2QzY3c3FsRTlXUXU3NER0d3liSGExZDB0R3JlQldqWGJjWVNPZUJaQUNpNWFSbTd2UVM1WlJnQjU4NG5YNmhGTnZzLTM2X1pSQS1XOHBvZEpjbFZ2Y2Y2MVQzWmZMdUpkZjNyRjlIbXlkcDJiTl9ma3NPZTRmUWZMQ3ZLbTRqMnIydzI0V1RNMGhMcXRXVVVTX0lSNXo5Q2c2bFREVGpDTQ?oc=5
2025-11-16	Google	0.0	GC=F News Today, Nov 16: Gold Price Surge Amid Dollar Volatility - Meyka		https://news.google.com/rss/articles/CBMilAFBVV95cUxNQ004bm5jN2gxZ2VwcjZzbWNwMmctWFRvempxVUFyUGxIWXVfcURZcmxndHV3d0ppajFZa2RScXEyeWF0NmlIcXBNdk5ZbkNMNFFoTnlMSnlMTkJRRU5GNjVYTmtLTUdod1l0R3VWdGNEYk80bUZFaHpmY2FpNzR6Qmw3TmFfb3pfUWpaaTNjbXpnbWg4?oc=5
2025-11-16	Google	-0.1	The Green Climate Fund (GCF) is Hiring a Climate Investment Specialist – East Asia and South Asia: Salary: USD 129,400 plus applicable benefits) - Global South Opportunities		https://news.google.com/rss/articles/CBMiakFVX3lxTE9kT09RdUJoYnhfXzZ4RThuNTVmNEVGQjBqSjBOc1hPdUhSZ0d4cUxKbmo4d2ZGNmdoYXA5QUItWWkwTEx3THVWU1N4WUZXUXM2d05YUDl5Ul9WWTFJWUJIZHNCYkRrQWl0aGc?oc=5
2025-11-15	Google	0.04	MoFEM officially accredited as a Direct Access Entity to GCF - Vanuatu Daily Post		https://news.google.com/rss/articles/CBMi1wFBVV95cUxPZ1FkdU8yV3NYY2pUemJ4SUpRVk9ONkF3Yng5NVEtNDdIWWNBTjZOLS0zaUhnVG91bnlGWDNpb1BXYlhqM0lJQmZ6Uk1JdnpTWHZlQ1pWRnhFVWFDRGZKaW9jSFpNODdaV1RsMnZ3dWdZOC14dmZsWkZ5dlZNNC04SGZvNGY4V2lDNlFYWnd5RkRuX19oMnlfNW15MGNzaWQzM3FRYlBRYWY3RjFSZGVzWjFuWU10QWRJTU9kMzdrSU5rTFg1NzF0cFU4Z3hacWt0WktHQVhqVQ?oc=5
2025-11-13	Google	0.067	GCF backs $27M early warning system for T&T - Trinidad Guardian		https://news.google.com/rss/articles/CBMimwFBVV95cUxNY2dnVHZlbFlzUTJXTnFJck9kZzFubGxmb1pSNk1oMS10a0NWTFBlY2NXT2s1RXgtQ2x5NWwxamJsbThZNjZ2ZmxXVEJYQll6M2xVcGNFckRmaHQ4Yng5NkJzYXp5a3YyZkVoNEtlMjlHc0Ywb1JBREoxU3hrWjlVZm5CUUtIWFdCQmppRVBpR0YwNTNmTTExRmtVcw?oc=5
2025-11-06	Google	-0.067	Green Climate Fund (GCF) is Calling for Applications: Learning and Knowledge Manager - Apply Before 17 November 2025 - Global South Opportunities		https://news.google.com/rss/articles/CBMiakFVX3lxTE03aDlJTHNyeUM2cjNiSWI2REl1N3EwTURIQU5oRXd1Vk1EWU1sWG9YS1dKeV8xOVFMRE5KQ0ViRTNac2lncG9RVFFybmNrdUVOTTZvWVVaRmN6VmM0b01ER0k3MEVWS2hyR2c?oc=5
2025-11-04	Google	0.0	GCF approves $50m for climate-tech investments in Egypt - Dailynewsegypt		https://news.google.com/rss/articles/CBMingFBVV95cUxPeTlGOE5LNXd4M25zdGw5bmh6bjgzVm5mN0x2NXBHSnNRZXZKdGplQk1DZEZyLUdFUzRlbncwVWNkcFE4OTdQdWY0djg1Vk9VRVRUWWYyWENZSVotS0ZIU1JEeGJUeHJsMlBZdVRJOTZTd0ZiTEJJRFFieUE2WjVmbjR6ZXFEWUVNX0tiTThmT3lvejdScUM3UmZFWEVadw?oc=5
2025-11-04	Google	0.0	Tata Capital, GCF Partner to Support Climate-Tech Startups in India - Mercomindia.com		https://news.google.com/rss/articles/CBMilAFBVV95cUxNeW1heHVhSWdVbkhEeTZQcklXODZaenpBTVBsRHJEdGtrbXRpNWwxNHhpenlNMDBIM1FCVklEOVdLaU5yejJsT25iTTJlNjdNTHl0ZWV6dE1mYXRFa290cTV0c2E2SV9DcG9iaUViaFdMYW84bC1RYkg0TGZzMXRmcDhSWXBSMWJMUDRLLThaS3A3TlNx?oc=5
2025-11-03	Google	0.025	Kshema General Insurance to receive $20 million capital infusion from GCF - Business Standard		https://news.google.com/rss/articles/CBMi3AFBVV95cUxPckNKTy1wODZod01GU3FTNTlNLXZVS1hHaFphWmxma05JeVNtbk9qTW9DVXQ5bTI2UktHV2tEUVVCVS1IVUlLTmxsemh0MUxhWWJxNWFkUVZKVVdqbkdUV09OdzJ4SUlKMzVVUXZBRjhCMUlnbVVveGVwUFV0WTAxaDIxc2ViNUtBM0Z1TmM0THV6ZkppdVpZSHgxSk9LT0EzRkREVWN1eDFrZ281WmZRT0tuTUZfQUxITDlMdy1KRkNtbE9FQ3JYN1I1WmRFM19LUk9GaG5xaGpmRm9E0gHiAUFVX3lxTE14Mm11ODRqdk5KNkJodEhuYzZlVlV3Rmo0R0xDNnlrbEVNVkpRTTRnX09QRW52M01IV1YtWmFTNE5JX2RZWlRpYTRlZ1ZGbUV2YzBKUm9BUjh4NEdQRnk4U0tTMVFEaFhvUk15RDFscmpWUlVnS1FRMnVqNnBaRGppMjBHOGFUZnRWZlRpZ0JiU1F0WE03VTdzUV8zWmQ2R3JfNEZzdThWWTRCaTdYa3ZMVFBXYUZwbk1zbDRqZ3BZeFo4MnpYeF9TQm1ObS1hT1lGcXU1eUFQVGtSTS1LYlJCa0E?oc=5
2025-11-03	Google	0.0	MUFG, GCF-backed Climate Adaptation Blended Finance Fund Raises $600 Million - ESG Today		https://news.google.com/rss/articles/CBMiogFBVV95cUxQVnNmejZOU215a3hIWS1LdF9tbEJRd0s0S3ExQ2MwUTRyOWh1TXNpWWI5VTlkWi1UR0ZvS1M5aU5iV1l1UjlUN0x6MmZCZUJrcEhBaFhMOGRoQmh6WXNqZmdyc0RQeXp4QnNCcHdKR2dNU2EtZU55WW5lUi1YU25remZBSTRfS05HMmdOR1dGdzd0QzlFUTQ3Rkxrbkc4RFczc1E?oc=5
2025-11-03	Google	0.0	Tata Capital receives $16 mn from GCF to back climate-focussed startups - VCCircle		https://news.google.com/rss/articles/CBMimgFBVV95cUxNNDZuSVNLd1ZpSlE4Y3l1c25hNzhzZjZuV0V5ZE5JOTdoZHRNMldvbXFVbVhvUHVBMzc0R0tzX21yWkpoMWxpWjFvVDFsRGxBQjJpYWRpQldsdTF1ZDFOZkRncVVmbS1lc3pBRHViaHRXdkg5R25RSUw4X3c3VV92UmZRS19oakxWa3Z5Y0gyTXBVYWdsU3JzNENB?oc=5
2025-10-30	Google	0.0	GCF approves USD250m for ‘Glaciers to Farms’ - Business Recorder		https://news.google.com/rss/articles/CBMiUEFVX3lxTFBGa2dHNzZjTXpCbkt2RjFlSkcwQlRSV0hYcW5RZzBFeE9LQUtaMjRiYkNia0tqXzVPRVZCb21uYWN4b1p6bGgydG5WLVFzcFdX0gFWQVVfeXFMTzEwc1hrMmkxRVRZYkNNT3F2T0JDbTh3TkZJS3VYMkxiTUl4TklFanZqMnVuLTZTek1TXzh2cVJnVURlOTg0dGV4Z1g3X0lSd1pQOWFhVGc?oc=5
2025-10-29	Google	0.0	Mandala Capital Earns Capital Injection From GCF for Southeast Asia-Focused Ag Fund - Global AgInvesting		https://news.google.com/rss/articles/CBMitAFBVV95cUxQSDR2ZTRDTDNicVMwU2lTYjFQeHZZMHVERnI5T2YxTGpnT2FFa2wzNkdJbHIwaFlIRmJZYmlZNHBEZWJLRU40YTJHZXJ0dndtZlJlQ0l1alQwNlJ0aEJFc2psTWs2S0lxc0NoYlVaREdqQnpuN21aaVFiQTl4UmVqQ29hMnlZUnpjN2tkVzMyc08xUkhDSnRfZ01WR1MxSXpkNkpTOHhpU3hyUmNxYmI3ZEdKbXg?oc=5
2025-10-29	Google	0.0	Pakistan to benefit from $250 million GCF-backed ‘Glaciers to Farms’ climate resilience program - Profit by Pakistan Today		https://news.google.com/rss/articles/CBMi1wFBVV95cUxPYkdOZXNiYm1fVUFMTWtXMklpSXBPLW93NWxoZzFRUDZIZXcwYUZ0MWNsWnM4R05KM24wbWNBalMwLUJkNnZTMHIwZUhSQ3FNOEt0V1pZaDlIcXR4VnNsS21VaVUxbW9vdU9Va3J0aFp4dmlHSVFWRTFaT2czQmE2dHJUc2YzZk03TklVeEdwOHV1cDMxdnNQQWM1VkpNcmplNEN1SFNsQkhUYWJsdDBLRi16UWZqWWRqM2M0WDBiQjBDbFZIQkVSbmpHeEc5aXViekoySXo0aw?oc=5
2025-10-17	Google	0.2	GCF Regional Dialogue with Africa - United Nations Economic Commission for Africa		https://news.google.com/rss/articles/CBMibEFVX3lxTFBidkZSelRpS3RUQ2hhNVBrT1hGa09YclY1WTRNMjVBZk5veElwOFJyZzlMb2MybDlyenBKYl96clV4X3RWdnFiUmh0MWJXZVZuYXJCRHN3MXlrT1Y3OTFCMXRpVnktMXJ1UWZ6WQ?oc=5
2025-10-16	Google	0.147	Resilient Roads and Clean Water: GCF-UNDP Transforms Rural Infrastructure in Lautém - United Nations Development Programme		https://news.google.com/rss/articles/CBMiuAFBVV95cUxNdkZPWnJ6Mzk1aXlGZXFfLVJudXk3Wm1EMGZ0QkdQWi1iWWhxYzExM2E1RWJJUHNJV3NpT0gtVnk0TWV5dHdIei1NWE92OWdDY3BfS25aaXV4NjBzYUYzamF4UWU0dnkyZXA4RFJWTEVQT0k5OGQzU1oxRUM1NUpoUmdOUUplYnJuXzF2U19NZFRsSnBzMXB2bHFfd1RJU0dLVmV4MllQRi0yZGd1TTJvS0o4Nm53ZGtp?oc=5
2025-10-15	Google	0.0	BofA expects a gold correction: Strategist explains why - Yahoo Finance		https://news.google.com/rss/articles/CBMijwFBVV95cUxNWnBXdlRhcUkwRnY3Tnl2YzlySUp0eHNSbUVHbjBwTWY5a1RfSkNwTFVUdG1ocU5JbkRFY2FRODRUbHdIV0tLQ2pqVlhHRWRneEVDWDE0YXBNNTlxVEpTMUtBTkZQQmIySmFKcEJtXy1aQ3E0VjljSE55RFdTaFoxNHdldmhuY051VTJ5Wndiaw?oc=5
2025-10-09	Google	0.0	Gold price could hit $5,000, analysts say - Yahoo Finance UK		https://news.google.com/rss/articles/CBMikgFBVV95cUxPdVd2ZHZ1NnBVdWtGbjd4a2NzZHlidzEyYTNaX29FcjhweHlCUTlVN2piNWJXSEZlMlJEd0kyM0JMTFpySl9UaEhqU1lMWmctc21xeFhWcHhkdTVyX2RDSGNHejZsSTJKUnRhbVJMMFFjbFBYSFdaSm9yMnU0UUVTbkRXQXF2bFVWLXBhVm8xTWtPQQ?oc=5
2025-09-24	Google	0.0	GC=F News Today: Gold Price Rallies on Geopolitical Tensions and Rate Trends - Meyka		https://news.google.com/rss/articles/CBMipgFBVV95cUxPNzZ0aGh4dEJmZ3VuZTNjSGFYcEx5anIwcVJ5VXVpY3ppR1N1Q1JteFZZWlNweWFZaGJtYnNfVUUwUF9jblphMXp5Y0hIdk1BYkNJbTd5TlBWM3FQYUZQTENzR2hReFVLa1ZVelgtWDFFN204aWxkbGNET1FvUXdlUFpSN2F2NWVCOHZKa0NyUVozTlEzUlBEZDVMem1pT2FELVh0UllR?oc=5
2025-09-24	Google	0.0	With high-level attendance, Iraqi Government and FAO conducted GCF-funded SRVALI project inception workshop [EN/AR] - ReliefWeb		https://news.google.com/rss/articles/CBMi1wFBVV95cUxOUlhsd2ctTTlRcDJ3T3FmWVBzcVZDSVpwZm9EQkJDUEp5d0hFSks5ZUR3cHJ3YUxQM0RTdkF1YS1SN3dIUEo4S3RsUWo2UTZYeDg4cjJhS2tqbmNXZGxVd1lsb3FkN1NSbUNBbkxlREVxdmFFeW5GWGFzcXdlZjdrTHg5NndNbVpVdjFibVFoTjJmOGNrMWFNRk95NVFySWotUEtsNGhfRmloYWpBcFBTVlNGTmh6M0dzSDFGeVh3dDlJeHJxTC1DVlBGSHp4ZmNFWndYTk5nSQ?oc=5
2025-09-23	Google	0.0	GC=F News Today: Gold Price Jumps 75% on Central Bank Moves and Global Developments - Meyka		https://news.google.com/rss/articles/CBMirgFBVV95cUxOei1wNFZfdjI2U1IwM01Zd1RDSTlEelJjV2xYWmtvQ01zVEY5eF9LRDI3eXNkUFpjYzNRTlJVQW8waWVnSklUaGMtSWlIdUVQamRqWmZJTl9JNVpud2lhLWtSaU54V1VVS2M1UHMyLWd5NTJSeXNYRDAzYU15UW84VEg1NmtVM1NsVDdIZ0RUTnJOY0kzM2ZySVBFbHRVSUxVREhMaVh0b0tYdFExeXc?oc=5
2025-09-15	Google	0.1	Gold price holds near record ahead of Fed interest rate decision - Yahoo Finance UK		https://news.google.com/rss/articles/CBMijAFBVV95cUxPQVJTRGc5aW9LV0hNcVBRbm5fVk92NkdINndYZkhJUVZpZGs3WU5wR2huZmxKWjVXSVJCM1NiOEdhNTdXaG5NTXljN0tPN1VSSkZKeFByd3pZY1I5VXdDd28wcDUyd3FGaUVqWnF4ZlhlMkFUSktzUDQtc3c3TXBKVEtnMDdtWDJ5dkUxYQ?oc=5
2025-09-08	Google	-0.133	EBRD, GCF, EU sign $50 mln green trade finance deal with Suez Canal Bank - Economy - Business - Ahram Online		https://news.google.com/rss/articles/CBMiWEFVX3lxTE9RbVZDUlA5R3AyYVpDN09xTi1BVWNTZU1FZk90RXBrR0NObUQ1TTFydGlnd0J2QW9BLVBZcEpZRWl3cEtOTXhiM18zN25VekV1SW5ybWRtSkc?oc=5
2025-09-07	Google	0.067	GCF funds $54 million in Belize climate action projects - Amandala Newspaper		https://news.google.com/rss/articles/CBMijAFBVV95cUxOTDd5d0hwc053Zk1NR3Q3ZGNxUnZQQ2pUdmpDcFhwZ0pBRVNjbWt4WG5BTHRYNUVTZmctS20zZU5DSnRXMS1vXzN5VHlGSFBycjQzOTViX3pEWUpKTVMtNUw1YlhJZ0hGTnUzMk5uaE5YalVmeC1Db01nVDIxS2RNdjlmb1RoSnBvd3c1UA?oc=5
2025-08-26	Google	0.0	JICA President Tanaka Met with GCF Executive Director Duarte ｜ News＆Publication - jica.go.jp		https://news.google.com/rss/articles/CBMifkFVX3lxTE9zeEhfcjNFVDEwaVQ2YTV5elJGeG5VNFVURllESWl4WDN1a3FTMkFEb2QyZDB5WExCVm53c2dmd1Z4U1lnQ3lMRGpuSjJMTS1HbEJyZVZTN0hzMF94X0tZS2YwaE5NUzVJN0dPekpDSm12bHVNeVgwWG9VZzhkdw?oc=5
2025-08-25	Google	0.0	West Papua drafts plan to use GCF Result-Based Payment funds - ANTARA News		https://news.google.com/rss/articles/CBMinwFBVV95cUxOVkEzbWRXUklRblBxMk5OODFXMEREVXhoRmNQVnpQSkpfcXpRYkVFXzZxZmNpUTVMNFgzT1JUMUhMT3UzMW9vRzRtWWNUak01X1lvLXRlc1Z2eHNKNWphc2MycEdGMmJvQUtIVThuYnoyb1dPejdVQXFYMlJhd0J3Q0FuLTZVaGUxeHlVUzF3T0pOelhtRV9uYnNoci1uMUXSAaQBQVVfeXFMTks4TERtRVFJUTZPZ1NmMjlHVGVvZFJaVzM4SjZfNklqNGFSWWRJem5EQXFzUkd0LXJFaEh6ai1MbnVvbUhkdk9MNVgxc19uTDItN2VEUTBBSHFWZTRlLXJ3NVpoSFhwc0JGSVVZSUIzVVUyQklGdXpsSVhzWVJSbHFzc25QMnBhSTBvOE9zdmNfYXQ5NEwxdFFTR2lGUGZER3loQjE?oc=5
2025-08-22	Google	0.25	International Paper sells GCF unit, closes more sites in the USA - EUWID Pulp and Paper		https://news.google.com/rss/articles/CBMitAFBVV95cUxPRHJma1VPZ0ZYelVZRnVVRG13WHdVRDRCRi04QTcyTlNGQWIzNHQzMGlNMkZ6c0xOZEhGRmVmSFo2STdZREJYcHJIR2trZ0pUbmhMQmdSQW1hUG1lLVFSR3lLdHdWOWFqU1g2WVIxZldEVVcwUWF4OWN5Y050VmZxMUE0UjFyUGM3OHpaUFItTkdPWWNWaVRYX2p2OG4yR1hydXYwY29rT250TUZmMnpUQXgzY24?oc=5
2025-08-22	Google	0.067	International Paper to Sell GCF Unit for $1.5B, Cut 1,100 Jobs in Restructuring - Modern Distribution Management		https://news.google.com/rss/articles/CBMixgFBVV95cUxQdzIyN18tdDBpYVlTa3VCQzY3TXlQaGlEb2VTQmhrMngybW5RRkRzdGhLV2xkZmxnUUUyZ3pBRkhac2ZHbGhYTmRjNDJON3ZKQmhSN0FRdzZSM1ZlTWxwaDR6ZjVLN0xKVC1WTHdqdldtY09BbEhIMGdvX0RrMWFQWVpDOUp6XzZYdG00ZU1TM3BtZ2lTYVlNM1kzVTEyWnBzc1hMbklKY0JLbmVoZ3JtTUxOTzBQS19paE9EN2YzTWJFb2hhQkE?oc=5
2025-08-12	Google	-0.067	Green Climate Fund (GCF) is Seeking a Head of Strategy – Apply Before 27 August 2025 - Global South Opportunities		https://news.google.com/rss/articles/CBMicEFVX3lxTE94Wm53TWo4N2twYkhheFFCTHBTYTNwVkJiWU1IcFNzcTJSemhaSnJ5UnlvdE53eE1rODJwSjJ2YjY4MmhnVzRJSXAwU1VDX2RZeVJ3NG41N2hGMWU5Z3hsVURLaGZUYXlKXzJwZElXOEo?oc=5
