Date	Source	Sentiment	Headline	Summary	URL
2026-02-28	Google	0.0	Technical Reactions to VIXY Trends in Macro Strategies - Stock Traders Daily		https://news.google.com/rss/articles/CBMizwFBVV95cUxOVXMzWWJ2R3ZuVzVzYS1WcXdrdnZReS11ZG4wVndodHF5NHhMM3ZqbnV1WlBNVFFhWVU1UklEV0NnS1dzS1dsUVRNc3BMa0VMZ1ZKbS1tbHZQVkVnTGZ1cjR4SUozX2pSSlNtTHdFY193djhkaUNVNlU5ckIyUmd0VVZ4VUx1Y2Y4TDg4OFpjNnlfMkNfaDlhWjV1NkdlSmpvdGtzUWFaYXlKbHNnRkdLUmlYQ2RBcVBRM0VUdzgyai1ma0phTjlfRFJFdm9rSDA?oc=5
2026-02-13	Yahoo	0.0	Why Volatility ETFs Deserve Attention as a Short-Term Play	AI jitters, rising debt and a spike in volatility are shaking markets. Here's why volatility ETFs may deserve a closer look as a short-term hedge.	https://finance.yahoo.com/news/why-volatility-etfs-deserve-attention-160600926.html?.tsrc=rss
2026-02-06	Google	0.0	(VIXY) Volatility Zones as Tactical Triggers - Stock Traders Daily		https://news.google.com/rss/articles/CBMivwFBVV95cUxQVGpVSVBPdkJ1VGdQRkZZR1hQRm5Kdm56TkpxNGdxeHI3TmRZaXl4bXhFVXJQS3JZZEdwLXhlV0dXQWFBTWh4YkdJMVBPSjhadE1DRDhacXRmOWwxUmF4N2xNLV9qRTg2UlJqWjNXOUlNc0Z1U0dXRWJJd1RPbllBVVk4X1Fudy1malc4NmVTVFBjZXZRaERjS0ZTZjMyeWR2Tkd6YVJQY0R1R2pKejdWdEVlMUY5eVNTbnVpbWs3RQ?oc=5
2026-01-26	Google	0.0	Price-Driven Insight from (VIXY) for Rule-Based Strategy - Stock Traders Daily		https://news.google.com/rss/articles/CBMi0AFBVV95cUxQUzIxOUx6MEVSWkRHQ3dUWWxEc1RrUkVYeW02Qmc5ZTI4R01MOVIycFpRUy11cXZPa1BaeENNMklBTXNFNmFCZmdlamdndkpHd20xTEQ1OEgtdExzS0locGdsZUV4V3pyWW1OTEhTNGlFWVZBa3BzQjE0OTJrQk82QVpwQ0hfN3VoRVpva3NpdnBFTlBmQTdXS0FCSFd1VWQ4SXJUd3pSYlhldXdVd0RjR25KWDEwQ2VSNDBMUlU3T19nSGtUYmtmdjIxT1o0eFg3?oc=5
2026-01-05	Yahoo	-0.1	Brace for Choppy Markets Ahead With These Volatility ETFs	With geopolitical tensions building and concerns about tech-driven inflation, volatility is back in focus. Here are volatility ETFs to watch.	https://finance.yahoo.com/news/brace-choppy-markets-ahead-volatility-152000111.html?.tsrc=rss
2026-01-04	Google	0.0	(VIXY) as a Liquidity Pulse for Institutional Tactics - Stock Traders Daily		https://news.google.com/rss/articles/CBMiywFBVV95cUxPb1NXdEp4Z2pramlWS0lkTVMtRlVuSTJhNWF3UjF1Q2VmTW5ZWGZLOGpHR290LU9NbWlVdmlmdHFDZnBNUEo3a2MxU0FSbnF1b1NNM2FodW1vaDJJSEIwUWxOLURRQlZiV3VQN0J0UVoxVkV3dzdRWHdVMU5OUGNzbVp1TmdVcUlfblh1MDdxY1FfNzVrNWlneTNMeGh6UWtkbjlOVE9vLU9jRWY0MTFCV2pzWFFTbTB6XzYzMkJ3VUZ3OFVRWmI5TjltTQ?oc=5
2025-12-12	Google	0.0	区块链黄小盖(@YellowGai)'s insights - Binance		https://news.google.com/rss/articles/CBMiZ0FVX3lxTFBUY2hnNG9zSTkya2lQU3BwSjUzNU1ybTlTbmxTTkRJcTV1QVRjWERoVTEzU2d3Ml8yZDR1bGNiYS15RFJ3WVU4azhfN2dUVTRrcmN3YjQtd1c2eXpCRFp6TzlKVWdnelU?oc=5
2025-11-14	Yahoo	0.0	Market Turbulence Ahead? Volatility ETFs to Consider	As tech selling raises volatility and rate-cut hopes fade, volatility ETFs stand out as a timely way to navigate near-term market swings.	https://finance.yahoo.com/news/market-turbulence-ahead-volatility-etfs-134500548.html?.tsrc=rss
2025-11-06	Google	0.0	VIXY: Hedge Against Another S&P 500 Meltdown (BATS:VIXY) - Seeking Alpha		https://news.google.com/rss/articles/CBMiigFBVV95cUxPY0pSQVlmRno1X2hHaXR2T1B3c2RSVjJ1Y05sU3drUV9fZi1aU1VLb29Pc0pyX0NsNGJkOUZHbzNuRDgtWlR5Yl9FWk5DQW5SeGRhSXNhT3dNei1LZTdQeUdhbElKbFFlWVJtZWJEdkRYZ2tCcEFWRWpxQkFIRnFxWV9qSTdhSDZWRHc?oc=5
2025-10-13	Yahoo	1.0	Here's Why Volatility ETFs Can Be Your Best Bet	As trade war tensions reignite and AI bubble fears mount, investors eye ETFs like VXX, VIXY and VIXM to hedge against rising market turmoil.	https://finance.yahoo.com/news/heres-why-volatility-etfs-best-161600691.html?.tsrc=rss
2025-10-08	Google	0.0	VIXY Merits A Sell With Risk Premium Out Of Wack - Seeking Alpha		https://news.google.com/rss/articles/CBMikwFBVV95cUxPQTd0RE1PdE15WkpDOFNRT1ljVHFJcVoxQnRQSk9FVFBKZFNrMGtnNHRUNTNyZnc4dUwwblBidzJNX2hjUmYzVFIxaVctMWNfNmtpQkxMeDJtSUg4R0UydERYVFlSMmtDaUUzeDJFLWN6WFFORDlDUWl2SllaaWFrNHl3dXVKcXA0VWJ3WGRnU1o0bG8?oc=5
2025-09-18	Yahoo	0.0	The Zacks Analyst Blog Highlights iPath Series B S&P 500 VIX Short-Term Futures ETN, ProShares VIX Short-Term Futures ETF and ProShares VIX Mid-Term Futures ETF	Tariff uncertainty and looming Fed moves could fuel market swings, VXX, VIXY, and VIXM offer ways to play rising volatility.	https://finance.yahoo.com/news/zacks-analyst-blog-highlights-ipath-090500762.html?.tsrc=rss
2025-09-18	Google	-1.0	Why Volatility ETFs Are Among 2025's Worst Performers - Benzinga		https://news.google.com/rss/articles/CBMisgFBVV95cUxPWUs3Wml4T094YmcyUUprVS1faWZ5dVBlNW4xRmpQem12NFU5dk9peFc4WXlwMnlfTG9yTlI4SDMtZlpKSkN4akNVdFBwZDRtSktDYmRrMllHN29TM1pZOXFIZkhhdDdoQks0V1FQck80b2JEY0p3cXplWnR4aDJBZ0REOHJpSzJaYThjWU1qVF9mbl9oUE1jZ05SZEQ5RmgxZE52d2xacnNRd1NUTzMzOXNn?oc=5
2025-09-17	Yahoo	0.0	Tariff Uncertainty Still Weighs on Markets: Volatility ETFs to Play	Tariff uncertainty and Fed moves cloud Wall Street, but VXX, VIXY and VIXM ETFs stand out as volatility plays.	https://finance.yahoo.com/news/tariff-uncertainty-still-weighs-markets-154100711.html?.tsrc=rss
2025-09-15	Google	0.0	The Reasons To Consider Or Avoid The Leveraged VIXY ETF (BATS:VIXY) - Seeking Alpha		https://news.google.com/rss/articles/CBMinAFBVV95cUxObUhERG5SZk8tOE1teU5qSzl1NlZjWV94VnF3SzYxalNZSFNBZFhPd1ZvR043UGJUdk11Nno3MnZVRnFIRmR2YXNHNTJUSHh2ZnVzQklHTV9CTzNlbHYySkczNURnWUdSUXpDZXV3OG1BZW1ZcnplQV9fRVF2eXZJNzdqU2ZLTEVhRHluLWlKZ1JWamE0MXB1WHZsblI?oc=5
2025-08-28	Yahoo	0.0	Why Caution Still Matters in a Bullish Market? ETFs in Focus	Rising inflation, record U.S. debt and AI-driven risks are fueling volatility, ETFs like VXX, VIXY and VIXM offer timely hedging options.	https://finance.yahoo.com/news/why-caution-still-matters-bullish-163800735.html?.tsrc=rss
2025-08-04	Google	0.333	VIXY vs UVXY vs UVIX: Comparing Top Volatility ETFs - ETF.com		https://news.google.com/rss/articles/CBMikwFBVV95cUxQZmRPbnhZZ2xzMUhKQS16T2tmMlR1aWlSVF9zbDcwZ25hMVVHZXI5Mlo3OXlnZFNTa3NHNWtGNV9wMmx6TklWMTBIRXdDTW5OVFhDd1Q3eUYwWW9iMnBXaGVyNFQ4NnB4cVBIMUVPNnBKLW9NSllrQnh6OWdDaUZ2RzBBSGNnRTFLR2JmNTl3RFEyR1E?oc=5
2025-07-17	Yahoo	0.0	Ride the Volatility Wave With These ETFs	As inflation, debt fears and Fed uncertainty rise, VXX, VIXY and VIXM offer a tactical hedge for short-term volatility.	https://finance.yahoo.com/news/ride-volatility-wave-etfs-195300053.html?.tsrc=rss
2025-06-18	Google	0.0	Play Short-Term Market Volatility With These ETFs - Nasdaq		https://news.google.com/rss/articles/CBMiggFBVV95cUxQa29PeWNCU215NnRHci15bHBfUXV4aEE0MkNMdUR4R0xIZDdpVk9uUDR3YzZFM1VHdHBGcURjSHA5QjdYME9MNVpheHBtdk81UUIxVEVoYURpckppNm0xR0JGN2taZExhNm5IbTZhZU1Ub3ZhdmpvS2kzMXRrY2JxQm9B?oc=5
2025-06-18	Google	0.0	VIXY: The 2025 Market Paradox Investing Tool - ETF.com		https://news.google.com/rss/articles/CBMifkFVX3lxTFA2SVY5SFE2aEJGSElJaHpIU05uZWFXODFXclZMT3lrcjRpLU04cjdyeFdUbkpvUUIySkV0a2pFU2VCQmdIeGc1YmhqZThLMktEU3Aya2VYdzJTdC0wN1M4SHpLLXdkRVlVNV9hUE1IUkpkZjdvS0lBRmRnVzUxdw?oc=5
2025-06-17	Google	0.0	Is the VIX Too Low Again? - The Globe and Mail		https://news.google.com/rss/articles/CBMirwFBVV95cUxOb0tDT0JDVDdEUHRUQVZlVEZOdzduckhsMjJRRFFqaExicVl3YzN6OGYyY1lBeEhJVXFXU0JkX21LZUZIZ2xZQVktMlZPYXVrcVNCazI3M0JqYkpucjJZek5pRWI1NmloSlJzdlQzT2V6cEo3U2tIUVJiV1I5dzI4MjdOTnNlNGNWVS10MmJsRXlqLWU5OHd5NkJwRElZUDlob21IZktmZ2xRNWNheTcw?oc=5
2025-06-17	Google	0.0	Palmetto Grain Brokerage - - Palmetto Grain Brokerage		https://news.google.com/rss/articles/CBMiekFVX3lxTE9IWDVVNFVES01mTnpCX1JUQlVRc1BvX2ptald4NU9Ma2FtTm1EdVRCY24xYW9VakVBeTZvUnVET2czWjI5WXpnSjB3WHNtVGZ2bW9EM1NuRktzbzI0R0hDM0RvNGJOMWFBRktOeTI2dGFVM2ZRUU9yUFZR?oc=5
2025-06-04	Google	0.0	QDWN, VIXY Among ETFs Posting Biggest Declines in May 2025 - ETF.com		https://news.google.com/rss/articles/CBMikgFBVV95cUxNeFVkU0ZsbWJDRXY0Qmp0Z05TMXFPWEM5cFFZdS1VR2hoUlk2Tnc0d1ptU3M2emVmVWtRYVV6NllXVm51RU9UQk9VUjZ3QzR6TnA0SlBrZXROdzE0N2Q5bC0xUmZNU0NGTnM4MnRBYzBLOXlmT2JFaTNvXzNhRHpyMTRjWHBIUGFZVklUSVNMc0cxZw?oc=5
2025-05-28	Google	0.55	Best VIX ETFs in 2026 - The Motley Fool		https://news.google.com/rss/articles/CBMia0FVX3lxTE8tNVlaV3Rud2NqQ1dqQTNIOFJKOURGTTFLeFRIVmk0WFYwcFRHSGs4THRRVm9hb2xDbnZ6ZWF2S0xLM1R2YXZYSmRtTjB1blJfX1pLVXl4RkJqQUdfM1kzSXRFZDBsVG5hYzdF?oc=5
2025-05-16	Google	0.0	VIXY: The Fear Has Subsided (Rating Upgrade) (BATS:VIXY) - Seeking Alpha		https://news.google.com/rss/articles/CBMiigFBVV95cUxQeGZQWlYtNlpBcHNSRGQ4VXdoRVlGcWRJWjhsZFVIRGJsX19vYjJXeVZZY1YyOVF2R0ZwendwUzh4aDhaTktjT0F0Z0VJbm5iZkxZRTJFR0lfQlpFcVBCcnNiZjIyZEZkLWtfa3dnRGxrQkJVOVFqeFdwZC1xeFdHQmozeEY3ZkljMVE?oc=5
2025-04-11	Google	0.0	VIXY: Today's Volatility Levels Are Not Sustainable (BATS:VIXY) - Seeking Alpha		https://news.google.com/rss/articles/CBMilAFBVV95cUxNQl9vREFJTTJLRmQ4NWFCT3RfY2kwQ204RkV1ZGYyX3Vmd1gtd2RkUkFZNmdvSWQzRmtTQW4taE5RMGJmWG1JNnVob0lqYWNjSVRTZkx6TkJmZVpUR2lFUXRzZk9Yb3BUczhkU2w3X3gzR3hZY2FsSlllR2lqTWg2aGhPZ2NlWXVxX2hoa3NPYVdQMFU3?oc=5
2025-04-04	Google	0.136	Volatility ETFs Roar on Trump's New Tariff Woes - Nasdaq		https://news.google.com/rss/articles/CBMigAFBVV95cUxPMHNpQVpqNGtLRFB1YWdINmxBTGFDMWdpYkxPSndQd0d0NTJwZzdIeDc0U216Qko1X3ZoRWhrRTJQMW1tT0hfSEszT2lZR3BJMnVBdHM5RFpXWE8tNjE4MlRYYjQ5cXRIQjVJZnZQbG9yMlk4dHoySXA5aXlyVGtwWA?oc=5
2025-04-03	Google	0.062	Trump Tariffs Sends VIXY Soaring, ETFs Broadly Slump - ETF.com		https://news.google.com/rss/articles/CBMijgFBVV95cUxOdkxqSXpJdjV5d1NtQzhGc2FMOEF2TXZ1T19KbHl1VVNRN19zOTE2RDF4SV9uY0I5NFdSYVIzcmRsT2ZRV2FPYTVuWVZyYk54eV9KSDF2NlIyWnh0UU9BWmxEWkRJMnUzYmJpbndtZFE0Q2xTQ0sxcUstQjNOZkFxZU42QVRaaWpXeWFpYWhB?oc=5
2025-03-28	Yahoo	-0.03	Why Fearful Investors Shouldn’t Take the VIXY ETF Bait	You’ve probably heard of the VIX Index before—it’s often referred to as the market’s “fear gauge,” a symbolic barometer for uncertainty in the stock market. If you’re a more seasoned investor, you may have tried investing in one of its indirect proxies: the ProShares VIX Short-Term Futures ETF (VIXY). But here’s the thing: the VIX isn’t something to be traded casually or opportunistically. It’s usually better used as a signal or a tool rather than a trade or an investment. I’m bearish on VIXY ov	https://finance.yahoo.com/news/why-fearful-investors-shouldn-t-132908168.html?.tsrc=rss
2025-03-28	Google	-0.9	Why Fearful Investors Shouldn’t Take the VIXY ETF Bait - Yahoo Finance		https://news.google.com/rss/articles/CBMigwFBVV95cUxOMWtfQXF0Y0tKMnR2amZ6Zks5ZExlQXFrTTNDUl9LekcyN3kwbEdaREhLVjhselkwZzB4TE41YzNrUjNxbmRNUWxud1doVUpwRm1QUjlmR1N4cWpUOW5FdlJVTHFuYmZ3NzUzZUo3aDBGNjNnZVVqZW1BQzdyX21mYWxFUQ?oc=5
2025-03-05	Google	0.0	Tariff Fears Send Key Volatility ETF Soaring - ETF.com		https://news.google.com/rss/articles/CBMiiAFBVV95cUxOQXFaNjBqdGVHMW9kVWtqUXBnSmlKZDAxSjBQSG1qZWdwWTQySjRldGdiTTVrUDFqckNVdWl1aEUyWWh6Y2IyWVl4UE5MWklpekJSbmthVmF6U1dSVmVQd0x0Z3BPdFRkajJsTmpnbEZ2eS1lWk1IamZzd1JJZV9QbTJqdzlwRFNJ?oc=5
