Date	Source	Sentiment	Headline	Summary	URL
2026-02-22	Yahoo	0.55	‘Money's moving out of tech’: Wall Street weighs stock market winners amid the AI scare trade	Investors are rotating out of the most popular tech stocks. Here's where they are finding gains.	https://finance.yahoo.com/news/moneys-moving-out-of-tech-wall-street-weighs-stock-market-winners-amid-the-ai-scare-trade-160024597.html?.tsrc=rss
2026-02-22	Yahoo	0.35	A Friendlier Regulatory Environment May Be on the Horizon for These 2 Energy Stocks as the Trump Administration Rolls Back Greenhouse Gas Regulation	The U.S. government is softening its stance on greenhouse gases, which is good news for these energy industry giants...for now.	https://www.fool.com/investing/2026/02/22/a-friendlier-regulatory-environment-may-be-on-the/?.tsrc=rss
2026-02-22	Yahoo	0.2	ExxonMobil Stock Surged 17% in January -- Here's What Drove the Rally (and What You Really Need to Focus On)	ExxonMobil rallied in January and is still holding those gains, but what you really need to watch is the company's two-pronged growth plan.	https://www.fool.com/investing/2026/02/22/exxonmobil-stock-surged-17-in-january-heres-what-d/?.tsrc=rss
2026-02-22	Yahoo	0.179	Prediction: 3 Stocks That'll Be Worth More Than Walmart 5 Years From Now	Walmart has crushed the S&amp;P 500 in recent years, but the red-hot stock is due for a cooldown.	https://www.fool.com/investing/2026/02/22/walmart-buy-exxonmobil-visa-asml-growth-stock/?.tsrc=rss
2026-02-22	Yahoo	0.02	Wall Street’s Latest Bet Is on ‘HALO’ Companies With AI Immunity	After a three-year love affair with anything related to artificial intelligence, U.S. investors are flocking to the factory owners, fast-food restaurants and commodity companies that have seemingly strong odds of surviving the technological revolution intact.  The winners include  McDonald’s Exxon Mobil  and tractor maker  Deere  Left behind are the perceived potential victims of the AI revolution, a list that has ranged from wealth managers to software firms.  In the past month, the S&amp;P 500	https://finance.yahoo.com/m/9f1971f2-c0c6-3364-9432-b31cd2c830f3/wall-street%E2%80%99s-latest-bet-is.html?.tsrc=rss
2026-02-22	Google	0.0	(XOM) Movement as an Input in Quant Signal Sets - Stock Traders Daily		https://news.google.com/rss/articles/CBMiwwFBVV95cUxONHRmM3NET1VBQ3lpZzFndFNHdkpHeW9CeFlyZnhTSWtnMFZNLVdKaV9feVVyZ01CemwycDJPYmxOemxHRUQxcnNmRGJlN1dueEZQd2F0SjZoa3lSS0k4dm9jOUlnMjdFLXZMeVVUSmd6ejhnT0kxeGxrYUlQeWdJN2stc1lkTkhLbDI1RGxCQ0RkZHpweE93UkRkQ0l1eXRoNDZacHNGX0ExeFNibnUtTWxhMmNncF9Yc25leGhabU1EYUU?oc=5
2026-02-22	Google	0.0	Exxon Mobil Corporation $XOM Shares Bought by Hillsdale Investment Management Inc. - MarketBeat		https://news.google.com/rss/articles/CBMi2AFBVV95cUxOQVNTU3RQMEh3WTN2dC1WLVMtNW1KZFlfZUhPbXJLRkpNRERNd2dLNmF0ZjAxX0daQkNfOV9lUlVXUXJYMldQVnByQ2dpSGtteXZqQW9XLW1yQ3NaWWgzTkoxOW9SZXRCUF9qQS05OXdXSEVoUWJ2ZVhzUWdMQzhqU0xVNDhXdTFjLU5mcGxOSjdxR01XQXV5QXBlZC1wLWpuTnZ3QnhWNW5mT0ZYTzRqNTdGdjE0M2YxUDJKZnNLVkFkOEd2WUgtaW5aV0hPanktTGQ4SkJISWw?oc=5
2026-02-22	Google	0.0	Exxon Mobil stock price: director exit filing lands as XOM drops 2.4% — what investors watch next - Bez Kabli		https://news.google.com/rss/articles/CBMiuwFBVV95cUxONDB6elVRUXlDVXVqYjIzN1dnMmZ6VzFRV0FyMlpPREFsMW9QXzNqQzJDSEhWbVVzRXQ0c2FlMWlXYUxZVE5udmR0QnRpV0NwdEdlUUdWOWlhanQ2dlNrTUc4d2k5czFtYmI1RlVZeW5wdHlia2NzOEE3UkZMLWJ5MlRISEJiUHdKU18zdVg3SjQ3djkwbE9zbTNpVE91NTB6eXU2ZlliZE9SUndoU2dRS1RaVWlrb1U2S19Z?oc=5
2026-02-21	Google	0.0	Exxon Mobil Corporation $XOM Shares Sold by Mitsubishi UFJ Asset Management UK Ltd. - MarketBeat		https://news.google.com/rss/articles/CBMi2gFBVV95cUxPOExySEkyYW95bUl5VWItV2JQcjdIME9rcG1QU25qLVVMcUJ0aTcwMmxDNGxlS3lXVEVDQlVhNUs3bTNSUk1FUGpDSjJ6dkR5NTVIbW1oWVpiZzhaWFJmZnF1b1hfd0FxVjdrX3Y3SXBCcGZfaXJRakZFaDJ1eDM3Wjc5R3Ayb0hhbXpTWXRwZEVEZ2N1cmRtdVZ6b3lSNlRNdVh4cmtXZUdtZDRaQWhuWjdBQjY5WTBucGRjZ18wQXRmeHozN0JvMjgycURRNFk2M0s4bzd2bldZdw?oc=5
2026-02-21	Google	0.0	Exxon Mobil stock price drops 2.4% — what could move XOM when markets reopen - TechStock²		https://news.google.com/rss/articles/CBMimgFBVV95cUxNdkcwNnhaQWtWTDdfYlJvMXA1YWYzbDRyUjJmYlRSQU5EVXQ5VTlEcTgxY1NTLWFqM09DOFl3UktZWXcxbGhMNjRfeUxTUWFkTUF1MHBTUTFPX0NaTmVkNW1HbTE3NkVVeE1rUGFaa0xRMTV4ODhuTXlFMDlwVDR5XzRFSmxnTFM0ZUhnYnl3b3QycDlkMzBhYmFR?oc=5
2026-02-21	Yahoo	-0.05	All It Takes Is $10,000 in ExxonMobil to Generate Hundreds in Annual Passive Income	ExxonMobil has a long history of increasing its annual dividend payout for investors. Here's why it can continue to deliver for years to come.	https://www.fool.com/investing/2026/02/20/all-it-takes-is-10000-in-exxonmobil-to-generate-h/?.tsrc=rss
2026-02-21	Google	-0.156	Exxon Mobil (NYSE:XOM) Trading Down 2.6% - Here's What Happened - MarketBeat		https://news.google.com/rss/articles/CBMirgFBVV95cUxQZkpyQzJ6c1BaV29ycUI5U0ZNZ1JFUzh0VDlVZWRScm45X2s4MGRZUDJUVDlLTXZ3NnNXMl9FY0NfWWFNbDR1Q0lxZ3VleHR2eFMyRUJ6MnFpalAybTFwTmROOFFYb05HZGszZllDNGZxdnh4ODZ4VG9zM3BUM0lQX0lHOVhmSDZHNlJwNHFZSGxVU1NfMzVuME02U05GMFNuVzRtYmhqbTFQQzQ4Q0E?oc=5
2026-02-20	Yahoo	0.15	Industrial Robotics Lubricants Market Size, Trends and Growth Outlook 2026-2030 Featuring Shell, ExxonMobil, Castrol, TotalEnergies, Chevron Corp. and More	"Key opportunities include the demand for precision robotics, IoT-enabled systems, and nano-additive lubricants. APAC leads due to robust manufacturing and robot installations. Industrial Robotics Lubricants Market Industrial Robotics Lubricants Market Dublin, Feb. 20, 2026 (GLOBE NEWSWIRE) -- The ""Industrial Robotics Lubricants Market"" has been added to ResearchAndMarkets.com's offering.The global market for industrial robotics lubricants is projected to expand significantly, reaching $16.2 bill"	https://finance.yahoo.com/news/industrial-robotics-lubricants-market-size-125100727.html?.tsrc=rss
2026-02-20	Google	0.0	Exxon stock price slips today: XOM drops as Guyana gas plans collide with market nerves - TechStock²		https://news.google.com/rss/articles/CBMiqwFBVV95cUxPQXhNVVFjbTdpaGV6OGtsUGxZYjBpTE0zZkZFT0FkYXY0RllZUFdfS1g0VmdIVndmUVVTWjZxcTdhM1lkb1ItNzUzbTJEX2NqQktUcy1tVDNHR1A4WmFTQzZXMjF6dEJrc3hfaFRNRi1CTE1JU3J1elNxUWw3VFJMU1lIenhiVjhNY3N4U0UxaFBvNFpvNTlDeWRvY1EyeUpwUWNOOVZLeHhCZEk?oc=5
2026-02-20	Yahoo	0.0	Here's How XOM Is Scaling Up Its CCS Footprint to Reduce Emissions	ExxonMobil ramps up carbon capture, launching its second CCS site in Louisiana as it accelerates plans to meet rising demand for lower-carbon fuels.	https://finance.yahoo.com/news/heres-xom-scaling-ccs-footprint-170300199.html?.tsrc=rss
2026-02-20	Google	0.0	Here's How XOM Is Scaling Up Its CCS Footprint to Reduce Emissions - Yahoo Finance		https://news.google.com/rss/articles/CBMigwFBVV95cUxPbjc3OEZvX0gwNFBRbThocUMyX3hDTDI1V0JNdDI0Z2RRSWFVaGJ3UlMxUnpuSzBjeG9PQnhqc2JMR2dWVl93NDdHcTcwM3hLbFB5MVh2eEp0LWhWWDl1WmVSeDlCSExsZTdmRWdpSWx0REk1S08xTkVlRVdBUW9PTHY0SQ?oc=5
2026-02-20	Yahoo	-0.011	Trump And Iran Put Oil Prices Near Six-Month Highs But This Energy Industry Was Already Rallying	President Donald Trump has set the stage for a possible military strike on Iran, presumably to pressure the country to meet demands for a nuclear deal.  The resulting tension between the U.S. and Iran sent oil prices near six-month highs and boosted some oil and gas stocks Thursday.  U.S. oil prices traded less than 1% lower Friday, holding above $66 per barrel.	https://finance.yahoo.com/m/e8b1178a-3447-3c3e-819f-5e7f9f9a4939/trump-and-iran-put-oil-prices.html?.tsrc=rss
2026-02-20	Yahoo	-0.115	United States Polyethylene Industry Report 2025: A $60+ Billion Market by 2033 - Rising Demand in Packaging, Automotive, and Construction Industries, Alongside Advances in Manufacturing Technologies	The US polyethylene market is set to expand from $47.66 billion in 2025 to $60.23 billion by 2033, driven by a 2.97% CAGR. Key growth drivers include rising demand in packaging, automotive, and construction industries, alongside advances in manufacturing technologies. Polyethylene's versatility and recyclability align with sustainability goals as industries pivot towards eco-friendly solutions. The market faces challenges from regulatory pressures and raw material price volatility. Nonetheless,	https://finance.yahoo.com/news/united-states-polyethylene-industry-report-115600676.html?.tsrc=rss
2026-02-20	Google	-0.2	ExxonMobil Beaumont Complex, Texas To Begin Maintenance Activity - TradingView		https://news.google.com/rss/articles/CBMizgFBVV95cUxQa3JHX3JidHFxMXhVNjE0eXpCNlN0bmI0dXhnY3ZvVl9paWhNRVFDUjR4OHFYcl9Ka3F1djJMa0hSUWJxd21DcHd0cjNYZ2JkX24zM042SUotT3lsbFE2Y1QwMUFfVXZsZHZmOS1JTFpUQWlyaEdlZXViWnFnRDhkTDdxdWt0Rk5EUTI4NzRSNl8wSnRxN1M3MWpJOF92Qk05RDZWMklqVXVoZXJuZDNTUDBaNUxhSzAtdzB2Njl2NkFPbXR1MXBuNV9hc2ZPdw?oc=5
2026-02-19	Google	0.617	Is Exxon Mobil (XOM) Still Attractive After Its Strong 1 Year Share Price Rally? - simplywall.st		https://news.google.com/rss/articles/CBMiwgFBVV95cUxOUDM3NXJCUEtDWkdoY1N1bF9SMVQwbllyWE1tcm50NEtRUG56SDB1NGVqa09yck1kcWdsR3psNEw1eDFHdDVIVHgtdExud0xNbk5KbmtCSF9FWG1VckNudzAwdXpxejBsdVFDejlZRVJDLXhKaUFHLUN1dUlPT3g5NkxUNi1iNzVKeDliVlg1NnV4aWJMZU1YTllKdTlIcmZGYm1YTkZkbTVpLUR5dDVob2k5eVNCa2NFRDBUTjFtZUg5dw?oc=5
2026-02-19	Yahoo	0.375	Occidental Stock Heads for Best Day in a Year. It’s Not Just About Oil Prices.	Occidental Petroleum stock surged Thursday after the energy giant posted fourth-quarter earnings that topped expectations.  Occidental posted its latest earnings after the bell Wednesday.  ConocoPhillips  gained 1.4% while  Chevron  and  Exxon Mobil  were up 1.1% and 0.8%, respectively.	https://finance.yahoo.com/m/c88a3b34-9ab8-3030-b105-c6d16583aec4/occidental-stock-heads-for.html?.tsrc=rss
2026-02-19	Google	0.267	October 16th Options Now Available For Exxon Mobil (XOM) - Nasdaq		https://news.google.com/rss/articles/CBMiigFBVV95cUxNdUpmTzlGNGJvNVQ0RHUzVE5CTkJJM0htZGszWGtJZTFwMkpiaC1kcG41aGc0R2VKVWFtM3MzLXpqd2FyOTVPdVJYYVRObEhhTXdWZGtBZVU5Xy1mV2laelpBVXRZM21mZE5NdzZkME9KaHNRX0dRb0xTck44d2lFc0M1VVBuSllLekE?oc=5
2026-02-19	Yahoo	0.229	MISC wins contract for Papua New Guinea’s first FSO vessel	The planned FSO unit will have an operational life of 30 years and a minimum storage capacity of 800,000bbl.	https://www.offshore-technology.com/news/misc-wins-contract-png-vessel/?.tsrc=rss
2026-02-19	Yahoo	0.15	Guyana Emerges as the Clear Winner in Venezuela’s Oil Reset	Guyana is set to become an even greater oil powerhouse as the easing of tensions with Venezuela following Nicolas Maduro’s exit lowers risk and accelerates development of the massive Stabroek block.	https://finance.yahoo.com/news/guyana-emerges-clear-winner-venezuela-000000438.html?.tsrc=rss
2026-02-19	Yahoo	0.117	Crypto Is Crashing — 4 Investments to Try Instead for the First Half of 2026	The crypto market's recent volatility has left many investors reconsidering their portfolios.	https://finance.yahoo.com/news/crypto-crashing-4-investments-try-143804963.html?.tsrc=rss
2026-02-19	Yahoo	0.075	What Exxon Mobil (XOM)'s Shifting Geopolitical and LNG Exposure Means For Shareholders	In recent weeks, Exxon Mobil has been affected by rising oil prices linked to heightened U.S.-Iran tensions, ongoing large-scale developments in Guyana, and new LNG-related contracts in Papua New Guinea that collectively reshape its operating backdrop. These events highlight how Exxon's exposure to geopolitically sensitive supply, long-lived offshore resources, and infrastructure partnerships may influence its longer-term growth mix and risk profile. Next, we will examine how heightened...	https://finance.yahoo.com/news/exxon-mobil-xom-shifting-geopolitical-210822970.html?.tsrc=rss
2026-02-19	Google	0.0	Burling Wealth Partners LLC Increases Holdings in Exxon Mobil Corporation $XOM - MarketBeat		https://news.google.com/rss/articles/CBMi1AFBVV95cUxNLVl4dzVNRnUzNUppSkRHS2xkUUJSWV9ZZnVSbVNkQXdoUkk5RXRFRUFnTTQyMmhiTzNkRV9HaG9scWdWUnRsVWZHZkpKTXBJTDcxbjBwd2FxQmd2YVBYWXVYSUtObVpUUld6enpwQmdZLXotMzR1VVZETDh6WW8wVUNITDVfWTdNZFZDMmdiY2hnaUVua3NNMVV6OWtWOGFzRkc5ZFJ6QzZTQWdmVWdSZ0QtVnlraDNCZ2JodW53dFZWMU5seVZRVzRqTXZlZF9IenlxTg?oc=5
2026-02-19	Google	0.0	Decoding Exxon Mobil Corp (XOM): A Strategic SWOT Insight - GuruFocus		https://news.google.com/rss/articles/CBMimAFBVV95cUxOdWxPSW1SenpYV0Q4NngwWHFPVmdNRGpPMlBVM3RHUDEtUThybjlVMmdBb1hsakNmc1JXRmVheU12LTBEMjdZbkVoYWVuM2lGV3N3eEtUZTVQcXh3RjhYNVItcHI2QXJULUNpMDJBZ0VaX0lPQXpKMWYtX0VUZlF1RDRJSUM4SFA3eXRzY0FEcTFXYWNFYXF5Zw?oc=5
2026-02-19	Yahoo	0.0	ETFs to Gain as Japan Pledges to Invest $36B in U.S. Projects	Japan's $36B U.S. investment targets energy, exports and minerals. ETFs like XLE could ride the industrial boost from this landmark pledge.	https://finance.yahoo.com/news/etfs-gain-japan-pledges-invest-143600724.html?.tsrc=rss
2026-02-19	Google	0.0	Exxon Mobil (XOM) Advances Guyana Projects Ahead of Schedule - GuruFocus		https://news.google.com/rss/articles/CBMingFBVV95cUxNOUdubzMxZmpCdmpTekRuZjFmbHBNbS1QOGgwanFTeUl1WlI5RmU4XzJYcVpJOWtpaEw1WW83XzFsZk12bHRFY0JGRGFhYWhwc3h3YjBBMGpMYktETl9NNjlCenMtMW54VGRvUDQwVnVxWVI0bWNuRlhjQzMwQXJJRzkwV2xBQ3JMUjVGVjlRaXVNa2FESkoyX1ZnU05nUQ?oc=5
2026-02-19	Google	0.0	Exxon working to determine Guyana gas resource, minister says (XOM:NYSE) - Seeking Alpha		https://news.google.com/rss/articles/CBMinwFBVV95cUxPZXMzdWsycnlGUk9iQmY2a3lBY2JoUzZ0d2Nqa2lxcjE3NlZCU3dYTGlEcmVhSXBlTUxjbjNvNnFreFI2TGZ3TERYQmVLYXF6eGNkZmppOGpVQjVobWF3dTZuaW5aY3hmNEFKZ1k3dFhRd18wTmpHcTExRm81dHA5el82N3dzR3g5UzR4WVhJU1ZRZkhkOFJ3THZxTFg1Qlk?oc=5
2026-02-19	Google	0.0	King Luther Capital Management Corp Decreases Stock Position in Exxon Mobil Corporation $XOM - MarketBeat		https://news.google.com/rss/articles/CBMi5wFBVV95cUxQdUFrV3ltS19Nc083SHh6elI3ZjZ1ZEpSY2wzdW9FaEQ0U3hrdnViRmhoRFd3anE3djBwYy1IN3ROb2piem1iTnY1dTRaSm1LRWdlZmlFdndNMjkzcFZob1poUVJ4Rk9NX1RQSnFhNlNVSE92NHk1WDlPenczX1RVaVNTa24zb1dqZ0M4bXFVVUY1cG1pb1JKNWFwUTFiMXl1Z2taLUlBMlZnM1hXNTJtQ2FhZzdlT25kYTJ4djB5UkNzV051UW5oc2RIdHdWREtReG0yb29QZTZqanJDdWVHLWVsaWxZVk0?oc=5
2026-02-19	Google	0.0	Pzena Investment Management LLC Buys 7,678 Shares of Exxon Mobil Corporation $XOM - MarketBeat		https://news.google.com/rss/articles/CBMi1wFBVV95cUxPMWY0TXVKbFFoVTh0M2lDZXdPaEV5WFk4WFB6QVRBR21WRGxBeG12cF9kRTFiWkxhYTNrcTBtUDB0Q3RqbG1VOExNUjN5RzdzNkhVREhRUVJiaUZ0Wk82QmJpYnNNczZuVWprY1R2UXJreEJianVnS2xRRV84aXFjTF9fSF92Q2JwOFNUNXBoQTEzU1FoVHM2eG84eGFycVNOWmFTci1pMS1ubGVFbHg1Ri1zdld1UVpmS0VFU1pxS1pKU3F0WVZ3OVNJeldLcUR3eHhJX2ZvUQ?oc=5
2026-02-19	Google	0.0	Synovus Financial Corp Buys 19,758 Shares of Exxon Mobil Corporation $XOM - MarketBeat		https://news.google.com/rss/articles/CBMizAFBVV95cUxNX3BmaW9taC14NC04SG9hVmI2WXhpNTNjUWx3Vm1nc0RFVkRmUmowZGdtSFNpcGRpcThob1RUcy1MNDhmWjdGUzZEQmlQTlJIdmFVaE5TSjhDVkNoaVplRXlfT0dnTjZkaVFpZERxODRVSFdFVF91RmZQOEtsQnl5OXlPTEF4bDN0MXVIejJrUVEwOWFick5mbl9XTTBRUG5yUTh1enVSSnh1U3pXcmNsbTFia0tQUEF2VnExeGtJeDZhaVZwY3EwelE3QUw?oc=5
2026-02-19	Yahoo	-0.009	After Years of Buybacks, Big Oil is Drilling Again	After years of prioritizing shareholder returns and low-carbon initiatives, major oil companies are shifting back to a growth strategy focused on expanding reserves and production as long-term demand for oil and gas is no longer expected to peak before 2030.	https://finance.yahoo.com/news/years-buybacks-big-oil-drilling-010000641.html?.tsrc=rss
2026-02-19	Yahoo	-0.05	Oil Price Rises Amid U.S.-Iran Tension. These Stocks Are Gaining.	Oil was building on recent gains amid reports that the U.S. military could be preparing for a strike against Iran.	https://finance.yahoo.com/m/ae62a8d8-f065-31a3-b582-1a8aa17b701a/oil-price-rises-amid.html?.tsrc=rss
2026-02-18	Google	0.125	First National Bank of Omaha Takes $9.34 Million Position in Exxon Mobil Corporation $XOM - MarketBeat		https://news.google.com/rss/articles/CBMi4AFBVV95cUxQc256M0Zmb2h3cVE4V0hzMDZHZTNGNVIwem5rMmFHUk85bjZSdUlZVHRKUEZiRnQ4bk4xQm5VaFBrVDF3ZEhORzhUYmVVYmF5NEFCT2MtTW5xVktVenp2RHZvRnVNTzlDZTJoa0hVTXE3ZGFORGw4bUxLNWFZM0N1a0ZaZ1p6bTNTdVlqeDhzbGpseEJHTmktdlIyblZuVThOLXdRa0NLV0RvT1VrTFZLUmFJYUtMWWNsenRHYS1SWF9sbzBSTkFrNEV3LTQyS0hBREd6VERjem13LWc2LWJGMQ?oc=5
2026-02-18	Yahoo	0.039	Exxon Mobil Weighs Long Term Oil Growth Against Valuation And Risk	Exxon Mobil (NYSE:XOM) is drawing attention for its role in long-term oil development projects as U.S. shale production shows signs of a potential plateau. The company is setting production records in the Permian Basin while expanding major offshore projects in Guyana. Recent discussions around possible international investments, including Venezuela, highlight new geopolitical and legal factors for future supply decisions. These moves come as the oil and gas sector faces pressure to clarify...	https://finance.yahoo.com/news/exxon-mobil-weighs-long-term-191223818.html?.tsrc=rss
2026-02-18	Yahoo	0.0	Eni Unveils Energy Discovery in Block CI-501 With Murene South-1X Well	E unveils the Calao South gas discovery offshore Cote d'Ivoire, which is estimated to hold 5 Tcf of gas and 450M barrels of condensate, its second-largest find.	https://finance.yahoo.com/news/eni-unveils-energy-discovery-block-163900627.html?.tsrc=rss
2026-02-18	Google	0.0	Exxon Mobil Corporation $XOM Shares Sold by Axxcess Wealth Management LLC - MarketBeat		https://news.google.com/rss/articles/CBMizgFBVV95cUxOaUFzMzZiUzRuZFNqaWllZEt0OXpxOV9lZERXWjE5NDgzSngya19nWHNLLWd6QnppWTB3cE5EeDRmM0NKRzFSa2hmV3pCOWZubHdmOU4ta2lWY0dNeC1UVHdLOXRZNU0wTFhUYnFVbHlJTF9GUGdlMVg3WlBaWWgzZENXRXNDYUJsaTUzSk0xcWJiWElOakdCWGVwZWFqX0tmSmdVeW8tUV81T3Y5eUl1TEIweG9uY1V5WWdaTFlXWU9jUzBrdUJzZ21IQ2c4Zw?oc=5
2026-02-18	Google	0.0	M&G PLC Lowers Holdings in Exxon Mobil Corporation $XOM - MarketBeat		https://news.google.com/rss/articles/CBMitAFBVV95cUxOVlF5enFiZXE4SnRjTHR4VTRuM0ZZWjhYTzliaUpFd2w0SUFraTE1aWoyMGY5R3FXZW1IeGlfeDJ3MVBQdEZ4ZFp5QmRXeW5hM0VmYVF1aDlVdnlENGtWZUF3YUxiZkg5VDRJN2JxQnp6WGltQXJqR2xaTjNBX1pZTzJGb2ZzTDNOVVo4VG54QWpfYkdzenhTOGlCUFFxVkttWk8zN2k1UV9SMWhHZFIzOF94YVk?oc=5
2026-02-18	Yahoo	-0.149	Key Factors to Watch Ahead of Par Pacific's Q4 Earnings Release	PARR gears up for Q4 results as estimates point to a sharp EPS jump, with lower crude prices and a positive ESP hinting at a beat.	https://finance.yahoo.com/news/key-factors-watch-ahead-par-153400635.html?.tsrc=rss
2026-02-18	Google	-0.156	Exxon Mobil (NYSE:XOM) Shares Down 1.6% - Here's Why - MarketBeat		https://news.google.com/rss/articles/CBMinwFBVV95cUxNVnhxak1va1YyRExZTUR2UU1Hd3c5eXN1YmlXTFZjOEpFcFJteUtiV25QMWpldjh2Ym1FRWpNTm5SRmdTMi1pN211UWtZM0xrbkw1clF3XzRMNWFuZzhRdjV0UjNSNzhoWW8zRmJXN2NxaE1FX0JRMVBYTEdfeXRtY0dsc2I4SHJHUWxRUmNmNzJFSlBKRzRiZVN4ajJWbFU?oc=5
2026-02-17	Google	0.2	Exxon pledges to move fast in developing gas in Guyana (XOM:NYSE) - Seeking Alpha		https://news.google.com/rss/articles/CBMilwFBVV95cUxPb01mVDdfNHFBUm1CM1NpTXh4alVpR3ZiaUZOZ3gtMUgwNjBKNzVvM19VaUJoallxcnRIXzROT3dUc0k2aUpwUjNQUFNwZS14VWQ0QmVad2Jxc2ViZTctWjhFZ0Z1cnRzSE9KeGtwTVNZOWFZSlFLNDJ6RFYyWFBqeGpSN0JHdHd3UFN2Ynd6R25BdExUUGhj?oc=5
2026-02-17	Google	0.1	Exxon Mobil (XOM) Accelerates Natural Gas Development in Guyana - GuruFocus		https://news.google.com/rss/articles/CBMiogFBVV95cUxQV0hPS3N3d2hQYWkyclRhWHhFUnQxRG5Bd0FRMzk4WlR0SGVFMlV5bmlqXzRiZ2k5NjIzMXVFb2toTzF0RFFma1pjTFBrYlV2TEliU3VxQ3lYQXNRZDFvUzZCUnNlR0Z4UUcwS3B6OGltMFlDelFuQVdnNnVvSnUyUDA5U0hVSDhudm9tM2pBU1hUa2JQdGtCUHVBcjJRTi1SeHc?oc=5
2026-02-17	Google	0.05	Exxon Mobil (XOM) Drives Guyana's Second Natural Gas Pipeline In - GuruFocus		https://news.google.com/rss/articles/CBMirAFBVV95cUxNaHpqVGhuXzdlcVVFWmtRVGRmOXMzUC05Nk56YWRaV2VnV2lsMUNNRFQ4Q0dmbVdoNlh1aTJESklPTlQ3XzRzTVAxT0t0a09nVlhnMlFsNXhSckxxQzdpaDdyTUJnbFV2bXVLUy12b3FDckR1OEhGVktETmc3ZWRCdzFrMVVjbC1ya0dEUDFyUmcydEJvOGJUZ3RHSS0yc0l3QVB3MHQ1aEt0MDdy?oc=5
2026-02-17	Google	0.0	Exxon Mobil (NYSE:XOM) Stock Sold Off Rep. Gilbert Ray Cisneros, Jr. - MarketBeat		https://news.google.com/rss/articles/CBMitwFBVV95cUxPdFJDVUppYjc1ejAzY0NjTWFNMWVOcHRxTkZMM05OZGUzVHFRaFFhQlZxZl85UW03bnZDMzV4c1U4U0RaQkN4UVVVYnVINm1OY1RvaXdVdllCb3MtTTJmeHdzelFHZzc4SEdobWIxR29VVjRlaWZZLV9Td3hrc2ZTNnU3NzFjUTdnZi1lTi0tOUtxSHdWLW0yZWNWTy1oNFdlSHVpb1ZyTkd0TVJOR3c3RTcwVkZxZmc?oc=5
2026-02-17	Google	0.0	ExxonMobil’s Jack Williams to join Morgan Stanley energy fireside chat - Stock Titan		https://news.google.com/rss/articles/CBMiqAFBVV95cUxQdlRmSEdnZ2ZOQkJmQm9mVDFLS2Y3RkxHeGZ6bDhsQmxPd0JiblJnVjljN1NucG8xT19kOFZoR3FTdlk3VVF5NW9vR1VibU9Cc0w3SV9qZ3NuajR0YlNES2VCWTUwMzV0VWplaTBYS2NMcnFNVEZGRktQVV9tNExQc0VCY0JibXc5MnpzYnBqU1NfbWVpSFM4dHNfdHNPQzlqaWhzbFB4ZnM?oc=5
2026-02-17	Google	0.0	Glenview Trust Co Cuts Stock Holdings in Exxon Mobil Corporation $XOM - MarketBeat		https://news.google.com/rss/articles/CBMiyAFBVV95cUxPang2NmtydDM5TDlpY1Q0Z1k5dFlmU3dmbE5iZE1feGY4aDltSWdDMFh3UDRQVUdkNG1sYTZEd3FRSmVBeU9HcVA5RDU3MWJTaFdyd3BLekxxMG5fSDh3WXZxeWIxSmZzdXlKNmJXN3BIbUR1cVVMeE9ubUY4RlFlMDg4V3lFRG8xLXRNOExxdnUzdU1UUEl4akdwNzdpN2t6UHhVcWhBQ1B4bFNVVjRVQVRyY1Y0VUtSMG9iSFF5dXZtY1ZkYURDZw?oc=5
2026-02-17	Google	0.0	Merit Financial Group LLC Purchases 45,124 Shares of Exxon Mobil Corporation $XOM - MarketBeat		https://news.google.com/rss/articles/CBMi1wFBVV95cUxQcnBHQXB6bzhFWURCczhzMTRRSlV2aFdrRG9zWXhjQVpnMzA0dUxjRk16b1JHMGs2WnBwTVhtZmZYVjJlNXJGVEtIU2hUYVV4WDQxMktTeWlrRWpFRWVQYmxiVTM4UFNRSGdSbGVGR0tYNzEyR2ZRd0FSSzNPYlJVYi1hTWVBLVR3TUVGYzh6c1M2U3NJOEU3eU9VYk13YW9QNzU5U3JPWUl2YVpHWUpzdTNKbWZjbFU2ck5UQWlZZU9pVFJnMWV6T3RqWkJGUnRqOGpZM2NWdw?oc=5
2026-02-17	Google	0.0	Mondrian Investment Partners LTD Buys Shares of 680,989 Exxon Mobil Corporation $XOM - MarketBeat		https://news.google.com/rss/articles/CBMi2wFBVV95cUxPd0piRG1BUjR6RVRzYWY4aFRXa2hLdXlyeHdKYzB1Y0txdlpPcVQxTmJyUFhGajhFODRNUFMzRGlZa1RrQnd4VUpGeFlENG5XN1V2WnZqb2JfU3pfZ0hWVzlDN2dwUF81ejd4VzJoTVlVaHlLQkhEOGdiY3EtNXR2Y0VDbEZZQXFJdHBFUzJQcFBMS1hoT1Ffb0l2b0xXY3cwQ0ozQjZkUzluc0pRQkpoMDMyTkJfT09MTkhSSEt4UThaOVA4emlUSGJJTnhpMzVJTW5SNUVJXy1hOEU?oc=5
2026-02-17	Google	0.0	Wealthcare Advisory Partners LLC Increases Holdings in Exxon Mobil Corporation $XOM - MarketBeat		https://news.google.com/rss/articles/CBMi2wFBVV95cUxPa19jZkhCdjFYV1RidWlyUkhIZVdReW1uZGJoNS1TV2VCLUxlTF85OS03ZDNjTzlQWWRLQkMzMXVUeEZpOElTUDJ4QTY0dUowTVZ0RHV0WTN0Q0FELW4xUm9oX1kzVjlNN3plNHVmMnVqdTVxWHNqUEtEWWhURnJfa0Yxd250Q0llY0w4MEFLMWw2cHV0dTB2eV9QUGZSSWxMWU1USDZqR1ZYWUJFejFmNUtCb3lpT2lNV2gtQVZ6bDlwRHN0dm9PYmZKd1lyXzZsWWFtd0FyMndYcWs?oc=5
2026-02-17	Google	-0.025	Assessing Exxon Mobil (XOM) Valuation As Mixed Signals Emerge On Long Term Returns - Yahoo Finance		https://news.google.com/rss/articles/CBMiiAFBVV95cUxNeDVoeGlzOGZxVmdjbkdrUFpENVpuNUphM1hZWm1RQmNEOXAtXzM2Z1h3QkhpWWM3VjlXenFfM015Z3V4dUpzSXNUSUVHclNpcmVKYmdkX3ZfWWVUR3RzS3VNTzd6aUpmOFpzTDE1RWpRenVYTHZQbUx4TGNXV2IzWVh6dkw1RDMw?oc=5
2026-02-17	Yahoo	-0.7	Cenovus Energy's Q4 Earnings on Deck: Should You Exit or Stay Invested?	CVE gears up for Q4 results amid softer crude prices and rising capital spend. Can the stock rally hold?	https://finance.yahoo.com/news/cenovus-energys-q4-earnings-deck-152200943.html?.tsrc=rss
2026-02-16	Yahoo	0.25	The shale boom that made the U.S. the world’s top oil producer is nearing a crucial turning point	The shale-oil revolution that transformed the U.S. into the world’s top oil producer is entering a new phase — one that could see America’s hard-fought lead in energy erode in fewer than five years as oil production growth peters out.	https://www.marketwatch.com/story/the-shale-boom-that-made-the-u-s-the-worlds-top-oil-producer-is-nearing-a-crucial-turning-point-a7bf72f8?.tsrc=rss
2026-02-16	Yahoo	0.0	Exxon Mobil Corporation (XOM) is Attracting Investor Attention: Here is What You Should Know	Recently, Zacks.com users have been paying close attention to Exxon (XOM). This makes it worthwhile to examine what the stock has in store.	https://finance.yahoo.com/news/exxon-mobil-corporation-xom-attracting-140003429.html?.tsrc=rss
2026-02-16	Google	0.0	Fifth Third Bancorp Sells 16,700 Shares of Exxon Mobil Corporation $XOM - MarketBeat		https://news.google.com/rss/articles/CBMiygFBVV95cUxNTGJHVWdTaHJtMVllQVd3WVROUk1LdVBuZmZzeEk1a3pHajF0MzFnMEF5Z0kzYlVLRUk4NFdabWhVa0FJNERGWkVpMmxpN0RkeGRzR0Nza2d1RHFlbTN6dUliT3ZPQ3lubHVHcV9QTEJCVV9OaFVtQlBONFdRaktGSkFRYkZXVGFMY3FHS1EwdEduczNEMVJmem42MHdoMkt5WlFqMFVONGJ0Vlh4Mm1iUlFGcVFtTE51WDBiekc1b3FPSFpKR3JfalFB?oc=5
2026-02-16	Google	0.0	Vanguard Group Inc. Has $48.42 Billion Stock Holdings in Exxon Mobil Corporation $XOM - MarketBeat		https://news.google.com/rss/articles/CBMi2gFBVV95cUxNcjM4N1ZmZkstTjRkbGtISU5VUkNsMWg1VkVrdjVvb29YUFRlQ0xCRGpoWDBDYW5uMU1UMlNtek12WmQzWkhwRzE1WFF6cDUxSWF0bjBkN3k2RXNGUFdIa01sY3QyTjQwUy1rR0p2YWtJYUtNU2pvMzdpOHp0RTh0VGhnZWo1SHZEem41Znd4dlhOUzduUXJnMGp5WVM0UjB5Y011aUt1TTFEWDFnTkU3eXpnQUlhZG50d3JoQ1kxVjJXd3ZMTkZCa1VQZXRYVDV0VXdra0Z5NVJzQQ?oc=5
2026-02-16	Google	0.0	Zions Bancorporation National Association UT Trims Stock Holdings in Exxon Mobil Corporation $XOM - MarketBeat		https://news.google.com/rss/articles/CBMi7gFBVV95cUxQdlpJdDVRRkJRYUpnS2lkNENjVGozYUVnNGpXeWJvbEcwR0NsM2lMMi1QeWJaZmZhbjZURmUzTW5oVlRQUWdUaUpfS0VGRVZ2RHozcU5LYnJWOENkdjJOWFd3UUtxN21zb09rZUtxaVJFUnFwQWp3UWpnb3BDeWFYV1RPdk5pamtZTWlVVm13NXRLc2M0dzB2cUIxQ19iclQyTVN2ell5MWRCT01xcE9FbllCNVY1WXBwWnZNbTlqUWszOVBCRHlZZVFoNWlHOGdrb3QzV2tkYndlVXBOc1ZKOVZQNDhZVlJfOHNtU1BB?oc=5
2026-02-16	Yahoo	-0.7	XLE Surged 21.6% This Year as Oil Majors Navigate $64 Crude Reality	The Energy Select Sector SPDR Fund (NYSEARCA:XLE) has surged 21.6% year to date as markets pivot from energy transition rhetoric toward energy security concerns. This performance reflects investor confidence that the fund’s $33 billion portfolio of oil majors can navigate volatile crude prices and deliver returns even when commodity markets remain unpredictable. The Oil Price ... XLE Surged 21.6% This Year as Oil Majors Navigate $64 Crude Reality	https://247wallst.com/investing/2026/02/16/xle-surged-21-6-this-year-as-oil-majors-navigate-64-crude-reality/?.tsrc=rss
