Date	Source	Sentiment	Headline	Summary	URL
2026-02-15	Google	0.0	Aberdeen Group plc Sells 161,025 Shares of Exxon Mobil Corporation $XOM - MarketBeat		https://news.google.com/rss/articles/CBMiygFBVV95cUxQb3RzZlNGc0F3QXZfOVVLM0M5UkYxbWx5bzN4Z1FTaEp5VjNOT2RsTlNwbFZCYmp5a2tCdXgxVnpYOTUyZWNJS3FLNFJURmlmRkhsZ0tUX0syT1hGWWZ3eEFuc0g5TW45czVHUnA2bVYwUWJnWUNlQThXUHhiNGNVaFJaelA2aS1QWEJ6NXFkWnhiWFNhd3BVdlRwU0NWZl95T2F2dnBvejlUX2p6ZXl0NHhGTVhzSHBzV3pYcFNSNTdaVmZfMWVYMXFn?oc=5
2026-02-15	Google	0.0	Shell Asset Management Co. Sells 55,733 Shares of Exxon Mobil Corporation $XOM - MarketBeat		https://news.google.com/rss/articles/CBMi0gFBVV95cUxNRTgzZWZFMW9GMUlFZS16WUEwM08tZ2ZLbng1RFFvRGpvdjB4cTEzbE5WMkFva1F1MFVvWEltczZaYmtNUDdxeHF3NUpIeVV4Z014Y2VqNVdDejAzNHc0ZGxURk9Vc3AyNTdKNzFPcDVDak5JYkJMdzVpS0JTZV9kWWtpY2xtNUctUWZDYmpSV210UUhQMTlKWjM3ekVfdjY2WG9NTVQyMlJLWGdveldGd2hzY3JWQktjQ1BjaWVlSE9CRkZLaFdORGNadmRyRDVyMHc?oc=5
2026-02-15	Google	-0.065	State of New Jersey Common Pension Fund D Boosts Stock Holdings in Exxon Mobil Corporation $XOM - MarketBeat		https://news.google.com/rss/articles/CBMi6wFBVV95cUxQQ1M4NDJ1cS10SWQtRGRwMk1RVTdYSUJ2dnpFRkw0VE9YSGNYR0ZSU0NTNEY5ZTc0eF9UYmh3My03MXNZeEhMbVNIaC1wZkNscWJCTTVIWXRwcm9odGJ3VnQ2c2s3S2Y4SENINU1lUzN0LWNaT3JMOVdSbE5udjdaZXlRaUZsWjdkbHNWQnU1UFluSnJkWHZYUlV4Wng2TE5xb3ExaU9WTmxJVG1xV1B3Z3lSSGhVeC03aHMwUWJ6NExXeUViaW9SUnhubG9Qdm1jdWhra1loUjdHSnJEbzZfd2l2ZFBlRklOaW9z?oc=5
2026-02-14	Google	0.0	Exxon Mobil Corporation $XOM Shares Acquired by BTC Capital Management Inc. - MarketBeat		https://news.google.com/rss/articles/CBMizwFBVV95cUxNbFF1SkNfQU9zVlJVbjRMb183LWY5TU1uMTRPaE9ONWx6SkQ1Z2Y0cEFXZk1JM3VaSGNCNm5JdEhXOWRpVmRwWGxLUVZxc0NRN214VS1vVGN3YVRkZE1ndHVka2RkeHdBOWljVG5KWVRMQ0VsTFpsZGN4blRIYVFWQ1lMRnozbUZjTG5RNmJiX2EyUVNicTVFVE01QkZ2STc2YjhzTVFyOEJxLTU4bXBGV2xocVlRVEhGM21tZldRZVBfTmtqcEJiaExyeFgySGc?oc=5
2026-02-14	Google	0.0	Exxon can sue California AG for defamation over recycling, judge rules (XOM:NYSE) - Seeking Alpha		https://news.google.com/rss/articles/CBMiqwFBVV95cUxOVjdtaU12S05RZ0M3WWlucWpIbEZtclVrV2ZYYlNmTzNTN3lCR25ld2ZuemFlMkdGeHd6UEwyZUFHalNPZ3d2N0l5bzQwVHY1ci1XaXRGelVjaVI0Q0JvakRsRFQzUTVrdTl3UUdYYWZfbnAzMEpXNVllak9ISWRTX0lpRHo5Z21zRTRQbGEwbW5TcWd6cDdTSzdrM0k4QnRmV1Q5MjYwT2xGd2M?oc=5
2026-02-14	Google	-0.312	Exxon Mobil Beaumont Accident And What It Could Mean For XOM Investors - simplywall.st		https://news.google.com/rss/articles/CBMiwwFBVV95cUxQd0JyYWxDLWpzdUd5VnhGM3lMQTB0SERmeTRnTldmNXdqT3FJU0l4ZzdNblExY3dhWXBVZDRaWVdUaXZUMVVhMEZKTTZPOFFweVBPYjRVZUVKR1RFZUwxd1l4OVFPSHgwUlJ5a3JBU1pORXVyVlNDd3VYSkdaTWRhTEFCQlVLYTZtMVFPVEVIbWY1bllWU3NqVkZwWlhQR2ZGZnJaSTBwc2VaTVNVcVpicnU1S0hiNG83aUdWVk5XS1FMSW8?oc=5
2026-02-13	Google	0.0	Assetmark Inc. Raises Stake in Exxon Mobil Corporation $XOM - MarketBeat		https://news.google.com/rss/articles/CBMiugFBVV95cUxQcnNlOHpZazQzYzRMN3dGRG5QMXAwZWdib3pwYXZTOHZxQzE1TzFydXpyNXJvcno5NDBqTUt5ekhlbVo5dldsbEVGenJXNlN2Vjd1dkVyQUFEUG9JckNMRmVmaXozSTdUR3FIeGlkdVRyT0RfTEpVV1lzQzg2X291M3Y2T1hYTW1YeHBibHBzZ0FGM1pBdDJBSW5OTEk3cGlhM2o2SDl6MGZwa09GUGh4MTdUSXNDa3lFcnc?oc=5
2026-02-13	Google	-0.533	Where Does Exxon Mobil Stock Rank Among Competitors? - Trefis		https://news.google.com/rss/articles/CBMiswFBVV95cUxNQmF0WlpfMGoyck5zenY5Mnlnd21DVkh6NWEtbzl4QmxQYVVSY2JScEhyX0NzZ0VaNC1tU0pKb2JGYW13ektIM0FhS3JvS1V4d1BBVEZMR1hrZmN4eXE0aHIyYVk0RDl3UEdvblh3VTctVVBFQzVxcTdCX0YzNDhCT0pUVGFGdEVNeDQzaTJwTkpQTXd3S0h5SWVlRmF5RHZLemlFakltQ3Flc3NuT2xxcFpKMA?oc=5
2026-02-12	Yahoo	0.433	Exxon Mobil Weighs EU Methane Rules Against Strong Share Price Momentum	Exxon Mobil has raised concerns over the European Union's new methane emissions regulations. The company warns the rules could increase crude import costs and limit access to compliant barrels for European refiners. Exxon supports methane reduction efforts but argues the EU framework may be too restrictive and difficult to meet. For investors watching NYSE:XOM, this regulatory debate comes as the stock trades at $155.56, with returns of 5.4% over the past week and 25.4% over the past month...	https://finance.yahoo.com/news/exxon-mobil-weighs-eu-methane-210849540.html?.tsrc=rss
2026-02-12	Yahoo	0.25	Comstock Beats Q4 Earnings Estimates on Higher Gas Price Realizations	CRK tops Q4 estimates as higher gas prices lift revenues, even as production declines year over year.	https://finance.yahoo.com/news/comstock-beats-q4-earnings-estimates-160300272.html?.tsrc=rss
2026-02-12	Yahoo	0.0	Chevron's Permian Scale Drives Cash Flow and Efficiency Edge	CVX hits 1M boe/d in Permian, leveraging AI, vast mineral rights and scale to cut costs, boost returns and strengthen free cash flow discipline.	https://finance.yahoo.com/news/chevrons-permian-scale-drives-cash-174800273.html?.tsrc=rss
2026-02-12	Yahoo	0.0	EQT Gears Up to Report Q4 Earnings: What's in the Cards?	EQT readies for Q4 results as estimates imply higher earnings and revenues, but the model flags low odds of a beat despite stronger gas prices.	https://finance.yahoo.com/news/eqt-gears-report-q4-earnings-154400894.html?.tsrc=rss
2026-02-12	Yahoo	0.0	I Predicted That ExxonMobil Would Join the $1 Trillion Club by 2030, But the Stock Is Already Up 24% in 2026. Is the High-Yield Dividend Stock Still a Buy Now?	Energy stocks are in the spotlight, and ExxonMobil is best in breed.	https://www.fool.com/investing/2026/02/11/exxonmobil-trillion-club-2030-buy-dividend-stock/?.tsrc=rss
2026-02-12	Yahoo	0.0	This Staid Dividend ETF Is Already Up 10% in 2026. Caterpillar Leads the Charge.	In 2026, the bet is finally paying off—with stalwarts like  Caterpillar Exxon Mobil  and  Clorox  posting 25%-plus returns.  It’s been a tough stretch for so-called dividend aristocrats, stocks known for decades of consistent payouts.  With investors suddenly jittery over software and other tech stocks, the script has flipped.	https://finance.yahoo.com/m/8f4090f3-61e3-34fa-9736-77f7ad80a442/this-staid-dividend-etf-is.html?.tsrc=rss
2026-02-12	Yahoo	0.0	US-led oil sales from Venezuela to bring in $5 billion in months, energy chief Wright tells NBC News	Feb 12 (Reuters) - Oil sales from Venezuela controlled by the U. have totaled over $1 billion so far and in the next few months will bring in another $5 billion, ‌U.	https://finance.yahoo.com/news/us-led-oil-sales-venezuela-215402892.html?.tsrc=rss
2026-02-12	Yahoo	-0.1	BKR Secures Gas Turbine Deal to Power U.S. Data Center Projects	Baker Hughes wins deal to supply 10 gas turbines for U.S. data centers, generating up to 250 MW in a long-term partnership with Twenty20 Energy.	https://finance.yahoo.com/news/bkr-secures-gas-turbine-deal-172500642.html?.tsrc=rss
2026-02-12	Google	-0.2	Is It Too Late To Reassess Exxon Mobil (XOM) After A 50% One Year Surge? - simplywall.st		https://news.google.com/rss/articles/CBMiwwFBVV95cUxNRldEbG9iN2s0TjVia1hkRHl1TVVPUE9iakhyMHowODNKVzRPQTcwVjZuX1dTS001N211Umtia0xPVnBYSXZOT0NJSVZYaGViS2NDVlBZSE1LY3YtTFR1RTlWVTlHN2NUQ216WC1KdTBvVWIyM2FkQXo4bkpYNkRVU3BnSDl2Uzdid0ZEUmNpdXYyUFNfdmRCWXRvXy1CaTk2YUl6NEdjS3gzeUhPRl9hRmw1ekhIME5zWFcyYTA4ZFpraXM?oc=5
2026-02-11	Google	0.8	Is Exxon Mobil (XOM) Still Attractively Priced After A 41% One Year Rally? - Yahoo Finance		https://news.google.com/rss/articles/CBMihwFBVV95cUxOU2JNZ1dTLUhnUUNENWpBR0x2VTJIbHpSc1dWeE5OY3ZCbjhDdHRQNWVlLWlIek45VjRoM3lBc01GUWpYSEhRNmp0Q3hNb21ROG55N21mckV4RWkzQTlzN29idGxmV3BVclRmWEhVUi14ZEhhY0dHcXdLZHpSbUdOa3pic1R6MUk?oc=5
2026-02-11	Google	-0.133	Exxon Mobil Corporation (XOM) Gets PT Increase at Mizuho as Firm Updates Estimates - Yahoo Finance		https://news.google.com/rss/articles/CBMihAFBVV95cUxObzY5RWNnY216OVlfclBuWVBORmt4RTVzdC1OOThVZk1WOFhUUE90SXppNXlqYXJISjlqRG5JaWFOTVd4akgtMnY5N1h5OTJPVDVOOEc1U200Z09kZlBJanpnZ3EzYkpHRF9ieVZuczhqQzVCUFVPbkZzblZSazNXdWxZN0c?oc=5
2026-02-10	Google	0.0	Cash Dividend On The Way From Exxon Mobil (XOM) - Nasdaq		https://news.google.com/rss/articles/CBMic0FVX3lxTE1tUVVCVzBtY3YyU2JUQUh1NzdvVWVqWlRCVEVyLWtKM3AwV0hFem1DTDl6eWRUQmtfcnlJdUhyN29FdGp0YVd3QkNxTk9iLU9YRDZRYmJLTU5Hd19paVBUMXhoaDYxcHVCSUdDVE9EN2cwTzA?oc=5
2026-02-10	Google	0.0	ExxonMobil | XOM Stock Price, Company Overview & News - Forbes		https://news.google.com/rss/articles/CBMiWEFVX3lxTFBkTkhEanE5RDBLUmU5UlJJOFpjdWJtdlA2c09aSUxwSlZqeVFQMnYydk5OVVc2aFNVMExXZTk4NHRXTWd1WC1NSWRDMGdBVWZiVFdCbWw5OC0?oc=5
2026-02-09	Google	0.314	SSL or XOM: Which Is the Better Value Stock Right Now? - Yahoo Finance		https://news.google.com/rss/articles/CBMifEFVX3lxTE9pXzhIUjlKVV9YRmZoOTFkMExHT1JteGExamVza1Z1VW9QZUI5ZHBaR2puaVQyOHVRNkFWb1JZMnNfUHE4UExYSkE5azhfVVNXZXlBdWNVWFl2NXJQNEdpWjlJdFlkVUQ4Z25KQURUTFRxcDRwMGtlWkJEUFA?oc=5
2026-02-08	Google	0.0	BMO and UBS Raise Exxon Mobil (XOM) Price Targets - Yahoo Finance		https://news.google.com/rss/articles/CBMie0FVX3lxTFAzX1NRbFhsbkNKbkc4YXhPa1dwOWQ5SEMyQVdpbjZXRmdDUXZZUG1sZnBQZkprdkQ1VDRneC00bVJOTExncmxySG4wdmRnSFRpa3lwUklxYW9IMXpadWV1WGNfdUVfTjA2UDVYcTVFc1NJQzg2cWxhX3ZNaw?oc=5
2026-02-08	Google	-0.025	BMO and UBS Raise Exxon Mobil (XOM) Price Targets - Insider Monkey		https://news.google.com/rss/articles/CBMilgFBVV95cUxOV0g2Vzh4RjBDQ0JNVUZnWkljYVB4SDZPQmpEZ0g4SFhjUTdsRGZHR1pjVGllcVhsaEw5eHFoYUpMMVB1dkQtbU9BVXJmcnZtNlA0TjhNaDI2eDNpLWFUUldzcURzNHhoWmpGSW4zdVNySUNoUFoxbzNZOThObTAzUGZQa1I3YkhqT0FMcEp2MTEwRU4zb0HSAZ4BQVVfeXFMT1YtR1lRTWpReE1HVS1YUEZIRm1IU1RENjBqOVd5QjZWMHpMdXFNcWJTR2ZLRUV6MUZhZTVkVjVyMml0X01wemY0YnRJMzhjQUJqbDhBeFJ5eE5oRDhRN2tKYzNyUTBkWGoxM0dndmtiTmh3VUI4SnlubjQzV1hHb0tyeks3RzluR1M4Y1hXVjVFMjF3T3UxeThwS3dsdmc?oc=5
2026-02-06	Google	0.6	Why ExxonMobil Stock Rocketed 17.5% in January - The Motley Fool		https://news.google.com/rss/articles/CBMikAFBVV95cUxOLWk5a1FKR18zbW5LLWhtZjVLTDc3V0Z1X2IwRVlEaFpJaUlOZ0kxanlUNFhGMUtrZWloN3p0WlZ3V0t2VU4xT3htX1JaSlB5blFWamJ1NXhVNU5UR3h2SlJDellxYzhkYzlPbTRrNmlwcEJnXzYxNG9vM2Z5Q2VsdVRZakI1bkZxV2dhcFQ0NUk?oc=5
2026-02-06	Google	0.0	Exxon Mobil stock price jumps as XOM shrugs off softer oil — what traders watch next - TechStock²		https://news.google.com/rss/articles/CBMipgFBVV95cUxQVFFRdUpmTW1ES204YWNUQm9LS2JpZHVpQTVpYVUwYTE1YjdaR2k0b3ZiVmVSZFNVRERyRHZpTlJvLTJMb0Q0TTJUczZwOWUzX1VjeWZuc0JVZEZqdnFwSzk2UTFMNjN1QVJTSHNkcE92eG02cnVXVURSU3ZwYVJwMnhFU01NMWR5QzFuWGV5aFM1VEZkSVJseVQ5cnRpNFRLQnlzQ05B?oc=5
2026-02-06	Google	0.0	ExxonMobil’s Guyana FPSO Move And Colombia Deal Shape XOM Valuation - Yahoo Finance		https://news.google.com/rss/articles/CBMiigFBVV95cUxOQzRwbm0zVWZTeG8tV0ZkT0xWSkFxU0hHR3owUXpXQXNicHlGU3BHSXVJdHNWRzVJUlFUbEFGanRtRmIya21oUjlrNW51R2dXbFhxS2Z1UWFMN00xWlU5cHRzN0dqZmpucFdSam53Y2hqUlZYS2VoNTlUcExUQVQ0aWdBb0ZrdGs0LXc?oc=5
2026-02-05	Google	0.0	Why Exxon Mobil Stock Jumped 40%? - Trefis		https://news.google.com/rss/articles/CBMiowFBVV95cUxQQ0pibWNWWGt5TlhxZkVqYnpjV1JBMFVLdzVhN2VIZURET0pzMzZoQVZWdTlfN3dEN3BNdFRRdk5WY0xuQjdObkNRSHFvcWd3N3RSVEhKMlRFQ0ZiaE8zcXl2N3BERTFCbzlUTUdYbV9XSkIwMU5ESHp5ak9iRWdfUEJPaVVEQ1EweVRreVc5VklTajFUVU96OWpWNlE2U2JWbjJF?oc=5
2026-02-03	Google	0.433	Exxon Mobil: Strong Value Despite Oil Rout (NYSE:XOM) - Seeking Alpha		https://news.google.com/rss/articles/CBMikgFBVV95cUxPakFsRjRWNHFfaFRadWlYcE90bnkwQXp6cGtSOUVRMTFwWm9VdE9RTWpJcjdSU0ZKMW16S3FPRmpJMENpV09uYmt1bWFpOGxsLWwyQ1VaSEpZV2lUMVYtd3Z5YWhnOW9HVnJxU2hhbXdLSzdTVG9mdW5tU1lKdWtYak9CcUU4dVpMa0VVUy1jUWJjdw?oc=5
2026-02-03	Google	0.0	Exxon Mobil Corporation (XOM) Is a Trending Stock: Facts to Know Before Betting on It - Yahoo Finance		https://news.google.com/rss/articles/CBMiigFBVV95cUxPNVBLU2sxTjNXWEtpSC1kaWw4SXU4b2FHdGNoQURDY0VXQ3pUTmNNbEE3S2loeGtPWUZEcFNETC15Xzh0UE1mbHRJZ3g2ODgtREN4SUF2UzV0RGQtZEpXRUJqRXBhU0NOd3dYUE91dGtqWThzVU5LQlBvXzFDM2xFa2pqMl9kc1pDU2c?oc=5
2026-02-03	Google	0.0	ExxonMobil (XOM) Earnings Dip in 2025, Yet Cash Flow, Dividends, and Low Carbon Strategy Remain Robust - CarbonCredits.com		https://news.google.com/rss/articles/CBMiwgFBVV95cUxOZndvWU5KS1pRbkJnbVk1SzhNZDVwQU03M2d5WXJ5ci1QdUhsZzRlNWFtQWJwcURobVA2akVuX213S2lIX0xfOEZJUzFIbUR4Sm5KdllzVlotcnJaQU1IY1NOWGo5NmZLVTZKRElaaUNMQmdUTlUtS05wTzF4bGFBclZzVEJsWFAtNjVQSUU5UTFBdktWRHU4Y3dvZ05DMmNvdzRLUUw2elNGalFneGlpQm85SzlzZU8zNXFFRUw4M3Zmdw?oc=5
2026-02-02	Google	0.45	ExxonMobil Continues to Prove It's in a League of Its Own - The Motley Fool		https://news.google.com/rss/articles/CBMimAFBVV95cUxOY0VVSUthbmZ0eUJ2M1BJV2FlN2F4d1Y2dVItc2dDa3dxTGpKM3h5M2F1WnRxdWtlRjhjcjdKY2F6b1B6TFNRNkczWFpBd05PdW9XOVJtZkNSS2JNbkhRZ3EwaVJ2eHRtekh1Q0ZUWGJhRWVNaFQ0RVZkVlppX0FOUGdxUE1rS0xWcDhaeUpXTTgtVmtUQkthSA?oc=5
2026-02-02	Google	0.0	Energy giant sends blunt $20 billion message on dividend growth - thestreet.com		https://news.google.com/rss/articles/CBMiuAFBVV95cUxOU3ItTmdyNjVaUWFNV2pmUFg1dlJfRlFSaWd4ZHVzaWYyd0IzM2lWX3VxY3k2YWhTUjhTdE5yeGNlOFdycUZ1cnhoX1lVdUh4VHdzdVBVMWhBWmZzMGhOeFNESmN5RnlqQ2tvN3Z3YXF3M2hSXzlVbDNmRkplR01nbkpzQ3BuV2ZvNjhfem1idHpJRFdyWmM1eWU0dkhYcWRQWXZfdzNSa2xNa3lXeEZ6c2dUOEhfbVZK?oc=5
2026-02-02	Google	0.0	Exxon Mobil (XOM) Valuation Check After Q4 Beat Powered By Permian And Guyana Output - Yahoo Finance		https://news.google.com/rss/articles/CBMigwFBVV95cUxQOUNoQ1N6WndSWlo1NWxzcHM5QXE1azFTMFJaTXk4MjNXMzVLclE5M1VrLU9qR3VWMHJxTjZOVXpIMkkyaGxkZ2RkS2IzQ1M2UExPeGNvc3M1VDlfMWx2bDRJb0xDUE50ZmFFbldnbFVyZjhSVFdZQ0VVMDdDV2UtOEVucw?oc=5
2026-02-02	Google	0.0	Opt-out - Exxon Mobil Corporation | ExxonMobil		https://news.google.com/rss/articles/CBMicEFVX3lxTE9lZVNtSWxlWUdnUzlWaGNTVV9oRTRuMURpclBFeXVPelpTY1BQVXNGRVREYUF4bVlwbEhseWI1ZUVQSXNwVm80dTE5SlJNME04YnpHTlNwNnVsS3VFb1ZZT1hxLVcwRWJFdDZjMWJsd24?oc=5
2026-02-02	Google	0.0	The Bull Case For Exxon Mobil (XOM) Could Change Following Record Output And Massive Buybacks – Learn Why - Yahoo Finance		https://news.google.com/rss/articles/CBMie0FVX3lxTE81QjBwMHY1TmE1azBsZU8yVGVSeUIyZ2RINHpoRG9iUXdBV25DSlR1ZDZEd1FSMHlGTzkzZHBwQzdGblZ6R3JodU54ZW5YbmxRTHZuc0ZmeWpreENFMVAtX2NQRWc5WUxDb1ZObVVLc016TEw2R09HYlFJZw?oc=5
2026-01-31	Google	0.0	Exxon’s (XOM) Relative Valuation Comes into Focus at BofA - Yahoo Finance		https://news.google.com/rss/articles/CBMihwFBVV95cUxNY0c4bHNkTXpfTGZqampiRlozY0VuMlkwX250Tzg3WEhYdUR5TTdqY3FWdEZoNDJjN3lVeHNreUtET2NwbU5MUHhkb051b09neWwzbFB5VU1ZQkxMdlNONlBKRm5JeGM0NU5EOVd4OUxIRFRNMkdPOGZYb0FsaWl6aDhaMFdROUk?oc=5
2026-01-30	Google	0.333	Exxon Mobil (XOM) Q4 Earnings Top Estimates - Yahoo Finance		https://news.google.com/rss/articles/CBMifkFVX3lxTE03RDdIc1JEMWVDcFBuT0ZVYlhJS09uWEdWSmtCQW9fZ1lQSFp1eWV0LUFhWUJJTVZVZ0NqTUdrdnpwQ2liU2xWMGZsRHh3QTEwVFJ4cXA1cXVtRUllUDI2TExRVlRQaGhMMmdGTWpjU19aS3g5bXNDcFAyRWhUQQ?oc=5
2026-01-30	Google	0.0	4Q 2025 Earnings Call - Exxon Mobil Corporation		https://news.google.com/rss/articles/CBMimAFBVV95cUxNdHB4T0hnTnVfbHh4c1R4MzN3VFhYUjQwaFhObUIyUS1oX0ZSd2tZc1FBS0YzUC0wZ04wcTQ0Y2d0X0NxODU0cW9LdzVkbWFFd2VPLXhWVXVRQWVaR0pickMyaURaLUZDdmlrYzI4MHUwWWdTUkxhM2ZuSUZBYkY0UUtHejZ5VHFUdmZ4MG9NTlZzSmlwZk1jSA?oc=5
2026-01-30	Google	0.0	Exxon Mobil (XOM) Commences Commercial Operations of CCS Project - Yahoo Finance		https://news.google.com/rss/articles/CBMiigFBVV95cUxNUE1JNE91YzZFd1hTZnZxYVZCSTRkanRTaXZXaHBISGJxVVR2M0FyUFlGbDB1QUhoSGFLbDdMaUVSaFRwcVNGOUgzV3Z6NElScDk5NUhVNEhnaFUtOUxGV3dmNzY3Z0NyYW9MQlBQcTVRTHVlVzdoRHNrUlNOUGlZNUZDejZsRkFDMHc?oc=5
2026-01-30	Google	0.0	Exxon earnings beat estimates despite low oil prices - CNBC		https://news.google.com/rss/articles/CBMid0FVX3lxTE1XZVZpMXAwSHE5Sm1Yc0lyLVRZSkdobVB4ZHdlNVlGY1RfNldlM2RpZlV2eElZcGhEVTFOQXhMamY1WmJXU182anVQcGZaX0EwXy1yanY5Sk1vU3hoVENEem0tdlh4LWd6MC13TVFvZnVIQ1BEOFNB0gF8QVVfeXFMUEcyNWt3SVlJVGpkeE5nUENwWnJWbFlmOWlEMHhKWEltOHlqQ2oyWERZd0U0eERkY2FBTGhBWDM5elViUVRxS2xsZDVxT0tKWkdnVk9ldUZGRkdFdGhtckptVGp5R2huWV9UV2pQV1dnRUhEUV9VZlV6Y0VTTA?oc=5
2026-01-30	Google	0.0	ExxonMobil Announces 2025 Results - Exxon Mobil Corporation		https://news.google.com/rss/articles/CBMisgFBVV95cUxNQ3JLTThBd01uRU1GRmh3bWN6cUJsRTA3Y0hHeWZwdjg1Rlk0QmRSMS1vWVVPTkhybzFfbXlHN2dfRlhGdm45YjlHUWJCaWdHaGQ3QXJvbjlPR3VETENBdTV3Y1k0bUxiVWtBc05vN0tkV0tmOEV0YmJFdHZla19rNjZRLThpUTE2M0ROOWRoSzZDcWhMLW4zNU9Yc19nY1R1Rkg1MFV3TFJyNWw5R2RiT1Vn?oc=5
2026-01-26	Google	0.0	XOM Stock To $95? - Forbes		https://news.google.com/rss/articles/CBMif0FVX3lxTE94eXdRQkFaVmprYkZwNXY4azZnZ25TY3AyWGZYVWhKcVNHblRjd2RrUi1aaGVlUTEtSi1SMFliUkpkblRwMXdOQjlUQXdwZzA1UUxmY3dDeFVJUTlKeFJHaFZKWjBycDdOM2ZNa3Q3cTF0U2ZoMjFSTko5NUdLQjA?oc=5
2026-01-23	Google	-0.067	Exxon Mobil (XOM) Expected to Beat Earnings Estimates: Should You Buy? - Yahoo Finance		https://news.google.com/rss/articles/CBMigAFBVV95cUxOTlRacWYzQnBOakZoaXIzTkNlajdTRUN0ZFBxN2EyazE5VDVUZjFkVG9vLTFBdEo3bHBEQmR5ekpxUXN6bTB1S1g2REpVdlMxM3FYdUJtTWY3eTVDZTdlTlBXVThFUWs3VWVyLVBNb0FOWlJFMzByZnFpTGpPLTJ4bA?oc=5
2026-01-22	Google	-0.2	Is It Too Late To Consider Exxon Mobil (XOM) After Its 26% One Year Rally? - Yahoo Finance		https://news.google.com/rss/articles/CBMif0FVX3lxTE5ROGFoTzBIY2ZkV0tLWHFSZ25kb3hCdTA4ZGxQRUI1d0d0Ty1ydFF2TnQyOU9lOGszbHBKTHMxaVl4dFBtM21ab1ZBdTR3eEhXc251em41ZnR2bTlsbVdKVzlYV2NBc0Q3MVBPZE9SaUxrZzYzckRFSkkzMW4zcWM?oc=5
2026-01-21	Google	0.0	Exxon Mobil (XOM) Price Target Raised by $9 at JPMorgan - Yahoo Finance		https://news.google.com/rss/articles/CBMif0FVX3lxTE5IeXUyTkRFZnluOHlmZGU5dndBajdIODUwbkpKYmp5NDFmaURMT0R6bng4Rk5XeGREVFlKc2IyZUlIUjlPdmNuTE9WejEwZ0xYVGpsMXZpOVFGaksxTjZnMGJpWndIN2NGa1pLVGhGTGdpZTRJTmg1dnVBWkw3SVE?oc=5
2026-01-19	Google	0.0	Scotiabank and Wolfe Research Cut Exxon Mobil (XOM) Price Targets - Yahoo Finance		https://news.google.com/rss/articles/CBMiiAFBVV95cUxQVUZyOGpadThGc3hUZHp5N1VLaWREM1BqT3JqVXVCdW5oenpPYnhaWGJiWHVjM3JxbmRJOFA4aVFDQzA1aXdjSl84T3dlbWJVcFlVMUd2R3o0WFdoNGhzMWFTNDY5Q0V1NzF4OFE4c3VtTGhNZy11R2VORXdLWGJlQnZ3anVlMm1p?oc=5
2026-01-14	Google	0.0	Exxon Mobil hit a record after Trump threatened to cut it out of Venezuela — here's why - CNBC		https://news.google.com/rss/articles/CBMiswFBVV95cUxOS2NVVGFDNm41azFiV1RfaUREcWhXNDVXS3RFcEVKQVIzajAtYTdwdlhxOEFmSzJXaU9sdkZMUzlRR0Y4WGQ3cmh0NmpJdDBSVUpDX1QyaUxFZkJ0S1dvR2ZCVHVHREFoWmhYN3E2ODhmeU9kSURReUlic0NmZzV6WW5pLUZGRFVjQ1BsVDZ5SVRTY0hwd2FlR0U5WkVJOXh3UnRxclBwNEFRRzZrVUZRVzNzMA?oc=5
2026-01-13	Google	0.0	ExxonMobil to Release Fourth Quarter 2025 Financial Results - Exxon Mobil Corporation		https://news.google.com/rss/articles/CBMi1AFBVV95cUxPOWl4QndTVGI0bGJVSkNKTkJRR2xhdmpPVlVpUlk2RmhSOE03UlBOSk44ZzVuSVUxOFdpdE5lcHNkMGVTOUVTRGZ5S2pENHdCejZMaS1PQUlqSXhlUGpJeEk2X1Y0MEE2MkYwaGd4NTFRaDJiSXlrUlFjeDJBQjgwdWZtMVNhYlhwQlZwVVg2TmE5di1tVjM4SF9NNlZ4TnFpRkE4SGFVbXlWZTRNYjhfMmNXTGRvWGlPanhjZlB0TTU0Xy01Z21FWHR2NFRkNUlYd3JXMw?oc=5
2026-01-09	Google	0.25	Top ExxonMobil Shareholders - Investopedia		https://news.google.com/rss/articles/CBMilwFBVV95cUxNTmNTZGNaUFQydFlXOG15S0dZN0F4dDA0cWFqemQ0VzNhMmNfSkZpWXpzVFdjVUJER3ptS1Rkd1NlVWpmNHMybnlDcmRQbkRMdFBvaVYyUG1JeFktZDFOX05yaHc4Y1pXWW9NajMyWEd6ZnRrbmh6ZXNDQ21lTFhWV2FheUtrdU1zVjY2VUNZUlo1SUlxMHpv?oc=5
2026-01-02	Google	0.0	Exxon Mobil (XOM) Laps the Stock Market: Here's Why - Yahoo Finance		https://news.google.com/rss/articles/CBMifEFVX3lxTE5LSGQzMlVYYjVGY3p5Nm9xdjhsU2M4djJObzZFYTR1SGN2SXg4NmdMSllJZ1Y0cEdSSkNUWk9SeWs0WkRaM3lBYzV6SS0yRmlzNTVMVkVuTXpqclFqSVpXUkZpZUgwVlRBU3lCTGFDNTRKOXZSdUVvVFpqX3g?oc=5
2025-12-30	Google	0.4	How to Buy Exxon Stock (XOM) in 2026 - The Motley Fool		https://news.google.com/rss/articles/CBMiiAFBVV95cUxNbFVZNXd0YmwxRUJ5eDZfbWNkYWs3MGJxTU5ySzVQMnVnUUR1UTlqQXZXNHRNYmZndUtHYWFXU0ZhT2tXeXlsVEdJUXo1T2loZXJ0cHJkTU1QRUhWT0dPX3lJaWZsM2h4R0c2MGNxWm1hYl9vWTR4eEgtRGYxRUk4dEhfX1N5QkJ2?oc=5
2025-12-26	Google	0.0	Exxon Mobil (XOM) Raises its 2030 Corporate Plan Outlook - Yahoo Finance		https://news.google.com/rss/articles/CBMifkFVX3lxTE92UTVvTkc3RlBBbnRrbHlJV0JDVlN3bVhtaGZKVXZBaHZuZDJVcXhjU2N3ZXBlWVI2emdSbDdobFQydGZ4UGFidDNsZUtTRGhRSVFoTHFOa01PSWZjTmRhbk9sRVQ5UmI5UEFxOVpRcHFfSnVHeFF1M2FUZ1ZRQQ?oc=5
2025-12-22	Google	0.0	Is Trending Stock Exxon Mobil Corporation (XOM) a Buy Now? - Yahoo Finance		https://news.google.com/rss/articles/CBMijAFBVV95cUxQcm9xYnVRa3FtcEhjTkt3OXFwZ3BaZEN2T2dlY1RURzdEVE5wTF8tRndZWUFwNHBncExheHp5REJkYmJkd2dQTEloUllHeWdJVi1NTFloQ2VvLVI4OUFyTnBKUGNDME1oWk85OEFtZ2JKNVoydDhsVzJBemUyYzJJWmR4ZzJaaU5uc2xvQg?oc=5
2025-12-17	Google	0.0	Exxon Mobil (XOM): Assessing Valuation as Recent Momentum Cools After Solid One-Year Gains - Yahoo Finance		https://news.google.com/rss/articles/CBMiiAFBVV95cUxOUG90NHJyTTlvM0dJUEJnQldrUEQySmxCbXBjTU54M0oyeDhFN1YzUm93Mmt2Q21MSERyTEExSnNJX29CTF9uU2Q5Y1I3bWxtYjhESlh5Z1plcktEZWpySWJHQXBSYjZFZkp0RjVFZWl0V2ZvQ3VaRExRa2FmTW9faG5KT3Y0UGZw?oc=5
2025-12-11	Google	0.4	What Has ExxonMobil (XOM) Stock Done For Investors? - The Motley Fool		https://news.google.com/rss/articles/CBMihwFBVV95cUxQbklIMEFiMEhNaWxFc05oV0pYamtJQW12cy1wQlo4V0MxUmNGaWlIYzlIaXJLR3JLcVd5QzRJM2NTUnByWWx2VHY3ZW5yTDk4SXczTWhUdFhMMU45UUlPajJDOHVVU0hqR3F3UzF2SFJZS0h2UXBVX0h4TkRlM2ZZZzNudm00QVE?oc=5
2025-12-09	Google	0.0	Corporate Plan Update - Exxon Mobil Corporation		https://news.google.com/rss/articles/CBMic0FVX3lxTE1OYlp5ZVhrM2k4U3BzcmhzZVdjX0FsMDdHMHlUWEhhVWpfVld2NjN1N2k0NjdTOUlMeXp2bGxfWXg3cFMtNTZIWEptRkF0N1pPVGJNU3JJVDRuQW5iWFN5SnNJanpmTWp3emlIOEtKeVZIME0?oc=5
2025-12-02	Google	0.111	Exxon Mobil (XOM): Evaluating Valuation After Its Steady Post-Pioneer Climb - Yahoo Finance		https://news.google.com/rss/articles/CBMiigFBVV95cUxQM1I1R3FFMHVva3hqTXh3Tk51eHlsdzBPUW9QdkhRV2NPRkpQaTFlTG1IbG5xa0ZxMUFfcnlwb2U2RkRVLTU1cVV1V2pHejFoNk45WkZORmk2WldnSVNlNFozNnBIZW9Jc0FPWFliLXUyZ2dvSV92RjQ1SXRkVlRZTy1TdDRuY0xiamc?oc=5
2025-12-01	Google	0.0	XOM's Upstream Advantage: The Growth Story Investors Shouldn't Ignore - Yahoo Finance		https://news.google.com/rss/articles/CBMiigFBVV95cUxPeXhvYzV4UktRdVViWmd4R3dSRDBrRmxWT2NRWE5zR0F6QS1hdEJzVThFTTd1elFCMmpTX1JoMkZzbElYQ1hibWVNeFZaaTN5SVNVVGJkMHluMG02V2VyVk9aSHVBZlRvLUlDb1YtTTRXaG5yeXRkNll2dXJDNE1pNjdwZEcyWEZ2ZHc?oc=5
2025-11-17	Google	-0.133	Investors Heavily Search Exxon Mobil Corporation (XOM): Here is What You Need to Know - Yahoo Finance		https://news.google.com/rss/articles/CBMiigFBVV95cUxQTVBCaDUzWVh1WTZuX3YwbTJSUXlPYi1QOURnTFVib3ktY0N0d3FERFJ1cGFhMjhldHh5aVMzN3dXckNUeVhBZGw4MVlUdUdreV9rUXZlUFRLdVZVUDNxU0QzLXJ6SXV0RUk4RUV2eVpxd0FRc0J5aFg4QTdhSFZwTkw5MDRWdUNtOXc?oc=5
2025-11-14	Google	0.0	Exxon Mobil Corporation (XOM): Analyst Upgrade and Q3 Highlights - Yahoo Finance		https://news.google.com/rss/articles/CBMiiAFBVV95cUxPblIxeGN3Ql9KZmwwUWk3WUEzRnpJWUdIZjVneFdlcWhGZm9idG9tZXZvZnBMVlQ1OWpnWFpqN2Nab3VMZzdjaGI1SnRRRUN5UnhzOGJwbkNkVXJESlRObFpJa0Jwc3pPbXloa2VOVzJaNHJXTlJKeThrMGZSUFdISEdienBCem9i?oc=5
2025-11-07	Google	0.0	Exxon (XOM) Q3 Earnings: Taking a Look at Key Metrics Versus Estimates - Yahoo Finance		https://news.google.com/rss/articles/CBMif0FVX3lxTFB3djR3RDhXZWVZSFEyOFhUUjV5MUEzal92MFQ4WVYtTDB6aHQtUXZIS3c2cmR0VzdjTlU0eXpzejVwWTR2NU13eG1qdTRWeFl2Q0pYUjdrTkhLQTY3VzZsSzU3dTF3eGxYeWkwdUUtdm1fTUM1S0V3LWQ4Nm5DTEU?oc=5
2025-11-05	Google	0.0	WTH, XOM? ExxonMobil Again Sues to Dodge Accountability - The Equation - Union of Concerned Scientists		https://news.google.com/rss/articles/CBMilAFBVV95cUxNc2Y1UkRrQUM3LUIwN3B6dEVRb2VMYTRHRDhuQXdIdGR2RGVLdndITG1yalkwVFI3NzM1My1pV3p3MUV6SWJsQ0xOMVA3N2RnelhtbG5MTUtnNDg5MnE3ZmFIM2pfM0FCWHVyaTdxOWtJOG9wVGxkcUNCVU5nVVYzbnRZNlFoR2U0YUdTbjVpNEl6TUty?oc=5
2025-10-31	Google	0.0	Exxon Mobil Corp (XOM) Q3 2025 Earnings Call Highlights: Record Production and Strategic ... - Yahoo Finance		https://news.google.com/rss/articles/CBMieEFVX3lxTE9hSTlMWTNNYlFxZjJBTVRGQ2NpQkRBNGZIZU1OSHZTMEIzRW5zemltaGNEYWpoOVY4QWxhOUFyTC1aX2NqUU1ZY2d4MFczQV9SMVVzYkpDUUdGdjJfWTRWa0hDY1NXWnFONjduR05kRmtiNUg2eDZSZw?oc=5
2025-10-31	Google	0.0	Exxon earnings beat as production in Guyana, Permian soar to records despite low oil prices - CNBC		https://news.google.com/rss/articles/CBMicEFVX3lxTE5XNG1COTZYUTN3TUs1VENaRHJpRlRMQzVKV0xvSjN3UmU5dzJzaDNvaFZPcURuUWF2YXRZSnZ1SjZFUnpiZDFkc25ROEJ6NHFFZUFhekFiemlkMVZxcnM4MXRBYzJxcjVsdWg5b1VWNmfSAXZBVV95cUxNS0Rvdjc1QWNBeFBYZDNSTDRDUGpMby01RG9fclVOLWF5SW5FYndRcTdzblphS05NM2RURHRkSHF5Znl2Q2p1OVNMMFhJamw5UkNWZW5KUHBnWTMxNTl1QzFZRDZzbUJuT3M1UThtU1VnbHQtTkh3?oc=5
2025-10-31	Google	0.0	ExxonMobil Announces Third-Quarter 2025 Results - Exxon Mobil Corporation		https://news.google.com/rss/articles/CBMixAFBVV95cUxNYjVLaW0wWUI1RGJlOE9WR2xDSGFzcktqbENRV3NrQWl5X1lDNjVOVFN3TWlHUU1helk4WHVpSkpWM3V2S2RtYXExNXNVYjNGVmhGQVNYOWMxQ0R5ZVFGVFdvXzNrRE5mZW9LdTdGWkt1LWtDRWRYNUxpSzA0dlAyUzZqQkJQc0VEUHp5OXZabktUVUl0TThxS25RX1BYcTByZ0h4ajI0QmRpNlF0cnR1R1Q1bjBWVG1DRHNQdkFvOTY4OFI1?oc=5
2025-10-24	Google	0.0	Analysts Estimate Exxon Mobil (XOM) to Report a Decline in Earnings: What to Look Out for - Yahoo Finance		https://news.google.com/rss/articles/CBMihgFBVV95cUxOOHV3clJVcV9pYjh6bUtGS3V3LWtQRmJJNGJaRmkzendGb0t1dGx2QjJCWFhNRGdIaG1zS0pJQ2Zzckx2d0xlNGpVVVp2UjRLSmt5UC1MNThjdElZaU9Udk1pc1JvOGFVaE5mTUtMOGZtdGhXd2w4TmUzaUtSeFZtRTQ2RmsxQQ?oc=5
2025-10-18	Google	0.0	Exxon Mobil (XOM): Evaluating Current Valuation After Recent Share Price Recovery - Yahoo Finance		https://news.google.com/rss/articles/CBMihwFBVV95cUxQQUpEOHd3YTZlakhBTGgyZGluQkYxVGxDdUpSeUxiVmV5S0JDZUpfcVdKb3FBR2hRblJaVTQ4am1yZGlhUGt2NkkwdnFJSkswcHBxZHZZNS1odzBOX0szY2VxVVlqS1BfSElNTDg1b05IRVJsakFRRVpkNFg1YVpNU2ZSQU1TSlU?oc=5
2025-10-13	Google	0.289	ExxonMobil (XOM): Strong Cash Flow and Strategic Investments Drive Dividend Confidence - Yahoo Finance		https://news.google.com/rss/articles/CBMigwFBVV95cUxNeVYyMUxhLVRVWkhkWXlzVVJMb2FUNlZzaDd1bkpXSXotRjh1M1JoUTdSQzViQk02dFdDWFlKSUFHaHBCekxmQVF1UC1sMkZ2S1l3MTVDdU5PU3lRbWY0NUVIOFNoXzZXU0pIWklQMVA3eFM0aGJwUDh4YWxFbGlGc090NA?oc=5
2025-10-13	Google	0.0	ExxonMobil to Release Third Quarter 2025 Financial Results - Exxon Mobil Corporation | ExxonMobil		https://news.google.com/rss/articles/CBMi0wFBVV95cUxQamw2M2F1QmtDSnNHcTQtVXNXSVR3b1U3Uy1RNXRQYms4VEgzVkZiU0dSRUNjdFhYOGw5bno4MVR6Y2lUY3NjMjNrUlBFMi1lRVZCTTRVeGtaY21HRGhWcnNidE1QWEhLaERfS1VFMUx4ZTlFR1l0eldUUzg3NFNMeFdHQkVERzBBMnYxMUhtemlTd3JHWGlGaXZtSXMxbXE0eWVuQWI3aWtaZEtTancyTDEzRHMwa0V1QXVCa0dlc1oxanhOQkhFNVE5NlNERVdZMmIw?oc=5
