Date	Source	Sentiment	Headline	Summary	URL
2026-02-25	Google	0.0	EverSource Wealth Advisors LLC Increases Stake in Schwab U.S. Large-Cap Value ETF $SCHV - Defense World		https://news.google.com/rss/articles/CBMiygFBVV95cUxNUE54dldVZHN6UVk2UnZsV091eTlsMmswRlpYai1IWXVnRm9JV0NKc3BwTHRQR2dweXoyWFM0bHJkbjFpWU5kcjEtelFlVk5XZzJjbUs3dGRaSHk3SHRsWUltc0MxeXc3TGJXZDRrSFZhZWR4LTVQYW1kc2hmcy1xVVNNNFczZFBuRjBjYmZ6c1FCUFV6d3IyXzVNdWJDcFhwSnk4VzhRSnI2ZmJqanNDQ0tnUjZUWW1tVjJ3dGNrdE5KalZMVnlOdlF3?oc=5
2026-02-24	Google	0.0	Compound Planning Inc. Has $60.86 Million Holdings in Schwab U.S. Large-Cap Value ETF $SCHV - Defense World		https://news.google.com/rss/articles/CBMizAFBVV95cUxPdDZWcnF3MGFWNGJBVjVNWXJoMmR2QmJMVHd6em5uZlZ6Z3MwVWpPMGtYblZsVVlSQjA5ZmRsWVBVeVN2YWhEQ0xQbEtGSFpXNEpqSTRwZFNlQ292MXVEdG5qcy0wLVVpZXg0bmFHZTk2Zzh0Sm1mempLNHlFTGlpTWFON1J3THlIcFFsRHlXd3dNclJjUEJfZ3VQaElnaTB3bjdONHJnX3A0N3BJaDJWWmdRZmJiNXVnTGt4a3JsQmd1eU9HQ0YxWDZsX3A?oc=5
2026-02-16	Google	0.0	Technical Reactions to SCHV Trends in Macro Strategies - Stock Traders Daily		https://news.google.com/rss/articles/CBMizwFBVV95cUxQRk4xajQ0MF9VLWR1VGdZLTNCVk85VVpYeV9tV0hDcGNJWnRmOFZFYkZUaE15elVXZ2c4a0U4Y1NvaXpEdkFaMlVsYWJ4eDBDMjhDd0huYzBFaVNFYlB4WnRpQ09QUFFLVFhOVHFLdTdXWFEzdjBOaG1VbHByNS1OWnk1S3UtbDFLZS1tUlFIem8wUDB1QklObnNScTdXalJ3R0FhckdhZG1rSS1zbnp5Y3dLNlNzaHlWRDJoZnRibUZSN1RmbzhQWC11YUVOOGM?oc=5
2026-02-05	Google	-0.375	Trading the Move, Not the Narrative: (SCHV) Edition - Stock Traders Daily		https://news.google.com/rss/articles/CBMiygFBVV95cUxQaVl1bXpKc2NnY2VuNUlkSFBRRmdvZUhUeG0tbzE2VVFmd2tBZDMyTy1CUUFUclNHQkU2ckFYNFVMVUpXQXdTTzhtWmw1d1ZBSFRUUE9DcnVfTzFBUmUycDBnRUNkMWlld1Rjd1NGQzEyVHhaOVRORy1JVjBFMXF6SzkzLXpQV1E5V3VwT2lIdERIekJHcU14VENXWTdQZW1PeTZwRnctMUFvSTYzU0s5a045bG1YTXViUkdxRjBXeFlQSXVKbXVmT093?oc=5
2026-01-28	Google	0.033	SCHV: Low Fees, Moderate Value Exposure, And Modest Volatility (NYSEARCA:SCHV) - Seeking Alpha		https://news.google.com/rss/articles/CBMiogFBVV95cUxOUDhYZWFyRmdQRjVWWGR3TGdwNDFtRkZ0VjJ6czZNNlJyYUpiWjJGZThrRzRFTXZoSzVyUk8wWmZjLTJtU095N0V5VjVza0hZMWVzb0ZXNTRKUUZlYlAzUzh0TndKUFY3cFo1M3k3TmxiNTItTTZKYnBMMV8xNVdiWmdRVnZ3amFtZ0g4eEFVenY3YUJZNXVaMDU2eU44dG56S3c?oc=5
2026-01-28	Google	0.0	SCHV: The Value Rotation May Have Already Begun (NYSEARCA:SCHV) - Seeking Alpha		https://news.google.com/rss/articles/CBMikAFBVV95cUxPSDNCNEwyUXNPczBGckwwemFLaGRWMFJNUmU4YVo0SC1WTDYwX1JFeHhrQVdPQUNKbWl2WG9Ud1l4N3MxVXBYM291OW1tc1lVMTRVb05LRURobVVUTTNSTVZ0UmoyWEk2QVA3alMzVlRlTFo3RFE2Sk50cUdfT1RqZHV3RjJwX01HYzBFbWt4S2o?oc=5
2026-01-01	Google	0.0	SCHG: How This ETF Looks Heading Into 2026 (NYSEARCA:SCHG) - Seeking Alpha		https://news.google.com/rss/articles/CBMiigFBVV95cUxPMjBMMi1FbUZ3VXAtYVNDc2x6QnRIeG9nOExGdE5pMXlmUUlfZzJybzlOUEE4RVcxeVlBeUZNU0xLSGVFc19LZHpLUDVwZ1VTdzg4WUpCa3ZncjBHWks0TENKMWZ6d3QweVl5Z2tubnZkS1gxR25VQlloSmtUdktiTmsxRzlnM0V4ZVE?oc=5
2025-12-23	Google	0.0	Seeking Alpha Lessons Learned: A Data-Driven Review Of What Worked (And What Didn't) - Seeking Alpha		https://news.google.com/rss/articles/CBMiuAFBVV95cUxQdFd3OWJkdFBNMFRzZ19VWVZhdmlnZEljOWU4SlRfMkdfVzAybEdQZTZlZkhScGZvSkRQOXF2QUpOSFNYbXlyNlJ4SlZSRWFmWnBpZzNFTW5DSUVhSXVNem9yZEN1SmRWeEJQVmdtUFRUX09LcTZsY2diVHhoVDU1X1EtN3UzVWZENW1ZX2hHQXdEZk45M2EtX2syeGZxVXhMOHJZb3h0amUyQnliNVcwSnlSdDBoRktL?oc=5
2025-12-01	Google	1.0	The 3 Best Schwab ETFs to Buy in December - 24/7 Wall St.		https://news.google.com/rss/articles/CBMijgFBVV95cUxQaXcxUld4NkNOMi1aQkptTmJDS1JCWmdNVmNVTV9OODV3UDRoRmF5Z2RTbE9BYlBzMXh5RUhYZE41QjZXUjJXQmlaV1hZX0VVTmZ3XzV3czZkZTQ0c1RyZndOU3FtcW9fLVdGVjdURm9Oa1l2OWFJVy1HeFQ1N2Z5UW1zVWplUmw1WHlteXBR?oc=5
2025-11-13	Google	0.0	SCHV: The Case For Patience In A Growth-Dominated Market (NYSEARCA:SCHV) - Seeking Alpha		https://news.google.com/rss/articles/CBMinAFBVV95cUxNTTE1RG9jblJPQVdxdEJtN2VUZjdVNE5zUGZzUlR1SGh4UGYwU2gxTmZvalVTOHZSQ2pSdXNyRFRLQkJaNHRjV3pSb2RZQVlpc1FDRWctWHZ2M3FzX3NiZjVmTEhhRFUwMTRjZE05RmRVTnFvSHRwVUlRNEhuR3RZM2psaUN0a1VDdEwxWHRYS1BaZkE3TElGSWtsZVI?oc=5
2025-08-27	Google	0.0	SCHV: A Year Later, Value Funds Still Have Plenty Of Relevance (NYSEARCA:SCHV) - Seeking Alpha		https://news.google.com/rss/articles/CBMiowFBVV95cUxNQUZ5ZjlSZVhieFhSUG5sS1MwUGlPM3h2Ql9HSHV4Um1FSDdCa2pONVY1enlqWmZVS1NSOWVWdE9SV0wzamNScXNrekJtY3R2T2pxYVhaR19PZFFzX0lXcDg5REFvUkQ4RzMxVFJ2UlZTTjJMU3YxOGxLQzFPQk5YeGUtU2tjZXVHd1VRNWpRLWFMR0JPRDRaYkk4SGpES1M1Wl9V?oc=5
2025-08-20	Yahoo	1.0	Magnificent 7 Stocks Push US Equity Indexes Lower as Investors Cut Growth Exposure Ahead of Fed Minutes	US equity indexes fell midday Wednesday as the so-called Magnificent 7 tech stocks lagged after inve	https://finance.yahoo.com/news/magnificent-7-stocks-push-us-174143314.html?.tsrc=rss
2025-08-20	Yahoo	0.0	Technology, Consumer Discretionary Push US Equity Indexes Lower in Midday Trading	US equity indexes fell in midday trading on Wednesday as the so-called Magnificent-7 lagged, reflect	https://finance.yahoo.com/news/technology-consumer-discretionary-push-us-164446900.html?.tsrc=rss
2025-07-23	Google	0.0	SCHV: A Quiet Contender In A Growth-Dominated World (NYSEARCA:SCHV) - Seeking Alpha		https://news.google.com/rss/articles/CBMijAFBVV95cUxNNnBDNFYtVXJmeDU3UmNsYlR0Z0NVNkJzRjdnRFJmVXFvUHhGamxUcWlOWEZNRDdaeUw0QlJLZ1BhU0xWMzdpWFBBdm5SOVh0WU5YM0xMRXFxOEZDN3NpNk9Cd3BVRTNiR1E2VnhhYm5jYVpxbTZ0bEk3WU5sRkFzZmpOdE1aYXozZGJpRA?oc=5
2025-07-02	Google	1.0	7 Best Value ETFs to Buy and Hold - US News Money		https://news.google.com/rss/articles/CBMia0FVX3lxTE85Z3ljeUh5bEFMTzVIVUdpaHVZVXd5RUFJdTd2RlBZRVhLZmlFbFdxMWtVa25lY19ObTZicHZsLXpOSWV3Tmxjbm1zZVlCNVFJQUg1N00zX1pxM2dmOHF2UlZzWVRQcWtWaE9j?oc=5
2025-05-13	Google	0.0	SCHV's Diversified Portfolio And Earnings Growth Power Makes It A Solid Long-Term Investment (NYSEARCA:SCHV) - Seeking Alpha		https://news.google.com/rss/articles/CBMiywFBVV95cUxOLWRuTVdEaGphQndNYXBYN3FmbzhMMGdjREFhMHFubFBwYWdSNjc5al82el94eU10ajh2cXdnOFdOdDVrbXpaMHVXcWE5cjBTQmZ2NUcxTnNMSExuMG02NUx3YlJIM2VnLVh3UkFzbExXSC1GVXVsZW5Gd210TXdqU2N1dHo4a3plLVg4YnRDMkJNS3Z0RDJzLWw0RXlDWkJrOXFqZkxVa2xDOE1PejBfS21TakxzaGxFYVVLbTBjU1JkYVp4Vm11ZEtFcw?oc=5
2025-04-23	Google	0.0	Buy Top-Ranked Value ETFs for Outperformance - Nasdaq		https://news.google.com/rss/articles/CBMifEFVX3lxTE1ueGZiWmdpZXphb0phRjZyQjVDUXRLM3BQZFJSS3Qwd09GN3dpb0xWZHBqdjZ3NUdxTVNQY21vUXZDVktiYVRPQWF5MGVwOXpFb1NuZmpISjkwOWdDZTRweW53MkVZWG5DMTBfNVRhalNqZU9vblA5Wm1aZjc?oc=5
2025-04-21	Google	0.0	These 3 Schwab ETFs Can Provide the Defensive Exposure You’re Looking For - 24/7 Wall St.		https://news.google.com/rss/articles/CBMitwFBVV95cUxOaWk1dDlJWWYzR05jNERUa0xxeHAwcm5HZHB2OTVPNHhJN1prV3VrSW13X3BNSXpGdGdmcnZMeF9hanpKaXF5aTZpdTlKRlpmc2VrZTd4R203LU5reHhHN1BwWTZ2MERTRi1FZXN6Q3I4aWRBbnpVVjREb05KcjkteWtaVkJzbkxCUDZFTXYzQlVYSFlKT0Z6VllVWkF4blVNOFZTZE9yVENqVnRTU1IyZjVSWnB4WVU?oc=5
