Date	Source	Sentiment	Headline	Summary	URL
2026-02-16	Yahoo	-0.3	Metaplanet Loses $660M on Bitcoin — Can It Still Hit 1% Supply Target by 2027?	Metaplanet’s ¥102.2 billion (~$660 million) loss reflects a year-end mark-to-market accounting adjustment under Japanese rules. To reach 210,000 BTC by 2027, Metaplanet must acquire roughly ...	https://www.ccn.com/news/crypto/metaplanet-reports-over-660m-bitcoin-valuation-losses-2027-target/?.tsrc=rss
2026-02-15	Yahoo	0.433	Strategy Inc (MSTR) a Strong Buy, Analysts Forecast 193% Upside	Strategy Inc (NASDAQ:MSTR) is among the 10 best meme stocks to buy now. On February 9, Cantor Fitzgerald trimmed its price target on the stock to $192 from $213, while keeping an Overweight rating. This follows BTIG’s adjustment on February 6, when the firm slashed its price target to $250 from $630, citing a sharp […]	https://finance.yahoo.com/news/strategy-inc-mstr-strong-buy-045227886.html?.tsrc=rss
2026-02-15	Google	0.433	Strategy Inc (MSTR) a Strong Buy, Analysts Forecast 193% Upside - Yahoo Finance		https://news.google.com/rss/articles/CBMif0FVX3lxTE9Jenljd0prQy05Vy1EOHdHUlNXUGV3Z3F4WmJpUkJjYl96YS14NnA4WnJ0U2FpNk1yXzd4Ny1MSTlKaXhDbElrUklrVmw2U0NCLUoyTGNLN3QxTnVrYXBJekt6cEZFNUVhN0YteGlLMTdHZXRTSmhkQ0ViYjBYY2M?oc=5
2026-02-15	Yahoo	0.0	Strategy Can Fully Cover $6 Billion In Debt if Bitcoin Drops 90%, But What Happens Below That Line?	Strategy claims it can cover $6 billion debt if Bitcoin falls to $8,000, but leverage and liquidity risks escalate below that level.	https://beincrypto.com/microstrategy-bitcoin-debt-risk-below-8000/?.tsrc=rss
2026-02-15	Yahoo	-0.125	Jim Chanos Slams Bitcoin Play Strategy For Bragging About Stability Of Preferred Shares: 'Can You Imagine Any Other CEO With A Plunging Stock…'	Veteran short seller Jim Chanos slammed Strategy Inc. (NASDAQ:MSTR) for touting the stability of its perpetual preferred shares on Wednesday, even as its main stock continues to get hammered. Chanos Takes Fresh Dig At Strategy Chanos reacted to a Bloomberg...	https://finance.yahoo.com/news/jim-chanos-slams-bitcoin-play-003117862.html?.tsrc=rss
2026-02-14	Yahoo	0.0	Michael Saylor: Strategy Has No Liquidation Risk Until Bitcoin Falls to $8,000 — How Is That Possible?	Michael Saylor says Strategy faces no liquidation risk unless Bitcoin drops to around $8,000, citing its low-interest convertible debt structure and absence of margin-call triggers. ...	https://www.ccn.com/news/crypto/strategy-no-liquidation-bitcoin-reach-8000-hows-that-possible/?.tsrc=rss
2026-02-14	Yahoo	0.0	Strategy’s Stretch Preferreds Deepen Bitcoin Bet While Aiming To Limit Dilution	Strategy Inc (NasdaqGS:MSTR) is issuing additional perpetual preferred shares, called Stretch, to fund continued Bitcoin accumulation. The company is shifting more of its Bitcoin funding toward preferred equity instead of common equity to address concerns about dilution. Management has reiterated plans to keep buying Bitcoin over the long term and has ruled out forced sales despite price volatility and large unrealized losses. Strategy, trading at $133.88, has been closely linked to Bitcoin...	https://finance.yahoo.com/news/strategy-stretch-preferreds-deepen-bitcoin-141126179.html?.tsrc=rss
2026-02-13	Google	0.0	Coinbase (COIN) And Strategy (MSTR) Shares Surge Today - Bitcoin Magazine		https://news.google.com/rss/articles/CBMif0FVX3lxTE9FNUJrZVBCVGV1bUgxa2pFOFIxeTI5NTl6dTlJaTVKR2NzOUpudDdhMlF6M3Z4dUpIU3ZtRlkwSlBISjRZUnJtVnlIM1pUMk1UcE5kLUpPZks1M3BmVUdhdERLeFYxS29Jd2FaQ1VsOXVoenJBT0RBU1RtY096MEk?oc=5
2026-02-13	Yahoo	0.0	Strategy Inc Leans On Stretch Preferreds To Deepen Bitcoin Exposure	"Strategy Inc (NasdaqGS:MSTR) plans to issue a new class of perpetual preferred equity, branded ""Stretch,"" to fund further Bitcoin purchases. The company is shifting away from issuing additional common equity in an effort to limit dilution for existing shareholders. The Stretch securities come with fixed dividend obligations, increasing ongoing funding commitments. This change comes while the company holds multi billion dollar unrealized losses on its Bitcoin position and faces persistent..."	https://finance.yahoo.com/news/strategy-inc-leans-stretch-preferreds-011221004.html?.tsrc=rss
2026-02-12	Google	0.5	MSTR's STRC returns to $100 par, poised to unlock more BTC accumulation - CoinDesk		https://news.google.com/rss/articles/CBMivAFBVV95cUxPTTJVLXd0d1B5M0Y5ZkZPbi03SjVmTnBoZklYVzI1TUd3MDBPMl9hZHNKM0hBXzc3RnJnQ08wcGpaZThCSXVPRGJBM0xOeEotX3A3QS1rMWt3T1dRT3F4TWU4YlhNcGhIbWJ2WU50bVN5TWdEWXU2a1U0cUtEaGxBd1MxLUgwWUNFRWNmY240Mjg1VU04Sk9IX1FvcWR2c0V1bHBGN095eVViRXZZcHViVTJpaFFia25uN1M2VA?oc=5
2026-02-12	Google	0.5	Why MicroStrategy Incorporated (MSTR) is one of the most oversold NASDAQ stocks to invest in - MSN		https://news.google.com/rss/articles/CBMi_AFBVV95cUxQZVdSZUlwWGJXektneDJCWkVMZ2VCQkdfak1OMENFSlV2dTNuSmsyMnNuMXJvWEVYZjRlbi1vM1pmRng5WXF1TUIwNlJhTFlzcmZybmZ6R09naE14emNScGJqTkRuV1VJVFFweGEyVnJGcTk3aFBhS3Y5X19oTm9RWFBfOTNSLWNLc3FQX2NMdlhCZkxOcjVpYTZ3aHFFNHNTQWttcXk0RUFteWIyQUFNQjFFTjZ1SU9LTDZMWExmWkdxbWhnTDlIWElFaGIxLW5OS212UmpfaGZLS0VDcVdCNlFwbDJNU1VQaHZ5RnJJS3MzbUV0Qko0M1lFbks?oc=5
2026-02-12	Google	0.0	Strategy (MSTR) Accounted for 97.5% of Corporate Bitcoin Buying Last Month, Report Shows - Bitcoin Magazine		https://news.google.com/rss/articles/CBMif0FVX3lxTE10ekw2b0t3NThIbE1sU1VpTkR1UGhsQlBjYmlMVVJVYW5YR0FUbTF0WmJZbzNUaWFXQmJTdnhGRXIzU1hjMjlYc3l4R2JxVDhMczR0OTlsYUdpUG94Wk5uZlI4NzA0Q19abktVQ3Rwa3U5ajhNLVZEMHN5MUNNTkk?oc=5
2026-02-11	Google	-0.104	Why Strategy (MSTR) Stock Is Down Today - Yahoo Finance		https://news.google.com/rss/articles/CBMif0FVX3lxTE5CWUlDc2hwTDR0S1pLb3hzWS1JZ1hXczFwVUZBV2ZidmFHbGQySHplSFVER3RKOTRoUjNmN0NzUGZEalBfVlhWVnViYWxPV1RRZGlEeFQ5TC1oTlpOcWd1cEUwc2s5RjlKb00xN2NvSHF6RkdlUk5DWW5rRDNQWTg?oc=5
2026-02-11	Google	-0.156	Michael Saylor Isn’t Backing Down from Buying Bitcoin. Why MSTR Stock Investors Don’t Like That. - Yahoo Finance		https://news.google.com/rss/articles/CBMif0FVX3lxTFBCZG13VE8tb0c5N09QMGlYZkFPb01waVl6MzQzNnpzcEd5MTNjZTVGZUJRMkhhRlJvRml4eV9vV1E4VnJsZnlCOE1YTnV2end1WXViWEpxYlBIcU03d2dsR1FSaGhNWVdkMGF4RXl4NExvQWFLQW9GWHMxaEdDd0k?oc=5
2026-02-10	Google	0.0	'If People in the Rest of the World Knew What I Know': MicroStrategy's Michael Saylor's Viral Message About MSTR Stock and Bitcoin to $10 Million - Barchart.com		https://news.google.com/rss/articles/CBMikgJBVV95cUxOcDhsSGItRVViZk9wRjZEZHNmYklXOFNwN3ZScjNBVFdCNk1fQnRraGpIUVNWalFwWjNaR3RKeXZvdUlMLXhTX2hoVzlfdm4zZzZZYjJoYmNKRmNha1NJRWNMeFlfZDNYakFOelRkQzN3dW4tZVNGTXJveFBsNFB0ZE4wanE0d0FVZnJpTzM0SDVzLUE3WUwtcjhXN0pXT0owYVVrYnY3RlJ2aVJKaVVpVUlDNncxWjdTek1HQV9VbDlIdEVxZ2lNRElIV25Vb01tUWpSNWRRamplczZkX2sxelVVd0x5VmtkUmY2a0NNRHlTQTlWX055WllTajEzR1pjRVZmZHZzTnpqMklhOXFCaDJB?oc=5
2026-02-10	Google	0.0	MSTR’s Michael Saylor says the company will buy ‘every quarter’ of Bitcoin ‘forever’ (BTC-USD:Cryptocurrency) - Seeking Alpha		https://news.google.com/rss/articles/CBMiugFBVV95cUxNQk5ib3pteWV5V3ZIZDA5Q1kyRm9QVXFzR1NwUFMzOGtlYUYwanJ1RE44aTNKMXVCSUpmMHN0N1J5akhHeXlDd25RQzFHV2xtMnQzNWNWMnR6NkdHWkIxSGVaT3ZPV2ZtVjFIdkFHalI5TGZ6OVlJMDAxamZpN3FZeUx6TmxUY1V5NUhEV1g0Zm52bUxZZ0xGc1pwLV9UTGxzYkhsVlEzMUJ5UWhfeG9NUEktRHJhcWdQQ0E?oc=5
2026-02-07	Google	0.0	Strategy Inc.’s (MSTR) Bitcoin Stockpile Now at 713,502 - Yahoo Finance		https://news.google.com/rss/articles/CBMiiAFBVV95cUxPTnFJZTItWnFIOHZYOWh6Vy16ek9TT0llN0hTb0lqV2VBZXY2SUtXWWxUVTBpR1JkRS1wVHJnUi1ZNVNUZjdaYkxVMEIwSFpRMFRqdl9ORU4zV3hQbUxiLUtmN1ZrUlRPUW5GUC1pY1NfTksyS3pTd21Bbm1fVnRWQkplT2VneDJv?oc=5
2026-02-06	Google	0.0	Michael Saylor Says Strategy ($MSTR) Will Lead Global Bitcoin Effort Against Quantum Threats - Bitcoin Magazine		https://news.google.com/rss/articles/CBMie0FVX3lxTE1sX3pRa2c2YllNRXc4R0Z3bDAxeERLRXlnZzNKWFZzU1Rkb3RkMlRRbDduSjVRMjNuSlpJU2VQeTdkcjZkd3lqdFppS0NpUU5xbktURFhoRHhDbEhIMnpDaS1NYm1NUTRETk8zWXFOMS14aS1HaFhXUVBCRQ?oc=5
2026-02-05	Google	0.5	Strategy (MSTR) Earnings Today – One KPI that Matters Most - TipRanks		https://news.google.com/rss/articles/CBMikAFBVV95cUxNYnRmNWNnR1JtZm5YN3h3aUJuN3ZVMmJjZ0JCZWRGVnQ3U1lLS0prWGlLOVFHUDQyVDhaaTFIbXJuaFIyeVRZTG9aT2RuUVZNS0lZMzNKRC1qQ1c3T0xGYU9sMUJsOUNwbkdSanFLRU1GTW8zSmdIc016c19WOEgxNWI0TEtnYXhPMmUxc2x6N2M?oc=5
2026-02-05	Google	0.0	Bitcoin Dive Puts Strategy Under Water, Facing Do-Or-Die Choice - Investor's Business Daily		https://news.google.com/rss/articles/CBMilgFBVV95cUxNVTVKT1VuWEZoVVdnZ3EyRWhERzRwc1lJZU9Ha19YYUk0QlpKUEdyQ0VBV0lWNG1WT29xUlBKWXpTMTJxb0Izd0t6ekZzTlRObGlLV1lpaFFHMkRPeEFkQjdiLXRIbTE5LTJnUU9maGloV3ZnUElKUGk2VWJUQUllNU43b0JZekhVWVVMUFhWRy1LMTZ4QUE?oc=5
2026-02-05	Google	0.0	Bitcoin Giant Strategy Records $12.4 Billion Q4 Loss as MSTR Shares Hit 18-Month Low - Yahoo Finance		https://news.google.com/rss/articles/CBMihgFBVV95cUxQdnl6Z1JmUDRiRERwaldCRzRoTG9vRFlfM3pmckFpWkQwWnZ6U2JpX3NVVE5jSE8xRDVrdlBBYXVtcHZVOHlLZHNLVHJ4R1gyT3BUWDRHV3pzX1JEWktXd3FaeHJmaWRYSDNudHpjREZPaWpMWG9Ybnhka1hkTENObXV3TXdGUQ?oc=5
2026-02-05	Google	0.0	Strategy Stock (MSTR) Q4 Earnings on Deck: Options Market Braces for 7.75% Swing - TipRanks		https://news.google.com/rss/articles/CBMiugFBVV95cUxQN093QlBnbUVyOTVneW1xMnBEWmYwS3N1a1ZkdXd6TmJnYTFaVmVRY1pFTUpTY3diY2hTYlBVYWtxWkVFZU5veE1QMzk0RWszNkQ1ZTVXTG9WZnc0RGplcUhERVh0aUVUSC1NWnhwOFpmLWc0cjNyaGp0QVprSS1GQkx0X29XZFYtRTM2eUVidi1GNWVPOTJtalVDak1iYnp1eU42Z1ZQVDFSYlJDQWJ2NlJnOHM0SmdDSWc?oc=5
2026-02-05	Google	-0.04	Strategy posts big Q4 loss as bitcoin sinks (MSTR:NASDAQ) - Seeking Alpha		https://news.google.com/rss/articles/CBMiiAFBVV95cUxOb0w2RGh3c3FrRXdUUWhJTlJDakZtNC1ITFQzb3hYUDhiRkFxclNNel9mczBxZWVvN19ic2RydmlBR2ZTakY5ZjdndlZlcU55VUFNZ3pNZWNfTDhWQ29SaGM4SWdyblN1X18tOTlLSkljRWl6QnRjU09PUDFRalFkYVVmQi04VmlR?oc=5
2026-02-04	Google	0.0	Bullish analyst slashes Saylor's Strategy price target by 60% - thestreet.com		https://news.google.com/rss/articles/CBMiogFBVV95cUxNZThlcHlGQVV0a0hhcFJNa2Q4NFIwNUNTcFlUYUMtMGhodzlLbU5MalhlMElGMDVzNVZmU0RwZ2ppMXNrNE5UZmdtQm1PQzdISDJMRndSdE9OS3FVQUFsTVJwc3JudWk4S0tHWGpoZ3ZONVVOdEtBQ2tZRFZnbUctOUkxUHlZYm92bTBlekNoeC1BTUxDajlLakF0cFBSRlgwWGc?oc=5
2026-02-04	Google	0.0	Canaccord Analyst Slashes Strategy Stock (MSTR) Forecast by 60%, Says Bitcoin Faces ‘Identity Crisis’ - TipRanks		https://news.google.com/rss/articles/CBMiwwFBVV95cUxNMDRRSzBTQjdQMGd3QkFmMHFkQmtkUkplMEc5WF9vSC10bWZrY3F6NktEUGlxR0FjYmx5YS1GRWtXZlVjdURZVkVrNk00ZzA4SVhXNkRpVHkwalN2MVVQckZMRnh0RlNBcXhtdzRQQ2ZESjRwdWkzaHBlaUdJWFlPRVZwc1E3MWhyNUVRdE5rb0RBVWtsRjlJUVU1Yzlrc2hBUGlvS3JOSDFZd3Jjcy1uYmpOTGRGQzVnZVZPdlBTXzhWcGc?oc=5
2026-02-04	Google	0.0	Strategy ($MSTR) Shares Fall 20% As Bitcoin Drops To $72k - Bitcoin Magazine		https://news.google.com/rss/articles/CBMif0FVX3lxTE9nV05fOEt6Mi1RNDhDZENXR3lRYkNtbDFJdWpEUENfYmdsMjNWb2gzclhKWDlYUXBNWWxUdkhPSkQ1Uzlfdk9HNTM0Y0luSE90cVNrOXY4Si03TFB6ZnZKQTJycXdyckNxbjlKT0hKUFhaVFh5SWF2b0dtNEhlMkk?oc=5
2026-02-04	Google	0.0	Strategy (MSTR) news: Canaccord slashes price target as stock tumbles to multi-year low - CoinDesk		https://news.google.com/rss/articles/CBMiuAFBVV95cUxQMkJWX1BmcUlkTHc3ZVJLUlZIZ3k4cVJlZU54Q0JJOWdpZk1sdGFtM1Qyc3d3dUN2NU95YzAyZk1odFFzUEplOGxSUGNrMm9iYmZfQmZGVUJyZ2xZcVoweGJ5b1haUXdwRlRQSHpGblotR3NtYzFVcUxuWllIaHFQalF5VGFGaF80LXhGZVdTZC1hbXVhbnRsQnVTMC1Lb3JvWFVVbDN3ejZxYlRfcDdDOGdwcDQ3Q1N1?oc=5
2026-02-04	Google	0.0	Strategy Q4 earnings preview: Number of diluted shares a key metric (MSTR:NASDAQ) - Seeking Alpha		https://news.google.com/rss/articles/CBMipwFBVV95cUxQQmJPMGZiUGpSa1hkVzVqdFpVN0E4X1dJVG1FZkF2MXVLX2Y0MHQtUnpwS05LZTU0VGxfMmlyZ2dWZENfcXdkdWEwNjAxOVY5YkhyRE1KeGN6OFVZNHBHUVRzMDFZZDEwcmtzdWt6OW84N0w2ZHIweDlXU1puWnhXSU5RQlNPTGhrTUdSeXczY2dUMXZYdVhCZ3JUeGdtaGVfVWNZOUozNA?oc=5
2026-02-03	Google	0.2	Shares of Michael Saylor's Strategy (MSTR) slide toward eighth straight monthly decline - CoinDesk		https://news.google.com/rss/articles/CBMinwFBVV95cUxPUE1tcHpQdFF4WUk1aUtUaTNnQThwQUZRMGhGWC1KcnVwZWxVV2h6dmhIbjdZSTRQbl9Ia194SFNnTV9NT1JfemNGSmpBZlI5ZGo3VlpiVktwSEhxS09ULU1nVW83MDF5ZzlkNUhFa2czVUZXbmJtdWhHMXoxeEV5d1FRMWl1OC1uU0FVSHQ3dGMwaHhhQVRtYjhZWlA1a0k?oc=5
2026-02-03	Google	0.16	ETF that feasts on carnage in bitcoin-holder Strategy hits record high - CoinDesk		https://news.google.com/rss/articles/CBMitAFBVV95cUxNemdRaEZRZHl2TF81dlRsb3pydDZZd3lxbE1qV3c5TFk3X0R5WC1QbUI2T2MyaThUR3BWU1dQUi1sMzg5SDV4cjY4VVpyVmJFNm53c2h5N241b0QtYmZzc3hnUTFocVowZFBIQ3lCcUdwdTBNajljZ3dmT21VRFZLTDRfTC1mOVBVaVYxRlJZVS0tbnExX04xU3c0RUVoY0NpV0hHWm9KLXZ6UTZicE16Y01lSmo?oc=5
2026-02-03	Google	0.143	Strategy: Bitcoin Selloff Looms Large Ahead Of Earnings (NASDAQ:MSTR) - Seeking Alpha		https://news.google.com/rss/articles/CBMimwFBVV95cUxPOTllekZQMGsyYmJHSm9DLTYxbUYzUHJXZ3RXNHJSS1R6aFdQc1diQkVLVEF4ZzJtVzA2UEZQN1QyODFlamdreDU2UjBQSzNVMFd3RHN2azdQN25heERPVTN3TGtOall6Y1pGT0REYnJjdzIwMXpCSlhUM1ZiWkR0RWY1aEl5OHpyaVlMdERjUGpmOGJFa2sxdVhlSQ?oc=5
2026-02-03	Google	0.05	MicroStrategy (MSTR) Stock Barely Escapes Cost-Basis Scare — A 20% Price Swing Awaits? - Yahoo Finance		https://news.google.com/rss/articles/CBMijgFBVV95cUxPN2ZUNlV1d0ROOGlwR0lHaEFSeHEtbEthc1lMbWtSM3MtS1FLRkl1c3ByaEw3bmFxS1puQ1ZJeGFQbXNSR0pSY2ZXQS1TWkVTdTRJR0JJNUxYa3JuODFLcU42VzMzN09GSHgwdDhFT1lIa0paQWVneU9ObkRHNkp3TDBZTXEzdzJPMVFYenp3?oc=5
2026-02-03	Google	0.0	MicroStrategy Stock Hinges on Bitcoin Correlation For a 20% Move - BeInCrypto		https://news.google.com/rss/articles/CBMihAFBVV95cUxQRGJFZFRXamE0Q1BvN1FPNmw4d0hCZWR1RTNxaUV4cVRVYWVIcVJ5WmFLZ2hFV285R1c3V0VBbjc5NXZDZlZjOWx3SGpKQlVzZWpZbW1jWkFibDl5YnAxX3dWVy1MMVNVYUtIVzNWdHJoYXl6VVktM1FkTUsxcE5SS29kTWw?oc=5
2026-02-03	Google	0.0	Strategy ($MSTR) Plummets 8% As Bitcoin Hits One‑Year Lows - Bitcoin Magazine		https://news.google.com/rss/articles/CBMieEFVX3lxTFBmazl6RkFwemVlQjIyY01Fd0ZOS0pTTkdLQXhCRU9Qby1lUEg5bm52SkxSenJNNW9rTXhMXzdvSDFBb3A3bm9kODBKN3AtdEVIQktDVDBuX19GR3hfN3R0bEk2YjV5d3RtVEduVjMyQ1hrY2FXbzEyVQ?oc=5
2026-02-03	Google	0.0	What To Expect From Strategy’s (MSTR) Q4 Earnings - Yahoo Finance		https://news.google.com/rss/articles/CBMihAFBVV95cUxNc014dGVvNkRPZ2xvb3pDLWFwMUhSX3lUYTh3MEJDcXFDQ3NEa1dtaEh0dHZQbTBIakQ1anpIQ2FxRkJEdTQxMHpBRmpTSUJTXy1CQlRNZ2VrWXNWbHhRemItbnJwamozWXB3M3lmZ2FKVHNPSDhLLVJkLTdoaU1fcHladlE?oc=5
2026-02-03	Google	-0.022	MicroStrategy Stock Is Down Nearly 70% from Its Record Highs. How Should You Play MSTR Here? - Yahoo Finance		https://news.google.com/rss/articles/CBMihwFBVV95cUxNTlM2R09rVGdzUVVzdUJCTWlkVG5MeGVpcVF6RFZISE5mT3hMLWYzLWttb05HeHZVcXl3cG1hVHJ6dFhHSDQ4MEpDWXFvbTh5WWNTS1VRYTZVZVRQbnVtMEE0MmctQklTdWlhTC1RUDNxZE1IWVliV0hEdm1MUGhING1YQU5mOWs?oc=5
2026-02-02	Google	0.08	MicroStrategy Is Trading Below NAV Again. Should You Buy MSTR Stock Here or Stay Far, Far Away? - Barchart.com		https://news.google.com/rss/articles/CBMi0wFBVV95cUxPZmREeEpfZXNwdkRfT3VwdzAyM19QcDlxZ0kyLUlkYjFSdTluclRqcWtoNTdxNzRkaTlVVWl6dnBpaXJBU0JwVGswRW92RTV1VHNLMHU1Z0pLSjE0d0hMNjBvRzVJWnNmYVk2UWFHX05SdEtzSDRYTGc4MVNFZGdaYThuazJock94bVpFdVYzQUFPbWJaOFRRUTJyV2RjSXdjMmFGWWp6OVhnV0VIMW9pQzRtcm10UXpRUkhSRlZQbm9iR25fVzNHSGl6Qldmb1lGZFpJ?oc=5
2026-02-02	Google	0.0	A Look At MicroStrategy (MSTR) Valuation After Bitcoin Plunge Tests Its Leveraged Crypto Strategy - Yahoo Finance		https://news.google.com/rss/articles/CBMikAFBVV95cUxNeVhLbHRmMGNGTDBlbnBkRklfWldDdHVZU1F2VnM1cG4yemQ2OU1sUk00REw4M1BUbm04UEtWN1dJLVc3TUFZbU5jZGUxQmcwUU42YnRTYlJFaDRETFZZQ19ESzVtdjFUZEg5dHJZcHhCRl94TkpYQVhZaWE0OElzWU91OHRpS3pjMVE0a1o1Q2c?oc=5
2026-02-02	Google	0.0	Strategy (MSTR) acquired 855 bitcoin ahead of last week's market crash - CoinDesk		https://news.google.com/rss/articles/CBMi1gFBVV95cUxPNF84NTYwOHowNUVEb1A0cUN1cElZUFhaZ04zaWxUMnlYeExCQndCMURyMzIwMmNSR1RZMC1HNnVwT0FPLXpSdmp1bU9xZThFR3RRU3FWdjlRNTRlVmFVd040c0J5cGRuVU9YbjJ4RkJOLXA5TXRZb2tkR3ViY3NkdHE2UTFQc3oyMEZpWGtzTy16RkN0RVduZmU5ckhjUi1UazlKSVZWNmpHNkJZSnZxSFlwN0FtcEw5M09ZaG1VV0ZnSktaMGhoelJxMzJsc1VxTWJlV1dR?oc=5
2026-02-02	Google	-0.128	Strategy Stock Drops as Bitcoin Price Sinks. MSTR Is Doubling Down on Its Bet. - Barron's		https://news.google.com/rss/articles/CBMimANBVV95cUxNMFF1NXpGWE9rTC1MZVgxUmVFbWJGYUNwNUc0c1B5eHkyODFRcl8tQU43U2tWRDF4cGs1OWRCWTgyZ2NpZXV4TzRqZ0RfWG5qTDFsOE9JLWtXd2Z4bXlqcEloU3lDYjBQUlVzWmVXTThzam13OGxwUC1RckJKU0pPWDZuX3lDMk5FRDYzVlhuLWZDbUZ5WTNIdzV5UUtDZm9ERk9oVF9oVDNOQTRxUHFHSlNqc3EzY01zU2FVNVRGTlBqUWpybzd3QWlWQlJWRXR3amcxcm15T0E3SmZjT1VseDhYQ0NGVE55d0Vza3JKU3JINVhFcHJIY3Z0WkNCdHBGTm9rWmNpWWlzVkN5NUp2Vm5vWjRCbDQ5YS1XOHJ0UHA0X1YyWF81cnFiNFZMdHp2dGpKQWxiRUlBdUpSVjd0R3lLRS1MdWoybjJGUG9mQUpXSUpEa0RDaDRvMk5EekZxZnZncGtORGdVSFctcktkMHdyNWhHazBxQWY0UjVhLVVDVVkzN2wxXzdhekxiNUJlUDBXcjYxTVQ?oc=5
2026-02-01	Google	0.0	Strategy (MSTR) lifts STRC dividend as shares drift below par - CoinDesk		https://news.google.com/rss/articles/CBMivgFBVV95cUxPNVZwU0JiTWplOElUZFZxcFViVHh0X29uZm1CWWk2bVIzaWV4d2RQTkpiRmdrdEdWbmlaN1VZazNIT3dFSU55dUVpMEJkeTlzU0pSa3YtMXlmNWhpWFZfTjRrSldKQ1hjVGt3X0ZoWlNWRjlrQUJqZER4aExPSWMzNjVzLW9IdWhJMFdCbW9NaGV2a3VTLVpRSm1NSmxacnBOekh4UXRObjRnRDVFUmZ4WGJ3VHVFa3gtRHMxLVZR?oc=5
2026-01-31	Google	0.0	Michael Saylor’s bitcoin stack is officially underwater, but here’s why he likely won't reach for the panic button - CoinDesk		https://news.google.com/rss/articles/CBMi7wFBVV95cUxPR3BOWWJkNlVHQVpoVHg1b1ZQcGhLMWV0cWRBZkVSU2lOc0tvakZ1Y0lNQnpXV21McG9Qdm9haC1LNkJvVUdvNlRkM1AxNnM0UGF4TXNCc2VhbHRRaXJrODVub2RfRkxsUW0zZ0hpR1ROU0d0bl9NQk9FTjJfVGtXTXBVTmM5TjJSZXpfd0FqU3JVbXlpTG1hRXNWUTJzdXd4Sl9qNkFWVDRGaDc5V0RHRzJDa1hBNkVXMm9KaDVGTUhSemJiSGFuRExaNC1RcWt0SGhPSVh4T1pXbXhpT0RQVmdDS1MtR09fV1gtSmNoOA?oc=5
2026-01-31	Google	0.0	Strategy Inc. (MSTR) Bolsters Bitcoin Holdings after Shares Sale - Yahoo Finance		https://news.google.com/rss/articles/CBMihwFBVV95cUxOVnJiZzhYMEZpeEozN2lyc0ItNDc5bk9faEtITnVwcTh3cXVLUlpxYUpIc0ZmOUQ2ZEVrdTI3OUJtQy1nRThaRlhnSDJsTHVGeFotT3FldHhsdnNCYUM4WW51OTB2Q2c4NmpkWVMxdXlXd3dTRTlMUXRZYTN5UTBLemF6NEVhUzQ?oc=5
2026-01-30	Google	0.4	MicroStrategy Stock: The Bitcoin Bet Trading Below Its Own Assets - Trefis		https://news.google.com/rss/articles/CBMiwwFBVV95cUxNcUNlcklJVFVkRjVQNWNNemZUZHFFMW9Qc1NmazdOdEtTSTZYZkw1TTU1X25uUzVrenVmTnRJeUFWTFctR0lOX2NjV0ZrOGlmR0NjZU1aZEY2Mk1EQXNRcVIxQjktQXZ2eTd6Z0tfdG9IajFReHlQYXFtSTNPRUdGRDBjcFdDUXZISlFwYW0tdGxDY29xMUxZUGgxTjdweXowOHFYY3FmQkN6QkhBX0JQOWtMbWZYeG5KbVpKR29BTWtaZjg?oc=5
2026-01-30	Google	0.0	Is Strategy Stock (MSTR) a Buy Ahead of Q4 Earnings? - TipRanks		https://news.google.com/rss/articles/CBMimgFBVV95cUxNRGMzX18yMy1PVzctY2xtQXdJX0JUOXBlcmN4SmtWNEZ2RVZBcnNxNlVhaVUxU2tDai12aGhHVkdYSWpMQjV0MklkYzN0NFRnYmJsWUR4RDFCY0hqa0ZiaVBBV0R3TUhuUVd6MU9YaTJWOWY4dmo4SUVhT2dEVWRiclgtX0FqdjlCOW5xOTE3cWw3Tk44bGR6cVJR?oc=5
2026-01-30	Google	0.0	Strategy: Bitcoin As A Treasury Model Faces Stress Test - Seeking Alpha		https://news.google.com/rss/articles/CBMimwFBVV95cUxNTUcyblNHWnZLS19DcGRlVTRsVi1aVHJlSkZHSjdRNGtqaVBBTDh1dTV6bU42c2FSNVl0RkFDd1RxLWc3aVZXaHFKeXBFVktVdnBlM3FWa2NXOTRCVHdQbzZWaU83VENFdnNIak13ZzdrQ3E0dk5pNk1GV2gwNE8yc2gyYUJaanlZT0VSTFhpMEU5YzhyRm5uWkFpWQ?oc=5
2026-01-30	Google	0.0	What's Happening With MSTR Stock? - Forbes		https://news.google.com/rss/articles/CBMilAFBVV95cUxObDItb0VFR3MzdWlXd0lWRm9kTGF1ZEo1eENmSi11bUU3cVFoNU1XZWw0YnF6d1JSSHl1VGJRV01PY2xBOHdaTEN0ejh4eF9OOW9YMkNlVlVhaE1POEZXZlE0RWVKYXdRVFhoS0c3elRLaWVvb0Y4eDV6eVBRWngwYjlXMVh4UGtGelpBc253MUpqMG8y?oc=5
2026-01-29	Google	0.0	Strategy Stock ($MSTR) Hits 52-Week Low As Bitcoin Craters Below $84,000 - Bitcoin Magazine		https://news.google.com/rss/articles/CBMifEFVX3lxTE83TXZxTWlpVmVsY3F3MXhNaUNVVW9yeWJhZFlaY28tZHJ3SjNPaklObGJxdmV5di1nZG5uSFNLTkpoQUFwLWlJaU51SjFRT1RHelk5Z1EzZWk4cDBCM0o5ZXNvVmIyUTJRVk5xVHh0aDFMUzZPOW9XVWhtMkw?oc=5
2026-01-28	Google	0.333	Here's Why Strategy (MSTR) Fell More Than Broader Market - Yahoo Finance		https://news.google.com/rss/articles/CBMif0FVX3lxTE1DV2JOOENULVY5cnM5NnpDRDBYampRckVmUmo4WVVrc3lHMjN4enlIT1dOY2lQcE1mMzV1REtOUDJVVnhweW1wczQ3RV9FUjZha1E5X3VOTmtQc0tobjZPdl96bExRQWt2SmYtcWc2aS1sWTJJRlU0bHRXNVJIQ3c?oc=5
2026-01-27	Google	0.0	Is It Time To Reassess Strategy (MSTR) After A 51.9% One Year Share Price Decline - Yahoo Finance		https://news.google.com/rss/articles/CBMiggFBVV95cUxOUEF6Z0Rlc25CSGY1OFVidlFLTW9TZ2E1a3o1LW5iYUpFeGsycWk4MWdSeEd6dTNTeTRlbkxFTkpfLXN2cHJtRWdHZm5BV3FXaC1tc1dRYnRYTlVjR3B2clQtbDBNSlF5OEhocWRwZU1VLWhnaDRqWUxwYzZtRmJDaDVR?oc=5
2026-01-27	Google	0.0	Strategy Buys 2,932 Bitcoin For $264M, But MSTR Stock Tests Critical $160 Support - Yahoo Finance		https://news.google.com/rss/articles/CBMifkFVX3lxTFBqTEFfT21UVHJHUWN5cm1lOWowVmxtSXlNSkhpSjcwV2t5dUIzaldXemd1bTFBSmdhYmNVNG1iempTVGVWaTJSZmtvNWc0RWh6Wk1jbzRQVEx2djJsVkszcHk2Y2tTOWdrWHlMMDlaZkxvbUdaRG9PNUZWNnNNUQ?oc=5
2026-01-26	Google	0.0	Strategy ($MSTR) Sells $257 Million in Stock to Buy 2,932 Bitcoin - Bitcoin Magazine		https://news.google.com/rss/articles/CBMigAFBVV95cUxQZE9YLVNxS2VrWVdUTkptM2toUWNpekJ3eGhuM3ROOHRuZ0tjQVdtQWV1LWRBQWtLbUY0dTZ2cFJleER2OTJKYUk3MkM0M0lVVG9HLUx6QVNKcXVXVGZONG9WQlpMTUNiclluendZRmxkYzYxU0VzREFkM1JTVm80UA?oc=5
2026-01-23	Google	0.0	MSTR Drops 50%+: Buy the Dip or Walk Away? - Yahoo Finance		https://news.google.com/rss/articles/CBMidkFVX3lxTE1zaVZNNFBiV0x3OEhrRUhGVjFNVHg4NEM1QmxDaDY2Z0pqTkJWVGxiYjBFMFF3UFdkQzdNYWVSNjV3eVJ6bm56anFGcFc5YTN0SV9yekZiYUx1dURESi0yc01veVZIak5pMzBEaTNNa0JZa0dpRWc?oc=5
2026-01-23	Google	0.0	MSTR Drops 50%+: Buy the Dip or Walk Away? - Zacks Investment Research		https://news.google.com/rss/articles/CBMihgFBVV95cUxNRUo1MWg5QTE2TDVFRm5LdzlkcF8xaDlKR0JWNzV5Ykd0Zlo5SmhneFlxSUhybDNBYTZjeHQ3ZjlobWxFTklGMWh2MU9SN0IyS2hIWkhYZ3RHSTlCNVVoUFhPZHQ2QzZJMXpqTXpvblBPa2FBSGxIXzlfN0VEQU5uem0yZWdEdw?oc=5
2026-01-22	Google	0.25	How Buying Strategy (MSTR) Stock Today Could 10x Your Net Worth - The Motley Fool		https://news.google.com/rss/articles/CBMimAFBVV95cUxNNHFEbWlxYVBUbXloVUlySGhQQ053MkhySGR4aG4zTG1VdHN0MTRoV0daSjk0VFVDQ0ZHeGc4SWppbGxWWl9nOTQ1M1BMa0RpWnZQYXNYSU52QlVldzZwZE5HSmhvTWNhcG9QcGJCcGNrWUdzelozOWtyQWI2dG5ZNC1XVmtiRjlLcjZoZGlFcWtEbU5tTk5seQ?oc=5
2026-01-21	Google	-0.104	Strategy (MSTR) Is Down 7.4% After Leveraged $2.13 Billion Bitcoin Buy - Has The Bull Case Changed? - Yahoo Finance		https://news.google.com/rss/articles/CBMid0FVX3lxTFBHQUdnekF1QXhkVUU3UzU1OExUZ0RmMmpqLS14OXF4ZFlRYUNEa3pKdWlyZ3l0TzY5NmhUdG14bE1QV21VMWJFRFQ3amsyLTJqdmhJVklfa3g0QnBqd0xVeGluMWV4Ry1PZG1jaXRZVUpDNFduTnBB?oc=5
2026-01-21	Google	-0.2	Michael Saylor and Strategy (MSTR) don't need common stock premium to add BTC: Cowen - CoinDesk		https://news.google.com/rss/articles/CBMiuAFBVV95cUxNRW9oWk93MzFIbE4tQ2JQOW83cFJONGUtM0V5U0xPR0w3SlFpSTd0cFo3bEFvUk5oUzRkNjE4S0s1SmZaV2JBRk1lUkxOX0tkeFdfRktVVWtzMjJvOGt3X1hVTU95ZUszQVV0M1JqaDVWQVk5aDh1Vnp5OVdCRTRITEpKcGhGQU9Ba1pZdW1ySVYwTndqandBR3Itb1dXR1FWUDVfYm0zeGh6bUd1QlVmZDVheFhUY0ZL?oc=5
2026-01-20	Google	0.2	Strategy: No Longer Worth It (NASDAQ:MSTR) - Seeking Alpha		https://news.google.com/rss/articles/CBMid0FVX3lxTE5uV0FqSFVFVm9GdWRFcGNXVy1mMXZ0aFF6UnRqQVBoOUxnOTkzUVFWRWN6Q2lXeWhJMDNDb1Nvd3RzS2cwemtkNGdmN3hndFJiYmxhc294YnBFalVtd1phcGZMWWtSb2lQYkwyOF9zblRVWnFoem9v?oc=5
2026-01-20	Google	0.0	MSTR Stock Outlook After a 62% Drop - Forbes		https://news.google.com/rss/articles/CBMivAFBVV95cUxNeEpYUVZYaG1uTmNVam5NS3RkallZR09YYUpZdTc3UnRqZW9CM1JNT3FRajJmOUtScktFWTlzZEFzLUc0Sld6bkFyRlNqMF9UWGxRa0s1OGpTRWFBWVRpajVaeUNmdk1OQS1zdG1iMlJRNnZDR1ZVU1MwNE96ci01ZEhONGNGZl81RmgxQjFNeGhzYm5yOVpRNWVYT1Z3ajBQM2xjZWlsR2owVVZnMW5EMmtoRVVSa3dlUEk3bA?oc=5
2026-01-19	Google	0.0	Strategy Inc. (MSTR) Acquires 13,627 BTC after $1.13B Balance Sheet Boost - Yahoo Finance		https://news.google.com/rss/articles/CBMigAFBVV95cUxQOWk2NnA4akRRZkJ6eEJFR2E4UUk4QUh4MDg4cWRYNGZEb0ZKcFpYZjBXWWhMNmkta0U3QXEydEc0TTFIQWIxdVNZNkh4SDVNUzExSFpERTkwMy13bjg0MkhlRDNITjZoZDJJQVF6X3Zyc1RVS09MMThmRDdGYjc3Zw?oc=5
2026-01-18	Google	0.0	It takes six years to earn a $MSTR degree in finance. - x.com		https://news.google.com/rss/articles/CBMiW0FVX3lxTE82bFc5MlpQcDRRdm1ERHViZEZCbTc3Nk5QVHNCLTFvSUh3ZVIyamNFNWJRVE5CMGZPYnlxNEZ2c2p5WnBPU2F1TTRWSS1ISlpqTHNLUGJwSEszd2c?oc=5
2026-01-14	Google	0.0	5 Reasons MSTR is a Buy at the Current Discounted Levels - Zacks Investment Research		https://news.google.com/rss/articles/CBMingFBVV95cUxOWkI3ZTcwOWtoU0k4bVlGR20wclVDYWh5SExtUTZmMDFDYm9zZDd3cEROX2RoN0ZyVzlFVUsxNVl2bnI2MDUxNG80bkxkZFFMbU5hY2Fxb05rSmFsWGs1enB6WUdGTzJoeHBsdzByZ1pibUY2dldUbnFFRElOeDVnT2U2U2YwQmJUbWVaX05NUTFZV3pHVl9fNDc5d3QxZw?oc=5
2026-01-11	Google	0.6	Institutions own 46% of Strategy Inc (NASDAQ:MSTR) shares but retail investors control 48% of the company - Yahoo Finance		https://news.google.com/rss/articles/CBMihAFBVV95cUxQa3YwLVZ2U2lEREU1WllxOFJzQzlRRXV6UThVek5DQjFDZl9VelA1VkhWeWRCdnBINE93Mlk5amZYQ3dHLXZPT0E5aDZIUDcyYUE5b3hZcnNMdFMzek95cFdOaDlOLXA5dlFNd1ctTUd1aGVpR1ZPQUdYWWNwWHNicVhDSVU?oc=5
2026-01-09	Google	0.0	Strategy (MSTR) Stock Falls Amid Market Uptick: What Investors Need to Know - Yahoo Finance		https://news.google.com/rss/articles/CBMiggFBVV95cUxNZUJ2YVBsWHV2MXNDZ3g1M1RBWm9QWHNJdU9rSjMxUXBydkZZdE9HVXdVcU9hcmZ5OS1aLWdPTUZid0w0Vi1BdkJGMm0tSlctdHNJc3NMUUNza2xib29uSXN3ZXlXc2lqRnJqcGRTVEk0ZDNENXFPa0VFNGI2bnE2NFdB?oc=5
2026-01-08	Google	0.32	MicroStrategy Gets to Stay in MSCI Indexes. Is That Win Enough to Keep Buying MSTR Stock in 2026? - Yahoo Finance		https://news.google.com/rss/articles/CBMiigFBVV95cUxOQ0s1S0dLZkhzdnlJSVRyS3RkdkdOOVp3OWk2UWRIUDZJQXJVLVpKTVBKX0JFOEZqaEdOS2IwU1pRLTgzeGxjMlFuMmV4VUFaRFpjemctNDl5Yl9YRnZTZjJna1NYaWRnUWg3cUlyS0czUG1kLXAwSU43ZHNUQXhWajFpZHh3NFhPSGc?oc=5
2026-01-08	Google	0.186	MSTR Stock Breaks Above 20-Day Moving Average on MSCI Win. Should You Buy Shares Here? - Yahoo Finance		https://news.google.com/rss/articles/CBMifEFVX3lxTE1XUjVnT1BUeVVUZlI0NXkxUjZtMEQyQ21WbGk5SzdxRV9rb3E3OFZRUDR4SFRDVXJ0LUxCOG1QNUhfbWtualFBRWFNQUpTVTZTeXdPUUlBcW1KcDlibk56WUZMQVA4YUVMdUZkc2VSWDdfYWhSb252ajNpU24?oc=5
2026-01-08	Google	-0.15	Bitcoin Falls, Strategy Wavers After Negative MSCI Rule - Investor's Business Daily		https://news.google.com/rss/articles/CBMirAFBVV95cUxNWHY2bmlNaEZhNkRBeC0zaXU3bVN4V3FGd0dRX2hwbFdwOHVqNXd3akpHWWZES0VvRy1NcmQycHZOdlRTXzZfdnNNa0UzSkFrTjRQMk9zM0JRYVViR1NxSGFJZ05keEszUmFsdWV4aWZvQjVHOFA2OWlPMDdqQndVNkdXNTV0eVFYc0tJbERleDE0UTFGeUVPSTZfNzZSMDZfd0lVQ0VWUzBjME4x?oc=5
