Date	Source	Sentiment	Headline	Summary	URL
2026-02-22	Yahoo	0.2	Scaramucci: 'Yes, We're in a Bear Market,' So Get Bitcoin	On Sunday, Anthony Scaramucci said he believes markets have slipped into a bear phase and argued the real issue is duration, not whether the downturn exists. He has also urged investors to keep building positions in Bitcoin (CRYPTO: BTC), a stance reflected in accumulate don’t speculate messaging tied to his long-running role as a high-profile crypto promoter. In a post on X, Scaramucci described bear markets as periods that linger until participants run out of energy, not moments that end simpl	https://finance.yahoo.com/news/scaramucci-yes-were-bear-market-181008051.html?.tsrc=rss
2026-02-22	Google	0.0	MSTR Stock Climbs 6% as Michael Saylor Teases 100th Bitcoin Purchase - CryptoRank		https://news.google.com/rss/articles/CBMiqAFBVV95cUxPSkNoU3hKWmV2VW1xS2dreGU2NnpDb3NuT3dMZjFqR2RqZ29pUTFMU1NNTFE3OWoxbGhZa204aHFTbnhMYlJheWN3R1h6RTcwdjFaTGt5MXBCMjI1c2ZHTlJpOHZ2dzRaandYbGM4aF9WeTQ4VHYxeVRZREsyNHRDaTJJaVhXVUNXMWxLT0xNNlcxSEFGMVNCbzktT2l1TllIUGhmWmY2M28?oc=5
2026-02-22	Google	0.0	MSTR vs BTC: Will MicroStrategy Outperform Bitcoin by Feb End? - CoinGape		https://news.google.com/rss/articles/CBMimgFBVV95cUxNOTVaNlk2RFRucHFaVkg0TzdXYTRoZnd1QTFra3YwYUhtZk9IVHBObzB5a2huN1FmZXZOcC0xbEd0RWhQallqLXd2MEE0NGVKSGVhSzEtekZxcGx5UXdWcVMwZzJTSkN1ZXhzWVZTYXZlRzViQXNzMHkwRmVoZE5fbDA5aHc2M05tbFp5a2hZaEZlQUNDZkpmYkRR?oc=5
2026-02-22	Google	0.0	Strategy (MSTR) Stock Forecast: Rebound to $130, $150 Next? - InteractiveCrypto		https://news.google.com/rss/articles/CBMiogFBVV95cUxNdmZjbG5KZGRZTEtseTg1azNCSFRKdkRUNDFOOEVQU19JUVlWbVRqVWxlbk52SzAwT1Z2alZQd0FybXh6enBFeUJjNmVQcUxQSGJXdlJ1MldpYm9CMjN2dC11TjBuNV9JVm4wSW5rVV9PcHVmZzZXY2h0UTJjOUt4c0ltSDNwV1RHckZtWktMaXRISDV2R2lOVm10aVRVN3pmUVE?oc=5
2026-02-21	Google	0.0	$MSTR stock fell 3% this week. Here's what we see in our data. - Quiver Quantitative		https://news.google.com/rss/articles/CBMiogFBVV95cUxOYkNOYWFhbDRQYVhhajBjWWsyQ2dVX0dfUVhOUEFBSWpMdF9yODNYZUlRWldadHdkUVY0VXA5R0kxUVNkZ0x4MWJCTjFNbjZNX3ZzSDNRR0lESC12Y2pYR0NrbFlLUDZ2LU90UDNHM2dnZkgtd0VOY2dSMmFMYkxSNVBvV18xN3BhXzJHemdlV1ZYVmtGelJJNG1MV0d3Q1cxSkE?oc=5
2026-02-21	Google	0.0	(MSTU) Technical Data (MSTU:CA) - Stock Traders Daily		https://news.google.com/rss/articles/CBMigwFBVV95cUxPMVg3bVVodkpKbW5xMm5aa2d2ZktxWF9RcXNZVzlNNF93bzJla1Z5T1BzNkJMTlpIQzIteHBNel9iZ3VpbmxuMENTU28zbmJUMEVtZFdZWjl4Sk1tck1YYVhvSVRJMXA1WEMydXQ0RmZLMG1JVlQ3TDgtR1NCOVBGeFZMaw?oc=5
2026-02-21	Yahoo	0.0	Stock Market Week: Nvidia Earnings, Apple And Strategy Events	The stock market will wrestle with the impact of Friday's SCOTUS tariffs ruling. Nvidia, Apple, Strategy and Iran will all be in focus.	https://finance.yahoo.com/m/e1e0182a-0a7c-3037-8c70-ab0d3a85c930/stock-market-week%3A-nvidia.html?.tsrc=rss
2026-02-20	Google	0.3	Strategy (MSTR) stock climbs with bitcoin bounce as fresh filing lays out funding risks - TechStock²		https://news.google.com/rss/articles/CBMiqgFBVV95cUxPcjYzR3l1cG4wMXNTR3Z4b0YyQWRMY3ZDVE9xYTMwcGpRMEhHR3RhQktQN28xaWZETFZuR1pJWU5XTTQ3MkpPa0hOMFQ4S0FZSGRiYm9UZnA5YzR6TGRmN2I1TTRwY3lleERCYnI3WUJpY2ctR2poRHNuXzQtdmpNUFNXa1RleWpTcWJ6YVZsMC10eEtjeVN2RlFOMDVUVHV4ZDNCY1EzdjlYQQ?oc=5
2026-02-20	Yahoo	0.239	Harvest Announces ETF Name Change for MSTE:TSX	"OAKVILLE, Ontario, February 20, 2026--Harvest Portfolios Group Inc. (""Harvest"") is pleased to announce that Harvest MicroStrategy Enhanced High Income Shares ETF (TSX:MSTE) has changed its name to Harvest Strategy Inc. Enhanced High Income Shares ETF (TSX:MSTE). The trading symbol for the Class A units of MSTE listed on the Toronto Stock Exchange (the ""TSX"") will not change. An application has been submitted to the TSX for the listed Class A units of the ETF to trade under the new name."	https://finance.yahoo.com/news/harvest-announces-etf-name-change-123000809.html?.tsrc=rss
2026-02-20	Yahoo	0.1	Why Michael Saylor Isn’t Worried About MicroStrategy Stock Unless Bitcoin Drops Below $8,000	Michael Saylor says Bitcoin must fall to $8,000 for Strategy to face real debt risk. Here's what the numbers actually reveal about MSTR's balance sheet.	https://www.barchart.com/story/news/330815/why-michael-saylor-isnt-worried-about-microstrategy-stock-unless-bitcoin-drops-below-8-000?.tsrc=rss
2026-02-20	Google	0.0	Strategy: Don't Buy The Perilous Dip, Still Grossly Overvalued (NASDAQ:MSTR) - Seeking Alpha		https://news.google.com/rss/articles/CBMiogFBVV95cUxQTXlYaHpDWVM3NmpyNkh0eE1scmZsMHJtbXVoM2lId05MQTd6VGZodm1xMml0WFNSQkI1Z051Q1Z5Q05fV1pjVGtSd3o3N3p3bnFORnhzdVBRUVMxTVVucVlQQ0ljeGE3S0J1bjVfWkhjVlVIQlBJanZXb0hqYXhVREYtZDFZSmJfaXFUOFozdHYzUVFoUEF0RlVKSlNHbDhSWkE?oc=5
2026-02-19	Google	0.05	MicroStrategy (MSTR) Releases Q4 2025 Earnings: Modest Revenue Growth but Massive Losses, Stronger Cash Position - Quiver Quantitative		https://news.google.com/rss/articles/CBMi6AFBVV95cUxQaUFoRl9mMVRHSE5XbUhXeFhNS3NvdnlJMUdvQnlXeUMxZUhjT3k4V3UyNVN2aDhBVFJnVm1mR2l3WFNtSENKbWZGdlBELWdqdXAwRm9hNi1SMi1BenozOUdwaV9TaUdZZkZ2ZlR6eHdXTjNYNGM0SDRhdDdfWnpQVEhiSFhfZWFUT1NuU0xNSGE1OWZfWGo1OXZCQUxsbDgyR3VBbVRSTDJCRXAySHR4RGxEb3U3N0dMSzJUc25QcEQ1ZEZzNWpzUWVhM0NPUkZGOF9xRjAxTGV6UWJpRG1fYld4WkhxdUZX?oc=5
2026-02-19	Yahoo	0.024	Michael Saylor Is Telling The Truth About Strategy's Bitcoin Stash, Coinbase Exec Says	John D’Agostino, Coinbase's Head of Institutional Strategy, appeared on CNBC Tuesday to weigh in on the market volatility. D’Agostino emphasized that while the decline looks large in dollar terms, it’s typical volatility on a percentage basis for crypto. Asked about...	https://finance.yahoo.com/news/michael-saylor-telling-truth-strategys-203026600.html?.tsrc=rss
2026-02-19	Google	0.0	Key facts: MSTR's Saylor buys 2,486 Bitcoin; long-term holders surge; BTC stable at $67,600 - TradingView		https://news.google.com/rss/articles/CBMi4wFBVV95cUxPMUsyTE9VbDRmVGctTlpwSEkwbW00NEtJaTY2WjFrLW9fWjJpUEVKaGdqbXo5U0t1SXpvTl9pRTNickhXZ2kyQzJOXzFuV2xCdGZ3ZjBYeEJPeS13UlZPdEdXT3VyaWlsVG9MQW9Uc0pJZ3BVQzBad1lndzF3c29OVF9PckhXUFBLWkVxaEZQdnEtSXFZNm51MWt3c2dvd1cyYjhKb3dBSzdIR3ZXSXRUeF96aTQ1TENseVp4NzdLUGZ6cUN1ZXFMRVdmX1FBSXdaNUR0WEpRVUhDUDRoRUpYbG5Wcw?oc=5
2026-02-19	Google	0.0	MSTR Has Lost 62% in a Year and Bitcoin Is Still Below Its Buy Price - 24/7 Wall St.		https://news.google.com/rss/articles/CBMisAFBVV95cUxOMllkQkV2dmE3SVhRaTBxTElCZ0lOMEgtdWlHcVAzMnF4ckVveFhBdFhwWGFKWWNUa200M1hFQmM3dkxFVk1MS1pBNEJEQW1kZ0FNdHE0MEMzUlQ5ZVRFS0IyVjhWQUM1N2FjUmxiYW9tek5IeG1BeXI5TUlBaDRzeGZnb2R6UldFLWJqS3RFRjUxWXRTYkdSSGw1a3E5NUx4bFFDT0I3dWdsN205eUNTaw?oc=5
2026-02-19	Google	0.0	MSTR Has Lost 62% in a Year and Bitcoin Is Still Below Its Buy Price - Yahoo Finance		https://news.google.com/rss/articles/CBMifEFVX3lxTFBzU0tLSGw1REJHa09HS3RJak9nYzFCQkVfUjVscGpzbDJBS3kzVE1QSzdTN005b0ZBSU1NSlZvVjRTYWtmeEpYbVNYS0JKQ25IbWtocGE5akxxal9SaEdVWXBpd1ZJSi1sTWUtaGZBa2pBZkUzUmFXOWdGMU0?oc=5
2026-02-19	Yahoo	0.0	U.S. state retirement fund boosts MicroStrategy stake despite stock downgrade	It has been a tumultuous cycle for Michael Saylor-led Strategy (Nasdaq: MSTR), formerly MicroStrategy. The company's stock has lost 65% of its value since Oct. 1 last year. Recently, the leading Bitcoin (BTC) treasury company posted financial results for the fourth quarter of 2025 when it ...	https://www.thestreet.com/crypto/markets/us-state-retirement-fund-boosts-microstrategy-stake-despite-stock-downgrade?.tsrc=rss
2026-02-19	Google	0.0	Why Strategy (MSTR) stock is moving today after its $168 million bitcoin buy - Bez Kabli		https://news.google.com/rss/articles/CBMioAFBVV95cUxObHR1b3FKbHExRC15Z1BucllNa2tqZ0FhNUdLM25pNUxMMGtpMHR1XzRTNHp5akdSV2ljNjFVTjg5V3BhTHdkWU5RSmN3N1M2bVVzSktHSmFiYWUxb3VfTlE0VjJjMGE4YThXMnBCLWw1LVdMdHpPSWFVVzhRM1N4R3Y0eEtTSWZkQ3UwVlNkNnNHTmZQbVBZcWcybFo1ekM2?oc=5
2026-02-19	Yahoo	-0.017	Strategy Bitcoin Bet Grows As Preferred Stock Funding Reshapes Risk Profile	Strategy Inc (NasdaqGS:MSTR), formerly MicroStrategy, recently acquired 2,486 BTC as part of its ongoing Bitcoin accumulation approach. The company is using high-yield preferred stock offerings to help fund these Bitcoin purchases, with the aim of limiting common share dilution. These moves come alongside a record net loss and growing interest from large institutional holders that are increasing their positions in the stock. Strategy Inc operates both as an enterprise software company and...	https://finance.yahoo.com/news/strategy-bitcoin-bet-grows-preferred-201046823.html?.tsrc=rss
2026-02-19	Yahoo	-0.117	MSTR Has Lost 62% in a Year and Bitcoin Is Still Below Its Buy Price	If you have spent any time on Reddit, you’ve seen that Strategy (NASDAQ:MSTR) shares have collapsed 62% over the past year, and Reddit investors are not holding back. With Bitcoin trading at $68,840 as of February 17, 2026, well below Strategy’s $76,052 per coin cost basis, the company’s aggressive treasury strategy is facing its toughest ... MSTR Has Lost 62% in a Year and Bitcoin Is Still Below Its Buy Price	https://247wallst.com/investing/2026/02/19/mstr-has-lost-62-in-a-year-and-bitcoin-is-still-below-its-buy-price/?.tsrc=rss
2026-02-18	Google	0.5	MSTR's Michael Saylor Says ‘Bitcoin Is Winning’ Amid Crypto Winter, Sees ‘Glorious Summer’ Ahead - Stocktwits		https://news.google.com/rss/articles/CBMizwFBVV95cUxQRHFiUld4UTF2YmxCMDQwWXk2dU8tSDlhUkQ5eGtobEtOTmVycEtEMHhwZ3p5cFZRRHJvaTZvblpnSGp5VGk1OWstVWRrZ0lPc29BSDRaSm5nZDBLVWVJZmE5R3ZubnRMN3BDZzg1YTVqRV9ySVpMQy1RdThnczQtaldQNEhCd0hySHZRVjZOVWJUYlZGS2pjTnkwQVBZZ21HWHhpWl9CWHQyU2tiNzYxdmdxU3dORGEzZmNOWG9SWWRSZDFYX2VBWTM3Y0xnbEk?oc=5
2026-02-18	Yahoo	0.283	Strategy’s Latest Bitcoin Buy Drops Average by $25 —Why MSTR Stock Could Drop More	Strategy bought more Bitcoin, but MSTR stock still looks weak. Charts show bearish divergence and a 40% breakdown risk ahead.	https://beincrypto.com/mstr-stock-price-new-bitcoin-buy-analysis/?.tsrc=rss
2026-02-18	Yahoo	0.2	Bitcoin Can Send 'Any Amount' Of Money Anywhere On Earth In Minutes On A Bank Holiday, Says Michael Saylor — Critics Aren't Buying It	Strategy Inc. (NASDAQ:MSTR) Chair Michael Saylor touted on Monday Bitcoin’s (CRYPTO: BTC) ability to enable fast and cheap global transfers even on bank holidays like Presidents’ Day. Saylor Champions Bitcoin’S 24/7 Operation Saylor highlighted Bitcoin’s fee estimator on X, with...	https://finance.yahoo.com/news/bitcoin-send-amount-money-anywhere-203017758.html?.tsrc=rss
2026-02-18	Google	0.136	MSTR Stock Price Could Dip 40% Despite New Bitcoin Buy? - BeInCrypto		https://news.google.com/rss/articles/CBMic0FVX3lxTE9mSXpPUjItaDBwcmViWDQ0SDVrYkNVbVpONTE1aUtnbDVldnFDVHhIMzlWVm5DX2drY0plOEhmdzd2NmpMekRyYzFCNWdpbmpQSlVSNTRGbjdJeGJjSnh4SnhGeWN2Wjl1Z0MzeUFFVHRPSlU?oc=5
2026-02-18	Yahoo	0.1	MSTR Stock Plunges 60% in a Year: Why the Dip Signals a Buying Chance	Strategy plunges nearly 60% in a year, but its $60B Bitcoin reserve and capital firepower may offer a strategic entry point.	https://finance.yahoo.com/news/mstr-stock-plunges-60-why-175600420.html?.tsrc=rss
2026-02-18	Yahoo	0.002	Peter Thiel sells off full stake in crypto company	Billionaire venture capitalist Peter Thiel has fully exited ETHZilla (NASDAQ: ETZH), the Ethereum-focused treasury firm. The firm once counted his backing as a major endorsement of corporate ETH accumulation strategies. Just months earlier, Thiel had disclosed his stake in ETHZilla, positioning the ...	https://www.thestreet.com/crypto/markets/peter-thiel-sells-off-full-stake-in-crypto-company?.tsrc=rss
2026-02-18	Yahoo	0.0	Assessing MicroStrategy (MSTR) Valuation After Recent Share Price Pullback And Bitcoin Exposure Concerns	Event Context and Immediate Investor Focus Strategy (MSTR) has drawn fresh attention after recent price moves, with the share price down about 26% over the past month and 31% over the past 3 months. This has prompted investors to reassess its bitcoin-focused model and AI analytics business. See our latest analysis for Strategy. Looking beyond the recent pullback, Strategy’s share price return is down over the year to date while the 1 year total shareholder return is also negative. However,...	https://finance.yahoo.com/news/assessing-microstrategy-mstr-valuation-recent-001846410.html?.tsrc=rss
2026-02-18	Yahoo	0.0	Bitcoin Price Falls to $68,000. Why Cryptos Are Struggling to Make a Comeback.	The price of Bitcoin fell slightly amid lingering uncertainty linked to the artificial intelligence trade.	https://finance.yahoo.com/m/185f5658-91fa-3dd3-a51d-963d94f9038a/bitcoin-price-falls-to.html?.tsrc=rss
2026-02-18	Yahoo	0.0	Cantor Fitzgerald Loads Up 3.33 Million IREN Shares	IREN runs data centers and mines Bitcoin, generating revenue from digital asset mining and infrastructure services in Australia and Canada.	https://www.fool.com/coverage/filings/2026/02/18/cantor-fitzgerald-loads-up-333m-iren-shares/?.tsrc=rss
2026-02-18	Google	0.0	MSTR Stock Plunges 60% in a Year: Why the Dip Signals a Buying Chance - Zacks Investment Research		https://news.google.com/rss/articles/CBMirAFBVV95cUxQVHhlNEFSdndyZjVsVno0aDNmSGRFRlk3ZXZfMW00RUh4dkF5V1I4Q1JtTXllaHNpMWdpUFRMUWxsZnFRMVFkNjNlM0NJYk9SUWtnQktJRHI4Y2ZMX0hqRW9OdHN5bzFFaTZnMjF2ZklMdTBDLXlhOTZFbXZMcXlWVHV5VlNONmNYWDMwSmRqQWxYdGxiZTB0VDBGMlVNTTg1UXlwdHdSaHh1SThM?oc=5
2026-02-18	Yahoo	0.0	Peter Thiel Cuts Ties With ETHZilla as Treasury Firms Face Mounting Pressure	Peter Thiel exits ETHZilla as Ethereum’s downturn strains DATs, prompting asset sales, balance sheet pressure, and strategic shifts.	https://beincrypto.com/peter-thiel-ethereum-treasury-exit/?.tsrc=rss
2026-02-18	Google	0.0	Strategy Raises Capital and Expands Bitcoin Holdings - The Globe and Mail		https://news.google.com/rss/articles/CBMi0gFBVV95cUxOdm5vRmcwMWhMbnc5VWloSUE5NFB5UE9SMW9Pc0xNTThpMTBOamFwX3lPNkhYdG1rb2RGM3VXc3Q3TjNvSHBvT1ByMWI3WC00dmE4MGtFSHNlcGNqQWdHeWZZR0x1OVBON2FuVlVLS2hrZzdMZ0ZXLVM2eDZxcGdRUF95OUV3MUtDZDE1LWthcnVKMWJBVFMxd3dsZE9sRjBBdjJ1WXQyNWtVQTJQZkEwT0pkT25PUUE0M3A4ZlNySzlhUzVhU3lBdDFUMERxZTlkWEE?oc=5
2026-02-18	Google	0.0	Strategy: Bitcoin Risk By Another Name (NASDAQ:MSTR) - Seeking Alpha		https://news.google.com/rss/articles/CBMihAFBVV95cUxPbE9ZMW1rMlBzWXN1Q01UMEJaN0VGeENRZHNManZ1alE4T282WVdscGFGQnREWWRabjhlVF9OblRHZ0RYYjRkYUZzWDF5dERJSEwxUktKd0dnUDJLR3BBNzVwbUpWRlJ5WFRfSnFMLUx4V3lhQWQ4eFByY2JfNVo3M0sya2k?oc=5
2026-02-18	Yahoo	-0.019	Strategy Deepens Bitcoin Bet While Shifting Risk From Debt To Equity	Strategy Inc (NasdaqGS:MSTR) purchased 2,486 bitcoins, funded through recent common and preferred stock sales. The company outlined a new capital management approach that aims to equitize a large portion of its convertible debt. Management reiterated its intention to keep accumulating Bitcoin as a core part of its corporate treasury policy. For investors watching Bitcoin focused equities, Strategy sits at the center of the conversation. The shares last closed at $128.67, with a return of...	https://finance.yahoo.com/news/strategy-deepens-bitcoin-bet-while-151055930.html?.tsrc=rss
2026-02-18	Google	-0.25	MSTR News: Saylor Calls Crypto Winter ‘Milder’ Than Past - Eudaimonia and Co		https://news.google.com/rss/articles/CBMieEFVX3lxTE9xS3NJZ0tqeG16OWdMVnl2Q0YzZ3hPY2tHcDJmclNvX2RONVgzOHFOM0lrRFFFRzQ0OV9hRDY4OFlIZ3BnakhjOHpqOU03YmgtRllVM1JFblBtb3I5eU9OYkdzNWd6S1BkWDVoelMyLTBOR1JnamNXYw?oc=5
2026-02-17	Google	0.5	Strategy ($MSTR) Spends $168 Million On More Bitcoin - Bitcoin Magazine		https://news.google.com/rss/articles/CBMidkFVX3lxTE5VN1Q0X0w1bG81eVJrckluSjNCdDNURXVxXzE1SnpJdnBNX0p4WG9ObHNwdUtxNFdmSnZ1V3dKMVJCUGFZVncxYVM5UV9wUkpDNHhvOHlndnFnN1lSNEhVTjl4Yll5V1JmdEp3UnF0SWlzQ3NzTUE?oc=5
2026-02-17	Google	0.2	Strategy (MSTR) Acquires Additional Bitcoin Worth $168.4M - GuruFocus		https://news.google.com/rss/articles/CBMilwFBVV95cUxPLTFZN0REb2J4ejl4bWZIQ2taSTd1MTgwRHpmdFNGYmpTVlN6amQ1RHAxa2IzZWRyYXVBMEFHOGFHNFdadjZCZkMzN0JIb3Qtbjk1T2NHY0xHZHcwaS1WTHdudHZlYXAzN2hTYXZKOEVDcEVPcV9rb1hrOVhXOGtUZFJmdnR4VE5lYzNXYTA2Q1FqcHlHRkVN?oc=5
2026-02-17	Google	0.2	Strategy acquires bitcoins worth $168.4M during February 9-February 16 (MSTR:NASDAQ) - Seeking Alpha		https://news.google.com/rss/articles/CBMiqgFBVV95cUxOa0V6WDdNWmV3VHozYWhBVUlhX0ZtYlNieU5oeEt0bEdpQjNETmlyTHl4RmN3N2RNbWZFMHA0TGhwUVpoVDlmY2pwZERiaUFUVlZGX1BsRmVHOWlxOGUxd1N6U3Q3aXhmM1Bwc1JHUm8xZ0gzZXBNWld1Um1ieDhrX0N3aUNqTDJKdzJZR1hNbWt6NEJIUF9ZWDFKQmRwQ01JNUxlLWZ0TlNRQQ?oc=5
2026-02-17	Google	0.19	IREN vs. MSTR: Which Bitcoin-Focused Stock is a Buy Right Now? - Yahoo Finance		https://news.google.com/rss/articles/CBMif0FVX3lxTFBLcmZFa1kxRnJZUDh2MWppVUE3TjBDSmNrVWpSWDJfaDliN2ZzUDNQend3d1Zibm5lQjJLNzdPVE1SdThaVFpVSkxReGhoN1RHUzdhbHEydHFTTkxQOUNsS2FkdW0zbmNyMXY4T3Z3OEVjOUtRS0h2NXVyRlBrVm8?oc=5
2026-02-17	Google	0.1	65% Yield from the YieldMax MSTR Option Income Strategy ETF (MSTY): Is It Real? - 24/7 Wall St.		https://news.google.com/rss/articles/CBMiugFBVV95cUxOWDBSbEFadlpTaHZqRTQzaGZLSWFSYzVxQ0tFMUx5X1FiOVN5VUg3YU1SLUFvd2s3bU9YLS1peW5GaDlYQW42ZUh1T0RrMFVtWGRnZlRVUEtfdGJMaEd1T3kyeTNEdGExcDYwbTVoWlhPRmNsZzB2OXpWNlBoNzU3eFdmaldWV19OSm9QVnNELTh0QXk3RlVLQ0ZCeHoya1FvNU8yVE16ekt1Um1fdE1TQ2x0a212YW1ZN0E?oc=5
2026-02-17	Google	0.091	MicroStrategy (MSTR) Boosts Bitcoin Holdings with New Acquisitio - GuruFocus		https://news.google.com/rss/articles/CBMipAFBVV95cUxQWllxRHh3SlhNdmtLUjhVX1pSR2pfTlhUVGM4MnlTSGpLTk5nemRTUEd6MTlBdW9KdGhlSk9qcWk1VFFNbm5EZkVIS3YwTUlZQTM3V2RnTldBdktzbVdCc3E2YUpWeVVHYlc2VEF6OUZwYjFEMVBjVF95M3U0YU9KZGRELWROWHNxajZXdUxwWTVwSGlHUG5ZMkN1MmdPWXpGTEc2Vw?oc=5
2026-02-17	Google	0.0	Breaking: Michael Saylor’s Strategy Adds 2,486 BTC Amid Institutional Concerns Over Quantum Threat To Bitcoin - Yahoo Finance		https://news.google.com/rss/articles/CBMiiwFBVV95cUxNZVBTNjd0cHBPMmFiNG9BdTNxOFFXLVlKQUVQNG5DMUpoVi1QNEp2dExIX2VWUnBlT2tyQW5sbGpNWXUwaUNlUWowWW00aUlsVmRPbkRBam1GTm1BeEJaVFBrWnhwN2IzN1I1emR1MTZXR19zYnN0WjU5VUpjZVVlcjROYm9ZQWFvaXpN?oc=5
2026-02-17	Google	0.0	MSTR Stock Dips: Mizuho Trims Target by 20% on ‘BTC Weakness’ - TipRanks		https://news.google.com/rss/articles/CBMikAFBVV95cUxNdGZweTJKR290aV9FTUVQcnQybnA4Q29nbE9YcU5sNUxsZnh1cTAxOEwzakNOVksxWTBfaEtNWlF0aTU0cXN3YlFtbUlvYzY1UzU3NHE1cHpjeXk4TXpYVXJxNHhCMzdtRWljcm5hV1dsX2thSkFybnhXanM0RU5LV2NhRnZ2Zlc2WlZjcHotN1U?oc=5
2026-02-17	Google	0.0	MSTR Stock Takes a Dive Amid Cryptocurrency Market Turbulence - timothysykes.com		https://news.google.com/rss/articles/CBMid0FVX3lxTE5Db3VlTHFKaGtoTjRxWkg3WTJjemNyUGVnLUxlTWE1VnBSQm8tQkVnOU9UN1pvTTdaUml5TDdKZWwxdFVvTkJ1WThUWlNwUjVsRUVQODhKLTU0YnpMelkwaVVEdjRTSWNTUFhmUXR4Mlh3TC16TGdB?oc=5
2026-02-17	Google	0.0	MSTR: Mizuho Maintains 'Outperform' Rating but Lowers Price Targ - GuruFocus		https://news.google.com/rss/articles/CBMiugFBVV95cUxNWlhqaHdXckNvdkZaa1FQbXZmQXNweGxzY09RRDJiaVhGcVlUTElaUWxjaExIaDVGUTlWWW5URU1GSW9LYkhqUEdEdjdsRDRJVGxxeGVMemdLaU9xVkRwc1I2NHhUSnViWGpOejhjQXhFbk5jNldEb05sVTF1OEFhRWZ1X1VLLWQ5TzVDbWhGOFdTSDRMWFVBXzBvNnZnSU1BQzFFRnpXc056TlFlMjBZbmtndjVaOXJKUnc?oc=5
2026-02-17	Google	0.0	MicroStrategy (MSTR) Prepares for Bitcoin Price Drop - GuruFocus		https://news.google.com/rss/articles/CBMikwFBVV95cUxQckdULUhDSWVCUWp2ZjBsdjRQMDJURTdSWlBkdkFYX3h0aWRMN05aWE82OTdheUZ3cWRIa1J3ZTNtY0pKRlNveGNsV3ZSNFFydzJBbEdGMVVZbGRsekpQYWdvOUlhS3BySUl5anNaYXl6MS1PLWpxMG9EUF85bks5ZXY0eTEzUjI0dXdpazY5bnpCZVE?oc=5
2026-02-17	Google	0.0	Strategy (MSTR) Stock: Jumps 8% as Bitcoin Holdings Hit 717,131 BTC After $168M Buy - CoinCentral		https://news.google.com/rss/articles/CBMipAFBVV95cUxOV01TeGtwZUN1YXJJZkdQTnJ1cnRFczhxcWVtVW02Sm45b0N3aVZ5bllSdnE1OU1UejF0RzRoUW1wZXc5NG1ZYURvNnA1TW5iNTA1N2lMWUh6YXJBSzlZYURYMWlhWW5RMW9ZREk4SlA1R3ZOancxYjlwbG5xZG1mcWRYdG53SDdVaEY2WkVqdXpzMnp4VHBhTkpyQmhuc1VFN3lxaA?oc=5
2026-02-17	Google	0.0	Strategy (MSTR) news: company added 2,486 bitcoin last week - CoinDesk		https://news.google.com/rss/articles/CBMitgFBVV95cUxQbXMzYy1aTFFOUXYzZjlnNmdHdkU5dDZlSklOeUdtNi1vTTFnTW1XazByX1paX1FQcnNGd3JFVGF6bTlDX3dlNEF1SnFMaHFBVEhSb19aNTdqLW9pd1k1UW9RV05ybU56QnZVRkprcHA1ZndSOFBzTlM5d3V5c1BhUndJbUswVzhQcmF0cUlfazVubVlqM3pUZFdjVnpScXpMZmlwRnFfZTY3QmJzN1pXNXUxd3VxUQ?oc=5
2026-02-17	Google	0.0	Strategy (MSTR), BitMine pour millions into BTC, ETH amid slump - TradingView		https://news.google.com/rss/articles/CBMitwFBVV95cUxPTTE4T1gwaTVwRkVfQlJ0NVU4bTY0WEUxVVZULWNkcjRGMUJIOVhVNHRIZkhGR1VkN19LSU5KXzZWcU9JUFFMMTAxQ3BDMExWVzdlb2FTTS1VWjdOTF9BQXZ5cGtsMjNiRFVRVmlHMzhVNnlrVVpnS3dXMFA2Nk93SWpuTHNWUUpvT2VrMVJpV1o0MTRLcFJIY1lUeFJJaEZyYnNxamtiNVVzdlF3Ync4MmIxQV92Nlk?oc=5
2026-02-17	Google	0.0	Strategy Buys 2,486 Bitcoin But MSTR Dives Another 3% - Benzinga		https://news.google.com/rss/articles/CBMiswFBVV95cUxOY3h3QUZrV1RBMWRid180X3JoMjhPUENqSHBpamEyUmk5bm5tSVBBSjBsUmhWUENuSnNnWHZNOHJOemdrQUxSUktoQTc1VFNWSjBuNDVYZTg5c21WWXJPc3FUT1VpWEJsVTA4UFd0eU1wMDkzdnF4WTlIdm52UDJuUkYwVmRibFBuTGdSazEzbldudS1Ka2lOS1pRenNnbVdCNndwZFNFbWsxLVFIS1lYZlN2SQ?oc=5
2026-02-17	Yahoo	0.0	Strategy Leans On Equity Conversion To Sustain Aggressive Bitcoin Exposure	Strategy Inc, NasdaqGS:MSTR, has highlighted its focus on resilience to sharp Bitcoin price declines. The company is pursuing a plan to convert about $6b of bond debt into equity as part of its ongoing Bitcoin accumulation approach. Management has reiterated its intention to keep adding Bitcoin despite substantial unrealized losses on existing holdings. Strategy, trading at $133.88, sits at the center of the corporate Bitcoin conversation, with its share price reflecting sharp swings in...	https://finance.yahoo.com/news/strategy-leans-equity-conversion-sustain-031202999.html?.tsrc=rss
2026-02-17	Google	0.0	Strategy: Time To Accumulate (NASDAQ:MSTR) - Seeking Alpha		https://news.google.com/rss/articles/CBMid0FVX3lxTE9lUVdhWlBsX3RibUJ0SU1uVkdmU25DSk1yeDFWWks3amhVSkFyT2hYM1p3RWNnc0JJaC1iN1hMV0ZCS2o4b2sxNm9YTUprc1FzQUwyUzRLMi16NFJCQW9sTXpfQ2QyekJBY0MwcDNhdHBhNFZXZ2pF?oc=5
2026-02-17	Yahoo	0.0	Strategy’s Bitcoin Buying Accelerates as $48 Billion BTC Stash Sits Underwater	Strategy reported its fourth-largest Bitcoin purchase of the year, a week after Michael Saylor's defense of the company's became a meme.	https://decrypt.co/358313/strategys-bitcoin-buying-accelerates-48-billion-btc-stash-underwater?.tsrc=rss
2026-02-17	Google	0.0	Strategy’s US$6b Debt To Equity Plan Tests Bitcoin-Centric Vision - simplywall.st		https://news.google.com/rss/articles/CBMixgFBVV95cUxQXzlJYk5pNlp0cDBCMk9fZ0tSZkJzZXBkdGdNYWZJN1BuM0tQX3BtTkNqN1pNdGFCOFBtbTh6SXMyZEFFVmVJNVBhR21mZlJ1b0c0YzljVEFNQVdESzQ4TEUwdTlJWE54NXZIRThJSkVrcW9oVU0xc0NnWVVPU1RPQnhGTk52dDhBQXR3dFFKM3lRc085U2wySVh2Tlh1VWZuQWMzb3N0ZEg5Yk83WEpFWFBWNmUzb2RnX2JraTBiWXZrTTAtdWc?oc=5
2026-02-16	Google	0.6	This $130 Stock Could Be Your Ticket to Millionaire Status - The Motley Fool		https://news.google.com/rss/articles/CBMilgFBVV95cUxOV0JjZExBWkNiU3NqeHBtd2FUd3VLY0Nwb1gyeTF1R3doZ0VwUnJPVk1ZM1JpZTljN1VTeUdSUG1aTGc5TTR2aWNtX0JRREZoa0UybHJRRmFVejBjTmpFQ1JZQncxWHh5MU00OW5DY1lURlZxNjAwQXFLR0k2ekFELXJrRzlveXlKaXFsSE1XS2owTGxwRWc?oc=5
2026-02-16	Yahoo	0.214	Bitcoin Falls 2.3% to $68,674 as Crypto Funds See Large Outflows	Bitcoin traded for $68,674.29 on Monday morning, down 2.28% from its price a week ago of $70,279.32. The decline came despite U.S. markets being closed for Washington’s Birthday today. For context, the S&amp;P 500 fell 1.28% over the past week, while the Nasdaq dropped 1.27%. The Week’s Volatility Story Bitcoin’s real drama unfolded Friday. On ... Bitcoin Falls 2.3% to $68,674 as Crypto Funds See Large Outflows	https://247wallst.com/investing/2026/02/16/bitcoin-falls-2-3-to-68674-as-crypto-funds-see-large-outflows/?.tsrc=rss
2026-02-16	Yahoo	0.0	3 Cash-Burning Stocks That Fall Short	Companies that burn cash at a rapid pace can run into serious trouble if they fail to secure funding. Without a clear path to profitability, these businesses risk dilution, mounting debt, or even bankruptcy.	https://finance.yahoo.com/news/3-cash-burning-stocks-fall-044720153.html?.tsrc=rss
2026-02-16	Yahoo	0.0	MicroStrategy Stock Price Flashes a 10% Warning as Bitcoin Link Tightens	MicroStrategy stock price flashes warning as Bitcoin correlation hits 0.98. Divergence and volume signals now point to a possible 10% risk.	https://beincrypto.com/microstrategy-stock-price-prediction-bitcoin-risk/?.tsrc=rss
2026-02-16	Yahoo	0.0	MicroStrategy claims it can survive Bitcoin crash to $8,000	There seems to be no stop for MicroStrategy's Bitcoin (BTC) shopping. Every week, there is at least one purchase. In fact, at press time, MicroStrategy, now better known as Strategy (NASDAQ: MSTR), has 714,644 Bitcoin in its coffers. That is 3.4% of the total 21 million Bitcoin supply. But ...	https://www.thestreet.com/crypto/markets/microstrategy-claims-it-can-survive-bitcoin-crash-to-8000?.tsrc=rss
2026-02-16	Google	0.0	Strategy (MSTR) plans to swap $6B convertible debt for equity - TradingView		https://news.google.com/rss/articles/CBMitgFBVV95cUxNcTU5X2xaREotcWpzRldqUWNGLVRNcUVvNDBnY0JuRjJyLWlDSzUwNXB2NENIWlNvWm9CQUtFYlJleGxmMXFXTXhiSWJMMG5jOWkxVWE0UWIwaHVuR3o2enBubENhUjlmYTk0andfUTFQWThRbkl2N3JybnVldFl3ZjBaem5VUXpyMGs2ZGhpNW5kNE9zckNTZVRVZGYzU1paUlJUNVhsSF9sOTZWUlpMOHgxcWgyQQ?oc=5
2026-02-16	Yahoo	0.0	Strategy Bitcoin Push Deepens With Stretch Financing And Mounting Risks	Strategy Inc (NasdaqGS:MSTR) continues to accumulate Bitcoin during a period of heightened crypto market volatility and significant unrealized losses. The company is funding additional Bitcoin purchases through perpetual preferred shares, branded as Stretch, to limit dilution for existing common shareholders. Executive Chairman Michael Saylor reiterates a commitment to holding and expanding the company’s Bitcoin reserves while advocating for Bitcoin at the government level. Strategy Inc is...	https://finance.yahoo.com/news/strategy-bitcoin-push-deepens-stretch-010756240.html?.tsrc=rss
