Date	Source	Sentiment	Headline	Summary	URL
2026-03-02	Yahoo	0.13	GE Vernova Stock Trades Near Record High — Lock in Gains or Let It Run?	With a rapidly expanding backlog, improving margins, and rising cash generation, GE Vernova appears well-positioned to deliver profitable growth.	https://www.barchart.com/story/news/510813/ge-vernova-stock-trades-near-record-high-lock-in-gains-or-let-it-run?.tsrc=rss
2026-03-02	Google	0.0	GE Vernova Inc. $GEV Shares Sold by Waverton Investment Management Ltd - MarketBeat		https://news.google.com/rss/articles/CBMiyAFBVV95cUxQbWswMGRPdU1yVnRKZTNVeWJRZjNDcGhuc25HUWJlUzN6SjJuMW1DSUdhUnAzblVWbkEwZXRPZnY2TE9NYkh5ODE3LXplTHhFYTQ2c0pfdTVXUlZ1V2RZN1VlQkljSGkzeGdOempESmt1dTFoalNlQjR2UFlrelRUdS1oeGhnTUhQQ2lJWWd0THQtLUxQOUczYVVUQ3E5RnNDSjZ2VzRxLUZwR1BjVzZCem8tVENKeHZ1amRvZHllVE9FdmRfVVk2SA?oc=5
2026-03-02	Google	0.0	GE Vernova Is Up 34% Year to Date. Here’s Where the Stock Could Go in 2026 - TIKR.com		https://news.google.com/rss/articles/CBMingFBVV95cUxOMUhmOHlmZnNRSWRKRG5zXzhoT0tlcDZsQjlwOEY4RmM5cC1aN2FIbVp3czVxQjNVYTJnSzFLb0QxUUppamt5LV90bU9rejItR1VQVFVpR0FwcGY5eV9ZcmlDZUVjbDh0Xy1iWkdGU1Y5M1VDNWdnUTZwOFh6VVM1aHloTDZWSFZoal9RdWtPM1JiMUg3LV9QN24wNzk4UQ?oc=5
2026-03-02	Google	0.0	Geneva Partners LLC Acquires 4,796 Shares of GE Vernova Inc. $GEV - MarketBeat		https://news.google.com/rss/articles/CBMiwAFBVV95cUxOaUthamhpSTgzY05jZ2NaaWJTcUk3bVhEQmVsMnJpMHVZU0ttRkFNVnMyMjN5SzdjZHczbFBTMGZQOXRTMG1BRGh3WEMxd2ZweWNzemtRQnlBSkxfUzZwRkdHWjZQS25JUVBoOUJkQ3diMWhFNWJjM1RmblRWVHhqWEthXzVrR3ZxOVY1ZWc4WW90OHJPQzNQM0xSSERfX3kwbHpiVW9nREQ3Q2c2RmRjU3pha2Zma090cHl1clMwVng?oc=5
2026-03-02	Google	-0.3	Is It Too Late To Consider GE Vernova (GEV) After 177% One Year Surge? - simplywall.st		https://news.google.com/rss/articles/CBMiywFBVV95cUxQeEpnQUhPUW13SDJndmF2SUw2MVBaYWJqa2x3SlIxdHdZNjFxeThSR3VCbmp3M1J0N2JPMEQxdVVvRHh4NzdiT3pveTd0WXZwb3FYTlY5NERaNkNZQTNjb0tWN21uQTkwazAzWFp6Z24wMGpfVkxBTXBVXzllcFNrOGRWTU1KcjUzRjhocFU0STJSaEpXcnBNR2gzWE5ucWVYUzNrV3d3N3E1MUhlOENidFIwSXVweV80Q0d3c183aFlvTHh2SFJVaHB3MNIB0AFBVV95cUxQU2tGcnVhZjI2ZGtGc0hUcVRMSXZIeVQtX2dobVdWenEwMnpkc3pwa0JmUWdsQjZsTkRGb1RIdGdQYi1rUE1MNU5Zel9scGZhUV9od2o1dHFVRlY2VGRHblhoenFSVWFzV0QtbDBPa0NtZVdzOWJ1X2QwNFlvVzdVNC1OYzFkRXNGSHdGUFVPNV9ibzY2WHlTdTMtNEJNLVptZkVFVldYMHFIQzVSZHZTb1JzYnNiQnhJZl9MZTAzUFlQeThEMlhJcnFFSWVVUXNC?oc=5
2026-03-01	Google	0.25	Creative Financial Designs Inc. ADV Has $1.38 Million Stock Position in GE Vernova Inc. $GEV - MarketBeat		https://news.google.com/rss/articles/CBMi4gFBVV95cUxQOWlvaHZuXzR2UzZCVFp2QjZUNzRldl85anNTVkpOcDh4OWVBeDU0eXBhZlhfVlZqdllnRTNSaEZYZ0dZdWU3MXIwaUFkRnRMUEREczNjb3JwNHNiRHRmMnNkMkJpeG1OTGFHQ2tDSXM2ZjRzdGNnaU9NS0pfQnR5dU96emZ1TERQdzhSZDExNFl4ZE5ZRENzRTNoM1pZM3kweGpjSGt5cllCZXBMclVjS05NdmRkUVBVV19SdE9ld1FmT21IZUlqWU9LNWZyU3Jhb0hNT1Q3X0YwNS1rNU4xWnBR?oc=5
2026-03-01	Google	0.1	3 Cash-Heavy Stocks We Steer Clear Of - The Globe and Mail		https://news.google.com/rss/articles/CBMivAFBVV95cUxNd3FISUpyVzhtYnBROF9odmVEWUZ3MWo4Q0JIUFdCQ0g4cGF2WkVXN2FzUnFxcjI0VWdNd2kzMXdKdFlXVjkxSEJ0VS11MzdYVXI2Z3QyRjhDNjdyR0hLS0hXd0tqd2hhSG1YWmJkWEdIeThRNnM2MFJRX0prZTc5NXJ2d0Nva1QweDRLdkt0djd6MlR0dVZVbFZxWld6bHY4SkxKbFROUjVBUXNEc0V4R2ZLZDhFTFVjcHptNg?oc=5
2026-03-01	Google	0.0	Harvest Portfolios Group Inc. Takes $2.23 Million Position in GE Vernova Inc. $GEV - MarketBeat		https://news.google.com/rss/articles/CBMi1AFBVV95cUxPNnVVN2dUSmxlaUF3UHBuTHZCY294MV9ORjA1c2pURGNJeHdTM2dmemZ6YmxaTmFUV19ESXYybEg1b1Z5TU56bnlGNWI3dWFjQ0lSbUlQa3JCNzJrcWxRVGpCekdKUFVsX2M3Y2RRY1Zzb09JdGVCT0xGMjZ3Zlo4Wm43UG9oSktaUHQ0MFV6dEVCM251MHp4U3NlSkZRZG1DVFNDT0lrYlIwdXFqNGlTTzhMX1lWNmo5NzJOQkNnMHhhVG8weVFyc1ZfU2NDRm85S0JhUg?oc=5
2026-02-27	Google	0.0	FUKOKU MUTUAL LIFE INSURANCE Co Lowers Position in GE Vernova Inc. $GEV - MarketBeat		https://news.google.com/rss/articles/CBMiygFBVV95cUxOejdnY0c3YWxFTVNFZlZBbUhiam5ZRGl6WTFEQkVMRHp4cy1iVGZReGEzbTZZUWw1YWtaY3VBZF9yQzFxWlQ4ZDljaGNITXJSdTgtRFlja1YzbGxnMFhzYnZuQmNNRTFCR3ZhZmRfN2Z4NURpbFVWclVJcHRTbENwRE96TndOeTJ6N1h2dHo3UlpYbVpab0dueVMwV1MxWndiNnpEd2NMLVlkYXJIN21TeEt1aTZWWktJRlo1LXJmcy1rS3ZFejl1VE9R?oc=5
2026-02-27	Google	0.0	GE Vernova Inc. $GEV Shares Bought by US Bancorp DE - MarketBeat		https://news.google.com/rss/articles/CBMirwFBVV95cUxOeGYtcnZYYXMyUXc1WW1VWGFUN21xc2J3c3Z1bVpvQ2hqSDhlZ3BBM01pa295QmtCTkZFZG1DVXBNVkgySS1yaXkzSkFfUFNRUGpoVkpaS3hJUGxGM3ZyNzZ0V0x5NFl1T1ZwLVloUVRVUTRRY21hSWVUbXpiM0xfMzVyYnFWV2pJYkZHSXdHR09rRlJJWUYtX283cUw2NWliMmVOaGRGVUdfVmowV1I0?oc=5
2026-02-27	Yahoo	0.0	GE Vernova Stock: Buy, Sell, or Hold?	The stock is over $880 now and has risen 170% in the last 12 months.	https://www.fool.com/investing/2026/02/27/ge-vernova-stock-buy-sell-or-hold/?.tsrc=rss
2026-02-27	Google	0.0	GE Vernova Stock: Buy, Sell, or Hold? - Nasdaq		https://news.google.com/rss/articles/CBMic0FVX3lxTFA3RlpVWnhkVHhZSDVGQ0dabEVGblVndW5wT3RIRnZ4T1ByVUVqOXdISUdCdG9DaldHSTZEMjB1blFyc1IzUlJ5eGV2bVBoU3NMVEZpSnVmMkpJSHpEcHBmNUd1elM4TzA1YlVIMzQzZlFxVU0?oc=5
2026-02-26	Yahoo	0.242	Assessing GE Vernova (GEV) Valuation After Dividend Hike Upgrades And AI Power Demand Tailwinds	GE Vernova (GEV) put shareholder returns in focus after its Board declared a $0.50 per share quarterly dividend, payable on April 14, 2026, to investors of record as of March 17. See our latest analysis for GE Vernova. The dividend announcement comes as the stock trades at US$876.01, after a 31.54% 30-day share price return and a very large 1-year total shareholder return of 161.92%. This reflects strong momentum as order growth, backlog expansion and recent upgrades keep attention on GE...	https://finance.yahoo.com/news/assessing-ge-vernova-gev-valuation-192352739.html?.tsrc=rss
2026-02-26	Google	0.183	The White House Portfolio Is Now Worth $9.7 Trillion — And It's Telling Investors Exactly What To Buy - Benzinga		https://news.google.com/rss/articles/CBMi9AFBVV95cUxOamNHX1RYRFIxVlc5Z0ZqLWZEQlpaRmVLcWpaYnVQSGZxLTd0eVpxMGZiYnlPQ3NYQUUzM0VHekltY19nUUNGZzJUZ1Q5bFdWRkFMdEczNmFSM3Z0NjB2aDc2b3lVTHdWOVQ4Ylh1ZTN3czFaRUY4ZjZ2cWVQSDE4bXRPbkFwek9CUVFTbzEta1N5ak1fWEVzbHVINEZhSi02MUNiREVtYVhNQUlLZ01NSlZ0eG02VTNGY05CV3A4STNHQVoyQ2Q0RmZpNE5sUjZzSWlTQU9pcEpwcWhWVXd1ZmFiMmJuak5EcDc0M1psS2Z4c3pI?oc=5
2026-02-26	Yahoo	0.125	Jim Cramer on GE Vernova: “I Still Like It”	GE Vernova Inc. (NYSE:GEV) is one of the stocks that was on Jim Cramer’s radar recently. During the episode, a caller asked if the stock still has more room to run at the current level or not. Cramer replied: Well, GE Vernova is presuming with that price-to-earnings multiple that will continue to build power plants, […]	https://finance.yahoo.com/news/jim-cramer-ge-vernova-still-145650803.html?.tsrc=rss
2026-02-26	Yahoo	0.071	The AI Trade Is Alive and Living in Industrials, Small-Caps, and Asia	Nvidia and other chip stocks are still going strong, but don’t forget about those sizzling small-caps, industrials, and foreign markets.	https://finance.yahoo.com/m/ee21c8cf-b3f4-39f4-8f7d-df87b90f3d22/the-ai-trade-is-alive-and.html?.tsrc=rss
2026-02-26	Google	0.0	A Closer Look at GE Vernova's Options Market Dynamics - Benzinga		https://news.google.com/rss/articles/CBMirgFBVV95cUxNc2o1Uk1QRTVzb3hPQmhpZV9WbTJIUlkzOThuaFd3cWgzLXplYWRZVjdPR3lkMXFwbEtma1k5Y0pRdVJIRlZmVldXM1c3QU5Val9Va1RvNlpxNTV0T1hFV1U4Snd5QXFpX1lyUkptTGdWYV8tQU4yN0dPcmlRSWZTSGlZeTVkeTFIR2ppX193bHdlTExoWUVBWVpQeXpSVXJJUV9vUDNSY3dMbENJeHc?oc=5
2026-02-26	Google	0.0	GE Vernova (GEV) Is Up 7.2% After AI-Fueled Orders and Dividend Hike - Has The Bull Case Changed? - simplywall.st		https://news.google.com/rss/articles/CBMiygFBVV95cUxPOXByT1U2c3FJMFJBMU1XcW1MOW84QWtCWTM0eG1TR2x4ZkNKZ3BCeXF2UzBjQVlTVUx0VWtGNTRRTklldFQwZ04yTmV1a19ld3BGYVVGQ0VZdmtFRW1rbUZhbVRlS0ZjSFpKbHpiRHp0MUZoLVNhT1dmcTlSb1UtckJRMU04WnVuUl9POEY2bV9qbTNLQzdHNi1Ha0hJOWRYSHhPdmx4bTNsUXdEcHhOczN6aHRIOXQ1RjlVN1RMYlJPcnlNbFBlb2R30gHPAUFVX3lxTFAxTGdCUml0dG9jREx2MEtybFZ5QVBka1BVSTRiamp6SHd1LU4xd1AweEg4dHJQTUhzN3dOVHhNdzY4RFNKbDNFY0E5ZGlONklfZzRFd0o5WTVWUXMwbHljNVlLZzVFN2ZxSVdjZEdTZ1F4TjNvRFZwTlBsbGxNaDI5OVVkZTlicFdUVU11QTV4M3ZsYWh3X29Eay1RNFdEX3h5dnVDZVhBNzZMRVoyQUtyWk9aYllSbFJ5cHI2X0diazZMU0lmTVFYRlBDbFpwUQ?oc=5
2026-02-26	Google	0.0	GE Vernova Inc. $GEV Shares Purchased by Intech Investment Management LLC - MarketBeat		https://news.google.com/rss/articles/CBMizAFBVV95cUxQY25lZzgzOUo4NFliczlIMmRuNVNnMVdhd3pPMy15U1o2cWxsWHVrM29mZE96QTlma21ZdU5tWTR1R3FKQThZX3F2RDdwdGdlZjBhTWVla3RiUTFUSTlLemNSTl9fUk5jN3lCbXY1OERSRzNrR0RNQmZsQzFDNzNsRUVlN2ZTUXRYbnJGTTNkdElJVW5CRDlMWU40cTlGNnNtQkM1QUZNYjhyZEhweHVxeVRDd1h1T2NLRHFyQUZTY1BCU2REZzNjYlducnE?oc=5
2026-02-26	Google	0.0	GE Vernova Inc. $GEV is Virtus Wealth Solutions LLC's 7th Largest Position - MarketBeat		https://news.google.com/rss/articles/CBMizAFBVV95cUxNTnZHQzdUdWVUNEhnOE11aWhoNGZfWlNtMEdCMnFKOWdLa3gwcXN1eTcwT0FGRWJrS09YR1JENEpQRGNXaEJGOWctNDFvVXB4X2t5MW5GcFZJamxISXE3MUJqcUo3RzlwbDFkWERGMFNwVWlCSHN0VDFxVDlqMExDMVhIZ2REVjZPQ1lUampza1FUVlE5dE03SkdVYlhiSTZmNU5fOElfT0pNbEpTUlNiTmpUaUdaOGJMMTFHN095UEwxclJpbGtZdzZkUk4?oc=5
2026-02-26	Google	0.0	Mitsubishi UFJ Asset Management Co. Ltd. Acquires 22,913 Shares of GE Vernova Inc. $GEV - MarketBeat		https://news.google.com/rss/articles/CBMi2wFBVV95cUxPZGxERXlqZkRnbXUxVFcxMU9ZbElsWFhxZ01KNTZIQVhsTWVXbjRCa1pNMGsza2ZReHZVaEwxUUtkZUpnVHJVT0RZdDBKZHRHNGNfN1Y5RTJZbl9JZW9tY0hFSmxDdmxMRTlHNDRiQUFXcWlxZmRJZzViY2g0b3F0NGw0S0pMV0ltRkk1UUtRbFZScUc3TXItOVh5MUpaSWlmb1VkemFtOGUzaDhmNWhjaVROZEkySnRXVWtrdE1uTFJIdGNlYS1RbEhjdm1UYlhHWXdTcjBOV05yckE?oc=5
2026-02-26	Google	0.0	SeaTown Holdings Pte. Ltd. Decreases Stock Holdings in GE Vernova Inc. $GEV - MarketBeat		https://news.google.com/rss/articles/CBMizAFBVV95cUxNVlJWdDZ6RE9hWHFuQ1ROMDZpT0JwZTk0TXNlLUFVMHYwLXR3cDJ2bkZHYmphc05tak00Vy1IYVRLdDBYb0o3MzNOSVFscHc5WmR3RUJUb3dmZjA3S1c1ZUZ3MVlUaVdROGtmbHRpazNDSUdrQlh3NlcySDZFRHY3YkYxQjRIM2ZING5RUjJlc2lUNkNjUzR2c3cwX3l1dmpFd1hHdE5XeENBMjJObUJDMkEzX1UzWDhmT1hLclFkMDdOM3hPcUx4b2JseG4?oc=5
2026-02-26	Google	0.0	Vestmark Advisory Solutions Inc. Has $1.05 Million Stock Holdings in GE Vernova Inc. $GEV - MarketBeat		https://news.google.com/rss/articles/CBMi3gFBVV95cUxNS3FFVmZSTjJTVU93VThoZWJqb1RiQXg0bnZEdjBmTEFCTDJtX0VMV3hzZ1ZzdUpUUE1JdU53M28xc2FaTktPdnlGbGpYaGtJUmtlVGRNRnZZSGJJaWNBemRJRnQyWjVyRU95VVdJX0V5LTNnTnBURjIyci01ZXZZNHRvN2lmZzNlcnFIbkhRV1I1WXZyYm9zaWdfOWp5RDZqWFk5aW8tQlRjcDE3SG9PYTU5UTAzYi1hQzVONXpWdzByT0Y3eTFWeFdKSG5WSTRfd1M3cEVwdHREZDdmT1E?oc=5
2026-02-26	Google	0.0	Waratah Capital Advisors Ltd. Sells 3,588 Shares of GE Vernova Inc. $GEV - MarketBeat		https://news.google.com/rss/articles/CBMiyAFBVV95cUxPN19HR0R0S3hNRVdJd000bEhmVDJJZ09iallDNFNGZ09jbnpId3BWSXVfZm9uRzFiaXZ6MzVpUlZvclpNWnEwZVRZZS1nLUN2OF9uYUszSUxOaERndDR1NlFEaE44MVEtVGw2TUlBNGZEYzZ6Q1ZFVGxaSDFIcnlMckxnMUlQRVNPaGZlclhnM1ZBT25RamlrNHFaNjdyR0ZDRVM0LUptMHd0clZvaXA4aWdaTlk3RzhHU2lNaWlfejQwV01PQkx4Tg?oc=5
2026-02-25	Google	0.5	Notable ETF Inflow Detected - XLI, CAT, RTX, GEV - Nasdaq		https://news.google.com/rss/articles/CBMigAFBVV95cUxPNC1EZU04dnluU2xUYVVfYXlpRHZxRzRwSXNQNEN1RHlRYTlnQmo1MzIyQ0NzZ1R6UzFTbEVzVXQycEhZcExWazQzdk9PUERuMzIxUkw0SnhhN0J0OXViVmplY1dabXN0bEZrZzBqcGx3am5YZXMxdHhFVHQ4RDJISw?oc=5
2026-02-25	Google	0.483	1 Brilliant Energy Stock to Buy Now and Hold for the Long Term - The Motley Fool		https://news.google.com/rss/articles/CBMilgFBVV95cUxOUVdvaC1wWmpCekdiNmJEWG5IMTNjUGFFUHZ3Uy1uRk15QlNFbXNDR1ZNOE15MjRPenU2RE04dmpYQjRVVHd2OW5nak82aVNQTzhZWl9ZUG9MTXpkRVg3UGpUeXVTQjE5T01uNXBoa0xMb3llQ1NuSHh1eU9ZQlJaTUxiSXZEbWZoRV91Y1loZkZadEQyLVE?oc=5
2026-02-25	Yahoo	0.3	Zacks Investment Ideas feature highlights: Bloom Energy, Excelerate Energy and GE Vernova	Bloom Energy breaks out to fresh highs as AI-driven power demand lifts Excelerate Energy and GE Vernova in a surging energy trade.	https://finance.yahoo.com/news/zacks-investment-ideas-feature-highlights-150100749.html?.tsrc=rss
2026-02-25	Yahoo	0.25	1 Brilliant Energy Stock to Buy Now and Hold for the Long Term	Data center electricity demands are increasing, and this energy company is seeing demand for its products explode.	https://www.fool.com/investing/2026/02/25/1-brilliant-energy-stock-to-buy-now-and-hold-for/?.tsrc=rss
2026-02-25	Google	0.1	Empirical Asset Management LLC Boosts Position in GE Vernova Inc. $GEV - MarketBeat		https://news.google.com/rss/articles/CBMiyAFBVV95cUxPcmxzS285X2VyUzR2bWpsYVBfRkFGVnNNWV9DZXRQYkNZMTZWYlZScTBOYVdwOE9lV2s4dkFMREFDRF9XZW04c2Iya3ltY1JCTXppQVZBNU5NOThWSHFMY0phd1BHZzl4aHdBd211amc0Ny15amFLRkNmSW1WU19PZU9iYXYzc0c1THNEcmFnNzhXOWt4aVBhQWFwSG1CVjQwcGRIcHFrT2VlWXdsTXdLcS1tbW9LNi1JQktxblI5Y0drUURlQjdacQ?oc=5
2026-02-25	Google	0.0	Could This Fuel The Next Surge in GE Vernova Stock - Trefis		https://news.google.com/rss/articles/CBMisAFBVV95cUxOOGVlZzdRUjgwQ3ptY0hyd0JEWDh1VDdUVE5SMWVoYXRXbzRyN1l3d1huaFRsTlBGMExNZ1AzN3ZxNGtqZE1uZ3hPVzJRSS1faGNWSXVPOE1QZ1c1RVBJVlRucU1XcTN5SnhDdUdhcHFBSl9jSG1pWk1rcEtIcnZHMzhKZUVQZHNVSVlfUlQ3SUpMX0N1aDJOOExRVG1UcTh5MTBRVFVMSEpRYk83Z0Vfeg?oc=5
2026-02-25	Google	0.0	GE Vernova is Sold Out and Scaling Up: Why Its 83-Gigawatt Backlog Could Point to $2,700 Stock Price - TIKR.com		https://news.google.com/rss/articles/CBMi0wFBVV95cUxNRGdVRlpScmo0aUowaUFLTXpVcmxzZXYzT1ZOTEpCaTRoV3g5Mm91OGNOeGlOektjd0VPY21Ka2JBU3p3NE1HZXE2OEhUQUJXZUVoNDVPaGdBYzF3SXBNMDRWRFRXc2FDTE52U1Z0anpPd2hseXpGczlaN0VZVExlZWRDZkVHTDdwN3FpUnhEdzFLcnJmRXpJVGZOM2N6UTAtLV9YR3QzbUZZNE50Skp5N3JmU0F6YUR6bWgzTjR3YWtQcnZ6cEpfOEtSTENIN3J4Q2tz?oc=5
2026-02-25	Google	0.0	GGM Financials LLC Decreases Stake in GE Vernova Inc. $GEV - MarketBeat		https://news.google.com/rss/articles/CBMiuAFBVV95cUxNaG1lblYxejcwcDhOOGFLRFRGX1F6NlMwQWJiZkFWSVhGcXVicC10eDNzaUNTNnRyNUlZcUxOdEIybU1peDBDbVhIeldUNmNBNHVmS3ZOcnNqVWRIbVMxQVFTWElwUk5HN2tGNVg4U1JNTTVJVUxhSUI4ajJmNkhHTDhKb2xuWjdZUHh3VVNnbnR3RHZlUHFpSHJmQ3l3SzBMVC1rcDRrV2tJTTFrNUE2UkZQN3dCb2Fo?oc=5
2026-02-25	Google	0.0	How Does GE Vernova Stock Compare With Peers? - Trefis		https://news.google.com/rss/articles/CBMipwFBVV95cUxOZVpaN0QwcU5rQ0FkazJpNWpLSjdVU2hYZnhoSmxmenR2cnJ2anlYMkNvbUlQcFA3eGl1OTFqWExVc0k1OXhNVUZxNldUS0M2NENsQU00TG1YRVQxeVFjN2VyTWpEalYxWkYtNjgzMGxLa1A1TjlZdkhzYk1vbF93LUszb0JkV0ZtcS0zb1pPTEZUcUJ2dzFCZ3VqTEN2RVNjckszTXFxNA?oc=5
2026-02-25	Google	0.0	TD Asset Management Inc Sells 130,914 Shares of GE Vernova Inc. $GEV - MarketBeat		https://news.google.com/rss/articles/CBMixAFBVV95cUxOempPbkhNeWMzT1FBT3BETDlfVmR3WklGZ1RFR1ZWYm93bDJpUm9RTVNMY3FCSzNGMkJ0Ynh5RUxFTEstNG56WDVxbzRidEE2VkhUN0d4cFRENUhDbmp2ZjlsMkkwRHVBenUwbmdGV0ZaT1hjbGZual8tbGJLQWM1OFdRQi1sZ1hOVElfRVp4UzRobk03MGhIX1dBUk1vV3pIeXVKMGs4NWY0REtXcnpoUGl0eWgwUV94cjZNdEFMSFlOdm9Y?oc=5
2026-02-25	Google	0.0	Tableaux LLC Grows Holdings in GE Vernova Inc. $GEV - MarketBeat		https://news.google.com/rss/articles/CBMirwFBVV95cUxOTk5vSzZ5cXpJX2FwZllTQm5zamRGZElSTDFUTkdJb2ktZUJfQTFxZmR5bXYwa3prSXFnV3pBSWxnd0kwYU43Q1p0M0dLYkUyZG1ucjdFcUo0eGE5bnVfSUFIS1hpeDJyY2hHQVpsVDZBaWRtVDZuNXR4NERtdXk5R0syTzM4bXM0MW5MZjFIUUpKTTNycWpXNXp5V0N5NmlEaXdsY1hOSzk1M2pxLVFZ?oc=5
2026-02-25	Google	0.0	The Next Big Rally in GE Vernova Stock Could Start Like This - Trefis		https://news.google.com/rss/articles/CBMiyAFBVV95cUxPdnpIamJmWmRaNnlMam04WF9HWWFBVHk3YjNIZ0dFTk94QndrM3h1YURCcU5iU2s2bUdvT25jMDFkZnB5ckpnTzR2eXRsNkFsX2ZxbnpYemRDdlVKb2x3MDlOWEtkcHo2Ml91d2dXd3FkbFJHSkxmU1VfRUNBQWFXVEF3VHpOendiNXVlMTFvYmpQOUpDM3pPRVRwYko5NEw2TGV4bXJuaTJZTjJWSkRwSENUeGVkVm5uNG5FYVFYT054eWpWVGNtZA?oc=5
2026-02-24	Google	0.444	VRT vs. APLD vs. GEV: Which ‘Strong Buy’ Data Center Infrastructure Stock Could Offer the Best Upside? - TipRanks		https://news.google.com/rss/articles/CBMixAFBVV95cUxPUWxkUms0bGk1Q3VlUnBZSVFhbG04YUx6QWJ4NFQxUDg2TTVRdzBWS1lCLWthZ2hWQ1lNRzFMTGJISTN6XzhGNk5TTS1jOGNubXJ1Qnl1cWYzV0h3OWYyWkFzMUFrbkNTTjlXdm9KTEZ5akprWXRkQl90bFFMWWFjdFVnSjFzYlZwRmZoTC16SENvcEU2QWNRWTFJRzhOdEZ1ZURMaHlSUFpQWnlfV0thclZHaDhLVkVqczE4cDRwb3MxakZj?oc=5
2026-02-24	Yahoo	0.188	I Trust GE Vernova (GEV) CEO, Says Jim Cramer	We recently published 10 Stocks Jim Cramer Talked About. GE Vernova Inc. (NYSE:GEV) is one of the stocks Jim Cramer talked about. GE Vernova Inc. (NYSE:GEV) is an industrial power generation equipment manufacturer. The shares are up by 159% over the past year and by 20% year-to-date. It is one of Cramer’s favorite and most […]	https://finance.yahoo.com/news/trust-ge-vernova-gev-ceo-115551544.html?.tsrc=rss
2026-02-24	Google	0.148	GE Vernova (NYSE:GEV) Sets New 1-Year High - Still a Buy? - MarketBeat		https://news.google.com/rss/articles/CBMiqAFBVV95cUxPMW56UGc2ZjcxdWVTZVJCal8yQm5Rd1QzUy1FVVRrU1NVM1VhaXBSY2g0Mk91VGlXUlJBZktLdHV2YU1hNm5YUm1STm9nV2YwMEQyWXlpajA4Nm5aUHJJNnk0NTQ0LV9zclRFMWhTNHppaWtsMkdQWS1Iak1STVJYWXlfU2gzU0VLR09DTlpyamUtRUpEZXZhb0lzdS1NYkNSWU5zRHlNZ3Y?oc=5
2026-02-24	Google	0.136	GE Vernova’s AI Power Supercycle And The Test For New Payouts - simplywall.st		https://news.google.com/rss/articles/CBMiywFBVV95cUxOeVd1Y0ExejZDY2d4QlkyLUdFOEstOEc0aGZpVnU5ZUh0dlhPSlZEMVV0d3JKRTlXVVgzbVMtdWZRUl9Fbkk1SDlWREQyc1RKSVE2ZU5ZSjVFeGE2Q1JCM2lBWWtMSDRVbmhiRlExM2FBLVZJT28wQ1RNY3U1T01HN21yNUFvZ0xpMlByM1p3OUxNbVFFS0hpRVBNa1NEdkw2Y2VhcWRpaWdqTkhyLXJlUGItejJXSVFkWVhiM3VaNVdTWnNVYW5Vd1p0TdIB0AFBVV95cUxNZnBjVUhkQjhPU3QySmI4Nk1YSmxHY3YwNDFWekdwV21WbmFoMWV3V2JCdzRSR1lFVFpvWHZkY0RWaUhKV3plaTFiNVh4RkFUYTh5bHRxbjlIemgyeHhrZ0xBZFFmcEJFdXg3a2hGZi01U1UwTUJjZkZmamI2Y2RKQzcxQlRVajV3N2FpWmNvQkE1YW9vbk1Xc25mNktsbXNycVZMWk8xQzl5VHVVQ3JEUUQ2eWpkZmZSNnFxSVhXWlBaX1RfM0QxNUpfT3ctVFZD?oc=5
2026-02-24	Yahoo	0.13	GE Vernova Growth Supercycle Tied To AI Power And Payouts	GE Vernova (NYSE:GEV) is reporting a growth supercycle supported by strong demand from AI data centers and wider power needs. The company cites large order intake and a substantial contract backlog as key drivers of its current momentum. Management has doubled the dividend and expanded the share buyback program as part of a broader capital return plan. For investors watching NYSE:GEV, the story now centers on how its power solutions are tied into the build out of AI and digital...	https://finance.yahoo.com/news/ge-vernova-growth-supercycle-tied-190726912.html?.tsrc=rss
2026-02-24	Yahoo	0.05	Natural gas equipment bottleneck is easing: Jefferies	“We expect at least 19 GW of total available equipment capacity by 2028, increasing to 49 [GW] and 76 GW by 2029 and 2030,” Jefferies said.	https://www.utilitydive.com/news/natural-gas-equipment-generation-bottleneck-data-centers/812931/?.tsrc=rss
2026-02-24	Yahoo	0.006	AI Power Play Bloom Energy Stock Breaking Out Now	Bloom Energy stock, among other alternative energy names is pushing to new highs amid the persistent demand for power	https://finance.yahoo.com/news/ai-power-play-bloom-energy-175700948.html?.tsrc=rss
2026-02-24	Google	0.0	Mufg Securities Americas Inc. Grows Stake in GE Vernova Inc. $GEV - MarketBeat		https://news.google.com/rss/articles/CBMiwAFBVV95cUxPLTB3dVl3OUtHNC0tblJKNC01OExja3F4RnN0Ml9zYmtWZHc0d3czT1V0bU5NMTZZSk5YQlBwZ0FkcTRRb3pBTFIzdENOWEV6REplYzZaRHZqLUZCbGNWdC1kOXlLaGxKb2QzLV9Ha29KUmctYUFEZ3FDckdXVTA1ZHZGOFBzb25ub3RXRGowdVFHX3Q1am4yZEJTLTFXWGFTVE43c0xpQTVRWjd2ZmRmaXNRTkVmSjhVdDRSVnJxcWw?oc=5
2026-02-24	Google	0.0	Rice Partnership LLC Buys 7,177 Shares of GE Vernova Inc. $GEV - MarketBeat		https://news.google.com/rss/articles/CBMivAFBVV95cUxNTUNTNkNTaXBIUkpqZ1E1YXRsQ2JaS3lTaVBaVWNqQ2ZRa01rLXpDYkJWclpuTjYzS194TG5nTmg5LVhTVXpvSjVQLWhOZ2FGWDJUT3NuUEJ3OTQwVlBZcE5QSElKLVBfanZtYU5ZWVpVZE5kUUNqWmtzbW0tM09IWWg1OGdGNkVXSW5fSGtuX3Y1V2k0dXBnZG5IMFdvbkIyNWlLMlVqdkJEN3UxQThmbThFLTlrSTY3TkNvWA?oc=5
2026-02-24	Yahoo	-0.163	The Stock That Didn’t Get Crushed by the AI Doomsday Essay	Monday was a tough day for the stock market.  One factor hitting the stocks on Monday was an essay from Citrini Research, published on Sunday, that imagines a future in which AI devastates the economy.	https://finance.yahoo.com/m/d883cb34-99d0-3abe-b9a6-d3d89f15bcaf/the-stock-that-didn%E2%80%99t-get.html?.tsrc=rss
2026-02-24	Yahoo	-0.228	1 Profitable Stock to Keep an Eye On and 2 We Find Risky	Not all profitable companies are built to last - some rely on outdated models or unsustainable advantages. Just because a business is in the green today doesn’t mean it will thrive tomorrow.	https://finance.yahoo.com/news/1-profitable-stock-keep-eye-044247894.html?.tsrc=rss
2026-02-23	Yahoo	0.5	How to Boost Your Portfolio with Top Oils-Energy Stocks Set to Beat Earnings	Why investors should use the Zacks Earnings ESP tool to help find stocks that are poised to top quarterly earnings estimates.	https://finance.yahoo.com/news/boost-portfolio-top-oils-energy-140001799.html?.tsrc=rss
2026-02-23	Yahoo	0.3	NextEra Energy vs. GE Vernova: Which Energy Transition Stock Wins?	As clean-energy demand accelerates, NEE and GEV stand out for growth, dividends and valuation differences shaping investor appeal.	https://finance.yahoo.com/news/nextera-energy-vs-ge-vernova-122000874.html?.tsrc=rss
2026-02-23	Google	0.217	Assessing GE Vernova (GEV) Valuation After Strong Recent Shareholder Returns - simplywall.st		https://news.google.com/rss/articles/CBMiywFBVV95cUxNSnN1U29TQXRjcnRrU3FqaFhFX19ScS1uekRNZGI5QXE2MnhKZUpQMEl1a2l3dDVKcEViT1JqRW5KeTNPdlhtd2NOQ2VxVWVJa2Z5Z2s1dXFzWnA1Nndoa05aenE3dkt1XzZNUS0wSVJ4TV9fZWFJdGFFZUVFTXpDNko4RjFOWUM0T2FkaEdFMFZIeUVQSkFNTmk3a2VGMHVEc280SWw5ZjZCU0p6N1FLR0txS2pWZlI1cm43QW5ael8zeXJKVV92MEdNUdIB0AFBVV95cUxPWHY5WjF2ZkRWTlFIY2kzci1sVzdibGVoMHNxbVZmdlFhNXZWWFY4d2NFR215d3lkUV9yNkxGZnB2T3NXdmo4dUV0SXdycGV6SnE1WWkwOWpSdFp3LWlKNHdVQVBfd3RwaHdieWZtSFhRNTg5c0pNcGN5MzVXeVRnaHR6b05OU1J0NExub1VqOW9Hbl8wVkllelN1ejV1R24xYzRHVHJfMHR6ak5pSEFpbUNZVlBoeFloTFVvWFBpcC03LTBDMDdaZmo5a0FWa29V?oc=5
2026-02-23	Yahoo	0.112	Is GE Vernova (GEV) Still Attractive After 163% One Year Share Price Surge	If you are wondering whether GE Vernova’s current share price makes sense or feels stretched, this article walks through what the numbers say about value rather than just the headline moves. The stock recently closed at US$830.34, with returns of 3.5% over 7 days, 26.2% over 30 days, 22.2% year to date, and 163.5% over the past year, figures that will catch many investors’ attention. Recent news around GE Vernova has focused on its position as a standalone energy business following the...	https://finance.yahoo.com/news/ge-vernova-gev-still-attractive-201017592.html?.tsrc=rss
2026-02-23	Yahoo	0.045	Dow Jones Futures Fall After Trump Hikes Global Tariff To 15%	Stocks rallied on the Trump tariff ruling but the president hiked new global tariffs to 15% on Saturday. Nvidia earnings loom.	https://finance.yahoo.com/m/3a31782f-5969-3157-9772-a6293c1ebb72/dow-jones-futures-fall-after.html?.tsrc=rss
2026-02-23	Google	0.0	1 Profitable Stock to Keep an Eye On and 2 We Find Risky - The Globe and Mail		https://news.google.com/rss/articles/CBMi1gFBVV95cUxOTFdsOUhlY0xmSUJfdTh2dEkteF9BVngtWm1NS3ZiZkxyMmRtU2ZsOFlnQ0l4RzJsbWlPSU1vcXNHV05ucjB2X3VzWk16Wk96cWZvankyMlN2YUpuTGUwbHdNd0tpSXRoV1RHSC14bjVxZHVhRWR2U3NwUTF0ZnRRV0ZITzBJS1VyeEVrVU5nMlJ1Ry1ac0JEekNScjczbDZHYUMyektxWFJxTlJsOTFKX2pmS3c1QnpTWUNZRXh2TGhrLXlaSGpnR1RyN0w5RWN2ZWVJNURR?oc=5
2026-02-23	Google	0.0	GE Vernova Inc. $GEV Shares Acquired by Private Advisory Group LLC - MarketBeat		https://news.google.com/rss/articles/CBMiwwFBVV95cUxPSzJFSDl5NjN5eUs0WF9DRUVuenRBcVZLYU5OTVFmWTN6TnQ4SW1SUG8tSmQ4WFpQdjdSUDA4T0xIUVg5bjJOMFhPbURXakFDNldvLVVCSTBzM1JHNmlpdi1tRnJWNHdkZ0k0bkNYZFpUX1V1Zm9pMGN2VzNjOTFET3Z2SmhudFlzbm0zRmZKdXRtSkNHV24yQjM1SjBwMFJMMDdVbXEwNDBkazF4VTRKZ0tReWJkOGx4NEYxdE1Hc244d3M?oc=5
2026-02-23	Google	0.0	GE Vernova Inc. $GEV is O Neil Global Advisors Inc.'s 7th Largest Position - MarketBeat		https://news.google.com/rss/articles/CBMiywFBVV95cUxPTDFHcm1qcWc2ZURNU3N1QWQwSlFoNG92T3Voc0NYdWhxQ3lzdWlaLW9GMUhyM2hLeFVxOU1xaUxQNkFyVE1nV0Z6ODVUc0RfdFprQXRQZEM1eHRoNmVhUXhiTUZ2cGh6WUYwUGd5UWo2NkJ1RTVRQkIwZEJ3SmNIQUpOb0NWWXpoLWxkdzNONGVwcHhaN1FPYnljcUllNGFvOTg0LUtVQ2JXQ2dpUktZMWNnYVRVNEZ2ckx4MVFSQ19QMGM1M3EtOFFxNA?oc=5
2026-02-23	Google	0.0	LaFleur & Godfrey LLC Cuts Stake in GE Vernova Inc. $GEV - MarketBeat		https://news.google.com/rss/articles/CBMiswFBVV95cUxQRDBzd3ZRbzZvalV5TmctLVg5bVRhaTI1QS1YdkVGaGZkNHFoc0l4OUotMmRQSnpubXFoc1FMeE15V1l2ZGpoSEF6M01kV3RuMWZoQzM1R2gwQUtfMDZncHk4REd5WVp5cDRmb3hLT2tyQVdSOXA4aUVCbUlUVGthRzZhNXJXWWx5VU9aTVhQYVZfaWpLcktjMkpieUtOZVFicmxCaThWZkhYSU5TallydEpEWQ?oc=5
2026-02-23	Google	-0.1	These 5 Stocks Are at the Center of the AI Supply Squeeze - MarketBeat		https://news.google.com/rss/articles/CBMingFBVV95cUxNMHV3bEhFSGlud0J3Q2pRdXJRWmU2VEpCRGlJaUdadW9qWXh1WkoyZkpkQnhnUmJvbGF1bGwzUVJnRDR6MmtUZFN3TWREbGYyTm9yNXN6NF9IRUhqLWFONGlFRDFiZ3lDZklFd0xZNGExeXZLeTlWSTQ5Q0VTS29WUzMyeG1UMjNsTjBRN00yQXE5SWtTWkNNUUpaSnNqUQ?oc=5
2026-02-23	Yahoo	-0.188	NuScale Power to Report Q4 Earnings: How to Play the Stock	SMR heads into Q4 with revenues set to plunge sharply Y/Y, even as long-term small modular reactor projects and partnerships gain traction.	https://finance.yahoo.com/news/nuscale-power-report-q4-earnings-151400247.html?.tsrc=rss
2026-02-23	Google	-0.4	GE Vernova Inc. $GEV Stock Holdings Decreased by Granite Investment Partners LLC - MarketBeat		https://news.google.com/rss/articles/CBMi1gFBVV95cUxQUVROSC02akxFVEszb1VfODFBWG5tU2VqUjk4ZmdmRDNrNUt5V3F4WWZ3RGp3MUQydE1SblR6X1V2cEpsQ2E3ZGp4SDlwUjJaOUlNS0lFODBXYWY0TVlTOTh2dUJhVGZrZmZ4VnJBbVRlUjBocTdvWVZBdXBieFd0QXpCeHZ2UG5UaXJxMXhEN0Mydmp1YUxSb2dNMUIxdkdnSXB3TXNWMEl2VFFZSGRFM2tUYUN3RFRjWHFrNnJhT0JhYlBjdWpUdFNQY0Q3RlFMSXZ2OUR3?oc=5
2026-02-22	Google	0.0	Sigma Planning Corp Trims Holdings in GE Vernova Inc. $GEV - MarketBeat		https://news.google.com/rss/articles/CBMiuAFBVV95cUxQUzRKZk54ZnV6bWFQbTF2RkxUVVV0RVo1T3pXNWoxQjJKazNuZDVwSjVaTmVNLWdZTkN0Q1NObXVqVGVYV3U0Ym5Bek1USHFJNGM3LWZDU09KMDc5RmFIYTBwb1JybnhOQS0yRG5hQ2o3aDRHWVJCdHNnY3FQbnluckF1WE5fSDdrMU1menJndTFHR1BSSlF3REtfX05Xd2lwa1dVR3RKR29idm9vdkx5UFoxZUdxM2NB?oc=5
2026-02-21	Google	0.629	The Best Stocks to Invest $1,000 in Right Now - The Motley Fool		https://news.google.com/rss/articles/CBMijwFBVV95cUxQNGNLR0t4Rk81NUNqd3pNdUtzd243bkpsU19zYURDSGZHUWxLLVNzZHBURXBoazdaRGVvdmpBLWlpQmpDZVgwVVlUckJETjQzSXZOS0dOMnFoRFQ3R21UdGNHMElZeUFBVWN3V2xuUjlRb2toWHQzdTlqa09UR19lcmNwRk1MVVByU0RBTWlpOA?oc=5
