Date	Source	Sentiment	Headline	Summary	URL
2026-02-21	Google	0.0	Analysts Conflicted on These Industrial Goods Names: UL Solutions Inc. Class A (ULS) and GE Vernova Inc. (GEV) - The Globe and Mail		https://news.google.com/rss/articles/CBMilAJBVV95cUxQOWg0UmNsa0ExWlRzVWdRbDI1MjZHQkkwbm9Gdm52VGNZMVNzM3dnSkRldHJfbjlSRjlvd2JkRVlXWjB0NFhmbm1XenRnVmNwQ0VFRlFfZzJ6YUdEcS1WWU9TWkNac0ZNeFVDMTVpcmF4dG9OTDBIbndqVXR6bUYtTmtLVFN5dUdGRFZWYkpNWjBidDlRVFRWc1cybkZ4VXZkNDl4OHlZMU1OeGVtcDcwenhwTkxvZlJaY3JaNW1SZmJSZk1WWVRnM21RUDB6S2U3VlFXY2RiamdvTU9rODhjYl8zcDMteUh6NjBzNjhNYkRqR0I1S01pa05uVFprV2tMY1Z3bkoyV2hwN1RGYjRpeTczWDc?oc=5
2026-02-21	Google	0.0	GE Vernova Inc. $GEV Shares Acquired by Stevens Capital Management LP - MarketBeat		https://news.google.com/rss/articles/CBMixwFBVV95cUxPNkVXYnhJbldabnZwLWVldTgtOUpPaHVOUVcyaTRHZHRNbTBiZUVpT2ZDbnBGR0NnVTZDWGw0RUQwYmpHRXFtR2E3VnlzT2pNbnhMemV0NzJaMkVhRHdSVUIxSEZWN3UtSnBpcFYwbVVKVmRCUUFMUG5YQ3NlM0p0TEF3bzlTNGl3WHlUZ3hDQTVRWW5PY09CTUw3Nnh0LXZHczNCWmVjVkxBQUZ2WXhBVlRQWGM2VHZ4ZHgzT0hMSnY0YnFZR3Jv?oc=5
2026-02-21	Google	0.0	"GE Vernova Inc. (NYSE:GEV) Given Consensus Recommendation of ""Moderate Buy"" by Brokerages - MarketBeat"		https://news.google.com/rss/articles/CBMi0wFBVV95cUxQbmFyaUZ5cGFSQVhyMEM1LUI4WE4zV0pFcHV4enk3eWVFVElFWEZ5Ym85R1lmUmRKb2dXQ2pGQ3duT2hqRjh0WVp4TnRVQjVVeTRMUWRhcXNCdkUzYm83Y0NBd3pLR1BUN1FZR0NSZV9WakJ5N1ZNTFA1OC00ZmNUbzM1Q1BTbldFQ3JUWW9DVFVUTDNhZG9RaE9ZeTZKSnVCUGtpY2NNa3VkVnVFOXd2NlJjNE9rLXEtSG9kbkd4bTdNSmNxbWIzNFRlbGF0dUFDbGFz?oc=5
2026-02-21	Google	0.0	Synovus Financial Corp Raises Position in GE Vernova Inc. $GEV - MarketBeat		https://news.google.com/rss/articles/CBMivgFBVV95cUxOejNRaFRmWnlSakVkei1wQUYtWFpQYzhucDdqUXRELTM4aFZUMUFzS2hKWGtiZXpBVkZEbEFYTFNoRzJnUFFMOHF6WEltdHdOS05tYXNQTVZJQ2dVSll0cy0td1k1MmtFSXdoNUM4NlBkWkRYMlpqV1hHZS04ejJsbDVURU1KZVFHalJNTTM1RGhDT3h1cU1BWjYyYW1YQUxRVW1JMERVWU40OUxBUFdOU2pQNXFrdHZtWXlHRjNR?oc=5
2026-02-20	Yahoo	0.267	GE Vernova (GEV) Upgraded to Outperform as Energy Infrastructure Cycle Boosts Growth Prospects	GE Vernova Inc. (NYSE:GEV) ranks among billionaire Stanley Druckenmiller’s 10 best stock picks. Baird upgraded GE Vernova Inc. (NYSE:GEV) to Outperform on February 4, stating that the firm is well-positioned to be among the largest beneficiaries of a growing energy-infrastructure cycle and that the market had misjudged the timing and magnitude of a potential surplus […]	https://finance.yahoo.com/news/ge-vernova-gev-upgraded-outperform-084423893.html?.tsrc=rss
2026-02-20	Yahoo	0.183	GE Just Hit Another Record. No One Noticed.	Thomas Edison would be proud.  There is, of course, no longer a single General Electric.  With GE Aerospace and GE Vernova recently hitting new 52-week highs, the combined value of the three companies is about $620 billion, up from about $540 billion at the end of 2025.	https://finance.yahoo.com/m/0705d594-51d8-322a-b028-29baf24d184c/ge-just-hit-another-record..html?.tsrc=rss
2026-02-20	Google	0.136	GE Vernova Inc. $GEV Shares Purchased by New Millennium Group LLC - MarketBeat		https://news.google.com/rss/articles/CBMiwgFBVV95cUxOa3VuanhyMjFYXzZhc09lMnE1R01jMHA2cWp0TmZNdTNULWdqQU02MHhyQUw5RXhVcEtpYkZNOTVtSV9fV1Y0RHN4eDJJNDR6VnJ2QXZBeFVvemtSX2wtaGJJLU1BcTZ5TEFESFZQeWtIRFhqemxEMHp6U0YxWFgxU1lPVXB6US1pek5La00zQmdOazhRYWZyd3BqcC1lVzdHQmwwOE9GNzdneGZUaU1WTzVfNTlzRzFQcVdpalJsQVVKUQ?oc=5
2026-02-20	Yahoo	0.0	ETFs to Buy as NVIDIA Nears $30 Billion Investment in OpenAI	NVIDIA is nearing a $30B OpenAI stake, replacing a $100B pact and spotlighting ETFs loaded with the AI chip giant as investors weigh risk and reward.	https://finance.yahoo.com/news/etfs-buy-nvidia-nears-30-153900102.html?.tsrc=rss
2026-02-20	Yahoo	0.0	GE Aerospace Flies Into Buy Range With Its 'AI Wingmate' In Tow	As GE Aerospace taps AI to enhance inspections and predictive maintenance, GE stock just flew into buy range.	https://finance.yahoo.com/m/528e0730-a182-3e6f-8689-275d49b94c73/ge-aerospace-flies-into-buy.html?.tsrc=rss
2026-02-20	Google	0.0	J.P. Morgan Maintains GE Vernova(GEV.US) With Buy Rating - 富途牛牛		https://news.google.com/rss/articles/CBMimAFBVV95cUxPMk1Nel9hNXp0TURJNk9hWHpRcnlZYnRsUHdYajBTTXVBa2hENGpCWlpTanZQVEswZGhOdU04N2t4UDFrSHFnM0ZEd0o5bzhOcXp2S00tM2Jwbk83NHBtZjA2U2tPU2xGWHh3UjRrSENoWHI3MkpVVk5vbVUtdlJ1M2VOTVFrZ0UzaEhyMXAwbXI2WlM3aUU2UQ?oc=5
2026-02-20	Google	0.0	Jupiter Asset Management Ltd. Invests $50.46 Million in GE Vernova Inc. $GEV - MarketBeat		https://news.google.com/rss/articles/CBMizAFBVV95cUxOZDMwcVoyQmZHT2dhQ1E0RHpoZ0hiZFlxRFd3cU5xVzRZeEY1QWU0UlpGN2FkMDBrT0I0ZnZYcVktMUFGUFhHWGRQb3VoeExoNmY1QjI1OXhVNTd0ajctOV9kZkJLTjJ4WEJHOXYwZW4zRkVDM1VxLVY1d09YY2RSWENlemw4bnJZWU9naGFUaWdYMS1rUGNVNWc4blRUUGFzN2RBQnBjUWN2dXdrdmpFcUFtREZZUDc4c2IzV09wS3lodmhGUEJuSDNMRXQ?oc=5
2026-02-20	Google	-0.4	What's Behind The 2x Rise In GE Vernova Stock? - Forbes		https://news.google.com/rss/articles/CBMipgFBVV95cUxPLUVpV3Bfd0dDd3hVR1lkZllXMWdnd3ZQaFY2RUZvcE5RSlNLRWdhSk1YakNlSElyV0FaczJRYm1UWG1HU19XSWtPZkRORkZ6UU1TdDktN1g1R2lvbHFWSmprQkdidllZenE3dFhCX3l0RnpLd3VNNklGMmR1U3I0T1RxQ3lsUTVURW9rM2twWGtuM3FlOXNlcFVpZnZ1Sm40ZHJ2S0x3?oc=5
2026-02-19	Yahoo	0.218	GE Vernova Gas And Wind Deals Test Valuation And Earnings Expectations	GE Vernova (NYSE:GEV) has secured a new turbine supply agreement with Lincoln Electric System for two aeroderivative gas turbines. The company entered into a reservation agreement with Maxim Power Corp. for a 7HA.02 gas turbine. GE Vernova's Onshore Wind business received 2025 orders to repower 1.1 GW of U.S. wind turbines using domestically manufactured components. For investors tracking NYSE:GEV, these contracts highlight fresh activity across both gas and onshore wind. The stock trades...	https://finance.yahoo.com/news/ge-vernova-gas-wind-deals-190956820.html?.tsrc=rss
2026-02-19	Yahoo	0.217	GE Vernova Inc. (GEV) is Attracting Investor Attention: Here is What You Should Know	GE Vernova (GEV) has received quite a bit of attention from Zacks.com users lately. Therefore, it is wise to be aware of the facts that can impact the stock's prospects.	https://finance.yahoo.com/news/ge-vernova-inc-gev-attracting-140005122.html?.tsrc=rss
2026-02-19	Google	0.136	Muhlenkamp & Co. Inc. Buys New Position in GE Vernova Inc. $GEV - MarketBeat		https://news.google.com/rss/articles/CBMiugFBVV95cUxPc0h0dkgyellyLWZwbmJwMUZFNGVoNGxFblgzWTJKaU1CSTFQOWI2N3k0S0pOU2xJYVFGNTA5SDNsdl9FbWxmNDJwRlBCM1NibXZaTmtzRTU2OVdtZFN2b2JrUkdwb3ZzTVZPek1fbXcxTUZFMDkyM0pwNHc1d1VyMGJaQWNwV29hQWJMdTIxME1DZDJtOHJBVG5TWHpTTE5XUFN4dmdDOXQwQmsyQ0FTZ3BVNzE5eWpiUlE?oc=5
2026-02-19	Google	0.133	How Do Investors Really Feel About GE Vernova Inc? - Benzinga		https://news.google.com/rss/articles/CBMisgFBVV95cUxONUkzRmctcnRmbURGbzV6Y3RHV2Z2TG53NWR3Z3J2Y3FUdThFR01VdzA2RkpVS05lQlBGdW01d1RtVmFLSXdtcEZ2N2FQX3dLTEZpcGNabV9RZEV0NXJuVnBLV2JEMV8tVE1rRjZtdHZONGJRRGdxalVsVEVMNDl5R0NPalBmY1FBbDRXMTI5Zm9pREU0UC1qV2JoaTdaNjhVZU5ITVNEaTluaVJwODVLc3Rn?oc=5
2026-02-19	Google	0.0	Cornerstone Advisors LLC Lowers Stock Holdings in GE Vernova Inc. $GEV - MarketBeat		https://news.google.com/rss/articles/CBMiyAFBVV95cUxOOVhPNnEwQnNLVTNjMkVqMDl4WkZ4VHY5b2VHc0hwa19QeFVNLW1yZkFZODlmTnlxRFNWUjVrV1E1WkFmbW1RNGJaR2tMV3R6M004VXdTQ1JPdHFmTllsakhhR3B2Qi0xVmVBYnpyVVk3SE01N2t0SFYycHo4dFd1TUFFakMteVN5NzVIYWlWal9yajdlc1FXcjVNUHlaV0cxamJkc21CRzJ0MWJZNi1pYmFCMHRLd1lleENuYW1CY2ljZHlwdkxDWA?oc=5
2026-02-19	Yahoo	0.0	ETFs to Gain as Japan Pledges to Invest $36B in U.S. Projects	Japan's $36B U.S. investment targets energy, exports and minerals. ETFs like XLE could ride the industrial boost from this landmark pledge.	https://finance.yahoo.com/news/etfs-gain-japan-pledges-invest-143600724.html?.tsrc=rss
2026-02-19	Google	0.0	GE Vernova (NYSE:GEV) Shares Up 2% - Here's What Happened - MarketBeat		https://news.google.com/rss/articles/CBMipwFBVV95cUxPZGduX042dW1tenFIVUxhNVljT2lTZktreTQ5RWRfZHQ2QlhHc0V4ak1vMzZESldKcFdvT2NzWEdwZnlSRW84dDJmMGpKYnlBYXAzVFRaZnB4VXcyNzNwR0U4UG9CVW5TNWxsYW42Nmg3aW5HRkJwUkFPWkwwU0ZVVmpOUkVuanpYUEN4Um1hWkRqcW82VzJheGJKb19sN25GSnZ0NHJ2SQ?oc=5
2026-02-19	Google	0.0	GE Vernova Contracts Highlight Growth Potential And Valuation Questions For Investors - simplywall.st		https://news.google.com/rss/articles/CBMiywFBVV95cUxPdXVfNVdzelMtbmQ0QjhWay1oV2h3Y3J5SWVBVGxBRy10TnhwRFNGSTBYX1ZfdHBmQ2FJQ3JpM2dqRkdlUlRoWmExNnVBTkhXVHVBdkgtekZDMEFNYmVmb1BkREViV3VVLW9aNGRyMndzSmZmaEI5TnJ0SzZnMy12V2ZuS3BiczhieGJnWEFINXNrX1ExeVJ6d2EyQkZ6TDFDTjlmUEpBYkgtMlM0VWJOTjJkblBLWmRYNWJFOEhDRENvLXhKT3UwTTFScw?oc=5
2026-02-19	Google	0.0	GE Vernova Inc. $GEV Shares Acquired by Harold Davidson & Associates Inc. - MarketBeat		https://news.google.com/rss/articles/CBMiyAFBVV95cUxOYXJ5R0ZPUzJScGhTbUctVkdDeGJ6WkJZLUtfUHl4UC1oNlpOcTFJYTVkb2xvS3Q2cE5TWGlWdU5wSkw3ZmFYZ24zRDN1bnlkWFBQaHpGaTJ0OTkxVXNZY1hqQ0RLbXBLN1pNZERMMjNDbmNmUzcyYnczR05xc2s2NW5HVHdscnQ2MmF6TEV4RnpXS01LbGROT2ZNc1VzbmlNUWg2WXBONG5PVXZVcVB2M3J3Z3d4bVMtc3I5Ym9FRlpsaTBXcmxBaQ?oc=5
2026-02-19	Google	0.0	L & S Advisors Inc Purchases 1,507 Shares of GE Vernova Inc. $GEV - MarketBeat		https://news.google.com/rss/articles/CBMivgFBVV95cUxQbWtKZjZEU2VuQl96alE2LVJHUEN6RGs2NUJUdEdwTE9rWmR0TFo4OHo2dXNXcHl5WUpPMEFaZG5YX19nOEtGWGhwQmFCbU5fNFd0d1R3MXhRMmxQQnVXcmNNRzFzRnlkOXdvaFdGZ3hnb3BrZDQwUXc4X0NRNTJUYVhIZGNvQlNWQlVtTGR0WDRsM2hFS09kZWN1c2JvZ0tnM0Exa1RZX291REh3b29oZUpWWW1HYlo3WWVvajFR?oc=5
2026-02-18	Google	0.5	Unpacking the Latest Options Trading Trends in GE Vernova - Benzinga		https://news.google.com/rss/articles/CBMitAFBVV95cUxQazZOR2JydmZTNUY3U3BUQ1lyNk5hakRybF90V0lmLVRmUEltb2M0Zlk3MFFYU3ViZENrM0FrUnFjME5Jc2VUN0tQeWNYaU83TnE0WnYwWFJYWlR1LWp5VVV4UU1xUWNZNGp4MFRwQ1hUaHpldG8ybGRrdWpkSkh6bHBZUXl4T3IyWXd6dkRSUXdDNkg1UGh3V2VORVE4Z3AtY3VyZnNvczN4aHllX21Ld0lMS0w?oc=5
2026-02-18	Google	0.0	Cercano Management LLC Decreases Stock Position in GE Vernova Inc. $GEV - MarketBeat		https://news.google.com/rss/articles/CBMiygFBVV95cUxPTy1QLVZDM3B1N2hBNm5yenJOYndhZXJNNU1KNTdBc19jS3psRmRpQmNsNDZTZXBsTXhMbzVCOGQyWW10UUEyNE1KeGZnckVWZ0R1LWUzTWR0OXFUVk94VElnUXF0NUREcjBlSHEwdDA1bWVISFNnbm9YM05nQ2l2WUlmbHRQQWlNRURGODhDVG1scXRUdHdwbFhOTE9VNFl1OWcxaWxicDN3SmU0aElfcjVncUI0Tmd4S3RKZHk4ajUtSXVMQTJrQlpR?oc=5
2026-02-18	Google	0.0	GE Vernova (NYSE:GEV) Stock Price Up 2% - Should You Buy? - MarketBeat		https://news.google.com/rss/articles/CBMipwFBVV95cUxQOUI0UzZIbzY0NW9EVzhuX3I0R2FrdGs2OTZIR3RGV1F0Qy1wVUg5Ri1CZHB6ZVRFd3FMYTdlYUpUV1ByR09EcGJ5QjRoQzFGdmJzZGhNRkJpN0lJMWs0T3dkSXBreDVtUS02ZEI3QWZRQWVTcGthT3VPbXZOQkdRRFMtRlk5UkFCaTJSUV9kZW50bmZpQWtKUmJFS3ZlUTZ0M1ZrOGhwRQ?oc=5
2026-02-18	Google	0.0	GE Vernova Inc. (NYSE:GEV) Announces $0.50 Quarterly Dividend - MarketBeat		https://news.google.com/rss/articles/CBMirgFBVV95cUxONmJyUmZRbU5pYjExdW9qRzhPOHB2REl6Q3NYZVhDaGZHN3pHQVNXMjZMNjVRV1ZVTUFCb1RvVUs3UDZiSkFnQy1kcVJpeU82Q0RWd2RpZF9HVmY5UU9COUl6cnNjVlpKZUQ3X2tqeTZpRTAtSW9mNkJraXp3Q2d3MGdDWG16V0Y4LWNqSVZXWHhjOU5qeHpMM1AtY0VlTTAydFVQUFZwS1A5UkU0bFE?oc=5
2026-02-18	Yahoo	-0.1	Jim Cramer Shared Why GE Vernova (GEV) Stock Got Crushed	We recently published 17 Stocks Jim Cramer Talked About. GE Vernova Inc. (NYSE:GEV) is one of the stocks that Jim Cramer talked about. GE Vernova Inc. (NYSE:GEV) is an industrial power generation equipment provider. Its shares are up by 114% over the past year and by 18% year-to-date. Baird discussed the firm in February as […]	https://finance.yahoo.com/news/jim-cramer-shared-why-ge-175156112.html?.tsrc=rss
2026-02-18	Google	-0.1	Jim Cramer Shared Why GE Vernova (GEV) Stock Got Crushed - Yahoo Finance		https://news.google.com/rss/articles/CBMiekFVX3lxTE5MRnhGZmdRVlFSNklUOXB1MlJVUFpwSnV1ellhVV9yNDdSUUN0TzdDbW51aERjYk5hZGI0NjBIRWhMMWlLMzFWZkhiaGdCVG9xdWVvQWljdFBnLU5fLUVvRjFhZFMzX25uS3llVDZoNU10OVZ1UE15ckJR?oc=5
2026-02-17	Google	0.136	Zweig DiMenna Associates LLC Makes New $10.49 Million Investment in GE Vernova Inc. $GEV - MarketBeat		https://news.google.com/rss/articles/CBMi3gFBVV95cUxNNElyZ296ZEFkOS1tdUJqQXF6UzVzT3JzVjc1WFIwOGtvQkNGclg2bzV6ZHlKVHlhRWVYbjZESjhuQldxQ21qVDBNSmd0SGxOM1Z2WG1YbU5yZk03ZEVMbW8tSnM5R0ZmdTFGbUhzSnV1MXlyYWo3ZmhtMDlNcmdIMl9VWG5odnM3MGsyQ2x0YnVLbmowRk5WUHM1U2FhcnlnZUNZUWxHZ1Z6QjY1a0RLRldmNlRGaEY2elZQcG8zUENhZHZaLVdSOG5Xcm5ic2tEdkNuZDZfZHNUZERoYXc?oc=5
2026-02-17	Yahoo	0.0	GE Vernova Declares Second Quarter 2026 Dividend	CAMBRIDGE, Mass., February 17, 2026--GE Vernova (NYSE: GEV) today announced that its Board of Directors has declared a $0.50 per share quarterly dividend. The quarterly dividend will be payable on April 14, 2026, to shareholders of record as of March 17, 2026.	https://finance.yahoo.com/news/ge-vernova-declares-second-quarter-222000002.html?.tsrc=rss
2026-02-17	Google	0.0	GE Vernova will pay investors $0.50 a share this April - Stock Titan		https://news.google.com/rss/articles/CBMimAFBVV95cUxNQ2dpaVd2RUNQQmNSbzFTWlRuZGNvZU1tNktvZFh0TWlMTFFER0xGcDdXOWlOR0lONEgwcjVVTXVpamdtbU9MNVhuTHpRdjJUOG5wb0U2VEVHLVJtY0lvSGwyazFxYUlRcGtoa3dQcWFBRmJOTFV5NmVUeEJHZlJnbURBZWNVWlVtQXladEROV0dkSGJfRHU5cg?oc=5
2026-02-17	Google	0.0	Skandinaviska Enskilda Banken AB publ Has $86.63 Million Position in GE Vernova Inc. $GEV - MarketBeat		https://news.google.com/rss/articles/CBMi3wFBVV95cUxOclJSLVJVSHRZOHBTN0RrY0xyYTNXSGhYYTR2ekNMOXVlcUtFQ19UaGZfb1FOOGRBd2Q3cGhwMUx5aE90eHdFMWVMa2FrdkZIMlpBU2xyN25YeFBUei1sdzBSSnFrUkJRNUhod3VyNTZ3NUlmNmcwMmIyWmNjNkgwR0xObC1RdDJ2MVpsbWdRaU03eWxzSHBEV2pER1F6OGE0OVoxeHBROHd6dHppZGNGM2JhaUNURU5JcVFjX2lXcTRSZzlaZnhYOW5WQjk4VFgyS09aWUNMRHpGZzF6aE04?oc=5
2026-02-16	Google	0.1	Has GE Vernova (GEV) Run Too Far After Spin Off And 119% One Year Surge? - simplywall.st		https://news.google.com/rss/articles/CBMiywFBVV95cUxNN3JFOHBrUmdzTXVlTUJJVmJiS2hCaVRGM0RJa2wyUkp4XzRUMzdmVXNDVXRZdHlPMzd3dkY2REVrNEpNV3YyeGx3OUlrQVpYUnJ0LUdBcmItam9wU19POWxPeklheGQzS3NmVVMwWTVMRFg0NlEtVjhLa045dWQ1MUsyUENxc251ZWxNVnZZVUJiYnN2RFdFVnhxSC1seXdKdkRjV1JDdS0ydlVkSTZKVDJGNm9mT1h5UVZCcVduLS1hLXExeGprVWlHdw?oc=5
2026-02-16	Yahoo	0.059	GE Vernova (NYSE:GEV) Is Doing The Right Things To Multiply Its Share Price	What trends should we look for it we want to identify stocks that can multiply in value over the long term? Amongst...	https://finance.yahoo.com/news/ge-vernova-nyse-gev-doing-140024913.html?.tsrc=rss
2026-02-16	Google	0.0	3 Reasons to Avoid GEV and 1 Stock to Buy Instead - The Globe and Mail		https://news.google.com/rss/articles/CBMizAFBVV95cUxPdEtKWUZuTS1JdWYtTUdOUS0zOEhnbVNETnBkVTA5dUc4VEdJZ1dWc0RraV9yNjl4OWZlTEkzeW90bjE0ZmpXQlREbGdaSHZveWhxanM3TnRGb3ExNWVlR1dTNjBNdFBuUFVIMkVGR2NudTUzdmZVQ1dKbzJzbUZ5aVFUWGFwbW4yck1JaDlia1pSbm9tTzFOYnZ4V1JJX3JNV29GMDZzNmxCbEdCbmFJb3VEQ2g2SVUwYngwNXlhTkR4c2Z2ckhtaFFPS3I?oc=5
2026-02-16	Google	0.0	Aberdeen Group plc Buys 10,339 Shares of GE Vernova Inc. $GEV - MarketBeat		https://news.google.com/rss/articles/CBMiuwFBVV95cUxQMm5JR1oxa1BvVllGWmJwYjhrc2piNDR4bklTc2dLcy04cTlfa1p2WUVZNVkxSVdKNnFJc29OYnNNZmx1bzV6VFBIRXo0czcwaTNhT08zb21UekNtUElMa3BldFFGcW0wUDc5QUd2UDJwaUpfWU1iRFB2WHV5SmJxRnQwNHpRTTNGaXMyOU1HWHRoNE5acVVwLTRsNk16OExBSklSbHg4aFpVcUREeVZjR2dkWWNRYkZkYkdN?oc=5
2026-02-16	Google	0.0	GE Vernova Inc. $GEV Shares Bought by PNC Financial Services Group Inc. - MarketBeat		https://news.google.com/rss/articles/CBMiyAFBVV95cUxOT2taSVFOdzRvMGFvRlh0QlVQM1p4ZzMxYVdEaVlkdmt1TVdhc0dfUlYxRXNmUnVlQl81Q3lSM2F6V1VwVXZzaWVkeGpmdmp6UWhPOV80QVd0UnlZRXhhakF6WDJvVlA4bnZpZGlkOTlYTWNSMERsbjVJcDRkWVpBNENINUZwQzJvY240UGxoS1drTHl3VjdaTVpPdGt0WlJHUjBnV0pLOE5jMHdlVEJKcXBySEFGVGd0MmRPNmFlZnpPN09YaUZRWA?oc=5
2026-02-16	Google	0.0	Vanguard Group Inc. Boosts Stock Holdings in GE Vernova Inc. $GEV - MarketBeat		https://news.google.com/rss/articles/CBMiwAFBVV95cUxQZXFxRnJtbjBiT2ZPdlZ0VTFXNDFGWDNrTzdHOHFHSW5lZXdWOTBlNDJSYmROVTYyYldnNzNEVG96WDlzOUxMMmt5aEFhQ29ObUxBSWVZOGc2dDF2ZXl1cjlSU1Z2NUlWNXVZcUcwYU9adTVfODB1NVNqenVQUmxEMWg1akczbEZBQjJ4N191alNwMnBjX193ODB0QWJTQTFvR3RnMVAtNzBGUmlIbDdPV1JGbl9PaDh1TzF5OEU0UWM?oc=5
2026-02-16	Yahoo	-0.125	3 Reasons to Avoid GEV and 1 Stock to Buy Instead	GE Vernova’s 28.4% return over the past six months has outpaced the S&amp;P 500 by 22.5%, and its stock price has climbed to $802.45 per share. This was partly due to its solid quarterly results, and the performance may have investors wondering how to approach the situation.	https://finance.yahoo.com/news/3-reasons-avoid-gev-1-040409713.html?.tsrc=rss
2026-02-15	Google	0.0	3 Reasons to Avoid GEV and 1 Stock to Buy Instead - Yahoo Finance		https://news.google.com/rss/articles/CBMidkFVX3lxTE4yZ2Y1czMtcUVSa0x3dXZwaG4yRDBNQmYwZFdrR0ZpSVpuekFVcE5rT0x2VUd5NUh2TlZ4V1Rjc0FLc0pzNlo4dFd4YUwwdTZGd1lfMk5fNHl1aEt4V2Y5QktpdlFtNUVEY1g0bTJMeFNjWDNzb0E?oc=5
2026-02-15	Google	0.0	GE Vernova (GEV) is Still Buyable, Says Jim Cramer - Yahoo Finance		https://news.google.com/rss/articles/CBMif0FVX3lxTE5zSVhDUkhDZ1Y5ZE9qQTBXTzBZVjMzQmtYblNNUmlaR011T3lVaEt6dU1WZXpQMndwTDh0UExBU0s3aXl2ZmdReFJ0OWxkeWRrdC1KTGZybHJxTlJ4ZEJnRC0yMnQ4aVBMbFRxZlBfbnFDcnVwNWJqVnJVNHJEYUk?oc=5
2026-02-15	Google	0.0	GE Vernova: Even Rapid Growth Doesn't Justify These Prices (Rating Downgrade) (NYSE:GEV) - Seeking Alpha		https://news.google.com/rss/articles/CBMitAFBVV95cUxNTTlNQzFrZ2lXY3ZKWFJtSUFXZUFfMWJ4ZVJ4Mk05b0d5aUxXWDA0ejNOZFdkTU1YeTlfWTRCOUtTNzFDUVpJc2I1bjJyWGd5LUUtRnkwNzRhUWkzVzZ6Q2VYRWF1ZkJsald4Nk1BcGUwalFxQWRTdEFQYnAxVVcyMVBUWVJYXzhFVGxEM0lqSUxyV3J5ZDhfY1AwOU9RQzFGUXA4VmFfLXE2eWRrLUdCeUx3NTc?oc=5
2026-02-15	Google	0.0	Pelham Capital Ltd. Boosts Holdings in GE Vernova Inc. $GEV - MarketBeat		https://news.google.com/rss/articles/CBMiuAFBVV95cUxPcGRBS2xPTkJENHc5TUMyQ0phenBUSXg1blotcUw0bnZNNVJrVVVMM0hFWW5Sc3E3cjg3djZ1NzZXbWdRWDZxNVBES1dOYXFwTkJiMlY3cmF3QVYxMGkwXy0xMzFyc2ROY3hMcGFOXzc0bmhYb0pKWldaNU8yWkVhNnRXYUlZeXhDN29sa0R3MHh3WTVFSW5BeEFPWjVrWE1QZmt6YzdYOFp4S0NxVTJydzhMN2R4NHBm?oc=5
2026-02-15	Google	0.0	Public Sector Pension Investment Board Decreases Stake in GE Vernova Inc. $GEV - MarketBeat		https://news.google.com/rss/articles/CBMi0wFBVV95cUxPemN1UDR2d3EzeC12UmQ5S2didlpUZHVaT21aRXNTUUM4Z0pfNFlfV1lmMGg3LVJuTXRDVS1kOVNOQUpoVUdyVUhLaUxMZ2NudWRrTlpkWVNKNUxBeWVrcHlKaFJZTnBQM3lfRjQ2dWhOOGNBcjdLbGZEYkNxMGhqRWpTQzBXSFllcW03VUxKSlBOZzlWMWRydzBqSE42Z3N2QXNHT2JjeTlkVWRGcW9ZQVdpTUJhdkxUTERNZkY3NVlhRWtkODJsaHlkQi1fRmozNHl3?oc=5
2026-02-15	Google	-0.05	GE Vernova (GEV) is Still Buyable, Says Jim Cramer - Insider Monkey		https://news.google.com/rss/articles/CBMilgFBVV95cUxPNUlHRG1mN19FaEItaUFGOXBmNUl2RjF6X2NZT182RjJzVEFfa2czWnV1Y1RyUTBBaVIzZXowSzhpQ29HamFKdk02cEVPR1NiX254aDZ2YlNsYk96QVYwUzRhc21oSC1ZMDVkQks0SHJwcGJpTWI2UkhDWGx4S1FoSURnU3ZqeS1taWYzbXRjVkpGdTNHbVHSAZ4BQVVfeXFMTlBZMHBjbFBlOElyNlM5UGs4ZlJLVUhaMGhpU3FHRVY0bFFvSDV5V3ByLXZncXFKZkd5cGw3eEN5LUdER3daaEpSeHFCMHkzRkpCazhqcXc3b1IxUnFGekV5aEs3ai1jOEtXeXlGbzU4U3E3SGxYSGR5RzRRd2d6eXVpWWxvcXN4WVJJR0V6RlcwaTRfWlA0QW9qdzVvVkE?oc=5
2026-02-15	Yahoo	-0.125	GE Vernova (GEV) is Still Buyable, Says Jim Cramer	We recently published 13 Stocks Jim Cramer Talked About. GE Vernova Inc. (NYSE:GEV) is one of the stocks that Jim Cramer talked about. GE Vernova Inc. (NYSE:GEV) is an industrial machinery manufacturer that focuses on the needs of the power generation industry. Its shares are up by 118% over the past year and by 18% […]	https://finance.yahoo.com/news/ge-vernova-gev-still-buyable-151227451.html?.tsrc=rss
2026-02-14	Google	0.23	GE Vernova (GEV) stock retreats from fresh high — what traders watch into Tuesday’s reopen - TechStock²		https://news.google.com/rss/articles/CBMiqgFBVV95cUxPSkNIMTlPMGdGQkVpOGRKelZpaHk5WTd1X0diTTViLTgzT2toLV8taWtwV3ktZkhjRk91WjFzRFViLVBxQUVLd2xQMG9uYlo4YVNNeVZvNFk5amtmbUJ5UHRnbUdWQi10V1BrbnZRN3pxZ29paFZyWm1zZG5hU0szSXNpWnlJMTEzb2Y2VG8tdkhlSG5zRWdaWll2TVRTTVd4LURQM1BoZF96QQ?oc=5
2026-02-14	Google	0.0	GE Vernova Inc. $GEV Stake Boosted by Atria Investments Inc - MarketBeat		https://news.google.com/rss/articles/CBMiugFBVV95cUxNNHEwci1waVlDY0Ryb1QxbTcwT3NENTNMN3BLY2xtbU5ER3ROOWYtSEoyLW5JZnRySzZ6cVI2TVFXb3BLUHBNbnZqRzFWX2hXSk5PUjBrUEFkOWo4aGcxRTdnQ2JOQVdkdHRNU3ZlM040LUR5YWVRTWVJV2VMZUIxVzVMel9pLXo4cktoRllSaXRJc0ZmOTNNbnhCd0pEbUtWYlpvYXFiZ0I2MEVNYW9ieVhQTExZbWFhamc?oc=5
2026-02-14	Google	0.0	GE Vernova Stock Surged 120%, Here’s Why - Trefis		https://news.google.com/rss/articles/CBMinwFBVV95cUxQZnQ4WnVYS1pZb2NXcnl1cUlqVnRPWWloUWVEZ3hRTC1ORGNrdWhLR01LeG9DS1JxaUpVdFRDTHlVLTVUbHdkQjJUMk4xWDl5SDNhRHZxM3dEMVROenljekNnQk1SN0VhZmdLbWhmajlHbktKbFMwaVhIdFp4VF9kWlNBMldCM3RobmVFbGJtUWJIOWJTQ1dHQmZMeEpZb1E?oc=5
2026-02-14	Google	0.0	GE Vernova Surges 2.95% This Week and Becomes Massachusetts’ Largest Company - 24/7 Wall St.		https://news.google.com/rss/articles/CBMiugFBVV95cUxNQWNhblVjcTVsTHJPNl9iWDcxbEd5SzhzNW9UWUt3eEs5dmxKaEJtdUNLSWFoZ0dITDhxSUozQlU3dTR5MlFYZlNZZE5BNXI0NzF1ejR6azVJT1o4ZTc4WWJDRGFhTVd6UU03clBoR3FGNy1jVFVMZW1SWWtkb1dTNXdmaW9MMHh4aGd1VXVnSlBYTWtJZ0lhRFNMQ0ZaSHlMUEs2ZV8tQlFwQzA0S2RmTmY2UGd5WHh2UWc?oc=5
2026-02-14	Google	0.0	Illinois Municipal Retirement Fund Grows Stake in GE Vernova Inc. $GEV - MarketBeat		https://news.google.com/rss/articles/CBMiyAFBVV95cUxNWlhvNi1xdGttY0NrYjBXRnRwZkw2UW1oOEpwSGpoSzcwZExXc2hNMDdySkNrUzZZYld1VndRazBuR21HV1JVemhUeVlVVHZpUHBpc3hhdURObUZMZDZ0LW1HNlhNU1FJTk5tVkFkQl9Ca04zZjVad2tWSklFSWNMUnRnT0NkQlU5ZWZFR3lXWTZJSGl0LWpndjdvVWYwZG9MSVpDWlVWdGZNSW5vVWl1Ty0yQ25MSTJLR1NMZ1BIZVJhRWdJZGw2cg?oc=5
2026-02-13	Google	0.0	GE Vernova Inc. $GEV Shares Sold by Baader Bank Aktiengesellschaft - MarketBeat		https://news.google.com/rss/articles/CBMiwwFBVV95cUxNWC0xZEZtUW1GT3FfeWFPcVpuZmREMndFRnMxMlhaeWd2SEd4NjVtVDlrZXRyZE9fYnJnbm5iS01WcklMUGdjVjB6bTVqcGZRcDQyZmZKRjk1c243cWFkVU5jSjgxSTJNbUF0UW9uTTJwM0hwN3AtaVo2QmRUVVEzbzBBV1RPdnlITGJVZnBUVUdneDY1c0hhb1Npb3NmSjBBS3BvTkk5aW0wWE1PVzNKT08xQkhkcVlNODY0UWNXOHhfNzg?oc=5
2026-02-13	Google	0.0	GE Vernova Stock To $573? - Trefis		https://news.google.com/rss/articles/CBMijAFBVV95cUxNUmhIZnBXVEVYMUYwZjR3VGxpZko4R2xsbF9YTlF1TmllYVk5dHJ5YlFKSWxWMTlQZG5pdjZSckpTWDF1TE1rNThPNUp0bHpmUjRMbzdaSTFVZzF2QWxOY3JiSlVGb0JkekhBdjIwclZvaV9VOVg1UXZfYjlmbWF5bExaamJoS3NPQ24xQg?oc=5
2026-02-13	Google	0.0	Longbow Finance SA Decreases Position in GE Vernova Inc. $GEV - MarketBeat		https://news.google.com/rss/articles/CBMivAFBVV95cUxOOVhBVllmdHBlUVB2T18xdWFleWxzWndyNDYtbmJtdFJzR2l2dmlDRDdtN1BWTk5MR3hRbUtkbWpjY1NXTG0ycVR3RDAzN3ZIUlJERVpYS2VJVXJlZ3dWb3E5eVRWdWpXMWFRLVZuY3VGQXNoMTlyRGdlSldrSHRPYWFxNjZVUEdrNXd1ZENmaUVZbXljV0E5Z3hoWmFDRHk4cmtxS1hka19SOHJUUEZxUllBZk4zdVhtU3hqOA?oc=5
2026-02-12	Google	0.136	Mitchell Capital Management Co. Purchases New Position in GE Vernova Inc. $GEV - MarketBeat		https://news.google.com/rss/articles/CBMi0gFBVV95cUxOMXpsUDBZdm1LRTE5NFlNTTdwYnUtc3RSMkw0dmdZN2toR2tmMkExM3dvTkFaMXR3RjNrSURjam9IQm9LWm5hSU5Bd3dlUjBtWTVZaXlaZGtNYjdqb3Y3UmxvSnU4VlJUSFhYUzNCUjZHWWZaTHNlbDM2UkxWLXZRZmUzOTBkdlpTbVJ4TmI1WS1teEExaHJGem9jdEk3SXpWNjFGNlZhVkN5Skkyc0tOSHBsSE1WLW5KNGg3cmpsUGVKcEVzcFhlWXNYczVyZzdjUnc?oc=5
2026-02-12	Yahoo	0.063	Does GE Vernova (GEV)ʼs Expanding Gas Turbine Backlog Quietly Redefine Its Long-Term Power Strategy?	In early February 2026, Maxim Power Corp. announced it had reserved a GE Vernova 7HA.02 gas turbine manufacturing slot for its 400 MW Prairie Lights Power project in Alberta, while GE Vernova also secured large U.S. wind repowering orders, a broad alliance with Xcel Energy, multiple long-dated bond issues, and completed a major UK gas plant upgrade. Together, these moves highlight how GE Vernova is locking in future gas turbine and grid-related work while simultaneously reinforcing its...	https://finance.yahoo.com/news/does-ge-vernova-gev-expanding-050943461.html?.tsrc=rss
2026-02-12	Yahoo	0.0	Terrestrial Energy: Nuclear Disruptor Positioned for Bull Run – Initiation Report	Download the Complete Report Here By Brandon Hornback Talk about a white-hot opportunity. This advanced nuclear-technology play targets a $1.4 trillion serviceable market between industrial heat, data center/AI energy needs and coal plant repowering optionality. Meet Terrestrial Energy (Nasdaq: IMSR), which sits at the center of the Generation IV advanced nuclear shift. IMSR has developed […]	https://finance.yahoo.com/news/terrestrial-energy-nuclear-disruptor-positioned-155452593.html?.tsrc=rss
2026-02-12	Yahoo	0.0	Zacks Industry Outlook Highlights GE Vernova, Constellation Energy and Montauk Renewables	GE Vernova, Constellation Energy and Montauk Renewables stand out as wind and EV growth surge despite rising tariffs and tax credit risks.	https://finance.yahoo.com/news/zacks-industry-outlook-highlights-ge-144100020.html?.tsrc=rss
2026-02-11	Yahoo	0.0	3 Alternative Energy Stocks to Watch Despite Rising Cost Pressure	GEV, CEG & MNTK are poised to gain from wind and EV growth, fueled by policy support and tech gains, even as tariffs and expiring tax credits push clean energy costs higher.	https://finance.yahoo.com/news/3-alternative-energy-stocks-watch-150100663.html?.tsrc=rss
2026-02-11	Yahoo	0.0	Castleton Commodities International LLC Acquires Linden VFT	Castleton Commodities International LLC (CCI) announced today that one of its subsidiaries has acquired Linden Variable Frequency Transformer (Linden VFT), a 315 MW transmission facility in Linden, NJ, from GE Vernova Inc.	https://finance.yahoo.com/news/castleton-commodities-international-llc-acquires-130300549.html?.tsrc=rss
2026-02-11	Google	0.0	Noteworthy Wednesday Option Activity: GEV, ACMR, ALDX - Nasdaq		https://news.google.com/rss/articles/CBMiigFBVV95cUxNaGJvamtZT0kzZVJFWlkwWXRwS00ySWlvbWZhRzZHLXJtalRRMlJHOTZRTkxuVHFMR1JBd2l6NGJhV25jZk5HWm42WS1JajZEUlRhenJtdjBqb2Y4ME92bVhyb1NrZHVqUHlmSXRjYUFfZWY0ZkZycUkteHJIN2hzVkVuSWpldHZwOEE?oc=5
2026-02-11	Google	-0.067	How Investors May Respond To GE Vernova (GEV) Earnings, Debt Issuance, Buybacks and Data Center Demand - simplywall.st		https://news.google.com/rss/articles/CBMiywFBVV95cUxQM2VQR1Nhc1EyM1lYdENRQUVHUndxTTI2NXJzMU4xN2ZPN29ENzBvRVczQzFMUGZTMUtfOXhyVmQtSmwxaWxfWkhwY2huZHExNE1BLUs0VXk2QXN0RDhmZERpMkwybVBsQkdGUURUeE1fYmJZa0tZX3o2UmFzNFltTHQ0UDE0Y05yZDMyLU1iVWc2d1d5ZEtpRmtaaGdyc3FHNXFNbXVwZ0JiUGdsQWxIa3RnUmZaM2JXQklCcFZBUXNzNVZheFFwd0t5Zw?oc=5
