Date	Source	Sentiment	Headline	Summary	URL
2026-02-11	Yahoo	-0.117	Here's Why GE Vernova Stock Popped Higher Today (Hint: It's Artificial Intelligence Related)	There's no let-up yet in spending on AI and building out data centers to support its growth, and that's great news for this stock.	https://www.fool.com/investing/2026/02/11/heres-why-ge-vernova-stock-popped-higher-today-hin/?.tsrc=rss
2026-02-10	Yahoo	-0.179	NuScale Power Trades at Premium Valuation: Time to Hold Tight or Exit?	SMR trades at a steep valuation premium as execution risks, delayed revenues and weak stock performance fuel debate over whether to hold or exit.	https://finance.yahoo.com/news/nuscale-power-trades-premium-valuation-152500462.html?.tsrc=rss
2026-02-09	Yahoo	0.0	Baird Upgrades GE Vernova (GEV) to Outperform Citing Early-Stage Energy Infrastructure Cycle	GE Vernova Inc. (NYSE:GEV) is one of the best IPO stocks to buy right now. On February 4, Baird analyst Ben Kallo upgraded GE Vernova to Outperform from Neutral and significantly raised the price target to $923 from $701. The firm asserted that the current energy infrastructure cycle is in its early stages, which positions […]	https://finance.yahoo.com/news/baird-upgrades-ge-vernova-gev-170500234.html?.tsrc=rss
2026-02-09	Yahoo	0.0	Dow Jones Futures Rise; Dow Above 50K With Apple, Boeing, AI Stocks In Buy Areas. But Market Is Still Divided.	The Dow has topped 50,000 for the first time, with JPMorgan, Apple and Boeing in buy areas. The Nasdaq is still below key support, but these AI stocks are reviving.	https://finance.yahoo.com/m/981503ee-3a91-3e34-a07b-308dadbf6a2a/dow-jones-futures-rise%3B-dow.html?.tsrc=rss
2026-02-09	Yahoo	0.0	GE Vernova Completes Turbine Upgrades at InterGen Gas-Fired Plant in the UK	GE Vernova said the energy giant has completed a modernization project at InterGen’s 800‑MW Coryton Power Plant in the UK. The group on February 9 said the work included two high-efficiency (HE) upgrades on GT26 gas turbines, delivering 85 MW of additional generation capacity, a 2.46% efficiency gain.	https://www.powermag.com/ge-vernova-completes-turbine-upgrades-at-intergen-gas-fired-plant-in-the-uk/?.tsrc=rss
2026-02-09	Yahoo	0.0	GE’s AI Repair Push And Vernova Demand Reframe Growth Drivers	GE Aerospace is committing a multi year investment to expand and upgrade its engine repair operations in Singapore with automation, AI enabled inspection, and digitization. The Singapore Economic Development Board is supporting this expansion, which is aimed at strengthening regional engine repair capacity. GE Aerospace is gaining traction with pilot facing SaaS tools for flight data and aviation safety, while GE Vernova is seeing strong demand for its power equipment. General Electric...	https://finance.yahoo.com/news/ge-ai-repair-push-vernova-221355457.html?.tsrc=rss
2026-02-09	Yahoo	0.0	Maxim Power Corp. enters into a Gas Turbine and Generator Reservation Agreement and provides Prairie Lights Power Project Update	"CALGARY, Alberta, Feb. 09, 2026 (GLOBE NEWSWIRE) -- Maxim Power Corp. (""MAXIM"" or the ""Corporation"") (TSX: MXG) announces that it has entered into a gas turbine and generator reservation agreement (the “Agreement”) with GE Vernova (NYSE: GEV). The Agreement allows MAXIM to hold a manufacturing slot for a 7HA.02 gas turbine and generator package (the “Gas Turbine”) with a target delivery by 2030. To hold this manufacturing slot, MAXIM is required to provide a non-refundable deposit which is payab"	https://finance.yahoo.com/news/maxim-power-corp-enters-gas-120000546.html?.tsrc=rss
2026-02-09	Yahoo	0.0	Maxim Power Enters Gas Turbine and Generator Reservation Agreement With U.S.-Listed GE Vernova	Maxim Power (MXG.TO) on Monday said it entered into a gas turbine and generator reservation agreemen	https://finance.yahoo.com/news/maxim-power-enters-gas-turbine-130942362.html?.tsrc=rss
2026-02-08	Google	0.0	After Leaping 25% GE Vernova Inc. (NYSE:GEV) Shares Are Not Flying Under The Radar - simplywall.st		https://news.google.com/rss/articles/CBMiywFBVV95cUxQc3ktd2RXbUM4cFhlQmlwUWJvX05QbXR1MHJSZUZCeWFUR2tZd09sbDh4YUtZejdiV2ZQcllwY0gzRTJfQnA2YjBvTnlSRUtRNk1JVkxPeXE5QUdWc3hKZk9ESXVoVmJMQU1PNHd2MzVFeHQzMVFDQjh4ci0tVWJRX2pOeUdyZUJhck1ZSlNYSXFnc01HZWhKanVWS2x3akx3TktEV2VndkNpU1lUTkN5bGowdjNlUG5yelhJNEM3NTRoUFBZa3gxbHJpOA?oc=5
2026-02-08	Yahoo	0.0	Scott Strazik on How GE Vernova Is Riding the AI Power Surge	When Scott Strazik became head of General Electric’s energy business, GE Vernova, in 2021, the electricity business felt very different than it does today.	https://finance.yahoo.com/m/987789d9-caa0-3c4e-ab17-45bac234211a/scott-strazik-on-how-ge.html?.tsrc=rss
2026-02-07	Yahoo	0.0	Here's Why GE Vernova Stock Keeps Soaring in 2026	Artificial intelligence (AI) application-led demand is driving soaring power orders at the General Electric spinoff.	https://www.fool.com/investing/2026/02/07/heres-why-ge-vernova-stock-keeps-soaring-in-2026/?.tsrc=rss
2026-02-06	Google	0.0	GEV Stock Surges 9.7% in a Month: Time to Hold or Book Profits? - Yahoo Finance		https://news.google.com/rss/articles/CBMidEFVX3lxTE9rb21LckY0UWFTTVpmaDFSNXBlbkpWQWpZanhFbzVQUUlWcjVyVUxiV2RMQUZmbTh0Tk9hR29FbXdBZzB2bUhUMUJKbkE1T0RMU1N6a0MyQUJzeVltenhXTjk4T0RNU0xfSGtrTlNNeEtaTndB?oc=5
2026-02-05	Google	0.067	Has GE Vernova (GEV) Run Too Far After 97% One Year Share Price Surge - Yahoo Finance		https://news.google.com/rss/articles/CBMid0FVX3lxTE9QQ2RfSy1zSm9pM1RkcW9PUWlWU1RKNHRkeG5tekt5SXUzNFVRbW1JZUlCcTRiUnFaNkVmQkpLV0s2d3l4YzgzM0Q1QmhJSVFnU1ZmM1lhZy1vVXVvcFVna3NsRC03N3lWdks2cUwwbWVCWHdBbTdr?oc=5
2026-02-05	Google	0.0	GE Vernova Inc. (GEV) Is a Trending Stock: Facts to Know Before Betting on It - Yahoo Finance		https://news.google.com/rss/articles/CBMifkFVX3lxTE44RWdiTWNHVXpET3F3eng5SERVMWR4bE1ESWdJM3NuVGFUdHdvTVg4OS1oU0F1cEJWcXJPX3Q2cnI0Q2YwenNZZmRidC1CWTl3cU1RSXB1bmllcmF0NHRLRUpqUzBkVU94emNqTGpISmVWakFfUXNMSmg0OXdkdw?oc=5
2026-02-05	Google	0.0	GE Vernova stock price today: GEV slips as $2.6B bond deal closes, wind repower update back in view - TechStock²		https://news.google.com/rss/articles/CBMiuAFBVV95cUxOUXBrVUJJQzE3eUp6UU44cHpEYW5jS0RQVGEyT1RsQkxQYnJpV0ozRjZXVGJwOGlKQ1BSeGhQWm5NRVZQUDBRS0NsM3F4ODBNTFE0TVlsN3dpZms2YmVmMm9DaFgzVXQzWVBXZmhjeDh1ZktjT3FLaGFsOC1heTZPTUdaYWUtUkx1aW1KMms0ZW5EYklJT0FNX2piN2lvMENWdDNvRlJSNDFvNHVOdWxza2FnTlpDQ2ZJ?oc=5
2026-02-04	Google	0.4	Should You Buy Shares of GE Vernova (GEV) In February? - The Motley Fool		https://news.google.com/rss/articles/CBMiiwFBVV95cUxQZDYzS2NJb3VJazRyMV9uQ1lYZ1Q1aUNJUWZmUWlCU25sYlRHQ0JhZ3owZEwxXzl2QXRZdEFiNDdxdWJpeTV2TU1MaWt0QnoxaWluLWpTeGNhWGFoMzd6OUNHTEhiMExDY2YtY0NTTkJOaUtKZGctT2VPanVGQlhHeEd2bTVVLUg4a3M4?oc=5
2026-02-04	Google	0.0	GEV Stock Surges 19% In 7-Day Spree On Massive Earnings Beat And Upgrades - Trefis		https://news.google.com/rss/articles/CBMizAFBVV95cUxNb0VyalA0MGlsQmdFX0ZQeEpGZ1RZMzdDZ21VOG41MzRWUExGZnl2YVlRbUJQVDR0ZU5sQkhnY3BTY0puME15enJ6b2pHMHY0dHBkdktrUWgtVS1kSV9QQnIxSkhQMVdhOHBlcmxPV1BaTmlLMi1nUEZvcElsM1p2VV9qYjFIRzBhU1Fab2dvcTBDWGdqOS1YQU43UWV3cG1VWlFRVWFtMnVlbE42Mk1WRFdrUzhqWlB6eXV3ekFvOVJVVjJ4VXlWNHhBN18?oc=5
2026-02-04	Google	0.0	Should You Buy Shares of GE Vernova (GEV) In February? - Nasdaq		https://news.google.com/rss/articles/CBMigwFBVV95cUxQc2w0Y0ppV2Z3RENua1BpM2hGRDNyV3RUZ3FjTE1pSG1ubC1sOXFxdjNEVVdSTWxaYVR5S2VNMXNyc0tyNC1CUl9Mei02ZnVmWXotem5jeUJtcm94NkhXenEzUGYzV1N0aDFKeE1ONVBjZXZJeFR6dmotcHpEaTBLUHFUTQ?oc=5
2026-02-04	Google	0.0	Should You Buy Shares of GE Vernova (GEV) In February? - Yahoo Finance		https://news.google.com/rss/articles/CBMie0FVX3lxTFBkVGpTck1JZ3d3LWFrRHJrbldCcEF3ZTN0dHdjVUh1ZjBSYkxHSTBRQjJ2em1kS1Q1Rm9mWEdna2NVd2N5SHpMOW9CV3NYOS13d3dTZE5DaGhBdFZOMHh1Wi12MXV4TWZYS2tYSWg0OXRNU0NKcl80VnJFdw?oc=5
2026-02-03	Google	0.333	GEV Stock Surges 15% With A 6-day Winning Spree On 315% EPS Beat - Trefis		https://news.google.com/rss/articles/CBMivwFBVV95cUxPQUVHWWZWSmgxcW5WNlZsazN0SXR6M3VyQkh0Smw0UEtCZDd5Z0xvVUZGNjBxWW0tYWVUT09ENG42b3E5UFU4RDk5d1hQMFJDVDRESHlYS1NZRm16elVZU1NsMXZ4QXo3a0k1YlhzeVJlN1FkM0tzN1dYSGRCUzQtaFA4U2VuTkpPN0gzQjVzRGJmN3JKdkVweDNFbjZsbnBGdEl3RjZHalFmNFdwcUtzLTRITHlXSkFOM0tMX0FZdw?oc=5
2026-02-03	Google	0.0	Are Wall Street Analysts Predicting GE Vernova Stock Will Climb or Sink? - Yahoo Finance		https://news.google.com/rss/articles/CBMihwFBVV95cUxPbGVxTF9BN0dxRkJXMDJKMkNDSmN1MWx4RlhGTGhfcWdqZ1Y4b05zbTZPdmdGTGJMMF9ydlhfY09GVjQ2cDVVWC1zSlpQb082NW0zS2ZaU3NlOU50NVlSMG5HRnBTNGJxZ1h4bFJFSEJ2S09yQXdyOXB0MnRDcXV6dVZWeW9tUlk?oc=5
2026-02-02	Google	0.0	Assessing GE Vernova (GEV) Valuation After A 101% One Year Total Return - Yahoo Finance		https://news.google.com/rss/articles/CBMihwFBVV95cUxQYUxxRWo5TFlaaHVxX0wwSkg4Z3FLUjJibUJUMTYtQWVLUEhfbkFTTWVSUmRfNmRmdnNURkw5NUlfVFFnVWdDLUhEdWhvdktrVXRuaXM1dG51dDYyZ0MzNUFjY0FoQkIzMUVnTGJ2TXhmZHppT0RuaEdXTldPWjZsWFlkajEwRGc?oc=5
2026-02-02	Google	0.0	GE Vernova Inc. (GEV): A Bull Case Theory - Yahoo Finance		https://news.google.com/rss/articles/CBMieEFVX3lxTFBVUU91a2tLcGUwMXJXd2NBdktJelhZcExrMVJvWXhfNXN0U3cwY1J3UXhwdGRfVFhqVXVSaGp6UER3RUI0ckpaTDgxWmNPR1R0NDZkTUNudUtUQVctb3RjWmJ4OWl1UFN6aE9tN09BYmRndHVad1VBZg?oc=5
2026-02-02	Google	0.0	GE Vernova buys remaining 50% of 10,000-worker transformer maker - Stock Titan		https://news.google.com/rss/articles/CBMirgFBVV95cUxPRjlra0lyaV9wRE5LTURWRTFUaXhyU2djS19aVmNEVVctMmtQcHlPLXE2UVNOLTdKNkRGcU10Q3ptMHpfV25PaFo3eXh0UGdDV20yYm5jRVZnZ0R6REFraFg0aUU1dk5vS2tGZ3hHbVBKS2h5ejE2cER4bzRhdjhqU1hmbnVrQ3ZSNDB0aXVkaDV5UjE3dkRQMkllT0k1alNLTHJnYlpDOGdCa0ZWWlE?oc=5
2026-02-01	Google	0.107	Jim Cramer Wonders How High GE Vernova (GEV) Could Have Gone - Finviz		https://news.google.com/rss/articles/CBMikwFBVV95cUxNaHBQTjY0ZVJjZS1ldmFRZnVpc0dyWm5BWVl0U292MVBXRnNOQV9PbjExd0hWTUpQa2dCelZGbFQyUFlxQ3BVZlpPbnBTSjVLeHBIV0YyekQwR1RMNDljSXh2U2ZpMWF2N2Z4ZlB6VWR6UHVnVDVfOEhfVDB4Yy1hczVQVThCSGE3ZnluQWNfcm1hb28?oc=5
2026-01-31	Google	0.467	GEV Stock Surges 10% With A 5-day Winning Spree On Strong Earnings & Upgrades - Trefis		https://news.google.com/rss/articles/CBMizwFBVV95cUxQQl9sX082TTJ4UFBuMUJGakp4OVJMSzE3TVFLdng5T0h4NE9XMzJERXZMSDd3Mzc4VWZSdWdMS3VSSC1HMlNDVFZDZThqRk5XVTQtZ1M5NzFqMnFpN3ZpNVNJOE92MEdzZ1E2T3V0LXUwbWRxX0lsWDZoOWJqRFBLb2hxVzdhYktvRWhHNlpkYmlyVnhnY1VFc2NDRTZuMGdXdl9WWnhwVnpBVW84c2xxUlg1dVNYek5mZmM5bEx2U2h6M3pxUWdxM09iQ19XU0E?oc=5
2026-01-31	Google	0.25	GE Vernova’s Q4 Was Strong—But the Backlog Number Matters More - MarketBeat		https://news.google.com/rss/articles/CBMinwFBVV95cUxQbF9KSWRkRk1jeE56T3dOaWhLdW1WQzRsNnJ0QkkwVnhUY09WcGpldWFDOTNveXVkRnhGMDJCTEltcnpZZlc0LV85aGQ5bHVVOGNUdUp3dERrLTZIOFYzOGx6cG9RV3dLNVBodjJWWjE5LUlLdlRRM1ctUkY3TkhPRmdHdlN1ZzR1bHFMNEc2ZGpNNGRPZzVMck9paC1VZEk?oc=5
2026-01-31	Google	-0.1	GE Vernova: Priced For Perfection, It's Not Worth The Risk (NYSE:GEV) - Seeking Alpha		https://news.google.com/rss/articles/CBMinAFBVV95cUxPcmlweEFlMkFScDlRbjZSSGhFSERkcDNGcUZValZuNnBRYXA5UlNWcUdKR1V6ZnQ1RGVTblkxVkplUUlCbVpyS3hzRVo3cE5MWnBwaXFRZC01MmJDX3MtYU8wMVVJbXFkRFhvclM1SU9oemdydS1JYV9oVzlyTk5kUFBicXprMEQzR0Fub0FtU1Jyc0JucGlKZzh4ZWk?oc=5
2026-01-30	Google	0.4	Is GE Vernova Stock a Buy Now? - The Motley Fool		https://news.google.com/rss/articles/CBMifEFVX3lxTE5MOU9MQndEY1lxQk5oQWE1a2VHcFktMWxocksyV1pVd1JveVQwTXlKYW1XQVJJbGtrbjNRdkhzTkRnV083b1p5MEJFcTAyNk82Ny1tTzB2c2ZKNzRySGVscDJuOE5CWkZibWMxSDFIcldaZ2pTM2huR2lTQjY?oc=5
2026-01-30	Google	0.25	GE Vernova (GEV) Earnings Surge And 12.8% Margin Test Rich Valuation Narratives - simplywall.st		https://news.google.com/rss/articles/CBMiywFBVV95cUxQcHN6TjFMYUdKTmUwdzVUamgwQXFNQ2s1cWNMREtKTk01X19iMmVIdW9TQW83aldYSjJDeDBWN3BoQTQtOXVKVFlSalZXUmN3ekZidUdqdGoyTVdFd0lkajV5YnVTeEM4T1h3VWdYb2phcXhHZ0pCb2VhVjhaZEhOck1IMFZYWkNtcjdqWWotOWhBbURHWjM2OXhYbVl0UThJN05zTVZOSXJqU2cwenBMb3RaNlJxY2hGanlZRWdxRXNKYVdicVZyQ2VYWQ?oc=5
2026-01-29	Google	0.333	GEV vs. PEG: Which Grid-Focused Energy Stock Is the Better Buy? - Zacks Investment Research		https://news.google.com/rss/articles/CBMiowFBVV95cUxOZFQ5WlJQMkdjRGMwWThCbER6VWdTbGloSmEzMWx1RFNDcC1rdmlSVHZrY2tYMzR0OUhiQ04tbDNrdk10d2VxeVZqbFU1R2laaTJTdHdXTG5rN21EZmJCTUJjNXBSdEVpNGpRSHJEUWFaRmM4aEU0VFo1QzhEajl1UU9TMFpOQVJCNFFuUEVXeHNPR2RJTlV2Y19saVNlTHRqbDhV?oc=5
2026-01-29	Google	0.2	GE Vernova's Momentum Is Real, But So Is The Valuation (NYSE:GEV) - Seeking Alpha		https://news.google.com/rss/articles/CBMilwFBVV95cUxOcnAzQ1J2TGpMcnVFNXBnY0VVdVVjT3J1TGZsem11OXBVVDA1QTllSk1iaFc4ejhGN1p4TUVJQlpPaEZMaWRBd1NobjBpWTZrYlpXbHdxc0hpNFhvRzNEVnU0c3MzaURjT3VIaVU2S2Z5TWlQT3Y5TmxjMTU1U1RkOVJTVnpLYmhCRUdfT1pwRnIzNWR1cVRR?oc=5
2026-01-29	Google	-0.267	GE Vernova (GEV) Moves to Buy: Rationale Behind the Upgrade - Yahoo Finance		https://news.google.com/rss/articles/CBMiekFVX3lxTE5CeXcwMXEyamNRSUZib3lwVTVJSWg5WmZ0aGc2RHNMbmdlWkNCdURQX2VsRDI5NXl2TkhWaGVzTDlfNGFJUnRkTEtPYWF0SUZzeVRVUmYxMG5MRTk5VF80MkxLZm10TnRuMXJlVExxRG1KZWc3c2pqRS1n?oc=5
2026-01-28	Google	0.0	GE VERNOVA ($GEV) Releases Q4 2025 Earnings - Quiver Quantitative		https://news.google.com/rss/articles/CBMiigFBVV95cUxQQ2p2Tm0xVVVTNktwSG1oNmlaMU5rVWVaZDVEcHV4TGlKLU5STjVMRHlzRVBoWlRSdzhMQy1QenB3bk1JY1Z5c1ZUbWNBQ3AtWWpNQXlGTkRCRjZxbEZIQ1RrblVnb0pNbmVJSnV6aEt2YWFGLXlzWHJwaVJVSzQ0WlpzQ2VZWDRGeFE?oc=5
2026-01-28	Google	0.0	GE Vernova (GEV) Surpasses Q4 Earnings and Revenue Estimates - Yahoo Finance		https://news.google.com/rss/articles/CBMifkFVX3lxTE1nb2tvRGNQU204TzJ3RzdPSGdFN2RQMXlHRDE1dTcxZ2NFT0FZTWQ2V3ZfZm1JNHNEbHEwdU42a3BCNmU2YUxMQm1lRjNZQXVvbFJwbzJ4VU1sN2t5TGFHWU93RkRqbE4wUzFLSE5PcGFOYV9ueENBZ1MySUFJQQ?oc=5
2026-01-28	Google	0.0	GE Vernova Flaunts $150 Billion Backlog, Doubles Dividend - GE Vernova (NYSE:GEV) - Benzinga		https://news.google.com/rss/articles/CBMisgFBVV95cUxQRHJaRUMxVU96akF4cS1aMEpYa0JPWmxfb0VtLVpRN19Cc2M4bTBUTzY4NDBZM2wzRkZPQmNiQjRNRHIzSEM0MzhCVWZiTFo3UGdpWVVkeU9BMjE0YmFtdTNyUjh5bmFTaEhZU2g0RTB3R21Fa2xLdEVfdElYYmt4UzB4Mm5PVHNTcFgzeHhyQ3dPWGEwRkU1dzRDVThMd2YwOHhrSUl2SmcyRXJZMmxDcDRR?oc=5
2026-01-28	Google	0.0	GE Vernova Raises 2026 And 2028 Outlook For These Reasons; S&P 500 Stock Rises - Investor's Business Daily		https://news.google.com/rss/articles/CBMieEFVX3lxTE1oakhYTWpDZmxPdktXdVJKdzNOMVNkTmwwdGdIVGZVbW9kSkN0ZHlLeWliT3lnOVlPNmVuM2FzZjROOWxPMUlrSzNyZ19UUE9OcV9lSUhqbzlXMkg1OHh4Nk5ycWpxN2hrdGdJdHdTT2ZvclU5SERXRw?oc=5
2026-01-28	Google	0.0	Why Is GEV Stock Drawing Investor Attention Today? - Stocktwits		https://news.google.com/rss/articles/CBMirgFBVV95cUxOSFVwanVULUJObGplMWdRNjVlOThpeUpjajlYX2dsTkRkZHhGNWExZzJjWVZiNUY5YjBrMmFtYjd3eXJiM2dsY3B3MmlGczB0dDhsR1RBZmExTHlKUFlmVC1FdGkzQ2JPMnZfbDlwMkdQc2E2c3RmbTFDVWF3ZDdzNnUtUl9rVkxWVWtUYXlTeWtWUVhFbjdKSHZ6OWdNWlJfNGdRS2lSWmZXZ3FtLVE?oc=5
2026-01-27	Google	0.0	GEV Q4 Earnings on the Deck: How to Approach the Stock Now? - Yahoo Finance		https://news.google.com/rss/articles/CBMigAFBVV95cUxPNnh5RXJPY29kRVh5clgtN0ZybjI0SUptT1JEejlpNnZiaFBpc1Y0ZXBMaFgwVEJ5Q1A3cm0zeXZsd2o2NXJqVF9OWkF6T3VjbWpzaGJIRUdVcVZQMGNzeFhmcHJZa3ZrZ1cybDcxTzhhMHNodGMyVF9ydWstS2NWRQ?oc=5
2026-01-22	Google	-0.133	Investors Heavily Search GE Vernova Inc. (GEV): Here is What You Need to Know - Yahoo Finance		https://news.google.com/rss/articles/CBMiiAFBVV95cUxPYkptSG9rSGlxWlhHSHJMOXhndzJDMUpwSWQwUmU2cEU2Zlljb2dkLUtQLUswdHZwTDdEV1ZzQ2pwQ19aemQ2amZnSVlPb290QVB1RTdnU1BzclBadTNOaF9fNzV2eGlQSndiLU8xZ29MQmpZX3owbXpuS3NMZmgybllTTGl4eFJZ?oc=5
2026-01-19	Google	0.0	Is GE Vernova (GEV) Too Dependent on AI-Driven Power Demand? - Yahoo Finance		https://news.google.com/rss/articles/CBMif0FVX3lxTE9VdGoxLWpDdHU0Ty1uTzhBNXdVOThzUjhNOVJMZGNvTnNuRVJTMF9BcGNWX3pINDByY2czM2xEQ1NNTnBzQmxVVWtOSlNWeVFpdE9hTnRncnJ2SE81X1FkMmhndVZyUUJwVlBreTlmdVJmc25NNy1NVno4c01fSjA?oc=5
2026-01-17	Google	0.0	GE Vernova Inc. (GEV): Big Upside Target Meets Near-Term Caution - Yahoo Finance		https://news.google.com/rss/articles/CBMid0FVX3lxTE1sRmZ0aXpsMzlBWHpMYXhlbUVGQk9OLVNRTE0yangwajE5TUJKUFhUZ3k1bjdlRDlzbTkzaWVGWmFwazd0aFd6SXJ0SGZ2aHd2UXpoZ2gwbnBxaVdyYUtqRUN1dEJxRFNOUnQwT19FNlJaNW8wZ2tr?oc=5
2026-01-14	Google	0.4	Where Will GE Vernova (GEV) Stock Be in 1 Year? - The Motley Fool		https://news.google.com/rss/articles/CBMikAFBVV95cUxQUkJmSkktUjA3UVBUcWxzeDdKaXJJUFpDSFk0SFE2MnhoaWdNZ282LURhajVwZ0V2TTAzVEV2SXFMTm9KWmhXLTNBSDBINkg3a3Q0TzluZVJJVG9ieXZ3OG5JeElTUHVzX3pQS1gtVktTX0xQZ2VPUk9DUndha1pPejFmOGJwYnpaS1JiWUl4Q3M?oc=5
2026-01-12	Google	0.4	How to Buy GE Vernova Stock (GEV) - The Motley Fool		https://news.google.com/rss/articles/CBMijwFBVV95cUxPamJkNTlkNm5NZE15dF9FbENsUW9YRUs3amdFWTZ3TWJrd0hBbDRKdHlkYzdJYng3R0F0RjNwSlpWMXhtZ3dnQ04wYlpSVGo1eWVXOWFGSEZhTFd3NkVHUVZmbGlFLXpDU0otMS1OS2lfTWhyYnNLU3hHdXg4dHFpOFFubnBPd1FKYVFOYlBhWQ?oc=5
2026-01-08	Google	-0.104	$GEV stock is down 6% today. Here's what we see in our data. | GEV Stock News - Quiver Quantitative		https://news.google.com/rss/articles/CBMioAFBVV95cUxNbjNGX2lhT2kxUktWazNmR2Q0LWFMd1Y4VEVwUXkyX3AxM05wZjg3VjNyMW5KNEcwcmE2UHRDZWxkb29RM1JHUF9LNlh6WmticFY5aVQ3RUM4Y1BRc0pPbzZEREg0TjFPS3l2OHpKLXFTbmRXZm9rX3B0R2NVZnIzSFAwWVBiUngxNF9WWFduSWVnZERUWnhSRVpTeEpmZFhh?oc=5
2026-01-07	Google	-0.122	GE Vernova (GEV) Suffers a Larger Drop Than the General Market: Key Insights - Yahoo Finance		https://news.google.com/rss/articles/CBMigAFBVV95cUxNRGloVk9DSU9qUGNKYVZQWGtCQWxsSWxhaEphN3cybkFyTk96V0hOc2dfZ2RRclZPTjV4SEdKRXhxazFDel96LU40OFo3MUFQU3hXb1dhT0VlM1haOC14QXJGY3JxbkRtOXp1RWdxWEl5bm9Ba2FzWVQ4WjRIRnQ5bw?oc=5
2026-01-07	Google	-0.2	Is It Too Late To Consider GE Vernova (GEV) After Its 81% One Year Rally - Yahoo Finance		https://news.google.com/rss/articles/CBMifkFVX3lxTFBHQWhmMUh5LVJ4emFzRjJBU2pKUXRDTHZhSUV1MkV3WV9vbUNqQmFNa3llSEpwaU84enlUWXVTY1lrMGVWQXBDaHFYalhHMFE1cmhyY2lfUnREQ3V2YnRMRk5EakZDeGwxaXhZVDFleG1iV1FzakF4Tm1ZSXRHdw?oc=5
2025-12-31	Google	0.0	Jim Cramer Discusses GE Vernova (GEV) & Turbines - Yahoo Finance		https://news.google.com/rss/articles/CBMigwFBVV95cUxOQXI0eFVVRDBDYV9MRFZvWDBFS1FqbE82eEV1YUtPNDdIMEROWktuREEycXd2WUppMDA2TjNvbHV4a0VaVWpwT3pJWk0yR2FYd2N0N1pwZW5rTlJyQ0hOaTB1dE5QZ0t4T1JXNl9NWnY1cXZ0cnhCOHZHeGRqdlB5bjhTTQ?oc=5
2025-12-25	Google	0.2	GE Vernova (GEV) Is Up 8.7% After Dividend Hike, Buybacks And Grid Wins - What's Changed - Yahoo Finance		https://news.google.com/rss/articles/CBMickFVX3lxTE5WaXZSbU4wRlNKRG5EYjlkcFZqcnl3M0lvei1MZWtiZHJsVUR4VmVlQlE3dnpoZThDdWhuMmdONjRJSWRHTDdzZHp3TC1YNF9pb1VtOWRiRnFSd19xRGdFeHlqT3RkUUd2U3lTN2FKVnJvdw?oc=5
2025-12-22	Google	0.0	GE Vernova (GEV)’s Been a “Home Run,” Says Jim Cramer - Yahoo Finance		https://news.google.com/rss/articles/CBMieEFVX3lxTE9QRVAtUHc3RndTMmxKdlJHOWdaUGM3V3N0VVEtOGFxM0hZU2I2dHM1MXpWMUxzMGtReVRrZnlicWRpQ3lCWnNlT3NzeVdxbkJJU3pZYjQycTc3ZElabnNaUkxNQzBnZUF4SnFWVExaYjFzSFp0eGtZSw?oc=5
2025-12-21	Google	0.167	GE Vernova (GEV) Gets Higher Price Targets from Wells Fargo and UBS - Yahoo Finance		https://news.google.com/rss/articles/CBMifEFVX3lxTE43VFB3QlVYQUl1WGhJVHhYOXcweXp1SmkyTUFVYmNYRWhDcnE4REFGWjZpc0o0aFZqQVkyN3MtSTBpTGVpUDE1Zl82Z1JxaDA0TkZ0SWhHdzNheEhOLUJGVkpxeUJMakJ4dExsSDVvV0VtclNwZ0VNVzFibWk?oc=5
2025-12-21	Google	0.0	GE Vernova (GEV) Stock Slides, but Jefferies Sees Long-Term AI Power Upside - Yahoo Finance		https://news.google.com/rss/articles/CBMifkFVX3lxTE1VNS1YLWtsb09McGhKaUZoeExUYTJPLTVIV21lb3lJeFpvWGRlaXVyZV9jZzhBSWN0SzllZGhpenI0UFdiUXR2bFR0X2Nrd0ViMEQwSy1ITUgyMkNFM2dOUmkxM2sycnJCUjJlZEx2TXd1UVcwejVJZi1RSHRsUQ?oc=5
2025-12-15	Google	0.0	GE Vernova (GEV) Ascends While Market Falls: Some Facts to Note - Yahoo Finance		https://news.google.com/rss/articles/CBMif0FVX3lxTE9udU1qVGpHX2FiVEttSE1jRkZGUEFYaTYwZVRkaDhpMnVQT2ZFMFpXVU04SmJRYnFJQzBIRFVQWDVPa3Y3dWt3VldFUXkxclRNMkd1NGk2N3BuZFlLWndxRXE5SnFhcGxXQVlGV3FNTXBxTnBMYXBYVDFiOGJXeGM?oc=5
2025-12-12	Google	0.2	GE Vernova (GEV) Jumps Back Into Favor as RBC Turns More Bullish - Yahoo Finance		https://news.google.com/rss/articles/CBMie0FVX3lxTFBZNjd6WlJMOWhMN2Rkb2VvT0tqVWMzUVE5dmtmZlhXTUZDTXN1YkYwMGNhbS1RdElZN1dfZGlmNFFkNEQyZEhhajNEMVdaaFAxeGZwUWxOWFVOQ0g2eTkyNl9sRFBfRktrcXZGQ1A4cm5SR29PTlRuU1BVQQ?oc=5
2025-12-11	Google	0.107	GE Vernova (GEV) Climbs to All-Time High on Upbeat 3-Year Outlook, Doubled Dividends - Yahoo Finance		https://news.google.com/rss/articles/CBMifEFVX3lxTE0xRUY4UWFvWUpjbTZlRmt3c2VWaGFsN1lOWTV3VXc1UG9Lby1oTUJtbmNGeS1mNUlDNE41ejU4cVZSaGVHazZIZ21ORWxEUzdOTXIyM09vMTNkQlVJUkJJWXlpanVLcEM0UnJhRUg3UXZud0pRd19nci1URm4?oc=5
2025-12-11	Google	0.0	Is Trending Stock GE Vernova Inc. (GEV) a Buy Now? - Yahoo Finance		https://news.google.com/rss/articles/CBMigAFBVV95cUxNdDJhLXZZS1BUQkRyVzdVYU9CMW5pdDZmaC1pRGhNYXNnVzZnS1MzNGtlWVJydUZDanFYTXRSZFVIZlVzMU4zOHZMRXRycjJQMEJlM1FKQ3VURy1kc19fNUgxT2hjTDlubVVTQUJXM3hsdERlMGdldkN4QnNTbjlNYg?oc=5
2025-12-11	Google	0.0	Why GE Vernova (GEV) Is Up 14.9% After Doubling Its Dividend And Expanding Buybacks - Yahoo Finance		https://news.google.com/rss/articles/CBMidkFVX3lxTE1vb01XakQ4WXFfc1ZZZ2llU0hfVEtqYzVISmRpNzR4aElKUzlPX1lBY3VYc290eThXenRNZmRsRGtsTjhiNlRoWE1lemdZcTJQbEtLMUpOY1J1RVNpMjRSOURxc1lkd1hSaTVPSTBxaXFnX001cnc?oc=5
2025-12-10	Google	0.0	GE Vernova Showing No Signs of Slowing, Will GEV Stock Hit $1,000? - Barchart.com		https://news.google.com/rss/articles/CBMirAFBVV95cUxNQnJKYkxaM080bUFWUzVSZTZiWGxNQ3pEal95OHZ4WXdXSDgwNjE3YklseS1iaFp1d2ZZYktRQXZ4UTZkZV90bkNnX0loUHkyd0hEbHpieVlLNnZDWDZVNEpfUE1ySURMcmdZeUNqSE5TQzEzNGk1MmZKbEpwYk9qVjJHVkd4NVFLaXp5c01WX2dtcjZOc3NfR3pRdUszMDh1dUpwNzZRMGZWb0NO?oc=5
2025-12-10	Google	0.0	GE Vernova Stock (GEV) Opinions on 2025 Investor Update Event - Quiver Quantitative		https://news.google.com/rss/articles/CBMinwFBVV95cUxQamxDV1dkQXpmWlZxaXkxY1JzN1dvTDljRXl4aGM2My04dDN3dTBpMWZDcmt2ZXMwRlNLWmNtalVjajJPRF9pMjFORU5JMFQ0NG8wTnFJWGZjWHJLUDUwN3UwckNXa05YWGRGUEEwSEY2WXlKQVZpaWtpNjBFTzdLN1ZyclNlaEdMaDg4Tk1RYXBFVnNXdnZaWmNwMnNRWjA?oc=5
2025-12-08	Google	0.333	Why GE Vernova (GEV) Dipped More Than Broader Market Today - Nasdaq		https://news.google.com/rss/articles/CBMiiwFBVV95cUxOdnF6QXRMbDlwZE96ZHlUTm5tZjhYblVZWXQzU09VOGx6Q2VmU1NiSDN3UU1NUUpFQ04wLUNpQXN1aHUyVmJscXQ0Tms3RlV5cTFEd1FEeUlaQTVVWTMzaFZpeFlCaDJFNkFFS0xsclViSjJzY3NEQ0gzczllUnhIS2ZVekdSbnFGdF9Z?oc=5
2025-12-05	Google	0.0	GE Vernova (GEV): Assessing Valuation After an 86% Yearly Rally and Rapid Earnings Growth Expectations - Yahoo Finance		https://news.google.com/rss/articles/CBMihwFBVV95cUxQaUdkMlZ4VWFHLUVtMU1UdkZMWGNjalNrSXB0UFFzNEhmWnpibDVsVmpwcjRLbklZQXdpdTI4ekJ1dzVoTW5ScFhIbDdydHFVZkhvS2tlVkxqN21XdkFydGdiV1RVSEJScUlaVE5wTUtWblNTazdEYXB1R3EzbUFTWWpFbEZXVEE?oc=5
2025-12-03	Google	0.667	GEV Stock Rises 3.5% in a Month: What's the Best Move for Investors? - Yahoo Finance		https://news.google.com/rss/articles/CBMic0FVX3lxTE9IeGxVSUtuT2JycXJ4OFVoSnRCdUxVU1RDTWRWbDBkTWc0WHhUaFVidzFhVmZuYU8waHI2YWxqTzBWeXRNRXFINmVPcWdYUUVTbUxZTGJQcjFMWF84M0MzcHJ4QmxwUHhfY0g5a3c4bFRmLUU?oc=5
2025-12-01	Google	0.0	Is GE Vernova (GEV) a Buy as Wall Street Analysts Look Optimistic? - Yahoo Finance		https://news.google.com/rss/articles/CBMieEFVX3lxTE5ZanRFOE1TVmU5RHE2ZG1Oay1Iblh6bXpId2lRX1ludlg5UW0yMW5feUlWS3pCeFNzUXNjaXR6aTZWOTVNYzBhVV9YS0w5UWZrcFFOdktaWVNHRnpFY21aLS1HVEZfenRUeXUzbEp5MzE1Nmo3MTc2aw?oc=5
2025-11-28	Google	0.0	Dynamical development of strength and stability of asteroid material under 440 GeV proton beam irradiation - Nature		https://news.google.com/rss/articles/CBMiX0FVX3lxTE9hLTA4YzNlV2JFb1lPMW5KSG40MW5SVkJZOU9zQTJEN1gySm1fNXh1V3RUdldPSWdtR05RTUY2M0ZadHN0M01xbVhNYkJFMXJPeGJpdG9BNVdCWk9kOXJ3?oc=5
2025-11-27	Google	0.2	Is Most-Watched Stock GE Vernova Inc. (GEV) Worth Betting on Now? - Nasdaq		https://news.google.com/rss/articles/CBMikAFBVV95cUxNZnpyUWlPOHNhYWx2cFlQTHVWMjhqRXlwam9aSU1FelF2SDd2bWlRc2xKME1YLXF4WFhIWmNhbXk3NmhaN3RlWFdmcU81dGg0QjR2ZnNhXzllT08yMElzcFJydXJUbmxPTFlJR0NRRzhnM1NKdUpGbGR6ZHBJa2VDbkRxaHZCWnU2VTFUeUdRU3Y?oc=5
2025-11-24	Google	0.333	GEV vs. AES: Which Is Better Positioned for the Clean-Energy Boom? - Zacks Investment Research		https://news.google.com/rss/articles/CBMipwFBVV95cUxObDdvRVhTQXRmYlhlMUJyalUwUG90OGlaTGFMd2tpVFdBR1FhbGVrcXhFREFqZlUxRjNnamhyTWtxQzlvNTIzeXRaVkl0bEZrc0FNRzl1bllTb0pxRWRTaU9BWG5uNXNXWnZWdkpnazFMNWdOai1WbEp4YTYyOFBIb0p6Nko5cnpDdHA0RjNsVXc5N2p4ZXdTM0RvSUZUcUJLVDk1Qm0yVQ?oc=5
2025-11-15	Google	0.0	GE Vernova (GEV) Is A Big Stock Position In The Trust, Says Jim Cramer - Yahoo Finance		https://news.google.com/rss/articles/CBMiekFVX3lxTE5TNE5Idnk5di12UUd6WVF3aUwyc09vM2NabEpMOG4yaS1vUk4yZmJkVUlQdm5WY1NYZkhUdElRSEZZdjF2dklmSFF2U1N2allvSE4wb29HV1RGSng4OU9tVndPcjJQcW4za2lzaGVtR0NCQ2hzSXR3ZXdB?oc=5
2025-11-14	Google	0.0	GE Vernova (GEV) Added to JPMorgan’s Focus List with Bullish View - Yahoo Finance		https://news.google.com/rss/articles/CBMigAFBVV95cUxNN3UzYktzQ25VeDdwR0ZsRUVtVUJxSmwzMGRpSWlacnRlR2dZM2VIS0MycmxjOEdjTjB5am9HZWFRMFNRbDBTVjhhRmVweTRFZkdqWXFGWjJETFRuZlZuOS1JbTR4aDhrRnMzdHlGX0lDUWh1cG5iQTE1UXhUeW5fRQ?oc=5
2025-11-13	Google	0.0	GE Vernova Inc. (GEV) is Attracting Investor Attention: Here is What You Should Know - Yahoo Finance		https://news.google.com/rss/articles/CBMigAFBVV95cUxOS3dMVTFtM3hJVDhORXVLeFJhV1ZOMTAxbXlOdGhqVHpXSERYU0NlRHU2OW81V2RsTUJLcjFuaTZVeW80SUFhcVhubmJhd0YyVzE3Z2EzVlV6UDVNU2NhT2h1cjFVNUlja0lqVHNyaUR3ODJSTS1Db2U4SjRDTWVsYw?oc=5
2025-11-13	Google	-0.156	$GEV stock is down 7% today. Here's what we see in our data. - Quiver Quantitative		https://news.google.com/rss/articles/CBMioAFBVV95cUxNbndsTHVyOURDcThGMkhBcC1HZUVUN0ZJYm1kUGlrem5MSzhWQVFzV2J1RWhUbEpwNUtSX0o1bTVtd29JUE04d0JtQzVQcnNibm9LN0UxcVJSSUsyWnlDeDZqR0NPWS1iWVY1Y3VsRnRXb1d2ZlVrWjBVTzF4dTljSVRPeDNxazhWbTJ1R25PWXlnSy12WHNhZkxSS09VaV9j?oc=5
2025-11-12	Google	0.0	GEV Rises 38.3% in Six Months: Should You Hold or Fold the Stock? - Yahoo Finance		https://news.google.com/rss/articles/CBMickFVX3lxTE9aWU5MMnFCYTFqaUtsTTZab3ZyaGdoTnhyUXVmVFltYkhBdk00MGxEOVppNTFwbmdUUERyLWFoYWpFSU1SYVdIM09BeTVYMVpLUndVb00wSGYwNHBNX0lTcWNvWURoVjBSR3BmejNfb0pvUQ?oc=5
2025-11-09	Google	0.0	GE Vernova Stock (GEV) Opinions on Recent Share Price Pullback - Quiver Quantitative		https://news.google.com/rss/articles/CBMioAFBVV95cUxPTVFqX184MmVMeEVCZ1JXeXUxdjA2OGVDS0R0V3JVRFpaam8zY1lsdmE4VlkyTm9BbnpBYTZuS2FZcXl0UmttNC1jaWNic05FcThpYXNpRF83WVg3M2RhelQyM3M1Vm41eGxONFRkS1FzejU2RUptaVMzemlBZlBuSy04ektHems2VjV6U21neF90SEpFY1ZXT2lsZDk5bUxK?oc=5
