Date	Source	Sentiment	Headline	Summary	URL
2026-02-24	Google	0.0	Chevron (CVX) Valuation Check After Recent Share Price Momentum - simplywall.st		https://news.google.com/rss/articles/CBMivgFBVV95cUxQQ0xJaWRGaE1NWklmbm0wOGRZLXhROW54T1RRWTBBLWJjOEg0bnpBb1ZVRWU4Zmh3ODI4eHJsQ1Z3TVVxOFFMaS1zN3BwcG0tOUxGTzN4STVhM2ItZHNDcWxHeXFkazZnR2tEZmlKV0VxcFpQY0hEYzBEdmpadkpwUXZHLWNCZGtCWnB3blh3bmpiemZfU3NoVzE3X2hGY2tRR1lvVDhxVkJnRDdZZDlBcm54dEpKM2ZvemFweXB30gHDAUFVX3lxTFA3cHJxRnhXT2VXREdlS0Q4cktQOHFFMWNENmFNMzdZbFdqN2hWM00wcXp6QWloZEc2cnpXUUlydVpUVWpfUE1zSUlBUnZ3NmJ2cWkzZ2xVWHFtR2c4OFctbUtzYm1DcXlFWVdqQ3liVW1aelhYSWdybFRhb3JPQ3FzOFp4QlRHaVcySzVOTVp2LTJuUGVxMkphdGd1dDl4Mm82d0w3a1F4OWhSMUdibktfN183MzE4aGdMMGNPZ3RzbHdYRQ?oc=5
2026-02-23	Yahoo	0.8	3 High-Yield Energy Stocks to Buy in February	With yields of up to 6%, these three reliable income generators are still attractive buys as February draws to a close.	https://www.fool.com/investing/2026/02/23/3-high-yield-energy-stocks-to-buy-in-february/?.tsrc=rss
2026-02-23	Yahoo	0.3	SM Energy Announces Divestiture Agreement Worth $950 Million	SM announces selling South Texas assets for $950M in cash, using proceeds to cut debt and fortify its balance sheet amid commodity swings.	https://finance.yahoo.com/news/sm-energy-announces-divestiture-agreement-160300893.html?.tsrc=rss
2026-02-23	Google	0.3	SM Energy Announces Divestiture Agreement Worth $950 Million - TradingView		https://news.google.com/rss/articles/CBMitgFBVV95cUxQZUVSeWNERGQxVGJYUTR6Qi16NzJQTmktUVlwcnViczExMTNkTHVucG9yM1NKTW02eGg5REo5bFctYXA4X05hN3pwdkN2ZWN3XzB2SlFtNFhud0RUb0kzWkU3bE1XTVI2U0ZHZEJIdWppRWFOOERfQlpOb3JHR3JoeVp3QjR1RnByTnVNZGVyNDlQcjljNWpZdVBzS3BKZnQwaG5VTTZuMXZsc0EzU1hHbkxCVHZoZw?oc=5
2026-02-23	Yahoo	0.267	Chevron (CVX) Gains Bullish Outlook as Exploration Spending Rises	Chevron Corporation (NYSE:CVX) is included among the 14 Best Warren Buffett Dividend Stocks to Buy. On February 17, Melius Research said Chevron Corporation (NYSE:CVX) could see upside as exploration activity picks up and the market overlooks its potential in Venezuela. The firm upgraded the stock to Buy and raised its price target to $205. That […]	https://finance.yahoo.com/news/chevron-cvx-gains-bullish-outlook-014857470.html?.tsrc=rss
2026-02-23	Yahoo	0.25	Market Chatter: Chevron, Exxon Buy Saudi Aramco's Jafurah Condensate Cargoes Ahead of First Export	Chevron (CVX) and Exxon Mobil (XOM) have purchased condensate cargoes from Saudi Aramco's $100 billi	https://finance.yahoo.com/news/market-chatter-chevron-exxon-buy-103618571.html?.tsrc=rss
2026-02-23	Yahoo	0.25	Sector Update: Energy Stocks Edge Higher Premarket Monday	Energy stocks were edging higher premarket Monday, with the State Street Energy Select Sector SPDR E	https://finance.yahoo.com/news/sector-energy-stocks-edge-higher-142322660.html?.tsrc=rss
2026-02-23	Yahoo	0.25	Sector Update: Energy Stocks Rise Monday Afternoon	Energy stocks were higher Monday afternoon, with the NYSE Energy Sector Index rising 0.3% and the St	https://finance.yahoo.com/news/sector-energy-stocks-rise-monday-185039779.html?.tsrc=rss
2026-02-23	Yahoo	0.021	Chevron Moves to Acquire Lukoil's Major West Qurna 2 Oilfield in Iraq	Chevron has signed a preliminary deal with Iraq’s Basra Oil Company to discuss the potential acquisition of the West Qurna 2 oilfield, formerly operated by Russia’s sanctioned Lukoil.	https://finance.yahoo.com/news/chevron-moves-acquire-lukoils-major-130000883.html?.tsrc=rss
2026-02-23	Yahoo	0.003	Saudi Aramco sells first Jafurah condensate cargoes to US firms, India, sources say	By Florence Tan and Siyi Liu SINGAPORE, Feb 23 (Reuters) - State energy major Saudi Aramco has sold several cargoes of ultra light crude oil from its $100 billion Jafurah gas plant to U.S. majors and	https://sg.finance.yahoo.com/news/saudi-aramco-sells-first-jafurah-062054535.html?.tsrc=rss
2026-02-23	Yahoo	0.0	3 Stocks Warren Buffett and Berkshire Were Gobbling Up in Q4	Berkshire leaned into DPZ, CVX, and CB, favoring franchise royalties, upstream output, and insurance float over high-growth tech bets.	https://www.barchart.com/story/news/360791/3-stocks-warren-buffett-and-berkshire-were-gobbling-up-in-q4?.tsrc=rss
2026-02-23	Google	0.0	Chevron (CVX) Moves Closer to Acquiring Iraq's West Qurna 2 Oil Field - GuruFocus		https://news.google.com/rss/articles/CBMiqAFBVV95cUxNRzVQNkxCRmU3VFR4UHV3OWRWaGN3d1RRZ2VCVEdNdUZLRkRMRVZhRVB1RnRyNE5yS3QyZFp3cVhEMTI2ZTMxdWpqLVNMejZrVGd0Vk9VM1B5UGhYQllYMG5DOEJnMkVWMXBTUVBpb1QyVHB0ck9xWXBULTZnbXRvaDhfeEVwLUh3aXlnN3ZKYUJnai04Zm95dldNbUdFLVNpOVdYaFlOQkY?oc=5
2026-02-23	Google	0.0	Chevron Corporation $CVX Shares Bought by Kovitz Investment Group Partners LLC - MarketBeat		https://news.google.com/rss/articles/CBMi1AFBVV95cUxOdGd2LUlCaHdOaS1NeHQyeFg2OHRyN2JHcjBhNk1iM05VbDAtWmNYX3dIMks3a2NaT2FrOTM3SlV4eVZTRTBfWUZhb0hzbHpWcUl0c2xQMERMMkRNU09ncC13VGl2N1hCNmoyNFhWN3dyRHlQTDFiSGxuRWVmT3FTNHI3cmY4SXVRTmJMMU83eXRvVmpoNzItYkhSZkozemhLNVNiRHlyWEV4WHNWenZGLS1IX1lHblF2ZWxJZ2tDQjhwbjlSVjdNdVczLU43Zmhkd00xTQ?oc=5
2026-02-23	Google	0.0	Chevron signs initial deals for stake in giant Iraq oilfield held by Russia's Lukoil (CVX:NYSE) - Seeking Alpha		https://news.google.com/rss/articles/CBMivgFBVV95cUxPOUp6UWlURzZ2bDZFTVpqVjdnS0NMUHBSTFhiUFVHVF9jVUV2aFh2OVlzN3NKWFNwX3pocFNTRHk1T1BWSzZhd0M2Uy1zNHhxVXIxVmg4VzhhQk5JTVdEdU9JVDVSbGtIWG9vZHhzTVVHSWc0bVJRWmJfZ245VkhfNXBiTUZxeTN2NXpNVVUtQmZUWkhDYmcweXpYM3VLTW9BNkM1LXhjYW5EZC1EMnhVRmxXTk1FaTNqdGxNcDNn?oc=5
2026-02-23	Google	0.0	Hillsdale Investment Management Inc. Boosts Stake in Chevron Corporation $CVX - MarketBeat		https://news.google.com/rss/articles/CBMi0gFBVV95cUxPcWg3ZDJpSF9zMjljRmUwVFl4c0N1U19pMG9faTNMQWlzeEswTVpYa2doSHNjNFVnaUxyaG9UNGhZRno5X0stS0U3QnY5a2NmYnFfX2ZwMmhnejE1NERDSmdtbzNCN2lvZExVcEg5aVp5OC0ybmFld3JzOTk5LUx0dDlvelItVk9XUTk4ZmJoSmZXODU1RU9ab0ZvdjBQSEtnRlRLbDNoMFhpanZZSGpha2RiUUc5ZnFTWVVHR3JQQUs5R0hfMEhmZHBNaV90R3VxY3c?oc=5
2026-02-23	Google	0.0	Legacy Financial Advisors Inc. Boosts Stock Holdings in Chevron Corporation $CVX - MarketBeat		https://news.google.com/rss/articles/CBMi1gFBVV95cUxQX0FoOWxFNTJUU2lVV3JqZEUwWUpUc2hpdXNFdVNBcWdaRzFLTlIzbFhuLTNwZWVMWjZkb2RnT1ZOcWRGY3doWTM2R1BBQTFUOEFXUG5CMzNVZFVJUEN0N05WcFVRZW1Xdm02MU9Cc1E3WnJkbzEyR1k2OFN2b05XT0tKVjdLdHk5T0dnN3c2VnphaDV1c1V0YXFfVTZSNERNWFdXdVBIMWVTdnFRYnQ5dWZEVnE2X05XVmtfanVJSFRzYTRUTDhBNHg4empVNUJJdEU2Z05n?oc=5
2026-02-23	Google	0.0	Payden & Rygel Grows Position in Chevron Corporation $CVX - MarketBeat		https://news.google.com/rss/articles/CBMitgFBVV95cUxOdnExV2dwNlBOUzh1NTd5Q0FCR0RKTV9JSDh0cDNjVGJhTzgwSWpobWZuMkJPcFFqTmp6dktYWWtSeVZNVlRFOEN5eGd0VXpENVNnc2VCM3JWelFTT2RIb0tIWDAwdEVUcGJRR3NkR0EtcnAxWHFMUjFqcVBmM293VkxQZGpIbDJVVWFYdWJGelZ6NkhFakIzLVpSQlNzOGxGTUZaRGNwTFM4NUkxVnhkZk5TZ1J3dw?oc=5
2026-02-23	Yahoo	0.0	Saudi Aramco begins Jafurah condensate exports with sales to US and India	Aramco may export four to six cargoes per month from Yanbu port, each comprising around 500,000bbl.	https://www.offshore-technology.com/news/saudi-aramco-begins-jafurah-condensate/?.tsrc=rss
2026-02-23	Google	-0.05	Chevron (CVX) Gains Bullish Outlook as Exploration Spending Rises - Insider Monkey		https://news.google.com/rss/articles/CBMiqwFBVV95cUxOVVR4Q3dNTWptSGlCVEdUZmNzZEZPbDBWSHZyNlNMZGI5TEJBNnFsOWQ3TFJ0VUsydWRiV2N6Nmd1RlJCTnlZWmFEOERoMk15b0JoLUpqZU1Pc3AyOExSbkdGZ2tBdzFvNGJadDNsSDdfTkl6bW5PQy1Wa3AyZ0F1TDlyY3FkaWw0MzhYSVpoS256cGpaQVhUS21KRFlubklWUnNHQTZZVTJjNDDSAbMBQVVfeXFMTTlHNTJoZDJiLWU4Qmp0enAwZFJCMmZVbXV3ZlRUcnUxX3BiWWtUQ1pyNi1Oc2c4ZzVjM21rMzNEcURuSFZBWUJwQU9VNGxZQlFYVUVMNzNiLWRKZllGZGhNWFVyR3BRZThSdWdhU0xqYlExRFZmTXNoSFVXT2RIY3lxWGFXYUpmZF9aZUo3aFBQejNiRnotMUd3RjIzaVJHcDRXTHV6VkhsWnJPTjZEWlgxRE0?oc=5
2026-02-23	Yahoo	-0.075	Chevron, Iraq Enter Exclusive Negotiations Over Giant Oil Field	Chevron is entering exclusive talks with Iraq's Basra Oil for a stake in one of the world's largest onshore oilfields, West Qurna 2, the company said Monday.  Iraq took control of the oil field in January after the U.S. imposed sanctions on Lukoil to put pressure on Russia to end the war in Ukraine.  The sanctions forced the Russian oil company to declare force majeure at West Qurna 2, in southern Iraq, about 40 miles north of Basra.	https://finance.yahoo.com/m/e7c145d4-91fd-306c-a66b-d54a3270c9dc/chevron%2C-iraq-enter-exclusive.html?.tsrc=rss
2026-02-22	Yahoo	0.55	‘Money's moving out of tech’: Wall Street weighs stock market winners amid the AI scare trade	Investors are rotating out of the most popular tech stocks. Here's where they are finding gains.	https://finance.yahoo.com/news/moneys-moving-out-of-tech-wall-street-weighs-stock-market-winners-amid-the-ai-scare-trade-160024597.html?.tsrc=rss
2026-02-22	Yahoo	0.208	Chevron (CVX) Valuation Check After 52-Week High And New Offshore Expansion In Greece And Libya	Catalyzed by a fresh 52 week high, investor attention on Chevron (CVX) now centers on how new offshore exploration leases in Greece and Libya, sector rotation into energy, and consistent dividend growth intersect. See our latest analysis for Chevron. Chevron’s share price has climbed to $183.93 after a strong run, with a 30 day share price return of 10.32% and a 90 day gain of 22.82%. The 1 year total shareholder return of 22.49% and 5 year total shareholder return of 126.50% suggest momentum...	https://finance.yahoo.com/news/chevron-cvx-valuation-check-52-231126672.html?.tsrc=rss
2026-02-22	Google	0.16	Chevron (CVX) Stock Hits 52-Week High as Insiders Cash Out - CoinCentral		https://news.google.com/rss/articles/CBMiiAFBVV95cUxOcTlid3Z5emJCN3B6REFTbUEzQnIxMGNTMzBsSXF4ZGpaSndDZk9wdVNGd0VmWVZXbjRnSmlKYnpnY2ZoRVJ5RlJPWXJvQWNPTmtLak1OOG5uMGJjN2d2bk5PbWxrVEVadjBJUTFUMGpmdFRadTJuQzdqd3ViQTFTOXZ2MGxKaVhv?oc=5
2026-02-22	Google	0.136	Oppenheimer & Close LLC Makes New $3.92 Million Investment in Chevron Corporation $CVX - MarketBeat		https://news.google.com/rss/articles/CBMi2gFBVV95cUxQa0dVZ0NfclVTamZFNnB1Z0FnU2VoOEEzMTFYd1FBZVRra2tLTnQ1cEgtMnYxWDRyeEl4Sk9tampHd2t5MTFFSlZNUlVUWDF6TVJCS2R2cU1xcUN4OTFZVzNiZW5pZzZhWm9teDBURks2Ym9tcTBKSE5lZ19XZEJJMHZOeWo0bGsxbmt2XzRRWktfbFhoTHRfRi1ndWp0dWpQNU1lOXJMRHVXU0lxSUdwWTQtdklzNWpBQmx3bTBKM1MzWExCNlRjVk1JVDU0eWdkaFlYbTQ0SFd0Zw?oc=5
2026-02-22	Google	0.0	Bleakley Financial Group LLC Has $10.32 Million Position in Chevron Corporation $CVX - MarketBeat		https://news.google.com/rss/articles/CBMi2gFBVV95cUxNMi1rUmk4NHdUck1pSDRFWUZNS0dzR29oMmZpbzQzZ2NfbWpYd1NoZ2x1WFhHbmxHZU1tUGlOWmlJMldQemx3LTduZTQ1NjVWTUxTUnl2Z1NONXN2MHFOZFpUNXZfejBSMmMwbmxrdHJMNWlSQmNubndiRkZHcUU1QlVLejAwbGdhbk5DSHBEZG9RTUI1cnlLTUtOaDg2czFVMjV4UVlFWHcxYjNvUG9YcHZ3b2NqQXc0SVdid2lGQzREX3FidFZpWExYbUFhS0w4dHZPVjlqdUwxdw?oc=5
2026-02-22	Google	0.0	Chevron Corporation $CVX Stock Holdings Boosted by Partners in Financial Planning - MarketBeat		https://news.google.com/rss/articles/CBMi2AFBVV95cUxOV3ZURm5tSXo4VE5ob0w5MmFwVHgtYjNOazc5c1lUd2RwaWVLZ3hjUENqdXNRVV9BVENwa1NKVVZ6U0FIb1hvV1FSQlVhU0FUZXpNOVpCajBqRjhJZWlrMDhtTWpIc3VjMkpNUS1kaG1MTDBhZjdfd3MwZTBuZTBnSUtDaXBlWjJSbWdJMWswOC1FeEZKRWE5Wkd2Z3d6bk5Yb1VTSnFfQ2pqdHlTa1g3cU1RMDZqMVh2b3hfWm9lbVBlMWVmRmtlZE8wUVNOVGtDYlZxVnBFUnY?oc=5
2026-02-22	Google	0.0	Chevron Corporation $CVX is Inspire Trust Co. N.A.'s 10th Largest Position - MarketBeat		https://news.google.com/rss/articles/CBMiygFBVV95cUxPSlg2VlhpZE1FV2N0NVJscDJhUncydjJobUtrWTk3QnBVSUpnUjBJVHJGVkUzQ04wbEZiT3VIVDZUUkZKNHlWMEhmVWtwSGRJY1ZZa1JWcm54N3NaRk1oRE9tVVlpY0x1ZVd2aXdoQWMxb2d1Z2FwbWxma0pwb0xCWXh0RVpaTjBPZXlXczFyeVpCOTc2UFpxb0dNNHZORmhYbHhKT3FzZzJnTmQ2QmFlb1NWUlFud1BoUDZPTF9kMkNQYWZERkduM2h3?oc=5
2026-02-22	Google	0.0	Energy Giants Navigate Regulatory Changes - Intellectia AI		https://news.google.com/rss/articles/CBMigAFBVV95cUxNN0NsVHp5SlZsV3RTQmlwTk9JdDVCbjBVcmxOXzZSX0I0aUpScmdjUDI2ckVQU1pDVlk2UUJ0NjZWNmxpWnRLdFZPMDlEMW02ei05UW80VzJ1eVBCaEtUUC15cHdhTDNNaTFxcE1rQkE4M2kwVTVMcTNySXlzSl9wWA?oc=5
2026-02-22	Google	0.0	Sigma Planning Corp Boosts Stake in Chevron Corporation $CVX - MarketBeat		https://news.google.com/rss/articles/CBMivAFBVV95cUxNVUczWmNaOGVZTTdtYk45RUh5eDJIWk5RWksxaW90UGh3TXFvc2ctVWZxQm1NdzVCVnhYd3QybTJEbTZNaEg4endOOGt4dW1SSGh2UmI1LU9fanRtVnMxaFFIWmRMV3ZLY3ctSTltVk05ZXpMU2VRYVhEMk5IenNQUmlOaDlSMU1MSWwxdWdTN045ZEptVVVDRXV6a2VEdkdHQVgwZmZNOVRic2F6aXhDSnlpOFJidmtoOFZjNw?oc=5
2026-02-22	Google	0.0	Vestmark Advisory Solutions Inc. Buys 48,602 Shares of Chevron Corporation $CVX - MarketBeat		https://news.google.com/rss/articles/CBMi0wFBVV95cUxPY2VUYzdoTDk3UURtTlNIcXVlRm9Lb0lhWExNeE5TTnlONFAteWtqN3lIaUVqdmF0THV2VVV2YW1DMmZrV1VuTGhYX2o4WEpNcl90TzB2V2ZqVlhPWm9VaVNCRVl1azB1cUxGeGpzdldLLXVFRjVMSjJTZkVDbzFBMHdFeURFYlBsZWlqTzJiQnFMNU92QVgxby00SWVrT0o0R25OUVpZaHF6eFo1LTlDb2VKUFFrNmhJNGhHZVRnaGI4aHJhNmlWaTdDOEVGYWdBMHpF?oc=5
2026-02-22	Yahoo	-0.013	Global energy giant joins Chevron in major Venezuela oil push	Repsol may not be a household name in the U.S., but that could change in 2026. It's one of Europe's biggest oil and gas companies, and a recent decision to double down on oil and gas production in Venezuela places it in the race with Chevron to tap Venezuela's massive 303 billion barrels in ...	https://www.thestreet.com/investing/global-energy-giant-joins-chevron-in-major-venezuela-oil-push?.tsrc=rss
2026-02-21	Google	0.6	All It Takes is $3,000 in Chevron to Generate Hundreds in Passive Income - The Motley Fool		https://news.google.com/rss/articles/CBMimAFBVV95cUxQSGJyeWdrRlR5Zkl5RkNrRWlobEdLY3dXdk1XeUJ3emxBOGI4ZDBndGJ6UzBFTXRES25OV2pSYng5LWFVSGx6YW52dU94VVVCd0t3MHo1VURoaUZVSUw3d2phSEFnWlNUWlJwUmc2Nkt4TXRxQkN0TjJpWFpvRHctZW9sNUFNRFFlcU5wS09KRXpXOG9PYzA4Yw?oc=5
2026-02-21	Yahoo	0.5	Is Chevron the Smartest Dividend Investment You Can Make in 2026?	If you're seeking income growth and diversification through the energy sector, Chevron is a top stock to consider today.	https://www.fool.com/investing/2026/02/21/is-chevron-the-smartest-dividend-investment-you/?.tsrc=rss
2026-02-21	Yahoo	0.0	All It Takes is $3,000 in Chevron to Generate Hundreds in Passive Income	Chevron is a top-tier dividend stock.	https://www.fool.com/investing/2026/02/21/all-it-takes-is-3000-in-chevron-to-generate-hundre/?.tsrc=rss
2026-02-21	Google	0.0	Barings LLC Grows Position in Chevron Corporation $CVX - MarketBeat		https://news.google.com/rss/articles/CBMitAFBVV95cUxPaVJlTmkwcVpwaFlOUTdRM005SXpUR1czcGFrM0IwWnluRE1aM1lYVGNoaUtSZnlPVkRVMGpFMDJ3LTNfa0VnMUQ5QzZ5M1RuN0phZlJtTXdzWklZTTVtUXJLQm0wZjJJTWJURm52Mlk5LVRJamRDeGZiR2trMnV2Q0JRLU9tYWhoTmlfYjAxT0xtNmZDM2FSZ0hIQTNTelNfTmxVVUtENkwySm5nRzNyVVpRMHQ?oc=5
2026-02-21	Google	0.0	CVX Stock Quote Price and Forecast - CNN		https://news.google.com/rss/articles/CBMiT0FVX3lxTE9MaTZwb0FqZ3Z2ZnE0Z3JRWHBSSEp2WVE2akwyUGVQd2xQVnVkWkVaVlJNSnNXNGx0S1pNVnRtbkRnTXdPVzczMXgwSkM3bFU?oc=5
2026-02-21	Google	0.0	Personal CFO Solutions LLC Boosts Stake in Chevron Corporation $CVX - MarketBeat		https://news.google.com/rss/articles/CBMixgFBVV95cUxOQ3FnaXpjaVJqVEJFWGRsRUNNckE3V0d4TFZTY05PcGhwVHU3REoyQWFQY3BVMnlRMnNhU0dPcklsWXVPcmZQMjNxaVQ4Y3Rxemd6NEJGUl9lbzE5bC1YcUJSc2NYVUdFNzJNSFZJbFJjemJ3dUlhb1NZUzdyWm9NMDNJenN1dkZhTFdSVlo2ZzA2TElZd0NwWWFjQ3ExbjBFTlFQMlpWS1kwdWdaZk5lYldFYjFQWmdXdjFJaFZVY2F5QU9MR3c?oc=5
2026-02-20	Yahoo	0.15	Industrial Robotics Lubricants Market Size, Trends and Growth Outlook 2026-2030 Featuring Shell, ExxonMobil, Castrol, TotalEnergies, Chevron Corp. and More	"Key opportunities include the demand for precision robotics, IoT-enabled systems, and nano-additive lubricants. APAC leads due to robust manufacturing and robot installations. Industrial Robotics Lubricants Market Industrial Robotics Lubricants Market Dublin, Feb. 20, 2026 (GLOBE NEWSWIRE) -- The ""Industrial Robotics Lubricants Market"" has been added to ResearchAndMarkets.com's offering.The global market for industrial robotics lubricants is projected to expand significantly, reaching $16.2 bill"	https://finance.yahoo.com/news/industrial-robotics-lubricants-market-size-125100727.html?.tsrc=rss
2026-02-20	Google	0.0	Chevron (NYSE:CVX) Insider Sells $441,338.24 in Stock - MarketBeat		https://news.google.com/rss/articles/CBMiowFBVV95cUxNQUtwQXVhd0pGcjBLMGt4NmFkYXN5VktDQUh4dk9fVGpDand5dnVoOWJBd2JIX2pNSVhSYVVKdlFpZjlsNS1kQnF4b2hzTm95RFV0c3JRSU5NWkV0V2xITkhMUWhnUmFydDBUWGl1OEdSVGRFT3JiMU91amk1cVotVkh4Y1BUMTAzRUxxT2l4SGRRYUpJQ2VoSXV0ZEFMcnoyaGZv?oc=5
2026-02-20	Google	0.0	Factory Mutual Insurance Co. Buys 347,567 Shares of Chevron Corporation $CVX - MarketBeat		https://news.google.com/rss/articles/CBMizwFBVV95cUxPSGhEMVFMc0N4SVZJMUVXZEQ2ck5qSUU4elp5UTNhVkJ5bVBsSzljaGVONmMySmh6cjY2V2haU3QySldQekR2N1RDa0xDdjlhQ0ZXQmlnQXUyYTU0dnVkV3FqSVJSZ1R6YTR2ZzdGU0RSWnl4ajFvRThZV05YYlZKWDlUUlJZRFpleTJDTV83bWxwUTU5UUlOa0t1bFp0cVdyczdwRXdBSm5JR3N4dWkxaVBENGJ3ejg1Z0t0ZW9ldWowRkpHbkcyOTFSUWtJSTQ?oc=5
2026-02-20	Google	0.0	IWD, PG, CVX, BAC: ETF Inflow Alert - Nasdaq		https://news.google.com/rss/articles/CBMicEFVX3lxTE5DY2ZELXRXZFd3Q1lVdEE3Vm1kWURVNGFGbHlRSkktcVBtQnphaU9tNHVLWmhOb2RtbXFoaWhNTk9WMmNSUlZFMjBjRDF3Umx3RkFGSEJab2V4b3loenNmZFRRMXZTSHNsaHlPOFpQM2o?oc=5
2026-02-20	Google	0.0	Insider Selling: Chevron (NYSE:CVX) Insider Sells $268,943.29 in Stock - MarketBeat		https://news.google.com/rss/articles/CBMiuAFBVV95cUxOaHowY0NIdmJZdzh4NVhkdDhYSGU3YkttUHhqZm8wMTBwVC1wN0hQVHNpN2dWTktvRXBHbndnTHNDbENzdlRNMnhiVVJhMWVYQTFjUC0tY1VjZEtBQzd1eEpnNlhoWGtCMnR3X2xZQjVCLXk3eTNCYkg4bDFHSjkyRFBIX1NuUWZZbW91RHYyWm1lS2VDYUhiaG5BWFRsVUFtOGhuakR1blVqWHBKWExuT3VxYXpYa1hG?oc=5
2026-02-20	Google	0.0	Kovack Advisors Inc. Decreases Stock Position in Chevron Corporation $CVX - MarketBeat		https://news.google.com/rss/articles/CBMizAFBVV95cUxPaFBGYlBYUFRKdkktMFBxcG92Y2RrdkpZbnB3bFphbkFqbDBzbXpPV0VSdlVvbzA2VG5DX1Z2aGFRcVdLeXRGYnRib1I3Y0F1OWRzdVc4N25FUG01WHRsUndxQWZtemFZSUxqd0U0RE5RUU15TFVJT09BTUJfVGwwcWhXSTUyRjczdU5GWVpTUVVWbEwzVVVNSzNaajlKak84bFBBSUNmMkt3d21yb3E3RmpxTzFaSjBMMTNORGIwR1IzNkpLU3ZzaERrZWo?oc=5
2026-02-20	Yahoo	-0.011	Trump And Iran Put Oil Prices Near Six-Month Highs But This Energy Industry Was Already Rallying	President Donald Trump has set the stage for a possible military strike on Iran, presumably to pressure the country to meet demands for a nuclear deal.  The resulting tension between the U.S. and Iran sent oil prices near six-month highs and boosted some oil and gas stocks Thursday.  U.S. oil prices traded less than 1% lower Friday, holding above $66 per barrel.	https://finance.yahoo.com/m/e8b1178a-3447-3c3e-819f-5e7f9f9a4939/trump-and-iran-put-oil-prices.html?.tsrc=rss
2026-02-19	Yahoo	0.643	The Best Warren Buffett Stocks to Buy With $2,000 Right Now	These three high-quality stocks each have Warren Buffett's seal of approval.	https://www.fool.com/investing/2026/02/19/the-best-warren-buffett-stocks-to-buy-with-2000-ri/?.tsrc=rss
2026-02-19	Yahoo	0.483	Chevron Expands Mediterranean Reach With Greece Lease Win	Chevron (NYSE:CVX) on Monday disclosed that it is expanding its exploration portfolio in the Mediterranean region. In particular, the company inked lease agreements with the Hellenic Republic for four offshore blocks in Greece, enhancing its exploration efforts in the region....	https://finance.yahoo.com/news/chevron-expands-mediterranean-reach-greece-173054417.html?.tsrc=rss
2026-02-19	Google	0.4	Retirees Are Winning Big in 2026: 3 Popular Dividend Stocks Are Soaring - 24/7 Wall St.		https://news.google.com/rss/articles/CBMitAFBVV95cUxOamxRQldmMWNIbTBpVkRZOE5vaElqbm1KNEktbDZ0cXZ5VlZsSkEwT0pUVVREY1oyNXAtZUNjMWZKVzUwY0ppZkcxRkwwYVUycDR4TVZrcWdFUFRndTVSNURKUFFib0lmTHUzQWd5WFdaMHdRZ1o4NEVLaGF4RzIteXpOLTNOWnpvNmhvdk43NElFbG52NWJnRVFNUEZiUXJsZmYyWTFNVHRqZ0pLLWs1N25ieG0?oc=5
2026-02-19	Yahoo	0.375	Occidental Stock Heads for Best Day in a Year. It’s Not Just About Oil Prices.	Occidental Petroleum stock surged Thursday after the energy giant posted fourth-quarter earnings that topped expectations.  Occidental posted its latest earnings after the bell Wednesday.  ConocoPhillips  gained 1.4% while  Chevron  and  Exxon Mobil  were up 1.1% and 0.8%, respectively.	https://finance.yahoo.com/m/c88a3b34-9ab8-3030-b105-c6d16583aec4/occidental-stock-heads-for.html?.tsrc=rss
2026-02-19	Yahoo	0.332	Retirees Are Winning Big in 2026: 3 Popular Dividend Stocks Are Soaring	Retirees watching their portfolios in early 2026 have reason to smile. While tech stocks stumble, dividend stalwarts are delivering steady cash flow and capital appreciation. Consumer Staples (XLP) is up 13.3% year-to-date, while Technology (XLK) has dropped 2.1%. In a year when growth stocks are catching their breath, dividend payers are sprinting ahead. We ranked ... Retirees Are Winning Big in 2026: 3 Popular Dividend Stocks Are Soaring	https://247wallst.com/investing/2026/02/19/retirees-are-winning-big-in-2026-3-popular-dividend-stocks-are-soaring/?.tsrc=rss
2026-02-19	Yahoo	0.136	Stock Market Today: Dow Drops Amid U.S.-Iran Tensions; Warren Buffett Berkshire Holding Soars (Live Coverage)	Stock Market Today: The Dow Jones index drops Thursday as the U.S.-Iran nuclear standoff persists. Carvana stock plunges on earnings.	https://finance.yahoo.com/m/9e3bb4c8-8cbc-36ae-813a-4288622e532b/stock-market-today%3A-dow-drops.html?.tsrc=rss
2026-02-19	Yahoo	0.13	Chevron Expands Mediterranean Exploration With New Greek And Libyan Leases	Chevron (NYSE:CVX) signed lease agreements with the Hellenic Republic to explore four offshore hydrocarbon blocks in Greece, partnering with HELLENiQ ENERGY. The Greek blocks are located in ultra deepwater areas of the Eastern Mediterranean, targeting new hydrocarbon prospects. Chevron was also selected as a winning bidder for an onshore exploration block in Libya, marking its entry into the country. These agreements expand Chevron's international footprint and add new exploration options in...	https://finance.yahoo.com/news/chevron-expands-mediterranean-exploration-greek-081702235.html?.tsrc=rss
2026-02-19	Yahoo	0.117	Crypto Is Crashing — 4 Investments to Try Instead for the First Half of 2026	The crypto market's recent volatility has left many investors reconsidering their portfolios.	https://finance.yahoo.com/news/crypto-crashing-4-investments-try-143804963.html?.tsrc=rss
2026-02-19	Google	0.107	Chevron Corp Hits 52-Week High — What's Driving The Move? - Benzinga		https://news.google.com/rss/articles/CBMitAFBVV95cUxOWS0wd054Rjl4ZFVDQmRBNnlVbUNXcVdsTGlRMF9DZUg1ZmFKOUFCMldwbEhqS1VrbkhMVVZ0dkQ0WERTTE9uNmZVWHVfYlVkM0d1a1hJdjU3bWExaW5rZjY4ZnJNZERWMkxOWjZPMkk0MzZrZHluNlNOZDhjVmc4X2Z1T25KY0ItR3BlQldjOGpxWUVUamtoaEQzRzZWUGNlN3UzWU1xVDZnUDM3SDFIalFHUEU?oc=5
2026-02-19	Yahoo	0.094	Latest News In Energy Transition - Hydrogen Infrastructure Growth Driven By Global Decarbonization Policies	"Global decarbonization policies and subsidies are major drivers of the hydrogen infrastructure market, fostering demand for pipelines, storage, and refueling networks. Key initiatives like the US Inflation Reduction Act and EU plans such as REPowerEU are creating a policy ""floor"" that lowers investment risks and encourages the advancement of hydrogen infrastructure as part of the broader energy transition. This growing focus on building large-scale hydrogen infrastructure is supported by..."	https://finance.yahoo.com/news/latest-news-energy-transition-hydrogen-113734294.html?.tsrc=rss
2026-02-19	Yahoo	0.077	Is Chevron (CVX) Still Priced Attractively After Strong Multi Year Share Gains	If you are looking at Chevron and wondering whether the current share price still represents value, you are not alone. This article focuses squarely on what the numbers are saying about the stock. Chevron shares last closed at US$183.87, with a 1% decline over the past week, a 10.6% return over the past 30 days, 17.9% year to date, 22.2% over 1 year, 30.2% over 3 years, and 119.2% over 5 years. Recent headlines around Chevron have focused on its role as a major integrated energy company and...	https://finance.yahoo.com/news/chevron-cvx-still-priced-attractively-070956994.html?.tsrc=rss
2026-02-19	Google	0.0	7,427 Shares in Chevron Corporation $CVX Purchased by Prospector Partners LLC - MarketBeat		https://news.google.com/rss/articles/CBMi0gFBVV95cUxOUFBFbkxQa0VLeWVRMkRQM0l4aHlsVVRoWWVMcWxodXlFMjZxTW9hdnlPRGZBRElhSVNaZThEejZ1bkFCWkFrMTFlM0NyRmxoUGxhTENLZHRWWW5yMlNfaFdRZ3NUcVlmUmJveE5vTnBUY2xQckUzc2FEdEtqbHlnLVFWZ1JPMnpjSElqYmp1RVl4NjlPYjAxUEdWdTdPRnF0SEVBcjRmX3FHTHlsMmJ5U1JocC1OU3ZuTW50U1RPcXNINFduWFNqcUxucnVkeHktdVE?oc=5
2026-02-19	Google	0.0	Analyst resets Chevron stock price target as oil strategy shifts - thestreet.com		https://news.google.com/rss/articles/CBMioAFBVV95cUxOUVpaWENDbVd4anIzY2Jna3d6WUltOFYzTEt6bGRBZDJOUzg4SGxKUzNBa3FhMnVkRFZRSWFXZFM2LVFtcERaU2xobU9uNm11SmdLNlM0NVV1dnVKT2hvOTFOZDdhaEhrNXNYb0FFMGp5cFZBY2VYTEM5aEdpUGc3U3VMbWFXSWhHaGdCVXEwYXdiY3J0bWxQakpiTmRUeFV6?oc=5
2026-02-19	Google	0.0	Caterpillar, Honeywell, and Chevron Lead the Dow Jones in 2026 - 24/7 Wall St.		https://news.google.com/rss/articles/CBMipwFBVV95cUxNRXlWeTluN0p4cUdHeld1aC1tMTd3c1RhRFJ6R09QYUdlUUR0U3hOdy12RkttR0N4TnFSbHYySlAyX05DTzFja2YtcjhaSnBxMTNhajF2MFVMVnEwcERwQy1tdEV1VDlmTmJEcXU1b2I1V3VKN00tb3ZYcDdjQUlZM2U0RTN5b0pycjQ0V2NxZ2Mwb0VNZkp4SUtSQ0FpOGlIVGlFSHk0dw?oc=5
2026-02-19	Yahoo	0.0	ETFs to Gain as Japan Pledges to Invest $36B in U.S. Projects	Japan's $36B U.S. investment targets energy, exports and minerals. ETFs like XLE could ride the industrial boost from this landmark pledge.	https://finance.yahoo.com/news/etfs-gain-japan-pledges-invest-143600724.html?.tsrc=rss
2026-02-19	Google	0.0	NewEdge Wealth LLC Has $12.46 Million Stock Position in Chevron Corporation $CVX - MarketBeat		https://news.google.com/rss/articles/CBMi1AFBVV95cUxPTUhGVzRYSWhRYS1BcjA2UkVNU3ZINnM0eFMtclBDbE5mSm9LZ3gtd29odU1DTDFvdDZVLXhGNFlHYS0xLXNyOXBMMHQtR1pfak92eXVIRXRlQmdWUUJ3ejZpMHVkRjJoQVZ3ZDBtMUpnd3NRV3R1cDJjeXg5eVljRTBMdjFsMzBhTlNBTzM1VEM2Mmx5bkJJQkFsTEFUZU95cTFCRDhmVHlObkRHcm5aeHg2cnpSX1pQUVQxTzZXaXdRV3BOR2dYdEl0azY1RnhEUjFKRg?oc=5
