Date	Source	Sentiment	Headline	Summary	URL
2025-11-19	Google	0.143	CVX or CNQ: Which Energy Giant Looks Stronger Right Now? - Yahoo Finance		https://news.google.com/rss/articles/CBMifEFVX3lxTE9ILUVOVGRNVFY2WTJJNXE1aHhJMmd6UlAzVHFqQU1hb2RsMDlINkZPQ1YxVUwxVUhRbURibHdEZEVVbkNnS3FaWTdtNWNxNHJfMXZIZnVuMlA4NVNaTzVHQnBNdEpxblBsZ2lWYTlMdTNfM0tCU3lMZUNiX3A?oc=5
2025-11-15	Google	0.133	I Always Recommend Chevron (CVX) To Anyone Who Wants An Oil Company, Says JIm Cramer - Yahoo Finance		https://news.google.com/rss/articles/CBMiiAFBVV95cUxNQ3VwYTdSLUQ5U3BGTFdzdFg0eHl5NjV5Mks5VHpRcTA0TlhIbmlsamZyTnhxMGQzUVV3WWdFdkEwYjhRWkdxc1kwYllLV0pBOEx6ellKOG1VUG84OThkUEJvNWNlUk5veVFwXzNQdmhtZWROQUUwN1RXS0xmcTBWVFV1Y3VrS2JO?oc=5
2025-11-14	Google	0.0	Earnings Troubles May Signal Larger Issues for Chevron (NYSE:CVX) Shareholders - Yahoo Finance		https://news.google.com/rss/articles/CBMiiAFBVV95cUxNZnJvTUVINUt2Q2o3eGM5S2tNYXVZdGF2SzItN1ctcHlvaVFKdThZMnlNc3QzNEdiQkotSlhKWnI3RHpSTzhZaDJBYWxpMDVrdUNzcXp0WERwT1d1UlBneU5FSnBtQmlmeXBQbnJMdEpMeE52bnRRdkJGQUpDMVZ2NmpzelNMU05f?oc=5
2025-10-31	Google	0.0	Chevron earnings beat Wall Street estimates as oil production hits record boosted by Hess acquisition - CNBC		https://news.google.com/rss/articles/CBMiggFBVV95cUxOYUtHaUltU2dlUEtGaEtvaFdyZTdTbGotWWs0cW9BOVdNUUFxekN4RzVBU0pKeTJtRk9jallLWHg3MzhGU2dEdlFyWjVITGJjeWJILV9Dc3FVZ2VnS0JNOHBnNFczQlg1QlRwcHNWdUVsTVFnajVsUXRtcldNcXQyMWVR0gGHAUFVX3lxTE1PTUgwYU1OMGVsb3FuUk9DWXZaTDBFMUVRdXllYlFWeU9FTUZ0cVVrX3JlMkhDWnIxbWhSSm1CRVIyLV90TG5iM2xjQ0E0QmZhRmpUc01XTUpMbGJLQ3A5Zm5XUExoSW1fX2k3cEVSelJkUS0yVk1GMmNCckNXX0tnYjBscF81Yw?oc=5
2025-10-16	Google	0.0	UBS Reaffirms Buy Rating on Chevron (CVX) Ahead of Q3 Earnings, Sees Long-Term Growth in Guyana and Beyond - Yahoo Finance		https://news.google.com/rss/articles/CBMihAFBVV95cUxPeUMyUk0zcWEzQTZWRGRqcHFnQzJKTzZlclR5RjdlQ2M5VkVNSFRjMC1ZSnJkbHl1NVhHOVVFNmZFUDVjbURuWmxrYi1OeDJLemxOblVQSDFqbFV4ZFMzbTZldEdvSTRVNjJCR2hrUjlWOU5HWkJwMUZGNl9JRzhXaGxjSWI?oc=5
2025-10-13	Google	0.217	Chevron’s (CVX) Strong Cash Flows and Low Costs Support its Growing Dividend - Yahoo Finance		https://news.google.com/rss/articles/CBMigAFBVV95cUxNUWZPSVdyamdrQ1l0LTh6MmJsQ1dRdlpRbXhFQUF5QmVuc0hOS2tqeUVzVE1ZcWtPb3Q5RVByelR1WDBGeVZxeE5naUtEUFRPOElHb0NwdTRfSE91YV9nQ0wtbWI0bUJsZTFrTnNsQnVvRFVBT09lQ3dSMzFkS2ZORQ?oc=5
2025-09-18	Google	0.167	Chevron Corporation's (NYSE:CVX) Has Had A Decent Run On The Stock market: Are Fundamentals In The Driver's Seat? - Yahoo Finance		https://news.google.com/rss/articles/CBMihgFBVV95cUxNMDAwUjRZLUxZYVQ1aERzYXVoZEg0dDhIbXNUWklHd2F1S242Nl91eVRlbGJCWFBGdHczbHZJRk1NdTBQVEZCY252blBKMEhxTGo2eTdESlM1cGJrdWI0WFo5OVRDNUo4SlFoNzRpVTBGeFRDT2V4cnhzMGxBWmRoVGh0QnEyUQ?oc=5
2025-08-26	Google	-0.083	Chevron Corp. (CVX) Declined Due to a Combination of Uncertainty in Oil Markets - Yahoo Finance		https://news.google.com/rss/articles/CBMigAFBVV95cUxPZ3BOU3JFbGpMRzhSZVg3VkhhMzJZbmtPVGFvejJWT0pwYnIxalE1ejB1MTRkbFFqNFp3cmF1a0tYWXpQRm5SRGQ1VGR4QWhDUy1BMXFJY3BsbDNWYndmcWsyT3BOdkdkYUlPWDd4aGRKOURBaGNxbkpJNG9oQWc2Tg?oc=5
2025-08-26	Google	-0.104	Here’s Why Chevron Corp. (CVX) Traded Down in Q2 - Yahoo Finance		https://news.google.com/rss/articles/CBMifkFVX3lxTE00c2RvRF95OXltMnUyU2RMX3dxRzBRcGE0OTkyQ0g2cEp1eGZnMFNLS2J4Wmg3cmw4a3FYc3htTEFxNWVVUmpPQmZpLUJ5Z1d2Q2puUEFkVVFpcUFYdVN1QmhQbi01WmFBTk0zVUdmQjhGdlVaX0owZE9aSGF0UQ?oc=5
2025-08-06	Google	0.0	Chevron (CVX Stock) Powers Through Q2 With $5.5B Payout, Permian Growth, and Net-Zero Push - CarbonCredits.com		https://news.google.com/rss/articles/CBMisgFBVV95cUxOdUFVVWhBZE5Uc0l5T3h2bjVId0JWdERyVnVRS1NrelRoNDZyd3lfT1dfQXhzSTQ2ck5BQUlfa0xnMDAyZkVGRU11NmcyQjNPMUVRQ3c4TU9GQklhSXZ6MWZUVldDWVpxSFlYUXVCdER3MjVlUkdTYkhxZ1FOYWNCdFlTd3lhZnpqQ3MxV0l5ZkRlVXZVb0Q0MlZCMC1QMm9HdkdXV1lhZ01pS3JqSkNka0JB?oc=5
