Date	Source	Sentiment	Headline	Summary	URL
2026-02-15	Google	0.0	Aberdeen Group plc Reduces Holdings in Chevron Corporation $CVX - MarketBeat		https://news.google.com/rss/articles/CBMiwAFBVV95cUxPOTBBVmtDLWZPUFlQNzVtLXJ4TUpWUHFlMzZKZU1IOGYtZEktbTZYQmgzT1JqUjZ2czdCZG40ZTZscFZaUWVuVHVaX01xbVI0WGo4OTd4VU5lM3ZWQ3pfaGNRZUd5emZPR25wcDNVNlZuTzhFdUpJY0Z0UmN6aFUxQW5LbXNCM05lVGVvU0dCVThEM3k3aGNDd21lclNnaThSNnZ5aTdwbzlUUUhXX0F0aERMeDQ2MUtBc3F4dWJ2d0Y?oc=5
2026-02-15	Google	0.0	Assetmark Inc. Boosts Holdings in Chevron Corporation $CVX - MarketBeat		https://news.google.com/rss/articles/CBMiuAFBVV95cUxNb0EtM004b0lmdy1qOTlydXRFTHdhWEtfVHRZcU9KUGtyMUtWbGoxZUlXdFVZV0FLZ3ctcFc3ejl4LUk3SGhmOTV6NlkxMWY1WHY2Z2huV2ZMZ1l4YTlVNkptUEVvN09aZVJHeU03a3Z2VnRjSk51cnY4RDR5ZVRQbWdyX0dZaDZCZ0hmeXZBTGplUTVWN1E4WGFGQ0FSd2VUOFN3RWxPM0daYkNZNlVjMzZlUE1MRkVt?oc=5
2026-02-15	Google	0.0	Calton & Associates Inc. Sells 5,609 Shares of Chevron Corporation $CVX - MarketBeat		https://news.google.com/rss/articles/CBMixgFBVV95cUxPVWItTkpvVHNPQmM1QkllVjZtLVNQclBCQ2lsSTRScUI0LTFQZlJ3Vkhlcm8tMTN1MnpRUlVGcXpLOF9YQ2NNWFdxd29faFVmYnJ5NklwSWFSU0M1TzRBckFHc05JNzBabnc2a3dET1hGb1pGekRBUXpYQ20yRGt5M05rdDNQYmczSTlmbkp4WEpURWtTTVhfS2J2TGVZRDNDZHZDVG5EYUVNamxZb3JUeTRwLThYOTR5Y1A2LWpRQnQ2b2dpTVE?oc=5
2026-02-15	Google	0.0	Chevron Corporation $CVX Shares Acquired by Berkshire Asset Management LLC PA - MarketBeat		https://news.google.com/rss/articles/CBMi0wFBVV95cUxNY0EtS2VEMjdqWDhLSnFnOVhrWV9tRHRVX3c2TFdVNzRxLTVCOWR0T3RGVkt4Wld5T0IwTTZxVmlPNk9fdl94eC1pc3dSdVdWUFJjQmk0aE1mdml4WjdBQ29zNnVtN1NZN25mOFlUNVRwY1ZrbEl2TXYwbzlSZlRoel9HLWtNOTVzNEJIZXdXcVdQUXBxZ3NkeHlDQ3ktakJsbkdzY1k3VzRNcnhER2U3b3ctdFV2SndzV0ZhNGpZd3BqNElxbExnazVYLXoxMHNMdXRv?oc=5
2026-02-15	Google	0.0	Chevron Corporation $CVX Shares Purchased by PNC Financial Services Group Inc. - MarketBeat		https://news.google.com/rss/articles/CBMi0wFBVV95cUxQODBwZ3VsNkNtOFBna09lZ0JtbUVfU28yR3VvWmxkOV9LS0xmME1URU9YZk0xdTlLX2I2bmI4UGhWdHBfMEJ1Q2ZTMy1zNjAxNkJxMUdNQjZKb18xelRSakljYzhQVlVEenBtQzlOcVhmOW1ZRUtEY1IzcnBJeGxPaFlua1V3MC1kS19nWUFyemdfeHFpUmRNODF6cHlSRDNvV1pEU21OcTJnUHRmUEZ3Sjc4UDlUQWZwZkZQcGdsa0RYYTc5NndYUzBqaFJvbzFEdEpj?oc=5
2026-02-15	Google	0.0	Chevron Corporation $CVX Shares Sold by HighTower Advisors LLC - MarketBeat		https://news.google.com/rss/articles/CBMivwFBVV95cUxOYV81aloxWHllbGpSMk5pV19uaWFXb1RuUVhmTEtvRmpIaVBtTFFuQS1zMERPU0RteHdKMGFCTWphNDJFSHZwcHJNYzZOVFF0b3JlcGNKeVFoaXd0bG93dlhQWGViWEhHNkF5UTVtZzJBbmNCS3pDdUpDY2tqWlFVYi1LTFZDa3U5STEzcXJCSGhpdXJ1MzBMYm1hcTZTWFNTaS03UTJ2VFZKTHc5VGZ6OHIwTUo0aGNEbDhhdjhTTQ?oc=5
2026-02-15	Yahoo	0.0	Chevron's (NYSE:CVX) Shareholders Will Receive A Bigger Dividend Than Last Year	Chevron Corporation ( NYSE:CVX ) has announced that it will be increasing its dividend from last year's comparable...	https://finance.yahoo.com/news/chevrons-nyse-cvx-shareholders-receive-130733448.html?.tsrc=rss
2026-02-15	Google	0.0	LSV Asset Management Sells 73,365 Shares of Chevron Corporation $CVX - MarketBeat		https://news.google.com/rss/articles/CBMixgFBVV95cUxQNFRiRG9iclRKYXBqMGZYakpuRUpXSlBLeGxlcXR4S3dySVhXeU1CWG5TOExLTmRHUGpMbTl4Q0ptV2dkLUZrbU9PYkRGeFNORFBoVHlDUWIyNHUzMDN0bTB1YVVUTy1wek5PNGNyd0tzUGZBQk0yNzdnejBRRXZ3UGdNQkVhOHMtbnFVWWZvOTQxaDJPbUZqcFIzZmFNVzlVU3JHNHVZQUw4YVZoZnZaaHBfS1R6SVZkZmpTTGRqUWlaaW1hUHc?oc=5
2026-02-15	Google	-0.082	Chevron Corporation $CVX Stake Raised by State of New Jersey Common Pension Fund D - MarketBeat		https://news.google.com/rss/articles/CBMi2gFBVV95cUxQMW1FdVVGa1NXaEJkWUlkZ1Z2aDN1UlRQa2tLZVN5eGV2SGFCNmk3SDVYOUxSLWpvYmxMUHhhaHlOMEVUX0pVZGEyMXI4UjRESFo5a3dQU1dqYmczTTNuLV8wNTVJVGNOSjdGTTloQ1BkSl9uSTdtSGxjQmptTnNPYUJqMUd6cHlwcHYxaXNtX0M4YkQwRDdZNjVEWk1aSG80UUJMR0VTUG4xdnhacURiX3NVV3A0V1hLWVc3ZEVtRy1NeGttbE5ZVHk3ZkxweUpfdk1WdkR4SHR5UQ?oc=5
2026-02-14	Yahoo	0.0	Chevron Reenters Libya And Expands Venezuela Footprint As Valuation Question Persists	Chevron (NYSE:CVX) has reentered Libya for the first time in 15 years with new exploration licenses in the Sirte Basin. The company is expanding operations in Venezuela after U.S. sanctions were eased and broader operational rights were granted. These moves follow international policy changes that reopened access to two oil rich regions that were previously restricted for many global majors. For investors watching NYSE:CVX, these developments highlight how policy shifts can open new...	https://finance.yahoo.com/news/chevron-reenters-libya-expands-venezuela-081140496.html?.tsrc=rss
2026-02-14	Google	0.0	DDD Partners LLC Lowers Stake in Chevron Corporation $CVX - MarketBeat		https://news.google.com/rss/articles/CBMiuAFBVV95cUxOUHU3UGg3RlVJMzRiVWpIOWZvNE5LbWRVRjkwTUU2T2hTeU9oU2VNdFN0R0N5OElMQ3kyMFA0QkNURjJkeUZNcVNGRjdoSzFxaU9ndW9pZnVsRThNcE85bTRLX1NqUmlJVVpKUk83MGIyOXBlT2VhUUpJaVNJUFNPUlVMTzVBaFY4bjdSTXlLUDNBTG9CLXI5SUhQMEkya0w0NnYtVUU4UU9MWEljZllsT2tWQ2FOU3Bm?oc=5
2026-02-13	Yahoo	0.5	Trump Greenlights More Oil-and-Gas Investments in Venezuela	The Treasury Department issued licenses Friday for oil companies including Chevron and certain European rivals to operate in the country.	https://finance.yahoo.com/m/f9e5cbd5-6d23-3e92-9325-64ddcc5e7fa5/trump-greenlights-more.html?.tsrc=rss
2026-02-13	Google	0.16	Chevron Sees Unusually High Options Volume (NYSE:CVX) - MarketBeat		https://news.google.com/rss/articles/CBMipwFBVV95cUxQb3VWdGQ1TGxEYWNjdlZFR3lYMjJBV01MbmREakxpbTBZNFRnMzZ3U19qTDR5Szc1SmU2dWxUdlR1Zk9DUTN0U180ODRCeFN0ajRQU19Da0RxR19sWU1LaEd3MVhkcWRpMjNkWFNYamVSVi1mbi1NUWlWbUQzbFUwbGxOVGIycVpRZW9xYkF0cndWckIwZGZ3cEpsaVdjeHR4dzJpMV9VZw?oc=5
2026-02-13	Yahoo	0.099	US allows oil majors to resume Venezuela operations, broadly okays new energy investments	By Timothy Gardner WASHINGTON, Feb 13 (Reuters) - The U.S. eased sanctions on Venezuela's energy sector on Friday, issuing two general licenses that allow global energy companies to resume oil and gas	https://ca.finance.yahoo.com/news/us-allows-oil-majors-resume-151828938.html?.tsrc=rss
2026-02-13	Yahoo	0.0	CEOs are still buying into the business case for sustainability, despite Trump’s climate rollbacks	Also: All the news and watercooler chat from Fortune.	https://finance.yahoo.com/news/ceos-still-buying-business-case-101507730.html?.tsrc=rss
2026-02-13	Yahoo	0.0	Exclusive-Venezuela's PDVSA selling oil only to individually licensed companies, sources say	HOUSTON, Feb 13 (Reuters) - Venezuela's state-run oil company PDVSA has refused to sell oil to companies without individual U. licenses in the past two weeks, four sources from companies seeking to buy cargoes told Reuters, limiting exports and preventing the country from draining brimming storage tanks ‌faster.	https://finance.yahoo.com/news/exclusive-venezuelas-pdvsa-selling-oil-170637369.html?.tsrc=rss
2026-02-13	Yahoo	-0.7	Exclusive-US refiner Valero to import up to 6.5 million barrels of Venezuelan crude in March, sources say	By Nicole Jao, Shariq Khan, Marianna Parraga and Arathy Somasekhar NEW YORK, Feb 13 (Reuters) - Valero Energy is set to buy up to 6.5 million barrels of Venezuelan crude in March bound for its Gulf	https://finance.yahoo.com/news/exclusive-us-refiner-valero-import-234051624.html?.tsrc=rss
2026-02-12	Yahoo	0.114	Chevron Wins Libya License as 20-Block Tender Draws Limited Bids	Libya awards five valid bids in first licensing round since 2007, targeting 2 million barrels per day by 2030.	https://finance.yahoo.com/news/chevron-wins-libya-license-20-192428993.html?.tsrc=rss
2026-02-12	Yahoo	0.0	Chevron's Permian Scale Drives Cash Flow and Efficiency Edge	CVX hits 1M boe/d in Permian, leveraging AI, vast mineral rights and scale to cut costs, boost returns and strengthen free cash flow discipline.	https://finance.yahoo.com/news/chevrons-permian-scale-drives-cash-174800273.html?.tsrc=rss
2026-02-12	Yahoo	0.0	US-led oil sales from Venezuela to bring in $5 billion in months, energy chief Wright tells NBC News	Feb 12 (Reuters) - Oil sales from Venezuela controlled by the U. have totaled over $1 billion so far and in the next few months will bring in another $5 billion, ‌U.	https://finance.yahoo.com/news/us-led-oil-sales-venezuela-215402892.html?.tsrc=rss
2026-02-12	Yahoo	-0.05	Chevron’s Libya And Syria Return Reshapes Long Term Upstream Risk Reward	Chevron (NYSE:CVX) has re-entered Libya with a new exploration license in the Sirte Basin after a 15 year absence. The company has also secured fresh exploration awards in Syria, supported by government backing. These moves expand Chevron's upstream presence into post conflict regions that were previously closed to many Western energy companies. Chevron's latest moves in Libya and Syria come as the stock trades at $185.82, with returns of 14.5% over the past 30 days and 19.2% year to date...	https://finance.yahoo.com/news/chevron-libya-syria-return-reshapes-221556336.html?.tsrc=rss
2026-02-12	Yahoo	-0.1	BKR Secures Gas Turbine Deal to Power U.S. Data Center Projects	Baker Hughes wins deal to supply 10 gas turbines for U.S. data centers, generating up to 250 MW in a long-term partnership with Twenty20 Energy.	https://finance.yahoo.com/news/bkr-secures-gas-turbine-deal-172500642.html?.tsrc=rss
2026-02-11	Google	0.091	Chevron’s new Libya block extends its North Africa exploration push - Stock Titan		https://news.google.com/rss/articles/CBMitAFBVV95cUxONnBQcG9XRFYyZHVHZVVpbzh6RmE4X0U0MV9waFh1RjFweGRIV3NZNWV2VERwN1VnVjNhOXBTOEZNLVNMT0xCRUF4M3NlcnNZclRham1JQVBoNW8yQUVzUkRfdExJMngzd1V5SjZtNXlvck1qcWoybEVuSHdsT3hDUGZ6NE5falUxRVpYX2RkVVVmVUlTZ1k3aWoySXktZnpPVHdITjZfaFV0clBJUjUybmFQdEc?oc=5
2026-02-10	Google	0.0	Chevron | CVX Stock Price, Company Overview & News - Forbes		https://news.google.com/rss/articles/CBMiU0FVX3lxTE9VRUNjVmdtU3VJcEZId1lzb2ZHcVdzVDYyVlNKT2dNUmZiZjhCeUFJZUthYW1qc2hzbnJwVWk1OFJNRkFzR1JCb245UnpjODJibWh3?oc=5
2026-02-08	Google	0.114	HSBC Downgrades Chevron (CVX), JPMorgan Stays Positive - Yahoo Finance		https://news.google.com/rss/articles/CBMiigFBVV95cUxOWU0wc3FpRVlLa1J0UHpjeFJ3TlZtZkJudklpX1ZfVzBvbDNHQUw5cjNrOWVTelpNa01OekVJX3NQTUQyOW1SVk1VSEkzUUhZemVJZFlyUVdBbVM5eWR5SGpSTHFmMWExVkRadGNNMXVUa29GVnBVSDFscU9KeV9mZkh2TzJHanJ0T2c?oc=5
2026-02-07	Google	0.167	Chevron Corporation (CVX) Gets Higher Target at Argus Research as Shareholder Returns Stand Out - Yahoo Finance		https://news.google.com/rss/articles/CBMiiAFBVV95cUxQTGdLZ2loVjRjS21ieTdkVFJ0eXNGVFhzMVByU0RJa1ZQcGtlV3VxZXg4Y2djUjl4NU5vQUtJcjB4ZW1BQ1E3QmlaMzlxUnZQY29DZ2dWT1ZpZjZ2YkFlVTRZVWo5czI4TldTT0FCLVBUMUI1WThnVHVvbUJwb2hDVnpXZWo2VnFn?oc=5
2026-02-06	Google	0.0	Chevron (NYSE:CVX) Has Announced That It Will Be Increasing Its Dividend To $1.78 - simplywall.st		https://news.google.com/rss/articles/CBMiwAFBVV95cUxNeVBNZHlxS3duTWhsU3dQT0ZKcnBRMEhmSl9TeXdGbzZmMGZxMVVBQmZORkNXWFVqUjNKTlhacGNzeEVEWlVYMldBMkVHcWFDTHl0Zk1rZmNLckcycFhXSFU2aDNkY19BRGpJLXduRlFNekRXbnRtc3RsekRRcXhWaEtlLW5vZWlBMzFFRlczQjQybXhXQXVIcjUzai1ySGR4b2xXeGxGeXpma0lEYWwyMVA1Q0F6U3k2ZDJVU014T0w?oc=5
2026-02-06	Google	0.0	How Recent Analyst Shifts Are Rewriting The Story For Chevron (CVX) - Yahoo Finance		https://news.google.com/rss/articles/CBMiiwFBVV95cUxNeGllZkZ6WXMxNUh4cGRBTmVGTVd5aFhCUmVVZmtzOW5PN1oxRWxMX2VKU2sySDhTa1ljLTk5LVY2eDgtUmtUblBJMFVNTnVJYzJsQVgzWXJoRmFfUEcxT2xWVVJuTVQzNGdMTUhsNF84RWNsem1vUjhhbGRsVnhBTENnZnZVTTBfS3VF?oc=5
2026-02-05	Google	0.2	Chevron shakes up top ranks as three veteran leaders retire - Stock Titan		https://news.google.com/rss/articles/CBMikwFBVV95cUxQMm02YTJGNHRBM3ZERTZsWVhSb0ZSazhKbDZaQTdsUk14cUM4M2NqTDRQOUtHUHNYT1M0SGMyRlpTaE5VdHpUN000YmViTlV5RE5hSEs5U3U4N2hmMlRUQXE1TXJSUDNvRG45dmpoWnljTGNiN3ZEdjZpOVdzTE9MaDBidnJ5N25FV0xMYXBzSVVLQUE?oc=5
2026-02-05	Google	0.0	Chevron (CVX) Valuation Check After Recent Share Price Momentum - Yahoo Finance		https://news.google.com/rss/articles/CBMihwFBVV95cUxPTHJOX0hpNmNoWXk3MkVySEhQVUFRbVNmMndWblIxYnRBNktIMlAzUzBGNlgtbVZsNl9TbFBiTE5UUHEtWi1sdlNmdDdnWjRLTS02V3VmRWJQdU1Ua2FualVrRWE0eElzaGtoRU5PSFBCaG5ZM3ZnSzFlcmhtUkpwdDZSWHduQXM?oc=5
2026-02-04	Google	0.533	Is Chevron (CVX) Still Attractive After A 22% One-Year Share Price Gain? - Yahoo Finance		https://news.google.com/rss/articles/CBMigwFBVV95cUxPYTA1WFA0QkxuNDVGR0NWMWhRd1U5V0w1aTAxaW54QjNkNUpjYjVzMFR0cF9vUnNUd2I0RFNZTi1Bcnp3SFprODBuelpDRkNRcWJFTHoxN3NKZEdxVzdpdWpXMjlEbzRxNUpIOWxEdDQ0bngtQ0lTVC1STnI5aUtlOTNWSQ?oc=5
2026-02-04	Google	0.354	2 No-Brainer Dividend Stocks to Buy Right Now - The Motley Fool		https://news.google.com/rss/articles/CBMijAFBVV95cUxPdXE2MDBld1NOQ3VnbWFPUUJISllMa3dMTk1lVk1jcWl3VHdnU0xFR0FvdjVwSGJuX2RoRXNXdk0xcjN0ZUJGTmNTRFVzbG9HQVJrS3VVUDJFcVJGWDhncnpLN1MzbFpFTUNNb0hzUDFOY25aMjRkcXp6YVJKQkpINE8yZGIybmUweU0yMw?oc=5
2026-02-04	Google	0.333	Chevron: Why More Upside Looms In 2026 (NYSE:CVX) - Seeking Alpha		https://news.google.com/rss/articles/CBMihAFBVV95cUxOQUgzeGhuRWFIdHdtZ2c5WXlGRzhwWWg2aVJENDRDZ01ONThvQmZ4a2dpUDdxdDlWSFQzTnNSWFVnNERuTVVacnB5NXUydzNyVHZubWFoZmtaUWdfam9ROGIzdXI4SmZyekJHTnFMb19zTERKYjNNcWJLdFdYUWlfeURwNGk?oc=5
2026-02-04	Google	0.0	Chevron signs offshore oil and gas deal with Syria (CVX:NYSE) - Seeking Alpha		https://news.google.com/rss/articles/CBMikgFBVV95cUxNS09LcEl3aWZMejZwOHk3R3F3azQ1VllmSUlsWDVMSzNwMS1URnMyU0NDU2lPODRrNkZMRDBhdDdaOW1zZTBvTFVLYi1WRFlhb21GOXFjSWFFNGhYcnhtaXdPYWxMM1dsTVpmN3d1NHBPdDQwQ29DSEtLR2RseHJLVzR4M0tFMDVQOXJlSVVuMko4QQ?oc=5
2026-02-04	Google	0.0	Final Trade: LVS, CVX, SMH, HAL - CNBC		https://news.google.com/rss/articles/CBMiekFVX3lxTE9KcjZKNDdMUUpiVldaTjF1WUc3TFdNcDg0d01vZUdiQ2lmRG5aM1JmQ19ROHFUaEI5YzBMcmprbDlCWlp5eDNnaW8tcURXWjNzd3VsemlBel8tU3lxbnRsemN1X1VYTTA5MmJQTTRiU0dmeE9aTTRjU2x3?oc=5
2026-02-04	Google	0.0	Insider Sale: Vice Chairman of $CVX Sells 27,700 Shares - Quiver Quantitative		https://news.google.com/rss/articles/CBMimgFBVV95cUxQWF9BQ1JScWoyX083TzNNWDB4dEwzb1kzaEdNREV6NlRVSTdoa1ZCeGNaOGgyazZwOEt1bkNlV0JKVEtTbjd0S25CTmNIR0tiRDBEaFgyaE4wR3c4bzZoVlZGR2pOMzd6QTN5UlBRM3ptSWRkTlpIb3h2WmlHVnpFU3BHeXlyck5SWjBzUGZCek8wY1o1TlQ0UUd3?oc=5
2026-02-04	Google	-0.133	Investors Heavily Search Chevron Corporation (CVX): Here is What You Need to Know - Yahoo Finance		https://news.google.com/rss/articles/CBMilAFBVV95cUxNcWFOeWlvTWhYOEp6S3dKcXRYcERYYWlXUC1EOTk3LWRud1RULTBPRGtyazFUcUR4TFNuWEdMVlF4ejFIU1VFQnRmeVFETHhTbmtHVHl4MWt5a0Vwc184d1pCOUdhMFk2dmdnLXFERmpjd1FRak1pU1BSOFJfYkpLUmJRbHY4ZzlvRm8xbHltS0txaXdH?oc=5
2026-02-03	Google	0.0	Chevron Corporation (CVX) Reports Fiscal Q4 2025 Earnings - Yahoo Finance		https://news.google.com/rss/articles/CBMijAFBVV95cUxPZklwMFdWeVVzWEc4ZXRrbG14TnRQR1VnT2FvNEw3RnRYclVaMWJyNC1XMEtxQ0xFenBvVmNtSDByNC1QN2NhTEdJNlVfNjJwekxRVHZyT01fWXBET0tqSkR1YzI1WkpUM0lvNU85T19MU2RlTW43d2FzRVFROExtZ0R3WTlnWXBIOERldQ?oc=5
2026-02-02	Google	0.0	Chevron Corporation (CVX): A Bull Case Theory - Yahoo Finance		https://news.google.com/rss/articles/CBMihgFBVV95cUxQQm1XMEJMTTBXOVQ4Snk2eDBpRkR6dkFCZ0dMQmQ5cTNIQmJCSTB5bmpLNXlxWE5nZmNyUllMTmkyVGJsZFlmTzFmdFZTLUpjZDd0UmMxY2RGb2xXTVYzdnAwWU1oOC1rSXhHbmNKN0JsdGw3RFZjaDgwMW1XNVlpVDI0SXFwUQ?oc=5
2026-02-02	Google	0.0	Does Chevron’s Dividend Hike And Venezuelan Push Reshape The Bull Case For CVX? - Yahoo Finance		https://news.google.com/rss/articles/CBMiiwFBVV95cUxPZXd4eno5X1A3SWo2NUlIRDRidnFSRzg5ZTlRNGZGSjNXVkItUzNsdWdobkg5OXpUYUMxY1RVUG1ieGJ6WHEyREExeHp5VDg3cnV5TkotMVBWemRneFBscUtpUUJiMXRTVFVvd1lIek5tZ05PaWxlVG12dmJGeXE3cTVLZTd5ZXF6M0Jz?oc=5
2026-02-01	Google	0.168	Chevron Earnings Hint at New Highs—Is CVX Ready to Run? - Yahoo Finance		https://news.google.com/rss/articles/CBMigwFBVV95cUxPcnJIeG1EbjBpOHdJSUFCeUVsQlpwSjBOV29GQkZBTzVsZVhJMVdaeFFJN1VMVlhadkVxNGJ5M1RlbnQzOWNiRFViZmRKc0d6RVZhRDg4SVpSUUhUYzF2MWtoYlhqLXY5R1J6WE5MX3JQdGZ6Y2x0aVR1YkZTRGJFOXAySQ?oc=5
2026-02-01	Google	0.135	Chevron Earnings Hint at New Highs—Is CVX Ready to Run? - MarketBeat		https://news.google.com/rss/articles/CBMilgFBVV95cUxOZW9jeWNCZWVUd2RJX1RYb1RxaXNJMm9qbGZvZi03NnJCcWUzVGVWRmRVck9URlB4alZ4dGtMQVJDbmFmMkZmWU83VjNleGlmb2hRb2JwNXA2V20tLU1peW80MUUxV0F1d3RRX1lLN2ZTd2sxMm5aSDdyb0Z6VktkeGVzb3NHSHh2MnR1RGpaYUNEM1RPbFE?oc=5
2026-02-01	Google	-0.133	Chevron Hikes Its Dividend - But It's Less Than Expected - Is CVX Stock Fully Valued? - Barchart.com		https://news.google.com/rss/articles/CBMiwwFBVV95cUxQRGdmTjg4WnlBUC1BbWU5el93bDZNX2lwRVlUMmhNajNqXzVGWDdhTDZlSERSa2w5S05NVEJESjZBX0stMjlCajcwblREeXRjQjFWX2VmNXVZOTJiam9KTGZrUWNxakNGWERSNzU3QVBfeFhWU3RSMzg2Rk1BanpLSE5FTWR5Y1hScUtiNUlfdy1ZdDd2Q2ZNcjk5bkJrRnI0MktlNzEwMUdNeGNWZEprcTlDdUUyOGNnNlhKcU0xMkZKdkE?oc=5
2026-02-01	Google	-0.133	Chevron Hikes Its Dividend - But It's Less Than Expected - Is CVX Stock Fully Valued? - Yahoo Finance		https://news.google.com/rss/articles/CBMiigFBVV95cUxNVmhsdzNiSGliN1FfQWlHS3lucEVjQVViYW1FNU9kamZlVXlYY0VOQWh2Uk1JVm93NkdyNzZDM3MyenRRNXlWUkpFZDBzTnIzb1NzRThoOWRlaExvNkxnbmV1c3Ryd2hTeFZkZ0VHMWNINVJrWE9ucERUQ1hNcHA1LVkwX1RHVlU2aGc?oc=5
2026-01-30	Google	0.0	BofA Raises Chevron (CVX) Target as Geopolitical Shifts Lift Energy Outlook - Yahoo Finance		https://news.google.com/rss/articles/CBMiggFBVV95cUxQUWcxYW5FMEdxU3BuWmNLRHgxcDY0VDFXZ0NoNVJlSWhHODFWMHRrQUtJbDNtRXFZbVlnZ2R0T3kwaTlzRU1GUmtBQ1RBaFUyMFdyT0tPdjhMZmFBUFJIYmlCMnBIX2tHVkx3NUtFa3J5SERydkJvMmFPRTk5Tm4wZHVR?oc=5
2026-01-30	Google	0.0	Chevron (CVX) Beats Q4 Earnings Estimates - Nasdaq		https://news.google.com/rss/articles/CBMie0FVX3lxTE9HZVJuN2ZhNWFYOW5zYnk5blE5SXcxSENUbEppR3RzdG9UTExpZ2hXNE9YRWxleWF4eWxxVmhUTnEtWlNEQ25YV1ZJcFBKTmRGeXVid1VHdTY3NFE5TmI0RTUxTHdTOHZ0SW9ZY2R2UkVzT21iVHFDUDM5aw?oc=5
2026-01-30	Google	0.0	Chevron controller Knowles sells $544,000 in CVX stock - Investing.com		https://news.google.com/rss/articles/CBMiuAFBVV95cUxNeGc0N1ZldGQ0UWF4eDJkdWVBdzBYdUtTdXpTYnBhWEVvVlJhS0MwdXA3aE5iU1g1UnZFMlhlNWNFWTZCandjby10aTR0bFBqcU1lY3Y1WWRLWFJoUWhiVl8tUklhTlpUeFA2cEEySTZSa3RteWM0RjFjRDlvSDU4djE3OUhTY05fczZYQVlUcHR3bEJJZkdXRGNsMTJxbkxkRU9NNjV4My1kc18xMTd5TGVRQm5zTTFD?oc=5
2026-01-30	Google	-0.067	Chevron earnings beat as production hits record with upside expected in Venezuela - CNBC		https://news.google.com/rss/articles/CBMidEFVX3lxTFBMdXBxTjBpYXpLSWVRS0FHWGg2bmo4LWxsVXpQT283VWp3OTFHQkUtbzk4cEJEclROcWxEdTBfcjRoTnhHSjAtcVR4NXMzVHNJYzdIVHFNQ2k5dURDalBQNFJndXJKSnBWV2FGR3ZvaEpvV2Nf0gF6QVVfeXFMTVlyOVkzckVVS3hrZlNFS2ZYNGxsWEFRYllSZGNFWUFqSENIMzlZcHczMGxPYXhEZU1JNXlkUzJMSlRGcGNtanhQb29fUjNDN3Bwb095a3NPOWEwTElqdzdvX1h4N0dCTldfWThfOGhnV2RiU0huVHVCQ3c?oc=5
2026-01-27	Google	0.0	Morgan Stanley Updates Chevron (CVX) Valuation on Lower Oil Price Assumptions - Yahoo Finance		https://news.google.com/rss/articles/CBMihwFBVV95cUxQa0pIa01TNXBFdVZSbXBZMG81bTJzNk5xeldnMDBwajVPUUZING5fTUFsSUJXOWVyT1dTZGVCSlRBd3hnSFlmc1h4SkVKMmR6TjBnVlBPVWQtVUhUdmJJdnRCUVB2WjQ2YkxmZ1J6UERnXzRLZnRrNjhXWmFsX3J1OFExdENaaG8?oc=5
2026-01-23	Google	-0.067	Earnings Preview: Chevron (CVX) Q4 Earnings Expected to Decline - Yahoo Finance		https://news.google.com/rss/articles/CBMigwFBVV95cUxNZlF2Q3JiN0dVOWtYSVg0X1Q1TlA3NnZaTnpyVXpVeDJPZ0VNU01MUUhvVFpCZFA4NTBYQk1ZUWFZWmlGM0RyTVIzOWNhRGF4V2stb0J4TmtmX3BxRGxmaGZtb3VOY2sweVpkNmt6V3lGaEQ1MGVUREdsbDZoSXQzOGNWSQ?oc=5
2026-01-21	Google	0.0	JPMorgan Resumes Coverage of Chevron (CVX) with ‘Overweight’ Rating - Yahoo Finance		https://news.google.com/rss/articles/CBMiiwFBVV95cUxNZy01S0s4NzNsVnFqNDRabEpORkw2VGtUTGZKNVhNNTM0UFQ1c0dUM05xcHBtSFYyeWlGbkxOZGc4LXhUMG5WenlWVW1iNmp1Mk15c0NkVzBIQnl5RDNuSVVRZUpmQV9oOUZoRTVLaVJ2d0RMNG9EbDJyemhNTERjU1hCeExGZmVES2xV?oc=5
2026-01-13	Google	0.0	Chevron (CVX) in Talks to Expand Oil License in Venezuela - Yahoo Finance		https://news.google.com/rss/articles/CBMif0FVX3lxTFBoNGh6SEV1NzRBMm1GWFZSTE9XME5zWWQ4THQwM243WTBhc09sN0w4azhMLWFWVW5qTEFWazh1QXlqcV83emhBeGdSZ050ZmI3cVkxbk1JN3d4bjlLOGo3YWVJT2dSSU1jSXVjbWJXTjlURzI4WGNac3ZNemxsQmc?oc=5
2026-01-09	Google	0.0	Jim Cramer Discusses Chevron (CVX) & Venezuela Operation - Yahoo Finance		https://news.google.com/rss/articles/CBMihAFBVV95cUxPS3pxUFE4ME05eHFObC1ZZnM3ZXl5WXRlZ0NEZjc3SmhseEdEMXFRM3l2Wm1ucTE4bUtPVlplSDBVOXFEb3BjbVJuMl9XanE1bkl2VHhyckRsZndXVlpDZ2RVTE1mbW51aFRzbjhHSUNDU1oyQklTVjNjYXNBM2ZrcWdjVXQ?oc=5
2026-01-08	Google	0.333	The Top 3 Chevron Shareholders - Investopedia		https://news.google.com/rss/articles/CBMikgFBVV95cUxNZzRLdlNJdHFGLUg0bkc1WEhvcVBSa2REcnQtZGs0SW90VEg5dUVzRW1JTUpsa1hRUGNWc3BsQ0dBTUpEakFrb0llb2xibWZFalBHMUEwV2VRQ1FQRnVJWDR0b1dXNzR4Q3lVdE5ISkFCc194RzlFM25hSFl0S0t3czZKMlRBODZiT2Q0eGRHNEhIQQ?oc=5
2026-01-06	Google	0.2	Chevron slides by most since April, reversing big Venezuela-fueled gain (CVX:NYSE) - Seeking Alpha		https://news.google.com/rss/articles/CBMirAFBVV95cUxOMEJlSUE4NU5FTnRIMVpyVTYtNHRvUUVJMy1HWnZVbExVWnFPWFJ1NWlKQ3BjWkZybmRJX0VET2tsdGFUeVU4ZFoyWU9UNEl4azcyM1g5dEl4M0ZZMVN0VTlzT0dHdkV0dXlHakpoN1p2SU9mSmZEQlJFZDdwMkttUEpMMVF4VmNlTWxUZlFtQVFlcmxxWXozWDd4OEN3eG51SHQ2dEJ3MnZueDVR?oc=5
2026-01-06	Google	0.175	Chevron Stock Just Broke Through Resistance Levels in an Epic Move Higher. Should You Buy CVX Now? - Yahoo Finance		https://news.google.com/rss/articles/CBMiiAFBVV95cUxNd0FKRU10UlpvamJDYmU5NkM1RjVyTEVQa2ZqaEloZ3EwM3VCUHliUGMxdWlrMnpiUGplOS1pTVFSM0pxX3Y2RUN5NjhkdjRvb0gtVExQX0ZxTnlpUm9SRjBJWEhvOVk0ckhGM3Q4MlpsOHBqS0lwLUcxc2gzRUMyd1luLVI5cVgt?oc=5
2026-01-06	Google	0.0	Chevron Stock Outlook: Can CVX Hold Up With Oil Under $60? - Yahoo Finance		https://news.google.com/rss/articles/CBMiggFBVV95cUxQekVvYmN2Ti16SEJlQ3FyTnBoQnJmWEFfUXhpdDdtei1WeHV0VHU4QUhuMldsbzVXRG5ENnowZnlERFRsbk9vVE95dnM0LTRqRmY2dU1fVzRCaF83OUZDejRLN1dGckNQb0pqRVpuMUk1c05xSjZPWG9uakgyWS1vR2hn?oc=5
2026-01-06	Google	0.0	Why Chevron’s Venezuela Exposure Puts CVX Stock in Play for 2026 - MarketBeat		https://news.google.com/rss/articles/CBMiowFBVV95cUxPMjRuOVJ1dXBkRDBCUlJsOE9rRFBER3hXclBmcXQweWpwMU14UThqejdreG0tOVVOOVpCMGVXeWwtdWwwRWZhSXRuQzdFZk5LVmpaZzlzTlFZWDJramxVNU5BZHd3M0dTQW8tck5NbnJidTFkU2M3RDVKX2ZDaUpIakFpS1daSlIwTWJjcDlYUDBIeVg5ekZJc25zOWNnV0tfMjFB?oc=5
2026-01-06	Google	0.0	Why Chevron’s Venezuela Exposure Puts CVX Stock in Play for 2026 - Yahoo Finance		https://news.google.com/rss/articles/CBMiiAFBVV95cUxOVTN1dnNoOGM2YjAzVTh6cGRjTVUtWFhJWlYzbkZlTDNsMkJHY20yU2FWT0ZLSi1PNGhZd05GNjNYeC1hbUFjWUFCQWd2RlFkRFdlOXVKSXZvek15cHFsTVVyRkNfUklaMmtWSlQ0MzhScGdUX1hreDBrazNJMmxsNm0zbTlOdW4t?oc=5
2026-01-04	Google	0.0	Chevron stock: What the Ratings say (CVX:NYSE) - Seeking Alpha		https://news.google.com/rss/articles/CBMifEFVX3lxTE9HT1FvVi1EMGRaX1B0YmpMSVV0OXEyR2s3ZF9PS3F6MmJhRy1ERzViZDUxV3Q4aHhKQlplUWk1RDNFdzkxTEJ4eUVjSVJ5OHBMNHR2c0w0dzNMcmxkWklmSmlLNlZrZElwN0w5Vlc2UUdLaFRKQzhIeXQ1aGI?oc=5
2025-12-21	Google	0.1	Chevron Could Raise Its Dividend Next Month - CVX Stock Looks Too Cheap - Yahoo Finance		https://news.google.com/rss/articles/CBMihgFBVV95cUxPbWxXalBMWU1icWMyVHZXdzd2cFVpdlJkS214azlOOXdXVXhEWlZFUjAzQ3IwNUQ5WUFKaDBfdzdKRTRLdkdmNWdPTFNrNGVFYmxqWlZXWHlzYml1djlNd19VQzJJS3RJQkZGMEp6N3NNZGN3cUlaWV96TUxnd3BPQWczWWFqUQ?oc=5
2025-12-17	Google	0.0	Chevron (CVX) Highlighted in Mizuho’s 2026 Energy Outlook - Yahoo Finance		https://news.google.com/rss/articles/CBMiiAFBVV95cUxOSXFFNVpYRTltRkVETkVkLTBLelhRQUJVbWRfSVhUZUo2SHBpbDV1RUYyM2FPbWpmRlI4QkRsTURCVzN0ZFRxaUZ4bVJ3N21KcFVhc0FfMlRqZDRJenRxSldsUE44TjRTLTdtSGVMd2VIN2RISF96YTczbHcwMlRYOThUTnJYMnR3?oc=5
2025-12-15	Google	0.0	BofA Remains Bullish On Chevron Corporation (CVX) - Yahoo Finance		https://news.google.com/rss/articles/CBMijwFBVV95cUxNN2s2Ul9HUjl5OXhjUmltRVJVd05yU2IyemJVaTVFd1pTQ3pJMGxVSU1GU19kNFRnM0loTFZRR0tuOWhwZnY5dW0wRTFWV2htVHNBMUwySXpCUklCUVVHSDdJa29UQmZpV2NCT044dXZRXzhTbjBLYkVKR0RFM3g4dkk2WnV6N2xmdVA2RGtyRQ?oc=5
2025-12-12	Google	0.24	CVX vs. SU: Which 2026 Plan Offers Better Upside for Investors - Yahoo Finance		https://news.google.com/rss/articles/CBMic0FVX3lxTE9sS0prSnVEdUhteXczV2NuMzFFdDdXMS1HMjQwbG52WjBGZWdsdzA3VFd1UmVydl9wdV9yTjFLTzhQY2ltaHBaOEo1SGdUVTN6bnVwaUR5RWIwS09SQV9LZVZ1Ujh5MU5rWE5LN0tUTk5kYUk?oc=5
2025-12-09	Google	0.0	Chevron (CVX): Taking Stock of Its Valuation After the Recent Pullback - Yahoo Finance		https://news.google.com/rss/articles/CBMihwFBVV95cUxObktMajlsR1pJY2dtN0RkTVB4QW5oRjlnaFRaQmEyUU1NV05zTUtYSHFSNm1ob2xzQzJmWWVtU0xPUjYxQ0lIN0x3Nm5RMm53Wm43bUdlQUJiWGFDd29hckxDNFhwclJOU1d0dVlJREVpMEN6dHg3UG5oYWV2ZzcwTDJiWlBwZ3c?oc=5
2025-12-02	Google	0.24	Evaluating Chevron (CVX) Stock's Actual Performance - The Motley Fool		https://news.google.com/rss/articles/CBMiiwFBVV95cUxQY2lKN0poOFBWRURhMU5ES0lHd0tyUVZEQlVsMTFqSDI3dmVNRWtVMkV2N3h4MTNKS3JvYmJGLVR3YWdqeWd2c290MlZzdjBBSzNMd1JrQlZMcUI3T0ZqMlZvcEZNNWoyVmNFeUhnajJnT1cwcXhnUDFXekthOHdFQ1k0ZzZJNE40Ymlr?oc=5
2025-12-01	Google	0.2	Are Chevron Corporation's (NYSE:CVX) Fundamentals Good Enough to Warrant Buying Given The Stock's Recent Weakness? - Yahoo Finance		https://news.google.com/rss/articles/CBMikgFBVV95cUxOZlpYQzNFQ1pwRGhPOHBMMnpCdUZ3VzVIdVFDX3hvRm5aaW9OLVFEeXBSQUF1MUo5aUtvYTRhbmc5UnZXbHJGNjFHZGhJNVpZLXM5OFp0V3hpODQ2VURfWUpESXh2TE9iZTZXc2h0ZWFyVkM2YmJuTHJRSTF6MTNxWFlpX2hjaFZ3MlVfdmxGdXdYZw?oc=5
2025-11-28	Google	0.0	Chevron Corporation (CVX) Is a Trending Stock: Facts to Know Before Betting on It - Yahoo Finance		https://news.google.com/rss/articles/CBMijAFBVV95cUxOR1ZWNTFZVHlfcER0Y1o0MDdSc2NENWUwNjc2Z3l4UVRKcW9vMW14eVJpRThwNE01cXM5U3hiUV9fclVsYUtQU2c4czhzNmVGLTRBXzd5eDZsVHRrcFdVNFM5c01weHFhTjRfeGFOeHpJWi1LM29zdjJiXzJiM0E4MGVyemltRDZoS3Z3cA?oc=5
2025-11-27	Google	0.0	UBS Reaffirms Buy on Chevron (CVX) Following Investor Day Portfolio Updates and Growth Plans - Yahoo Finance		https://news.google.com/rss/articles/CBMigAFBVV95cUxNbEwwazgxaDEwLThQZ01ZZ3VqSkNqZDZVbW5fMUFJQnlpOUpmckxQOHBVbnptNVY1UTA3dkNZOGV4eGZyNE9ENkIzRWxLV21ZbEZCdDRzS1MxRFlWQVJhUE5MMHlSREN2M0VVUXQxbjFVOENOcVhKalFuX1J2OUJNdg?oc=5
2025-11-26	Google	0.0	Bear of the Day: Chevron (CVX) - Yahoo Finance		https://news.google.com/rss/articles/CBMidEFVX3lxTFBENUxNQURNdHZSblRFd3Z0bWRFYlZpZE9ZaFFxYTYtb3hLVEFhQmRkVUdBRlR4QXhzWF8xaHBaSXo5UEFSTjM1N0NSYjJaZFgydlNlWElXX0RhSlg0ck53M0dJdHphOVd1TTdFWGRzb2Z3dHht?oc=5
2025-11-24	Google	0.152	Wells Fargo Raises Chevron (CVX) Price Target to $196 After Positive Investor Day - Yahoo Finance		https://news.google.com/rss/articles/CBMiggFBVV95cUxNNEJUQXlCZ3VqTDRsaVNDWGtteEE1VDhLcU5QYkU0Ql9zMGRzVUUzY3p1VWYzQWtoOHNkdVNrelFYd25YcDBTeHRzWEZaQU9RZVU5ajBjREIzczc3eWJsdUhhZDdrUi1jUExFMWlzeld2Y3o1YmRSYnRKRlJXUWRqZDFB?oc=5
