Date	Source	Sentiment	Headline	Summary	URL
2026-02-19	Yahoo	-0.05	Oil Price Rises Amid U.S.-Iran Tension. These Stocks Are Gaining.	Oil was building on recent gains amid reports that the U.S. military could be preparing for a strike against Iran.	https://finance.yahoo.com/m/ae62a8d8-f065-31a3-b582-1a8aa17b701a/oil-price-rises-amid.html?.tsrc=rss
2026-02-19	Yahoo	-0.062	Repsol Plans to Triple Venezuela Output After Securing U.S. Approval	Spanish energy company Repsol plans to sharply expand its oil production in Venezuela after receiving authorization from the U.S. Treasury to operate in the country.	https://finance.yahoo.com/news/repsol-plans-triple-venezuela-output-193747656.html?.tsrc=rss
2026-02-19	Yahoo	-0.275	Caterpillar, Honeywell, and Chevron Lead the Dow Jones in 2026	The Dow Jones Industrial Average (NYSEARCA:DIA) has climbed 3.4% year-to-date through Wednesday, but three industrial and energy giants are leaving the broader index behind. Caterpillar (NYSE:CAT), Honeywell (NASDAQ:HON), and Chevron (NYSE:CVX) are leading the Dow’s 2026 charge with double-digit gains driven by record earnings, strategic restructuring, and energy market resilience. The Dow’s 2026 Leaderboard Company ... Caterpillar, Honeywell, and Chevron Lead the Dow Jones in 2026	https://247wallst.com/investing/2026/02/19/caterpillar-honeywell-and-chevron-lead-the-dow-jones-in-2026/?.tsrc=rss
2026-02-18	Google	0.136	Chevron (CVX) Faces New Competition for Venezuelan Oil Supplies - GuruFocus		https://news.google.com/rss/articles/CBMiogFBVV95cUxObHVoOVAzb25ZOUJ2MC1BNEpuX2ZLVGFoOE9zeU9OMXVTY205MTBjSmpzTjNGS3lFRzBiLTJFRExiaUZaajhLN1R2QTJhM2lGcGFMbGJSNzNvcFJUb05sUkxCbVA1Y1F1TmMtZEVfbkZURm9qeHQzbTllWG5BT2pFcEJwR0FwdFB5MUkxVVFlT2F0N2FPeTl3UVNsNHlnYkJqV0E?oc=5
2026-02-18	Google	0.125	First National Bank of Omaha Takes $15.71 Million Position in Chevron Corporation $CVX - MarketBeat		https://news.google.com/rss/articles/CBMi3AFBVV95cUxOV01RTG9GVF9NaDlteGEzUUR0a3NFSUF1d3dDVkNsYUt5U0dhbGlsOTJKelJmOUNfUWRzNE9EY19LYk5Mc2dIQVRTeTVxY2ZoS3F3QnRhN1dGRWJ0ZHhXOV9KeTVHRDBDNDFteVVudGhPaXdOV2MwUzhxVFhmbks0Nml6VHROUGNVQlpjdnNLTmVIQ3p0Xy1zMlR3ZEJZeENyOWp3MXNCVW5TYWZ1ZFd1WHJOTnB2M3Z0T05aNElESnhTTkQ3ZUZHcG9LaXg2S3VIb0tHZEFxU1V5OUhs?oc=5
2026-02-18	Google	0.0	Chevron (NYSE:CVX) Trading Up 1.8% Following Analyst Upgrade - MarketBeat		https://news.google.com/rss/articles/CBMirgFBVV95cUxNTDJzTTc0Qmh6Nl9ET1lEbE1xU0RQZmp0SFBEYXZ2Ym1CY2tPZksxQnphVEExUjRTZ3FOLW51akMydmkwUjM0Mlk5RFN0Y1hJalRoemNNb3k0T2tjMEZKcDVjQm5FM0NwcG9SREdEVmZ1X053OWMzTkhMQkx0ZW5Id0dDTXpPVldsbWM0NFVWOHlfTVFrdC0zNTUtdWtWMk5Gb0pCUnpSUF9WZTJTRWc?oc=5
2026-02-18	Google	0.0	Chevron Corp (CVX) Stock Price, Trades & News - GuruFocus		https://news.google.com/rss/articles/CBMiVkFVX3lxTFA4MjMwUkZGWjR6WVdJbnpsajE2dUFCSWFyZUp0dnNRU1dzT2piRDM0eTNmWTF6SW1pb015VjZGQ2FrVDk2cHRjZG5uMHBzcW5UR3dTaEZn?oc=5
2026-02-18	Google	0.0	Chevron Corporation $CVX Stake Boosted by Advisors Capital Management LLC - MarketBeat		https://news.google.com/rss/articles/CBMizgFBVV95cUxQdGVaMndfNXRfWjdtR2ZDcU1iSkJBMWFTRHltQXdyamloNUNOQjY1Rm4zT1U0REp0YlhhVDJrWFRnMk11OWF5eUtoY2M4anhtN3p5c2EyMkVMQnJhOE53ZUNzVnltY0NqZFcxcVNZUU1hc0phTGZ3WmJLallVWW5fS3l2elphRW02V01pMFN3Smo2Ukk1Y0hXOE1udXV0cWlVdld1TUVNRDVyV0JpYlVxOHlERzY2M2VSZDRlVC1jcG9CTEVIU3Nrb1dNUWtwdw?oc=5
2026-02-18	Google	0.0	Drucker Wealth 3.0 LLC Increases Holdings in Chevron Corporation $CVX - MarketBeat		https://news.google.com/rss/articles/CBMixwFBVV95cUxNV3o5cnpmNTZhcUE2VTEwbDM5Ym9WTGozV0prelRRMWVpV1ZQa012WEE0TTBzSHZLdkFQeHAzX2dXc2VFbGNCc0syd1JtZFFOU0d5S3Nldjl5UDdQVDVEM3JvWUZQRDMtMXhJaU9wMThCUkVXcnozMEhEdExOM3FoVTdHTG1JUVhneUNQS1JGSzAzWVplNVc1b2k2c3ZIZFdvWTVDNEpUWWlrakpXWW1LZ21zV1dfSVl3dXA3bDdMLTk5RHJhNEZ3?oc=5
2026-02-18	Yahoo	0.0	Eni Unveils Energy Discovery in Block CI-501 With Murene South-1X Well	E unveils the Calao South gas discovery offshore Cote d'Ivoire, which is estimated to hold 5 Tcf of gas and 450M barrels of condensate, its second-largest find.	https://finance.yahoo.com/news/eni-unveils-energy-discovery-block-163900627.html?.tsrc=rss
2026-02-18	Google	0.0	Insider Selling: Chevron (NYSE:CVX) CTO Sells 1,122 Shares of Stock - MarketBeat		https://news.google.com/rss/articles/CBMitwFBVV95cUxNZ2VMdXlzN2lvaFdza0ZIbW5OdU1HR3VITTBTRlNIcEZIOTFKNnhsNG9NNkJTb1VOTW1TUTdNcjNJUTVXanl1WUVDQjlPRGpYNHM4UmdZeDFPY09RVC0yVmdzQmNYWFFGUEJLNGpLVXdTWmZNTUJpMVRXOU1zbFpUN1dEUlM2WEVIckhLREw4ZEhmdVVGYWtmcmp2TDZLdHQ1ODNjRkl2TWVjZml0TVZ0WGREaGFHUTA?oc=5
2026-02-18	Yahoo	0.0	Key Factors to Watch Ahead of Par Pacific's Q4 Earnings Release	PARR gears up for Q4 results as estimates point to a sharp EPS jump, with lower crude prices and a positive ESP hinting at a beat.	https://finance.yahoo.com/news/key-factors-watch-ahead-par-153400635.html?.tsrc=rss
2026-02-18	Google	0.0	Key Factors to Watch Ahead of Par Pacific's Q4 Earnings Release - TradingView		https://news.google.com/rss/articles/CBMiuwFBVV95cUxQdkktX3BSczdHdVg0bFBmWHZ4YTF2THNjb0JxZ3JFWjZ1MXc3Zjl3UFdHRXBFYk1xV3o0dER5dlk3SDFqVU5nSFdmWTBYRlBpR2ljaHlSRVF2ZUZnb1ZEZjIzUnprM0psUnAtTU1ycHFPNjNDdFFGVUhpRmpybGIzVWhld2FxaWMyb185bUFRa0FPTmdMcE9YU3J0aG5WZW9FZE51QjRxN1JULWNJZjh6dzZPeUhzSjZTRkxB?oc=5
2026-02-18	Google	-0.05	Chevron’s Greece And Libya Deals Add Long Term Upstream Options - simplywall.st		https://news.google.com/rss/articles/CBMivgFBVV95cUxNM3hKMVF5VVFEbnI1Y2RYV2xveUEydm1ESnJuRjV6TXM3dVozVldXcTZyU0NGbkpqQTJJYVpjUmstdnU1eVRydUdnMUtQYVVVUVpJN0hyTENBS3FQcUdMdHNZNHhlby1vSEZxb2dPX1d1VHNmN0d4VGNuMlU2TjBfay16RGQ1azVRZzViNS1KYXNEMHFpNGYydUM5WHpWVFpITm05RkR5MHk4OV92ZENCNzJxX1lNYndFdmE4Y2tB?oc=5
2026-02-18	Google	-0.156	Chevron (NYSE:CVX) Stock Price Down 1.8% on Insider Selling - MarketBeat		https://news.google.com/rss/articles/CBMirAFBVV95cUxOeXBWLVl6T0t0RzhNSjZlS0ZJdVdIdXBfbEJyem9DOFdkaFdRVl9QaEU1cVM0Mk9WQ05aTmRYSzYya18yWVRxNmNfbnVHM0dXNnljRWxVTFc0bV9SQXdSa3p5akkwcVpKRTU4b1RyRm5aanNtMFZuZnVEMVlPTFZONEFpSDM3WEJTNkJLbUxXNHhsaVdUdXdIXzNfeXUxLVdILTNMVzFJanJRM3JJ?oc=5
2026-02-17	Yahoo	0.629	Pacer’s Cash Cows ETF Might Be The Perfect ETF To Own Right Now | COWZ	While the S&amp;P 500 (NYSEARCA:SPY) sits flat year-to-date, the Pacer US Cash Cows 100 ETF (NYSEARCA:COWZ) has surged nearly 7%. This shift reflects growing concerns about expensive technology valuations and concentration risk, with the Magnificent Seven trading above 30x earnings on average while comprising over 30% of the S&amp;P 500. COWZ addresses a specific portfolio ... Pacer’s Cash Cows ETF Might Be The Perfect ETF To Own Right Now | COWZ	https://247wallst.com/investing/2026/02/17/pacers-cash-cows-etf-might-be-the-perfect-etf-to-own-right-now-cowz/?.tsrc=rss
2026-02-17	Yahoo	0.5	Chevron vs ConocoPhillips: Which Is the Better Buy as Energy Sector Crushes the Market?	Chevron (NYSE: CVX) and ConocoPhillips (NYSE: COP) have both delivered strong returns as energy dominates 2026. The Energy Select Sector SPDR Fund (NYSE: XLE) is up 21.56% year-to-date through February 13, making energy the top-performing sector. Chevron has climbed 20.56% year-to-date, slightly ahead of ConocoPhillips’ 19.04% gain. Both are crushing the S&amp;P 500, but their ... Chevron vs ConocoPhillips: Which Is the Better Buy as Energy Sector Crushes the Market?	https://247wallst.com/investing/2026/02/17/chevron-vs-conocophillips-which-is-the-better-buy-as-energy-sector-crushes-the-market/?.tsrc=rss
2026-02-17	Yahoo	0.35	Here Are Tuesday’s Top Wall Street Analyst Research Calls: Albemarle, BitGo Holdings, Chevron, Dollar General, Equifax, Shopify, Southwest Airlines, Visa, and More	Pre-Market Stock Futures: Futures are trading lower as investors and traders return from the three-day holiday break, after a wild week that saw just about everything. The catalyst on Friday was that the January consumer price index data came in below estimates at 2.4%. While anyone buying beef recently would dispute that inflation is lower, ... Here Are Tuesday’s Top Wall Street Analyst Research Calls: Albemarle, BitGo Holdings, Chevron, Dollar General, Equifax, Shopify, Southwest Airlines, Vis	https://247wallst.com/investing/2026/02/17/here-are-tuesdays-top-wall-street-analyst-research-calls-albemarle-bitgo-holdings-chevron-dollar-general-equifax-shopify-southwest-airlines-visa-and-more/?.tsrc=rss
2026-02-17	Yahoo	0.275	Dollar General downgraded, Dollar Tree upgraded: Wall Street's top analyst calls	Dollar General downgraded, Dollar Tree upgraded: Wall Street's top analyst calls	https://finance.yahoo.com/news/dollar-general-downgraded-dollar-tree-144304935.html?.tsrc=rss
2026-02-17	Yahoo	0.15	Chevron Wins Four Exploration Blocks in Greek Mediterranean	Two of the blocks are in the south of the island of Crete and two are in the Peloponnese peninsula.	https://finance.yahoo.com/news/chevron-wins-four-exploration-blocks-100632087.html?.tsrc=rss
2026-02-17	Yahoo	0.136	Warren Buffett's company invests in The New York Times 6 years after he sold all his newspapers	Six years after Warren Buffett sold off all of Berkshire Hathaway's newspapers and predicted unending declines for most of the industry, Berkshire disclosed a new $350 million investment in The New York Times on Tuesday.  The somewhat surprising move highlighted the quarterly update Berkshire filed with the Securities and Exchange Commission about the company's stock holdings in Buffett's last quarter as CEO.  Berkshire also increased its investment in Chevron just before President Donald Trump ordered the arrest of Venezuela's president, and the Omaha-based company continued selling off more of its Bank of America and Apple shares.	https://finance.yahoo.com/news/warren-buffetts-company-invests-york-234544558.html?.tsrc=rss
2026-02-17	Yahoo	0.091	Berkshire issues last 13F of Buffett-era, New York Times gains on new stake	Berkshire Hathaway (NYSE:BRKa) released its 13F for the quarter ended December 31, 2025, after the close of trading on Tuesday, offering a revealing look at how the firm is positioning its massive equity portfolio at a historic transition. With Warren Buffett officially retiring as chief executive officer on December 31, 2025, at age ninety-five, the filing carries added weight. It marks the last of the Buffett era and the first under successor Greg Abel, who assumed day-to-day leadership. The c	https://finance.yahoo.com/news/berkshire-issues-last-13f-buffett-221005128.html?.tsrc=rss
2026-02-17	Yahoo	0.0	BP and Eni Expand Angola Footprint With Algaita-01 Oil Discovery	BP plc unveils its fourth oil and gas discovery since 2025 beginning, as Azule Energy strikes oil at Angola's Algaita-01, eyeing faster, lower-cost development.	https://finance.yahoo.com/news/bp-eni-expand-angola-footprint-141200170.html?.tsrc=rss
2026-02-17	Google	0.0	CVX Stock Today: OFAC Lifts Venezuela Oil Sanctions, February 16 - Meyka		https://news.google.com/rss/articles/CBMilgFBVV95cUxNVFR5eDNxU1FfNkZkWmZEOE1qQ2RsLWpSRzBPclZrRnJXY1RIaHBGN0R1ZENTb3BURU13a1F5WmZCUXZ3dDZUd3dqTnVlNVNnM2NrdU81T2FkaVc0UTNfaWlxWGxuR0JhVjF0aklJeEw0cVFtOFJITEtFVnJrMnprQVVHSTFycE1UZ0VxQnA0dG5MalpNbGc?oc=5
2026-02-17	Google	0.0	Chevron (CVX) Expands Exploration Efforts in Eastern Mediterrane - GuruFocus		https://news.google.com/rss/articles/CBMipgFBVV95cUxNVmFnaEZpWGdEV1VQaFQyNDh1ck4wZmdLSUljeHhFRTUwMHBVc0V6WjY5T2dNT05maUZfQnJTNFZ0bzRzSjIzVHFGLVA0TVJNd0txTVNldHNCdlJGclRqQlNDaEhhTG9HSW45dEpfVFB0MEZTZGp5ZkUza3oyOGRtS1FRdWdpejlNOXhuaFp0bHhnZzNiYUZFaGR5QkFEZnNYbWFRdTlB?oc=5
2026-02-17	Google	0.0	Chevron (NYSE:CVX) Upgraded to Buy at Melius Research - MarketBeat		https://news.google.com/rss/articles/CBMipwFBVV95cUxPMlNkbXl3S0VqTGEzZVNVV2h2OHN3SjNNNHZxTjRoR0QtaFBXSnJ3cktzSzZTOHl6LVRUTmFyelhEbGxHV1ZzcGx0amdBaER5WnZMVEZLMjdGeG45YTVzTEk4dmpjdlQzS3oxQlJMZkxfYTd0RXNXb0Z2d05zeTNCQ2VYQXVuQi1Ua29qSkZsUkozekxiRzh5VS1INWpINDhRb1lxa01tVQ?oc=5
2026-02-17	Google	0.0	Chevron Corporation $CVX Holdings Raised by NJ State Employees Deferred Compensation Plan - MarketBeat		https://news.google.com/rss/articles/CBMi4wFBVV95cUxPZmtPQzdsejBFMm5HRUwzWWZoTDQ1SlNCd25zVWZBblRXOGNvQTQ2bzB4NHhuY3htUVFqTllUVGNPT1h2X2Z3aExmUHJ5RlVVLXRtMTctRFM0Z2N5YzRIX1RlS1JqT1Jjcl9DOGlYZm1ScV9IekVBcUdoeW05UW1zMUdTUEpRUnQzbHI4Uk9SUW1RXy1heDFlNHNRam9YdS1XdG4tMDlTN2tlZmE2RXlMSW5qV01fQm5rdWM3cEdUTjVLRndodTBsNmxSdDAyVG9jUVRteGNVMG1MMmtpVkxVRnNjbw?oc=5
2026-02-17	Yahoo	0.0	Chevron Corporation (CVX) Is a Trending Stock: Facts to Know Before Betting on It	Chevron (CVX) has been one of the stocks most watched by Zacks.com users lately. So, it is worth exploring what lies ahead for the stock.	https://finance.yahoo.com/news/chevron-corporation-cvx-trending-stock-140005804.html?.tsrc=rss
2026-02-17	Yahoo	0.0	Chevron Secures Offshore Greece Leases in Med Expansion Push	Chevron has signed lease agreements with Greece for four offshore exploration blocks south of Crete and Peloponnese.	https://finance.yahoo.com/news/chevron-secures-offshore-greece-leases-015824408.html?.tsrc=rss
2026-02-17	Google	0.0	Chevron Stock Brushes Off Upgrade, Price-Target Hike - Schaeffer's Investment Research		https://news.google.com/rss/articles/CBMirwFBVV95cUxQNE5mcDByWndmVWtVZ1pLSEpqaVF0WkRaQWU2VDBWQW9SNGpLZVpBYjFUSVR2Uk0yUlA0bERWZFFXS2RFcnBiWGhiaGJhQlZHelJYb1NhSS1fT19QSm04Vnd0QUtMcXdseThSSUk4dEpfNlAxb0VScVZ4OU1MbDVqWnVRcXJkbUxBQW5nN21wNzRJWFMyVUw2N0o1LXNkcXpxbVA5WEFzakJLeG05dEVV?oc=5
2026-02-17	Yahoo	0.0	Chevron and HELLENiQ sign offshore exploration leases in Greece	The prospects sit in ultra-deep-water terrain at water depths in excess of 1,500m, and involve complex geological structures.	https://www.offshore-technology.com/news/chevron-helleniq-sign-offshore-exploration-leases/?.tsrc=rss
2026-02-17	Google	0.0	Chevron-led consortium signs gas exploration deal in Greece (CVX:NYSE) - Seeking Alpha		https://news.google.com/rss/articles/CBMingFBVV95cUxNSkJDQXNRTFRFYnY1bGdtTGRlVXZraG5BQUxZMU5xS0RTTFZrTlprWllocFZTRmQwUTZLSnRDUmZvemxieTlPX1hxNnV1NXQ4c05NdjRmQ1h6bURXaTJHdDRlUjVlRXo1TUR5cDBoelUxX2JRTVJoaTBUSnFaS1lhTDBPc0l2czNTdFJnbl9rbHhPTzZpRFFlamdUd29Kdw?oc=5
2026-02-17	Google	0.0	Fund Update: BERKSHIRE HATHAWAY INC added 8,091,570 shares of CHEVRON ($CVX) to their portfolio - Quiver Quantitative		https://news.google.com/rss/articles/CBMi1wFBVV95cUxPMkFjYndtMmU1Y1ZvWnZIWTNiSUJTeDBTRGQ3Y1ZXeWV1empRQXM1cUMwUTEyNHRXanFucV9UYUlDVmdMNmNYbElxbGoteW85cUI2VGNTQlV1eDM5NUZtRE1NTWxkcGNacTVRV1RyWmF4eU5HQVBOVDQyMnJIZ3pILWlrRWp6TG5MTlBKR2hIR21HUk1QT0VWSXJtYnZwb3l4N3lCTC02Mzg1ZlFPV1NPQUUtMUx6R2NTdktIdGtkd0pnWFl5RG5EY2MwZXBySGM4YTItZ0Rsdw?oc=5
2026-02-17	Google	0.0	Is Chevron (CVX) Pricing Reflecting Recent Share Gains Or Future Expectations? - simplywall.st		https://news.google.com/rss/articles/CBMivgFBVV95cUxNaGFzSGxfd0ZpaUlDODJaekRCZGxQN2pEVUpTY0dVcEhfTkRVT01iNUZvb0ZGdTlfYVI2cmZuOEtHZVBhSjhONE1CZFdXOWtFZWNnb201SlZXak5HNUtNUzM1cEVsVTVyWHZfUnZ0eTBmZzZiN2paRElYalQ3R1M2cFpObW5jWWxfQkljNS1CM2ROdE15djNCRHU5SjdmWEpGZWJCdk9xbFpzRnRjRkxhbENjUWVSWFMtdHh3S0NR?oc=5
2026-02-17	Google	0.0	Melius Research Turns Bullish on Chevron (CVX) Stock. Here’s Why - TipRanks		https://news.google.com/rss/articles/CBMilAFBVV95cUxQcV9oaHRBRGt5WDVaQjUzZ1lhVmg5MzFQczUxWDdNd0NPaHIzV2lfUW5KNFZBZXpQbjN2NWhOVWZYNTNzQlhSeDdrLXJTVjRkVEVpdmpQSWhKUEJLNXZKb2xxUHNJUURHeG5QMmNSQXZKSnNKel9iNnJDeHd3bWdKcXh1QjVCcGk2VXluVzFVU1ZKUGVC?oc=5
2026-02-17	Google	0.0	Merit Financial Group LLC Buys 13,485 Shares of Chevron Corporation $CVX - MarketBeat		https://news.google.com/rss/articles/CBMiywFBVV95cUxOZ3lIN1NhYTlyOEttMEhKd2ZJRTQ3YVNHa09FX0FlUEhsbkJnZ1cybmllVF9zZW5lYkNmcWNEOUhjc3RaMEhoaDVhRHdVbWNYUDhyWHQ5X21ka0J3cTZnSU4zcDdjLTA1UDkwS0x1NHYwa3hCeDhSY2NMa3M2ZUpOeHZCNC02ZnREMS16MWpDVi1wTV9nTURqSjBGd1pDQl85ZFR4SGUwUlhSMFdYWF93S1JGcWk5T2x5alRaSTRPSWxGanRqdkZxNXdyTQ?oc=5
2026-02-17	Google	0.0	NEOS Investment Management LLC Buys 103,963 Shares of Chevron Corporation $CVX - MarketBeat		https://news.google.com/rss/articles/CBMi0wFBVV95cUxQRXh0WHgwZTlnTWVybGk0cjZyNHdJbnhvRGZOUENTdFk2Wkdlazk5OXM3OUZGWjNlMllWbkx2azBjRHZWc1NRbExfWmZ0eWJhekllRFV1aW1MNE9pMXY5RTBqT3ZzSkl0WGhCZFlqclctc056YnhGZmp6Qk5QSW54cTNvZ21wc2EtbG5wV1NrQ1M3WktIcmxrLUlBRlBIS2xJNnQ5UzBqb2xzTjlIY3hZd29qWmhBbmdGc0Zqcy1qU1NIQ1B2Yk1ocG9ZajNkTjNXNTNV?oc=5
2026-02-17	Google	0.0	Rep. Gilbert Ray Cisneros, Jr. Sells Off Shares of Chevron Corporation (NYSE:CVX) - MarketBeat		https://news.google.com/rss/articles/CBMiyAFBVV95cUxQWGx5V2J1LWlCWURGcEhndUcyNzN2RUM5TkIzY2F2T0pmaXBsOGZLazVJYnVoVS1zYXE1UnN5b0t5N3E1QTUwLUlFSDN0TDNiSk9kb3hOV1dCY1l6RXF6cEdvM3FacTdJdkljTHNRa0lwSklhY3BVclFNWUpSRGVvV2hQcDU2ekZiX1VrdHZBQWNobkZRRjA2Z1pjUmtMVE1IRmxwZXVCY0thMUZCeGROSHdtYVhJY05VVllJMU5mam1fME5IZEEwVQ?oc=5
2026-02-17	Google	0.0	Shell Asset Management Co. Decreases Stock Position in Chevron Corporation $CVX - MarketBeat		https://news.google.com/rss/articles/CBMi1AFBVV95cUxNVjN0b0ZQYVQxZ3lNQ2lNQWtJUlo4TnVabTNsYk9XVVlaSDJ2d2pyVzV6U1Ffekk4ZVNTZUZzWThpVldtWUZHRDdKeWIwOEN5NWRPS24zZ2hJRDhmTVFRLWozdktDUkcwc0NSZUZicDVVVUdtc3NIV1FZUGN3S1NtUjZqVVZfUFVQRDFia2pBMzZQeUFoUzB6eTlYMVdDVU5qM3RURG5XVEZCNHRJdTFQdEFoUEJCd0Q1S1N2UmRTU1VpRHJpaFkxWHBneTlYMmtIN2g3NA?oc=5
2026-02-17	Yahoo	0.0	This Week In Energy Transition - Global Energy Shift Unveils Multi-Trillion-Dollar Opportunities	The global alternative energy market is experiencing significant transformation, driven by technological advancements and cost reductions that are shifting the focus away from fossil fuels toward renewables. Solar and wind energy are projected to dramatically increase their share of global energy by 2045, while energy storage solutions and advanced nuclear technologies are also gaining importance. As Asia-Pacific continues to lead in manufacturing, North America pioneers innovation, and...	https://finance.yahoo.com/news/week-energy-transition-global-energy-113746915.html?.tsrc=rss
2026-02-17	Google	0.0	What's Going On With Chevron Stock Tuesday? - Chevron (NYSE:CVX) - Benzinga		https://news.google.com/rss/articles/CBMitgFBVV95cUxQOVB5b185SUpFUGNzZ3d3YXV3Nlo1YnViWXA0MlBNODlseE41bi1LLVZDNzJWX1dpT2UtM0ctcXZtcy0tcEFRSjNvMUc5ck5aMDlta29wbjF2X0JvaWpKdUNhcWZZR3AzQXZHRjFFNzRlZFNQNEpzVkt0OUFzTnR0TERiTHM5aE1WNkY1eVVEbkw5d0RlaVFrOGFmUkxPcFhCbVFVVzZXZEJCZzZ5S0VfQjN6SUE2dw?oc=5
2026-02-17	Google	0.0	Why Energy Stocks Are Rallying While Oil Prices Stall - Benzinga		https://news.google.com/rss/articles/CBMiowFBVV95cUxPeURLSHk5cFlMclVuTUh0Q3VreUpOc0VQM3I4S25aWFJva2t0UndxTm1WZDh6dHJWeVEtVHZ2UXJVajVfcE03RDlVcXdqYk9rQkhyYkZXNXZrUVRwNXNpQzFRU29jdkxLZWxUWm1OTTA0cm51Q1lIc19tMTBQbFpETE9jQjU4SW04QkZpRTF5aVQxSkZiVVRtMkNLUUh1d3RfWWQ4?oc=5
2026-02-17	Yahoo	0.0	Will Chevron’s (CVX) Ultra-Deepwater Greece Push Reshape Its Long-Term Upstream Optionality Narrative?	HELLENiQ ENERGY, together with Chevron, has signed lease agreements with the Greek state to explore four ultra-deepwater offshore blocks south of Crete and the Peloponnese, with Chevron holding a 70% operating stake and HELLENiQ ENERGY 30%, pending ratification by the Greek Parliament. This move extends Chevron’s upstream footprint in the Eastern Mediterranean, adding large frontier acreage to its portfolio at a time when energy security and supply diversification remain central policy...	https://finance.yahoo.com/news/chevron-cvx-ultra-deepwater-greece-121106190.html?.tsrc=rss
2026-02-16	Google	0.2	Energy Stocks Are Printing Cash — So Why Are They Still Cheap? - Benzinga		https://news.google.com/rss/articles/CBMiwgFBVV95cUxOcjQzMHYxUXlCZ1FCQUkxRU9YelA4ak9BVEhCaU1Gc1hkR3JjSmZ0Sl9vQVc3ZE8xcXUtTDhsRE0tTTY5Z3N0ZXNTNVlSWm05MVZuMlBKOGFTY2pzUWp2Z1YxdW90ZGlIX2l1SXdWRVZaX2NmME1CWnctZ1IyVGpOQWZKZDk0Uk4tV3lmX19odUFHUjBkd0JmcFJINUE1aTRFS1hVNE02dEhTSWVCa1FielBaODFxZTFuSnBoaHk1eHQ5Zw?oc=5
2026-02-16	Yahoo	0.062	Chevron-Led Joint Venture Signs Major Gas Exploration Deal Offshore Greece	A Chevron-led consortium, including Helleniq Energy, signed lease agreements with Greece for oil and gas exploration in four offshore blocks as the country aims to become a major gas supplier in the Mediterranean.	https://finance.yahoo.com/news/chevron-led-joint-venture-signs-153000802.html?.tsrc=rss
2026-02-16	Yahoo	0.0	California gas prices surge 40 cents in just 2 weeks as impact of refinery closures weighs	Refinery closures including Valero's Benicia facility leave California with six operating refineries, driving gas prices to the highest in nation at $4.58 per gallon.	https://www.foxbusiness.com/economy/california-gas-prices-surge-40-cents-just-2-weeks-impact-refinery-closures-weighs?.tsrc=rss
2026-02-16	Google	0.0	Chevron (CVX) Partners with HELLENiQ ENERGY for Greek Offshore E - GuruFocus		https://news.google.com/rss/articles/CBMisAFBVV95cUxOYjdiX2tNOUtYUEdaWWcwZnFUd04yWTY1QmhKZjN1ajJHdE15UlNxalVsck8tTFpERk1Hc2QzM0Q2UlE5LVh2RlBUV3JnSDBYS2dSNVczTmM3bDRhbGRMVUZVaUNZT2RsSXMxWV9waEl0ZkdMd3FYbW4xSXpqeWVVME80REd0dnluZE43S2dpWVNXZDA4VmRlbzUyUkRMVzZXeFJlUEVaUGNFcXB5TThIRg?oc=5
2026-02-16	Yahoo	0.0	Chevron Awarded Four Offshore Leases for Greece Exploration Blocks	HOUSTON, February 16, 2026--Chevron Corporation (NYSE: CVX), via its four Dutch subsidiaries, together with HELLENiQ ENERGY has today signed Lease Agreements with the Hellenic Republic which will enable exploration of four blocks offshore Greece.	https://finance.yahoo.com/news/chevron-awarded-four-offshore-leases-120500170.html?.tsrc=rss
2026-02-16	Google	0.0	Chevron Corporation $CVX Shares Bought by Vanguard Group Inc. - MarketBeat		https://news.google.com/rss/articles/CBMivAFBVV95cUxNdm9WNUpFZEZPdTFhei1NZnRFQmZCWUhBNFlKbG9faVJpNFFhODd1eThpWlFJQ25meEg3RFFJQU9SYnFDc0NfUHphQ1M2Ui1fY3FDUE5laEE4b0RJNlFHUldLbG00c2k2Vm10Wm85VUZ6WUlKQTFwdlhaOWhZMWJ6a1ZELVV4NlFSdmd2a1YxQVBCRVV6cjZyV3pjTEpfd2dIZ1o1N1JpdmFQME9kOHFzaEVVY2FqclFla05nSw?oc=5
2026-02-16	Google	0.0	Chevron Corporation $CVX Shares Purchased by Fifth Third Bancorp - MarketBeat		https://news.google.com/rss/articles/CBMiwgFBVV95cUxNY3Fxa3VUbzU5d2ZlWTBuNVVhNUJESGtsaC1OQjhHV1NnaU1KU2ZGOFlvZzhiS2dGalFrT2ljcXBGRVVrZEh2eWNYN0tKTzNZZzBJNS03Zkd5U3JZQVR4ck9hLUhhckQ3ZWZWOEZnSndZMndQQXBLdXdrWUl2NDV6QThYekl1YUdpQUs1cnR2dzhrbmZzbURLejZBTGloMFdNajBJRjFZbVhRaG5KUkVSYjRBOVQ5OVk4SEZ6Z2xTenhnQQ?oc=5
2026-02-16	Google	0.0	Chevron steps up Mediterranean search with four offshore Greece blocks - Stock Titan		https://news.google.com/rss/articles/CBMiswFBVV95cUxOX1lONFg3d0J3cEhyNjVtQ0k0S1I2WWFzcWN4QnlwZElvakNjRzNYRGNXc3lMUnRMUjJqVGtWd2VMemdCVDRFN25VWHIyTUFpU3RCMHJmYm1oeGpONHB3Wkw0RERQT1BiQXZJb2doTUFtend2ZXZWRDJEcHppZkUzOEdHeTRwWDR6ZksxYTdPOVRPaUstWlJvaGhpNnU1VG8zcVZDSWJfRnhrdVJoMGM4dVRnYw?oc=5
2026-02-16	Yahoo	0.0	Chevron’s Greece Ultra Deepwater Push Tests Valuation And Growth Story	Chevron has signed lease agreements with the Hellenic Republic to explore four ultra deepwater offshore blocks in Greece through a consortium with HELLENiQ ENERGY. The new Greek acreage sits in a complex and underexplored basin that is viewed as having significant hydrocarbon potential. Chevron is also expanding its upstream footprint with recently announced acreage wins in Libya and other regional ventures. For investors tracking NYSE:CVX, these moves come as the stock trades at $183.74,...	https://finance.yahoo.com/news/chevron-greece-ultra-deepwater-push-231207850.html?.tsrc=rss
2026-02-16	Yahoo	0.0	HELLENiQ ENERGY and Chevron Sign Offshore Concession Agreements for Hydrocarbon Exploration and Production with the Hellenic Republic	ATHENS, Greece, February 16, 2026--HELLENiQ ENERGY, in collaboration with Chevron, signed today the Lease Agreements with the Hellenic Republic for the exploration of four offshore blocks located south of Crete and the Peloponnese, marking a significant milestone for Greece’s upstream development.	https://finance.yahoo.com/news/helleniq-energy-chevron-sign-offshore-180700749.html?.tsrc=rss
2026-02-16	Google	0.0	Northwestern Mutual Investment Management Company LLC Increases Stake in Chevron Corporation $CVX - MarketBeat		https://news.google.com/rss/articles/CBMi7gFBVV95cUxNTzRLd1d0RnAtcXotLVJJd2xOQzFDcWlIcFpKZjhoakJIQkRtNlR0WUdRTHJvSjlTSzFtMDVsanBmQjN1OElXVXhmdmhzUVlhVFdhSm1vOGExZzBSWW5sRUJCZjRBYnlDOG54bTVjRnhweDJuTFZLR0ZvZWlxNjRqd0FZb0pJdldlTVp1Y3Z2Y0lZaTh2Z2pPd2h5LUNaTkpIN3RMUFpTOXl1YnBjWUtuUDZaSTlFQ0RiV2g4Nm9rTjhRV3p6VW90aTZkT0FxTDlYTmdyV0JTeXc3TXpVdlgyRzVMTVlDMGZqbzJvbmNn?oc=5
2026-02-16	Yahoo	0.0	US grants two licences to global companies in Venezuela oil sector	The OFAC issued general licences to Chevron, bp, Eni, Shell and Repsol for operating oil and gas projects in Venezuela.	https://www.offshore-technology.com/news/us-grants-two-licences-venezuela-oil-sector/?.tsrc=rss
2026-02-16	Google	0.0	Zions Bancorporation National Association UT Has $9.18 Million Stock Holdings in Chevron Corporation $CVX - MarketBeat		https://news.google.com/rss/articles/CBMi9gFBVV95cUxOMlZCYVQ0OV9tU2JjNm1HRmZNSVhxUkF6N1Bwc2o3MGNHM3dRLTVHMFc1SVNHbXVkbXZhQjdMM1hRUU83TW5Mb19kVzRIcTNXeUd2a2hHaHJ4OXVvaG50TlZnd1NhN3NGSGdJYW1TQWFwWmVDSFhUNUpkazFWb1V2UzFJNlBJU3plNEE5YmtaRGVVQXBaYUZqUmlPUmRDZzhzX0dSVEptMl9WSnNIejdOSVpEWUcwQ0xPNHdXeHY1bWoydHBlNG5kRTJiOFU1SjdHZ0VqaV9hVmc0YjdOQ1MzazVRemI1RkJYcHhYdERVTDlDdUdSS3c?oc=5
2026-02-16	Yahoo	-0.7	XLE Surged 21.6% This Year as Oil Majors Navigate $64 Crude Reality	The Energy Select Sector SPDR Fund (NYSEARCA:XLE) has surged 21.6% year to date as markets pivot from energy transition rhetoric toward energy security concerns. This performance reflects investor confidence that the fund’s $33 billion portfolio of oil majors can navigate volatile crude prices and deliver returns even when commodity markets remain unpredictable. The Oil Price ... XLE Surged 21.6% This Year as Oil Majors Navigate $64 Crude Reality	https://247wallst.com/investing/2026/02/16/xle-surged-21-6-this-year-as-oil-majors-navigate-64-crude-reality/?.tsrc=rss
2026-02-15	Google	0.167	Chevron stock price: CVX closes higher on $270 million Hong Kong deal as traders eye Tuesday restart - TechStock²		https://news.google.com/rss/articles/CBMiuwFBVV95cUxNbjhPUXdPaTFLQlFYOEFSelg3aVJhNTAyV1FLVExLeE0wUkxwSTUxaGM1OWJRa2JiLW5BZHR5d3pQNEJsbWk4Wi0yVmxySnoyaUxOM2FES2FLYS1BNURUcG9LSHMxRTMtQ01YRzlsd1llaTJUWWZTQ2hzOTE4TjhITDlhNXpWUG1vLUJ0MmRqZG5sOUJpQ3FWR2dQWmdRR3VsMllkV1Axc0lrakJiUF8wblI4eEpsb2UxU19Z?oc=5
