Date	Source	Sentiment	Headline	Summary	URL
2026-02-20	Google	0.0	Kinko Optical Co., Ltd. Selects Beneq C2R(TM) to Scale High-Performance AR Waveguides for XR Glasses - Medianet News Hub		https://news.google.com/rss/articles/CBMi2wFBVV95cUxOMkY1ZEdvLVZCd3hCRk1iTExBQTVEcGZrNk42QnRGdGVsdUQ2bXlreXl5VWxvWW1aN1I0bTEzbmJpZU44WUxVM0thQ2N4WUp3YkRNM2U2bVJMNEVfUHA5aDFRaTNoRVVqaW9Sb2VNdkNZcnhWSExzRjhuSDk2dFY2amEwSUl0R0VrclJPelNRdXNHVk5XMzJoN2NqVjlqUGRRZFY0ZFFGNXU5V0NjWlpaUzZpS1dvMVRPY0JxNzBRdWVaQjJQaUVRbjVsbU1tR1FwRzFaWGJZbzZIT1E?oc=5
2026-02-20	Google	0.0	Rakuten Mobile achieves TM Forum Level 4 autonomy validation - Telecompaper		https://news.google.com/rss/articles/CBMipgFBVV95cUxOdFdQQ0Fud2NqOFZidGtyRVFBOXZkTlJCZW1KTk9wNGJMZDV2c2owZUFqZEhfY0VXdHg1ZDgwVlptX0Z5MW5BUUZ2NldNVEViYXI2UTQwbkdMeUdhQnZrY1NwM0xhcFB5VnlrSlJCQ2VQV0NXeGVlVTZMMHVPamhoOFZkaDU5R0MwTV85UmIwVnQwRkdQVmxZVGt2MlUxeE1ZUmNmb1Rn?oc=5
2026-02-20	Google	0.0	Toyota (TM) Stock; Edges Lower Amid Agility Robotics SUV Automation Rollout - CoinCentral		https://news.google.com/rss/articles/CBMif0FVX3lxTE5KLVAwOVZ4UEx6aDI3bFEwTnRYWVRwUTBNSWszYzZreWFEdTRMVGVxc2diMS0wbUppV1ZpbHRKN2dSTXB1cDVWZkdUZW5RVWRvd2xNRmpXaW1WZnBrZlFXMnc4NUVYcDVLTW00eVJNRU82WllONlJRODE4ZEVSYzg?oc=5
2026-02-20	Google	0.0	Turkmen leader’s visit to United States remains shrouded in mystery - Eurasianet		https://news.google.com/rss/articles/CBMikwFBVV95cUxQX3RwNlQyVURiYWF0eld3bWEtRlNTVUdQTW1qTTRLN3pRYjJtczFuLVdnX0k5Ql95SHpleVphcWlSZHI1WHhncGpXeXFPMWdDYS1oR3JBT3lwTEUyeFRDcjY2U18wYmRjSFgyY3JrSFFxY1htaTlEbFlEWE9xWGlTOXM4akRFNlNiZ1NYYXEyWEpvVlU?oc=5
2026-02-20	Google	0.0	WSK Viterbo: Pizzonia takes OK-Junior pole - Kartcom		https://news.google.com/rss/articles/CBMitgFBVV95cUxQR3U3MWVfWjNUR2xfcWliQ2NwVFhfVC1tbWZSNlVTQ1huLU5sR281czVuelBtZU5Fc0NZdG84bU5jYWtLZnFGSERlX0xVaXhxMGpsaW1PVElFRG0tTDhyN3BzM29yUkVQdHJoLTVreXhUYXVFMVFyeVJFOTFWYWt5REFiem9ySF9WTmZCem5OVG9WbW0zSXRvYnBzRGJEOWg4Rkk2d19SUjJkeTJKRWNSTjhaRGhXdw?oc=5
2026-02-20	Google	0.0	“The air conditioning in my room wasn’t working” – Remco Evenepoel admits sleepless night may have played role in UAE Tour setback - CyclingUpToDate.com		https://news.google.com/rss/articles/CBMi8wFBVV95cUxPSVYyMTM2R2tPUzhCYkJYVllfU0NpVkFTMGY2cldSbWg0WnNiTV9wM1lkTHQzVGJmdTUxYjQ0amNyNFhueGpTTTRhdl82SVRBS0xrWER0VmRZNFdBX3p4M0N2c3RpVlJJWkFuTkwxdFBsejNRSE5rQ0xucWQ2NVZyOS1zcENQNGhpLUVjbFNKRkZjZnR2bHIyVDFaUnp1U0tHQ3hJeXpfX0tPZHBvbmlFLWt3YXRfUjNGay1PejBPVzRlN2F0NjVOY09JZHkyNHpNd0tSYTVOWHlzNno2eUMtR0RqOWR0cTJTWmlZSGNfQkFHLU0?oc=5
2026-02-19	Yahoo	0.5	Toyota Strengthens Ties with Joby Aviation Inc. (JOBY) to Safeguard $1B Investment	Joby Aviation Inc. (NYSE:JOBY) is one of the best debt-free mid-cap stocks to buy according to hedge funds. On February 13, Bloomberg reported that Toyota has moved to safeguard its $1 billion investment pledge in Joby Aviation Inc (NYSE:JOBY). The Japanese automaker is helping the air taxi maker troubleshoot production glitches at its facilities as […]	https://finance.yahoo.com/news/toyota-strengthens-ties-joby-aviation-194220886.html?.tsrc=rss
2026-02-19	Google	0.4	Despite dominant win, Texas Tech women's basketball not talking Big 12 title - Lubbock Avalanche-Journal		https://news.google.com/rss/articles/CBMi-wFBVV95cUxOQXpLdVVVWTlnSnRkcFhzVTZoVkZ6LTJRTUpSOTIwemdJS0c2am5yNW5TUTFUUVJjT2lmSkdzUUVTVFBSVk9BQXM0SWNDQjNNQnlYRlRTc2hweTgza1E1OHFjVEZuaXUxYUR2a2RYNVVRRGMwUmdFOXhfU01oTGdWN0oyTzBTTVVvdmV5UEtoRmg2MWRBclpTNXktMWtlTy0wMmhzN1ZXWHlaa1EzR0hnRzAtaFJKWTBtWkQ3NHFrMkQwSGgyOGFnMERabGR6NEowb2VIWDFqc0V0RGkzMnlEUWNQNEZUVFJ6WWpfbUFUZmtSdDlheFV5VXdBWQ?oc=5
2026-02-19	Google	0.4	Snow, ice, groundhogs. Oh, my! Freezing weather inspires a warm meal - Bergen Record		https://news.google.com/rss/articles/CBMi7wFBVV95cUxNTkJZbTZYMHU0dm53UkhnbUQwT1RiS2NkMlBMU1V1MDA4Z2FsVEU2U3FpMkV0UHNmMTdCWGd6OGVja19jeHFVTFYwWlhzTVFCdi1RcWFUMjhvTmctc3kyUVN6N1ZvOUU4dVRJa3lYRFlUOHdhMTRNTm9OWGNzVGQwcjRyOUJiaTJrSFphYUNUNlJpajc2RHFGOFVhWUd2MUxmLS1Fb09XTVhqeVpVdWJkZkhnNXlJT19sNGJSR0J4TkxxdncxRGdobmVGQVhwZVoyWFFXQXg2Qm9RNWFMUWU5bU1TOURfMXFQRTZpM1d6cw?oc=5
2026-02-19	Google	0.4	Texas Tech women's basketball routs Baylor for second win over Bears - Lubbock Avalanche-Journal		https://news.google.com/rss/articles/CBMi8wFBVV95cUxPdUZ6RHFRYWhxVHp5aC1xT3U4bGJUZUtuZWhqeHgyOVM1OEkzWmRlRWw1ZzIwcy14UlFlM0NGMUlJbjBYRW5CLW5vQkVKdFZQLWhpd2ItWENXYXVkbkppdkdNSzhBakczYjhHbWhKbFYtMWR0MWNSSXlHcE5wZDgzZ19jOGYzV1VxaEVWVVltWGlnMVNfS2I1Q2tzck02QXBuYjdQdXpOdnpjZXZ6cHVub2RLZ2NNVEZuOXhIeUhjN2RMcXhCMWg1X2l2VUZNblZrWEpYRlY1ejVTcGJITlpMdGZsRlUtME84Y0ZjZUJ2QnJHTE0?oc=5
2026-02-19	Google	0.371	The State Street SPDR Dow Jones REIT ETF Could Soar If These 2 Things Go Right - The Motley Fool		https://news.google.com/rss/articles/CBMimAFBVV95cUxQbVpEaXhzUnNNeGpOdm1mMTNsTzlCNU1ReDhYMnVOZVI1YzhZVHh1cW4xWF96c0F2OGV5MGpnV0JrVng1Ym1QOXRaSU5wM2Q5RGdDaWVuUUowV295YlE0MTQ5a2o5YUxkTDdmd1pvQ29QQTBlQ3VCWVp5eUJQYmxsQVlIdGx1VWJ1TlZwVHFSVFBqZlJzakgzXw?oc=5
2026-02-19	Yahoo	0.35	Toyota contracts seven Agility humanoid robots for Canadian factory	The robots will be unloading totes full of auto parts from an automated warehouse tugger.	https://finance.yahoo.com/news/toyota-hires-seven-agility-humanoid-202902952.html?.tsrc=rss
2026-02-19	Google	0.333	Ferrari shocks rivals in Bahrain with phenomenal rear wing design - GPblog		https://news.google.com/rss/articles/CBMimAFBVV95cUxPOTM2WXFQa2JjQ085UkNNd05aR2puQ0kwc25HN0IwUjZncFA0elpVN1Y4elVWc3lNc0tVQ3JXbzljQW9QcHlFS2JTdjZscW9RVHVEZGZ4cTEybFFhb3lONm5VNG16Tl9ydHhQMUZWM09Xajhvb1luZFh5NGtKLUlueUFkTWVEbklpcGswbXBNR1l2b0hfNnN3Yg?oc=5
2026-02-19	Google	0.333	Team USA men's hockey: Top 5 performances vs. Canada of all-time - USA Today		https://news.google.com/rss/articles/CBMitAFBVV95cUxPTHJ4WGhHVmc2WUJkRGgtU3FiMmVQVEUzcFdjUkFmZUNpeEpDTHFtWGNUU1I5OGk5dVRUSkc4RkFBTlVUbVI5MDRlOTZnbXN5eW05cm52MEpHWHZSTjFPczZSRFUwbkJJM0dwcnRVYzVwNmdKRWhvdDJZc21RdXMwVEJJUDZMb3BOQmo5NHBMUXMxQVdoSW1kMnhBc3JMWHN4OF9fTEdRSTZ4V280dnNWaDhLbXI?oc=5
2026-02-19	Google	0.267	Mikaela Shiffrin Didn’t Just Win Gold. She Changed Her Entire Story. - Outside Magazine		https://news.google.com/rss/articles/CBMipAFBVV95cUxNbGpuQndNRmJ6TVVZNUFuNTF3LXJlcmJOMUxyVUNBZ1lnQmg3cUtXd3d5LUxqUjY1NERXSS1zZDFDZ3V1RnBXQTVlQS0zcDQxWHlPOUdfN1ZzT3E2ckRZazVMTUVSRld2Mnh2Ukg0Tlh0N245dV9TbVNsRTRWRk56aVFHdXhmU1FRbk5RLXEzQUtBclhmcU1HV0J1Rm5fZTRGTTAzZw?oc=5
2026-02-19	Google	0.233	Mario Barrios vs. Ryan Garcia: Full card, how to watch and stream - USA Today		https://news.google.com/rss/articles/CBMirgFBVV95cUxPVElsLV9YSkZOX3ItazNndkZueTBlUlpsTllqWXRtamhLcmtjQktDbGtTZUxNdzlpQlN1UUV5bEVidGtEczVOemstbDBfMmRtT3pTQm9xSGl0aHJmLU02Y2NvQzVOSlZKX2o5Zl9xOWR2ZURCSEZSVjZhR2FmVnFGOV9sZzlZOUFKVzNpanE5Q1Rmd2lXSFE2b0lsZ01RTS1PR09mQnlyaXd2TnVNNkE?oc=5
2026-02-19	Google	0.2	Which city department pays the most employees below living wage? - The Commercial Appeal		https://news.google.com/rss/articles/CBMiugFBVV95cUxORXRpRTRrVFVBdjdMZjNOTVB2QksxWERVLUJEY01xZVZGQng3UHhlQnZBeEEyZUozcDZwUGxVZ3JBOHgwRnAxeklMM2oxeHNKTUVjUllLR2MyRS00dUpjSXpkQ2k3TkhFcGdETnpHS0E3eEMza2wtNVJCSTRCbXF2bXRpNmUwSW54Z3JrSHlqTFlMSkw2UjlEM0t6OEZhTkI2WUtKSjFvSHF1Nm8yR2JzeUxRM29KSFZXSVE?oc=5
2026-02-19	Yahoo	0.143	Electric Vehicles Competitor Analysis Report 2025: Recent Developments, Company Strategies, Sustainability Benchmarking, Product Launches, Key Persons, and Revenue Forecasts to 2033	The Electric Vehicles (EV) industry is set to soar, reaching an estimated US$ 1.58 trillion by 2033, a significant increase from US$ 600.13 billion in 2024, at a CAGR of 11.43%. Key growth drivers include heightened awareness of environmental issues, a strong focus on reducing emissions, and the rising demand for sustainable transport solutions. Leading automakers like Tesla, BMW, and General Motors are spearheading this transformation, boosting EV offerings, and enhancing battery technology, wh	https://finance.yahoo.com/news/electric-vehicles-competitor-analysis-report-162000120.html?.tsrc=rss
2026-02-19	Google	0.133	This company wants to lock Tennesseans out of the courthouse | Opinion - The Tennessean		https://news.google.com/rss/articles/CBMingFBVV95cUxONG5aaGZ3R1pOUFRxY2RXYnBCaVhXNExCUFVXdjRDcHhUWGpveTJwQ1ZYRm5RSkotT3U1NlhMcXNEelBlc29reks4dGtmS2M4VW5veEYyNHNYV2pmaUhEMXhHcnR0U040VHdFX0Z4WV83M0JzR0VIWjl3WWNBSURRU05qZTBFTVNKbGsyVDhNM3djam5xa1JzYnJET2ZfUQ?oc=5
2026-02-19	Google	0.107	Delhi High Court: IP damages for Nutella jar shape mark breach - Law.asia		https://news.google.com/rss/articles/CBMiWEFVX3lxTE1uU1BRNEpVdFR2TzZCeExocUlDT0xLSFQwaHRBNy1QZl9kZk1MNXVraUxDWF9qTVdpYXUtM3NUSHkwTm05bUp1LUNYTXlRMm5SV2VhdXYtMDk?oc=5
2026-02-19	Google	0.1	Connor McDavid sends clear message and warning to Sidney Crosby and Team Canada at 2026 Winter Olympics - bolavip.com		https://news.google.com/rss/articles/CBMiygFBVV95cUxPcTh0WnJXWG1fdXlkSGRQenJfQ2NOOHRrbDltc0dHeGFCcmhHRVZXWmNhZG5lREhWTEhzT2U2NTdDTlhTS1E2QWNvSWJFbUxEby01UmpIZ3o3NlppUEF0c19uOFdEQXNaOF93OGFId1RUM3BQclJ6UkY5bnpYZVdGMzFWdmFScko2NExxMktoMElrUFZjZXdodmVod1N3SzRHZUlkYTMzNUNTRUxIRk5CbFgxVzkyU0xoSjk1VWVTVE42SGxBN2lIdFJ30gHPAUFVX3lxTE80S1UxT1V1UlRxazhpN3ZUTlBQYmlDYjJjeXIyLWpOT3lsZUNFMG5JX3hreTlRM2w5Mk5DUGh5d3hoR2pUYmVGek9RVHgtdnFEY1c4OXowcUc5UVRwZkxpU25HOG5JaEEtaDRPX1VnWkJNV0MyNFdXcDFZREdmZ2VlYWxXVXRVSjE2d2g5S2Rka3pCUFc1ZEUzcmhDdDRwQlg3OXVnalZZOTYzVjBlSHlDX3FKRUJqY2tDZjJiTFdXMWY1aEhyR2o3NjBXR2VPcw?oc=5
2026-02-19	Google	0.091	Scream 7 Might Set A New Record For The Slasher Series At The Box Office - AOL.com		https://news.google.com/rss/articles/CBMieEFVX3lxTE1CdEp3dmJOM3ZZMjZLNk9ybTg1Z0xxc1ZxVHp4RURyYWp6X2NkRG5pZFU1cElNTnJMT1hNUEsxeXNVcHVPU3ozNjN1Q1pfcGpicjlsYVQ3bFVCLXdEZVMxdE55RHlpX193Nm55NnJ5NmRhd3g2SVljNg?oc=5
2026-02-19	Google	0.091	UX Team Launches Evident(TM), A New Human-Centered, AI-Assisted UX Design Methodology - The Globe and Mail		https://news.google.com/rss/articles/CBMi8wFBVV95cUxQQUZJQjBPN0U2ckpfMzRpOEgtN2Z5SWxpTTFxTElqbGt1UzJuYmp5bktqd2RGWU5RcmRBTjJOeFVrMFVkdG9aUmgySHlMMjk3SUJsb0pIYWxwbGVFN2RXWWFRb0tkN2pIWF9MSGQ1NmpPcHo3cmRiQ2ltcld3WnJJSG1KV0pCU2xzTmxtOFhmRmZpQUx2M005QTBQUDlTZld6bjFfQnJwd3Bpbm9tR3BYdzM3RnBVWHAzcklXWElYck95Tm5IMFAyRk1XOWQzS2cxYVZoeC13Y0ZlZjlEZlNzd2I3STRnakN4bDZqZWhRemJsbW8?oc=5
2026-02-19	Google	0.068	Former Arby's on Patton Avenue proposed for new drive-thru chain - The Asheville Citizen Times		https://news.google.com/rss/articles/CBMivAFBVV95cUxQWWlFQXZHemxvOGJwOS16dlEycnoyUk5VT2tuUkVyYnpVSUlacjhVbnFWSndWeXZNekp5dDI2MENFNkNzUWJLVjdscWgzNld5SWdiX1VtX3hzdk1TMVBMMGRCaGlOa0pTR2pCNFNTMlJ6TC11UjhUaEhsOFhfV0JKYW1TS2ZxRTk0QmJIMVg3aEg2SzEyd0ZobS1OZGNkLXlqYUxnY1dPSXNwbTY5Z1VuQ21EV1QtZ29maTd3bw?oc=5
2026-02-19	Google	0.042	Rejuvenate Muscle Health(TM) Nears 10,000 Points of Distribution as Major U.S. Retailer Expands Functional Beverage Breakout by 2,105 Stores - Yahoo Finance		https://news.google.com/rss/articles/CBMihgFBVV95cUxNRFN4RmNNNnQ1RFN2b3RRTjMxdEFDb19LRUV2RmdfdWx6MzVEb3NUTDlVcFNxbXZaSm5Bc3BKYVFxVkc0bXo3ZkRQcnBmSFdac3NfVXFWSVVacGZnR05ydnJsb1NpeWV5czl1OXpvWWF0ZnJMU1haRTQwV1dtaGdWaDFJbXhMUQ?oc=5
2026-02-19	Google	0.04	When will the snow end in Binghamton? Historical data offers clues - Press & Sun-Bulletin		https://news.google.com/rss/articles/CBMisgFBVV95cUxOZkt6LVh1OHRqUTA4RFJJQzc3MGdUY3oxYm1uU1c1bThYX1hrTEQ4SG1CZHVkWUpuWko0YnlsQ0NtR3Z0RUxnN0Z3NUVXbUl5SHVWcUo2SWlQb1JFUGlQUXpYT3cyOFVpUUFZc2hxTVZXZGJ4bmhEcHRNVE9tOE1DdHE1ckpKY2tqOUNWUzlxaHJMMDRVa1I1YXF1ZTRxSEdaOWtPMjVNaV9HSVNxWXFraGNn?oc=5
2026-02-19	Google	0.025	Shia LaBeouf Raves About Church, Sex in Wild Clip Recorded Week Before Arrest - Yahoo		https://news.google.com/rss/articles/CBMioAFBVV95cUxNTG93U0N0WGFwUzZqWVc1R3FDNmlGb0FoaVJnYTQ0TDhrVTEyQkRaYmpuRm1sT2I0cS1xQ2ZyRHBTUENlWjBBRWpFcHpKMzl0UFh3NnB2Tk9WdmRRV2xqUm8wQWttdEhpWU42cjlGbFJ3LW5VclctNTVtVG1Wa0dzQktBLTJGSkhUOUNHS0ZnblJSTEVZdGVKQnM5RWhwZ0lD?oc=5
2026-02-19	Google	0.0	15 Wilmington actors who are well-known for big TV and movie roles - Wilmington Star-News		https://news.google.com/rss/articles/CBMiiAJBVV95cUxQZFFlWHBuS2gtT0xlckJxb21CQUxQMmNtaWRYem1fVkhWanZzUzFKR2xYMFJ5RFJjdW15bUxKLWRra3FyT3Jscl85MHB5OUJZWEVCclRZMng4aGE2UDhkY09VYVdFNG1Oam1pZzBnWTlXc1o2UEpmVm9ucnhKaDZYdDdad1ljbmFuSThyTjZsRWU4TWlPaHJ2Q0I1RDlXTkNLMm12TlVxNll2V1RieEt0ZlFOUjJXUmlpRGFONUhQdVltM1BzVExwRmEtSE9jR3pqNk84OFA3SzgzTWFoMkF4MEtZWlVaQmRfSVZ0bHVXNm52eWxrRVduRDB1NVBhb3p1OWhjbktlMFE?oc=5
2026-02-19	Google	0.0	Accelerate 2026: Driving AI automation across IT and networks - TMForum - Inform		https://news.google.com/rss/articles/CBMirAFBVV95cUxPaXNCUHBQZWFxeGVHdVZjYWV1QzJrZWwwNmJaVVFYNk5XRFE4enh3WkdQWTA3c1FQWUxJekRwLUdOZG5VMFpoakdWR1AwY3NaRVhaXzRjeUlqSFJ3WlJxaTRwaHlRb1RaWENHZFhDeFdwcnhDOVIybnMxSlpyVUFvZTRwWmpKWTV2eENLMW1Oc3Y2RHMtTk5IeEw2ZVd0aHNxTEZYRjVkc0VzZlBP?oc=5
2026-02-19	Google	0.0	Amazon Says Atty Accused Of TM Scheme Used AI Citations - Law360		https://news.google.com/rss/articles/CBMimAFBVV95cUxOV0l4Uk02RmpLcTVFbHIzWUdqUDJpWkVJSGliV3NUX0MyLVZLQU9JZWlNeVlFbEdwNEFWTjBCQXBZTUx5SDlLNGJhRHJ4NHZvS2hKYXRIZkNtYjRwNHNNV3FYUjR6NjVfUlo5NEFzNmVZUmZYbFAxcG1DQk9hRkxSUWwzS1JVYVpWbGlZU1BnUVpTRG9ra2FYQ9IBVkFVX3lxTE1DNzhTazViYVM5anJJNndHcDdQS2c0dlBTR3UtNG9NcW9SRVowS3NWYXBKbGhNd0JONjhaWlp2aXNqbFdjdml5YUdlWVZGR0hacGl5QWdB?oc=5
2026-02-19	Google	0.0	Apple Might Be About to Open the Floodgates to In-Car Video Streaming Via CarPlay - AOL.com		https://news.google.com/rss/articles/CBMigAFBVV95cUxORUhCOXpPRkc0NFpUT255WDMyY29qZF9Xa0NaODJhdVpjTXZsVk1iUHh2Ty00cW05RmpIRnFsMHJMdHlvRG1aLWFVZTJweE9VQXdiY2t3dHFMT2Zzb2VacUxXX3VPUi1keV9CNzN3NkdwWGhrblMyMFBlY2RodWtzNw?oc=5
2026-02-19	Google	0.0	BrandPilot AI Launches ClickRadar(TM), Targeting $63Billion[1] Bot Epidemic Problem - TMX Newsfile		https://news.google.com/rss/articles/CBMivgFBVV95cUxPS3FWMGJMbThDQndTTDlvWFlNOEh4enpSRHlkOEhWUDNCLWVxYkFZbWhHV25uRXB0LXFzX0NjTlVtTGl2Z1piRkJSb1Z0dVNHaEtCbEh2XzlXeC1MMUY3YXhtYUVqbko2MWJQbnp5c3drQUdCenZxUVF1VGI1V1NMRnJEcF91Skpya0ZjakJZaFdjSUlRZWxhV1c0anc1N01PU2t0Z2NPWlcxbERITnIzOG5TTFdXWjVEQmtXeTZR?oc=5
2026-02-19	Google	0.0	Bristol-Plymouth boys basketball's Aisiku reaches 1,000 career points - Taunton Daily Gazette		https://news.google.com/rss/articles/CBMi7AFBVV95cUxQc0VyX21FZXgxaDd0WHh1UzFNeW5CYmJ2UE1JNC1LOFNzWUc5aW1ZdUd3c0ZNU2tkUUpOQ3NBQVE5MmRac1podm9HVnUwMjQxNmNjdEFmY0dpZjJuc2VzaDFWdTNpNjdCUTVJcnd5THZvOTI2VVVlTUkzY0VVTFdnN3ZJalJoQ1M4Z3lDVDVyb2UxTzI0TG5BSHM4RTAtRHZzT001MVZEazVNQ294MDJlcXF6YmNRU0FtNGo5cnNjN0M3N3lKemRkR09KZzNDeG95b2M0OGNWZGRSQ0VybENjOGxqWVFkcGpBSVJzeA?oc=5
2026-02-19	Google	0.0	Chelsea news: Jose Sa challenge on Joao Pedro was a penalty, panel says - BBC		https://news.google.com/rss/articles/CBMiZ0FVX3lxTFBtVlo3ZXhZdktMV1pkU1dCYmxrYjBfQzV0d19IMW5nY2VQX2c0Rml5cEdYQ1V1NVN5TDRGZTFSaUZ4LXdCZ1pydXNJR2VjY1AzV0FKSThNZzBGdHNJQ2tRazhNdVFWQkU?oc=5
2026-02-19	Google	0.0	ECB: Leadership transition raises policy uncertainty – ABN AMRO - FXStreet		https://news.google.com/rss/articles/CBMipgFBVV95cUxNdjliT3lXcTRmT3hfRHMzWktVcUNlSlVuWmRzOHRKTFBIN3JLNk9tWHpYZkhWdnJPU2RXdTY1eGdtTnhRdmdPRlpIVWdaMHhnakxyMW4xSWM0NU9VSFJrbHpUWTdiUnJ1OGFzWGxfSGJxMjdrYmQyQTFtd1hpLXczaFIwWjJmOHoyTlR5ZEZNTlV1TlFaM1RXT19Sek1vSWswSzBELTNB?oc=5
2026-02-19	Google	0.0	FSU achieves record fall-to-spring retention of first-year students - Tallahassee Democrat		https://news.google.com/rss/articles/CBMi1gFBVV95cUxPcjFaVDJMWjVUMHd2ZGNrVDdQMG9Ga0duLTFEdGRWZDJ1MWlMNS1jeEthYTFXbklrUTgxMXR4VmkwSXZDOXBBejgxMHgwd2RfNFVqdTdLR3Z6eG4tVGRNa2liTXU4Qi1QTDZYcEY5WEdHbjltSGVoSy1nQzhlVXhXSmFZT2pfTnpadDFVYlBCbnRpbTdFNjZSOURyOWNMODBPdGVtWWEyWlQ2TzFoeFJtQUxZMGZBUXRsQ1ROZGZ5R3pBbFoxTzI4OGlGYmNRRS1rcWJ4Tmhn?oc=5
2026-02-19	Google	0.0	Fatal crash closes I-69 southbound in Fishers during morning rush hour - IndyStar		https://news.google.com/rss/articles/CBMi8gFBVV95cUxPQU53S2NURzh3SnVxX2pTdkFtVGQzMkswM0dIU0hvNlVnOE9HbE1WV3F1eFVET3cyLTZZVGJRWm42SXo2TXEzVmltUEtWZ3ZiUXNzNU9TSjItYWVoTkQ1SEdpanVrSUhWZmdPMlhrUkswRk5MVXpkZ1F4UDN0aTNfUEZ1aEd2SnB2bHdDdnV4alRLaFZmcGZwNkdILVptY2dselBObnRnSXFpbEpQX1RBbXFWTnI5U3JmTFU4RkJRTTlnRjBfR25jd0xubzYtdkU2THJNR25VWWp3bFpST0daZHFVV1hqcktDclg4TGttNFJYZw?oc=5
2026-02-19	Google	0.0	Fed up Wolff slams speculation around Mercedes: 'Maybe I’ve been in the Epstein files' - GPblog		https://news.google.com/rss/articles/CBMiswFBVV95cUxQckxUSWZlcVUzVzFkUllscWF6NHNFLVd0bU1JWXU1bDczZlY1b3g5NWxzYTNFeHphdDhQUGpURG9oNmo0dkZMQ2NPbHpPb3JTcTVvSVpRREE3ZmNUZEVGVzd5MjdYZkRpckNjS2MyeXkxeEQzQzRTN3JWcVdWRHJoQ0JUNS03NTVGWVJQU0ZEN3lVN3BGNmNnNFNMUmRFdEVINlh3Z2VxbVJ4X01VLWtseVluUQ?oc=5
2026-02-19	Google	0.0	Harriette Isabelle Roehling Obituary (2026) - Plantation, FL - T. M. Ralph Plantation Funeral Home - Plantation - Legacy | Obituary		https://news.google.com/rss/articles/CBMiiAFBVV95cUxOMXdVOXppSnJtc21mVm9Qc2dxWmFUenoyQm1DSElVVXRHVlBKSDJwMTY1MVBVUGhIcGpab3VoWERENzFxMUI2a2dfcl9JV3JQR0pxbkk1dDg3X1BpWllPSWlnYjBzblZ0SVRxYllBVXpQTVlUQVRIajM0WjRVQTJmb1BZRUVVUWFn?oc=5
2026-02-19	Google	0.0	How Szoboszlai became Liverpool's key man - AOL.com		https://news.google.com/rss/articles/CBMihwFBVV95cUxOZjdOalVqWEJBSEg4UE05cEgxbDBxZ2hPUmJ6ZkxGVjRoWlRZYkp0WWMyWEI4V0I1dnV5UDRrZEpNeGdUVXRGRHp6cHdITXc0dmJHdmFLMFhUTENMa3I1aGNfM2daRjZneUFSZFBEbS00OXBvREp4ejhGU2JLV0FOU245djhHVUU?oc=5
2026-02-19	Google	0.0	IHSAA girls basketball playoffs: Ranking the 16 semistate semifinals - IndyStar		https://news.google.com/rss/articles/CBMi2AFBVV95cUxOSHZ4S3BQUnhRbmVCTHBuOHhUV3g2WXlzQUxFbkVYdU1CeTBESGNPcWVsMjZ0cXJrT2RXek0wbjJMS0cxTDNiYndlT1FYTkFWVkQwenZGTEFBWW9kM2pDRGVoME1aNEM0bzEweGdwRnYxeUlnV09iNzJpX2N2djdqLWdOM2JnVkU2UlVWVHUtQmVZUWhQeXBqZ1RSYjZPazRqcWRtTDZBcmJXTW8xSy01bkRCWDVUVm5rcUVjV1ptZ0NiY2dRaUdUZlFIeEptT29uSnMxRktxTFo?oc=5
2026-02-19	Google	0.0	IOH’s CTO on building trusted AI at scale - TMForum - Inform		https://news.google.com/rss/articles/CBMinwFBVV95cUxQMjN0NlNWb3VSM05aVl9sZUZMVHRuSWpmaG8yVTVSSkMzcGVrYXZLZGZVU05iY0xVb1ctVEcxdWJZeEZQWlRwTW1UdlVld2NELWgyMnBiM2U3NDdVd3Nsb3I2RzRMSXMxMkcydVRXalM2YzZwMDBxLTZLcU9Qay1IZ29KcG5LcVlURW51VmtlcDM5UE1BNG90bldBY3JJaTQ?oc=5
2026-02-19	Google	0.0	Interstate 80 reopens over Donner Pass; WCSD on two-hour delay Friday - Reno Gazette Journal		https://news.google.com/rss/articles/CBMimgFBVV95cUxQcWduektVTkVJSG10WXhBLUhHY2Y3SFV4QmQ0b0IyM0NOaGVhRFl5Rkc4Ym9hYXJPZFg0c0loZDlrMVlEblRraE0zd3RVM043VVFqVnZ5d0hWdkJQSExTZFp5RHNncGlUSUtud3JZeUw2c0N0Q2ZQZGZoQ0xZSkhyYjZyQmpmRExGczNIS0tKMXJIVDl5dWZXdHl3?oc=5
2026-02-19	Google	0.0	Kevin O'Leary Says AI Is Quietly Creating The Biggest Content Opportunity In Years - AOL.com		https://news.google.com/rss/articles/CBMifEFVX3lxTE1LYkRmVFRpcGhCZTdmYlFGRjk3TXQzaG9mLXN4V2pPM2RJcGQ1blJ6aVdGTWVUS1l5bm92NkoybjFSaXh2NzNxZWtJQVhYZTBMbVVjNHF0V0lRbUJyTmZveE5TNXJ4eGt3ejlsT0FqaGxtR3pMTVJUUGNFTHI?oc=5
2026-02-19	Google	0.0	Midtown OKC's $10 lunch week returns with 20+ restaurants - The Oklahoman		https://news.google.com/rss/articles/CBMi1AFBVV95cUxNc2xzVmY3djhWWEozRWZOTEkyUUxKVDlEU0k5NGM2OFFtcDRVS2dUcFR1c3JXS2hiZlVhUU9pQWNfNWxmMWFQS3RIR1ZjdkJzRjA0Q2lyNzZhQnpQRDFlQV9oRmtmLUdPRHc5YXNZNnFOMHJyOEhZUXA3WElJNUh2TDRXX3ZicURQUTRFb09TY3lvZjdrdWRCRGxPYm5WdXJNRGM3c2lBVTF6UnVMR1ZFUWlieXlObWxhdk83RHh5TU5xNEFDRmtaMHFubWE4WUd1MEdkZg?oc=5
2026-02-19	Google	0.0	Missouri basketball coach Dennis Gates on last play vs. Vanderbilt: 'Oh, s**t' - Columbia Daily Tribune		https://news.google.com/rss/articles/CBMi8gFBVV95cUxOYWV2THNvMTNtdVhkWHQtWmh5aThVbVJOYUg3Zk95Vzh5NjdPaHJLQjZuTmRyUHhyNThOcW0tVm1NTEEyNlJpcVFGWkxqczM5UzktSkNLQl91eE9PRFVySnVPV25nQmJpUENBdGVWTXJQajh1T3B6TzdVQ3h6YTdQazFpSWZuUHpkRHVwcFNUa2FMUFROa2NqeFZHWEFwdTFnZzFFckRiem9tM1JnalJfTWl5SmVoNllNYUtBcWgwWmgtMFRnZE9kR29UZE1IZFdZd3MwVnd2ZXJSZEluZ3JkdDdnVlhOaGM1REtZNlJlZjJCQQ?oc=5
2026-02-19	Google	0.0	Pakistan hockey chief resigns after banning captain for 2 years over Sydney fiasco - India Today		https://news.google.com/rss/articles/CBMizAFBVV95cUxONnJ6amZMMUtsV3hYS3hEelpZLXI3V2FMbEZfQ3I3QVZDak9KZmNHQXRheWVtMFd2WjRXTjJHdlplU1JJSmxGOWJvUTFfbTlCQzhYN25SLUtwbWdDeWxVUlVtVjFPaXFsalR0eXBRR1NpNzI5UVlhSVQ1b055RG1WOUFxLXE0RkloSnBsU2lKQ2R4N090aThOd0pGSmE0dzh1NXJNSm1kSWJtSUhSNkVKcFd2aDBzY3dqdGZHY0R1M2VsV3doUG15eEdMLTPSAdIBQVVfeXFMTml5MDdhaXF2dlZuWGpGZ2ZOYzU0aVl3RFZka0ZrZ3ItMzlBNncwaHNyWWI2OUU1Wkl6YmRUTE5aS2daWlpZUE9WN3pZNkVtZmVCNGFoNVJyaGd3eUdlYjN5b18wcXVQU1VhZkdlc3kySFdNRDJGQWpFak5uck8zT1p3eGdmN1ctckhnc1VfVEk0aFNEb1NwakpjRDFHV0djVXZ6WU1fVFc3a0tyeXVBd1JBTUJTNXphV0NsUzU3VFhzdk90NElwNFBpaVNhMVQ3bVBB?oc=5
2026-02-19	Google	0.0	Results UAE Tour 2026 Stage 4 | Jonathan Milan powers to victory as break finally caught in frantic Fujairah finale - CyclingUpToDate.com		https://news.google.com/rss/articles/CBMi4wFBVV95cUxQcHJPZmtjTkVRWUswSHNxRjN6VFN3MllLZGFKN2hVaTJReEZoRl8tV1k2MENIS1NPRkFrVlgxQWFzMVJmbDhMYW9CbFpqRkhoaWV5eHVtQXhfTkFHZXh1dW40dXFVZGFaOFRFdUV0S2c2ZHVYbEhCNDZiMnhxX19Lazd2X1dabmlJY1hucV9hN0FOOG8tOG1KeHpyV09fTFhZaktmNW9lU19JcG5jUmdPV24tUGhDeld4OS1oYVhLajRUeUQtNno0UC1lS0NObTJkU0F1Qnl2VlctemJ6bEdmVVhhNA?oc=5
2026-02-19	Google	0.0	San Angelo ISD investigation by Office for Civil Rights still open - gosanangelo.com		https://news.google.com/rss/articles/CBMi-AFBVV95cUxOWDY2VDVCa0d4S2w2Y21qQ1Z2WmhDZ0ZYSGg5WHc2V21KSHFkTkREekNwZDF6Vnd5bjkyX1VwcTBaVXl2U2ZENTBBdFJNNnFrcjRkMGw3QXNiZ2x3VmZYdkRGV0dmRHMyTWFQNkE0XzNtNGd0d1dCT3lITlNZYVBKUUprbHFuRXJ2bDR0YVFJLUtmSDBRV3huOEFrcVVqbW5xU3JOenRKaTR5TzZGOW9jcGV5Wk0zaHJYYXdhRFhqRU9uOTJoZ2o4MENmVXliekllVjJIc0s2NldFcnV4ZHBVelRQRE5ObVdfYzZXT0J5Q2h1R1lfOTZ1ag?oc=5
2026-02-19	Google	0.0	Tennessee defeats Oklahoma basketball - Vols Wire		https://news.google.com/rss/articles/CBMihwJBVV95cUxPZTZhTkZvcGV0TF9jc3pIRlR1Rm5wQzN5ZFZSNkFfVlJ3Y3JoYTRhZFNuQWxNZ3k1LVJRVnJWdGRGenR1OEhjLTlxNjVUQzJuYTVTV2l1VVNhTkhFRE1XYnAyUzBlSEFhZmFTN1BVYUtpUG5uekloWTh4TU1ObEVjNnhEaHZ3YTB5ZVZuc0pOSUhlell5MkpLRnUyYUpDb0pod3ZlTEthUGplak5mMGN4QXBXT3JlUTQ2ZmJhekZQVVRRSEpneTZFeUVQNk90WFQ3WUJldWs3ejdwaG5zeHVVdnJvdkU4WHd4OWFYMGhhY3luUGNZeEh6YXNXRFhtX2o3SGV0SGl2MA?oc=5
2026-02-19	Google	0.0	Thad Matta secures 500th victory during coaching career at Butler, Ohio State, Xavier - IndyStar		https://news.google.com/rss/articles/CBMi-wFBVV95cUxOMkRVMEhLTVYyckROWTdUdl84d0VaYUh1cjRVdnFhM2xoS0MxUEFPd3hJVGNZSjNjOG5sVFZtY3BDdWRCSmRzZFBBc3ZkWlFtVzB0bFNNS2c3Z1ZsZHZoZDJoY0pwLTNCaHNRWVlWT2dSM0J5cG5WRzduT3lxUnp5c3gtbk1MV1A5QzVFSllrUEFhNHFXM3JLVWNvQmNzZVJ3c24xNHJaQThiZ0c1M1pxNjBHYk5fYUJvMDB6cm9ZV2RNVld2TmNJeUxVWldPWjlxa0hFNkQtcWFTNG43Tl9pZmZOUmNmUkdsazI5N2NyaUZ4am13aWJUUVZ0UQ?oc=5
2026-02-19	Yahoo	0.0	This Fortune 500 CEO says ‘lean manufacturing’—the management philosophy Toyota made famous—is a prerequisite for leveraging AI	Also: All the news and watercooler chat from Fortune.	https://finance.yahoo.com/news/fortune-500-ceo-says-lean-103158808.html?.tsrc=rss
2026-02-19	Google	0.0	Today's Wordle Hint, Answers for #1706 on Thursday, February 19, 2026 - AOL.com		https://news.google.com/rss/articles/CBMigAFBVV95cUxNQ3BIeElIWFhiczRhdl9fUUZOdVZFSzAybHNnM0xfRXc3a0pGTExDeFVCTzJJT3I5Z01iZlcxVzhSeDZLQ200NEZ1RlNBbFl4cEdBRkh5ZEVUU1hEWVlzUWh5V2dUOHFyMXY0b3NVM0lwQjE5c3A4QU5fLXZWNzZEMw?oc=5
2026-02-19	Google	0.0	Townsend on recalls for Kinghorn & Van der Merwe, 'motivated' Wales & Tandy - BBC		https://news.google.com/rss/articles/CBMiW0FVX3lxTFB4MEFDQnUwNlI5YXFfMW9kVlJ6MnRwUU1pYXhzNHNTQVNZVkFpT1VTbUo4eVM2dERaVEFLMDhhRldsanZndDVLZklEVTkwaUpqdkNFQjhIc2VRYWs?oc=5
2026-02-19	Google	0.0	Truck battery box clears rules on path to big-box shelves - Stock Titan		https://news.google.com/rss/articles/CBMiwAFBVV95cUxOZjBTV0dQa013QU45SzdVeTBtRDNfdjAwS1JPUlVRN0c1QWVPR0d0S2UyUkNLSTFzYzJMVkJ0b3UtTm5XWjdNbWFUYkVVcjRCWkdZaU5SZ2R0R0lHWVhZOUtuVHNSOTlvRm5JbHg4V1pXM2dvOU5uZnFTSnJWcVQxTXNQR0s2bkNNSkUweDBUOU1fb2NzQmV4SGsySE9FOUphOExZNVQ4X19COWV3S19Ga3JyN3FMM3hQNTZkUXhnNGc?oc=5
2026-02-19	Yahoo	0.0	US trade commission launches review of USMCA automotive rules of origin	WASHINGTON, Feb 19 (Reuters) - The U. International Trade Commission has initiated an investigation into the automotive rules of origin under the United States-Mexico-Canada ‌trade agreement, the commission said in a statement on Thursday.	https://finance.yahoo.com/news/us-trade-commission-launches-review-171628207.html?.tsrc=rss
2026-02-19	Yahoo	0.0	Visteon Corporation Q4 2025 Earnings Call Summary	Moby summary of Visteon Corporation's Q4 2025 earnings call	https://app.moby.co/home/research/tools/earningsCalendar/earnings-visteon-corporation-q4-2025-earnings-call-summary?utm_source=yahoo_finance&utm_medium=rss&.tsrc=rss
2026-02-19	Google	0.0	What Gen X Thinks of Millennial Metalheads - PopMatters		https://news.google.com/rss/articles/CBMiYkFVX3lxTFBHNWxlZ0hVZk4xWXBmaHlBWDJfelp6VWJNVmJyRmFKcUlKMGdLMHNlbGRsQW9jM1dGWTJKZmZ0cmV1TnNCSjdOY3BwRUp3cmVYMHRJMUlwR29vRTB3VWdkZXh3?oc=5
2026-02-19	Google	0.0	When do the Winter Olympics end? Closing ceremony date and time - Cincinnati Enquirer		https://news.google.com/rss/articles/CBMivwFBVV95cUxOaW9maHJreUNLSW1rVkFGZjI4RjJsUDRTYklqei1wUXBCQ0hYaV9uaGIwdXREa250VnlVTW8zMzhVUUN4RUgtLUJMWkxkcFQwYy03cUxlYXVSVU5CY29BNXhtVnV6eHE1Mk9ZZWt3VXZXcnlCbHpNWEZDaTZtOF9yUHZHa0RQSjN2U3hYSFMwR3k0enE5cVFkdmZ0UkZmTFA5Z05UVzVUbHdTTEtabUJ2Nl9ZV2NOWjZuaHhCWXVrYw?oc=5
2026-02-19	Google	0.0	When is daylight saving time 2026? Delaware law may make it permanent - Delawareonline.com		https://news.google.com/rss/articles/CBMiwgFBVV95cUxPU0drRGhvMk9TcEZqSUt2cFFmX1h6ZlVaN0w2TXpCa1JvZnRBM0FER2hURU5OSjNtNVBwODAzaFBwZmsyVUlSc3dkNlg5OWtLOXBwbjJUQkZtMVVXQl9oQm9KYlJxM0tUZXN4TWNOQWtmdERKS2dvOUpkM2F4WnBFblFqREJMb3h1alRkWFVSTjlNNENUYkY1b01UaUh6RlNjQWZVZ0lIaTV6a1JEU3o3akgtR1NxdGVTUzIxbHJZQlUydw?oc=5
2026-02-19	Google	0.0	"Worksport Secures Key Certifications for COR(TM) System; Clearing Path to ""Big Box"" Retail in Q1 2026 - ACCESS Newswire"		https://news.google.com/rss/articles/CBMi6AFBVV95cUxQRzdIdHZkNGJyUi1JS3JSanozMUVFakFWVXBxUVVBMVVhTmlESENiX0w1MFQ5MXdzODVCVlR5UzVGNURBSDVleUtYWjZZZEI2S216TFJZbEVjcF9ZRWFvdGVpOE1Qdy14TnQxenhJbWxGSFk0ekp0SVhJMlBab1BmX1c3U0hTcnNxcnB0RUEzekxTaXZUWm4xNmRYNUh6UGhDSUxrZkpBY2J0bnYwTk50dzdfYnBhc0dhODRoVzVFWXFBSEpDV05jVnEza1lwekF2Ull1R0lWY01qNlJaMTktM3ZlOXBXSFpC?oc=5
