Date	Source	Sentiment	Headline	Summary	URL
2026-02-12	Google	0.0	Toyota Motor (NYSE:TM) Coverage Initiated by Analysts at BNP Paribas Exane - MarketBeat		https://news.google.com/rss/articles/CBMiwwFBVV95cUxQdERrSHBmdDVqQURLOXBoeS01MHVjRWxkQ3loZC1KQ3g1Z3hFaTQ2X1hBTGxWZnU1ZmxEeEFGbHNYZkxlSko5NHFuQktwbU92WE9IYzVISy1ER0hIeTUyT0VOVFJwME9kSTYyRmNZejd4cHh5VTNwN2VXYUwxaEFCLUN5WUt1ZzA0eUxPQ043anBueWd0dmxPQUpZdUF1OEJSaGVyY1ZMSTY5YzB4dERQSWZrN2RjVFJyR0dCek9yaVpGQUU?oc=5
2026-02-11	Yahoo	0.136	Why Toyota is expanding its EV lineup with new Highlander	Toyota (TM) is expanding its electric vehicle (EV) lineup, with the revamped 2027 Highlander. Yahoo Finance Senior Autos Reporter Pras Subramanian joins Market Domination host Josh Lipton to share the latest. To watch more expert insights and analysis on the latest market action, check out more Market Domination.	https://finance.yahoo.com/video/why-toyota-expanding-ev-lineup-211551843.html?.tsrc=rss
2026-02-11	Yahoo	0.1	Elevated Style Meets Modern Power in the Next Generation 2027 Toyota Highlander	Striking style, everyday versatility, and battery electric efficiency, that's the all-new 2027 Highlander. With a stunning new look inside and out, and seating for up to seven, the latest Highlander is the all-electric Toyota built to carry the whole crew. It is also Toyota's first three‑row battery‑electric vehicle (BEV) for the U.S. market and the first BEV assembled in America.	https://finance.yahoo.com/news/elevated-style-meets-modern-power-023000265.html?.tsrc=rss
2026-02-11	Yahoo	0.0	Aurora Triples Driverless Network to 10 Routes and Prepares to Expand Across U.S. Sun Belt	PITTSBURGH, February 11, 2026--Aurora Innovation, Inc. (NASDAQ: AUR) announced it is tripling its driverless network with the launch of its latest software release, which also provides the Aurora Driver with the capabilities to begin expanding across the Southern United States and serve customer endpoints in 2026.	https://finance.yahoo.com/news/aurora-triples-driverless-network-10-211500893.html?.tsrc=rss
2026-02-11	Google	0.0	Susan Leigh Galt Obituary (2026) - Davie, FL - T. M. Ralph Funeral Home Sawgrass/Weston - Sunrise - Legacy | Obituary		https://news.google.com/rss/articles/CBMifkFVX3lxTE5fYVoydUJIQXlpbndpb3JmYXBpdk5uaGdKMnlpUWJwdGZXOWJiSkRhVmduUVhGUFVFUTd1LXViazJZeHpDSTUzYmtQajROWHZwUE5qWTVwRmxHdnlDLXJJX241UUpKVDl2WEZiYlYzdUc3NTg3RDdYWU5QVXBJQQ?oc=5
2026-02-11	Yahoo	0.0	Toyota Shifts Leadership As Highlander EV Tests North America Profit Focus	Toyota Motor announced that CFO Kenta Kon will become President and CEO in April 2026, succeeding Koji Sato. The company introduced the 2027 Highlander as its first three-row, fully electric SUV for the US market. The new Highlander EV is positioned as part of Toyota’s North American manufacturing and electrification plans. Toyota Motor, TSE:7203, is pairing a leadership reshuffle with a high profile product launch, which gives investors a fresh set of milestones to watch. The stock trades...	https://finance.yahoo.com/news/toyota-shifts-leadership-highlander-ev-151201637.html?.tsrc=rss
2026-02-11	Yahoo	0.0	Toyota recasts Highlander as 3-row electric SUV, even as industry reverses from EVs	Toyota reintroduced its once-popular Highlander three-row SUV as a full EV with improved capabilities, just as the industry pushes away from costly battery electrics.	https://finance.yahoo.com/news/toyota-recasts-highlander-as-3-row-electric-suv-even-as-industry-reverses-from-evs-160850022.html?.tsrc=rss
2026-02-11	Yahoo	0.0	Will NIO's Recall Spark Broader Software Scrutiny in EVs?	NIO recalls 246,229 EVs in China due to a software glitch that can black out screens, highlighting safety risks and OTA fixes.	https://finance.yahoo.com/news/nios-recall-spark-broader-software-155900749.html?.tsrc=rss
2026-02-10	Google	0.3	Stereo Integrity's TM-8 speakers: Why I feel they are worth considering - Team-BHP		https://news.google.com/rss/articles/CBMioAFBVV95cUxOWW1nQ3M5aEZVV1hYUmdPRGhrWUNpWFBnZXdmTjk3TjRrMmpoRkFTR3VIRFQ3RUlFbVJxY2RndVRfa1IzUXJPTVM2b0NzS21tX1RxUm9STVhsN2dhcXE3dWwtWF9wcnFMMl9YTmxNRnpZU3V0eDMwTlFvZzlFbE5oMkY3UXBDQXJCRy1zSGJhdTBEbTRWWUtIOVFkVFRFaEh50gGmAUFVX3lxTE91T1V5OGpfV2dRcjNSbW9EMHJyQkhDV29NZnJRajl5RTdsQnZ1UXQ5cEYzQzRoNElUNDZkNVBpNkNyNzdJdHdJaHpKbzI3ZG9Ocjk0dGVrVkRHY08tTTBHY1pFMW4wNXdIY01UbktFZ3BvVXRxS0Z4R294blZRRUgzdFlHUWE3T05XWTVER2R0Uk43TUtQTTFOZkZwN0duMGt4LWlSNGc?oc=5
2026-02-06	Google	0.0	Panasonic's nanoe™ (hydroxyl radicals contained in water) technology proven to inactivate harmful mycotoxins - Panasonic Newsroom Global		https://news.google.com/rss/articles/CBMiX0FVX3lxTE1XQ3hsd3FfdGZjaXpWMkZXTHhmVjloUnVUVlQ2aXVJNlVnZ1ZyaGRYbk5zYUE1TkJLSEtLa0l5Q2JBdnpWbEpwY2VyX1FYSE56T0UxUVVudFhaaWhySmFJ?oc=5
2026-02-04	Google	0.286	Are Investors Undervaluing Toyota Motor (TM) Right Now? - Yahoo Finance		https://news.google.com/rss/articles/CBMijAFBVV95cUxQNXc3VkVfN1A3OXVXb0RFTTdTbF81cmRCTXhNcm9UczVUOElMS0t6UklVZW5ma1ZKTEs1OVlWMWtaSGZNWWRnRDhxSGZDUDVuNXNPdmtTTm5FaFNfWlBkSG1UN0V2UzZpMVJra0RDOUc5bHF1Q1ZWd3ViOVRBLTRUWGQybVhHb2E3bzdCUw?oc=5
2026-02-04	Google	0.25	Toyota Stock (TM) Motors Higher as it Powers Up Hybrid Production Plan - TipRanks		https://news.google.com/rss/articles/CBMinwFBVV95cUxNc2N0a1dxYk1GZmNoeVBxYlJzQVpmTzFtc1pNX3FuZmtWRTI0ZTVBOVlMWVNSMWNnMDUyZXY4MkZjNkNWa0wzcFdSd3U2YzdSTURhU3ExbmtwNUpYSzZWdDhyM3hFVExuVGRfWnF1TnFIaXhLTlBFUFVaajhiN1JGS3lMUWNYSVp6SXBRdHJnSC1keXNOSWYtWVN1bGxTOHM?oc=5
2026-02-04	Google	0.0	TM Global: The digital infrastructure gateway to Southeast Asia - capacityglobal.com		https://news.google.com/rss/articles/CBMimwFBVV95cUxQZ0JpSVJITTA0SVRoSVdMWnN2bnpUSEhlcHZTYnJPU2cxYm9uY3JZeHJicnQ1RS1MMHFnTDdqVjkwZ296aXJNTlNxd2U2elNKYUJwLV9VNWphVkVjUjJwbVcyNEhtSU0xQlZZQmRIc21JcEdienByQno3LXFiMDhZeWZfZVBBcVNmc1pIbnFHSTBfU2ZtRUk0MnBWSQ?oc=5
2026-02-02	Google	0.0	FRUZAQLA(TM) (fruquintinib capsules) now reimbursed in Ontario to treat metastatic colorectal cancer (mCRC) - Yahoo Finance		https://news.google.com/rss/articles/CBMiiwFBVV95cUxNVnh3N2Zkc1NvX1EtTzBta0NjZDFMZWFyakNqbDZkTzBPdHh6QVhMTlMzbmRvRnI3WGRhY2llRXRqVldCZm9rdmt4VG1mdmNGbGNVam03bVJfX01fNGFOUU9TWkFHM3JTc3YwWlM0TzJ1YW1WUXJLSzM1TjhMYTg0ZWJFUjBFN3UwdC1r?oc=5
2026-01-28	Google	0.525	Toyota Motor (TM) Is Considered a Good Investment by Brokers: Is That True? - Yahoo Finance		https://news.google.com/rss/articles/CBMigwFBVV95cUxNYnI2MkU3RWJRb19CZVhjazZlQlhDN0dIOHFQUVROUHNOYTRaSjJkbklPRzUxbV9JOU5CUzBWUFhyMGNxNXBDenllYjFjNlhncmpBU29pNVBHOWN5VDhmT3J3dEpLZjFiNEwtT1BINmxySS1zcGVfaUpERGNLcWlJVmhOZw?oc=5
2026-01-28	Google	0.267	Is Telekom Malaysia Berhad's (KLSE:TM) Recent Performance Tethered To Its Attractive Financial Prospects? - Yahoo Finance		https://news.google.com/rss/articles/CBMihAFBVV95cUxPSzNnQVI5c2lzOUJpVXRtNDNKVFpyTjZqZHZsVG9TV1BPbHhLLTZKR0E4ay1XdkVMcVFvZUpXWW5TUHRoM2k1ODROR2U0S2dzNjFycEkzaGRvTl83empIWEQ3RnlVQXVsdVN4SVU2SDAwdDlsNkFVTGdqLWViNjY3N0ZIcms?oc=5
2026-01-28	Google	0.2	Toyota Motor Corporation (TM) Registers a Bigger Fall Than the Market: Important Facts to Note - Yahoo Finance		https://news.google.com/rss/articles/CBMiiwFBVV95cUxQSE1UOVM3eUpRQU9qXzlBcUQyVlViUWFIRHBoYVk5eDdySnp2MFNGY1lwUllONEkzWWhqWTNkbTlXTDV6cXQzN1hQdWNSMFB0QjZxUUZud1JYYThkSVF5V1huY0lGSzZTblg1c21kQVdkclpVeld6Wk9fZ3pveVFLSFl2cm1TNVFZMFdj?oc=5
2026-01-28	Google	0.145	To the next level: Birketts’ new TM lead eyes ‘end-to-end’ service - Managing Intellectual Property		https://news.google.com/rss/articles/CBMiygFBVV95cUxOemcxRnZxRjltalh4Mm9nQmVaSWlQSlNfb3J4dFNBSmo3TGlaWkl0RDZ4MFRPaDgtOXdpUjkyaC1LWXFRU2l3WVFXcDJfNDR2SEdiNDB0Mk1rbUNhU3hhODJISUJ0NmxKZGZhc2YzRFEyeGd4QUFCY3YwZk1LM29kM1lGRVE5QlNwTmF1dExsRVZfbzFkSy10VHFFZ2V5OXgzbVh2c21TWmJLOFZtcUV3dGRmWXFXdlpJWGxSQmJ0UVV5WnRVT0JjeHpn?oc=5
2026-01-28	Google	0.0	38th Annual Dr. Sadie T.M. Alexander Commemorative Conference - National Community Reinvestment Coalition		https://news.google.com/rss/articles/CBMiiwFBVV95cUxQc3ItM2N2QzdOZlhZcm9LRGIwRjRQVzJCb0lfeDVjVlVUQ2JMT21VWUhIOTBDNndBM2tlZEpDOEZjclhybEhTcWxlQjRxZFUxLWktWU9URl9JTEFsYmxFT3g2OU1pLTdXREZvOHFmV21NSGNXM1pidVc1Z2NDWFZhUWVjTVc3M1A0UG1V?oc=5
2026-01-28	Google	0.0	Rice to announce support of FIFA World Cup 2026(TM) Houston Host Committee - Rice University		https://news.google.com/rss/articles/CBMiogFBVV95cUxQSXBTMXd2QXdRY1ZUTTBwNFZ1Y05VYWhxVFdGZ2VKSEYySnNEYkJPcEZralcyNFdPbXo5ckM1cUFuMjUtb1VlaEY3SkY4MVJiVE9oR2hrUkt6S1pzc1hoci1xazdlNElySHQ3aVI4ZTZGYnRWTjFzcFB1Z2FfY1pYdHlUMjk3ZFNmSDZwdWprd1czYjRjLVJOUDhwb29SV0tGa0E?oc=5
2026-01-22	Google	0.0	Integrated Quantum Technologies Unveils AIQu(TM) VEIL(TM), a Breakthrough Quantum-Resilient AI Infrastructure Platform Redefining Enterprise AI - Yahoo Finance		https://news.google.com/rss/articles/CBMilAFBVV95cUxNcEJFWW1sRi1tQm5KVlVZc0RSSlp6c1ZxSmRHam5IM1pVZGRLWnFETGVSbkFNd1lQYzBVYTJmYnVrZUVIZUQ0c2JRU3dkVVFYR3Z0UEI2M1FMOUcxSUcyR3BYMjhraWJuWWJBSG9TT0xvRFdLamU2Z2NjSnQ4OUM2aF9nRHlBQkhka3VHV1FFYThjUUdj?oc=5
2026-01-21	Google	0.157	Aspire Biopharma's Unveils Bold New Era for BUZZ BOMB(TM) Caffeine with Dynamic Website and Packaging Redesign - Yahoo Finance		https://news.google.com/rss/articles/CBMihwFBVV95cUxNNWM1TUVOelVCOHozT0dWTWhuQzJuZFp0aXZPMFhXS00xaVhjVnc3NUdkckRwOEFHVGtoSWZ1N2NHclhEMTZ0aGxUcTd0Vm5vNVhRWnNHVllvNGw0SGZpdlN1ZDBRdUpXbUtDQTBXVFNzOFk5SmN0dzM5aUJKU3ZxTVA1clVrQ0k?oc=5
2026-01-21	Google	0.136	Braskem showcases new I'm greenTM bio-based grade at Pharmapack 2026 - braskem.com.br		https://news.google.com/rss/articles/CBMiuwFBVV95cUxQY3JFdzhld2RhRHNqbEh0U3owQ2hNZUc3aHRpMUd0Mk5YRUZCZV9JTEQ4dGV1ektDajZ6end1Z0h3Y3RHQjNIM0FlODdkeV9hcHBacE1Xa2p4YkJlOUs5azRqRms3OEdUNGF4U1hJclQxX2NxbGpfLU9rRUhtNTdHM3Vib0ZKb2tYN3JiLTdmaXozOENGWmpiMGNfY2cwNEZ1b2FLWno5Q2ZCYjE5NGFLVWlaeDU2M1hiTnNF?oc=5
2026-01-20	Google	0.5	Toyota Motor Corporation (TM) Declines More Than Market: Some Information for Investors - Yahoo Finance		https://news.google.com/rss/articles/CBMiigFBVV95cUxPQXZ5R1ktYVQ3c0VZUlhXTmg0ajZNdWlCeEFub0xXWGJob0hlOG9vNnBhR2dPSkxtNFMwOUpJU0U4S21uT1hhdjRpcjNCS0czV2JmbUs4R2tZamtmanFSREdDMkpfVEpyOEhDU0xYbTRUU20tM1BoWGZiMloxcEdCT2YzQjF0VlV6TGc?oc=5
2026-01-20	Google	0.136	New York Times Review: Katie Benner ’99 Book “Miracle Children” - Bowdoin College		https://news.google.com/rss/articles/CBMiowFBVV95cUxPM19vTl91OFRUUFd2bDdzbUpwa1doLTBsVlFuVlZqalA3QmFhRS1tOUNGbGNVYW93SmZpM2xiNFpnWWEwNThuYS1GdVFwVUF0U0ttTXVoWTFwM2xhQlBtMVVSYWYzUXVabE51VThmVEJreTJ5VldheXFiWE9VWnV1cHczeU5Sc202QUdXZEZLcDkwSmk2cnNtTzhET2tsOURXdlFZ?oc=5
2026-01-16	Google	0.3	Change ahead: unpicking China’s draft TM law amendments - Managing Intellectual Property		https://news.google.com/rss/articles/CBMivgFBVV95cUxQaUVhTTBJalY3NUl3NkFYRkVXQzJGUUw3Zk9mM2M4dW1Wc1JUMnJTUVc2a1RYbjMxNFNyUmp5a1laX0tjZGczcXdlN3F5LUNGeDMwZ3B3ZlFJeGlUYTBuLW5fenA5TENlVWFoREV3TklRRy12d00xSExYWWo0S0E0UDNTU2U1eno2WmxyNWJRLUdLbHFnZjZKclozNDYtd1l2WGpKZzJjNGYwcy03anN0a2poMTZFSDhfNEVPcDhR?oc=5
2026-01-15	Google	0.175	The tm:rw Store Reimagines the Future of Retail - Cool Hunting		https://news.google.com/rss/articles/CBMiggFBVV95cUxNWUlfN0pFbXdyTDI2Uk83emV6ZWwzRnhUcXB3RmlRbjU5c0E4QklsU2hOaVg1aXFtNTZBbUxOSVFxTzZsWklidDFsV01GTEpZcVNfc1IxUVpZMXpTTV9aYVBwMkVYcTdYWHBVcHpUOFBPUEx0X2hkeEpoM3RFRkNfQzRR?oc=5
2026-01-12	Google	0.0	Wall Street Analysts See Toyota Motor (TM) as a Buy: Should You Invest? - Yahoo Finance		https://news.google.com/rss/articles/CBMigwFBVV95cUxNWHcwUG1yLTZJaHptc0tQMVJnbTlOMFJnQmIydGpjSmlXaTN6d1NacjFCb1BuQTZERTB5VW5YOTFEUmRYYllUeGZzbGk4bTBtdkV5TWRUTlRZMmR4UmJNS2xaN3lLNjFrT2lxWFRMV29HT1JieTB0c0hzc0dKY3RFWHE0UQ?oc=5
2026-01-12	Google	-0.1	TM Nxera signs 280MW electrical supply agreement with TNB to power Malaysian data center campus - Data Center Dynamics		https://news.google.com/rss/articles/CBMi1gFBVV95cUxNajJNdjVnMVBaaDRldGFLOVROVW81aWt5bGI5MUdKUFJ4emJYUDJwbm9Ud3d0ck9DVGQyU3NNQWhfOWV4NmVxR292SUZ3LUQ3TkVNV0t2cHd0eWtCNGtTcjhadDlHRkMxa0dPVmhwV2JDXzloOUVZQ1NXT2lJWWVCWnhXc3pBRC1LM3MyUndXV1NIc3FoUGIxLTduSkFYclpVSTRlRTA3WWJEYXlpQjhiVjZVZFB1SGNnd2dtc2w0N3FSNmNTTEtoNnVhT2d3WG5GdlBNOFJ3?oc=5
2026-01-09	Google	0.167	Who Are Toyota's (TM) Main Suppliers? - Investopedia		https://news.google.com/rss/articles/CBMijwFBVV95cUxPaUhoZjR5NnhGN1RZdzF6NVM4dmxlaHRQcVZzeHhzajFzOXdBalVVRTZ3azcxZWt5dk9oclhZem5ycVIyMWFJVnNhNWNXN0ZMeWRRT2FBU3BsYS00ZnBfTU1ZNllzdlhkbnYwU0h3eXZPLWtQTkJzdVJDcW9YSWZod0d3S29Fc2hnaWxCUmJiOA?oc=5
2026-01-09	Google	0.0	Research Initiative (Part 6) - トヨタ自動車株式会社 公式企業サイト		https://news.google.com/rss/articles/CBMic0FVX3lxTE41TUJzeTlZWUQ3UDVRUEpMZnFxdTJRcW1uTjRydWUwVUhmTlcxVHF5VFVVTm1LNGtBSlJBcDhpak5rc3ppR0ZEbkRqT3d6ZWNxdHBZcjl6Mmw1WFJjRFhMWXNtMDFhM2ItZk00aWlDMzdrTjg?oc=5
2026-01-07	Google	0.0	Soviet-Era TM-62 Landmine Has Become An All-Purpose Weapon In Ukraine - Forbes		https://news.google.com/rss/articles/CBMiwAFBVV95cUxOTkFlbmFIZXFFQXNyenp3RnJ6VGlxRTNTdy1LMW1OVnJwT0s4NC1NSGJ6cDJXOWRIMmRjVTVKV2hSSE90bFFxbUJKRnB6ak1ETVluV2tQRlpUb1lHY2F3SktjejVxZk9YN3lhazhYd1BfYXUwc2JjX0YyTXBQN1NKYVpsX1pIN2VrWmdZYnVOZ00wRHRoX1hvME85c0VnV0Nva09vRWJyTG5fQkZja2RnaU1OWEc5elhtdkhaSmhHbWY?oc=5
2026-01-04	Google	0.167	[CES 2026] Meet The First Look Speakers - samsung.com		https://news.google.com/rss/articles/CBMidEFVX3lxTE5SZ0hNU2JyY0VleUJxVmVRQTRYRUV4UDctV0VmMS1hZ2dzam1KcEtnUk1wWVZPNTBlREpSbTBLSFh0bEJVcTJVLV9tcnFjM2NZbkJ5WU5yUlVZQ0YyakM0MFRtc0ZZZjg0bzFSb09vMUthLUpp?oc=5
2026-01-04	Google	0.0	Fashion retail predictions 2026: John Lewis, Mango, TM Lewin, Agent Provocateur - Drapers		https://news.google.com/rss/articles/CBMivwFBVV95cUxNazNlQ19PdDJJRU1QSk03SExYYmQwXzNpYmVlUkFabUlHUXNGMXVIWXRScGh2SjktU3JGRVhtSUgyMVlNNWxrbTB5TWFUaEhHT0pZZFNxVkRydjNPbGZaTG1YcjB1UlR3ZVJWM2U0S3B4Q05XN3hJUVV3Zy1TX3VNVkxIRXU4ZTdhNEQ4SnpGRElzQnFfdmRRbEtJZ1h3djVhVVkwTnU0MTdSendaeTJtR2tYb1lZZ1pXZ3NieDN1VQ?oc=5
2026-01-02	Google	0.0	Why Toyota Motor Corporation (TM) Outpaced the Stock Market Today - Yahoo Finance		https://news.google.com/rss/articles/CBMigwFBVV95cUxPTUVHVmNmRzVMWkM5dFhYZW9Ic0FaY25CbWZ6SFk2YkRKQ2lCdTFpYUhqSG9SV1FKUE9rTUw5dklDV2s5aVFVZ3N3aGNvRW9RUE1aSjJkRllwWm9TaE55NnJoVGV0d3FCUWRGS3l4WHJCN2wwMUd0alpMcVFwejF2Z1NzZw?oc=5
2025-12-30	Google	0.5	Court documents reveal more than a dozen shots were fired at Lee's Summit sports facility - KMBC		https://news.google.com/rss/articles/CBMikgFBVV95cUxPZ2hQTWhYOTNsZmxfQ25TamR2ZU50cTJBbFRLNWl5RjU3Yno0TWFNcFZ1ZlZ5Sk1CdUprNHJUU0Q3eFcyT1VUeXpJeFFLN2F4Y0VITXZHT1lhSmlvM05WUHFuR2JYQTRqSUdtbG5NQXM3NEkyVjRzQ1JWX21uT1Q0clZPSkxJblRpNjBUUGY4YnR0UQ?oc=5
2025-12-29	Google	0.0	TM Fieldhouse owners discuss safety precautions after weekend shooting - FOX4KC.com		https://news.google.com/rss/articles/CBMimwFBVV95cUxNRDQxNnBSNUpzZmJoaDlxcnV2b0JpcVY0WkJVZ2JBME01elBrSGdjbVJvVUJITklzSDFac0tnUmZrWXduUEpnTk9Hck5GcnBKUUZkdS1KM01oU2g5X1YxYUhEVHR0WGFJVVZpZmV3QmU5RDZ1SmNxdElycWl0VkRpZ2c0S1U1eUd3bmtDdTR1d3l0YXlZeTIwQVVnb9IBoAFBVV95cUxNaWNLNHIyNk9VR3NyZy0zWklBaU5Sd01UVUwxd05pbUg1TWhvQXI1NmJRUDhVckxSanAtRXZqNnRwZEhuOVp2UVlEcFpyRnNKcE9yOW1aWE9xQ09tbmJDNEx4TmY3Tzk4Y1M4TFdxTC13djhhVFpkdFpPaDRlZnA2Tkx2YU84Z2ZtLUJyWVEydlM5WUhLTndINHQ4R2s5aF9n?oc=5
2025-12-28	Google	0.0	Man shot, injured during fight at crowded Lee’s Summit gymnasium. Suspects arrested - Kansas City Star		https://news.google.com/rss/articles/CBMia0FVX3lxTE5Vc09HVjhXZXc4SjduTmk3MlNYRFZnWDV2akhEaDIxRFZtSE9MSFVMTUFSVmI5aHFIcVpYT2ZTQXo3OXo0U3djSkxLLTJCZFQ2NjVrc1hINVluWGlVTUloUHZpYUlic0VpWjVF0gFrQVVfeXFMT2tkcjRMN2dwUFczc3JPXzlNUkFrQ1ZqQ1hvUjVnZDI4V1BNclFHcUh6TXdNRk8zMDFERTJ1MUNSUldpV0tFaXoxNlBVc0ZSQ0IxTlktblZnWG5UcmNKS1N4TWFDUVVFZTV4dUU?oc=5
2025-12-28	Google	-0.025	Charges filed, second arrest made in Lee’s Summit sports venue shooting - FOX4KC.com		https://news.google.com/rss/articles/CBMimgFBVV95cUxOcGFWU2Nua3RYN2VidFdCWGNWbUZrLVFQMV96amRzcVV4Qll4N0w2bXdhRnBIM05uQUFyUDQwTnh2RG41Tlg4OFQ5cWZpeVQ1cnVfWEF2M1dmazY2dzQwblBIekNPLXFucjFBYlQ1VGpDaFFXNjBScFRQRFFxakdHNkJJdTZjTmlFLTQxV25nRGdVOGlZamRmZTB30gGfAUFVX3lxTFBvUVFDbzZ0azFXbFVocHBkaWZ0UUtRWUF6bkdnQXJxYzdYVk9pQXl6d0ViWFJCQzFOZDEwSWpUT1M0dVVFMWFsUGt4MXN5a3dXak03TkctYlVsRGpScFJEMlh6ZzU2VXhFWFhZajhxMml0ZGZLM1oxc2g5dU1wbk1pOU9jcGxON1V5X0dZdlBPWjBSdVdfLUdYbG53eW01MA?oc=5
2025-12-28	Google	-0.125	Lee's Summit police: Suspects shoot at each other during argument at TM Fieldhouse - KSHB 41 Kansas City		https://news.google.com/rss/articles/CBMirwFBVV95cUxOY2pzZEx1TnlxYTJmSEpJZk9WZDRpYnQ0SHFrdEdNUVZZUGl6Z0hIUUVRWFBLRTdCak1hejI5TUs0R05IZmIyemlNVU0wMEhuM2hHMDNrc0RMQXZoWE4xR3dIY25UUHB4b3FRbm1WejlzckE0aExJYTBUYmhFaDhQd0x1elg0SUxkbEhFck9xWjRyT2w0NUFTdWZZVDJqc1RGa21rTlZ3WkVfWHpZSEVv?oc=5
2025-12-27	Google	0.0	Fight leads to shooting at Lee’s Summit sports venue: LSPD - FOX4KC.com		https://news.google.com/rss/articles/CBMiiAFBVV95cUxPZm5wYmZZYjE4UF84Zk5UaGd6czNFQ2lyYVlfUjdGN2pNeFMtRU5YR05sNFJWeENGR2tBLTB5Zmt2ZjB5cXlNczZua1dLNWpuRmo4N1B4c2s2X3pnQkgwMTduMmNwUjZIaWk0dGVPY1N0eXdnNmR1bHBwTEtnZmFwSkFyNWs1ZlVP0gGOAUFVX3lxTE9vYXBMUl94MFU2TUdsNm1xbjJ4SUFrT3c0dExPZVhTVkVXWHotOVpkTTNwdFREc2lWY2dLLTV2M00tRVZJTTQ2cHZVdWlhVHdQQTFZbkJlREJKTnlDT3FIWEZwOVc3QjdfTy11SXdqY2lOaWxYR2E3bF9ELVJ6cEVUUlRQR3d0Q29yaTF1SGc?oc=5
2025-12-27	Google	0.0	Man charged in connection to incident Saturday night at TM Fieldhouse in Lee’s Summit - KSHB 41 Kansas City		https://news.google.com/rss/articles/CBMitwFBVV95cUxQdEFuTmZkeVV4SVhJSnRaN0FsWnl5Ym9uamRwNWRVZHFPRTRZZnZ3eW1JY0l0MGthZ2NiQWllRjFHbWxadUFBRWliLTNnbU5jZzZ2RGNLRGktcHREeWFweFVKWXhUNDJkakFHOG5LaUlYRlc1cldMOERROWhjdGlzM3BOd2JlUzhmckRNaE1TbWZBa3N6SHNkeXRYODRrM0pFSUlrQmFVVmdhSEl5TG9aSmJzcnpoU3c?oc=5
2025-12-23	Google	0.0	Should You Invest in Toyota Motor (TM) Based on Bullish Wall Street Views? - Yahoo Finance		https://news.google.com/rss/articles/CBMif0FVX3lxTE1QMTFaLU9kT2VBbEpGa3BKSnV0ZDhtWWRCMEVRZHBoeFNGUTlfeWQwT19wMEFQSHNjS3ZhS0I2U3pSM08wd0lvaFR5X0RhZzZHdXZySVF3MnhhcVJwMXFWUEJXS2tJOXllbkNvdHlEQkYyT29FOVdlS0I5SGprWDA?oc=5
2025-12-19	Google	0.0	Toyota Motor Corporation (TM) Exceeds Market Returns: Some Facts to Consider - Yahoo Finance		https://news.google.com/rss/articles/CBMiiAFBVV95cUxQTkRBUHQ1LUFCeVdBUlBzRDZfYVlSc2hUam9aS1hIZmh5dUJGaDUzX3MyZlg3ZFR4MjJJQ1h1RmV0NTVtM3JVcDNleXA2X1JXanRvVV9mQU1aZlpjcHVFeVZmVk14NU00ZTJiNG9zRGRMcGJPQWs0bmFISTJwNFNxU2QyVFVWTUs0?oc=5
2025-12-18	Google	0.083	WHO launches its first Strategic and Technical Advisory Group on Traditional, Complementary and Integrative Medicine - World Health Organization (WHO)		https://news.google.com/rss/articles/CBMi7gFBVV95cUxOUlczV2JuNEF6VEVfYkJuSVl1WkhJSllmZzRMZzE3RlIzOWUwSThIMGFsTXNiN0ZXUVVMVkt3cUd1WGgwcTZDZGdibDU1UHd3LW9KWkczTk1pSnE0a1VRRVlJZnd5NUVONWEwcEs2UThieWV4REdBeHNzcVh5Um80Y0FQdFQwdE1LWWZCd3JEdzY5ZEJLWjBHcTczdDRtZmJvOHY3YmhXTHNBM3p1VHdRVW1SZVpyRl8zVXM2cVFQbl90SnNZT1ltMWU0YjcxLTZ1Xy1qT05kQTNSQmhVMVhDb3dMVmE3RGE2aW5oa1hR?oc=5
2025-12-18	Google	0.0	Toyota Motor Corporation (TM) Outperforms in China - Yahoo Finance		https://news.google.com/rss/articles/CBMijgFBVV95cUxOS2t5bGRqRHYzTHdwNTJxd0Frb2dFTkVsckhYQXpTdW1VVVVWdzVvZy1ma0U5ODRONmdxMXBwOFE0UUpZQU90Y0NpaGl4Z2U4VGdNZy1tbURGVG42U3huZExVRmM5ZVhpVHMtaGZObzlySmpueUY0VmdkSWdHcks2RE51VkRTQjhlN0loaS1R?oc=5
2025-12-16	Google	0.0	"A.TM creates two minimalist homes in ""architectural dialogue"" with French manor - Dezeen"		https://news.google.com/rss/articles/CBMickFVX3lxTFBhNHhRSndKNkpkN0JVMHZ4Z05taTNzWXJUQm1tU0wzbTNRNzY2REJnUWxzQ0psaHJwSjB2MzEwWHpXY1o3WnJTV2hKck5TdmNua0V6WUJlZ1FpVHZyMUpvZjE5WmwtTVdDV3RDa3VhS0xZdw?oc=5
2025-12-15	Google	0.0	2025: A TM Year in Review & Images - Twittering Machines		https://news.google.com/rss/articles/CBMicEFVX3lxTE9uSHRkX0hMeWlaU2owa1F2SW5UaFk1aDZZeGFmV3BJVVYteXRwRDk4RjQ0YV9Uc3JTcG5fSkdiQkp3dS1zMVdmeEtJVF84UFh5VExtdk84eVRzZGE0MTdWb3pzcGNtQi1YWUp5NXRTNlE?oc=5
2025-12-14	Google	0.0	T.M. Stevens - Legacy | Obituary		https://news.google.com/rss/articles/CBMijgFBVV95cUxPdTFiQkNWRE5iYmhMdWljSlZnQnp3MVdvcXBZLUV6dENnSHJKWDNpTTBvYmtKS2RiT01qZGwySjRaMjJkZVk4Q3ZURnZrNlBZdE42RkljYUZoSzVxeURWWmhSNWJDQ0liaXFSLU9BeU1OZy1fOWhCSHBMZlFOalVJQ0hqcS1XSURJV2RNaThn?oc=5
2025-12-12	Google	0.0	Marcus Rashford - Player profile 25/26 - Transfermarkt		https://news.google.com/rss/articles/CBMidkFVX3lxTE04R1hra1hpOUJ6SlJMMXhtZk5KLUNqWV81U2ItcjFYX0pIeGdoem1keFpSU1N3TXg4V3RRcTJJeG56bnpMRXNNa0I1dzByZWFjbmVCZy1Ga2pBVy02NEV5Z3pEMExGVmdIYjZQNDNQSG9ZcFJaZ0E?oc=5
2025-12-11	Google	0.0	The Texanist Will Take Your Questions Now - Texas Monthly		https://news.google.com/rss/articles/CBMiakFVX3lxTE56REdlQm0tUE5DT3NyRE5nNkdabGhCTkdQRlBGUDN3VkhaQ01sMG5XaGtWbUhzTnBTNTludVFCMmlTekVrZUxyN3pwVW1uZHI3bXI4MFpCZVJRNFY4SDBneXlDNzl4UmhnVkE?oc=5
2025-12-11	Google	0.0	Toyota Motor Corporation (TM) Outpaces Stock Market Gains: What You Should Know - Yahoo Finance		https://news.google.com/rss/articles/CBMiigFBVV95cUxOSDRwSjdxaGpCQVZoa0FYRHJnSzg0ZlhTSGp2aC11b3pzV09pMlRiSnJHU1JMcjBGOHhZM0JHWnIzbDZfbWp2TFRXekRfRldxT1RKMk1YZ2NINVkyM3RYb3k1b2k0YVVOeEZIY19kWGZpRnJnVHBVeTJOWU4ydmhYdldCOEM5MmR0d1E?oc=5
2025-12-09	Google	0.179	A Rivian spin-off is betting $305 million on e-bikes. I rode it around New York City, and it felt natural — and powerful. - Business Insider		https://news.google.com/rss/articles/CBMiigFBVV95cUxPbnZHLXMwRmdhX2NzS1R5dFYzZkMtdjBieW8ySF9wTXNFZTdkWERhWmJGOHhCTlNPZG9IMFFIR0M3U3prZ2RrRWI5cm5DUGtWd1BPUzNHWUFsYnlSelpzY25scHV5N0JOcGM5bFRNMUF2SXBGT1JlWXVTZXY0NXUxaGVLc1F2cGgtdUE?oc=5
2025-12-09	Google	0.0	Toyota Motor (TM): Global Production Increases for 5th Consecutive Month - Yahoo Finance		https://news.google.com/rss/articles/CBMihgFBVV95cUxQN2JSeUFOcEhNMmNROG5PWm1KRGVjd0Ftel81eG5BcVNzUXZVc2JPY201ZU1HQzk3MHdoc01TWXlhZVhuSjlHbHNpdkdZTXV5eUVTSVNEMFpiMlRjWld5U05GTlk2dkF3UWpyRkRxMTNWNXFmQXp2eDZOZDY5cGUxNjNYNE51QQ?oc=5
2025-12-05	Google	0.525	ALSO. TM-B on Test – is Rivian’s Sister Brand’s eBike Too Good to Be True? - E-MOUNTAINBIKE Magazine		https://news.google.com/rss/articles/CBMiWEFVX3lxTE01d0VuR2x4cDVpaTlFSE1iWGphYmM0MFBMWVdkVG84QTVyaUw4LW41NG4yMlJibHdsOWYzVlpaZDRMSHZKU0Uwdm1pdWVNLXRmVk5wT1gzdU4?oc=5
2025-11-26	Google	0.136	Italy’s EOLO automates new 5G standalone FWA network with TM Forum AN framework - TMForum - Inform		https://news.google.com/rss/articles/CBMi1wFBVV95cUxQYTNmeHVqU0lVOG5pc0NOZVBwLXh1ck5pUThQVVpaUjA5UmtlMF9qeHlrMzNXbHB1NnhVdnBzTmFDVl9HSHVaajBTcklBaDZzMWVnRUI4UjhONjFVV1l6a1R3b09pTDR4REFIZWZRUk5CbWFDcGVfclVxN2JHc05lZ2ZmbE5XM0lLQUl5THdPWVFGMEhzLW5zQk9NZkc1OGhmRExoaFF2VHBmY3ZoS3FOX3JsT2hmR1BkNmxHc0Zfb2xYUTVqdVpQaTlWaFVmejZQTDBscmItVQ?oc=5
2025-11-25	Google	0.0	Tania Lewis - Wildlife Biologist - National Park Service (.gov)		https://news.google.com/rss/articles/CBMiW0FVX3lxTE9xMmc0V2YtR0hPZ2NlaDcwRVpGcmlyMGdoclJqVjRueFZScGszM0t6cGFyVTB4aWx5T1RzTkgyNkxfcE9UZ291ckdtbUw4dmh6Rnh6SkxpYmhEdEU?oc=5
2025-11-24	Google	0.0	TM Lewin store expansion continues and MD has big plans for the future - us.fashionnetwork.com		https://news.google.com/rss/articles/CBMiugFBVV95cUxOaXVjUzZvdmN4THFIbUxEYXNOWFFzQllrT0JfT1I0MGJoZXYyd3IzV1I0UVd4cTRrNFcycjdfc05pbW0wSVNxYXNmbWFlamxfMVJST1FTQXRtaFdBUnZsZTdRN1k3aEVuRmFDaTBIdFdrT1NUNDI0R19VUUh6amxWTVFDQjl6RGpUUXR3ZTVSajRtMFBERUZnV19HSW9BWVp4MEpfT3o5a3hsb0dndGx0OFFoNDF5TjRHVVE?oc=5
2025-11-20	Google	0.0	GSMA and TM Forum partner to advance network API monetization at scale - TMForum - Inform		https://news.google.com/rss/articles/CBMiugFBVV95cUxOSElqNXh6WTNsME1sTGI5bUpHcFJBd0d6WDVxNUdISW1uOE01dl8zbFF4LVQzSWRYbDZuQmtxVnJtRmtPWXV5eXB3cXN2X3h5TFpZRzVZV0JMaVkwd2t4ZjJjWVBHMFVsd0FiUklvQklmY082UFpxeURvaGJJRUQ2TXBCbE9mNFp2LVVqR3J0cmxjMWl5LUF6LS1zV3RlM2lCZWFYSDkweVR1bHB4SWhJeUlhTmpZQVVseEE?oc=5
2025-11-14	Google	0.0	tm:rw Announces tm:rworld, presented by Amazon: A Three-Day Celebration of Innovation, Creativity, and Connection in Times Square - PR Newswire		https://news.google.com/rss/articles/CBMiiwJBVV95cUxOcS1rOHNJQzNjclVSVDBfT2FLVkRkeHQzd2dtQnU3NEVQMDhrR245ZHhrWk1nQmQzR3FVZUZHSF9DbWtRQzdvcEs1MldiWkVQdm1HTTlhRjlZZ1AwNUN5RUFxWW4zNVVmWkN4MGtnQkxvWXdNOUROa2hYNUw3UjNEalBsNGZjdU8zYTVrTEQzY2xyYm1pM3UxOWJKd0w3TkF6bXhUVjZKQUFJYV9rOTc4bHk5ZEw3SjhfdmtYaHBYNUtaTm9peEJWcmlvcEltcXRRbmFxMmFqSUVldGZtVjRobzZLbXAxRTNydTVOU1lFNXN1QzdWNDlEYWRJcEJyTl9WVjJEMXQteWFkNWc?oc=5
2025-11-13	Google	0.179	Plainfield Select Board declines vote on solar moratorium at special TM - Daily Hampshire Gazette		https://news.google.com/rss/articles/CBMiqgFBVV95cUxPa2xGdU1FTkNzNlIzWlp6R0IxVzVVY053MXYwSWtzamdITnY1NXZMMTNkSTQ0T0NsemRoVWJySTNvVGlRS0xGUW5EMzFsMVgwSkRuTlVreDNVamlTRHlNa09jV2xmZWNKckZGX28yR3p1WUhPOEI3MGRtNnloZTNBU3JFSjYtV2JJZ1FaemM4REo5YkFFaGdRRGtSNXhLRXVWMms0dXFVdVBndw?oc=5
2025-11-13	Google	0.0	Uncertain Futures: About Episode 116 of ‘Texas Monthly Presents’ on PBS - Texas Monthly		https://news.google.com/rss/articles/CBMickFVX3lxTFBJT1Rsc0JfVzdVdWpFWTdQVHYydmp5NktGek9aNHU1dHZCTXd1S0hNbmNKNmtaRWhRZFd0WkNHZGZ1UHk0N3VZa0tqdHVmcHF5Tnl4SkJZQm5pNmVNSkdPbHR2bHhzVlJRUWpZUVlwTTNiZw?oc=5
2025-11-12	Google	0.0	LG Defeats Descriptive 'Washtower' TM In EU Court - Law360		https://news.google.com/rss/articles/CBMikAFBVV95cUxPeTlWeU1sYlkxMElmTVVVOXZQN3AwcWRKYkc2Q1NKeUxNckpOZFdVX0cwdmVjQ1pZalAwcDVVWjVlUm1EUHhKNU41RFJEdDFRYUZLV2VrbjNMX09QZlZJa3FpTUUzNWRGTlBKWVRIakQ5dTRkc0FDUlFEUDZrQmtTd3pjUU5VY2pOREM4Y2luV1bSAVZBVV95cUxQUXc4Si1PQ0V1dXVhSUpUT1ZTX0h1cWJCOEdiWkZmOGJpOE53ejc1UTRVTFZUMnVGNDNaZG1WcjFZRzRpaVBOQ2g5RFo0clpLQWdNdkJfQQ?oc=5
2025-11-03	Google	0.091	EUIPO launches new AI-powered tool to screen trade marks before filing - EUIPO		https://news.google.com/rss/articles/CBMiqgFBVV95cUxNQ3Z6dW54Vk1hcEZxalhTSV95dVZSV29xSHBtekZvY2Z1RFdpcG4xdTA2aEc2OWFaVG85cnoyd1RwWjhfV1JLLWtIRlFGeHR3R2ozRjR0VHJ1UkdkbWtMdktjc21ManJWMGt2YjV3VnN2OEk1bUlvclVBaTR2RllsMUltUzktb3ppLTU3M25NUlBzQVJwLUhqN2U4Z1ZoaUJEQkozWWVXXzh5Zw?oc=5
2025-10-31	Google	0.375	Rivian Spin-Off ‘ALSO’ Unveils Unique, Modular TM-B Ebike - Forbes		https://news.google.com/rss/articles/CBMirAFBVV95cUxNcXJsa01xeW9EWmx1aW1GOTZqeUVlZFFoQkhPenRpclJYX1h3V0ZmRnBFR3JlU1pYNURTU0tsZGpGZk5XMHc2SXE2OHd6Q3VUckhSMGQ2RDJCdk9KQ3hkOHZpZFAtNTVLQzJqdHVEM0d1MF96cGRqbmttR3EyYi1RcFZVdHFhWG1jUFVPS2paakkzWUpMbkRJa0c0TzBacV9ILWFuZGxncHdTTEhj?oc=5
