Date	Source	Sentiment	Headline	Summary	URL
2026-02-26	Google	0.0	TM poised as key growth driver amid Malaysia's digital expansion: PublicInvest - NST Online		https://news.google.com/rss/articles/CBMiugFBVV95cUxOaTBjVGVBc1UwREVrd0hQRTh0aGFuX0pNQkpQaWpfTWJNNmNPcVV6VXJUclVISHJEZEdrU1V6Q2tZV1JzNTc0NFpRRG9rV3BjdkRSRFRNMHZpU05yMjctWjhENkRpeEJCS1lGRFhnNGl2ek1pLUl4dTFiVVRKb1VObW5vQlpRNFVmdFJWamhLMk9wZjk1WTBka3h3TnVxRTlrdEV6TDJ4RjFxZ0Y0ZzVSRHJTZ2lvUG4tc0HSAb8BQVVfeXFMTjBlNFBIU0NITWc2eGE2WjlyclpDc2xkME00aUc3THAtRWgwV0xmWUpqYnJSOFZZMnoyNThSblVvbHdZMmhjU1E5WjFjOG5pc25JOFRxQlV0YzZ6d0dtUU04WjJ2NV9XalVMc3NNbHdaRHVlYktDd1hFVzRWbWcyb3JZVU5wWWNncEJQUnI3VXJvNHllRHRsd1ZTWUdIZ19EaERQT1pmaGdmcEx2cm9QbklGdE9ZNFFmOU5fbDFvc28?oc=5
2026-02-26	Google	0.0	TM’s net profit dips 15.1pc to rm1.71 billion - Daily Express Malaysia		https://news.google.com/rss/articles/CBMilAFBVV95cUxOdmxlZmxSNlRmOVhvMmVWYkhoazFTYzdpVlZKRjFjUElWTlktTFFqcHNfVlRFT05lck5rcDhpNnVfT2ViTDUyZ2t3SEVIZDJtSzhaSzZLVTdtYkxTcjFuZ0VueEhfT25aNzFCUWdlY3VJOG9vRDRtbE5pOG9MMFVYYVBuUFMyR0hIeXVObzRtRThZcU5m?oc=5
2026-02-26	Yahoo	-0.1	The Presidio Group Advised Asbury Automotive Group on the Sale of Three South Carolina Dealerships to RBM of Atlanta	"GREENVILLE, S.C., February 26, 2026--The Presidio Group LLC (""Presidio""), an independent merchant banking firm focused on mergers and acquisitions, capital raising and investments in the automotive retail and consumer mobility sectors, exclusively advised Asbury Automotive Group (""Asbury"") on the sale of three dealerships in Greenville, S.C., to RBM of Atlanta (""RBM"")."	https://finance.yahoo.com/news/presidio-group-advised-asbury-automotive-004900963.html?.tsrc=rss
2026-02-25	Google	0.5	Turkmen leader acknowledges meeting with “prominent politicians” during Florida visit - Eurasianet		https://news.google.com/rss/articles/CBMiqgFBVV95cUxOdmE3ZDJGU0p2Zi1vSFNORU9FMmVxSkpESm9jZUdCaHBWc0hpSXNNWE9aRHZmVThGQ2VNTHhtU3hKSkE1UkdyUVdvV0p4cWo3cFBzQjJpc291cW5PN0FHM3pLUndKQmtsSV9VRHgzVVRBNC1INjdKX3k1aFJOeXVpYXp5WF9wN1JZTUVsbVN5VFRpYmNLeWlnTGkwWnY4WGdjT184UHlTSS1Mdw?oc=5
2026-02-25	Google	0.35	TM:RW Goes Full Fan Mode for Heated Rivalry’s Ksenia Kharlamova - The Knockturnal		https://news.google.com/rss/articles/CBMiTEFVX3lxTE1TSFMzb1phVDA1WElWQTVIZ1FCTXExN1JuNnlxTW5WSnNya2ltZ0RWWW5udzlhMGRUSWRtTDhiZEc4NkhrSTltVWpSYzU?oc=5
2026-02-25	Yahoo	0.157	SIXT Unveils Starting Five Los Angeles Lakers Wrapped Vehicles	FORT LAUDERDALE, Fla., February 25, 2026--SIXT USA, a subsidiary of Sixt SE – a global leader in premium mobility services – unveiled an exclusive Starting Five vehicle activation in celebration of its sponsorship with the Los Angeles Lakers. Five custom-wrapped Lakers jersey-inspired Toyota Grand Highlanders debuted on February 24, 2026, during the Los Angeles Lakers vs. Orlando Magic home game, bringing an elevated and memorable transportation experience to the Los Angeles community.	https://finance.yahoo.com/news/sixt-unveils-starting-five-los-210000684.html?.tsrc=rss
2026-02-25	Google	0.068	T-Mobile, SoftBank, Singtel, Jio call for revenues-led 6G approach in new TM Forum white paper - Telecompaper		https://news.google.com/rss/articles/CBMizwFBVV95cUxPM2s2aU16ZGdxUEZmck9meU9RcktsTlVOS095SmxoNVBvMUJ3ejhwcHZjZi05TmxpVWY1SGx2aUFvREJIeFNkYmR3WVBmeGhpZ21Ha0lJbXp0aW1Fd0otSzBKb2FCYXYtU1hQWWtDUjhoSHBqQ3ZUNmtlaG1GOFhGRUszNkJFMzdaNUFVZWdtWW9hckxRTm5XRGxORGx1dTQtbmE2S0JQclRrLTlGcjNORGo0T3luY3NiOTR0cE1udVJoUzBvc19pRlAxUnlMSEk?oc=5
2026-02-25	Google	0.017	Aspire Biopharma's Buzz Bomb(TM) Caffeine Company Achieves Record Social Media Growth and Sales Surge Following World-Record Marathon Sponsorship - ACCESS Newswire		https://news.google.com/rss/articles/CBMi5AFBVV95cUxNMEYya080VkpFQzNOZFYzZTctdWxBRWd3WHFZdWJPTVg4a2hRYXRkQTIwLUNkNEtKemFEQjB4MVNNYmZ4dDUxX0MwSkViLUZ2TnpuN2hoMF9jQ09FVDA3aUxzVUNKLXRwUHRlVnlwY21qbWVTdlBGZUxFNFNtcGw2cXdPdXlXMFZGNjQtVm5aa0hwSEZINmptSlpvUWF3a0JTQ2duMVdSZkZXR240djZiUzQ1RG5Xc3VxT3pvUHAwTEFXcGFXYVZpT3BPSU1Hc21wdXNadlVxbXFkRWhBVzY2dlVKRHg?oc=5
2026-02-25	Google	0.0	RM10,000 for stealing TM cables - Daily Express Malaysia		https://news.google.com/rss/articles/CBMiggFBVV95cUxQVjJFYVpfcXlLUWFHUEtFODBaOVM3Ty1iTU1iczRRNWpiQXZUMW81ekc0NTV5NnotdmRKRmloQzdpMFBGQ0hreDFwYzh6SWJBNXZscUIyYnQ5a2JHYWtmakUtSG13MTRTSmxKUmRlRGR6OGtyZ3JoZUp2ZEQ4ZGlsbWx3?oc=5
2026-02-25	Google	0.0	TM FY25 profit declines - The Star		https://news.google.com/rss/articles/CBMijAFBVV95cUxPV2U4VnJ6SThWV25TYXl0bXJUZGtEaHZTNzNBWUtNS1dnZkN1Q0tnWGVDV0NtZzh1WnlJbHNRV0RvNTdoZ2NRVUFWUGxjQmppRUJwSGxwbURvc0JQTHF1Uk5BeWtNbjBzTlJPbWxtd09sd2hSTl9RSVotRFczVnpJY2lpRnVnT2tTZ09sTQ?oc=5
2026-02-25	Google	0.0	TM and U Mobile Enter into 5G Wholesale Arrangement - CEO Insights Asia		https://news.google.com/rss/articles/CBMipwFBVV95cUxPd0JYVVNjMHE3ZUk0ZXJ6MXdZWWx6bHNFRkpUUkdPU0hvcUNPNUdjNWticFJJS2hKYktFMVFIdDhBYU9aR2xhQkVxVzQtZHZFZTh1cDVxbGhkVlZfamhMUmctSm1zY2pITm1laFBrWTBCYnBHa0d3YUpRN0ZjakFyalpmZ2M0ZFhoRVJDamlUcE10dnpVYzJ5UldMTlYwbzZHaVhaMTBMUQ?oc=5
2026-02-25	Google	0.0	TM and U Mobile enter into 5G wholesale arrangement - The Star		https://news.google.com/rss/articles/CBMipwFBVV95cUxPSFppTWFuQkhDaTdqU3lyVWVIOVV4ZU9VR2swMk1iTS1uZnhqdS1oREtUbmhEUnlaVElUOUpNdFVzRGd4TC1oWnE2X3JhMVVIUC1iZlBtdGJIUFJGMDBoX1kta3BEbjBFNGJPMHg0cFp1d2tpLTI0cmJXX2xRYnhBRDItV3hTeU9keXBGYWg3V0ZZaDI3dWNxeFRsWXJRVldNMjJhanQ3OA?oc=5
2026-02-25	Google	0.0	TM ends DNB 5G deal, reams up with U Mobile to boost mobile network - scoop.my		https://news.google.com/rss/articles/CBMiqAFBVV95cUxOdGxfQUVnd1RycEdvTmRqTEFvcFh6SzR4eGlDai1IakNqMmF6bGt6d1I0b0JGY2h0NHZXQ1FicGRZU1REaV9Nei1uY0JJQjBlZ3psTXdkX05tSjZmS296WlI1eXprSEpqSUVRMjdlWE94aDN0aEh4WC1Yak91WDBZMzVxVDJiVzd3WHctTWIycDZKTlp1T0hRVHE3M3VCbzljaXdVOC1hZ2c?oc=5
2026-02-25	Google	0.0	TM eyes stronger foothold in mobile services, signs 3-year 5G wholesale contract with U Mobile - The Sun Malaysia		https://news.google.com/rss/articles/CBMi0gFBVV95cUxQQ0NYMUh3Mm1wRWJXY0hCZEFZeWh1TndORnB4Qk9lWVdPVWw4azVhbUFmS1Qtdk5CNHpFOGhvNkhKalF0V2FNeDdWVUk2Rmx2UDQyNWxVa2VnLWdEci1veGMxQWM2RjhKWmlBOEk5SUZyZFBpRmdXRTBFZDVTUHVpWTlIVWRDbHlLS1FEYnFEbnZlRG9tVlFpQ2E4MlVRbGJWalZoRG9YMWQyS2Vqak5SZjJzNXVNS1ZoRFZZSTlXX0o4bG84S24tQWpNNHg4bWpZZEE?oc=5
2026-02-25	Google	0.0	TM pivots to U Mobile for 5G services as it terminates DNB agreement - Malay Mail		https://news.google.com/rss/articles/CBMiwAFBVV95cUxNTUl0dWFqbnpnNFZqQ1pLc2tGTUpBSF93QURyMFZOSG8ydXJPdkZjRFBxNnhhSDh2X1pqelFEWU9LVWI1a0lNODVuNlRlQkhlb3lCcG0zUDZJbzB1NkRNNmZlZXRtNjFwZ0NDZGFqNW1Ud0xkQjhURHRnZkt2VUFEV1lISjh1R0xzYVA0c3hpdEFKbXl0MDhBRnpfYjFxVl81bDhwaUxLMVduanlHcmZqOWpiMUdKbTV0ZWo2eG15VETSAcYBQVVfeXFMUE8td2ZMNHZOT1FYalp0WUFpc253ekxIMFZRdTA1WURtemVaWEdrSXM0dXdpTHBRNGNPX0RqTHRXZEZOT0c4NkFLLWdNaWxqUTQweWRFeGJ3ZGFQRHA3VTBrQXIza09JYWRKdUlRek44X25fanZidjhIZ05VaTRqZE1zaE9EOU5yeDVIR0dlVGw5dEFGQjFYUWcyd19PSlhyM1NhVmU1Z3B0RWZqb09CYTM1WmotNnBHTEMwNFpoanRPWXYwekJ3?oc=5
2026-02-25	Google	0.0	TM to partner with U Mobile for 5G MOCN, ends DNB wholesale arrangement - KLSE Screener		https://news.google.com/rss/articles/CBMivAFBVV95cUxPcFo2cXB6OUp3QVUxYnFwQ2FIYk84V3NNVmlPWnJUVFMwYUhjYjZCcEh4VkxFRHVpTkFTU3JITXZwWktkOFZieUVvd3ZPV3d2REtvdlA3ZFZ1SWJvRmxNb2c4RjdFc1lDTzd4aG5wMk5DV2pPZGJmeGI5ZlYyaW12QWViMk9KZUFtWnViRUZTR1RnekFnb1VpRl9sbTYteUlaT1EtZWxGX2tIRm1tTGtkSjVLSWdNSF9qbzBTcQ?oc=5
2026-02-25	Google	0.0	TM turns to U Mobile for 5G wholesale access, terminates Access Agreement with DNB - SoyaCincau		https://news.google.com/rss/articles/CBMioAFBVV95cUxPelo4M0xmNDFkMkJzLUhfNmRVN3paX2Y2MlhjWmQzakxQQUNuZTBpeldDUzdBcWpYVGpxZXRRc0k2WVg2eUJ4TGViYnpSMWdENnNlREdEQmczRjBvNUkybFZsalVBT2Jtb1A1ZWNfUFhDbGE3ellmeGV5Y0JyZEtfTEpFQWRRUk81dW1uVHdzdGpNLWQwMXIyUFVoQWswQ2tf?oc=5
2026-02-25	Google	0.0	TM, U Mobile enter 5G wholesale arrangement under MOCN framework - The Star		https://news.google.com/rss/articles/CBMiwgFBVV95cUxPRFlIbk85aG1tcm0wWm42Y2MwTVJfc0hPclpFVHRTaUNCOGFvN3BCMHNUdTQwbEwyaTkwMU9PWWlNZWxqRlgwSXo4am1fVjhxN2w4VUdNOGZra3czak9vU1NLbEVXeXQtaDNBd21oNUhsaTlsNEUtOWlNZjV4Njdsd28ta2E0aHQtZUN2VU55VHJOOEQ2d1dFRkhBVk5UOEdfS3dJeUNNaEhJczVjcGR2MnZrS2xpLVAtdGRJNXFRMkY2QQ?oc=5
2026-02-25	Google	0.0	Telekom Malaysia to exit DNB, tap U Mobile for 5G under dual-network framework - The Edge Malaysia		https://news.google.com/rss/articles/CBMiUEFVX3lxTE1DaHhZZ1VjOGo1Sm1Va2xnVHFxQnMxZUg3cU5mSUY2b3JTWkJmeGpMeDdfTEtucXVCbkg0Y3RNaFdydmVyOFd1MTJrRG9rN2tS?oc=5
2026-02-25	Google	0.0	U Mobile Signs Three-Year 5G Wholesale Deal with Telekom Malaysia - Telecom Review Asia		https://news.google.com/rss/articles/CBMiwgFBVV95cUxQci1XM29MWmdOaGtKSzFOd3JJZnlXQklCUGVTeTBJWlZZeTNqTDJxNkd2dGh3VTJzRDBaQVBXRWhhRHBfRlZ6YU8xcGZ3alE3eU9LUEw4aG1HRnU2UjQ4Y1dyN0dFTWFEc0NYcURxNTVyVExRN00yMW1uN2FKcFVpNW5RTUJ2ajFCeVN1bjY2eUJPY2dzNDU4NEJkajVtbXc5OHlTVzczVXJsLWFCcldqOHBmS1QzcGJ1UjNyTG4tVmktQQ?oc=5
2026-02-25	Google	-0.006	TM’s 4Q net profit slumps 69.5% on absence of one-off tax credit - The Malaysian Reserve		https://news.google.com/rss/articles/CBMiqgFBVV95cUxPZUFaTS1MS3kwZkdLaDIwS2hXeHdIOUY5TTc0aVVISHcwRlNkd3VLV1lVMEdZRmRtOUkzNGdiWS04TUNrLVJXaExqemJLTEdJV2t5LXpQX213TFJLXzZBSTd6ZU1sX3FfS01rUjdVeS1JbnFmLXhhd2ZFX2cxcDBValZIRXBqTVktNTNDQWZVQVRWR1BIeWtpczk3WFBSSjZ4U2pzOUVRQXpFQQ?oc=5
2026-02-25	Google	-0.021	TM To Terminate DNB Access, Migrate To New 5G Network Over Next Few Months - bernama		https://news.google.com/rss/articles/CBMiY0FVX3lxTFAteGZuTmY5V0xLRHJBMnlTNnRubWV3TUhFVWFVNUwydDZuZlRrZEo0NnUwV3hOd3MtaTBaRGQ4bVpkSHpNS1c4YnhrVHdJNFhiaEpGQVVCRFBHQVMyOTN2R2FJbw?oc=5
2026-02-25	Google	-0.1	Transcendental Meditation Explained: Dr. Tony Nader Reveals How TM Reduces Stress And Boosts Mental Clarity - TheHealthSite		https://news.google.com/rss/articles/CBMi8AFBVV95cUxOX1JYcjE0TTNVMmkzbFlHMl9kTjVyN29jNEtXZ2NNTVF2ZlBLZnlrcDhrRDBEZjJIRlFvWDJUdjBCaEtPaUxhYnBFRmtUY0k1eGRlVE5JQnBPV29ZdEZEaWRyU3NLOGF3aE9xcG5uY2wyNG9QclNKcjJGR2dTQloxYWhiSEMtbEpkU1JVdVVtdllVdGlpeWxRMGVPRC1KVWZYOFRTVnB2U1NpbndoZEhmNjZySnpBZkE2VjJBSGZadUNrV0VOSzVBd3A3Z1dabEVpTy1ieFRzTjhIUmoyNnZQVVN3Yzh6MEVibFVaR1RxMFfSAfYBQVVfeXFMTWNJdjA2di1PY3VLRVlFdkZseWIxbXphQkZrNVptQy1HT3dRRXdPWU1DbGFaY3BfOVZYQU16ZHVrOVVGSTltVXF1MzBmbncyb0dJeUNxQ3J2M2Nqci1wcU1FVEh0U21mS0ptbnhiQ19PSm1jZGlHRFpuUEMtMllKZXZlMVJld182ZEQzaDQtRFdQR05MYUJERWFBbHVFdVZCdjI5b2xHbDZTaG5jQjNFeHUxOFotSkpkYmJKOXA0eFpsQjZtR2xrMl9HcmVGWE96cldUZ3JpbXM3andvODNMelViZWppdmUzSHNGVlZoRjdkSmFSZWxR?oc=5
2026-02-25	Google	-0.3	Prayer ceremony held at National Press Club, for late father of T.M. Awan - Associated Press of Pakistan		https://news.google.com/rss/articles/CBMipwFBVV95cUxPVFNmQUpGeG5iQ3ZrbXpWbWI4YVpWTG5TdThoNWZtSUJCS3ZHYXZlRzZnZVlqQ0JtcUhuNV9DZGM2Uzl0MlJ1WF84cmhmZVpiNlNCY0xGaURTc2g4SGNzc3dXakRfSjBraldjRngtdkhKUDlDM0pLQkNScjVjaGFmeTg1azZjNHllM255V0p1SDdpOFFPSmdpaTQxSnVHMEl0ODR2VEZNcw?oc=5
2026-02-24	Google	0.5	Nexalin announces pivotal Halo(TM) Clarity trial - marketscreener.com		https://news.google.com/rss/articles/CBMiogFBVV95cUxPcE1QV2FmUm5kdm1TeV9GcC1raWFVcEV5RlJhQ21rVmxMSTlHLXVKd0hJd0o5Z3lJcU96dGV0WUgtd1NWTU9NZWNHNE5ISDgwQ0ZOZEt1b0NweElvaWl4Q2oxVUk2LWxtSHFNTFh4TUh6VHpuWFUyM2IzM1E0UGpCb2N0WkE2UlRfd2d3MXJ6ZHA2UlhiaEZTU1RuN05sZmtpWkE?oc=5
2026-02-24	Google	0.175	REMSleep Holdings Announces Full Commercial Launch of DeltaWave(TM) - marketscreener.com		https://news.google.com/rss/articles/CBMiuwFBVV95cUxPNmZhLThwOFJWMzhmZVhhcmhac0t3Q0d5MkJvcmQ3Zm4wYkJ3dUJXRGQzSERjU1ByRG41c29Ga2JqSWhpQ1JIX0xNMnFadURzZmxCUERiRFkwdDJsNVBKZHFiRFpNd09aeV9fclVDVG00aVFNRzM4YWxLZkZmTmVoamRWaFlyS3Npa3h3c0RLeWxCRnFIbEQ5QlVYejlpc1JWQk9NcmVyTVQyUG9GRUZpQ1JaMmVxcTZfZndv?oc=5
2026-02-24	Yahoo	0.136	Renesas R-Car V4H ADAS SoC Selected for Toyota RAV4 Model	TOKYO, February 24, 2026--Renesas' ADAS automotive SoC, R-Car V4H, has been selected for the TSS(LSS) control unit used in Toyota Motor Corporation’s new RAV4 model.	https://finance.yahoo.com/news/renesas-r-car-v4h-adas-130000154.html?.tsrc=rss
2026-02-24	Google	0.068	Legacy Financial Advisors Inc. Makes New $1.01 Million Investment in Toyota Motor Corporation $TM - MarketBeat		https://news.google.com/rss/articles/CBMi6gFBVV95cUxObW1udXNES2JrNHRYYThHb3drcWI2UmFjeUZkSHZwTm0wY19pYUloUmd5LTdQX2Z5Nm1QY1hpbEg5dnN2OU9KTjhLQkk3UDdsZ3RmVk5QbnJvSG0zLU1IN1VZYU9SRzg5dDNZOHVKQzcxeE9hckFKRDBscUlRMkhfTHNaSE9JcXNyQW81Q1k0dWgwRzYxWW5xVmFSQnZGeUdROUg1ZWU0c0pVWFpVc1lPbWExZzlrVENUc1g5ZmcyV2RFb3lvVWNKbUx4TXdKN05hYlA2eFNsanBQWFR2SFc2c09ZOFJ1RXZhWkE?oc=5
2026-02-24	Yahoo	0.067	Panasonic Automotive Systems secures industry-wide endorsement for its initiative to standardize VirtIO device virtualization technology	Panasonic Automotive Systems Co., Ltd. ⁠(Headquarters: Yokohama, Kanagawa, Japan; President: Masashi Nagayasu) has been actively promoting the global adoption and industry-wide standardization of VirtIO—an open-source device virtualization technology advanced by industry groups such as AGL*1, Android™, OASIS*2, and SOAFEE*3—for automotive applications. Today, our efforts have gained industry-wide endorsement from Honda Motor Co., Ltd., Mazda Motor Corporation, Mitsubishi Motors Corporation, Niss	https://finance.yahoo.com/news/panasonic-automotive-systems-secures-industry-010000300.html?.tsrc=rss
2026-02-24	Google	0.062	ARIA Cybersecurity Announces Major Oil Refiner Deploys AZT PROTECT(TM) - ACCESS Newswire		https://news.google.com/rss/articles/CBMi5AFBVV95cUxQWDBpSGwySktCTG9qQVM0RXlsY1kydkFKaDZpUjJhR05rcVVaU3owTUczWXFsNlM1aG1hajFMdElnOUZQYWl6Qk5BeGxyMFRKU0dTdE90ejhpNEZiTkw4dVM0UUtXc3FKdFh6WW1mT1RyeFM0SHhwTlBEdkxGVmNvdGZfSTA1VkVjSFVzSDBJU05NbE8td1lBWmtLeUtndDU4ZDBqdEFsVS0weE82Y0cxbGZMZkp0VGE1ZEhUNFlSbzJXTjhYaTY0bDRveEFhSUVQZjlza2Jqb3owZWpNamV6M2ViRy0?oc=5
2026-02-24	Yahoo	0.054	FedEx is latest company to sue Trump admin. for tariff refunds	FedEx (FDX) has filed a lawsuit seeking refunds on President Trump's tariff policies, while Costco (COST) and Revlon have also staked claims following a recent Supreme Court decision that struck down the administration's sweeping tariffs. The ruling did not address whether companies would be reimbursed. Sevens Report Research founder Tom Essaye joins the live show with Yahoo Finance Markets and Data Editor Jared Blikre and Yahoo Finance Senior Markets Reporter Ines Ferré to break down what the t	https://finance.yahoo.com/video/fedex-latest-company-sue-trump-161939715.html?.tsrc=rss
2026-02-24	Yahoo	0.05	Elliott Offers Market Price as Toyota Industries Bid Nears 9% Gap	Elliott Investment Management is stepping up its campaign against Toyota Industries Corp.'s (TYIDF) privatization, potentially raising the odds of a last-minute twist before the March 2 tender deadline.  According to Reuters, the US activist fund has been offering to purchase shares from investors who have already agreed to tender into the Toyota group's bid, proposing to pay the prevailing market price.  In Tuesday morning trading in Tokyo, Toyota Industries shares were quoted at 20,270, unders	https://finance.yahoo.com/news/elliott-offers-market-price-toyota-191625256.html?.tsrc=rss
2026-02-24	Google	0.0	Sneaker Biz Hits KC Chiefs Stars With TM Suit For '1587' Name - Law360		https://news.google.com/rss/articles/CBMioAFBVV95cUxOanQ5OGRNdkt2dVNCdlNzMzRHazZtU1Z0XzdRZFBVajY3N0RsYk04WnNLZmZVOWpZbnhLRmtqWFRMMDJWY0lrWkxCTUN3ZV9pLXVaYTlqR2MwUUUzakdFb1hEZTFPZmRnNE5HbFN4emFMclo2MVZuXzNjbG1aX1pVOFdCb2Rmd3JINWVpWGs3QkNQc0tJWjBacEw5ajc3Ymtq0gFWQVVfeXFMUGllZi0ybW9xOUlFaUxhakdvSF9rVVpDNW1JQjJpdXRqM3NVcGlzNEVCSERKNTBnUXdQdmJ1QTZxekRiNGVkWGVVeXhWWTd3cFRtckk3QWc?oc=5
2026-02-24	Google	0.0	Stryker launches Synchfix(TM) evt, expanding options for flexible syndesmotic fixation - marketscreener.com		https://news.google.com/rss/articles/CBMi0wFBVV95cUxNdE1UWUdSYUJwTFI2dVN3NVpNVHY2cjUweklWMVZOZFdHN3J5WTVLTlBvSlB1UzdLNG15cmthZ2ZFRy1SUk05dGNid3R5ci1ZZmdqR0V2N3A1YUFrVWpRQXpaRE1BbWFycTRsUEV1YUJkN01OWmYwSEl2ckZTOFBOYUtjSnlMNG1ySkpnQjdsajY5WDNJNm9OZ1RlSnplcE52NDA5Vm1ZbzBoRzdLTEVodTBfd3RiaXh0UGVKWWhnd3hUSldackRMaEhFVzFNRjZsY3dB?oc=5
2026-02-24	Google	0.0	TM Plans To Introduce Virtual Taekwondo At 2027 SEA Games - Bernama		https://news.google.com/rss/articles/CBMiWEFVX3lxTFBCYWVCMkVFajh6UnFtR2ZQLU5sNFVZSU5PdTJSSEFicUMyeERlRHZwQWFKSDJhVXlHVHEydzViRDMtMXFOOW9BR2huNHprMHc1SDJ0TXNLODI?oc=5
2026-02-24	Google	0.0	Tesla Must Face Rival's TM Bid Again Over Brexit Error - Law360		https://news.google.com/rss/articles/CBMimgFBVV95cUxNMXZYaC10Q0RDT2Y5eG5sQlBXNW0wSnNCeFFSX2FUUmFiTl93ek51aTZaUlQtZ1JvSmhNeGdkNE51S09hcmlQWVBmYXdGQzRqR1p2a1BqZDEzYkdEVkxQXzItM1lDaFN4Zm1uenZnWUVReXlWQm53U2hlaWxncUdJY3Fkak00YkFTMS1MbnFDdUNGYU5ya2k0MXdR0gFWQVVfeXFMTUhHTzJSd0ZhenR3endydTZyWVZtQlVRMjBCS2Jud0hwWmVmRmxQd2RjcW9nQzROZThlX3ZNVlg1dG9rYU01VklVUzRfRzZIdEhjY1BZd3c?oc=5
2026-02-24	Google	0.0	The Weekend by T M Logan: awash in moral dilemmas and dramas – book review – - Lancashire Evening Post		https://news.google.com/rss/articles/CBMiwgFBVV95cUxNdEt6bmFPMVljdnV3Q1VHRnB0OFI5Zm9OcFMzLV9LSUctekRKQkdCVmh0TkxsalZIaFRzTFJjVXZwVlhUdWJVaDZtUGZvT05JZDlzX2dHMFUyMkRLNWF1UGlOcFJBZ1FPamJwUS00eml6a2tONFpTRnJHdUN2S1p0OXZyUjNPa2tMaVJFbmpucnJTN1RtSmhxdmRCVDlBbnRlaTVXcG1rRHJKSzZWSnVxRl9tYVBlSjRMNzJ2UDdtWXFTZw?oc=5
2026-02-24	Google	-0.6	Apple Suffers A Blow In Appeal Over EU 'WeatherKit' TM - Law360		https://news.google.com/rss/articles/CBMilwFBVV95cUxQUkxVUlJTMkV5QWViUGp0ZEluaUdsOGVWbWdnSVV2amNSZFM1c2RjTkU2d0dkS2ZZUXFRRmszQi1qZjR2bF90TGFZY2pxS0piWl84VEtRQTBrZlpBcWpZNURTMFotQUFFdDZ3elFXUlEtYUpKX3dGQVNiU096STRtOTBudlJXYk9uTmVpYWw2dllZQTBSSTVV0gFWQVVfeXFMT2xnaU9FQkZDY3oyeEN5MzdBRWFyQzg2WjV4V1I4T2kyV2RIUVFGSnhRX09ySDNyOFRpVktadVFXN0g3aThGVlc1S1BPU0pWNWV0VjcxNUE?oc=5
2026-02-23	Google	0.8	Justices Won't Review Peloton Win In 'Bike+' TM Fight - Law360		https://news.google.com/rss/articles/CBMimAFBVV95cUxQMnhPVHdfSUU3dlpwOTA1TUZ6N0RTMk1xVlQwaFppN1ZMSTRUemdZdHA4ZnNxdzNGNFRxTnp5b3N5eklQdVFfT3VsTnMyTjF3LTJ0M3ZtQUE4MGR6bS0wQUNDRG5uOTdpdVgwenlYdHlZVG5DaHhNVW80TWRMbmQyVGNpQThJVmNWbF9qYUNicVEzWjl4aWV4dtIBWEFVX3lxTE82ek9GR05jR2czcV9HWUpZME1zdzJadHdXRFlXSXg1Q3AwZmEzbHFySnVLaGt6TnpJSWxWM0dYdXBvTXJWVEQ2X0czRUx0OEZSRnNYbzV0Rjk?oc=5
2026-02-23	Google	0.8	Olympian Gabby Thomas, BetterWay(TM) Blood Testing to Host 'Track Like Gabby' Happy Hour During SXSW - ACCESS Newswire		https://news.google.com/rss/articles/CBMi5AFBVV95cUxNU1BXTlROVWxqclBYWlRnbThYX0hhOGV6cHl1Rk84cUxPbnJxMVhsVTlJcmdlYmlPQjBLdVRlVGxQdm9lRDZoSEFWU0IySjBiODlrd0VBdG1oTURlZE94MGJMOTZaU0NxNnZTRlNaSnVNVGd2b0lDQVplcFg3ZDdKNzFicER1UnpmU3BuQVNPRndNYVBPa2lNcEI2aTgzTmJTTnNNWko4LVJnSzFjNjQxVXJMT3FRTWNFOFJwTGhSS2FQWVJnU0VtTEliSFJrN3BwbWtKdnB5Q3p6c0FYcENOTUJ4LUU?oc=5
2026-02-23	Google	0.8	Olympian Gabby Thomas, BetterWay(TM) Blood Testing to Host 'Track Like Gabby' Happy Hour During SXSW - Weatherford Democrat		https://news.google.com/rss/articles/CBMilwJBVV95cUxPc3FyYzZ0dFA2emV1bzdTSVhPTTY4V2wwUExDRGVPZkhoVEJlWGY0SVRlN0pYQnIyN1FQeGxqcmZFTGFsLXZBZzZ6SGlUTE9CcWw1dDF5SmxTZWZzTW9KWnFoelNrYUs3LTJ3TU1oMGJwYkZZcEg3NkZEM25acDQzSEZxNy1lanJKRkJUcnM4WlFaczJfQlJpVk5QeXItVlN6QmtSZ1ZPOFdzaGo0TFBqc1FBX2ZhQllzN2hZUGEwZFJVSDVZcWtpQ0Qwd3FoUUpTR1gxNTNCa3k1NmJOZ2ZhWG9qMzV0UTZmcmI1RGRQOEN1OVotV1NSTGQ2VFl5c2duQ19RLXV1dUxIOTVyTkROSDJYYTI3a3M?oc=5
2026-02-23	Google	0.4	Toyota ADR Pops on EV, AI and Dividend Hopes: Is TM Still Cheap? - AD HOC NEWS		https://news.google.com/rss/articles/CBMivAFBVV95cUxQOUpqU0d3T2NLVjdFb1JPR0UwckdxX0Z4cWplZFY2NUd6VFZ1QTU4YVdoa0U3endCQ2VvWUpwSTJzVS1VUmFRdFV1b2Fqd3NDRllraXcyV1BjSXJmekRER2U1ZWVTZmxUeFR0YUkyR1dhYlBvVjlRRjN0aFNQaEtYN2UtOU1CaTdIaEZaQkVuUkprTEdIeEZRUkpVczdLSXZYQ1B0cGFIRGxtaWpYUmIwR1dndTJaOExYNjRqOQ?oc=5
2026-02-23	Yahoo	0.164	Elon Musk's Net Worth Is So Large He Could Buy Ford, GM, Rivian And Toyota—And Still Have $141 Billion Left	Tesla Inc (NASDAQ:TSLA) and SpaceX CEO Elon Musk is the world's richest person by a significant margin. While some of the other billionaires have watched their wealth decline in 2026, Musk is gaining. Here's how his net worth stacks up compared to the automotive sector. Elon Musk Net Worth Rises in 2026 The top 10 richest people in the world have lost a combined $45.6 billion in net worth so far in 2026, reflecting declines in technology stocks. Musk has navigated through the trend thanks to the	https://finance.yahoo.com/news/elon-musks-net-worth-large-173109744.html?.tsrc=rss
2026-02-23	Google	0.136	Donaldson Introduces ArmorSeal(TM): The New Era of Air Filtration Technology for On-Road and Off-Road Heavy-Duty Equipment – News Hub - Medianet News Hub		https://news.google.com/rss/articles/CBMi-wFBVV95cUxOaWdEYktaYW40eUVDZllnem0zUHRiMkpfc1gzcXF2cVNkclFFajVNakwyWGE3RmdvZ1dDS0tiOUdCWGpMSzAtMFpqRFZqT084TWZ5SXVnbnFtRTMwMTBZQlV3YUlHSVJudkpfRUlDb29oNXBsUFdhLUo5aDcyMTZSNV9zM1ZDeDRpVWpFY1QwU3FaQ1hQRmdWU0tSYVBHT1drb0llU01iOVRNcVBQaDZkbXQyaXZHNHRaZHZSTVBTRDRRZ01RRHdKZDZGTVdpUF95cXNXUGdqd3NSSGhQRGZEV1I0VjdFUlJLaGVsTzlrejhZWUpSeTlVV19Tbw?oc=5
2026-02-23	Yahoo	0.05	Toyota and Lexus Introduce Treehouse to Simplify Customers' Home EV Charger Installation	The moment you sign the paperwork on your 2026 Toyota or Lexus battery electric vehicle (BEV) or plug-in hybrid vehicle (PHEV), the next question becomes clear: how do you want to charge it?	https://finance.yahoo.com/news/toyota-lexus-introduce-treehouse-simplify-140000168.html?.tsrc=rss
2026-02-23	Yahoo	0.034	Toyota Investment Puts Joby Production Plans And Risks In Sharper Focus	Toyota is expanding its partnership with Joby Aviation (NYSE:JOBY) with a new US$250 million investment tranche. The agreement deepens their manufacturing alliance and brings the Toyota Production System into Joby's facilities. The collaboration is intended to support Joby's electric air taxi certification efforts with the FAA and increase future production capacity. Joby Aviation focuses on electric vertical takeoff and landing aircraft, aiming to offer short distance urban and regional...	https://finance.yahoo.com/news/toyota-investment-puts-joby-production-160754744.html?.tsrc=rss
2026-02-23	Google	0.0	Detroit Lions Move To Sack 'Motor City Muscle' TM Claims - Law360		https://news.google.com/rss/articles/CBMimwFBVV95cUxNR3pJU3FLY05TM0N3NEZSZEZSNDByanNfQ0Z1TVd1SnFGREJDay1lcVhMOFBCb2JaQVlfaFcyeFUzNktydS1GN25oZmk4SWtCeFVrYVhPR3Vsb2FDdERORTR0TnVLY092ZEwwc25MaTJ1ZG1ENUlwREJBUWk3WFNYcUJiUlFJU2U3NkdXV1JsX1lsSEw4bmdVN0FoWdIBVkFVX3lxTE1DcnVqdlhzbm9wMzcwV2IxQVdtQWUwSzJWc0dHaGhZQzl2bVVqdEZyNmhhZFVwdi1FWmNPWUYtSHJsZVNucDFJUWR4VHBHYXBodHVkMDRR?oc=5
2026-02-23	Google	0.0	Pet Toy Maker Settles TM Dispute With Founder To Avoid Trial - Law360		https://news.google.com/rss/articles/CBMinwFBVV95cUxOaUpZOGt6YlE2SVVtMXoteERUSG0tYU1YYUNxX0MtVXpWQzQ1VEp1YzhwRUNPakJxWTd2UWFVT19TQjZfWGR2eWJzNjlBT3hLZlJxSVFfcnl5Z1FzM1RQTUpuQW9NSXRSSFg2Vlh5V2JkbThzUmtDQkZjOC0xRHBzMkREZHA4ekR1WjMyUTRHbkNraVJEMERweVRPMXBYZ0XSAVhBVV95cUxOVmlqQ2w2ZzRUREluQktHVHFsT3Ruc3hvNGlRRDlPVS1Id3JpcGt5RFdVaG95Z0k4SW1vU1ZCbmhxTy1rMGVBY245WmtYSU5LSkFZRFZyTWRB?oc=5
2026-02-23	Google	0.0	Rapid Dose Therapeutics Advances Cannabinoid Research and Clinical Evaluation of QuickStrip(TM) Platform - TMX Newsfile		https://news.google.com/rss/articles/CBMi3wFBVV95cUxNVDloM3JoeS1yMEhVT2lQUXYzQU5jaTZDalZka0hNYTRGN2JCUWE2OXgwS1hpMU1EZmFuNVZIOUVQYzlTbklvRkNja2lwTUV0VHcxOHRzSWEyQW80SlhuOWFNODB3VThreGI3TlcyV1hOM3N4aU5XVDFCYVhlT2syOHVGdm5VNGowaWhqRXdyZG5Uc0thMUk4RzRjVGgyb21wbExFbGFlcFA5YW4tcU5hVnFsTVpoaVA0VXBUY1FER2tkdHA0SmdVVmE3NzdEdHdHNDdiYkt0VVV2b0tfUGtZ?oc=5
2026-02-23	Google	0.0	TM Fieldhouse in Lee’s Summit celebrates growth one year after opening - KMBC		https://news.google.com/rss/articles/CBMiqwFBVV95cUxNS1VxNVU2aVh6cjdaWVhfWFlLTHkyalJWSVQwamprMDlFZzcxNTYwVkN2eE1SMGx4Vk44RTR4QnJCQkNpSklnbER5Y3VlVEZZaWVYSnBMdEExVHBtTVZCYzZQWFliODFzYTNTYzdLUHhoaW8xWDdvbjBzUkNra3lCbDU2b1haNVRZbTE3WGdYMC1HeGZfeTR3blFPQzY5WjRyVTg4c3V4YjBaWTg?oc=5
2026-02-23	Google	0.0	TM SIM Registration 2026 - North Penn Now		https://news.google.com/rss/articles/CBMidkFVX3lxTE8zQXpqbXc2bVVDZ09qZkkyVHhGTmdLLWN5QVd2b0V1TFU1OTF5RFNJcHUxVFJNSnBFVVNlUllMdF80TGtMbUF5NFF1TkVrdTZpMDJGWXhXVThvdkdjNVVkS2REbUkwVG1lNTcwQWMwcWo1N1BHUEE?oc=5
2026-02-23	Google	0.0	Tempur-Pedic Maker Hits Mattress Seller With TM Suit - Law360		https://news.google.com/rss/articles/CBMirwFBVV95cUxQSmR1UmtlY3h5dld2MEpkelZRTTR1UnlCT3RvOHdDY0NTQTVZR09qWkx1THdac1RoeFJEbm0yb0pFeUF5UFFKM2JESEM2WEl2VkVuaHNoR01VcHRSeG81VTZWVU5BZ2dQQjByR3NhZWlIQzhuMnFBeHVaVGFpdkdiWXB6MzNNUlVOeHcxS3ozcTFVaTFwLU45ekd1Yl9QUFFoNlFaUnloNW9seFlnN3JV0gFWQVVfeXFMUHlFMlRqUms2VXU3M1hLdWRJdVBBMTAxRnJWSGlfdmlwUmlPWVEtNWtWZFpNdjV1Qi1zRmE5MVByaDRoNDRXcEgxTWdWQ1FyeVl0VVZJaGc?oc=5
2026-02-23	Yahoo	-0.231	Toyota to build circular vehicle recycling facility in Poland	The 25,000m² Circular Factory will take a systematic approach to dismantling vehicles at the end of their life, prioritising recovery of reusable parts and raw materials.	https://www.just-auto.com/news/toyota-circular-vehicle-recycling-facility-poland/?.tsrc=rss
2026-02-20	Google	0.0	'I want to return TM Lewin to its former glories' - Yahoo Finance UK		https://news.google.com/rss/articles/CBMikAFBVV95cUxNY0x2X2RmQ2lZSjRpSjFnWjFmQUZYOHAwdFpGYkszWjhic014SE1ySS1FcFFNM1BzZzcwZnJBZWZ0aGktblUtQ25KQS1MVTZ3THNsYlVFa3RqR1FUcFpEZTlvM19kNThyaU5iNDlGNUR5THlURXdPTENYU1BoRElHV0JUdkUyU05QMUhoU21tNVU?oc=5
2026-02-20	Google	0.0	Central Indiana severe weather: Storm brings hail, tornado - IndyStar		https://news.google.com/rss/articles/CBMi6AFBVV95cUxNanNCd0xDMEVwWXRnbksxZkRwMDhQRExnWEpPYURKTDRHcVBRQ0xFNWxwdWFIWkp0RmYwLXhhOHdzcy1WYXRBVVNyOTNneTRmMkZpWUMxZkJFaGRZTXpCS05LejBhS3pjb1JjcXRDcmV5emtURDN4aEhLVVhtSVlLdzV0REw1bmRBdVR6ZWItS3JVQ1p4U3NhMWRLQjBTcUFnbXVhVlEzRUJpMEhzb0RVTUsyemNRMU92TEJCLWtFVFBzc0cxcXZJQTBPZXBBYkNLLUxzaG0zMTdHd3J4N0dyUTZDd2RobG5K?oc=5
2026-02-20	Google	0.0	Gisèle Pelicot Picks Up the Pieces - Air Mail		https://news.google.com/rss/articles/CBMibkFVX3lxTE0wWEZUTTl1cEMzNTBLQ0VtNGhLMGZGRi1vNm5YVXhGMmRmbFpNRk83ZXBSRjFha3hBMkhXZjZnRlFZM19LLXA5aDNyT21EMzRZUy1lLVEtNElKUEotWEJqM0REWFp2Uk9panRrZ3l3?oc=5
