Date	Source	Sentiment	Headline	Summary	URL
2026-03-02	Yahoo	0.212	Treasury Yields Rise as War Spreads Across Middle East	Treasuries sell off, sending yields higher, as the U.S.-Israel attack on Iran spreads across the region. Investors seek safe havens, sending gold up 2% and the WSJ Dollar Index up nearly 1%. Demand for Treasuries, however, dwindles.	https://finance.yahoo.com/m/0cbbf21d-e19c-389a-b64b-8562f0a11d08/treasury-yields-rise-as-war.html?.tsrc=rss
2026-02-28	Google	0.0	20 camels disqualified from Oman beauty pageant over cosmetic cheating - standardmedia.co.ke		https://news.google.com/rss/articles/CBMiygFBVV95cUxPMUt0S1ZRTkFvX1NxWUNVQkVmbFZtWXNJaHZ3RUZzTjBXSFBCQUpmcmdwM0U2S1B1N2Ziel9xNXcyQmw2aHZYUndlQnZ2VlU1RkpvRG1ZQzEyYjVQY2xjRXBkUXhoNm1VcGN0NndCYWZPUWVTUlgtY0pla204XzlQVnN1UWUxajc3RXEtWWEzTmlEa1NLSE50VWFxTHBJWVlvX2RRa3NaZ0ZhY0w3Q0xxTGJVWElieXpybzV1bm40ZjhRWHNxLVRrc1R3?oc=5
2026-02-28	Google	0.0	Netflix withdraws Sh9.2 trillion bid for Warner Bros - standardmedia.co.ke		https://news.google.com/rss/articles/CBMisAFBVV95cUxOUnBfU0k5cnNzbUJDRE52M2tGSWJWSktRV3ZEUzYwaVhoMTNDNGlKVEtEN3JWcDVUMU9YWThOdFVFeHhuczR6TVBlQjVBMjNCQVd5ZExfSGM1ZXNwSlhrQ3BrSzhEb3oxTHJHbWszTm9EaVhBcHg2UktZQTRpUXdQdmVtejlaR005OE5KVHhmZVZWcS1ZNFJ6d0ZrcDJLdGFzVnNEN29IUTl2MF91NHk3OA?oc=5
2026-02-27	Yahoo	0.25	Treasury Yield Falls Below 4%	U.S. government-bond prices rallied Friday, pushing the yield on the 10-year U.S. Treasury note below 4% for the first time since November. The move coincided with declines in U.S. stocks and came despite hotter-than-expected wholesale inflation data.	https://finance.yahoo.com/m/d4bd791c-242e-319c-b909-53015979c868/treasury-yield-falls-below-4%25.html?.tsrc=rss
2026-02-27	Yahoo	0.0	January's Inflation Report Is the Spring Rate Cut's Obituary	The middlemen want their money back, tariffs are showing up in the data, and the Fed's spring plans just got quietly dismantled by a wholesale equipment margin	https://app.moby.co/home/news/news-januarys-inflation-report-is-the-spring-rate-cuts-obituary?utm_source=yahoo_finance&utm_medium=rss&.tsrc=rss
2026-02-27	Google	0.0	Tenax Extends Phase 3 TNX-103 Study, Signaling Long-Term Bet on Pulmonary Hypertension Franchise - TipRanks		https://news.google.com/rss/articles/CBMi4AFBVV95cUxQdnZXdjg3TXo2VkJRWmUtaUxpQW9YRTViOGFpYW9UeEFuVmkwNEMzdTM0ZWVSb2cySnJmaFUxcGlMTmE4NVN6ckNuU2JOYTJYQXJTYkJhbVZUSXlORjE4WVBLSnAwbkswSHkzNXYyODQzRWx5WEt3dTFnNmdTSkRocGNvV01tRTNFRkFnM0ZIaVZ6Sm14UU5WcmNybU1EbFJFMThVZUVkSVhLVFhNTHhnVG5JLU9Vb0JBNllOLWJZemtDdUpFZURBdHNGYzBaVmptUFpYZTd5dDZ4andrSUgxUQ?oc=5
2026-02-27	Yahoo	-0.164	Stocks Fall Sharply at the Open. The Dow Is Down 500 Points.	Stocks fell sharply to start Friday’s session, as Wall Street contended with a storm of headlines related to Iran, wholesale price inflation, and artificial intelligence.  The Dow Jones Industrial Average fell 700 points, or 1.4%.  The S&amp;P 500 was down 0.9%.	https://finance.yahoo.com/m/f8f94308-912e-3192-a685-3a84473506b5/stocks-fall-sharply-at-the.html?.tsrc=rss
2026-02-26	Google	0.0	Shameless CSs... - standardmedia.co.ke		https://news.google.com/rss/articles/CBMijwFBVV95cUxOSVpidC04aC1tN3hxS1R6NXF3aHpPNkJzTUFtcVRSd3BBMHdhVTVaVUJHcmZxODQ1aS0wbGVQcFZlWGpHaDFZVnJxQk9taXVKc19kVWtHQUlycTgwV1dlaGltem5ud29ieXJQckdweWNDbHhFSFFZTGdIclEyZ3NnX1ZDNGVyODl3b1VEdlRwVdIBgwFBVV95cUxOTFJVN0xualptZHVka1lDYWxKckxwT0RkQll3S0ZiVTdRUzJsbGlScG5CYzlpSTRZNTBseUlRWG00TFI1RThXYnNxT3dLa3hCTkRCRVZHcG5faW1CdHdyQ0FOTXBvaFVOREt3b0tGZ3VFbXEyNGhHbmxlQ3A2YTZON0pZbw?oc=5
2026-02-26	Google	0.0	Thamani Africa Awards goes continental in second edition - standardmedia.co.ke		https://news.google.com/rss/articles/CBMitAFBVV95cUxQS0x1X3lCaVAwMVpuQkNjRUh6N3JXa1hQNEU5MkxMeWtTcXpzV3NDYnF3VWU2LUI1QWY5a2xXZ1ZZU3NaczlBUXBuaHlESENTQUhLd1liQlQ2YkhmOWVwTEpnWGNYdno3R2tfRGJQdUEyR0gxMUQyY3RqSVJxTm1XOUJkbXlJQTZUbndPRUFNNXRHWTZSX3dZUWprLUxmeXBMRUw5SWtQT3drQ3hFRHFiMTFPcWU?oc=5
2026-02-26	Google	0.0	VIDEO: Daring Nairobi man blocks Lang'ata matatu overlapping on walkway - standardmedia.co.ke		https://news.google.com/rss/articles/CBMixgFBVV95cUxNeXRKaTlZd29vbnNvMXRNcC1xMmJjdVplR1g5dm9yNkcxQnNhSTQ3aW91UlMxZGRxci14dnNSMU9GLTFkNk5yRkdXVTBHcXQ3OVFuN2c2TU45cVNJdFAtbEVXbU0tc2hfV0FOOVZhU3ZaaHFoaVZZQVh1TkR1ei1IeG9xa1dNOUR0SDJaa0ZCTUZ1eDVRV2dJRHg5bkFOX3M0QlozQ0Rocml6WHZzVTltVEZKXzBwRVFMSjFuMkxrWUdXb3gzbGc?oc=5
2026-02-26	Yahoo	-0.054	Dow Opens Higher, but Tech Rebound Stalls	The stock market’s furious rebound pumped the brakes in Thursday morning trading.  The Nasdaq Composite was down 0.6%.  The yield on the 2-year Treasury note was down to 3.48%, while the 10-year yield was down to 4.04%.	https://finance.yahoo.com/m/aaafe1bb-ca4d-3c6e-91dc-0285e1831f0d/dow-opens-higher%2C-but-tech.html?.tsrc=rss
2026-02-26	Yahoo	-0.1	Treasury Yields Decline as U.S. Layoffs Remain Elusive	Treasury yields edge lower amid renewed signs that U.S. employers continue to hold on to their workers. Weekly jobless claims rise to 212,000 from an upwardly revised 208,000, while economists surveyed by WSJ expected 215,000.	https://finance.yahoo.com/m/aa44ec8f-b267-3980-8379-1a29f0e1eab4/treasury-yields-decline-as.html?.tsrc=rss
2026-02-25	Google	0.136	Filmmaker Daudi Anguka tackles organ trafficking in new series 'Mizani' - standardmedia.co.ke		https://news.google.com/rss/articles/CBMiyAFBVV95cUxPT0lGSzkzeTZGWWhCVjZIZlJDbnJZN3N6VGdoS215cDV4STJ2YWtaRkl2OTlFdU5MLTBOMS1zalY3cC1MaFpqMS02NnpIQy1RakQyRy1qTnZRcF9HSHBic2VLNERQZk9od2ZsXzh6R2htNWEzNHFVVjN6TktuZjE0ZUdmN1B5bFZkS1FrTHZid3B3TTVPQzRNLWxqVlZjbUJadVJEMVluVDhfZzEwYkRDSjJHNGZtV2pxcDI0MDdfWkl5MDhJSWVvdA?oc=5
2026-02-24	Yahoo	-0.046	Stocks Waver at the Open Following Another AI-Fueled Selloff	Stocks were mixed on Tuesday as Wall Street sorted through the prior session’s selloff on artificial intelligence fears.  The Nasdaq Composite was down 0.1%.  Wall Street’s recent panic that success for AI upstarts could usurp leaders in various industries including software, logistics, and financial services reemerged on Monday when a blog by Citrini Research on Substack went viral among traders.	https://finance.yahoo.com/m/3a519377-e349-3e5f-a9bd-b2b16f2a846f/stocks-waver-at-the-open.html?.tsrc=rss
2026-02-23	Google	0.455	Beyond the playbook: Inside secrets of successful high school tacticians - standardmedia.co.ke		https://news.google.com/rss/articles/CBMi2gFBVV95cUxQME8tWFRQOFBoSUloZGduRXRONXBHZHU0MWx3a1R5MUhTckthLThqWG9iSkhsQVdwVFNxd1JMSHJ5Q0p4T2ZyQTRqSDVkTVRhS1N0ejVOOXVkUDFDRENRYWM3UGJmODczazQtajhLdVh3ejRYaWxSeFpUWUpxdEU0S0pNempjNzlMYVd5WnB2cExjX3VkS1FYTW0tTWh6cVVkdEhNdm13aWpFUTR6cjlNUzF5YU5OUVh3Zm9kUGxlQXJEXzFNa3NnWE9aWGFjd2FPeFF0QmNNUWxOZw?oc=5
2026-02-23	Yahoo	0.135	Trump’s Push and Pull on Tariffs Lowers Rates but Raises Uncertainty in Global Markets	President Donald Trump’s decision to increase the level tariffs on U.S. imports, less than 24 hours after declaring his original schedule provided “great certainty” for the global economy, again has stoked concerns over trade policy and ignited another round of “Sell America” pressures in trading Monday.  Trump, who said Friday he would use an untested section of the Trade Act of 1974 to impose a 10% tariff on goods from abroad after losing a Supreme Court ruling on his use of emergency powers, 	https://finance.yahoo.com/m/83b9bf0b-6028-3a50-8eaa-5d77c4793608/trump%E2%80%99s-push-and-pull-on.html?.tsrc=rss
2026-02-23	Yahoo	0.007	Treasury Yields, Dollar Decline Amid Tariff Uncertainty	"Treasury yields and the dollar decline as Wall Street grapples with tariff uncertainty. President Trump slaps on a 15% global levy after the Supreme Court declared most of the previous ones illegal. The moves create ""a lot of noise and legal uncertainty,"" Deutsche Bank's Jim Reid writes."	https://finance.yahoo.com/m/8702b289-3653-3e4f-964b-88522d04cd50/treasury-yields%2C-dollar.html?.tsrc=rss
2026-02-23	Yahoo	-0.051	Stocks Slide After Trump Raises Global Tariffs to 15%	With more than a foot of snow blanketing Wall Street on Monday, the stock market received a chilly reception from traders to start the week.  The Nasdaq Composite was down 1.3%.  President Donald Trump said over the weekend that the 10% global tariff he announced Friday under Section 122 of the Trade Act of 1974 will be upped to 15%.	https://finance.yahoo.com/m/3178ee0a-4916-3360-bf0c-b5b9bb0725c4/stocks-slide-after-trump.html?.tsrc=rss
2026-02-20	Yahoo	0.233	Treasury Yields Spike After Tariffs Ruled Invalid. Here's Why.	The U.S. debt market saw prices drop as investors contended with the loss of tariff revenue.  The yield on a 10-year Treasury note rose to 4.109% in the aftermath of a Supreme Court ruling that concluded President Donald Trump didn't have the authority to impose global tariffs.  Tariffs have so far brought in $118 billion in revenue in fiscal year 2026 or the four months ended January.	https://finance.yahoo.com/m/5461dcc2-ad22-37ce-935d-fe57f50c0523/treasury-yields-spike-after.html?.tsrc=rss
2026-02-20	Yahoo	0.13	Treasury Yields Edge Higher After Tariff Decision	Treasury yields edged higher after the Supreme Court ruled against President Trump's tariffs, extending an upward move that began after inflation data came in slightly higher than expected.  The yield on the benchmark 10-year note climbed to a recent 4.	https://finance.yahoo.com/m/14bd2ffa-e8a7-3b69-86e8-4190b5644047/treasury-yields-edge-higher.html?.tsrc=rss
2026-02-20	Yahoo	0.043	Stocks Are Rising as Market Digests Supreme Court Ruling Against Trump's Tariffs	Wall Street is getting pulled in a few directions in the wake of the Supreme Court’s ruling against a large chunk of the president’s signature tariffs.  The Dow initially rallied more than 300 points from negative territory, but was up closer to 133 points, or 0.3%.  The Nasdaq Composite rallied 1%.	https://finance.yahoo.com/m/c42d118a-0762-39b1-b168-a7cd4b49a30a/stocks-are-rising-as-market.html?.tsrc=rss
2026-02-20	Yahoo	-0.021	Stocks Are Wavering After Mixed Bag of Economic Data	Stocks fell Friday morning in the wake of a double dose of data on inflation and the economy. The Dow Jones Industrial Average fell 204 points, or 0.4%. The S&amp;P 500 was down 0.1%. The Nasdaq Composite was up 0.	https://finance.yahoo.com/m/bd09589e-ab3d-34e6-abb8-02bcf132dd99/stocks-are-wavering-after.html?.tsrc=rss
2026-02-19	Yahoo	0.031	Treasury Yields Rise as U.S. Jobless Claims Decline, Trade Deficit Widens	Treasury yields rise as the U.S. trade balance deteriorates while layoffs cool down. December's trade deficit widens to $70.3 billion from November's downwardly revised $53 billion. Economists surveyed by WSJ expected $55.	https://finance.yahoo.com/m/5467343d-5134-3d83-86c8-ea5f0c263533/treasury-yields-rise-as-u.s..html?.tsrc=rss
2026-02-19	Yahoo	-0.102	Stocks Fall. U.S.-Iran Tensions Are Ramping Up.	Stocks dropped at the open on Thursday as investors digested a wave of data and kept an eye on tensions between Iran and the U.S. The Dow Jones Industrial Average fell 310 points, or 0.6%. The S&amp;P 500 was down 0.	https://finance.yahoo.com/m/5d1bf1a4-74d0-3439-87c2-c739a24cf704/stocks-fall.-u.s.-iran.html?.tsrc=rss
2026-02-18	Yahoo	0.0	Treasury Yields Rise as U.S. Data Beat Forecast	Treasury yields rise as delayed U.S. data surprise on the upside, while markets wait for Fed minutes and a $16 billion 20-year Treasury auction. December durable goods orders contract 1.4%, following November's 5.	https://finance.yahoo.com/m/b5124258-f6c9-3c47-b51c-df02454c00fb/treasury-yields-rise-as-u.s..html?.tsrc=rss
2026-02-17	Yahoo	0.143	'Unstability' weighs over Fed's options to cut rates: Strategist	Schwab Center for Financial Research fixed income strategist Cooper Howard shares his outlook on US Treasury yields (^TYX, ^TNX, ^FVX) and what the Federal Reserve's interest rate policy could mean for the economy, mortgage rates, and the yield curve. Also, catch Cooper Howard compare how January's jobs report contrasts with recent labor revisions. To watch more expert insights and analysis on the latest market action, check out more Market Catalysts.	https://finance.yahoo.com/video/unstability-weighs-over-feds-options-130023840.html?.tsrc=rss
2026-02-13	Yahoo	0.106	Bonds, Dollar Rally as Investors Play It Safe Ahead of January Inflation Report	U.S. Treasury bonds rallied, while the dollar held steady and gold prices crept modestly higher, as investors set up cautious positioning into Friday’s crucial January inflation report.  The Bureau of Labor Statistics is likely to report that its benchmark consumer price index eased to 2.5% last month, from a reading of 2.7% in December, with core price pressures moderating from 2.6% from 2.5%, the slowest pace of increase in nearly five years.  “January is typically a ‘noisy’ month for CPI, as 	https://finance.yahoo.com/m/ea9cad8d-a799-3c9b-b7f4-0db7ad75d3d2/bonds%2C-dollar-rally-as.html?.tsrc=rss
2026-02-13	Yahoo	0.055	Bonds Extend Rally as January Inflation Report Stokes New Fed Rate-Cut Bets	Treasury bond yields extended their recent declines while the dollar gave back earlier gains and stocks bounced higher, following a tamer-than-expected January inflation report.  Headline CPI eased to 2.4% from 2.7% last month, the Bureau of Labor Statistics said, a reading that fell inside Wall Street’s 2.5% forecast.  The report may likely provide the Federal Reserve with enough cover on the inflation front to consider a spring time rate cut, particularly after the January jobs reading showed 	https://finance.yahoo.com/m/b16023b4-8a47-3744-b8ae-4d93e60bbce1/bonds-extend-rally-as-january.html?.tsrc=rss
2026-02-13	Google	-0.05	TRX Gold (TSE:TNX) Stock Price Crosses Above 50 Day Moving Average - What's Next? - MarketBeat		https://news.google.com/rss/articles/CBMixwFBVV95cUxQYXNNZUxzQ0NQR3pxa25FMlBEcGc1RWo4MnU3ejBhaUdzUUJtNDhMQ1BTV2tUVVpuTzBQY3pNazhsdVIzYjNscmVQaU9FOUJSa0hSc0tmTWNTb1BUVHVGM3FqdGRKZ0RReFF5VXdQRVZQNmw3SkhYeU9zaGRQeENZMUp3YmxBcGlSVWVMNzBuS0x3TEVSWGh4YTBKMHpVVmY5a1Y3WnE5ZnRpZUJnWU1PczNfTzM4MTF4dUxpTnNhbm5PV1hKT284?oc=5
2026-02-12	Yahoo	0.433	Treasury Yields Fall as Investors Look Beyond Strong Labor Data	"U.S. Treasury yields fell in European trade Thursday as investors preferred to err on the side of caution on U.S. economic outlook, despite solid labor data on Wednesday.  Market attention now turns to the upcoming inflation release on Friday, where ""an upside surprise would likely push yields higher and strengthen the dollar by dampening easing bets,"" Naga's Frank Walbaum said in a note.  If data come in line with expectations, the dollar could remain confined to consolidation, particularly as investors remain attentive to leadership dynamics at the Federal Reserve and what they might imply for the policy outlook in 2026, the market analyst said."	https://finance.yahoo.com/m/ffd61b28-3c53-3c55-814b-d862dbf578d4/treasury-yields-fall-as.html?.tsrc=rss
2026-02-12	Yahoo	0.133	The Stock Selloff Is Accelerating. A Pattern Is Emerging.	"Stock market selling accelerated without a clear catalyst on Thursday. The Dow Jones Industrial Average fell 419 points, or 0.8%. The S&amp;P 500 dropped 1%. The Nasdaq Composite sank 1.5%.  ""This is becoming a pattern,"" Steve Sosnick, chief strategist of Interactive Brokers, told Barron's."	https://finance.yahoo.com/m/06a3bdaa-b6a8-3220-82ba-95d3de4d96fa/the-stock-selloff-is.html?.tsrc=rss
2026-02-12	Yahoo	0.08	Stocks Are Rising. S&P 500 Heads Back Toward Record High.	The S&amp;P 500 mounted another early push toward its closing highs on Thursday. The Dow Jones Industrial Average rose 180 points, or 0.4%. The S&amp;P 500 was up 0.4%. The Nasdaq Composite was up 0.4%. The S&amp;P was roughly 10 points away from its highest close on record.	https://finance.yahoo.com/m/82f397f3-88a4-36dc-ad19-7fe47edb7d35/stocks-are-rising.-s%26p-500.html?.tsrc=rss
2026-02-11	Yahoo	0.2	Treasury Yields Rise as U.S. Creates More Jobs Than Expected	Treasury yields rise as U.S. job creation surprises on the upside. January payrolls rise by 130,000, significantly more than the 55,000 figure forecast in a WSJ consensus. December number is revised down to 48,000 from 50,000.	https://finance.yahoo.com/m/15d43bd1-9718-3f8e-b1ed-1a6ec7c4f91d/treasury-yields-rise-as-u.s..html?.tsrc=rss
2026-02-11	Yahoo	0.0	January jobs data shows 'different picture' compared to revisions	US Treasury yields (^TYX, ^TNX, ^FVX) are rising in response to January's overwhelmingly positive jobs report. Schwab Center for Financial Research fixed income strategist Cooper Howard sits down with Julie Hyman to discuss what the labor data print indicates about how the Federal Reserve may act on interest rates in 2026 as the US central bank works to draw inflation down to its 2% target. January's Consumer Price Index (CPI) is due out this Friday, February 13. To watch more expert insights and analysis on the latest market action, check out more Market Catalysts.	https://finance.yahoo.com/video/january-jobs-data-shows-different-183000339.html?.tsrc=rss
2026-02-11	Yahoo	0.0	Stock Futures Pop After Stronger-Than-Expected January Jobs Report	Stock futures jumped after the delayed January jobs report came in stronger than expected. Dow futures rose 0.3%. S&amp;P 500 rose 0.4%. Nasdaq 100 futures rose 0.4%. The U.S. economy added 130,000 nonfarm jobs in January.	https://finance.yahoo.com/m/eec8c7cd-5dfc-378a-8b47-87ec58372010/stock-futures-pop-after.html?.tsrc=rss
2026-02-11	Yahoo	0.0	Stocks Trade Sideways. S&P 500 Can't Break Through 7000.	The 7000 level is proving to be a major roadblock for the S&amp;P 500. The market benchmark was up just 0.1% after surging as high as 6993.48 shortly after the open. The Dow was down 30 points, or 0.1%, after moving near 50,499.	https://finance.yahoo.com/m/ccf1227b-8688-3af1-91b3-13e918ee6470/stocks-trade-sideways.-s%26p.html?.tsrc=rss
2026-02-11	Yahoo	0.0	Watch Out for a 10-Year Treasury Auction	After a busy morning digesting jobs data, traders now switch to a Treasury market auction this afternoon. Investors are tasked with buying $42 billion worth of 10-year notes. Yields are at 4.16%. Not too attractive given that the market was trading at 4.	https://finance.yahoo.com/m/46f1afd5-0f4f-34da-acef-1d97d48b71fc/watch-out-for-a-10-year.html?.tsrc=rss
2026-02-11	Yahoo	-0.138	Weak 10-Year Auction Raises Yields Modestly	The market reacted modestly this afternoon to a weak 10-year auction.  An auction of 10-year notes saw a result of 4.177%, which was higher than the yield in the pre-auction, indicating weak demand.  Higher yields mean investors demanded lower prices.	https://finance.yahoo.com/m/187c5982-35f8-347c-982e-766c1b660e5e/weak-10-year-auction-raises.html?.tsrc=rss
2026-02-10	Yahoo	0.25	Treasuries Jolt Higher on Retail Sales, Labor Data	The U.S. debt market saw prices rise after the release of fresh economic data. The benchmark 10-year Treasury yield was 4.4 basis points lower at 4.167%. Yields move in the opposite direction to prices.	https://finance.yahoo.com/m/8abdc0f6-5126-3de9-82f0-32d1aa1249a5/treasuries-jolt-higher-on.html?.tsrc=rss
2026-02-10	Google	0.0	Focusrite Introduces RedNet TNX Thunderbolt-Dante Interface - rAVe [PUBS]		https://news.google.com/rss/articles/CBMiiAFBVV95cUxOOEpDbEtJVzF3N05vU2JFZkdKdHBjTzZiTHJqWmhNWnJkRGdMUHBSU2lHUVJEWjVvRWpQTkt5ZFZpT0NsZVZpYndCLUxfcmx0bHlYWUJLdGpxVjhrcnZBekVncmc0V2hrdkMzSExWWkVUOEc4bXZpd29SZDB0QVJnSFZPR2NJLWRF0gGOAUFVX3lxTFA2YmVqbmVjcEZiMUVicGFab2VkM18tTFEyNjhISTlzOThQQ2o1V1ZmS2p4RXMxMFVoVlVqYjlRd0NZbWU3LUxZWDdscjFndkhhXzFDWGFFdWp6WkJ2azYxdU40QjRqM2J6S1pjU1FmQzU4aHRRc0oxNk8yVTI4b1lRQXZQYXRfTFFIQW9DTkE?oc=5
2026-02-10	Yahoo	0.0	Stocks Are Rising Following Lackluster Retail Sales Report	Stocks perked up on Tuesday despite December retail sales that came in short of expectations.  The Nasdaq Composite was up 0.1%.  Retail sales were flat in December compared to November, compared to economists' expectations for a 0.4% uptick for the month.	https://finance.yahoo.com/m/0381bb4b-8e0e-3456-bfcd-bca0ca80c6e5/stocks-are-rising-following.html?.tsrc=rss
2026-02-09	Yahoo	0.0	Stocks Are Falling. The Dow Is Hovering Around 50,000.	The stock market’s resurgence lost steam at the start of Monday’s session. The Dow Jones Industrial Average fell 150 points, or 0.3%. The S&amp;P 500 was down 0.1%. The Nasdaq Composite was flat. The Dow was pulling back after a furious rally on Friday that pushed the index north of 50,000 for the first time.	https://finance.yahoo.com/m/7560d7dc-6bd0-39d2-89af-257e442ecc59/stocks-are-falling.-the-dow.html?.tsrc=rss
2026-02-07	Google	0.25	[Photo] TNX Hyun-soo-Jun-hyeok-Hwi-Sung-jun stand confidently - CHOSUNBIZ - Chosunbiz		https://news.google.com/rss/articles/CBMigwFBVV95cUxPUUcyWmZUWUVZNDA3RzJyVkJ2akRnbHpaUGlZMFY2UzdPd0k5QXdfWFlKc1F3THlxaWMtM2M5eHFqU21LZk1aS0w5M1VKdXJQR3BINDJGaENkVzBnQkxJanhTckxpalI0SGRnT2toNThqd1J6Sk1OSDJwR1IyaEVnMkFzUdIBlwFBVV95cUxPMEJFNW13Wmt1YXZuR1VOR0JEOE1kaHQycnR5SkZrNWZSbWdsSWxueTA3RDFHNUN2aWFMRmo2dzFub2VnSHVhUE5RTlZtb2VZZUhPdW1hV2NfLTNSenp5bFc1SXR0QWNDamd2QWVCN3hBT2VCS0RwSHVFZVppeFhxSDlCZlNIZ2NxX1lTOGExMl80UmJ2dGQ0?oc=5
2026-02-07	Google	-0.389	TNX 226 - Tough N Xtreme - Sherdog		https://news.google.com/rss/articles/CBMibEFVX3lxTE9VaWUxamY1Wm9POWJkNXg2cURYNzNJcTVKWjNsQlQwdDhLMlh4YlYwamVRRktRa1RCNjRIa09WV2thbk5xbG9uMlQxMVpVNVJBZkhmdHBlNEx1RjZjVGdVTmZMOHBSMVlwSDd1Vw?oc=5
2026-02-06	Google	0.167	"TNX Eunhwi unveils first mixtape ""THAT'S ME"" - starnewskorea.com"		https://news.google.com/rss/articles/CBMid0FVX3lxTE1DWXhrQVB1OGxQVzR6S3ZFX2MwbnB0aGxjbXB4RUpRaGp3OHdEV01LeF9ocTYxRTFUZ2xyWXgtQmhmaGV0U1ZYSWVLYkhWUF82WHFMeWJHUmdhMDl2WkkzWGUwTmtuMWNwNHdOcHdzQUprT2plWVg0?oc=5
2026-02-05	Yahoo	0.0	Consumer Staples Is the Only S&P 500 Sector Rising	Of the 11 major S&amp;P 500 sectors, consumer staples is the only one on the rise. A flight to safety pushed the staples sector 0.7% higher. Utilities and health care were both down 0.4%. Real estate was down 0.	https://finance.yahoo.com/m/3edfefd9-32c4-3f04-bfaf-cbd9f02b42ea/consumer-staples-is-the-only.html?.tsrc=rss
2026-02-05	Yahoo	0.0	Stocks Slide. Tech Selloff Enters Its Third Day.	The Nasdaq Composite dropped 1.8%.  Outplacement firm Challenger, Gray & Christmas said U.S. employers announced 108,435 job cuts in January, which was the most in the first month of a year since 2009.  “Bottom line, the pace of firing’s has remained low but it’s hard to ignore the Challenger data,” writes Peter Boockvar, chief investment officer at One Point BFG Wealth Partners.	https://finance.yahoo.com/m/48a75c65-43e0-3dc6-b588-d01aaea595c9/stocks-slide.-tech-selloff.html?.tsrc=rss
2026-02-05	Google	-0.075	TRX Gold (TSE:TNX) Share Price Crosses Above Fifty Day Moving Average - Here's What Happened - MarketBeat		https://news.google.com/rss/articles/CBMi1wFBVV95cUxNSzNTUjBCbTAzOG1fMlI3Q2tQTzF2dVZsYlJ4UHdMZ3FfN0N5eFM5ZVM0SEhQTkE1ODBSV0VOWVd5UGoxZm5PaDJNcXB1Uk9Ndk5TNTJuanMtc2NMSGUzaFZVZlh4ZjRjRER1QVFDZklZWTBmcnEyeWxEMnRLMkdSaFVoZFpncUZoYXBfZ2pqMW10Yk1JejVHN0ZXR2tfVDQtdzVZQmhudlZfeF9EQ1BZaGNaWWZ5OTZDYUZOYzM2cmZPMjE3YjZPdmZ2NGtyZkdtN0RmR2lLaw?oc=5
2026-02-04	Google	0.0	"""Free-spirited Performance"" TNX, ""CALL ME BACK"" MV surpassed 10 million views - starnewskorea.com"		https://news.google.com/rss/articles/CBMieEFVX3lxTE5SZUx2MjdoYnNJbEVla21wVWx0NUZzTWFoQldGNXV5MlpyY0NnREdrSWtDLUJMVHdCNXU1NmN1Y3VtS1hmQVdldDFKUnJYTHI5MkxMUUlHcU14MWdfSGhRb0wtcWVvTFVKRDZTejB3QmVUWmFxU2NnRw?oc=5
2026-02-04	Google	0.0	"TNX surpasses 10 million views with ""CALL ME BACK"" MV - CHOSUNBIZ - Chosunbiz"		https://news.google.com/rss/articles/CBMiiAFBVV95cUxQdEFFdmJENnNybzFyXzZuQlhBN1Z5TlB3eUhqNnEtQ2NCSXU1ZGJvMU9JZHVHX3lndTRtLUlULUlkNWtIcXpsdWdvVjN6dVp4aHByLW1vY2V2NDVHLXpLOWtFbGRVVTdzVUt3NlNyVUt3dzhucVdsZWNKV0ZiOU1PREpYSnAybEdE0gGcAUFVX3lxTE9sRUhoZXpZYk9TZnZDdEZnd1Z2dE8xNU8tTzgwLW8xZDc1bF92UlFsRUdKQjFxMUNfSGpoM0Z6VHVGMmZHN0hybHFsazZVXzA0OVJxTkQ3SlJVTHVEQS0xS3p6em9XSmQyZFVtUWxLY0VTaGhPZ19ONnkzZl95Rk85aTdhNnVObjJNZk9mSUVVY2RnNjdxbjBGYjlFdg?oc=5
2026-02-04	Google	0.0	TNX's 'CALL ME BACK' MV Surpasses 10 Million Views - 조선일보		https://news.google.com/rss/articles/CBMijgFBVV95cUxPZEpVU0NnMXRXeUc4QmNlWWx0dzl2TXgwQjNrVTJoZTRfaW90eHZrMDlfdGhRU1M2bFhfQTFJWWVwRzZmYlZsUlA3TTRVdFlETUdQV3NPcVpERWNEWUd6dXFEbVpDMS16ajJyZ3hSSDJleWFwbk95aWR5cUpuYWNWVlowMDZDUmZmU1Z1Q1Rn?oc=5
2026-01-30	Google	0.5	TNXP - Tonix Pharmaceut Latest Stock News & Market Updates - Stock Titan		https://news.google.com/rss/articles/CBMiTkFVX3lxTE1UWlZSQVlKQnhpcW93TG1WZzkyc3JMX3d0UlZLXzdpNTVVc1ZoMXZzMEZzZ2ZvaXdub1Y2LVpwQ0lDWUZfdnFBeTVkMHZaQQ?oc=5
2026-01-30	Google	0.042	Tonix Receives FDA Clearance for Phase 2 Study of TNX-102 SL in Major Depressive Disorder - Intellectia AI		https://news.google.com/rss/articles/CBMivAFBVV95cUxQeE1YM3ZwZGJobXJ6OVZlbG5oSHZqcFVPeHpRQTF5ZDBDUnY4NzRlRElxUjVVSDFkRWtvR3FmVTh5OGMxbzJwUWJZNS1nTzlfMmltazFhb0VYMll6bkM1bkFHMldOT0lONHJjTS1YV2J0V0JNQVpqNFNKNS14aVJaVTAxU1FGWGU2ZlNNcU10YjM5czkwQmZUblBnTVNSM0hJR215Si04Zk80UlVQUnVQbF9GaG92VjZJY3ZhaA?oc=5
2026-01-30	Google	0.0	Tonix Pharmaceuticals Receives FDA Approval to Advance TNX-102 for Depression Treatment - Intellectia AI		https://news.google.com/rss/articles/CBMiugFBVV95cUxNVkZGNmVNT3dneksybllGNkpmc2VwdjA0WEQ0MjVmNWFjQkVKRzdYaXlDaGxOajZtR0gxRUtJYlFpelVhdDZxVk5lZTZGQWtjeVQtbGs5b0NmYmFDRDFQYWhBQnpwYkxLMDJ3eTFWaEs2eXhucnYwQmxybUNrQ0FiQ0M2VVBGaDkwZnlwQ3pDekUxVldlZFVBY1J2NFJJQUxzamFaTWx3Z3MwSWV4Y3ZreXI1RXZHdXN4OEE?oc=5
2026-01-30	Google	0.0	[4K] ONEUS, WHIB, LNGSHOT, KiiiKiii, SAY MY NAME, TNX, XG, 8TURN | On the way to Music Bank 260130 - KBS WORLD Radio		https://news.google.com/rss/articles/CBMilgFBVV95cUxQX2p4djdVLVB1RWEwTEN5emJzeVZWdU1BUE9GS1dpLVRmNEZkVUpOZFZTaWNhNTZiZ0lBSURyQTk4UVhyaHBMN0lxaDluWDU1dkRRc2Q3QTJOM3doYldrMHYyYUo5ZV9tRlQ0TzBrb0RsTXB0RWhsZFZoSnJUN1VNb2RsRWJZWm9SRlFWYmU2LWF3WlBwYWc?oc=5
